,number,value,datetime_start,datetime_complete,duration,params_activation,params_dropout,params_layers,params_shrink,system_attrs_completed_rung_0,system_attrs_completed_rung_1,system_attrs_completed_rung_2,system_attrs_completed_rung_3,state
1472,1472,86.39027404785156,2022-12-25 12:13:29.260436,2022-12-25 12:13:38.076732,0 days 00:00:08.816296,tanh,0.4,2,0.6,86.39027404785156,,,,PRUNED
1473,1473,103.05973052978516,2022-12-25 12:13:38.168094,2022-12-25 12:13:46.976998,0 days 00:00:08.808904,relu,0.0,2,0.8,103.05973052978516,,,,PRUNED
1474,1474,27.779150009155273,2022-12-25 12:13:47.058061,2022-12-25 12:14:02.591624,0 days 00:00:15.533563,relu,0.4,2,0.6,27.779150009155273,,,,PRUNED
1475,1475,84.19872283935547,2022-12-25 12:14:02.673994,2022-12-25 12:14:11.366549,0 days 00:00:08.692555,relu,0.45,2,0.6,84.19872283935547,,,,PRUNED
1476,1476,16.108829498291016,2022-12-25 12:14:11.458617,2022-12-25 12:14:27.422710,0 days 00:00:15.964093,tanh,0.5,2,0.6,42.48226547241211,16.108829498291016,,,PRUNED
1477,1477,1.4068981409072876,2022-12-25 12:14:27.514376,2022-12-25 12:16:12.460695,0 days 00:01:44.946319,relu,0.5,2,0.6,31.947723388671875,13.376582145690918,5.177329063415527,4.181300163269043,COMPLETE
1478,1478,18.301694869995117,2022-12-25 12:16:12.568765,2022-12-25 12:16:28.030304,0 days 00:00:15.461539,sigmoid,0.1,2,0.6,18.301694869995117,,,,PRUNED
1479,1479,105.00218963623047,2022-12-25 12:16:28.113602,2022-12-25 12:16:37.029881,0 days 00:00:08.916279,relu,0.5,2,0.6,105.00218963623047,,,,PRUNED
1480,1480,27.102231979370117,2022-12-25 12:16:37.122939,2022-12-25 12:16:52.662781,0 days 00:00:15.539842,relu,0.0,2,0.6,50.737464904785156,27.102231979370117,,,PRUNED
1481,1481,54.89868927001953,2022-12-25 12:16:52.751852,2022-12-25 12:17:29.543562,0 days 00:00:36.791710,sigmoid,0.4,5,0.7,54.89868927001953,,,,PRUNED
1482,1482,1.4697860479354858,2022-12-25 12:17:29.626164,2022-12-25 12:19:08.212056,0 days 00:01:38.585892,sigmoid,0.4,2,0.6,6.371730804443359,4.195549011230469,,,COMPLETE
1483,1483,25.582717895507812,2022-12-25 12:19:08.314070,2022-12-25 12:19:23.843426,0 days 00:00:15.529356,tanh,0.45,2,0.8,55.5677604675293,25.582717895507812,,,PRUNED
1484,1484,22.175315856933594,2022-12-25 12:19:23.934482,2022-12-25 12:19:39.557908,0 days 00:00:15.623426,relu,0.35000000000000003,2,0.6,44.67106246948242,22.175315856933594,,,PRUNED
1485,1485,83.57878112792969,2022-12-25 12:19:39.650965,2022-12-25 12:19:48.358242,0 days 00:00:08.707277,relu,0.4,2,0.6,83.57878112792969,,,,PRUNED
1486,1486,101.93609619140625,2022-12-25 12:19:48.447192,2022-12-25 12:19:57.549191,0 days 00:00:09.101999,tanh,0.5,2,0.85,101.93609619140625,,,,PRUNED
1487,1487,19.298219680786133,2022-12-25 12:19:57.640207,2022-12-25 12:20:13.338652,0 days 00:00:15.698445,relu,0.5,2,0.8,64.40727233886719,19.298219680786133,,,PRUNED
1488,1488,4.554765701293945,2022-12-25 12:20:13.421014,2022-12-25 12:21:51.473661,0 days 00:01:38.052647,relu,0.35000000000000003,2,0.6,14.441777229309082,5.646190166473389,4.554765701293945,,PRUNED
1489,1489,127.11485290527344,2022-12-25 12:21:51.562943,2022-12-25 12:22:00.523268,0 days 00:00:08.960325,relu,0.25,2,0.6,127.11485290527344,,,,PRUNED
1490,1490,80.85525512695312,2022-12-25 12:22:00.615511,2022-12-25 12:22:09.222616,0 days 00:00:08.607105,tanh,0.45,2,0.9,80.85525512695312,,,,PRUNED
1491,1491,1.5832359790802002,2022-12-25 12:22:09.313852,2022-12-25 12:23:23.535728,0 days 00:01:14.221876,sigmoid,0.5,2,0.6,36.4112663269043,14.17451286315918,5.729254722595215,,COMPLETE
1492,1492,22.220937728881836,2022-12-25 12:23:23.638747,2022-12-25 12:23:39.231986,0 days 00:00:15.593239,relu,0.4,2,0.85,22.220937728881836,,,,PRUNED
1493,1493,19.627689361572266,2022-12-25 12:23:39.315567,2022-12-25 12:24:15.412093,0 days 00:00:36.096526,sigmoid,0.30000000000000004,2,0.65,19.627689361572266,,,,PRUNED
1494,1494,229.38558959960938,2022-12-25 12:24:15.495619,2022-12-25 12:24:31.661815,0 days 00:00:16.166196,relu,0.05,8,0.6,229.38558959960938,,,,PRUNED
1495,1495,44.24248504638672,2022-12-25 12:24:31.742771,2022-12-25 12:24:47.168025,0 days 00:00:15.425254,tanh,0.45,2,0.7,44.24248504638672,,,,PRUNED
1496,1496,25.00790023803711,2022-12-25 12:24:47.463311,2022-12-25 12:25:03.125654,0 days 00:00:15.662343,sigmoid,0.15000000000000002,2,0.6,25.00790023803711,,,,PRUNED
1497,1497,4.663522720336914,2022-12-25 12:25:03.215742,2022-12-25 12:26:41.117627,0 days 00:01:37.901885,sigmoid,0.30000000000000004,2,0.7,5.603391170501709,4.663522720336914,,,PRUNED
1498,1498,84.36915588378906,2022-12-25 12:26:41.208998,2022-12-25 12:26:49.851436,0 days 00:00:08.642438,sigmoid,0.5,2,0.6,84.36915588378906,,,,PRUNED
1499,1499,6.19774055480957,2022-12-25 12:26:49.943680,2022-12-25 12:27:26.414337,0 days 00:00:36.470657,relu,0.35000000000000003,2,0.6,11.975991249084473,6.19774055480957,,,PRUNED
