,number,value,datetime_start,datetime_complete,duration,params_activation,params_dropout,params_layers,params_shrink,system_attrs_completed_rung_0,system_attrs_completed_rung_1,system_attrs_completed_rung_2,system_attrs_completed_rung_3,state
0,0,2.4909989833831787,2022-12-25 00:43:56.496738,2022-12-25 00:44:47.195602,0 days 00:00:50.698864,sigmoid,0.05,4,0.95,,,,,COMPLETE
1,1,1.810343861579895,2022-12-25 00:44:47.282394,2022-12-25 00:46:30.727544,0 days 00:01:43.445150,relu,0.2,2,0.75,100.82957458496094,21.066003799438477,8.318999290466309,6.6616129875183105,COMPLETE
2,2,32.49030685424805,2022-12-25 00:46:30.830404,2022-12-25 00:46:46.250236,0 days 00:00:15.419832,relu,0.35000000000000003,3,0.65,62.2149543762207,32.49030685424805,,,PRUNED
3,3,1.8238680362701416,2022-12-25 00:46:46.332332,2022-12-25 00:47:35.385986,0 days 00:00:49.053654,relu,0.4,3,0.75,22.15074920654297,8.331406593322754,,,COMPLETE
4,4,75.89039611816406,2022-12-25 00:47:35.474514,2022-12-25 00:47:43.895971,0 days 00:00:08.421457,sigmoid,0.4,3,0.7,75.89039611816406,,,,PRUNED
5,5,30.595821380615234,2022-12-25 00:47:43.970033,2022-12-25 00:47:59.235871,0 days 00:00:15.265838,sigmoid,0.5,2,0.95,30.595821380615234,,,,PRUNED
6,6,98.28897857666016,2022-12-25 00:47:59.326804,2022-12-25 00:48:07.976714,0 days 00:00:08.649910,tanh,0.1,5,0.7,98.28897857666016,,,,PRUNED
7,7,98.6905746459961,2022-12-25 00:48:08.059028,2022-12-25 00:48:16.518356,0 days 00:00:08.459328,relu,0.30000000000000004,3,0.9,98.6905746459961,,,,PRUNED
8,8,160.411376953125,2022-12-25 00:48:16.600052,2022-12-25 00:48:25.542341,0 days 00:00:08.942289,sigmoid,0.30000000000000004,8,0.75,160.411376953125,,,,PRUNED
9,9,23.121549606323242,2022-12-25 00:48:25.624377,2022-12-25 00:48:41.340463,0 days 00:00:15.716086,relu,0.05,4,0.85,38.96817398071289,23.121549606323242,,,PRUNED
10,10,57.587581634521484,2022-12-25 00:48:41.429445,2022-12-25 00:48:57.281033,0 days 00:00:15.851588,sigmoid,0.30000000000000004,7,0.9,57.587581634521484,,,,PRUNED
11,11,25.395816802978516,2022-12-25 00:48:57.364017,2022-12-25 00:49:13.023391,0 days 00:00:15.659374,tanh,0.1,5,0.85,70.90299224853516,25.395816802978516,,,PRUNED
12,12,26.83248519897461,2022-12-25 00:49:13.130368,2022-12-25 00:49:28.171239,0 days 00:00:15.040871,tanh,0.45,2,0.85,26.83248519897461,,,,PRUNED
13,13,42.87367248535156,2022-12-25 00:49:28.253928,2022-12-25 00:49:43.827653,0 days 00:00:15.573725,tanh,0.15000000000000002,6,0.95,42.87367248535156,,,,PRUNED
14,14,94.01188659667969,2022-12-25 00:49:43.910076,2022-12-25 00:49:52.693368,0 days 00:00:08.783292,tanh,0.0,6,0.7,94.01188659667969,,,,PRUNED
15,15,1.3594812154769897,2022-12-25 00:49:52.776071,2022-12-25 00:51:35.946999,0 days 00:01:43.170928,relu,0.5,2,0.6,59.37104797363281,13.481715202331543,6.90955924987793,3.9941487312316895,COMPLETE
16,16,259.9917907714844,2022-12-25 00:51:36.050483,2022-12-25 00:51:51.684279,0 days 00:00:15.633796,tanh,0.05,8,0.85,259.9917907714844,,,,PRUNED
17,17,1.652732491493225,2022-12-25 00:51:51.766974,2022-12-25 00:53:04.264257,0 days 00:01:12.497283,relu,0.5,2,0.6,55.856571197509766,14.50235652923584,5.791142463684082,,COMPLETE
18,18,20.52745246887207,2022-12-25 00:53:04.358787,2022-12-25 00:53:40.185400,0 days 00:00:35.826613,sigmoid,0.1,4,1.0,23.18708610534668,20.52745246887207,,,PRUNED
19,19,10.460772514343262,2022-12-25 00:53:40.268536,2022-12-25 00:54:15.723317,0 days 00:00:35.454781,tanh,0.4,3,0.65,22.571962356567383,10.460772514343262,,,PRUNED
20,20,256.7172546386719,2022-12-25 00:54:15.807634,2022-12-25 00:54:31.531446,0 days 00:00:15.723812,relu,0.45,8,0.6,256.7172546386719,,,,PRUNED
21,21,93.31978607177734,2022-12-25 00:54:31.605506,2022-12-25 00:54:39.896485,0 days 00:00:08.290979,relu,0.5,2,0.6,93.31978607177734,,,,PRUNED
22,22,8.997227668762207,2022-12-25 00:54:39.979178,2022-12-25 00:55:15.577108,0 days 00:00:35.597930,relu,0.30000000000000004,2,0.9,22.869626998901367,8.997227668762207,,,PRUNED
23,23,46.3017578125,2022-12-25 00:55:15.659437,2022-12-25 00:55:30.784282,0 days 00:00:15.124845,relu,0.5,2,0.6,35.96828079223633,46.3017578125,,,PRUNED
24,24,32.454200744628906,2022-12-25 00:55:30.866981,2022-12-25 00:55:46.241452,0 days 00:00:15.374471,relu,0.2,5,0.7,32.454200744628906,,,,PRUNED
25,25,27.70690155029297,2022-12-25 00:55:46.323138,2022-12-25 00:56:01.457359,0 days 00:00:15.134221,relu,0.30000000000000004,3,0.75,27.70690155029297,,,,PRUNED
26,26,70.0213623046875,2022-12-25 00:56:01.539657,2022-12-25 00:56:10.590000,0 days 00:00:09.050343,relu,0.4,7,0.6,70.0213623046875,,,,PRUNED
27,27,1.6865202188491821,2022-12-25 00:56:10.672300,2022-12-25 00:57:22.879968,0 days 00:01:12.207668,relu,0.2,2,0.7,6.238356590270996,,,,COMPLETE
28,28,14.631925582885742,2022-12-25 00:57:22.963160,2022-12-25 00:57:58.440327,0 days 00:00:35.477167,relu,0.2,4,0.85,14.631925582885742,,,,PRUNED
29,29,77.82181549072266,2022-12-25 00:57:58.522449,2022-12-25 00:58:07.323408,0 days 00:00:08.800959,relu,0.45,4,1.0,77.82181549072266,,,,PRUNED
30,30,2.9667727947235107,2022-12-25 00:58:07.405452,2022-12-25 00:58:39.683473,0 days 00:00:32.278021,relu,0.35000000000000003,4,0.95,,,,,COMPLETE
31,31,7.25095272064209,2022-12-25 00:58:39.768400,2022-12-25 00:59:15.034362,0 days 00:00:35.265962,relu,0.4,3,0.6,7.25095272064209,,,,PRUNED
32,32,24.3271484375,2022-12-25 00:59:15.109095,2022-12-25 00:59:30.641090,0 days 00:00:15.531995,relu,0.35000000000000003,4,0.8,24.3271484375,,,,PRUNED
33,33,15.90148639678955,2022-12-25 00:59:30.716199,2022-12-25 01:00:06.221722,0 days 00:00:35.505523,relu,0.1,4,0.7,15.90148639678955,,,,PRUNED
34,34,1.5957505702972412,2022-12-25 01:00:06.296081,2022-12-25 01:01:48.691059,0 days 00:01:42.394978,relu,0.25,2,0.75,18.51285743713379,7.642991065979004,4.975321292877197,,COMPLETE
35,35,105.3134765625,2022-12-25 01:01:48.786203,2022-12-25 01:01:57.071623,0 days 00:00:08.285420,relu,0.2,2,0.65,105.3134765625,,,,PRUNED
36,36,4.013393878936768,2022-12-25 01:01:57.155322,2022-12-25 01:02:29.894978,0 days 00:00:32.739656,relu,0.5,5,0.75,,,,,COMPLETE
37,37,10.150156021118164,2022-12-25 01:02:29.981501,2022-12-25 01:03:05.399756,0 days 00:00:35.418255,relu,0.2,3,0.75,21.057506561279297,10.150156021118164,,,PRUNED
38,38,29.31165885925293,2022-12-25 01:03:05.482455,2022-12-25 01:03:20.707923,0 days 00:00:15.225468,relu,0.0,4,0.7,29.31165885925293,,,,PRUNED
39,39,99.1923828125,2022-12-25 01:03:20.790615,2022-12-25 01:03:29.457259,0 days 00:00:08.666644,relu,0.45,3,0.65,99.1923828125,,,,PRUNED
40,40,44.384490966796875,2022-12-25 01:03:29.531422,2022-12-25 01:03:44.846801,0 days 00:00:15.315379,relu,0.25,5,0.75,44.384490966796875,,,,PRUNED
41,41,123.64639282226562,2022-12-25 01:03:44.921118,2022-12-25 01:03:53.679412,0 days 00:00:08.758294,tanh,0.5,6,0.8,123.64639282226562,,,,PRUNED
42,42,1.536435604095459,2022-12-25 01:03:53.762267,2022-12-25 01:06:01.264973,0 days 00:02:07.502706,relu,0.35000000000000003,3,0.6,12.399455070495605,6.327816963195801,4.893138408660889,,COMPLETE
43,43,23.603734970092773,2022-12-25 01:06:01.358085,2022-12-25 01:06:16.386222,0 days 00:00:15.028137,relu,0.2,2,0.6,23.603734970092773,,,,PRUNED
44,44,28.356489181518555,2022-12-25 01:06:16.459579,2022-12-25 01:06:31.843373,0 days 00:00:15.383794,sigmoid,0.4,4,0.6,67.87273406982422,28.356489181518555,,,PRUNED
45,45,9.127737998962402,2022-12-25 01:06:31.916745,2022-12-25 01:07:01.551299,0 days 00:00:29.634554,tanh,0.1,8,0.75,,,,,COMPLETE
46,46,33.935821533203125,2022-12-25 01:07:01.635824,2022-12-25 01:07:16.948276,0 days 00:00:15.312452,sigmoid,0.35000000000000003,5,0.65,33.935821533203125,,,,PRUNED
47,47,77.4517593383789,2022-12-25 01:07:17.022642,2022-12-25 01:07:25.321962,0 days 00:00:08.299320,relu,0.25,2,0.75,77.4517593383789,,,,PRUNED
48,48,32.76219940185547,2022-12-25 01:07:25.396007,2022-12-25 01:07:40.603807,0 days 00:00:15.207800,relu,0.25,4,0.65,32.76219940185547,,,,PRUNED
49,49,91.2595443725586,2022-12-25 01:07:40.677861,2022-12-25 01:07:49.236486,0 days 00:00:08.558625,relu,0.15000000000000002,2,0.75,91.2595443725586,,,,PRUNED
50,50,91.1021499633789,2022-12-25 01:07:49.311755,2022-12-25 01:07:57.702505,0 days 00:00:08.390750,relu,0.2,3,0.65,91.1021499633789,,,,PRUNED
51,51,23.694704055786133,2022-12-25 01:07:57.777873,2022-12-25 01:08:12.868016,0 days 00:00:15.090143,relu,0.4,3,0.8,23.694704055786133,,,,PRUNED
52,52,1.607343316078186,2022-12-25 01:08:12.942384,2022-12-25 01:09:32.449476,0 days 00:01:19.507092,relu,0.35000000000000003,3,0.7,23.001556396484375,7.573583602905273,,,COMPLETE
53,53,12.050098419189453,2022-12-25 01:09:32.533016,2022-12-25 01:09:55.000779,0 days 00:00:22.467763,sigmoid,0.15000000000000002,8,0.6,,,,,COMPLETE
54,54,6.534270763397217,2022-12-25 01:09:55.089280,2022-12-25 01:10:30.374218,0 days 00:00:35.284938,relu,0.30000000000000004,2,0.8,47.02960968017578,15.416376113891602,6.534270763397217,,PRUNED
55,55,4.212294101715088,2022-12-25 01:10:30.448583,2022-12-25 01:11:03.074586,0 days 00:00:32.626003,tanh,0.0,6,0.85,,,,,COMPLETE
56,56,1.6314653158187866,2022-12-25 01:11:03.159107,2022-12-25 01:12:32.704426,0 days 00:01:29.545319,relu,0.35000000000000003,2,0.7,15.125048637390137,7.056265830993652,,,COMPLETE
57,57,65.59567260742188,2022-12-25 01:12:32.795954,2022-12-25 01:12:47.922042,0 days 00:00:15.126088,relu,0.30000000000000004,3,0.6,65.59567260742188,,,,PRUNED
58,58,37.92261505126953,2022-12-25 01:12:47.996445,2022-12-25 01:13:03.529245,0 days 00:00:15.532800,relu,0.5,6,0.65,37.92261505126953,,,,PRUNED
59,59,7.335378646850586,2022-12-25 01:13:03.611003,2022-12-25 01:13:33.175818,0 days 00:00:29.564815,tanh,0.15000000000000002,7,0.75,,,,,COMPLETE
60,60,92.72259521484375,2022-12-25 01:13:33.273815,2022-12-25 01:13:41.677109,0 days 00:00:08.403294,relu,0.45,3,0.7,92.72259521484375,,,,PRUNED
61,61,4.69687557220459,2022-12-25 01:13:41.758118,2022-12-25 01:15:17.669010,0 days 00:01:35.910892,relu,0.2,2,0.65,66.64383697509766,12.935101509094238,5.817437171936035,4.69687557220459,PRUNED
62,62,78.97962188720703,2022-12-25 01:15:17.750557,2022-12-25 01:15:26.327680,0 days 00:00:08.577123,relu,0.35000000000000003,3,0.6,78.97962188720703,,,,PRUNED
63,63,17.963516235351562,2022-12-25 01:15:26.408479,2022-12-25 01:15:41.567194,0 days 00:00:15.158715,relu,0.25,2,0.85,36.713741302490234,17.963516235351562,,,PRUNED
64,64,85.74850463867188,2022-12-25 01:15:41.647990,2022-12-25 01:15:56.974345,0 days 00:00:15.326355,tanh,0.35000000000000003,4,0.75,62.98125457763672,85.74850463867188,,,PRUNED
65,65,13.673157691955566,2022-12-25 01:15:57.054848,2022-12-25 01:16:32.663295,0 days 00:00:35.608447,relu,0.25,4,0.7,20.576335906982422,13.673157691955566,,,PRUNED
66,66,105.37601470947266,2022-12-25 01:16:32.743962,2022-12-25 01:16:41.463631,0 days 00:00:08.719669,sigmoid,0.45,3,0.95,105.37601470947266,,,,PRUNED
67,67,30.069076538085938,2022-12-25 01:16:41.552475,2022-12-25 01:16:56.629138,0 days 00:00:15.076663,relu,0.15000000000000002,2,0.6,30.069076538085938,,,,PRUNED
68,68,1.5758464336395264,2022-12-25 01:16:56.708935,2022-12-25 01:18:12.440209,0 days 00:01:15.731274,sigmoid,0.30000000000000004,2,0.65,5.870014190673828,,,,COMPLETE
69,69,86.5552749633789,2022-12-25 01:18:12.543934,2022-12-25 01:18:21.026509,0 days 00:00:08.482575,sigmoid,0.15000000000000002,4,0.9,86.5552749633789,,,,PRUNED
70,70,98.16472625732422,2022-12-25 01:18:21.119535,2022-12-25 01:18:29.651862,0 days 00:00:08.532327,sigmoid,0.05,2,1.0,98.16472625732422,,,,PRUNED
71,71,7.821139812469482,2022-12-25 01:18:29.743518,2022-12-25 01:19:04.956489,0 days 00:00:35.212971,sigmoid,0.30000000000000004,2,0.65,7.821139812469482,,,,PRUNED
72,72,140.66476440429688,2022-12-25 01:19:05.023919,2022-12-25 01:19:13.423513,0 days 00:00:08.399594,sigmoid,0.05,3,0.95,140.66476440429688,,,,PRUNED
73,73,170.3331756591797,2022-12-25 01:19:13.499277,2022-12-25 01:19:22.498223,0 days 00:00:08.998946,sigmoid,0.1,6,0.65,170.3331756591797,,,,PRUNED
74,74,1.5802897214889526,2022-12-25 01:19:22.572831,2022-12-25 01:20:35.105347,0 days 00:01:12.532516,sigmoid,0.25,2,0.65,6.1750807762146,,,,COMPLETE
75,75,117.7076416015625,2022-12-25 01:20:35.205064,2022-12-25 01:20:43.833295,0 days 00:00:08.628231,sigmoid,0.0,5,0.7,117.7076416015625,,,,PRUNED
76,76,1.7480602264404297,2022-12-25 01:20:43.917387,2022-12-25 01:22:06.828366,0 days 00:01:22.910979,tanh,0.35000000000000003,3,0.65,20.546932220458984,6.4751105308532715,,,COMPLETE
77,77,1.4753813743591309,2022-12-25 01:22:06.924076,2022-12-25 01:23:26.486958,0 days 00:01:19.562882,sigmoid,0.30000000000000004,2,0.65,5.701566219329834,,,,COMPLETE
78,78,23.131423950195312,2022-12-25 01:23:26.586936,2022-12-25 01:23:41.703080,0 days 00:00:15.116144,sigmoid,0.45,2,0.8,23.131423950195312,,,,PRUNED
79,79,90.46012878417969,2022-12-25 01:23:41.787173,2022-12-25 01:23:50.235761,0 days 00:00:08.448588,relu,0.4,3,0.95,90.46012878417969,,,,PRUNED
80,80,24.841434478759766,2022-12-25 01:23:50.328137,2022-12-25 01:24:05.759584,0 days 00:00:15.431447,relu,0.4,4,0.7,24.841434478759766,,,,PRUNED
81,81,110.30752563476562,2022-12-25 01:24:05.852250,2022-12-25 01:24:14.725561,0 days 00:00:08.873311,sigmoid,0.30000000000000004,5,0.7,110.30752563476562,,,,PRUNED
82,82,33.983001708984375,2022-12-25 01:24:14.809908,2022-12-25 01:24:30.332708,0 days 00:00:15.522800,relu,0.15000000000000002,4,0.9,46.52037811279297,33.983001708984375,,,PRUNED
83,83,90.00071716308594,2022-12-25 01:24:30.426153,2022-12-25 01:24:39.357018,0 days 00:00:08.930865,tanh,0.5,7,0.8,90.00071716308594,,,,PRUNED
84,84,9.385950088500977,2022-12-25 01:24:39.441357,2022-12-25 01:25:15.402206,0 days 00:00:35.960849,sigmoid,0.45,3,0.6,9.385950088500977,,,,PRUNED
85,85,95.52378845214844,2022-12-25 01:25:15.489406,2022-12-25 01:25:23.845300,0 days 00:00:08.355894,relu,0.35000000000000003,2,0.85,95.52378845214844,,,,PRUNED
86,86,27.085935592651367,2022-12-25 01:25:23.937841,2022-12-25 01:25:39.026475,0 days 00:00:15.088634,relu,0.35000000000000003,2,0.7,27.085935592651367,,,,PRUNED
87,87,127.4146499633789,2022-12-25 01:25:39.111813,2022-12-25 01:25:48.326770,0 days 00:00:09.214957,sigmoid,0.0,8,0.9,127.4146499633789,,,,PRUNED
88,88,35.99922561645508,2022-12-25 01:25:48.411105,2022-12-25 01:26:03.708930,0 days 00:00:15.297825,relu,0.35000000000000003,3,0.75,35.99922561645508,,,,PRUNED
89,89,93.5876235961914,2022-12-25 01:26:03.793267,2022-12-25 01:26:12.158293,0 days 00:00:08.365026,relu,0.2,2,0.6,93.5876235961914,,,,PRUNED
90,90,30.872920989990234,2022-12-25 01:26:12.242383,2022-12-25 01:26:27.290467,0 days 00:00:15.048084,relu,0.30000000000000004,2,0.75,30.872920989990234,,,,PRUNED
91,91,88.20960998535156,2022-12-25 01:26:27.374563,2022-12-25 01:26:36.089125,0 days 00:00:08.714562,relu,0.25,2,0.65,88.20960998535156,,,,PRUNED
92,92,1.63914954662323,2022-12-25 01:26:36.182455,2022-12-25 01:27:48.801321,0 days 00:01:12.618866,sigmoid,0.4,2,0.85,13.484097480773926,6.236056327819824,,,COMPLETE
93,93,92.80548858642578,2022-12-25 01:27:48.916922,2022-12-25 01:27:57.466935,0 days 00:00:08.550013,relu,0.1,3,0.6,92.80548858642578,,,,PRUNED
94,94,8.791976928710938,2022-12-25 01:27:57.559258,2022-12-25 01:28:33.230878,0 days 00:00:35.671620,sigmoid,0.35000000000000003,3,0.95,8.791976928710938,,,,PRUNED
95,95,113.59532165527344,2022-12-25 01:28:33.323681,2022-12-25 01:28:41.655197,0 days 00:00:08.331516,relu,0.2,2,0.65,113.59532165527344,,,,PRUNED
96,96,2.9700493812561035,2022-12-25 01:28:41.739575,2022-12-25 01:29:14.088487,0 days 00:00:32.348912,relu,0.30000000000000004,3,0.6,40.00901794433594,16.355937957763672,,,COMPLETE
97,97,5.383910655975342,2022-12-25 01:29:14.184206,2022-12-25 01:29:39.979199,0 days 00:00:25.794993,sigmoid,0.30000000000000004,5,0.85,,,,,COMPLETE
98,98,108.09454345703125,2022-12-25 01:29:40.089807,2022-12-25 01:29:48.825124,0 days 00:00:08.735317,tanh,0.5,3,0.6,108.09454345703125,,,,PRUNED
99,99,1.4228578805923462,2022-12-25 01:29:48.908213,2022-12-25 01:31:11.753538,0 days 00:01:22.845325,relu,0.45,2,0.7,20.30483055114746,5.593957901000977,,,COMPLETE
100,100,21.650402069091797,2022-12-25 01:31:11.867797,2022-12-25 01:31:27.267623,0 days 00:00:15.399826,relu,0.45,4,0.6,60.294315338134766,21.650402069091797,,,PRUNED
101,101,38.71495819091797,2022-12-25 01:31:27.360296,2022-12-25 01:31:42.848772,0 days 00:00:15.488476,relu,0.4,3,0.75,48.221553802490234,38.71495819091797,,,PRUNED
102,102,8.36205005645752,2022-12-25 01:31:42.926037,2022-12-25 01:32:18.522058,0 days 00:00:35.596021,tanh,0.45,3,0.65,21.27941131591797,8.36205005645752,,,PRUNED
103,103,47.21894454956055,2022-12-25 01:32:18.606619,2022-12-25 01:32:34.220862,0 days 00:00:15.614243,relu,0.5,6,0.75,47.21894454956055,,,,PRUNED
104,104,27.740732192993164,2022-12-25 01:32:34.295484,2022-12-25 01:32:49.502031,0 days 00:00:15.206547,sigmoid,0.45,3,0.85,27.740732192993164,,,,PRUNED
105,105,1.4971024990081787,2022-12-25 01:32:49.586349,2022-12-25 01:34:33.252786,0 days 00:01:43.666437,tanh,0.5,2,0.6,19.16012954711914,5.832520008087158,4.729641437530518,,COMPLETE
106,106,6.653685092926025,2022-12-25 01:34:33.341918,2022-12-25 01:35:08.767420,0 days 00:00:35.425502,sigmoid,0.4,2,0.65,6.653685092926025,,,,PRUNED
107,107,25.589153289794922,2022-12-25 01:35:08.851881,2022-12-25 01:35:23.941835,0 days 00:00:15.089954,tanh,0.5,2,0.6,25.589153289794922,,,,PRUNED
108,108,6.692439079284668,2022-12-25 01:35:24.026561,2022-12-25 01:35:59.246911,0 days 00:00:35.220350,tanh,0.5,2,0.6,10.8082275390625,6.692439079284668,,,PRUNED
109,109,22.54033851623535,2022-12-25 01:35:59.322909,2022-12-25 01:36:14.995709,0 days 00:00:15.672800,relu,0.30000000000000004,4,0.7,64.48762512207031,22.54033851623535,,,PRUNED
110,110,19.480453491210938,2022-12-25 01:36:15.070740,2022-12-25 01:36:30.319549,0 days 00:00:15.248809,relu,0.5,3,0.65,41.85105514526367,19.480453491210938,,,PRUNED
111,111,1.6987086534500122,2022-12-25 01:36:30.395548,2022-12-25 01:37:36.152582,0 days 00:01:05.757034,relu,0.15000000000000002,2,0.6,48.092926025390625,10.657215118408203,5.777571201324463,,COMPLETE
112,112,94.52637481689453,2022-12-25 01:37:36.255550,2022-12-25 01:37:44.771202,0 days 00:00:08.515652,relu,0.15000000000000002,2,0.6,94.52637481689453,,,,PRUNED
113,113,7.605173110961914,2022-12-25 01:37:44.856539,2022-12-25 01:38:20.319477,0 days 00:00:35.462938,tanh,0.45,3,0.65,13.422136306762695,7.605173110961914,,,PRUNED
114,114,1.3745620250701904,2022-12-25 01:38:20.403490,2022-12-25 01:39:56.715325,0 days 00:01:36.311835,relu,0.1,2,0.6,39.49418640136719,11.089601516723633,5.770503520965576,3.9178965091705322,COMPLETE
115,115,97.62873840332031,2022-12-25 01:39:56.816833,2022-12-25 01:40:05.144843,0 days 00:00:08.328010,relu,0.1,2,0.6,97.62873840332031,,,,PRUNED
116,116,104.68547058105469,2022-12-25 01:40:05.229264,2022-12-25 01:40:13.894174,0 days 00:00:08.664910,relu,0.05,2,0.65,104.68547058105469,,,,PRUNED
117,117,42.51462173461914,2022-12-25 01:40:13.970500,2022-12-25 01:40:29.652312,0 days 00:00:15.681812,tanh,0.4,7,0.7,42.51462173461914,,,,PRUNED
118,118,106.39427185058594,2022-12-25 01:40:29.727631,2022-12-25 01:40:38.050665,0 days 00:00:08.323034,tanh,0.1,2,0.65,106.39427185058594,,,,PRUNED
119,119,95.57655334472656,2022-12-25 01:40:38.125993,2022-12-25 01:40:46.433364,0 days 00:00:08.307371,relu,0.15000000000000002,2,0.85,95.57655334472656,,,,PRUNED
120,120,9.484925270080566,2022-12-25 01:40:46.509688,2022-12-25 01:41:22.312619,0 days 00:00:35.802931,sigmoid,0.30000000000000004,3,0.7,9.484925270080566,,,,PRUNED
121,121,7.31425142288208,2022-12-25 01:41:22.390289,2022-12-25 01:41:57.768248,0 days 00:00:35.377959,relu,0.05,2,0.6,30.911399841308594,10.696601867675781,7.31425142288208,,PRUNED
122,122,7.143502712249756,2022-12-25 01:41:57.845922,2022-12-25 01:42:32.981920,0 days 00:00:35.135998,tanh,0.45,2,1.0,13.68368911743164,7.143502712249756,,,PRUNED
123,123,3.5696094036102295,2022-12-25 01:42:33.059903,2022-12-25 01:43:05.759478,0 days 00:00:32.699575,sigmoid,0.25,5,0.8,,,,,COMPLETE
124,124,1.486538052558899,2022-12-25 01:43:05.856378,2022-12-25 01:44:48.526650,0 days 00:01:42.670272,relu,0.15000000000000002,2,0.65,10.43259334564209,5.678372859954834,4.362456798553467,,COMPLETE
125,125,88.1510009765625,2022-12-25 01:44:48.629680,2022-12-25 01:44:57.271195,0 days 00:00:08.641515,sigmoid,0.25,2,1.0,88.1510009765625,,,,PRUNED
126,126,250.5618896484375,2022-12-25 01:44:57.365556,2022-12-25 01:45:06.436291,0 days 00:00:09.070735,relu,0.15000000000000002,7,0.7,250.5618896484375,,,,PRUNED
127,127,72.24130249023438,2022-12-25 01:45:06.515878,2022-12-25 01:45:14.903233,0 days 00:00:08.387355,relu,0.2,3,0.6,72.24130249023438,,,,PRUNED
128,128,85.0060806274414,2022-12-25 01:45:14.980230,2022-12-25 01:45:23.527571,0 days 00:00:08.547341,relu,0.05,3,0.6,85.0060806274414,,,,PRUNED
129,129,124.1498031616211,2022-12-25 01:45:23.605239,2022-12-25 01:45:31.942597,0 days 00:00:08.337358,relu,0.1,2,0.65,124.1498031616211,,,,PRUNED
130,130,58.746334075927734,2022-12-25 01:45:32.021573,2022-12-25 01:45:47.842386,0 days 00:00:15.820813,relu,0.45,5,0.6,56.18149185180664,58.746334075927734,,,PRUNED
131,131,93.66552734375,2022-12-25 01:45:47.911659,2022-12-25 01:45:56.315742,0 days 00:00:08.404083,relu,0.15000000000000002,3,0.65,93.66552734375,,,,PRUNED
132,132,7.904648303985596,2022-12-25 01:45:56.412076,2022-12-25 01:46:31.664054,0 days 00:00:35.251978,relu,0.15000000000000002,2,0.6,21.731216430664062,7.904648303985596,,,PRUNED
133,133,11.585768699645996,2022-12-25 01:46:31.741881,2022-12-25 01:47:06.994694,0 days 00:00:35.252813,tanh,0.0,2,0.65,19.378219604492188,11.585768699645996,,,PRUNED
134,134,1.4675307273864746,2022-12-25 01:47:07.071363,2022-12-25 01:48:43.390848,0 days 00:01:36.319485,relu,0.1,2,0.6,17.93292999267578,5.241415977478027,4.33289098739624,,COMPLETE
