,number,value,datetime_start,datetime_complete,duration,params_activation,params_dropout,params_layers,params_shrink,system_attrs_completed_rung_0,system_attrs_completed_rung_1,system_attrs_completed_rung_2,system_attrs_completed_rung_3,state
670,670,15.5538330078125,2022-12-25 06:03:13.574052,2022-12-25 06:03:28.884530,0 days 00:00:15.310478,sigmoid,0.05,2,0.6,28.19088363647461,15.5538330078125,,,PRUNED
671,671,20.241134643554688,2022-12-25 06:03:28.971877,2022-12-25 06:03:44.125034,0 days 00:00:15.153157,relu,0.4,2,0.6,20.241134643554688,,,,PRUNED
672,672,102.69901275634766,2022-12-25 06:03:44.203464,2022-12-25 06:04:20.513923,0 days 00:00:36.310459,sigmoid,0.4,6,0.6,102.69901275634766,,,,PRUNED
673,673,94.44570922851562,2022-12-25 06:04:20.592940,2022-12-25 06:04:29.129932,0 days 00:00:08.536992,sigmoid,0.05,2,0.65,94.44570922851562,,,,PRUNED
674,674,108.34449005126953,2022-12-25 06:04:29.207814,2022-12-25 06:04:37.754290,0 days 00:00:08.546476,sigmoid,0.0,2,0.6,108.34449005126953,,,,PRUNED
675,675,74.5274887084961,2022-12-25 06:04:37.834290,2022-12-25 06:04:46.286957,0 days 00:00:08.452667,sigmoid,0.0,2,0.6,74.5274887084961,,,,PRUNED
676,676,37.989925384521484,2022-12-25 06:04:46.376284,2022-12-25 06:05:01.944096,0 days 00:00:15.567812,sigmoid,0.05,2,0.6,35.352108001708984,37.989925384521484,,,PRUNED
677,677,101.29496765136719,2022-12-25 06:05:02.031436,2022-12-25 06:05:10.435109,0 days 00:00:08.403673,sigmoid,0.05,2,0.6,101.29496765136719,,,,PRUNED
678,678,10.96093463897705,2022-12-25 06:05:10.514128,2022-12-25 06:05:46.005474,0 days 00:00:35.491346,relu,0.4,2,0.6,14.317411422729492,10.96093463897705,,,PRUNED
679,679,72.55720520019531,2022-12-25 06:05:46.086593,2022-12-25 06:05:54.531300,0 days 00:00:08.444707,sigmoid,0.05,2,0.6,72.55720520019531,,,,PRUNED
680,680,1.3971894979476929,2022-12-25 06:05:54.610759,2022-12-25 06:07:37.803047,0 days 00:01:43.192288,tanh,0.30000000000000004,2,0.65,6.211767196655273,4.156994342803955,,,COMPLETE
681,681,6.830191612243652,2022-12-25 06:07:37.889314,2022-12-25 06:08:13.571155,0 days 00:00:35.681841,sigmoid,0.0,3,0.65,31.572675704956055,14.527656555175781,6.830191612243652,,PRUNED
682,682,37.449180603027344,2022-12-25 06:08:13.649701,2022-12-25 06:08:28.969786,0 days 00:00:15.320085,sigmoid,0.0,2,0.6,55.302799224853516,37.449180603027344,,,PRUNED
683,683,7.934637069702148,2022-12-25 06:08:29.057314,2022-12-25 06:09:04.433927,0 days 00:00:35.376613,relu,0.45,2,0.6,11.39840030670166,7.934637069702148,,,PRUNED
684,684,6.564910411834717,2022-12-25 06:09:04.513938,2022-12-25 06:09:40.239528,0 days 00:00:35.725590,relu,0.4,2,0.6,18.373291015625,6.564910411834717,,,PRUNED
685,685,5.155484676361084,2022-12-25 06:09:40.318538,2022-12-25 06:11:16.423855,0 days 00:01:36.105317,tanh,0.30000000000000004,2,0.65,6.45359468460083,5.155484676361084,,,PRUNED
686,686,8.206083297729492,2022-12-25 06:11:16.501865,2022-12-25 06:11:51.945993,0 days 00:00:35.444128,relu,0.1,2,0.6,16.946704864501953,8.206083297729492,,,PRUNED
687,687,19.51386833190918,2022-12-25 06:11:52.024670,2022-12-25 06:12:07.253312,0 days 00:00:15.228642,sigmoid,0.05,2,0.9,57.42219924926758,19.51386833190918,,,PRUNED
688,688,8.68331241607666,2022-12-25 06:12:07.341654,2022-12-25 06:12:42.950590,0 days 00:00:35.608936,tanh,0.30000000000000004,2,0.65,8.68331241607666,,,,PRUNED
689,689,1.3109588623046875,2022-12-25 06:12:43.029601,2022-12-25 06:14:19.280749,0 days 00:01:36.251148,sigmoid,0.35000000000000003,2,0.6,11.754155158996582,5.403092384338379,3.5489001274108887,,COMPLETE
690,690,196.73374938964844,2022-12-25 06:14:19.366823,2022-12-25 06:14:28.225889,0 days 00:00:08.859066,sigmoid,0.15000000000000002,6,0.6,196.73374938964844,,,,PRUNED
691,691,20.52231216430664,2022-12-25 06:14:28.304741,2022-12-25 06:14:43.799700,0 days 00:00:15.494959,sigmoid,0.35000000000000003,2,0.6,20.52231216430664,,,,PRUNED
692,692,85.67826843261719,2022-12-25 06:14:43.878747,2022-12-25 06:14:52.340550,0 days 00:00:08.461803,sigmoid,0.0,2,0.6,85.67826843261719,,,,PRUNED
693,693,93.89347839355469,2022-12-25 06:14:52.419324,2022-12-25 06:15:00.890064,0 days 00:00:08.470740,tanh,0.45,2,0.6,93.89347839355469,,,,PRUNED
694,694,22.008255004882812,2022-12-25 06:15:00.968069,2022-12-25 06:15:16.180561,0 days 00:00:15.212492,sigmoid,0.15000000000000002,2,0.6,47.055091857910156,22.008255004882812,,,PRUNED
695,695,14.552621841430664,2022-12-25 06:15:16.259491,2022-12-25 06:15:52.061158,0 days 00:00:35.801667,tanh,0.25,2,0.7,14.552621841430664,,,,PRUNED
696,696,75.1046371459961,2022-12-25 06:15:52.139170,2022-12-25 06:16:00.535502,0 days 00:00:08.396332,sigmoid,0.05,2,0.6,75.1046371459961,,,,PRUNED
697,697,101.21126556396484,2022-12-25 06:16:00.613519,2022-12-25 06:16:09.043193,0 days 00:00:08.429674,sigmoid,0.0,2,0.8,101.21126556396484,,,,PRUNED
698,698,21.514650344848633,2022-12-25 06:16:09.131599,2022-12-25 06:16:44.532193,0 days 00:00:35.400594,tanh,0.35000000000000003,2,0.65,21.514650344848633,,,,PRUNED
699,699,25.108795166015625,2022-12-25 06:16:44.611168,2022-12-25 06:17:00.397612,0 days 00:00:15.786444,relu,0.15000000000000002,4,0.65,63.58279037475586,25.108795166015625,,,PRUNED
700,700,1.683458924293518,2022-12-25 06:17:00.483976,2022-12-25 06:18:29.947694,0 days 00:01:29.463718,sigmoid,0.4,2,0.6,10.392637252807617,6.224824905395508,,,COMPLETE
701,701,16.569608688354492,2022-12-25 06:18:30.059800,2022-12-25 06:19:05.513062,0 days 00:00:35.453262,sigmoid,0.45,2,0.6,10.655782699584961,16.569608688354492,,,PRUNED
702,702,36.17878341674805,2022-12-25 06:19:05.593071,2022-12-25 06:19:21.403511,0 days 00:00:15.810440,relu,0.5,5,1.0,56.579830169677734,36.17878341674805,,,PRUNED
703,703,1.390478253364563,2022-12-25 06:19:21.481639,2022-12-25 06:20:57.738943,0 days 00:01:36.257304,sigmoid,0.35000000000000003,2,0.65,16.74140739440918,6.119046688079834,3.8487768173217773,,COMPLETE
704,704,22.583721160888672,2022-12-25 06:20:57.830272,2022-12-25 06:21:12.945001,0 days 00:00:15.114729,sigmoid,0.35000000000000003,2,0.7,22.583721160888672,,,,PRUNED
705,705,52.1214714050293,2022-12-25 06:21:13.030342,2022-12-25 06:21:28.343478,0 days 00:00:15.313136,tanh,0.05,2,0.6,39.712711334228516,52.1214714050293,,,PRUNED
706,706,99.80088806152344,2022-12-25 06:21:28.422839,2022-12-25 06:21:37.209814,0 days 00:00:08.786975,sigmoid,0.1,2,0.7,99.80088806152344,,,,PRUNED
707,707,11.891429901123047,2022-12-25 06:21:37.297161,2022-12-25 06:22:12.707214,0 days 00:00:35.410053,tanh,0.25,2,0.6,11.891429901123047,,,,PRUNED
708,708,80.53054809570312,2022-12-25 06:22:12.787121,2022-12-25 06:22:21.198122,0 days 00:00:08.411001,relu,0.25,2,0.6,80.53054809570312,,,,PRUNED
709,709,1.5317515134811401,2022-12-25 06:22:21.277136,2022-12-25 06:23:33.860996,0 days 00:01:12.583860,sigmoid,0.35000000000000003,2,0.65,11.863210678100586,5.397375583648682,,,COMPLETE
710,710,22.396039962768555,2022-12-25 06:23:33.950269,2022-12-25 06:23:49.399645,0 days 00:00:15.449376,sigmoid,0.35000000000000003,2,0.6,22.396039962768555,,,,PRUNED
711,711,19.708396911621094,2022-12-25 06:23:49.487071,2022-12-25 06:24:04.631449,0 days 00:00:15.144378,sigmoid,0.4,2,0.7,19.708396911621094,,,,PRUNED
712,712,10.910642623901367,2022-12-25 06:24:04.710909,2022-12-25 06:24:40.104189,0 days 00:00:35.393280,relu,0.45,2,0.6,10.910642623901367,,,,PRUNED
713,713,5.059691905975342,2022-12-25 06:24:40.191536,2022-12-25 06:26:16.171941,0 days 00:01:35.980405,tanh,0.35000000000000003,2,0.7,6.766358852386475,5.059691905975342,,,PRUNED
714,714,188.1690673828125,2022-12-25 06:26:16.445380,2022-12-25 06:26:25.396150,0 days 00:00:08.950770,relu,0.1,7,0.6,188.1690673828125,,,,PRUNED
715,715,86.8322525024414,2022-12-25 06:26:25.475265,2022-12-25 06:26:33.953830,0 days 00:00:08.478565,relu,0.5,2,0.6,86.8322525024414,,,,PRUNED
716,716,7.717525482177734,2022-12-25 06:26:34.032737,2022-12-25 06:27:09.584756,0 days 00:00:35.552019,relu,0.25,3,0.65,7.717525482177734,,,,PRUNED
717,717,6.895720958709717,2022-12-25 06:27:09.662783,2022-12-25 06:27:45.465039,0 days 00:00:35.802256,sigmoid,0.35000000000000003,2,0.65,17.24196434020996,6.895720958709717,,,PRUNED
718,718,15.009860038757324,2022-12-25 06:27:45.544059,2022-12-25 06:28:00.813866,0 days 00:00:15.269807,relu,0.15000000000000002,2,0.6,67.86027526855469,15.009860038757324,,,PRUNED
719,719,79.37370300292969,2022-12-25 06:28:00.902212,2022-12-25 06:28:09.463208,0 days 00:00:08.560996,relu,0.0,2,0.65,79.37370300292969,,,,PRUNED
720,720,15.72996997833252,2022-12-25 06:28:09.542220,2022-12-25 06:28:45.510707,0 days 00:00:35.968487,relu,0.1,2,0.7,34.254276275634766,11.066286087036133,15.72996997833252,,PRUNED
721,721,7.021657466888428,2022-12-25 06:28:45.588468,2022-12-25 06:29:21.233014,0 days 00:00:35.644546,sigmoid,0.0,2,0.6,17.428037643432617,7.021657466888428,,,PRUNED
722,722,17.845108032226562,2022-12-25 06:29:21.320074,2022-12-25 06:29:56.688393,0 days 00:00:35.368319,sigmoid,0.30000000000000004,2,0.65,17.845108032226562,,,,PRUNED
723,723,108.43257141113281,2022-12-25 06:29:56.769355,2022-12-25 06:30:05.354046,0 days 00:00:08.584691,sigmoid,0.05,3,0.6,108.43257141113281,,,,PRUNED
724,724,18.960186004638672,2022-12-25 06:30:05.432383,2022-12-25 06:30:21.036494,0 days 00:00:15.604111,relu,0.15000000000000002,2,0.6,48.674354553222656,18.960186004638672,,,PRUNED
725,725,31.077592849731445,2022-12-25 06:30:21.115508,2022-12-25 06:30:36.401723,0 days 00:00:15.286215,relu,0.25,2,0.6,43.758705139160156,31.077592849731445,,,PRUNED
726,726,23.734485626220703,2022-12-25 06:30:36.490962,2022-12-25 06:30:51.809150,0 days 00:00:15.318188,tanh,0.1,2,0.6,23.734485626220703,,,,PRUNED
727,727,1.5868797302246094,2022-12-25 06:30:51.887294,2022-12-25 06:32:11.073253,0 days 00:01:19.185959,sigmoid,0.15000000000000002,2,0.7,18.056411743164062,5.8293023109436035,,,COMPLETE
728,728,21.1026611328125,2022-12-25 06:32:11.189814,2022-12-25 06:32:26.668574,0 days 00:00:15.478760,tanh,0.4,2,0.6,21.1026611328125,,,,PRUNED
729,729,90.1990966796875,2022-12-25 06:32:26.746758,2022-12-25 06:32:35.160066,0 days 00:00:08.413308,relu,0.0,2,0.6,90.1990966796875,,,,PRUNED
730,730,7.129912853240967,2022-12-25 06:32:35.247937,2022-12-25 06:33:10.681426,0 days 00:00:35.433489,relu,0.35000000000000003,2,0.65,18.611957550048828,7.129912853240967,,,PRUNED
731,731,8.186572074890137,2022-12-25 06:33:10.760612,2022-12-25 06:33:46.362491,0 days 00:00:35.601879,tanh,0.2,2,0.6,8.186572074890137,,,,PRUNED
732,732,4.77157735824585,2022-12-25 06:33:46.441534,2022-12-25 06:35:22.655144,0 days 00:01:36.213610,relu,0.1,2,0.6,34.20909118652344,11.734878540039062,5.796898365020752,4.77157735824585,PRUNED
733,733,83.77464294433594,2022-12-25 06:35:22.742489,2022-12-25 06:35:31.146337,0 days 00:00:08.403848,relu,0.1,2,0.65,83.77464294433594,,,,PRUNED
734,734,20.044321060180664,2022-12-25 06:35:31.225409,2022-12-25 06:35:46.344858,0 days 00:00:15.119449,sigmoid,0.35000000000000003,2,0.65,20.044321060180664,,,,PRUNED
735,735,77.82820892333984,2022-12-25 06:35:46.432348,2022-12-25 06:35:55.125887,0 days 00:00:08.693539,relu,0.1,2,0.8,77.82820892333984,,,,PRUNED
736,736,16.162187576293945,2022-12-25 06:35:55.206946,2022-12-25 06:36:10.568155,0 days 00:00:15.361209,relu,0.1,2,0.6,53.78548812866211,16.162187576293945,,,PRUNED
737,737,69.16627502441406,2022-12-25 06:36:10.648395,2022-12-25 06:36:19.117506,0 days 00:00:08.469111,relu,0.1,2,0.6,69.16627502441406,,,,PRUNED
738,738,7.343256950378418,2022-12-25 06:36:19.196514,2022-12-25 06:36:54.606472,0 days 00:00:35.409958,sigmoid,0.35000000000000003,2,0.65,17.03638458251953,7.343256950378418,,,PRUNED
739,739,23.28340721130371,2022-12-25 06:36:54.685478,2022-12-25 06:37:10.463222,0 days 00:00:15.777744,relu,0.1,3,0.6,67.55647277832031,23.28340721130371,,,PRUNED
740,740,110.61664581298828,2022-12-25 06:37:10.567591,2022-12-25 06:37:19.004602,0 days 00:00:08.437011,relu,0.15000000000000002,2,0.6,110.61664581298828,,,,PRUNED
741,741,21.401525497436523,2022-12-25 06:37:19.109814,2022-12-25 06:37:34.269810,0 days 00:00:15.159996,sigmoid,0.35000000000000003,2,0.65,21.401525497436523,,,,PRUNED
742,742,21.919498443603516,2022-12-25 06:37:34.355444,2022-12-25 06:37:49.576975,0 days 00:00:15.221531,sigmoid,0.2,2,0.6,21.919498443603516,,,,PRUNED
743,743,84.64896392822266,2022-12-25 06:37:49.673565,2022-12-25 06:37:58.443254,0 days 00:00:08.769689,relu,0.1,2,0.6,84.64896392822266,,,,PRUNED
744,744,122.59976959228516,2022-12-25 06:37:58.521016,2022-12-25 06:38:06.934595,0 days 00:00:08.413579,relu,0.5,2,0.9,122.59976959228516,,,,PRUNED
745,745,70.87911224365234,2022-12-25 06:38:07.013282,2022-12-25 06:38:15.492496,0 days 00:00:08.479214,relu,0.05,2,0.7,70.87911224365234,,,,PRUNED
746,746,15.203563690185547,2022-12-25 06:38:15.589697,2022-12-25 06:38:31.107426,0 days 00:00:15.517729,relu,0.4,2,0.65,56.56709671020508,15.203563690185547,,,PRUNED
747,747,4.815143585205078,2022-12-25 06:38:31.194768,2022-12-25 06:40:07.366547,0 days 00:01:36.171779,sigmoid,0.35000000000000003,2,0.6,14.057398796081543,5.941795825958252,4.815143585205078,,PRUNED
748,748,82.36652374267578,2022-12-25 06:40:07.455092,2022-12-25 06:40:16.165816,0 days 00:00:08.710724,relu,0.2,2,0.6,82.36652374267578,,,,PRUNED
749,749,1.6403390169143677,2022-12-25 06:40:16.254948,2022-12-25 06:41:28.846035,0 days 00:01:12.591087,relu,0.30000000000000004,2,0.65,6.134975910186768,,,,COMPLETE
750,750,3.5650839805603027,2022-12-25 06:41:28.935192,2022-12-25 06:41:58.290189,0 days 00:00:29.354997,relu,0.35000000000000003,5,0.65,,,,,COMPLETE
751,751,23.964641571044922,2022-12-25 06:41:58.384639,2022-12-25 06:42:13.531896,0 days 00:00:15.147257,sigmoid,0.1,2,0.65,23.964641571044922,,,,PRUNED
752,752,71.70021057128906,2022-12-25 06:42:13.620463,2022-12-25 06:42:22.206167,0 days 00:00:08.585704,relu,0.1,4,0.6,71.70021057128906,,,,PRUNED
753,753,21.591798782348633,2022-12-25 06:42:22.285464,2022-12-25 06:42:37.396974,0 days 00:00:15.111510,relu,0.35000000000000003,2,0.7,21.591798782348633,,,,PRUNED
754,754,76.20330047607422,2022-12-25 06:42:37.484690,2022-12-25 06:42:46.221291,0 days 00:00:08.736601,relu,0.15000000000000002,2,0.6,76.20330047607422,,,,PRUNED
755,755,4.8086771965026855,2022-12-25 06:42:46.300304,2022-12-25 06:44:22.439205,0 days 00:01:36.138901,relu,0.4,2,0.6,13.226507186889648,5.822343349456787,4.8086771965026855,,PRUNED
756,756,93.2547607421875,2022-12-25 06:44:22.525264,2022-12-25 06:44:31.047538,0 days 00:00:08.522274,relu,0.2,2,0.8,93.2547607421875,,,,PRUNED
757,757,22.167173385620117,2022-12-25 06:44:31.176941,2022-12-25 06:44:46.587090,0 days 00:00:15.410149,tanh,0.5,2,0.6,22.167173385620117,,,,PRUNED
758,758,7.166068077087402,2022-12-25 06:44:46.685761,2022-12-25 06:45:22.100861,0 days 00:00:35.415100,relu,0.4,2,0.7,7.166068077087402,,,,PRUNED
759,759,8.209381103515625,2022-12-25 06:45:22.188402,2022-12-25 06:45:57.556675,0 days 00:00:35.368273,relu,0.30000000000000004,2,0.6,8.209381103515625,,,,PRUNED
760,760,31.01628303527832,2022-12-25 06:45:57.644029,2022-12-25 06:46:12.772186,0 days 00:00:15.128157,relu,0.35000000000000003,2,0.7,31.01628303527832,,,,PRUNED
761,761,7.9416184425354,2022-12-25 06:46:12.859225,2022-12-25 06:46:48.693944,0 days 00:00:35.834719,relu,0.35000000000000003,2,0.6,18.379587173461914,7.9416184425354,,,PRUNED
762,762,24.160287857055664,2022-12-25 06:46:48.781119,2022-12-25 06:47:03.934947,0 days 00:00:15.153828,relu,0.35000000000000003,2,0.6,24.160287857055664,,,,PRUNED
763,763,69.97393798828125,2022-12-25 06:47:04.021718,2022-12-25 06:47:12.500962,0 days 00:00:08.479244,relu,0.05,2,0.95,69.97393798828125,,,,PRUNED
764,764,7.121653079986572,2022-12-25 06:47:12.592059,2022-12-25 06:47:45.647522,0 days 00:00:33.055463,relu,0.25,7,0.65,,,,,COMPLETE
765,765,7.137190818786621,2022-12-25 06:47:45.758095,2022-12-25 06:48:21.095723,0 days 00:00:35.337628,sigmoid,0.25,2,0.65,7.137190818786621,,,,PRUNED
766,766,1.7064757347106934,2022-12-25 06:48:21.185069,2022-12-25 06:49:43.732256,0 days 00:01:22.547187,relu,0.30000000000000004,2,0.6,6.741861343383789,,,,COMPLETE
767,767,97.77288818359375,2022-12-25 06:49:43.825093,2022-12-25 06:49:52.288758,0 days 00:00:08.463665,relu,0.1,2,0.6,97.77288818359375,,,,PRUNED
768,768,7.61337947845459,2022-12-25 06:49:52.387425,2022-12-25 06:50:28.052700,0 days 00:00:35.665275,tanh,0.2,2,0.7,7.61337947845459,,,,PRUNED
769,769,109.45624542236328,2022-12-25 06:50:28.133710,2022-12-25 06:50:36.593604,0 days 00:00:08.459894,tanh,0.25,2,0.65,109.45624542236328,,,,PRUNED
770,770,80.80003356933594,2022-12-25 06:50:36.683047,2022-12-25 06:50:45.134741,0 days 00:00:08.451694,relu,0.5,2,0.6,80.80003356933594,,,,PRUNED
771,771,27.1485595703125,2022-12-25 06:50:45.224871,2022-12-25 06:51:00.647399,0 days 00:00:15.422528,relu,0.15000000000000002,2,0.6,41.40843200683594,27.1485595703125,,,PRUNED
772,772,58.20233154296875,2022-12-25 06:51:00.739892,2022-12-25 06:51:16.773960,0 days 00:00:16.034068,relu,0.35000000000000003,7,0.6,58.20233154296875,,,,PRUNED
773,773,19.366846084594727,2022-12-25 06:51:16.855979,2022-12-25 06:51:31.989497,0 days 00:00:15.133518,relu,0.1,2,0.6,19.366846084594727,,,,PRUNED
774,774,79.93994140625,2022-12-25 06:51:32.079823,2022-12-25 06:51:40.547167,0 days 00:00:08.467344,relu,0.2,2,0.6,79.93994140625,,,,PRUNED
775,775,99.29576873779297,2022-12-25 06:51:40.628166,2022-12-25 06:51:49.254832,0 days 00:00:08.626666,relu,0.1,3,0.6,99.29576873779297,,,,PRUNED
776,776,73.08592987060547,2022-12-25 06:51:49.353503,2022-12-25 06:51:58.179150,0 days 00:00:08.825647,relu,0.45,2,0.6,73.08592987060547,,,,PRUNED
777,777,19.677112579345703,2022-12-25 06:51:58.259498,2022-12-25 06:52:13.427989,0 days 00:00:15.168491,relu,0.35000000000000003,2,0.6,19.677112579345703,,,,PRUNED
778,778,24.73081398010254,2022-12-25 06:52:13.527656,2022-12-25 06:52:28.732264,0 days 00:00:15.204608,relu,0.4,2,1.0,24.73081398010254,,,,PRUNED
779,779,117.24689483642578,2022-12-25 06:52:28.826312,2022-12-25 06:52:37.609474,0 days 00:00:08.783162,relu,0.1,2,0.7,117.24689483642578,,,,PRUNED
780,780,8.771269798278809,2022-12-25 06:52:37.691475,2022-12-25 06:53:13.131765,0 days 00:00:35.440290,sigmoid,0.25,2,0.6,8.771269798278809,,,,PRUNED
781,781,77.18138885498047,2022-12-25 06:53:13.221241,2022-12-25 06:53:21.772771,0 days 00:00:08.551530,relu,0.05,2,0.6,77.18138885498047,,,,PRUNED
782,782,27.39158821105957,2022-12-25 06:53:21.854769,2022-12-25 06:53:37.021594,0 days 00:00:15.166825,sigmoid,0.30000000000000004,2,0.6,27.39158821105957,,,,PRUNED
783,783,91.20223999023438,2022-12-25 06:53:37.120269,2022-12-25 06:53:45.862594,0 days 00:00:08.742325,relu,0.15000000000000002,2,0.6,91.20223999023438,,,,PRUNED
784,784,24.060056686401367,2022-12-25 06:53:45.960391,2022-12-25 06:54:01.583647,0 days 00:00:15.623256,relu,0.2,4,0.6,46.71058654785156,24.060056686401367,,,PRUNED
785,785,105.52205657958984,2022-12-25 06:54:01.668395,2022-12-25 06:54:10.115925,0 days 00:00:08.447530,relu,0.15000000000000002,2,0.65,105.52205657958984,,,,PRUNED
786,786,1.5299650430679321,2022-12-25 06:54:10.192741,2022-12-25 06:55:15.946833,0 days 00:01:05.754092,relu,0.1,2,0.65,11.591619491577148,5.442438125610352,,,COMPLETE
787,787,6.3559465408325195,2022-12-25 06:55:16.048725,2022-12-25 06:55:51.766900,0 days 00:00:35.718175,relu,0.1,2,0.65,14.870820045471191,6.3559465408325195,,,PRUNED
788,788,19.947450637817383,2022-12-25 06:55:51.843318,2022-12-25 06:56:06.973780,0 days 00:00:15.130462,relu,0.1,2,0.65,19.947450637817383,,,,PRUNED
789,789,6.726739406585693,2022-12-25 06:56:07.065153,2022-12-25 06:56:42.371447,0 days 00:00:35.306294,relu,0.1,2,0.65,10.648603439331055,6.726739406585693,,,PRUNED
790,790,71.06126403808594,2022-12-25 06:56:42.456120,2022-12-25 06:56:51.137374,0 days 00:00:08.681254,relu,0.25,2,0.6,71.06126403808594,,,,PRUNED
791,791,104.06676483154297,2022-12-25 06:56:51.212222,2022-12-25 06:56:59.678389,0 days 00:00:08.466167,relu,0.1,2,0.6,104.06676483154297,,,,PRUNED
792,792,105.9462890625,2022-12-25 06:56:59.754872,2022-12-25 06:57:08.202544,0 days 00:00:08.447672,relu,0.2,2,0.6,105.9462890625,,,,PRUNED
793,793,72.9222640991211,2022-12-25 06:57:08.293340,2022-12-25 06:57:16.685428,0 days 00:00:08.392088,relu,0.05,2,0.6,72.9222640991211,,,,PRUNED
794,794,29.90603256225586,2022-12-25 06:57:16.761839,2022-12-25 06:57:32.225903,0 days 00:00:15.464064,relu,0.25,2,0.65,29.90603256225586,,,,PRUNED
795,795,8.275910377502441,2022-12-25 06:57:32.309646,2022-12-25 06:58:07.864850,0 days 00:00:35.555204,tanh,0.45,3,0.65,8.275910377502441,,,,PRUNED
796,796,22.5015869140625,2022-12-25 06:58:07.948595,2022-12-25 06:58:43.337143,0 days 00:00:35.388548,relu,0.15000000000000002,2,0.8,42.682125091552734,11.570813179016113,22.5015869140625,,PRUNED
797,797,7.577568054199219,2022-12-25 06:58:43.421885,2022-12-25 06:59:18.701114,0 days 00:00:35.279229,sigmoid,0.25,2,0.6,7.577568054199219,,,,PRUNED
798,798,1.3282828330993652,2022-12-25 06:59:18.784855,2022-12-25 07:01:25.475974,0 days 00:02:06.691119,relu,0.1,2,0.6,11.074911117553711,5.0287652015686035,3.661743640899658,,COMPLETE
799,799,118.54657745361328,2022-12-25 07:01:25.562190,2022-12-25 07:01:34.099111,0 days 00:00:08.536921,relu,0.5,2,0.6,118.54657745361328,,,,PRUNED
800,800,95.33585357666016,2022-12-25 07:01:34.174522,2022-12-25 07:01:42.740554,0 days 00:00:08.566032,relu,0.2,2,0.7,95.33585357666016,,,,PRUNED
801,801,7.892118453979492,2022-12-25 07:01:42.823865,2022-12-25 07:02:18.512391,0 days 00:00:35.688526,sigmoid,0.25,2,0.6,7.892118453979492,,,,PRUNED
802,802,39.03696823120117,2022-12-25 07:02:18.586823,2022-12-25 07:02:33.902882,0 days 00:00:15.316059,relu,0.1,2,0.65,48.977020263671875,39.03696823120117,,,PRUNED
803,803,89.06890869140625,2022-12-25 07:02:33.979245,2022-12-25 07:02:42.545045,0 days 00:00:08.565800,tanh,0.05,2,0.6,89.06890869140625,,,,PRUNED
804,804,8.477838516235352,2022-12-25 07:02:42.646305,2022-12-25 07:03:18.066180,0 days 00:00:35.419875,relu,0.1,2,0.7,18.216106414794922,8.477838516235352,,,PRUNED
