,number,value,datetime_start,datetime_complete,duration,params_activation,params_dropout,params_layers,params_shrink,system_attrs_completed_rung_0,system_attrs_completed_rung_1,system_attrs_completed_rung_2,system_attrs_completed_rung_3,state
1072,1072,95.60008239746094,2022-12-25 09:06:51.311452,2022-12-25 09:07:00.052276,0 days 00:00:08.740824,relu,0.5,2,0.8,95.60008239746094,,,,PRUNED
1073,1073,83.87845611572266,2022-12-25 09:07:00.141378,2022-12-25 09:07:08.601203,0 days 00:00:08.459825,relu,0.35000000000000003,2,0.65,83.87845611572266,,,,PRUNED
1074,1074,5.976419448852539,2022-12-25 09:07:08.692455,2022-12-25 09:07:38.489437,0 days 00:00:29.796982,tanh,0.2,8,0.95,,,,,COMPLETE
1075,1075,18.041032791137695,2022-12-25 09:07:38.592760,2022-12-25 09:07:54.064664,0 days 00:00:15.471904,relu,0.0,2,0.6,65.62810516357422,18.041032791137695,,,PRUNED
1076,1076,6.8093461990356445,2022-12-25 09:07:54.148779,2022-12-25 09:08:29.703348,0 days 00:00:35.554569,relu,0.5,2,0.6,14.785457611083984,6.8093461990356445,,,PRUNED
1077,1077,86.33743286132812,2022-12-25 09:08:29.784938,2022-12-25 09:08:38.287036,0 days 00:00:08.502098,relu,0.5,2,0.6,86.33743286132812,,,,PRUNED
1078,1078,89.27256774902344,2022-12-25 09:08:38.375273,2022-12-25 09:08:46.843826,0 days 00:00:08.468553,relu,0.2,2,0.6,89.27256774902344,,,,PRUNED
1079,1079,89.01853942871094,2022-12-25 09:08:46.933952,2022-12-25 09:08:55.534709,0 days 00:00:08.600757,tanh,0.15000000000000002,2,0.7,89.01853942871094,,,,PRUNED
1080,1080,4.6494598388671875,2022-12-25 09:08:55.614867,2022-12-25 09:10:31.544056,0 days 00:01:35.929189,tanh,0.2,2,1.0,6.407965660095215,4.6494598388671875,,,PRUNED
1081,1081,1.6662143468856812,2022-12-25 09:10:31.784715,2022-12-25 09:11:41.106470,0 days 00:01:09.321755,tanh,0.25,2,0.9,5.994476318359375,,,,COMPLETE
1082,1082,19.819448471069336,2022-12-25 09:11:41.206696,2022-12-25 09:11:56.387596,0 days 00:00:15.180900,relu,0.30000000000000004,2,0.6,19.819448471069336,,,,PRUNED
1083,1083,37.63426208496094,2022-12-25 09:11:56.467511,2022-12-25 09:12:11.829089,0 days 00:00:15.361578,relu,0.0,2,0.6,37.63426208496094,,,,PRUNED
1084,1084,10.563138008117676,2022-12-25 09:12:11.909042,2022-12-25 09:12:47.442044,0 days 00:00:35.533002,sigmoid,0.15000000000000002,2,0.7,16.781673431396484,10.563138008117676,,,PRUNED
1085,1085,21.230060577392578,2022-12-25 09:12:47.521966,2022-12-25 09:13:02.724218,0 days 00:00:15.202252,relu,0.1,2,0.6,21.230060577392578,,,,PRUNED
1086,1086,103.6916732788086,2022-12-25 09:13:02.805142,2022-12-25 09:13:11.290411,0 days 00:00:08.485269,sigmoid,0.05,2,0.6,103.6916732788086,,,,PRUNED
1087,1087,23.895139694213867,2022-12-25 09:13:11.386820,2022-12-25 09:13:26.830715,0 days 00:00:15.443895,tanh,0.35000000000000003,2,0.6,23.895139694213867,,,,PRUNED
1088,1088,7.474950313568115,2022-12-25 09:13:26.910628,2022-12-25 09:14:02.461337,0 days 00:00:35.550709,relu,0.2,2,0.6,65.58157348632812,13.20374870300293,7.474950313568115,,PRUNED
1089,1089,1.4456429481506348,2022-12-25 09:14:02.542249,2022-12-25 09:15:32.374332,0 days 00:01:29.832083,relu,0.4,2,0.6,10.473333358764648,5.918196678161621,,,COMPLETE
1090,1090,96.5080795288086,2022-12-25 09:15:32.472417,2022-12-25 09:15:41.021501,0 days 00:00:08.549084,relu,0.25,2,0.6,96.5080795288086,,,,PRUNED
1091,1091,7.471220016479492,2022-12-25 09:15:41.108555,2022-12-25 09:16:16.951100,0 days 00:00:35.842545,relu,0.4,2,0.6,17.645610809326172,7.471220016479492,,,PRUNED
1092,1092,7.8573384284973145,2022-12-25 09:16:17.041353,2022-12-25 09:16:52.448501,0 days 00:00:35.407148,tanh,0.35000000000000003,2,1.0,7.8573384284973145,,,,PRUNED
1093,1093,7.024436950683594,2022-12-25 09:16:52.537639,2022-12-25 09:17:27.920693,0 days 00:00:35.383054,sigmoid,0.15000000000000002,2,0.95,7.024436950683594,,,,PRUNED
1094,1094,110.8133773803711,2022-12-25 09:17:28.008938,2022-12-25 09:17:36.503372,0 days 00:00:08.494434,relu,0.30000000000000004,2,0.6,110.8133773803711,,,,PRUNED
1095,1095,6.363743305206299,2022-12-25 09:17:36.778471,2022-12-25 09:18:12.617289,0 days 00:00:35.838818,relu,0.05,2,0.6,46.64262771606445,10.943192481994629,6.363743305206299,,PRUNED
1096,1096,110.51788330078125,2022-12-25 09:18:12.698204,2022-12-25 09:18:21.384287,0 days 00:00:08.686083,tanh,0.2,3,0.65,110.51788330078125,,,,PRUNED
1097,1097,81.24192810058594,2022-12-25 09:18:21.472544,2022-12-25 09:18:30.040966,0 days 00:00:08.568422,relu,0.15000000000000002,2,0.6,81.24192810058594,,,,PRUNED
1098,1098,4.531291484832764,2022-12-25 09:18:30.132215,2022-12-25 09:20:06.741931,0 days 00:01:36.609716,relu,0.30000000000000004,2,0.6,6.733955383300781,4.531291484832764,,,PRUNED
1099,1099,18.29300308227539,2022-12-25 09:20:06.833205,2022-12-25 09:20:22.182346,0 days 00:00:15.349141,sigmoid,0.0,2,0.6,63.2415885925293,18.29300308227539,,,PRUNED
1100,1100,111.94416046142578,2022-12-25 09:20:22.280009,2022-12-25 09:20:30.740102,0 days 00:00:08.460093,relu,0.5,2,0.6,111.94416046142578,,,,PRUNED
1101,1101,18.51419448852539,2022-12-25 09:20:30.821017,2022-12-25 09:20:46.263918,0 days 00:00:15.442901,relu,0.4,2,0.6,18.51419448852539,,,,PRUNED
1102,1102,1.767696738243103,2022-12-25 09:20:46.344819,2022-12-25 09:21:59.467847,0 days 00:01:13.123028,sigmoid,0.4,2,0.65,11.135189056396484,6.132744789123535,,,COMPLETE
1103,1103,20.207717895507812,2022-12-25 09:21:59.569867,2022-12-25 09:22:14.907107,0 days 00:00:15.337240,relu,0.4,2,0.6,20.207717895507812,,,,PRUNED
1104,1104,87.39996337890625,2022-12-25 09:22:14.995422,2022-12-25 09:22:23.514855,0 days 00:00:08.519433,relu,0.25,2,0.6,87.39996337890625,,,,PRUNED
1105,1105,127.05635833740234,2022-12-25 09:22:23.603864,2022-12-25 09:22:32.372918,0 days 00:00:08.769054,relu,0.05,2,0.6,127.05635833740234,,,,PRUNED
1106,1106,22.271203994750977,2022-12-25 09:22:32.470078,2022-12-25 09:22:47.621750,0 days 00:00:15.151672,tanh,0.4,2,0.7,22.271203994750977,,,,PRUNED
1107,1107,1.7888457775115967,2022-12-25 09:22:47.702255,2022-12-25 09:23:53.589157,0 days 00:01:05.886902,tanh,0.2,2,0.65,6.266578674316406,,,,COMPLETE
1108,1108,16.860742568969727,2022-12-25 09:23:53.692578,2022-12-25 09:24:08.940147,0 days 00:00:15.247569,relu,0.2,2,0.7,54.61947250366211,16.860742568969727,,,PRUNED
1109,1109,10.484028816223145,2022-12-25 09:24:09.029405,2022-12-25 09:24:45.045720,0 days 00:00:36.016315,relu,0.45,2,0.6,17.700998306274414,10.484028816223145,,,PRUNED
1110,1110,8.222305297851562,2022-12-25 09:24:45.126644,2022-12-25 09:25:20.701165,0 days 00:00:35.574521,tanh,0.25,2,0.6,8.222305297851562,,,,PRUNED
1111,1111,26.25308609008789,2022-12-25 09:25:20.781221,2022-12-25 09:25:36.066842,0 days 00:00:15.285621,tanh,0.5,2,0.8,50.12517547607422,26.25308609008789,,,PRUNED
1112,1112,10.807107925415039,2022-12-25 09:25:36.147759,2022-12-25 09:26:11.839112,0 days 00:00:35.691353,sigmoid,0.25,2,0.85,10.807107925415039,,,,PRUNED
1113,1113,22.63614273071289,2022-12-25 09:26:11.917938,2022-12-25 09:26:27.379734,0 days 00:00:15.461796,relu,0.1,3,0.75,56.019371032714844,22.63614273071289,,,PRUNED
1114,1114,9.357714653015137,2022-12-25 09:26:27.468854,2022-12-25 09:27:02.968552,0 days 00:00:35.499698,sigmoid,0.30000000000000004,2,0.65,9.357714653015137,,,,PRUNED
1115,1115,70.76756286621094,2022-12-25 09:27:03.049469,2022-12-25 09:27:11.493903,0 days 00:00:08.444434,sigmoid,0.2,2,0.6,70.76756286621094,,,,PRUNED
1116,1116,85.54080963134766,2022-12-25 09:27:11.582120,2022-12-25 09:27:20.640346,0 days 00:00:09.058226,relu,0.15000000000000002,5,0.65,85.54080963134766,,,,PRUNED
1117,1117,31.054794311523438,2022-12-25 09:27:20.731454,2022-12-25 09:27:36.066727,0 days 00:00:15.335273,relu,0.0,2,0.6,57.94736862182617,31.054794311523438,,,PRUNED
1118,1118,16.72339630126953,2022-12-25 09:27:36.147959,2022-12-25 09:27:51.414865,0 days 00:00:15.266906,relu,0.45,2,0.6,44.29240798950195,16.72339630126953,,,PRUNED
1119,1119,23.860584259033203,2022-12-25 09:27:51.496265,2022-12-25 09:28:06.780361,0 days 00:00:15.284096,relu,0.4,2,0.7,23.860584259033203,,,,PRUNED
1120,1120,1.5362389087677002,2022-12-25 09:28:07.072126,2022-12-25 09:29:13.535937,0 days 00:01:06.463811,relu,0.05,2,0.6,42.04660415649414,13.518007278442383,5.054708003997803,,COMPLETE
1121,1121,115.73609161376953,2022-12-25 09:29:13.634872,2022-12-25 09:29:22.074629,0 days 00:00:08.439757,tanh,0.05,2,0.6,115.73609161376953,,,,PRUNED
1122,1122,92.08544158935547,2022-12-25 09:29:22.155394,2022-12-25 09:29:30.583315,0 days 00:00:08.427921,relu,0.05,2,0.6,92.08544158935547,,,,PRUNED
1123,1123,105.38639831542969,2022-12-25 09:29:30.672560,2022-12-25 09:29:39.448741,0 days 00:00:08.776181,sigmoid,0.05,2,0.95,105.38639831542969,,,,PRUNED
1124,1124,83.32728576660156,2022-12-25 09:29:39.538556,2022-12-25 09:29:48.089892,0 days 00:00:08.551336,relu,0.05,2,0.6,83.32728576660156,,,,PRUNED
1125,1125,23.75041389465332,2022-12-25 09:29:48.178875,2022-12-25 09:30:03.513241,0 days 00:00:15.334366,relu,0.35000000000000003,2,0.6,23.75041389465332,,,,PRUNED
1126,1126,111.75984954833984,2022-12-25 09:30:03.595368,2022-12-25 09:30:12.080031,0 days 00:00:08.484663,relu,0.05,2,1.0,111.75984954833984,,,,PRUNED
1127,1127,1.4667012691497803,2022-12-25 09:30:12.167416,2022-12-25 09:31:42.283795,0 days 00:01:30.116379,sigmoid,0.35000000000000003,2,0.6,16.50580406188965,5.270349502563477,,,COMPLETE
1128,1128,72.50013732910156,2022-12-25 09:31:42.381969,2022-12-25 09:31:51.021621,0 days 00:00:08.639652,relu,0.05,4,0.6,72.50013732910156,,,,PRUNED
1129,1129,40.073421478271484,2022-12-25 09:31:51.112180,2022-12-25 09:32:06.403783,0 days 00:00:15.291603,relu,0.05,2,0.6,55.38247299194336,40.073421478271484,,,PRUNED
1130,1130,19.309627532958984,2022-12-25 09:32:06.493345,2022-12-25 09:32:22.002597,0 days 00:00:15.509252,sigmoid,0.35000000000000003,2,0.6,19.309627532958984,,,,PRUNED
1131,1131,67.11016082763672,2022-12-25 09:32:22.085752,2022-12-25 09:32:30.643745,0 days 00:00:08.557993,tanh,0.05,2,0.6,67.11016082763672,,,,PRUNED
1132,1132,131.15560913085938,2022-12-25 09:32:30.734084,2022-12-25 09:32:39.218954,0 days 00:00:08.484870,relu,0.0,2,0.65,131.15560913085938,,,,PRUNED
1133,1133,100.0172348022461,2022-12-25 09:32:39.308995,2022-12-25 09:32:47.866981,0 days 00:00:08.557986,sigmoid,0.05,2,0.75,100.0172348022461,,,,PRUNED
1134,1134,19.838191986083984,2022-12-25 09:32:47.947054,2022-12-25 09:33:04.921569,0 days 00:00:16.974515,sigmoid,0.35000000000000003,2,0.65,19.838191986083984,,,,PRUNED
1135,1135,18.835018157958984,2022-12-25 09:33:05.002767,2022-12-25 09:33:20.566927,0 days 00:00:15.564160,relu,0.5,2,0.6,36.002037048339844,18.835018157958984,,,PRUNED
1136,1136,92.63928985595703,2022-12-25 09:33:20.651955,2022-12-25 09:33:29.187011,0 days 00:00:08.535056,relu,0.05,2,0.9,92.63928985595703,,,,PRUNED
1137,1137,23.020307540893555,2022-12-25 09:33:29.275572,2022-12-25 09:33:44.901472,0 days 00:00:15.625900,sigmoid,0.35000000000000003,3,0.6,23.020307540893555,,,,PRUNED
1138,1138,7.285027027130127,2022-12-25 09:33:44.991023,2022-12-25 09:34:20.540431,0 days 00:00:35.549408,relu,0.30000000000000004,2,0.85,33.98611831665039,11.857129096984863,7.285027027130127,,PRUNED
1139,1139,22.744976043701172,2022-12-25 09:34:20.621770,2022-12-25 09:34:35.805933,0 days 00:00:15.184163,sigmoid,0.45,2,0.6,22.744976043701172,,,,PRUNED
1140,1140,16.554922103881836,2022-12-25 09:34:35.888942,2022-12-25 09:34:51.321420,0 days 00:00:15.432478,relu,0.5,2,0.6,32.10865020751953,16.554922103881836,,,PRUNED
1141,1141,21.89676284790039,2022-12-25 09:34:51.412549,2022-12-25 09:35:06.911908,0 days 00:00:15.499359,sigmoid,0.35000000000000003,2,0.75,21.89676284790039,,,,PRUNED
1142,1142,25.52518081665039,2022-12-25 09:35:06.992917,2022-12-25 09:35:42.593020,0 days 00:00:35.600103,sigmoid,0.35000000000000003,2,0.7,11.885693550109863,25.52518081665039,,,PRUNED
1143,1143,6.72977876663208,2022-12-25 09:35:42.675512,2022-12-25 09:36:18.464780,0 days 00:00:35.789268,tanh,0.0,3,0.6,52.071041107177734,13.103103637695312,6.72977876663208,,PRUNED
1144,1144,1.7258280515670776,2022-12-25 09:36:18.555737,2022-12-25 09:37:34.819469,0 days 00:01:16.263732,sigmoid,0.30000000000000004,2,0.65,6.819901466369629,,,,COMPLETE
1145,1145,19.416112899780273,2022-12-25 09:37:34.919638,2022-12-25 09:37:50.107797,0 days 00:00:15.188159,sigmoid,0.30000000000000004,2,0.6,19.416112899780273,,,,PRUNED
1146,1146,1.768973469734192,2022-12-25 09:37:50.189798,2022-12-25 09:39:16.337722,0 days 00:01:26.147924,sigmoid,0.35000000000000003,2,0.65,6.5920891761779785,,,,COMPLETE
1147,1147,4.367954254150391,2022-12-25 09:39:16.437694,2022-12-25 09:40:52.727222,0 days 00:01:36.289528,sigmoid,0.05,2,0.6,36.07069778442383,14.083285331726074,5.418456077575684,4.367954254150391,PRUNED
1148,1148,62.01570510864258,2022-12-25 09:40:52.846150,2022-12-25 09:41:09.000986,0 days 00:00:16.154836,relu,0.35000000000000003,8,0.65,62.01570510864258,,,,PRUNED
1149,1149,23.002918243408203,2022-12-25 09:41:09.091331,2022-12-25 09:41:24.408158,0 days 00:00:15.316827,relu,0.35000000000000003,2,0.6,23.002918243408203,,,,PRUNED
1150,1150,26.78343391418457,2022-12-25 09:41:24.497479,2022-12-25 09:41:39.756981,0 days 00:00:15.259502,relu,0.4,2,0.6,26.78343391418457,,,,PRUNED
1151,1151,66.39073944091797,2022-12-25 09:41:39.856640,2022-12-25 09:41:48.598976,0 days 00:00:08.742336,relu,0.35000000000000003,2,0.7,66.39073944091797,,,,PRUNED
1152,1152,112.29145812988281,2022-12-25 09:41:48.678969,2022-12-25 09:41:57.139999,0 days 00:00:08.461030,relu,0.2,2,0.65,112.29145812988281,,,,PRUNED
1153,1153,39.841243743896484,2022-12-25 09:41:57.220998,2022-12-25 09:42:12.437820,0 days 00:00:15.216822,relu,0.45,2,0.6,39.841243743896484,,,,PRUNED
1154,1154,20.63137435913086,2022-12-25 09:42:12.520830,2022-12-25 09:42:28.053300,0 days 00:00:15.532470,sigmoid,0.35000000000000003,2,0.6,20.63137435913086,,,,PRUNED
1155,1155,112.00003814697266,2022-12-25 09:42:28.135960,2022-12-25 09:42:36.611988,0 days 00:00:08.476028,relu,0.25,2,0.6,112.00003814697266,,,,PRUNED
1156,1156,8.36216926574707,2022-12-25 09:42:36.702316,2022-12-25 09:43:12.083283,0 days 00:00:35.380967,relu,0.4,2,0.85,18.107580184936523,8.36216926574707,,,PRUNED
1157,1157,26.83453941345215,2022-12-25 09:43:12.174640,2022-12-25 09:43:27.540663,0 days 00:00:15.366023,relu,0.5,2,0.6,52.49405288696289,26.83453941345215,,,PRUNED
1158,1158,1.5413062572479248,2022-12-25 09:43:27.630713,2022-12-25 09:44:40.820800,0 days 00:01:13.190087,relu,0.1,2,0.6,43.62027359008789,10.838321685791016,5.512885093688965,,COMPLETE
1159,1159,1.4373905658721924,2022-12-25 09:44:40.924031,2022-12-25 09:46:03.798365,0 days 00:01:22.874334,sigmoid,0.30000000000000004,2,0.65,5.123088836669922,,,,COMPLETE
1160,1160,93.80612182617188,2022-12-25 09:46:03.899460,2022-12-25 09:46:12.336986,0 days 00:00:08.437526,tanh,0.1,2,0.6,93.80612182617188,,,,PRUNED
1161,1161,26.569149017333984,2022-12-25 09:46:12.427567,2022-12-25 09:46:27.751727,0 days 00:00:15.324160,relu,0.2,2,0.7,26.569149017333984,,,,PRUNED
1162,1162,21.428186416625977,2022-12-25 09:46:27.833729,2022-12-25 09:46:43.175552,0 days 00:00:15.341823,relu,0.05,2,0.8,44.786739349365234,21.428186416625977,,,PRUNED
1163,1163,24.703948974609375,2022-12-25 09:46:43.257553,2022-12-25 09:46:58.474392,0 days 00:00:15.216839,relu,0.30000000000000004,2,0.6,24.703948974609375,,,,PRUNED
1164,1164,120.50357818603516,2022-12-25 09:46:58.557545,2022-12-25 09:47:07.033246,0 days 00:00:08.475701,sigmoid,0.1,2,0.6,120.50357818603516,,,,PRUNED
1165,1165,138.2196044921875,2022-12-25 09:47:07.123405,2022-12-25 09:47:15.939724,0 days 00:00:08.816319,relu,0.1,2,0.6,138.2196044921875,,,,PRUNED
1166,1166,112.01007080078125,2022-12-25 09:47:16.033064,2022-12-25 09:47:24.564542,0 days 00:00:08.531478,relu,0.1,2,0.6,112.01007080078125,,,,PRUNED
1167,1167,1.7168830633163452,2022-12-25 09:47:24.655311,2022-12-25 09:48:37.202390,0 days 00:01:12.547079,sigmoid,0.45,2,0.65,6.163074016571045,,,,COMPLETE
1168,1168,67.37110900878906,2022-12-25 09:48:37.304561,2022-12-25 09:48:45.882951,0 days 00:00:08.578390,relu,0.1,3,0.75,67.37110900878906,,,,PRUNED
1169,1169,24.504003524780273,2022-12-25 09:48:45.965891,2022-12-25 09:49:01.473370,0 days 00:00:15.507479,sigmoid,0.05,2,0.6,24.504003524780273,,,,PRUNED
1170,1170,168.52259826660156,2022-12-25 09:49:01.565432,2022-12-25 09:49:37.720618,0 days 00:00:36.155186,relu,0.2,6,0.6,168.52259826660156,,,,PRUNED
1171,1171,84.83514404296875,2022-12-25 09:49:37.814121,2022-12-25 09:49:46.253304,0 days 00:00:08.439183,relu,0.1,2,0.65,84.83514404296875,,,,PRUNED
1172,1172,74.98416900634766,2022-12-25 09:49:46.335302,2022-12-25 09:49:55.103629,0 days 00:00:08.768327,tanh,0.1,2,0.6,74.98416900634766,,,,PRUNED
1173,1173,4.133309841156006,2022-12-25 09:49:55.194179,2022-12-25 09:51:31.520295,0 days 00:01:36.326116,relu,0.35000000000000003,2,0.7,17.437803268432617,5.811336994171143,4.133309841156006,,PRUNED
1174,1174,19.13259506225586,2022-12-25 09:51:31.602298,2022-12-25 09:51:46.802885,0 days 00:00:15.200587,relu,0.35000000000000003,2,0.65,19.13259506225586,,,,PRUNED
1175,1175,1.519411563873291,2022-12-25 09:51:46.884468,2022-12-25 09:53:06.067290,0 days 00:01:19.182822,sigmoid,0.30000000000000004,2,0.9,6.75623083114624,,,,COMPLETE
1176,1176,19.50466537475586,2022-12-25 09:53:06.173376,2022-12-25 09:53:21.611932,0 days 00:00:15.438556,relu,0.4,2,0.6,19.50466537475586,,,,PRUNED
1177,1177,28.48666763305664,2022-12-25 09:53:21.703267,2022-12-25 09:53:36.902438,0 days 00:00:15.199171,sigmoid,0.4,2,0.6,28.48666763305664,,,,PRUNED
1178,1178,16.105484008789062,2022-12-25 09:53:36.985439,2022-12-25 09:53:52.484585,0 days 00:00:15.499146,sigmoid,0.1,2,0.6,57.51979446411133,16.105484008789062,,,PRUNED
1179,1179,127.64407348632812,2022-12-25 09:53:52.567872,2022-12-25 09:54:02.326536,0 days 00:00:09.758664,relu,0.1,4,0.6,127.64407348632812,,,,PRUNED
1180,1180,86.14631652832031,2022-12-25 09:54:02.416479,2022-12-25 09:54:11.025847,0 days 00:00:08.609368,relu,0.30000000000000004,2,0.6,86.14631652832031,,,,PRUNED
1181,1181,107.05167388916016,2022-12-25 09:54:11.115473,2022-12-25 09:54:20.216271,0 days 00:00:09.100798,relu,0.05,2,0.6,107.05167388916016,,,,PRUNED
1182,1182,6.9707465171813965,2022-12-25 09:54:20.297835,2022-12-25 09:54:55.812845,0 days 00:00:35.515010,sigmoid,0.30000000000000004,2,0.65,6.9707465171813965,,,,PRUNED
1183,1183,18.861370086669922,2022-12-25 09:54:55.895107,2022-12-25 09:55:11.461939,0 days 00:00:15.566832,relu,0.35000000000000003,2,0.6,18.861370086669922,,,,PRUNED
1184,1184,24.311025619506836,2022-12-25 09:55:11.544923,2022-12-25 09:55:26.736045,0 days 00:00:15.191122,relu,0.25,2,0.7,24.311025619506836,,,,PRUNED
1185,1185,46.70468521118164,2022-12-25 09:55:26.817756,2022-12-25 09:55:42.492897,0 days 00:00:15.675141,relu,0.45,5,0.6,46.70468521118164,,,,PRUNED
1186,1186,75.99784088134766,2022-12-25 09:55:42.576039,2022-12-25 09:55:51.551540,0 days 00:00:08.975501,relu,0.1,2,0.6,75.99784088134766,,,,PRUNED
1187,1187,6.684848785400391,2022-12-25 09:55:51.643086,2022-12-25 09:56:27.406138,0 days 00:00:35.763052,relu,0.0,2,0.7,49.78759002685547,11.50326919555664,6.684848785400391,,PRUNED
1188,1188,19.85547637939453,2022-12-25 09:56:27.486716,2022-12-25 09:56:42.754978,0 days 00:00:15.268262,sigmoid,0.1,2,0.6,19.85547637939453,,,,PRUNED
1189,1189,105.35641479492188,2022-12-25 09:56:42.838019,2022-12-25 09:56:51.313347,0 days 00:00:08.475328,tanh,0.1,2,0.6,105.35641479492188,,,,PRUNED
1190,1190,67.74114990234375,2022-12-25 09:56:51.402992,2022-12-25 09:57:00.204386,0 days 00:00:08.801394,sigmoid,0.05,2,0.85,67.74114990234375,,,,PRUNED
1191,1191,543.069580078125,2022-12-25 09:57:00.302315,2022-12-25 09:57:09.345620,0 days 00:00:09.043305,relu,0.5,8,0.6,543.069580078125,,,,PRUNED
1192,1192,22.395736694335938,2022-12-25 09:57:09.434955,2022-12-25 09:57:24.618461,0 days 00:00:15.183506,relu,0.35000000000000003,2,0.65,22.395736694335938,,,,PRUNED
1193,1193,82.49879455566406,2022-12-25 09:57:24.702461,2022-12-25 09:57:33.318796,0 days 00:00:08.616335,relu,0.0,2,0.65,82.49879455566406,,,,PRUNED
1194,1194,13.512091636657715,2022-12-25 09:57:33.408132,2022-12-25 09:58:09.023465,0 days 00:00:35.615333,relu,0.4,2,0.75,17.28404426574707,13.512091636657715,,,PRUNED
1195,1195,7.656324863433838,2022-12-25 09:58:09.114745,2022-12-25 09:58:44.537143,0 days 00:00:35.422398,sigmoid,0.30000000000000004,2,0.9,7.656324863433838,,,,PRUNED
1196,1196,6.499353885650635,2022-12-25 09:58:44.621388,2022-12-25 09:59:20.251338,0 days 00:00:35.629950,relu,0.05,2,0.6,29.340103149414062,13.769871711730957,6.499353885650635,,PRUNED
1197,1197,11.53630542755127,2022-12-25 09:59:20.333337,2022-12-25 09:59:56.215274,0 days 00:00:35.881937,relu,0.15000000000000002,2,0.6,13.209932327270508,11.53630542755127,,,PRUNED
1198,1198,129.7874755859375,2022-12-25 09:59:56.297272,2022-12-25 10:00:05.107263,0 days 00:00:08.809991,relu,0.5,5,0.6,129.7874755859375,,,,PRUNED
1199,1199,68.27277374267578,2022-12-25 10:00:05.197599,2022-12-25 10:00:13.664945,0 days 00:00:08.467346,tanh,0.30000000000000004,2,0.6,68.27277374267578,,,,PRUNED
1200,1200,105.90705871582031,2022-12-25 10:00:13.756417,2022-12-25 10:00:22.196633,0 days 00:00:08.440216,relu,0.05,2,0.6,105.90705871582031,,,,PRUNED
1201,1201,110.06867218017578,2022-12-25 10:00:22.278676,2022-12-25 10:00:31.113628,0 days 00:00:08.834952,sigmoid,0.45,2,0.8,110.06867218017578,,,,PRUNED
1202,1202,97.28093719482422,2022-12-25 10:00:31.203949,2022-12-25 10:00:39.687981,0 days 00:00:08.484032,relu,0.1,2,0.65,97.28093719482422,,,,PRUNED
1203,1203,1.3635163307189941,2022-12-25 10:00:39.777054,2022-12-25 10:02:15.831841,0 days 00:01:36.054787,sigmoid,0.30000000000000004,2,0.7,5.685388565063477,4.0432562828063965,,,COMPLETE
1204,1204,89.21128845214844,2022-12-25 10:02:15.932016,2022-12-25 10:02:24.571239,0 days 00:00:08.639223,relu,0.5,2,0.6,89.21128845214844,,,,PRUNED
1205,1205,88.1963882446289,2022-12-25 10:02:24.661009,2022-12-25 10:02:33.270019,0 days 00:00:08.609010,relu,0.1,2,0.6,88.1963882446289,,,,PRUNED
