,number,value,datetime_start,datetime_complete,duration,params_activation,params_dropout,params_layers,params_shrink,system_attrs_completed_rung_0,system_attrs_completed_rung_1,system_attrs_completed_rung_2,system_attrs_completed_rung_3,state
537,537,9.288620948791504,2022-12-25 04:58:47.215027,2022-12-25 04:59:22.411479,0 days 00:00:35.196452,tanh,0.30000000000000004,2,0.6,9.288620948791504,,,,PRUNED
538,538,33.30772399902344,2022-12-25 04:59:22.495675,2022-12-25 04:59:37.602241,0 days 00:00:15.106566,sigmoid,0.35000000000000003,2,0.6,33.30772399902344,,,,PRUNED
539,539,80.64767456054688,2022-12-25 04:59:37.686171,2022-12-25 04:59:46.076434,0 days 00:00:08.390263,relu,0.0,2,0.85,80.64767456054688,,,,PRUNED
540,540,77.73342895507812,2022-12-25 04:59:46.160268,2022-12-25 04:59:55.017597,0 days 00:00:08.857329,relu,0.1,2,0.6,77.73342895507812,,,,PRUNED
541,541,117.37196350097656,2022-12-25 04:59:55.101510,2022-12-25 05:00:30.655274,0 days 00:00:35.553764,relu,0.5,2,0.6,10.323283195495605,117.37196350097656,,,PRUNED
542,542,194.7223663330078,2022-12-25 05:00:30.732134,2022-12-25 05:00:39.663982,0 days 00:00:08.931848,sigmoid,0.45,6,0.85,194.7223663330078,,,,PRUNED
543,543,23.45692253112793,2022-12-25 05:00:39.748110,2022-12-25 05:01:16.361119,0 days 00:00:36.613009,relu,0.05,2,0.6,51.38296890258789,11.375753402709961,23.45692253112793,,PRUNED
544,544,8.680270195007324,2022-12-25 05:01:16.436970,2022-12-25 05:01:51.875073,0 days 00:00:35.438103,sigmoid,0.35000000000000003,2,0.6,8.680270195007324,,,,PRUNED
545,545,80.77207946777344,2022-12-25 05:01:51.950931,2022-12-25 05:02:00.374425,0 days 00:00:08.423494,relu,0.0,2,0.6,80.77207946777344,,,,PRUNED
546,546,110.24085235595703,2022-12-25 05:02:00.450279,2022-12-25 05:02:08.791050,0 days 00:00:08.340771,relu,0.15000000000000002,2,0.6,110.24085235595703,,,,PRUNED
547,547,17.506711959838867,2022-12-25 05:02:08.874631,2022-12-25 05:02:24.414272,0 days 00:00:15.539641,relu,0.0,2,0.6,70.3133316040039,17.506711959838867,,,PRUNED
548,548,5.895381927490234,2022-12-25 05:02:24.498440,2022-12-25 05:02:59.844885,0 days 00:00:35.346445,relu,0.1,2,0.75,60.61526107788086,14.989341735839844,5.895381927490234,,PRUNED
549,549,1.5921540260314941,2022-12-25 05:02:59.929072,2022-12-25 05:04:29.076943,0 days 00:01:29.147871,tanh,0.30000000000000004,2,0.6,6.834774494171143,,,,COMPLETE
550,550,15.743186950683594,2022-12-25 05:04:29.186266,2022-12-25 05:04:44.328572,0 days 00:00:15.142306,relu,0.1,2,0.75,43.214111328125,15.743186950683594,,,PRUNED
551,551,119.13810729980469,2022-12-25 05:04:44.404753,2022-12-25 05:04:53.344548,0 days 00:00:08.939795,relu,0.1,5,0.6,119.13810729980469,,,,PRUNED
552,552,29.000343322753906,2022-12-25 05:04:53.428740,2022-12-25 05:05:08.676711,0 days 00:00:15.247971,relu,0.05,2,0.75,51.60551452636719,29.000343322753906,,,PRUNED
553,553,79.77881622314453,2022-12-25 05:05:08.752564,2022-12-25 05:05:17.184401,0 days 00:00:08.431837,relu,0.15000000000000002,2,0.9,79.77881622314453,,,,PRUNED
554,554,111.58436584472656,2022-12-25 05:05:17.260261,2022-12-25 05:05:26.108983,0 days 00:00:08.848722,relu,0.2,4,0.75,111.58436584472656,,,,PRUNED
555,555,1.7809598445892334,2022-12-25 05:05:26.185100,2022-12-25 05:06:38.722010,0 days 00:01:12.536910,sigmoid,0.30000000000000004,2,0.6,6.610080718994141,,,,COMPLETE
556,556,9.034255981445312,2022-12-25 05:06:38.825369,2022-12-25 05:07:14.208903,0 days 00:00:35.383534,relu,0.2,3,0.65,9.034255981445312,,,,PRUNED
557,557,12.466743469238281,2022-12-25 05:07:14.293017,2022-12-25 05:07:49.672758,0 days 00:00:35.379741,tanh,0.25,3,0.95,12.466743469238281,,,,PRUNED
558,558,82.18965911865234,2022-12-25 05:07:49.756711,2022-12-25 05:08:05.754892,0 days 00:00:15.998181,relu,0.05,8,0.7,82.18965911865234,,,,PRUNED
559,559,88.89496612548828,2022-12-25 05:08:05.839057,2022-12-25 05:08:14.212675,0 days 00:00:08.373618,relu,0.1,2,0.6,88.89496612548828,,,,PRUNED
560,560,18.19483757019043,2022-12-25 05:08:14.297666,2022-12-25 05:08:29.544713,0 days 00:00:15.247047,sigmoid,0.4,2,0.6,51.62855529785156,18.19483757019043,,,PRUNED
561,561,7.771942615509033,2022-12-25 05:08:29.629909,2022-12-25 05:09:05.108655,0 days 00:00:35.478746,tanh,0.35000000000000003,2,0.6,7.771942615509033,,,,PRUNED
562,562,1.6081370115280151,2022-12-25 05:09:05.192855,2022-12-25 05:10:17.663409,0 days 00:01:12.470554,tanh,0.15000000000000002,2,0.65,6.674448013305664,,,,COMPLETE
563,563,1.4650858640670776,2022-12-25 05:10:17.752319,2022-12-25 05:11:36.792924,0 days 00:01:19.040605,relu,0.25,2,0.7,13.04826831817627,5.846080780029297,,,COMPLETE
564,564,7.784900665283203,2022-12-25 05:11:36.881616,2022-12-25 05:12:12.486258,0 days 00:00:35.604642,relu,0.0,3,0.65,40.4349250793457,14.486889839172363,7.784900665283203,,PRUNED
565,565,80.22830200195312,2022-12-25 05:12:12.565317,2022-12-25 05:12:21.127646,0 days 00:00:08.562329,relu,0.05,2,0.6,80.22830200195312,,,,PRUNED
566,566,11.150839805603027,2022-12-25 05:12:21.195708,2022-12-25 05:12:56.507055,0 days 00:00:35.311347,tanh,0.5,2,0.75,11.150839805603027,,,,PRUNED
567,567,110.23624420166016,2022-12-25 05:12:56.586712,2022-12-25 05:13:04.940348,0 days 00:00:08.353636,relu,0.2,2,0.6,110.23624420166016,,,,PRUNED
568,568,6.555771827697754,2022-12-25 05:13:05.019348,2022-12-25 05:13:40.509326,0 days 00:00:35.489978,relu,0.30000000000000004,2,0.7,10.688685417175293,6.555771827697754,,,PRUNED
569,569,79.88932037353516,2022-12-25 05:13:40.583297,2022-12-25 05:13:49.003649,0 days 00:00:08.420352,relu,0.35000000000000003,2,0.6,79.88932037353516,,,,PRUNED
570,570,15.604074478149414,2022-12-25 05:13:49.074316,2022-12-25 05:14:04.219159,0 days 00:00:15.144843,relu,0.15000000000000002,2,0.6,54.92856979370117,15.604074478149414,,,PRUNED
571,571,16.077106475830078,2022-12-25 05:14:04.306287,2022-12-25 05:14:19.539935,0 days 00:00:15.233648,relu,0.30000000000000004,2,0.7,63.564720153808594,16.077106475830078,,,PRUNED
572,572,22.497516632080078,2022-12-25 05:14:19.635771,2022-12-25 05:14:35.142227,0 days 00:00:15.506456,relu,0.15000000000000002,2,0.65,63.74452590942383,22.497516632080078,,,PRUNED
573,573,139.53758239746094,2022-12-25 05:14:35.234296,2022-12-25 05:14:43.891126,0 days 00:00:08.656830,relu,0.2,3,0.75,139.53758239746094,,,,PRUNED
574,574,21.92293357849121,2022-12-25 05:14:43.970177,2022-12-25 05:14:59.089966,0 days 00:00:15.119789,relu,0.25,2,0.7,21.92293357849121,,,,PRUNED
575,575,88.00555419921875,2022-12-25 05:14:59.169176,2022-12-25 05:15:07.572647,0 days 00:00:08.403471,relu,0.30000000000000004,2,0.95,88.00555419921875,,,,PRUNED
576,576,71.02986145019531,2022-12-25 05:15:07.651650,2022-12-25 05:15:16.280321,0 days 00:00:08.628671,relu,0.25,2,0.6,71.02986145019531,,,,PRUNED
577,577,314.5367431640625,2022-12-25 05:15:16.351625,2022-12-25 05:15:25.296359,0 days 00:00:08.944734,relu,0.15000000000000002,8,0.6,314.5367431640625,,,,PRUNED
578,578,78.1787109375,2022-12-25 05:15:25.375295,2022-12-25 05:15:40.903219,0 days 00:00:15.527924,relu,0.15000000000000002,6,0.7,78.1787109375,,,,PRUNED
579,579,4.166862964630127,2022-12-25 05:15:40.982444,2022-12-25 05:17:17.037766,0 days 00:01:36.055322,relu,0.4,2,0.6,15.986942291259766,5.4287238121032715,4.166862964630127,,PRUNED
580,580,73.63392639160156,2022-12-25 05:17:17.116766,2022-12-25 05:17:25.487390,0 days 00:00:08.370624,sigmoid,0.30000000000000004,2,0.7,73.63392639160156,,,,PRUNED
581,581,90.59503173828125,2022-12-25 05:17:25.573265,2022-12-25 05:17:34.011470,0 days 00:00:08.438205,relu,0.1,2,0.6,90.59503173828125,,,,PRUNED
582,582,110.76300811767578,2022-12-25 05:17:34.095272,2022-12-25 05:17:42.511331,0 days 00:00:08.416059,relu,0.25,2,0.6,110.76300811767578,,,,PRUNED
583,583,5.056003093719482,2022-12-25 05:17:42.581489,2022-12-25 05:19:18.345173,0 days 00:01:35.763684,tanh,0.25,2,0.8,6.643096446990967,5.056003093719482,,,PRUNED
584,584,108.31038665771484,2022-12-25 05:19:18.415840,2022-12-25 05:19:26.819523,0 days 00:00:08.403683,relu,0.05,2,0.65,108.31038665771484,,,,PRUNED
585,585,4.358639240264893,2022-12-25 05:19:26.914001,2022-12-25 05:21:03.187421,0 days 00:01:36.273420,relu,0.2,2,0.6,46.19157028198242,11.773402214050293,5.435199737548828,4.358639240264893,PRUNED
586,586,1.3194912672042847,2022-12-25 05:21:03.274774,2022-12-25 05:22:39.679142,0 days 00:01:36.404368,relu,0.35000000000000003,2,0.6,12.672739028930664,5.62539005279541,3.694389581680298,,COMPLETE
587,587,6.622810363769531,2022-12-25 05:22:39.773291,2022-12-25 05:23:15.393743,0 days 00:00:35.620452,sigmoid,0.35000000000000003,2,0.6,18.844451904296875,6.622810363769531,,,PRUNED
588,588,94.53346252441406,2022-12-25 05:23:15.840933,2022-12-25 05:23:24.418094,0 days 00:00:08.577161,relu,0.30000000000000004,2,0.6,94.53346252441406,,,,PRUNED
589,589,4.748621463775635,2022-12-25 05:23:24.497054,2022-12-25 05:25:00.444053,0 days 00:01:35.946999,relu,0.35000000000000003,2,0.6,13.36530876159668,5.82106876373291,4.748621463775635,,PRUNED
590,590,6.691375255584717,2022-12-25 05:25:00.525050,2022-12-25 05:25:36.150068,0 days 00:00:35.625018,relu,0.35000000000000003,2,0.6,70.8604965209961,14.456581115722656,6.691375255584717,,PRUNED
591,591,20.719486236572266,2022-12-25 05:25:36.243595,2022-12-25 05:25:51.690139,0 days 00:00:15.446544,tanh,0.1,2,0.65,20.719486236572266,,,,PRUNED
592,592,5.969073295593262,2022-12-25 05:25:51.778469,2022-12-25 05:26:27.387417,0 days 00:00:35.608948,relu,0.2,2,0.6,48.83668518066406,14.08995532989502,5.969073295593262,,PRUNED
593,593,6.897284984588623,2022-12-25 05:26:27.476750,2022-12-25 05:27:02.880983,0 days 00:00:35.404233,relu,0.45,2,0.6,17.448909759521484,6.897284984588623,,,PRUNED
594,594,97.17688751220703,2022-12-25 05:27:02.965709,2022-12-25 05:27:11.392393,0 days 00:00:08.426684,relu,0.2,2,0.6,97.17688751220703,,,,PRUNED
595,595,4.364336967468262,2022-12-25 05:27:11.465058,2022-12-25 05:28:48.035015,0 days 00:01:36.569957,relu,0.2,2,0.6,59.53082275390625,11.302389144897461,5.875645637512207,4.364336967468262,PRUNED
596,596,75.67920684814453,2022-12-25 05:28:48.106151,2022-12-25 05:28:56.850736,0 days 00:00:08.744585,relu,0.2,2,0.6,75.67920684814453,,,,PRUNED
597,597,1.6682151556015015,2022-12-25 05:28:56.939359,2022-12-25 05:30:02.758488,0 days 00:01:05.819129,relu,0.35000000000000003,2,0.6,17.90537452697754,6.066553115844727,,,COMPLETE
598,598,5.065338134765625,2022-12-25 05:30:02.858024,2022-12-25 05:31:39.188619,0 days 00:01:36.330595,relu,0.2,2,0.6,6.14112663269043,5.065338134765625,,,PRUNED
599,599,21.13311004638672,2022-12-25 05:31:39.261283,2022-12-25 05:31:54.379121,0 days 00:00:15.117838,relu,0.35000000000000003,2,0.7,21.13311004638672,,,,PRUNED
600,600,26.295455932617188,2022-12-25 05:31:54.473812,2022-12-25 05:32:09.877940,0 days 00:00:15.404128,relu,0.30000000000000004,2,0.6,26.295455932617188,,,,PRUNED
601,601,120.71920776367188,2022-12-25 05:32:09.951605,2022-12-25 05:32:18.365771,0 days 00:00:08.414166,relu,0.2,2,0.6,120.71920776367188,,,,PRUNED
602,602,1.3635071516036987,2022-12-25 05:32:18.458291,2022-12-25 05:34:25.552054,0 days 00:02:07.093763,relu,0.35000000000000003,2,0.6,13.968015670776367,6.019857883453369,4.130641937255859,,COMPLETE
603,603,21.206172943115234,2022-12-25 05:34:25.634591,2022-12-25 05:34:40.766420,0 days 00:00:15.131829,relu,0.35000000000000003,2,0.6,21.206172943115234,,,,PRUNED
604,604,92.67243957519531,2022-12-25 05:34:40.846430,2022-12-25 05:34:49.398490,0 days 00:00:08.552060,relu,0.2,3,0.6,92.67243957519531,,,,PRUNED
605,605,76.70509338378906,2022-12-25 05:34:49.477562,2022-12-25 05:34:57.865347,0 days 00:00:08.387785,sigmoid,0.2,2,1.0,76.70509338378906,,,,PRUNED
606,606,131.6067657470703,2022-12-25 05:34:57.946123,2022-12-25 05:35:13.764193,0 days 00:00:15.818070,relu,0.2,4,0.6,54.62028121948242,131.6067657470703,,,PRUNED
607,607,6.803712368011475,2022-12-25 05:35:13.843915,2022-12-25 05:35:49.302803,0 days 00:00:35.458888,relu,0.4,2,0.6,18.986553192138672,6.803712368011475,,,PRUNED
608,608,22.04665756225586,2022-12-25 05:35:49.374521,2022-12-25 05:36:04.568362,0 days 00:00:15.193841,relu,0.35000000000000003,2,0.6,22.04665756225586,,,,PRUNED
609,609,85.0398941040039,2022-12-25 05:36:04.663552,2022-12-25 05:36:13.301026,0 days 00:00:08.637474,relu,0.2,2,0.6,85.0398941040039,,,,PRUNED
610,610,125.71924591064453,2022-12-25 05:36:13.382112,2022-12-25 05:36:21.858708,0 days 00:00:08.476596,relu,0.2,2,0.6,125.71924591064453,,,,PRUNED
611,611,117.0822525024414,2022-12-25 05:36:21.940704,2022-12-25 05:36:30.349735,0 days 00:00:08.409031,relu,0.2,2,0.6,117.0822525024414,,,,PRUNED
612,612,5.904327869415283,2022-12-25 05:36:30.430340,2022-12-25 05:38:06.392391,0 days 00:01:35.962051,relu,0.1,2,0.6,17.471603393554688,6.467918872833252,5.904327869415283,,PRUNED
613,613,90.22344207763672,2022-12-25 05:38:06.464426,2022-12-25 05:38:15.208386,0 days 00:00:08.743960,relu,0.15000000000000002,2,0.6,90.22344207763672,,,,PRUNED
614,614,124.49501037597656,2022-12-25 05:38:15.289378,2022-12-25 05:38:23.699589,0 days 00:00:08.410211,relu,0.15000000000000002,2,0.6,124.49501037597656,,,,PRUNED
615,615,105.0647201538086,2022-12-25 05:38:23.779958,2022-12-25 05:38:32.273747,0 days 00:00:08.493789,relu,0.0,3,0.65,105.0647201538086,,,,PRUNED
616,616,16.879348754882812,2022-12-25 05:38:32.353746,2022-12-25 05:38:47.514244,0 days 00:00:15.160498,relu,0.2,2,0.6,66.36273956298828,16.879348754882812,,,PRUNED
617,617,83.57588958740234,2022-12-25 05:38:47.595249,2022-12-25 05:38:56.130259,0 days 00:00:08.535010,relu,0.25,2,0.6,83.57588958740234,,,,PRUNED
618,618,88.11473083496094,2022-12-25 05:38:56.218589,2022-12-25 05:39:04.629612,0 days 00:00:08.411023,relu,0.2,2,0.6,88.11473083496094,,,,PRUNED
619,619,25.603139877319336,2022-12-25 05:39:04.709721,2022-12-25 05:39:19.811887,0 days 00:00:15.102166,sigmoid,0.35000000000000003,2,0.65,25.603139877319336,,,,PRUNED
620,620,83.96946716308594,2022-12-25 05:39:19.892785,2022-12-25 05:39:28.302804,0 days 00:00:08.410019,relu,0.2,2,0.6,83.96946716308594,,,,PRUNED
621,621,65.81119537353516,2022-12-25 05:39:28.388059,2022-12-25 05:39:44.234918,0 days 00:00:15.846859,relu,0.45,5,0.95,65.81119537353516,,,,PRUNED
622,622,25.554401397705078,2022-12-25 05:39:44.312960,2022-12-25 05:39:59.592072,0 days 00:00:15.279112,relu,0.30000000000000004,2,0.7,25.554401397705078,,,,PRUNED
623,623,92.96310424804688,2022-12-25 05:39:59.669737,2022-12-25 05:40:08.358469,0 days 00:00:08.688732,sigmoid,0.4,2,0.6,92.96310424804688,,,,PRUNED
624,624,89.03863525390625,2022-12-25 05:40:08.445065,2022-12-25 05:40:17.232164,0 days 00:00:08.787099,relu,0.15000000000000002,2,0.6,89.03863525390625,,,,PRUNED
625,625,4.669787883758545,2022-12-25 05:40:17.319228,2022-12-25 05:41:53.716495,0 days 00:01:36.397267,relu,0.1,2,0.6,56.543060302734375,11.89231014251709,5.813136577606201,4.669787883758545,PRUNED
626,626,109.86286926269531,2022-12-25 05:41:53.805541,2022-12-25 05:42:02.232720,0 days 00:00:08.427179,relu,0.1,2,0.65,109.86286926269531,,,,PRUNED
627,627,5.8603925704956055,2022-12-25 05:42:02.321064,2022-12-25 05:42:37.836370,0 days 00:00:35.515306,relu,0.1,2,0.75,47.76211929321289,11.52247428894043,5.8603925704956055,,PRUNED
628,628,4.415060043334961,2022-12-25 05:42:37.917348,2022-12-25 05:44:14.822325,0 days 00:01:36.904977,relu,0.4,2,0.6,16.321123123168945,6.100136756896973,4.415060043334961,,PRUNED
629,629,30.016530990600586,2022-12-25 05:44:14.901615,2022-12-25 05:44:30.588067,0 days 00:00:15.686452,relu,0.1,2,0.75,70.22163391113281,30.016530990600586,,,PRUNED
630,630,95.15592193603516,2022-12-25 05:44:30.675126,2022-12-25 05:44:39.162409,0 days 00:00:08.487283,relu,0.1,2,0.75,95.15592193603516,,,,PRUNED
631,631,16.061439514160156,2022-12-25 05:44:39.240421,2022-12-25 05:44:54.869545,0 days 00:00:15.629124,relu,0.1,2,0.75,55.40211486816406,16.061439514160156,,,PRUNED
632,632,23.771163940429688,2022-12-25 05:44:54.956328,2022-12-25 05:45:10.168332,0 days 00:00:15.212004,relu,0.35000000000000003,2,0.6,23.771163940429688,,,,PRUNED
633,633,89.90138244628906,2022-12-25 05:45:10.246386,2022-12-25 05:45:18.667456,0 days 00:00:08.421070,relu,0.1,2,0.75,89.90138244628906,,,,PRUNED
634,634,95.34977722167969,2022-12-25 05:45:18.755072,2022-12-25 05:45:27.175404,0 days 00:00:08.420332,relu,0.1,2,0.75,95.34977722167969,,,,PRUNED
635,635,15.932646751403809,2022-12-25 05:45:27.261754,2022-12-25 05:45:42.840883,0 days 00:00:15.579129,relu,0.1,2,0.75,59.07522201538086,15.932646751403809,,,PRUNED
636,636,1.7349629402160645,2022-12-25 05:45:42.936559,2022-12-25 05:47:09.104140,0 days 00:01:26.167581,tanh,0.30000000000000004,2,0.7,6.621543884277344,,,,COMPLETE
637,637,4.2175822257995605,2022-12-25 05:47:09.191226,2022-12-25 05:48:45.451944,0 days 00:01:36.260718,relu,0.1,2,0.65,33.29970169067383,11.350005149841309,5.2879157066345215,4.2175822257995605,PRUNED
638,638,42.01064682006836,2022-12-25 05:48:45.537286,2022-12-25 05:49:00.950609,0 days 00:00:15.413323,relu,0.1,2,0.6,45.5911979675293,42.01064682006836,,,PRUNED
639,639,124.79341125488281,2022-12-25 05:49:01.036651,2022-12-25 05:49:09.825061,0 days 00:00:08.788410,sigmoid,0.1,2,0.75,124.79341125488281,,,,PRUNED
640,640,81.71106719970703,2022-12-25 05:49:09.938430,2022-12-25 05:49:18.657523,0 days 00:00:08.719093,relu,0.1,4,0.6,81.71106719970703,,,,PRUNED
641,641,74.39196014404297,2022-12-25 05:49:18.746095,2022-12-25 05:49:27.215429,0 days 00:00:08.469334,relu,0.05,3,0.65,74.39196014404297,,,,PRUNED
642,642,6.327925682067871,2022-12-25 05:49:27.303774,2022-12-25 05:50:02.903843,0 days 00:00:35.600069,relu,0.1,2,0.6,40.07398223876953,14.925742149353027,6.327925682067871,,PRUNED
643,643,74.18861389160156,2022-12-25 05:50:02.982382,2022-12-25 05:50:11.745362,0 days 00:00:08.762980,relu,0.1,2,0.6,74.18861389160156,,,,PRUNED
644,644,89.07691955566406,2022-12-25 05:50:11.832704,2022-12-25 05:50:20.353040,0 days 00:00:08.520336,relu,0.1,2,0.95,89.07691955566406,,,,PRUNED
645,645,8.880204200744629,2022-12-25 05:50:20.440075,2022-12-25 05:50:56.100323,0 days 00:00:35.660248,relu,0.1,2,0.6,17.948270797729492,8.880204200744629,,,PRUNED
646,646,86.1751708984375,2022-12-25 05:50:56.187874,2022-12-25 05:51:04.916304,0 days 00:00:08.728430,relu,0.1,2,0.75,86.1751708984375,,,,PRUNED
647,647,6.93853235244751,2022-12-25 05:51:04.994318,2022-12-25 05:51:40.488588,0 days 00:00:35.494270,relu,0.5,2,0.7,14.235038757324219,6.93853235244751,,,PRUNED
648,648,8.2548246383667,2022-12-25 05:51:40.567603,2022-12-25 05:52:15.960885,0 days 00:00:35.393282,tanh,0.45,2,0.6,8.2548246383667,,,,PRUNED
649,649,1.355776309967041,2022-12-25 05:52:16.039896,2022-12-25 05:53:58.948867,0 days 00:01:42.908971,relu,0.4,2,0.6,10.981544494628906,5.627583026885986,3.9627387523651123,,COMPLETE
650,650,16.76712417602539,2022-12-25 05:53:59.035713,2022-12-25 05:54:14.548967,0 days 00:00:15.513254,relu,0.05,2,0.6,46.064186096191406,16.76712417602539,,,PRUNED
651,651,38.130985260009766,2022-12-25 05:54:14.639022,2022-12-25 05:54:29.850662,0 days 00:00:15.211640,tanh,0.4,2,0.6,38.130985260009766,,,,PRUNED
652,652,7.716814994812012,2022-12-25 05:54:29.938013,2022-12-25 05:55:05.472718,0 days 00:00:35.534705,relu,0.4,2,0.6,19.04489517211914,7.716814994812012,,,PRUNED
653,653,89.96891784667969,2022-12-25 05:55:05.561292,2022-12-25 05:55:13.972298,0 days 00:00:08.411006,relu,0.15000000000000002,2,0.6,89.96891784667969,,,,PRUNED
654,654,126.12249755859375,2022-12-25 05:55:14.058643,2022-12-25 05:55:22.846620,0 days 00:00:08.787977,relu,0.1,2,0.8,126.12249755859375,,,,PRUNED
655,655,26.853681564331055,2022-12-25 05:55:22.942395,2022-12-25 05:55:38.220451,0 days 00:00:15.278056,relu,0.0,2,0.6,43.77002716064453,26.853681564331055,,,PRUNED
656,656,74.05925750732422,2022-12-25 05:55:38.306583,2022-12-25 05:55:46.694798,0 days 00:00:08.388215,relu,0.15000000000000002,2,0.65,74.05925750732422,,,,PRUNED
657,657,1.4158416986465454,2022-12-25 05:55:46.783147,2022-12-25 05:57:09.717642,0 days 00:01:22.934495,sigmoid,0.05,2,0.6,48.8451042175293,12.378303527832031,4.955031394958496,,COMPLETE
658,658,5.86084508895874,2022-12-25 05:57:09.831486,2022-12-25 05:57:45.335751,0 days 00:00:35.504265,sigmoid,0.0,2,0.6,45.855430603027344,9.588103294372559,5.86084508895874,,PRUNED
659,659,98.17032623291016,2022-12-25 05:57:45.413757,2022-12-25 05:57:54.210070,0 days 00:00:08.796313,sigmoid,0.0,5,0.6,98.17032623291016,,,,PRUNED
660,660,15.561417579650879,2022-12-25 05:57:54.306817,2022-12-25 05:58:09.692291,0 days 00:00:15.385474,sigmoid,0.0,2,0.75,47.69864273071289,15.561417579650879,,,PRUNED
661,661,7.728447437286377,2022-12-25 05:58:09.805858,2022-12-25 05:58:45.456556,0 days 00:00:35.650698,relu,0.1,2,0.65,7.728447437286377,,,,PRUNED
662,662,77.4908218383789,2022-12-25 05:58:45.536178,2022-12-25 05:58:53.964169,0 days 00:00:08.427991,sigmoid,0.0,2,0.6,77.4908218383789,,,,PRUNED
663,663,1.449062466621399,2022-12-25 05:58:54.051272,2022-12-25 06:00:23.359194,0 days 00:01:29.307922,relu,0.4,2,0.6,14.435049057006836,5.561194896697998,,,COMPLETE
664,664,80.67854309082031,2022-12-25 06:00:23.456377,2022-12-25 06:00:31.956367,0 days 00:00:08.499990,sigmoid,0.05,3,0.6,80.67854309082031,,,,PRUNED
665,665,15.30894947052002,2022-12-25 06:00:32.044717,2022-12-25 06:00:47.605420,0 days 00:00:15.560703,sigmoid,0.05,2,0.6,65.64901733398438,15.30894947052002,,,PRUNED
666,666,22.774682998657227,2022-12-25 06:00:47.693517,2022-12-25 06:01:02.879008,0 days 00:00:15.185491,relu,0.4,2,0.6,22.774682998657227,,,,PRUNED
667,667,5.945624828338623,2022-12-25 06:01:02.958016,2022-12-25 06:01:38.459626,0 days 00:00:35.501610,sigmoid,0.0,2,0.75,41.531402587890625,10.412813186645508,5.945624828338623,,PRUNED
668,668,1.5320689678192139,2022-12-25 06:01:38.539637,2022-12-25 06:03:04.664554,0 days 00:01:26.124917,sigmoid,0.05,2,0.6,49.770572662353516,11.462709426879883,5.59843111038208,,COMPLETE
669,669,95.92469787597656,2022-12-25 06:03:04.751402,2022-12-25 06:03:13.494042,0 days 00:00:08.742640,sigmoid,0.05,2,0.6,95.92469787597656,,,,PRUNED
