,number,value,datetime_start,datetime_complete,duration,params_activation,params_dropout,params_layers,params_shrink,system_attrs_completed_rung_0,system_attrs_completed_rung_1,system_attrs_completed_rung_2,system_attrs_completed_rung_3,state
1337,1337,7.499515056610107,2022-12-25 11:14:44.374422,2022-12-25 11:15:20.798832,0 days 00:00:36.424410,sigmoid,0.35000000000000003,2,0.6,17.13197135925293,7.499515056610107,,,PRUNED
1338,1338,70.20671844482422,2022-12-25 11:15:20.905996,2022-12-25 11:15:29.607134,0 days 00:00:08.701138,tanh,0.45,2,0.8,70.20671844482422,,,,PRUNED
1339,1339,114.20440673828125,2022-12-25 11:15:29.713569,2022-12-25 11:15:38.381513,0 days 00:00:08.667944,tanh,0.4,2,0.8,114.20440673828125,,,,PRUNED
1340,1340,20.23615264892578,2022-12-25 11:15:38.471529,2022-12-25 11:15:53.987574,0 days 00:00:15.516045,relu,0.45,2,0.6,20.23615264892578,,,,PRUNED
1341,1341,7.216498374938965,2022-12-25 11:15:54.070154,2022-12-25 11:16:30.484818,0 days 00:00:36.414664,tanh,0.5,2,0.8,43.90773010253906,12.30105209350586,7.216498374938965,,PRUNED
1342,1342,6.449342250823975,2022-12-25 11:16:30.567397,2022-12-25 11:17:06.765407,0 days 00:00:36.198010,relu,0.1,2,0.6,12.613442420959473,6.449342250823975,,,PRUNED
1343,1343,91.11417388916016,2022-12-25 11:17:06.856809,2022-12-25 11:17:15.473536,0 days 00:00:08.616727,tanh,0.4,2,0.8,91.11417388916016,,,,PRUNED
1344,1344,1.4631024599075317,2022-12-25 11:17:15.563995,2022-12-25 11:18:22.795253,0 days 00:01:07.231258,tanh,0.45,2,0.8,38.61375045776367,10.314835548400879,5.302875995635986,,COMPLETE
1345,1345,87.7318344116211,2022-12-25 11:18:22.895918,2022-12-25 11:18:31.476671,0 days 00:00:08.580753,tanh,0.45,2,0.8,87.7318344116211,,,,PRUNED
1346,1346,101.93450927734375,2022-12-25 11:18:31.566585,2022-12-25 11:18:40.275655,0 days 00:00:08.709070,tanh,0.5,2,0.8,101.93450927734375,,,,PRUNED
1347,1347,19.32211685180664,2022-12-25 11:18:40.365918,2022-12-25 11:18:55.915443,0 days 00:00:15.549525,tanh,0.4,2,0.8,36.982730865478516,19.32211685180664,,,PRUNED
1348,1348,6.622038841247559,2022-12-25 11:18:56.007134,2022-12-25 11:19:32.496172,0 days 00:00:36.489038,tanh,0.45,2,0.8,38.14784622192383,12.922258377075195,6.622038841247559,,PRUNED
1349,1349,14.98046588897705,2022-12-25 11:19:32.578202,2022-12-25 11:20:09.010060,0 days 00:00:36.431858,sigmoid,0.5,4,0.7,14.98046588897705,,,,PRUNED
1350,1350,1.3534603118896484,2022-12-25 11:20:09.091543,2022-12-25 11:22:24.367661,0 days 00:02:15.276118,sigmoid,0.5,2,0.7,6.480417251586914,3.9830310344696045,,,COMPLETE
1351,1351,112.19344329833984,2022-12-25 11:22:24.471482,2022-12-25 11:22:33.125080,0 days 00:00:08.653598,tanh,0.45,2,0.8,112.19344329833984,,,,PRUNED
1352,1352,23.022428512573242,2022-12-25 11:22:33.424503,2022-12-25 11:22:49.015554,0 days 00:00:15.591051,tanh,0.35000000000000003,2,0.6,23.022428512573242,,,,PRUNED
1353,1353,79.49588012695312,2022-12-25 11:22:49.107009,2022-12-25 11:22:57.798386,0 days 00:00:08.691377,tanh,0.45,2,0.8,79.49588012695312,,,,PRUNED
1354,1354,85.46002197265625,2022-12-25 11:22:57.887442,2022-12-25 11:23:06.614228,0 days 00:00:08.726786,tanh,0.45,2,0.8,85.46002197265625,,,,PRUNED
1355,1355,19.876832962036133,2022-12-25 11:23:06.712786,2022-12-25 11:23:22.470515,0 days 00:00:15.757729,relu,0.30000000000000004,2,0.65,19.876832962036133,,,,PRUNED
1356,1356,194.59974670410156,2022-12-25 11:23:22.561259,2022-12-25 11:23:58.467800,0 days 00:00:35.906541,sigmoid,0.5,2,0.7,194.59974670410156,,,,PRUNED
1357,1357,118.51719665527344,2022-12-25 11:23:58.548937,2022-12-25 11:24:07.234317,0 days 00:00:08.685380,tanh,0.5,2,0.8,118.51719665527344,,,,PRUNED
1358,1358,83.64258575439453,2022-12-25 11:24:07.331302,2022-12-25 11:24:15.916483,0 days 00:00:08.585181,tanh,0.4,2,0.8,83.64258575439453,,,,PRUNED
1359,1359,186.7235565185547,2022-12-25 11:24:16.007219,2022-12-25 11:24:25.424910,0 days 00:00:09.417691,tanh,0.4,7,0.8,186.7235565185547,,,,PRUNED
1360,1360,98.61518096923828,2022-12-25 11:24:25.513878,2022-12-25 11:24:34.224433,0 days 00:00:08.710555,tanh,0.4,2,0.8,98.61518096923828,,,,PRUNED
1361,1361,37.747886657714844,2022-12-25 11:24:34.314169,2022-12-25 11:24:49.938911,0 days 00:00:15.624742,tanh,0.45,2,0.8,46.12723922729492,37.747886657714844,,,PRUNED
1362,1362,19.752962112426758,2022-12-25 11:24:50.021706,2022-12-25 11:25:05.796162,0 days 00:00:15.774456,sigmoid,0.4,2,0.7,19.752962112426758,,,,PRUNED
1363,1363,1.361470341682434,2022-12-25 11:25:05.902447,2022-12-25 11:26:44.616776,0 days 00:01:38.714329,relu,0.1,2,0.6,14.42690658569336,5.2781171798706055,3.783357858657837,,COMPLETE
1364,1364,103.8062515258789,2022-12-25 11:26:44.715844,2022-12-25 11:26:53.304589,0 days 00:00:08.588745,tanh,0.45,2,0.8,103.8062515258789,,,,PRUNED
1365,1365,14.063191413879395,2022-12-25 11:26:53.411997,2022-12-25 11:27:29.410187,0 days 00:00:35.998190,sigmoid,0.5,2,0.7,14.063191413879395,,,,PRUNED
1366,1366,13.641297340393066,2022-12-25 11:27:29.492234,2022-12-25 11:28:05.823928,0 days 00:00:36.331694,sigmoid,0.4,2,0.7,13.641297340393066,,,,PRUNED
1367,1367,130.847900390625,2022-12-25 11:28:05.904926,2022-12-25 11:28:14.532787,0 days 00:00:08.627861,tanh,0.45,2,0.8,130.847900390625,,,,PRUNED
1368,1368,1.3543214797973633,2022-12-25 11:28:14.623524,2022-12-25 11:30:06.109952,0 days 00:01:51.486428,sigmoid,0.45,2,0.75,5.630906105041504,3.8403120040893555,,,COMPLETE
1369,1369,18.458072662353516,2022-12-25 11:30:06.209439,2022-12-25 11:30:21.847132,0 days 00:00:15.637693,relu,0.1,2,0.6,18.458072662353516,,,,PRUNED
1370,1370,1.547366738319397,2022-12-25 11:30:21.929572,2022-12-25 11:31:45.978409,0 days 00:01:24.048837,sigmoid,0.45,2,0.75,5.800276756286621,,,,COMPLETE
1371,1371,95.69678497314453,2022-12-25 11:31:46.084930,2022-12-25 11:31:54.666154,0 days 00:00:08.581224,tanh,0.4,2,0.8,95.69678497314453,,,,PRUNED
1372,1372,6.896854400634766,2022-12-25 11:31:54.754949,2022-12-25 11:32:30.845721,0 days 00:00:36.090772,sigmoid,0.45,2,0.75,6.896854400634766,,,,PRUNED
1373,1373,116.66497802734375,2022-12-25 11:32:30.936493,2022-12-25 11:32:39.621090,0 days 00:00:08.684597,tanh,0.45,2,0.8,116.66497802734375,,,,PRUNED
1374,1374,21.398412704467773,2022-12-25 11:32:39.710861,2022-12-25 11:32:55.144447,0 days 00:00:15.433586,relu,0.1,2,0.6,21.398412704467773,,,,PRUNED
1375,1375,1.4894509315490723,2022-12-25 11:32:55.241585,2022-12-25 11:34:09.184950,0 days 00:01:13.943365,relu,0.1,2,0.6,16.72026252746582,5.225413799285889,,,COMPLETE
1376,1376,18.612485885620117,2022-12-25 11:34:09.291418,2022-12-25 11:34:25.254446,0 days 00:00:15.963028,sigmoid,0.4,3,0.95,18.612485885620117,,,,PRUNED
1377,1377,6.8496294021606445,2022-12-25 11:34:25.335179,2022-12-25 11:35:01.409328,0 days 00:00:36.074149,sigmoid,0.45,2,0.7,6.8496294021606445,,,,PRUNED
1378,1378,6.56257963180542,2022-12-25 11:35:01.500116,2022-12-25 11:35:37.557142,0 days 00:00:36.057026,tanh,0.1,2,0.6,16.868139266967773,6.56257963180542,,,PRUNED
1379,1379,121.05560302734375,2022-12-25 11:35:37.648762,2022-12-25 11:35:46.198661,0 days 00:00:08.549899,tanh,0.5,2,0.8,121.05560302734375,,,,PRUNED
1380,1380,20.799652099609375,2022-12-25 11:35:46.481252,2022-12-25 11:36:02.105004,0 days 00:00:15.623752,relu,0.45,2,0.6,20.799652099609375,,,,PRUNED
1381,1381,9.741142272949219,2022-12-25 11:36:02.193524,2022-12-25 11:36:38.285591,0 days 00:00:36.092067,relu,0.35000000000000003,2,0.6,14.228577613830566,9.741142272949219,,,PRUNED
1382,1382,21.43500518798828,2022-12-25 11:36:38.384707,2022-12-25 11:36:53.934211,0 days 00:00:15.549504,relu,0.35000000000000003,2,0.6,21.43500518798828,,,,PRUNED
1383,1383,122.8919677734375,2022-12-25 11:36:54.042934,2022-12-25 11:37:02.958856,0 days 00:00:08.915922,tanh,0.45,2,0.8,122.8919677734375,,,,PRUNED
1384,1384,84.3542709350586,2022-12-25 11:37:03.049120,2022-12-25 11:37:11.741056,0 days 00:00:08.691936,tanh,0.4,2,0.85,84.3542709350586,,,,PRUNED
1385,1385,97.46427154541016,2022-12-25 11:37:11.832105,2022-12-25 11:37:20.474876,0 days 00:00:08.642771,tanh,0.5,2,0.8,97.46427154541016,,,,PRUNED
1386,1386,71.63780212402344,2022-12-25 11:37:20.565534,2022-12-25 11:37:29.298612,0 days 00:00:08.733078,tanh,0.35000000000000003,2,0.8,71.63780212402344,,,,PRUNED
1387,1387,97.81916046142578,2022-12-25 11:37:29.388939,2022-12-25 11:37:38.315188,0 days 00:00:08.926249,tanh,0.45,2,0.8,97.81916046142578,,,,PRUNED
1388,1388,13.011082649230957,2022-12-25 11:37:38.412733,2022-12-25 11:38:14.536456,0 days 00:00:36.123723,sigmoid,0.25,2,0.75,13.011082649230957,,,,PRUNED
1389,1389,6.836201190948486,2022-12-25 11:38:14.619568,2022-12-25 11:38:50.542062,0 days 00:00:35.922494,sigmoid,0.45,2,0.7,6.836201190948486,,,,PRUNED
1390,1390,122.2556381225586,2022-12-25 11:38:50.623127,2022-12-25 11:38:59.559052,0 days 00:00:08.935925,tanh,0.5,2,0.8,122.2556381225586,,,,PRUNED
1391,1391,7.164671897888184,2022-12-25 11:38:59.647792,2022-12-25 11:39:35.888873,0 days 00:00:36.241081,sigmoid,0.35000000000000003,2,0.6,15.771578788757324,7.164671897888184,,,PRUNED
1392,1392,1.5510499477386475,2022-12-25 11:39:35.969047,2022-12-25 11:40:49.920743,0 days 00:01:13.951696,tanh,0.5,2,0.85,30.887540817260742,10.129693031311035,5.357058525085449,,COMPLETE
1393,1393,6.495832443237305,2022-12-25 11:40:50.027830,2022-12-25 11:41:26.313631,0 days 00:00:36.285801,relu,0.4,2,0.9,13.340030670166016,6.495832443237305,,,PRUNED
1394,1394,125.67701721191406,2022-12-25 11:41:26.396039,2022-12-25 11:41:35.088843,0 days 00:00:08.692804,tanh,0.5,2,0.85,125.67701721191406,,,,PRUNED
1395,1395,6.288993835449219,2022-12-25 11:41:35.179707,2022-12-25 11:42:11.468552,0 days 00:00:36.288845,tanh,0.5,2,0.85,36.7237548828125,13.510346412658691,6.288993835449219,,PRUNED
1396,1396,112.06196594238281,2022-12-25 11:42:11.561293,2022-12-25 11:42:20.268886,0 days 00:00:08.707593,tanh,0.5,2,0.8,112.06196594238281,,,,PRUNED
1397,1397,20.70473861694336,2022-12-25 11:42:20.358622,2022-12-25 11:42:36.166685,0 days 00:00:15.808063,tanh,0.1,2,0.6,20.70473861694336,,,,PRUNED
1398,1398,105.33988952636719,2022-12-25 11:42:36.256423,2022-12-25 11:42:44.933701,0 days 00:00:08.677278,tanh,0.5,2,0.85,105.33988952636719,,,,PRUNED
1399,1399,88.54235076904297,2022-12-25 11:42:45.024284,2022-12-25 11:42:53.607036,0 days 00:00:08.582752,tanh,0.5,2,0.85,88.54235076904297,,,,PRUNED
1400,1400,6.197088241577148,2022-12-25 11:42:53.699777,2022-12-25 11:43:29.920954,0 days 00:00:36.221177,relu,0.4,2,0.6,17.76205062866211,6.197088241577148,,,PRUNED
1401,1401,21.53647804260254,2022-12-25 11:43:30.003119,2022-12-25 11:43:45.769647,0 days 00:00:15.766528,relu,0.45,2,0.6,21.53647804260254,,,,PRUNED
1402,1402,121.13699340820312,2022-12-25 11:43:45.852167,2022-12-25 11:43:54.528761,0 days 00:00:08.676594,tanh,0.5,2,0.85,121.13699340820312,,,,PRUNED
1403,1403,16.03993034362793,2022-12-25 11:43:54.618173,2022-12-25 11:44:10.159583,0 days 00:00:15.541410,tanh,0.5,2,0.85,47.75688934326172,16.03993034362793,,,PRUNED
1404,1404,105.68653869628906,2022-12-25 11:44:10.241993,2022-12-25 11:44:19.134905,0 days 00:00:08.892912,tanh,0.5,2,0.85,105.68653869628906,,,,PRUNED
1405,1405,18.168668746948242,2022-12-25 11:44:19.224727,2022-12-25 11:44:34.866493,0 days 00:00:15.641766,sigmoid,0.1,2,0.6,18.168668746948242,,,,PRUNED
1406,1406,26.901168823242188,2022-12-25 11:44:34.947458,2022-12-25 11:44:50.397792,0 days 00:00:15.450334,relu,0.35000000000000003,2,0.6,26.901168823242188,,,,PRUNED
1407,1407,1.7042721509933472,2022-12-25 11:44:50.481613,2022-12-25 11:46:04.487765,0 days 00:01:14.006152,sigmoid,0.5,2,0.8,6.717302322387695,,,,COMPLETE
1408,1408,1.469853401184082,2022-12-25 11:46:04.586932,2022-12-25 11:47:28.698065,0 days 00:01:24.111133,sigmoid,0.4,2,0.7,5.274928569793701,,,,COMPLETE
1409,1409,6.455810070037842,2022-12-25 11:47:28.797945,2022-12-25 11:48:04.925175,0 days 00:00:36.127230,relu,0.35000000000000003,2,0.6,14.185989379882812,6.455810070037842,,,PRUNED
1410,1410,25.74566078186035,2022-12-25 11:48:05.025302,2022-12-25 11:48:20.590659,0 days 00:00:15.565357,tanh,0.45,2,0.85,65.1317138671875,25.74566078186035,,,PRUNED
1411,1411,19.172786712646484,2022-12-25 11:48:20.672735,2022-12-25 11:48:36.497793,0 days 00:00:15.825058,relu,0.4,2,0.6,19.172786712646484,,,,PRUNED
1412,1412,14.494522094726562,2022-12-25 11:48:36.588055,2022-12-25 11:48:52.313263,0 days 00:00:15.725208,tanh,0.5,2,0.85,37.297332763671875,14.494522094726562,,,PRUNED
1413,1413,18.47947120666504,2022-12-25 11:48:52.404458,2022-12-25 11:49:07.812756,0 days 00:00:15.408298,tanh,0.4,2,0.6,18.47947120666504,,,,PRUNED
1414,1414,25.386661529541016,2022-12-25 11:49:07.901267,2022-12-25 11:49:23.611466,0 days 00:00:15.710199,tanh,0.5,2,0.85,40.62883377075195,25.386661529541016,,,PRUNED
1415,1415,85.50016021728516,2022-12-25 11:49:23.702086,2022-12-25 11:49:32.252913,0 days 00:00:08.550827,tanh,0.5,2,0.8,85.50016021728516,,,,PRUNED
1416,1416,15.99078369140625,2022-12-25 11:49:32.359095,2022-12-25 11:49:47.843333,0 days 00:00:15.484238,tanh,0.45,2,0.85,60.69428634643555,15.99078369140625,,,PRUNED
1417,1417,6.826871871948242,2022-12-25 11:49:47.942038,2022-12-25 11:50:23.973031,0 days 00:00:36.030993,sigmoid,0.45,2,0.7,6.826871871948242,,,,PRUNED
1418,1418,11.621206283569336,2022-12-25 11:50:24.056411,2022-12-25 11:51:00.728561,0 days 00:00:36.672150,sigmoid,0.5,2,0.7,11.621206283569336,,,,PRUNED
1419,1419,24.72953224182129,2022-12-25 11:51:00.844564,2022-12-25 11:51:16.395015,0 days 00:00:15.550451,sigmoid,0.45,2,0.7,24.72953224182129,,,,PRUNED
1420,1420,95.15242004394531,2022-12-25 11:51:16.486124,2022-12-25 11:51:25.194379,0 days 00:00:08.708255,tanh,0.5,2,0.85,95.15242004394531,,,,PRUNED
1421,1421,5.929891109466553,2022-12-25 11:51:25.284443,2022-12-25 11:52:01.633068,0 days 00:00:36.348625,tanh,0.35000000000000003,2,0.8,39.88751220703125,11.805582046508789,5.929891109466553,,PRUNED
1422,1422,23.853824615478516,2022-12-25 11:52:01.715180,2022-12-25 11:52:17.206971,0 days 00:00:15.491791,tanh,0.4,2,0.85,63.9461784362793,23.853824615478516,,,PRUNED
1423,1423,13.718435287475586,2022-12-25 11:52:17.288132,2022-12-25 11:52:53.353807,0 days 00:00:36.065675,sigmoid,0.30000000000000004,2,0.7,13.718435287475586,,,,PRUNED
1424,1424,22.11008644104004,2022-12-25 11:52:53.445879,2022-12-25 11:53:09.073860,0 days 00:00:15.627981,tanh,0.5,2,0.8,46.16773223876953,22.11008644104004,,,PRUNED
1425,1425,126.70329284667969,2022-12-25 11:53:09.168267,2022-12-25 11:53:18.102909,0 days 00:00:08.934642,tanh,0.45,2,0.8,126.70329284667969,,,,PRUNED
1426,1426,23.69246482849121,2022-12-25 11:53:18.192009,2022-12-25 11:53:33.659525,0 days 00:00:15.467516,tanh,0.5,2,0.8,24.64586067199707,23.69246482849121,,,PRUNED
1427,1427,100.77658081054688,2022-12-25 11:53:33.741564,2022-12-25 11:53:42.417747,0 days 00:00:08.676183,tanh,0.5,2,0.85,100.77658081054688,,,,PRUNED
1428,1428,4.4973554611206055,2022-12-25 11:53:42.514865,2022-12-25 11:55:20.417385,0 days 00:01:37.902520,sigmoid,0.5,2,0.7,6.227250576019287,4.4973554611206055,,,PRUNED
1429,1429,8.00384521484375,2022-12-25 11:55:20.498685,2022-12-25 11:55:56.856585,0 days 00:00:36.357900,relu,0.1,2,0.6,17.608352661132812,8.00384521484375,,,PRUNED
1430,1430,6.95456075668335,2022-12-25 11:55:56.939692,2022-12-25 11:56:32.878662,0 days 00:00:35.938970,sigmoid,0.4,2,0.7,6.95456075668335,,,,PRUNED
1431,1431,110.73135375976562,2022-12-25 11:56:32.961357,2022-12-25 11:56:41.595875,0 days 00:00:08.634518,tanh,0.4,2,0.8,110.73135375976562,,,,PRUNED
1432,1432,93.24861907958984,2022-12-25 11:56:41.685389,2022-12-25 11:56:50.612347,0 days 00:00:08.926958,tanh,0.5,2,0.8,93.24861907958984,,,,PRUNED
1433,1433,22.831850051879883,2022-12-25 11:56:50.709595,2022-12-25 11:57:06.143029,0 days 00:00:15.433434,relu,0.05,2,0.6,22.831850051879883,,,,PRUNED
1434,1434,38.89126968383789,2022-12-25 11:57:06.234273,2022-12-25 11:57:21.675182,0 days 00:00:15.440909,sigmoid,0.35000000000000003,2,0.8,38.89126968383789,,,,PRUNED
1435,1435,72.9857177734375,2022-12-25 11:57:21.766905,2022-12-25 11:57:30.341868,0 days 00:00:08.574963,tanh,0.5,2,0.85,72.9857177734375,,,,PRUNED
1436,1436,7.351877212524414,2022-12-25 11:57:30.433541,2022-12-25 11:58:06.880105,0 days 00:00:36.446564,relu,0.0,2,0.6,17.008853912353516,7.351877212524414,,,PRUNED
1437,1437,144.1077423095703,2022-12-25 11:58:06.978463,2022-12-25 11:58:43.027370,0 days 00:00:36.048907,relu,0.1,2,0.75,11.332518577575684,144.1077423095703,,,PRUNED
1438,1438,84.11878967285156,2022-12-25 11:58:43.118484,2022-12-25 11:58:51.744388,0 days 00:00:08.625904,tanh,0.35000000000000003,2,0.8,84.11878967285156,,,,PRUNED
1439,1439,92.95603942871094,2022-12-25 11:58:51.833728,2022-12-25 11:59:00.718700,0 days 00:00:08.884972,tanh,0.45,2,0.85,92.95603942871094,,,,PRUNED
1440,1440,16.737016677856445,2022-12-25 11:59:00.808050,2022-12-25 11:59:16.358192,0 days 00:00:15.550142,tanh,0.0,2,0.6,53.8740234375,16.737016677856445,,,PRUNED
1441,1441,87.79183197021484,2022-12-25 11:59:16.457232,2022-12-25 11:59:25.132529,0 days 00:00:08.675297,tanh,0.45,2,0.6,87.79183197021484,,,,PRUNED
1442,1442,21.205577850341797,2022-12-25 11:59:25.215949,2022-12-25 11:59:41.006577,0 days 00:00:15.790628,tanh,0.4,2,0.6,21.205577850341797,,,,PRUNED
1443,1443,18.64474868774414,2022-12-25 11:59:41.088344,2022-12-25 11:59:56.522233,0 days 00:00:15.433889,relu,0.35000000000000003,2,0.7,18.64474868774414,,,,PRUNED
1444,1444,4.820962429046631,2022-12-25 11:59:56.604275,2022-12-25 12:01:34.414592,0 days 00:01:37.810317,relu,0.45,2,0.65,5.898196220397949,4.820962429046631,,,PRUNED
1445,1445,85.177734375,2022-12-25 12:01:34.503778,2022-12-25 12:01:43.289797,0 days 00:00:08.786019,tanh,0.5,2,0.8,85.177734375,,,,PRUNED
1446,1446,6.213545799255371,2022-12-25 12:01:43.379110,2022-12-25 12:02:19.728367,0 days 00:00:36.349257,tanh,0.5,2,0.6,29.440217971801758,12.599981307983398,6.213545799255371,,PRUNED
1447,1447,15.047563552856445,2022-12-25 12:02:19.828359,2022-12-25 12:02:55.958764,0 days 00:00:36.130405,sigmoid,0.30000000000000004,2,0.6,15.179275512695312,15.047563552856445,,,PRUNED
1448,1448,6.2669243812561035,2022-12-25 12:02:56.057667,2022-12-25 12:03:32.206110,0 days 00:00:36.148443,relu,0.35000000000000003,2,0.6,14.158437728881836,6.2669243812561035,,,PRUNED
1449,1449,6.358923435211182,2022-12-25 12:03:32.307221,2022-12-25 12:04:08.695102,0 days 00:00:36.387881,relu,0.1,2,0.6,17.02913475036621,6.358923435211182,,,PRUNED
1450,1450,331.961181640625,2022-12-25 12:04:08.786797,2022-12-25 12:04:17.994848,0 days 00:00:09.208051,tanh,0.0,8,0.6,331.961181640625,,,,PRUNED
1451,1451,18.763315200805664,2022-12-25 12:04:18.084906,2022-12-25 12:04:33.668010,0 days 00:00:15.583104,tanh,0.5,2,0.6,39.67420959472656,18.763315200805664,,,PRUNED
1452,1452,106.87215423583984,2022-12-25 12:04:33.759067,2022-12-25 12:04:42.659467,0 days 00:00:08.900400,tanh,0.5,2,0.8,106.87215423583984,,,,PRUNED
1453,1453,23.255319595336914,2022-12-25 12:04:42.750119,2022-12-25 12:04:58.424287,0 days 00:00:15.674168,tanh,0.4,2,0.6,65.26375579833984,23.255319595336914,,,PRUNED
1454,1454,110.26294708251953,2022-12-25 12:04:58.506038,2022-12-25 12:05:07.182133,0 days 00:00:08.676095,tanh,0.45,2,0.6,110.26294708251953,,,,PRUNED
1455,1455,19.57889747619629,2022-12-25 12:05:07.273081,2022-12-25 12:05:22.956224,0 days 00:00:15.683143,relu,0.4,2,0.6,19.57889747619629,,,,PRUNED
1456,1456,16.345489501953125,2022-12-25 12:05:23.039275,2022-12-25 12:05:59.328078,0 days 00:00:36.288803,tanh,0.35000000000000003,2,0.6,17.413955688476562,16.345489501953125,,,PRUNED
1457,1457,26.84792709350586,2022-12-25 12:05:59.409779,2022-12-25 12:06:14.960679,0 days 00:00:15.550900,sigmoid,0.4,2,0.7,26.84792709350586,,,,PRUNED
1458,1458,6.883026123046875,2022-12-25 12:06:15.041934,2022-12-25 12:06:51.141166,0 days 00:00:36.099232,tanh,0.35000000000000003,2,0.7,6.883026123046875,,,,PRUNED
1459,1459,33.4250373840332,2022-12-25 12:06:51.240005,2022-12-25 12:07:07.180940,0 days 00:00:15.940935,relu,0.1,3,0.6,33.4250373840332,,,,PRUNED
1460,1460,20.630483627319336,2022-12-25 12:07:07.273181,2022-12-25 12:07:22.830378,0 days 00:00:15.557197,relu,0.45,2,0.6,20.630483627319336,,,,PRUNED
1461,1461,1.472887635231018,2022-12-25 12:07:22.922376,2022-12-25 12:08:54.343571,0 days 00:01:31.421195,tanh,0.5,2,0.6,59.88638687133789,12.331853866577148,5.694302082061768,,COMPLETE
1462,1462,26.99224281311035,2022-12-25 12:08:54.442782,2022-12-25 12:09:10.305015,0 days 00:00:15.862233,tanh,0.0,2,0.6,48.416839599609375,26.99224281311035,,,PRUNED
1463,1463,1.5864444971084595,2022-12-25 12:09:10.396784,2022-12-25 12:10:24.519500,0 days 00:01:14.122716,relu,0.35000000000000003,2,0.6,11.363241195678711,5.482196807861328,,,COMPLETE
1464,1464,21.380802154541016,2022-12-25 12:10:24.627291,2022-12-25 12:10:40.332131,0 days 00:00:15.704840,sigmoid,0.35000000000000003,4,0.7,21.380802154541016,,,,PRUNED
1465,1465,1.6339380741119385,2022-12-25 12:10:40.415230,2022-12-25 12:11:54.513264,0 days 00:01:14.098034,relu,0.1,2,0.75,10.72774887084961,5.959075927734375,,,COMPLETE
1466,1466,87.96338653564453,2022-12-25 12:11:54.620975,2022-12-25 12:12:03.592677,0 days 00:00:08.971702,relu,0.35000000000000003,2,0.6,87.96338653564453,,,,PRUNED
1467,1467,110.0474853515625,2022-12-25 12:12:03.682808,2022-12-25 12:12:12.400610,0 days 00:00:08.717802,relu,0.5,2,0.85,110.0474853515625,,,,PRUNED
1468,1468,114.62525177001953,2022-12-25 12:12:12.492003,2022-12-25 12:12:21.216417,0 days 00:00:08.724414,relu,0.5,2,0.6,114.62525177001953,,,,PRUNED
1469,1469,22.749404907226562,2022-12-25 12:12:21.307424,2022-12-25 12:12:37.156063,0 days 00:00:15.848639,tanh,0.4,2,0.6,22.749404907226562,,,,PRUNED
1470,1470,6.765026569366455,2022-12-25 12:12:37.246696,2022-12-25 12:13:13.269833,0 days 00:00:36.023137,sigmoid,0.25,2,0.65,6.765026569366455,,,,PRUNED
1471,1471,29.87538719177246,2022-12-25 12:13:13.362639,2022-12-25 12:13:29.168804,0 days 00:00:15.806165,relu,0.30000000000000004,5,0.65,29.87538719177246,,,,PRUNED
