,number,value,datetime_start,datetime_complete,duration,params_activation,params_dropout,params_layers,params_shrink,system_attrs_completed_rung_0,system_attrs_completed_rung_1,system_attrs_completed_rung_2,system_attrs_completed_rung_3,state
1206,1206,14.676963806152344,2022-12-25 10:02:33.360341,2022-12-25 10:03:08.942845,0 days 00:00:35.582504,sigmoid,0.30000000000000004,2,0.6,17.11611557006836,14.676963806152344,,,PRUNED
1207,1207,220.78761291503906,2022-12-25 10:03:09.032643,2022-12-25 10:03:18.059287,0 days 00:00:09.026644,relu,0.0,7,0.75,220.78761291503906,,,,PRUNED
1208,1208,7.282045364379883,2022-12-25 10:03:18.150623,2022-12-25 10:03:53.938890,0 days 00:00:35.788267,sigmoid,0.30000000000000004,2,0.7,7.282045364379883,,,,PRUNED
1209,1209,107.8182144165039,2022-12-25 10:03:54.038664,2022-12-25 10:04:02.589244,0 days 00:00:08.550580,tanh,0.05,3,0.95,107.8182144165039,,,,PRUNED
1210,1210,96.0333023071289,2022-12-25 10:04:02.679580,2022-12-25 10:04:11.138593,0 days 00:00:08.459013,sigmoid,0.05,2,0.6,96.0333023071289,,,,PRUNED
1211,1211,36.462764739990234,2022-12-25 10:04:11.220600,2022-12-25 10:04:26.761409,0 days 00:00:15.540809,relu,0.35000000000000003,2,0.6,36.462764739990234,,,,PRUNED
1212,1212,7.853704452514648,2022-12-25 10:04:26.852968,2022-12-25 10:05:02.400382,0 days 00:00:35.547414,sigmoid,0.30000000000000004,2,0.7,7.853704452514648,,,,PRUNED
1213,1213,1.5469229221343994,2022-12-25 10:05:02.483375,2022-12-25 10:06:15.449019,0 days 00:01:12.965644,relu,0.4,2,0.6,59.530826568603516,12.839828491210938,5.347845077514648,,COMPLETE
1214,1214,87.5296401977539,2022-12-25 10:06:15.565856,2022-12-25 10:06:23.986862,0 days 00:00:08.421006,relu,0.35000000000000003,2,0.8,87.5296401977539,,,,PRUNED
1215,1215,22.756969451904297,2022-12-25 10:06:24.076892,2022-12-25 10:06:39.609682,0 days 00:00:15.532790,relu,0.1,2,0.6,22.756969451904297,,,,PRUNED
1216,1216,47.971107482910156,2022-12-25 10:06:39.691788,2022-12-25 10:06:54.907987,0 days 00:00:15.216199,relu,0.4,2,0.7,47.971107482910156,,,,PRUNED
1217,1217,6.398654460906982,2022-12-25 10:06:55.000133,2022-12-25 10:07:30.555818,0 days 00:00:35.555685,sigmoid,0.35000000000000003,2,0.65,16.396148681640625,6.398654460906982,,,PRUNED
1218,1218,17.081422805786133,2022-12-25 10:07:30.647150,2022-12-25 10:08:06.510883,0 days 00:00:35.863733,relu,0.4,2,0.6,15.216697692871094,17.081422805786133,,,PRUNED
1219,1219,1.4498467445373535,2022-12-25 10:08:06.593980,2022-12-25 10:09:12.517935,0 days 00:01:05.923955,sigmoid,0.30000000000000004,2,0.7,4.72462797164917,,,,COMPLETE
1220,1220,78.98567199707031,2022-12-25 10:09:12.618106,2022-12-25 10:09:21.081780,0 days 00:00:08.463674,relu,0.45,2,0.6,78.98567199707031,,,,PRUNED
1221,1221,7.581597328186035,2022-12-25 10:09:21.172111,2022-12-25 10:09:56.594520,0 days 00:00:35.422409,sigmoid,0.30000000000000004,2,0.7,7.581597328186035,,,,PRUNED
1222,1222,25.176025390625,2022-12-25 10:09:56.693422,2022-12-25 10:10:12.243568,0 days 00:00:15.550146,relu,0.25,2,0.6,25.176025390625,,,,PRUNED
1223,1223,1.4194231033325195,2022-12-25 10:10:12.326585,2022-12-25 10:11:49.083080,0 days 00:01:36.756495,sigmoid,0.30000000000000004,2,0.7,5.8611626625061035,4.290114402770996,,,COMPLETE
1224,1224,83.326171875,2022-12-25 10:11:49.192466,2022-12-25 10:11:57.644922,0 days 00:00:08.452456,relu,0.45,2,0.85,83.326171875,,,,PRUNED
1225,1225,7.021384239196777,2022-12-25 10:11:57.735263,2022-12-25 10:12:33.599535,0 days 00:00:35.864272,relu,0.5,2,0.6,37.31684875488281,12.145174980163574,7.021384239196777,,PRUNED
1226,1226,1.6588530540466309,2022-12-25 10:12:33.681534,2022-12-25 10:13:46.716847,0 days 00:01:13.035313,sigmoid,0.30000000000000004,2,0.7,6.176131725311279,,,,COMPLETE
1227,1227,9.398357391357422,2022-12-25 10:13:46.822219,2022-12-25 10:14:22.241311,0 days 00:00:35.419092,sigmoid,0.30000000000000004,2,0.7,9.398357391357422,,,,PRUNED
1228,1228,14.249283790588379,2022-12-25 10:14:22.332641,2022-12-25 10:14:58.006046,0 days 00:00:35.673405,tanh,0.4,2,0.6,42.20631408691406,11.073713302612305,14.249283790588379,,PRUNED
1229,1229,153.98558044433594,2022-12-25 10:14:58.096420,2022-12-25 10:15:07.238228,0 days 00:00:09.141808,relu,0.30000000000000004,6,0.6,153.98558044433594,,,,PRUNED
1230,1230,1.6386369466781616,2022-12-25 10:15:07.329233,2022-12-25 10:16:30.261805,0 days 00:01:22.932572,sigmoid,0.30000000000000004,2,0.7,6.207482814788818,,,,COMPLETE
1231,1231,1.7187579870224,2022-12-25 10:16:30.370299,2022-12-25 10:17:43.101954,0 days 00:01:12.731655,sigmoid,0.30000000000000004,2,0.7,6.4835357666015625,,,,COMPLETE
1232,1232,74.47164916992188,2022-12-25 10:17:43.206451,2022-12-25 10:17:51.659791,0 days 00:00:08.453340,sigmoid,0.35000000000000003,2,0.9,74.47164916992188,,,,PRUNED
1233,1233,25.329042434692383,2022-12-25 10:17:51.751130,2022-12-25 10:18:07.291658,0 days 00:00:15.540528,relu,0.45,2,0.6,25.329042434692383,,,,PRUNED
1234,1234,21.821529388427734,2022-12-25 10:18:07.374592,2022-12-25 10:18:23.081453,0 days 00:00:15.706861,relu,0.4,4,0.6,56.10087203979492,21.821529388427734,,,PRUNED
1235,1235,21.684782028198242,2022-12-25 10:18:23.172750,2022-12-25 10:18:38.580076,0 days 00:00:15.407326,sigmoid,0.05,3,0.7,21.684782028198242,,,,PRUNED
1236,1236,112.97196197509766,2022-12-25 10:18:38.662253,2022-12-25 10:18:47.388722,0 days 00:00:08.726469,relu,0.45,2,0.6,112.97196197509766,,,,PRUNED
1237,1237,1.5952463150024414,2022-12-25 10:18:47.478277,2022-12-25 10:20:00.345903,0 days 00:01:12.867626,sigmoid,0.30000000000000004,2,0.75,5.846841812133789,,,,COMPLETE
1238,1238,5.941383361816406,2022-12-25 10:20:00.452398,2022-12-25 10:20:36.062750,0 days 00:00:35.610352,relu,0.4,2,0.6,48.574527740478516,11.818304061889648,5.941383361816406,,PRUNED
1239,1239,132.4801025390625,2022-12-25 10:20:36.148020,2022-12-25 10:20:44.905015,0 days 00:00:08.756995,relu,0.5,3,0.6,132.4801025390625,,,,PRUNED
1240,1240,1.4252756834030151,2022-12-25 10:20:44.995352,2022-12-25 10:22:28.491015,0 days 00:01:43.495663,sigmoid,0.35000000000000003,2,0.7,5.951639652252197,4.2610087394714355,,,COMPLETE
1241,1241,92.59673309326172,2022-12-25 10:22:28.599527,2022-12-25 10:22:37.054603,0 days 00:00:08.455076,tanh,0.35000000000000003,2,0.8,92.59673309326172,,,,PRUNED
1242,1242,26.707395553588867,2022-12-25 10:22:37.155682,2022-12-25 10:22:52.686766,0 days 00:00:15.531084,relu,0.1,4,0.6,26.707395553588867,,,,PRUNED
1243,1243,8.068197250366211,2022-12-25 10:22:52.770015,2022-12-25 10:23:28.441495,0 days 00:00:35.671480,tanh,0.35000000000000003,2,0.6,18.176103591918945,8.068197250366211,,,PRUNED
1244,1244,95.50035858154297,2022-12-25 10:23:28.525650,2022-12-25 10:23:37.300314,0 days 00:00:08.774664,sigmoid,0.4,2,0.6,95.50035858154297,,,,PRUNED
1245,1245,6.884500503540039,2022-12-25 10:23:37.391354,2022-12-25 10:24:12.871709,0 days 00:00:35.480355,sigmoid,0.35000000000000003,2,0.7,6.884500503540039,,,,PRUNED
1246,1246,20.632343292236328,2022-12-25 10:24:12.954751,2022-12-25 10:24:28.195852,0 days 00:00:15.241101,relu,0.4,2,0.6,20.632343292236328,,,,PRUNED
1247,1247,98.37850189208984,2022-12-25 10:24:28.277452,2022-12-25 10:24:36.804133,0 days 00:00:08.526681,relu,0.25,2,0.6,98.37850189208984,,,,PRUNED
1248,1248,4.495194435119629,2022-12-25 10:24:36.894469,2022-12-25 10:26:14.554074,0 days 00:01:37.659605,sigmoid,0.30000000000000004,2,0.7,6.095072269439697,4.495194435119629,,,PRUNED
1249,1249,86.4552230834961,2022-12-25 10:26:14.636079,2022-12-25 10:26:23.196086,0 days 00:00:08.560007,relu,0.30000000000000004,2,0.6,86.4552230834961,,,,PRUNED
1250,1250,18.401138305664062,2022-12-25 10:26:23.285042,2022-12-25 10:26:38.593920,0 days 00:00:15.308878,relu,0.5,2,0.6,54.16107940673828,18.401138305664062,,,PRUNED
1251,1251,1.7001230716705322,2022-12-25 10:26:38.676922,2022-12-25 10:28:05.208648,0 days 00:01:26.531726,sigmoid,0.30000000000000004,2,0.7,6.2575812339782715,,,,COMPLETE
1252,1252,110.44527435302734,2022-12-25 10:28:05.314715,2022-12-25 10:28:13.854385,0 days 00:00:08.539670,relu,0.5,2,0.6,110.44527435302734,,,,PRUNED
1253,1253,19.27100372314453,2022-12-25 10:28:13.944660,2022-12-25 10:28:29.235549,0 days 00:00:15.290889,relu,0.1,2,0.75,19.27100372314453,,,,PRUNED
1254,1254,28.52464485168457,2022-12-25 10:28:29.326884,2022-12-25 10:28:44.717672,0 days 00:00:15.390788,sigmoid,0.30000000000000004,2,0.6,28.52464485168457,,,,PRUNED
1255,1255,94.74381256103516,2022-12-25 10:28:44.800731,2022-12-25 10:28:53.409725,0 days 00:00:08.608994,relu,0.25,2,0.6,94.74381256103516,,,,PRUNED
1256,1256,17.048986434936523,2022-12-25 10:28:53.500070,2022-12-25 10:29:09.015877,0 days 00:00:15.515807,tanh,0.5,2,0.6,39.40626525878906,17.048986434936523,,,PRUNED
1257,1257,85.14361572265625,2022-12-25 10:29:09.107213,2022-12-25 10:29:24.798263,0 days 00:00:15.691050,relu,0.35000000000000003,6,0.7,85.14361572265625,,,,PRUNED
1258,1258,1.4557937383651733,2022-12-25 10:29:24.883304,2022-12-25 10:31:08.651380,0 days 00:01:43.768076,sigmoid,0.5,2,0.7,6.262238025665283,4.213796615600586,,,COMPLETE
1259,1259,11.552472114562988,2022-12-25 10:31:08.760178,2022-12-25 10:31:44.320800,0 days 00:00:35.560622,relu,0.35000000000000003,2,0.6,15.999699592590332,11.552472114562988,,,PRUNED
1260,1260,24.516616821289062,2022-12-25 10:31:44.403799,2022-12-25 10:31:59.836284,0 days 00:00:15.432485,tanh,0.45,2,0.6,24.516616821289062,,,,PRUNED
1261,1261,9.489351272583008,2022-12-25 10:31:59.918729,2022-12-25 10:32:35.533590,0 days 00:00:35.614861,sigmoid,0.35000000000000003,2,0.7,9.489351272583008,,,,PRUNED
1262,1262,23.665327072143555,2022-12-25 10:32:35.615604,2022-12-25 10:32:51.291477,0 days 00:00:15.675873,sigmoid,0.45,2,0.95,56.411354064941406,23.665327072143555,,,PRUNED
1263,1263,9.415667533874512,2022-12-25 10:32:51.389400,2022-12-25 10:33:26.779719,0 days 00:00:35.390319,sigmoid,0.5,2,0.7,9.415667533874512,,,,PRUNED
1264,1264,78.00074005126953,2022-12-25 10:33:26.862779,2022-12-25 10:33:35.430066,0 days 00:00:08.567287,relu,0.0,2,0.6,78.00074005126953,,,,PRUNED
1265,1265,88.2078628540039,2022-12-25 10:33:35.520415,2022-12-25 10:33:44.262732,0 days 00:00:08.742317,relu,0.4,2,0.85,88.2078628540039,,,,PRUNED
1266,1266,18.41054344177246,2022-12-25 10:33:44.352732,2022-12-25 10:34:20.167349,0 days 00:00:35.814617,relu,0.4,2,0.65,11.284194946289062,18.41054344177246,,,PRUNED
1267,1267,1.6976388692855835,2022-12-25 10:34:20.258531,2022-12-25 10:35:32.967019,0 days 00:01:12.708488,sigmoid,0.30000000000000004,2,0.7,6.097174167633057,,,,COMPLETE
1268,1268,20.831132888793945,2022-12-25 10:35:33.072520,2022-12-25 10:35:48.302350,0 days 00:00:15.229830,sigmoid,0.1,2,0.6,20.831132888793945,,,,PRUNED
1269,1269,136.1807098388672,2022-12-25 10:35:48.386351,2022-12-25 10:35:57.194351,0 days 00:00:08.808000,relu,0.5,2,0.6,136.1807098388672,,,,PRUNED
1270,1270,27.024425506591797,2022-12-25 10:35:57.285394,2022-12-25 10:36:12.500524,0 days 00:00:15.215130,relu,0.35000000000000003,2,0.6,27.024425506591797,,,,PRUNED
1271,1271,7.2414069175720215,2022-12-25 10:36:12.585524,2022-12-25 10:36:48.264484,0 days 00:00:35.678960,relu,0.30000000000000004,2,0.75,37.01127624511719,12.733902931213379,7.2414069175720215,,PRUNED
1272,1272,4.943779945373535,2022-12-25 10:36:48.347489,2022-12-25 10:38:24.740530,0 days 00:01:36.393041,relu,0.15000000000000002,2,0.7,9.873697280883789,6.140353202819824,4.943779945373535,,PRUNED
1273,1273,7.591847896575928,2022-12-25 10:38:24.823531,2022-12-25 10:39:00.546156,0 days 00:00:35.722625,sigmoid,0.5,2,0.7,7.591847896575928,,,,PRUNED
1274,1274,108.55735778808594,2022-12-25 10:39:00.630157,2022-12-25 10:39:09.313158,0 days 00:00:08.683001,tanh,0.05,3,0.6,108.55735778808594,,,,PRUNED
1275,1275,92.54048156738281,2022-12-25 10:39:09.411824,2022-12-25 10:39:17.929174,0 days 00:00:08.517350,relu,0.5,2,0.6,92.54048156738281,,,,PRUNED
1276,1276,1.425400972366333,2022-12-25 10:39:18.019508,2022-12-25 10:40:55.082340,0 days 00:01:37.062832,sigmoid,0.25,2,0.6,37.88741683959961,14.036009788513184,5.170507431030273,4.186756134033203,COMPLETE
1277,1277,21.036842346191406,2022-12-25 10:40:55.193842,2022-12-25 10:41:10.536226,0 days 00:00:15.342384,sigmoid,0.25,2,0.6,38.89347457885742,21.036842346191406,,,PRUNED
1278,1278,102.11697387695312,2022-12-25 10:41:10.618844,2022-12-25 10:41:19.245006,0 days 00:00:08.626162,sigmoid,0.25,2,0.6,102.11697387695312,,,,PRUNED
1279,1279,1.489958643913269,2022-12-25 10:41:19.335120,2022-12-25 10:42:31.995832,0 days 00:01:12.660712,sigmoid,0.5,2,0.7,5.544004917144775,,,,COMPLETE
1280,1280,1.6450871229171753,2022-12-25 10:42:32.099891,2022-12-25 10:43:45.137429,0 days 00:01:13.037538,relu,0.4,2,0.65,12.934471130371094,6.148009777069092,,,COMPLETE
1281,1281,4.413063049316406,2022-12-25 10:43:45.247651,2022-12-25 10:45:21.559024,0 days 00:01:36.311373,sigmoid,0.2,2,0.8,13.700456619262695,5.37893533706665,4.413063049316406,,PRUNED
1282,1282,130.3381805419922,2022-12-25 10:45:21.643015,2022-12-25 10:45:30.234055,0 days 00:00:08.591040,sigmoid,0.30000000000000004,2,0.6,130.3381805419922,,,,PRUNED
1283,1283,79.39728546142578,2022-12-25 10:45:30.324689,2022-12-25 10:45:39.125347,0 days 00:00:08.800658,sigmoid,0.25,2,0.6,79.39728546142578,,,,PRUNED
1284,1284,20.676029205322266,2022-12-25 10:45:39.214679,2022-12-25 10:45:54.648174,0 days 00:00:15.433495,relu,0.30000000000000004,2,0.6,20.676029205322266,,,,PRUNED
1285,1285,16.31905174255371,2022-12-25 10:45:54.739510,2022-12-25 10:46:10.022011,0 days 00:00:15.282501,sigmoid,0.30000000000000004,2,0.6,60.41345977783203,16.31905174255371,,,PRUNED
1286,1286,1.5353223085403442,2022-12-25 10:46:10.113287,2022-12-25 10:47:33.009499,0 days 00:01:22.896212,tanh,0.1,2,0.6,10.999058723449707,5.565549373626709,,,COMPLETE
1287,1287,19.632490158081055,2022-12-25 10:47:33.109748,2022-12-25 10:47:48.531230,0 days 00:00:15.421482,relu,0.35000000000000003,2,0.6,19.632490158081055,,,,PRUNED
1288,1288,4.469515800476074,2022-12-25 10:47:48.630897,2022-12-25 10:49:24.990611,0 days 00:01:36.359714,sigmoid,0.4,2,0.75,16.154470443725586,6.0511579513549805,4.469515800476074,,PRUNED
1289,1289,1.4007107019424438,2022-12-25 10:49:25.081966,2022-12-25 10:51:38.482852,0 days 00:02:13.400886,sigmoid,0.5,2,0.7,6.250957489013672,4.068389415740967,,,COMPLETE
1290,1290,16.04852867126465,2022-12-25 10:51:38.583844,2022-12-25 10:51:53.896010,0 days 00:00:15.312166,sigmoid,0.35000000000000003,2,0.6,38.19442367553711,16.04852867126465,,,PRUNED
1291,1291,27.45174217224121,2022-12-25 10:51:53.995346,2022-12-25 10:52:09.603154,0 days 00:00:15.607808,relu,0.45,2,0.7,27.45174217224121,,,,PRUNED
1292,1292,8.241929054260254,2022-12-25 10:52:09.694514,2022-12-25 10:52:45.208791,0 days 00:00:35.514277,sigmoid,0.5,2,0.7,8.241929054260254,,,,PRUNED
1293,1293,15.305956840515137,2022-12-25 10:52:45.300126,2022-12-25 10:53:00.574298,0 days 00:00:15.274172,sigmoid,0.25,2,0.75,64.45756530761719,15.305956840515137,,,PRUNED
1294,1294,76.95471954345703,2022-12-25 10:53:00.657299,2022-12-25 10:53:09.415921,0 days 00:00:08.758622,sigmoid,0.30000000000000004,2,1.0,76.95471954345703,,,,PRUNED
1295,1295,4.474447250366211,2022-12-25 10:53:09.513963,2022-12-25 10:54:45.624947,0 days 00:01:36.110984,sigmoid,0.5,2,0.7,5.614887237548828,4.474447250366211,,,PRUNED
1296,1296,125.0833969116211,2022-12-25 10:54:45.708167,2022-12-25 10:54:54.191706,0 days 00:00:08.483539,sigmoid,0.35000000000000003,2,0.6,125.0833969116211,,,,PRUNED
1297,1297,33.26610565185547,2022-12-25 10:54:54.282758,2022-12-25 10:55:09.614620,0 days 00:00:15.331862,relu,0.35000000000000003,2,0.6,33.26610565185547,,,,PRUNED
1298,1298,26.809436798095703,2022-12-25 10:55:09.705637,2022-12-25 10:55:25.146697,0 days 00:00:15.441060,tanh,0.4,2,0.6,26.809436798095703,,,,PRUNED
1299,1299,4.221630096435547,2022-12-25 10:55:25.238032,2022-12-25 10:57:01.422751,0 days 00:01:36.184719,relu,0.05,2,0.6,11.433972358703613,5.4758381843566895,4.221630096435547,,PRUNED
1300,1300,120.53950500488281,2022-12-25 10:57:01.532546,2022-12-25 10:57:10.673232,0 days 00:00:09.140686,sigmoid,0.25,5,0.6,120.53950500488281,,,,PRUNED
1301,1301,23.937381744384766,2022-12-25 10:57:10.766223,2022-12-25 10:57:27.545779,0 days 00:00:16.779556,sigmoid,0.0,2,0.8,55.64577102661133,23.937381744384766,,,PRUNED
1302,1302,114.64582824707031,2022-12-25 10:57:27.626804,2022-12-25 10:57:36.528960,0 days 00:00:08.902156,sigmoid,0.5,2,0.6,114.64582824707031,,,,PRUNED
1303,1303,1.660871982574463,2022-12-25 10:57:36.617764,2022-12-25 10:58:43.941913,0 days 00:01:07.324149,sigmoid,0.25,2,1.0,11.340747833251953,5.926122665405273,,,COMPLETE
1304,1304,94.66845703125,2022-12-25 10:58:44.043796,2022-12-25 10:58:52.690341,0 days 00:00:08.646545,sigmoid,0.45,3,0.6,94.66845703125,,,,PRUNED
1305,1305,6.8755011558532715,2022-12-25 10:58:52.780672,2022-12-25 10:59:28.994930,0 days 00:00:36.214258,sigmoid,0.5,2,0.7,6.8755011558532715,,,,PRUNED
1306,1306,7.096987247467041,2022-12-25 10:59:29.078003,2022-12-25 11:00:04.950544,0 days 00:00:35.872541,sigmoid,0.5,2,0.7,7.096987247467041,,,,PRUNED
1307,1307,89.86357879638672,2022-12-25 11:00:05.034543,2022-12-25 11:00:13.642554,0 days 00:00:08.608011,tanh,0.30000000000000004,2,0.6,89.86357879638672,,,,PRUNED
1308,1308,16.033355712890625,2022-12-25 11:00:13.732785,2022-12-25 11:00:29.399354,0 days 00:00:15.666569,sigmoid,0.05,2,0.85,48.654014587402344,16.033355712890625,,,PRUNED
1309,1309,7.590300559997559,2022-12-25 11:00:29.491442,2022-12-25 11:01:05.712616,0 days 00:00:36.221174,sigmoid,0.5,2,0.7,7.590300559997559,,,,PRUNED
1310,1310,15.930216789245605,2022-12-25 11:01:05.793618,2022-12-25 11:01:21.311437,0 days 00:00:15.517819,tanh,0.2,2,0.6,42.792808532714844,15.930216789245605,,,PRUNED
1311,1311,77.70454406738281,2022-12-25 11:01:21.392910,2022-12-25 11:01:30.094718,0 days 00:00:08.701808,sigmoid,0.05,2,0.6,77.70454406738281,,,,PRUNED
1312,1312,7.167884349822998,2022-12-25 11:01:30.184441,2022-12-25 11:02:06.191012,0 days 00:00:36.006571,relu,0.35000000000000003,2,0.7,16.156742095947266,7.167884349822998,,,PRUNED
1313,1313,92.94612884521484,2022-12-25 11:02:06.480419,2022-12-25 11:02:15.207837,0 days 00:00:08.727418,relu,0.0,2,0.6,92.94612884521484,,,,PRUNED
1314,1314,15.135259628295898,2022-12-25 11:02:15.298877,2022-12-25 11:02:51.421292,0 days 00:00:36.122415,relu,0.1,2,0.6,16.726287841796875,15.135259628295898,,,PRUNED
1315,1315,7.385923862457275,2022-12-25 11:02:51.513459,2022-12-25 11:03:27.751876,0 days 00:00:36.238417,relu,0.30000000000000004,3,0.65,14.339849472045898,7.385923862457275,,,PRUNED
1316,1316,43.30666732788086,2022-12-25 11:03:27.833892,2022-12-25 11:03:43.709005,0 days 00:00:15.875113,sigmoid,0.5,2,0.6,50.88966369628906,43.30666732788086,,,PRUNED
1317,1317,7.897579669952393,2022-12-25 11:03:43.791005,2022-12-25 11:04:19.822943,0 days 00:00:36.031938,sigmoid,0.4,2,0.6,17.454395294189453,7.897579669952393,,,PRUNED
1318,1318,14.490840911865234,2022-12-25 11:04:19.903941,2022-12-25 11:04:35.647201,0 days 00:00:15.743260,tanh,0.25,2,0.6,42.11030197143555,14.490840911865234,,,PRUNED
1319,1319,124.38438415527344,2022-12-25 11:04:35.728366,2022-12-25 11:04:44.380422,0 days 00:00:08.652056,relu,0.35000000000000003,2,0.6,124.38438415527344,,,,PRUNED
1320,1320,15.645903587341309,2022-12-25 11:04:44.470754,2022-12-25 11:05:00.304214,0 days 00:00:15.833460,relu,0.2,2,0.75,50.4725227355957,15.645903587341309,,,PRUNED
1321,1321,8.10422134399414,2022-12-25 11:05:00.392549,2022-12-25 11:05:36.400752,0 days 00:00:36.008203,sigmoid,0.5,2,0.7,8.10422134399414,,,,PRUNED
1322,1322,19.30099105834961,2022-12-25 11:05:36.491825,2022-12-25 11:05:52.124298,0 days 00:00:15.632473,relu,0.5,2,0.6,40.58148956298828,19.30099105834961,,,PRUNED
1323,1323,18.424184799194336,2022-12-25 11:05:52.215636,2022-12-25 11:06:08.023478,0 days 00:00:15.807842,relu,0.2,2,0.6,50.29643249511719,18.424184799194336,,,PRUNED
1324,1324,87.71492767333984,2022-12-25 11:06:08.114432,2022-12-25 11:06:16.981147,0 days 00:00:08.866715,sigmoid,0.05,4,0.9,87.71492767333984,,,,PRUNED
1325,1325,132.64724731445312,2022-12-25 11:06:17.079181,2022-12-25 11:06:25.823186,0 days 00:00:08.744005,relu,0.0,2,0.6,132.64724731445312,,,,PRUNED
1326,1326,27.43406105041504,2022-12-25 11:06:25.914294,2022-12-25 11:06:41.396266,0 days 00:00:15.481972,relu,0.35000000000000003,2,0.65,27.43406105041504,,,,PRUNED
1327,1327,26.55655288696289,2022-12-25 11:06:41.493397,2022-12-25 11:06:57.244537,0 days 00:00:15.751140,tanh,0.15000000000000002,2,0.6,26.55655288696289,,,,PRUNED
1328,1328,4.51409387588501,2022-12-25 11:06:57.334696,2022-12-25 11:08:34.895795,0 days 00:01:37.561099,sigmoid,0.45,2,0.75,5.883116722106934,4.51409387588501,,,PRUNED
1329,1329,1.4638229608535767,2022-12-25 11:08:34.978931,2022-12-25 11:09:48.709246,0 days 00:01:13.730315,tanh,0.45,2,0.8,57.155670166015625,10.88949203491211,4.664876937866211,,COMPLETE
1330,1330,1.4698010683059692,2022-12-25 11:09:48.809772,2022-12-25 11:11:20.084911,0 days 00:01:31.275139,tanh,0.4,2,0.8,43.06616973876953,13.520977973937988,5.637850284576416,,COMPLETE
1331,1331,6.8746442794799805,2022-12-25 11:11:20.186743,2022-12-25 11:11:56.230032,0 days 00:00:36.043289,relu,0.1,2,0.6,16.232118606567383,6.8746442794799805,,,PRUNED
1332,1332,1.4694831371307373,2022-12-25 11:11:56.322461,2022-12-25 11:13:27.008224,0 days 00:01:30.685763,sigmoid,0.5,2,0.7,5.364774703979492,,,,COMPLETE
1333,1333,212.3648223876953,2022-12-25 11:13:27.109299,2022-12-25 11:13:43.372423,0 days 00:00:16.263124,relu,0.4,7,0.7,212.3648223876953,,,,PRUNED
1334,1334,123.64671325683594,2022-12-25 11:13:43.472143,2022-12-25 11:13:52.497769,0 days 00:00:09.025626,tanh,0.4,6,0.8,123.64671325683594,,,,PRUNED
1335,1335,23.97599983215332,2022-12-25 11:13:52.588060,2022-12-25 11:14:08.204695,0 days 00:00:15.616635,tanh,0.45,2,0.8,53.72964859008789,23.97599983215332,,,PRUNED
1336,1336,7.19279146194458,2022-12-25 11:14:08.286495,2022-12-25 11:14:44.292842,0 days 00:00:36.006347,sigmoid,0.5,2,0.7,7.19279146194458,,,,PRUNED
