,number,value,datetime_start,datetime_complete,duration,params_activation,params_dropout,params_layers,params_shrink,system_attrs_completed_rung_0,system_attrs_completed_rung_1,system_attrs_completed_rung_2,state
918,918,0.03590942919254303,2023-01-05 23:00:26.654293,2023-01-05 23:00:53.683475,0 days 00:00:27.029182,relu,0.25,2,0.5,0.0800933986902237,0.0503469817340374,0.03590942919254303,PRUNED
919,919,0.07998489588499069,2023-01-05 23:00:53.786562,2023-01-05 23:01:05.431957,0 days 00:00:11.645395,tanh,0.2,2,0.8500000000000001,0.07998489588499069,,,PRUNED
920,920,0.10846730321645737,2023-01-05 23:01:05.540999,2023-01-05 23:01:12.332427,0 days 00:00:06.791428,sigmoid,0.15000000000000002,2,0.55,0.10846730321645737,,,PRUNED
921,921,0.13753391802310944,2023-01-05 23:01:12.424266,2023-01-05 23:01:39.040426,0 days 00:00:26.616160,tanh,0.4,2,0.8500000000000001,0.040810659527778625,0.032178428024053574,,COMPLETE
922,922,0.07018490135669708,2023-01-05 23:01:39.159924,2023-01-05 23:01:50.970166,0 days 00:00:11.810242,tanh,0.4,2,0.8,0.07018490135669708,,,PRUNED
923,923,0.03670526295900345,2023-01-05 23:01:51.073879,2023-01-05 23:02:17.793489,0 days 00:00:26.719610,relu,0.05,2,0.6,0.08500485122203827,0.05165373906493187,0.03670526295900345,PRUNED
924,924,0.1335601657629013,2023-01-05 23:02:17.905896,2023-01-05 23:02:24.575950,0 days 00:00:06.670054,sigmoid,0.2,2,0.5,0.1335601657629013,,,PRUNED
925,925,0.13780352473258972,2023-01-05 23:02:24.677656,2023-01-05 23:02:31.633745,0 days 00:00:06.956089,tanh,0.15000000000000002,2,0.5,0.13780352473258972,,,PRUNED
926,926,0.05841302499175072,2023-01-05 23:02:31.737460,2023-01-05 23:02:43.566174,0 days 00:00:11.828714,relu,0.1,2,0.8500000000000001,0.09725560992956161,0.05841302499175072,,PRUNED
927,927,0.11812777072191238,2023-01-05 23:02:43.660555,2023-01-05 23:02:50.523973,0 days 00:00:06.863418,sigmoid,0.0,2,0.7,0.11812777072191238,,,PRUNED
928,928,0.06057612970471382,2023-01-05 23:02:50.626960,2023-01-05 23:03:02.322101,0 days 00:00:11.695141,relu,0.4,2,0.65,0.08187772333621979,0.06057612970471382,,PRUNED
929,929,0.06933530420064926,2023-01-05 23:03:02.426300,2023-01-05 23:03:14.505735,0 days 00:00:12.079435,sigmoid,0.15000000000000002,2,0.75,0.08244051784276962,0.06933530420064926,,PRUNED
930,930,0.09284067153930664,2023-01-05 23:03:14.728746,2023-01-05 23:03:26.562763,0 days 00:00:11.834017,tanh,0.5,2,0.8500000000000001,0.09284067153930664,,,PRUNED
931,931,0.12210054695606232,2023-01-05 23:03:26.666624,2023-01-05 23:03:33.679568,0 days 00:00:07.012944,tanh,0.05,2,0.5,0.12210054695606232,,,PRUNED
932,932,0.07237853854894638,2023-01-05 23:03:33.792077,2023-01-05 23:03:45.486659,0 days 00:00:11.694582,relu,0.45,2,0.8500000000000001,0.07237853854894638,,,PRUNED
933,933,0.15083126723766327,2023-01-05 23:03:45.590189,2023-01-05 23:03:58.152373,0 days 00:00:12.562184,relu,0.4,8,0.8500000000000001,0.15083126723766327,,,PRUNED
934,934,0.06470136344432831,2023-01-05 23:03:58.273262,2023-01-05 23:04:10.018302,0 days 00:00:11.745040,relu,0.2,2,0.7,0.06470136344432831,,,PRUNED
935,935,0.0802021250128746,2023-01-05 23:04:10.128212,2023-01-05 23:04:21.917232,0 days 00:00:11.789020,relu,0.15000000000000002,2,0.5,0.09785928577184677,0.0802021250128746,,PRUNED
936,936,0.1439434289932251,2023-01-05 23:04:22.020752,2023-01-05 23:04:51.345710,0 days 00:00:29.324958,sigmoid,0.15000000000000002,2,0.8500000000000001,0.031351521611213684,,,COMPLETE
937,937,0.0751105397939682,2023-01-05 23:04:51.460861,2023-01-05 23:05:03.172428,0 days 00:00:11.711567,relu,0.4,2,0.9,0.0751105397939682,,,PRUNED
938,938,0.13853219151496887,2023-01-05 23:05:03.273955,2023-01-05 23:05:10.063580,0 days 00:00:06.789625,sigmoid,0.1,2,0.5,0.13853219151496887,,,PRUNED
939,939,0.0359204076230526,2023-01-05 23:05:10.167108,2023-01-05 23:05:37.119681,0 days 00:00:26.952573,relu,0.0,2,0.8,0.061662714928388596,0.0359204076230526,,PRUNED
940,940,0.03608742728829384,2023-01-05 23:05:37.220695,2023-01-05 23:06:03.934490,0 days 00:00:26.713795,relu,0.45,2,0.65,0.0592602975666523,0.03608742728829384,,PRUNED
941,941,0.08919631689786911,2023-01-05 23:06:04.053729,2023-01-05 23:06:15.633603,0 days 00:00:11.579874,relu,0.2,2,0.8500000000000001,0.08919631689786911,,,PRUNED
942,942,0.11242890357971191,2023-01-05 23:06:15.736120,2023-01-05 23:06:22.509084,0 days 00:00:06.772964,relu,0.25,2,0.55,0.11242890357971191,,,PRUNED
943,943,0.0662946105003357,2023-01-05 23:06:22.619944,2023-01-05 23:06:34.640491,0 days 00:00:12.020547,relu,0.4,2,0.65,0.0662946105003357,,,PRUNED
944,944,0.13459885120391846,2023-01-05 23:06:34.744013,2023-01-05 23:07:03.847451,0 days 00:00:29.103438,sigmoid,0.1,2,0.8500000000000001,0.03391747176647186,,,COMPLETE
945,945,0.1245856061577797,2023-01-05 23:07:03.950806,2023-01-05 23:07:10.637755,0 days 00:00:06.686949,sigmoid,0.15000000000000002,2,0.8,0.1245856061577797,,,PRUNED
946,946,0.03489218279719353,2023-01-05 23:07:10.739913,2023-01-05 23:07:37.619049,0 days 00:00:26.879136,relu,0.1,2,0.5,0.09337897598743439,0.054383888840675354,0.03489218279719353,PRUNED
947,947,0.04303963482379913,2023-01-05 23:07:37.722575,2023-01-05 23:08:04.150365,0 days 00:00:26.427790,sigmoid,0.1,2,0.8500000000000001,0.04303963482379913,,,PRUNED
948,948,0.13029345870018005,2023-01-05 23:08:04.262214,2023-01-05 23:08:11.299814,0 days 00:00:07.037600,tanh,0.2,4,0.55,0.13029345870018005,,,PRUNED
949,949,0.04009231552481651,2023-01-05 23:08:11.405647,2023-01-05 23:08:37.847806,0 days 00:00:26.442159,sigmoid,0.2,2,0.8500000000000001,0.04009231552481651,,,PRUNED
950,950,0.1148189902305603,2023-01-05 23:08:37.968993,2023-01-05 23:08:45.055585,0 days 00:00:07.086592,sigmoid,0.30000000000000004,2,0.5,0.1148189902305603,,,PRUNED
951,951,0.05752567574381828,2023-01-05 23:08:45.166446,2023-01-05 23:08:57.038011,0 days 00:00:11.871565,relu,0.05,2,0.6,0.08920466899871826,0.05752567574381828,,PRUNED
952,952,0.08099016547203064,2023-01-05 23:08:57.133206,2023-01-05 23:09:08.853307,0 days 00:00:11.720101,relu,0.4,2,0.8500000000000001,0.08099016547203064,,,PRUNED
953,953,0.13570396602153778,2023-01-05 23:09:08.965638,2023-01-05 23:09:40.672800,0 days 00:00:31.707162,relu,0.45,2,0.8500000000000001,0.04901731386780739,0.035220008343458176,,COMPLETE
954,954,0.10407431423664093,2023-01-05 23:09:40.781567,2023-01-05 23:09:47.800832,0 days 00:00:07.019265,sigmoid,0.15000000000000002,2,0.5,0.10407431423664093,,,PRUNED
955,955,0.1535792350769043,2023-01-05 23:09:47.913441,2023-01-05 23:10:17.004076,0 days 00:00:29.090635,sigmoid,0.1,2,0.8500000000000001,0.037074267864227295,,,COMPLETE
956,956,0.04280408099293709,2023-01-05 23:10:17.122480,2023-01-05 23:10:43.663258,0 days 00:00:26.540778,relu,0.4,2,0.75,0.05886087194085121,0.04280408099293709,,PRUNED
957,957,0.1330927163362503,2023-01-05 23:10:43.775680,2023-01-05 23:11:15.680297,0 days 00:00:31.904617,sigmoid,0.15000000000000002,2,0.9,0.030780388042330742,,,COMPLETE
958,958,0.14702759683132172,2023-01-05 23:11:15.840644,2023-01-05 23:11:47.552918,0 days 00:00:31.712274,sigmoid,0.15000000000000002,2,0.9,0.035905420780181885,,,COMPLETE
959,959,0.1102343499660492,2023-01-05 23:11:47.670748,2023-01-05 23:11:54.494398,0 days 00:00:06.823650,sigmoid,0.1,2,0.5,0.1102343499660492,,,PRUNED
960,960,0.1035488173365593,2023-01-05 23:11:54.601629,2023-01-05 23:12:06.667464,0 days 00:00:12.065835,relu,0.2,4,0.8500000000000001,0.1035488173365593,,,PRUNED
961,961,0.1309172511100769,2023-01-05 23:12:06.768373,2023-01-05 23:12:13.909588,0 days 00:00:07.141215,relu,0.15000000000000002,3,0.8500000000000001,0.1309172511100769,,,PRUNED
962,962,0.12644033133983612,2023-01-05 23:12:14.025319,2023-01-05 23:12:20.775731,0 days 00:00:06.750412,tanh,0.05,2,0.75,0.12644033133983612,,,PRUNED
963,963,0.06494762748479843,2023-01-05 23:12:20.883417,2023-01-05 23:12:32.632164,0 days 00:00:11.748747,sigmoid,0.4,2,0.7,0.06494762748479843,,,PRUNED
964,964,0.07448849081993103,2023-01-05 23:12:32.730800,2023-01-05 23:12:44.673507,0 days 00:00:11.942707,relu,0.4,2,0.9,0.07448849081993103,,,PRUNED
965,965,0.035301029682159424,2023-01-05 23:12:44.782153,2023-01-05 23:13:11.763034,0 days 00:00:26.980881,sigmoid,0.2,2,0.5,0.08020161837339401,0.05013232305645943,0.035301029682159424,PRUNED
966,966,0.06024688482284546,2023-01-05 23:13:11.880805,2023-01-05 23:13:23.837333,0 days 00:00:11.956528,relu,0.15000000000000002,2,0.7,0.07598190009593964,0.06024688482284546,,PRUNED
967,967,0.1480586677789688,2023-01-05 23:13:23.944237,2023-01-05 23:13:55.512630,0 days 00:00:31.568393,sigmoid,0.15000000000000002,2,0.8500000000000001,0.0359940342605114,,,COMPLETE
968,968,0.03755546733736992,2023-01-05 23:13:55.652453,2023-01-05 23:14:22.540489,0 days 00:00:26.888036,relu,0.2,2,0.8500000000000001,0.0577976368367672,0.03755546733736992,,PRUNED
969,969,0.04359627887606621,2023-01-05 23:14:22.649724,2023-01-05 23:14:49.280125,0 days 00:00:26.630401,sigmoid,0.1,2,0.8500000000000001,0.04359627887606621,,,PRUNED
970,970,0.04013354331254959,2023-01-05 23:14:49.380025,2023-01-05 23:15:15.778139,0 days 00:00:26.398114,sigmoid,0.1,2,0.9,0.04013354331254959,,,PRUNED
971,971,0.1422208696603775,2023-01-05 23:15:15.880020,2023-01-05 23:15:22.570265,0 days 00:00:06.690245,sigmoid,0.05,2,0.5,0.1422208696603775,,,PRUNED
972,972,0.05880114436149597,2023-01-05 23:15:22.687817,2023-01-05 23:15:34.735001,0 days 00:00:12.047184,relu,0.25,2,0.5,0.08261954039335251,0.05880114436149597,,PRUNED
973,973,0.13936491310596466,2023-01-05 23:15:34.844243,2023-01-05 23:15:41.684479,0 days 00:00:06.840236,tanh,0.35000000000000003,2,0.55,0.13936491310596466,,,PRUNED
974,974,0.0742068663239479,2023-01-05 23:15:41.783582,2023-01-05 23:15:53.433584,0 days 00:00:11.650002,tanh,0.4,2,0.8500000000000001,0.0742068663239479,,,PRUNED
975,975,0.13258711993694305,2023-01-05 23:15:53.533487,2023-01-05 23:16:23.152778,0 days 00:00:29.619291,sigmoid,0.15000000000000002,2,0.5,0.06582139432430267,0.0424482487142086,0.03310425952076912,COMPLETE
976,976,0.13807782530784607,2023-01-05 23:16:23.266242,2023-01-05 23:16:52.260226,0 days 00:00:28.993984,sigmoid,0.2,2,0.8500000000000001,0.03450911119580269,,,COMPLETE
977,977,0.062843918800354,2023-01-05 23:16:52.373362,2023-01-05 23:17:04.094891,0 days 00:00:11.721529,relu,0.45,2,0.7,0.062843918800354,,,PRUNED
978,978,0.07222553342580795,2023-01-05 23:17:04.201142,2023-01-05 23:17:16.118975,0 days 00:00:11.917833,sigmoid,0.15000000000000002,2,0.7,0.0775592178106308,0.07222553342580795,,PRUNED
979,979,0.1375599056482315,2023-01-05 23:17:16.234604,2023-01-05 23:17:23.293439,0 days 00:00:07.058835,sigmoid,0.15000000000000002,2,0.8,0.1375599056482315,,,PRUNED
980,980,0.04075966030359268,2023-01-05 23:17:23.392132,2023-01-05 23:17:50.033583,0 days 00:00:26.641451,sigmoid,0.15000000000000002,2,0.8500000000000001,0.04075966030359268,,,PRUNED
981,981,0.041698355227708817,2023-01-05 23:17:50.141299,2023-01-05 23:18:16.797701,0 days 00:00:26.656402,relu,0.15000000000000002,2,0.7,0.041698355227708817,,,PRUNED
982,982,0.039480146020650864,2023-01-05 23:18:16.916329,2023-01-05 23:18:43.703992,0 days 00:00:26.787663,sigmoid,0.1,2,0.8500000000000001,0.039480146020650864,,,PRUNED
983,983,0.0402783527970314,2023-01-05 23:18:43.803133,2023-01-05 23:19:10.226977,0 days 00:00:26.423844,relu,0.25,2,0.8,0.053683217614889145,0.0402783527970314,,PRUNED
984,984,0.08159277588129044,2023-01-05 23:19:10.337128,2023-01-05 23:19:22.067129,0 days 00:00:11.730001,relu,0.4,2,0.8500000000000001,0.08159277588129044,,,PRUNED
985,985,0.07420969009399414,2023-01-05 23:19:22.177980,2023-01-05 23:19:33.983619,0 days 00:00:11.805639,relu,0.2,3,0.8500000000000001,0.07420969009399414,,,PRUNED
986,986,0.09999745339155197,2023-01-05 23:19:34.092744,2023-01-05 23:19:41.057967,0 days 00:00:06.965223,sigmoid,0.15000000000000002,2,0.8,0.09999745339155197,,,PRUNED
987,987,0.11260634660720825,2023-01-05 23:19:41.168203,2023-01-05 23:19:47.857447,0 days 00:00:06.689244,sigmoid,0.15000000000000002,2,0.65,0.11260634660720825,,,PRUNED
988,988,0.06737255305051804,2023-01-05 23:19:47.957352,2023-01-05 23:19:59.764880,0 days 00:00:11.807528,relu,0.4,2,0.7,0.06737255305051804,,,PRUNED
989,989,0.10595732182264328,2023-01-05 23:19:59.874121,2023-01-05 23:20:06.739948,0 days 00:00:06.865827,sigmoid,0.15000000000000002,2,0.5,0.10595732182264328,,,PRUNED
990,990,0.04162159189581871,2023-01-05 23:20:06.855596,2023-01-05 23:20:33.329003,0 days 00:00:26.473407,sigmoid,0.0,2,0.95,0.04162159189581871,,,PRUNED
991,991,0.04325728490948677,2023-01-05 23:20:33.429908,2023-01-05 23:21:00.010634,0 days 00:00:26.580726,relu,0.30000000000000004,2,0.8500000000000001,0.05756673216819763,0.04325728490948677,,PRUNED
992,992,0.13540513813495636,2023-01-05 23:21:00.117731,2023-01-05 23:21:06.894115,0 days 00:00:06.776384,sigmoid,0.15000000000000002,2,0.8500000000000001,0.13540513813495636,,,PRUNED
993,993,0.1305490881204605,2023-01-05 23:21:06.992116,2023-01-05 23:21:39.094457,0 days 00:00:32.102341,sigmoid,0.15000000000000002,2,0.5,0.06933832913637161,0.04573298990726471,0.03198862448334694,COMPLETE
994,994,0.07157626748085022,2023-01-05 23:21:39.229581,2023-01-05 23:21:51.081673,0 days 00:00:11.852092,sigmoid,0.2,2,0.5,0.07153453677892685,0.07157626748085022,,PRUNED
995,995,0.12689273059368134,2023-01-05 23:21:51.190664,2023-01-05 23:21:57.990233,0 days 00:00:06.799569,sigmoid,0.15000000000000002,2,0.5,0.12689273059368134,,,PRUNED
996,996,0.0782841145992279,2023-01-05 23:21:58.090137,2023-01-05 23:22:09.805008,0 days 00:00:11.714871,relu,0.25,2,0.8500000000000001,0.0782841145992279,,,PRUNED
997,997,0.12693873047828674,2023-01-05 23:22:09.906909,2023-01-05 23:22:17.004464,0 days 00:00:07.097555,sigmoid,0.15000000000000002,2,0.5,0.12693873047828674,,,PRUNED
998,998,0.03902153670787811,2023-01-05 23:22:17.096045,2023-01-05 23:22:43.460787,0 days 00:00:26.364742,sigmoid,0.2,2,0.95,0.03902153670787811,,,PRUNED
999,999,0.03859029710292816,2023-01-05 23:22:43.561682,2023-01-05 23:23:10.100428,0 days 00:00:26.538746,sigmoid,0.05,2,0.9,0.03859029710292816,,,PRUNED
1000,1000,0.12583419680595398,2023-01-05 23:23:10.200652,2023-01-05 23:23:47.196486,0 days 00:00:36.995834,relu,0.4,2,0.65,0.041369955986738205,0.03186459094285965,,COMPLETE
1001,1001,0.11908341944217682,2023-01-05 23:23:47.315417,2023-01-05 23:23:54.039425,0 days 00:00:06.724008,sigmoid,0.1,2,0.5,0.11908341944217682,,,PRUNED
1002,1002,0.12707750499248505,2023-01-05 23:23:54.147667,2023-01-05 23:24:00.971562,0 days 00:00:06.823895,sigmoid,0.15000000000000002,2,0.5,0.12707750499248505,,,PRUNED
1003,1003,0.03622377663850784,2023-01-05 23:24:01.080708,2023-01-05 23:24:27.869518,0 days 00:00:26.788810,tanh,0.15000000000000002,2,0.75,0.08258199691772461,0.05345974862575531,0.03622377663850784,PRUNED
1004,1004,0.0443822480738163,2023-01-05 23:24:27.979756,2023-01-05 23:24:55.050947,0 days 00:00:27.071191,relu,0.4,2,0.65,0.058330949395895004,0.0443822480738163,,PRUNED
1005,1005,0.06964968144893646,2023-01-05 23:24:55.160025,2023-01-05 23:25:06.849893,0 days 00:00:11.689868,relu,0.2,2,0.7,0.06964968144893646,,,PRUNED
1006,1006,0.04009748995304108,2023-01-05 23:25:06.958767,2023-01-05 23:25:33.564534,0 days 00:00:26.605767,relu,0.4,2,0.65,0.05416687950491905,0.04009748995304108,,PRUNED
1007,1007,0.07767931371927261,2023-01-05 23:25:33.672769,2023-01-05 23:25:45.330298,0 days 00:00:11.657529,relu,0.4,2,0.65,0.07767931371927261,,,PRUNED
1008,1008,0.03761979937553406,2023-01-05 23:25:45.440539,2023-01-05 23:26:12.178051,0 days 00:00:26.737512,sigmoid,0.0,2,0.8500000000000001,0.03761979937553406,,,PRUNED
1009,1009,0.09911959618330002,2023-01-05 23:26:12.286500,2023-01-05 23:26:19.078746,0 days 00:00:06.792246,sigmoid,0.1,2,0.9,0.09911959618330002,,,PRUNED
1010,1010,0.12903577089309692,2023-01-05 23:26:19.178642,2023-01-05 23:26:25.903222,0 days 00:00:06.724580,sigmoid,0.2,2,0.5,0.12903577089309692,,,PRUNED
1011,1011,0.0384683795273304,2023-01-05 23:26:26.018504,2023-01-05 23:26:52.841858,0 days 00:00:26.823354,sigmoid,0.25,2,0.8,0.0384683795273304,,,PRUNED
1012,1012,0.13167783617973328,2023-01-05 23:26:52.950091,2023-01-05 23:26:59.799648,0 days 00:00:06.849557,sigmoid,0.25,2,0.5,0.13167783617973328,,,PRUNED
1013,1013,0.12901583313941956,2023-01-05 23:26:59.900553,2023-01-05 23:27:06.674884,0 days 00:00:06.774331,tanh,0.15000000000000002,2,0.5,0.12901583313941956,,,PRUNED
1014,1014,0.1519942283630371,2023-01-05 23:27:06.781536,2023-01-05 23:27:35.993216,0 days 00:00:29.211680,sigmoid,0.1,2,1.0,0.03652816638350487,,,COMPLETE
1015,1015,0.03840276598930359,2023-01-05 23:27:36.115857,2023-01-05 23:28:02.828196,0 days 00:00:26.712339,sigmoid,0.0,2,0.8500000000000001,0.03840276598930359,,,PRUNED
1016,1016,0.1300555020570755,2023-01-05 23:28:02.937428,2023-01-05 23:28:09.662000,0 days 00:00:06.724572,sigmoid,0.15000000000000002,2,0.5,0.1300555020570755,,,PRUNED
1017,1017,0.039940252900123596,2023-01-05 23:28:09.770242,2023-01-05 23:28:36.533965,0 days 00:00:26.763723,tanh,0.45,2,0.65,0.059973981231451035,0.039940252900123596,,PRUNED
1018,1018,0.10137289762496948,2023-01-05 23:28:36.643200,2023-01-05 23:28:43.417781,0 days 00:00:06.774581,sigmoid,0.1,2,0.5,0.10137289762496948,,,PRUNED
1019,1019,0.03937801346182823,2023-01-05 23:28:43.543764,2023-01-05 23:29:10.606373,0 days 00:00:27.062609,relu,0.2,2,0.65,0.058157049119472504,0.03937801346182823,,PRUNED
1020,1020,0.06367120891809464,2023-01-05 23:29:10.708283,2023-01-05 23:29:22.730451,0 days 00:00:12.022168,tanh,0.15000000000000002,2,0.5,0.07723813503980637,0.06367120891809464,,PRUNED
1021,1021,0.03481694683432579,2023-01-05 23:29:22.831548,2023-01-05 23:29:49.686743,0 days 00:00:26.855195,sigmoid,0.15000000000000002,2,0.5,0.08421698212623596,0.052735939621925354,0.03481694683432579,PRUNED
1022,1022,0.03811969980597496,2023-01-05 23:29:49.796986,2023-01-05 23:30:16.724242,0 days 00:00:26.927256,sigmoid,0.0,2,0.9,0.03811969980597496,,,PRUNED
1023,1023,0.1336013227701187,2023-01-05 23:30:16.828261,2023-01-05 23:30:23.607981,0 days 00:00:06.779720,sigmoid,0.45,2,0.75,0.1336013227701187,,,PRUNED
1024,1024,0.04664239659905434,2023-01-05 23:30:23.710011,2023-01-05 23:30:50.338287,0 days 00:00:26.628276,sigmoid,0.0,2,0.8500000000000001,0.04664239659905434,,,PRUNED
1025,1025,0.12964016199111938,2023-01-05 23:30:50.450712,2023-01-05 23:31:22.663891,0 days 00:00:32.213179,sigmoid,0.2,2,0.5,0.07709870487451553,0.04307126626372337,0.03142235800623894,COMPLETE
1026,1026,0.03761139512062073,2023-01-05 23:31:22.772923,2023-01-05 23:31:49.675436,0 days 00:00:26.902513,relu,0.4,2,0.7,0.05723036453127861,0.03761139512062073,,PRUNED
1027,1027,0.13052213191986084,2023-01-05 23:31:49.787867,2023-01-05 23:32:21.678079,0 days 00:00:31.890212,tanh,0.2,2,0.5,0.0554940439760685,0.04522666707634926,0.03140808269381523,COMPLETE
1028,1028,0.06888698786497116,2023-01-05 23:32:21.804116,2023-01-05 23:32:33.612574,0 days 00:00:11.808458,relu,0.25,2,0.65,0.06888698786497116,,,PRUNED
1029,1029,0.07544296979904175,2023-01-05 23:32:33.707716,2023-01-05 23:32:45.711833,0 days 00:00:12.004117,relu,0.45,2,0.9,0.07544296979904175,,,PRUNED
1030,1030,0.06188655272126198,2023-01-05 23:32:45.823858,2023-01-05 23:32:57.671239,0 days 00:00:11.847381,sigmoid,0.2,2,0.5,0.07068950682878494,0.06188655272126198,,PRUNED
1031,1031,0.07889290899038315,2023-01-05 23:32:57.801366,2023-01-05 23:33:09.485117,0 days 00:00:11.683751,relu,0.4,2,0.8,0.07889290899038315,,,PRUNED
1032,1032,0.055765874683856964,2023-01-05 23:33:09.604798,2023-01-05 23:33:21.358956,0 days 00:00:11.754158,tanh,0.2,2,0.5,0.0731605514883995,0.055765874683856964,,PRUNED
1033,1033,0.04493860900402069,2023-01-05 23:33:21.463231,2023-01-05 23:33:48.315243,0 days 00:00:26.852012,sigmoid,0.05,2,0.8,0.04493860900402069,,,PRUNED
1034,1034,0.03543764725327492,2023-01-05 23:33:48.428857,2023-01-05 23:34:15.496512,0 days 00:00:27.067655,relu,0.2,3,0.5,0.06704545766115189,0.043932560831308365,0.03543764725327492,PRUNED
1035,1035,0.10115496814250946,2023-01-05 23:34:15.626447,2023-01-05 23:34:22.305061,0 days 00:00:06.678614,sigmoid,0.2,2,0.5,0.10115496814250946,,,PRUNED
1036,1036,0.11941796541213989,2023-01-05 23:34:22.414601,2023-01-05 23:34:29.137568,0 days 00:00:06.722967,relu,0.2,2,0.95,0.11941796541213989,,,PRUNED
1037,1037,0.10079968720674515,2023-01-05 23:34:29.266079,2023-01-05 23:34:36.328259,0 days 00:00:07.062180,sigmoid,0.2,2,0.5,0.10079968720674515,,,PRUNED
1038,1038,0.04014436900615692,2023-01-05 23:34:36.433199,2023-01-05 23:35:03.192885,0 days 00:00:26.759686,tanh,0.25,2,0.5,0.09059340506792068,0.053408555686473846,0.04014436900615692,PRUNED
1039,1039,0.07310410588979721,2023-01-05 23:35:03.314493,2023-01-05 23:35:15.142081,0 days 00:00:11.827588,relu,0.30000000000000004,2,0.75,0.07310410588979721,,,PRUNED
1040,1040,0.06592374294996262,2023-01-05 23:35:15.263587,2023-01-05 23:35:27.282724,0 days 00:00:12.019137,sigmoid,0.2,2,0.6,0.06592374294996262,,,PRUNED
1041,1041,0.03812745586037636,2023-01-05 23:35:27.404326,2023-01-05 23:35:54.039026,0 days 00:00:26.634700,sigmoid,0.0,2,0.65,0.03812745586037636,,,PRUNED
1042,1042,0.11658956110477448,2023-01-05 23:35:54.150299,2023-01-05 23:36:01.247552,0 days 00:00:07.097253,sigmoid,0.25,5,0.5,0.11658956110477448,,,PRUNED
1043,1043,0.03898259252309799,2023-01-05 23:36:01.366417,2023-01-05 23:36:28.194492,0 days 00:00:26.828075,sigmoid,0.0,2,0.55,0.03898259252309799,,,PRUNED
1044,1044,0.12319734692573547,2023-01-05 23:36:28.316373,2023-01-05 23:36:35.186898,0 days 00:00:06.870525,relu,0.2,2,0.5,0.12319734692573547,,,PRUNED
1045,1045,0.13241827487945557,2023-01-05 23:36:35.307505,2023-01-05 23:36:42.185777,0 days 00:00:06.878272,sigmoid,0.2,2,0.5,0.13241827487945557,,,PRUNED
1046,1046,0.04059480503201485,2023-01-05 23:36:42.297638,2023-01-05 23:37:08.874997,0 days 00:00:26.577359,relu,0.4,2,0.7,0.06044081225991249,0.04059480503201485,,PRUNED
