,number,value,datetime_start,datetime_complete,duration,params_activation,params_dropout,params_layers,params_shrink,system_attrs_completed_rung_0,system_attrs_completed_rung_1,system_attrs_completed_rung_2,state
2996,2996,0.13165776431560516,2023-01-06 08:13:10.519540,2023-01-06 08:13:17.398963,0 days 00:00:06.879423,sigmoid,0.25,2,0.5,0.13165776431560516,,,PRUNED
2997,2997,0.05655049905180931,2023-01-06 08:13:17.517628,2023-01-06 08:13:29.672653,0 days 00:00:12.155025,tanh,0.30000000000000004,2,0.55,0.07923141866922379,0.05655049905180931,,PRUNED
2998,2998,0.14455683529376984,2023-01-06 08:13:29.802208,2023-01-06 08:13:56.797366,0 days 00:00:26.995158,sigmoid,0.2,2,0.5,0.06687135249376297,0.04573061689734459,0.03157999739050865,COMPLETE
2999,2999,0.06666795909404755,2023-01-06 08:13:56.915138,2023-01-06 08:14:08.966142,0 days 00:00:12.051004,tanh,0.35000000000000003,2,0.7,0.06666795909404755,,,PRUNED
3000,3000,0.0644591897726059,2023-01-06 08:14:09.128348,2023-01-06 08:14:21.102022,0 days 00:00:11.973674,tanh,0.45,2,0.7,0.0644591897726059,,,PRUNED
3001,3001,0.03821859508752823,2023-01-06 08:14:21.227385,2023-01-06 08:14:47.991611,0 days 00:00:26.764226,relu,0.0,2,0.8500000000000001,0.03821859508752823,,,PRUNED
3002,3002,0.04088481143116951,2023-01-06 08:14:48.099304,2023-01-06 08:15:14.980194,0 days 00:00:26.880890,sigmoid,0.15000000000000002,2,0.9,0.04088481143116951,,,PRUNED
3003,3003,0.27067831158638,2023-01-06 08:15:15.098578,2023-01-06 08:15:34.918215,0 days 00:00:19.819637,sigmoid,0.1,6,0.8500000000000001,,,,COMPLETE
3004,3004,0.07215476036071777,2023-01-06 08:15:35.042327,2023-01-06 08:15:46.912077,0 days 00:00:11.869750,sigmoid,0.15000000000000002,2,0.8500000000000001,0.07215476036071777,,,PRUNED
3005,3005,0.12247133255004883,2023-01-06 08:15:47.104822,2023-01-06 08:15:54.245424,0 days 00:00:07.140602,sigmoid,0.25,2,0.5,0.12247133255004883,,,PRUNED
3006,3006,0.06021610274910927,2023-01-06 08:15:54.355281,2023-01-06 08:16:06.343906,0 days 00:00:11.988625,sigmoid,0.1,2,0.5,0.07777857780456543,0.06021610274910927,,PRUNED
3007,3007,0.06119619309902191,2023-01-06 08:16:06.453077,2023-01-06 08:16:18.659628,0 days 00:00:12.206551,tanh,0.05,2,0.6,0.07975512742996216,0.06119619309902191,,PRUNED
3008,3008,0.04093295335769653,2023-01-06 08:16:18.768317,2023-01-06 08:16:45.357540,0 days 00:00:26.589223,sigmoid,0.35000000000000003,2,0.8500000000000001,0.04093295335769653,,,PRUNED
