,number,value,datetime_start,datetime_complete,duration,params_activation,params_dropout,params_layers,params_shrink,system_attrs_completed_rung_0,system_attrs_completed_rung_1,system_attrs_completed_rung_2,state
1822,1822,0.07394814491271973,2023-01-06 03:06:59.868476,2023-01-06 03:07:11.820547,0 days 00:00:11.952071,sigmoid,0.0,2,0.5,0.09351252019405365,0.07394814491271973,,PRUNED
1823,1823,0.11794641613960266,2023-01-06 03:07:11.941553,2023-01-06 03:07:18.953453,0 days 00:00:07.011900,sigmoid,0.0,2,0.5,0.11794641613960266,,,PRUNED
1824,1824,0.1163395568728447,2023-01-06 03:07:19.076347,2023-01-06 03:07:25.952791,0 days 00:00:06.876444,sigmoid,0.0,2,0.5,0.1163395568728447,,,PRUNED
1825,1825,0.06196834146976471,2023-01-06 03:07:26.072811,2023-01-06 03:07:38.043277,0 days 00:00:11.970466,sigmoid,0.0,2,0.5,0.07993584871292114,0.06196834146976471,,PRUNED
1826,1826,0.04448341578245163,2023-01-06 03:07:38.147893,2023-01-06 03:08:04.932172,0 days 00:00:26.784279,sigmoid,0.2,3,0.9,0.04448341578245163,,,PRUNED
1827,1827,0.1250901222229004,2023-01-06 03:08:05.037273,2023-01-06 03:08:42.142506,0 days 00:00:37.105233,relu,0.2,2,0.7,0.04202837124466896,0.031194917857646942,,COMPLETE
1828,1828,0.03555358201265335,2023-01-06 03:08:42.271634,2023-01-06 03:09:09.019943,0 days 00:00:26.748309,relu,0.2,2,0.7,0.05187887325882912,0.03555358201265335,,PRUNED
1829,1829,0.10901909321546555,2023-01-06 03:09:09.135638,2023-01-06 03:09:16.069406,0 days 00:00:06.933768,sigmoid,0.0,3,0.9,0.10901909321546555,,,PRUNED
1830,1830,0.14710499346256256,2023-01-06 03:09:16.354247,2023-01-06 03:09:45.646008,0 days 00:00:29.291761,tanh,0.05,2,0.8500000000000001,0.03425861895084381,,,COMPLETE
1831,1831,0.04102249816060066,2023-01-06 03:09:45.775186,2023-01-06 03:10:12.372475,0 days 00:00:26.597289,sigmoid,0.0,2,0.8,0.04102249816060066,,,PRUNED
1832,1832,0.03854715824127197,2023-01-06 03:10:12.494484,2023-01-06 03:10:39.387069,0 days 00:00:26.892585,relu,0.2,2,0.7,0.058856260031461716,0.03854715824127197,,PRUNED
1833,1833,0.05851348116993904,2023-01-06 03:10:39.499759,2023-01-06 03:10:51.737133,0 days 00:00:12.237374,sigmoid,0.0,2,0.55,0.06309117376804352,0.05851348116993904,,PRUNED
1834,1834,0.10452412813901901,2023-01-06 03:10:51.841486,2023-01-06 03:10:58.836587,0 days 00:00:06.995101,sigmoid,0.0,2,0.5,0.10452412813901901,,,PRUNED
1835,1835,0.03652011603116989,2023-01-06 03:10:58.949475,2023-01-06 03:11:25.825206,0 days 00:00:26.875731,relu,0.2,2,0.7,0.058230798691511154,0.03652011603116989,,PRUNED
1836,1836,0.11093711853027344,2023-01-06 03:11:25.937308,2023-01-06 03:11:33.017423,0 days 00:00:07.080115,sigmoid,0.0,2,0.5,0.11093711853027344,,,PRUNED
1837,1837,0.1202852800488472,2023-01-06 03:11:33.121232,2023-01-06 03:11:40.008460,0 days 00:00:06.887228,sigmoid,0.0,2,0.5,0.1202852800488472,,,PRUNED
1838,1838,0.140872523188591,2023-01-06 03:11:40.138615,2023-01-06 03:11:47.108919,0 days 00:00:06.970304,sigmoid,0.0,2,0.55,0.140872523188591,,,PRUNED
1839,1839,0.062153711915016174,2023-01-06 03:11:47.212534,2023-01-06 03:11:59.289322,0 days 00:00:12.076788,relu,0.2,2,0.7,0.062153711915016174,,,PRUNED
1840,1840,0.07056860625743866,2023-01-06 03:11:59.413563,2023-01-06 03:12:11.239416,0 days 00:00:11.825853,relu,0.2,2,0.7,0.07056860625743866,,,PRUNED
1841,1841,0.0799369215965271,2023-01-06 03:12:11.345771,2023-01-06 03:12:23.271048,0 days 00:00:11.925277,relu,0.2,2,0.7,0.0799369215965271,,,PRUNED
1842,1842,0.03598018363118172,2023-01-06 03:12:23.377679,2023-01-06 03:12:50.452099,0 days 00:00:27.074420,relu,0.2,2,0.75,0.05772491544485092,0.03598018363118172,,PRUNED
1843,1843,0.10778515785932541,2023-01-06 03:12:50.577118,2023-01-06 03:12:57.477561,0 days 00:00:06.900443,sigmoid,0.0,2,0.5,0.10778515785932541,,,PRUNED
1844,1844,0.11315949261188507,2023-01-06 03:12:57.582921,2023-01-06 03:13:04.485364,0 days 00:00:06.902443,tanh,0.30000000000000004,2,0.5,0.11315949261188507,,,PRUNED
1845,1845,0.06009678542613983,2023-01-06 03:13:04.607388,2023-01-06 03:13:16.950803,0 days 00:00:12.343415,sigmoid,0.0,4,0.5,0.08718884736299515,0.06009678542613983,,PRUNED
1846,1846,0.06185879185795784,2023-01-06 03:13:17.072100,2023-01-06 03:13:28.907443,0 days 00:00:11.835343,relu,0.2,2,0.7,0.06185879185795784,,,PRUNED
1847,1847,0.1259390115737915,2023-01-06 03:13:29.012538,2023-01-06 03:13:36.150615,0 days 00:00:07.138077,sigmoid,0.05,2,0.5,0.1259390115737915,,,PRUNED
1848,1848,0.038270991295576096,2023-01-06 03:13:36.263310,2023-01-06 03:14:03.080035,0 days 00:00:26.816725,sigmoid,0.0,2,0.7,0.038270991295576096,,,PRUNED
1849,1849,0.1266891360282898,2023-01-06 03:14:03.199920,2023-01-06 03:14:10.138693,0 days 00:00:06.938773,tanh,0.0,2,0.55,0.1266891360282898,,,PRUNED
1850,1850,0.06365357339382172,2023-01-06 03:14:10.250383,2023-01-06 03:14:22.204302,0 days 00:00:11.953919,sigmoid,0.0,2,0.5,0.09426431357860565,0.06365357339382172,,PRUNED
1851,1851,0.06943202018737793,2023-01-06 03:14:22.345240,2023-01-06 03:14:34.394176,0 days 00:00:12.048936,tanh,0.2,2,0.7,0.06943202018737793,,,PRUNED
1852,1852,0.13226772844791412,2023-01-06 03:14:34.506744,2023-01-06 03:14:41.477969,0 days 00:00:06.971225,sigmoid,0.0,2,0.95,0.13226772844791412,,,PRUNED
1853,1853,0.09731773287057877,2023-01-06 03:14:41.582207,2023-01-06 03:14:48.485772,0 days 00:00:06.903565,sigmoid,0.0,2,0.5,0.09731773287057877,,,PRUNED
1854,1854,0.1421903520822525,2023-01-06 03:14:48.589005,2023-01-06 03:14:55.660222,0 days 00:00:07.071217,tanh,0.0,2,0.5,0.1421903520822525,,,PRUNED
1855,1855,0.14236792922019958,2023-01-06 03:14:55.772795,2023-01-06 03:15:02.926338,0 days 00:00:07.153543,sigmoid,0.0,5,0.8,0.14236792922019958,,,PRUNED
1856,1856,0.12891404330730438,2023-01-06 03:15:03.021236,2023-01-06 03:15:09.917468,0 days 00:00:06.896232,sigmoid,0.0,2,0.5,0.12891404330730438,,,PRUNED
1857,1857,0.07420924305915833,2023-01-06 03:15:10.032034,2023-01-06 03:15:21.748889,0 days 00:00:11.716855,relu,0.15000000000000002,2,0.8,0.07420924305915833,,,PRUNED
1858,1858,0.07673830538988113,2023-01-06 03:15:21.874875,2023-01-06 03:15:33.757434,0 days 00:00:11.882559,relu,0.25,2,0.75,0.07673830538988113,,,PRUNED
1859,1859,0.07203560322523117,2023-01-06 03:15:33.860580,2023-01-06 03:15:45.580407,0 days 00:00:11.719827,sigmoid,0.30000000000000004,2,0.65,0.07203560322523117,,,PRUNED
1860,1860,0.08810609579086304,2023-01-06 03:15:45.685644,2023-01-06 03:15:57.687818,0 days 00:00:12.002174,relu,0.2,2,0.8500000000000001,0.08810609579086304,,,PRUNED
1861,1861,0.12923836708068848,2023-01-06 03:15:57.803511,2023-01-06 03:16:04.729948,0 days 00:00:06.926437,sigmoid,0.0,2,0.55,0.12923836708068848,,,PRUNED
1862,1862,0.13681553304195404,2023-01-06 03:16:04.843521,2023-01-06 03:16:11.704414,0 days 00:00:06.860893,tanh,0.0,2,0.5,0.13681553304195404,,,PRUNED
1863,1863,0.10323743522167206,2023-01-06 03:16:11.817985,2023-01-06 03:16:18.820539,0 days 00:00:07.002554,sigmoid,0.0,2,0.5,0.10323743522167206,,,PRUNED
1864,1864,0.054952509701251984,2023-01-06 03:16:18.933108,2023-01-06 03:16:30.886281,0 days 00:00:11.953173,sigmoid,0.0,2,0.5,0.07166734337806702,0.054952509701251984,,PRUNED
1865,1865,0.11866392195224762,2023-01-06 03:16:30.997873,2023-01-06 03:16:37.785755,0 days 00:00:06.787882,tanh,0.25,2,0.5,0.11866392195224762,,,PRUNED
1866,1866,0.04205220565199852,2023-01-06 03:16:38.060147,2023-01-06 03:17:04.800099,0 days 00:00:26.739952,sigmoid,0.0,2,0.6,0.04205220565199852,,,PRUNED
1867,1867,0.13788461685180664,2023-01-06 03:17:04.905283,2023-01-06 03:17:34.441604,0 days 00:00:29.536321,relu,0.25,2,0.7,0.054144591093063354,0.03372466191649437,,COMPLETE
1868,1868,0.11541616171598434,2023-01-06 03:17:34.579514,2023-01-06 03:17:41.655875,0 days 00:00:07.076361,sigmoid,0.25,2,0.5,0.11541616171598434,,,PRUNED
1869,1869,0.04186711460351944,2023-01-06 03:17:41.777785,2023-01-06 03:18:08.519497,0 days 00:00:26.741712,tanh,0.05,2,0.8500000000000001,0.04186711460351944,,,PRUNED
1870,1870,0.10245800763368607,2023-01-06 03:18:08.627712,2023-01-06 03:18:15.536632,0 days 00:00:06.908920,sigmoid,0.0,2,0.5,0.10245800763368607,,,PRUNED
1871,1871,0.0376921184360981,2023-01-06 03:18:15.648201,2023-01-06 03:18:42.517384,0 days 00:00:26.869183,sigmoid,0.0,2,0.5,0.07506866008043289,0.04987763613462448,0.0376921184360981,PRUNED
1872,1872,0.12333063036203384,2023-01-06 03:18:42.621139,2023-01-06 03:18:49.750684,0 days 00:00:07.129545,tanh,0.2,2,0.55,0.12333063036203384,,,PRUNED
1873,1873,0.06389636546373367,2023-01-06 03:18:49.865509,2023-01-06 03:19:02.024267,0 days 00:00:12.158758,sigmoid,0.05,2,0.5,0.06850137561559677,0.06389636546373367,,PRUNED
1874,1874,0.03758033737540245,2023-01-06 03:19:02.135318,2023-01-06 03:19:28.805036,0 days 00:00:26.669718,relu,0.35000000000000003,2,0.8500000000000001,0.053835179656744,0.03758033737540245,,PRUNED
1875,1875,0.04111574962735176,2023-01-06 03:19:29.103855,2023-01-06 03:19:55.794765,0 days 00:00:26.690910,relu,0.0,2,0.8500000000000001,0.04111574962735176,,,PRUNED
1876,1876,0.08494795858860016,2023-01-06 03:19:55.924400,2023-01-06 03:20:07.636410,0 days 00:00:11.712010,relu,0.15000000000000002,2,0.75,0.08494795858860016,,,PRUNED
1877,1877,0.15280936658382416,2023-01-06 03:20:07.740646,2023-01-06 03:20:34.352839,0 days 00:00:26.612193,sigmoid,0.0,2,0.9,0.03425949066877365,,,COMPLETE
1878,1878,0.10987449437379837,2023-01-06 03:20:34.467287,2023-01-06 03:20:41.550492,0 days 00:00:07.083205,sigmoid,0.25,2,0.5,0.10987449437379837,,,PRUNED
1879,1879,0.03729742392897606,2023-01-06 03:20:41.669411,2023-01-06 03:21:08.224828,0 days 00:00:26.555417,sigmoid,0.05,2,0.65,0.03729742392897606,,,PRUNED
1880,1880,0.2298649400472641,2023-01-06 03:21:08.337026,2023-01-06 03:21:27.941466,0 days 00:00:19.604440,sigmoid,0.0,4,0.8500000000000001,,,,COMPLETE
1881,1881,0.1305362433195114,2023-01-06 03:21:28.265038,2023-01-06 03:21:35.171400,0 days 00:00:06.906362,sigmoid,0.05,2,0.8500000000000001,0.1305362433195114,,,PRUNED
1882,1882,0.12692338228225708,2023-01-06 03:21:35.283744,2023-01-06 03:21:42.329189,0 days 00:00:07.045445,tanh,0.0,3,0.5,0.12692338228225708,,,PRUNED
1883,1883,0.04209665209054947,2023-01-06 03:21:42.451091,2023-01-06 03:22:09.426123,0 days 00:00:26.975032,relu,0.45,2,0.7,0.056674811989068985,0.04209665209054947,,PRUNED
1884,1884,0.04004118591547012,2023-01-06 03:22:09.530319,2023-01-06 03:22:36.132417,0 days 00:00:26.602098,tanh,0.05,2,0.8,0.04004118591547012,,,PRUNED
1885,1885,0.10886849462985992,2023-01-06 03:22:36.255326,2023-01-06 03:22:43.157888,0 days 00:00:06.902562,sigmoid,0.2,2,0.55,0.10886849462985992,,,PRUNED
1886,1886,0.05738666653633118,2023-01-06 03:22:43.272460,2023-01-06 03:22:55.240300,0 days 00:00:11.967840,sigmoid,0.25,2,0.5,0.09007132798433304,0.05738666653633118,,PRUNED
1887,1887,0.061600297689437866,2023-01-06 03:22:55.362201,2023-01-06 03:23:07.639175,0 days 00:00:12.276974,tanh,0.35000000000000003,2,0.5,0.07561250776052475,0.061600297689437866,,PRUNED
1888,1888,0.06606423109769821,2023-01-06 03:23:07.770484,2023-01-06 03:23:19.588398,0 days 00:00:11.817914,relu,0.2,2,0.8500000000000001,0.06606423109769821,,,PRUNED
1889,1889,0.05811205878853798,2023-01-06 03:23:19.700014,2023-01-06 03:23:31.845816,0 days 00:00:12.145802,sigmoid,0.5,2,0.5,0.08913760632276535,0.05811205878853798,,PRUNED
1890,1890,0.15156884491443634,2023-01-06 03:23:31.953083,2023-01-06 03:23:38.919293,0 days 00:00:06.966210,sigmoid,0.4,2,0.5,0.15156884491443634,,,PRUNED
1891,1891,0.0670667514204979,2023-01-06 03:23:39.023396,2023-01-06 03:23:51.119370,0 days 00:00:12.095974,relu,0.30000000000000004,3,0.65,0.0670667514204979,,,PRUNED
1892,1892,0.057596344500780106,2023-01-06 03:23:51.234361,2023-01-06 03:24:03.234526,0 days 00:00:12.000165,sigmoid,0.30000000000000004,2,0.8,0.09509987384080887,0.057596344500780106,,PRUNED
1893,1893,0.09741496294736862,2023-01-06 03:24:03.357021,2023-01-06 03:24:10.484561,0 days 00:00:07.127540,tanh,0.05,2,0.5,0.09741496294736862,,,PRUNED
1894,1894,0.06642358750104904,2023-01-06 03:24:10.599154,2023-01-06 03:24:22.416985,0 days 00:00:11.817831,relu,0.25,2,0.7,0.06642358750104904,,,PRUNED
1895,1895,0.1258636713027954,2023-01-06 03:24:22.530557,2023-01-06 03:24:29.658095,0 days 00:00:07.127538,sigmoid,0.2,2,0.5,0.1258636713027954,,,PRUNED
1896,1896,0.12856774032115936,2023-01-06 03:24:29.772070,2023-01-06 03:25:04.093278,0 days 00:00:34.321208,relu,0.2,2,0.8500000000000001,0.04189670830965042,0.03282955661416054,,COMPLETE
1897,1897,0.07789654284715652,2023-01-06 03:25:04.239384,2023-01-06 03:25:15.953567,0 days 00:00:11.714183,relu,0.2,2,0.8500000000000001,0.07789654284715652,,,PRUNED
1898,1898,0.042114682495594025,2023-01-06 03:25:16.087554,2023-01-06 03:25:42.701524,0 days 00:00:26.613970,sigmoid,0.45,2,0.8500000000000001,0.042114682495594025,,,PRUNED
1899,1899,0.07132717967033386,2023-01-06 03:25:42.807762,2023-01-06 03:25:54.975589,0 days 00:00:12.167827,tanh,0.2,2,0.65,0.07132717967033386,,,PRUNED
1900,1900,0.13181889057159424,2023-01-06 03:25:55.082838,2023-01-06 03:26:29.378408,0 days 00:00:34.295570,relu,0.2,2,0.75,0.04463636502623558,0.03411422297358513,,COMPLETE
1901,1901,0.10124770551919937,2023-01-06 03:26:29.496543,2023-01-06 03:26:36.281490,0 days 00:00:06.784947,sigmoid,0.15000000000000002,2,0.55,0.10124770551919937,,,PRUNED
1902,1902,0.07251615077257156,2023-01-06 03:26:36.394334,2023-01-06 03:26:48.373488,0 days 00:00:11.979154,relu,0.2,2,0.75,0.07251615077257156,,,PRUNED
1903,1903,0.03882063180208206,2023-01-06 03:26:48.489088,2023-01-06 03:27:15.202795,0 days 00:00:26.713707,sigmoid,0.0,2,0.6,0.03882063180208206,,,PRUNED
1904,1904,0.07329379767179489,2023-01-06 03:27:15.316367,2023-01-06 03:27:27.119553,0 days 00:00:11.803186,relu,0.2,2,0.75,0.07329379767179489,,,PRUNED
1905,1905,0.1029675081372261,2023-01-06 03:27:27.242458,2023-01-06 03:27:34.335329,0 days 00:00:07.092871,sigmoid,0.15000000000000002,2,0.5,0.1029675081372261,,,PRUNED
1906,1906,0.0637630745768547,2023-01-06 03:27:34.439906,2023-01-06 03:27:46.192098,0 days 00:00:11.752192,relu,0.2,2,0.75,0.0637630745768547,,,PRUNED
1907,1907,0.059412192553281784,2023-01-06 03:27:46.312996,2023-01-06 03:27:58.342168,0 days 00:00:12.029172,tanh,0.2,3,0.5,0.06866499036550522,0.059412192553281784,,PRUNED
1908,1908,0.13154448568820953,2023-01-06 03:27:58.482226,2023-01-06 03:28:05.566615,0 days 00:00:07.084389,relu,0.0,2,0.5,0.13154448568820953,,,PRUNED
1909,1909,0.26500487327575684,2023-01-06 03:28:05.674031,2023-01-06 03:28:12.999383,0 days 00:00:07.325352,sigmoid,0.15000000000000002,7,0.5,0.26500487327575684,,,PRUNED
1910,1910,0.12210989743471146,2023-01-06 03:28:13.097912,2023-01-06 03:28:20.191500,0 days 00:00:07.093588,sigmoid,0.25,2,0.55,0.12210989743471146,,,PRUNED
1911,1911,0.045544493943452835,2023-01-06 03:28:20.297915,2023-01-06 03:28:46.996783,0 days 00:00:26.698868,sigmoid,0.0,2,0.8500000000000001,0.045544493943452835,,,PRUNED
1912,1912,0.04222187027335167,2023-01-06 03:28:47.096863,2023-01-06 03:29:13.927060,0 days 00:00:26.830197,relu,0.2,2,0.75,0.05336257815361023,0.04222187027335167,,PRUNED
1913,1913,0.13219836354255676,2023-01-06 03:29:14.029158,2023-01-06 03:29:43.157410,0 days 00:00:29.128252,tanh,0.0,2,0.95,0.0334242582321167,,,COMPLETE
1914,1914,0.13484850525856018,2023-01-06 03:29:43.277590,2023-01-06 03:29:50.391945,0 days 00:00:07.114355,relu,0.15000000000000002,2,0.5,0.13484850525856018,,,PRUNED
1915,1915,0.14197441935539246,2023-01-06 03:29:50.491029,2023-01-06 03:29:57.459431,0 days 00:00:06.968402,tanh,0.05,2,0.9,0.14197441935539246,,,PRUNED
1916,1916,0.06971430778503418,2023-01-06 03:29:57.566487,2023-01-06 03:30:09.506383,0 days 00:00:11.939896,relu,0.2,3,0.75,0.06971430778503418,,,PRUNED
1917,1917,0.12306790053844452,2023-01-06 03:30:09.614567,2023-01-06 03:30:16.723265,0 days 00:00:07.108698,sigmoid,0.25,2,0.5,0.12306790053844452,,,PRUNED
1918,1918,0.11282830685377121,2023-01-06 03:30:16.814015,2023-01-06 03:30:23.606073,0 days 00:00:06.792058,relu,0.15000000000000002,2,0.5,0.11282830685377121,,,PRUNED
1919,1919,0.12295075505971909,2023-01-06 03:30:23.714274,2023-01-06 03:30:30.572206,0 days 00:00:06.857932,sigmoid,0.0,2,0.8500000000000001,0.12295075505971909,,,PRUNED
1920,1920,0.12249583005905151,2023-01-06 03:30:30.671284,2023-01-06 03:30:37.779991,0 days 00:00:07.108707,sigmoid,0.15000000000000002,2,0.5,0.12249583005905151,,,PRUNED
1921,1921,0.07698436081409454,2023-01-06 03:30:37.880069,2023-01-06 03:30:50.020720,0 days 00:00:12.140651,relu,0.2,4,0.75,0.07698436081409454,,,PRUNED
1922,1922,0.06826373189687729,2023-01-06 03:30:50.118807,2023-01-06 03:31:02.129081,0 days 00:00:12.010274,relu,0.2,2,0.8,0.06826373189687729,,,PRUNED
1923,1923,0.1285439282655716,2023-01-06 03:31:02.235827,2023-01-06 03:31:09.144261,0 days 00:00:06.908434,relu,0.2,2,0.5,0.1285439282655716,,,PRUNED
1924,1924,0.25294309854507446,2023-01-06 03:31:09.253544,2023-01-06 03:31:21.409990,0 days 00:00:12.156446,relu,0.2,6,0.75,0.25294309854507446,,,PRUNED
1925,1925,0.10392215102910995,2023-01-06 03:31:21.516418,2023-01-06 03:31:28.512296,0 days 00:00:06.995878,tanh,0.30000000000000004,2,0.55,0.10392215102910995,,,PRUNED
1926,1926,0.14416326582431793,2023-01-06 03:31:28.598201,2023-01-06 03:31:57.888320,0 days 00:00:29.290119,relu,0.2,2,0.8500000000000001,0.05791580677032471,0.03288722783327103,,COMPLETE
1927,1927,0.10279756039381027,2023-01-06 03:31:58.016300,2023-01-06 03:32:04.784552,0 days 00:00:06.768252,sigmoid,0.15000000000000002,2,0.5,0.10279756039381027,,,PRUNED
1928,1928,0.06694936752319336,2023-01-06 03:32:04.887091,2023-01-06 03:32:16.774761,0 days 00:00:11.887670,sigmoid,0.15000000000000002,2,0.75,0.06694936752319336,,,PRUNED
1929,1929,0.05513475462794304,2023-01-06 03:32:16.878855,2023-01-06 03:32:29.141016,0 days 00:00:12.262161,relu,0.05,2,0.5,0.09193558245897293,0.05513475462794304,,PRUNED
1930,1930,0.08965637534856796,2023-01-06 03:32:29.255899,2023-01-06 03:32:41.031770,0 days 00:00:11.775871,relu,0.2,2,0.8,0.08965637534856796,,,PRUNED
1931,1931,0.13651356101036072,2023-01-06 03:32:41.145655,2023-01-06 03:33:13.101699,0 days 00:00:31.956044,relu,0.2,2,0.55,0.04983530566096306,0.0343543216586113,,COMPLETE
1932,1932,0.1279580295085907,2023-01-06 03:33:13.219886,2023-01-06 03:33:20.337107,0 days 00:00:07.117221,sigmoid,0.15000000000000002,2,0.5,0.1279580295085907,,,PRUNED
1933,1933,0.04040957987308502,2023-01-06 03:33:20.441647,2023-01-06 03:33:47.200724,0 days 00:00:26.759077,tanh,0.25,2,0.9,0.06034272536635399,0.04040957987308502,,PRUNED
1934,1934,0.05837428942322731,2023-01-06 03:33:47.316596,2023-01-06 03:33:59.367453,0 days 00:00:12.050857,sigmoid,0.15000000000000002,2,0.5,0.07928762584924698,0.05837428942322731,,PRUNED
1935,1935,0.038143787533044815,2023-01-06 03:33:59.479952,2023-01-06 03:34:26.498719,0 days 00:00:27.018767,relu,0.15000000000000002,2,0.95,0.060239896178245544,0.038143787533044815,,PRUNED
1936,1936,0.13307777047157288,2023-01-06 03:34:26.611876,2023-01-06 03:34:33.448179,0 days 00:00:06.836303,tanh,0.25,2,0.55,0.13307777047157288,,,PRUNED
1937,1937,0.03721073269844055,2023-01-06 03:34:33.546834,2023-01-06 03:35:00.345022,0 days 00:00:26.798188,relu,0.2,2,0.8500000000000001,0.05566323921084404,0.03721073269844055,,PRUNED
1938,1938,0.1255921572446823,2023-01-06 03:35:00.443344,2023-01-06 03:35:07.528790,0 days 00:00:07.085446,relu,0.2,2,0.6,0.1255921572446823,,,PRUNED
1939,1939,0.13127350807189941,2023-01-06 03:35:07.624121,2023-01-06 03:35:14.553374,0 days 00:00:06.929253,sigmoid,0.15000000000000002,2,0.5,0.13127350807189941,,,PRUNED
1940,1940,0.07722937315702438,2023-01-06 03:35:14.673592,2023-01-06 03:35:26.560225,0 days 00:00:11.886633,relu,0.25,2,0.65,0.07722937315702438,,,PRUNED
1941,1941,0.11492140591144562,2023-01-06 03:35:26.666340,2023-01-06 03:35:33.776904,0 days 00:00:07.110564,relu,0.25,2,0.5,0.11492140591144562,,,PRUNED
1942,1942,0.1172906756401062,2023-01-06 03:35:33.883457,2023-01-06 03:35:40.793032,0 days 00:00:06.909575,sigmoid,0.05,2,0.5,0.1172906756401062,,,PRUNED
1943,1943,0.061924535781145096,2023-01-06 03:35:40.905918,2023-01-06 03:35:52.799449,0 days 00:00:11.893531,relu,0.2,2,0.75,0.061924535781145096,,,PRUNED
1944,1944,0.12934379279613495,2023-01-06 03:35:52.914534,2023-01-06 03:36:00.015924,0 days 00:00:07.101390,sigmoid,0.15000000000000002,2,0.8,0.12934379279613495,,,PRUNED
1945,1945,0.14808014035224915,2023-01-06 03:36:00.103004,2023-01-06 03:36:26.833161,0 days 00:00:26.730157,tanh,0.0,2,0.95,0.034999992698431015,,,COMPLETE
1946,1946,0.13507559895515442,2023-01-06 03:36:26.943406,2023-01-06 03:36:33.713998,0 days 00:00:06.770592,tanh,0.15000000000000002,2,0.5,0.13507559895515442,,,PRUNED
1947,1947,0.13538502156734467,2023-01-06 03:36:33.810206,2023-01-06 03:36:40.630123,0 days 00:00:06.819917,relu,0.0,2,0.5,0.13538502156734467,,,PRUNED
1948,1948,0.043230388313531876,2023-01-06 03:36:40.743005,2023-01-06 03:37:07.761170,0 days 00:00:27.018165,relu,0.25,2,0.8500000000000001,0.056115902960300446,0.043230388313531876,,PRUNED
1949,1949,0.04191131144762039,2023-01-06 03:37:07.858332,2023-01-06 03:37:34.566663,0 days 00:00:26.708331,tanh,0.0,2,0.95,0.04191131144762039,,,PRUNED
1950,1950,0.06555630266666412,2023-01-06 03:37:34.661882,2023-01-06 03:37:46.583411,0 days 00:00:11.921529,relu,0.2,2,0.8,0.06555630266666412,,,PRUNED
1951,1951,0.08203322440385818,2023-01-06 03:37:46.694921,2023-01-06 03:37:58.682491,0 days 00:00:11.987570,relu,0.5,2,0.65,0.08203322440385818,,,PRUNED
1952,1952,0.19196999073028564,2023-01-06 03:37:58.787037,2023-01-06 03:38:06.023593,0 days 00:00:07.236556,sigmoid,0.2,6,0.5,0.19196999073028564,,,PRUNED
1953,1953,0.14950384199619293,2023-01-06 03:38:06.127143,2023-01-06 03:38:13.139715,0 days 00:00:07.012572,sigmoid,0.15000000000000002,2,0.55,0.14950384199619293,,,PRUNED
1954,1954,0.1381653994321823,2023-01-06 03:38:13.244267,2023-01-06 03:38:20.181130,0 days 00:00:06.936863,relu,0.15000000000000002,2,0.5,0.1381653994321823,,,PRUNED
