,number,value,datetime_start,datetime_complete,duration,params_activation,params_dropout,params_layers,params_shrink,system_attrs_completed_rung_0,system_attrs_completed_rung_1,system_attrs_completed_rung_2,state
2606,2606,0.14760413765907288,2023-01-06 06:26:17.321631,2023-01-06 06:26:44.274702,0 days 00:00:26.953071,sigmoid,0.0,2,0.55,0.07528594881296158,0.0477929525077343,0.0324283167719841,COMPLETE
2607,2607,0.1323252171278,2023-01-06 06:26:44.414901,2023-01-06 06:27:16.701783,0 days 00:00:32.286882,tanh,0.25,2,0.6,0.06488927453756332,0.04101695492863655,0.03327693045139313,COMPLETE
2608,2608,0.03397116810083389,2023-01-06 06:27:16.829696,2023-01-06 06:27:43.684998,0 days 00:00:26.855302,sigmoid,0.05,2,0.5,0.08095166832208633,0.053959209471940994,0.03397116810083389,PRUNED
2609,2609,0.04248359799385071,2023-01-06 06:27:43.800938,2023-01-06 06:28:10.556928,0 days 00:00:26.755990,tanh,0.0,2,0.95,0.04248359799385071,,,PRUNED
2610,2610,0.06913620233535767,2023-01-06 06:28:10.665538,2023-01-06 06:28:22.806986,0 days 00:00:12.141448,relu,0.2,2,0.95,0.06913620233535767,,,PRUNED
2611,2611,0.14033925533294678,2023-01-06 06:28:22.932267,2023-01-06 06:28:55.079138,0 days 00:00:32.146871,sigmoid,0.0,2,0.5,0.07722087949514389,0.053010158240795135,0.03163990005850792,COMPLETE
2612,2612,0.079680435359478,2023-01-06 06:28:55.215787,2023-01-06 06:29:07.220237,0 days 00:00:12.004450,relu,0.45,2,0.8,0.079680435359478,,,PRUNED
2613,2613,0.13123829662799835,2023-01-06 06:29:07.345698,2023-01-06 06:29:37.065976,0 days 00:00:29.720278,sigmoid,0.30000000000000004,2,0.65,0.06289903819561005,0.048421718180179596,0.031108401715755463,COMPLETE
2614,2614,0.13547632098197937,2023-01-06 06:29:37.203225,2023-01-06 06:30:08.963418,0 days 00:00:31.760193,sigmoid,0.35000000000000003,2,0.8500000000000001,0.06169077381491661,0.03218233212828636,,COMPLETE
2615,2615,0.07925458252429962,2023-01-06 06:30:09.091434,2023-01-06 06:30:21.247877,0 days 00:00:12.156443,tanh,0.25,2,0.65,0.07513588666915894,0.07925458252429962,,PRUNED
2616,2616,0.06728533655405045,2023-01-06 06:30:21.373147,2023-01-06 06:30:33.238613,0 days 00:00:11.865466,relu,0.2,2,0.7,0.06728533655405045,,,PRUNED
2617,2617,0.0415211021900177,2023-01-06 06:30:33.362890,2023-01-06 06:31:00.164508,0 days 00:00:26.801618,relu,0.25,2,0.65,0.057187650352716446,0.0415211021900177,,PRUNED
2618,2618,0.04026287421584129,2023-01-06 06:31:00.296160,2023-01-06 06:31:27.404078,0 days 00:00:27.107918,relu,0.35000000000000003,2,0.6,0.05247774347662926,0.04026287421584129,,PRUNED
2619,2619,0.06019844487309456,2023-01-06 06:31:27.525390,2023-01-06 06:31:39.591853,0 days 00:00:12.066463,sigmoid,0.05,2,0.65,0.08987144380807877,0.06019844487309456,,PRUNED
2620,2620,0.04269234463572502,2023-01-06 06:31:39.717119,2023-01-06 06:32:06.706362,0 days 00:00:26.989243,sigmoid,0.05,2,0.9,0.04269234463572502,,,PRUNED
2621,2621,0.08102820068597794,2023-01-06 06:32:06.828462,2023-01-06 06:32:18.796463,0 days 00:00:11.968001,relu,0.4,2,0.8500000000000001,0.08102820068597794,,,PRUNED
2622,2622,0.11089791357517242,2023-01-06 06:32:18.919574,2023-01-06 06:32:25.997004,0 days 00:00:07.077430,sigmoid,0.0,2,0.65,0.11089791357517242,,,PRUNED
2623,2623,0.07738403975963593,2023-01-06 06:32:26.229220,2023-01-06 06:32:38.578993,0 days 00:00:12.349773,sigmoid,0.30000000000000004,3,0.65,0.06348136067390442,0.07738403975963593,,PRUNED
2624,2624,0.06475839763879776,2023-01-06 06:32:38.700260,2023-01-06 06:32:50.711383,0 days 00:00:12.011123,tanh,0.25,2,0.65,0.07509515434503555,0.06475839763879776,,PRUNED
2625,2625,0.14572763442993164,2023-01-06 06:32:50.825710,2023-01-06 06:33:17.722391,0 days 00:00:26.896681,relu,0.0,2,0.95,0.03308190405368805,,,COMPLETE
2626,2626,0.03637083247303963,2023-01-06 06:33:17.851924,2023-01-06 06:33:44.567152,0 days 00:00:26.715228,relu,0.30000000000000004,2,0.55,0.057301267981529236,0.03637083247303963,,PRUNED
2627,2627,0.07469532638788223,2023-01-06 06:33:44.699195,2023-01-06 06:33:56.509200,0 days 00:00:11.810005,relu,0.25,2,0.7,0.07469532638788223,,,PRUNED
2628,2628,0.1351902335882187,2023-01-06 06:33:56.630603,2023-01-06 06:34:26.400005,0 days 00:00:29.769402,sigmoid,0.0,2,0.65,0.06487026065587997,0.04393347352743149,0.03280264139175415,COMPLETE
2629,2629,0.13140255212783813,2023-01-06 06:34:26.530982,2023-01-06 06:34:33.322739,0 days 00:00:06.791757,sigmoid,0.2,2,0.65,0.13140255212783813,,,PRUNED
2630,2630,0.08023534715175629,2023-01-06 06:34:33.452769,2023-01-06 06:34:45.496799,0 days 00:00:12.044030,relu,0.2,2,0.9,0.08023534715175629,,,PRUNED
2631,2631,0.06657624244689941,2023-01-06 06:34:45.617501,2023-01-06 06:34:57.912510,0 days 00:00:12.295009,tanh,0.35000000000000003,2,0.65,0.0754847377538681,0.06657624244689941,,PRUNED
2632,2632,0.13109219074249268,2023-01-06 06:34:58.062788,2023-01-06 06:35:05.004632,0 days 00:00:06.941844,sigmoid,0.30000000000000004,2,0.65,0.13109219074249268,,,PRUNED
2633,2633,0.12690764665603638,2023-01-06 06:35:05.123334,2023-01-06 06:35:37.243560,0 days 00:00:32.120226,sigmoid,0.25,2,0.65,0.05947144702076912,0.04533816874027252,0.030055485665798187,COMPLETE
2634,2634,0.10860376060009003,2023-01-06 06:35:37.366198,2023-01-06 06:35:44.159954,0 days 00:00:06.793756,sigmoid,0.05,2,0.65,0.10860376060009003,,,PRUNED
2635,2635,0.06989997625350952,2023-01-06 06:35:44.271117,2023-01-06 06:35:56.149695,0 days 00:00:11.878578,relu,0.4,2,0.65,0.06989997625350952,,,PRUNED
2636,2636,0.039878860116004944,2023-01-06 06:35:56.270395,2023-01-06 06:36:23.246611,0 days 00:00:26.976216,sigmoid,0.0,2,0.8,0.039878860116004944,,,PRUNED
2637,2637,0.039095379412174225,2023-01-06 06:36:23.364764,2023-01-06 06:36:50.028881,0 days 00:00:26.664117,tanh,0.30000000000000004,2,0.95,0.039095379412174225,,,PRUNED
2638,2638,0.035423096269369125,2023-01-06 06:36:50.164493,2023-01-06 06:37:17.042471,0 days 00:00:26.877978,relu,0.45,2,0.8500000000000001,0.055993493646383286,0.035423096269369125,,PRUNED
2639,2639,0.12969478964805603,2023-01-06 06:37:17.162707,2023-01-06 06:37:24.367904,0 days 00:00:07.205197,sigmoid,0.0,2,0.65,0.12969478964805603,,,PRUNED
2640,2640,0.1286322921514511,2023-01-06 06:37:24.485145,2023-01-06 06:37:31.685015,0 days 00:00:07.199870,sigmoid,0.2,5,0.65,0.1286322921514511,,,PRUNED
2641,2641,0.040649138391017914,2023-01-06 06:37:31.812578,2023-01-06 06:37:58.747590,0 days 00:00:26.935012,sigmoid,0.0,2,0.95,0.040649138391017914,,,PRUNED
2642,2642,0.11393850296735764,2023-01-06 06:37:58.866835,2023-01-06 06:38:05.898109,0 days 00:00:07.031274,sigmoid,0.25,2,0.65,0.11393850296735764,,,PRUNED
2643,2643,0.12960362434387207,2023-01-06 06:38:06.017291,2023-01-06 06:38:40.430505,0 days 00:00:34.413214,relu,0.4,2,0.5,0.04916718974709511,0.030299808830022812,,COMPLETE
2644,2644,0.10147760063409805,2023-01-06 06:38:40.559967,2023-01-06 06:38:47.670826,0 days 00:00:07.110859,sigmoid,0.0,2,0.65,0.10147760063409805,,,PRUNED
2645,2645,0.14968790113925934,2023-01-06 06:38:47.796390,2023-01-06 06:39:19.661927,0 days 00:00:31.865537,tanh,0.25,2,0.9,0.035752810537815094,,,COMPLETE
2646,2646,0.11600557714700699,2023-01-06 06:39:19.804935,2023-01-06 06:39:26.916806,0 days 00:00:07.111871,sigmoid,0.05,2,0.65,0.11600557714700699,,,PRUNED
2647,2647,0.05660213530063629,2023-01-06 06:39:27.045371,2023-01-06 06:39:39.084155,0 days 00:00:12.038784,sigmoid,0.30000000000000004,2,0.65,0.09102150797843933,0.05660213530063629,,PRUNED
2648,2648,0.12940549850463867,2023-01-06 06:39:39.186103,2023-01-06 06:40:11.197629,0 days 00:00:32.011526,sigmoid,0.25,2,0.65,0.06568871438503265,0.046165551990270615,0.031324874609708786,COMPLETE
2649,2649,0.12766258418560028,2023-01-06 06:40:11.338079,2023-01-06 06:40:18.438836,0 days 00:00:07.100757,sigmoid,0.05,2,0.65,0.12766258418560028,,,PRUNED
2650,2650,0.1427394449710846,2023-01-06 06:40:18.557073,2023-01-06 06:40:25.529962,0 days 00:00:06.972889,sigmoid,0.0,2,0.65,0.1427394449710846,,,PRUNED
2651,2651,0.057829342782497406,2023-01-06 06:40:25.656534,2023-01-06 06:40:37.853012,0 days 00:00:12.196478,sigmoid,0.25,2,0.65,0.09092645347118378,0.057829342782497406,,PRUNED
2652,2652,0.06291848421096802,2023-01-06 06:40:37.973247,2023-01-06 06:40:49.860411,0 days 00:00:11.887164,relu,0.4,2,0.55,0.06291848421096802,,,PRUNED
2653,2653,0.037891436368227005,2023-01-06 06:40:49.979650,2023-01-06 06:41:16.565690,0 days 00:00:26.586040,sigmoid,0.05,2,0.9,0.037891436368227005,,,PRUNED
2654,2654,0.1399509310722351,2023-01-06 06:41:16.684868,2023-01-06 06:41:23.867246,0 days 00:00:07.182378,sigmoid,0.05,2,0.65,0.1399509310722351,,,PRUNED
2655,2655,0.06912849843502045,2023-01-06 06:41:23.985366,2023-01-06 06:41:35.840202,0 days 00:00:11.854836,relu,0.4,2,0.5,0.06912849843502045,,,PRUNED
2656,2656,0.07084307074546814,2023-01-06 06:41:35.958441,2023-01-06 06:41:47.814197,0 days 00:00:11.855756,relu,0.4,2,0.5,0.07084307074546814,,,PRUNED
2657,2657,0.059516988694667816,2023-01-06 06:41:47.932533,2023-01-06 06:42:00.121119,0 days 00:00:12.188586,sigmoid,0.30000000000000004,2,0.65,0.06317344307899475,0.059516988694667816,,PRUNED
2658,2658,0.12549011409282684,2023-01-06 06:42:00.251241,2023-01-06 06:42:07.187791,0 days 00:00:06.936550,sigmoid,0.30000000000000004,2,0.65,0.12549011409282684,,,PRUNED
2659,2659,0.04033922404050827,2023-01-06 06:42:07.313515,2023-01-06 06:42:34.485809,0 days 00:00:27.172294,sigmoid,0.2,2,0.65,0.09473706781864166,0.05419563129544258,0.04033922404050827,PRUNED
2660,2660,0.07047470659017563,2023-01-06 06:42:34.604926,2023-01-06 06:42:46.443391,0 days 00:00:11.838465,relu,0.4,2,0.55,0.07047470659017563,,,PRUNED
2661,2661,0.04443784058094025,2023-01-06 06:42:46.562338,2023-01-06 06:43:13.607655,0 days 00:00:27.045317,tanh,0.0,3,0.8500000000000001,0.04443784058094025,,,PRUNED
2662,2662,0.15100552141666412,2023-01-06 06:43:13.750205,2023-01-06 06:43:45.531114,0 days 00:00:31.780909,sigmoid,0.0,2,1.0,0.037438035011291504,,,COMPLETE
2663,2663,0.13475337624549866,2023-01-06 06:43:45.667201,2023-01-06 06:44:17.472325,0 days 00:00:31.805124,relu,0.4,2,0.8500000000000001,0.05173582211136818,0.03008676879107952,,COMPLETE
2664,2664,0.13241755962371826,2023-01-06 06:44:17.607001,2023-01-06 06:44:24.744871,0 days 00:00:07.137870,sigmoid,0.0,2,0.7,0.13241755962371826,,,PRUNED
2665,2665,0.07734937220811844,2023-01-06 06:44:24.888102,2023-01-06 06:44:36.767534,0 days 00:00:11.879432,relu,0.4,2,0.5,0.07734937220811844,,,PRUNED
2666,2666,0.1321626901626587,2023-01-06 06:44:36.887178,2023-01-06 06:44:44.000750,0 days 00:00:07.113572,sigmoid,0.25,2,0.65,0.1321626901626587,,,PRUNED
2667,2667,0.08156418800354004,2023-01-06 06:44:44.139309,2023-01-06 06:44:56.083115,0 days 00:00:11.943806,relu,0.4,2,0.5,0.08156418800354004,,,PRUNED
2668,2668,0.8251042366027832,2023-01-06 06:44:56.208701,2023-01-06 06:45:08.732151,0 days 00:00:12.523450,relu,0.4,8,0.5,0.8251042366027832,,,PRUNED
2669,2669,0.07364651560783386,2023-01-06 06:45:08.841060,2023-01-06 06:45:20.964536,0 days 00:00:12.123476,relu,0.35000000000000003,2,0.5,0.07364651560783386,,,PRUNED
2670,2670,0.11850689351558685,2023-01-06 06:45:21.076439,2023-01-06 06:45:28.139639,0 days 00:00:07.063200,sigmoid,0.0,3,0.65,0.11850689351558685,,,PRUNED
2671,2671,0.10209256410598755,2023-01-06 06:45:28.259218,2023-01-06 06:45:35.172759,0 days 00:00:06.913541,sigmoid,0.05,2,0.7,0.10209256410598755,,,PRUNED
2672,2672,0.07959283888339996,2023-01-06 06:45:35.282681,2023-01-06 06:45:47.379165,0 days 00:00:12.096484,sigmoid,0.4,2,0.5,0.07959283888339996,,,PRUNED
2673,2673,0.04268530011177063,2023-01-06 06:45:47.505737,2023-01-06 06:46:14.218166,0 days 00:00:26.712429,tanh,0.0,2,0.95,0.04268530011177063,,,PRUNED
2674,2674,0.11117447912693024,2023-01-06 06:46:14.332672,2023-01-06 06:46:21.544204,0 days 00:00:07.211532,sigmoid,0.30000000000000004,2,0.65,0.11117447912693024,,,PRUNED
2675,2675,0.14524973928928375,2023-01-06 06:46:21.653102,2023-01-06 06:46:53.618628,0 days 00:00:31.965526,relu,0.4,2,0.55,0.05341438576579094,0.033279675990343094,,COMPLETE
2676,2676,0.038995567709207535,2023-01-06 06:46:53.736637,2023-01-06 06:47:20.513655,0 days 00:00:26.777018,sigmoid,0.2,2,0.65,0.07449933141469955,0.054323263466358185,0.038995567709207535,PRUNED
2677,2677,0.13548484444618225,2023-01-06 06:47:20.626399,2023-01-06 06:47:50.120974,0 days 00:00:29.494575,sigmoid,0.0,2,0.8500000000000001,0.03478303551673889,,,COMPLETE
2678,2678,0.1367405503988266,2023-01-06 06:47:50.241625,2023-01-06 06:48:19.916149,0 days 00:00:29.674524,sigmoid,0.25,2,0.65,0.06234074756503105,0.045995671302080154,0.03310854360461235,COMPLETE
2679,2679,0.150593101978302,2023-01-06 06:48:20.038327,2023-01-06 06:48:47.218112,0 days 00:00:27.179785,relu,0.45,2,0.5,0.061227429658174515,0.03503075987100601,,COMPLETE
2680,2680,0.03776982054114342,2023-01-06 06:48:47.336467,2023-01-06 06:49:14.163245,0 days 00:00:26.826778,sigmoid,0.0,2,0.65,0.09260060638189316,0.05032956227660179,0.03776982054114342,PRUNED
2681,2681,0.1390727013349533,2023-01-06 06:49:14.275136,2023-01-06 06:49:43.889992,0 days 00:00:29.614856,sigmoid,0.05,2,0.65,0.07369252294301987,0.04853498563170433,0.03119925782084465,COMPLETE
2682,2682,0.1352730691432953,2023-01-06 06:49:44.006591,2023-01-06 06:50:21.068460,0 days 00:00:37.061869,sigmoid,0.05,2,0.5,0.0352744460105896,,,COMPLETE
2683,2683,0.1308615505695343,2023-01-06 06:50:21.200661,2023-01-06 06:50:28.033552,0 days 00:00:06.832891,tanh,0.0,2,0.65,0.1308615505695343,,,PRUNED
2684,2684,0.12401820719242096,2023-01-06 06:50:28.164366,2023-01-06 06:50:35.299653,0 days 00:00:07.135287,sigmoid,0.35000000000000003,2,0.7,0.12401820719242096,,,PRUNED
2685,2685,0.03557322919368744,2023-01-06 06:50:35.416888,2023-01-06 06:51:02.179183,0 days 00:00:26.762295,relu,0.4,2,0.75,0.05810248851776123,0.03557322919368744,,PRUNED
2686,2686,0.07593972980976105,2023-01-06 06:51:02.288817,2023-01-06 06:51:14.254263,0 days 00:00:11.965446,relu,0.35000000000000003,2,0.7,0.07593972980976105,,,PRUNED
2687,2687,0.11431168019771576,2023-01-06 06:51:14.373217,2023-01-06 06:51:21.554580,0 days 00:00:07.181363,sigmoid,0.25,2,0.65,0.11431168019771576,,,PRUNED
2688,2688,0.11450546234846115,2023-01-06 06:51:21.673657,2023-01-06 06:51:28.686473,0 days 00:00:07.012816,tanh,0.30000000000000004,2,0.65,0.11450546234846115,,,PRUNED
2689,2689,0.3154454827308655,2023-01-06 06:51:28.804440,2023-01-06 06:51:36.545188,0 days 00:00:07.740748,sigmoid,0.0,7,0.65,0.3154454827308655,,,PRUNED
2690,2690,0.07820490747690201,2023-01-06 06:51:36.662171,2023-01-06 06:51:48.759530,0 days 00:00:12.097359,sigmoid,0.2,2,0.65,0.07613173872232437,0.07820490747690201,,PRUNED
2691,2691,0.06306015700101852,2023-01-06 06:51:48.876636,2023-01-06 06:52:00.925654,0 days 00:00:12.049018,sigmoid,0.30000000000000004,2,0.7,0.06752823293209076,0.06306015700101852,,PRUNED
2692,2692,0.12862154841423035,2023-01-06 06:52:01.043795,2023-01-06 06:52:08.301945,0 days 00:00:07.258150,tanh,0.0,2,0.65,0.12862154841423035,,,PRUNED
2693,2693,0.1420501470565796,2023-01-06 06:52:08.401144,2023-01-06 06:52:15.300548,0 days 00:00:06.899404,sigmoid,0.25,2,0.65,0.1420501470565796,,,PRUNED
2694,2694,0.09591861069202423,2023-01-06 06:52:15.419517,2023-01-06 06:52:22.433331,0 days 00:00:07.013814,sigmoid,0.05,2,0.65,0.09591861069202423,,,PRUNED
2695,2695,0.06667017936706543,2023-01-06 06:52:22.532458,2023-01-06 06:52:34.448073,0 days 00:00:11.915615,relu,0.45,2,0.7,0.06667017936706543,,,PRUNED
2696,2696,0.13103918731212616,2023-01-06 06:52:34.551377,2023-01-06 06:52:41.498528,0 days 00:00:06.947151,tanh,0.0,2,0.65,0.13103918731212616,,,PRUNED
2697,2697,0.10473025590181351,2023-01-06 06:52:41.609166,2023-01-06 06:52:48.714641,0 days 00:00:07.105475,sigmoid,0.30000000000000004,2,0.7,0.10473025590181351,,,PRUNED
2698,2698,0.06824301928281784,2023-01-06 06:52:48.830604,2023-01-06 06:53:00.621056,0 days 00:00:11.790452,relu,0.4,2,0.5,0.06824301928281784,,,PRUNED
2699,2699,0.07815762609243393,2023-01-06 06:53:00.723356,2023-01-06 06:53:12.561804,0 days 00:00:11.838448,relu,0.4,2,0.65,0.07815762609243393,,,PRUNED
2700,2700,0.03428618982434273,2023-01-06 06:53:12.663098,2023-01-06 06:53:39.643052,0 days 00:00:26.979954,sigmoid,0.25,2,0.65,0.08420800417661667,0.054345179349184036,0.03428618982434273,PRUNED
2701,2701,0.12429825961589813,2023-01-06 06:53:39.744349,2023-01-06 06:53:51.692871,0 days 00:00:11.948522,relu,0.4,3,0.8500000000000001,0.12429825961589813,,,PRUNED
2702,2702,0.0405057817697525,2023-01-06 06:53:51.811799,2023-01-06 06:54:18.581713,0 days 00:00:26.769914,tanh,0.30000000000000004,2,0.95,0.0405057817697525,,,PRUNED
2703,2703,0.1340285986661911,2023-01-06 06:54:18.682011,2023-01-06 06:54:25.707631,0 days 00:00:07.025620,sigmoid,0.05,3,0.65,0.1340285986661911,,,PRUNED
2704,2704,0.059445880353450775,2023-01-06 06:54:25.806464,2023-01-06 06:54:37.764103,0 days 00:00:11.957639,tanh,0.2,2,0.7,0.07436364889144897,0.059445880353450775,,PRUNED
2705,2705,0.08608119189739227,2023-01-06 06:54:37.874203,2023-01-06 06:54:49.979294,0 days 00:00:12.105091,relu,0.35000000000000003,2,0.75,0.08608119189739227,,,PRUNED
2706,2706,0.16460157930850983,2023-01-06 06:54:50.079596,2023-01-06 06:55:02.253361,0 days 00:00:12.173765,relu,0.4,5,0.8,0.16460157930850983,,,PRUNED
2707,2707,0.14977024495601654,2023-01-06 06:55:02.355652,2023-01-06 06:55:29.520758,0 days 00:00:27.165106,sigmoid,0.25,2,0.65,0.07839493453502655,0.05401347205042839,0.03227943554520607,COMPLETE
2708,2708,0.04067249968647957,2023-01-06 06:55:29.631225,2023-01-06 06:55:56.274194,0 days 00:00:26.642969,sigmoid,0.0,2,0.55,0.04067249968647957,,,PRUNED
2709,2709,0.10406494140625,2023-01-06 06:55:56.385824,2023-01-06 06:56:03.508486,0 days 00:00:07.122662,sigmoid,0.45,2,0.65,0.10406494140625,,,PRUNED
2710,2710,0.12459474802017212,2023-01-06 06:56:03.626934,2023-01-06 06:56:10.481859,0 days 00:00:06.854925,sigmoid,0.0,2,0.65,0.12459474802017212,,,PRUNED
2711,2711,0.038606978952884674,2023-01-06 06:56:10.592064,2023-01-06 06:56:37.087710,0 days 00:00:26.495646,tanh,0.1,2,0.75,0.038606978952884674,,,PRUNED
2712,2712,0.1501455008983612,2023-01-06 06:56:37.366173,2023-01-06 06:57:04.106897,0 days 00:00:26.740724,sigmoid,0.0,2,0.9,0.033115290105342865,,,COMPLETE
2713,2713,0.12550362944602966,2023-01-06 06:57:04.214601,2023-01-06 06:57:11.028284,0 days 00:00:06.813683,tanh,0.30000000000000004,2,0.6,0.12550362944602966,,,PRUNED
2714,2714,0.13875634968280792,2023-01-06 06:57:11.129064,2023-01-06 06:57:45.510514,0 days 00:00:34.381450,tanh,0.0,2,0.8500000000000001,0.036912355571985245,,,COMPLETE
2715,2715,0.13312049210071564,2023-01-06 06:57:45.619746,2023-01-06 06:58:17.402579,0 days 00:00:31.782833,relu,0.35000000000000003,2,0.55,0.04358146712183952,0.03191801905632019,,COMPLETE
2716,2716,0.12263195961713791,2023-01-06 06:58:17.509884,2023-01-06 06:58:24.239202,0 days 00:00:06.729318,sigmoid,0.05,2,0.65,0.12263195961713791,,,PRUNED
2717,2717,0.03759486600756645,2023-01-06 06:58:24.519253,2023-01-06 06:58:51.411108,0 days 00:00:26.891855,sigmoid,0.0,2,0.65,0.08566237986087799,0.0517294742166996,0.03759486600756645,PRUNED
2718,2718,0.06648122519254684,2023-01-06 06:58:51.511995,2023-01-06 06:59:03.560171,0 days 00:00:12.048176,tanh,0.25,2,0.6,0.07388853281736374,0.06648122519254684,,PRUNED
2719,2719,0.05032840743660927,2023-01-06 06:59:03.814144,2023-01-06 06:59:30.573924,0 days 00:00:26.759780,sigmoid,0.05,2,0.9,0.05032840743660927,,,PRUNED
2720,2720,0.04109382629394531,2023-01-06 06:59:30.676021,2023-01-06 06:59:57.238371,0 days 00:00:26.562350,tanh,0.2,2,0.95,0.04109382629394531,,,PRUNED
2721,2721,0.04259687289595604,2023-01-06 06:59:57.347677,2023-01-06 07:00:24.170625,0 days 00:00:26.822948,sigmoid,0.0,2,0.95,0.04259687289595604,,,PRUNED
2722,2722,0.04023595154285431,2023-01-06 07:00:24.274523,2023-01-06 07:00:50.943564,0 days 00:00:26.669041,tanh,0.0,2,0.8,0.04023595154285431,,,PRUNED
2723,2723,0.06753680855035782,2023-01-06 07:00:51.045458,2023-01-06 07:01:03.017642,0 days 00:00:11.972184,sigmoid,0.2,2,0.65,0.09087906032800674,0.06753680855035782,,PRUNED
2724,2724,0.14035794138908386,2023-01-06 07:01:03.119854,2023-01-06 07:01:10.243079,0 days 00:00:07.123225,sigmoid,0.30000000000000004,2,0.65,0.14035794138908386,,,PRUNED
2725,2725,0.0744057148694992,2023-01-06 07:01:10.343975,2023-01-06 07:01:22.124503,0 days 00:00:11.780528,relu,0.30000000000000004,2,0.8500000000000001,0.0744057148694992,,,PRUNED
2726,2726,0.14316077530384064,2023-01-06 07:01:22.233725,2023-01-06 07:01:29.525355,0 days 00:00:07.291630,sigmoid,0.35000000000000003,4,0.6,0.14316077530384064,,,PRUNED
2727,2727,0.1893438696861267,2023-01-06 07:01:29.632152,2023-01-06 07:01:36.782710,0 days 00:00:07.150558,tanh,0.0,6,0.65,0.1893438696861267,,,PRUNED
2728,2728,0.07007633149623871,2023-01-06 07:01:36.892932,2023-01-06 07:01:49.030762,0 days 00:00:12.137830,relu,0.25,2,0.7,0.07007633149623871,,,PRUNED
2729,2729,0.037458110600709915,2023-01-06 07:01:49.140987,2023-01-06 07:02:15.819978,0 days 00:00:26.678991,relu,0.5,2,0.7,0.05789223685860634,0.037458110600709915,,PRUNED
2730,2730,0.06164291128516197,2023-01-06 07:02:15.921256,2023-01-06 07:02:27.861468,0 days 00:00:11.940212,sigmoid,0.25,2,0.7,0.08060043305158615,0.06164291128516197,,PRUNED
2731,2731,0.06469110399484634,2023-01-06 07:02:27.967338,2023-01-06 07:02:40.051829,0 days 00:00:12.084491,relu,0.4,2,0.65,0.06469110399484634,,,PRUNED
2732,2732,0.05643544718623161,2023-01-06 07:02:40.161056,2023-01-06 07:02:52.217563,0 days 00:00:12.056507,sigmoid,0.0,2,0.65,0.08922375738620758,0.05643544718623161,,PRUNED
2733,2733,0.1358850747346878,2023-01-06 07:02:52.336120,2023-01-06 07:03:26.750018,0 days 00:00:34.413898,sigmoid,0.0,2,0.8500000000000001,0.03408253565430641,,,COMPLETE
2734,2734,0.04277781397104263,2023-01-06 07:03:26.860137,2023-01-06 07:03:53.578507,0 days 00:00:26.718370,relu,0.15000000000000002,3,0.95,0.04277781397104263,,,PRUNED
