,number,value,datetime_start,datetime_complete,duration,params_activation,params_dropout,params_layers,params_shrink,system_attrs_completed_rung_0,system_attrs_completed_rung_1,system_attrs_completed_rung_2,state
1566,1566,0.05990137159824371,2023-01-06 01:54:29.058074,2023-01-06 01:54:40.892327,0 days 00:00:11.834253,tanh,0.25,2,0.5,0.08152120560407639,0.05990137159824371,,PRUNED
1567,1567,0.08555664867162704,2023-01-06 01:54:41.006492,2023-01-06 01:54:52.825396,0 days 00:00:11.818904,relu,0.4,2,0.75,0.08555664867162704,,,PRUNED
1568,1568,0.03625745326280594,2023-01-06 01:54:52.937864,2023-01-06 01:55:19.882029,0 days 00:00:26.944165,relu,0.2,2,0.7,0.0476955771446228,0.03625745326280594,,PRUNED
1569,1569,0.040862370282411575,2023-01-06 01:55:19.984860,2023-01-06 01:55:46.604000,0 days 00:00:26.619140,tanh,0.15000000000000002,2,0.8500000000000001,0.040862370282411575,,,PRUNED
1570,1570,0.13974489271640778,2023-01-06 01:55:46.734831,2023-01-06 01:56:16.115086,0 days 00:00:29.380255,sigmoid,0.1,2,0.65,0.036181654781103134,,,COMPLETE
1571,1571,0.1679064929485321,2023-01-06 01:56:16.395163,2023-01-06 01:56:23.777173,0 days 00:00:07.382010,sigmoid,0.1,7,0.8,0.1679064929485321,,,PRUNED
1572,1572,0.13380227982997894,2023-01-06 01:56:23.873674,2023-01-06 01:56:30.718311,0 days 00:00:06.844637,sigmoid,0.15000000000000002,2,0.55,0.13380227982997894,,,PRUNED
1573,1573,0.172113299369812,2023-01-06 01:56:30.832477,2023-01-06 01:56:38.159415,0 days 00:00:07.326938,tanh,0.15000000000000002,5,0.5,0.172113299369812,,,PRUNED
1574,1574,0.06520756334066391,2023-01-06 01:56:38.263247,2023-01-06 01:56:49.990846,0 days 00:00:11.727599,relu,0.45,2,0.75,0.06520756334066391,,,PRUNED
1575,1575,0.12522390484809875,2023-01-06 01:56:50.130011,2023-01-06 01:56:57.016312,0 days 00:00:06.886301,sigmoid,0.15000000000000002,2,0.8500000000000001,0.12522390484809875,,,PRUNED
1576,1576,0.15351057052612305,2023-01-06 01:56:57.137823,2023-01-06 01:57:21.577786,0 days 00:00:24.439963,sigmoid,0.25,2,0.5,0.05693816766142845,0.04220842570066452,,COMPLETE
1577,1577,0.1429411768913269,2023-01-06 01:57:21.695304,2023-01-06 01:57:48.766204,0 days 00:00:27.070900,sigmoid,0.05,2,0.9,0.032193537801504135,,,COMPLETE
1578,1578,0.10813385248184204,2023-01-06 01:57:48.901218,2023-01-06 01:57:55.770178,0 days 00:00:06.868960,tanh,0.35000000000000003,2,0.5,0.10813385248184204,,,PRUNED
1579,1579,0.06351586431264877,2023-01-06 01:57:55.865323,2023-01-06 01:58:07.844260,0 days 00:00:11.978937,sigmoid,0.1,2,0.5,0.09554833918809891,0.06351586431264877,,PRUNED
1580,1580,0.10173387080430984,2023-01-06 01:58:07.975161,2023-01-06 01:58:15.085491,0 days 00:00:07.110330,tanh,0.15000000000000002,2,0.7,0.10173387080430984,,,PRUNED
1581,1581,0.12768664956092834,2023-01-06 01:58:15.197534,2023-01-06 01:58:22.076515,0 days 00:00:06.878981,sigmoid,0.05,3,0.5,0.12768664956092834,,,PRUNED
1582,1582,0.11765296757221222,2023-01-06 01:58:22.181346,2023-01-06 01:58:29.075981,0 days 00:00:06.894635,sigmoid,0.15000000000000002,2,0.55,0.11765296757221222,,,PRUNED
1583,1583,0.10220987349748611,2023-01-06 01:58:29.179118,2023-01-06 01:58:36.333766,0 days 00:00:07.154648,tanh,0.05,2,0.5,0.10220987349748611,,,PRUNED
1584,1584,0.12042970210313797,2023-01-06 01:58:36.448635,2023-01-06 01:58:43.349898,0 days 00:00:06.901263,sigmoid,0.1,2,0.8,0.12042970210313797,,,PRUNED
1585,1585,0.06952708214521408,2023-01-06 01:58:43.460843,2023-01-06 01:58:55.448570,0 days 00:00:11.987727,relu,0.35000000000000003,2,0.5,0.06952708214521408,,,PRUNED
1586,1586,0.04220245033502579,2023-01-06 01:58:55.562133,2023-01-06 01:59:22.487574,0 days 00:00:26.925441,sigmoid,0.05,2,0.8500000000000001,0.04220245033502579,,,PRUNED
1587,1587,0.10065165907144547,2023-01-06 01:59:22.618420,2023-01-06 01:59:29.579713,0 days 00:00:06.961293,sigmoid,0.15000000000000002,2,0.5,0.10065165907144547,,,PRUNED
1588,1588,0.0828583762049675,2023-01-06 01:59:29.693880,2023-01-06 01:59:41.577803,0 days 00:00:11.883923,sigmoid,0.4,2,0.65,0.0828583762049675,,,PRUNED
1589,1589,0.04153259098529816,2023-01-06 01:59:41.689967,2023-01-06 02:00:08.576375,0 days 00:00:26.886408,tanh,0.05,2,0.8500000000000001,0.04153259098529816,,,PRUNED
1590,1590,0.10002794861793518,2023-01-06 02:00:08.708579,2023-01-06 02:00:15.701207,0 days 00:00:06.992628,relu,0.15000000000000002,2,0.5,0.10002794861793518,,,PRUNED
1591,1591,0.06447037309408188,2023-01-06 02:00:15.807042,2023-01-06 02:00:27.850284,0 days 00:00:12.043242,tanh,0.1,2,0.55,0.09680823981761932,0.06447037309408188,,PRUNED
1592,1592,0.1347777247428894,2023-01-06 02:00:27.969772,2023-01-06 02:01:05.057793,0 days 00:00:37.088021,sigmoid,0.05,2,0.8500000000000001,0.03541531041264534,,,COMPLETE
1593,1593,0.14876191318035126,2023-01-06 02:01:05.177963,2023-01-06 02:01:37.065695,0 days 00:00:31.887732,sigmoid,0.05,2,0.8500000000000001,0.03679570555686951,,,COMPLETE
1594,1594,0.04033215343952179,2023-01-06 02:01:37.193196,2023-01-06 02:02:04.009048,0 days 00:00:26.815852,relu,0.4,2,0.8,0.05449020862579346,0.04033215343952179,,PRUNED
1595,1595,0.13095179200172424,2023-01-06 02:02:04.121151,2023-01-06 02:02:36.570507,0 days 00:00:32.449356,sigmoid,0.15000000000000002,2,0.5,0.08371679484844208,0.04349670186638832,0.030932432040572166,COMPLETE
1596,1596,0.040588296949863434,2023-01-06 02:02:36.705336,2023-01-06 02:03:03.387466,0 days 00:00:26.682130,sigmoid,0.4,2,0.8500000000000001,0.040588296949863434,,,PRUNED
1597,1597,0.12816880643367767,2023-01-06 02:03:03.500621,2023-01-06 02:03:10.487241,0 days 00:00:06.986620,sigmoid,0.25,2,0.5,0.12816880643367767,,,PRUNED
1598,1598,0.1144896075129509,2023-01-06 02:03:10.601081,2023-01-06 02:03:17.812370,0 days 00:00:07.211289,sigmoid,0.15000000000000002,4,0.75,0.1144896075129509,,,PRUNED
1599,1599,0.1298496276140213,2023-01-06 02:03:17.925106,2023-01-06 02:03:24.795172,0 days 00:00:06.870066,sigmoid,0.15000000000000002,2,0.5,0.1298496276140213,,,PRUNED
1600,1600,0.03996511921286583,2023-01-06 02:03:24.899304,2023-01-06 02:03:51.467146,0 days 00:00:26.567842,sigmoid,0.05,2,0.8500000000000001,0.03996511921286583,,,PRUNED
1601,1601,0.038490861654281616,2023-01-06 02:03:51.605291,2023-01-06 02:04:18.440545,0 days 00:00:26.835254,tanh,0.05,2,0.8500000000000001,0.038490861654281616,,,PRUNED
1602,1602,0.14125967025756836,2023-01-06 02:04:18.581253,2023-01-06 02:04:45.623166,0 days 00:00:27.041913,tanh,0.2,2,0.7,0.050049394369125366,0.030148010700941086,,COMPLETE
1603,1603,0.13083748519420624,2023-01-06 02:04:45.744348,2023-01-06 02:04:52.538507,0 days 00:00:06.794159,sigmoid,0.15000000000000002,2,0.7,0.13083748519420624,,,PRUNED
1604,1604,0.035366304218769073,2023-01-06 02:04:52.668338,2023-01-06 02:05:19.778102,0 days 00:00:27.109764,sigmoid,0.0,2,0.5,0.07213960587978363,0.042781904339790344,0.035366304218769073,PRUNED
1605,1605,0.04354282096028328,2023-01-06 02:05:19.906928,2023-01-06 02:05:46.741720,0 days 00:00:26.834792,sigmoid,0.05,3,0.8500000000000001,0.04354282096028328,,,PRUNED
1606,1606,0.034340158104896545,2023-01-06 02:05:46.855889,2023-01-06 02:06:13.748022,0 days 00:00:26.892133,sigmoid,0.15000000000000002,2,0.5,0.07193247228860855,0.04301031306385994,0.034340158104896545,PRUNED
1607,1607,0.14728650450706482,2023-01-06 02:06:13.885156,2023-01-06 02:06:41.016321,0 days 00:00:27.131165,relu,0.25,2,0.6,0.06138398125767708,0.03285378962755203,,COMPLETE
1608,1608,0.06912606954574585,2023-01-06 02:06:41.145651,2023-01-06 02:06:52.887621,0 days 00:00:11.741970,relu,0.5,2,0.6,0.06912606954574585,,,PRUNED
1609,1609,0.1272110790014267,2023-01-06 02:06:52.998859,2023-01-06 02:06:59.737099,0 days 00:00:06.738240,sigmoid,0.05,2,0.55,0.1272110790014267,,,PRUNED
1610,1610,0.03936825320124626,2023-01-06 02:06:59.851332,2023-01-06 02:07:26.967368,0 days 00:00:27.116036,sigmoid,0.25,2,0.5,0.07722928375005722,0.04801420867443085,0.03936825320124626,PRUNED
1611,1611,0.0827258825302124,2023-01-06 02:07:27.089938,2023-01-06 02:07:38.925076,0 days 00:00:11.835138,relu,0.4,2,0.7,0.0827258825302124,,,PRUNED
1612,1612,0.13925008475780487,2023-01-06 02:07:39.037027,2023-01-06 02:07:46.150235,0 days 00:00:07.113208,sigmoid,0.15000000000000002,6,0.5,0.13925008475780487,,,PRUNED
1613,1613,0.12145674973726273,2023-01-06 02:07:46.263481,2023-01-06 02:07:53.258219,0 days 00:00:06.994738,sigmoid,0.1,2,0.65,0.12145674973726273,,,PRUNED
1614,1614,0.144385427236557,2023-01-06 02:07:53.370266,2023-01-06 02:08:00.199173,0 days 00:00:06.828907,sigmoid,0.15000000000000002,2,0.95,0.144385427236557,,,PRUNED
1615,1615,0.14042969048023224,2023-01-06 02:08:00.313408,2023-01-06 02:08:07.131976,0 days 00:00:06.818568,sigmoid,0.1,2,0.5,0.14042969048023224,,,PRUNED
1616,1616,0.14982803165912628,2023-01-06 02:08:07.244742,2023-01-06 02:08:34.350378,0 days 00:00:27.105636,relu,0.15000000000000002,2,0.65,0.05836894363164902,0.03539669141173363,,COMPLETE
1617,1617,0.07250672578811646,2023-01-06 02:08:34.468819,2023-01-06 02:08:46.261334,0 days 00:00:11.792515,relu,0.45,2,0.95,0.07250672578811646,,,PRUNED
1618,1618,0.12920723855495453,2023-01-06 02:08:46.380911,2023-01-06 02:08:53.170150,0 days 00:00:06.789239,sigmoid,0.30000000000000004,2,0.5,0.12920723855495453,,,PRUNED
1619,1619,0.06707143783569336,2023-01-06 02:08:53.282737,2023-01-06 02:09:05.377122,0 days 00:00:12.094385,sigmoid,0.15000000000000002,2,0.55,0.06618010252714157,0.06707143783569336,,PRUNED
1620,1620,0.0379466786980629,2023-01-06 02:09:05.487798,2023-01-06 02:09:31.958869,0 days 00:00:26.471071,sigmoid,0.05,2,0.8500000000000001,0.0379466786980629,,,PRUNED
1621,1621,0.12267837673425674,2023-01-06 02:09:32.082048,2023-01-06 02:09:38.958334,0 days 00:00:06.876286,sigmoid,0.25,2,0.5,0.12267837673425674,,,PRUNED
1622,1622,0.07636228203773499,2023-01-06 02:09:39.046067,2023-01-06 02:09:50.957420,0 days 00:00:11.911353,relu,0.05,2,0.5,0.07525575906038284,0.07636228203773499,,PRUNED
1623,1623,0.03488053381443024,2023-01-06 02:09:51.067655,2023-01-06 02:10:18.372007,0 days 00:00:27.304352,sigmoid,0.15000000000000002,2,0.5,0.06643861532211304,0.047677360475063324,0.03488053381443024,PRUNED
1624,1624,0.06250695884227753,2023-01-06 02:10:18.493998,2023-01-06 02:10:30.471086,0 days 00:00:11.977088,relu,0.2,2,0.8500000000000001,0.08892519772052765,0.06250695884227753,,PRUNED
1625,1625,0.14864270389080048,2023-01-06 02:10:30.590662,2023-01-06 02:10:59.795466,0 days 00:00:29.204804,sigmoid,0.1,2,0.8500000000000001,0.03492338955402374,,,COMPLETE
1626,1626,0.04441651701927185,2023-01-06 02:10:59.924436,2023-01-06 02:11:26.832469,0 days 00:00:26.908033,tanh,0.05,2,0.9,0.04441651701927185,,,PRUNED
1627,1627,0.0427686832845211,2023-01-06 02:11:26.944708,2023-01-06 02:11:53.722088,0 days 00:00:26.777380,relu,0.4,2,0.75,0.058759089559316635,0.0427686832845211,,PRUNED
1628,1628,0.04014844819903374,2023-01-06 02:11:53.836329,2023-01-06 02:12:20.520379,0 days 00:00:26.684050,sigmoid,0.05,2,0.55,0.04014844819903374,,,PRUNED
1629,1629,0.06557997316122055,2023-01-06 02:12:20.642618,2023-01-06 02:12:32.911776,0 days 00:00:12.269158,sigmoid,0.15000000000000002,2,0.5,0.07402464747428894,0.06557997316122055,,PRUNED
1630,1630,0.055983707308769226,2023-01-06 02:12:33.032526,2023-01-06 02:12:45.091993,0 days 00:00:12.059467,relu,0.05,2,0.5,0.08534971624612808,0.055983707308769226,,PRUNED
1631,1631,0.12701956927776337,2023-01-06 02:12:45.216758,2023-01-06 02:12:52.099792,0 days 00:00:06.883034,sigmoid,0.1,2,0.7,0.12701956927776337,,,PRUNED
1632,1632,0.14146986603736877,2023-01-06 02:12:52.204892,2023-01-06 02:13:24.259205,0 days 00:00:32.054313,sigmoid,0.1,2,0.9,0.03390122577548027,,,COMPLETE
1633,1633,0.11987509578466415,2023-01-06 02:13:24.389447,2023-01-06 02:13:31.271804,0 days 00:00:06.882357,relu,0.15000000000000002,2,0.8,0.11987509578466415,,,PRUNED
1634,1634,0.08333192765712738,2023-01-06 02:13:31.385235,2023-01-06 02:13:43.304446,0 days 00:00:11.919211,relu,0.4,2,0.8,0.08333192765712738,,,PRUNED
1635,1635,0.1413499265909195,2023-01-06 02:13:43.410331,2023-01-06 02:14:13.225186,0 days 00:00:29.814855,relu,0.35000000000000003,2,0.65,0.055876582860946655,0.0316481739282608,,COMPLETE
1636,1636,0.055447500199079514,2023-01-06 02:14:13.345597,2023-01-06 02:14:25.341695,0 days 00:00:11.996098,sigmoid,0.4,2,0.5,0.08112577348947525,0.055447500199079514,,PRUNED
1637,1637,0.036065973341464996,2023-01-06 02:14:25.473799,2023-01-06 02:14:52.433837,0 days 00:00:26.960038,sigmoid,0.25,2,0.75,0.07833708077669144,0.05037865787744522,0.036065973341464996,PRUNED
1638,1638,0.05554885044693947,2023-01-06 02:14:52.547038,2023-01-06 02:15:04.731374,0 days 00:00:12.184336,relu,0.15000000000000002,2,0.5,0.08978524804115295,0.05554885044693947,,PRUNED
1639,1639,0.039453744888305664,2023-01-06 02:15:04.848476,2023-01-06 02:15:32.129045,0 days 00:00:27.280569,sigmoid,0.1,3,0.55,0.08277799934148788,0.053585994988679886,0.039453744888305664,PRUNED
1640,1640,0.037754159420728683,2023-01-06 02:15:32.252049,2023-01-06 02:15:59.343006,0 days 00:00:27.090957,relu,0.25,2,0.55,0.05860043317079544,0.037754159420728683,,PRUNED
1641,1641,0.11387328803539276,2023-01-06 02:15:59.459318,2023-01-06 02:16:06.385023,0 days 00:00:06.925705,relu,0.15000000000000002,2,1.0,0.11387328803539276,,,PRUNED
1642,1642,0.055969372391700745,2023-01-06 02:16:06.499446,2023-01-06 02:16:18.399778,0 days 00:00:11.900332,sigmoid,0.2,2,0.65,0.08992423862218857,0.055969372391700745,,PRUNED
1643,1643,0.13759756088256836,2023-01-06 02:16:18.549403,2023-01-06 02:16:52.936051,0 days 00:00:34.386648,sigmoid,0.2,2,0.8,0.03584815561771393,,,COMPLETE
1644,1644,0.3541660010814667,2023-01-06 02:16:53.066261,2023-01-06 02:17:13.181181,0 days 00:00:20.114920,relu,0.0,7,0.65,,,,COMPLETE
1645,1645,0.05469692870974541,2023-01-06 02:17:13.305384,2023-01-06 02:17:39.885245,0 days 00:00:26.579861,tanh,0.0,2,0.8500000000000001,0.05469692870974541,,,PRUNED
1646,1646,0.0826248824596405,2023-01-06 02:17:40.008946,2023-01-06 02:17:51.960328,0 days 00:00:11.951382,relu,0.2,2,0.75,0.0826248824596405,,,PRUNED
1647,1647,0.12187143415212631,2023-01-06 02:17:52.081586,2023-01-06 02:17:59.142108,0 days 00:00:07.060522,relu,0.15000000000000002,2,0.5,0.12187143415212631,,,PRUNED
1648,1648,0.07404664158821106,2023-01-06 02:17:59.250211,2023-01-06 02:18:10.974935,0 days 00:00:11.724724,relu,0.4,2,0.7,0.07404664158821106,,,PRUNED
1649,1649,0.14032422006130219,2023-01-06 02:18:11.092119,2023-01-06 02:18:17.950013,0 days 00:00:06.857894,sigmoid,0.30000000000000004,2,0.5,0.14032422006130219,,,PRUNED
1650,1650,0.10047206282615662,2023-01-06 02:18:18.063132,2023-01-06 02:18:25.259166,0 days 00:00:07.196034,relu,0.25,2,0.5,0.10047206282615662,,,PRUNED
1651,1651,0.044273845851421356,2023-01-06 02:18:25.380564,2023-01-06 02:18:52.288814,0 days 00:00:26.908250,sigmoid,0.05,2,0.8500000000000001,0.044273845851421356,,,PRUNED
1652,1652,0.08053841441869736,2023-01-06 02:18:52.406508,2023-01-06 02:19:04.688128,0 days 00:00:12.281620,sigmoid,0.15000000000000002,5,0.5,0.08588144928216934,0.08053841441869736,,PRUNED
1653,1653,0.07982257753610611,2023-01-06 02:19:04.802560,2023-01-06 02:19:16.969534,0 days 00:00:12.166974,tanh,0.25,2,0.6,0.07982257753610611,,,PRUNED
1654,1654,0.07365741580724716,2023-01-06 02:19:17.112608,2023-01-06 02:19:28.985285,0 days 00:00:11.872677,relu,0.2,2,1.0,0.07365741580724716,,,PRUNED
1655,1655,0.1302994042634964,2023-01-06 02:19:29.100713,2023-01-06 02:19:36.018609,0 days 00:00:06.917896,sigmoid,0.2,2,0.55,0.1302994042634964,,,PRUNED
1656,1656,0.06249058619141579,2023-01-06 02:19:36.123697,2023-01-06 02:19:48.234642,0 days 00:00:12.110945,relu,0.15000000000000002,2,0.5,0.07170587033033371,0.06249058619141579,,PRUNED
1657,1657,0.12306101620197296,2023-01-06 02:19:48.359114,2023-01-06 02:19:55.284290,0 days 00:00:06.925176,sigmoid,0.1,2,0.5,0.12306101620197296,,,PRUNED
1658,1658,0.03653346747159958,2023-01-06 02:19:55.400714,2023-01-06 02:20:22.348887,0 days 00:00:26.948173,relu,0.05,2,0.5,0.07633955776691437,0.05101144686341286,0.03653346747159958,PRUNED
1659,1659,0.07956822216510773,2023-01-06 02:20:22.472656,2023-01-06 02:20:34.797655,0 days 00:00:12.324999,relu,0.35000000000000003,5,0.7,0.07956822216510773,,,PRUNED
1660,1660,0.035241637378931046,2023-01-06 02:20:34.921708,2023-01-06 02:21:02.003207,0 days 00:00:27.081499,sigmoid,0.15000000000000002,2,0.55,0.06711272895336151,0.04615587368607521,0.035241637378931046,PRUNED
1661,1661,0.14081741869449615,2023-01-06 02:21:02.125251,2023-01-06 02:21:08.987006,0 days 00:00:06.861755,relu,0.35000000000000003,2,0.5,0.14081741869449615,,,PRUNED
1662,1662,0.13904322683811188,2023-01-06 02:21:09.103443,2023-01-06 02:21:36.228409,0 days 00:00:27.124966,sigmoid,0.45,2,0.75,0.058824677020311356,0.042259372770786285,0.031021008267998695,COMPLETE
1663,1663,0.09831815212965012,2023-01-06 02:21:36.354647,2023-01-06 02:21:43.501054,0 days 00:00:07.146407,sigmoid,0.05,2,0.5,0.09831815212965012,,,PRUNED
1664,1664,0.03868912532925606,2023-01-06 02:21:43.616479,2023-01-06 02:22:10.166016,0 days 00:00:26.549537,sigmoid,0.0,2,0.9,0.03868912532925606,,,PRUNED
1665,1665,0.13651499152183533,2023-01-06 02:22:10.279125,2023-01-06 02:22:39.794897,0 days 00:00:29.515772,relu,0.4,2,0.65,0.04700480028986931,0.034539032727479935,,COMPLETE
1666,1666,0.44504690170288086,2023-01-06 02:22:39.912884,2023-01-06 02:22:47.374308,0 days 00:00:07.461424,relu,0.15000000000000002,7,0.5,0.44504690170288086,,,PRUNED
1667,1667,0.05749301612377167,2023-01-06 02:22:47.487628,2023-01-06 02:22:59.314459,0 days 00:00:11.826831,sigmoid,0.1,2,0.65,0.09490319341421127,0.05749301612377167,,PRUNED
1668,1668,0.0390714593231678,2023-01-06 02:22:59.441041,2023-01-06 02:23:26.070357,0 days 00:00:26.629316,sigmoid,0.0,2,0.8500000000000001,0.0390714593231678,,,PRUNED
1669,1669,0.12122003734111786,2023-01-06 02:23:26.184678,2023-01-06 02:23:33.379134,0 days 00:00:07.194456,relu,0.25,2,0.5,0.12122003734111786,,,PRUNED
1670,1670,0.03920869156718254,2023-01-06 02:23:33.484121,2023-01-06 02:24:00.167933,0 days 00:00:26.683812,tanh,0.35000000000000003,2,0.8500000000000001,0.03920869156718254,,,PRUNED
1671,1671,0.06666434556245804,2023-01-06 02:24:00.288419,2023-01-06 02:24:12.184525,0 days 00:00:11.896106,relu,0.4,2,0.6,0.06666434556245804,,,PRUNED
1672,1672,0.0356331393122673,2023-01-06 02:24:12.322853,2023-01-06 02:24:39.581435,0 days 00:00:27.258582,sigmoid,0.15000000000000002,2,0.5,0.07593784481287003,0.05135685205459595,0.0356331393122673,PRUNED
1673,1673,0.13504146039485931,2023-01-06 02:24:39.693751,2023-01-06 02:24:46.681698,0 days 00:00:06.987947,relu,0.0,2,0.5,0.13504146039485931,,,PRUNED
1674,1674,0.13005898892879486,2023-01-06 02:24:46.784888,2023-01-06 02:24:53.673029,0 days 00:00:06.888141,sigmoid,0.15000000000000002,2,0.5,0.13005898892879486,,,PRUNED
1675,1675,0.12030428647994995,2023-01-06 02:24:53.804036,2023-01-06 02:25:00.805818,0 days 00:00:07.001782,relu,0.2,2,0.7,0.12030428647994995,,,PRUNED
1676,1676,0.14416714012622833,2023-01-06 02:25:00.909803,2023-01-06 02:25:28.108552,0 days 00:00:27.198749,relu,0.45,2,0.65,0.05965402349829674,0.032284170389175415,,COMPLETE
1677,1677,0.13966885209083557,2023-01-06 02:25:28.254093,2023-01-06 02:25:57.404403,0 days 00:00:29.150310,sigmoid,0.05,2,0.7,0.035175833851099014,,,COMPLETE
1678,1678,0.03810502588748932,2023-01-06 02:25:57.541390,2023-01-06 02:26:24.323474,0 days 00:00:26.782084,relu,0.2,2,0.7,0.05039112642407417,0.03810502588748932,,PRUNED
1679,1679,0.037634607404470444,2023-01-06 02:26:24.446116,2023-01-06 02:26:51.338088,0 days 00:00:26.891972,sigmoid,0.0,2,0.8500000000000001,0.037634607404470444,,,PRUNED
1680,1680,0.03839525952935219,2023-01-06 02:26:51.450405,2023-01-06 02:27:18.152702,0 days 00:00:26.702297,sigmoid,0.0,2,0.65,0.03839525952935219,,,PRUNED
1681,1681,0.03445027396082878,2023-01-06 02:27:18.263029,2023-01-06 02:27:45.184980,0 days 00:00:26.921951,sigmoid,0.05,2,0.55,0.06950751692056656,0.0536663793027401,0.03445027396082878,PRUNED
1682,1682,0.03642209991812706,2023-01-06 02:27:45.304199,2023-01-06 02:28:12.315251,0 days 00:00:27.011052,sigmoid,0.4,2,0.7,0.05832833796739578,0.03642209991812706,,PRUNED
1683,1683,0.14377494156360626,2023-01-06 02:28:12.436915,2023-01-06 02:28:44.290818,0 days 00:00:31.853903,tanh,0.15000000000000002,2,0.9,0.03374607115983963,,,COMPLETE
1684,1684,0.06996592879295349,2023-01-06 02:28:44.410927,2023-01-06 02:28:56.412898,0 days 00:00:12.001971,sigmoid,0.1,3,0.8500000000000001,0.07242238521575928,0.06996592879295349,,PRUNED
1685,1685,0.13020744919776917,2023-01-06 02:28:56.533559,2023-01-06 02:29:03.654023,0 days 00:00:07.120464,relu,0.30000000000000004,2,0.5,0.13020744919776917,,,PRUNED
1686,1686,0.1202811598777771,2023-01-06 02:29:03.891594,2023-01-06 02:29:10.820134,0 days 00:00:06.928540,sigmoid,0.15000000000000002,2,0.9,0.1202811598777771,,,PRUNED
1687,1687,0.05987420305609703,2023-01-06 02:29:10.932450,2023-01-06 02:29:22.810888,0 days 00:00:11.878438,relu,0.15000000000000002,2,0.5,0.09602335840463638,0.05987420305609703,,PRUNED
1688,1688,0.13264067471027374,2023-01-06 02:29:22.932008,2023-01-06 02:29:29.785207,0 days 00:00:06.853199,sigmoid,0.2,2,0.55,0.13264067471027374,,,PRUNED
1689,1689,0.04074577987194061,2023-01-06 02:29:30.091493,2023-01-06 02:29:56.973964,0 days 00:00:26.882471,relu,0.4,2,0.6,0.06152426823973656,0.04074577987194061,,PRUNED
1690,1690,0.13526929914951324,2023-01-06 02:29:57.079945,2023-01-06 02:30:28.826433,0 days 00:00:31.746488,sigmoid,0.1,2,0.8500000000000001,0.035393860191106796,,,COMPLETE
1691,1691,0.14149193465709686,2023-01-06 02:30:28.954205,2023-01-06 02:30:56.065853,0 days 00:00:27.111648,relu,0.25,2,0.8,0.06050266698002815,0.04226072505116463,0.031013527885079384,COMPLETE
1692,1692,0.07806486636400223,2023-01-06 02:30:56.191796,2023-01-06 02:31:07.985229,0 days 00:00:11.793433,relu,0.30000000000000004,2,0.55,0.07806486636400223,,,PRUNED
