,number,value,datetime_start,datetime_complete,duration,params_activation,params_dropout,params_layers,params_shrink,system_attrs_completed_rung_0,system_attrs_completed_rung_1,system_attrs_completed_rung_2,state
0,0,0.17649532854557037,2023-01-05 17:14:59.523905,2023-01-05 17:15:30.376662,0 days 00:00:30.852757,relu,0.35000000000000003,5,1.0,,,,COMPLETE
1,1,0.3385331332683563,2023-01-05 17:15:30.495906,2023-01-05 17:15:50.515187,0 days 00:00:20.019281,tanh,0.45,7,0.65,0.18515807390213013,0.5227978229522705,,COMPLETE
2,2,0.14690999686717987,2023-01-05 17:15:50.647372,2023-01-05 17:16:22.743466,0 days 00:00:32.096094,relu,0.05,2,0.55,0.09967634081840515,0.056881438940763474,0.040340323001146317,COMPLETE
3,3,0.31512776017189026,2023-01-05 17:16:22.870727,2023-01-05 17:16:40.151480,0 days 00:00:17.280753,tanh,0.0,6,0.8500000000000001,,,,COMPLETE
4,4,0.12199507653713226,2023-01-05 17:16:40.260646,2023-01-05 17:16:47.125529,0 days 00:00:06.864883,tanh,0.05,4,0.8500000000000001,0.12199507653713226,,,PRUNED
5,5,0.5136056542396545,2023-01-05 17:16:47.205795,2023-01-05 17:16:54.474729,0 days 00:00:07.268934,tanh,0.05,8,0.55,0.5136056542396545,,,PRUNED
6,6,0.13678650557994843,2023-01-05 17:16:54.589218,2023-01-05 17:17:02.033442,0 days 00:00:07.444224,relu,0.35000000000000003,8,1.0,0.13678650557994843,,,PRUNED
7,7,0.06424200534820557,2023-01-05 17:17:02.129314,2023-01-05 17:17:14.032710,0 days 00:00:11.903396,relu,0.1,3,0.6,0.1161375567317009,0.06424200534820557,,PRUNED
8,8,,2023-01-05 17:17:14.120079,,,tanh,0.30000000000000004,3,0.9,0.09044921398162842,,,RUNNING
9,9,0.24608494341373444,2023-01-05 18:41:50.327465,2023-01-05 18:42:14.067892,0 days 00:00:23.740427,relu,0.2,5,0.95,,,,COMPLETE
10,10,0.25370174646377563,2023-01-05 18:42:14.186242,2023-01-05 18:42:34.580205,0 days 00:00:20.393963,tanh,0.2,6,0.9,,,,COMPLETE
11,11,0.06529232859611511,2023-01-05 18:42:34.698373,2023-01-05 18:42:47.085906,0 days 00:00:12.387533,sigmoid,0.2,3,0.8500000000000001,0.06425263732671738,0.06529232859611511,,PRUNED
12,12,0.2931113839149475,2023-01-05 18:42:47.178096,2023-01-05 18:42:54.625541,0 days 00:00:07.447445,sigmoid,0.15000000000000002,7,0.75,0.2931113839149475,,,PRUNED
13,13,0.1128857210278511,2023-01-05 18:42:54.727532,2023-01-05 18:43:01.991432,0 days 00:00:07.263900,relu,0.25,5,1.0,0.1128857210278511,,,PRUNED
14,14,0.17091800272464752,2023-01-05 18:43:02.116641,2023-01-05 18:43:32.907721,0 days 00:00:30.791080,tanh,0.5,3,1.0,0.08788713812828064,0.054464634507894516,,COMPLETE
15,15,0.4491925835609436,2023-01-05 18:43:33.036312,2023-01-05 18:43:40.546379,0 days 00:00:07.510067,relu,0.35000000000000003,8,0.7,0.4491925835609436,,,PRUNED
16,16,0.14569221436977386,2023-01-05 18:43:40.648481,2023-01-05 18:44:08.502581,0 days 00:00:27.854100,relu,0.0,2,0.5,0.03228482976555824,,,COMPLETE
17,17,0.06239454448223114,2023-01-05 18:44:08.615639,2023-01-05 18:44:20.835353,0 days 00:00:12.219714,relu,0.5,2,0.5,0.07110181450843811,0.06239454448223114,,PRUNED
18,18,0.4315949082374573,2023-01-05 18:44:20.926877,2023-01-05 18:44:33.951189,0 days 00:00:13.024312,relu,0.30000000000000004,8,0.6,0.4315949082374573,,,PRUNED
19,19,0.41647616028785706,2023-01-05 18:44:34.051414,2023-01-05 18:44:46.808704,0 days 00:00:12.757290,relu,0.0,8,0.55,0.41647616028785706,,,PRUNED
20,20,0.09131216257810593,2023-01-05 18:44:46.911780,2023-01-05 18:45:15.106448,0 days 00:00:28.194668,relu,0.25,5,0.5,0.09131216257810593,,,PRUNED
21,21,0.15834127366542816,2023-01-05 18:45:15.206660,2023-01-05 18:45:51.466299,0 days 00:00:36.259639,relu,0.30000000000000004,3,0.65,0.07618189603090286,0.051395196467638016,,COMPLETE
22,22,0.28396087884902954,2023-01-05 18:45:51.583478,2023-01-05 18:46:04.418767,0 days 00:00:12.835289,tanh,0.0,6,0.8500000000000001,0.09855857491493225,0.28396087884902954,,PRUNED
23,23,0.4040614664554596,2023-01-05 18:46:04.518946,2023-01-05 18:46:17.201813,0 days 00:00:12.682867,tanh,0.15000000000000002,7,0.8,0.4040614664554596,,,PRUNED
24,24,0.18544363975524902,2023-01-05 18:46:17.302039,2023-01-05 18:46:30.341954,0 days 00:00:13.039915,sigmoid,0.4,6,0.75,0.18544363975524902,,,PRUNED
25,25,0.17808173596858978,2023-01-05 18:46:30.443285,2023-01-05 18:46:37.925262,0 days 00:00:07.481977,tanh,0.0,5,0.65,0.17808173596858978,,,PRUNED
26,26,0.2138083130121231,2023-01-05 18:46:38.051119,2023-01-05 18:46:58.747452,0 days 00:00:20.696333,relu,0.1,4,0.9,0.1785193234682083,,,COMPLETE
27,27,0.14835961163043976,2023-01-05 18:46:58.862543,2023-01-05 18:47:31.991728,0 days 00:00:33.129185,sigmoid,0.1,2,0.65,0.06860607862472534,0.03738510236144066,,COMPLETE
28,28,0.09471417963504791,2023-01-05 18:47:32.116487,2023-01-05 18:47:44.428618,0 days 00:00:12.312131,tanh,0.35000000000000003,4,0.95,0.09471417963504791,,,PRUNED
29,29,0.254558265209198,2023-01-05 18:47:44.537163,2023-01-05 18:48:07.641930,0 days 00:00:23.104767,tanh,0.15000000000000002,6,0.55,,,,COMPLETE
30,30,0.13187876343727112,2023-01-05 18:48:07.764807,2023-01-05 18:48:15.450912,0 days 00:00:07.686105,tanh,0.15000000000000002,6,0.9,0.13187876343727112,,,PRUNED
31,31,0.11128316819667816,2023-01-05 18:48:15.559876,2023-01-05 18:48:22.475683,0 days 00:00:06.915807,sigmoid,0.0,2,0.75,0.11128316819667816,,,PRUNED
32,32,0.15743832290172577,2023-01-05 18:48:22.560927,2023-01-05 18:48:29.858500,0 days 00:00:07.297573,relu,0.1,6,0.5,0.15743832290172577,,,PRUNED
33,33,0.06312490254640579,2023-01-05 18:48:29.977835,2023-01-05 18:48:42.774972,0 days 00:00:12.797137,tanh,0.35000000000000003,4,0.65,0.07626074552536011,0.06312490254640579,,PRUNED
34,34,0.370141863822937,2023-01-05 18:48:42.885087,2023-01-05 18:49:03.635747,0 days 00:00:20.750660,relu,0.0,8,0.75,,,,COMPLETE
35,35,0.15167692303657532,2023-01-05 18:49:03.759894,2023-01-05 18:49:42.164245,0 days 00:00:38.404351,sigmoid,0.15000000000000002,2,0.5,0.07763754576444626,0.04249372333288193,,COMPLETE
36,36,0.14885985851287842,2023-01-05 18:49:42.273677,2023-01-05 18:49:49.894209,0 days 00:00:07.620532,tanh,0.1,4,0.9,0.14885985851287842,,,PRUNED
37,37,0.2746714651584625,2023-01-05 18:49:50.003322,2023-01-05 18:50:10.480282,0 days 00:00:20.476960,relu,0.0,6,0.5,,,,COMPLETE
38,38,0.1422276496887207,2023-01-05 18:50:10.597558,2023-01-05 18:50:46.477564,0 days 00:00:35.880006,sigmoid,0.15000000000000002,2,0.5,0.061311449855566025,0.03775697201490402,,COMPLETE
39,39,0.11021656543016434,2023-01-05 18:50:46.604305,2023-01-05 18:50:54.189427,0 days 00:00:07.585122,relu,0.25,7,0.75,0.11021656543016434,,,PRUNED
40,40,0.10673458874225616,2023-01-05 18:50:54.289599,2023-01-05 18:51:06.746267,0 days 00:00:12.456668,sigmoid,0.5,3,0.8,0.07389144599437714,0.10673458874225616,,PRUNED
41,41,0.11353749781847,2023-01-05 18:51:06.856318,2023-01-05 18:51:14.212880,0 days 00:00:07.356562,relu,0.05,5,0.95,0.11353749781847,,,PRUNED
42,42,0.13317881524562836,2023-01-05 18:51:14.315006,2023-01-05 18:51:21.379019,0 days 00:00:07.064013,relu,0.5,2,0.5,0.13317881524562836,,,PRUNED
43,43,0.06435427814722061,2023-01-05 18:51:21.488004,2023-01-05 18:51:34.119719,0 days 00:00:12.631715,relu,0.45,2,0.55,0.08655773103237152,0.06435427814722061,,PRUNED
44,44,0.1385076493024826,2023-01-05 18:51:34.229217,2023-01-05 18:51:41.194084,0 days 00:00:06.964867,relu,0.4,2,0.55,0.1385076493024826,,,PRUNED
45,45,0.03894016519188881,2023-01-05 18:51:41.294987,2023-01-05 18:52:09.316808,0 days 00:00:28.021821,sigmoid,0.0,2,0.5,0.0742916390299797,0.03894016519188881,,PRUNED
46,46,0.10074756294488907,2023-01-05 18:52:09.408971,2023-01-05 18:52:16.791526,0 days 00:00:07.382555,relu,0.30000000000000004,3,0.6,0.10074756294488907,,,PRUNED
47,47,0.14796222746372223,2023-01-05 18:52:16.892113,2023-01-05 18:52:24.332622,0 days 00:00:07.440509,tanh,0.2,7,0.5,0.14796222746372223,,,PRUNED
48,48,0.12182704359292984,2023-01-05 18:52:24.416164,2023-01-05 18:52:31.606806,0 days 00:00:07.190642,relu,0.45,4,0.6,0.12182704359292984,,,PRUNED
49,49,0.12895260751247406,2023-01-05 18:52:31.741313,2023-01-05 18:53:08.035120,0 days 00:00:36.293807,tanh,0.15000000000000002,2,0.65,0.07219439744949341,0.058104850351810455,0.03168073296546936,COMPLETE
50,50,0.03743791580200195,2023-01-05 18:53:08.175901,2023-01-05 18:53:36.027236,0 days 00:00:27.851335,sigmoid,0.35000000000000003,2,0.8500000000000001,0.03743791580200195,,,PRUNED
51,51,0.14461635053157806,2023-01-05 18:53:36.138114,2023-01-05 18:53:43.335025,0 days 00:00:07.196911,tanh,0.15000000000000002,3,0.7,0.14461635053157806,,,PRUNED
52,52,0.10380084067583084,2023-01-05 18:53:43.443566,2023-01-05 18:53:56.150500,0 days 00:00:12.706934,tanh,0.05,5,0.65,0.09812849014997482,0.10380084067583084,,PRUNED
53,53,0.08334717154502869,2023-01-05 18:53:56.242583,2023-01-05 18:54:08.849630,0 days 00:00:12.607047,sigmoid,0.1,2,0.75,0.08334717154502869,,,PRUNED
54,54,0.14435304701328278,2023-01-05 18:54:08.958749,2023-01-05 18:54:16.324204,0 days 00:00:07.365455,tanh,0.1,6,0.8,0.14435304701328278,,,PRUNED
55,55,0.12336760759353638,2023-01-05 18:54:16.419632,2023-01-05 18:54:28.931824,0 days 00:00:12.512192,sigmoid,0.2,4,0.65,0.12336760759353638,,,PRUNED
56,56,0.06973595917224884,2023-01-05 18:54:29.041517,2023-01-05 18:54:41.581101,0 days 00:00:12.539584,tanh,0.0,2,0.55,0.09147903323173523,0.06973595917224884,,PRUNED
57,57,0.03470722958445549,2023-01-05 18:54:41.689194,2023-01-05 18:55:09.861589,0 days 00:00:28.172395,tanh,0.05,2,0.5,0.07355523109436035,0.053560275584459305,0.03470722958445549,PRUNED
58,58,0.1211903914809227,2023-01-05 18:55:09.970989,2023-01-05 18:55:17.195160,0 days 00:00:07.224171,tanh,0.05,3,0.6,0.1211903914809227,,,PRUNED
59,59,0.2609140872955322,2023-01-05 18:55:17.294853,2023-01-05 18:55:45.875802,0 days 00:00:28.580949,tanh,0.35000000000000003,7,0.55,0.2609140872955322,,,PRUNED
60,60,0.10005596280097961,2023-01-05 18:55:45.985819,2023-01-05 18:55:58.591526,0 days 00:00:12.605707,sigmoid,0.05,3,0.6,0.10005596280097961,,,PRUNED
61,61,0.1316610872745514,2023-01-05 18:55:58.693120,2023-01-05 18:56:05.815612,0 days 00:00:07.122492,tanh,0.05,2,0.7,0.1316610872745514,,,PRUNED
62,62,0.10450787097215652,2023-01-05 18:56:05.925516,2023-01-05 18:56:13.157080,0 days 00:00:07.231564,tanh,0.2,3,0.55,0.10450787097215652,,,PRUNED
63,63,0.11341136693954468,2023-01-05 18:56:13.260300,2023-01-05 18:56:20.681150,0 days 00:00:07.420850,tanh,0.1,4,0.65,0.11341136693954468,,,PRUNED
64,64,0.038174740970134735,2023-01-05 18:56:20.798399,2023-01-05 18:56:48.679410,0 days 00:00:27.881011,sigmoid,0.5,2,0.7,0.038174740970134735,,,PRUNED
65,65,0.13407182693481445,2023-01-05 18:56:48.788957,2023-01-05 18:56:55.978869,0 days 00:00:07.189912,sigmoid,0.05,3,0.55,0.13407182693481445,,,PRUNED
66,66,0.12450966238975525,2023-01-05 18:56:56.098107,2023-01-05 18:57:03.103060,0 days 00:00:07.004953,tanh,0.15000000000000002,2,0.8,0.12450966238975525,,,PRUNED
67,67,0.1494019329547882,2023-01-05 18:57:03.188177,2023-01-05 18:57:16.118925,0 days 00:00:12.930748,sigmoid,0.2,5,0.8,0.1494019329547882,,,PRUNED
68,68,0.1779521405696869,2023-01-05 18:57:16.219226,2023-01-05 18:57:23.618455,0 days 00:00:07.399229,tanh,0.1,7,0.6,0.1779521405696869,,,PRUNED
69,69,0.11108904331922531,2023-01-05 18:57:23.702020,2023-01-05 18:57:30.759987,0 days 00:00:07.057967,sigmoid,0.0,2,0.9,0.11108904331922531,,,PRUNED
70,70,0.03527939319610596,2023-01-05 18:57:30.861984,2023-01-05 18:57:59.124208,0 days 00:00:28.262224,relu,0.2,2,0.5,0.08830121159553528,0.05987705662846565,0.03527939319610596,PRUNED
71,71,0.09024413675069809,2023-01-05 18:57:59.234454,2023-01-05 18:58:11.556479,0 days 00:00:12.322025,sigmoid,0.25,2,0.55,0.09024413675069809,,,PRUNED
72,72,0.046603888273239136,2023-01-05 18:58:11.666583,2023-01-05 18:58:39.729171,0 days 00:00:28.062588,relu,0.4,3,1.0,0.046603888273239136,,,PRUNED
73,73,0.03984581679105759,2023-01-05 18:58:39.838157,2023-01-05 18:59:08.027262,0 days 00:00:28.189105,relu,0.2,2,0.5,0.09434211254119873,0.05458962172269821,0.03984581679105759,PRUNED
74,74,0.19168736040592194,2023-01-05 18:59:08.128154,2023-01-05 18:59:20.959774,0 days 00:00:12.831620,sigmoid,0.1,5,0.7,0.19168736040592194,,,PRUNED
75,75,0.051203932613134384,2023-01-05 18:59:21.077766,2023-01-05 18:59:49.457664,0 days 00:00:28.379898,relu,0.1,4,0.65,0.051203932613134384,,,PRUNED
76,76,0.04314769059419632,2023-01-05 18:59:49.566790,2023-01-05 19:00:17.764443,0 days 00:00:28.197653,relu,0.45,3,0.8500000000000001,0.04314769059419632,,,PRUNED
77,77,0.06532394140958786,2023-01-05 19:00:17.872398,2023-01-05 19:00:46.344265,0 days 00:00:28.471867,relu,0.30000000000000004,4,0.65,0.06532394140958786,,,PRUNED
78,78,0.039728473871946335,2023-01-05 19:00:46.471068,2023-01-05 19:01:14.634580,0 days 00:00:28.163512,sigmoid,0.2,3,0.55,0.07142281532287598,0.039728473871946335,,PRUNED
79,79,0.110863596200943,2023-01-05 19:01:14.727262,2023-01-05 19:01:21.900506,0 days 00:00:07.173244,relu,0.15000000000000002,3,0.5,0.110863596200943,,,PRUNED
80,80,0.35097062587738037,2023-01-05 19:01:22.010127,2023-01-05 19:01:43.070830,0 days 00:00:21.060703,sigmoid,0.1,8,0.8,,,,COMPLETE
81,81,0.09315051883459091,2023-01-05 19:01:43.195576,2023-01-05 19:01:55.614893,0 days 00:00:12.419317,sigmoid,0.05,4,0.8500000000000001,0.09315051883459091,,,PRUNED
82,82,0.05073089897632599,2023-01-05 19:01:55.740956,2023-01-05 19:02:23.862499,0 days 00:00:28.121543,relu,0.30000000000000004,3,1.0,0.05073089897632599,,,PRUNED
83,83,0.03604484349489212,2023-01-05 19:02:23.971043,2023-01-05 19:02:52.060506,0 days 00:00:28.089463,tanh,0.0,2,0.55,0.06922496110200882,0.052507877349853516,0.03604484349489212,PRUNED
84,84,0.05970774590969086,2023-01-05 19:02:52.153254,2023-01-05 19:03:04.801106,0 days 00:00:12.647852,relu,0.2,2,0.7,0.09813535958528519,0.05970774590969086,,PRUNED
85,85,0.13826438784599304,2023-01-05 19:03:04.892210,2023-01-05 19:03:12.334516,0 days 00:00:07.442306,tanh,0.30000000000000004,6,0.6,0.13826438784599304,,,PRUNED
86,86,0.07958710193634033,2023-01-05 19:03:12.442392,2023-01-05 19:03:24.924567,0 days 00:00:12.482175,relu,0.25,3,0.5,0.09017051756381989,0.07958710193634033,,PRUNED
87,87,0.10039910674095154,2023-01-05 19:03:25.017147,2023-01-05 19:03:32.007069,0 days 00:00:06.989922,sigmoid,0.15000000000000002,2,1.0,0.10039910674095154,,,PRUNED
88,88,0.16552993655204773,2023-01-05 19:03:32.108472,2023-01-05 19:03:40.040089,0 days 00:00:07.931617,tanh,0.1,8,0.8500000000000001,0.16552993655204773,,,PRUNED
89,89,0.11616429686546326,2023-01-05 19:03:40.149634,2023-01-05 19:03:47.414581,0 days 00:00:07.264947,relu,0.0,4,0.95,0.11616429686546326,,,PRUNED
90,90,0.11568745225667953,2023-01-05 19:03:47.514743,2023-01-05 19:03:54.505397,0 days 00:00:06.990654,tanh,0.0,2,0.55,0.11568745225667953,,,PRUNED
91,91,0.03803147003054619,2023-01-05 19:03:54.614218,2023-01-05 19:04:22.936588,0 days 00:00:28.322370,tanh,0.0,2,0.55,0.08644717186689377,0.059500981122255325,0.03803147003054619,PRUNED
92,92,0.08582570403814316,2023-01-05 19:04:23.045401,2023-01-05 19:04:35.494243,0 days 00:00:12.448842,sigmoid,0.15000000000000002,2,0.5,0.08582570403814316,,,PRUNED
93,93,0.0733577311038971,2023-01-05 19:04:35.586822,2023-01-05 19:05:03.834225,0 days 00:00:28.247403,relu,0.05,4,0.6,0.0733577311038971,,,PRUNED
94,94,0.040352702140808105,2023-01-05 19:05:03.943327,2023-01-05 19:05:32.090402,0 days 00:00:28.147075,sigmoid,0.15000000000000002,2,0.5,0.06064451113343239,0.040352702140808105,,PRUNED
95,95,0.11950930207967758,2023-01-05 19:05:32.207549,2023-01-05 19:05:39.364738,0 days 00:00:07.157189,tanh,0.05,3,0.5,0.11950930207967758,,,PRUNED
96,96,0.09714251756668091,2023-01-05 19:05:39.457123,2023-01-05 19:05:51.821831,0 days 00:00:12.364708,sigmoid,0.25,3,0.6,0.09714251756668091,,,PRUNED
97,97,0.15797001123428345,2023-01-05 19:05:51.913702,2023-01-05 19:06:22.684242,0 days 00:00:30.770540,sigmoid,0.4,2,0.75,0.03872470557689667,,,COMPLETE
98,98,0.10823655128479004,2023-01-05 19:06:22.792003,2023-01-05 19:06:30.035613,0 days 00:00:07.243610,tanh,0.05,2,0.55,0.10823655128479004,,,PRUNED
99,99,0.06163010001182556,2023-01-05 19:06:30.153493,2023-01-05 19:06:42.443310,0 days 00:00:12.289817,tanh,0.05,2,0.65,0.07326973229646683,0.06163010001182556,,PRUNED
100,100,0.1223892942070961,2023-01-05 19:06:42.536903,2023-01-05 19:06:49.884106,0 days 00:00:07.347203,tanh,0.1,5,0.6,0.1223892942070961,,,PRUNED
101,101,0.04015951231122017,2023-01-05 19:06:50.009729,2023-01-05 19:07:18.190844,0 days 00:00:28.181115,sigmoid,0.5,2,0.75,0.04015951231122017,,,PRUNED
102,102,0.09801220148801804,2023-01-05 19:07:18.283154,2023-01-05 19:07:30.747931,0 days 00:00:12.464777,relu,0.0,3,0.5,0.09047539532184601,0.09801220148801804,,PRUNED
103,103,0.2810841202735901,2023-01-05 19:07:30.842597,2023-01-05 19:07:38.231165,0 days 00:00:07.388568,tanh,0.0,6,0.55,0.2810841202735901,,,PRUNED
104,104,0.0424412302672863,2023-01-05 19:07:38.323598,2023-01-05 19:08:06.195029,0 days 00:00:27.871431,sigmoid,0.05,2,0.5,0.06983881443738937,0.0424412302672863,,PRUNED
105,105,0.043568748980760574,2023-01-05 19:08:06.304587,2023-01-05 19:08:34.592884,0 days 00:00:28.288297,sigmoid,0.45,3,0.65,0.043568748980760574,,,PRUNED
106,106,0.13230520486831665,2023-01-05 19:08:34.702621,2023-01-05 19:09:13.540185,0 days 00:00:38.837564,relu,0.1,2,0.5,0.07365276664495468,0.05106935650110245,0.035035450011491776,COMPLETE
107,107,0.11553417146205902,2023-01-05 19:09:13.669844,2023-01-05 19:09:20.689414,0 days 00:00:07.019570,relu,0.15000000000000002,3,0.5,0.11553417146205902,,,PRUNED
108,108,0.04581539332866669,2023-01-05 19:09:20.790636,2023-01-05 19:09:48.787305,0 days 00:00:27.996669,sigmoid,0.4,2,0.9,0.04581539332866669,,,PRUNED
109,109,0.1251804083585739,2023-01-05 19:09:48.904707,2023-01-05 19:09:56.061960,0 days 00:00:07.157253,relu,0.05,2,0.5,0.1251804083585739,,,PRUNED
110,110,0.05251626670360565,2023-01-05 19:09:56.163631,2023-01-05 19:10:24.485234,0 days 00:00:28.321603,sigmoid,0.30000000000000004,4,0.8,0.05251626670360565,,,PRUNED
111,111,0.08748576045036316,2023-01-05 19:10:24.602247,2023-01-05 19:10:37.258646,0 days 00:00:12.656399,sigmoid,0.15000000000000002,3,0.7,0.08748576045036316,,,PRUNED
112,112,0.04119240865111351,2023-01-05 19:10:37.352758,2023-01-05 19:11:05.282358,0 days 00:00:27.929600,sigmoid,0.25,2,0.55,0.06778911501169205,0.04119240865111351,,PRUNED
113,113,0.03778552636504173,2023-01-05 19:11:05.399491,2023-01-05 19:11:33.587724,0 days 00:00:28.188233,relu,0.1,2,0.55,0.0957927480340004,0.05491270497441292,0.03778552636504173,PRUNED
114,114,0.12949715554714203,2023-01-05 19:11:33.695877,2023-01-05 19:11:40.804313,0 days 00:00:07.108436,relu,0.05,2,0.5,0.12949715554714203,,,PRUNED
115,115,0.050502464175224304,2023-01-05 19:11:40.897955,2023-01-05 19:12:09.302090,0 days 00:00:28.404135,relu,0.4,3,0.7,0.050502464175224304,,,PRUNED
116,116,0.08143336325883865,2023-01-05 19:12:09.419507,2023-01-05 19:12:21.842131,0 days 00:00:12.422624,sigmoid,0.1,3,0.6,0.08143336325883865,,,PRUNED
117,117,0.13675794005393982,2023-01-05 19:12:21.953007,2023-01-05 19:12:29.066831,0 days 00:00:07.113824,relu,0.1,2,0.75,0.13675794005393982,,,PRUNED
118,118,0.10105009377002716,2023-01-05 19:12:29.160260,2023-01-05 19:12:41.707587,0 days 00:00:12.547327,relu,0.2,4,0.7,0.10105009377002716,,,PRUNED
119,119,0.2623550593852997,2023-01-05 19:12:41.827682,2023-01-05 19:13:03.198524,0 days 00:00:21.370842,tanh,0.35000000000000003,7,0.95,,,,COMPLETE
120,120,0.14934201538562775,2023-01-05 19:13:03.321394,2023-01-05 19:13:33.973735,0 days 00:00:30.652341,sigmoid,0.25,2,0.8,0.04199816659092903,,,COMPLETE
121,121,0.14229752123355865,2023-01-05 19:13:34.094089,2023-01-05 19:14:04.833267,0 days 00:00:30.739178,sigmoid,0.25,2,0.8500000000000001,0.07758194953203201,0.05309605970978737,0.03273429349064827,COMPLETE
122,122,0.05873853713274002,2023-01-05 19:14:04.948637,2023-01-05 19:14:17.508206,0 days 00:00:12.559569,sigmoid,0.25,2,0.8500000000000001,0.09129435569047928,0.05873853713274002,,PRUNED
123,123,0.13376295566558838,2023-01-05 19:14:17.619224,2023-01-05 19:14:24.924803,0 days 00:00:07.305579,sigmoid,0.30000000000000004,3,0.9,0.13376295566558838,,,PRUNED
124,124,0.042499274015426636,2023-01-05 19:14:25.035701,2023-01-05 19:14:52.972914,0 days 00:00:27.937213,sigmoid,0.2,2,0.8,0.042499274015426636,,,PRUNED
125,125,0.15058746933937073,2023-01-05 19:14:53.091885,2023-01-05 19:15:21.224361,0 days 00:00:28.132476,sigmoid,0.1,2,0.7,0.03363101929426193,,,COMPLETE
126,126,0.04344954341650009,2023-01-05 19:15:21.343388,2023-01-05 19:15:49.855000,0 days 00:00:28.511612,sigmoid,0.05,3,0.6,0.04344954341650009,,,PRUNED
127,127,0.12624794244766235,2023-01-05 19:15:49.994514,2023-01-05 19:15:57.104666,0 days 00:00:07.110152,sigmoid,0.2,2,0.8500000000000001,0.12624794244766235,,,PRUNED
128,128,0.13325396180152893,2023-01-05 19:15:57.202615,2023-01-05 19:16:33.167395,0 days 00:00:35.964780,sigmoid,0.05,2,0.7,0.034533340483903885,,,COMPLETE
129,129,0.11240094155073166,2023-01-05 19:16:33.296189,2023-01-05 19:16:46.117484,0 days 00:00:12.821295,tanh,0.05,5,0.65,0.11240094155073166,,,PRUNED
130,130,0.3163059651851654,2023-01-05 19:16:46.224544,2023-01-05 19:16:53.741940,0 days 00:00:07.517396,sigmoid,0.15000000000000002,8,0.8,0.3163059651851654,,,PRUNED
131,131,0.15932266414165497,2023-01-05 19:16:53.841011,2023-01-05 19:17:01.349606,0 days 00:00:07.508595,sigmoid,0.25,7,0.75,0.15932266414165497,,,PRUNED
132,132,0.10392194986343384,2023-01-05 19:17:01.456418,2023-01-05 19:17:08.783381,0 days 00:00:07.326963,tanh,0.0,2,0.95,0.10392194986343384,,,PRUNED
133,133,0.10026157647371292,2023-01-05 19:17:08.881109,2023-01-05 19:17:15.999076,0 days 00:00:07.117967,relu,0.25,2,0.55,0.10026157647371292,,,PRUNED
