,number,value,datetime_start,datetime_complete,duration,params_activation,params_dropout,params_layers,params_shrink,system_attrs_completed_rung_0,system_attrs_completed_rung_1,system_attrs_completed_rung_2,state
1693,1693,0.12850069999694824,2023-01-06 02:31:08.104880,2023-01-06 02:31:15.060694,0 days 00:00:06.955814,sigmoid,0.1,2,0.5,0.12850069999694824,,,PRUNED
1694,1694,0.11552149802446365,2023-01-06 02:31:15.146702,2023-01-06 02:31:22.085147,0 days 00:00:06.938445,sigmoid,0.15000000000000002,2,0.5,0.11552149802446365,,,PRUNED
1695,1695,0.10664664953947067,2023-01-06 02:31:22.198474,2023-01-06 02:31:29.292942,0 days 00:00:07.094468,relu,0.15000000000000002,2,0.6,0.10664664953947067,,,PRUNED
1696,1696,0.03961130604147911,2023-01-06 02:31:29.381135,2023-01-06 02:31:55.907190,0 days 00:00:26.526055,sigmoid,0.05,2,0.8,0.03961130604147911,,,PRUNED
1697,1697,0.11385327577590942,2023-01-06 02:31:56.020897,2023-01-06 02:32:07.998134,0 days 00:00:11.977237,relu,0.35000000000000003,3,0.8500000000000001,0.11385327577590942,,,PRUNED
1698,1698,0.0457119382917881,2023-01-06 02:32:08.101228,2023-01-06 02:32:35.153775,0 days 00:00:27.052547,sigmoid,0.0,3,0.8500000000000001,0.0457119382917881,,,PRUNED
1699,1699,0.13610151410102844,2023-01-06 02:32:35.265912,2023-01-06 02:33:09.848674,0 days 00:00:34.582762,relu,0.25,2,0.7,0.05554109811782837,0.034634076058864594,,COMPLETE
1700,1700,0.13794001936912537,2023-01-06 02:33:09.974855,2023-01-06 02:33:41.760912,0 days 00:00:31.786057,tanh,0.0,2,0.8500000000000001,0.03589456155896187,,,COMPLETE
1701,1701,0.06353617459535599,2023-01-06 02:33:41.889852,2023-01-06 02:33:54.040143,0 days 00:00:12.150291,sigmoid,0.15000000000000002,2,0.65,0.06858257204294205,0.06353617459535599,,PRUNED
1702,1702,0.13788336515426636,2023-01-06 02:33:54.152576,2023-01-06 02:34:26.175205,0 days 00:00:32.022629,relu,0.4,2,0.65,0.04944264888763428,0.03468301147222519,,COMPLETE
1703,1703,0.03745005652308464,2023-01-06 02:34:26.293141,2023-01-06 02:34:53.034729,0 days 00:00:26.741588,sigmoid,0.0,2,0.9,0.03745005652308464,,,PRUNED
1704,1704,0.06157219409942627,2023-01-06 02:34:53.148087,2023-01-06 02:35:05.384833,0 days 00:00:12.236746,relu,0.25,2,0.5,0.06373795121908188,0.06157219409942627,,PRUNED
1705,1705,0.14378200471401215,2023-01-06 02:35:05.504501,2023-01-06 02:35:35.184621,0 days 00:00:29.680120,sigmoid,0.15000000000000002,2,0.5,0.08353130519390106,0.05241828039288521,0.033316101878881454,COMPLETE
1706,1706,0.14567343890666962,2023-01-06 02:35:35.303893,2023-01-06 02:36:02.052990,0 days 00:00:26.749097,sigmoid,0.15000000000000002,2,0.8,0.034171100705862045,,,COMPLETE
1707,1707,0.1233949139714241,2023-01-06 02:36:02.169515,2023-01-06 02:36:08.971668,0 days 00:00:06.802153,relu,0.15000000000000002,2,0.75,0.1233949139714241,,,PRUNED
1708,1708,0.038704242557287216,2023-01-06 02:36:09.084611,2023-01-06 02:36:35.926946,0 days 00:00:26.842335,tanh,0.05,2,0.5,0.038704242557287216,,,PRUNED
1709,1709,0.14378541707992554,2023-01-06 02:36:36.031709,2023-01-06 02:37:07.770242,0 days 00:00:31.738533,tanh,0.2,2,0.75,0.06100495904684067,0.03331678733229637,,COMPLETE
1710,1710,0.12577813863754272,2023-01-06 02:37:07.897852,2023-01-06 02:37:14.849989,0 days 00:00:06.952137,sigmoid,0.1,2,0.5,0.12577813863754272,,,PRUNED
1711,1711,0.07036928832530975,2023-01-06 02:37:14.945647,2023-01-06 02:37:26.964731,0 days 00:00:12.019084,relu,0.45,2,0.8500000000000001,0.07036928832530975,,,PRUNED
1712,1712,0.05849136784672737,2023-01-06 02:37:27.071369,2023-01-06 02:37:39.064810,0 days 00:00:11.993441,relu,0.15000000000000002,2,0.5,0.0796748623251915,0.05849136784672737,,PRUNED
1713,1713,0.03635268285870552,2023-01-06 02:37:39.177131,2023-01-06 02:38:06.045093,0 days 00:00:26.867962,relu,0.4,2,0.6,0.05467890202999115,0.03635268285870552,,PRUNED
1714,1714,0.06408146023750305,2023-01-06 02:38:06.157409,2023-01-06 02:38:18.203508,0 days 00:00:12.046099,relu,0.25,2,0.8,0.06408146023750305,,,PRUNED
1715,1715,0.11721190065145493,2023-01-06 02:38:18.305485,2023-01-06 02:38:25.185312,0 days 00:00:06.879827,sigmoid,0.2,2,0.55,0.11721190065145493,,,PRUNED
1716,1716,0.10358628630638123,2023-01-06 02:38:25.272622,2023-01-06 02:38:32.102394,0 days 00:00:06.829772,sigmoid,0.05,2,0.5,0.10358628630638123,,,PRUNED
1717,1717,0.08250228315591812,2023-01-06 02:38:32.215765,2023-01-06 02:38:44.451039,0 days 00:00:12.235274,relu,0.15000000000000002,2,0.5,0.07493823021650314,0.08250228315591812,,PRUNED
1718,1718,0.06228969991207123,2023-01-06 02:38:44.563833,2023-01-06 02:38:56.524592,0 days 00:00:11.960759,relu,0.4,2,0.5,0.06228969991207123,,,PRUNED
1719,1719,0.14750388264656067,2023-01-06 02:38:56.638913,2023-01-06 02:39:26.125533,0 days 00:00:29.486620,relu,0.35000000000000003,2,0.8500000000000001,0.05459511652588844,0.03517816960811615,,COMPLETE
1720,1720,0.12330038845539093,2023-01-06 02:39:26.247429,2023-01-06 02:39:33.281123,0 days 00:00:07.033694,sigmoid,0.05,2,0.7,0.12330038845539093,,,PRUNED
1721,1721,0.03709472343325615,2023-01-06 02:39:33.401785,2023-01-06 02:40:00.462918,0 days 00:00:27.061133,relu,0.30000000000000004,2,0.5,0.08995610475540161,0.053650546818971634,0.03709472343325615,PRUNED
1722,1722,0.07196557521820068,2023-01-06 02:40:00.566380,2023-01-06 02:40:12.361882,0 days 00:00:11.795502,relu,0.30000000000000004,2,0.7,0.07196557521820068,,,PRUNED
1723,1723,0.12834741175174713,2023-01-06 02:40:12.474355,2023-01-06 02:40:19.353303,0 days 00:00:06.878948,sigmoid,0.1,2,0.5,0.12834741175174713,,,PRUNED
1724,1724,0.12363439053297043,2023-01-06 02:40:19.473792,2023-01-06 02:40:26.619155,0 days 00:00:07.145363,relu,0.2,2,0.5,0.12363439053297043,,,PRUNED
1725,1725,0.04110366106033325,2023-01-06 02:40:26.731073,2023-01-06 02:40:53.282794,0 days 00:00:26.551721,sigmoid,0.0,2,0.8500000000000001,0.04110366106033325,,,PRUNED
1726,1726,0.1275423765182495,2023-01-06 02:40:53.395698,2023-01-06 02:41:25.060231,0 days 00:00:31.664533,sigmoid,0.0,2,0.8500000000000001,0.031971607357263565,,,COMPLETE
1727,1727,0.0627763420343399,2023-01-06 02:41:25.186615,2023-01-06 02:41:37.371102,0 days 00:00:12.184487,sigmoid,0.15000000000000002,2,0.6,0.07576628774404526,0.0627763420343399,,PRUNED
1728,1728,0.06294649094343185,2023-01-06 02:41:37.493345,2023-01-06 02:41:49.521171,0 days 00:00:12.027826,sigmoid,0.25,2,0.55,0.0797608345746994,0.06294649094343185,,PRUNED
1729,1729,0.09847721457481384,2023-01-06 02:41:49.642422,2023-01-06 02:41:56.678971,0 days 00:00:07.036549,relu,0.15000000000000002,2,0.65,0.09847721457481384,,,PRUNED
1730,1730,0.0338653139770031,2023-01-06 02:41:56.790631,2023-01-06 02:42:23.960227,0 days 00:00:27.169596,sigmoid,0.1,2,0.5,0.07618115842342377,0.047145552933216095,0.0338653139770031,PRUNED
1731,1731,0.12692007422447205,2023-01-06 02:42:24.073124,2023-01-06 02:42:31.009688,0 days 00:00:06.936564,relu,0.15000000000000002,2,0.5,0.12692007422447205,,,PRUNED
1732,1732,0.1254492700099945,2023-01-06 02:42:31.095597,2023-01-06 02:42:37.792504,0 days 00:00:06.696907,sigmoid,0.2,2,0.8500000000000001,0.1254492700099945,,,PRUNED
1733,1733,0.13368232548236847,2023-01-06 02:42:37.904371,2023-01-06 02:42:45.100293,0 days 00:00:07.195922,relu,0.15000000000000002,3,0.5,0.13368232548236847,,,PRUNED
1734,1734,0.10286431759595871,2023-01-06 02:42:45.187451,2023-01-06 02:42:51.899769,0 days 00:00:06.712318,sigmoid,0.0,2,0.5,0.10286431759595871,,,PRUNED
1735,1735,0.10933922976255417,2023-01-06 02:42:52.009669,2023-01-06 02:42:58.899238,0 days 00:00:06.889569,sigmoid,0.25,2,0.55,0.10933922976255417,,,PRUNED
1736,1736,0.03995473310351372,2023-01-06 02:42:59.178256,2023-01-06 02:43:26.004512,0 days 00:00:26.826256,sigmoid,0.0,2,0.55,0.03995473310351372,,,PRUNED
1737,1737,0.06454449892044067,2023-01-06 02:43:26.126744,2023-01-06 02:43:38.054190,0 days 00:00:11.927446,relu,0.2,2,0.9,0.06454449892044067,,,PRUNED
1738,1738,0.0416744127869606,2023-01-06 02:43:38.166477,2023-01-06 02:44:04.951811,0 days 00:00:26.785334,tanh,0.0,2,0.8500000000000001,0.0416744127869606,,,PRUNED
1739,1739,0.04393613710999489,2023-01-06 02:44:05.066052,2023-01-06 02:44:32.000473,0 days 00:00:26.934421,sigmoid,0.0,2,0.7,0.04393613710999489,,,PRUNED
1740,1740,0.0983777642250061,2023-01-06 02:44:32.109989,2023-01-06 02:44:43.990226,0 days 00:00:11.880237,relu,0.45,2,0.8500000000000001,0.0983777642250061,,,PRUNED
1741,1741,0.1271878182888031,2023-01-06 02:44:44.091792,2023-01-06 02:44:50.982299,0 days 00:00:06.890507,relu,0.15000000000000002,2,0.5,0.1271878182888031,,,PRUNED
1742,1742,0.05578229948878288,2023-01-06 02:44:51.096265,2023-01-06 02:45:03.281424,0 days 00:00:12.185159,tanh,0.2,2,0.8,0.08748931437730789,0.05578229948878288,,PRUNED
1743,1743,0.04146646335721016,2023-01-06 02:45:03.382992,2023-01-06 02:45:29.995047,0 days 00:00:26.612055,sigmoid,0.0,2,0.9,0.04146646335721016,,,PRUNED
1744,1744,0.03620515018701553,2023-01-06 02:45:30.106862,2023-01-06 02:45:57.034471,0 days 00:00:26.927609,relu,0.4,2,0.65,0.058216143399477005,0.03620515018701553,,PRUNED
1745,1745,0.0632171556353569,2023-01-06 02:45:57.140238,2023-01-06 02:46:09.326169,0 days 00:00:12.185931,sigmoid,0.1,2,0.5,0.0792934000492096,0.0632171556353569,,PRUNED
1746,1746,0.0384051650762558,2023-01-06 02:46:09.437296,2023-01-06 02:46:36.416000,0 days 00:00:26.978704,relu,0.15000000000000002,2,0.5,0.0871596485376358,0.05434069037437439,0.0384051650762558,PRUNED
1747,1747,0.17814850807189941,2023-01-06 02:46:36.544571,2023-01-06 02:47:01.537607,0 days 00:00:24.993036,relu,0.2,5,0.65,0.06110313534736633,,,COMPLETE
1748,1748,0.12613561749458313,2023-01-06 02:47:01.656664,2023-01-06 02:47:08.796859,0 days 00:00:07.140195,sigmoid,0.05,2,0.5,0.12613561749458313,,,PRUNED
1749,1749,0.0674743577837944,2023-01-06 02:47:08.908771,2023-01-06 02:47:20.920941,0 days 00:00:12.012170,relu,0.15000000000000002,2,0.75,0.08785296231508255,0.0674743577837944,,PRUNED
1750,1750,0.11028283089399338,2023-01-06 02:47:21.042173,2023-01-06 02:47:28.287047,0 days 00:00:07.244874,sigmoid,0.1,4,0.5,0.11028283089399338,,,PRUNED
1751,1751,0.03487323224544525,2023-01-06 02:47:28.398945,2023-01-06 02:47:55.458971,0 days 00:00:27.060026,tanh,0.15000000000000002,2,0.7,0.06814087927341461,0.047543950378894806,0.03487323224544525,PRUNED
1752,1752,0.036439087241888046,2023-01-06 02:47:55.571877,2023-01-06 02:48:22.541251,0 days 00:00:26.969374,relu,0.25,2,0.55,0.0820259377360344,0.050081491470336914,0.036439087241888046,PRUNED
1753,1753,0.09924811124801636,2023-01-06 02:48:22.654151,2023-01-06 02:48:29.757360,0 days 00:00:07.103209,sigmoid,0.15000000000000002,2,0.5,0.09924811124801636,,,PRUNED
1754,1754,0.134677454829216,2023-01-06 02:48:29.870517,2023-01-06 02:48:59.341302,0 days 00:00:29.470785,relu,0.4,2,0.75,0.04261324182152748,0.034121058881282806,,COMPLETE
1755,1755,0.10698624700307846,2023-01-06 02:48:59.452339,2023-01-06 02:49:06.246250,0 days 00:00:06.793911,sigmoid,0.1,2,0.5,0.10698624700307846,,,PRUNED
1756,1756,0.10047134757041931,2023-01-06 02:49:06.360157,2023-01-06 02:49:13.187395,0 days 00:00:06.827238,relu,0.05,2,0.5,0.10047134757041931,,,PRUNED
1757,1757,0.11890950053930283,2023-01-06 02:49:13.297292,2023-01-06 02:49:20.353514,0 days 00:00:07.056222,tanh,0.2,2,0.65,0.11890950053930283,,,PRUNED
1758,1758,0.09902383387088776,2023-01-06 02:49:20.464414,2023-01-06 02:49:27.319650,0 days 00:00:06.855236,sigmoid,0.15000000000000002,2,0.5,0.09902383387088776,,,PRUNED
1759,1759,0.07338335365056992,2023-01-06 02:49:27.422744,2023-01-06 02:49:39.343729,0 days 00:00:11.920985,relu,0.15000000000000002,2,0.5,0.06804300844669342,0.07338335365056992,,PRUNED
1760,1760,0.19084449112415314,2023-01-06 02:49:39.464977,2023-01-06 02:49:46.884826,0 days 00:00:07.419849,sigmoid,0.25,6,0.6,0.19084449112415314,,,PRUNED
1761,1761,0.2410537153482437,2023-01-06 02:49:46.995737,2023-01-06 02:49:54.359583,0 days 00:00:07.363846,relu,0.15000000000000002,8,0.55,0.2410537153482437,,,PRUNED
1762,1762,0.08115213364362717,2023-01-06 02:49:54.461721,2023-01-06 02:50:06.465665,0 days 00:00:12.003944,tanh,0.35000000000000003,2,0.8500000000000001,0.08115213364362717,,,PRUNED
1763,1763,0.03839343786239624,2023-01-06 02:50:06.570238,2023-01-06 02:50:33.480281,0 days 00:00:26.910043,relu,0.25,2,0.6,0.059886813163757324,0.03839343786239624,,PRUNED
1764,1764,0.039412032812833786,2023-01-06 02:50:33.593175,2023-01-06 02:51:00.411882,0 days 00:00:26.818707,sigmoid,0.0,2,0.65,0.039412032812833786,,,PRUNED
1765,1765,0.07240063697099686,2023-01-06 02:51:00.541132,2023-01-06 02:51:12.536153,0 days 00:00:11.995021,relu,0.4,2,0.75,0.07240063697099686,,,PRUNED
1766,1766,0.06831728667020798,2023-01-06 02:51:12.641211,2023-01-06 02:51:24.569056,0 days 00:00:11.927845,relu,0.45,2,0.55,0.06831728667020798,,,PRUNED
1767,1767,0.1284303516149521,2023-01-06 02:51:24.687614,2023-01-06 02:51:31.626843,0 days 00:00:06.939229,sigmoid,0.15000000000000002,2,0.5,0.1284303516149521,,,PRUNED
1768,1768,0.06225806847214699,2023-01-06 02:51:31.746091,2023-01-06 02:51:43.491672,0 days 00:00:11.745581,relu,0.4,2,0.7,0.06225806847214699,,,PRUNED
1769,1769,0.07386234402656555,2023-01-06 02:51:43.605515,2023-01-06 02:51:55.690685,0 days 00:00:12.085170,sigmoid,0.15000000000000002,2,0.8500000000000001,0.07386234402656555,,,PRUNED
1770,1770,0.12638409435749054,2023-01-06 02:51:55.812915,2023-01-06 02:52:02.782808,0 days 00:00:06.969893,tanh,0.2,2,0.5,0.12638409435749054,,,PRUNED
1771,1771,0.05608165264129639,2023-01-06 02:52:02.885372,2023-01-06 02:52:14.898549,0 days 00:00:12.013177,sigmoid,0.30000000000000004,2,0.5,0.0924132913351059,0.05608165264129639,,PRUNED
1772,1772,0.06701099872589111,2023-01-06 02:52:15.017780,2023-01-06 02:52:27.405928,0 days 00:00:12.388148,relu,0.15000000000000002,2,0.75,0.0835689976811409,0.06701099872589111,,PRUNED
1773,1773,0.13968916237354279,2023-01-06 02:52:27.510498,2023-01-06 02:53:01.964358,0 days 00:00:34.453860,relu,0.0,2,0.8500000000000001,0.03682311251759529,,,COMPLETE
1774,1774,0.1179339662194252,2023-01-06 02:53:02.100203,2023-01-06 02:53:09.044424,0 days 00:00:06.944221,sigmoid,0.05,2,0.5,0.1179339662194252,,,PRUNED
1775,1775,0.12996351718902588,2023-01-06 02:53:09.132326,2023-01-06 02:53:16.336494,0 days 00:00:07.204168,relu,0.1,2,0.55,0.12996351718902588,,,PRUNED
1776,1776,0.21944478154182434,2023-01-06 02:53:16.445446,2023-01-06 02:53:28.942912,0 days 00:00:12.497466,relu,0.25,7,0.65,0.21944478154182434,,,PRUNED
1777,1777,0.1436937153339386,2023-01-06 02:53:29.083329,2023-01-06 02:53:36.109030,0 days 00:00:07.025701,tanh,0.25,3,0.65,0.1436937153339386,,,PRUNED
1778,1778,0.0631318986415863,2023-01-06 02:53:36.204359,2023-01-06 02:53:48.308164,0 days 00:00:12.103805,relu,0.35000000000000003,2,0.8,0.0631318986415863,,,PRUNED
1779,1779,0.08620113879442215,2023-01-06 02:53:48.422002,2023-01-06 02:54:00.314509,0 days 00:00:11.892507,relu,0.2,2,0.6,0.08620113879442215,,,PRUNED
1780,1780,0.0977008268237114,2023-01-06 02:54:00.418938,2023-01-06 02:54:07.414973,0 days 00:00:06.996035,sigmoid,0.15000000000000002,2,0.5,0.0977008268237114,,,PRUNED
1781,1781,0.037866950035095215,2023-01-06 02:54:07.526875,2023-01-06 02:54:34.886877,0 days 00:00:27.360002,relu,0.05,2,0.7,0.07688979804515839,0.05115073174238205,0.037866950035095215,PRUNED
1782,1782,0.057113733142614365,2023-01-06 02:54:35.000940,2023-01-06 02:54:47.028621,0 days 00:00:12.027681,sigmoid,0.15000000000000002,2,0.5,0.07548053562641144,0.057113733142614365,,PRUNED
1783,1783,0.15401874482631683,2023-01-06 02:54:47.134258,2023-01-06 02:55:18.835203,0 days 00:00:31.700945,tanh,0.05,2,0.8500000000000001,0.03621875122189522,,,COMPLETE
1784,1784,0.03874899446964264,2023-01-06 02:55:18.940773,2023-01-06 02:55:45.556502,0 days 00:00:26.615729,sigmoid,0.0,2,0.9,0.03874899446964264,,,PRUNED
1785,1785,0.03930414840579033,2023-01-06 02:55:45.858251,2023-01-06 02:56:12.563044,0 days 00:00:26.704793,sigmoid,0.0,2,0.8,0.03930414840579033,,,PRUNED
1786,1786,0.04241802170872688,2023-01-06 02:56:12.692855,2023-01-06 02:56:39.352698,0 days 00:00:26.659843,sigmoid,0.0,2,0.8500000000000001,0.04241802170872688,,,PRUNED
1787,1787,0.11268917471170425,2023-01-06 02:56:39.455965,2023-01-06 02:56:46.302864,0 days 00:00:06.846899,relu,0.1,2,0.8,0.11268917471170425,,,PRUNED
1788,1788,0.1377067118883133,2023-01-06 02:56:46.413769,2023-01-06 02:57:18.318774,0 days 00:00:31.905005,tanh,0.0,2,0.8500000000000001,0.03549966588616371,,,COMPLETE
1789,1789,0.1012301966547966,2023-01-06 02:57:18.430681,2023-01-06 02:57:25.324872,0 days 00:00:06.894191,sigmoid,0.2,2,0.5,0.1012301966547966,,,PRUNED
1790,1790,0.11019240319728851,2023-01-06 02:57:25.451981,2023-01-06 02:57:32.432662,0 days 00:00:06.980681,tanh,0.15000000000000002,2,0.5,0.11019240319728851,,,PRUNED
1791,1791,0.11281537264585495,2023-01-06 02:57:32.526019,2023-01-06 02:57:39.582351,0 days 00:00:07.056332,sigmoid,0.15000000000000002,2,0.5,0.11281537264585495,,,PRUNED
1792,1792,0.14468587934970856,2023-01-06 02:57:39.713232,2023-01-06 02:58:06.749450,0 days 00:00:27.036218,relu,0.4,2,0.7,0.05208246037364006,0.03423311188817024,,COMPLETE
1793,1793,0.040860991925001144,2023-01-06 02:58:06.896174,2023-01-06 02:58:33.668459,0 days 00:00:26.772285,sigmoid,0.05,2,0.9,0.040860991925001144,,,PRUNED
1794,1794,0.06707896292209625,2023-01-06 02:58:33.782696,2023-01-06 02:58:45.876079,0 days 00:00:12.093383,relu,0.5,2,0.8500000000000001,0.06707896292209625,,,PRUNED
1795,1795,0.06933148205280304,2023-01-06 02:58:45.982872,2023-01-06 02:58:57.875168,0 days 00:00:11.892296,relu,0.05,2,0.7,0.06933148205280304,,,PRUNED
1796,1796,0.04313473030924797,2023-01-06 02:58:58.000627,2023-01-06 02:59:24.739789,0 days 00:00:26.739162,sigmoid,0.0,2,0.8500000000000001,0.04313473030924797,,,PRUNED
1797,1797,0.037200599908828735,2023-01-06 02:59:24.876104,2023-01-06 02:59:51.754392,0 days 00:00:26.878288,sigmoid,0.0,2,0.7,0.037200599908828735,,,PRUNED
1798,1798,0.1251891404390335,2023-01-06 02:59:51.884385,2023-01-06 02:59:58.821531,0 days 00:00:06.937146,relu,0.15000000000000002,2,0.55,0.1251891404390335,,,PRUNED
1799,1799,0.062453340739011765,2023-01-06 02:59:58.923508,2023-01-06 03:00:10.869615,0 days 00:00:11.946107,sigmoid,0.25,2,0.5,0.09550902247428894,0.062453340739011765,,PRUNED
1800,1800,0.03887705132365227,2023-01-06 03:00:10.991781,2023-01-06 03:00:38.026872,0 days 00:00:27.035091,relu,0.05,2,0.6,0.08164913207292557,0.05048445612192154,0.03887705132365227,PRUNED
1801,1801,0.1039431020617485,2023-01-06 03:00:38.155857,2023-01-06 03:00:45.043011,0 days 00:00:06.887154,tanh,0.15000000000000002,2,0.5,0.1039431020617485,,,PRUNED
1802,1802,0.09923330694437027,2023-01-06 03:00:45.163650,2023-01-06 03:00:52.092336,0 days 00:00:06.928686,sigmoid,0.1,2,0.5,0.09923330694437027,,,PRUNED
1803,1803,0.13708902895450592,2023-01-06 03:00:52.202788,2023-01-06 03:00:59.233592,0 days 00:00:07.030804,relu,0.2,2,0.8500000000000001,0.13708902895450592,,,PRUNED
1804,1804,0.06302373111248016,2023-01-06 03:00:59.377241,2023-01-06 03:01:11.216390,0 days 00:00:11.839149,relu,0.45,2,0.65,0.06302373111248016,,,PRUNED
1805,1805,0.13063010573387146,2023-01-06 03:01:11.336663,2023-01-06 03:01:41.072375,0 days 00:00:29.735712,sigmoid,0.0,2,0.5,0.056326258927583694,0.04214595630764961,0.031938545405864716,COMPLETE
1806,1806,0.1433548480272293,2023-01-06 03:01:41.193394,2023-01-06 03:01:48.221502,0 days 00:00:07.028108,sigmoid,0.0,2,0.5,0.1433548480272293,,,PRUNED
1807,1807,0.07751087099313736,2023-01-06 03:01:48.325514,2023-01-06 03:02:00.036817,0 days 00:00:11.711303,tanh,0.4,2,0.9,0.07751087099313736,,,PRUNED
1808,1808,0.13454237580299377,2023-01-06 03:02:00.154924,2023-01-06 03:02:07.111755,0 days 00:00:06.956831,sigmoid,0.0,2,0.5,0.13454237580299377,,,PRUNED
1809,1809,0.10111691057682037,2023-01-06 03:02:07.212964,2023-01-06 03:02:14.136221,0 days 00:00:06.923257,sigmoid,0.0,2,0.5,0.10111691057682037,,,PRUNED
1810,1810,0.06707565486431122,2023-01-06 03:02:14.248544,2023-01-06 03:02:26.168008,0 days 00:00:11.919464,sigmoid,0.0,2,0.5,0.08278463780879974,0.06707565486431122,,PRUNED
1811,1811,0.08323204517364502,2023-01-06 03:02:26.287303,2023-01-06 03:02:38.067730,0 days 00:00:11.780427,relu,0.4,2,0.6,0.08323204517364502,,,PRUNED
1812,1812,0.1449323147535324,2023-01-06 03:02:38.194714,2023-01-06 03:03:05.460121,0 days 00:00:27.265407,sigmoid,0.35000000000000003,2,0.5,0.06807858496904373,0.045056942850351334,0.030361440032720566,COMPLETE
1813,1813,0.1302143931388855,2023-01-06 03:03:05.586969,2023-01-06 03:03:40.055985,0 days 00:00:34.469016,sigmoid,0.0,2,0.5,0.06335490196943283,0.04348613694310188,0.03345288708806038,COMPLETE
1814,1814,0.038744065910577774,2023-01-06 03:03:40.184339,2023-01-06 03:04:06.869309,0 days 00:00:26.684970,tanh,0.05,2,0.8500000000000001,0.038744065910577774,,,PRUNED
1815,1815,0.03874918445944786,2023-01-06 03:04:06.996296,2023-01-06 03:04:33.633492,0 days 00:00:26.637196,sigmoid,0.0,2,0.65,0.03874918445944786,,,PRUNED
1816,1816,0.038349051028490067,2023-01-06 03:04:33.745246,2023-01-06 03:05:00.214249,0 days 00:00:26.469003,sigmoid,0.0,2,0.9,0.038349051028490067,,,PRUNED
1817,1817,0.044136565178632736,2023-01-06 03:05:00.327568,2023-01-06 03:05:26.820560,0 days 00:00:26.492992,sigmoid,0.05,2,0.8500000000000001,0.044136565178632736,,,PRUNED
1818,1818,0.04728899151086807,2023-01-06 03:05:26.948005,2023-01-06 03:05:53.826836,0 days 00:00:26.878831,tanh,0.0,2,0.55,0.04728899151086807,,,PRUNED
1819,1819,0.037273332476615906,2023-01-06 03:05:53.946487,2023-01-06 03:06:20.865969,0 days 00:00:26.919482,sigmoid,0.0,2,0.55,0.08353590965270996,0.05281473323702812,0.037273332476615906,PRUNED
1820,1820,0.04486160725355148,2023-01-06 03:06:20.970432,2023-01-06 03:06:47.529920,0 days 00:00:26.559488,sigmoid,0.0,2,1.0,0.04486160725355148,,,PRUNED
1821,1821,0.09426936507225037,2023-01-06 03:06:47.652736,2023-01-06 03:06:59.729571,0 days 00:00:12.076835,relu,0.25,3,0.8500000000000001,0.09426936507225037,,,PRUNED
