,number,value,datetime_start,datetime_complete,duration,params_activation,params_dropout,params_layers,params_shrink,system_attrs_completed_rung_0,system_attrs_completed_rung_1,system_attrs_completed_rung_2,state
1955,1955,0.05917854234576225,2023-01-06 03:38:20.285167,2023-01-06 03:38:32.104929,0 days 00:00:11.819762,tanh,0.15000000000000002,2,0.5,0.07860471308231354,0.05917854234576225,,PRUNED
1956,1956,0.03595190495252609,2023-01-06 03:38:32.208478,2023-01-06 03:38:59.051868,0 days 00:00:26.843390,relu,0.2,2,0.8500000000000001,0.05696602910757065,0.03595190495252609,,PRUNED
1957,1957,0.03899798542261124,2023-01-06 03:38:59.148412,2023-01-06 03:39:26.109197,0 days 00:00:26.960785,relu,0.2,2,0.8500000000000001,0.05169180408120155,0.03899798542261124,,PRUNED
1958,1958,0.11829894036054611,2023-01-06 03:39:26.214685,2023-01-06 03:39:33.108927,0 days 00:00:06.894242,sigmoid,0.30000000000000004,2,0.5,0.11829894036054611,,,PRUNED
1959,1959,0.10210071504116058,2023-01-06 03:39:33.213146,2023-01-06 03:39:40.049740,0 days 00:00:06.836594,relu,0.25,2,0.5,0.10210071504116058,,,PRUNED
1960,1960,0.12871749699115753,2023-01-06 03:39:40.161619,2023-01-06 03:39:47.257516,0 days 00:00:07.095897,sigmoid,0.0,2,0.55,0.12871749699115753,,,PRUNED
1961,1961,0.1098846048116684,2023-01-06 03:39:47.353730,2023-01-06 03:39:54.256981,0 days 00:00:06.903251,sigmoid,0.05,2,0.8,0.1098846048116684,,,PRUNED
1962,1962,0.1327182948589325,2023-01-06 03:39:54.370866,2023-01-06 03:40:23.656688,0 days 00:00:29.285822,tanh,0.25,2,0.95,0.033672839403152466,,,COMPLETE
1963,1963,0.10936468839645386,2023-01-06 03:40:23.786871,2023-01-06 03:40:30.812518,0 days 00:00:07.025647,relu,0.15000000000000002,2,0.5,0.10936468839645386,,,PRUNED
1964,1964,0.12869048118591309,2023-01-06 03:40:30.926507,2023-01-06 03:40:37.820312,0 days 00:00:06.893805,tanh,0.2,2,0.5,0.12869048118591309,,,PRUNED
1965,1965,0.13387669622898102,2023-01-06 03:40:37.916847,2023-01-06 03:41:14.562131,0 days 00:00:36.645284,tanh,0.0,2,0.95,0.03566872701048851,,,COMPLETE
1966,1966,0.12020540237426758,2023-01-06 03:41:14.691711,2023-01-06 03:41:21.633637,0 days 00:00:06.941926,sigmoid,0.15000000000000002,2,0.9,0.12020540237426758,,,PRUNED
1967,1967,0.07932102680206299,2023-01-06 03:41:21.732169,2023-01-06 03:41:33.548389,0 days 00:00:11.816220,relu,0.25,2,0.75,0.07932102680206299,,,PRUNED
1968,1968,0.036496810615062714,2023-01-06 03:41:33.663904,2023-01-06 03:42:00.371338,0 days 00:00:26.707434,tanh,0.2,2,0.9,0.04997582361102104,0.036496810615062714,,PRUNED
1969,1969,0.03804079070687294,2023-01-06 03:42:00.487542,2023-01-06 03:42:27.645257,0 days 00:00:27.157715,relu,0.15000000000000002,2,0.6,0.08246339857578278,0.050195854157209396,0.03804079070687294,PRUNED
1970,1970,0.03734298795461655,2023-01-06 03:42:27.749632,2023-01-06 03:42:54.626529,0 days 00:00:26.876897,sigmoid,0.05,2,0.5,0.0881214290857315,0.05318225175142288,0.03734298795461655,PRUNED
1971,1971,0.11054592579603195,2023-01-06 03:42:54.741731,2023-01-06 03:43:01.551632,0 days 00:00:06.809901,sigmoid,0.25,2,0.5,0.11054592579603195,,,PRUNED
1972,1972,0.1275733858346939,2023-01-06 03:43:01.657844,2023-01-06 03:43:08.967079,0 days 00:00:07.309235,tanh,0.15000000000000002,2,0.55,0.1275733858346939,,,PRUNED
1973,1973,0.25722208619117737,2023-01-06 03:43:09.083090,2023-01-06 03:43:31.437104,0 days 00:00:22.354014,tanh,0.2,6,0.95,,,,COMPLETE
1974,1974,0.1163332536816597,2023-01-06 03:43:31.548930,2023-01-06 03:43:38.356522,0 days 00:00:06.807592,relu,0.05,3,0.5,0.1163332536816597,,,PRUNED
1975,1975,0.11470602452754974,2023-01-06 03:43:38.468164,2023-01-06 03:43:45.548639,0 days 00:00:07.080475,sigmoid,0.0,2,0.5,0.11470602452754974,,,PRUNED
1976,1976,0.03892957791686058,2023-01-06 03:43:45.654509,2023-01-06 03:44:12.653247,0 days 00:00:26.998738,relu,0.2,2,0.5,0.08363629132509232,0.05191165208816528,0.03892957791686058,PRUNED
1977,1977,0.03724679723381996,2023-01-06 03:44:12.767100,2023-01-06 03:44:39.675839,0 days 00:00:26.908739,relu,0.2,2,0.8500000000000001,0.05713088810443878,0.03724679723381996,,PRUNED
1978,1978,0.15209528803825378,2023-01-06 03:44:39.791039,2023-01-06 03:45:06.860897,0 days 00:00:27.069858,tanh,0.25,2,0.95,0.03391917422413826,,,COMPLETE
1979,1979,0.13097159564495087,2023-01-06 03:45:06.972975,2023-01-06 03:45:38.845941,0 days 00:00:31.872966,tanh,0.0,2,0.95,0.03289702907204628,,,COMPLETE
1980,1980,0.06480766087770462,2023-01-06 03:45:38.985956,2023-01-06 03:45:50.979735,0 days 00:00:11.993779,sigmoid,0.15000000000000002,2,0.5,0.09349039942026138,0.06480766087770462,,PRUNED
1981,1981,0.13735534250736237,2023-01-06 03:45:51.103267,2023-01-06 03:45:57.937536,0 days 00:00:06.834269,tanh,0.15000000000000002,2,0.5,0.13735534250736237,,,PRUNED
1982,1982,0.03819885849952698,2023-01-06 03:45:58.041402,2023-01-06 03:46:25.317780,0 days 00:00:27.276378,sigmoid,0.25,2,0.5,0.08641541004180908,0.05311989039182663,0.03819885849952698,PRUNED
1983,1983,0.14223214983940125,2023-01-06 03:46:25.441312,2023-01-06 03:46:32.559901,0 days 00:00:07.118589,relu,0.1,5,0.8500000000000001,0.14223214983940125,,,PRUNED
1984,1984,0.07084854692220688,2023-01-06 03:46:32.662707,2023-01-06 03:46:44.525512,0 days 00:00:11.862805,relu,0.35000000000000003,2,0.65,0.07084854692220688,,,PRUNED
1985,1985,0.03879623860120773,2023-01-06 03:46:44.800936,2023-01-06 03:47:11.455931,0 days 00:00:26.654995,tanh,0.25,2,0.95,0.03879623860120773,,,PRUNED
1986,1986,0.03937481716275215,2023-01-06 03:47:11.569481,2023-01-06 03:47:38.303880,0 days 00:00:26.734399,relu,0.25,2,0.8,0.06073397770524025,0.03937481716275215,,PRUNED
1987,1987,0.04125574603676796,2023-01-06 03:47:38.419081,2023-01-06 03:48:04.927137,0 days 00:00:26.508056,tanh,0.25,2,0.95,0.04125574603676796,,,PRUNED
1988,1988,0.05522304028272629,2023-01-06 03:48:05.207875,2023-01-06 03:48:17.193579,0 days 00:00:11.985704,sigmoid,0.15000000000000002,2,0.55,0.0705035999417305,0.05522304028272629,,PRUNED
1989,1989,0.07389302551746368,2023-01-06 03:48:17.308782,2023-01-06 03:48:29.051273,0 days 00:00:11.742491,relu,0.2,2,0.5,0.07389302551746368,,,PRUNED
1990,1990,0.03999679535627365,2023-01-06 03:48:29.166219,2023-01-06 03:48:55.981613,0 days 00:00:26.815394,tanh,0.30000000000000004,2,0.95,0.03999679535627365,,,PRUNED
1991,1991,0.1348402202129364,2023-01-06 03:48:56.094487,2023-01-06 03:49:02.973741,0 days 00:00:06.879254,relu,0.30000000000000004,2,0.5,0.1348402202129364,,,PRUNED
1992,1992,0.14734558761119843,2023-01-06 03:49:03.088262,2023-01-06 03:49:27.519307,0 days 00:00:24.431045,sigmoid,0.2,2,0.5,0.0602455697953701,0.04068630933761597,,COMPLETE
1993,1993,0.10899852961301804,2023-01-06 03:49:27.637422,2023-01-06 03:49:34.396341,0 days 00:00:06.758919,tanh,0.15000000000000002,2,0.5,0.10899852961301804,,,PRUNED
1994,1994,0.07800240814685822,2023-01-06 03:49:34.700071,2023-01-06 03:49:46.553086,0 days 00:00:11.853015,relu,0.30000000000000004,2,0.8500000000000001,0.07800240814685822,,,PRUNED
1995,1995,0.14561313390731812,2023-01-06 03:49:46.667628,2023-01-06 03:50:13.738557,0 days 00:00:27.070929,sigmoid,0.15000000000000002,2,0.55,0.07233694195747375,0.05316152796149254,0.033292338252067566,COMPLETE
1996,1996,0.03774196654558182,2023-01-06 03:50:13.842226,2023-01-06 03:50:40.616295,0 days 00:00:26.774069,tanh,0.0,2,0.95,0.03774196654558182,,,PRUNED
1997,1997,0.13821417093276978,2023-01-06 03:50:40.714512,2023-01-06 03:50:47.615768,0 days 00:00:06.901256,relu,0.05,2,0.75,0.13821417093276978,,,PRUNED
1998,1998,0.09794384986162186,2023-01-06 03:50:47.729637,2023-01-06 03:50:54.790216,0 days 00:00:07.060579,sigmoid,0.1,4,0.5,0.09794384986162186,,,PRUNED
1999,1999,0.09508202224969864,2023-01-06 03:50:54.903091,2023-01-06 03:51:06.847638,0 days 00:00:11.944547,relu,0.25,2,0.65,0.09508202224969864,,,PRUNED
2000,2000,0.14766116440296173,2023-01-06 03:51:06.962511,2023-01-06 03:51:38.795971,0 days 00:00:31.833460,tanh,0.30000000000000004,2,0.95,0.035424672067165375,,,COMPLETE
2001,2001,0.03739086538553238,2023-01-06 03:51:38.927414,2023-01-06 03:52:05.367862,0 days 00:00:26.440448,tanh,0.35000000000000003,2,0.95,0.03739086538553238,,,PRUNED
2002,2002,0.14300130307674408,2023-01-06 03:52:05.472715,2023-01-06 03:52:32.467903,0 days 00:00:26.995188,relu,0.15000000000000002,2,0.75,0.04963970556855202,0.0327974334359169,,COMPLETE
2003,2003,0.04647251218557358,2023-01-06 03:52:32.575328,2023-01-06 03:52:59.321387,0 days 00:00:26.746059,tanh,0.0,3,0.95,0.04647251218557358,,,PRUNED
2004,2004,0.07257816195487976,2023-01-06 03:52:59.427936,2023-01-06 03:53:11.304815,0 days 00:00:11.876879,relu,0.45,2,0.65,0.07257816195487976,,,PRUNED
2005,2005,0.040179233998060226,2023-01-06 03:53:11.401025,2023-01-06 03:53:38.152764,0 days 00:00:26.751739,tanh,0.0,2,0.95,0.040179233998060226,,,PRUNED
2006,2006,0.13306783139705658,2023-01-06 03:53:38.246976,2023-01-06 03:53:45.143896,0 days 00:00:06.896920,relu,0.0,2,0.5,0.13306783139705658,,,PRUNED
2007,2007,0.11554078757762909,2023-01-06 03:53:45.250447,2023-01-06 03:53:52.235031,0 days 00:00:06.984584,sigmoid,0.15000000000000002,2,0.5,0.11554078757762909,,,PRUNED
2008,2008,0.08025821298360825,2023-01-06 03:53:52.356238,2023-01-06 03:54:04.642416,0 days 00:00:12.286178,tanh,0.25,3,0.5,0.07282944023609161,0.08025821298360825,,PRUNED
2009,2009,0.12616492807865143,2023-01-06 03:54:04.773325,2023-01-06 03:54:11.658542,0 days 00:00:06.885217,sigmoid,0.45,2,0.5,0.12616492807865143,,,PRUNED
2010,2010,0.05697155371308327,2023-01-06 03:54:11.762713,2023-01-06 03:54:23.732620,0 days 00:00:11.969907,relu,0.2,2,0.55,0.0919637382030487,0.05697155371308327,,PRUNED
2011,2011,0.05523226782679558,2023-01-06 03:54:23.837612,2023-01-06 03:54:35.748755,0 days 00:00:11.911143,sigmoid,0.15000000000000002,2,0.5,0.08687640726566315,0.05523226782679558,,PRUNED
2012,2012,0.2505449652671814,2023-01-06 03:54:35.862252,2023-01-06 03:54:48.638908,0 days 00:00:12.776656,sigmoid,0.2,8,0.8500000000000001,0.2505449652671814,,,PRUNED
2013,2013,0.1012587770819664,2023-01-06 03:54:48.745605,2023-01-06 03:54:55.646853,0 days 00:00:06.901248,tanh,0.15000000000000002,2,0.5,0.1012587770819664,,,PRUNED
2014,2014,0.06722333282232285,2023-01-06 03:54:55.752704,2023-01-06 03:55:07.929179,0 days 00:00:12.176475,relu,0.0,2,0.5,0.08174525201320648,0.06722333282232285,,PRUNED
2015,2015,0.04074982553720474,2023-01-06 03:55:08.034798,2023-01-06 03:55:34.810537,0 days 00:00:26.775739,tanh,0.0,2,0.95,0.04074982553720474,,,PRUNED
2016,2016,0.06570755690336227,2023-01-06 03:55:34.916832,2023-01-06 03:55:46.801279,0 days 00:00:11.884447,relu,0.25,2,0.55,0.06570755690336227,,,PRUNED
2017,2017,0.042506907135248184,2023-01-06 03:55:46.916165,2023-01-06 03:56:13.682580,0 days 00:00:26.766415,tanh,0.0,2,0.95,0.042506907135248184,,,PRUNED
2018,2018,0.12768512964248657,2023-01-06 03:56:13.797454,2023-01-06 03:56:20.690288,0 days 00:00:06.892834,sigmoid,0.15000000000000002,2,0.6,0.12768512964248657,,,PRUNED
2019,2019,0.03898002207279205,2023-01-06 03:56:20.805245,2023-01-06 03:56:47.445662,0 days 00:00:26.640417,tanh,0.0,2,1.0,0.03898002207279205,,,PRUNED
2020,2020,0.22134888172149658,2023-01-06 03:56:47.560537,2023-01-06 03:57:12.217455,0 days 00:00:24.656918,tanh,0.0,5,0.95,,,,COMPLETE
2021,2021,0.14087289571762085,2023-01-06 03:57:12.338609,2023-01-06 03:57:19.495220,0 days 00:00:07.156611,sigmoid,0.2,2,0.5,0.14087289571762085,,,PRUNED
2022,2022,0.05535493418574333,2023-01-06 03:57:19.601056,2023-01-06 03:57:31.668280,0 days 00:00:12.067224,relu,0.1,2,0.5,0.08421577513217926,0.05535493418574333,,PRUNED
2023,2023,0.11494234204292297,2023-01-06 03:57:31.773113,2023-01-06 03:57:38.751070,0 days 00:00:06.977957,sigmoid,0.05,2,0.5,0.11494234204292297,,,PRUNED
2024,2024,0.07481798529624939,2023-01-06 03:57:38.849417,2023-01-06 03:57:50.808496,0 days 00:00:11.959079,relu,0.2,3,0.7,0.07481798529624939,,,PRUNED
2025,2025,0.11219695955514908,2023-01-06 03:57:50.920650,2023-01-06 03:57:57.800629,0 days 00:00:06.879979,tanh,0.15000000000000002,2,0.8,0.11219695955514908,,,PRUNED
2026,2026,0.10879400372505188,2023-01-06 03:57:57.914134,2023-01-06 03:58:04.974885,0 days 00:00:07.060751,relu,0.15000000000000002,2,0.75,0.10879400372505188,,,PRUNED
2027,2027,0.1333416998386383,2023-01-06 03:58:05.080903,2023-01-06 03:58:34.589321,0 days 00:00:29.508418,sigmoid,0.25,2,0.55,0.06551168113946915,0.043427009135484695,0.032941121608018875,COMPLETE
2028,2028,0.09722946584224701,2023-01-06 03:58:34.735845,2023-01-06 03:58:41.512953,0 days 00:00:06.777108,sigmoid,0.25,2,0.6,0.09722946584224701,,,PRUNED
2029,2029,0.24469414353370667,2023-01-06 03:58:41.616775,2023-01-06 03:59:09.418392,0 days 00:00:27.801617,tanh,0.0,7,0.95,0.24469414353370667,,,PRUNED
2030,2030,0.125688374042511,2023-01-06 03:59:09.514641,2023-01-06 03:59:16.452184,0 days 00:00:06.937543,sigmoid,0.25,2,0.55,0.125688374042511,,,PRUNED
2031,2031,0.13618315756320953,2023-01-06 03:59:16.588346,2023-01-06 03:59:50.775338,0 days 00:00:34.186992,tanh,0.0,2,1.0,0.03560002148151398,,,COMPLETE
2032,2032,0.1302349865436554,2023-01-06 03:59:50.899474,2023-01-06 03:59:57.632480,0 days 00:00:06.733006,sigmoid,0.25,2,0.6,0.1302349865436554,,,PRUNED
2033,2033,0.14261530339717865,2023-01-06 03:59:57.746508,2023-01-06 04:00:25.001095,0 days 00:00:27.254587,sigmoid,0.25,2,0.55,0.06696232408285141,0.0514131523668766,0.029596881940960884,COMPLETE
2034,2034,0.07041125744581223,2023-01-06 04:00:25.112939,2023-01-06 04:00:36.946026,0 days 00:00:11.833087,relu,0.15000000000000002,2,0.75,0.07041125744581223,,,PRUNED
2035,2035,0.07832079380750656,2023-01-06 04:00:37.061955,2023-01-06 04:00:48.995106,0 days 00:00:11.933151,tanh,0.35000000000000003,2,0.8500000000000001,0.07832079380750656,,,PRUNED
2036,2036,0.14828597009181976,2023-01-06 04:00:49.110037,2023-01-06 04:01:20.811126,0 days 00:00:31.701089,tanh,0.0,2,0.95,0.036910682916641235,,,COMPLETE
2037,2037,0.049410950392484665,2023-01-06 04:01:20.924955,2023-01-06 04:01:47.656159,0 days 00:00:26.731204,tanh,0.0,2,0.95,0.049410950392484665,,,PRUNED
2038,2038,0.11289747059345245,2023-01-06 04:01:47.755550,2023-01-06 04:01:54.849414,0 days 00:00:07.093864,sigmoid,0.25,2,0.55,0.11289747059345245,,,PRUNED
2039,2039,0.06661563366651535,2023-01-06 04:01:54.956003,2023-01-06 04:02:06.947482,0 days 00:00:11.991479,sigmoid,0.25,2,0.6,0.07527191936969757,0.06661563366651535,,PRUNED
2040,2040,0.13280178606510162,2023-01-06 04:02:07.062459,2023-01-06 04:02:38.795836,0 days 00:00:31.733377,tanh,0.0,2,0.95,0.03199727460741997,,,COMPLETE
2041,2041,0.09966034442186356,2023-01-06 04:02:38.918991,2023-01-06 04:02:45.877840,0 days 00:00:06.958849,sigmoid,0.25,2,0.55,0.09966034442186356,,,PRUNED
2042,2042,0.13156728446483612,2023-01-06 04:02:45.975108,2023-01-06 04:03:16.162790,0 days 00:00:30.187682,sigmoid,0.25,2,0.55,0.06966955959796906,0.040359362959861755,0.03217729181051254,COMPLETE
2043,2043,0.05576498806476593,2023-01-06 04:03:16.291907,2023-01-06 04:03:28.166288,0 days 00:00:11.874381,sigmoid,0.25,2,0.55,0.08757071942090988,0.05576498806476593,,PRUNED
2044,2044,0.03864844888448715,2023-01-06 04:03:28.272881,2023-01-06 04:03:55.122585,0 days 00:00:26.849704,tanh,0.0,2,0.95,0.03864844888448715,,,PRUNED
2045,2045,0.12613698840141296,2023-01-06 04:03:55.244597,2023-01-06 04:04:02.238700,0 days 00:00:06.994103,sigmoid,0.25,2,0.55,0.12613698840141296,,,PRUNED
2046,2046,0.05733034014701843,2023-01-06 04:04:02.352390,2023-01-06 04:04:14.421116,0 days 00:00:12.068726,sigmoid,0.25,2,0.55,0.059753380715847015,0.05733034014701843,,PRUNED
2047,2047,0.13512660562992096,2023-01-06 04:04:14.525413,2023-01-06 04:04:21.437147,0 days 00:00:06.911734,sigmoid,0.25,2,0.55,0.13512660562992096,,,PRUNED
2048,2048,0.10013680905103683,2023-01-06 04:04:21.532967,2023-01-06 04:04:28.745024,0 days 00:00:07.212057,sigmoid,0.25,2,0.55,0.10013680905103683,,,PRUNED
2049,2049,0.12219265103340149,2023-01-06 04:04:28.859947,2023-01-06 04:04:35.761467,0 days 00:00:06.901520,sigmoid,0.25,2,0.55,0.12219265103340149,,,PRUNED
2050,2050,0.037453074008226395,2023-01-06 04:04:35.880872,2023-01-06 04:05:02.924752,0 days 00:00:27.043880,relu,0.45,2,0.75,0.05768240988254547,0.037453074008226395,,PRUNED
2051,2051,0.06252586096525192,2023-01-06 04:05:03.021007,2023-01-06 04:05:14.998858,0 days 00:00:11.977851,sigmoid,0.25,2,0.55,0.08896971493959427,0.06252586096525192,,PRUNED
2052,2052,0.08152799308300018,2023-01-06 04:05:15.102419,2023-01-06 04:05:26.939575,0 days 00:00:11.837156,relu,0.2,2,0.8500000000000001,0.08152799308300018,,,PRUNED
2053,2053,0.12811730802059174,2023-01-06 04:05:27.055739,2023-01-06 04:05:34.148372,0 days 00:00:07.092633,sigmoid,0.25,3,0.55,0.12811730802059174,,,PRUNED
2054,2054,0.14432738721370697,2023-01-06 04:05:34.262308,2023-01-06 04:05:41.081173,0 days 00:00:06.818865,sigmoid,0.25,2,0.55,0.14432738721370697,,,PRUNED
2055,2055,0.13358162343502045,2023-01-06 04:05:41.194363,2023-01-06 04:06:10.430711,0 days 00:00:29.236348,tanh,0.30000000000000004,2,0.95,0.03388461470603943,,,COMPLETE
2056,2056,0.10175730288028717,2023-01-06 04:06:10.555043,2023-01-06 04:06:17.504727,0 days 00:00:06.949684,sigmoid,0.25,2,0.6,0.10175730288028717,,,PRUNED
2057,2057,0.07915150374174118,2023-01-06 04:06:17.600835,2023-01-06 04:06:29.501950,0 days 00:00:11.901115,relu,0.0,2,0.65,0.07915150374174118,,,PRUNED
2058,2058,0.06003677472472191,2023-01-06 04:06:29.609235,2023-01-06 04:06:41.626895,0 days 00:00:12.017660,sigmoid,0.25,2,0.55,0.09148705005645752,0.06003677472472191,,PRUNED
2059,2059,0.07525281608104706,2023-01-06 04:06:41.748972,2023-01-06 04:06:53.575973,0 days 00:00:11.827001,relu,0.35000000000000003,2,0.8,0.07525281608104706,,,PRUNED
2060,2060,0.04129009321331978,2023-01-06 04:06:53.681961,2023-01-06 04:07:20.397904,0 days 00:00:26.715943,tanh,0.25,2,0.95,0.04129009321331978,,,PRUNED
2061,2061,0.04263800382614136,2023-01-06 04:07:20.502003,2023-01-06 04:07:47.304142,0 days 00:00:26.802139,relu,0.25,2,0.7,0.05917462334036827,0.04263800382614136,,PRUNED
2062,2062,0.0558694489300251,2023-01-06 04:07:47.417942,2023-01-06 04:07:59.595901,0 days 00:00:12.177959,sigmoid,0.25,2,0.55,0.09629286080598831,0.0558694489300251,,PRUNED
2063,2063,0.039266910403966904,2023-01-06 04:07:59.720001,2023-01-06 04:08:26.426188,0 days 00:00:26.706187,tanh,0.35000000000000003,2,0.95,0.039266910403966904,,,PRUNED
2064,2064,0.15459713339805603,2023-01-06 04:08:26.532609,2023-01-06 04:08:58.294298,0 days 00:00:31.761689,tanh,0.30000000000000004,2,0.95,0.03708239644765854,,,COMPLETE
2065,2065,0.10177331417798996,2023-01-06 04:08:58.414819,2023-01-06 04:09:05.465859,0 days 00:00:07.051040,sigmoid,0.25,2,0.6,0.10177331417798996,,,PRUNED
2066,2066,0.03593742102384567,2023-01-06 04:09:05.589961,2023-01-06 04:09:32.497127,0 days 00:00:26.907166,sigmoid,0.30000000000000004,2,0.55,0.08078358322381973,0.05197020620107651,0.03593742102384567,PRUNED
2067,2067,0.10445624589920044,2023-01-06 04:09:32.600788,2023-01-06 04:09:39.546588,0 days 00:00:06.945800,sigmoid,0.25,2,0.55,0.10445624589920044,,,PRUNED
2068,2068,0.1104578748345375,2023-01-06 04:09:39.660238,2023-01-06 04:09:46.771031,0 days 00:00:07.110793,sigmoid,0.25,2,0.6,0.1104578748345375,,,PRUNED
2069,2069,0.0393141470849514,2023-01-06 04:09:46.885804,2023-01-06 04:10:13.659949,0 days 00:00:26.774145,relu,0.2,2,0.8500000000000001,0.058919358998537064,0.0393141470849514,,PRUNED
2070,2070,0.13168734312057495,2023-01-06 04:10:13.766075,2023-01-06 04:10:20.693451,0 days 00:00:06.927376,sigmoid,0.25,2,0.55,0.13168734312057495,,,PRUNED
2071,2071,0.03870091587305069,2023-01-06 04:10:20.796872,2023-01-06 04:10:48.074689,0 days 00:00:27.277817,sigmoid,0.30000000000000004,2,0.55,0.07827802002429962,0.05407370626926422,0.03870091587305069,PRUNED
2072,2072,0.03556956723332405,2023-01-06 04:10:48.180581,2023-01-06 04:11:14.996632,0 days 00:00:26.816051,relu,0.2,2,0.7,0.05402889475226402,0.03556956723332405,,PRUNED
2073,2073,0.056458838284015656,2023-01-06 04:11:15.095728,2023-01-06 04:11:27.070705,0 days 00:00:11.974977,sigmoid,0.25,2,0.55,0.09544983506202698,0.056458838284015656,,PRUNED
2074,2074,0.0685470849275589,2023-01-06 04:11:27.194803,2023-01-06 04:11:39.154115,0 days 00:00:11.959312,relu,0.30000000000000004,2,0.65,0.0685470849275589,,,PRUNED
2075,2075,0.0760284811258316,2023-01-06 04:11:39.267523,2023-01-06 04:11:51.119862,0 days 00:00:11.852339,relu,0.25,2,0.8500000000000001,0.0760284811258316,,,PRUNED
2076,2076,0.04039786756038666,2023-01-06 04:11:51.250706,2023-01-06 04:12:18.033477,0 days 00:00:26.782771,tanh,0.30000000000000004,2,0.95,0.04039786756038666,,,PRUNED
2077,2077,0.05758460611104965,2023-01-06 04:12:18.142641,2023-01-06 04:12:30.108553,0 days 00:00:11.965912,sigmoid,0.25,2,0.55,0.08032828569412231,0.05758460611104965,,PRUNED
2078,2078,0.07263366878032684,2023-01-06 04:12:30.217718,2023-01-06 04:12:42.082638,0 days 00:00:11.864920,relu,0.1,2,0.6,0.07263366878032684,,,PRUNED
2079,2079,0.12373591214418411,2023-01-06 04:12:42.208466,2023-01-06 04:12:49.223763,0 days 00:00:07.015297,sigmoid,0.25,2,0.6,0.12373591214418411,,,PRUNED
2080,2080,0.11284928768873215,2023-01-06 04:12:49.332918,2023-01-06 04:12:56.331547,0 days 00:00:06.998629,sigmoid,0.30000000000000004,3,0.55,0.11284928768873215,,,PRUNED
2081,2081,0.04087917134165764,2023-01-06 04:12:56.429559,2023-01-06 04:13:23.161830,0 days 00:00:26.732271,tanh,0.25,2,0.95,0.04087917134165764,,,PRUNED
2082,2082,0.06333661079406738,2023-01-06 04:13:23.270084,2023-01-06 04:13:35.145245,0 days 00:00:11.875161,relu,0.45,2,0.7,0.06333661079406738,,,PRUNED
2083,2083,0.05644559860229492,2023-01-06 04:13:35.252571,2023-01-06 04:13:47.260996,0 days 00:00:12.008425,sigmoid,0.25,2,0.55,0.07042483985424042,0.05644559860229492,,PRUNED
2084,2084,0.03642568364739418,2023-01-06 04:13:47.359817,2023-01-06 04:14:14.275374,0 days 00:00:26.915557,sigmoid,0.25,2,0.55,0.08684702217578888,0.05223098397254944,0.03642568364739418,PRUNED
