,number,value,datetime_start,datetime_complete,duration,params_activation,params_dropout,params_layers,params_shrink,system_attrs_completed_rung_0,system_attrs_completed_rung_1,system_attrs_completed_rung_2,state
1176,1176,0.11978461593389511,2023-01-06 00:14:00.388204,2023-01-06 00:14:07.633020,0 days 00:00:07.244816,relu,0.2,3,0.5,0.11978461593389511,,,PRUNED
1177,1177,0.08569195866584778,2023-01-06 00:14:07.727311,2023-01-06 00:14:19.915654,0 days 00:00:12.188343,tanh,0.15000000000000002,4,0.5,0.06801499426364899,0.08569195866584778,,PRUNED
1178,1178,0.1095849871635437,2023-01-06 00:14:20.046696,2023-01-06 00:14:26.857260,0 days 00:00:06.810564,relu,0.30000000000000004,2,0.5,0.1095849871635437,,,PRUNED
1179,1179,0.12461987137794495,2023-01-06 00:14:26.959180,2023-01-06 00:14:33.890360,0 days 00:00:06.931180,relu,0.15000000000000002,2,0.55,0.12461987137794495,,,PRUNED
1180,1180,0.09987124055624008,2023-01-06 00:14:34.205828,2023-01-06 00:14:41.223136,0 days 00:00:07.017308,tanh,0.45,2,0.5,0.09987124055624008,,,PRUNED
1181,1181,0.14320653676986694,2023-01-06 00:14:41.344382,2023-01-06 00:14:48.222606,0 days 00:00:06.878224,relu,0.15000000000000002,2,0.5,0.14320653676986694,,,PRUNED
1182,1182,0.06345963478088379,2023-01-06 00:14:48.345406,2023-01-06 00:15:00.279020,0 days 00:00:11.933614,relu,0.15000000000000002,2,0.6,0.07838227599859238,0.06345963478088379,,PRUNED
1183,1183,0.03755708038806915,2023-01-06 00:15:00.425261,2023-01-06 00:15:27.335314,0 days 00:00:26.910053,sigmoid,0.0,2,0.8500000000000001,0.03755708038806915,,,PRUNED
1184,1184,0.05859318748116493,2023-01-06 00:15:27.466877,2023-01-06 00:15:39.392720,0 days 00:00:11.925843,tanh,0.2,2,1.0,0.08963951468467712,0.05859318748116493,,PRUNED
1185,1185,0.03839026764035225,2023-01-06 00:15:39.516247,2023-01-06 00:16:06.416055,0 days 00:00:26.899808,relu,0.25,2,0.65,0.05819840356707573,0.03839026764035225,,PRUNED
1186,1186,0.0873304009437561,2023-01-06 00:16:06.527921,2023-01-06 00:16:18.623269,0 days 00:00:12.095348,relu,0.25,3,0.65,0.0873304009437561,,,PRUNED
1187,1187,0.05698762461543083,2023-01-06 00:16:18.752026,2023-01-06 00:16:30.822151,0 days 00:00:12.070125,relu,0.2,2,0.5,0.09455917775630951,0.05698762461543083,,PRUNED
1188,1188,0.11922212690114975,2023-01-06 00:16:30.935054,2023-01-06 00:16:38.005938,0 days 00:00:07.070884,tanh,0.15000000000000002,2,0.5,0.11922212690114975,,,PRUNED
1189,1189,0.0632433295249939,2023-01-06 00:16:38.134510,2023-01-06 00:16:49.962598,0 days 00:00:11.828088,relu,0.25,2,0.65,0.0632433295249939,,,PRUNED
1190,1190,0.03861689940094948,2023-01-06 00:16:50.085877,2023-01-06 00:17:17.060304,0 days 00:00:26.974427,tanh,0.0,2,0.7,0.03861689940094948,,,PRUNED
1191,1191,0.07614501565694809,2023-01-06 00:17:17.174392,2023-01-06 00:17:29.176051,0 days 00:00:12.001659,relu,0.25,2,0.65,0.07614501565694809,,,PRUNED
1192,1192,0.08034952729940414,2023-01-06 00:17:29.290963,2023-01-06 00:17:41.266807,0 days 00:00:11.975844,relu,0.30000000000000004,2,0.65,0.08034952729940414,,,PRUNED
1193,1193,0.04274020716547966,2023-01-06 00:17:41.388040,2023-01-06 00:18:08.114763,0 days 00:00:26.726723,sigmoid,0.0,2,0.55,0.04274020716547966,,,PRUNED
1194,1194,0.03848247975111008,2023-01-06 00:18:08.248152,2023-01-06 00:18:35.404352,0 days 00:00:27.156200,relu,0.30000000000000004,2,0.65,0.056868597865104675,0.03848247975111008,,PRUNED
1195,1195,0.10858310014009476,2023-01-06 00:18:35.535927,2023-01-06 00:18:42.429612,0 days 00:00:06.893685,relu,0.15000000000000002,2,0.5,0.10858310014009476,,,PRUNED
1196,1196,0.11805351823568344,2023-01-06 00:18:42.552282,2023-01-06 00:18:49.404311,0 days 00:00:06.852029,sigmoid,0.15000000000000002,2,0.55,0.11805351823568344,,,PRUNED
1197,1197,0.041040390729904175,2023-01-06 00:18:49.518200,2023-01-06 00:19:16.417907,0 days 00:00:26.899707,sigmoid,0.1,2,0.9,0.041040390729904175,,,PRUNED
1198,1198,0.04317489266395569,2023-01-06 00:19:16.532812,2023-01-06 00:19:43.282532,0 days 00:00:26.749720,tanh,0.0,2,0.8,0.04317489266395569,,,PRUNED
1199,1199,0.12301377207040787,2023-01-06 00:19:43.402769,2023-01-06 00:19:50.258002,0 days 00:00:06.855233,relu,0.15000000000000002,2,0.5,0.12301377207040787,,,PRUNED
1200,1200,0.13713927567005157,2023-01-06 00:19:50.370913,2023-01-06 00:20:19.671681,0 days 00:00:29.300768,relu,0.25,2,0.7,0.05163400247693062,0.034980446100234985,,COMPLETE
1201,1201,0.07230647653341293,2023-01-06 00:20:19.788023,2023-01-06 00:20:31.912169,0 days 00:00:12.124146,tanh,0.25,2,0.6,0.07230647653341293,,,PRUNED
1202,1202,0.10965048521757126,2023-01-06 00:20:32.027074,2023-01-06 00:20:38.979303,0 days 00:00:06.952229,sigmoid,0.15000000000000002,2,0.5,0.10965048521757126,,,PRUNED
1203,1203,0.07252829521894455,2023-01-06 00:20:39.094203,2023-01-06 00:20:50.994055,0 days 00:00:11.899852,relu,0.35000000000000003,2,0.65,0.07252829521894455,,,PRUNED
1204,1204,0.13940662145614624,2023-01-06 00:20:51.106963,2023-01-06 00:21:23.076692,0 days 00:00:31.969729,sigmoid,0.0,2,0.8500000000000001,0.037086717784404755,,,COMPLETE
1205,1205,0.15254931151866913,2023-01-06 00:21:23.210612,2023-01-06 00:21:30.191078,0 days 00:00:06.980466,tanh,0.2,3,0.5,0.15254931151866913,,,PRUNED
1206,1206,0.13974212110042572,2023-01-06 00:21:30.303988,2023-01-06 00:21:42.556812,0 days 00:00:12.252824,sigmoid,0.25,6,0.65,0.13974212110042572,,,PRUNED
1207,1207,0.03599408641457558,2023-01-06 00:21:42.677396,2023-01-06 00:22:09.755286,0 days 00:00:27.077890,relu,0.45,2,1.0,0.047848619520664215,0.03599408641457558,,PRUNED
1208,1208,0.076755590736866,2023-01-06 00:22:09.868654,2023-01-06 00:22:21.762171,0 days 00:00:11.893517,relu,0.4,2,0.7,0.076755590736866,,,PRUNED
1209,1209,0.042149245738983154,2023-01-06 00:22:21.884401,2023-01-06 00:22:48.535365,0 days 00:00:26.650964,sigmoid,0.0,2,0.8500000000000001,0.042149245738983154,,,PRUNED
1210,1210,0.07237839698791504,2023-01-06 00:22:48.667704,2023-01-06 00:23:00.542549,0 days 00:00:11.874845,relu,0.4,2,0.8,0.07237839698791504,,,PRUNED
1211,1211,0.044987019151449203,2023-01-06 00:23:00.658460,2023-01-06 00:23:27.615739,0 days 00:00:26.957279,sigmoid,0.0,2,0.8500000000000001,0.044987019151449203,,,PRUNED
1212,1212,0.11768119037151337,2023-01-06 00:23:27.736738,2023-01-06 00:23:34.723293,0 days 00:00:06.986555,relu,0.15000000000000002,2,0.5,0.11768119037151337,,,PRUNED
1213,1213,0.037527717649936676,2023-01-06 00:23:34.845530,2023-01-06 00:24:01.687906,0 days 00:00:26.842376,relu,0.35000000000000003,2,0.7,0.05789700895547867,0.037527717649936676,,PRUNED
1214,1214,0.12776216864585876,2023-01-06 00:24:01.801817,2023-01-06 00:24:08.938352,0 days 00:00:07.136535,sigmoid,0.30000000000000004,2,0.5,0.12776216864585876,,,PRUNED
1215,1215,0.13947685062885284,2023-01-06 00:24:09.069931,2023-01-06 00:24:36.112344,0 days 00:00:27.042413,sigmoid,0.0,2,0.95,0.03263256326317787,,,COMPLETE
1216,1216,0.04156271368265152,2023-01-06 00:24:36.241543,2023-01-06 00:25:02.866603,0 days 00:00:26.625060,sigmoid,0.0,2,0.8500000000000001,0.04156271368265152,,,PRUNED
1217,1217,0.04008020460605621,2023-01-06 00:25:02.981507,2023-01-06 00:25:29.772886,0 days 00:00:26.791379,sigmoid,0.0,2,0.8500000000000001,0.04008020460605621,,,PRUNED
1218,1218,0.05618788301944733,2023-01-06 00:25:29.896126,2023-01-06 00:25:41.921318,0 days 00:00:12.025192,relu,0.2,2,0.5,0.08979684114456177,0.05618788301944733,,PRUNED
1219,1219,0.09839340299367905,2023-01-06 00:25:42.224038,2023-01-06 00:25:49.304146,0 days 00:00:07.080108,sigmoid,0.15000000000000002,2,0.55,0.09839340299367905,,,PRUNED
1220,1220,0.07039882242679596,2023-01-06 00:25:49.410600,2023-01-06 00:26:01.243950,0 days 00:00:11.833350,relu,0.45,2,0.75,0.07039882242679596,,,PRUNED
1221,1221,0.10332304984331131,2023-01-06 00:26:01.362403,2023-01-06 00:26:08.336079,0 days 00:00:06.973676,tanh,0.15000000000000002,2,0.5,0.10332304984331131,,,PRUNED
1222,1222,0.11514927446842194,2023-01-06 00:26:08.443190,2023-01-06 00:26:15.518309,0 days 00:00:07.075119,relu,0.2,2,0.5,0.11514927446842194,,,PRUNED
1223,1223,0.13660567998886108,2023-01-06 00:26:15.616655,2023-01-06 00:26:45.256055,0 days 00:00:29.639400,sigmoid,0.0,2,0.8500000000000001,0.03448547050356865,,,COMPLETE
1224,1224,0.1477515697479248,2023-01-06 00:26:45.376109,2023-01-06 00:26:52.149429,0 days 00:00:06.773320,sigmoid,0.15000000000000002,2,0.5,0.1477515697479248,,,PRUNED
1225,1225,0.044569820165634155,2023-01-06 00:26:52.255536,2023-01-06 00:27:18.796846,0 days 00:00:26.541310,relu,0.0,2,1.0,0.044569820165634155,,,PRUNED
1226,1226,0.06964165717363358,2023-01-06 00:27:18.912845,2023-01-06 00:27:31.053791,0 days 00:00:12.140946,relu,0.4,2,0.6,0.06964165717363358,,,PRUNED
1227,1227,0.13298098742961884,2023-01-06 00:27:31.159531,2023-01-06 00:27:38.054260,0 days 00:00:06.894729,relu,0.0,2,0.55,0.13298098742961884,,,PRUNED
1228,1228,0.0589120090007782,2023-01-06 00:27:38.170128,2023-01-06 00:27:50.052382,0 days 00:00:11.882254,sigmoid,0.15000000000000002,2,0.5,0.0900571420788765,0.0589120090007782,,PRUNED
1229,1229,0.06742565333843231,2023-01-06 00:27:50.168798,2023-01-06 00:28:02.368859,0 days 00:00:12.200061,tanh,0.15000000000000002,2,0.6,0.07844001054763794,0.06742565333843231,,PRUNED
1230,1230,0.09993483126163483,2023-01-06 00:28:02.502454,2023-01-06 00:28:14.608814,0 days 00:00:12.106360,relu,0.30000000000000004,4,0.95,0.09993483126163483,,,PRUNED
1231,1231,0.13754776120185852,2023-01-06 00:28:14.731601,2023-01-06 00:28:21.666786,0 days 00:00:06.935185,relu,0.2,2,0.5,0.13754776120185852,,,PRUNED
1232,1232,0.07151342928409576,2023-01-06 00:28:21.793119,2023-01-06 00:28:33.774421,0 days 00:00:11.981302,relu,0.25,2,0.8500000000000001,0.07151342928409576,,,PRUNED
1233,1233,0.163469597697258,2023-01-06 00:28:33.883145,2023-01-06 00:28:41.149473,0 days 00:00:07.266328,sigmoid,0.15000000000000002,5,0.5,0.163469597697258,,,PRUNED
1234,1234,0.060535166412591934,2023-01-06 00:28:41.256586,2023-01-06 00:28:53.222425,0 days 00:00:11.965839,relu,0.30000000000000004,2,0.5,0.08535738289356232,0.060535166412591934,,PRUNED
1235,1235,0.14013411104679108,2023-01-06 00:28:53.345341,2023-01-06 00:29:00.239258,0 days 00:00:06.893917,sigmoid,0.05,2,0.5,0.14013411104679108,,,PRUNED
1236,1236,0.11520712822675705,2023-01-06 00:29:00.345810,2023-01-06 00:29:07.463673,0 days 00:00:07.117863,tanh,0.15000000000000002,2,0.5,0.11520712822675705,,,PRUNED
1237,1237,0.1315903216600418,2023-01-06 00:29:07.597464,2023-01-06 00:29:14.513174,0 days 00:00:06.915710,relu,0.15000000000000002,2,0.65,0.1315903216600418,,,PRUNED
1238,1238,0.05747859552502632,2023-01-06 00:29:14.627107,2023-01-06 00:29:26.628930,0 days 00:00:12.001823,sigmoid,0.15000000000000002,2,0.8,0.08260481059551239,0.05747859552502632,,PRUNED
1239,1239,0.14483682811260223,2023-01-06 00:29:26.762715,2023-01-06 00:29:54.078634,0 days 00:00:27.315919,tanh,0.2,2,0.55,0.07397699356079102,0.04918105527758598,0.032583024352788925,COMPLETE
1240,1240,0.05692002922296524,2023-01-06 00:29:54.202778,2023-01-06 00:30:06.258254,0 days 00:00:12.055476,relu,0.15000000000000002,2,0.5,0.07127277553081512,0.05692002922296524,,PRUNED
1241,1241,0.10893663018941879,2023-01-06 00:30:06.382512,2023-01-06 00:30:13.250387,0 days 00:00:06.867875,sigmoid,0.05,2,0.5,0.10893663018941879,,,PRUNED
1242,1242,0.12175124138593674,2023-01-06 00:30:13.397666,2023-01-06 00:30:20.333182,0 days 00:00:06.935516,relu,0.15000000000000002,2,0.5,0.12175124138593674,,,PRUNED
1243,1243,0.06559915840625763,2023-01-06 00:30:20.456448,2023-01-06 00:30:32.622915,0 days 00:00:12.166467,sigmoid,0.2,2,0.55,0.07589586824178696,0.06559915840625763,,PRUNED
1244,1244,0.042412593960762024,2023-01-06 00:30:32.762911,2023-01-06 00:30:59.487551,0 days 00:00:26.724640,sigmoid,0.0,2,0.8500000000000001,0.042412593960762024,,,PRUNED
1245,1245,0.11637895554304123,2023-01-06 00:30:59.603480,2023-01-06 00:31:06.554676,0 days 00:00:06.951196,tanh,0.15000000000000002,2,0.5,0.11637895554304123,,,PRUNED
1246,1246,0.068630151450634,2023-01-06 00:31:06.676943,2023-01-06 00:31:18.669425,0 days 00:00:11.992482,relu,0.4,2,0.5,0.068630151450634,,,PRUNED
1247,1247,0.12016724795103073,2023-01-06 00:31:18.827192,2023-01-06 00:31:25.711553,0 days 00:00:06.884361,relu,0.05,2,0.6,0.12016724795103073,,,PRUNED
1248,1248,0.14308546483516693,2023-01-06 00:31:25.833818,2023-01-06 00:31:32.502707,0 days 00:00:06.668889,sigmoid,0.35000000000000003,2,0.5,0.14308546483516693,,,PRUNED
1249,1249,0.06803274899721146,2023-01-06 00:31:32.617639,2023-01-06 00:31:44.359138,0 days 00:00:11.741499,relu,0.4,2,0.65,0.06803274899721146,,,PRUNED
1250,1250,0.10745043307542801,2023-01-06 00:31:44.475071,2023-01-06 00:31:51.700599,0 days 00:00:07.225528,relu,0.0,2,0.5,0.10745043307542801,,,PRUNED
1251,1251,0.12146726250648499,2023-01-06 00:31:51.807085,2023-01-06 00:31:58.717383,0 days 00:00:06.910298,sigmoid,0.25,2,0.55,0.12146726250648499,,,PRUNED
1252,1252,0.14828920364379883,2023-01-06 00:31:58.839645,2023-01-06 00:32:30.501580,0 days 00:00:31.661935,tanh,0.05,2,0.8500000000000001,0.03514525294303894,,,COMPLETE
1253,1253,0.1253463178873062,2023-01-06 00:32:30.622249,2023-01-06 00:32:37.347787,0 days 00:00:06.725538,tanh,0.15000000000000002,2,0.9,0.1253463178873062,,,PRUNED
1254,1254,0.13742177188396454,2023-01-06 00:32:37.468978,2023-01-06 00:32:44.563903,0 days 00:00:07.094925,relu,0.2,2,0.5,0.13742177188396454,,,PRUNED
1255,1255,0.037439774721860886,2023-01-06 00:32:44.693500,2023-01-06 00:33:11.310882,0 days 00:00:26.617382,tanh,0.25,2,0.8500000000000001,0.05788469314575195,0.037439774721860886,,PRUNED
1256,1256,0.13146325945854187,2023-01-06 00:33:11.426641,2023-01-06 00:33:18.353007,0 days 00:00:06.926366,sigmoid,0.15000000000000002,2,0.5,0.13146325945854187,,,PRUNED
1257,1257,0.1311357468366623,2023-01-06 00:33:18.460606,2023-01-06 00:33:25.635789,0 days 00:00:07.175183,relu,0.25,2,0.5,0.1311357468366623,,,PRUNED
1258,1258,0.07728061825037003,2023-01-06 00:33:25.757048,2023-01-06 00:33:37.584427,0 days 00:00:11.827379,relu,0.2,2,0.9,0.07728061825037003,,,PRUNED
1259,1259,0.03866422921419144,2023-01-06 00:33:37.697454,2023-01-06 00:34:04.690158,0 days 00:00:26.992704,relu,0.35000000000000003,2,0.7,0.060457948595285416,0.03866422921419144,,PRUNED
1260,1260,0.047436222434043884,2023-01-06 00:34:04.795756,2023-01-06 00:34:31.921424,0 days 00:00:27.125668,relu,0.45,3,0.8500000000000001,0.06235465034842491,0.047436222434043884,,PRUNED
1261,1261,0.0345347598195076,2023-01-06 00:34:32.036355,2023-01-06 00:34:59.019523,0 days 00:00:26.983168,sigmoid,0.05,2,0.5,0.08106853812932968,0.05200105905532837,0.0345347598195076,PRUNED
1262,1262,0.07059982419013977,2023-01-06 00:34:59.134300,2023-01-06 00:35:10.918467,0 days 00:00:11.784167,relu,0.4,2,0.8500000000000001,0.07059982419013977,,,PRUNED
1263,1263,0.13076893985271454,2023-01-06 00:35:11.033395,2023-01-06 00:35:42.790983,0 days 00:00:31.757588,sigmoid,0.0,2,0.9,0.032267387956380844,,,COMPLETE
1264,1264,0.07507763803005219,2023-01-06 00:35:42.906657,2023-01-06 00:35:54.882391,0 days 00:00:11.975734,relu,0.4,2,0.65,0.07507763803005219,,,PRUNED
1265,1265,0.11542899906635284,2023-01-06 00:35:54.997728,2023-01-06 00:36:01.848685,0 days 00:00:06.850957,tanh,0.15000000000000002,2,0.5,0.11542899906635284,,,PRUNED
1266,1266,0.03857967630028725,2023-01-06 00:36:01.952528,2023-01-06 00:36:28.412597,0 days 00:00:26.460069,sigmoid,0.0,2,0.9,0.03857967630028725,,,PRUNED
1267,1267,0.06201613321900368,2023-01-06 00:36:28.536002,2023-01-06 00:36:40.628326,0 days 00:00:12.092324,relu,0.1,3,0.5,0.09755782783031464,0.06201613321900368,,PRUNED
1268,1268,0.04413832351565361,2023-01-06 00:36:40.742044,2023-01-06 00:37:07.817950,0 days 00:00:27.075906,relu,0.35000000000000003,2,0.6,0.05896911397576332,0.04413832351565361,,PRUNED
1269,1269,0.05589403584599495,2023-01-06 00:37:07.925532,2023-01-06 00:37:19.817030,0 days 00:00:11.891498,sigmoid,0.2,2,0.8,0.07099069654941559,0.05589403584599495,,PRUNED
1270,1270,0.11855052411556244,2023-01-06 00:37:19.931992,2023-01-06 00:37:26.809160,0 days 00:00:06.877168,relu,0.15000000000000002,2,0.55,0.11855052411556244,,,PRUNED
1271,1271,0.13501237332820892,2023-01-06 00:37:26.906419,2023-01-06 00:37:56.294610,0 days 00:00:29.388191,relu,0.15000000000000002,2,0.8,0.044011034071445465,0.03382231667637825,,COMPLETE
1272,1272,0.035188473761081696,2023-01-06 00:37:56.413189,2023-01-06 00:38:23.128884,0 days 00:00:26.715695,sigmoid,0.15000000000000002,2,0.95,0.06564842164516449,0.05237369239330292,0.035188473761081696,PRUNED
1273,1273,0.05698553845286369,2023-01-06 00:38:23.243811,2023-01-06 00:38:35.161302,0 days 00:00:11.917491,tanh,0.1,2,0.6,0.09190564602613449,0.05698553845286369,,PRUNED
1274,1274,0.06636659801006317,2023-01-06 00:38:35.276231,2023-01-06 00:38:47.160391,0 days 00:00:11.884160,relu,0.15000000000000002,2,0.5,0.06865613162517548,0.06636659801006317,,PRUNED
1275,1275,0.06523020565509796,2023-01-06 00:38:47.291985,2023-01-06 00:38:59.301151,0 days 00:00:12.009166,relu,0.4,2,0.55,0.06523020565509796,,,PRUNED
1276,1276,0.06143780052661896,2023-01-06 00:38:59.415844,2023-01-06 00:39:11.341895,0 days 00:00:11.926051,sigmoid,0.25,2,0.5,0.09071248024702072,0.06143780052661896,,PRUNED
1277,1277,0.06640405207872391,2023-01-06 00:39:11.463021,2023-01-06 00:39:23.165998,0 days 00:00:11.702977,relu,0.25,2,0.7,0.06640405207872391,,,PRUNED
1278,1278,0.07374542206525803,2023-01-06 00:39:23.279921,2023-01-06 00:39:34.973429,0 days 00:00:11.693508,relu,0.2,2,0.8500000000000001,0.07374542206525803,,,PRUNED
1279,1279,0.084970623254776,2023-01-06 00:39:35.277063,2023-01-06 00:39:47.139174,0 days 00:00:11.862111,sigmoid,0.4,2,0.7,0.084970623254776,,,PRUNED
1280,1280,0.04203737899661064,2023-01-06 00:39:47.253101,2023-01-06 00:40:13.762154,0 days 00:00:26.509053,sigmoid,0.0,2,0.9,0.04203737899661064,,,PRUNED
1281,1281,0.06153876706957817,2023-01-06 00:40:13.912418,2023-01-06 00:40:25.744672,0 days 00:00:11.832254,tanh,0.2,2,0.5,0.09548886865377426,0.06153876706957817,,PRUNED
1282,1282,0.039055436849594116,2023-01-06 00:40:25.858411,2023-01-06 00:40:52.609300,0 days 00:00:26.750889,tanh,0.1,2,0.9,0.039055436849594116,,,PRUNED
1283,1283,0.07846701145172119,2023-01-06 00:40:52.724135,2023-01-06 00:41:04.491742,0 days 00:00:11.767607,relu,0.30000000000000004,2,0.8500000000000001,0.07846701145172119,,,PRUNED
1284,1284,0.04154533892869949,2023-01-06 00:41:04.604149,2023-01-06 00:41:31.131390,0 days 00:00:26.527241,sigmoid,0.0,2,0.9,0.04154533892869949,,,PRUNED
1285,1285,0.04049035906791687,2023-01-06 00:41:31.255544,2023-01-06 00:41:58.204847,0 days 00:00:26.949303,sigmoid,0.05,2,0.55,0.04049035906791687,,,PRUNED
1286,1286,0.07011982798576355,2023-01-06 00:41:58.321015,2023-01-06 00:42:10.262633,0 days 00:00:11.941618,relu,0.05,2,0.5,0.0886029303073883,0.07011982798576355,,PRUNED
1287,1287,0.0598590113222599,2023-01-06 00:42:10.382911,2023-01-06 00:42:22.319169,0 days 00:00:11.936258,sigmoid,0.30000000000000004,2,0.5,0.09309493750333786,0.0598590113222599,,PRUNED
1288,1288,0.1375446915626526,2023-01-06 00:42:22.435663,2023-01-06 00:42:56.665874,0 days 00:00:34.230211,sigmoid,0.15000000000000002,2,0.6,0.03631334379315376,,,COMPLETE
1289,1289,0.041226327419281006,2023-01-06 00:42:56.798729,2023-01-06 00:43:23.856160,0 days 00:00:27.057431,tanh,0.45,2,0.65,0.0608951561152935,0.041226327419281006,,PRUNED
1290,1290,0.03965102136135101,2023-01-06 00:43:23.997991,2023-01-06 00:43:50.595796,0 days 00:00:26.597805,tanh,0.0,2,0.65,0.03965102136135101,,,PRUNED
1291,1291,0.13308410346508026,2023-01-06 00:43:50.710628,2023-01-06 00:43:57.662933,0 days 00:00:06.952305,relu,0.15000000000000002,2,0.65,0.13308410346508026,,,PRUNED
1292,1292,0.2616639733314514,2023-01-06 00:43:57.767425,2023-01-06 00:44:05.837307,0 days 00:00:08.069882,sigmoid,0.15000000000000002,8,0.55,0.2616639733314514,,,PRUNED
1293,1293,0.10740436613559723,2023-01-06 00:44:05.935896,2023-01-06 00:44:12.703010,0 days 00:00:06.767114,tanh,0.15000000000000002,2,0.5,0.10740436613559723,,,PRUNED
1294,1294,0.08020327985286713,2023-01-06 00:44:12.792711,2023-01-06 00:44:24.518219,0 days 00:00:11.725508,relu,0.4,2,0.8500000000000001,0.08020327985286713,,,PRUNED
1295,1295,0.059696510434150696,2023-01-06 00:44:24.626142,2023-01-06 00:44:36.434748,0 days 00:00:11.808606,relu,0.05,2,0.5,0.06904570013284683,0.059696510434150696,,PRUNED
1296,1296,0.041627172380685806,2023-01-06 00:44:36.540897,2023-01-06 00:45:03.398509,0 days 00:00:26.857612,sigmoid,0.0,2,0.95,0.041627172380685806,,,PRUNED
1297,1297,0.05899598449468613,2023-01-06 00:45:03.507522,2023-01-06 00:45:15.340028,0 days 00:00:11.832506,sigmoid,0.2,2,0.5,0.07477325946092606,0.05899598449468613,,PRUNED
1298,1298,0.037676405161619186,2023-01-06 00:45:15.444310,2023-01-06 00:45:42.012347,0 days 00:00:26.568037,sigmoid,0.0,2,0.9,0.037676405161619186,,,PRUNED
1299,1299,0.10864723473787308,2023-01-06 00:45:42.120278,2023-01-06 00:45:48.962815,0 days 00:00:06.842537,relu,0.1,2,0.55,0.10864723473787308,,,PRUNED
1300,1300,0.1310063898563385,2023-01-06 00:45:49.051058,2023-01-06 00:45:56.178934,0 days 00:00:07.127876,sigmoid,0.15000000000000002,2,0.5,0.1310063898563385,,,PRUNED
1301,1301,0.10228642076253891,2023-01-06 00:45:56.286856,2023-01-06 00:46:03.027418,0 days 00:00:06.740562,tanh,0.25,2,0.5,0.10228642076253891,,,PRUNED
1302,1302,0.134553924202919,2023-01-06 00:46:03.125020,2023-01-06 00:46:09.844269,0 days 00:00:06.719249,relu,0.15000000000000002,2,0.5,0.134553924202919,,,PRUNED
1303,1303,0.13275165855884552,2023-01-06 00:46:09.932809,2023-01-06 00:46:39.491627,0 days 00:00:29.558818,relu,0.2,2,0.6,0.045115094631910324,0.03314534202218056,,COMPLETE
1304,1304,0.12128801643848419,2023-01-06 00:46:39.600903,2023-01-06 00:46:46.441794,0 days 00:00:06.840891,sigmoid,0.05,2,0.5,0.12128801643848419,,,PRUNED
1305,1305,0.06409364193677902,2023-01-06 00:46:46.539373,2023-01-06 00:46:58.215288,0 days 00:00:11.675915,relu,0.2,2,0.6,0.06409364193677902,,,PRUNED
