,number,value,datetime_start,datetime_complete,duration,params_activation,params_dropout,params_layers,params_shrink,system_attrs_completed_rung_0,system_attrs_completed_rung_1,system_attrs_completed_rung_2,state
524,524,0.11377566307783127,2023-01-05 21:12:34.409442,2023-01-05 21:12:41.514255,0 days 00:00:07.104813,relu,0.15000000000000002,2,0.55,0.11377566307783127,,,PRUNED
525,525,0.0680483877658844,2023-01-05 21:12:41.629624,2023-01-05 21:12:53.346694,0 days 00:00:11.717070,relu,0.15000000000000002,2,0.8,0.0680483877658844,,,PRUNED
526,526,0.1130625456571579,2023-01-05 21:12:53.475682,2023-01-05 21:13:00.455503,0 days 00:00:06.979821,sigmoid,0.1,2,0.5,0.1130625456571579,,,PRUNED
527,527,0.07809625566005707,2023-01-05 21:13:00.566800,2023-01-05 21:13:12.570067,0 days 00:00:12.003267,relu,0.1,2,0.8500000000000001,0.07809625566005707,,,PRUNED
528,528,0.04046188294887543,2023-01-05 21:13:12.685085,2023-01-05 21:13:39.431706,0 days 00:00:26.746621,tanh,0.0,2,0.8500000000000001,0.04046188294887543,,,PRUNED
529,529,0.10920513421297073,2023-01-05 21:13:39.589996,2023-01-05 21:13:46.417705,0 days 00:00:06.827709,relu,0.2,2,0.5,0.10920513421297073,,,PRUNED
530,530,0.042286619544029236,2023-01-05 21:13:46.529005,2023-01-05 21:14:13.207346,0 days 00:00:26.678341,relu,0.2,2,0.8500000000000001,0.06030785292387009,0.042286619544029236,,PRUNED
531,531,0.039028994739055634,2023-01-05 21:14:13.319651,2023-01-05 21:14:40.330317,0 days 00:00:27.010666,relu,0.2,2,0.8,0.06017326936125755,0.039028994739055634,,PRUNED
532,532,0.0926486998796463,2023-01-05 21:14:40.462283,2023-01-05 21:14:52.321717,0 days 00:00:11.859434,relu,0.15000000000000002,2,0.9,0.0926486998796463,,,PRUNED
533,533,0.26363974809646606,2023-01-05 21:14:52.440710,2023-01-05 21:14:59.678842,0 days 00:00:07.238132,sigmoid,0.05,6,0.5,0.26363974809646606,,,PRUNED
534,534,0.12175873667001724,2023-01-05 21:14:59.773401,2023-01-05 21:15:06.536655,0 days 00:00:06.763254,relu,0.15000000000000002,2,0.55,0.12175873667001724,,,PRUNED
535,535,0.13443632423877716,2023-01-05 21:15:06.667468,2023-01-05 21:15:41.100003,0 days 00:00:34.432535,tanh,0.0,2,0.8500000000000001,0.03505750745534897,,,COMPLETE
536,536,0.043677277863025665,2023-01-05 21:15:41.207378,2023-01-05 21:16:07.673722,0 days 00:00:26.466344,tanh,0.0,2,0.9,0.043677277863025665,,,PRUNED
537,537,0.0558476485311985,2023-01-05 21:16:07.794364,2023-01-05 21:16:19.714481,0 days 00:00:11.920117,sigmoid,0.05,2,0.65,0.08679933100938797,0.0558476485311985,,PRUNED
538,538,0.03957138955593109,2023-01-05 21:16:19.843457,2023-01-05 21:16:46.704376,0 days 00:00:26.860919,tanh,0.0,2,0.9,0.03957138955593109,,,PRUNED
539,539,0.1180613785982132,2023-01-05 21:16:46.819417,2023-01-05 21:16:53.661921,0 days 00:00:06.842504,relu,0.15000000000000002,2,0.5,0.1180613785982132,,,PRUNED
540,540,0.07278294861316681,2023-01-05 21:16:53.757560,2023-01-05 21:17:05.619348,0 days 00:00:11.861788,sigmoid,0.05,2,0.5,0.08327876031398773,0.07278294861316681,,PRUNED
541,541,0.07177655398845673,2023-01-05 21:17:05.747557,2023-01-05 21:17:17.585112,0 days 00:00:11.837555,relu,0.25,2,0.9,0.07177655398845673,,,PRUNED
542,542,0.11087629199028015,2023-01-05 21:17:17.697420,2023-01-05 21:17:24.776238,0 days 00:00:07.078818,relu,0.2,2,0.5,0.11087629199028015,,,PRUNED
543,543,0.0388181172311306,2023-01-05 21:17:24.881420,2023-01-05 21:17:51.524220,0 days 00:00:26.642800,relu,0.05,2,0.8,0.0388181172311306,,,PRUNED
544,544,0.14776696264743805,2023-01-05 21:17:51.644870,2023-01-05 21:18:20.838287,0 days 00:00:29.193417,relu,0.15000000000000002,2,0.8500000000000001,0.054838187992572784,0.03255929425358772,,COMPLETE
545,545,0.12352097034454346,2023-01-05 21:18:20.968017,2023-01-05 21:18:27.871486,0 days 00:00:06.903469,sigmoid,0.15000000000000002,2,0.5,0.12352097034454346,,,PRUNED
546,546,0.13401241600513458,2023-01-05 21:18:27.992121,2023-01-05 21:18:57.432648,0 days 00:00:29.440527,relu,0.15000000000000002,2,0.75,0.06613627821207047,0.04142194241285324,0.033230289816856384,COMPLETE
547,547,0.08124296367168427,2023-01-05 21:18:57.550901,2023-01-05 21:19:09.243371,0 days 00:00:11.692470,relu,0.2,2,0.8,0.08124296367168427,,,PRUNED
548,548,0.10829202085733414,2023-01-05 21:19:09.355680,2023-01-05 21:19:16.217828,0 days 00:00:06.862148,sigmoid,0.45,2,0.75,0.10829202085733414,,,PRUNED
549,549,0.13443171977996826,2023-01-05 21:19:16.314923,2023-01-05 21:19:23.392292,0 days 00:00:07.077369,relu,0.15000000000000002,2,0.75,0.13443171977996826,,,PRUNED
550,550,0.1393616646528244,2023-01-05 21:19:23.514939,2023-01-05 21:19:52.846397,0 days 00:00:29.331458,tanh,0.0,2,0.8,0.035252876579761505,,,COMPLETE
551,551,0.12057887017726898,2023-01-05 21:19:52.982061,2023-01-05 21:19:59.656229,0 days 00:00:06.674168,sigmoid,0.15000000000000002,2,0.75,0.12057887017726898,,,PRUNED
552,552,0.1204034686088562,2023-01-05 21:19:59.769448,2023-01-05 21:20:06.789024,0 days 00:00:07.019576,relu,0.35000000000000003,2,0.7,0.1204034686088562,,,PRUNED
553,553,0.15627318620681763,2023-01-05 21:20:06.900811,2023-01-05 21:20:33.690805,0 days 00:00:26.789994,relu,0.25,2,0.8,0.059664059430360794,0.035891178995370865,,COMPLETE
554,554,0.12611684203147888,2023-01-05 21:20:33.817648,2023-01-05 21:20:40.569812,0 days 00:00:06.752164,sigmoid,0.15000000000000002,2,0.75,0.12611684203147888,,,PRUNED
555,555,0.13342468440532684,2023-01-05 21:20:40.681119,2023-01-05 21:20:47.652619,0 days 00:00:06.971500,relu,0.1,3,0.55,0.13342468440532684,,,PRUNED
556,556,0.041703253984451294,2023-01-05 21:20:47.774255,2023-01-05 21:21:14.525584,0 days 00:00:26.751329,tanh,0.05,2,0.8500000000000001,0.041703253984451294,,,PRUNED
557,557,0.1338232010602951,2023-01-05 21:21:14.638749,2023-01-05 21:21:21.500700,0 days 00:00:06.861951,sigmoid,0.0,2,0.65,0.1338232010602951,,,PRUNED
558,558,0.1330222636461258,2023-01-05 21:21:21.614367,2023-01-05 21:22:00.710762,0 days 00:00:39.096395,relu,0.2,2,0.75,0.05753679201006889,0.0355076938867569,,COMPLETE
559,559,0.12159084528684616,2023-01-05 21:22:00.837921,2023-01-05 21:22:07.605643,0 days 00:00:06.767722,relu,0.05,2,0.5,0.12159084528684616,,,PRUNED
560,560,0.12921448051929474,2023-01-05 21:22:07.734900,2023-01-05 21:22:14.854372,0 days 00:00:07.119472,sigmoid,0.1,2,0.75,0.12921448051929474,,,PRUNED
561,561,0.10742584615945816,2023-01-05 21:22:14.993684,2023-01-05 21:22:21.820514,0 days 00:00:06.826830,tanh,0.15000000000000002,2,0.75,0.10742584615945816,,,PRUNED
562,562,0.0359874926507473,2023-01-05 21:22:21.944168,2023-01-05 21:22:48.627151,0 days 00:00:26.682983,relu,0.2,2,0.8500000000000001,0.06101594865322113,0.0359874926507473,,PRUNED
563,563,0.11475834995508194,2023-01-05 21:22:48.748472,2023-01-05 21:22:55.851285,0 days 00:00:07.102813,relu,0.05,2,0.7,0.11475834995508194,,,PRUNED
564,564,0.09967873245477676,2023-01-05 21:22:55.956263,2023-01-05 21:23:02.825765,0 days 00:00:06.869502,sigmoid,0.15000000000000002,2,0.5,0.09967873245477676,,,PRUNED
565,565,0.06556268036365509,2023-01-05 21:23:02.930767,2023-01-05 21:23:14.783195,0 days 00:00:11.852428,relu,0.25,2,0.75,0.06556268036365509,,,PRUNED
566,566,0.04004630818963051,2023-01-05 21:23:14.887149,2023-01-05 21:23:41.690817,0 days 00:00:26.803668,relu,0.2,2,0.8500000000000001,0.05664107948541641,0.04004630818963051,,PRUNED
567,567,0.13092000782489777,2023-01-05 21:23:41.793497,2023-01-05 21:23:48.905625,0 days 00:00:07.112128,relu,0.05,2,0.55,0.13092000782489777,,,PRUNED
568,568,0.18718886375427246,2023-01-05 21:23:49.036523,2023-01-05 21:23:56.355057,0 days 00:00:07.318534,tanh,0.15000000000000002,7,0.5,0.18718886375427246,,,PRUNED
569,569,0.18154260516166687,2023-01-05 21:23:56.460065,2023-01-05 21:24:03.937814,0 days 00:00:07.477749,sigmoid,0.05,8,0.95,0.18154260516166687,,,PRUNED
570,570,0.14953359961509705,2023-01-05 21:24:04.050150,2023-01-05 21:24:36.102359,0 days 00:00:32.052209,tanh,0.0,2,0.9,0.0370057076215744,,,COMPLETE
571,571,0.08317970484495163,2023-01-05 21:24:36.226405,2023-01-05 21:24:48.201181,0 days 00:00:11.974776,relu,0.05,2,0.8500000000000001,0.08317970484495163,,,PRUNED
572,572,0.03802518919110298,2023-01-05 21:24:48.304275,2023-01-05 21:25:15.140794,0 days 00:00:26.836519,relu,0.25,2,0.9,0.06261046230792999,0.03802518919110298,,PRUNED
573,573,0.12397830188274384,2023-01-05 21:25:15.245794,2023-01-05 21:25:22.040277,0 days 00:00:06.794483,relu,0.15000000000000002,2,0.6,0.12397830188274384,,,PRUNED
574,574,0.037844154983758926,2023-01-05 21:25:22.153608,2023-01-05 21:25:49.138233,0 days 00:00:26.984625,relu,0.2,2,0.8500000000000001,0.06033588945865631,0.037844154983758926,,PRUNED
575,575,0.1074080616235733,2023-01-05 21:25:49.243226,2023-01-05 21:25:56.445300,0 days 00:00:07.202074,tanh,0.0,6,0.8500000000000001,0.1074080616235733,,,PRUNED
576,576,0.09887825697660446,2023-01-05 21:25:56.551007,2023-01-05 21:26:03.328110,0 days 00:00:06.777103,sigmoid,0.1,2,0.5,0.09887825697660446,,,PRUNED
577,577,0.10937061160802841,2023-01-05 21:26:03.443154,2023-01-05 21:26:10.485915,0 days 00:00:07.042761,relu,0.15000000000000002,2,0.55,0.10937061160802841,,,PRUNED
578,578,0.12271148711442947,2023-01-05 21:26:10.575319,2023-01-05 21:26:17.311140,0 days 00:00:06.735821,tanh,0.05,2,0.5,0.12271148711442947,,,PRUNED
579,579,0.108255535364151,2023-01-05 21:26:17.426439,2023-01-05 21:26:24.251535,0 days 00:00:06.825096,sigmoid,0.05,2,1.0,0.108255535364151,,,PRUNED
580,580,0.12860415875911713,2023-01-05 21:26:24.374758,2023-01-05 21:26:31.251010,0 days 00:00:06.876252,relu,0.35000000000000003,2,0.5,0.12860415875911713,,,PRUNED
581,581,0.16589520871639252,2023-01-05 21:26:31.355718,2023-01-05 21:26:38.458798,0 days 00:00:07.103080,tanh,0.15000000000000002,3,0.5,0.16589520871639252,,,PRUNED
582,582,0.14308977127075195,2023-01-05 21:26:38.573843,2023-01-05 21:27:08.056573,0 days 00:00:29.482730,relu,0.15000000000000002,2,0.75,0.05962497740983963,0.033090509474277496,,COMPLETE
583,583,0.13352985680103302,2023-01-05 21:27:08.187636,2023-01-05 21:27:14.938979,0 days 00:00:06.751343,sigmoid,0.1,2,0.8,0.13352985680103302,,,PRUNED
584,584,0.08148086071014404,2023-01-05 21:27:15.060372,2023-01-05 21:27:27.163462,0 days 00:00:12.103090,relu,0.15000000000000002,2,0.55,0.09493675827980042,0.08148086071014404,,PRUNED
585,585,0.11611056327819824,2023-01-05 21:27:27.278284,2023-01-05 21:27:34.146271,0 days 00:00:06.867987,tanh,0.1,2,0.65,0.11611056327819824,,,PRUNED
586,586,0.12885883450508118,2023-01-05 21:27:34.242646,2023-01-05 21:27:40.970753,0 days 00:00:06.728107,sigmoid,0.15000000000000002,2,0.8500000000000001,0.12885883450508118,,,PRUNED
587,587,0.14349126815795898,2023-01-05 21:27:41.073468,2023-01-05 21:28:05.627566,0 days 00:00:24.554098,relu,0.05,2,0.5,0.057118479162454605,0.03865483030676842,,COMPLETE
588,588,0.13573744893074036,2023-01-05 21:28:05.734613,2023-01-05 21:28:45.180886,0 days 00:00:39.446273,tanh,0.0,2,0.8500000000000001,0.035961102694272995,,,COMPLETE
589,589,0.08327657729387283,2023-01-05 21:28:45.308649,2023-01-05 21:28:57.190017,0 days 00:00:11.881368,relu,0.1,2,0.8,0.08327657729387283,,,PRUNED
590,590,0.12727461755275726,2023-01-05 21:28:57.303063,2023-01-05 21:29:04.264398,0 days 00:00:06.961335,relu,0.05,2,0.5,0.12727461755275726,,,PRUNED
591,591,0.08311809599399567,2023-01-05 21:29:04.378521,2023-01-05 21:29:16.213580,0 days 00:00:11.835059,relu,0.2,2,0.9,0.08311809599399567,,,PRUNED
592,592,0.13064855337142944,2023-01-05 21:29:16.310955,2023-01-05 21:29:23.454696,0 days 00:00:07.143741,relu,0.05,2,0.5,0.13064855337142944,,,PRUNED
593,593,0.05603804811835289,2023-01-05 21:29:23.570748,2023-01-05 21:29:35.503789,0 days 00:00:11.933041,relu,0.05,2,0.5,0.0988830178976059,0.05603804811835289,,PRUNED
594,594,0.14219829440116882,2023-01-05 21:29:35.626175,2023-01-05 21:29:42.883527,0 days 00:00:07.257352,relu,0.05,6,0.6,0.14219829440116882,,,PRUNED
595,595,0.07373311370611191,2023-01-05 21:29:43.011024,2023-01-05 21:29:54.935657,0 days 00:00:11.924633,relu,0.05,2,0.9,0.0647665411233902,0.07373311370611191,,PRUNED
596,596,0.13215917348861694,2023-01-05 21:29:55.049879,2023-01-05 21:30:01.943368,0 days 00:00:06.893489,relu,0.0,2,0.5,0.13215917348861694,,,PRUNED
597,597,0.1512145847082138,2023-01-05 21:30:02.067029,2023-01-05 21:30:09.159591,0 days 00:00:07.092562,relu,0.05,5,0.65,0.1512145847082138,,,PRUNED
598,598,0.1025877296924591,2023-01-05 21:30:09.272230,2023-01-05 21:30:16.025735,0 days 00:00:06.753505,tanh,0.1,2,0.5,0.1025877296924591,,,PRUNED
599,599,0.09600026160478592,2023-01-05 21:30:16.132448,2023-01-05 21:30:28.424806,0 days 00:00:12.292358,relu,0.4,4,0.75,0.09600026160478592,,,PRUNED
600,600,0.05850348249077797,2023-01-05 21:30:28.530513,2023-01-05 21:30:40.565556,0 days 00:00:12.035043,relu,0.05,2,0.5,0.09332845360040665,0.05850348249077797,,PRUNED
601,601,0.04416543245315552,2023-01-05 21:30:40.679785,2023-01-05 21:31:07.280212,0 days 00:00:26.600427,tanh,0.0,2,0.95,0.04416543245315552,,,PRUNED
602,602,0.12056472897529602,2023-01-05 21:31:07.386919,2023-01-05 21:31:14.296349,0 days 00:00:06.909430,tanh,0.05,2,0.55,0.12056472897529602,,,PRUNED
603,603,0.10982680320739746,2023-01-05 21:31:14.411399,2023-01-05 21:31:21.470604,0 days 00:00:07.059205,relu,0.0,2,0.5,0.10982680320739746,,,PRUNED
604,604,0.03703359141945839,2023-01-05 21:31:21.568189,2023-01-05 21:31:48.443584,0 days 00:00:26.875395,relu,0.4,2,0.8500000000000001,0.056721340864896774,0.03703359141945839,,PRUNED
605,605,0.039938442409038544,2023-01-05 21:31:48.568157,2023-01-05 21:32:15.375079,0 days 00:00:26.806922,relu,0.35000000000000003,2,0.8500000000000001,0.06165570020675659,0.039938442409038544,,PRUNED
606,606,0.12222577631473541,2023-01-05 21:32:15.481793,2023-01-05 21:32:22.391212,0 days 00:00:06.909419,tanh,0.1,2,0.8500000000000001,0.12222577631473541,,,PRUNED
607,607,0.06162452697753906,2023-01-05 21:32:22.699392,2023-01-05 21:32:34.798626,0 days 00:00:12.099234,relu,0.05,2,0.5,0.0744251012802124,0.06162452697753906,,PRUNED
608,608,0.12288399785757065,2023-01-05 21:32:34.915972,2023-01-05 21:32:41.814748,0 days 00:00:06.898776,relu,0.05,2,0.7,0.12288399785757065,,,PRUNED
609,609,0.03545502573251724,2023-01-05 21:32:41.938314,2023-01-05 21:33:08.712727,0 days 00:00:26.774413,tanh,0.1,2,0.5,0.08161415904760361,0.05231563374400139,0.03545502573251724,PRUNED
610,610,0.13364733755588531,2023-01-05 21:33:08.827778,2023-01-05 21:33:15.971480,0 days 00:00:07.143702,relu,0.15000000000000002,2,0.55,0.13364733755588531,,,PRUNED
611,611,0.12678013741970062,2023-01-05 21:33:16.085555,2023-01-05 21:33:23.053607,0 days 00:00:06.968052,tanh,0.30000000000000004,2,0.6,0.12678013741970062,,,PRUNED
612,612,0.038438159972429276,2023-01-05 21:33:23.168374,2023-01-05 21:33:51.076262,0 days 00:00:27.907888,tanh,0.0,2,0.8500000000000001,0.038438159972429276,,,PRUNED
613,613,0.03919427841901779,2023-01-05 21:33:51.191247,2023-01-05 21:34:17.740855,0 days 00:00:26.549608,tanh,0.0,2,0.8,0.03919427841901779,,,PRUNED
614,614,0.1006690189242363,2023-01-05 21:34:17.864235,2023-01-05 21:34:24.990312,0 days 00:00:07.126077,relu,0.05,2,0.5,0.1006690189242363,,,PRUNED
615,615,0.12615668773651123,2023-01-05 21:34:25.095052,2023-01-05 21:34:31.981532,0 days 00:00:06.886480,tanh,0.15000000000000002,2,0.75,0.12615668773651123,,,PRUNED
616,616,0.0733598843216896,2023-01-05 21:34:32.095630,2023-01-05 21:34:44.197195,0 days 00:00:12.101565,relu,0.0,3,0.6,0.09687165170907974,0.0733598843216896,,PRUNED
617,617,0.12985000014305115,2023-01-05 21:34:44.327282,2023-01-05 21:35:18.765121,0 days 00:00:34.437839,relu,0.25,2,0.7,0.052958812564611435,0.031899355351924896,,COMPLETE
618,618,0.14167916774749756,2023-01-05 21:35:18.878977,2023-01-05 21:35:47.962920,0 days 00:00:29.083943,tanh,0.05,2,0.8500000000000001,0.03616103529930115,,,COMPLETE
619,619,0.040570806711912155,2023-01-05 21:35:48.084110,2023-01-05 21:36:14.798701,0 days 00:00:26.714591,relu,0.25,2,0.7,0.060337331146001816,0.040570806711912155,,PRUNED
620,620,0.04041508957743645,2023-01-05 21:36:14.923091,2023-01-05 21:36:41.671678,0 days 00:00:26.748587,relu,0.25,2,0.7,0.0526336170732975,0.04041508957743645,,PRUNED
621,621,0.06462101638317108,2023-01-05 21:36:41.974978,2023-01-05 21:36:53.770764,0 days 00:00:11.795786,relu,0.25,2,0.65,0.06462101638317108,,,PRUNED
622,622,0.13060323894023895,2023-01-05 21:36:53.881567,2023-01-05 21:37:00.695241,0 days 00:00:06.813674,sigmoid,0.15000000000000002,2,0.5,0.13060323894023895,,,PRUNED
623,623,0.11186192184686661,2023-01-05 21:37:00.808043,2023-01-05 21:37:07.461397,0 days 00:00:06.653354,relu,0.05,2,0.8,0.11186192184686661,,,PRUNED
624,624,0.08041450381278992,2023-01-05 21:37:07.573203,2023-01-05 21:37:19.518832,0 days 00:00:11.945629,relu,0.25,2,0.7,0.08041450381278992,,,PRUNED
625,625,0.1263400763273239,2023-01-05 21:37:19.639952,2023-01-05 21:37:26.476631,0 days 00:00:06.836679,tanh,0.1,2,0.5,0.1263400763273239,,,PRUNED
626,626,0.12404059618711472,2023-01-05 21:37:26.589434,2023-01-05 21:37:33.376112,0 days 00:00:06.786678,sigmoid,0.15000000000000002,2,0.5,0.12404059618711472,,,PRUNED
627,627,0.06565095484256744,2023-01-05 21:37:33.502404,2023-01-05 21:37:45.238846,0 days 00:00:11.736442,relu,0.15000000000000002,2,0.75,0.06565095484256744,,,PRUNED
628,628,0.1360710710287094,2023-01-05 21:37:45.359509,2023-01-05 21:38:17.576645,0 days 00:00:32.217136,relu,0.2,2,0.5,0.0819815918803215,0.05281621217727661,0.03282138332724571,COMPLETE
629,629,0.14733095467090607,2023-01-05 21:38:17.707755,2023-01-05 21:38:44.432888,0 days 00:00:26.725133,tanh,0.2,2,0.8500000000000001,0.05639859661459923,0.03230905905365944,,COMPLETE
630,630,0.1307671070098877,2023-01-05 21:38:44.572384,2023-01-05 21:39:16.438879,0 days 00:00:31.866495,tanh,0.25,2,0.5,0.05912786349654198,0.04079324007034302,0.03235035017132759,COMPLETE
631,631,0.07257185876369476,2023-01-05 21:39:16.547989,2023-01-05 21:39:28.134127,0 days 00:00:11.586138,relu,0.45,2,0.65,0.07257185876369476,,,PRUNED
632,632,0.05587621033191681,2023-01-05 21:39:28.425595,2023-01-05 21:39:40.312823,0 days 00:00:11.887228,sigmoid,0.2,2,0.5,0.08942259103059769,0.05587621033191681,,PRUNED
633,633,0.039546333253383636,2023-01-05 21:39:40.424844,2023-01-05 21:40:07.114201,0 days 00:00:26.689357,tanh,0.0,2,0.8500000000000001,0.039546333253383636,,,PRUNED
634,634,0.07754000276327133,2023-01-05 21:40:07.231146,2023-01-05 21:40:18.902262,0 days 00:00:11.671116,relu,0.2,2,0.65,0.07754000276327133,,,PRUNED
635,635,0.03913705050945282,2023-01-05 21:40:19.033290,2023-01-05 21:40:45.844849,0 days 00:00:26.811559,relu,0.0,2,0.65,0.03913705050945282,,,PRUNED
636,636,0.11500510573387146,2023-01-05 21:40:45.961367,2023-01-05 21:40:52.869748,0 days 00:00:06.908381,tanh,0.25,2,0.5,0.11500510573387146,,,PRUNED
637,637,0.19226351380348206,2023-01-05 21:40:52.988035,2023-01-05 21:41:00.260520,0 days 00:00:07.272485,relu,0.25,7,0.5,0.19226351380348206,,,PRUNED
638,638,0.06570113450288773,2023-01-05 21:41:00.376143,2023-01-05 21:41:12.442934,0 days 00:00:12.066791,relu,0.4,2,0.7,0.06570113450288773,,,PRUNED
639,639,0.11486145853996277,2023-01-05 21:41:12.561557,2023-01-05 21:41:19.417651,0 days 00:00:06.856094,sigmoid,0.25,2,0.5,0.11486145853996277,,,PRUNED
640,640,0.06351523846387863,2023-01-05 21:41:19.533026,2023-01-05 21:41:31.183188,0 days 00:00:11.650162,relu,0.35000000000000003,2,0.8,0.06351523846387863,,,PRUNED
641,641,0.11707369238138199,2023-01-05 21:41:31.317478,2023-01-05 21:41:38.167084,0 days 00:00:06.849606,relu,0.25,2,0.5,0.11707369238138199,,,PRUNED
642,642,0.042056355625391006,2023-01-05 21:41:38.275546,2023-01-05 21:42:05.081345,0 days 00:00:26.805799,tanh,0.0,2,0.8,0.042056355625391006,,,PRUNED
643,643,0.07133974134922028,2023-01-05 21:42:05.198258,2023-01-05 21:42:17.063780,0 days 00:00:11.865522,tanh,0.2,2,0.55,0.06504307687282562,0.07133974134922028,,PRUNED
644,644,0.13498559594154358,2023-01-05 21:42:17.180686,2023-01-05 21:42:23.896667,0 days 00:00:06.715981,sigmoid,0.2,2,0.5,0.13498559594154358,,,PRUNED
645,645,0.1042931005358696,2023-01-05 21:42:24.003178,2023-01-05 21:42:30.879403,0 days 00:00:06.876225,relu,0.15000000000000002,2,0.8500000000000001,0.1042931005358696,,,PRUNED
646,646,0.13144318759441376,2023-01-05 21:42:30.994308,2023-01-05 21:42:38.395506,0 days 00:00:07.401198,tanh,0.30000000000000004,2,0.5,0.13144318759441376,,,PRUNED
647,647,0.04396122321486473,2023-01-05 21:42:38.514415,2023-01-05 21:43:05.510128,0 days 00:00:26.995713,tanh,0.05,3,0.8500000000000001,0.04396122321486473,,,PRUNED
648,648,0.037984658032655716,2023-01-05 21:43:05.625128,2023-01-05 21:43:32.508094,0 days 00:00:26.882966,relu,0.35000000000000003,2,0.6,0.06257757544517517,0.037984658032655716,,PRUNED
649,649,0.03711533173918724,2023-01-05 21:43:32.623999,2023-01-05 21:43:59.314398,0 days 00:00:26.690399,relu,0.2,2,0.8,0.05733555927872658,0.03711533173918724,,PRUNED
650,650,0.1363687664270401,2023-01-05 21:43:59.437519,2023-01-05 21:44:06.630514,0 days 00:00:07.192995,relu,0.25,4,0.55,0.1363687664270401,,,PRUNED
651,651,0.11557231098413467,2023-01-05 21:44:06.736945,2023-01-05 21:44:13.554992,0 days 00:00:06.818047,sigmoid,0.25,2,0.5,0.11557231098413467,,,PRUNED
652,652,0.13559851050376892,2023-01-05 21:44:13.653245,2023-01-05 21:44:20.746108,0 days 00:00:07.092863,tanh,0.2,5,0.5,0.13559851050376892,,,PRUNED
653,653,0.13663749396800995,2023-01-05 21:44:20.853070,2023-01-05 21:44:50.330204,0 days 00:00:29.477134,tanh,0.0,2,0.6,0.03516397997736931,,,COMPLETE
654,654,0.10079845786094666,2023-01-05 21:44:50.453142,2023-01-05 21:44:57.276695,0 days 00:00:06.823553,relu,0.15000000000000002,2,0.5,0.10079845786094666,,,PRUNED
655,655,0.2431376874446869,2023-01-05 21:44:57.385284,2023-01-05 21:45:22.097628,0 days 00:00:24.712344,tanh,0.0,6,0.55,,,,COMPLETE
656,656,0.14049099385738373,2023-01-05 21:45:22.231801,2023-01-05 21:45:51.742386,0 days 00:00:29.510585,sigmoid,0.25,2,0.5,0.07143164426088333,0.051505375653505325,0.03199216350913048,COMPLETE
