,number,value,datetime_start,datetime_complete,duration,params_activation,params_dropout,params_layers,params_shrink,system_attrs_completed_rung_0,system_attrs_completed_rung_1,system_attrs_completed_rung_2,state
1436,1436,0.03781648352742195,2023-01-06 01:19:52.126721,2023-01-06 01:20:18.757920,0 days 00:00:26.631199,relu,0.25,2,0.8500000000000001,0.06181980296969414,0.03781648352742195,,PRUNED
1437,1437,0.1359894871711731,2023-01-06 01:20:18.873683,2023-01-06 01:20:25.900043,0 days 00:00:07.026360,relu,0.25,2,0.5,0.1359894871711731,,,PRUNED
1438,1438,0.03694799169898033,2023-01-06 01:20:26.006479,2023-01-06 01:20:52.730336,0 days 00:00:26.723857,relu,0.4,2,0.65,0.059729330241680145,0.03694799169898033,,PRUNED
1439,1439,0.05517717823386192,2023-01-06 01:20:52.846103,2023-01-06 01:21:04.647102,0 days 00:00:11.800999,sigmoid,0.15000000000000002,2,0.65,0.09041422605514526,0.05517717823386192,,PRUNED
1440,1440,0.19044893980026245,2023-01-06 01:21:04.759871,2023-01-06 01:21:12.146698,0 days 00:00:07.386827,relu,0.2,6,0.5,0.19044893980026245,,,PRUNED
1441,1441,0.14799867570400238,2023-01-06 01:21:12.268497,2023-01-06 01:21:36.899298,0 days 00:00:24.630801,sigmoid,0.15000000000000002,2,0.5,0.08008424192667007,0.04157053306698799,,COMPLETE
1442,1442,0.1074976846575737,2023-01-06 01:21:37.010103,2023-01-06 01:21:43.802461,0 days 00:00:06.792358,tanh,0.1,2,0.55,0.1074976846575737,,,PRUNED
1443,1443,0.13146810233592987,2023-01-06 01:21:43.918242,2023-01-06 01:21:50.985261,0 days 00:00:07.067019,relu,0.15000000000000002,2,0.5,0.13146810233592987,,,PRUNED
1444,1444,0.13251319527626038,2023-01-06 01:21:51.089684,2023-01-06 01:21:57.867439,0 days 00:00:06.777755,sigmoid,0.2,2,0.8,0.13251319527626038,,,PRUNED
1445,1445,0.06941886246204376,2023-01-06 01:21:57.980033,2023-01-06 01:22:09.824361,0 days 00:00:11.844328,relu,0.2,2,0.6,0.06941886246204376,,,PRUNED
1446,1446,0.14999867975711823,2023-01-06 01:22:09.940252,2023-01-06 01:22:16.841618,0 days 00:00:06.901366,relu,0.15000000000000002,2,0.5,0.14999867975711823,,,PRUNED
1447,1447,0.1034746766090393,2023-01-06 01:22:16.948056,2023-01-06 01:22:23.916287,0 days 00:00:06.968231,sigmoid,0.25,2,0.5,0.1034746766090393,,,PRUNED
1448,1448,0.11801812797784805,2023-01-06 01:22:24.029972,2023-01-06 01:22:30.898881,0 days 00:00:06.868909,tanh,0.2,2,0.6,0.11801812797784805,,,PRUNED
1449,1449,0.059881873428821564,2023-01-06 01:22:30.995018,2023-01-06 01:22:42.813824,0 days 00:00:11.818806,relu,0.15000000000000002,2,0.5,0.09688493609428406,0.059881873428821564,,PRUNED
1450,1450,0.12848404049873352,2023-01-06 01:22:42.929413,2023-01-06 01:23:17.940622,0 days 00:00:35.011209,sigmoid,0.15000000000000002,2,0.5,0.08139079809188843,0.04144055023789406,0.029812099412083626,COMPLETE
1451,1451,0.06258847564458847,2023-01-06 01:23:18.062022,2023-01-06 01:23:29.785077,0 days 00:00:11.723055,relu,0.45,2,0.7,0.06258847564458847,,,PRUNED
1452,1452,0.038070157170295715,2023-01-06 01:23:29.892509,2023-01-06 01:23:56.533054,0 days 00:00:26.640545,relu,0.4,2,0.8500000000000001,0.05299737676978111,0.038070157170295715,,PRUNED
1453,1453,0.14293059706687927,2023-01-06 01:23:56.639482,2023-01-06 01:24:23.796118,0 days 00:00:27.156636,sigmoid,0.05,2,0.8,0.033203672617673874,,,COMPLETE
1454,1454,0.1027693971991539,2023-01-06 01:24:23.923426,2023-01-06 01:24:30.756449,0 days 00:00:06.833023,sigmoid,0.15000000000000002,2,0.55,0.1027693971991539,,,PRUNED
1455,1455,0.12687744200229645,2023-01-06 01:24:30.870218,2023-01-06 01:24:37.764251,0 days 00:00:06.894033,sigmoid,0.15000000000000002,2,0.7,0.12687744200229645,,,PRUNED
1456,1456,0.1053970530629158,2023-01-06 01:24:37.860354,2023-01-06 01:24:44.779704,0 days 00:00:06.919350,sigmoid,0.15000000000000002,2,0.5,0.1053970530629158,,,PRUNED
1457,1457,0.039709605276584625,2023-01-06 01:24:44.892807,2023-01-06 01:25:12.177305,0 days 00:00:27.284498,sigmoid,0.15000000000000002,3,0.75,0.05983215570449829,0.05084499344229698,0.039709605276584625,PRUNED
1458,1458,0.08060909807682037,2023-01-06 01:25:12.284144,2023-01-06 01:25:24.293065,0 days 00:00:12.008921,sigmoid,0.1,2,0.5,0.08832444250583649,0.08060909807682037,,PRUNED
1459,1459,0.03822700306773186,2023-01-06 01:25:24.400480,2023-01-06 01:25:51.216342,0 days 00:00:26.815862,relu,0.4,2,0.6,0.05524321645498276,0.03822700306773186,,PRUNED
1460,1460,0.06752926856279373,2023-01-06 01:25:51.316357,2023-01-06 01:26:03.365565,0 days 00:00:12.049208,tanh,0.2,2,0.8500000000000001,0.06752926856279373,,,PRUNED
1461,1461,0.10769104212522507,2023-01-06 01:26:03.476696,2023-01-06 01:26:10.407228,0 days 00:00:06.930532,sigmoid,0.15000000000000002,2,0.65,0.10769104212522507,,,PRUNED
1462,1462,0.04010044410824776,2023-01-06 01:26:10.510496,2023-01-06 01:26:37.086799,0 days 00:00:26.576303,sigmoid,0.0,2,0.55,0.04010044410824776,,,PRUNED
1463,1463,0.04041556641459465,2023-01-06 01:26:37.192532,2023-01-06 01:27:04.118812,0 days 00:00:26.926280,sigmoid,0.0,2,0.75,0.04041556641459465,,,PRUNED
1464,1464,0.1231812834739685,2023-01-06 01:27:04.244155,2023-01-06 01:27:11.152603,0 days 00:00:06.908448,sigmoid,0.15000000000000002,2,0.5,0.1231812834739685,,,PRUNED
1465,1465,0.06546604633331299,2023-01-06 01:27:11.264216,2023-01-06 01:27:22.950706,0 days 00:00:11.686490,relu,0.25,2,0.65,0.06546604633331299,,,PRUNED
1466,1466,0.08250751346349716,2023-01-06 01:27:23.065202,2023-01-06 01:27:35.758072,0 days 00:00:12.692870,relu,0.35000000000000003,2,0.55,0.08250751346349716,,,PRUNED
1467,1467,0.061935752630233765,2023-01-06 01:27:35.920776,2023-01-06 01:27:49.090392,0 days 00:00:13.169616,sigmoid,0.15000000000000002,2,0.6,0.07098501175642014,0.061935752630233765,,PRUNED
1468,1468,0.15732672810554504,2023-01-06 01:27:49.202421,2023-01-06 01:28:16.090148,0 days 00:00:26.887727,sigmoid,0.0,2,0.8,0.037161197513341904,,,COMPLETE
1469,1469,0.0610664077103138,2023-01-06 01:28:16.219218,2023-01-06 01:28:28.338517,0 days 00:00:12.119299,sigmoid,0.1,2,0.5,0.08478479087352753,0.0610664077103138,,PRUNED
1470,1470,0.11006757616996765,2023-01-06 01:28:28.451771,2023-01-06 01:28:35.404549,0 days 00:00:06.952778,sigmoid,0.15000000000000002,2,0.55,0.11006757616996765,,,PRUNED
1471,1471,0.13188427686691284,2023-01-06 01:28:35.525422,2023-01-06 01:29:04.977383,0 days 00:00:29.451961,relu,0.4,2,0.75,0.04316246509552002,0.03292537108063698,,COMPLETE
1472,1472,0.03768831118941307,2023-01-06 01:29:05.091533,2023-01-06 01:29:31.857596,0 days 00:00:26.766063,relu,0.4,2,0.75,0.05416686832904816,0.03768831118941307,,PRUNED
1473,1473,0.06257785111665726,2023-01-06 01:29:31.969135,2023-01-06 01:29:43.990002,0 days 00:00:12.020867,relu,0.45,2,0.75,0.06257785111665726,,,PRUNED
1474,1474,0.03372073918581009,2023-01-06 01:29:44.100225,2023-01-06 01:30:11.136054,0 days 00:00:27.035829,sigmoid,0.15000000000000002,2,0.5,0.0807236060500145,0.0540146566927433,0.03372073918581009,PRUNED
1475,1475,0.14265641570091248,2023-01-06 01:30:11.250481,2023-01-06 01:30:40.589934,0 days 00:00:29.339453,sigmoid,0.05,2,0.75,0.0366230309009552,,,COMPLETE
1476,1476,0.12106823176145554,2023-01-06 01:30:40.705719,2023-01-06 01:30:47.674756,0 days 00:00:06.969037,sigmoid,0.15000000000000002,2,0.5,0.12106823176145554,,,PRUNED
1477,1477,0.13606812059879303,2023-01-06 01:30:47.799241,2023-01-06 01:31:19.919139,0 days 00:00:32.119898,sigmoid,0.1,2,0.5,0.08274351060390472,0.05286738649010658,0.03141630068421364,COMPLETE
1478,1478,0.13854478299617767,2023-01-06 01:31:20.046903,2023-01-06 01:31:46.887617,0 days 00:00:26.840714,relu,0.25,2,0.75,0.043512195348739624,0.03139321506023407,,COMPLETE
1479,1479,0.1449134796857834,2023-01-06 01:31:47.011560,2023-01-06 01:32:18.813667,0 days 00:00:31.802107,sigmoid,0.0,2,0.95,0.03583431616425514,,,COMPLETE
1480,1480,0.13447023928165436,2023-01-06 01:32:18.932529,2023-01-06 01:32:48.811911,0 days 00:00:29.879382,sigmoid,0.1,2,0.5,0.06180349364876747,0.04423864185810089,0.03240535780787468,COMPLETE
1481,1481,0.14074623584747314,2023-01-06 01:32:48.925531,2023-01-06 01:32:55.740218,0 days 00:00:06.814687,sigmoid,0.1,2,0.5,0.14074623584747314,,,PRUNED
1482,1482,0.136723592877388,2023-01-06 01:32:55.838993,2023-01-06 01:33:02.681165,0 days 00:00:06.842172,sigmoid,0.1,2,0.5,0.136723592877388,,,PRUNED
1483,1483,0.0629035234451294,2023-01-06 01:33:02.795807,2023-01-06 01:33:14.872106,0 days 00:00:12.076299,relu,0.2,2,0.7,0.0629035234451294,,,PRUNED
1484,1484,0.08056184649467468,2023-01-06 01:33:14.986529,2023-01-06 01:33:26.803523,0 days 00:00:11.816994,relu,0.5,2,0.75,0.08056184649467468,,,PRUNED
1485,1485,0.12494954466819763,2023-01-06 01:33:26.916723,2023-01-06 01:33:33.820909,0 days 00:00:06.904186,sigmoid,0.1,2,0.5,0.12494954466819763,,,PRUNED
1486,1486,0.1382252424955368,2023-01-06 01:33:33.934090,2023-01-06 01:33:41.020111,0 days 00:00:07.086021,sigmoid,0.1,2,0.5,0.1382252424955368,,,PRUNED
1487,1487,0.1064273938536644,2023-01-06 01:33:41.116886,2023-01-06 01:33:47.811262,0 days 00:00:06.694376,sigmoid,0.1,2,0.5,0.1064273938536644,,,PRUNED
1488,1488,0.04186160862445831,2023-01-06 01:33:47.925697,2023-01-06 01:34:14.574904,0 days 00:00:26.649207,sigmoid,0.0,2,0.7,0.04186160862445831,,,PRUNED
1489,1489,0.06887385994195938,2023-01-06 01:34:14.691536,2023-01-06 01:34:26.691043,0 days 00:00:11.999507,relu,0.15000000000000002,2,0.75,0.06887385994195938,,,PRUNED
1490,1490,0.07795935869216919,2023-01-06 01:34:26.806076,2023-01-06 01:34:38.714731,0 days 00:00:11.908655,relu,0.35000000000000003,2,0.75,0.07795935869216919,,,PRUNED
1491,1491,0.07434318214654922,2023-01-06 01:34:38.838499,2023-01-06 01:34:50.672165,0 days 00:00:11.833666,relu,0.4,2,0.8,0.07434318214654922,,,PRUNED
1492,1492,0.04563383013010025,2023-01-06 01:34:50.789601,2023-01-06 01:35:17.703495,0 days 00:00:26.913894,sigmoid,0.1,2,0.8500000000000001,0.04563383013010025,,,PRUNED
1493,1493,0.045687638223171234,2023-01-06 01:35:17.818868,2023-01-06 01:35:44.718062,0 days 00:00:26.899194,sigmoid,0.30000000000000004,2,0.9,0.045687638223171234,,,PRUNED
1494,1494,0.07738067954778671,2023-01-06 01:35:44.843821,2023-01-06 01:35:56.709369,0 days 00:00:11.865548,tanh,0.4,2,0.75,0.07738067954778671,,,PRUNED
1495,1495,0.07494574040174484,2023-01-06 01:35:56.823379,2023-01-06 01:36:08.792346,0 days 00:00:11.968967,sigmoid,0.1,3,0.5,0.08194673806428909,0.07494574040174484,,PRUNED
1496,1496,0.05799512937664986,2023-01-06 01:36:08.913990,2023-01-06 01:36:21.181952,0 days 00:00:12.267962,sigmoid,0.1,2,0.5,0.09031814336776733,0.05799512937664986,,PRUNED
1497,1497,0.06735297292470932,2023-01-06 01:36:21.299384,2023-01-06 01:36:32.997717,0 days 00:00:11.698333,relu,0.4,2,0.65,0.06735297292470932,,,PRUNED
1498,1498,0.07944580167531967,2023-01-06 01:36:33.114151,2023-01-06 01:36:44.855775,0 days 00:00:11.741624,sigmoid,0.25,2,0.7,0.07944580167531967,,,PRUNED
1499,1499,0.04009919613599777,2023-01-06 01:36:44.970582,2023-01-06 01:37:11.994755,0 days 00:00:27.024173,relu,0.30000000000000004,2,0.6,0.05306696519255638,0.04009919613599777,,PRUNED
1500,1500,0.0604124553501606,2023-01-06 01:37:12.111951,2023-01-06 01:37:24.119834,0 days 00:00:12.007883,sigmoid,0.1,2,0.5,0.07456732541322708,0.0604124553501606,,PRUNED
1501,1501,0.04640526324510574,2023-01-06 01:37:24.241599,2023-01-06 01:37:51.316775,0 days 00:00:27.075176,tanh,0.0,3,0.8500000000000001,0.04640526324510574,,,PRUNED
1502,1502,0.04047691076993942,2023-01-06 01:37:51.440841,2023-01-06 01:38:18.381380,0 days 00:00:26.940539,sigmoid,0.0,2,0.8500000000000001,0.04047691076993942,,,PRUNED
1503,1503,0.06910643726587296,2023-01-06 01:38:18.495823,2023-01-06 01:38:30.288816,0 days 00:00:11.792993,relu,0.2,2,0.6,0.06910643726587296,,,PRUNED
1504,1504,0.07244060933589935,2023-01-06 01:38:30.404254,2023-01-06 01:38:42.346100,0 days 00:00:11.941846,relu,0.35000000000000003,3,0.7,0.07244060933589935,,,PRUNED
1505,1505,0.03955211117863655,2023-01-06 01:38:42.461669,2023-01-06 01:39:09.269188,0 days 00:00:26.807519,relu,0.4,2,0.7,0.06202757731080055,0.03955211117863655,,PRUNED
1506,1506,0.10126722604036331,2023-01-06 01:39:09.386507,2023-01-06 01:39:21.535517,0 days 00:00:12.149010,relu,0.1,2,0.65,0.10126722604036331,,,PRUNED
1507,1507,0.10237139463424683,2023-01-06 01:39:21.662688,2023-01-06 01:39:28.610212,0 days 00:00:06.947524,sigmoid,0.1,2,0.5,0.10237139463424683,,,PRUNED
1508,1508,0.3602023422718048,2023-01-06 01:39:28.734147,2023-01-06 01:39:36.126479,0 days 00:00:07.392332,sigmoid,0.1,8,0.5,0.3602023422718048,,,PRUNED
1509,1509,0.0827547162771225,2023-01-06 01:39:36.238908,2023-01-06 01:39:48.033112,0 days 00:00:11.794204,relu,0.4,2,0.75,0.0827547162771225,,,PRUNED
1510,1510,0.04369112104177475,2023-01-06 01:39:48.149698,2023-01-06 01:40:14.856220,0 days 00:00:26.706522,relu,0.45,2,0.65,0.05535534396767616,0.04369112104177475,,PRUNED
1511,1511,0.12603560090065002,2023-01-06 01:40:14.970309,2023-01-06 01:40:21.573029,0 days 00:00:06.602720,sigmoid,0.0,2,0.5,0.12603560090065002,,,PRUNED
1512,1512,0.12573350965976715,2023-01-06 01:40:21.688456,2023-01-06 01:40:28.805815,0 days 00:00:07.117359,sigmoid,0.25,2,0.5,0.12573350965976715,,,PRUNED
1513,1513,0.041194990277290344,2023-01-06 01:40:28.936919,2023-01-06 01:40:55.977745,0 days 00:00:27.040826,sigmoid,0.30000000000000004,2,0.5,0.08210621774196625,0.05338902398943901,0.041194990277290344,PRUNED
1514,1514,0.1071668267250061,2023-01-06 01:40:56.101507,2023-01-06 01:41:02.719892,0 days 00:00:06.618385,sigmoid,0.1,2,0.5,0.1071668267250061,,,PRUNED
1515,1515,0.13908161222934723,2023-01-06 01:41:02.824999,2023-01-06 01:41:09.644379,0 days 00:00:06.819380,tanh,0.1,2,0.5,0.13908161222934723,,,PRUNED
1516,1516,0.09991265088319778,2023-01-06 01:41:09.752471,2023-01-06 01:41:16.435525,0 days 00:00:06.683054,sigmoid,0.15000000000000002,2,0.5,0.09991265088319778,,,PRUNED
1517,1517,0.06816822290420532,2023-01-06 01:41:16.548958,2023-01-06 01:41:28.267622,0 days 00:00:11.718664,tanh,0.05,2,0.5,0.09032934904098511,0.06816822290420532,,PRUNED
1518,1518,0.04252409189939499,2023-01-06 01:41:28.382397,2023-01-06 01:41:54.791006,0 days 00:00:26.408609,sigmoid,0.0,2,0.75,0.04252409189939499,,,PRUNED
1519,1519,0.03557407483458519,2023-01-06 01:41:54.898049,2023-01-06 01:42:21.962881,0 days 00:00:27.064832,relu,0.25,2,0.8,0.05734334886074066,0.03557407483458519,,PRUNED
1520,1520,0.06917797029018402,2023-01-06 01:42:22.076334,2023-01-06 01:42:33.811981,0 days 00:00:11.735647,relu,0.2,2,0.6,0.06917797029018402,,,PRUNED
1521,1521,0.06292931735515594,2023-01-06 01:42:33.928413,2023-01-06 01:42:45.711067,0 days 00:00:11.782654,relu,0.4,3,0.55,0.06292931735515594,,,PRUNED
1522,1522,0.11484131217002869,2023-01-06 01:42:45.819171,2023-01-06 01:42:52.778197,0 days 00:00:06.959026,sigmoid,0.1,2,0.5,0.11484131217002869,,,PRUNED
1523,1523,0.07242673635482788,2023-01-06 01:42:52.849449,2023-01-06 01:43:04.476317,0 days 00:00:11.626868,relu,0.15000000000000002,2,0.9,0.07242673635482788,,,PRUNED
1524,1524,0.13121676445007324,2023-01-06 01:43:04.585015,2023-01-06 01:43:11.401792,0 days 00:00:06.816777,sigmoid,0.15000000000000002,2,0.5,0.13121676445007324,,,PRUNED
1525,1525,0.10970373451709747,2023-01-06 01:43:11.500902,2023-01-06 01:43:18.468000,0 days 00:00:06.967098,tanh,0.25,2,0.5,0.10970373451709747,,,PRUNED
1526,1526,0.10337751358747482,2023-01-06 01:43:18.550026,2023-01-06 01:43:25.409060,0 days 00:00:06.859034,sigmoid,0.30000000000000004,2,0.8,0.10337751358747482,,,PRUNED
1527,1527,0.05603516846895218,2023-01-06 01:43:25.508833,2023-01-06 01:43:37.517674,0 days 00:00:12.008841,sigmoid,0.15000000000000002,2,0.5,0.09081114828586578,0.05603516846895218,,PRUNED
1528,1528,0.036893732845783234,2023-01-06 01:43:37.622575,2023-01-06 01:44:04.329477,0 days 00:00:26.706902,tanh,0.4,2,0.7,0.05762016028165817,0.036893732845783234,,PRUNED
1529,1529,0.13005676865577698,2023-01-06 01:44:04.444531,2023-01-06 01:44:33.965986,0 days 00:00:29.521455,sigmoid,0.05,2,0.8500000000000001,0.03253082185983658,,,COMPLETE
1530,1530,0.12898841500282288,2023-01-06 01:44:34.072999,2023-01-06 01:44:40.803332,0 days 00:00:06.730333,tanh,0.15000000000000002,2,0.55,0.12898841500282288,,,PRUNED
1531,1531,0.05905381590127945,2023-01-06 01:44:40.902072,2023-01-06 01:44:52.634767,0 days 00:00:11.732695,sigmoid,0.1,2,0.5,0.08769930899143219,0.05905381590127945,,PRUNED
1532,1532,0.1324058175086975,2023-01-06 01:44:52.741869,2023-01-06 01:45:34.446879,0 days 00:00:41.705010,tanh,0.05,2,0.9,0.03627627342939377,,,COMPLETE
1533,1533,0.10786933451890945,2023-01-06 01:45:34.565087,2023-01-06 01:45:41.272972,0 days 00:00:06.707885,sigmoid,0.15000000000000002,2,0.75,0.10786933451890945,,,PRUNED
1534,1534,0.13009169697761536,2023-01-06 01:45:41.377835,2023-01-06 01:45:48.131547,0 days 00:00:06.753712,tanh,0.05,2,0.5,0.13009169697761536,,,PRUNED
1535,1535,0.06620180606842041,2023-01-06 01:45:48.237268,2023-01-06 01:46:00.121785,0 days 00:00:11.884517,relu,0.45,2,0.65,0.06620180606842041,,,PRUNED
1536,1536,0.1259310096502304,2023-01-06 01:46:00.227407,2023-01-06 01:46:07.121770,0 days 00:00:06.894363,sigmoid,0.25,2,0.5,0.1259310096502304,,,PRUNED
1537,1537,0.12935836613178253,2023-01-06 01:46:07.203397,2023-01-06 01:46:13.887923,0 days 00:00:06.684526,sigmoid,0.35000000000000003,2,0.9,0.12935836613178253,,,PRUNED
1538,1538,0.11925861984491348,2023-01-06 01:46:13.993901,2023-01-06 01:46:20.704070,0 days 00:00:06.710169,tanh,0.15000000000000002,2,0.5,0.11925861984491348,,,PRUNED
1539,1539,0.13665767014026642,2023-01-06 01:46:20.791981,2023-01-06 01:46:50.206459,0 days 00:00:29.414478,tanh,0.05,2,0.9,0.035079821944236755,,,COMPLETE
1540,1540,0.05763213708996773,2023-01-06 01:46:50.326274,2023-01-06 01:47:02.261040,0 days 00:00:11.934766,sigmoid,0.15000000000000002,2,0.5,0.08614826947450638,0.05763213708996773,,PRUNED
1541,1541,0.07777824997901917,2023-01-06 01:47:02.366346,2023-01-06 01:47:14.126283,0 days 00:00:11.759937,relu,0.35000000000000003,2,0.7,0.07777824997901917,,,PRUNED
1542,1542,0.038140684366226196,2023-01-06 01:47:14.232114,2023-01-06 01:47:40.949256,0 days 00:00:26.717142,tanh,0.05,2,0.9,0.038140684366226196,,,PRUNED
1543,1543,0.13992366194725037,2023-01-06 01:47:41.054077,2023-01-06 01:48:12.658915,0 days 00:00:31.604838,tanh,0.05,2,0.9,0.03248519450426102,,,COMPLETE
1544,1544,0.12750011682510376,2023-01-06 01:48:12.778347,2023-01-06 01:48:19.571946,0 days 00:00:06.793599,sigmoid,0.15000000000000002,2,0.55,0.12750011682510376,,,PRUNED
1545,1545,0.03542964905500412,2023-01-06 01:48:19.692806,2023-01-06 01:48:46.569997,0 days 00:00:26.877191,tanh,0.15000000000000002,2,0.7,0.06923064589500427,0.05320192128419876,0.03542964905500412,PRUNED
1546,1546,0.13289447128772736,2023-01-06 01:48:46.675096,2023-01-06 01:49:23.526585,0 days 00:00:36.851489,relu,0.4,2,0.75,0.04465867951512337,0.03473067283630371,,COMPLETE
1547,1547,0.1108473688364029,2023-01-06 01:49:23.647958,2023-01-06 01:49:30.408598,0 days 00:00:06.760640,sigmoid,0.1,2,0.75,0.1108473688364029,,,PRUNED
1548,1548,0.09846087545156479,2023-01-06 01:49:30.521759,2023-01-06 01:49:37.241410,0 days 00:00:06.719651,sigmoid,0.15000000000000002,2,0.5,0.09846087545156479,,,PRUNED
1549,1549,0.150215283036232,2023-01-06 01:49:37.353566,2023-01-06 01:50:04.341118,0 days 00:00:26.987552,tanh,0.05,2,0.9,0.03461829572916031,,,COMPLETE
1550,1550,0.14335143566131592,2023-01-06 01:50:04.454294,2023-01-06 01:50:33.383558,0 days 00:00:28.929264,tanh,0.05,2,0.95,0.035679224878549576,,,COMPLETE
1551,1551,0.13440027832984924,2023-01-06 01:50:33.502985,2023-01-06 01:51:05.254133,0 days 00:00:31.751148,relu,0.30000000000000004,2,0.75,0.049413569271564484,0.03304636478424072,,COMPLETE
1552,1552,0.06094437092542648,2023-01-06 01:51:05.373573,2023-01-06 01:51:32.523315,0 days 00:00:27.149742,tanh,0.05,4,0.9,0.06094437092542648,,,PRUNED
1553,1553,0.142219677567482,2023-01-06 01:51:32.637472,2023-01-06 01:51:39.357130,0 days 00:00:06.719658,tanh,0.05,2,0.5,0.142219677567482,,,PRUNED
1554,1554,0.10570622980594635,2023-01-06 01:51:39.444296,2023-01-06 01:51:46.256607,0 days 00:00:06.812311,sigmoid,0.0,2,0.5,0.10570622980594635,,,PRUNED
1555,1555,0.12613405287265778,2023-01-06 01:51:46.344368,2023-01-06 01:51:53.389395,0 days 00:00:07.045027,sigmoid,0.30000000000000004,2,0.5,0.12613405287265778,,,PRUNED
1556,1556,0.1397884041070938,2023-01-06 01:51:53.502561,2023-01-06 01:52:00.497193,0 days 00:00:06.994632,tanh,0.15000000000000002,3,0.55,0.1397884041070938,,,PRUNED
1557,1557,0.146627277135849,2023-01-06 01:52:00.602022,2023-01-06 01:52:12.695262,0 days 00:00:12.093240,relu,0.25,4,0.75,0.146627277135849,,,PRUNED
1558,1558,0.13010942935943604,2023-01-06 01:52:12.809425,2023-01-06 01:52:19.878970,0 days 00:00:07.069545,sigmoid,0.25,2,0.5,0.13010942935943604,,,PRUNED
1559,1559,0.04281970113515854,2023-01-06 01:52:19.983134,2023-01-06 01:52:46.467694,0 days 00:00:26.484560,relu,0.1,2,0.8500000000000001,0.04281970113515854,,,PRUNED
1560,1560,0.13006456196308136,2023-01-06 01:52:46.573375,2023-01-06 01:52:53.409843,0 days 00:00:06.836468,sigmoid,0.05,2,0.5,0.13006456196308136,,,PRUNED
1561,1561,0.1261509209871292,2023-01-06 01:52:53.514663,2023-01-06 01:53:00.359584,0 days 00:00:06.844921,tanh,0.1,2,0.5,0.1261509209871292,,,PRUNED
1562,1562,0.03708971291780472,2023-01-06 01:53:00.496436,2023-01-06 01:53:27.406669,0 days 00:00:26.910233,relu,0.2,2,0.8,0.0574239157140255,0.03708971291780472,,PRUNED
1563,1563,0.05907988175749779,2023-01-06 01:53:27.509080,2023-01-06 01:53:39.522992,0 days 00:00:12.013912,sigmoid,0.15000000000000002,2,0.5,0.08975555002689362,0.05907988175749779,,PRUNED
1564,1564,0.03454134613275528,2023-01-06 01:53:39.627827,2023-01-06 01:54:06.419953,0 days 00:00:26.792126,sigmoid,0.15000000000000002,2,0.5,0.06517649441957474,0.04743242636322975,0.03454134613275528,PRUNED
1565,1565,0.22632461786270142,2023-01-06 01:54:06.526061,2023-01-06 01:54:28.940331,0 days 00:00:22.414270,tanh,0.05,5,1.0,,,,COMPLETE
