,number,value,datetime_start,datetime_complete,duration,params_activation,params_dropout,params_layers,params_shrink,system_attrs_completed_rung_0,system_attrs_completed_rung_1,system_attrs_completed_rung_2,state
2476,2476,0.0701725035905838,2023-01-06 05:52:46.918256,2023-01-06 05:52:59.050048,0 days 00:00:12.131792,relu,0.30000000000000004,2,0.7,0.0701725035905838,,,PRUNED
2477,2477,0.0663653016090393,2023-01-06 05:52:59.168312,2023-01-06 05:53:11.074121,0 days 00:00:11.905809,relu,0.35000000000000003,2,0.7,0.0663653016090393,,,PRUNED
2478,2478,0.05901053175330162,2023-01-06 05:53:11.190382,2023-01-06 05:53:23.223253,0 days 00:00:12.032871,tanh,0.05,2,0.65,0.08304537087678909,0.05901053175330162,,PRUNED
2479,2479,0.03988618031144142,2023-01-06 05:53:23.350799,2023-01-06 05:53:50.403427,0 days 00:00:27.052628,sigmoid,0.05,2,0.9,0.03988618031144142,,,PRUNED
2480,2480,0.06612388044595718,2023-01-06 05:53:50.526020,2023-01-06 05:54:02.453496,0 days 00:00:11.927476,relu,0.35000000000000003,2,0.7,0.06612388044595718,,,PRUNED
2481,2481,0.1356525868177414,2023-01-06 05:54:02.571763,2023-01-06 05:54:09.495624,0 days 00:00:06.923861,tanh,0.05,2,0.65,0.1356525868177414,,,PRUNED
2482,2482,0.06235054135322571,2023-01-06 05:54:09.601554,2023-01-06 05:54:21.835350,0 days 00:00:12.233796,relu,0.30000000000000004,3,0.7,0.06235054135322571,,,PRUNED
2483,2483,0.06749066710472107,2023-01-06 05:54:21.962734,2023-01-06 05:54:33.867749,0 days 00:00:11.905015,relu,0.35000000000000003,2,0.8500000000000001,0.06749066710472107,,,PRUNED
2484,2484,0.13702227175235748,2023-01-06 05:54:33.986011,2023-01-06 05:55:03.591279,0 days 00:00:29.605268,tanh,0.05,2,0.65,0.059416722506284714,0.04090414568781853,0.032554011791944504,COMPLETE
2485,2485,0.12231066823005676,2023-01-06 05:55:03.717730,2023-01-06 05:55:10.924225,0 days 00:00:07.206495,tanh,0.05,2,0.65,0.12231066823005676,,,PRUNED
2486,2486,0.04368533566594124,2023-01-06 05:55:11.049823,2023-01-06 05:55:37.811816,0 days 00:00:26.761993,tanh,0.30000000000000004,2,0.95,0.04368533566594124,,,PRUNED
2487,2487,0.1399397850036621,2023-01-06 05:55:37.948444,2023-01-06 05:56:10.038215,0 days 00:00:32.089771,relu,0.15000000000000002,2,0.8500000000000001,0.05687744542956352,0.03410929813981056,,COMPLETE
2488,2488,0.03788581117987633,2023-01-06 05:56:10.172961,2023-01-06 05:56:36.815935,0 days 00:00:26.642974,sigmoid,0.0,2,0.8,0.03788581117987633,,,PRUNED
2489,2489,0.08193720877170563,2023-01-06 05:56:36.942207,2023-01-06 05:56:48.723547,0 days 00:00:11.781340,relu,0.35000000000000003,2,0.9,0.08193720877170563,,,PRUNED
2490,2490,0.08093339949846268,2023-01-06 05:56:48.846891,2023-01-06 05:57:01.040250,0 days 00:00:12.193359,tanh,0.0,2,0.65,0.07374445348978043,0.08093339949846268,,PRUNED
2491,2491,0.11075285822153091,2023-01-06 05:57:01.179004,2023-01-06 05:57:08.156868,0 days 00:00:06.977864,tanh,0.0,2,0.65,0.11075285822153091,,,PRUNED
2492,2492,0.05950191244482994,2023-01-06 05:57:08.282463,2023-01-06 05:57:20.413255,0 days 00:00:12.130792,tanh,0.05,2,0.65,0.08270663768053055,0.05950191244482994,,PRUNED
2493,2493,0.07319577038288116,2023-01-06 05:57:20.530522,2023-01-06 05:57:32.712306,0 days 00:00:12.181784,sigmoid,0.5,2,0.7,0.07319577038288116,,,PRUNED
2494,2494,0.10703498125076294,2023-01-06 05:57:32.839907,2023-01-06 05:57:39.871089,0 days 00:00:07.031182,tanh,0.0,2,0.7,0.10703498125076294,,,PRUNED
2495,2495,0.041301172226667404,2023-01-06 05:57:39.987680,2023-01-06 05:58:07.100404,0 days 00:00:27.112724,relu,0.2,2,0.8500000000000001,0.05416577309370041,0.041301172226667404,,PRUNED
2496,2496,0.0624617263674736,2023-01-06 05:58:07.219134,2023-01-06 05:58:19.242058,0 days 00:00:12.022924,tanh,0.0,2,0.65,0.0722641870379448,0.0624617263674736,,PRUNED
2497,2497,0.062091339379549026,2023-01-06 05:58:19.357318,2023-01-06 05:58:31.324460,0 days 00:00:11.967142,relu,0.25,2,0.5,0.062091339379549026,,,PRUNED
2498,2498,0.04220116510987282,2023-01-06 05:58:31.452057,2023-01-06 05:58:58.446365,0 days 00:00:26.994308,tanh,0.0,2,0.95,0.04220116510987282,,,PRUNED
2499,2499,0.05492956191301346,2023-01-06 05:58:58.563655,2023-01-06 05:59:10.638628,0 days 00:00:12.074973,tanh,0.05,2,0.65,0.0807873085141182,0.05492956191301346,,PRUNED
2500,2500,0.1456734538078308,2023-01-06 05:59:10.761694,2023-01-06 05:59:37.922132,0 days 00:00:27.160438,relu,0.2,2,0.7,0.061087481677532196,0.03096473589539528,,COMPLETE
2501,2501,0.09928722679615021,2023-01-06 05:59:38.053935,2023-01-06 05:59:44.886460,0 days 00:00:06.832525,tanh,0.0,2,0.7,0.09928722679615021,,,PRUNED
2502,2502,0.09925853461027145,2023-01-06 05:59:45.001516,2023-01-06 05:59:51.952583,0 days 00:00:06.951067,tanh,0.35000000000000003,2,0.65,0.09925853461027145,,,PRUNED
2503,2503,0.12350775301456451,2023-01-06 05:59:52.068251,2023-01-06 06:00:26.514412,0 days 00:00:34.446161,sigmoid,0.15000000000000002,2,0.95,0.03022925928235054,,,COMPLETE
2504,2504,0.07458792626857758,2023-01-06 06:00:26.627592,2023-01-06 06:00:38.414207,0 days 00:00:11.786615,relu,0.35000000000000003,2,0.8500000000000001,0.07458792626857758,,,PRUNED
2505,2505,0.05676340311765671,2023-01-06 06:00:38.538270,2023-01-06 06:00:50.547073,0 days 00:00:12.008803,tanh,0.05,2,0.65,0.09377508610486984,0.05676340311765671,,PRUNED
2506,2506,0.11938412487506866,2023-01-06 06:00:50.672751,2023-01-06 06:00:57.837242,0 days 00:00:07.164491,tanh,0.0,2,0.65,0.11938412487506866,,,PRUNED
2507,2507,0.04141789302229881,2023-01-06 06:00:57.952438,2023-01-06 06:01:24.674266,0 days 00:00:26.721828,sigmoid,0.15000000000000002,2,0.9,0.04141789302229881,,,PRUNED
2508,2508,0.08880257606506348,2023-01-06 06:01:24.795042,2023-01-06 06:01:36.975656,0 days 00:00:12.180614,relu,0.25,2,0.7,0.08880257606506348,,,PRUNED
2509,2509,0.12236426770687103,2023-01-06 06:01:37.101428,2023-01-06 06:01:44.159441,0 days 00:00:07.058013,tanh,0.0,2,0.65,0.12236426770687103,,,PRUNED
2510,2510,0.06357180327177048,2023-01-06 06:01:44.274884,2023-01-06 06:01:56.274171,0 days 00:00:11.999287,tanh,0.05,2,0.65,0.07405822724103928,0.06357180327177048,,PRUNED
2511,2511,0.13303790986537933,2023-01-06 06:01:56.390612,2023-01-06 06:02:03.532948,0 days 00:00:07.142336,tanh,0.0,2,0.65,0.13303790986537933,,,PRUNED
2512,2512,0.13505883514881134,2023-01-06 06:02:03.639165,2023-01-06 06:02:10.640727,0 days 00:00:07.001562,tanh,0.05,2,0.65,0.13505883514881134,,,PRUNED
2513,2513,0.0868401899933815,2023-01-06 06:02:10.766485,2023-01-06 06:02:22.638799,0 days 00:00:11.872314,relu,0.2,3,0.8500000000000001,0.0868401899933815,,,PRUNED
2514,2514,0.0690004751086235,2023-01-06 06:02:22.739579,2023-01-06 06:02:34.963092,0 days 00:00:12.223513,relu,0.35000000000000003,2,0.6,0.0690004751086235,,,PRUNED
2515,2515,0.14605076611042023,2023-01-06 06:02:35.088574,2023-01-06 06:03:02.345877,0 days 00:00:27.257303,relu,0.2,2,0.7,0.050358276814222336,0.03159729391336441,,COMPLETE
2516,2516,0.07933522015810013,2023-01-06 06:03:02.490901,2023-01-06 06:03:14.384747,0 days 00:00:11.893846,relu,0.25,2,0.55,0.07933522015810013,,,PRUNED
2517,2517,0.040702514350414276,2023-01-06 06:03:14.496922,2023-01-06 06:03:41.313603,0 days 00:00:26.816681,tanh,0.15000000000000002,2,0.95,0.040702514350414276,,,PRUNED
2518,2518,0.039719682186841965,2023-01-06 06:03:41.423509,2023-01-06 06:04:08.069028,0 days 00:00:26.645519,sigmoid,0.2,2,0.75,0.039719682186841965,,,PRUNED
2519,2519,0.122362419962883,2023-01-06 06:04:08.180369,2023-01-06 06:04:15.462115,0 days 00:00:07.281746,tanh,0.0,2,0.65,0.122362419962883,,,PRUNED
2520,2520,0.03741014748811722,2023-01-06 06:04:15.572362,2023-01-06 06:04:42.541363,0 days 00:00:26.969001,relu,0.15000000000000002,2,0.6,0.051525749266147614,0.03741014748811722,,PRUNED
2521,2521,0.14537444710731506,2023-01-06 06:04:42.663102,2023-01-06 06:05:14.349076,0 days 00:00:31.685974,tanh,0.15000000000000002,2,0.95,0.03493790701031685,,,COMPLETE
2522,2522,0.06120220199227333,2023-01-06 06:05:14.469701,2023-01-06 06:05:26.680553,0 days 00:00:12.210852,tanh,0.05,2,0.7,0.07780829071998596,0.06120220199227333,,PRUNED
2523,2523,0.07867512851953506,2023-01-06 06:05:26.811674,2023-01-06 06:05:38.804698,0 days 00:00:11.993024,tanh,0.30000000000000004,2,0.7,0.0919521227478981,0.07867512851953506,,PRUNED
2524,2524,0.13658125698566437,2023-01-06 06:05:38.934810,2023-01-06 06:06:08.394913,0 days 00:00:29.460103,relu,0.25,2,0.8,0.05272269994020462,0.03387101739645004,,COMPLETE
2525,2525,0.12779992818832397,2023-01-06 06:06:08.528961,2023-01-06 06:06:15.669058,0 days 00:00:07.140097,tanh,0.25,2,0.65,0.12779992818832397,,,PRUNED
2526,2526,0.12358269840478897,2023-01-06 06:06:15.794405,2023-01-06 06:06:22.701317,0 days 00:00:06.906912,tanh,0.0,2,0.65,0.12358269840478897,,,PRUNED
2527,2527,0.05749114975333214,2023-01-06 06:06:22.810529,2023-01-06 06:06:35.117442,0 days 00:00:12.306913,tanh,0.30000000000000004,2,0.6,0.09213939309120178,0.05749114975333214,,PRUNED
2528,2528,0.08249393105506897,2023-01-06 06:06:35.239811,2023-01-06 06:06:47.141985,0 days 00:00:11.902174,relu,0.30000000000000004,2,0.8500000000000001,0.08249393105506897,,,PRUNED
2529,2529,0.03878452628850937,2023-01-06 06:06:47.258637,2023-01-06 06:07:14.056878,0 days 00:00:26.798241,relu,0.2,2,0.7,0.06103800609707832,0.03878452628850937,,PRUNED
2530,2530,0.11653744429349899,2023-01-06 06:07:14.173245,2023-01-06 06:07:21.322985,0 days 00:00:07.149740,sigmoid,0.25,2,0.55,0.11653744429349899,,,PRUNED
2531,2531,0.03593122959136963,2023-01-06 06:07:21.455011,2023-01-06 06:07:48.737546,0 days 00:00:27.282535,sigmoid,0.0,3,0.55,0.0656876266002655,0.045173559337854385,0.03593122959136963,PRUNED
2532,2532,0.1354181468486786,2023-01-06 06:07:48.863589,2023-01-06 06:08:20.720341,0 days 00:00:31.856752,sigmoid,0.15000000000000002,2,0.9,0.03464860841631889,,,COMPLETE
2533,2533,0.03698093816637993,2023-01-06 06:08:20.846786,2023-01-06 06:08:47.717764,0 days 00:00:26.870978,sigmoid,0.30000000000000004,2,0.65,0.09272249788045883,0.05401252210140228,0.03698093816637993,PRUNED
2534,2534,0.13846789300441742,2023-01-06 06:08:47.899361,2023-01-06 06:09:14.715271,0 days 00:00:26.815910,tanh,0.2,2,1.0,0.03551987558603287,,,COMPLETE
2535,2535,0.05695882439613342,2023-01-06 06:09:15.027112,2023-01-06 06:09:26.954988,0 days 00:00:11.927876,tanh,0.0,2,0.55,0.09166082739830017,0.05695882439613342,,PRUNED
2536,2536,0.03679732605814934,2023-01-06 06:09:27.089007,2023-01-06 06:09:54.052850,0 days 00:00:26.963843,sigmoid,0.05,2,0.65,0.08510416001081467,0.05437353998422623,0.03679732605814934,PRUNED
2537,2537,0.06899106502532959,2023-01-06 06:09:54.185922,2023-01-06 06:10:06.184469,0 days 00:00:11.998547,relu,0.45,2,0.8500000000000001,0.06899106502532959,,,PRUNED
2538,2538,0.12444932013750076,2023-01-06 06:10:06.324653,2023-01-06 06:10:13.302663,0 days 00:00:06.978010,sigmoid,0.25,2,0.6,0.12444932013750076,,,PRUNED
2539,2539,0.06281334161758423,2023-01-06 06:10:13.414396,2023-01-06 06:10:25.275500,0 days 00:00:11.861104,relu,0.35000000000000003,2,0.9,0.06281334161758423,,,PRUNED
2540,2540,0.11801465600728989,2023-01-06 06:10:25.409537,2023-01-06 06:10:32.524944,0 days 00:00:07.115407,sigmoid,0.0,2,0.7,0.11801465600728989,,,PRUNED
2541,2541,0.19286702573299408,2023-01-06 06:10:32.640538,2023-01-06 06:10:40.050606,0 days 00:00:07.410068,tanh,0.30000000000000004,6,0.55,0.19286702573299408,,,PRUNED
2542,2542,0.11805824935436249,2023-01-06 06:10:40.156557,2023-01-06 06:10:47.216671,0 days 00:00:07.060114,sigmoid,0.25,2,0.5,0.11805824935436249,,,PRUNED
2543,2543,0.11672528088092804,2023-01-06 06:10:47.339615,2023-01-06 06:10:54.241057,0 days 00:00:06.901442,sigmoid,0.05,2,0.5,0.11672528088092804,,,PRUNED
2544,2544,0.0998910516500473,2023-01-06 06:10:54.354287,2023-01-06 06:11:01.315087,0 days 00:00:06.960800,tanh,0.25,2,0.55,0.0998910516500473,,,PRUNED
2545,2545,0.1144818365573883,2023-01-06 06:11:01.428744,2023-01-06 06:11:08.515082,0 days 00:00:07.086338,sigmoid,0.35000000000000003,2,0.65,0.1144818365573883,,,PRUNED
2546,2546,0.055400338023900986,2023-01-06 06:11:08.632191,2023-01-06 06:11:20.638143,0 days 00:00:12.005952,sigmoid,0.0,2,0.5,0.08541020005941391,0.055400338023900986,,PRUNED
2547,2547,0.571264386177063,2023-01-06 06:11:20.745926,2023-01-06 06:11:28.413305,0 days 00:00:07.667379,sigmoid,0.4,8,0.5,0.571264386177063,,,PRUNED
2548,2548,0.12752996385097504,2023-01-06 06:11:28.529661,2023-01-06 06:11:35.345098,0 days 00:00:06.815437,tanh,0.30000000000000004,2,0.5,0.12752996385097504,,,PRUNED
2549,2549,0.05919615551829338,2023-01-06 06:11:35.452311,2023-01-06 06:11:47.444409,0 days 00:00:11.992098,sigmoid,0.0,2,0.55,0.0941849797964096,0.05919615551829338,,PRUNED
2550,2550,0.07687883824110031,2023-01-06 06:11:47.558523,2023-01-06 06:11:59.601571,0 days 00:00:12.043048,relu,0.2,2,0.7,0.07687883824110031,,,PRUNED
2551,2551,0.0783877819776535,2023-01-06 06:11:59.718928,2023-01-06 06:12:11.683970,0 days 00:00:11.965042,sigmoid,0.05,2,0.5,0.09545248001813889,0.0783877819776535,,PRUNED
2552,2552,0.04405982419848442,2023-01-06 06:12:11.814863,2023-01-06 06:12:38.765212,0 days 00:00:26.950349,relu,0.2,2,0.6,0.05774155631661415,0.04405982419848442,,PRUNED
2553,2553,0.062010250985622406,2023-01-06 06:12:38.890907,2023-01-06 06:12:50.755827,0 days 00:00:11.864920,relu,0.35000000000000003,2,0.8500000000000001,0.062010250985622406,,,PRUNED
2554,2554,0.05783103033900261,2023-01-06 06:12:50.880649,2023-01-06 06:13:02.905029,0 days 00:00:12.024380,tanh,0.30000000000000004,2,0.6,0.09114258736371994,0.05783103033900261,,PRUNED
2555,2555,0.07781629264354706,2023-01-06 06:13:03.029416,2023-01-06 06:13:15.054331,0 days 00:00:12.024915,sigmoid,0.25,2,0.8,0.07781629264354706,,,PRUNED
2556,2556,0.13728907704353333,2023-01-06 06:13:15.169436,2023-01-06 06:13:22.120213,0 days 00:00:06.950777,sigmoid,0.05,2,0.5,0.13728907704353333,,,PRUNED
2557,2557,0.03878810256719589,2023-01-06 06:13:22.227796,2023-01-06 06:13:49.392962,0 days 00:00:27.165166,sigmoid,0.25,2,0.5,0.08726616948843002,0.05392152816057205,0.03878810256719589,PRUNED
2558,2558,0.07823988050222397,2023-01-06 06:13:49.507156,2023-01-06 06:14:01.375767,0 days 00:00:11.868611,relu,0.2,2,0.8500000000000001,0.07823988050222397,,,PRUNED
2559,2559,0.07602591812610626,2023-01-06 06:14:01.501211,2023-01-06 06:14:13.299828,0 days 00:00:11.798617,relu,0.25,2,0.7,0.07602591812610626,,,PRUNED
2560,2560,0.041759736835956573,2023-01-06 06:14:13.457625,2023-01-06 06:14:40.413992,0 days 00:00:26.956367,sigmoid,0.1,2,0.9,0.041759736835956573,,,PRUNED
2561,2561,0.11358406394720078,2023-01-06 06:14:40.529540,2023-01-06 06:14:47.464638,0 days 00:00:06.935098,sigmoid,0.0,2,0.65,0.11358406394720078,,,PRUNED
2562,2562,0.035677701234817505,2023-01-06 06:14:47.579998,2023-01-06 06:15:14.277656,0 days 00:00:26.697658,relu,0.45,2,0.6,0.05017463117837906,0.035677701234817505,,PRUNED
2563,2563,0.14083223044872284,2023-01-06 06:15:14.396596,2023-01-06 06:15:21.536250,0 days 00:00:07.139654,tanh,0.0,2,0.55,0.14083223044872284,,,PRUNED
2564,2564,0.10572461783885956,2023-01-06 06:15:21.660704,2023-01-06 06:15:28.570056,0 days 00:00:06.909352,sigmoid,0.25,2,0.5,0.10572461783885956,,,PRUNED
2565,2565,0.045187849551439285,2023-01-06 06:15:28.694493,2023-01-06 06:15:55.483647,0 days 00:00:26.789154,sigmoid,0.05,2,0.95,0.045187849551439285,,,PRUNED
2566,2566,0.0590013787150383,2023-01-06 06:15:55.607086,2023-01-06 06:16:07.615808,0 days 00:00:12.008722,sigmoid,0.30000000000000004,2,0.6,0.07501965016126633,0.0590013787150383,,PRUNED
2567,2567,0.10240324586629868,2023-01-06 06:16:07.740495,2023-01-06 06:16:14.815321,0 days 00:00:07.074826,tanh,0.05,2,0.5,0.10240324586629868,,,PRUNED
2568,2568,0.03739335387945175,2023-01-06 06:16:14.930973,2023-01-06 06:16:42.485902,0 days 00:00:27.554929,sigmoid,0.5,3,0.5,0.07532358169555664,0.04984918236732483,0.03739335387945175,PRUNED
2569,2569,0.03959784656763077,2023-01-06 06:16:42.615070,2023-01-06 06:17:09.408826,0 days 00:00:26.793756,relu,0.35000000000000003,2,0.7,0.061695367097854614,0.03959784656763077,,PRUNED
2570,2570,0.06208130717277527,2023-01-06 06:17:09.526395,2023-01-06 06:17:21.399972,0 days 00:00:11.873577,relu,0.30000000000000004,2,0.8500000000000001,0.06208130717277527,,,PRUNED
2571,2571,0.06748640537261963,2023-01-06 06:17:21.509811,2023-01-06 06:17:33.706957,0 days 00:00:12.197146,sigmoid,0.25,2,0.7,0.09108197689056396,0.06748640537261963,,PRUNED
2572,2572,0.28352096676826477,2023-01-06 06:17:33.835858,2023-01-06 06:17:53.723591,0 days 00:00:19.887733,tanh,0.25,6,0.95,,,,COMPLETE
2573,2573,0.04346229135990143,2023-01-06 06:17:53.859004,2023-01-06 06:18:20.694002,0 days 00:00:26.834998,relu,0.4,2,0.9,0.05672380328178406,0.04346229135990143,,PRUNED
2574,2574,0.11064397543668747,2023-01-06 06:18:20.822006,2023-01-06 06:18:27.878809,0 days 00:00:07.056803,sigmoid,0.0,2,0.5,0.11064397543668747,,,PRUNED
2575,2575,0.06537161022424698,2023-01-06 06:18:28.004694,2023-01-06 06:18:39.785202,0 days 00:00:11.780508,relu,0.2,2,0.7,0.06537161022424698,,,PRUNED
2576,2576,0.1031205877661705,2023-01-06 06:18:39.923439,2023-01-06 06:18:47.077386,0 days 00:00:07.153947,tanh,0.30000000000000004,2,0.55,0.1031205877661705,,,PRUNED
2577,2577,0.15619538724422455,2023-01-06 06:18:47.192879,2023-01-06 06:18:54.360085,0 days 00:00:07.167206,sigmoid,0.05,4,0.65,0.15619538724422455,,,PRUNED
2578,2578,0.05890930816531181,2023-01-06 06:18:54.468323,2023-01-06 06:19:06.683137,0 days 00:00:12.214814,sigmoid,0.25,2,0.5,0.08817964792251587,0.05890930816531181,,PRUNED
2579,2579,0.1291651576757431,2023-01-06 06:19:06.793373,2023-01-06 06:19:13.774785,0 days 00:00:06.981412,tanh,0.0,2,0.5,0.1291651576757431,,,PRUNED
2580,2580,0.06698520481586456,2023-01-06 06:19:13.892828,2023-01-06 06:19:25.806659,0 days 00:00:11.913831,relu,0.45,2,0.6,0.06698520481586456,,,PRUNED
2581,2581,0.15014486014842987,2023-01-06 06:19:25.940200,2023-01-06 06:19:38.247368,0 days 00:00:12.307168,relu,0.5,4,0.8500000000000001,0.15014486014842987,,,PRUNED
2582,2582,0.03870020806789398,2023-01-06 06:19:38.360873,2023-01-06 06:20:05.119298,0 days 00:00:26.758425,sigmoid,0.1,2,0.8,0.03870020806789398,,,PRUNED
2583,2583,0.04394146427512169,2023-01-06 06:20:05.251910,2023-01-06 06:20:32.004527,0 days 00:00:26.752617,tanh,0.35000000000000003,2,0.55,0.04394146427512169,,,PRUNED
2584,2584,0.03731805458664894,2023-01-06 06:20:32.123835,2023-01-06 06:20:59.390594,0 days 00:00:27.266759,relu,0.35000000000000003,2,0.55,0.053505655378103256,0.03731805458664894,,PRUNED
2585,2585,0.07460575550794601,2023-01-06 06:20:59.513675,2023-01-06 06:21:11.427485,0 days 00:00:11.913810,relu,0.4,2,0.8500000000000001,0.07460575550794601,,,PRUNED
2586,2586,0.0767788365483284,2023-01-06 06:21:11.548763,2023-01-06 06:21:23.630918,0 days 00:00:12.082155,relu,0.15000000000000002,2,0.65,0.0767788365483284,,,PRUNED
2587,2587,0.05520124360918999,2023-01-06 06:21:23.771865,2023-01-06 06:21:35.830232,0 days 00:00:12.058367,sigmoid,0.25,2,0.5,0.06536449491977692,0.05520124360918999,,PRUNED
2588,2588,0.043963927775621414,2023-01-06 06:21:35.948654,2023-01-06 06:22:02.685245,0 days 00:00:26.736591,sigmoid,0.05,2,0.95,0.043963927775621414,,,PRUNED
2589,2589,0.12190156430006027,2023-01-06 06:22:02.803665,2023-01-06 06:22:10.028345,0 days 00:00:07.224680,sigmoid,0.05,2,0.5,0.12190156430006027,,,PRUNED
2590,2590,0.12388930469751358,2023-01-06 06:22:10.142293,2023-01-06 06:22:17.151799,0 days 00:00:07.009506,sigmoid,0.30000000000000004,2,0.55,0.12388930469751358,,,PRUNED
2591,2591,0.1460130214691162,2023-01-06 06:22:17.277076,2023-01-06 06:22:49.178705,0 days 00:00:31.901629,tanh,0.15000000000000002,2,1.0,0.033955901861190796,,,COMPLETE
2592,2592,0.07486631721258163,2023-01-06 06:22:49.300284,2023-01-06 06:23:01.373386,0 days 00:00:12.073102,relu,0.2,2,0.7,0.07486631721258163,,,PRUNED
2593,2593,0.061709824949502945,2023-01-06 06:23:01.497673,2023-01-06 06:23:13.547459,0 days 00:00:12.049786,tanh,0.0,2,0.5,0.09170202910900116,0.061709824949502945,,PRUNED
2594,2594,0.07492579519748688,2023-01-06 06:23:13.670733,2023-01-06 06:23:25.771514,0 days 00:00:12.100781,relu,0.25,3,0.8500000000000001,0.07492579519748688,,,PRUNED
2595,2595,0.11079373955726624,2023-01-06 06:23:25.905827,2023-01-06 06:23:32.913402,0 days 00:00:07.007575,sigmoid,0.35000000000000003,2,0.5,0.11079373955726624,,,PRUNED
2596,2596,0.03373730182647705,2023-01-06 06:23:33.029578,2023-01-06 06:23:59.993886,0 days 00:00:26.964308,sigmoid,0.25,2,0.65,0.06460057199001312,0.04566149786114693,0.03373730182647705,PRUNED
2597,2597,0.10027023404836655,2023-01-06 06:24:00.115271,2023-01-06 06:24:07.360791,0 days 00:00:07.245520,tanh,0.0,2,0.5,0.10027023404836655,,,PRUNED
2598,2598,0.04306071624159813,2023-01-06 06:24:07.477923,2023-01-06 06:24:34.603509,0 days 00:00:27.125586,sigmoid,0.05,2,0.55,0.09365619719028473,0.0543467216193676,0.04306071624159813,PRUNED
2599,2599,0.11204615235328674,2023-01-06 06:24:34.723823,2023-01-06 06:24:41.816456,0 days 00:00:07.092633,sigmoid,0.30000000000000004,2,0.65,0.11204615235328674,,,PRUNED
2600,2600,0.05309993401169777,2023-01-06 06:24:41.939973,2023-01-06 06:25:08.871910,0 days 00:00:26.931937,sigmoid,0.2,2,0.9,0.05309993401169777,,,PRUNED
2601,2601,0.12067442387342453,2023-01-06 06:25:08.987871,2023-01-06 06:25:15.922252,0 days 00:00:06.934381,sigmoid,0.25,2,0.5,0.12067442387342453,,,PRUNED
2602,2602,0.12166201323270798,2023-01-06 06:25:16.047646,2023-01-06 06:25:23.287463,0 days 00:00:07.239817,tanh,0.0,2,0.5,0.12166201323270798,,,PRUNED
2603,2603,0.12604673206806183,2023-01-06 06:25:23.395083,2023-01-06 06:25:30.395255,0 days 00:00:07.000172,sigmoid,0.30000000000000004,2,0.5,0.12604673206806183,,,PRUNED
2604,2604,0.06887169182300568,2023-01-06 06:25:30.517559,2023-01-06 06:25:42.293935,0 days 00:00:11.776376,relu,0.4,2,0.65,0.06887169182300568,,,PRUNED
2605,2605,0.1349671185016632,2023-01-06 06:25:42.415610,2023-01-06 06:26:17.180358,0 days 00:00:34.764748,relu,0.4,2,0.7,0.05633166432380676,0.03457653895020485,,COMPLETE
