,number,value,datetime_start,datetime_complete,duration,params_activation,params_dropout,params_layers,params_shrink,system_attrs_completed_rung_0,system_attrs_completed_rung_1,system_attrs_completed_rung_2,state
264,264,0.07893431186676025,2023-01-05 19:58:22.138675,2023-01-05 19:58:34.421322,0 days 00:00:12.282647,sigmoid,0.25,3,0.65,0.07893431186676025,,,PRUNED
265,265,0.04706718772649765,2023-01-05 19:58:34.537967,2023-01-05 19:59:01.244305,0 days 00:00:26.706338,sigmoid,0.0,2,0.95,0.04706718772649765,,,PRUNED
266,266,0.06313197314739227,2023-01-05 19:59:01.351371,2023-01-05 19:59:13.301724,0 days 00:00:11.950353,tanh,0.4,2,0.8500000000000001,0.08392573148012161,0.06313197314739227,,PRUNED
267,267,0.06859497725963593,2023-01-05 19:59:13.419130,2023-01-05 19:59:25.208812,0 days 00:00:11.789682,relu,0.30000000000000004,2,0.7,0.06859497725963593,,,PRUNED
268,268,0.14140662550926208,2023-01-05 19:59:25.318828,2023-01-05 19:59:54.844779,0 days 00:00:29.525951,sigmoid,0.0,2,1.0,0.03692547604441643,,,COMPLETE
269,269,0.034163448959589005,2023-01-05 19:59:54.969815,2023-01-05 20:00:22.080306,0 days 00:00:27.110491,tanh,0.15000000000000002,2,0.5,0.07817886024713516,0.053022950887680054,0.034163448959589005,PRUNED
270,270,0.06181780621409416,2023-01-05 20:00:22.186935,2023-01-05 20:00:34.137298,0 days 00:00:11.950363,tanh,0.15000000000000002,2,0.5,0.07762456685304642,0.06181780621409416,,PRUNED
271,271,0.11977748572826385,2023-01-05 20:00:34.254844,2023-01-05 20:00:41.320089,0 days 00:00:07.065245,relu,0.2,2,0.5,0.11977748572826385,,,PRUNED
272,272,0.1390540599822998,2023-01-05 20:00:41.439862,2023-01-05 20:00:48.277893,0 days 00:00:06.838031,tanh,0.15000000000000002,2,0.5,0.1390540599822998,,,PRUNED
273,273,0.06621492654085159,2023-01-05 20:00:48.403810,2023-01-05 20:01:00.426976,0 days 00:00:12.023166,relu,0.1,3,0.55,0.0920274406671524,0.06621492654085159,,PRUNED
274,274,0.1341390460729599,2023-01-05 20:01:00.536052,2023-01-05 20:01:07.301456,0 days 00:00:06.765404,sigmoid,0.2,2,0.5,0.1341390460729599,,,PRUNED
275,275,0.08660592138767242,2023-01-05 20:01:07.418220,2023-01-05 20:01:19.600529,0 days 00:00:12.182309,tanh,0.35000000000000003,3,0.6,0.08660592138767242,,,PRUNED
276,276,0.04198690876364708,2023-01-05 20:01:19.727450,2023-01-05 20:01:46.531831,0 days 00:00:26.804381,sigmoid,0.05,2,0.75,0.04198690876364708,,,PRUNED
277,277,0.1453026533126831,2023-01-05 20:01:46.666145,2023-01-05 20:02:15.934131,0 days 00:00:29.267986,relu,0.25,2,0.65,0.06716487556695938,0.038510940968990326,,COMPLETE
278,278,0.11730816215276718,2023-01-05 20:02:16.063029,2023-01-05 20:02:23.012893,0 days 00:00:06.949864,tanh,0.15000000000000002,2,0.55,0.11730816215276718,,,PRUNED
279,279,0.13212080299854279,2023-01-05 20:02:23.114149,2023-01-05 20:02:29.928560,0 days 00:00:06.814411,tanh,0.05,2,0.5,0.13212080299854279,,,PRUNED
280,280,0.06371533125638962,2023-01-05 20:02:30.027988,2023-01-05 20:02:41.794323,0 days 00:00:11.766335,tanh,0.0,2,1.0,0.08625363558530807,0.06371533125638962,,PRUNED
281,281,0.0755639299750328,2023-01-05 20:02:41.919068,2023-01-05 20:02:53.710095,0 days 00:00:11.791027,relu,0.30000000000000004,2,0.6,0.0755639299750328,,,PRUNED
282,282,0.04219839721918106,2023-01-05 20:02:53.827498,2023-01-05 20:03:20.799718,0 days 00:00:26.972220,sigmoid,0.1,2,0.9,0.04219839721918106,,,PRUNED
283,283,0.04633750393986702,2023-01-05 20:03:20.908032,2023-01-05 20:03:47.747688,0 days 00:00:26.839656,sigmoid,0.05,3,0.8500000000000001,0.04633750393986702,,,PRUNED
284,284,0.0379943810403347,2023-01-05 20:03:47.855891,2023-01-05 20:04:14.828976,0 days 00:00:26.973085,tanh,0.1,2,0.55,0.08682487159967422,0.05629831179976463,0.0379943810403347,PRUNED
285,285,0.10592925548553467,2023-01-05 20:04:14.952424,2023-01-05 20:04:22.153434,0 days 00:00:07.201010,tanh,0.15000000000000002,4,0.65,0.10592925548553467,,,PRUNED
286,286,0.1213601678609848,2023-01-05 20:04:22.261524,2023-01-05 20:04:28.969813,0 days 00:00:06.708289,relu,0.15000000000000002,2,0.5,0.1213601678609848,,,PRUNED
287,287,0.11673616617918015,2023-01-05 20:04:29.105652,2023-01-05 20:04:35.869721,0 days 00:00:06.764069,tanh,0.1,2,0.6,0.11673616617918015,,,PRUNED
288,288,0.08644813299179077,2023-01-05 20:04:36.011481,2023-01-05 20:04:47.695115,0 days 00:00:11.683634,relu,0.0,2,0.55,0.08644813299179077,,,PRUNED
289,289,0.04465111345052719,2023-01-05 20:04:47.819897,2023-01-05 20:05:14.807785,0 days 00:00:26.987888,sigmoid,0.0,3,0.75,0.04465111345052719,,,PRUNED
290,290,0.18459798395633698,2023-01-05 20:05:14.925188,2023-01-05 20:05:22.048559,0 days 00:00:07.123371,tanh,0.05,6,0.65,0.18459798395633698,,,PRUNED
291,291,0.15469425916671753,2023-01-05 20:05:22.165871,2023-01-05 20:05:51.340027,0 days 00:00:29.174156,relu,0.35000000000000003,2,0.5,0.05879496410489082,0.03586407005786896,,COMPLETE
292,292,0.11931096017360687,2023-01-05 20:05:51.475111,2023-01-05 20:05:58.412823,0 days 00:00:06.937712,relu,0.0,2,0.9,0.11931096017360687,,,PRUNED
293,293,0.14566755294799805,2023-01-05 20:05:58.531239,2023-01-05 20:06:05.595615,0 days 00:00:07.064376,sigmoid,0.2,5,0.5,0.14566755294799805,,,PRUNED
294,294,0.13070574402809143,2023-01-05 20:06:05.713023,2023-01-05 20:06:12.386775,0 days 00:00:06.673752,tanh,0.1,2,0.6,0.13070574402809143,,,PRUNED
295,295,0.21706242859363556,2023-01-05 20:06:12.520880,2023-01-05 20:06:35.048063,0 days 00:00:22.527183,sigmoid,0.15000000000000002,6,1.0,,,,COMPLETE
296,296,0.057878993451595306,2023-01-05 20:06:35.171817,2023-01-05 20:06:46.909387,0 days 00:00:11.737570,tanh,0.1,2,0.6,0.08339165896177292,0.057878993451595306,,PRUNED
297,297,0.06968126446008682,2023-01-05 20:06:47.041507,2023-01-05 20:06:58.683099,0 days 00:00:11.641592,relu,0.2,2,0.55,0.06968126446008682,,,PRUNED
298,298,0.15277338027954102,2023-01-05 20:06:58.799687,2023-01-05 20:07:28.072392,0 days 00:00:29.272705,relu,0.35000000000000003,2,0.75,0.05654887855052948,0.03702202066779137,,COMPLETE
299,299,0.06234373897314072,2023-01-05 20:07:28.209485,2023-01-05 20:07:40.213160,0 days 00:00:12.003675,tanh,0.1,2,0.6,0.0725073516368866,0.06234373897314072,,PRUNED
300,300,0.06092755123972893,2023-01-05 20:07:40.331891,2023-01-05 20:07:52.253896,0 days 00:00:11.922005,tanh,0.15000000000000002,2,0.55,0.07253517210483551,0.06092755123972893,,PRUNED
301,301,0.06370598077774048,2023-01-05 20:07:52.372904,2023-01-05 20:08:04.228336,0 days 00:00:11.855432,tanh,0.05,2,0.6,0.08019740134477615,0.06370598077774048,,PRUNED
302,302,0.035933248698711395,2023-01-05 20:08:04.346242,2023-01-05 20:08:31.009646,0 days 00:00:26.663404,tanh,0.15000000000000002,2,0.8500000000000001,0.06970404833555222,0.04667732119560242,0.035933248698711395,PRUNED
303,303,0.11556058377027512,2023-01-05 20:08:31.116734,2023-01-05 20:08:38.125779,0 days 00:00:07.009045,relu,0.15000000000000002,2,0.8500000000000001,0.11556058377027512,,,PRUNED
304,304,0.05875598266720772,2023-01-05 20:08:38.243178,2023-01-05 20:08:50.083208,0 days 00:00:11.840030,tanh,0.2,2,0.8500000000000001,0.09483981877565384,0.05875598266720772,,PRUNED
305,305,0.2304379791021347,2023-01-05 20:08:50.198610,2023-01-05 20:08:57.382659,0 days 00:00:07.184049,sigmoid,0.15000000000000002,7,0.8500000000000001,0.2304379791021347,,,PRUNED
306,306,0.1510927528142929,2023-01-05 20:08:57.500067,2023-01-05 20:09:24.594429,0 days 00:00:27.094362,sigmoid,0.30000000000000004,2,0.6,0.05723493546247482,0.03516003489494324,,COMPLETE
307,307,0.1448134332895279,2023-01-05 20:09:24.717358,2023-01-05 20:09:31.422469,0 days 00:00:06.705111,relu,0.25,2,0.8,0.1448134332895279,,,PRUNED
308,308,0.0739084854722023,2023-01-05 20:09:31.530175,2023-01-05 20:09:43.462517,0 days 00:00:11.932342,relu,0.1,3,0.55,0.0739084854722023,,,PRUNED
309,309,0.11983942985534668,2023-01-05 20:09:43.571588,2023-01-05 20:09:50.287003,0 days 00:00:06.715415,tanh,0.15000000000000002,2,0.9,0.11983942985534668,,,PRUNED
310,310,0.12358883768320084,2023-01-05 20:09:50.402409,2023-01-05 20:09:57.386469,0 days 00:00:06.984060,tanh,0.1,2,0.95,0.12358883768320084,,,PRUNED
311,311,0.1367678940296173,2023-01-05 20:09:57.521535,2023-01-05 20:10:26.658008,0 days 00:00:29.136473,tanh,0.0,2,0.8,0.034539248794317245,,,COMPLETE
312,312,0.07574715465307236,2023-01-05 20:10:26.778339,2023-01-05 20:10:38.400042,0 days 00:00:11.621703,relu,0.25,2,0.5,0.07574715465307236,,,PRUNED
313,313,0.11977951973676682,2023-01-05 20:10:38.507115,2023-01-05 20:10:45.349517,0 days 00:00:06.842402,tanh,0.1,2,0.55,0.11977951973676682,,,PRUNED
314,314,0.05692742019891739,2023-01-05 20:10:45.466598,2023-01-05 20:10:57.573593,0 days 00:00:12.106995,tanh,0.15000000000000002,2,0.5,0.08234083652496338,0.05692742019891739,,PRUNED
315,315,0.057581305503845215,2023-01-05 20:10:57.682671,2023-01-05 20:11:09.531025,0 days 00:00:11.848354,tanh,0.15000000000000002,2,0.65,0.07329531759023666,0.057581305503845215,,PRUNED
316,316,0.14372555911540985,2023-01-05 20:11:09.650427,2023-01-05 20:11:16.413660,0 days 00:00:06.763233,tanh,0.05,2,0.6,0.14372555911540985,,,PRUNED
317,317,0.06843535602092743,2023-01-05 20:11:16.530250,2023-01-05 20:11:43.503465,0 days 00:00:26.973215,tanh,0.1,4,0.8,0.06843535602092743,,,PRUNED
318,318,0.041414253413677216,2023-01-05 20:11:43.630200,2023-01-05 20:12:10.284784,0 days 00:00:26.654584,relu,0.30000000000000004,2,0.65,0.05563840642571449,0.041414253413677216,,PRUNED
319,319,0.4623391330242157,2023-01-05 20:12:10.392860,2023-01-05 20:12:22.633856,0 days 00:00:12.240996,sigmoid,0.4,8,0.6,0.4623391330242157,,,PRUNED
320,320,0.1339569389820099,2023-01-05 20:12:22.740923,2023-01-05 20:12:52.308374,0 days 00:00:29.567451,tanh,0.15000000000000002,2,0.5,0.07788970321416855,0.0442984402179718,0.03372573480010033,COMPLETE
321,321,0.058536097407341,2023-01-05 20:12:52.451687,2023-01-05 20:13:04.530687,0 days 00:00:12.079000,relu,0.15000000000000002,2,0.5,0.09528744220733643,0.058536097407341,,PRUNED
322,322,0.1777687519788742,2023-01-05 20:13:04.648097,2023-01-05 20:13:16.821652,0 days 00:00:12.173555,relu,0.4,5,0.55,0.1777687519788742,,,PRUNED
323,323,0.14031511545181274,2023-01-05 20:13:16.939844,2023-01-05 20:13:51.211256,0 days 00:00:34.271412,tanh,0.0,2,0.8,0.037535615265369415,,,COMPLETE
324,324,0.13009551167488098,2023-01-05 20:13:51.338652,2023-01-05 20:13:58.184978,0 days 00:00:06.846326,tanh,0.2,2,0.5,0.13009551167488098,,,PRUNED
325,325,0.08560360223054886,2023-01-05 20:13:58.311722,2023-01-05 20:14:10.150746,0 days 00:00:11.839024,relu,0.4,2,0.5,0.08560360223054886,,,PRUNED
326,326,0.12956371903419495,2023-01-05 20:14:10.275505,2023-01-05 20:14:17.125216,0 days 00:00:06.849711,sigmoid,0.0,2,0.7,0.12956371903419495,,,PRUNED
327,327,0.14087286591529846,2023-01-05 20:14:17.242617,2023-01-05 20:14:46.657066,0 days 00:00:29.414449,relu,0.35000000000000003,2,0.55,0.0653495341539383,0.035830121487379074,,COMPLETE
328,328,0.07520212233066559,2023-01-05 20:14:46.783260,2023-01-05 20:14:58.730415,0 days 00:00:11.947155,relu,0.35000000000000003,2,0.6,0.07520212233066559,,,PRUNED
329,329,0.039926983416080475,2023-01-05 20:14:58.840641,2023-01-05 20:15:25.603392,0 days 00:00:26.762751,tanh,0.0,2,0.8500000000000001,0.039926983416080475,,,PRUNED
330,330,0.28955477476119995,2023-01-05 20:15:25.721058,2023-01-05 20:15:43.082821,0 days 00:00:17.361763,tanh,0.05,7,0.8500000000000001,,,,COMPLETE
331,331,0.1345905363559723,2023-01-05 20:15:43.214230,2023-01-05 20:15:50.068338,0 days 00:00:06.854108,tanh,0.15000000000000002,2,0.5,0.1345905363559723,,,PRUNED
332,332,0.12164095789194107,2023-01-05 20:15:50.194164,2023-01-05 20:15:56.892695,0 days 00:00:06.698531,tanh,0.15000000000000002,2,0.8500000000000001,0.12164095789194107,,,PRUNED
333,333,0.39466428756713867,2023-01-05 20:15:57.011109,2023-01-05 20:16:04.342131,0 days 00:00:07.331022,tanh,0.25,8,0.5,0.39466428756713867,,,PRUNED
334,334,0.13965171575546265,2023-01-05 20:16:04.451209,2023-01-05 20:16:11.174946,0 days 00:00:06.723737,tanh,0.1,2,0.55,0.13965171575546265,,,PRUNED
335,335,0.1415720283985138,2023-01-05 20:16:11.309028,2023-01-05 20:16:41.092255,0 days 00:00:29.783227,relu,0.30000000000000004,2,0.55,0.0629902109503746,0.03638993948698044,,COMPLETE
336,336,0.042912986129522324,2023-01-05 20:16:41.227121,2023-01-05 20:17:07.870679,0 days 00:00:26.643558,relu,0.0,2,0.75,0.042912986129522324,,,PRUNED
337,337,0.0437314473092556,2023-01-05 20:17:07.978757,2023-01-05 20:17:34.851980,0 days 00:00:26.873223,relu,0.35000000000000003,2,0.5,0.06502257287502289,0.0437314473092556,,PRUNED
338,338,0.05704762786626816,2023-01-05 20:17:34.969386,2023-01-05 20:17:47.084394,0 days 00:00:12.115008,tanh,0.15000000000000002,2,0.5,0.0956384465098381,0.05704762786626816,,PRUNED
339,339,0.06933027505874634,2023-01-05 20:17:47.196469,2023-01-05 20:17:58.908503,0 days 00:00:11.712034,relu,0.30000000000000004,2,0.6,0.06933027505874634,,,PRUNED
340,340,0.07812513411045074,2023-01-05 20:17:59.026903,2023-01-05 20:18:11.249235,0 days 00:00:12.222332,tanh,0.15000000000000002,3,0.55,0.07812513411045074,,,PRUNED
341,341,0.034950993955135345,2023-01-05 20:18:11.356309,2023-01-05 20:18:38.372191,0 days 00:00:27.015882,relu,0.05,2,0.6,0.07414674013853073,0.041285187005996704,0.034950993955135345,PRUNED
342,342,0.04157058522105217,2023-01-05 20:18:38.472933,2023-01-05 20:19:05.652915,0 days 00:00:27.179982,relu,0.30000000000000004,2,0.55,0.06192197650671005,0.04157058522105217,,PRUNED
343,343,0.13303928077220917,2023-01-05 20:19:05.763540,2023-01-05 20:19:35.431500,0 days 00:00:29.667960,relu,0.05,2,0.5,0.0638485699892044,0.04548951983451843,0.03283793106675148,COMPLETE
344,344,0.14177186787128448,2023-01-05 20:19:35.563975,2023-01-05 20:19:42.392394,0 days 00:00:06.828419,relu,0.05,2,0.5,0.14177186787128448,,,PRUNED
345,345,0.13367033004760742,2023-01-05 20:19:42.525438,2023-01-05 20:19:49.366277,0 days 00:00:06.840839,relu,0.05,2,0.5,0.13367033004760742,,,PRUNED
346,346,0.03959842026233673,2023-01-05 20:19:49.494582,2023-01-05 20:20:16.547561,0 days 00:00:27.052979,relu,0.35000000000000003,2,0.6,0.056796152144670486,0.03959842026233673,,PRUNED
347,347,0.08939141035079956,2023-01-05 20:20:16.659200,2023-01-05 20:20:28.504995,0 days 00:00:11.845795,relu,0.25,2,0.55,0.08939141035079956,,,PRUNED
348,348,0.060717642307281494,2023-01-05 20:20:28.604887,2023-01-05 20:20:40.462423,0 days 00:00:11.857536,relu,0.15000000000000002,2,0.5,0.08480005711317062,0.060717642307281494,,PRUNED
349,349,0.11311434209346771,2023-01-05 20:20:40.572056,2023-01-05 20:20:47.428574,0 days 00:00:06.856518,relu,0.05,2,0.5,0.11311434209346771,,,PRUNED
350,350,0.1437709778547287,2023-01-05 20:20:47.555865,2023-01-05 20:20:54.569703,0 days 00:00:07.013838,relu,0.05,2,0.55,0.1437709778547287,,,PRUNED
351,351,0.040868766605854034,2023-01-05 20:20:54.714661,2023-01-05 20:21:21.600990,0 days 00:00:26.886329,relu,0.30000000000000004,2,0.55,0.05380699038505554,0.040868766605854034,,PRUNED
352,352,0.05947834625840187,2023-01-05 20:21:21.718216,2023-01-05 20:21:33.625096,0 days 00:00:11.906880,relu,0.0,2,0.8500000000000001,0.08513210713863373,0.05947834625840187,,PRUNED
353,353,0.1356835663318634,2023-01-05 20:21:33.744039,2023-01-05 20:22:03.414248,0 days 00:00:29.670209,relu,0.35000000000000003,2,0.55,0.055085137486457825,0.03390400484204292,,COMPLETE
354,354,0.12540088593959808,2023-01-05 20:22:03.544489,2023-01-05 20:22:10.363974,0 days 00:00:06.819485,relu,0.0,2,0.55,0.12540088593959808,,,PRUNED
355,355,0.116374172270298,2023-01-05 20:22:10.492277,2023-01-05 20:22:17.471365,0 days 00:00:06.979088,relu,0.05,2,0.7,0.116374172270298,,,PRUNED
356,356,0.06125837191939354,2023-01-05 20:22:17.589741,2023-01-05 20:22:29.545873,0 days 00:00:11.956132,relu,0.05,2,0.5,0.08016550540924072,0.06125837191939354,,PRUNED
357,357,0.10763901472091675,2023-01-05 20:22:29.654211,2023-01-05 20:22:36.603668,0 days 00:00:06.949457,relu,0.0,2,0.6,0.10763901472091675,,,PRUNED
358,358,0.03613227978348732,2023-01-05 20:22:36.756559,2023-01-05 20:23:03.643205,0 days 00:00:26.886646,relu,0.2,2,0.8,0.0745488628745079,0.05132599174976349,0.03613227978348732,PRUNED
359,359,0.1403224617242813,2023-01-05 20:23:03.759310,2023-01-05 20:23:33.130251,0 days 00:00:29.370941,tanh,0.05,2,0.9,0.03273813799023628,,,COMPLETE
360,360,0.10923093557357788,2023-01-05 20:23:33.252391,2023-01-05 20:23:40.090560,0 days 00:00:06.838169,relu,0.05,2,0.65,0.10923093557357788,,,PRUNED
361,361,0.08053024858236313,2023-01-05 20:23:40.226279,2023-01-05 20:23:52.222825,0 days 00:00:11.996546,relu,0.35000000000000003,2,0.5,0.08053024858236313,,,PRUNED
362,362,0.1381007879972458,2023-01-05 20:23:52.350276,2023-01-05 20:24:24.577374,0 days 00:00:32.227098,sigmoid,0.15000000000000002,2,0.5,0.08169467002153397,0.055018313229084015,0.032563015818595886,COMPLETE
363,363,0.1293168067932129,2023-01-05 20:24:24.713740,2023-01-05 20:24:59.238420,0 days 00:00:34.524680,relu,0.35000000000000003,2,0.55,0.058173321187496185,0.031365618109703064,,COMPLETE
364,364,0.11428842693567276,2023-01-05 20:24:59.364562,2023-01-05 20:25:06.217393,0 days 00:00:06.852831,sigmoid,0.15000000000000002,2,0.5,0.11428842693567276,,,PRUNED
365,365,0.05975697934627533,2023-01-05 20:25:06.343639,2023-01-05 20:25:18.499801,0 days 00:00:12.156162,relu,0.15000000000000002,2,0.5,0.09675495326519012,0.05975697934627533,,PRUNED
366,366,0.04563705623149872,2023-01-05 20:25:18.626100,2023-01-05 20:25:45.472766,0 days 00:00:26.846666,sigmoid,0.0,3,0.7,0.04563705623149872,,,PRUNED
367,367,0.13801394402980804,2023-01-05 20:25:45.582394,2023-01-05 20:26:19.758356,0 days 00:00:34.175962,sigmoid,0.0,2,0.65,0.03613348677754402,,,COMPLETE
368,368,0.15143218636512756,2023-01-05 20:26:19.881484,2023-01-05 20:26:51.780947,0 days 00:00:31.899463,sigmoid,0.05,2,0.8,0.037052784115076065,,,COMPLETE
369,369,0.07177598029375076,2023-01-05 20:26:51.915408,2023-01-05 20:27:03.766864,0 days 00:00:11.851456,relu,0.35000000000000003,2,0.55,0.07177598029375076,,,PRUNED
370,370,0.03998958319425583,2023-01-05 20:27:03.910833,2023-01-05 20:27:30.823163,0 days 00:00:26.912330,relu,0.35000000000000003,3,0.7,0.05050048977136612,0.03998958319425583,,PRUNED
371,371,0.0349813736975193,2023-01-05 20:27:30.932795,2023-01-05 20:27:58.054445,0 days 00:00:27.121650,sigmoid,0.15000000000000002,2,0.5,0.08226052671670914,0.0537152998149395,0.0349813736975193,PRUNED
372,372,0.12961925566196442,2023-01-05 20:27:58.164072,2023-01-05 20:28:05.537213,0 days 00:00:07.373141,sigmoid,0.15000000000000002,2,0.5,0.12961925566196442,,,PRUNED
373,373,0.128269761800766,2023-01-05 20:28:05.654177,2023-01-05 20:28:37.881407,0 days 00:00:32.227230,relu,0.4,2,0.6,0.03738400712609291,0.030213817954063416,,COMPLETE
374,374,0.12752628326416016,2023-01-05 20:28:38.022072,2023-01-05 20:28:45.150618,0 days 00:00:07.128546,sigmoid,0.15000000000000002,2,0.5,0.12752628326416016,,,PRUNED
375,375,0.04188835620880127,2023-01-05 20:28:45.268854,2023-01-05 20:29:12.190514,0 days 00:00:26.921660,tanh,0.2,3,0.8500000000000001,0.04188835620880127,,,PRUNED
376,376,0.07250422984361649,2023-01-05 20:29:12.300154,2023-01-05 20:29:24.331266,0 days 00:00:12.031112,relu,0.30000000000000004,2,0.6,0.07250422984361649,,,PRUNED
377,377,0.07568012177944183,2023-01-05 20:29:24.440897,2023-01-05 20:29:36.171736,0 days 00:00:11.730839,relu,0.35000000000000003,2,0.65,0.07568012177944183,,,PRUNED
378,378,0.041121095418930054,2023-01-05 20:29:36.298239,2023-01-05 20:30:02.953367,0 days 00:00:26.655128,relu,0.0,2,0.8,0.041121095418930054,,,PRUNED
379,379,0.13972455263137817,2023-01-05 20:30:03.071318,2023-01-05 20:30:32.690743,0 days 00:00:29.619425,sigmoid,0.0,2,0.65,0.03176851570606232,,,COMPLETE
380,380,0.12937307357788086,2023-01-05 20:30:32.823758,2023-01-05 20:31:07.579458,0 days 00:00:34.755700,sigmoid,0.15000000000000002,2,0.5,0.0802173912525177,0.05307101830840111,0.03234495595097542,COMPLETE
381,381,0.04068407416343689,2023-01-05 20:31:07.713791,2023-01-05 20:31:34.379740,0 days 00:00:26.665949,sigmoid,0.0,2,0.65,0.04068407416343689,,,PRUNED
382,382,0.1370285600423813,2023-01-05 20:31:34.507093,2023-01-05 20:31:41.272181,0 days 00:00:06.765088,sigmoid,0.15000000000000002,2,0.5,0.1370285600423813,,,PRUNED
383,383,0.04324383661150932,2023-01-05 20:31:41.396422,2023-01-05 20:32:08.336805,0 days 00:00:26.940383,sigmoid,0.05,2,0.6,0.04324383661150932,,,PRUNED
384,384,0.11875366419553757,2023-01-05 20:32:08.454542,2023-01-05 20:32:15.561271,0 days 00:00:07.106729,sigmoid,0.15000000000000002,5,0.5,0.11875366419553757,,,PRUNED
385,385,0.11039870977401733,2023-01-05 20:32:15.687321,2023-01-05 20:32:22.569069,0 days 00:00:06.881748,sigmoid,0.2,2,0.5,0.11039870977401733,,,PRUNED
386,386,0.10424953699111938,2023-01-05 20:32:22.676470,2023-01-05 20:32:29.852299,0 days 00:00:07.175829,sigmoid,0.15000000000000002,2,0.5,0.10424953699111938,,,PRUNED
387,387,0.11218518763780594,2023-01-05 20:32:29.987244,2023-01-05 20:32:36.884652,0 days 00:00:06.897408,sigmoid,0.15000000000000002,2,0.5,0.11218518763780594,,,PRUNED
388,388,0.14728526771068573,2023-01-05 20:32:37.027836,2023-01-05 20:33:01.236552,0 days 00:00:24.208716,sigmoid,0.0,2,0.7,,,,COMPLETE
389,389,0.04078831151127815,2023-01-05 20:33:01.381229,2023-01-05 20:33:28.222452,0 days 00:00:26.841223,relu,0.4,2,0.55,0.0610814206302166,0.04078831151127815,,PRUNED
390,390,0.10322629660367966,2023-01-05 20:33:28.330459,2023-01-05 20:33:35.480236,0 days 00:00:07.149777,sigmoid,0.15000000000000002,2,0.5,0.10322629660367966,,,PRUNED
391,391,0.11493076384067535,2023-01-05 20:33:35.612977,2023-01-05 20:33:42.463042,0 days 00:00:06.850065,sigmoid,0.15000000000000002,2,0.5,0.11493076384067535,,,PRUNED
392,392,0.12366548180580139,2023-01-05 20:33:42.570462,2023-01-05 20:33:49.446135,0 days 00:00:06.875673,sigmoid,0.15000000000000002,2,0.8500000000000001,0.12366548180580139,,,PRUNED
393,393,0.07172522693872452,2023-01-05 20:33:49.562582,2023-01-05 20:34:01.487150,0 days 00:00:11.924568,relu,0.4,2,0.6,0.07172522693872452,,,PRUNED
