,number,value,datetime_start,datetime_complete,duration,params_activation,params_dropout,params_layers,params_shrink,system_attrs_completed_rung_0,system_attrs_completed_rung_1,system_attrs_completed_rung_2,state
2085,2085,0.043147843331098557,2023-01-06 04:14:14.403324,2023-01-06 04:14:41.348527,0 days 00:00:26.945203,tanh,0.2,2,0.9,0.05741553753614426,0.043147843331098557,,PRUNED
2086,2086,0.06498047709465027,2023-01-06 04:14:41.475633,2023-01-06 04:14:53.338269,0 days 00:00:11.862636,relu,0.25,2,0.65,0.06498047709465027,,,PRUNED
2087,2087,0.0387176088988781,2023-01-06 04:14:53.456767,2023-01-06 04:15:20.320543,0 days 00:00:26.863776,sigmoid,0.25,2,0.6,0.07474604994058609,0.05378793552517891,0.0387176088988781,PRUNED
2088,2088,0.17357245087623596,2023-01-06 04:15:20.419374,2023-01-06 04:15:28.120199,0 days 00:00:07.700825,sigmoid,0.25,8,0.5,0.17357245087623596,,,PRUNED
2089,2089,0.10465686768293381,2023-01-06 04:15:28.229109,2023-01-06 04:15:35.178015,0 days 00:00:06.948906,sigmoid,0.30000000000000004,2,0.55,0.10465686768293381,,,PRUNED
2090,2090,0.10173112899065018,2023-01-06 04:15:35.284223,2023-01-06 04:15:42.202203,0 days 00:00:06.917980,sigmoid,0.25,2,0.5,0.10173112899065018,,,PRUNED
2091,2091,0.039552465081214905,2023-01-06 04:15:42.317700,2023-01-06 04:16:09.324925,0 days 00:00:27.007225,relu,0.2,2,0.75,0.05836394056677818,0.039552465081214905,,PRUNED
2092,2092,0.040057409554719925,2023-01-06 04:16:09.442623,2023-01-06 04:16:36.088839,0 days 00:00:26.646216,tanh,0.35000000000000003,2,1.0,0.040057409554719925,,,PRUNED
2093,2093,0.03872612491250038,2023-01-06 04:16:36.223911,2023-01-06 04:17:02.845031,0 days 00:00:26.621120,tanh,0.0,2,0.95,0.03872612491250038,,,PRUNED
2094,2094,0.07908422499895096,2023-01-06 04:17:02.944391,2023-01-06 04:17:14.986773,0 days 00:00:12.042382,relu,0.35000000000000003,2,0.8,0.07908422499895096,,,PRUNED
2095,2095,0.13779260218143463,2023-01-06 04:17:15.104536,2023-01-06 04:17:49.308028,0 days 00:00:34.203492,tanh,0.0,2,0.95,0.036586325615644455,,,COMPLETE
2096,2096,0.13507084548473358,2023-01-06 04:17:49.420444,2023-01-06 04:18:28.382040,0 days 00:00:38.961596,relu,0.30000000000000004,2,0.95,0.035380151122808456,,,COMPLETE
2097,2097,0.06790342926979065,2023-01-06 04:18:28.508670,2023-01-06 04:18:40.412582,0 days 00:00:11.903912,relu,0.45,2,0.55,0.06790342926979065,,,PRUNED
2098,2098,0.12376691401004791,2023-01-06 04:18:40.531073,2023-01-06 04:18:47.471380,0 days 00:00:06.940307,sigmoid,0.25,2,0.5,0.12376691401004791,,,PRUNED
2099,2099,0.07498805224895477,2023-01-06 04:18:47.579531,2023-01-06 04:18:59.478791,0 days 00:00:11.899260,relu,0.2,2,0.8500000000000001,0.07498805224895477,,,PRUNED
2100,2100,0.06235985457897186,2023-01-06 04:18:59.587952,2023-01-06 04:19:11.827844,0 days 00:00:12.239892,sigmoid,0.05,2,0.6,0.09160220623016357,0.06235985457897186,,PRUNED
2101,2101,0.048432063311338425,2023-01-06 04:19:11.944338,2023-01-06 04:19:38.534136,0 days 00:00:26.589798,tanh,0.4,2,0.95,0.048432063311338425,,,PRUNED
2102,2102,0.05224769935011864,2023-01-06 04:19:38.657959,2023-01-06 04:20:05.464410,0 days 00:00:26.806451,tanh,0.0,3,0.95,0.05224769935011864,,,PRUNED
2103,2103,0.13179531693458557,2023-01-06 04:20:05.611807,2023-01-06 04:20:37.947147,0 days 00:00:32.335340,sigmoid,0.30000000000000004,2,0.5,0.05672892555594444,0.04083254560828209,0.032756589353084564,COMPLETE
2104,2104,0.12214040011167526,2023-01-06 04:20:38.064435,2023-01-06 04:20:45.054050,0 days 00:00:06.989615,sigmoid,0.35000000000000003,2,0.55,0.12214040011167526,,,PRUNED
2105,2105,0.040231797844171524,2023-01-06 04:20:45.182116,2023-01-06 04:21:11.835350,0 days 00:00:26.653234,tanh,0.0,2,1.0,0.040231797844171524,,,PRUNED
2106,2106,0.09723382443189621,2023-01-06 04:21:11.960175,2023-01-06 04:21:19.193121,0 days 00:00:07.232946,sigmoid,0.25,2,0.5,0.09723382443189621,,,PRUNED
2107,2107,0.1322125345468521,2023-01-06 04:21:19.310096,2023-01-06 04:21:26.217575,0 days 00:00:06.907479,sigmoid,0.30000000000000004,2,0.5,0.1322125345468521,,,PRUNED
2108,2108,0.06412635743618011,2023-01-06 04:21:26.315900,2023-01-06 04:21:38.099936,0 days 00:00:11.784036,relu,0.25,2,0.8500000000000001,0.06412635743618011,,,PRUNED
2109,2109,0.15089702606201172,2023-01-06 04:21:38.210165,2023-01-06 04:21:50.781368,0 days 00:00:12.571203,relu,0.5,6,0.6,0.15089702606201172,,,PRUNED
2110,2110,0.11082997173070908,2023-01-06 04:21:50.897150,2023-01-06 04:21:57.856820,0 days 00:00:06.959670,sigmoid,0.30000000000000004,2,0.5,0.11082997173070908,,,PRUNED
2111,2111,0.07174700498580933,2023-01-06 04:21:57.975859,2023-01-06 04:22:09.989197,0 days 00:00:12.013338,sigmoid,0.30000000000000004,2,0.5,0.095620296895504,0.07174700498580933,,PRUNED
2112,2112,0.03450731560587883,2023-01-06 04:22:10.126287,2023-01-06 04:22:37.228056,0 days 00:00:27.101769,sigmoid,0.30000000000000004,2,0.5,0.0674780085682869,0.05188199132680893,0.03450731560587883,PRUNED
2113,2113,0.04041413590312004,2023-01-06 04:22:37.344137,2023-01-06 04:23:03.909097,0 days 00:00:26.564960,tanh,0.0,2,0.9,0.04041413590312004,,,PRUNED
2114,2114,0.036200620234012604,2023-01-06 04:23:04.025594,2023-01-06 04:23:31.074686,0 days 00:00:27.049092,sigmoid,0.30000000000000004,2,0.5,0.08771564066410065,0.050974614918231964,0.036200620234012604,PRUNED
2115,2115,0.08066733181476593,2023-01-06 04:23:31.176520,2023-01-06 04:23:43.147998,0 days 00:00:11.971478,sigmoid,0.30000000000000004,2,0.55,0.07357778400182724,0.08066733181476593,,PRUNED
2116,2116,0.056778617203235626,2023-01-06 04:23:43.287830,2023-01-06 04:23:55.305830,0 days 00:00:12.018000,sigmoid,0.30000000000000004,2,0.5,0.08026252686977386,0.056778617203235626,,PRUNED
2117,2117,0.1072845384478569,2023-01-06 04:23:55.423662,2023-01-06 04:24:02.556275,0 days 00:00:07.132613,sigmoid,0.30000000000000004,2,0.6,0.1072845384478569,,,PRUNED
2118,2118,0.04016396403312683,2023-01-06 04:24:02.707012,2023-01-06 04:24:29.668867,0 days 00:00:26.961855,relu,0.2,2,0.65,0.055367954075336456,0.04016396403312683,,PRUNED
2119,2119,0.06621941179037094,2023-01-06 04:24:29.817006,2023-01-06 04:24:41.743953,0 days 00:00:11.926947,sigmoid,0.30000000000000004,2,0.7,0.06621941179037094,,,PRUNED
2120,2120,0.30741187930107117,2023-01-06 04:24:41.861633,2023-01-06 04:24:59.535509,0 days 00:00:17.673876,tanh,0.0,8,0.9,,,,COMPLETE
2121,2121,0.10525990277528763,2023-01-06 04:24:59.636423,2023-01-06 04:25:06.825357,0 days 00:00:07.188934,sigmoid,0.30000000000000004,6,0.5,0.10525990277528763,,,PRUNED
2122,2122,0.06380591541528702,2023-01-06 04:25:06.933816,2023-01-06 04:25:18.832771,0 days 00:00:11.898955,relu,0.15000000000000002,2,0.75,0.06380591541528702,,,PRUNED
2123,2123,0.1307019740343094,2023-01-06 04:25:18.942235,2023-01-06 04:25:53.349077,0 days 00:00:34.406842,tanh,0.30000000000000004,2,0.95,0.03374418616294861,,,COMPLETE
2124,2124,0.06423168629407883,2023-01-06 04:25:53.467945,2023-01-06 04:26:05.128986,0 days 00:00:11.661041,relu,0.2,2,0.8500000000000001,0.06423168629407883,,,PRUNED
2125,2125,0.1385541409254074,2023-01-06 04:26:05.254352,2023-01-06 04:26:34.575823,0 days 00:00:29.321471,tanh,0.30000000000000004,2,0.95,0.03665793314576149,,,COMPLETE
2126,2126,0.03887122496962547,2023-01-06 04:26:34.696000,2023-01-06 04:27:01.440599,0 days 00:00:26.744599,tanh,0.30000000000000004,2,0.95,0.03887122496962547,,,PRUNED
2127,2127,0.06638889014720917,2023-01-06 04:27:01.579048,2023-01-06 04:27:13.409966,0 days 00:00:11.830918,relu,0.35000000000000003,2,0.7,0.06638889014720917,,,PRUNED
2128,2128,0.03748529031872749,2023-01-06 04:27:13.525132,2023-01-06 04:27:40.316242,0 days 00:00:26.791110,tanh,0.35000000000000003,2,0.65,0.054913733154535294,0.03748529031872749,,PRUNED
2129,2129,0.12513817846775055,2023-01-06 04:27:40.431199,2023-01-06 04:27:47.509361,0 days 00:00:07.078162,sigmoid,0.30000000000000004,2,0.55,0.12513817846775055,,,PRUNED
2130,2130,0.06919920444488525,2023-01-06 04:27:47.611938,2023-01-06 04:27:59.489775,0 days 00:00:11.877837,relu,0.2,2,0.8500000000000001,0.06919920444488525,,,PRUNED
2131,2131,0.12549175322055817,2023-01-06 04:27:59.601930,2023-01-06 04:28:06.556896,0 days 00:00:06.954966,sigmoid,0.30000000000000004,2,0.5,0.12549175322055817,,,PRUNED
2132,2132,0.1320553869009018,2023-01-06 04:28:06.671054,2023-01-06 04:28:13.464708,0 days 00:00:06.793654,sigmoid,0.35000000000000003,2,0.5,0.1320553869009018,,,PRUNED
2133,2133,0.20744101703166962,2023-01-06 04:28:13.773356,2023-01-06 04:28:26.238728,0 days 00:00:12.465372,relu,0.25,7,0.8,0.20744101703166962,,,PRUNED
2134,2134,0.0387120358645916,2023-01-06 04:28:26.338862,2023-01-06 04:28:53.144006,0 days 00:00:26.805144,relu,0.4,2,0.6,0.05686504393815994,0.0387120358645916,,PRUNED
2135,2135,0.08111000806093216,2023-01-06 04:28:53.248388,2023-01-06 04:29:05.335210,0 days 00:00:12.086822,relu,0.45,2,0.55,0.08111000806093216,,,PRUNED
2136,2136,0.13681070506572723,2023-01-06 04:29:05.445381,2023-01-06 04:29:12.368537,0 days 00:00:06.923156,sigmoid,0.30000000000000004,2,0.5,0.13681070506572723,,,PRUNED
2137,2137,0.1241810992360115,2023-01-06 04:29:12.469668,2023-01-06 04:29:19.476621,0 days 00:00:07.006953,sigmoid,0.30000000000000004,2,0.55,0.1241810992360115,,,PRUNED
2138,2138,0.14730125665664673,2023-01-06 04:29:19.586790,2023-01-06 04:29:46.784748,0 days 00:00:27.197958,relu,0.25,2,0.75,0.056897103786468506,0.03210647776722908,,COMPLETE
2139,2139,0.12052835524082184,2023-01-06 04:29:46.904040,2023-01-06 04:29:53.682036,0 days 00:00:06.777996,sigmoid,0.30000000000000004,2,0.5,0.12052835524082184,,,PRUNED
2140,2140,0.12171223014593124,2023-01-06 04:29:53.783170,2023-01-06 04:30:00.798029,0 days 00:00:07.014859,sigmoid,0.30000000000000004,2,0.5,0.12171223014593124,,,PRUNED
2141,2141,0.13032084703445435,2023-01-06 04:30:00.900292,2023-01-06 04:30:08.039267,0 days 00:00:07.138975,sigmoid,0.35000000000000003,2,0.5,0.13032084703445435,,,PRUNED
2142,2142,0.041760560125112534,2023-01-06 04:30:08.141406,2023-01-06 04:30:35.019532,0 days 00:00:26.878126,tanh,0.30000000000000004,2,0.95,0.041760560125112534,,,PRUNED
2143,2143,0.08456386625766754,2023-01-06 04:30:35.121663,2023-01-06 04:30:46.993630,0 days 00:00:11.871967,relu,0.2,2,0.9,0.08456386625766754,,,PRUNED
2144,2144,0.14190466701984406,2023-01-06 04:30:47.104081,2023-01-06 04:30:54.219059,0 days 00:00:07.114978,sigmoid,0.25,2,0.5,0.14190466701984406,,,PRUNED
2145,2145,0.13075359165668488,2023-01-06 04:30:54.320192,2023-01-06 04:31:24.085348,0 days 00:00:29.765156,sigmoid,0.30000000000000004,2,0.55,0.0578644722700119,0.045320816338062286,0.03166738897562027,COMPLETE
2146,2146,0.03742283210158348,2023-01-06 04:31:24.196447,2023-01-06 04:31:50.988705,0 days 00:00:26.792258,relu,0.15000000000000002,2,0.65,0.058852337300777435,0.03742283210158348,,PRUNED
2147,2147,0.08768828958272934,2023-01-06 04:31:51.092844,2023-01-06 04:32:03.347091,0 days 00:00:12.254247,relu,0.30000000000000004,3,0.7,0.08768828958272934,,,PRUNED
2148,2148,0.06277193874120712,2023-01-06 04:32:03.465890,2023-01-06 04:32:15.421168,0 days 00:00:11.955278,sigmoid,0.0,2,0.5,0.08865418285131454,0.06277193874120712,,PRUNED
2149,2149,0.09826184064149857,2023-01-06 04:32:15.540967,2023-01-06 04:32:22.705291,0 days 00:00:07.164324,sigmoid,0.30000000000000004,3,0.6,0.09826184064149857,,,PRUNED
2150,2150,0.11741399019956589,2023-01-06 04:32:22.805080,2023-01-06 04:32:29.745066,0 days 00:00:06.939986,sigmoid,0.30000000000000004,2,0.5,0.11741399019956589,,,PRUNED
2151,2151,0.10187479853630066,2023-01-06 04:32:29.845202,2023-01-06 04:32:36.711203,0 days 00:00:06.866001,sigmoid,0.30000000000000004,2,0.8500000000000001,0.10187479853630066,,,PRUNED
2152,2152,0.13024035096168518,2023-01-06 04:32:36.856004,2023-01-06 04:33:11.686878,0 days 00:00:34.830874,sigmoid,0.30000000000000004,2,0.5,0.06449179351329803,0.04308657348155975,0.0332929827272892,COMPLETE
2153,2153,0.10646437108516693,2023-01-06 04:33:11.822214,2023-01-06 04:33:18.592326,0 days 00:00:06.770112,sigmoid,0.30000000000000004,2,0.5,0.10646437108516693,,,PRUNED
2154,2154,0.07243627309799194,2023-01-06 04:33:18.686128,2023-01-06 04:33:30.431082,0 days 00:00:11.744954,relu,0.4,2,0.8500000000000001,0.07243627309799194,,,PRUNED
2155,2155,0.07126522064208984,2023-01-06 04:33:30.542550,2023-01-06 04:33:42.656069,0 days 00:00:12.113519,sigmoid,0.30000000000000004,2,0.5,0.08087404817342758,0.07126522064208984,,PRUNED
2156,2156,0.07484415173530579,2023-01-06 04:33:42.756279,2023-01-06 04:33:54.571901,0 days 00:00:11.815622,relu,0.45,2,0.5,0.07484415173530579,,,PRUNED
2157,2157,0.13045638799667358,2023-01-06 04:33:54.674017,2023-01-06 04:34:29.357374,0 days 00:00:34.683357,sigmoid,0.30000000000000004,2,0.5,0.066550612449646,0.042997293174266815,0.03305545449256897,COMPLETE
2158,2158,0.05924416705965996,2023-01-06 04:34:29.481371,2023-01-06 04:34:41.652253,0 days 00:00:12.170882,sigmoid,0.30000000000000004,2,0.5,0.09605198353528976,0.05924416705965996,,PRUNED
2159,2159,0.08247656375169754,2023-01-06 04:34:41.752748,2023-01-06 04:34:53.575706,0 days 00:00:11.822958,relu,0.25,2,0.8500000000000001,0.08247656375169754,,,PRUNED
2160,2160,0.13206517696380615,2023-01-06 04:34:53.676238,2023-01-06 04:35:05.899762,0 days 00:00:12.223524,sigmoid,0.30000000000000004,4,0.5,0.07875129580497742,0.13206517696380615,,PRUNED
2161,2161,0.10269712656736374,2023-01-06 04:35:06.001893,2023-01-06 04:35:13.073966,0 days 00:00:07.072073,sigmoid,0.30000000000000004,2,0.5,0.10269712656736374,,,PRUNED
2162,2162,0.06195471063256264,2023-01-06 04:35:13.175343,2023-01-06 04:35:24.897303,0 days 00:00:11.721960,tanh,0.35000000000000003,2,0.7,0.06195471063256264,,,PRUNED
2163,2163,0.056752461940050125,2023-01-06 04:35:25.008769,2023-01-06 04:35:36.914047,0 days 00:00:11.905278,sigmoid,0.30000000000000004,2,0.5,0.09370246529579163,0.056752461940050125,,PRUNED
2164,2164,0.03825204074382782,2023-01-06 04:35:37.033841,2023-01-06 04:36:03.927642,0 days 00:00:26.893801,relu,0.2,2,0.6,0.05266225337982178,0.03825204074382782,,PRUNED
2165,2165,0.21414172649383545,2023-01-06 04:36:04.039108,2023-01-06 04:36:11.328078,0 days 00:00:07.288970,sigmoid,0.30000000000000004,7,0.5,0.21414172649383545,,,PRUNED
2166,2166,0.07480399310588837,2023-01-06 04:36:11.446875,2023-01-06 04:36:23.268362,0 days 00:00:11.821487,relu,0.4,2,0.75,0.07480399310588837,,,PRUNED
2167,2167,0.07261361926794052,2023-01-06 04:36:23.369959,2023-01-06 04:36:35.526223,0 days 00:00:12.156264,relu,0.2,2,0.7,0.07261361926794052,,,PRUNED
2168,2168,0.05677737668156624,2023-01-06 04:36:35.637684,2023-01-06 04:36:47.633624,0 days 00:00:11.995940,sigmoid,0.30000000000000004,2,0.5,0.09402848035097122,0.05677737668156624,,PRUNED
2169,2169,0.04396951198577881,2023-01-06 04:36:47.734759,2023-01-06 04:37:14.422241,0 days 00:00:26.687482,relu,0.30000000000000004,2,0.95,0.04396951198577881,,,PRUNED
2170,2170,0.037652190774679184,2023-01-06 04:37:14.533409,2023-01-06 04:37:41.528501,0 days 00:00:26.995092,tanh,0.35000000000000003,2,0.95,0.037652190774679184,,,PRUNED
2171,2171,0.1303700953722,2023-01-06 04:37:41.655622,2023-01-06 04:37:48.395629,0 days 00:00:06.740007,sigmoid,0.30000000000000004,2,0.5,0.1303700953722,,,PRUNED
2172,2172,0.04323672503232956,2023-01-06 04:37:48.513217,2023-01-06 04:38:15.059249,0 days 00:00:26.546032,tanh,0.0,2,0.95,0.04323672503232956,,,PRUNED
2173,2173,0.2850850522518158,2023-01-06 04:38:15.163278,2023-01-06 04:38:32.575481,0 days 00:00:17.412203,tanh,0.0,5,0.9,,,,COMPLETE
2174,2174,0.07832369208335876,2023-01-06 04:38:32.708522,2023-01-06 04:38:44.374667,0 days 00:00:11.666145,sigmoid,0.4,2,0.65,0.07832369208335876,,,PRUNED
2175,2175,0.03950146213173866,2023-01-06 04:38:44.475410,2023-01-06 04:39:10.846643,0 days 00:00:26.371233,tanh,0.30000000000000004,2,0.95,0.03950146213173866,,,PRUNED
2176,2176,0.12200846523046494,2023-01-06 04:39:10.949773,2023-01-06 04:39:17.938758,0 days 00:00:06.988985,sigmoid,0.35000000000000003,2,0.5,0.12200846523046494,,,PRUNED
2177,2177,0.1238148957490921,2023-01-06 04:39:18.038891,2023-01-06 04:39:24.913226,0 days 00:00:06.874335,sigmoid,0.30000000000000004,2,0.5,0.1238148957490921,,,PRUNED
2178,2178,0.14040547609329224,2023-01-06 04:39:25.014357,2023-01-06 04:39:31.896021,0 days 00:00:06.881664,sigmoid,0.30000000000000004,2,0.5,0.14040547609329224,,,PRUNED
2179,2179,0.1086731031537056,2023-01-06 04:39:32.014822,2023-01-06 04:39:39.112593,0 days 00:00:07.097771,sigmoid,0.30000000000000004,2,0.5,0.1086731031537056,,,PRUNED
2180,2180,0.11257003247737885,2023-01-06 04:39:39.223604,2023-01-06 04:39:46.103262,0 days 00:00:06.879658,sigmoid,0.30000000000000004,2,0.5,0.11257003247737885,,,PRUNED
2181,2181,0.1266137659549713,2023-01-06 04:39:46.203690,2023-01-06 04:39:53.152722,0 days 00:00:06.949032,sigmoid,0.35000000000000003,2,0.5,0.1266137659549713,,,PRUNED
2182,2182,0.07401584833860397,2023-01-06 04:39:53.253895,2023-01-06 04:40:05.335119,0 days 00:00:12.081224,relu,0.4,3,0.8500000000000001,0.07401584833860397,,,PRUNED
2183,2183,0.11099031567573547,2023-01-06 04:40:05.501587,2023-01-06 04:40:12.501237,0 days 00:00:06.999650,sigmoid,0.30000000000000004,2,0.5,0.11099031567573547,,,PRUNED
2184,2184,0.12961430847644806,2023-01-06 04:40:12.612709,2023-01-06 04:40:19.550699,0 days 00:00:06.937990,sigmoid,0.30000000000000004,2,0.5,0.12961430847644806,,,PRUNED
2185,2185,0.11903201788663864,2023-01-06 04:40:19.662163,2023-01-06 04:40:26.764193,0 days 00:00:07.102030,sigmoid,0.30000000000000004,2,0.5,0.11903201788663864,,,PRUNED
2186,2186,0.07514005154371262,2023-01-06 04:40:26.868129,2023-01-06 04:40:38.746357,0 days 00:00:11.878228,relu,0.2,2,0.75,0.07514005154371262,,,PRUNED
2187,2187,0.14855775237083435,2023-01-06 04:40:38.867022,2023-01-06 04:41:03.373413,0 days 00:00:24.506391,sigmoid,0.30000000000000004,2,0.5,0.07022218406200409,0.042134203016757965,,COMPLETE
2188,2188,0.03853822126984596,2023-01-06 04:41:03.494809,2023-01-06 04:41:30.275734,0 days 00:00:26.780925,relu,0.45,2,0.6,0.05689914897084236,0.03853822126984596,,PRUNED
2189,2189,0.04111523926258087,2023-01-06 04:41:30.389795,2023-01-06 04:41:56.956300,0 days 00:00:26.566505,sigmoid,0.25,2,0.9,0.04111523926258087,,,PRUNED
2190,2190,0.10009071975946426,2023-01-06 04:41:57.062400,2023-01-06 04:42:03.931488,0 days 00:00:06.869088,sigmoid,0.30000000000000004,2,0.5,0.10009071975946426,,,PRUNED
2191,2191,0.12173951417207718,2023-01-06 04:42:04.027876,2023-01-06 04:42:11.115269,0 days 00:00:07.087393,sigmoid,0.30000000000000004,2,0.5,0.12173951417207718,,,PRUNED
2192,2192,0.10445316135883331,2023-01-06 04:42:11.226787,2023-01-06 04:42:23.196603,0 days 00:00:11.969816,sigmoid,0.30000000000000004,2,0.9,0.05779067054390907,0.10445316135883331,,PRUNED
2193,2193,0.0675419345498085,2023-01-06 04:42:23.294066,2023-01-06 04:42:34.995776,0 days 00:00:11.701710,relu,0.35000000000000003,2,0.65,0.0675419345498085,,,PRUNED
2194,2194,0.12980325520038605,2023-01-06 04:42:35.110827,2023-01-06 04:42:41.987901,0 days 00:00:06.877074,sigmoid,0.30000000000000004,2,0.5,0.12980325520038605,,,PRUNED
2195,2195,0.1195947676897049,2023-01-06 04:42:42.294807,2023-01-06 04:42:49.211342,0 days 00:00:06.916535,sigmoid,0.35000000000000003,2,0.5,0.1195947676897049,,,PRUNED
2196,2196,0.13363155722618103,2023-01-06 04:42:49.308158,2023-01-06 04:43:21.067990,0 days 00:00:31.759832,tanh,0.2,2,0.95,0.032422102987766266,,,COMPLETE
2197,2197,0.035932257771492004,2023-01-06 04:43:21.177635,2023-01-06 04:43:48.031832,0 days 00:00:26.854197,relu,0.2,2,0.8500000000000001,0.05749129876494408,0.035932257771492004,,PRUNED
2198,2198,0.0379403717815876,2023-01-06 04:43:48.130213,2023-01-06 04:44:14.853767,0 days 00:00:26.723554,tanh,0.25,2,0.95,0.0379403717815876,,,PRUNED
2199,2199,0.08075534552335739,2023-01-06 04:44:14.968823,2023-01-06 04:44:26.978839,0 days 00:00:12.010016,relu,0.25,2,0.75,0.08075534552335739,,,PRUNED
2200,2200,0.08497485518455505,2023-01-06 04:44:27.093888,2023-01-06 04:44:39.102909,0 days 00:00:12.009021,relu,0.4,2,0.8,0.08497485518455505,,,PRUNED
2201,2201,0.06413860619068146,2023-01-06 04:44:39.200303,2023-01-06 04:44:51.085163,0 days 00:00:11.884860,relu,0.5,2,0.65,0.06413860619068146,,,PRUNED
2202,2202,0.05732079595327377,2023-01-06 04:44:51.191644,2023-01-06 04:45:03.567776,0 days 00:00:12.376132,sigmoid,0.30000000000000004,5,0.5,0.06453162431716919,0.05732079595327377,,PRUNED
2203,2203,0.1287885159254074,2023-01-06 04:45:03.691085,2023-01-06 04:45:10.734814,0 days 00:00:07.043729,sigmoid,0.30000000000000004,2,0.5,0.1287885159254074,,,PRUNED
2204,2204,0.039386603981256485,2023-01-06 04:45:10.840553,2023-01-06 04:45:37.580757,0 days 00:00:26.740204,tanh,0.2,2,0.95,0.039386603981256485,,,PRUNED
2205,2205,0.06928146630525589,2023-01-06 04:45:37.696815,2023-01-06 04:45:49.572735,0 days 00:00:11.875920,tanh,0.25,2,0.95,0.06928146630525589,,,PRUNED
2206,2206,0.138761505484581,2023-01-06 04:45:49.679226,2023-01-06 04:45:56.689189,0 days 00:00:07.009963,sigmoid,0.30000000000000004,3,0.5,0.138761505484581,,,PRUNED
2207,2207,0.11388244479894638,2023-01-06 04:45:56.987714,2023-01-06 04:46:03.971303,0 days 00:00:06.983589,sigmoid,0.30000000000000004,2,0.5,0.11388244479894638,,,PRUNED
2208,2208,0.11349397897720337,2023-01-06 04:46:04.067780,2023-01-06 04:46:11.080189,0 days 00:00:07.012409,sigmoid,0.35000000000000003,2,0.5,0.11349397897720337,,,PRUNED
2209,2209,0.03550488129258156,2023-01-06 04:46:11.185908,2023-01-06 04:46:38.385432,0 days 00:00:27.199524,sigmoid,0.30000000000000004,2,0.65,0.0923333391547203,0.05185541883111,0.03550488129258156,PRUNED
2210,2210,0.05636658892035484,2023-01-06 04:46:38.501482,2023-01-06 04:46:50.559487,0 days 00:00:12.058005,sigmoid,0.30000000000000004,2,0.5,0.0921538844704628,0.05636658892035484,,PRUNED
2211,2211,0.0555013008415699,2023-01-06 04:46:50.666083,2023-01-06 04:47:02.633561,0 days 00:00:11.967478,sigmoid,0.30000000000000004,2,0.5,0.09026112407445908,0.0555013008415699,,PRUNED
