,number,value,datetime_start,datetime_complete,duration,params_activation,params_dropout,params_layers,params_shrink,system_attrs_completed_rung_0,system_attrs_completed_rung_1,system_attrs_completed_rung_2,state
2343,2343,0.05827460438013077,2023-01-06 05:19:43.658305,2023-01-06 05:19:55.664303,0 days 00:00:12.005998,sigmoid,0.2,2,0.6,0.09270693361759186,0.05827460438013077,,PRUNED
2344,2344,0.03814108297228813,2023-01-06 05:19:55.758409,2023-01-06 05:20:22.577898,0 days 00:00:26.819489,tanh,0.5,2,0.6,0.05175601318478584,0.03814108297228813,,PRUNED
2345,2345,0.11057250201702118,2023-01-06 05:20:22.699003,2023-01-06 05:20:29.903905,0 days 00:00:07.204902,tanh,0.25,2,0.5,0.11057250201702118,,,PRUNED
2346,2346,0.04487057775259018,2023-01-06 05:20:30.015107,2023-01-06 05:20:56.850291,0 days 00:00:26.835184,sigmoid,0.0,2,0.95,0.04487057775259018,,,PRUNED
2347,2347,0.055238787084817886,2023-01-06 05:20:56.980956,2023-01-06 05:21:08.950662,0 days 00:00:11.969706,sigmoid,0.1,2,0.5,0.08803359419107437,0.055238787084817886,,PRUNED
2348,2348,0.15070906281471252,2023-01-06 05:21:09.072441,2023-01-06 05:21:16.232930,0 days 00:00:07.160489,sigmoid,0.30000000000000004,2,0.5,0.15070906281471252,,,PRUNED
2349,2349,0.06573949009180069,2023-01-06 05:21:16.343089,2023-01-06 05:21:28.315522,0 days 00:00:11.972433,sigmoid,0.0,2,0.95,0.09237726032733917,0.06573949009180069,,PRUNED
2350,2350,0.03762611001729965,2023-01-06 05:21:28.412625,2023-01-06 05:21:55.380102,0 days 00:00:26.967477,tanh,0.45,2,0.65,0.05740940198302269,0.03762611001729965,,PRUNED
2351,2351,0.06406117230653763,2023-01-06 05:21:55.500208,2023-01-06 05:22:07.379182,0 days 00:00:11.878974,tanh,0.4,2,0.8500000000000001,0.06406117230653763,,,PRUNED
2352,2352,0.08086641877889633,2023-01-06 05:22:07.499532,2023-01-06 05:22:19.343929,0 days 00:00:11.844397,tanh,0.35000000000000003,2,0.7,0.08086641877889633,,,PRUNED
2353,2353,0.14354391396045685,2023-01-06 05:22:19.473876,2023-01-06 05:22:26.594998,0 days 00:00:07.121122,sigmoid,0.30000000000000004,2,0.5,0.14354391396045685,,,PRUNED
2354,2354,0.134462371468544,2023-01-06 05:22:26.703141,2023-01-06 05:22:33.685882,0 days 00:00:06.982741,sigmoid,0.1,2,0.5,0.134462371468544,,,PRUNED
2355,2355,0.07568256556987762,2023-01-06 05:22:33.807595,2023-01-06 05:22:45.650237,0 days 00:00:11.842642,sigmoid,0.4,2,0.6,0.07568256556987762,,,PRUNED
2356,2356,0.12884661555290222,2023-01-06 05:22:45.770050,2023-01-06 05:22:52.950676,0 days 00:00:07.180626,tanh,0.25,2,0.65,0.12884661555290222,,,PRUNED
2357,2357,0.15141761302947998,2023-01-06 05:22:53.081114,2023-01-06 05:23:17.492958,0 days 00:00:24.411844,tanh,0.05,2,0.5,0.042643558233976364,,,COMPLETE
2358,2358,0.06423208862543106,2023-01-06 05:23:17.603902,2023-01-06 05:23:29.297637,0 days 00:00:11.693735,tanh,0.25,2,0.65,0.06423208862543106,,,PRUNED
2359,2359,0.11565376818180084,2023-01-06 05:23:29.424315,2023-01-06 05:23:41.546949,0 days 00:00:12.122634,relu,0.4,3,1.0,0.11565376818180084,,,PRUNED
2360,2360,0.04194319620728493,2023-01-06 05:23:41.674378,2023-01-06 05:24:08.352207,0 days 00:00:26.677829,sigmoid,0.0,2,0.9,0.04194319620728493,,,PRUNED
2361,2361,0.040834952145814896,2023-01-06 05:24:08.480646,2023-01-06 05:24:34.933585,0 days 00:00:26.452939,tanh,0.25,2,0.95,0.040834952145814896,,,PRUNED
2362,2362,0.14178533852100372,2023-01-06 05:24:35.061938,2023-01-06 05:24:42.208908,0 days 00:00:07.146970,sigmoid,0.0,2,0.5,0.14178533852100372,,,PRUNED
2363,2363,0.10184218734502792,2023-01-06 05:24:42.311001,2023-01-06 05:24:49.316723,0 days 00:00:07.005722,sigmoid,0.2,2,0.6,0.10184218734502792,,,PRUNED
2364,2364,0.07553229480981827,2023-01-06 05:24:49.427891,2023-01-06 05:25:01.107489,0 days 00:00:11.679598,tanh,0.30000000000000004,2,0.8500000000000001,0.07553229480981827,,,PRUNED
2365,2365,0.13492286205291748,2023-01-06 05:25:01.235934,2023-01-06 05:25:08.340264,0 days 00:00:07.104330,sigmoid,0.30000000000000004,2,0.55,0.13492286205291748,,,PRUNED
2366,2366,0.057482026517391205,2023-01-06 05:25:08.443711,2023-01-06 05:25:20.321676,0 days 00:00:11.877965,sigmoid,0.0,2,0.5,0.08968789875507355,0.057482026517391205,,PRUNED
2367,2367,0.06956750154495239,2023-01-06 05:25:20.433447,2023-01-06 05:25:32.220944,0 days 00:00:11.787497,relu,0.35000000000000003,2,0.65,0.06956750154495239,,,PRUNED
2368,2368,0.11026101559400558,2023-01-06 05:25:32.351351,2023-01-06 05:25:39.429537,0 days 00:00:07.078186,tanh,0.25,2,0.5,0.11026101559400558,,,PRUNED
2369,2369,0.05707821249961853,2023-01-06 05:25:39.541315,2023-01-06 05:25:51.536938,0 days 00:00:11.995623,sigmoid,0.1,2,0.5,0.0892644003033638,0.05707821249961853,,PRUNED
2370,2370,0.11794795095920563,2023-01-06 05:25:51.664372,2023-01-06 05:25:58.804044,0 days 00:00:07.139672,sigmoid,0.2,2,0.5,0.11794795095920563,,,PRUNED
2371,2371,0.12605029344558716,2023-01-06 05:25:58.897241,2023-01-06 05:26:05.827693,0 days 00:00:06.930452,sigmoid,0.25,2,0.5,0.12605029344558716,,,PRUNED
2372,2372,0.07830650359392166,2023-01-06 05:26:05.946616,2023-01-06 05:26:17.793269,0 days 00:00:11.846653,relu,0.25,2,0.7,0.07830650359392166,,,PRUNED
2373,2373,0.06814539432525635,2023-01-06 05:26:17.913359,2023-01-06 05:26:29.908993,0 days 00:00:11.995634,sigmoid,0.45,2,0.6,0.06814539432525635,,,PRUNED
2374,2374,0.0355512909591198,2023-01-06 05:26:30.018759,2023-01-06 05:26:56.823586,0 days 00:00:26.804827,sigmoid,0.1,2,0.55,0.07587679475545883,0.0478581003844738,0.0355512909591198,PRUNED
2375,2375,0.07211804389953613,2023-01-06 05:26:56.933355,2023-01-06 05:27:08.863756,0 days 00:00:11.930401,tanh,0.2,2,0.5,0.0769319087266922,0.07211804389953613,,PRUNED
2376,2376,0.11336171627044678,2023-01-06 05:27:09.010284,2023-01-06 05:27:16.181202,0 days 00:00:07.170918,sigmoid,0.25,3,0.5,0.11336171627044678,,,PRUNED
2377,2377,0.03886221721768379,2023-01-06 05:27:16.281944,2023-01-06 05:27:42.810712,0 days 00:00:26.528768,sigmoid,0.0,2,1.0,0.03886221721768379,,,PRUNED
2378,2378,0.09862712770700455,2023-01-06 05:27:42.930815,2023-01-06 05:27:49.990825,0 days 00:00:07.060010,sigmoid,0.30000000000000004,2,0.5,0.09862712770700455,,,PRUNED
2379,2379,0.054636452347040176,2023-01-06 05:27:50.088709,2023-01-06 05:28:02.001840,0 days 00:00:11.913131,sigmoid,0.05,2,0.5,0.09412012994289398,0.054636452347040176,,PRUNED
2380,2380,0.12525400519371033,2023-01-06 05:28:02.120990,2023-01-06 05:28:33.874948,0 days 00:00:31.753958,sigmoid,0.0,2,0.55,0.054255224764347076,0.04322541505098343,0.02961157076060772,COMPLETE
2381,2381,0.08361715823411942,2023-01-06 05:28:34.006562,2023-01-06 05:28:46.382917,0 days 00:00:12.376355,sigmoid,0.0,4,0.55,0.06929777562618256,0.08361715823411942,,PRUNED
2382,2382,0.14470839500427246,2023-01-06 05:28:46.491591,2023-01-06 05:29:18.185204,0 days 00:00:31.693613,tanh,0.0,2,0.95,0.03443100303411484,,,COMPLETE
2383,2383,0.06839409470558167,2023-01-06 05:29:18.312490,2023-01-06 05:29:30.062998,0 days 00:00:11.750508,relu,0.4,2,0.8500000000000001,0.06839409470558167,,,PRUNED
2384,2384,0.03974722698330879,2023-01-06 05:29:30.171564,2023-01-06 05:29:57.085812,0 days 00:00:26.914248,sigmoid,0.30000000000000004,2,0.95,0.03974722698330879,,,PRUNED
2385,2385,0.12405688315629959,2023-01-06 05:29:57.207436,2023-01-06 05:30:04.151939,0 days 00:00:06.944503,tanh,0.0,2,0.55,0.12405688315629959,,,PRUNED
2386,2386,0.1531876176595688,2023-01-06 05:30:04.271945,2023-01-06 05:30:33.540238,0 days 00:00:29.268293,tanh,0.0,2,0.9,0.03716381639242172,,,COMPLETE
2387,2387,0.11992065608501434,2023-01-06 05:30:33.646366,2023-01-06 05:30:40.741704,0 days 00:00:07.095338,sigmoid,0.0,2,0.55,0.11992065608501434,,,PRUNED
2388,2388,0.11904142796993256,2023-01-06 05:30:40.859806,2023-01-06 05:30:47.782917,0 days 00:00:06.923111,sigmoid,0.0,2,0.55,0.11904142796993256,,,PRUNED
2389,2389,0.1344422847032547,2023-01-06 05:30:47.899920,2023-01-06 05:30:54.923025,0 days 00:00:07.023105,sigmoid,0.0,2,0.55,0.1344422847032547,,,PRUNED
2390,2390,0.13448867201805115,2023-01-06 05:30:55.223529,2023-01-06 05:31:02.214876,0 days 00:00:06.991347,sigmoid,0.0,2,0.55,0.13448867201805115,,,PRUNED
2391,2391,0.06551395356655121,2023-01-06 05:31:02.336182,2023-01-06 05:31:14.229881,0 days 00:00:11.893699,relu,0.45,2,0.65,0.06551395356655121,,,PRUNED
2392,2392,0.041316453367471695,2023-01-06 05:31:14.357221,2023-01-06 05:31:41.110144,0 days 00:00:26.752923,sigmoid,0.0,2,0.95,0.041316453367471695,,,PRUNED
2393,2393,0.07276445627212524,2023-01-06 05:31:41.238484,2023-01-06 05:31:53.443528,0 days 00:00:12.205044,tanh,0.0,2,0.55,0.09455656260251999,0.07276445627212524,,PRUNED
2394,2394,0.05926685407757759,2023-01-06 05:31:53.573875,2023-01-06 05:32:05.600938,0 days 00:00:12.027063,sigmoid,0.0,2,0.55,0.08950800448656082,0.05926685407757759,,PRUNED
2395,2395,0.04192488268017769,2023-01-06 05:32:05.719938,2023-01-06 05:32:32.564513,0 days 00:00:26.844575,sigmoid,0.0,2,1.0,0.04192488268017769,,,PRUNED
2396,2396,0.037089116871356964,2023-01-06 05:32:32.691860,2023-01-06 05:32:59.520784,0 days 00:00:26.828924,relu,0.25,2,0.7,0.05842132121324539,0.037089116871356964,,PRUNED
2397,2397,0.17006736993789673,2023-01-06 05:32:59.630169,2023-01-06 05:33:21.512972,0 days 00:00:21.882803,tanh,0.0,3,0.9,,,,COMPLETE
2398,2398,0.0568794421851635,2023-01-06 05:33:21.650113,2023-01-06 05:33:33.844743,0 days 00:00:12.194630,sigmoid,0.0,2,0.55,0.05721430853009224,0.0568794421851635,,PRUNED
2399,2399,0.12113033980131149,2023-01-06 05:33:33.969509,2023-01-06 05:33:40.952494,0 days 00:00:06.982985,sigmoid,0.0,2,0.55,0.12113033980131149,,,PRUNED
2400,2400,0.061731502413749695,2023-01-06 05:33:41.065607,2023-01-06 05:33:53.076000,0 days 00:00:12.010393,sigmoid,0.0,2,0.55,0.08625753223896027,0.061731502413749695,,PRUNED
2401,2401,0.06380689144134521,2023-01-06 05:33:53.185393,2023-01-06 05:34:05.258397,0 days 00:00:12.073004,relu,0.15000000000000002,2,0.8500000000000001,0.06380689144134521,,,PRUNED
2402,2402,0.04139422997832298,2023-01-06 05:34:05.359738,2023-01-06 05:34:32.030338,0 days 00:00:26.670600,sigmoid,0.0,2,0.95,0.04139422997832298,,,PRUNED
2403,2403,0.0559815913438797,2023-01-06 05:34:32.149343,2023-01-06 05:34:59.246084,0 days 00:00:27.096741,tanh,0.0,4,0.5,0.0559815913438797,,,PRUNED
2404,2404,0.12943466007709503,2023-01-06 05:34:59.356587,2023-01-06 05:35:31.635493,0 days 00:00:32.278906,tanh,0.0,2,0.6,0.07832816988229752,0.0450512170791626,0.03194866701960564,COMPLETE
2405,2405,0.09701326489448547,2023-01-06 05:35:31.748517,2023-01-06 05:35:38.551962,0 days 00:00:06.803445,tanh,0.0,2,0.6,0.09701326489448547,,,PRUNED
2406,2406,0.11860162019729614,2023-01-06 05:35:38.677566,2023-01-06 05:35:45.801280,0 days 00:00:07.123714,tanh,0.0,2,0.6,0.11860162019729614,,,PRUNED
2407,2407,0.05497700348496437,2023-01-06 05:35:45.919672,2023-01-06 05:35:58.024726,0 days 00:00:12.105054,tanh,0.0,2,0.6,0.0817108303308487,0.05497700348496437,,PRUNED
2408,2408,0.06736166775226593,2023-01-06 05:35:58.153069,2023-01-06 05:36:10.307114,0 days 00:00:12.154045,relu,0.35000000000000003,5,0.65,0.06736166775226593,,,PRUNED
2409,2409,0.14588797092437744,2023-01-06 05:36:10.433453,2023-01-06 05:36:37.729742,0 days 00:00:27.296289,tanh,0.4,2,0.7,0.05317128449678421,0.03290540352463722,,COMPLETE
2410,2410,0.12666362524032593,2023-01-06 05:36:37.867356,2023-01-06 05:36:44.879907,0 days 00:00:07.012551,tanh,0.0,2,0.6,0.12666362524032593,,,PRUNED
2411,2411,0.14856895804405212,2023-01-06 05:36:45.023326,2023-01-06 05:36:52.216727,0 days 00:00:07.193401,tanh,0.0,2,0.6,0.14856895804405212,,,PRUNED
2412,2412,0.08206628262996674,2023-01-06 05:36:52.399601,2023-01-06 05:37:04.402954,0 days 00:00:12.003353,relu,0.4,2,0.6,0.08206628262996674,,,PRUNED
2413,2413,0.033724214881658554,2023-01-06 05:37:04.535951,2023-01-06 05:37:31.717029,0 days 00:00:27.181078,tanh,0.0,2,0.6,0.07798220217227936,0.051554374396800995,0.033724214881658554,PRUNED
2414,2414,0.12407075613737106,2023-01-06 05:37:31.821529,2023-01-06 05:37:39.000291,0 days 00:00:07.178762,tanh,0.0,2,0.65,0.12407075613737106,,,PRUNED
2415,2415,0.11749047785997391,2023-01-06 05:37:39.123956,2023-01-06 05:37:46.150740,0 days 00:00:07.026784,tanh,0.0,2,0.6,0.11749047785997391,,,PRUNED
2416,2416,0.14429186284542084,2023-01-06 05:37:46.248406,2023-01-06 05:37:53.257528,0 days 00:00:07.009122,tanh,0.0,3,0.55,0.14429186284542084,,,PRUNED
2417,2417,0.07732308655977249,2023-01-06 05:37:53.374864,2023-01-06 05:38:05.489923,0 days 00:00:12.115059,relu,0.25,2,0.55,0.07732308655977249,,,PRUNED
2418,2418,0.04081154242157936,2023-01-06 05:38:05.614584,2023-01-06 05:38:32.245192,0 days 00:00:26.630608,sigmoid,0.0,2,0.95,0.04081154242157936,,,PRUNED
2419,2419,0.13253089785575867,2023-01-06 05:38:32.352193,2023-01-06 05:38:39.363315,0 days 00:00:07.011122,tanh,0.0,2,0.55,0.13253089785575867,,,PRUNED
2420,2420,0.06528976559638977,2023-01-06 05:38:39.484768,2023-01-06 05:38:51.286395,0 days 00:00:11.801627,relu,0.4,2,0.8500000000000001,0.06528976559638977,,,PRUNED
2421,2421,0.13795380294322968,2023-01-06 05:38:51.391932,2023-01-06 05:39:20.674101,0 days 00:00:29.282169,tanh,0.05,2,0.75,0.035776667296886444,,,COMPLETE
2422,2422,0.1411934345960617,2023-01-06 05:39:20.818968,2023-01-06 05:39:48.028495,0 days 00:00:27.209527,tanh,0.0,2,0.65,0.06506043672561646,0.052102454006671906,0.03322135657072067,COMPLETE
2423,2423,0.13053114712238312,2023-01-06 05:39:48.161376,2023-01-06 05:40:19.934207,0 days 00:00:31.772831,relu,0.4,2,0.8500000000000001,0.043716587126255035,0.032138727605342865,,COMPLETE
2424,2424,0.06778962910175323,2023-01-06 05:40:20.066252,2023-01-06 05:40:32.136969,0 days 00:00:12.070717,tanh,0.0,2,0.6,0.07607844471931458,0.06778962910175323,,PRUNED
2425,2425,0.07069217413663864,2023-01-06 05:40:32.251504,2023-01-06 05:40:44.369361,0 days 00:00:12.117857,relu,0.30000000000000004,2,0.9,0.07069217413663864,,,PRUNED
2426,2426,0.12293019145727158,2023-01-06 05:40:44.484695,2023-01-06 05:40:51.485485,0 days 00:00:07.000790,tanh,0.0,2,0.55,0.12293019145727158,,,PRUNED
2427,2427,0.0629371628165245,2023-01-06 05:40:51.607144,2023-01-06 05:41:03.484570,0 days 00:00:11.877426,relu,0.35000000000000003,2,0.8500000000000001,0.0629371628165245,,,PRUNED
2428,2428,0.1882607340812683,2023-01-06 05:41:03.599568,2023-01-06 05:41:11.109977,0 days 00:00:07.510409,tanh,0.0,7,0.55,0.1882607340812683,,,PRUNED
2429,2429,0.06826265156269073,2023-01-06 05:41:11.264192,2023-01-06 05:41:23.124716,0 days 00:00:11.860524,relu,0.4,2,0.7,0.06826265156269073,,,PRUNED
2430,2430,0.03545317053794861,2023-01-06 05:41:23.248378,2023-01-06 05:41:50.288312,0 days 00:00:27.039934,tanh,0.4,2,0.65,0.04497586190700531,0.03545317053794861,,PRUNED
2431,2431,0.11275676637887955,2023-01-06 05:41:50.403625,2023-01-06 05:41:57.348083,0 days 00:00:06.944458,tanh,0.0,2,0.55,0.11275676637887955,,,PRUNED
2432,2432,0.05936191603541374,2023-01-06 05:41:57.452077,2023-01-06 05:42:09.504480,0 days 00:00:12.052403,tanh,0.0,2,0.65,0.09547162055969238,0.05936191603541374,,PRUNED
2433,2433,0.055562879890203476,2023-01-06 05:42:09.627149,2023-01-06 05:42:21.886864,0 days 00:00:12.259715,tanh,0.0,2,0.6,0.0775439515709877,0.055562879890203476,,PRUNED
2434,2434,0.03795210272073746,2023-01-06 05:42:22.002248,2023-01-06 05:42:48.876450,0 days 00:00:26.874202,relu,0.45,2,0.8500000000000001,0.06140872463583946,0.03795210272073746,,PRUNED
2435,2435,0.05216895416378975,2023-01-06 05:42:48.991066,2023-01-06 05:43:15.632725,0 days 00:00:26.641659,sigmoid,0.0,2,0.9,0.05216895416378975,,,PRUNED
2436,2436,0.1370413452386856,2023-01-06 05:43:15.749047,2023-01-06 05:43:28.356745,0 days 00:00:12.607698,relu,0.2,7,0.65,0.1370413452386856,,,PRUNED
2437,2437,0.12864410877227783,2023-01-06 05:43:28.471071,2023-01-06 05:43:35.472945,0 days 00:00:07.001874,tanh,0.0,2,0.6,0.12864410877227783,,,PRUNED
2438,2438,0.07698965072631836,2023-01-06 05:43:35.627061,2023-01-06 05:43:47.771910,0 days 00:00:12.144849,relu,0.4,2,0.6,0.07698965072631836,,,PRUNED
2439,2439,0.05846408009529114,2023-01-06 05:43:47.887203,2023-01-06 05:43:59.987645,0 days 00:00:12.100442,tanh,0.0,2,0.55,0.0826648697257042,0.05846408009529114,,PRUNED
2440,2440,0.10097141563892365,2023-01-06 05:44:00.099864,2023-01-06 05:44:07.063095,0 days 00:00:06.963231,tanh,0.0,2,0.55,0.10097141563892365,,,PRUNED
2441,2441,0.12814471125602722,2023-01-06 05:44:07.175429,2023-01-06 05:44:14.445865,0 days 00:00:07.270436,tanh,0.0,2,0.55,0.12814471125602722,,,PRUNED
2442,2442,0.13043451309204102,2023-01-06 05:44:14.583187,2023-01-06 05:44:46.742106,0 days 00:00:32.158919,tanh,0.05,2,0.65,0.07170641422271729,0.04764449596405029,0.031113604083657265,COMPLETE
2443,2443,0.24582235515117645,2023-01-06 05:44:46.841243,2023-01-06 05:44:59.386974,0 days 00:00:12.545731,relu,0.25,8,0.65,0.24582235515117645,,,PRUNED
2444,2444,0.12385343015193939,2023-01-06 05:44:59.526936,2023-01-06 05:45:06.404106,0 days 00:00:06.877170,tanh,0.05,2,0.65,0.12385343015193939,,,PRUNED
2445,2445,0.04144497215747833,2023-01-06 05:45:06.553784,2023-01-06 05:45:33.066719,0 days 00:00:26.512935,relu,0.25,2,0.95,0.04144497215747833,,,PRUNED
2446,2446,0.1302993893623352,2023-01-06 05:45:33.179162,2023-01-06 05:45:40.308890,0 days 00:00:07.129728,tanh,0.05,2,0.65,0.1302993893623352,,,PRUNED
2447,2447,0.13026739656925201,2023-01-06 05:45:40.413955,2023-01-06 05:46:12.337519,0 days 00:00:31.923564,tanh,0.05,2,0.65,0.06017350032925606,0.04539165273308754,0.031242497265338898,COMPLETE
2448,2448,0.036270130425691605,2023-01-06 05:46:12.460143,2023-01-06 05:46:39.186627,0 days 00:00:26.726484,relu,0.0,2,0.55,0.06024767830967903,0.036270130425691605,,PRUNED
2449,2449,0.12850362062454224,2023-01-06 05:46:39.281405,2023-01-06 05:46:46.362248,0 days 00:00:07.080843,tanh,0.05,2,0.65,0.12850362062454224,,,PRUNED
2450,2450,0.12790396809577942,2023-01-06 05:46:46.481849,2023-01-06 05:46:53.395867,0 days 00:00:06.914018,tanh,0.05,2,0.65,0.12790396809577942,,,PRUNED
2451,2451,0.13344618678092957,2023-01-06 05:46:53.496001,2023-01-06 05:47:20.628905,0 days 00:00:27.132904,tanh,0.05,2,0.65,0.05736085772514343,0.040895894169807434,0.029436571523547173,COMPLETE
2452,2452,0.12705233693122864,2023-01-06 05:47:20.746561,2023-01-06 05:47:27.818217,0 days 00:00:07.071656,tanh,0.05,2,0.65,0.12705233693122864,,,PRUNED
2453,2453,0.0752529427409172,2023-01-06 05:47:27.928673,2023-01-06 05:47:39.857960,0 days 00:00:11.929287,tanh,0.2,2,0.7,0.0752529427409172,,,PRUNED
2454,2454,0.10541941970586777,2023-01-06 05:47:39.976750,2023-01-06 05:47:47.157393,0 days 00:00:07.180643,tanh,0.05,2,0.65,0.10541941970586777,,,PRUNED
2455,2455,0.11682797968387604,2023-01-06 05:47:47.270256,2023-01-06 05:47:54.208168,0 days 00:00:06.937912,tanh,0.05,2,0.65,0.11682797968387604,,,PRUNED
2456,2456,0.07274717092514038,2023-01-06 05:47:54.326639,2023-01-06 05:48:06.189265,0 days 00:00:11.862626,relu,0.45,2,0.8500000000000001,0.07274717092514038,,,PRUNED
2457,2457,0.13062387704849243,2023-01-06 05:48:06.284084,2023-01-06 05:48:43.372899,0 days 00:00:37.088815,relu,0.35000000000000003,2,0.7,0.04408952593803406,0.03472670912742615,,COMPLETE
2458,2458,0.11773115396499634,2023-01-06 05:48:43.483858,2023-01-06 05:48:55.793816,0 days 00:00:12.309958,tanh,0.05,5,0.65,0.07862702012062073,0.11773115396499634,,PRUNED
2459,2459,0.07672351598739624,2023-01-06 05:48:55.921043,2023-01-06 05:49:08.134452,0 days 00:00:12.213409,tanh,0.05,2,0.65,0.06659750640392303,0.07672351598739624,,PRUNED
2460,2460,0.09392669796943665,2023-01-06 05:49:08.236620,2023-01-06 05:49:20.183565,0 days 00:00:11.946945,relu,0.35000000000000003,2,0.7,0.09392669796943665,,,PRUNED
2461,2461,0.036381665617227554,2023-01-06 05:49:20.295010,2023-01-06 05:49:47.014848,0 days 00:00:26.719838,relu,0.35000000000000003,2,0.7,0.05407155305147171,0.036381665617227554,,PRUNED
2462,2462,0.12947121262550354,2023-01-06 05:49:47.116948,2023-01-06 05:49:54.248463,0 days 00:00:07.131515,tanh,0.05,2,0.65,0.12947121262550354,,,PRUNED
2463,2463,0.09995736181735992,2023-01-06 05:49:54.385052,2023-01-06 05:50:01.338732,0 days 00:00:06.953680,tanh,0.05,2,0.65,0.09995736181735992,,,PRUNED
2464,2464,0.1138310357928276,2023-01-06 05:50:01.447184,2023-01-06 05:50:08.413136,0 days 00:00:06.965952,tanh,0.05,2,0.65,0.1138310357928276,,,PRUNED
2465,2465,0.1433250904083252,2023-01-06 05:50:08.522627,2023-01-06 05:50:35.687890,0 days 00:00:27.165263,relu,0.35000000000000003,2,0.7,0.052720289677381516,0.031067444011569023,,COMPLETE
2466,2466,0.0822310596704483,2023-01-06 05:50:35.818639,2023-01-06 05:50:47.810153,0 days 00:00:11.991514,tanh,0.05,2,0.65,0.07493283599615097,0.0822310596704483,,PRUNED
2467,2467,0.04123639687895775,2023-01-06 05:50:47.912263,2023-01-06 05:51:14.532096,0 days 00:00:26.619833,sigmoid,0.0,2,0.95,0.04123639687895775,,,PRUNED
2468,2468,0.12814289331436157,2023-01-06 05:51:14.636171,2023-01-06 05:51:21.824214,0 days 00:00:07.188043,tanh,0.0,2,0.65,0.12814289331436157,,,PRUNED
2469,2469,0.12466118484735489,2023-01-06 05:51:21.949316,2023-01-06 05:51:28.898656,0 days 00:00:06.949340,tanh,0.05,2,0.65,0.12466118484735489,,,PRUNED
2470,2470,0.11907503008842468,2023-01-06 05:51:29.014931,2023-01-06 05:51:36.157348,0 days 00:00:07.142417,tanh,0.05,2,0.65,0.11907503008842468,,,PRUNED
2471,2471,0.08449787646532059,2023-01-06 05:51:36.289360,2023-01-06 05:51:48.280495,0 days 00:00:11.991135,relu,0.35000000000000003,2,0.7,0.08449787646532059,,,PRUNED
2472,2472,0.04355606809258461,2023-01-06 05:51:48.405092,2023-01-06 05:52:15.111763,0 days 00:00:26.706671,tanh,0.2,2,0.9,0.04355606809258461,,,PRUNED
2473,2473,0.13058479130268097,2023-01-06 05:52:15.234363,2023-01-06 05:52:22.661184,0 days 00:00:07.426821,tanh,0.05,3,0.65,0.13058479130268097,,,PRUNED
2474,2474,0.08031094819307327,2023-01-06 05:52:22.776444,2023-01-06 05:52:34.718588,0 days 00:00:11.942144,relu,0.35000000000000003,2,0.7,0.08031094819307327,,,PRUNED
2475,2475,0.07571803033351898,2023-01-06 05:52:34.867162,2023-01-06 05:52:46.784037,0 days 00:00:11.916875,relu,0.35000000000000003,2,0.7,0.07571803033351898,,,PRUNED
