,number,value,datetime_start,datetime_complete,duration,params_activation,params_dropout,params_layers,params_shrink,system_attrs_completed_rung_0,system_attrs_completed_rung_1,system_attrs_completed_rung_2,state
1047,1047,0.11699753254652023,2023-01-05 23:37:09.002946,2023-01-05 23:37:16.116151,0 days 00:00:07.113205,relu,0.30000000000000004,2,0.5,0.11699753254652023,,,PRUNED
1048,1048,0.10851255804300308,2023-01-05 23:37:16.226694,2023-01-05 23:37:23.048929,0 days 00:00:06.822235,tanh,0.2,2,0.5,0.10851255804300308,,,PRUNED
1049,1049,0.07150481641292572,2023-01-05 23:37:23.167141,2023-01-05 23:37:34.889697,0 days 00:00:11.722556,relu,0.4,2,0.65,0.07150481641292572,,,PRUNED
1050,1050,0.12220990657806396,2023-01-05 23:37:35.011300,2023-01-05 23:37:41.897507,0 days 00:00:06.886207,sigmoid,0.25,2,0.5,0.12220990657806396,,,PRUNED
1051,1051,0.05749930813908577,2023-01-05 23:37:42.001439,2023-01-05 23:37:54.088236,0 days 00:00:12.086797,relu,0.2,2,0.5,0.08772853016853333,0.05749930813908577,,PRUNED
1052,1052,0.03449728339910507,2023-01-05 23:37:54.192177,2023-01-05 23:38:20.844536,0 days 00:00:26.652359,sigmoid,0.2,2,0.5,0.09068673849105835,0.05429830029606819,0.03449728339910507,PRUNED
1053,1053,0.042828042060136795,2023-01-05 23:38:20.967148,2023-01-05 23:38:47.559178,0 days 00:00:26.592030,sigmoid,0.0,2,0.7,0.042828042060136795,,,PRUNED
1054,1054,0.1338714063167572,2023-01-05 23:38:47.671450,2023-01-05 23:38:54.675304,0 days 00:00:07.003854,relu,0.25,2,0.5,0.1338714063167572,,,PRUNED
1055,1055,0.1308574229478836,2023-01-05 23:38:54.794903,2023-01-05 23:39:29.067155,0 days 00:00:34.272252,sigmoid,0.25,2,0.5,0.08110741525888443,0.051584456115961075,0.032321058213710785,COMPLETE
1056,1056,0.03840258717536926,2023-01-05 23:39:29.185642,2023-01-05 23:39:55.678995,0 days 00:00:26.493353,sigmoid,0.0,2,0.8500000000000001,0.03840258717536926,,,PRUNED
1057,1057,0.04103725403547287,2023-01-05 23:39:55.799610,2023-01-05 23:40:22.502023,0 days 00:00:26.702413,sigmoid,0.0,2,0.8500000000000001,0.04103725403547287,,,PRUNED
1058,1058,0.045465368777513504,2023-01-05 23:40:22.621574,2023-01-05 23:40:49.224926,0 days 00:00:26.603352,sigmoid,0.0,2,0.65,0.045465368777513504,,,PRUNED
1059,1059,0.07970519363880157,2023-01-05 23:40:49.328876,2023-01-05 23:41:00.965709,0 days 00:00:11.636833,relu,0.35000000000000003,2,0.8500000000000001,0.07970519363880157,,,PRUNED
1060,1060,0.10792063176631927,2023-01-05 23:41:01.095652,2023-01-05 23:41:07.915178,0 days 00:00:06.819526,tanh,0.25,2,0.5,0.10792063176631927,,,PRUNED
1061,1061,0.13537666201591492,2023-01-05 23:41:08.026454,2023-01-05 23:41:14.964644,0 days 00:00:06.938190,sigmoid,0.25,2,0.5,0.13537666201591492,,,PRUNED
1062,1062,0.0724649429321289,2023-01-05 23:41:15.094585,2023-01-05 23:41:26.897071,0 days 00:00:11.802486,relu,0.25,2,0.8500000000000001,0.0724649429321289,,,PRUNED
1063,1063,0.08654478937387466,2023-01-05 23:41:27.009360,2023-01-05 23:41:38.796177,0 days 00:00:11.786817,relu,0.4,2,0.8500000000000001,0.08654478937387466,,,PRUNED
1064,1064,0.1316276490688324,2023-01-05 23:41:38.916771,2023-01-05 23:42:08.455040,0 days 00:00:29.538269,relu,0.25,2,0.5,0.05886191874742508,0.043306779116392136,0.03215447813272476,COMPLETE
1065,1065,0.06558670103549957,2023-01-05 23:42:08.574532,2023-01-05 23:42:20.668706,0 days 00:00:12.094174,tanh,0.45,2,0.6,0.06558670103549957,,,PRUNED
1066,1066,0.23133602738380432,2023-01-05 23:42:20.779156,2023-01-05 23:42:43.073415,0 days 00:00:22.294259,sigmoid,0.0,5,0.95,,,,COMPLETE
1067,1067,0.10205528140068054,2023-01-05 23:42:43.207234,2023-01-05 23:42:49.965760,0 days 00:00:06.758526,sigmoid,0.25,2,0.5,0.10205528140068054,,,PRUNED
1068,1068,0.1526310294866562,2023-01-05 23:42:50.079030,2023-01-05 23:43:19.454704,0 days 00:00:29.375674,sigmoid,0.0,2,0.9,0.034558843821287155,,,COMPLETE
1069,1069,0.04296909645199776,2023-01-05 23:43:19.579277,2023-01-05 23:43:47.353067,0 days 00:00:27.773790,sigmoid,0.0,2,0.7,0.04296909645199776,,,PRUNED
1070,1070,0.05873742327094078,2023-01-05 23:43:47.457905,2023-01-05 23:43:59.318819,0 days 00:00:11.860914,relu,0.25,2,0.8500000000000001,0.08121515065431595,0.05873742327094078,,PRUNED
1071,1071,0.034386858344078064,2023-01-05 23:43:59.426376,2023-01-05 23:44:26.325486,0 days 00:00:26.899110,sigmoid,0.25,2,0.5,0.08343926817178726,0.05171806737780571,0.034386858344078064,PRUNED
1072,1072,0.12828722596168518,2023-01-05 23:44:26.431113,2023-01-05 23:44:33.560368,0 days 00:00:07.129255,tanh,0.25,2,0.55,0.12828722596168518,,,PRUNED
1073,1073,0.040249116718769073,2023-01-05 23:44:33.680436,2023-01-05 23:45:00.422508,0 days 00:00:26.742072,sigmoid,0.05,2,0.75,0.040249116718769073,,,PRUNED
1074,1074,0.06185661256313324,2023-01-05 23:45:00.555606,2023-01-05 23:45:12.671560,0 days 00:00:12.115954,relu,0.25,3,0.5,0.09034474939107895,0.06185661256313324,,PRUNED
1075,1075,0.04239014536142349,2023-01-05 23:45:12.796087,2023-01-05 23:45:39.411211,0 days 00:00:26.615124,relu,0.0,2,0.8500000000000001,0.04239014536142349,,,PRUNED
1076,1076,0.07959600538015366,2023-01-05 23:45:39.516294,2023-01-05 23:45:51.585295,0 days 00:00:12.069001,relu,0.15000000000000002,2,0.8500000000000001,0.07959600538015366,,,PRUNED
1077,1077,0.13014957308769226,2023-01-05 23:45:51.723700,2023-01-05 23:45:58.560767,0 days 00:00:06.837067,sigmoid,0.30000000000000004,2,0.5,0.13014957308769226,,,PRUNED
1078,1078,0.1304474025964737,2023-01-05 23:45:58.675936,2023-01-05 23:46:05.551287,0 days 00:00:06.875351,relu,0.25,2,0.5,0.1304474025964737,,,PRUNED
1079,1079,0.12953853607177734,2023-01-05 23:46:05.666060,2023-01-05 23:46:40.094736,0 days 00:00:34.428676,sigmoid,0.0,2,0.8500000000000001,0.032603152096271515,,,COMPLETE
1080,1080,0.1380794197320938,2023-01-05 23:46:40.233779,2023-01-05 23:47:16.698286,0 days 00:00:36.464507,sigmoid,0.0,2,0.8500000000000001,0.03713419660925865,,,COMPLETE
1081,1081,0.1377187967300415,2023-01-05 23:47:16.822468,2023-01-05 23:47:23.594962,0 days 00:00:06.772494,sigmoid,0.25,2,0.5,0.1377187967300415,,,PRUNED
1082,1082,0.10866367071866989,2023-01-05 23:47:23.700968,2023-01-05 23:47:30.477780,0 days 00:00:06.776812,tanh,0.25,2,0.5,0.10866367071866989,,,PRUNED
1083,1083,0.06005556508898735,2023-01-05 23:47:30.783120,2023-01-05 23:47:42.701864,0 days 00:00:11.918744,sigmoid,0.25,2,0.8500000000000001,0.07482212036848068,0.06005556508898735,,PRUNED
1084,1084,0.13509051501750946,2023-01-05 23:47:42.818021,2023-01-05 23:48:17.043489,0 days 00:00:34.225468,relu,0.5,2,0.8,0.058277059346437454,0.0346241258084774,,COMPLETE
1085,1085,0.05491817370057106,2023-01-05 23:48:17.156751,2023-01-05 23:48:29.115080,0 days 00:00:11.958329,relu,0.25,2,0.5,0.08123905211687088,0.05491817370057106,,PRUNED
1086,1086,0.1359454244375229,2023-01-05 23:48:29.232163,2023-01-05 23:49:03.769162,0 days 00:00:34.536999,relu,0.4,2,0.9,0.060680463910102844,0.034281905740499496,,COMPLETE
1087,1087,0.059150200337171555,2023-01-05 23:49:03.886533,2023-01-05 23:49:15.712450,0 days 00:00:11.825917,sigmoid,0.25,2,0.5,0.09291505813598633,0.059150200337171555,,PRUNED
1088,1088,0.12172792106866837,2023-01-05 23:49:15.818277,2023-01-05 23:49:27.893856,0 days 00:00:12.075579,relu,0.2,5,0.75,0.12172792106866837,,,PRUNED
1089,1089,0.0897793099284172,2023-01-05 23:49:28.000688,2023-01-05 23:49:40.042938,0 days 00:00:12.042250,relu,0.4,3,0.65,0.0897793099284172,,,PRUNED
1090,1090,0.13321128487586975,2023-01-05 23:49:40.167439,2023-01-05 23:50:09.746481,0 days 00:00:29.579042,relu,0.30000000000000004,2,0.55,0.06146799400448799,0.04204118251800537,0.03203312307596207,COMPLETE
1091,1091,0.06301145255565643,2023-01-05 23:50:09.856525,2023-01-05 23:50:21.631444,0 days 00:00:11.774919,relu,0.4,2,0.8500000000000001,0.06301145255565643,,,PRUNED
1092,1092,0.128403440117836,2023-01-05 23:50:21.737267,2023-01-05 23:50:28.490246,0 days 00:00:06.752979,relu,0.30000000000000004,2,0.55,0.128403440117836,,,PRUNED
1093,1093,0.03921522945165634,2023-01-05 23:50:28.605424,2023-01-05 23:50:55.529031,0 days 00:00:26.923607,sigmoid,0.0,2,0.8500000000000001,0.03921522945165634,,,PRUNED
1094,1094,0.07803697884082794,2023-01-05 23:50:55.635612,2023-01-05 23:51:07.561274,0 days 00:00:11.925662,relu,0.45,2,0.7,0.07803697884082794,,,PRUNED
1095,1095,0.037331510335206985,2023-01-05 23:51:07.667109,2023-01-05 23:51:34.600896,0 days 00:00:26.933787,relu,0.35000000000000003,2,0.55,0.08474375307559967,0.05277638882398605,0.037331510335206985,PRUNED
1096,1096,0.1118679940700531,2023-01-05 23:51:34.714374,2023-01-05 23:51:41.667022,0 days 00:00:06.952648,relu,0.2,2,0.55,0.1118679940700531,,,PRUNED
1097,1097,0.0602584145963192,2023-01-05 23:51:41.981690,2023-01-05 23:51:53.941093,0 days 00:00:11.959403,relu,0.30000000000000004,2,0.55,0.09119899570941925,0.0602584145963192,,PRUNED
1098,1098,0.06665652245283127,2023-01-05 23:51:54.057263,2023-01-05 23:52:05.756850,0 days 00:00:11.699587,relu,0.2,2,0.6,0.06665652245283127,,,PRUNED
1099,1099,0.12498363852500916,2023-01-05 23:52:05.874024,2023-01-05 23:52:12.765109,0 days 00:00:06.891085,relu,0.2,2,0.55,0.12498363852500916,,,PRUNED
1100,1100,0.0357370525598526,2023-01-05 23:52:12.887392,2023-01-05 23:52:39.795931,0 days 00:00:26.908539,relu,0.4,2,0.8500000000000001,0.05405081436038017,0.0357370525598526,,PRUNED
1101,1101,0.12027162313461304,2023-01-05 23:52:39.913113,2023-01-05 23:52:46.754988,0 days 00:00:06.841875,relu,0.30000000000000004,2,0.5,0.12027162313461304,,,PRUNED
1102,1102,0.08323587477207184,2023-01-05 23:52:46.877246,2023-01-05 23:52:58.644516,0 days 00:00:11.767270,relu,0.35000000000000003,2,0.8500000000000001,0.08323587477207184,,,PRUNED
1103,1103,0.1277773380279541,2023-01-05 23:52:58.757679,2023-01-05 23:53:30.542262,0 days 00:00:31.784583,relu,0.35000000000000003,2,0.7,0.043194498866796494,0.031159672886133194,,COMPLETE
1104,1104,0.06656806915998459,2023-01-05 23:53:30.858439,2023-01-05 23:53:42.858394,0 days 00:00:11.999955,relu,0.30000000000000004,2,0.5,0.06473594903945923,0.06656806915998459,,PRUNED
1105,1105,0.03838667273521423,2023-01-05 23:53:42.963575,2023-01-05 23:54:09.789924,0 days 00:00:26.826349,relu,0.35000000000000003,2,0.7,0.06047391518950462,0.03838667273521423,,PRUNED
1106,1106,0.0829041451215744,2023-01-05 23:54:09.905269,2023-01-05 23:54:21.704862,0 days 00:00:11.799593,tanh,0.35000000000000003,2,0.7,0.0829041451215744,,,PRUNED
1107,1107,0.0653526559472084,2023-01-05 23:54:21.827368,2023-01-05 23:54:33.828936,0 days 00:00:12.001568,relu,0.35000000000000003,2,0.7,0.0653526559472084,,,PRUNED
1108,1108,0.08593161404132843,2023-01-05 23:54:33.944112,2023-01-05 23:54:45.869690,0 days 00:00:11.925578,relu,0.25,2,0.65,0.08593161404132843,,,PRUNED
1109,1109,0.14724616706371307,2023-01-05 23:54:45.985687,2023-01-05 23:54:53.045099,0 days 00:00:07.059412,relu,0.35000000000000003,4,0.55,0.14724616706371307,,,PRUNED
1110,1110,0.12466878443956375,2023-01-05 23:54:53.161371,2023-01-05 23:55:00.302932,0 days 00:00:07.141561,relu,0.2,3,0.5,0.12466878443956375,,,PRUNED
1111,1111,0.06935842335224152,2023-01-05 23:55:00.418307,2023-01-05 23:55:12.201019,0 days 00:00:11.782712,relu,0.25,2,0.7,0.06935842335224152,,,PRUNED
1112,1112,0.15840569138526917,2023-01-05 23:55:12.316191,2023-01-05 23:55:39.107997,0 days 00:00:26.791806,sigmoid,0.0,2,0.5,0.03651167452335358,,,COMPLETE
1113,1113,0.06280744820833206,2023-01-05 23:55:39.240594,2023-01-05 23:55:51.240730,0 days 00:00:12.000136,relu,0.15000000000000002,2,0.5,0.09435934573411942,0.06280744820833206,,PRUNED
1114,1114,0.1510211080312729,2023-01-05 23:55:51.355892,2023-01-05 23:56:03.722115,0 days 00:00:12.366223,sigmoid,0.35000000000000003,7,0.7,0.1510211080312729,,,PRUNED
1115,1115,0.044568393379449844,2023-01-05 23:56:03.838279,2023-01-05 23:56:30.554607,0 days 00:00:26.716328,relu,0.35000000000000003,2,0.65,0.0603630430996418,0.044568393379449844,,PRUNED
1116,1116,0.04650893062353134,2023-01-05 23:56:30.684828,2023-01-05 23:56:57.402927,0 days 00:00:26.718099,sigmoid,0.0,2,0.8500000000000001,0.04650893062353134,,,PRUNED
1117,1117,0.04175838083028793,2023-01-05 23:56:57.535658,2023-01-05 23:57:24.499308,0 days 00:00:26.963650,sigmoid,0.0,2,0.8500000000000001,0.04175838083028793,,,PRUNED
1118,1118,0.1630680412054062,2023-01-05 23:57:24.630151,2023-01-05 23:57:31.833091,0 days 00:00:07.202940,relu,0.2,6,0.5,0.1630680412054062,,,PRUNED
1119,1119,0.07242454588413239,2023-01-05 23:57:31.948261,2023-01-05 23:57:43.747847,0 days 00:00:11.799586,relu,0.4,2,0.7,0.07242454588413239,,,PRUNED
1120,1120,0.0678941011428833,2023-01-05 23:57:43.862014,2023-01-05 23:57:55.838604,0 days 00:00:11.976590,relu,0.4,2,0.6,0.0678941011428833,,,PRUNED
1121,1121,0.06307608634233475,2023-01-05 23:57:55.962100,2023-01-05 23:58:08.188974,0 days 00:00:12.226874,tanh,0.15000000000000002,2,0.55,0.0951375886797905,0.06307608634233475,,PRUNED
1122,1122,0.13091249763965607,2023-01-05 23:58:08.320868,2023-01-05 23:58:15.154800,0 days 00:00:06.833932,relu,0.15000000000000002,2,0.5,0.13091249763965607,,,PRUNED
1123,1123,0.06420405954122543,2023-01-05 23:58:15.261018,2023-01-05 23:58:27.186194,0 days 00:00:11.925176,relu,0.15000000000000002,2,0.5,0.08925692737102509,0.06420405954122543,,PRUNED
1124,1124,0.06217246502637863,2023-01-05 23:58:27.294060,2023-01-05 23:58:39.444628,0 days 00:00:12.150568,relu,0.45,2,0.7,0.06217246502637863,,,PRUNED
1125,1125,0.13381922245025635,2023-01-05 23:58:39.590238,2023-01-05 23:58:46.501420,0 days 00:00:06.911182,tanh,0.2,2,0.5,0.13381922245025635,,,PRUNED
1126,1126,0.04240576550364494,2023-01-05 23:58:46.604645,2023-01-05 23:59:13.342000,0 days 00:00:26.737355,sigmoid,0.0,2,0.8500000000000001,0.04240576550364494,,,PRUNED
1127,1127,0.12291982769966125,2023-01-05 23:59:13.469995,2023-01-05 23:59:20.432177,0 days 00:00:06.962182,relu,0.15000000000000002,2,0.5,0.12291982769966125,,,PRUNED
1128,1128,0.03522421419620514,2023-01-05 23:59:20.542460,2023-01-05 23:59:47.771774,0 days 00:00:27.229314,relu,0.25,2,0.5,0.08746699243783951,0.05135166272521019,0.03522421419620514,PRUNED
1129,1129,0.14826051890850067,2023-01-05 23:59:47.885065,2023-01-06 00:00:19.653386,0 days 00:00:31.768321,sigmoid,0.05,2,0.8,0.03461996093392372,,,COMPLETE
1130,1130,0.042038436979055405,2023-01-06 00:00:19.800319,2023-01-06 00:00:46.334104,0 days 00:00:26.533785,sigmoid,0.0,2,0.8500000000000001,0.042038436979055405,,,PRUNED
1131,1131,0.20501942932605743,2023-01-06 00:00:46.487970,2023-01-06 00:00:53.866751,0 days 00:00:07.378781,tanh,0.2,7,0.6,0.20501942932605743,,,PRUNED
1132,1132,0.06710793823003769,2023-01-06 00:00:53.969704,2023-01-06 00:01:05.807515,0 days 00:00:11.837811,relu,0.4,2,0.65,0.06710793823003769,,,PRUNED
1133,1133,0.07770043611526489,2023-01-06 00:01:05.911463,2023-01-06 00:01:17.531622,0 days 00:00:11.620159,relu,0.4,2,0.8500000000000001,0.07770043611526489,,,PRUNED
1134,1134,0.04050315171480179,2023-01-06 00:01:17.643268,2023-01-06 00:01:44.571235,0 days 00:00:26.927967,relu,0.25,2,0.6,0.05662354454398155,0.04050315171480179,,PRUNED
1135,1135,0.11547615379095078,2023-01-06 00:01:44.683523,2023-01-06 00:01:51.571697,0 days 00:00:06.888174,relu,0.35000000000000003,2,0.55,0.11547615379095078,,,PRUNED
1136,1136,0.06282582134008408,2023-01-06 00:01:51.730339,2023-01-06 00:02:03.653110,0 days 00:00:11.922771,relu,0.15000000000000002,2,0.5,0.07430719584226608,0.06282582134008408,,PRUNED
1137,1137,0.040969885885715485,2023-01-06 00:02:03.765398,2023-01-06 00:02:30.367756,0 days 00:00:26.602358,tanh,0.0,2,0.8500000000000001,0.040969885885715485,,,PRUNED
1138,1138,0.13524094223976135,2023-01-06 00:02:30.490725,2023-01-06 00:02:57.736149,0 days 00:00:27.245424,tanh,0.15000000000000002,2,0.5,0.05634604021906853,0.054230038076639175,0.03307292237877846,COMPLETE
1139,1139,0.1263161301612854,2023-01-06 00:02:57.882300,2023-01-06 00:03:04.690161,0 days 00:00:06.807861,tanh,0.15000000000000002,2,0.5,0.1263161301612854,,,PRUNED
1140,1140,0.040403109043836594,2023-01-06 00:03:04.841430,2023-01-06 00:03:31.371418,0 days 00:00:26.529988,tanh,0.0,2,0.8500000000000001,0.040403109043836594,,,PRUNED
1141,1141,0.13700097799301147,2023-01-06 00:03:31.482956,2023-01-06 00:04:05.669341,0 days 00:00:34.186385,sigmoid,0.0,2,0.8500000000000001,0.03698578476905823,,,COMPLETE
1142,1142,0.11773432791233063,2023-01-06 00:04:05.793365,2023-01-06 00:04:12.894307,0 days 00:00:07.100942,tanh,0.15000000000000002,2,0.5,0.11773432791233063,,,PRUNED
1143,1143,0.11000195890665054,2023-01-06 00:04:12.999480,2023-01-06 00:04:19.902108,0 days 00:00:06.902628,tanh,0.4,2,0.5,0.11000195890665054,,,PRUNED
1144,1144,0.13475346565246582,2023-01-06 00:04:20.024942,2023-01-06 00:04:26.883910,0 days 00:00:06.858968,tanh,0.15000000000000002,2,0.5,0.13475346565246582,,,PRUNED
1145,1145,0.12412595003843307,2023-01-06 00:04:26.999410,2023-01-06 00:04:34.158357,0 days 00:00:07.158947,tanh,0.15000000000000002,2,0.55,0.12412595003843307,,,PRUNED
1146,1146,0.13688096404075623,2023-01-06 00:04:34.262527,2023-01-06 00:05:10.912384,0 days 00:00:36.649857,tanh,0.25,2,0.8500000000000001,0.036478158086538315,,,COMPLETE
1147,1147,0.07218865305185318,2023-01-06 00:05:11.045325,2023-01-06 00:05:22.763381,0 days 00:00:11.718056,relu,0.35000000000000003,2,0.9,0.07218865305185318,,,PRUNED
1148,1148,0.13651782274246216,2023-01-06 00:05:22.885836,2023-01-06 00:05:29.921159,0 days 00:00:07.035323,tanh,0.15000000000000002,2,0.5,0.13651782274246216,,,PRUNED
1149,1149,0.10042839497327805,2023-01-06 00:05:30.035292,2023-01-06 00:05:42.205654,0 days 00:00:12.170362,relu,0.5,5,0.75,0.10042839497327805,,,PRUNED
1150,1150,0.1125023290514946,2023-01-06 00:05:42.326023,2023-01-06 00:05:49.188541,0 days 00:00:06.862518,tanh,0.15000000000000002,2,0.5,0.1125023290514946,,,PRUNED
1151,1151,0.1360338181257248,2023-01-06 00:05:49.306829,2023-01-06 00:06:21.033066,0 days 00:00:31.726237,sigmoid,0.0,2,0.9,0.033293627202510834,,,COMPLETE
1152,1152,0.13141050934791565,2023-01-06 00:06:21.156934,2023-01-06 00:06:28.202252,0 days 00:00:07.045318,tanh,0.15000000000000002,2,0.5,0.13141050934791565,,,PRUNED
1153,1153,0.06504399329423904,2023-01-06 00:06:28.315203,2023-01-06 00:06:40.017012,0 days 00:00:11.701809,tanh,0.4,2,0.7,0.06504399329423904,,,PRUNED
1154,1154,0.1471000611782074,2023-01-06 00:06:40.138302,2023-01-06 00:07:07.051093,0 days 00:00:26.912791,tanh,0.15000000000000002,2,0.5,0.06793390959501266,0.04958583787083626,0.032981693744659424,COMPLETE
1155,1155,0.15163809061050415,2023-01-06 00:07:07.182595,2023-01-06 00:07:34.039719,0 days 00:00:26.857124,sigmoid,0.0,2,0.8500000000000001,0.03660602495074272,,,COMPLETE
1156,1156,0.05827371031045914,2023-01-06 00:07:34.167204,2023-01-06 00:07:45.938008,0 days 00:00:11.770804,tanh,0.15000000000000002,2,0.5,0.08064857870340347,0.05827371031045914,,PRUNED
1157,1157,0.04138297587633133,2023-01-06 00:07:46.060298,2023-01-06 00:08:12.643319,0 days 00:00:26.583021,tanh,0.0,2,0.65,0.04138297587633133,,,PRUNED
1158,1158,0.04042157903313637,2023-01-06 00:08:12.773532,2023-01-06 00:08:39.282962,0 days 00:00:26.509430,sigmoid,0.0,2,0.95,0.04042157903313637,,,PRUNED
1159,1159,0.14834725856781006,2023-01-06 00:08:39.404243,2023-01-06 00:09:11.300465,0 days 00:00:31.896222,sigmoid,0.0,2,0.8500000000000001,0.03410530835390091,,,COMPLETE
1160,1160,0.08350120484828949,2023-01-06 00:09:11.427491,2023-01-06 00:09:23.329611,0 days 00:00:11.902120,relu,0.45,2,0.6,0.08350120484828949,,,PRUNED
1161,1161,0.13071012496948242,2023-01-06 00:09:23.450898,2023-01-06 00:09:30.287414,0 days 00:00:06.836516,tanh,0.15000000000000002,2,0.6,0.13071012496948242,,,PRUNED
1162,1162,0.26485565304756165,2023-01-06 00:09:30.402374,2023-01-06 00:09:50.648144,0 days 00:00:20.245770,sigmoid,0.05,8,0.8500000000000001,,,,COMPLETE
1163,1163,0.060665979981422424,2023-01-06 00:09:50.757833,2023-01-06 00:10:02.718284,0 days 00:00:11.960451,relu,0.2,2,0.55,0.08661055564880371,0.060665979981422424,,PRUNED
1164,1164,0.1234230026602745,2023-01-06 00:10:02.848910,2023-01-06 00:10:09.735422,0 days 00:00:06.886512,relu,0.15000000000000002,2,0.5,0.1234230026602745,,,PRUNED
1165,1165,0.060256004333496094,2023-01-06 00:10:09.865043,2023-01-06 00:10:21.716851,0 days 00:00:11.851808,tanh,0.15000000000000002,2,0.5,0.08387197554111481,0.060256004333496094,,PRUNED
1166,1166,0.062196068465709686,2023-01-06 00:10:21.838322,2023-01-06 00:10:34.067135,0 days 00:00:12.228813,relu,0.2,2,0.5,0.09334253519773483,0.062196068465709686,,PRUNED
1167,1167,0.042052969336509705,2023-01-06 00:10:34.175906,2023-01-06 00:11:00.913875,0 days 00:00:26.737969,sigmoid,0.0,2,0.8500000000000001,0.042052969336509705,,,PRUNED
1168,1168,0.062077395617961884,2023-01-06 00:11:01.035157,2023-01-06 00:11:13.062944,0 days 00:00:12.027787,relu,0.15000000000000002,2,0.5,0.08723742514848709,0.062077395617961884,,PRUNED
1169,1169,0.14253012835979462,2023-01-06 00:11:13.199897,2023-01-06 00:11:38.024237,0 days 00:00:24.824340,tanh,0.15000000000000002,2,0.5,0.05788111686706543,0.038313400000333786,,COMPLETE
1170,1170,0.10384409129619598,2023-01-06 00:11:38.160052,2023-01-06 00:11:45.086933,0 days 00:00:06.926881,relu,0.0,2,0.55,0.10384409129619598,,,PRUNED
1171,1171,0.0700778141617775,2023-01-06 00:11:45.190132,2023-01-06 00:11:57.134600,0 days 00:00:11.944468,relu,0.4,2,0.8500000000000001,0.0700778141617775,,,PRUNED
1172,1172,0.13526684045791626,2023-01-06 00:11:57.273553,2023-01-06 00:12:29.313490,0 days 00:00:32.039937,sigmoid,0.0,2,0.8500000000000001,0.03444971144199371,,,COMPLETE
1173,1173,0.13212226331233978,2023-01-06 00:12:29.445792,2023-01-06 00:13:01.209049,0 days 00:00:31.763257,relu,0.25,2,0.65,0.04827738180756569,0.03267909586429596,,COMPLETE
1174,1174,0.1534518301486969,2023-01-06 00:13:01.353699,2023-01-06 00:13:33.006631,0 days 00:00:31.652932,sigmoid,0.0,2,0.8500000000000001,0.036437612026929855,,,COMPLETE
1175,1175,0.06899555027484894,2023-01-06 00:13:33.144952,2023-01-06 00:14:00.266914,0 days 00:00:27.121962,sigmoid,0.15000000000000002,4,0.8500000000000001,0.06899555027484894,,,PRUNED
