,number,value,datetime_start,datetime_complete,duration,params_activation,params_dropout,params_layers,params_shrink,system_attrs_completed_rung_0,system_attrs_completed_rung_1,system_attrs_completed_rung_2,state
1306,1306,1.008670687675476,2023-01-06 00:46:58.321813,2023-01-06 00:47:10.880609,0 days 00:00:12.558796,relu,0.2,8,0.6,1.008670687675476,,,PRUNED
1307,1307,0.05544991046190262,2023-01-06 00:47:10.988518,2023-01-06 00:47:22.854698,0 days 00:00:11.866180,relu,0.35000000000000003,2,0.5,0.09064654260873795,0.05544991046190262,,PRUNED
1308,1308,0.06614253669977188,2023-01-06 00:47:22.962604,2023-01-06 00:47:34.787125,0 days 00:00:11.824521,relu,0.2,2,0.6,0.06614253669977188,,,PRUNED
1309,1309,0.12379763275384903,2023-01-06 00:47:34.893401,2023-01-06 00:47:41.754264,0 days 00:00:06.860863,sigmoid,0.2,2,0.5,0.12379763275384903,,,PRUNED
1310,1310,0.07344378530979156,2023-01-06 00:47:41.844511,2023-01-06 00:47:54.010665,0 days 00:00:12.166154,relu,0.2,2,0.6,0.07344378530979156,,,PRUNED
1311,1311,0.1500353068113327,2023-01-06 00:47:54.118578,2023-01-06 00:48:01.018938,0 days 00:00:06.900360,tanh,0.15000000000000002,2,0.55,0.1500353068113327,,,PRUNED
1312,1312,0.1244475468993187,2023-01-06 00:48:01.107715,2023-01-06 00:48:07.919268,0 days 00:00:06.811553,relu,0.0,2,0.6,0.1244475468993187,,,PRUNED
1313,1313,0.06499731540679932,2023-01-06 00:48:08.041918,2023-01-06 00:48:20.183677,0 days 00:00:12.141759,sigmoid,0.1,2,0.5,0.05895674228668213,0.06499731540679932,,PRUNED
1314,1314,0.04807087406516075,2023-01-06 00:48:20.291588,2023-01-06 00:48:47.098294,0 days 00:00:26.806706,tanh,0.0,2,0.75,0.04807087406516075,,,PRUNED
1315,1315,0.08098003268241882,2023-01-06 00:48:47.204230,2023-01-06 00:48:58.889073,0 days 00:00:11.684843,relu,0.2,2,0.6,0.08098003268241882,,,PRUNED
1316,1316,0.07550983130931854,2023-01-06 00:48:58.995269,2023-01-06 00:49:10.771504,0 days 00:00:11.776235,relu,0.25,2,0.6,0.07550983130931854,,,PRUNED
1317,1317,0.0428478829562664,2023-01-06 00:49:11.068783,2023-01-06 00:49:37.911118,0 days 00:00:26.842335,relu,0.2,2,0.55,0.06006639078259468,0.0428478829562664,,PRUNED
1318,1318,0.05664634332060814,2023-01-06 00:49:38.016026,2023-01-06 00:49:49.918535,0 days 00:00:11.902509,relu,0.15000000000000002,2,0.5,0.07307561486959457,0.05664634332060814,,PRUNED
1319,1319,0.03448176011443138,2023-01-06 00:49:50.025452,2023-01-06 00:50:16.774825,0 days 00:00:26.749373,tanh,0.25,2,0.5,0.06956041604280472,0.04332969710230827,0.03448176011443138,PRUNED
1320,1320,0.03927038237452507,2023-01-06 00:50:16.882759,2023-01-06 00:50:43.806113,0 days 00:00:26.923354,relu,0.15000000000000002,2,0.75,0.05816921964287758,0.03927038237452507,,PRUNED
1321,1321,0.08646166324615479,2023-01-06 00:50:43.914028,2023-01-06 00:50:55.755524,0 days 00:00:11.841496,relu,0.2,2,0.65,0.08646166324615479,,,PRUNED
1322,1322,0.03386916592717171,2023-01-06 00:50:55.862120,2023-01-06 00:51:22.661489,0 days 00:00:26.799369,sigmoid,0.2,2,0.5,0.06505043059587479,0.043087054044008255,0.03386916592717171,PRUNED
1323,1323,0.033672839403152466,2023-01-06 00:51:22.769418,2023-01-06 00:51:49.760433,0 days 00:00:26.991015,relu,0.15000000000000002,2,0.55,0.060820676386356354,0.041801415383815765,0.033672839403152466,PRUNED
1324,1324,0.06170853599905968,2023-01-06 00:51:49.865356,2023-01-06 00:52:01.725193,0 days 00:00:11.859837,sigmoid,0.30000000000000004,2,0.5,0.09640607237815857,0.06170853599905968,,PRUNED
1325,1325,0.036023154854774475,2023-01-06 00:52:01.838640,2023-01-06 00:52:28.681807,0 days 00:00:26.843167,tanh,0.15000000000000002,2,0.6,0.08343812078237534,0.05454596132040024,0.036023154854774475,PRUNED
1326,1326,0.140258327126503,2023-01-06 00:52:28.782065,2023-01-06 00:52:35.756293,0 days 00:00:06.974228,relu,0.05,3,0.5,0.140258327126503,,,PRUNED
1327,1327,0.14774224162101746,2023-01-06 00:52:35.864399,2023-01-06 00:52:42.915066,0 days 00:00:07.050667,sigmoid,0.05,2,0.8,0.14774224162101746,,,PRUNED
1328,1328,0.13478687405586243,2023-01-06 00:52:43.030989,2023-01-06 00:53:12.345150,0 days 00:00:29.314161,sigmoid,0.05,2,0.6,0.03289472684264183,,,COMPLETE
1329,1329,0.0707521140575409,2023-01-06 00:53:12.463759,2023-01-06 00:53:24.252273,0 days 00:00:11.788514,relu,0.35000000000000003,2,0.7,0.0707521140575409,,,PRUNED
1330,1330,0.1162818893790245,2023-01-06 00:53:24.360188,2023-01-06 00:53:31.577018,0 days 00:00:07.216830,relu,0.1,2,0.5,0.1162818893790245,,,PRUNED
1331,1331,0.11676549911499023,2023-01-06 00:53:31.676298,2023-01-06 00:53:38.502190,0 days 00:00:06.825892,sigmoid,0.15000000000000002,2,0.5,0.11676549911499023,,,PRUNED
1332,1332,0.12103073298931122,2023-01-06 00:53:38.608982,2023-01-06 00:53:45.468333,0 days 00:00:06.859351,tanh,0.15000000000000002,2,0.55,0.12103073298931122,,,PRUNED
1333,1333,0.11564682424068451,2023-01-06 00:53:45.566912,2023-01-06 00:53:52.434466,0 days 00:00:06.867554,relu,0.2,2,0.5,0.11564682424068451,,,PRUNED
1334,1334,0.09726159274578094,2023-01-06 00:53:52.524718,2023-01-06 00:53:59.633670,0 days 00:00:07.108952,sigmoid,0.25,2,0.5,0.09726159274578094,,,PRUNED
1335,1335,0.13127441704273224,2023-01-06 00:53:59.764089,2023-01-06 00:54:31.730794,0 days 00:00:31.966705,relu,0.15000000000000002,2,0.65,0.06206260994076729,0.04283125698566437,0.03242751955986023,COMPLETE
1336,1336,0.10799364000558853,2023-01-06 00:54:31.839089,2023-01-06 00:54:43.821397,0 days 00:00:11.982308,tanh,0.25,4,0.6,0.10799364000558853,,,PRUNED
1337,1337,0.1298803836107254,2023-01-06 00:54:43.930156,2023-01-06 00:54:51.046688,0 days 00:00:07.116532,sigmoid,0.15000000000000002,2,0.65,0.1298803836107254,,,PRUNED
1338,1338,0.03876769170165062,2023-01-06 00:54:51.145260,2023-01-06 00:55:17.976969,0 days 00:00:26.831709,relu,0.2,2,0.6,0.060836657881736755,0.03876769170165062,,PRUNED
1339,1339,0.03823067992925644,2023-01-06 00:55:18.085886,2023-01-06 00:55:44.658286,0 days 00:00:26.572400,sigmoid,0.05,2,0.6,0.03823067992925644,,,PRUNED
1340,1340,0.04016498848795891,2023-01-06 00:55:44.764198,2023-01-06 00:56:11.697899,0 days 00:00:26.933701,relu,0.30000000000000004,2,0.65,0.061890121549367905,0.04016498848795891,,PRUNED
1341,1341,0.0742725282907486,2023-01-06 00:56:11.804817,2023-01-06 00:56:23.780314,0 days 00:00:11.975497,relu,0.1,3,0.7,0.0742725282907486,,,PRUNED
1342,1342,0.1524207890033722,2023-01-06 00:56:23.889788,2023-01-06 00:56:50.832068,0 days 00:00:26.942280,relu,0.5,2,0.75,0.057650815695524216,0.03359158709645271,,COMPLETE
1343,1343,0.13521148264408112,2023-01-06 00:56:50.946427,2023-01-06 00:57:20.542549,0 days 00:00:29.596122,relu,0.15000000000000002,2,0.7,0.060400575399398804,0.04238542169332504,0.03289998695254326,COMPLETE
1344,1344,0.07461690157651901,2023-01-06 00:57:20.653265,2023-01-06 00:57:32.474807,0 days 00:00:11.821542,relu,0.45,2,0.6,0.07461690157651901,,,PRUNED
1345,1345,0.13411323726177216,2023-01-06 00:57:32.582014,2023-01-06 00:58:06.758711,0 days 00:00:34.176697,relu,0.35000000000000003,2,0.65,0.05443516746163368,0.03482922166585922,,COMPLETE
1346,1346,0.04067292809486389,2023-01-06 00:58:06.865051,2023-01-06 00:58:33.570163,0 days 00:00:26.705112,sigmoid,0.05,2,0.6,0.04067292809486389,,,PRUNED
1347,1347,0.06586953997612,2023-01-06 00:58:33.677372,2023-01-06 00:58:45.360943,0 days 00:00:11.683571,sigmoid,0.25,2,0.8,0.06586953997612,,,PRUNED
1348,1348,0.039776403456926346,2023-01-06 00:58:45.468143,2023-01-06 00:59:12.008921,0 days 00:00:26.540778,sigmoid,0.05,2,0.6,0.039776403456926346,,,PRUNED
1349,1349,0.12406465411186218,2023-01-06 00:59:12.123050,2023-01-06 00:59:18.892731,0 days 00:00:06.769681,relu,0.15000000000000002,2,0.7,0.12406465411186218,,,PRUNED
1350,1350,0.1254834085702896,2023-01-06 00:59:18.998794,2023-01-06 00:59:26.058851,0 days 00:00:07.060057,relu,0.15000000000000002,2,0.65,0.1254834085702896,,,PRUNED
1351,1351,0.14713282883167267,2023-01-06 00:59:26.172969,2023-01-06 00:59:50.421834,0 days 00:00:24.248865,relu,0.2,2,0.7,0.04116592928767204,,,COMPLETE
1352,1352,0.12066776305437088,2023-01-06 00:59:50.538461,2023-01-06 00:59:57.389761,0 days 00:00:06.851300,relu,0.15000000000000002,2,0.7,0.12066776305437088,,,PRUNED
1353,1353,0.10668643563985825,2023-01-06 00:59:57.494591,2023-01-06 01:00:04.372612,0 days 00:00:06.878021,relu,0.15000000000000002,2,0.7,0.10668643563985825,,,PRUNED
1354,1354,0.131263867020607,2023-01-06 01:00:04.672570,2023-01-06 01:00:11.546064,0 days 00:00:06.873494,relu,0.15000000000000002,2,0.7,0.131263867020607,,,PRUNED
1355,1355,0.11636203527450562,2023-01-06 01:00:11.653854,2023-01-06 01:00:18.471540,0 days 00:00:06.817686,relu,0.15000000000000002,2,0.65,0.11636203527450562,,,PRUNED
1356,1356,0.06316804885864258,2023-01-06 01:00:18.579344,2023-01-06 01:00:30.328678,0 days 00:00:11.749334,relu,0.4,2,0.55,0.06316804885864258,,,PRUNED
1357,1357,0.10377639532089233,2023-01-06 01:00:30.443092,2023-01-06 01:00:42.485381,0 days 00:00:12.042289,relu,0.15000000000000002,2,0.65,0.0760611817240715,0.10377639532089233,,PRUNED
1358,1358,0.11894528567790985,2023-01-06 01:00:42.626501,2023-01-06 01:00:49.744161,0 days 00:00:07.117660,relu,0.15000000000000002,4,0.7,0.11894528567790985,,,PRUNED
1359,1359,0.1470557600259781,2023-01-06 01:00:49.851954,2023-01-06 01:01:19.182767,0 days 00:00:29.330813,sigmoid,0.1,2,0.6,0.03406350314617157,,,COMPLETE
1360,1360,0.0603821687400341,2023-01-06 01:01:19.317062,2023-01-06 01:01:31.540994,0 days 00:00:12.223932,relu,0.2,2,0.7,0.083453468978405,0.0603821687400341,,PRUNED
1361,1361,0.11882651597261429,2023-01-06 01:01:31.656112,2023-01-06 01:01:38.632122,0 days 00:00:06.976010,relu,0.15000000000000002,2,0.65,0.11882651597261429,,,PRUNED
1362,1362,0.06365128606557846,2023-01-06 01:01:38.728573,2023-01-06 01:01:50.738528,0 days 00:00:12.009955,relu,0.15000000000000002,2,0.65,0.09394203126430511,0.06365128606557846,,PRUNED
1363,1363,0.1250828504562378,2023-01-06 01:01:50.851652,2023-01-06 01:01:57.897327,0 days 00:00:07.045675,relu,0.15000000000000002,2,0.7,0.1250828504562378,,,PRUNED
1364,1364,0.10150611400604248,2023-01-06 01:01:58.003113,2023-01-06 01:02:04.930128,0 days 00:00:06.927015,tanh,0.25,2,0.7,0.10150611400604248,,,PRUNED
1365,1365,0.040280599147081375,2023-01-06 01:02:05.058910,2023-01-06 01:02:31.652100,0 days 00:00:26.593190,sigmoid,0.05,2,0.65,0.040280599147081375,,,PRUNED
1366,1366,0.14508461952209473,2023-01-06 01:02:31.767588,2023-01-06 01:03:03.249033,0 days 00:00:31.481445,sigmoid,0.05,2,0.65,0.03362663835287094,,,COMPLETE
1367,1367,0.19757957756519318,2023-01-06 01:03:03.366495,2023-01-06 01:03:10.858448,0 days 00:00:07.491953,relu,0.2,7,0.65,0.19757957756519318,,,PRUNED
1368,1368,0.1519857943058014,2023-01-06 01:03:10.953770,2023-01-06 01:03:18.099566,0 days 00:00:07.145796,relu,0.1,5,0.7,0.1519857943058014,,,PRUNED
1369,1369,0.07212820649147034,2023-01-06 01:03:18.203199,2023-01-06 01:03:30.072637,0 days 00:00:11.869438,relu,0.25,2,0.9,0.07212820649147034,,,PRUNED
1370,1370,0.039099209010601044,2023-01-06 01:03:30.190780,2023-01-06 01:03:57.237264,0 days 00:00:27.046484,relu,0.05,2,0.65,0.061818014830350876,0.039099209010601044,,PRUNED
1371,1371,0.10820113122463226,2023-01-06 01:03:57.360716,2023-01-06 01:04:04.420025,0 days 00:00:07.059309,tanh,0.15000000000000002,3,0.6,0.10820113122463226,,,PRUNED
1372,1372,0.08278348296880722,2023-01-06 01:04:04.544658,2023-01-06 01:04:16.344148,0 days 00:00:11.799490,relu,0.4,2,0.8500000000000001,0.08278348296880722,,,PRUNED
1373,1373,0.05598205327987671,2023-01-06 01:04:16.457689,2023-01-06 01:04:28.577555,0 days 00:00:12.119866,relu,0.2,2,0.65,0.08912191540002823,0.05598205327987671,,PRUNED
1374,1374,0.1344691663980484,2023-01-06 01:04:28.693718,2023-01-06 01:04:35.735342,0 days 00:00:07.041624,relu,0.15000000000000002,2,0.65,0.1344691663980484,,,PRUNED
1375,1375,0.07886544615030289,2023-01-06 01:04:35.848461,2023-01-06 01:04:47.641771,0 days 00:00:11.793310,tanh,0.45,2,0.7,0.07886544615030289,,,PRUNED
1376,1376,0.07463125139474869,2023-01-06 01:04:47.757891,2023-01-06 01:04:59.574191,0 days 00:00:11.816300,relu,0.2,2,0.65,0.07463125139474869,,,PRUNED
1377,1377,0.03663400188088417,2023-01-06 01:04:59.690317,2023-01-06 01:05:26.630364,0 days 00:00:26.940047,relu,0.4,2,0.8500000000000001,0.05816102400422096,0.03663400188088417,,PRUNED
1378,1378,0.11760929226875305,2023-01-06 01:05:26.746674,2023-01-06 01:05:33.655907,0 days 00:00:06.909233,tanh,0.15000000000000002,2,0.6,0.11760929226875305,,,PRUNED
1379,1379,0.041326455771923065,2023-01-06 01:05:33.778394,2023-01-06 01:06:00.569570,0 days 00:00:26.791176,relu,0.1,2,0.65,0.08760222792625427,0.05341929942369461,0.041326455771923065,PRUNED
1380,1380,0.24585779011249542,2023-01-06 01:06:00.684692,2023-01-06 01:06:13.118610,0 days 00:00:12.433918,relu,0.4,6,0.6,0.24585779011249542,,,PRUNED
1381,1381,0.13764238357543945,2023-01-06 01:06:13.227403,2023-01-06 01:06:44.886580,0 days 00:00:31.659177,sigmoid,0.15000000000000002,2,0.7,0.036808550357818604,,,COMPLETE
1382,1382,0.0557057149708271,2023-01-06 01:06:45.007000,2023-01-06 01:06:56.874630,0 days 00:00:11.867630,relu,0.25,2,0.6,0.08716534078121185,0.0557057149708271,,PRUNED
1383,1383,0.034361813217401505,2023-01-06 01:06:57.006414,2023-01-06 01:07:23.889244,0 days 00:00:26.882830,tanh,0.15000000000000002,2,0.75,0.09043590724468231,0.05454471707344055,0.034361813217401505,PRUNED
1384,1384,0.06567288935184479,2023-01-06 01:07:24.002361,2023-01-06 01:07:36.256865,0 days 00:00:12.254504,relu,0.2,2,0.7,0.08760357648134232,0.06567288935184479,,PRUNED
1385,1385,0.07052399963140488,2023-01-06 01:07:36.377425,2023-01-06 01:07:48.244728,0 days 00:00:11.867303,relu,0.35000000000000003,2,0.7,0.07052399963140488,,,PRUNED
1386,1386,0.05576705187559128,2023-01-06 01:07:48.359849,2023-01-06 01:08:00.327247,0 days 00:00:11.967398,relu,0.15000000000000002,2,0.8,0.07233649492263794,0.05576705187559128,,PRUNED
1387,1387,0.14331474900245667,2023-01-06 01:08:00.445263,2023-01-06 01:08:07.552027,0 days 00:00:07.106764,tanh,0.30000000000000004,2,0.75,0.14331474900245667,,,PRUNED
1388,1388,0.15049035847187042,2023-01-06 01:08:07.656667,2023-01-06 01:08:34.454342,0 days 00:00:26.797675,sigmoid,0.0,2,0.6,0.03377946838736534,,,COMPLETE
1389,1389,0.09981686621904373,2023-01-06 01:08:34.576165,2023-01-06 01:08:41.475015,0 days 00:00:06.898850,relu,0.1,2,0.65,0.09981686621904373,,,PRUNED
1390,1390,0.151966854929924,2023-01-06 01:08:41.591141,2023-01-06 01:09:08.288443,0 days 00:00:26.697302,sigmoid,0.05,2,0.8,0.035763856023550034,,,COMPLETE
1391,1391,0.13532161712646484,2023-01-06 01:09:08.424115,2023-01-06 01:09:15.547434,0 days 00:00:07.123319,relu,0.15000000000000002,2,0.8,0.13532161712646484,,,PRUNED
1392,1392,0.14631062746047974,2023-01-06 01:09:15.651222,2023-01-06 01:09:47.381774,0 days 00:00:31.730552,sigmoid,0.2,2,0.9,0.03560176119208336,,,COMPLETE
1393,1393,0.1280103325843811,2023-01-06 01:09:47.494150,2023-01-06 01:09:54.436149,0 days 00:00:06.941999,tanh,0.25,2,0.6,0.1280103325843811,,,PRUNED
1394,1394,0.043909478932619095,2023-01-06 01:09:54.541932,2023-01-06 01:10:21.383513,0 days 00:00:26.841581,sigmoid,0.0,2,0.95,0.043909478932619095,,,PRUNED
1395,1395,0.15259024500846863,2023-01-06 01:10:21.498224,2023-01-06 01:10:48.772664,0 days 00:00:27.274440,relu,0.1,6,0.5,0.15259024500846863,,,PRUNED
1396,1396,0.1401493400335312,2023-01-06 01:10:48.889812,2023-01-06 01:10:55.839824,0 days 00:00:06.950012,relu,0.15000000000000002,2,0.7,0.1401493400335312,,,PRUNED
1397,1397,0.06940266489982605,2023-01-06 01:10:55.936271,2023-01-06 01:11:08.079600,0 days 00:00:12.143329,relu,0.15000000000000002,2,0.6,0.09656654298305511,0.06940266489982605,,PRUNED
1398,1398,0.14248166978359222,2023-01-06 01:11:08.202712,2023-01-06 01:11:15.146698,0 days 00:00:06.943986,tanh,0.2,2,0.55,0.14248166978359222,,,PRUNED
1399,1399,0.07536008208990097,2023-01-06 01:11:15.259812,2023-01-06 01:11:27.144780,0 days 00:00:11.884968,relu,0.15000000000000002,2,0.75,0.06837170571088791,0.07536008208990097,,PRUNED
1400,1400,0.08957702666521072,2023-01-06 01:11:27.268231,2023-01-06 01:11:39.027209,0 days 00:00:11.758978,relu,0.25,2,0.8500000000000001,0.08957702666521072,,,PRUNED
1401,1401,0.09802145510911942,2023-01-06 01:11:39.142328,2023-01-06 01:11:46.236000,0 days 00:00:07.093672,relu,0.2,2,0.6,0.09802145510911942,,,PRUNED
1402,1402,0.11568310856819153,2023-01-06 01:11:46.359183,2023-01-06 01:11:53.276759,0 days 00:00:06.917576,tanh,0.15000000000000002,2,0.7,0.11568310856819153,,,PRUNED
1403,1403,0.13384953141212463,2023-01-06 01:11:53.390243,2023-01-06 01:12:22.888550,0 days 00:00:29.498307,relu,0.4,2,0.65,0.046579159796237946,0.03228645399212837,,COMPLETE
1404,1404,0.0834929496049881,2023-01-06 01:12:23.015673,2023-01-06 01:12:34.997954,0 days 00:00:11.982281,relu,0.2,2,0.75,0.0834929496049881,,,PRUNED
1405,1405,0.06892357766628265,2023-01-06 01:12:35.110084,2023-01-06 01:12:46.930773,0 days 00:00:11.820689,relu,0.15000000000000002,2,0.8,0.06892357766628265,,,PRUNED
1406,1406,0.098284512758255,2023-01-06 01:12:47.040329,2023-01-06 01:12:53.972519,0 days 00:00:06.932190,relu,0.15000000000000002,2,0.65,0.098284512758255,,,PRUNED
1407,1407,0.06940466165542603,2023-01-06 01:12:54.079985,2023-01-06 01:13:05.745618,0 days 00:00:11.665633,relu,0.45,2,0.7,0.06940466165542603,,,PRUNED
1408,1408,0.1431323140859604,2023-01-06 01:13:06.048738,2023-01-06 01:13:18.028025,0 days 00:00:11.979287,relu,0.4,3,0.5,0.1431323140859604,,,PRUNED
1409,1409,0.041341181844472885,2023-01-06 01:13:18.136472,2023-01-06 01:13:45.000978,0 days 00:00:26.864506,relu,0.35000000000000003,2,0.6,0.06196688488125801,0.041341181844472885,,PRUNED
1410,1410,0.12241841107606888,2023-01-06 01:13:45.113920,2023-01-06 01:13:51.969108,0 days 00:00:06.855188,sigmoid,0.1,2,0.55,0.12241841107606888,,,PRUNED
1411,1411,0.10926925390958786,2023-01-06 01:13:52.078062,2023-01-06 01:13:59.187744,0 days 00:00:07.109682,relu,0.1,2,0.9,0.10926925390958786,,,PRUNED
1412,1412,0.0667121633887291,2023-01-06 01:13:59.293181,2023-01-06 01:14:11.010844,0 days 00:00:11.717663,tanh,0.25,2,0.55,0.0667121633887291,,,PRUNED
1413,1413,0.04069390147924423,2023-01-06 01:14:11.132946,2023-01-06 01:14:37.792150,0 days 00:00:26.659204,sigmoid,0.0,2,0.6,0.04069390147924423,,,PRUNED
1414,1414,0.1385241448879242,2023-01-06 01:14:37.900581,2023-01-06 01:15:07.383353,0 days 00:00:29.482772,relu,0.4,2,0.9,0.045099496841430664,0.03456280380487442,,COMPLETE
1415,1415,0.11920177936553955,2023-01-06 01:15:07.498002,2023-01-06 01:15:14.373700,0 days 00:00:06.875698,tanh,0.4,2,0.65,0.11920177936553955,,,PRUNED
1416,1416,0.06302390247583389,2023-01-06 01:15:14.503639,2023-01-06 01:15:26.188469,0 days 00:00:11.684830,relu,0.4,2,0.8500000000000001,0.06302390247583389,,,PRUNED
1417,1417,0.03556917980313301,2023-01-06 01:15:26.304240,2023-01-06 01:15:53.328201,0 days 00:00:27.023961,sigmoid,0.25,2,0.55,0.07972794771194458,0.05221538990736008,0.03556917980313301,PRUNED
1418,1418,0.0928850993514061,2023-01-06 01:15:53.427178,2023-01-06 01:16:05.252169,0 days 00:00:11.824991,relu,0.45,2,0.65,0.0928850993514061,,,PRUNED
1419,1419,0.10616181045770645,2023-01-06 01:16:05.359608,2023-01-06 01:16:12.177106,0 days 00:00:06.817498,relu,0.15000000000000002,2,0.5,0.10616181045770645,,,PRUNED
1420,1420,0.10600439459085464,2023-01-06 01:16:12.257078,2023-01-06 01:16:19.257550,0 days 00:00:07.000472,sigmoid,0.15000000000000002,3,0.5,0.10600439459085464,,,PRUNED
1421,1421,0.11165586113929749,2023-01-06 01:16:19.560057,2023-01-06 01:16:26.501558,0 days 00:00:06.941501,relu,0.2,2,0.5,0.11165586113929749,,,PRUNED
1422,1422,0.063472680747509,2023-01-06 01:16:26.579993,2023-01-06 01:16:38.392317,0 days 00:00:11.812324,relu,0.35000000000000003,2,0.8500000000000001,0.063472680747509,,,PRUNED
1423,1423,0.13839873671531677,2023-01-06 01:16:38.505085,2023-01-06 01:17:07.775060,0 days 00:00:29.269975,sigmoid,0.30000000000000004,2,0.8500000000000001,0.0492786280810833,0.03500077873468399,,COMPLETE
1424,1424,0.1192123144865036,2023-01-06 01:17:07.880538,2023-01-06 01:17:14.922427,0 days 00:00:07.041889,tanh,0.15000000000000002,2,0.5,0.1192123144865036,,,PRUNED
1425,1425,0.1352538764476776,2023-01-06 01:17:15.019525,2023-01-06 01:17:51.586398,0 days 00:00:36.566873,sigmoid,0.0,2,0.75,0.03530994802713394,,,COMPLETE
1426,1426,0.0969000980257988,2023-01-06 01:17:51.710536,2023-01-06 01:17:58.675005,0 days 00:00:06.964469,sigmoid,0.25,2,0.5,0.0969000980257988,,,PRUNED
1427,1427,0.1000303328037262,2023-01-06 01:17:58.790983,2023-01-06 01:18:05.885680,0 days 00:00:07.094697,relu,0.15000000000000002,2,0.8,0.1000303328037262,,,PRUNED
1428,1428,0.08716895431280136,2023-01-06 01:18:05.982792,2023-01-06 01:18:18.075414,0 days 00:00:12.092622,sigmoid,0.1,4,0.5,0.09285096824169159,0.08716895431280136,,PRUNED
1429,1429,0.12133871763944626,2023-01-06 01:18:18.206874,2023-01-06 01:18:25.139798,0 days 00:00:06.932924,tanh,0.2,2,0.75,0.12133871763944626,,,PRUNED
1430,1430,0.11075489968061447,2023-01-06 01:18:25.240649,2023-01-06 01:18:32.108683,0 days 00:00:06.868034,relu,0.15000000000000002,2,0.6,0.11075489968061447,,,PRUNED
1431,1431,0.11298777163028717,2023-01-06 01:18:32.425985,2023-01-06 01:18:39.505231,0 days 00:00:07.079246,relu,0.30000000000000004,2,0.5,0.11298777163028717,,,PRUNED
1432,1432,0.033505309373140335,2023-01-06 01:18:39.614558,2023-01-06 01:19:06.463415,0 days 00:00:26.848857,sigmoid,0.15000000000000002,2,0.55,0.07989811152219772,0.046990346163511276,0.033505309373140335,PRUNED
1433,1433,0.1297713667154312,2023-01-06 01:19:06.582850,2023-01-06 01:19:13.363884,0 days 00:00:06.781034,tanh,0.5,2,0.7,0.1297713667154312,,,PRUNED
1434,1434,0.06398054212331772,2023-01-06 01:19:13.443055,2023-01-06 01:19:25.337293,0 days 00:00:11.894238,relu,0.2,2,0.7,0.06398054212331772,,,PRUNED
1435,1435,0.04025649279356003,2023-01-06 01:19:25.442410,2023-01-06 01:19:52.009957,0 days 00:00:26.567547,sigmoid,0.0,2,0.7,0.04025649279356003,,,PRUNED
