,number,value,datetime_start,datetime_complete,duration,params_activation,params_dropout,params_layers,params_shrink,system_attrs_completed_rung_0,system_attrs_completed_rung_1,system_attrs_completed_rung_2,state
394,394,0.14069610834121704,2023-01-05 20:34:01.609989,2023-01-05 20:34:08.427757,0 days 00:00:06.817768,sigmoid,0.15000000000000002,2,0.5,0.14069610834121704,,,PRUNED
395,395,0.14512108266353607,2023-01-05 20:34:08.552810,2023-01-05 20:34:38.074028,0 days 00:00:29.521218,sigmoid,0.1,2,0.5,0.08355949819087982,0.050372164696455,0.031184008345007896,COMPLETE
396,396,0.12186484038829803,2023-01-05 20:34:38.207263,2023-01-05 20:34:44.990983,0 days 00:00:06.783720,sigmoid,0.1,2,0.5,0.12186484038829803,,,PRUNED
397,397,0.10729804635047913,2023-01-05 20:34:45.107078,2023-01-05 20:34:52.132803,0 days 00:00:07.025725,sigmoid,0.1,2,0.75,0.10729804635047913,,,PRUNED
398,398,0.14948230981826782,2023-01-05 20:34:52.250510,2023-01-05 20:35:26.294399,0 days 00:00:34.043889,sigmoid,0.05,2,0.9,0.03794463351368904,,,COMPLETE
399,399,0.11093991994857788,2023-01-05 20:35:26.433642,2023-01-05 20:35:33.146079,0 days 00:00:06.712437,sigmoid,0.1,2,0.5,0.11093991994857788,,,PRUNED
400,400,0.06758566945791245,2023-01-05 20:35:33.263787,2023-01-05 20:35:45.103797,0 days 00:00:11.840010,sigmoid,0.30000000000000004,2,0.55,0.06572364270687103,0.06758566945791245,,PRUNED
401,401,0.132801353931427,2023-01-05 20:35:45.227590,2023-01-05 20:36:17.363821,0 days 00:00:32.136231,relu,0.4,2,0.8500000000000001,0.04623741656541824,0.03361457213759422,,COMPLETE
402,402,0.039279088377952576,2023-01-05 20:36:17.497470,2023-01-05 20:36:44.565981,0 days 00:00:27.068511,sigmoid,0.15000000000000002,2,0.5,0.09367168694734573,0.05433066189289093,0.039279088377952576,PRUNED
403,403,0.038485798984766006,2023-01-05 20:36:44.691266,2023-01-05 20:37:11.588944,0 days 00:00:26.897678,sigmoid,0.1,2,0.5,0.08972447365522385,0.052555862814188004,0.038485798984766006,PRUNED
404,404,0.07579367607831955,2023-01-05 20:37:11.706363,2023-01-05 20:37:23.679778,0 days 00:00:11.973415,sigmoid,0.05,2,0.5,0.06517644226551056,0.07579367607831955,,PRUNED
405,405,0.04106320068240166,2023-01-05 20:37:23.771127,2023-01-05 20:37:50.902654,0 days 00:00:27.131527,sigmoid,0.0,3,0.65,0.04106320068240166,,,PRUNED
406,406,0.24607081711292267,2023-01-05 20:37:51.038737,2023-01-05 20:38:13.299766,0 days 00:00:22.261029,sigmoid,0.25,6,0.75,,,,COMPLETE
407,407,0.11612269282341003,2023-01-05 20:38:13.450727,2023-01-05 20:38:20.175380,0 days 00:00:06.724653,relu,0.15000000000000002,2,0.5,0.11612269282341003,,,PRUNED
408,408,0.13853907585144043,2023-01-05 20:38:20.301199,2023-01-05 20:38:54.851038,0 days 00:00:34.549839,tanh,0.1,2,0.7,0.037263669073581696,,,COMPLETE
409,409,0.042368821799755096,2023-01-05 20:38:54.967923,2023-01-05 20:39:21.629065,0 days 00:00:26.661142,sigmoid,0.05,2,0.6,0.042368821799755096,,,PRUNED
410,410,0.045024365186691284,2023-01-05 20:39:21.763228,2023-01-05 20:39:48.643773,0 days 00:00:26.880545,sigmoid,0.0,3,0.8500000000000001,0.045024365186691284,,,PRUNED
411,411,0.15314769744873047,2023-01-05 20:39:48.788189,2023-01-05 20:39:56.209419,0 days 00:00:07.421230,sigmoid,0.1,6,0.5,0.15314769744873047,,,PRUNED
412,412,0.07260927557945251,2023-01-05 20:39:56.311622,2023-01-05 20:40:08.175630,0 days 00:00:11.864008,relu,0.25,2,1.0,0.07260927557945251,,,PRUNED
413,413,0.22947239875793457,2023-01-05 20:40:08.307313,2023-01-05 20:40:15.525088,0 days 00:00:07.217775,relu,0.15000000000000002,7,0.6,0.22947239875793457,,,PRUNED
414,414,0.06191699951887131,2023-01-05 20:40:15.659166,2023-01-05 20:40:27.465846,0 days 00:00:11.806680,tanh,0.05,2,0.8500000000000001,0.07628574222326279,0.06191699951887131,,PRUNED
415,415,0.12155880779027939,2023-01-05 20:40:27.574931,2023-01-05 20:40:34.623585,0 days 00:00:07.048654,relu,0.15000000000000002,2,0.5,0.12155880779027939,,,PRUNED
416,416,0.14393794536590576,2023-01-05 20:40:34.757727,2023-01-05 20:41:09.134220,0 days 00:00:34.376493,relu,0.35000000000000003,2,0.8500000000000001,0.06340863555669785,0.03761705756187439,,COMPLETE
417,417,0.06687361001968384,2023-01-05 20:41:09.265131,2023-01-05 20:41:21.186254,0 days 00:00:11.921123,tanh,0.2,2,0.6,0.09693669527769089,0.06687361001968384,,PRUNED
418,418,0.1357431262731552,2023-01-05 20:41:21.312558,2023-01-05 20:41:28.361252,0 days 00:00:07.048694,sigmoid,0.1,2,0.55,0.1357431262731552,,,PRUNED
419,419,0.1022944524884224,2023-01-05 20:41:28.476172,2023-01-05 20:41:35.385723,0 days 00:00:06.909551,tanh,0.05,2,0.6,0.1022944524884224,,,PRUNED
420,420,0.08537186682224274,2023-01-05 20:41:35.519304,2023-01-05 20:41:47.526476,0 days 00:00:12.007172,tanh,0.15000000000000002,2,0.55,0.0631076842546463,0.08537186682224274,,PRUNED
421,421,0.070896215736866,2023-01-05 20:41:47.661324,2023-01-05 20:41:59.483910,0 days 00:00:11.822586,relu,0.4,2,0.8500000000000001,0.070896215736866,,,PRUNED
422,422,0.12701408565044403,2023-01-05 20:41:59.601324,2023-01-05 20:42:06.775024,0 days 00:00:07.173700,tanh,0.0,2,0.5,0.12701408565044403,,,PRUNED
423,423,0.1168365329504013,2023-01-05 20:42:06.897793,2023-01-05 20:42:13.824494,0 days 00:00:06.926701,tanh,0.15000000000000002,2,0.5,0.1168365329504013,,,PRUNED
424,424,0.14417098462581635,2023-01-05 20:42:13.915796,2023-01-05 20:42:45.723925,0 days 00:00:31.808129,relu,0.25,2,0.9,0.06338979303836823,0.03561745956540108,,COMPLETE
425,425,0.07576604187488556,2023-01-05 20:42:45.831735,2023-01-05 20:42:57.537865,0 days 00:00:11.706130,relu,0.35000000000000003,2,0.8,0.07576604187488556,,,PRUNED
426,426,0.07774873077869415,2023-01-05 20:42:57.660089,2023-01-05 20:43:09.745015,0 days 00:00:12.084926,relu,0.30000000000000004,2,0.7,0.07774873077869415,,,PRUNED
427,427,0.12801261246204376,2023-01-05 20:43:09.863582,2023-01-05 20:43:16.769756,0 days 00:00:06.906174,tanh,0.05,2,0.6,0.12801261246204376,,,PRUNED
428,428,0.1313805729150772,2023-01-05 20:43:16.885587,2023-01-05 20:43:29.135483,0 days 00:00:12.249896,relu,0.35000000000000003,7,0.65,0.1313805729150772,,,PRUNED
429,429,0.03933071345090866,2023-01-05 20:43:29.260564,2023-01-05 20:43:56.141108,0 days 00:00:26.880544,tanh,0.1,2,0.7,0.03933071345090866,,,PRUNED
430,430,0.134680837392807,2023-01-05 20:43:56.256099,2023-01-05 20:44:25.550744,0 days 00:00:29.294645,tanh,0.0,2,0.65,0.03272291645407677,,,COMPLETE
431,431,0.1339854598045349,2023-01-05 20:44:25.676324,2023-01-05 20:44:32.522850,0 days 00:00:06.846526,relu,0.15000000000000002,2,0.5,0.1339854598045349,,,PRUNED
432,432,0.15192082524299622,2023-01-05 20:44:32.628346,2023-01-05 20:45:04.231155,0 days 00:00:31.602809,tanh,0.0,2,0.65,0.03788332641124725,,,COMPLETE
433,433,0.08681114763021469,2023-01-05 20:45:04.346302,2023-01-05 20:45:16.393600,0 days 00:00:12.047298,relu,0.4,2,0.55,0.08681114763021469,,,PRUNED
434,434,0.13788695633411407,2023-01-05 20:45:16.529036,2023-01-05 20:45:23.376874,0 days 00:00:06.847838,tanh,0.05,2,0.55,0.13788695633411407,,,PRUNED
435,435,0.13339857757091522,2023-01-05 20:45:23.484376,2023-01-05 20:45:55.486629,0 days 00:00:32.002253,relu,0.4,2,0.6,0.05614570528268814,0.031214110553264618,,COMPLETE
436,436,0.13424061238765717,2023-01-05 20:45:55.723601,2023-01-05 20:46:25.036405,0 days 00:00:29.312804,tanh,0.0,2,0.65,0.03242071717977524,,,COMPLETE
437,437,0.11783895641565323,2023-01-05 20:46:25.159879,2023-01-05 20:46:32.172284,0 days 00:00:07.012405,tanh,0.15000000000000002,2,0.5,0.11783895641565323,,,PRUNED
438,438,0.060090065002441406,2023-01-05 20:46:32.285990,2023-01-05 20:46:44.245103,0 days 00:00:11.959113,relu,0.1,2,0.8500000000000001,0.08698713779449463,0.060090065002441406,,PRUNED
439,439,0.04210353642702103,2023-01-05 20:46:44.386539,2023-01-05 20:47:11.035427,0 days 00:00:26.648888,tanh,0.05,2,0.6,0.04210353642702103,,,PRUNED
440,440,0.04892154410481453,2023-01-05 20:47:11.148660,2023-01-05 20:47:38.032717,0 days 00:00:26.884057,tanh,0.0,3,0.95,0.04892154410481453,,,PRUNED
441,441,0.12079664319753647,2023-01-05 20:47:38.144718,2023-01-05 20:47:45.207849,0 days 00:00:07.063131,sigmoid,0.0,2,0.65,0.12079664319753647,,,PRUNED
442,442,0.1305476576089859,2023-01-05 20:47:45.326180,2023-01-05 20:47:52.057148,0 days 00:00:06.730968,relu,0.2,2,0.8,0.1305476576089859,,,PRUNED
443,443,0.12585091590881348,2023-01-05 20:47:52.175640,2023-01-05 20:47:58.998474,0 days 00:00:06.822834,relu,0.25,2,0.8,0.12585091590881348,,,PRUNED
444,444,0.12029355019330978,2023-01-05 20:47:59.123120,2023-01-05 20:48:06.281256,0 days 00:00:07.158136,relu,0.2,2,0.8500000000000001,0.12029355019330978,,,PRUNED
445,445,0.0762614831328392,2023-01-05 20:48:06.400565,2023-01-05 20:48:18.180354,0 days 00:00:11.779789,relu,0.45,2,0.6,0.0762614831328392,,,PRUNED
446,446,0.042472176253795624,2023-01-05 20:48:18.302882,2023-01-05 20:48:45.161664,0 days 00:00:26.858782,tanh,0.0,2,0.9,0.042472176253795624,,,PRUNED
447,447,0.14300179481506348,2023-01-05 20:48:45.269637,2023-01-05 20:49:17.017409,0 days 00:00:31.747772,relu,0.4,2,0.6,0.05475185066461563,0.034419458359479904,,COMPLETE
448,448,0.13240817189216614,2023-01-05 20:49:17.136024,2023-01-05 20:49:46.592182,0 days 00:00:29.456158,relu,0.15000000000000002,2,0.8500000000000001,0.0761004090309143,0.04334457218647003,0.03333576023578644,COMPLETE
449,449,0.03790745884180069,2023-01-05 20:49:46.723440,2023-01-05 20:50:13.271690,0 days 00:00:26.548250,relu,0.4,2,0.6,0.05809584632515907,0.03790745884180069,,PRUNED
450,450,0.1381026804447174,2023-01-05 20:50:13.421193,2023-01-05 20:50:42.447305,0 days 00:00:29.026112,relu,0.35000000000000003,2,0.95,0.06391751021146774,0.035477422177791595,,COMPLETE
451,451,0.13704252243041992,2023-01-05 20:50:42.555155,2023-01-05 20:51:16.597431,0 days 00:00:34.042276,tanh,0.05,2,0.8,0.03623553737998009,,,COMPLETE
452,452,0.06940975040197372,2023-01-05 20:51:16.719238,2023-01-05 20:51:28.335898,0 days 00:00:11.616660,tanh,0.35000000000000003,2,0.95,0.06940975040197372,,,PRUNED
453,453,0.10454195737838745,2023-01-05 20:51:28.452639,2023-01-05 20:51:35.177049,0 days 00:00:06.724410,relu,0.15000000000000002,2,0.8500000000000001,0.10454195737838745,,,PRUNED
454,454,0.06141655519604683,2023-01-05 20:51:35.292787,2023-01-05 20:51:46.959490,0 days 00:00:11.666703,relu,0.15000000000000002,2,0.8500000000000001,0.08830900490283966,0.06141655519604683,,PRUNED
455,455,0.1398710310459137,2023-01-05 20:51:47.067032,2023-01-05 20:52:16.381666,0 days 00:00:29.314634,tanh,0.05,2,0.75,0.03629093989729881,,,COMPLETE
456,456,0.12311625480651855,2023-01-05 20:52:16.515030,2023-01-05 20:52:23.173802,0 days 00:00:06.658772,tanh,0.15000000000000002,2,0.6,0.12311625480651855,,,PRUNED
457,457,0.07283827662467957,2023-01-05 20:52:23.292169,2023-01-05 20:52:34.972536,0 days 00:00:11.680367,relu,0.45,2,0.9,0.07283827662467957,,,PRUNED
458,458,0.05585870519280434,2023-01-05 20:52:35.087278,2023-01-05 20:53:01.895502,0 days 00:00:26.808224,tanh,0.05,3,0.8,0.05585870519280434,,,PRUNED
459,459,0.06945518404245377,2023-01-05 20:53:02.011248,2023-01-05 20:53:14.002929,0 days 00:00:11.991681,relu,0.35000000000000003,2,0.65,0.06945518404245377,,,PRUNED
460,460,0.08314459025859833,2023-01-05 20:53:14.119950,2023-01-05 20:53:25.834880,0 days 00:00:11.714930,relu,0.35000000000000003,2,1.0,0.08314459025859833,,,PRUNED
461,461,0.03880869597196579,2023-01-05 20:53:25.955129,2023-01-05 20:53:52.633653,0 days 00:00:26.678524,tanh,0.15000000000000002,2,0.5,0.09812016785144806,0.055923718959093094,0.03880869597196579,PRUNED
462,462,0.16025876998901367,2023-01-05 20:53:52.751095,2023-01-05 20:54:19.633124,0 days 00:00:26.882029,relu,0.25,2,0.95,0.05839595943689346,0.037387508898973465,,COMPLETE
463,463,0.13607320189476013,2023-01-05 20:54:19.751740,2023-01-05 20:54:48.786010,0 days 00:00:29.034270,tanh,0.0,2,0.8500000000000001,0.033498261123895645,,,COMPLETE
464,464,0.13713812828063965,2023-01-05 20:54:48.924547,2023-01-05 20:55:17.992581,0 days 00:00:29.068034,tanh,0.0,2,0.8500000000000001,0.033939819782972336,,,COMPLETE
465,465,0.0588124580681324,2023-01-05 20:55:18.113005,2023-01-05 20:55:29.892626,0 days 00:00:11.779621,relu,0.15000000000000002,2,0.5,0.061706118285655975,0.0588124580681324,,PRUNED
466,466,0.034641966223716736,2023-01-05 20:55:29.994371,2023-01-05 20:55:57.232293,0 days 00:00:27.237922,sigmoid,0.05,2,0.5,0.066678985953331,0.04964190721511841,0.034641966223716736,PRUNED
467,467,0.13556915521621704,2023-01-05 20:55:57.352330,2023-01-05 20:56:04.231765,0 days 00:00:06.879435,sigmoid,0.05,2,0.5,0.13556915521621704,,,PRUNED
468,468,0.06302241235971451,2023-01-05 20:56:04.347508,2023-01-05 20:56:16.205863,0 days 00:00:11.858355,sigmoid,0.05,2,0.5,0.08714791387319565,0.06302241235971451,,PRUNED
469,469,0.13106638193130493,2023-01-05 20:56:16.305865,2023-01-05 20:56:45.984497,0 days 00:00:29.678632,sigmoid,0.05,2,0.5,0.06371191143989563,0.03915334865450859,0.03129551187157631,COMPLETE
470,470,0.12538951635360718,2023-01-05 20:56:46.123044,2023-01-05 20:56:53.069756,0 days 00:00:06.946712,sigmoid,0.05,2,0.5,0.12538951635360718,,,PRUNED
471,471,0.08937367796897888,2023-01-05 20:56:53.180165,2023-01-05 20:57:05.018856,0 days 00:00:11.838691,relu,0.30000000000000004,2,0.55,0.08937367796897888,,,PRUNED
472,472,0.1305965781211853,2023-01-05 20:57:05.129270,2023-01-05 20:57:39.540801,0 days 00:00:34.411531,sigmoid,0.05,2,0.5,0.06499246507883072,0.042872268706560135,0.03268064558506012,COMPLETE
473,473,0.04369252920150757,2023-01-05 20:57:39.651343,2023-01-05 20:58:06.522551,0 days 00:00:26.871208,tanh,0.05,2,0.8,0.04369252920150757,,,PRUNED
474,474,0.1189107820391655,2023-01-05 20:58:06.649625,2023-01-05 20:58:13.455361,0 days 00:00:06.805736,sigmoid,0.05,2,0.5,0.1189107820391655,,,PRUNED
475,475,0.133490189909935,2023-01-05 20:58:13.582390,2023-01-05 20:58:20.313037,0 days 00:00:06.730647,sigmoid,0.05,2,0.5,0.133490189909935,,,PRUNED
476,476,0.0828283503651619,2023-01-05 20:58:20.429363,2023-01-05 20:58:32.212283,0 days 00:00:11.782920,relu,0.4,2,0.95,0.0828283503651619,,,PRUNED
477,477,0.03580609709024429,2023-01-05 20:58:32.337364,2023-01-05 20:58:59.501898,0 days 00:00:27.164534,sigmoid,0.05,2,0.5,0.0646565780043602,0.04963593930006027,0.03580609709024429,PRUNED
478,478,0.22530882060527802,2023-01-05 20:58:59.619640,2023-01-05 20:59:11.825963,0 days 00:00:12.206323,relu,0.35000000000000003,6,0.55,0.22530882060527802,,,PRUNED
479,479,0.13060501217842102,2023-01-05 20:59:11.942706,2023-01-05 20:59:18.809292,0 days 00:00:06.866586,sigmoid,0.05,2,0.5,0.13060501217842102,,,PRUNED
480,480,0.0384872704744339,2023-01-05 20:59:18.943895,2023-01-05 20:59:45.806736,0 days 00:00:26.862841,sigmoid,0.05,2,0.5,0.08314806967973709,0.05117897316813469,0.0384872704744339,PRUNED
481,481,0.07098663598299026,2023-01-05 20:59:45.923480,2023-01-05 20:59:58.164148,0 days 00:00:12.240668,sigmoid,0.05,2,0.5,0.0784439668059349,0.07098663598299026,,PRUNED
482,482,0.13446104526519775,2023-01-05 20:59:58.289334,2023-01-05 21:00:27.776456,0 days 00:00:29.487122,relu,0.2,2,0.8500000000000001,0.05507105588912964,0.03347605839371681,,COMPLETE
483,483,0.11686566472053528,2023-01-05 21:00:27.897377,2023-01-05 21:00:34.819712,0 days 00:00:06.922335,sigmoid,0.05,2,0.5,0.11686566472053528,,,PRUNED
484,484,0.06194237992167473,2023-01-05 21:00:34.936060,2023-01-05 21:00:47.127115,0 days 00:00:12.191055,sigmoid,0.1,2,0.5,0.09289713203907013,0.06194237992167473,,PRUNED
485,485,0.11507932096719742,2023-01-05 21:00:47.254194,2023-01-05 21:00:54.060031,0 days 00:00:06.805837,sigmoid,0.05,2,0.5,0.11507932096719742,,,PRUNED
486,486,0.04075930267572403,2023-01-05 21:00:54.178673,2023-01-05 21:01:20.991240,0 days 00:00:26.812567,relu,0.2,2,0.75,0.0627794861793518,0.04075930267572403,,PRUNED
487,487,0.12924961745738983,2023-01-05 21:01:21.118314,2023-01-05 21:01:57.914594,0 days 00:00:36.796280,relu,0.2,2,0.8500000000000001,0.05544206127524376,0.03291502967476845,,COMPLETE
488,488,0.08099918812513351,2023-01-05 21:01:58.036880,2023-01-05 21:02:10.029208,0 days 00:00:11.992328,relu,0.2,2,0.8500000000000001,0.08099918812513351,,,PRUNED
489,489,0.12629999220371246,2023-01-05 21:02:10.145948,2023-01-05 21:02:16.995349,0 days 00:00:06.849401,sigmoid,0.5,2,0.75,0.12629999220371246,,,PRUNED
490,490,0.03891428932547569,2023-01-05 21:02:17.112090,2023-01-05 21:02:43.868321,0 days 00:00:26.756231,tanh,0.0,2,0.8,0.03891428932547569,,,PRUNED
491,491,0.09168950468301773,2023-01-05 21:02:43.994407,2023-01-05 21:02:55.900607,0 days 00:00:11.906200,relu,0.2,2,0.8500000000000001,0.09168950468301773,,,PRUNED
492,492,0.10611582547426224,2023-01-05 21:02:56.017489,2023-01-05 21:03:03.133534,0 days 00:00:07.116045,sigmoid,0.1,2,0.5,0.10611582547426224,,,PRUNED
493,493,0.04395885393023491,2023-01-05 21:03:03.241941,2023-01-05 21:03:29.948184,0 days 00:00:26.706243,tanh,0.0,2,0.8500000000000001,0.04395885393023491,,,PRUNED
494,494,0.04318203032016754,2023-01-05 21:03:30.065931,2023-01-05 21:03:57.054476,0 days 00:00:26.988545,relu,0.2,3,0.8,0.05853432044386864,0.04318203032016754,,PRUNED
495,495,0.13831911981105804,2023-01-05 21:03:57.169051,2023-01-05 21:04:24.421885,0 days 00:00:27.252834,relu,0.05,2,0.5,0.058080125600099564,0.05045536532998085,0.02849184162914753,COMPLETE
496,496,0.11914995312690735,2023-01-05 21:04:24.550838,2023-01-05 21:04:31.318557,0 days 00:00:06.767719,relu,0.05,2,0.5,0.11914995312690735,,,PRUNED
497,497,0.36045944690704346,2023-01-05 21:04:31.462070,2023-01-05 21:04:51.384501,0 days 00:00:19.922431,tanh,0.05,8,0.55,,,,COMPLETE
498,498,0.1316828727722168,2023-01-05 21:04:51.510477,2023-01-05 21:05:30.827690,0 days 00:00:39.317213,relu,0.2,2,0.8500000000000001,0.056266073137521744,0.03418326377868652,,COMPLETE
499,499,0.06769083440303802,2023-01-05 21:05:30.940826,2023-01-05 21:05:42.838173,0 days 00:00:11.897347,relu,0.2,2,0.8500000000000001,0.06769083440303802,,,PRUNED
500,500,0.07003932446241379,2023-01-05 21:05:42.946579,2023-01-05 21:05:54.587713,0 days 00:00:11.641134,relu,0.15000000000000002,2,0.8500000000000001,0.07003932446241379,,,PRUNED
501,501,0.11484964191913605,2023-01-05 21:05:54.705036,2023-01-05 21:06:01.528427,0 days 00:00:06.823391,relu,0.05,2,0.5,0.11484964191913605,,,PRUNED
502,502,0.041548434644937515,2023-01-05 21:06:01.646906,2023-01-05 21:06:28.484737,0 days 00:00:26.837831,tanh,0.0,2,0.7,0.041548434644937515,,,PRUNED
503,503,0.03551609069108963,2023-01-05 21:06:28.603436,2023-01-05 21:06:55.616021,0 days 00:00:27.012585,relu,0.05,2,0.5,0.0667881965637207,0.04990236833691597,0.03551609069108963,PRUNED
504,504,0.138035848736763,2023-01-05 21:06:55.733766,2023-01-05 21:07:25.148065,0 days 00:00:29.414299,relu,0.25,2,0.8,0.04930155724287033,0.03394569456577301,,COMPLETE
505,505,0.07918554544448853,2023-01-05 21:07:25.258209,2023-01-05 21:07:37.054556,0 days 00:00:11.796347,relu,0.2,2,0.8,0.07918554544448853,,,PRUNED
506,506,0.09800083190202713,2023-01-05 21:07:37.173303,2023-01-05 21:07:49.545283,0 days 00:00:12.371980,relu,0.1,4,0.5,0.08696684241294861,0.09800083190202713,,PRUNED
507,507,0.13351547718048096,2023-01-05 21:07:49.671357,2023-01-05 21:07:56.477855,0 days 00:00:06.806498,relu,0.15000000000000002,2,0.5,0.13351547718048096,,,PRUNED
508,508,0.1311701089143753,2023-01-05 21:07:56.593837,2023-01-05 21:08:03.443929,0 days 00:00:06.850092,sigmoid,0.15000000000000002,2,0.5,0.1311701089143753,,,PRUNED
509,509,0.05493994429707527,2023-01-05 21:08:03.565193,2023-01-05 21:08:15.434635,0 days 00:00:11.869442,relu,0.1,2,0.5,0.09010513126850128,0.05493994429707527,,PRUNED
510,510,0.07760852575302124,2023-01-05 21:08:15.566289,2023-01-05 21:08:27.691607,0 days 00:00:12.125318,relu,0.25,2,0.9,0.07760852575302124,,,PRUNED
511,511,0.13202203810214996,2023-01-05 21:08:27.812947,2023-01-05 21:09:04.737344,0 days 00:00:36.924397,relu,0.2,2,0.8500000000000001,0.05950379744172096,0.034592773765325546,,COMPLETE
512,512,0.05670143663883209,2023-01-05 21:09:04.862252,2023-01-05 21:09:16.729701,0 days 00:00:11.867449,sigmoid,0.15000000000000002,2,0.55,0.09377355128526688,0.05670143663883209,,PRUNED
513,513,0.15138861536979675,2023-01-05 21:09:16.859865,2023-01-05 21:09:24.170612,0 days 00:00:07.310747,relu,0.1,5,0.9,0.15138861536979675,,,PRUNED
514,514,0.1408744901418686,2023-01-05 21:09:24.275778,2023-01-05 21:09:30.995296,0 days 00:00:06.719518,sigmoid,0.4,2,0.5,0.1408744901418686,,,PRUNED
515,515,0.15400466322898865,2023-01-05 21:09:31.117939,2023-01-05 21:10:00.352034,0 days 00:00:29.234095,tanh,0.0,2,0.8500000000000001,0.038138825446367264,,,COMPLETE
516,516,0.04039891064167023,2023-01-05 21:10:00.459067,2023-01-05 21:10:27.024394,0 days 00:00:26.565327,tanh,0.05,2,0.65,0.04039891064167023,,,PRUNED
517,517,0.08019930124282837,2023-01-05 21:10:27.151968,2023-01-05 21:10:39.206817,0 days 00:00:12.054849,relu,0.2,2,0.8500000000000001,0.08019930124282837,,,PRUNED
518,518,0.06582637876272202,2023-01-05 21:10:39.329462,2023-01-05 21:10:51.164238,0 days 00:00:11.834776,relu,0.25,2,0.5,0.09444868564605713,0.06582637876272202,,PRUNED
519,519,0.13772383332252502,2023-01-05 21:10:51.293216,2023-01-05 21:11:20.710627,0 days 00:00:29.417411,relu,0.15000000000000002,2,0.8500000000000001,0.04433829337358475,0.03419695049524307,,COMPLETE
520,520,0.044005386531353,2023-01-05 21:11:20.828000,2023-01-05 21:11:48.084947,0 days 00:00:27.256947,tanh,0.1,3,0.75,0.044005386531353,,,PRUNED
521,521,0.036158062517642975,2023-01-05 21:11:48.224036,2023-01-05 21:12:15.308305,0 days 00:00:27.084269,sigmoid,0.05,2,0.7,0.06986910849809647,0.05195622518658638,0.036158062517642975,PRUNED
522,522,0.07946780323982239,2023-01-05 21:12:15.428760,2023-01-05 21:12:27.364844,0 days 00:00:11.936084,tanh,0.15000000000000002,2,0.8500000000000001,0.07946780323982239,,,PRUNED
523,523,0.10987568646669388,2023-01-05 21:12:27.495764,2023-01-05 21:12:34.323137,0 days 00:00:06.827373,relu,0.15000000000000002,2,0.5,0.10987568646669388,,,PRUNED
