,number,value,datetime_start,datetime_complete,duration,params_activation,params_dropout,params_layers,params_shrink,system_attrs_completed_rung_0,system_attrs_completed_rung_1,system_attrs_completed_rung_2,state
2212,2212,0.038548942655324936,2023-01-06 04:47:02.731948,2023-01-06 04:47:29.872135,0 days 00:00:27.140187,relu,0.2,2,0.7,0.05758190527558327,0.038548942655324936,,PRUNED
2213,2213,0.08251169323921204,2023-01-06 04:47:29.986866,2023-01-06 04:47:41.847217,0 days 00:00:11.860351,relu,0.45,2,0.8500000000000001,0.08251169323921204,,,PRUNED
2214,2214,0.04303038865327835,2023-01-06 04:47:41.943603,2023-01-06 04:48:08.719154,0 days 00:00:26.775551,relu,0.4,2,0.8500000000000001,0.05692523345351219,0.04303038865327835,,PRUNED
2215,2215,0.1047358512878418,2023-01-06 04:48:08.817544,2023-01-06 04:48:15.903939,0 days 00:00:07.086395,sigmoid,0.35000000000000003,2,0.5,0.1047358512878418,,,PRUNED
2216,2216,0.1328442096710205,2023-01-06 04:48:15.999325,2023-01-06 04:48:22.969233,0 days 00:00:06.969908,sigmoid,0.30000000000000004,2,0.5,0.1328442096710205,,,PRUNED
2217,2217,0.07380178570747375,2023-01-06 04:48:23.067456,2023-01-06 04:48:34.843149,0 days 00:00:11.775693,relu,0.30000000000000004,2,0.7,0.07380178570747375,,,PRUNED
2218,2218,0.0815042033791542,2023-01-06 04:48:34.959211,2023-01-06 04:48:46.875559,0 days 00:00:11.916348,relu,0.4,2,0.6,0.0815042033791542,,,PRUNED
2219,2219,0.04306435585021973,2023-01-06 04:48:47.187954,2023-01-06 04:49:14.147901,0 days 00:00:26.959947,tanh,0.2,2,1.0,0.04306435585021973,,,PRUNED
2220,2220,0.1350020170211792,2023-01-06 04:49:14.246856,2023-01-06 04:49:46.194094,0 days 00:00:31.947238,relu,0.35000000000000003,2,0.8,0.04704120010137558,0.03234170377254486,,COMPLETE
2221,2221,0.09847099334001541,2023-01-06 04:49:46.303409,2023-01-06 04:49:53.387616,0 days 00:00:07.084207,sigmoid,0.0,2,0.8500000000000001,0.09847099334001541,,,PRUNED
2222,2222,0.1241309866309166,2023-01-06 04:49:53.476183,2023-01-06 04:50:00.478245,0 days 00:00:07.002062,sigmoid,0.30000000000000004,2,0.5,0.1241309866309166,,,PRUNED
2223,2223,0.057897426187992096,2023-01-06 04:50:00.601711,2023-01-06 04:50:12.635640,0 days 00:00:12.033929,sigmoid,0.2,2,0.5,0.08371400088071823,0.057897426187992096,,PRUNED
2224,2224,0.07174739986658096,2023-01-06 04:50:12.734034,2023-01-06 04:50:24.893056,0 days 00:00:12.159022,sigmoid,0.30000000000000004,2,0.65,0.07303409278392792,0.07174739986658096,,PRUNED
2225,2225,0.08143741637468338,2023-01-06 04:50:24.991428,2023-01-06 04:50:36.875451,0 days 00:00:11.884023,relu,0.2,2,0.9,0.08143741637468338,,,PRUNED
2226,2226,0.040530089288949966,2023-01-06 04:50:36.973601,2023-01-06 04:51:03.472401,0 days 00:00:26.498800,tanh,0.30000000000000004,2,0.95,0.040530089288949966,,,PRUNED
2227,2227,0.05973818525671959,2023-01-06 04:51:03.581123,2023-01-06 04:51:15.822457,0 days 00:00:12.241334,sigmoid,0.2,2,0.5,0.09430384635925293,0.05973818525671959,,PRUNED
2228,2228,0.07669644057750702,2023-01-06 04:51:15.952170,2023-01-06 04:51:27.846238,0 days 00:00:11.894068,relu,0.15000000000000002,2,0.55,0.07669644057750702,,,PRUNED
2229,2229,0.04379385709762573,2023-01-06 04:51:27.943921,2023-01-06 04:51:54.477433,0 days 00:00:26.533512,tanh,0.25,2,0.95,0.04379385709762573,,,PRUNED
2230,2230,0.13253772258758545,2023-01-06 04:51:54.583537,2023-01-06 04:52:01.785591,0 days 00:00:07.202054,sigmoid,0.0,2,0.5,0.13253772258758545,,,PRUNED
2231,2231,0.12697888910770416,2023-01-06 04:52:01.881969,2023-01-06 04:52:08.843380,0 days 00:00:06.961411,sigmoid,0.30000000000000004,2,0.5,0.12697888910770416,,,PRUNED
2232,2232,0.13507585227489471,2023-01-06 04:52:08.933435,2023-01-06 04:52:15.834512,0 days 00:00:06.901077,sigmoid,0.0,2,0.5,0.13507585227489471,,,PRUNED
2233,2233,0.0711560770869255,2023-01-06 04:52:15.958898,2023-01-06 04:52:27.991914,0 days 00:00:12.033016,relu,0.4,2,0.7,0.0711560770869255,,,PRUNED
2234,2234,0.059100378304719925,2023-01-06 04:52:28.090303,2023-01-06 04:52:40.290813,0 days 00:00:12.200510,sigmoid,0.2,2,0.5,0.08013884723186493,0.059100378304719925,,PRUNED
2235,2235,0.13496246933937073,2023-01-06 04:52:40.387356,2023-01-06 04:53:09.975205,0 days 00:00:29.587849,relu,0.2,2,0.65,0.06013105437159538,0.03330925479531288,,COMPLETE
2236,2236,0.13152001798152924,2023-01-06 04:53:10.097400,2023-01-06 04:53:16.938901,0 days 00:00:06.841501,sigmoid,0.30000000000000004,2,1.0,0.13152001798152924,,,PRUNED
2237,2237,0.03360803425312042,2023-01-06 04:53:17.042869,2023-01-06 04:53:44.069401,0 days 00:00:27.026532,sigmoid,0.2,2,0.5,0.07271222025156021,0.052950941026210785,0.03360803425312042,PRUNED
2238,2238,0.07867308706045151,2023-01-06 04:53:44.176121,2023-01-06 04:53:56.518445,0 days 00:00:12.342324,relu,0.45,4,0.75,0.07867308706045151,,,PRUNED
2239,2239,0.10058874636888504,2023-01-06 04:53:56.624170,2023-01-06 04:54:03.576233,0 days 00:00:06.952063,sigmoid,0.30000000000000004,2,0.5,0.10058874636888504,,,PRUNED
2240,2240,0.11139196157455444,2023-01-06 04:54:03.680952,2023-01-06 04:54:10.626689,0 days 00:00:06.945737,sigmoid,0.0,2,0.5,0.11139196157455444,,,PRUNED
2241,2241,0.08150764554738998,2023-01-06 04:54:10.733416,2023-01-06 04:54:22.857082,0 days 00:00:12.123666,sigmoid,0.1,2,0.8500000000000001,0.08150764554738998,,,PRUNED
2242,2242,0.07726208865642548,2023-01-06 04:54:22.964808,2023-01-06 04:54:34.882162,0 days 00:00:11.917354,tanh,0.25,2,0.8500000000000001,0.07726208865642548,,,PRUNED
2243,2243,0.05836809426546097,2023-01-06 04:54:34.986750,2023-01-06 04:54:47.022896,0 days 00:00:12.036146,sigmoid,0.1,2,0.5,0.08661679923534393,0.05836809426546097,,PRUNED
2244,2244,0.06088482216000557,2023-01-06 04:54:47.146282,2023-01-06 04:54:59.421862,0 days 00:00:12.275580,sigmoid,0.35000000000000003,2,0.5,0.07634474337100983,0.06088482216000557,,PRUNED
2245,2245,0.1763741672039032,2023-01-06 04:54:59.552537,2023-01-06 04:55:11.929314,0 days 00:00:12.376777,relu,0.4,6,0.55,0.1763741672039032,,,PRUNED
2246,2246,0.041692573577165604,2023-01-06 04:55:12.034311,2023-01-06 04:55:38.976234,0 days 00:00:26.941923,relu,0.2,2,0.7,0.060813240706920624,0.041692573577165604,,PRUNED
2247,2247,0.035983480513095856,2023-01-06 04:55:39.097896,2023-01-06 04:56:06.425124,0 days 00:00:27.327228,sigmoid,0.2,2,0.5,0.09156244993209839,0.051792461425065994,0.035983480513095856,PRUNED
2248,2248,0.14352992177009583,2023-01-06 04:56:06.556126,2023-01-06 04:56:38.312135,0 days 00:00:31.756009,tanh,0.2,2,0.95,0.032955583184957504,,,COMPLETE
2249,2249,0.12837372720241547,2023-01-06 04:56:38.421877,2023-01-06 04:56:45.349452,0 days 00:00:06.927575,sigmoid,0.30000000000000004,3,0.95,0.12837372720241547,,,PRUNED
2250,2250,0.06236153841018677,2023-01-06 04:56:45.462464,2023-01-06 04:56:57.640172,0 days 00:00:12.177708,sigmoid,0.25,2,0.5,0.058815762400627136,0.06236153841018677,,PRUNED
2251,2251,0.10002098977565765,2023-01-06 04:56:57.767848,2023-01-06 04:57:04.656304,0 days 00:00:06.888456,sigmoid,0.1,2,0.5,0.10002098977565765,,,PRUNED
2252,2252,0.1356033831834793,2023-01-06 04:57:04.768313,2023-01-06 04:57:34.167263,0 days 00:00:29.398950,relu,0.25,2,0.65,0.0488915853202343,0.03303110599517822,,COMPLETE
2253,2253,0.07552800327539444,2023-01-06 04:57:34.451041,2023-01-06 04:57:46.294766,0 days 00:00:11.843725,relu,0.35000000000000003,2,0.75,0.07552800327539444,,,PRUNED
2254,2254,0.055597759783267975,2023-01-06 04:57:46.404007,2023-01-06 04:57:58.402173,0 days 00:00:11.998166,sigmoid,0.25,2,0.5,0.08525951951742172,0.055597759783267975,,PRUNED
2255,2255,0.13908545672893524,2023-01-06 04:57:58.504848,2023-01-06 04:58:30.415851,0 days 00:00:31.911003,tanh,0.25,2,0.95,0.03589101880788803,,,COMPLETE
2256,2256,0.10282687097787857,2023-01-06 04:58:30.533880,2023-01-06 04:58:37.582447,0 days 00:00:07.048567,sigmoid,0.4,4,0.5,0.10282687097787857,,,PRUNED
2257,2257,0.0799921303987503,2023-01-06 04:58:37.705178,2023-01-06 04:58:49.647918,0 days 00:00:11.942740,relu,0.2,2,0.8500000000000001,0.0799921303987503,,,PRUNED
2258,2258,0.07475443184375763,2023-01-06 04:58:49.771422,2023-01-06 04:59:01.847299,0 days 00:00:12.075877,relu,0.4,2,0.7,0.07475443184375763,,,PRUNED
2259,2259,0.06239819899201393,2023-01-06 04:59:01.981591,2023-01-06 04:59:14.046368,0 days 00:00:12.064777,sigmoid,0.2,2,0.9,0.0693373903632164,0.06239819899201393,,PRUNED
2260,2260,0.14558784663677216,2023-01-06 04:59:14.145523,2023-01-06 04:59:41.212744,0 days 00:00:27.067221,relu,0.45,2,0.6,0.054653242230415344,0.03412066772580147,,COMPLETE
2261,2261,0.1314230114221573,2023-01-06 04:59:41.323073,2023-01-06 05:00:11.045794,0 days 00:00:29.722721,sigmoid,0.0,2,0.65,0.06006646156311035,0.05208113044500351,0.03230523318052292,COMPLETE
2262,2262,0.12699729204177856,2023-01-06 05:00:11.155131,2023-01-06 05:00:17.966454,0 days 00:00:06.811323,sigmoid,0.0,2,0.65,0.12699729204177856,,,PRUNED
2263,2263,0.06437920778989792,2023-01-06 05:00:18.064575,2023-01-06 05:00:30.048861,0 days 00:00:11.984286,sigmoid,0.0,2,0.65,0.08201654255390167,0.06437920778989792,,PRUNED
2264,2264,0.06651284545660019,2023-01-06 05:00:30.347148,2023-01-06 05:00:42.339587,0 days 00:00:11.992439,relu,0.25,2,0.65,0.06651284545660019,,,PRUNED
2265,2265,0.09265457838773727,2023-01-06 05:00:42.438706,2023-01-06 05:00:54.321910,0 days 00:00:11.883204,relu,0.2,2,0.8500000000000001,0.09265457838773727,,,PRUNED
2266,2266,0.08235806226730347,2023-01-06 05:00:54.449113,2023-01-06 05:01:06.562676,0 days 00:00:12.113563,relu,0.4,2,0.8,0.08235806226730347,,,PRUNED
2267,2267,0.13540583848953247,2023-01-06 05:01:06.695808,2023-01-06 05:01:43.653215,0 days 00:00:36.957407,relu,0.2,2,0.7,0.05628053843975067,0.03543867915868759,,COMPLETE
2268,2268,0.13276296854019165,2023-01-06 05:01:43.787723,2023-01-06 05:02:13.299741,0 days 00:00:29.512018,tanh,0.4,2,0.65,0.044021930545568466,0.032777123153209686,,COMPLETE
2269,2269,0.0437292754650116,2023-01-06 05:02:13.434366,2023-01-06 05:02:40.287866,0 days 00:00:26.853500,tanh,0.30000000000000004,2,0.95,0.0437292754650116,,,PRUNED
2270,2270,0.09996818751096725,2023-01-06 05:02:40.415988,2023-01-06 05:02:47.355990,0 days 00:00:06.940002,sigmoid,0.0,2,0.65,0.09996818751096725,,,PRUNED
2271,2271,0.08104633539915085,2023-01-06 05:02:47.472779,2023-01-06 05:02:59.379067,0 days 00:00:11.906288,tanh,0.4,2,0.65,0.08104633539915085,,,PRUNED
2272,2272,0.06479230523109436,2023-01-06 05:02:59.547847,2023-01-06 05:03:11.711453,0 days 00:00:12.163606,sigmoid,0.0,2,0.95,0.08428793400526047,0.06479230523109436,,PRUNED
2273,2273,0.1499032974243164,2023-01-06 05:03:11.835573,2023-01-06 05:03:18.819242,0 days 00:00:06.983669,sigmoid,0.0,2,0.65,0.1499032974243164,,,PRUNED
2274,2274,0.13044586777687073,2023-01-06 05:03:18.917361,2023-01-06 05:03:53.387394,0 days 00:00:34.470033,tanh,0.4,2,0.65,0.04456579312682152,0.03356901928782463,,COMPLETE
2275,2275,0.15025626122951508,2023-01-06 05:03:53.511614,2023-01-06 05:04:20.465315,0 days 00:00:26.953701,tanh,0.0,2,1.0,0.03312886506319046,,,COMPLETE
2276,2276,0.06590607017278671,2023-01-06 05:04:20.599643,2023-01-06 05:04:32.488979,0 days 00:00:11.889336,sigmoid,0.0,2,0.65,0.06457101553678513,0.06590607017278671,,PRUNED
2277,2277,0.06192360073328018,2023-01-06 05:04:32.623044,2023-01-06 05:04:44.654282,0 days 00:00:12.031238,sigmoid,0.0,2,0.65,0.08862464129924774,0.06192360073328018,,PRUNED
2278,2278,0.10117164254188538,2023-01-06 05:04:44.781576,2023-01-06 05:04:51.937099,0 days 00:00:07.155523,sigmoid,0.0,2,0.65,0.10117164254188538,,,PRUNED
2279,2279,0.13366374373435974,2023-01-06 05:04:52.045551,2023-01-06 05:04:58.986560,0 days 00:00:06.941009,sigmoid,0.0,2,0.65,0.13366374373435974,,,PRUNED
2280,2280,0.1256149411201477,2023-01-06 05:04:59.092670,2023-01-06 05:05:10.994063,0 days 00:00:11.901393,sigmoid,0.0,2,0.6,0.08995842933654785,0.1256149411201477,,PRUNED
2281,2281,0.0627516582608223,2023-01-06 05:05:11.084758,2023-01-06 05:05:23.389927,0 days 00:00:12.305169,sigmoid,0.0,2,0.5,0.07829045504331589,0.0627516582608223,,PRUNED
2282,2282,0.10392829775810242,2023-01-06 05:05:23.509807,2023-01-06 05:05:30.484839,0 days 00:00:06.975032,sigmoid,0.0,2,0.65,0.10392829775810242,,,PRUNED
2283,2283,0.07109984755516052,2023-01-06 05:05:30.592594,2023-01-06 05:05:42.841525,0 days 00:00:12.248931,sigmoid,0.0,2,0.65,0.07099874317646027,0.07109984755516052,,PRUNED
2284,2284,0.1161714494228363,2023-01-06 05:05:42.942646,2023-01-06 05:05:49.940980,0 days 00:00:06.998334,sigmoid,0.0,2,0.65,0.1161714494228363,,,PRUNED
2285,2285,0.12311620265245438,2023-01-06 05:05:50.040102,2023-01-06 05:05:57.032099,0 days 00:00:06.991997,sigmoid,0.0,2,0.65,0.12311620265245438,,,PRUNED
2286,2286,0.1202346459031105,2023-01-06 05:05:57.141555,2023-01-06 05:06:04.007565,0 days 00:00:06.866010,sigmoid,0.0,2,0.65,0.1202346459031105,,,PRUNED
2287,2287,0.03908096253871918,2023-01-06 05:06:04.105697,2023-01-06 05:06:31.078484,0 days 00:00:26.972787,tanh,0.0,2,0.9,0.03908096253871918,,,PRUNED
2288,2288,0.13727188110351562,2023-01-06 05:06:31.203604,2023-01-06 05:06:38.154020,0 days 00:00:06.950416,sigmoid,0.0,2,0.65,0.13727188110351562,,,PRUNED
2289,2289,0.07364635169506073,2023-01-06 05:06:38.289395,2023-01-06 05:06:50.269220,0 days 00:00:11.979825,tanh,0.4,3,0.65,0.07364635169506073,,,PRUNED
2290,2290,0.0409436859190464,2023-01-06 05:06:50.383324,2023-01-06 05:07:17.574910,0 days 00:00:27.191586,tanh,0.4,2,0.65,0.055722687393426895,0.0409436859190464,,PRUNED
2291,2291,0.040247466415166855,2023-01-06 05:07:17.701034,2023-01-06 05:07:44.639499,0 days 00:00:26.938465,tanh,0.0,2,0.5,0.040247466415166855,,,PRUNED
2292,2292,0.0733063593506813,2023-01-06 05:07:44.764614,2023-01-06 05:07:56.855593,0 days 00:00:12.090979,sigmoid,0.0,2,0.65,0.09534580260515213,0.0733063593506813,,PRUNED
2293,2293,0.1520845592021942,2023-01-06 05:07:56.979344,2023-01-06 05:08:26.265800,0 days 00:00:29.286456,tanh,0.30000000000000004,2,0.95,0.03650468587875366,,,COMPLETE
2294,2294,0.09905696660280228,2023-01-06 05:08:26.380764,2023-01-06 05:08:34.311683,0 days 00:00:07.930919,sigmoid,0.0,3,0.6,0.09905696660280228,,,PRUNED
2295,2295,0.13112862408161163,2023-01-06 05:08:34.437805,2023-01-06 05:08:41.636121,0 days 00:00:07.198316,sigmoid,0.30000000000000004,2,0.65,0.13112862408161163,,,PRUNED
2296,2296,0.034032512456178665,2023-01-06 05:08:41.734240,2023-01-06 05:09:08.825695,0 days 00:00:27.091455,sigmoid,0.25,2,0.65,0.0860627219080925,0.05373837798833847,0.034032512456178665,PRUNED
2297,2297,0.3857027590274811,2023-01-06 05:09:08.949134,2023-01-06 05:09:16.351118,0 days 00:00:07.401984,sigmoid,0.30000000000000004,8,0.6,0.3857027590274811,,,PRUNED
2298,2298,0.06658089905977249,2023-01-06 05:09:16.457574,2023-01-06 05:09:28.557512,0 days 00:00:12.099938,tanh,0.4,2,0.65,0.06658089905977249,,,PRUNED
2299,2299,0.14103086292743683,2023-01-06 05:09:28.682618,2023-01-06 05:09:35.657965,0 days 00:00:06.975347,sigmoid,0.0,2,0.6,0.14103086292743683,,,PRUNED
2300,2300,0.08419078588485718,2023-01-06 05:09:35.765419,2023-01-06 05:09:48.022684,0 days 00:00:12.257265,tanh,0.4,4,0.65,0.08419078588485718,,,PRUNED
2301,2301,0.05820911377668381,2023-01-06 05:09:48.149802,2023-01-06 05:10:00.121355,0 days 00:00:11.971553,sigmoid,0.0,2,0.65,0.09421245753765106,0.05820911377668381,,PRUNED
2302,2302,0.0973329246044159,2023-01-06 05:10:00.240389,2023-01-06 05:10:07.212871,0 days 00:00:06.972482,sigmoid,0.30000000000000004,2,0.5,0.0973329246044159,,,PRUNED
2303,2303,0.12095873802900314,2023-01-06 05:10:07.337368,2023-01-06 05:10:14.470943,0 days 00:00:07.133575,tanh,0.25,2,0.5,0.12095873802900314,,,PRUNED
2304,2304,0.12029477953910828,2023-01-06 05:10:14.569766,2023-01-06 05:10:21.576346,0 days 00:00:07.006580,sigmoid,0.35000000000000003,2,0.5,0.12029477953910828,,,PRUNED
2305,2305,0.03737811744213104,2023-01-06 05:10:21.687891,2023-01-06 05:10:48.417159,0 days 00:00:26.729268,relu,0.0,2,0.9,0.03737811744213104,,,PRUNED
2306,2306,0.15328767895698547,2023-01-06 05:10:48.545015,2023-01-06 05:10:55.909126,0 days 00:00:07.364111,sigmoid,0.25,5,1.0,0.15328767895698547,,,PRUNED
2307,2307,0.041136495769023895,2023-01-06 05:10:56.035247,2023-01-06 05:11:22.781060,0 days 00:00:26.745813,tanh,0.5,2,0.95,0.041136495769023895,,,PRUNED
2308,2308,0.14411601424217224,2023-01-06 05:11:22.923623,2023-01-06 05:11:55.010084,0 days 00:00:32.086461,tanh,0.35000000000000003,2,0.65,0.060047175735235214,0.034686487168073654,,COMPLETE
2309,2309,0.12418490648269653,2023-01-06 05:11:55.132449,2023-01-06 05:12:01.954374,0 days 00:00:06.821925,sigmoid,0.0,2,0.5,0.12418490648269653,,,PRUNED
2310,2310,0.12464449554681778,2023-01-06 05:12:02.093406,2023-01-06 05:12:09.020168,0 days 00:00:06.926762,sigmoid,0.30000000000000004,2,0.5,0.12464449554681778,,,PRUNED
2311,2311,0.13703666627407074,2023-01-06 05:12:09.120293,2023-01-06 05:12:16.202949,0 days 00:00:07.082656,tanh,0.25,2,0.5,0.13703666627407074,,,PRUNED
2312,2312,0.10046301782131195,2023-01-06 05:12:16.310403,2023-01-06 05:12:23.369064,0 days 00:00:07.058661,sigmoid,0.1,2,0.5,0.10046301782131195,,,PRUNED
2313,2313,0.2591009736061096,2023-01-06 05:12:23.493180,2023-01-06 05:12:35.851437,0 days 00:00:12.358257,tanh,0.4,5,0.65,0.2591009736061096,,,PRUNED
2314,2314,0.11879265308380127,2023-01-06 05:12:35.975558,2023-01-06 05:12:42.900894,0 days 00:00:06.925336,sigmoid,0.2,2,0.5,0.11879265308380127,,,PRUNED
2315,2315,0.11861499398946762,2023-01-06 05:12:43.017937,2023-01-06 05:12:50.026350,0 days 00:00:07.008413,sigmoid,0.30000000000000004,2,0.65,0.11861499398946762,,,PRUNED
2316,2316,0.08887899667024612,2023-01-06 05:12:50.159800,2023-01-06 05:13:02.299406,0 days 00:00:12.139606,tanh,0.4,2,0.65,0.08887899667024612,,,PRUNED
2317,2317,0.10197073966264725,2023-01-06 05:13:02.424770,2023-01-06 05:13:09.382196,0 days 00:00:06.957426,sigmoid,0.25,2,0.5,0.10197073966264725,,,PRUNED
2318,2318,0.06765567511320114,2023-01-06 05:13:09.498990,2023-01-06 05:13:21.419850,0 days 00:00:11.920860,tanh,0.35000000000000003,2,0.65,0.06765567511320114,,,PRUNED
2319,2319,0.15923352539539337,2023-01-06 05:13:21.546048,2023-01-06 05:13:28.914521,0 days 00:00:07.368473,tanh,0.0,6,0.5,0.15923352539539337,,,PRUNED
2320,2320,0.06447512656450272,2023-01-06 05:13:29.023476,2023-01-06 05:13:40.888106,0 days 00:00:11.864630,tanh,0.45,2,0.65,0.06447512656450272,,,PRUNED
2321,2321,0.06198849156498909,2023-01-06 05:13:41.013218,2023-01-06 05:13:53.162156,0 days 00:00:12.148938,sigmoid,0.25,2,0.5,0.07489216327667236,0.06198849156498909,,PRUNED
2322,2322,0.1110905185341835,2023-01-06 05:13:53.290275,2023-01-06 05:14:00.195242,0 days 00:00:06.904967,sigmoid,0.1,2,0.5,0.1110905185341835,,,PRUNED
2323,2323,0.03807060793042183,2023-01-06 05:14:00.313739,2023-01-06 05:14:27.356436,0 days 00:00:27.042697,tanh,0.4,2,0.65,0.053330544382333755,0.03807060793042183,,PRUNED
2324,2324,0.04190251976251602,2023-01-06 05:14:27.477311,2023-01-06 05:14:54.464776,0 days 00:00:26.987465,tanh,0.4,2,0.65,0.05860954150557518,0.04190251976251602,,PRUNED
2325,2325,0.03812004253268242,2023-01-06 05:14:54.582561,2023-01-06 05:15:21.312712,0 days 00:00:26.730151,sigmoid,0.2,2,0.9,0.03812004253268242,,,PRUNED
2326,2326,0.11278076469898224,2023-01-06 05:15:21.430501,2023-01-06 05:15:28.444411,0 days 00:00:07.013910,sigmoid,0.2,2,0.5,0.11278076469898224,,,PRUNED
2327,2327,0.10642748326063156,2023-01-06 05:15:28.565744,2023-01-06 05:15:35.713220,0 days 00:00:07.147476,sigmoid,0.30000000000000004,2,0.5,0.10642748326063156,,,PRUNED
2328,2328,0.0714922696352005,2023-01-06 05:15:35.812728,2023-01-06 05:15:47.725711,0 days 00:00:11.912983,tanh,0.30000000000000004,2,0.65,0.0714922696352005,,,PRUNED
2329,2329,0.11921188235282898,2023-01-06 05:15:47.852750,2023-01-06 05:15:54.850633,0 days 00:00:06.997883,tanh,0.30000000000000004,3,0.65,0.11921188235282898,,,PRUNED
2330,2330,0.08482617884874344,2023-01-06 05:15:54.977921,2023-01-06 05:16:06.981884,0 days 00:00:12.003963,tanh,0.4,2,0.65,0.08482617884874344,,,PRUNED
2331,2331,0.06408718973398209,2023-01-06 05:16:07.083897,2023-01-06 05:16:18.955195,0 days 00:00:11.871298,tanh,0.35000000000000003,2,0.6,0.06408718973398209,,,PRUNED
2332,2332,0.03571232035756111,2023-01-06 05:16:19.074414,2023-01-06 05:16:45.862223,0 days 00:00:26.787809,tanh,0.4,2,0.65,0.05890278145670891,0.03571232035756111,,PRUNED
2333,2333,0.08407997339963913,2023-01-06 05:16:45.981328,2023-01-06 05:16:58.102942,0 days 00:00:12.121614,tanh,0.4,2,0.6,0.08407997339963913,,,PRUNED
2334,2334,0.06983095407485962,2023-01-06 05:16:58.231411,2023-01-06 05:17:10.077025,0 days 00:00:11.845614,tanh,0.45,2,0.65,0.06983095407485962,,,PRUNED
2335,2335,0.14628943800926208,2023-01-06 05:17:10.221130,2023-01-06 05:17:39.421143,0 days 00:00:29.200013,tanh,0.0,2,0.95,0.035586319863796234,,,COMPLETE
2336,2336,0.03843385726213455,2023-01-06 05:17:39.546553,2023-01-06 05:18:06.206046,0 days 00:00:26.659493,sigmoid,0.0,2,0.95,0.03843385726213455,,,PRUNED
2337,2337,0.05677975341677666,2023-01-06 05:18:06.327174,2023-01-06 05:18:18.329745,0 days 00:00:12.002571,sigmoid,0.0,2,0.5,0.07689900696277618,0.05677975341677666,,PRUNED
2338,2338,0.1479618400335312,2023-01-06 05:18:18.457804,2023-01-06 05:18:45.481229,0 days 00:00:27.023425,sigmoid,0.35000000000000003,2,0.5,0.07732994854450226,0.052038125693798065,0.03322327882051468,COMPLETE
2339,2339,0.054604850709438324,2023-01-06 05:18:45.618003,2023-01-06 05:19:12.642022,0 days 00:00:27.024019,tanh,0.0,3,0.9,0.054604850709438324,,,PRUNED
2340,2340,0.06539332866668701,2023-01-06 05:19:12.779829,2023-01-06 05:19:24.473963,0 days 00:00:11.694134,tanh,0.25,2,0.65,0.06539332866668701,,,PRUNED
2341,2341,0.07025180011987686,2023-01-06 05:19:24.601041,2023-01-06 05:19:36.299119,0 days 00:00:11.698078,tanh,0.4,2,0.65,0.07025180011987686,,,PRUNED
2342,2342,0.12850342690944672,2023-01-06 05:19:36.420230,2023-01-06 05:19:43.548563,0 days 00:00:07.128333,sigmoid,0.25,2,0.5,0.12850342690944672,,,PRUNED
