,number,value,datetime_start,datetime_complete,duration,params_activation,params_dropout,params_layers,params_shrink,system_attrs_completed_rung_0,system_attrs_completed_rung_1,system_attrs_completed_rung_2,state
275,275,0.9841048121452332,2022-12-28 12:04:28.071349,2022-12-28 12:06:23.778492,0 days 00:01:55.707143,tanh,0.05,3,0.6,0.9841048121452332,,,PRUNED
276,276,0.9697335362434387,2022-12-28 12:04:30.884909,2022-12-28 12:05:35.274426,0 days 00:01:04.389517,relu,0.2,8,1.0,0.9697335362434387,,,PRUNED
277,277,0.9844399690628052,2022-12-28 12:04:52.476535,2022-12-28 12:06:42.855821,0 days 00:01:50.379286,tanh,0.0,3,0.6,0.9844399690628052,,,PRUNED
278,278,0.966325044631958,2022-12-28 12:04:58.667161,2022-12-28 12:06:02.582235,0 days 00:01:03.915074,relu,0.2,8,1.0,0.966325044631958,,,PRUNED
279,279,0.9688279628753662,2022-12-28 12:05:22.734032,2022-12-28 12:06:29.179398,0 days 00:01:06.445366,relu,0.2,8,1.0,0.9688279628753662,,,PRUNED
280,280,0.9699786305427551,2022-12-28 12:05:26.641584,2022-12-28 12:06:30.379488,0 days 00:01:03.737904,relu,0.2,5,1.0,0.9699786305427551,,,PRUNED
281,281,0.9708132147789001,2022-12-28 12:05:35.740849,2022-12-28 12:06:36.237810,0 days 00:01:00.496961,relu,0.15000000000000002,5,0.9,0.9708132147789001,,,PRUNED
282,282,0.9864389300346375,2022-12-28 12:05:51.068777,2022-12-28 12:09:55.262648,0 days 00:04:04.193871,tanh,0.0,3,0.7,0.9863566756248474,,,COMPLETE
283,283,0.9836035966873169,2022-12-28 12:06:03.034646,2022-12-28 12:07:52.629220,0 days 00:01:49.594574,tanh,0.0,3,0.7,0.9836035966873169,,,PRUNED
284,284,0.988921046257019,2022-12-28 12:06:24.234906,2022-12-28 12:10:02.641351,0 days 00:03:38.406445,tanh,0.0,3,0.7,0.9879080057144165,,,COMPLETE
285,285,0.9862004518508911,2022-12-28 12:06:29.631809,2022-12-28 12:08:27.063511,0 days 00:01:57.431702,relu,0.15000000000000002,7,0.9,0.9746189117431641,0.9862004518508911,,PRUNED
286,286,0.9855321049690247,2022-12-28 12:06:30.949006,2022-12-28 12:10:11.775649,0 days 00:03:40.826643,relu,0.15000000000000002,5,0.6,0.9715021848678589,0.9871146082878113,,COMPLETE
287,287,0.9801140427589417,2022-12-28 12:06:36.731258,2022-12-28 12:08:28.585892,0 days 00:01:51.854634,tanh,0.0,3,0.7,0.9801140427589417,,,PRUNED
288,288,0.9679348468780518,2022-12-28 12:06:43.336259,2022-12-28 12:07:45.430680,0 days 00:01:02.094421,relu,0.4,5,0.65,0.9679348468780518,,,PRUNED
289,289,0.9841120839118958,2022-12-28 12:07:17.885656,2022-12-28 12:09:10.600066,0 days 00:01:52.714410,relu,0.2,5,0.6,0.9841120839118958,,,PRUNED
290,290,0.9704242944717407,2022-12-28 12:07:40.212940,2022-12-28 12:08:43.026019,0 days 00:01:02.813079,tanh,0.4,7,1.0,0.9704242944717407,,,PRUNED
291,291,0.9793899059295654,2022-12-28 12:07:40.464169,2022-12-28 12:09:30.606246,0 days 00:01:50.142077,tanh,0.0,3,0.6,0.9793899059295654,,,PRUNED
292,292,0.9857039451599121,2022-12-28 12:07:45.872080,2022-12-28 12:11:43.363909,0 days 00:03:57.491829,tanh,0.0,3,0.6,0.9863560795783997,,,COMPLETE
293,293,0.9827436804771423,2022-12-28 12:07:53.103650,2022-12-28 12:09:46.980122,0 days 00:01:53.876472,tanh,0.1,3,0.6,0.9827436804771423,,,PRUNED
294,294,0.9702212810516357,2022-12-28 12:07:54.850237,2022-12-28 12:08:57.259949,0 days 00:01:02.409712,tanh,0.15000000000000002,7,1.0,0.9702212810516357,,,PRUNED
295,295,0.983705461025238,2022-12-28 12:08:05.888268,2022-12-28 12:09:58.312418,0 days 00:01:52.424150,tanh,0.1,3,0.6,0.983705461025238,,,PRUNED
296,296,0.9684064984321594,2022-12-28 12:08:27.512917,2022-12-28 12:09:32.972395,0 days 00:01:05.459478,tanh,0.15000000000000002,7,1.0,0.9684064984321594,,,PRUNED
297,297,0.9815431237220764,2022-12-28 12:08:29.064327,2022-12-28 12:10:18.728964,0 days 00:01:49.664637,tanh,0.1,3,0.6,0.9815431237220764,,,PRUNED
298,298,0.9845898747444153,2022-12-28 12:08:43.547493,2022-12-28 12:10:39.126498,0 days 00:01:55.579005,tanh,0.15000000000000002,7,1.0,0.9716058969497681,0.9845898747444153,,PRUNED
299,299,0.9862754344940186,2022-12-28 12:08:57.707355,2022-12-28 12:12:53.311448,0 days 00:03:55.604093,tanh,0.1,3,0.6,0.9867486953735352,,,COMPLETE
300,300,0.9798651933670044,2022-12-28 12:09:11.046472,2022-12-28 12:11:01.340680,0 days 00:01:50.294208,tanh,0.05,3,0.65,0.9798651933670044,,,PRUNED
301,301,0.969923198223114,2022-12-28 12:09:31.076673,2022-12-28 12:10:34.134961,0 days 00:01:03.058288,tanh,0.15000000000000002,8,1.0,0.969923198223114,,,PRUNED
302,302,0.9771934151649475,2022-12-28 12:09:33.442822,2022-12-28 12:11:24.540809,0 days 00:01:51.097987,tanh,0.1,3,0.65,0.9771934151649475,,,PRUNED
303,303,0.9709637761116028,2022-12-28 12:09:47.401505,2022-12-28 12:10:46.833503,0 days 00:00:59.431998,tanh,0.15000000000000002,8,1.0,0.9709637761116028,,,PRUNED
304,304,0.9695687890052795,2022-12-28 12:09:55.802138,2022-12-28 12:10:59.550053,0 days 00:01:03.747915,tanh,0.15000000000000002,8,1.0,0.9695687890052795,,,PRUNED
305,305,0.9641484022140503,2022-12-28 12:09:58.815876,2022-12-28 12:11:02.394638,0 days 00:01:03.578762,tanh,0.15000000000000002,8,1.0,0.9641484022140503,,,PRUNED
306,306,0.9840311408042908,2022-12-28 12:10:03.167829,2022-12-28 12:11:57.236509,0 days 00:01:54.068680,sigmoid,0.0,5,0.7,0.9840311408042908,,,PRUNED
307,307,0.9831361174583435,2022-12-28 12:10:12.275102,2022-12-28 12:12:02.986732,0 days 00:01:50.711630,sigmoid,0.15000000000000002,5,0.7,0.9831361174583435,,,PRUNED
308,308,0.9507716298103333,2022-12-28 12:10:19.254442,2022-12-28 12:11:21.022614,0 days 00:01:01.768172,tanh,0.15000000000000002,8,0.6,0.9507716298103333,,,PRUNED
309,309,0.9650717973709106,2022-12-28 12:10:34.595380,2022-12-28 12:11:34.965280,0 days 00:01:00.369900,tanh,0.15000000000000002,7,0.6,0.9650717973709106,,,PRUNED
310,310,0.9846572279930115,2022-12-28 12:10:39.565898,2022-12-28 12:12:28.604006,0 days 00:01:49.038108,tanh,0.0,3,0.7,0.9846572279930115,,,PRUNED
311,311,0.9855979084968567,2022-12-28 12:10:47.277905,2022-12-28 12:14:42.686820,0 days 00:03:55.408915,tanh,0.0,3,0.7,0.9862492084503174,,,COMPLETE
312,312,0.9804719686508179,2022-12-28 12:11:00.034494,2022-12-28 12:12:48.832381,0 days 00:01:48.797887,tanh,0.0,3,0.7,0.9804719686508179,,,PRUNED
313,313,0.9683737754821777,2022-12-28 12:11:01.795093,2022-12-28 12:12:04.048697,0 days 00:01:02.253604,tanh,0.35000000000000003,7,0.6,0.9683737754821777,,,PRUNED
314,314,0.953222930431366,2022-12-28 12:11:02.918113,2022-12-28 12:12:05.037595,0 days 00:01:02.119482,tanh,0.35000000000000003,7,0.6,0.953222930431366,,,PRUNED
315,315,0.9686534404754639,2022-12-28 12:11:21.464014,2022-12-28 12:12:23.518386,0 days 00:01:02.054372,tanh,0.35000000000000003,7,0.95,0.9686534404754639,,,PRUNED
316,316,0.9612976908683777,2022-12-28 12:11:25.020245,2022-12-28 12:12:27.629119,0 days 00:01:02.608874,tanh,0.35000000000000003,7,0.6,0.9612976908683777,,,PRUNED
317,317,0.9795848727226257,2022-12-28 12:11:35.462731,2022-12-28 12:13:24.449742,0 days 00:01:48.987011,sigmoid,0.0,4,0.7,0.9795848727226257,,,PRUNED
318,318,0.9856905937194824,2022-12-28 12:11:43.867365,2022-12-28 12:13:34.424803,0 days 00:01:50.557438,tanh,0.35000000000000003,7,0.95,0.9717509746551514,0.9856905937194824,,PRUNED
319,319,0.9705052971839905,2022-12-28 12:11:57.679912,2022-12-28 12:12:59.082695,0 days 00:01:01.402783,tanh,0.35000000000000003,7,0.95,0.9705052971839905,,,PRUNED
320,320,0.9820948243141174,2022-12-28 12:12:03.450153,2022-12-28 12:13:52.320062,0 days 00:01:48.869909,relu,0.0,4,0.7,0.9820948243141174,,,PRUNED
321,321,0.969950258731842,2022-12-28 12:12:04.878451,2022-12-28 12:13:05.669678,0 days 00:01:00.791227,tanh,0.35000000000000003,6,0.95,0.969950258731842,,,PRUNED
322,322,0.976809024810791,2022-12-28 12:12:05.579087,2022-12-28 12:13:57.936162,0 days 00:01:52.357075,tanh,0.35000000000000003,6,0.95,0.9723138213157654,0.976809024810791,,PRUNED
323,323,0.9836544990539551,2022-12-28 12:12:24.016838,2022-12-28 12:15:58.475694,0 days 00:03:34.458856,relu,0.0,4,0.7,0.98683762550354,,,COMPLETE
324,324,0.9666958451271057,2022-12-28 12:12:28.143587,2022-12-28 12:13:33.657105,0 days 00:01:05.513518,tanh,0.30000000000000004,6,0.95,0.9666958451271057,,,PRUNED
325,325,0.9673027992248535,2022-12-28 12:12:29.284623,2022-12-28 12:13:32.663201,0 days 00:01:03.378578,tanh,0.30000000000000004,6,0.95,0.9673027992248535,,,PRUNED
326,326,0.9834775328636169,2022-12-28 12:12:49.318822,2022-12-28 12:14:40.266621,0 days 00:01:50.947799,tanh,0.30000000000000004,6,0.95,0.9713243842124939,0.9834775328636169,,PRUNED
327,327,0.9704205989837646,2022-12-28 12:12:53.857946,2022-12-28 12:13:56.236620,0 days 00:01:02.378674,tanh,0.30000000000000004,6,0.95,0.9704205989837646,,,PRUNED
328,328,0.9701421856880188,2022-12-28 12:12:59.593158,2022-12-28 12:13:59.294397,0 days 00:00:59.701239,sigmoid,0.30000000000000004,3,0.85,0.9701421856880188,,,PRUNED
329,329,0.9822515845298767,2022-12-28 12:13:06.166129,2022-12-28 12:14:55.682628,0 days 00:01:49.516499,relu,0.0,4,0.7,0.9822515845298767,,,PRUNED
330,330,0.9870505332946777,2022-12-28 12:13:24.895145,2022-12-28 12:17:26.265469,0 days 00:04:01.370324,sigmoid,0.5,3,0.85,0.9770731925964355,0.9873061180114746,,COMPLETE
331,331,0.9808424115180969,2022-12-28 12:13:33.167660,2022-12-28 12:15:22.229750,0 days 00:01:49.062090,sigmoid,0.2,3,1.0,0.9719774723052979,0.9808424115180969,,PRUNED
332,332,0.9806954860687256,2022-12-28 12:13:34.233627,2022-12-28 12:15:31.713370,0 days 00:01:57.479743,relu,0.25,6,1.0,0.9736558794975281,0.9806954860687256,,PRUNED
333,333,0.9840233325958252,2022-12-28 12:13:35.081399,2022-12-28 12:15:32.518100,0 days 00:01:57.436701,relu,0.15000000000000002,6,0.75,0.9840233325958252,,,PRUNED
334,334,0.9710318446159363,2022-12-28 12:13:52.778478,2022-12-28 12:14:56.534401,0 days 00:01:03.755923,relu,0.4,6,1.0,0.9710318446159363,,,PRUNED
335,335,0.9675416350364685,2022-12-28 12:13:56.711050,2022-12-28 12:14:58.648323,0 days 00:01:01.937273,relu,0.25,6,1.0,0.9675416350364685,,,PRUNED
336,336,0.9640169143676758,2022-12-28 12:13:58.467646,2022-12-28 12:15:03.056326,0 days 00:01:04.588680,relu,0.4,6,1.0,0.9640169143676758,,,PRUNED
337,337,0.9828287959098816,2022-12-28 12:13:59.723787,2022-12-28 12:15:52.311089,0 days 00:01:52.587302,tanh,0.05,3,0.7,0.9828287959098816,,,PRUNED
338,338,0.9824399352073669,2022-12-28 12:14:40.764073,2022-12-28 12:16:30.291605,0 days 00:01:49.527532,tanh,0.15000000000000002,3,0.7,0.9824399352073669,,,PRUNED
339,339,0.9837436676025391,2022-12-28 12:14:43.180268,2022-12-28 12:16:33.734733,0 days 00:01:50.554465,tanh,0.0,6,0.75,0.9837436676025391,,,PRUNED
340,340,0.9864659309387207,2022-12-28 12:14:56.159061,2022-12-28 12:19:04.639923,0 days 00:04:08.480862,relu,0.25,3,1.0,0.9754047393798828,0.9867374897003174,,COMPLETE
341,341,0.9874789714813232,2022-12-28 12:14:57.015839,2022-12-28 12:19:05.082324,0 days 00:04:08.066485,relu,0.25,3,1.0,0.9740058779716492,0.9875856041908264,,COMPLETE
342,342,0.9758793711662292,2022-12-28 12:14:59.100732,2022-12-28 12:16:54.139275,0 days 00:01:55.038543,tanh,0.0,6,0.75,0.9758793711662292,,,PRUNED
343,343,0.9820404052734375,2022-12-28 12:15:03.765971,2022-12-28 12:18:42.005294,0 days 00:03:38.239323,relu,0.2,4,1.0,0.9723787903785706,0.9868807792663574,,COMPLETE
344,344,0.9853399395942688,2022-12-28 12:15:22.690169,2022-12-28 12:17:20.712421,0 days 00:01:58.022252,tanh,0.0,6,0.75,0.9853399395942688,,,PRUNED
345,345,0.9828289151191711,2022-12-28 12:15:32.227836,2022-12-28 12:19:15.342644,0 days 00:03:43.114808,relu,0.15000000000000002,4,0.9,0.9719275236129761,0.9869393110275269,,COMPLETE
346,346,0.9670601487159729,2022-12-28 12:15:33.012548,2022-12-28 12:16:36.207986,0 days 00:01:03.195438,relu,0.15000000000000002,4,0.9,0.9670601487159729,,,PRUNED
347,347,0.9806843996047974,2022-12-28 12:15:52.795528,2022-12-28 12:17:47.459728,0 days 00:01:54.664200,tanh,0.0,3,0.75,0.9806843996047974,,,PRUNED
348,348,0.9801398515701294,2022-12-28 12:15:59.037205,2022-12-28 12:17:57.101488,0 days 00:01:58.064283,relu,0.15000000000000002,4,0.9,0.9720070958137512,0.9801398515701294,,PRUNED
349,349,0.9861787557601929,2022-12-28 12:16:30.826090,2022-12-28 12:18:26.875543,0 days 00:01:56.049453,relu,0.15000000000000002,4,0.9,0.9721046090126038,0.9861787557601929,,PRUNED
350,350,0.9854912161827087,2022-12-28 12:16:34.195151,2022-12-28 12:18:27.672267,0 days 00:01:53.477116,relu,0.15000000000000002,4,0.9,0.9748293161392212,0.9854912161827087,,PRUNED
351,351,0.9784775376319885,2022-12-28 12:16:36.659397,2022-12-28 12:18:29.270722,0 days 00:01:52.611325,relu,0.35000000000000003,3,0.65,0.9784775376319885,,,PRUNED
352,352,0.9674557447433472,2022-12-28 12:16:54.613705,2022-12-28 12:17:58.163457,0 days 00:01:03.549752,relu,0.15000000000000002,4,0.6,0.9674557447433472,,,PRUNED
353,353,0.9698916673660278,2022-12-28 12:17:21.199865,2022-12-28 12:18:25.146973,0 days 00:01:03.947108,relu,0.15000000000000002,4,0.6,0.9698916673660278,,,PRUNED
354,354,0.986748456954956,2022-12-28 12:17:26.810963,2022-12-28 12:21:33.910947,0 days 00:04:07.099984,sigmoid,0.35000000000000003,3,0.85,0.9717811346054077,0.9868176579475403,,COMPLETE
355,355,0.9705231189727783,2022-12-28 12:17:47.977197,2022-12-28 12:18:46.431315,0 days 00:00:58.454118,sigmoid,0.45,3,0.85,0.9705231189727783,,,PRUNED
356,356,0.9830208420753479,2022-12-28 12:17:57.685023,2022-12-28 12:19:51.109543,0 days 00:01:53.424520,relu,0.05,3,0.65,0.9830208420753479,,,PRUNED
357,357,0.9696429371833801,2022-12-28 12:17:58.704948,2022-12-28 12:18:59.063859,0 days 00:01:00.358911,sigmoid,0.45,3,0.85,0.9696429371833801,,,PRUNED
358,358,0.9855918288230896,2022-12-28 12:18:25.588375,2022-12-28 12:20:18.315267,0 days 00:01:52.726892,relu,0.05,3,0.65,0.9855918288230896,,,PRUNED
359,359,0.9838652610778809,2022-12-28 12:18:27.313941,2022-12-28 12:20:22.798339,0 days 00:01:55.484398,sigmoid,0.35000000000000003,3,1.0,0.9714997410774231,0.9838652610778809,,PRUNED
360,360,0.9854784607887268,2022-12-28 12:18:28.202749,2022-12-28 12:22:38.040562,0 days 00:04:09.837813,relu,0.05,3,0.7,0.9859776496887207,,,COMPLETE
361,361,0.982295572757721,2022-12-28 12:18:30.108482,2022-12-28 12:22:15.425016,0 days 00:03:45.316534,tanh,0.05,3,0.95,0.9875999093055725,,,COMPLETE
362,362,0.9815985560417175,2022-12-28 12:18:42.507749,2022-12-28 12:20:35.022442,0 days 00:01:52.514693,sigmoid,0.5,3,0.85,0.9747095704078674,0.9815985560417175,,PRUNED
363,363,0.9865530133247375,2022-12-28 12:18:46.874717,2022-12-28 12:22:54.179327,0 days 00:04:07.304610,sigmoid,0.5,3,0.85,0.9740212559700012,0.9866190552711487,,COMPLETE
364,364,0.9705792665481567,2022-12-28 12:18:59.522273,2022-12-28 12:19:59.041753,0 days 00:00:59.519480,sigmoid,0.2,3,1.0,0.9705792665481567,,,PRUNED
365,365,0.9826659560203552,2022-12-28 12:19:05.231461,2022-12-28 12:22:48.910537,0 days 00:03:43.679076,tanh,0.05,3,0.7,0.9875010251998901,,,COMPLETE
366,366,0.9864000678062439,2022-12-28 12:19:05.911078,2022-12-28 12:22:49.701255,0 days 00:03:43.790177,relu,0.5,3,1.0,0.976168155670166,0.9867424368858337,,COMPLETE
367,367,0.9877280592918396,2022-12-28 12:19:15.832090,2022-12-28 12:23:24.293683,0 days 00:04:08.461593,sigmoid,0.25,3,1.0,0.9729508757591248,0.9878869652748108,,COMPLETE
368,368,0.9822676777839661,2022-12-28 12:19:51.544938,2022-12-28 12:21:45.359352,0 days 00:01:53.814414,sigmoid,0.5,3,1.0,0.9717366695404053,0.9822676777839661,,PRUNED
369,369,0.9858770370483398,2022-12-28 12:19:59.501171,2022-12-28 12:21:56.835129,0 days 00:01:57.333958,relu,0.25,3,1.0,0.9725058674812317,0.9858770370483398,,PRUNED
370,370,0.9839411973953247,2022-12-28 12:20:18.768678,2022-12-28 12:22:15.031658,0 days 00:01:56.262980,relu,0.25,3,1.0,0.9747645258903503,0.9839411973953247,,PRUNED
371,371,0.9843109846115112,2022-12-28 12:20:23.247747,2022-12-28 12:22:16.795260,0 days 00:01:53.547513,relu,0.5,3,1.0,0.9720509648323059,0.9843109846115112,,PRUNED
372,372,0.9850426316261292,2022-12-28 12:20:35.490868,2022-12-28 12:22:31.680782,0 days 00:01:56.189914,tanh,0.45,3,0.7,0.9850426316261292,,,PRUNED
373,373,0.9840319752693176,2022-12-28 12:21:34.395388,2022-12-28 12:23:22.597142,0 days 00:01:48.201754,sigmoid,0.5,3,0.9,0.9731559157371521,0.9840319752693176,,PRUNED
374,374,0.9832201600074768,2022-12-28 12:21:45.805757,2022-12-28 12:23:32.451094,0 days 00:01:46.645337,tanh,0.45,3,0.7,0.9832201600074768,,,PRUNED
375,375,0.9839817881584167,2022-12-28 12:21:57.260515,2022-12-28 12:23:42.842538,0 days 00:01:45.582023,tanh,0.45,3,0.7,0.9839817881584167,,,PRUNED
376,376,0.9694293737411499,2022-12-28 12:22:15.528109,2022-12-28 12:23:16.435545,0 days 00:01:00.907436,sigmoid,0.25,3,0.9,0.9694293737411499,,,PRUNED
377,377,0.9864209890365601,2022-12-28 12:22:16.065598,2022-12-28 12:26:16.395416,0 days 00:04:00.329818,tanh,0.45,3,0.7,0.9865183234214783,,,COMPLETE
378,378,0.9695582985877991,2022-12-28 12:22:17.235660,2022-12-28 12:23:17.585589,0 days 00:01:00.349929,relu,0.25,3,0.9,0.9695582985877991,,,PRUNED
379,379,0.9679811000823975,2022-12-28 12:22:32.145203,2022-12-28 12:23:27.756829,0 days 00:00:55.611626,sigmoid,0.25,3,0.9,0.9679811000823975,,,PRUNED
380,380,0.986315906047821,2022-12-28 12:22:38.506986,2022-12-28 12:26:11.970388,0 days 00:03:33.463402,relu,0.2,3,0.7,0.9867571592330933,,,COMPLETE
381,381,0.9842676520347595,2022-12-28 12:22:49.351938,2022-12-28 12:24:41.937237,0 days 00:01:52.585299,relu,0.2,3,0.7,0.9842676520347595,,,PRUNED
382,382,0.9696200489997864,2022-12-28 12:22:50.401892,2022-12-28 12:23:49.984028,0 days 00:00:59.582136,sigmoid,0.1,3,0.9,0.9696200489997864,,,PRUNED
383,383,0.9696255922317505,2022-12-28 12:22:54.615724,2022-12-28 12:23:54.410051,0 days 00:00:59.794327,sigmoid,0.5,3,0.85,0.9696255922317505,,,PRUNED
384,384,0.9870836138725281,2022-12-28 12:23:16.872942,2022-12-28 12:27:20.278772,0 days 00:04:03.405830,sigmoid,0.35000000000000003,3,0.85,0.9744645357131958,0.9878079295158386,,COMPLETE
385,385,0.9872030019760132,2022-12-28 12:23:18.034998,2022-12-28 12:27:20.698155,0 days 00:04:02.663157,sigmoid,0.5,3,0.85,0.9727806448936462,0.9876214861869812,,COMPLETE
386,386,0.9849510192871094,2022-12-28 12:23:23.103601,2022-12-28 12:25:16.476973,0 days 00:01:53.373372,relu,0.2,3,0.7,0.9849510192871094,,,PRUNED
387,387,0.9817745089530945,2022-12-28 12:23:25.143455,2022-12-28 12:25:19.298536,0 days 00:01:54.155081,relu,0.2,3,0.7,0.9817745089530945,,,PRUNED
388,388,0.9683786034584045,2022-12-28 12:23:28.187220,2022-12-28 12:24:29.254714,0 days 00:01:01.067494,sigmoid,0.5,3,0.85,0.9683786034584045,,,PRUNED
389,389,0.9698563814163208,2022-12-28 12:23:32.938536,2022-12-28 12:24:32.604759,0 days 00:00:59.666223,sigmoid,0.5,3,0.85,0.9698563814163208,,,PRUNED
390,390,0.9674712419509888,2022-12-28 12:23:43.269926,2022-12-28 12:24:42.831048,0 days 00:00:59.561122,sigmoid,0.5,3,0.85,0.9674712419509888,,,PRUNED
391,391,0.9797282814979553,2022-12-28 12:23:50.427433,2022-12-28 12:25:51.450747,0 days 00:02:01.023314,relu,0.4,8,0.7,0.9797282814979553,,,PRUNED
392,392,0.9808250665664673,2022-12-28 12:23:54.825429,2022-12-28 12:25:49.945379,0 days 00:01:55.119950,sigmoid,0.5,3,0.85,0.972176194190979,0.9808250665664673,,PRUNED
393,393,0.981831967830658,2022-12-28 12:24:29.669090,2022-12-28 12:26:21.763294,0 days 00:01:52.094204,relu,0.2,4,0.7,0.981831967830658,,,PRUNED
394,394,0.9699601531028748,2022-12-28 12:24:33.052166,2022-12-28 12:25:34.234105,0 days 00:01:01.181939,sigmoid,0.5,3,0.85,0.9699601531028748,,,PRUNED
395,395,0.9714151620864868,2022-12-28 12:24:42.362623,2022-12-28 12:25:44.458393,0 days 00:01:02.095770,sigmoid,0.5,3,1.0,0.9714151620864868,,,PRUNED
396,396,0.9793756604194641,2022-12-28 12:24:43.290466,2022-12-28 12:26:35.345632,0 days 00:01:52.055166,relu,0.05,3,0.6,0.9793756604194641,,,PRUNED
397,397,0.9844726920127869,2022-12-28 12:25:16.925380,2022-12-28 12:27:09.759894,0 days 00:01:52.834514,sigmoid,0.5,3,1.0,0.9716699719429016,0.9844726920127869,,PRUNED
398,398,0.9709867238998413,2022-12-28 12:25:19.742939,2022-12-28 12:26:19.315068,0 days 00:00:59.572129,sigmoid,0.5,3,1.0,0.9709867238998413,,,PRUNED
399,399,0.971233606338501,2022-12-28 12:25:34.683513,2022-12-28 12:26:32.680211,0 days 00:00:57.996698,sigmoid,0.5,3,1.0,0.971233606338501,,,PRUNED
400,400,0.9866414666175842,2022-12-28 12:25:44.926818,2022-12-28 12:29:45.570503,0 days 00:04:00.643685,sigmoid,0.25,3,1.0,0.972805917263031,0.9868690371513367,,COMPLETE
401,401,0.9828221201896667,2022-12-28 12:25:50.414806,2022-12-28 12:27:42.889311,0 days 00:01:52.474505,relu,0.05,3,0.6,0.9828221201896667,,,PRUNED
402,402,0.9756719470024109,2022-12-28 12:25:51.959209,2022-12-28 12:27:42.805235,0 days 00:01:50.846026,relu,0.05,3,0.6,0.9756719470024109,,,PRUNED
403,403,0.9777775406837463,2022-12-28 12:26:12.432807,2022-12-28 12:28:01.113871,0 days 00:01:48.681064,relu,0.25,3,0.7,0.9777775406837463,,,PRUNED
404,404,0.9813652038574219,2022-12-28 12:26:16.858836,2022-12-28 12:28:07.767918,0 days 00:01:50.909082,sigmoid,0.25,3,1.0,0.9739904999732971,0.9813652038574219,,PRUNED
405,405,0.9867450594902039,2022-12-28 12:26:19.734448,2022-12-28 12:30:27.322458,0 days 00:04:07.588010,relu,0.35000000000000003,3,1.0,0.9716145396232605,0.9872183799743652,,COMPLETE
406,406,0.9833306670188904,2022-12-28 12:26:22.214704,2022-12-28 12:28:15.898303,0 days 00:01:53.683599,relu,0.15000000000000002,7,0.65,0.9833306670188904,,,PRUNED
407,407,0.9867299199104309,2022-12-28 12:26:33.077571,2022-12-28 12:30:41.740555,0 days 00:04:08.662984,relu,0.25,7,0.65,0.987259030342102,,,COMPLETE
408,408,0.984765887260437,2022-12-28 12:26:35.790035,2022-12-28 12:28:26.671099,0 days 00:01:50.881064,relu,0.25,7,0.7,0.984765887260437,,,PRUNED
409,409,0.9689663648605347,2022-12-28 12:27:10.223316,2022-12-28 12:28:11.997761,0 days 00:01:01.774445,relu,0.35000000000000003,5,1.0,0.9689663648605347,,,PRUNED
410,410,0.969340980052948,2022-12-28 12:27:20.796242,2022-12-28 12:28:20.519501,0 days 00:00:59.723259,sigmoid,0.35000000000000003,3,0.85,0.969340980052948,,,PRUNED
