,number,value,datetime_start,datetime_complete,duration,params_activation,params_dropout,params_layers,params_shrink,system_attrs_completed_rung_0,system_attrs_completed_rung_1,system_attrs_completed_rung_2,state
1098,1098,0.9860499501228333,2022-12-28 14:17:00.344571,2022-12-28 14:18:49.988490,0 days 00:01:49.643919,relu,0.25,3,0.75,0.9740490913391113,0.9860499501228333,,PRUNED
1099,1099,0.9835572242736816,2022-12-28 14:17:03.221184,2022-12-28 14:18:52.132438,0 days 00:01:48.911254,relu,0.4,2,0.7,0.9835572242736816,,,PRUNED
1100,1100,0.9649317264556885,2022-12-28 14:17:26.461585,2022-12-28 14:18:28.121128,0 days 00:01:01.659543,relu,0.25,3,1.0,0.9649317264556885,,,PRUNED
1101,1101,0.9833925366401672,2022-12-28 14:17:29.318178,2022-12-28 14:21:01.550505,0 days 00:03:32.232327,relu,0.4,2,0.75,0.9869998097419739,,,COMPLETE
1102,1102,0.9698274731636047,2022-12-28 14:17:32.249845,2022-12-28 14:18:33.508025,0 days 00:01:01.258180,relu,0.25,3,1.0,0.9698274731636047,,,PRUNED
1103,1103,0.9813293814659119,2022-12-28 14:17:34.810678,2022-12-28 14:19:27.068657,0 days 00:01:52.257979,relu,0.4,2,0.75,0.9813293814659119,,,PRUNED
1104,1104,0.9853770136833191,2022-12-28 14:17:48.998565,2022-12-28 14:19:39.825244,0 days 00:01:50.826679,relu,0.4,2,0.75,0.9853770136833191,,,PRUNED
1105,1105,0.9833942651748657,2022-12-28 14:17:50.696107,2022-12-28 14:19:39.331795,0 days 00:01:48.635688,relu,0.4,2,0.75,0.9833942651748657,,,PRUNED
1106,1106,0.9810810089111328,2022-12-28 14:18:01.378814,2022-12-28 14:21:34.688612,0 days 00:03:33.309798,relu,0.4,2,0.75,0.9872282147407532,,,COMPLETE
1107,1107,0.9711459875106812,2022-12-28 14:18:28.654613,2022-12-28 14:19:28.994406,0 days 00:01:00.339793,tanh,0.25,3,1.0,0.9711459875106812,,,PRUNED
1108,1108,0.9714329242706299,2022-12-28 14:18:29.644516,2022-12-28 14:19:32.476568,0 days 00:01:02.832052,tanh,0.25,3,1.0,0.9714329242706299,,,PRUNED
1109,1109,0.9805719256401062,2022-12-28 14:18:31.380092,2022-12-28 14:22:05.783820,0 days 00:03:34.403728,relu,0.35000000000000003,2,0.75,0.9870350360870361,,,COMPLETE
1110,1110,0.9842016696929932,2022-12-28 14:18:33.963438,2022-12-28 14:20:26.230409,0 days 00:01:52.266971,tanh,0.5,3,0.9,0.9722762107849121,0.9842016696929932,,PRUNED
1111,1111,0.9686712026596069,2022-12-28 14:18:38.173264,2022-12-28 14:19:40.150540,0 days 00:01:01.977276,tanh,0.25,3,0.9,0.9686712026596069,,,PRUNED
1112,1112,0.9848023653030396,2022-12-28 14:18:50.457916,2022-12-28 14:20:38.822853,0 days 00:01:48.364937,relu,0.35000000000000003,2,0.75,0.9848023653030396,,,PRUNED
1113,1113,0.9697539806365967,2022-12-28 14:18:52.607869,2022-12-28 14:19:51.084474,0 days 00:00:58.476605,tanh,0.5,3,0.65,0.9697539806365967,,,PRUNED
1114,1114,0.9690626263618469,2022-12-28 14:19:27.538083,2022-12-28 14:20:26.110302,0 days 00:00:58.572219,tanh,0.5,3,0.9,0.9690626263618469,,,PRUNED
1115,1115,0.9685181975364685,2022-12-28 14:19:29.419791,2022-12-28 14:20:27.899926,0 days 00:00:58.480135,tanh,0.5,3,0.9,0.9685181975364685,,,PRUNED
1116,1116,0.9818535447120667,2022-12-28 14:19:32.962009,2022-12-28 14:21:27.237842,0 days 00:01:54.275833,sigmoid,0.5,8,0.9,0.9754664301872253,0.9818535447120667,,PRUNED
1117,1117,0.9660526514053345,2022-12-28 14:19:40.148539,2022-12-28 14:20:42.749424,0 days 00:01:02.600885,sigmoid,0.5,3,0.65,0.9660526514053345,,,PRUNED
1118,1118,0.9709465503692627,2022-12-28 14:19:40.544898,2022-12-28 14:20:43.650241,0 days 00:01:03.105343,sigmoid,0.5,4,0.9,0.9709465503692627,,,PRUNED
1119,1119,0.9858620166778564,2022-12-28 14:19:40.705043,2022-12-28 14:23:16.802342,0 days 00:03:36.097299,relu,0.2,2,0.7,0.9884629249572754,,,COMPLETE
1120,1120,0.9860925078392029,2022-12-28 14:19:51.531881,2022-12-28 14:24:02.304681,0 days 00:04:10.772800,sigmoid,0.35000000000000003,8,0.9,0.974197268486023,0.9866228103637695,,COMPLETE
1121,1121,0.9701101779937744,2022-12-28 14:20:26.924039,2022-12-28 14:21:30.736022,0 days 00:01:03.811983,sigmoid,0.35000000000000003,4,0.8,0.9701101779937744,,,PRUNED
1122,1122,0.9836399555206299,2022-12-28 14:20:27.026132,2022-12-28 14:22:18.415295,0 days 00:01:51.389163,relu,0.2,2,0.7,0.9836399555206299,,,PRUNED
1123,1123,0.9806313514709473,2022-12-28 14:20:28.514486,2022-12-28 14:22:19.580353,0 days 00:01:51.065867,relu,0.2,2,0.7,0.9806313514709473,,,PRUNED
1124,1124,0.9691057801246643,2022-12-28 14:20:39.259252,2022-12-28 14:21:38.119730,0 days 00:00:58.860478,sigmoid,0.35000000000000003,3,0.8,0.9691057801246643,,,PRUNED
1125,1125,0.9848139882087708,2022-12-28 14:20:43.185821,2022-12-28 14:22:37.814920,0 days 00:01:54.629099,sigmoid,0.35000000000000003,4,0.95,0.9723484516143799,0.9848139882087708,,PRUNED
1126,1126,0.9851387143135071,2022-12-28 14:20:44.254791,2022-12-28 14:22:35.397724,0 days 00:01:51.142933,relu,0.2,2,0.7,0.9851387143135071,,,PRUNED
1127,1127,0.9869549870491028,2022-12-28 14:21:02.029940,2022-12-28 14:24:56.162606,0 days 00:03:54.132666,relu,0.2,2,0.7,0.9873492121696472,,,COMPLETE
1128,1128,0.984239399433136,2022-12-28 14:21:27.748306,2022-12-28 14:23:19.302613,0 days 00:01:51.554307,sigmoid,0.35000000000000003,4,0.95,0.9726126194000244,0.984239399433136,,PRUNED
1129,1129,0.9680688381195068,2022-12-28 14:21:31.273510,2022-12-28 14:22:31.632305,0 days 00:01:00.358795,sigmoid,0.25,3,0.95,0.9680688381195068,,,PRUNED
1130,1130,0.9630131721496582,2022-12-28 14:21:35.303171,2022-12-28 14:22:36.976159,0 days 00:01:01.672988,sigmoid,0.25,6,0.95,0.9630131721496582,,,PRUNED
1131,1131,0.9814972877502441,2022-12-28 14:21:38.552124,2022-12-28 14:23:30.743008,0 days 00:01:52.190884,relu,0.25,6,0.7,0.9814972877502441,,,PRUNED
1132,1132,0.9697780013084412,2022-12-28 14:22:06.245240,2022-12-28 14:23:05.704257,0 days 00:00:59.459017,sigmoid,0.25,3,0.85,0.9697780013084412,,,PRUNED
1133,1133,0.9679218530654907,2022-12-28 14:22:18.886722,2022-12-28 14:23:17.948383,0 days 00:00:59.061661,sigmoid,0.25,6,0.85,0.9679218530654907,,,PRUNED
1134,1134,0.9834392070770264,2022-12-28 14:22:20.153874,2022-12-28 14:24:05.919965,0 days 00:01:45.766091,sigmoid,0.25,3,0.85,0.9718557596206665,0.9834392070770264,,PRUNED
1135,1135,0.9701176285743713,2022-12-28 14:22:32.091722,2022-12-28 14:23:34.948829,0 days 00:01:02.857107,sigmoid,0.45,6,0.85,0.9701176285743713,,,PRUNED
1136,1136,0.9674361348152161,2022-12-28 14:22:35.837124,2022-12-28 14:23:39.384861,0 days 00:01:03.547737,sigmoid,0.45,6,0.85,0.9674361348152161,,,PRUNED
1137,1137,0.9666600823402405,2022-12-28 14:22:37.543673,2022-12-28 14:23:38.935450,0 days 00:01:01.391777,sigmoid,0.45,3,0.85,0.9666600823402405,,,PRUNED
1138,1138,0.9790627956390381,2022-12-28 14:22:38.277340,2022-12-28 14:24:26.371543,0 days 00:01:48.094203,relu,0.25,2,0.7,0.9790627956390381,,,PRUNED
1139,1139,0.9698348641395569,2022-12-28 14:23:06.165675,2022-12-28 14:24:05.024151,0 days 00:00:58.858476,sigmoid,0.45,3,0.85,0.9698348641395569,,,PRUNED
1140,1140,0.9872066974639893,2022-12-28 14:23:17.324817,2022-12-28 14:27:23.652351,0 days 00:04:06.327534,relu,0.25,4,0.6,0.9876418113708496,,,COMPLETE
1141,1141,0.9837738871574402,2022-12-28 14:23:18.468856,2022-12-28 14:25:07.422838,0 days 00:01:48.953982,relu,0.25,4,0.6,0.9837738871574402,,,PRUNED
1142,1142,0.9876134991645813,2022-12-28 14:23:19.769037,2022-12-28 14:27:21.974827,0 days 00:04:02.205790,tanh,0.45,3,0.85,0.9737163782119751,0.9877955913543701,,COMPLETE
1143,1143,0.971437931060791,2022-12-28 14:23:31.199424,2022-12-28 14:24:31.864533,0 days 00:01:00.665109,tanh,0.45,3,0.85,0.971437931060791,,,PRUNED
1144,1144,0.9702219367027283,2022-12-28 14:23:35.539366,2022-12-28 14:24:33.886371,0 days 00:00:58.347005,tanh,0.4,3,0.7,0.9702219367027283,,,PRUNED
1145,1145,0.9700576663017273,2022-12-28 14:23:39.770209,2022-12-28 14:24:38.877904,0 days 00:00:59.107695,tanh,0.4,3,0.95,0.9700576663017273,,,PRUNED
1146,1146,0.9817362427711487,2022-12-28 14:23:39.894322,2022-12-28 14:25:35.256122,0 days 00:01:55.361800,relu,0.45,4,0.6,0.9817362427711487,,,PRUNED
1147,1147,0.9696670174598694,2022-12-28 14:24:02.808139,2022-12-28 14:25:02.620476,0 days 00:00:59.812337,tanh,0.4,3,0.7,0.9696670174598694,,,PRUNED
1148,1148,0.9839293360710144,2022-12-28 14:24:05.528609,2022-12-28 14:26:00.456498,0 days 00:01:54.927889,relu,0.45,4,0.6,0.9839293360710144,,,PRUNED
1149,1149,0.9792235493659973,2022-12-28 14:24:06.445442,2022-12-28 14:27:47.434959,0 days 00:03:40.989517,relu,0.45,4,0.6,0.986456573009491,,,COMPLETE
1150,1150,0.9838704466819763,2022-12-28 14:24:26.869995,2022-12-28 14:28:03.105194,0 days 00:03:36.235199,relu,0.45,2,0.6,0.9886512160301208,,,COMPLETE
1151,1151,0.9716639518737793,2022-12-28 14:24:32.496106,2022-12-28 14:25:35.168042,0 days 00:01:02.671936,tanh,0.25,3,0.95,0.9716639518737793,,,PRUNED
1152,1152,0.9853696227073669,2022-12-28 14:24:34.370811,2022-12-28 14:26:31.529987,0 days 00:01:57.159176,relu,0.45,4,0.6,0.9853696227073669,,,PRUNED
1153,1153,0.9858436584472656,2022-12-28 14:24:39.435410,2022-12-28 14:26:33.679940,0 days 00:01:54.244530,tanh,0.25,2,1.0,0.9720256924629211,0.9858436584472656,,PRUNED
1154,1154,0.9847394227981567,2022-12-28 14:24:56.641042,2022-12-28 14:26:45.943081,0 days 00:01:49.302039,relu,0.2,2,0.7,0.9847394227981567,,,PRUNED
1155,1155,0.969234824180603,2022-12-28 14:25:03.059875,2022-12-28 14:26:05.315911,0 days 00:01:02.256036,tanh,0.25,2,0.95,0.969234824180603,,,PRUNED
1156,1156,0.9808991551399231,2022-12-28 14:25:07.921292,2022-12-28 14:27:01.514229,0 days 00:01:53.592937,relu,0.2,2,0.7,0.9808991551399231,,,PRUNED
1157,1157,0.9715250730514526,2022-12-28 14:25:35.910716,2022-12-28 14:26:38.521338,0 days 00:01:02.610622,sigmoid,0.25,3,1.0,0.9715250730514526,,,PRUNED
1158,1158,0.9828689098358154,2022-12-28 14:25:36.055849,2022-12-28 14:27:31.522500,0 days 00:01:55.466651,relu,0.2,2,0.7,0.9828689098358154,,,PRUNED
1159,1159,0.9868401288986206,2022-12-28 14:26:00.892894,2022-12-28 14:30:01.482037,0 days 00:04:00.589143,relu,0.2,2,0.7,0.9876042604446411,,,COMPLETE
1160,1160,0.9788125157356262,2022-12-28 14:26:05.749305,2022-12-28 14:29:43.682868,0 days 00:03:37.933563,relu,0.2,2,0.7,0.9857196807861328,,,COMPLETE
1161,1161,0.967472493648529,2022-12-28 14:26:31.979396,2022-12-28 14:27:31.074092,0 days 00:00:59.094696,sigmoid,0.25,3,1.0,0.967472493648529,,,PRUNED
1162,1162,0.9829980731010437,2022-12-28 14:26:34.076302,2022-12-28 14:28:24.263424,0 days 00:01:50.187122,relu,0.2,2,0.7,0.9829980731010437,,,PRUNED
1163,1163,0.9848207831382751,2022-12-28 14:26:38.970746,2022-12-28 14:28:29.745404,0 days 00:01:50.774658,sigmoid,0.2,3,0.95,0.9717121124267578,0.9848207831382751,,PRUNED
1164,1164,0.982131838798523,2022-12-28 14:26:46.400496,2022-12-28 14:28:36.773787,0 days 00:01:50.373291,relu,0.2,2,0.7,0.982131838798523,,,PRUNED
1165,1165,0.9816755056381226,2022-12-28 14:27:02.096759,2022-12-28 14:30:37.629882,0 days 00:03:35.533123,sigmoid,0.2,3,0.95,0.9719737768173218,0.9866319298744202,,COMPLETE
1166,1166,0.9844011068344116,2022-12-28 14:27:22.414226,2022-12-28 14:29:12.704429,0 days 00:01:50.290203,relu,0.2,2,0.7,0.9844011068344116,,,PRUNED
1167,1167,0.9860886931419373,2022-12-28 14:27:24.110768,2022-12-28 14:29:13.838464,0 days 00:01:49.727696,sigmoid,0.45,3,0.85,0.9721633195877075,0.9860886931419373,,PRUNED
1168,1168,0.9712002277374268,2022-12-28 14:27:31.892836,2022-12-28 14:28:35.456591,0 days 00:01:03.563755,sigmoid,0.45,3,0.85,0.9712002277374268,,,PRUNED
1169,1169,0.9702175259590149,2022-12-28 14:27:32.026958,2022-12-28 14:28:35.887984,0 days 00:01:03.861026,sigmoid,0.45,3,0.85,0.9702175259590149,,,PRUNED
1170,1170,0.9824010133743286,2022-12-28 14:27:47.917396,2022-12-28 14:29:39.072681,0 days 00:01:51.155285,sigmoid,0.45,3,0.85,0.9720028638839722,0.9824010133743286,,PRUNED
1171,1171,0.9834900498390198,2022-12-28 14:28:03.636678,2022-12-28 14:31:44.871996,0 days 00:03:41.235318,relu,0.2,4,0.6,0.9859349727630615,,,COMPLETE
1172,1172,0.9692793488502502,2022-12-28 14:28:24.707828,2022-12-28 14:29:21.721629,0 days 00:00:57.013801,sigmoid,0.45,3,0.85,0.9692793488502502,,,PRUNED
1173,1173,0.983672022819519,2022-12-28 14:28:30.150773,2022-12-28 14:30:20.702500,0 days 00:01:50.551727,relu,0.25,4,0.7,0.983672022819519,,,PRUNED
1174,1174,0.9835399985313416,2022-12-28 14:28:36.240303,2022-12-28 14:32:23.576794,0 days 00:03:47.336491,sigmoid,0.45,3,0.85,0.9719928503036499,0.9868189692497253,,COMPLETE
1175,1175,0.982344925403595,2022-12-28 14:28:36.467509,2022-12-28 14:30:34.409957,0 days 00:01:57.942448,relu,0.25,4,0.6,0.982344925403595,,,PRUNED
1176,1176,0.9866290092468262,2022-12-28 14:28:37.307272,2022-12-28 14:32:49.372242,0 days 00:04:12.064970,sigmoid,0.45,3,0.85,0.9730879068374634,0.9871516823768616,,COMPLETE
1177,1177,0.9847624897956848,2022-12-28 14:29:13.248924,2022-12-28 14:33:16.465864,0 days 00:04:03.216940,relu,0.25,4,0.6,0.9858672022819519,,,COMPLETE
1178,1178,0.9694299101829529,2022-12-28 14:29:14.389966,2022-12-28 14:30:16.253459,0 days 00:01:01.863493,tanh,0.45,3,0.85,0.9694299101829529,,,PRUNED
1179,1179,0.9685835838317871,2022-12-28 14:29:22.177043,2022-12-28 14:30:22.085757,0 days 00:00:59.908714,tanh,0.45,3,0.85,0.9685835838317871,,,PRUNED
1180,1180,0.9826634526252747,2022-12-28 14:29:39.507076,2022-12-28 14:33:18.725916,0 days 00:03:39.218840,relu,0.25,4,0.6,0.9862720370292664,,,COMPLETE
1181,1181,0.9703354239463806,2022-12-28 14:29:44.146289,2022-12-28 14:30:43.626328,0 days 00:00:59.480039,tanh,0.1,3,0.85,0.9703354239463806,,,PRUNED
1182,1182,0.9851065874099731,2022-12-28 14:30:01.899416,2022-12-28 14:31:51.472995,0 days 00:01:49.573579,relu,0.2,2,0.6,0.9851065874099731,,,PRUNED
1183,1183,0.9685829877853394,2022-12-28 14:30:16.715878,2022-12-28 14:31:17.615215,0 days 00:01:00.899337,relu,0.45,3,0.85,0.9685829877853394,,,PRUNED
1184,1184,0.984868586063385,2022-12-28 14:30:21.120880,2022-12-28 14:34:00.481862,0 days 00:03:39.360982,relu,0.1,3,0.85,0.9727373719215393,0.988601803779602,,COMPLETE
1185,1185,0.9795076847076416,2022-12-28 14:30:22.493128,2022-12-28 14:32:17.849592,0 days 00:01:55.356464,relu,0.15000000000000002,2,0.6,0.9795076847076416,,,PRUNED
1186,1186,0.9827096462249756,2022-12-28 14:30:34.900403,2022-12-28 14:32:27.661504,0 days 00:01:52.761101,relu,0.2,2,0.6,0.9827096462249756,,,PRUNED
1187,1187,0.9853370785713196,2022-12-28 14:30:38.069280,2022-12-28 14:32:31.400905,0 days 00:01:53.331625,relu,0.1,3,0.85,0.9731491804122925,0.9853370785713196,,PRUNED
1188,1188,0.967088520526886,2022-12-28 14:30:44.088748,2022-12-28 14:31:48.657437,0 days 00:01:04.568689,relu,0.45,3,0.85,0.967088520526886,,,PRUNED
1189,1189,0.9680933952331543,2022-12-28 14:31:18.065625,2022-12-28 14:32:21.002456,0 days 00:01:02.936831,sigmoid,0.45,3,0.85,0.9680933952331543,,,PRUNED
1190,1190,0.9675748944282532,2022-12-28 14:31:45.344425,2022-12-28 14:32:47.109186,0 days 00:01:01.764761,sigmoid,0.15000000000000002,3,0.85,0.9675748944282532,,,PRUNED
1191,1191,0.9860050678253174,2022-12-28 14:31:49.157891,2022-12-28 14:35:52.667797,0 days 00:04:03.509906,relu,0.15000000000000002,2,0.6,0.986280083656311,,,COMPLETE
1192,1192,0.9713051319122314,2022-12-28 14:31:51.968445,2022-12-28 14:32:51.033752,0 days 00:00:59.065307,sigmoid,0.30000000000000004,3,0.8,0.9713051319122314,,,PRUNED
1193,1193,0.9851460456848145,2022-12-28 14:32:18.270975,2022-12-28 14:34:07.860565,0 days 00:01:49.589590,relu,0.1,2,0.95,0.9851460456848145,,,PRUNED
1194,1194,0.9827955365180969,2022-12-28 14:32:21.524930,2022-12-28 14:35:56.478263,0 days 00:03:34.953333,relu,0.1,2,0.7,0.9872004985809326,,,COMPLETE
1195,1195,0.9690588712692261,2022-12-28 14:32:24.116285,2022-12-28 14:33:23.447205,0 days 00:00:59.330920,tanh,0.30000000000000004,3,0.8,0.9690588712692261,,,PRUNED
1196,1196,0.981896698474884,2022-12-28 14:32:28.126926,2022-12-28 14:34:18.451187,0 days 00:01:50.324261,relu,0.15000000000000002,2,0.7,0.981896698474884,,,PRUNED
1197,1197,0.9688336253166199,2022-12-28 14:32:31.932388,2022-12-28 14:33:29.131377,0 days 00:00:57.198989,tanh,0.4,3,0.8,0.9688336253166199,,,PRUNED
1198,1198,0.9848695993423462,2022-12-28 14:32:47.537575,2022-12-28 14:34:42.016603,0 days 00:01:54.479028,relu,0.15000000000000002,2,0.7,0.9848695993423462,,,PRUNED
1199,1199,0.9851461052894592,2022-12-28 14:32:49.892715,2022-12-28 14:34:43.224701,0 days 00:01:53.331986,relu,0.1,2,0.7,0.9851461052894592,,,PRUNED
1200,1200,0.9856184124946594,2022-12-28 14:32:51.510184,2022-12-28 14:34:45.532797,0 days 00:01:54.022613,tanh,0.4,3,1.0,0.973663866519928,0.9856184124946594,,PRUNED
1201,1201,0.9796561002731323,2022-12-28 14:33:16.914271,2022-12-28 14:36:53.425013,0 days 00:03:36.510742,relu,0.15000000000000002,2,0.95,0.9866127371788025,,,COMPLETE
1202,1202,0.9853779077529907,2022-12-28 14:33:19.309447,2022-12-28 14:37:24.576320,0 days 00:04:05.266873,relu,0.1,2,0.7,0.9857300519943237,,,COMPLETE
1203,1203,0.9848757982254028,2022-12-28 14:33:23.896613,2022-12-28 14:35:18.410673,0 days 00:01:54.514060,relu,0.15000000000000002,2,0.7,0.9848757982254028,,,PRUNED
1204,1204,0.9694077372550964,2022-12-28 14:33:29.620820,2022-12-28 14:34:31.601138,0 days 00:01:01.980318,sigmoid,0.5,3,0.95,0.9694077372550964,,,PRUNED
1205,1205,0.9671581983566284,2022-12-28 14:34:00.962297,2022-12-28 14:35:00.091028,0 days 00:00:59.128731,sigmoid,0.5,3,0.95,0.9671581983566284,,,PRUNED
1206,1206,0.9785782694816589,2022-12-28 14:34:08.341000,2022-12-28 14:35:57.511202,0 days 00:01:49.170202,sigmoid,0.5,3,0.95,0.9737651348114014,0.9785782694816589,,PRUNED
1207,1207,0.9706595540046692,2022-12-28 14:34:18.915609,2022-12-28 14:35:20.929961,0 days 00:01:02.014352,sigmoid,0.5,3,0.95,0.9706595540046692,,,PRUNED
1208,1208,0.9667120575904846,2022-12-28 14:34:32.062558,2022-12-28 14:35:31.962987,0 days 00:00:59.900429,tanh,0.35000000000000003,3,1.0,0.9667120575904846,,,PRUNED
1209,1209,0.9862425327301025,2022-12-28 14:34:42.438987,2022-12-28 14:38:49.609575,0 days 00:04:07.170588,tanh,0.35000000000000003,3,1.0,0.9731774926185608,0.9869400262832642,,COMPLETE
1210,1210,0.9855620265007019,2022-12-28 14:34:43.635073,2022-12-28 14:38:46.034327,0 days 00:04:02.399254,relu,0.05,2,0.7,0.9856375455856323,,,COMPLETE
1211,1211,0.9693298935890198,2022-12-28 14:34:45.937165,2022-12-28 14:35:47.961519,0 days 00:01:02.024354,sigmoid,0.35000000000000003,3,0.95,0.9693298935890198,,,PRUNED
1212,1212,0.9844560027122498,2022-12-28 14:35:00.515415,2022-12-28 14:36:51.798535,0 days 00:01:51.283120,relu,0.2,2,0.7,0.9844560027122498,,,PRUNED
1213,1213,0.9664058685302734,2022-12-28 14:35:18.854075,2022-12-28 14:36:19.634297,0 days 00:01:00.780222,tanh,0.35000000000000003,3,1.0,0.9664058685302734,,,PRUNED
1214,1214,0.9840776920318604,2022-12-28 14:35:21.419406,2022-12-28 14:37:13.747479,0 days 00:01:52.328073,relu,0.05,2,0.7,0.9840776920318604,,,PRUNED
1215,1215,0.970807671546936,2022-12-28 14:35:32.451430,2022-12-28 14:36:31.116739,0 days 00:00:58.665309,sigmoid,0.35000000000000003,3,0.95,0.970807671546936,,,PRUNED
1216,1216,0.9827359318733215,2022-12-28 14:35:48.414933,2022-12-28 14:39:23.020931,0 days 00:03:34.605998,relu,0.05,2,0.7,0.988326370716095,,,COMPLETE
1217,1217,0.9872444868087769,2022-12-28 14:35:53.220300,2022-12-28 14:39:56.638472,0 days 00:04:03.418172,tanh,0.30000000000000004,3,0.9,0.9733262062072754,0.9873535633087158,,COMPLETE
1218,1218,0.984977662563324,2022-12-28 14:35:57.002740,2022-12-28 14:37:55.889769,0 days 00:01:58.887029,relu,0.2,4,0.7,0.984977662563324,,,PRUNED
1219,1219,0.9831498861312866,2022-12-28 14:35:58.034677,2022-12-28 14:37:53.560653,0 days 00:01:55.525976,tanh,0.30000000000000004,3,0.9,0.9719323515892029,0.9831498861312866,,PRUNED
1220,1220,0.9834627509117126,2022-12-28 14:36:20.093715,2022-12-28 14:38:13.666918,0 days 00:01:53.573203,sigmoid,0.30000000000000004,3,0.9,0.9726719856262207,0.9834627509117126,,PRUNED
1221,1221,0.9840071797370911,2022-12-28 14:36:31.559140,2022-12-28 14:38:24.574834,0 days 00:01:53.015694,relu,0.2,5,0.7,0.9840071797370911,,,PRUNED
1222,1222,0.9834054112434387,2022-12-28 14:36:52.227924,2022-12-28 14:38:46.298567,0 days 00:01:54.070643,tanh,0.30000000000000004,3,0.9,0.9746429920196533,0.9834054112434387,,PRUNED
1223,1223,0.9829554557800293,2022-12-28 14:36:53.938478,2022-12-28 14:38:48.139240,0 days 00:01:54.200762,relu,0.05,5,0.7,0.9829554557800293,,,PRUNED
1224,1224,0.9691515564918518,2022-12-28 14:37:14.218908,2022-12-28 14:38:15.817874,0 days 00:01:01.598966,tanh,0.30000000000000004,3,0.9,0.9691515564918518,,,PRUNED
1225,1225,0.9701305627822876,2022-12-28 14:37:25.075774,2022-12-28 14:38:26.116234,0 days 00:01:01.040460,tanh,0.05,3,0.9,0.9701305627822876,,,PRUNED
1226,1226,0.9837793707847595,2022-12-28 14:37:54.011064,2022-12-28 14:39:46.386158,0 days 00:01:52.375094,relu,0.2,5,0.7,0.9837793707847595,,,PRUNED
1227,1227,0.9843146204948425,2022-12-28 14:37:56.333172,2022-12-28 14:39:48.577149,0 days 00:01:52.243977,relu,0.35000000000000003,5,0.7,0.9843146204948425,,,PRUNED
1228,1228,0.9858734607696533,2022-12-28 14:38:14.070284,2022-12-28 14:42:09.359061,0 days 00:03:55.288777,relu,0.35000000000000003,4,0.7,0.9857077598571777,,,COMPLETE
1229,1229,0.9688848853111267,2022-12-28 14:38:16.266282,2022-12-28 14:39:12.248142,0 days 00:00:55.981860,sigmoid,0.25,3,1.0,0.9688848853111267,,,PRUNED
1230,1230,0.9858889579772949,2022-12-28 14:38:25.015234,2022-12-28 14:42:18.507371,0 days 00:03:53.492137,sigmoid,0.25,3,1.0,0.9754170179367065,0.9864159226417542,,COMPLETE
1231,1231,0.9847844243049622,2022-12-28 14:38:26.542622,2022-12-28 14:40:10.241832,0 days 00:01:43.699210,relu,0.30000000000000004,4,0.7,0.9847844243049622,,,PRUNED
1232,1232,0.9707021713256836,2022-12-28 14:38:46.719951,2022-12-28 14:39:51.947210,0 days 00:01:05.227259,sigmoid,0.25,3,1.0,0.9707021713256836,,,PRUNED
1233,1233,0.9710274934768677,2022-12-28 14:38:46.852070,2022-12-28 14:39:51.069412,0 days 00:01:04.217342,sigmoid,0.25,2,1.0,0.9710274934768677,,,PRUNED
1234,1234,0.9607754349708557,2022-12-28 14:38:48.602660,2022-12-28 14:39:54.282332,0 days 00:01:05.679672,sigmoid,0.25,8,1.0,0.9607754349708557,,,PRUNED
