,number,value,datetime_start,datetime_complete,duration,params_activation,params_dropout,params_layers,params_shrink,system_attrs_completed_rung_0,system_attrs_completed_rung_1,system_attrs_completed_rung_2,state
961,961,0.97859787940979,2022-12-28 13:56:59.053156,2022-12-28 13:58:52.655389,0 days 00:01:53.602233,relu,0.5,5,0.75,0.97859787940979,,,PRUNED
962,962,0.9854843616485596,2022-12-28 13:57:14.915575,2022-12-28 13:59:04.637278,0 days 00:01:49.721703,tanh,0.25,4,0.65,0.9727460145950317,0.9854843616485596,,PRUNED
963,963,0.987063467502594,2022-12-28 13:57:17.187641,2022-12-28 14:01:18.507903,0 days 00:04:01.320262,tanh,0.45,4,0.85,0.9741799831390381,0.9872084856033325,,COMPLETE
964,964,0.9806534647941589,2022-12-28 13:57:44.375348,2022-12-28 13:59:34.293227,0 days 00:01:49.917879,relu,0.35000000000000003,5,0.7,0.9806534647941589,,,PRUNED
965,965,0.9756712913513184,2022-12-28 13:57:51.660965,2022-12-28 13:59:49.832342,0 days 00:01:58.171377,relu,0.35000000000000003,8,0.75,0.9756712913513184,,,PRUNED
966,966,0.9715256094932556,2022-12-28 13:58:01.819200,2022-12-28 13:58:59.179321,0 days 00:00:57.360121,sigmoid,0.25,3,0.85,0.9715256094932556,,,PRUNED
967,967,0.9819516539573669,2022-12-28 13:58:13.240581,2022-12-28 14:00:06.396389,0 days 00:01:53.155808,relu,0.5,7,0.7,0.9819516539573669,,,PRUNED
968,968,0.9858628511428833,2022-12-28 13:58:14.061327,2022-12-28 14:00:03.037338,0 days 00:01:48.976011,sigmoid,0.25,3,0.85,0.9720312356948853,0.9858628511428833,,PRUNED
969,969,0.9676817655563354,2022-12-28 13:58:20.615281,2022-12-28 13:59:21.751834,0 days 00:01:01.136553,sigmoid,0.25,3,0.85,0.9676817655563354,,,PRUNED
970,970,0.9669342041015625,2022-12-28 13:58:25.996168,2022-12-28 13:59:25.919621,0 days 00:00:59.923453,sigmoid,0.25,3,0.85,0.9669342041015625,,,PRUNED
971,971,0.9834023714065552,2022-12-28 13:58:45.993338,2022-12-28 14:00:29.929769,0 days 00:01:43.936431,relu,0.5,3,0.75,0.9834023714065552,,,PRUNED
972,972,0.9716558456420898,2022-12-28 13:58:53.083779,2022-12-28 13:59:54.282384,0 days 00:01:01.198605,sigmoid,0.25,3,0.85,0.9716558456420898,,,PRUNED
973,973,0.9706262350082397,2022-12-28 13:58:56.616987,2022-12-28 13:59:56.906769,0 days 00:01:00.289782,sigmoid,0.25,3,0.85,0.9706262350082397,,,PRUNED
974,974,0.9689707159996033,2022-12-28 13:58:59.691786,2022-12-28 13:59:58.836522,0 days 00:00:59.144736,sigmoid,0.25,3,0.85,0.9689707159996033,,,PRUNED
975,975,0.9661551713943481,2022-12-28 13:59:05.079682,2022-12-28 14:00:04.049256,0 days 00:00:58.969574,sigmoid,0.25,3,0.85,0.9661551713943481,,,PRUNED
976,976,0.9656569957733154,2022-12-28 13:59:22.210252,2022-12-28 14:00:17.656618,0 days 00:00:55.446366,sigmoid,0.25,3,0.85,0.9656569957733154,,,PRUNED
977,977,0.9675150513648987,2022-12-28 13:59:26.370030,2022-12-28 14:00:20.490193,0 days 00:00:54.120163,sigmoid,0.25,3,0.85,0.9675150513648987,,,PRUNED
978,978,0.9835861921310425,2022-12-28 13:59:34.734628,2022-12-28 14:01:28.932500,0 days 00:01:54.197872,relu,0.5,7,0.65,0.9835861921310425,,,PRUNED
979,979,0.9834614992141724,2022-12-28 13:59:50.270742,2022-12-28 14:01:44.190368,0 days 00:01:53.919626,relu,0.5,7,0.65,0.9834614992141724,,,PRUNED
980,980,0.9846017360687256,2022-12-28 13:59:54.793850,2022-12-28 14:01:48.490277,0 days 00:01:53.696427,relu,0.5,7,0.65,0.9846017360687256,,,PRUNED
981,981,0.9827905297279358,2022-12-28 13:59:57.352174,2022-12-28 14:03:41.602045,0 days 00:03:44.249871,relu,0.5,7,0.65,0.9880900382995605,,,COMPLETE
982,982,0.9703798890113831,2022-12-28 13:59:59.491116,2022-12-28 14:01:02.077977,0 days 00:01:02.586861,tanh,0.5,3,0.95,0.9703798890113831,,,PRUNED
983,983,0.9853097200393677,2022-12-28 14:00:03.526783,2022-12-28 14:01:56.514568,0 days 00:01:52.987785,relu,0.5,3,0.65,0.9853097200393677,,,PRUNED
984,984,0.9716169834136963,2022-12-28 14:00:04.620776,2022-12-28 14:01:06.085618,0 days 00:01:01.464842,tanh,0.2,3,0.95,0.9716169834136963,,,PRUNED
985,985,0.9841991662979126,2022-12-28 14:00:07.290201,2022-12-28 14:02:00.290000,0 days 00:01:52.999799,tanh,0.2,3,0.95,0.9731379747390747,0.9841991662979126,,PRUNED
986,986,0.9852645397186279,2022-12-28 14:00:18.122042,2022-12-28 14:02:11.605283,0 days 00:01:53.483241,relu,0.5,3,0.65,0.9852645397186279,,,PRUNED
987,987,0.9844189882278442,2022-12-28 14:00:20.940603,2022-12-28 14:02:12.896455,0 days 00:01:51.955852,relu,0.4,3,0.65,0.9844189882278442,,,PRUNED
988,988,0.987030029296875,2022-12-28 14:00:30.366165,2022-12-28 14:04:29.734771,0 days 00:03:59.368606,tanh,0.5,3,0.95,0.9754522442817688,0.9871017336845398,,COMPLETE
989,989,0.971102774143219,2022-12-28 14:01:02.625474,2022-12-28 14:02:02.116660,0 days 00:00:59.491186,tanh,0.2,3,0.95,0.971102774143219,,,PRUNED
990,990,0.9703713059425354,2022-12-28 14:01:06.520013,2022-12-28 14:02:07.218294,0 days 00:01:00.698281,sigmoid,0.30000000000000004,3,0.95,0.9703713059425354,,,PRUNED
991,991,0.9698867797851562,2022-12-28 14:01:19.001352,2022-12-28 14:02:16.720930,0 days 00:00:57.719578,tanh,0.45,4,0.95,0.9698867797851562,,,PRUNED
992,992,0.9779435992240906,2022-12-28 14:01:29.366894,2022-12-28 14:03:16.500243,0 days 00:01:47.133349,relu,0.2,3,0.65,0.9779435992240906,,,PRUNED
993,993,0.9823724627494812,2022-12-28 14:01:44.641777,2022-12-28 14:05:15.732560,0 days 00:03:31.090783,relu,0.4,3,0.65,0.9855170249938965,,,COMPLETE
994,994,0.985706627368927,2022-12-28 14:01:48.923673,2022-12-28 14:03:38.007781,0 days 00:01:49.084108,tanh,0.45,4,0.95,0.9720972180366516,0.985706627368927,,PRUNED
995,995,0.9695349335670471,2022-12-28 14:01:56.973986,2022-12-28 14:02:54.544293,0 days 00:00:57.570307,tanh,0.45,2,0.95,0.9695349335670471,,,PRUNED
996,996,0.9710206985473633,2022-12-28 14:02:00.694368,2022-12-28 14:03:00.960123,0 days 00:01:00.265755,tanh,0.45,4,0.9,0.9710206985473633,,,PRUNED
997,997,0.9669811725616455,2022-12-28 14:02:02.575076,2022-12-28 14:03:02.619632,0 days 00:01:00.044556,tanh,0.45,4,0.9,0.9669811725616455,,,PRUNED
998,998,0.966016948223114,2022-12-28 14:02:07.710741,2022-12-28 14:03:08.327820,0 days 00:01:00.617079,tanh,0.45,4,0.75,0.966016948223114,,,PRUNED
999,999,0.9689780473709106,2022-12-28 14:02:12.033671,2022-12-28 14:03:12.761848,0 days 00:01:00.728177,tanh,0.45,4,0.75,0.9689780473709106,,,PRUNED
1000,1000,0.9688817262649536,2022-12-28 14:02:13.304827,2022-12-28 14:03:14.767670,0 days 00:01:01.462843,tanh,0.45,4,0.9,0.9688817262649536,,,PRUNED
1001,1001,0.9700717926025391,2022-12-28 14:02:17.445589,2022-12-28 14:03:17.570215,0 days 00:01:00.124626,tanh,0.45,4,0.9,0.9700717926025391,,,PRUNED
1002,1002,0.9712194800376892,2022-12-28 14:02:55.006714,2022-12-28 14:03:51.089664,0 days 00:00:56.082950,tanh,0.45,4,0.9,0.9712194800376892,,,PRUNED
1003,1003,0.9700688123703003,2022-12-28 14:03:01.426547,2022-12-28 14:03:59.146986,0 days 00:00:57.720439,tanh,0.45,4,0.8,0.9700688123703003,,,PRUNED
1004,1004,0.9636964797973633,2022-12-28 14:03:03.108075,2022-12-28 14:04:01.121780,0 days 00:00:58.013705,tanh,0.45,5,0.8,0.9636964797973633,,,PRUNED
1005,1005,0.984991729259491,2022-12-28 14:03:08.878321,2022-12-28 14:04:59.410735,0 days 00:01:50.532414,tanh,0.45,5,0.8,0.972578763961792,0.984991729259491,,PRUNED
1006,1006,0.9857293963432312,2022-12-28 14:03:13.217261,2022-12-28 14:05:04.603451,0 days 00:01:51.386190,tanh,0.45,5,0.65,0.9727150201797485,0.9857293963432312,,PRUNED
1007,1007,0.9621025919914246,2022-12-28 14:03:15.250107,2022-12-28 14:04:15.862169,0 days 00:01:00.612062,tanh,0.5,5,0.8,0.9621025919914246,,,PRUNED
1008,1008,0.9693330526351929,2022-12-28 14:03:16.923628,2022-12-28 14:04:20.129046,0 days 00:01:03.205418,tanh,0.5,7,0.8,0.9693330526351929,,,PRUNED
1009,1009,0.9845183491706848,2022-12-28 14:03:18.014619,2022-12-28 14:05:07.991528,0 days 00:01:49.976909,relu,0.4,3,0.7,0.9845183491706848,,,PRUNED
1010,1010,0.9700454473495483,2022-12-28 14:03:38.450181,2022-12-28 14:04:39.319477,0 days 00:01:00.869296,tanh,0.25,5,0.85,0.9700454473495483,,,PRUNED
1011,1011,0.9692780375480652,2022-12-28 14:03:42.064466,2022-12-28 14:04:43.711468,0 days 00:01:01.647002,tanh,0.5,5,0.6,0.9692780375480652,,,PRUNED
1012,1012,0.9819122552871704,2022-12-28 14:03:51.555086,2022-12-28 14:05:39.040740,0 days 00:01:47.485654,relu,0.4,2,0.7,0.9819122552871704,,,PRUNED
1013,1013,0.9862089157104492,2022-12-28 14:03:59.598396,2022-12-28 14:07:37.013420,0 days 00:03:37.415024,tanh,0.5,3,0.8,0.9738391637802124,0.9864917397499084,,COMPLETE
1014,1014,0.984801709651947,2022-12-28 14:04:01.547167,2022-12-28 14:05:50.488139,0 days 00:01:48.940972,relu,0.4,2,0.85,0.984801709651947,,,PRUNED
1015,1015,0.9709102511405945,2022-12-28 14:04:16.324590,2022-12-28 14:05:15.383243,0 days 00:00:59.058653,sigmoid,0.5,3,0.6,0.9709102511405945,,,PRUNED
1016,1016,0.9867305159568787,2022-12-28 14:04:20.631502,2022-12-28 14:08:25.915846,0 days 00:04:05.284344,sigmoid,0.25,3,0.85,0.9731144309043884,0.9875794649124146,,COMPLETE
1017,1017,0.9705583453178406,2022-12-28 14:04:30.272260,2022-12-28 14:05:29.090699,0 days 00:00:58.818439,tanh,0.5,3,0.95,0.9705583453178406,,,PRUNED
1018,1018,0.9675638675689697,2022-12-28 14:04:39.852963,2022-12-28 14:05:37.847656,0 days 00:00:57.994693,tanh,0.5,3,0.95,0.9675638675689697,,,PRUNED
1019,1019,0.9860504865646362,2022-12-28 14:04:44.148864,2022-12-28 14:06:34.726833,0 days 00:01:50.577969,tanh,0.5,3,0.95,0.9725305438041687,0.9860504865646362,,PRUNED
1020,1020,0.9878685474395752,2022-12-28 14:04:59.901179,2022-12-28 14:09:01.399088,0 days 00:04:01.497909,relu,0.4,2,0.7,0.988006055355072,,,COMPLETE
1021,1021,0.9702878594398499,2022-12-28 14:05:05.025834,2022-12-28 14:06:04.779121,0 days 00:00:59.753287,tanh,0.5,3,0.95,0.9702878594398499,,,PRUNED
1022,1022,0.9712317585945129,2022-12-28 14:05:08.419917,2022-12-28 14:06:06.996135,0 days 00:00:58.576218,tanh,0.5,3,0.95,0.9712317585945129,,,PRUNED
1023,1023,0.9805330038070679,2022-12-28 14:05:15.872687,2022-12-28 14:07:06.799975,0 days 00:01:50.927288,tanh,0.5,3,0.95,0.9724150896072388,0.9805330038070679,,PRUNED
1024,1024,0.9710984230041504,2022-12-28 14:05:16.409175,2022-12-28 14:06:17.311505,0 days 00:01:00.902330,tanh,0.5,3,0.95,0.9710984230041504,,,PRUNED
1025,1025,0.9834460616111755,2022-12-28 14:05:29.538104,2022-12-28 14:07:21.232085,0 days 00:01:51.693981,relu,0.0,4,0.7,0.9834460616111755,,,PRUNED
1026,1026,0.9695983529090881,2022-12-28 14:05:38.273044,2022-12-28 14:06:39.250941,0 days 00:01:00.977897,tanh,0.5,3,0.95,0.9695983529090881,,,PRUNED
1027,1027,0.970518171787262,2022-12-28 14:05:39.482141,2022-12-28 14:06:39.848484,0 days 00:01:00.366343,tanh,0.5,3,0.95,0.970518171787262,,,PRUNED
1028,1028,0.9714756011962891,2022-12-28 14:05:50.916527,2022-12-28 14:06:49.002807,0 days 00:00:58.086280,tanh,0.5,3,0.95,0.9714756011962891,,,PRUNED
1029,1029,0.9828640818595886,2022-12-28 14:06:05.214515,2022-12-28 14:09:44.485252,0 days 00:03:39.270737,tanh,0.5,3,0.95,0.9731879830360413,0.9877431392669678,,COMPLETE
1030,1030,0.9845069050788879,2022-12-28 14:06:07.410511,2022-12-28 14:09:44.091895,0 days 00:03:36.681384,tanh,0.5,3,0.95,0.9740237593650818,0.9882696270942688,,COMPLETE
1031,1031,0.98243248462677,2022-12-28 14:06:17.765918,2022-12-28 14:08:12.978089,0 days 00:01:55.212171,relu,0.45,4,0.6,0.98243248462677,,,PRUNED
1032,1032,0.9811379909515381,2022-12-28 14:06:35.161228,2022-12-28 14:08:25.568530,0 days 00:01:50.407302,tanh,0.5,3,0.95,0.9731983542442322,0.9811379909515381,,PRUNED
1033,1033,0.966029167175293,2022-12-28 14:06:39.691342,2022-12-28 14:07:41.415419,0 days 00:01:01.724077,tanh,0.5,3,1.0,0.966029167175293,,,PRUNED
1034,1034,0.9690262079238892,2022-12-28 14:06:40.386973,2022-12-28 14:07:45.462095,0 days 00:01:05.075122,tanh,0.5,3,1.0,0.9690262079238892,,,PRUNED
1035,1035,0.9782359600067139,2022-12-28 14:06:49.516272,2022-12-28 14:10:28.470220,0 days 00:03:38.953948,relu,0.0,3,0.6,0.9863449335098267,,,COMPLETE
1036,1036,0.9675576686859131,2022-12-28 14:07:07.253386,2022-12-28 14:08:07.512124,0 days 00:01:00.258738,tanh,0.30000000000000004,2,1.0,0.9675576686859131,,,PRUNED
1037,1037,0.9687570333480835,2022-12-28 14:07:21.691502,2022-12-28 14:08:20.119580,0 days 00:00:58.428078,tanh,0.0,2,1.0,0.9687570333480835,,,PRUNED
1038,1038,0.9814905524253845,2022-12-28 14:07:37.481846,2022-12-28 14:11:16.285964,0 days 00:03:38.804118,relu,0.15000000000000002,3,0.6,0.9861103892326355,,,COMPLETE
1039,1039,0.9680193662643433,2022-12-28 14:07:41.841807,2022-12-28 14:08:41.142684,0 days 00:00:59.300877,sigmoid,0.30000000000000004,2,1.0,0.9680193662643433,,,PRUNED
1040,1040,0.9716095924377441,2022-12-28 14:07:45.883478,2022-12-28 14:08:43.526850,0 days 00:00:57.643372,sigmoid,0.30000000000000004,2,0.85,0.9716095924377441,,,PRUNED
1041,1041,0.9834014773368835,2022-12-28 14:08:07.957529,2022-12-28 14:11:46.383308,0 days 00:03:38.425779,sigmoid,0.25,3,0.85,0.973200261592865,0.9869158267974854,,COMPLETE
1042,1042,0.9849504232406616,2022-12-28 14:08:13.413490,2022-12-28 14:10:03.096162,0 days 00:01:49.682672,relu,0.2,3,0.7,0.9849504232406616,,,PRUNED
1043,1043,0.984172523021698,2022-12-28 14:08:20.590008,2022-12-28 14:12:03.688034,0 days 00:03:43.098026,relu,0.2,3,0.7,0.9865906238555908,,,COMPLETE
1044,1044,0.9708929061889648,2022-12-28 14:08:26.049967,2022-12-28 14:09:26.141586,0 days 00:01:00.091619,sigmoid,0.30000000000000004,3,0.85,0.9708929061889648,,,PRUNED
1045,1045,0.9709565043449402,2022-12-28 14:08:26.771623,2022-12-28 14:09:27.347681,0 days 00:01:00.576058,sigmoid,0.30000000000000004,3,0.85,0.9709565043449402,,,PRUNED
1046,1046,0.9864529967308044,2022-12-28 14:08:41.635132,2022-12-28 14:12:50.445515,0 days 00:04:08.810383,sigmoid,0.2,3,0.85,0.9730534553527832,0.9870739579200745,,COMPLETE
1047,1047,0.9701336026191711,2022-12-28 14:08:43.985267,2022-12-28 14:09:42.826745,0 days 00:00:58.841478,sigmoid,0.2,3,0.95,0.9701336026191711,,,PRUNED
1048,1048,0.9691478610038757,2022-12-28 14:09:01.865514,2022-12-28 14:09:59.036475,0 days 00:00:57.170961,sigmoid,0.2,3,0.95,0.9691478610038757,,,PRUNED
1049,1049,0.9860126376152039,2022-12-28 14:09:26.587993,2022-12-28 14:13:31.515837,0 days 00:04:04.927844,relu,0.2,2,0.7,0.9868850708007812,,,COMPLETE
1050,1050,0.9874410033226013,2022-12-28 14:09:27.766061,2022-12-28 14:13:30.267704,0 days 00:04:02.501643,relu,0.2,2,0.7,0.9874814748764038,,,COMPLETE
1051,1051,0.9820225238800049,2022-12-28 14:09:43.291168,2022-12-28 14:13:24.499461,0 days 00:03:41.208293,relu,0.15000000000000002,2,0.7,0.9855121970176697,,,COMPLETE
1052,1052,0.9632852673530579,2022-12-28 14:09:44.597353,2022-12-28 14:10:49.335483,0 days 00:01:04.738130,relu,0.25,7,0.9,0.9632852673530579,,,PRUNED
1053,1053,0.9703689217567444,2022-12-28 14:09:45.308000,2022-12-28 14:10:51.624562,0 days 00:01:06.316562,relu,0.25,7,0.9,0.9703689217567444,,,PRUNED
1054,1054,0.9841423630714417,2022-12-28 14:09:59.510906,2022-12-28 14:11:52.656006,0 days 00:01:53.145100,relu,0.2,2,0.7,0.9841423630714417,,,PRUNED
1055,1055,0.970452070236206,2022-12-28 14:10:03.536562,2022-12-28 14:11:05.624280,0 days 00:01:02.087718,relu,0.25,3,0.9,0.970452070236206,,,PRUNED
1056,1056,0.9834800362586975,2022-12-28 14:10:28.928637,2022-12-28 14:12:25.433789,0 days 00:01:56.505152,relu,0.25,7,0.9,0.9732818007469177,0.9834800362586975,,PRUNED
1057,1057,0.969457745552063,2022-12-28 14:10:49.789896,2022-12-28 14:11:50.746272,0 days 00:01:00.956376,sigmoid,0.25,3,0.85,0.969457745552063,,,PRUNED
1058,1058,0.985908031463623,2022-12-28 14:10:52.083980,2022-12-28 14:14:53.476318,0 days 00:04:01.392338,relu,0.45,2,0.7,0.9863812923431396,,,COMPLETE
1059,1059,0.9847004413604736,2022-12-28 14:11:06.076691,2022-12-28 14:12:58.399740,0 days 00:01:52.323049,sigmoid,0.25,3,0.85,0.9720792770385742,0.9847004413604736,,PRUNED
1060,1060,0.9716194272041321,2022-12-28 14:11:16.765400,2022-12-28 14:12:17.463550,0 days 00:01:00.698150,sigmoid,0.25,3,0.85,0.9716194272041321,,,PRUNED
1061,1061,0.9680885076522827,2022-12-28 14:11:46.945819,2022-12-28 14:12:48.323588,0 days 00:01:01.377769,sigmoid,0.25,3,1.0,0.9680885076522827,,,PRUNED
1062,1062,0.9672114253044128,2022-12-28 14:11:51.162650,2022-12-28 14:12:52.039963,0 days 00:01:00.877313,sigmoid,0.25,3,1.0,0.9672114253044128,,,PRUNED
1063,1063,0.9853152632713318,2022-12-28 14:11:53.166471,2022-12-28 14:13:44.602734,0 days 00:01:51.436263,relu,0.45,2,0.7,0.9853152632713318,,,PRUNED
1064,1064,0.9845430254936218,2022-12-28 14:12:04.188489,2022-12-28 14:13:54.526752,0 days 00:01:50.338263,relu,0.30000000000000004,2,0.7,0.9845430254936218,,,PRUNED
1065,1065,0.9830676913261414,2022-12-28 14:12:17.906954,2022-12-28 14:14:07.376431,0 days 00:01:49.469477,relu,0.30000000000000004,2,0.7,0.9830676913261414,,,PRUNED
1066,1066,0.9842954277992249,2022-12-28 14:12:25.881196,2022-12-28 14:14:16.708915,0 days 00:01:50.827719,sigmoid,0.25,3,1.0,0.9725646376609802,0.9842954277992249,,PRUNED
1067,1067,0.9827256202697754,2022-12-28 14:12:48.775999,2022-12-28 14:14:38.683881,0 days 00:01:49.907882,sigmoid,0.25,3,1.0,0.9727879166603088,0.9827256202697754,,PRUNED
1068,1068,0.9682552218437195,2022-12-28 14:12:50.921947,2022-12-28 14:13:49.835487,0 days 00:00:58.913540,sigmoid,0.1,3,0.95,0.9682552218437195,,,PRUNED
1069,1069,0.9852814674377441,2022-12-28 14:12:52.555432,2022-12-28 14:16:31.447318,0 days 00:03:38.891886,sigmoid,0.15000000000000002,3,0.95,0.9748479127883911,0.986348569393158,,COMPLETE
1070,1070,0.987028956413269,2022-12-28 14:12:58.894190,2022-12-28 14:17:02.703714,0 days 00:04:03.809524,relu,0.45,2,0.7,0.9868709444999695,,,COMPLETE
1071,1071,0.9842215180397034,2022-12-28 14:13:25.035947,2022-12-28 14:16:59.818092,0 days 00:03:34.782145,relu,0.30000000000000004,2,0.65,0.9856602549552917,,,COMPLETE
1072,1072,0.9707267880439758,2022-12-28 14:13:30.792180,2022-12-28 14:14:30.499446,0 days 00:00:59.707266,tanh,0.15000000000000002,3,0.95,0.9707267880439758,,,PRUNED
1073,1073,0.9687638282775879,2022-12-28 14:13:32.002279,2022-12-28 14:14:32.316096,0 days 00:01:00.313817,tanh,0.25,3,0.95,0.9687638282775879,,,PRUNED
1074,1074,0.9687823057174683,2022-12-28 14:13:45.032123,2022-12-28 14:14:45.270864,0 days 00:01:00.238741,tanh,0.15000000000000002,3,0.95,0.9687823057174683,,,PRUNED
1075,1075,0.9789540767669678,2022-12-28 14:13:50.253867,2022-12-28 14:15:41.786205,0 days 00:01:51.532338,relu,0.15000000000000002,2,0.65,0.9789540767669678,,,PRUNED
1076,1076,0.9684644937515259,2022-12-28 14:13:54.920109,2022-12-28 14:14:55.532186,0 days 00:01:00.612077,tanh,0.4,3,0.95,0.9684644937515259,,,PRUNED
1077,1077,0.9711663126945496,2022-12-28 14:14:07.791809,2022-12-28 14:15:06.522169,0 days 00:00:58.730360,tanh,0.4,3,0.95,0.9711663126945496,,,PRUNED
1078,1078,0.9861685633659363,2022-12-28 14:14:17.145312,2022-12-28 14:17:50.231685,0 days 00:03:33.086373,tanh,0.25,3,0.95,0.9753471612930298,0.9863930344581604,,COMPLETE
1079,1079,0.9697884321212769,2022-12-28 14:14:30.947851,2022-12-28 14:15:31.953273,0 days 00:01:01.005422,tanh,0.45,3,0.95,0.9697884321212769,,,PRUNED
1080,1080,0.9834861755371094,2022-12-28 14:14:32.722465,2022-12-28 14:16:26.625939,0 days 00:01:53.903474,sigmoid,0.25,3,0.95,0.9727305769920349,0.9834861755371094,,PRUNED
1081,1081,0.9651106595993042,2022-12-28 14:14:39.159313,2022-12-28 14:15:40.103677,0 days 00:01:00.944364,tanh,0.45,3,0.95,0.9651106595993042,,,PRUNED
1082,1082,0.9691643714904785,2022-12-28 14:14:45.732283,2022-12-28 14:15:45.394482,0 days 00:00:59.662199,sigmoid,0.2,3,0.95,0.9691643714904785,,,PRUNED
1083,1083,0.9828979969024658,2022-12-28 14:14:53.956755,2022-12-28 14:16:47.865232,0 days 00:01:53.908477,sigmoid,0.2,3,0.95,0.9721965789794922,0.9828979969024658,,PRUNED
1084,1084,0.9844610095024109,2022-12-28 14:14:55.946561,2022-12-28 14:16:48.548853,0 days 00:01:52.602292,relu,0.15000000000000002,2,0.65,0.9844610095024109,,,PRUNED
1085,1085,0.982369065284729,2022-12-28 14:15:06.939547,2022-12-28 14:16:58.630013,0 days 00:01:51.690466,sigmoid,0.45,3,0.85,0.9744973182678223,0.982369065284729,,PRUNED
1086,1086,0.9696503281593323,2022-12-28 14:15:32.393674,2022-12-28 14:16:32.895633,0 days 00:01:00.501959,sigmoid,0.2,3,0.85,0.9696503281593323,,,PRUNED
1087,1087,0.969194769859314,2022-12-28 14:15:40.560091,2022-12-28 14:16:41.330296,0 days 00:01:00.770205,sigmoid,0.2,3,0.85,0.969194769859314,,,PRUNED
1088,1088,0.9714027643203735,2022-12-28 14:15:42.240617,2022-12-28 14:16:43.164962,0 days 00:01:00.924345,sigmoid,0.2,3,0.85,0.9714027643203735,,,PRUNED
1089,1089,0.9833528399467468,2022-12-28 14:15:45.795847,2022-12-28 14:17:34.313721,0 days 00:01:48.517874,sigmoid,0.25,3,0.85,0.9718688130378723,0.9833528399467468,,PRUNED
1090,1090,0.9692428708076477,2022-12-28 14:16:27.104373,2022-12-28 14:17:26.028910,0 days 00:00:58.924537,sigmoid,0.30000000000000004,3,0.85,0.9692428708076477,,,PRUNED
1091,1091,0.9679983854293823,2022-12-28 14:16:31.906737,2022-12-28 14:17:28.902802,0 days 00:00:56.996065,sigmoid,0.30000000000000004,3,0.85,0.9679983854293823,,,PRUNED
1092,1092,0.9673792719841003,2022-12-28 14:16:33.432121,2022-12-28 14:17:31.819455,0 days 00:00:58.387334,sigmoid,0.25,3,0.75,0.9673792719841003,,,PRUNED
1093,1093,0.985366940498352,2022-12-28 14:16:41.786711,2022-12-28 14:18:29.070994,0 days 00:01:47.284283,relu,0.5,2,0.6,0.985366940498352,,,PRUNED
1094,1094,0.9846941828727722,2022-12-28 14:16:43.598356,2022-12-28 14:18:30.914669,0 days 00:01:47.316313,sigmoid,0.30000000000000004,3,0.75,0.9730170369148254,0.9846941828727722,,PRUNED
1095,1095,0.9854756593704224,2022-12-28 14:16:48.363684,2022-12-28 14:18:37.043236,0 days 00:01:48.679552,relu,0.30000000000000004,3,1.0,0.9721935391426086,0.9854756593704224,,PRUNED
1096,1096,0.9707959890365601,2022-12-28 14:16:48.979244,2022-12-28 14:17:48.559167,0 days 00:00:59.579923,relu,0.30000000000000004,3,1.0,0.9707959890365601,,,PRUNED
1097,1097,0.9686324000358582,2022-12-28 14:16:59.077420,2022-12-28 14:18:00.908386,0 days 00:01:01.830966,relu,0.25,3,1.0,0.9686324000358582,,,PRUNED
