,number,value,datetime_start,datetime_complete,duration,params_activation,params_dropout,params_layers,params_shrink,system_attrs_completed_rung_0,system_attrs_completed_rung_1,system_attrs_completed_rung_2,state
0,0,0.9846671223640442,2022-12-28 11:21:52.543025,2022-12-28 11:26:15.404089,0 days 00:04:22.861064,tanh,0.25,2,0.75,0.9846671223640442,,,PRUNED
1,1,0.9854399561882019,2022-12-28 11:21:52.544026,2022-12-28 11:26:10.898998,0 days 00:04:18.354972,relu,0.35000000000000003,3,0.95,0.9854399561882019,,,PRUNED
2,2,0.9844998121261597,2022-12-28 11:21:52.732855,2022-12-28 11:26:18.359775,0 days 00:04:25.626920,relu,0.5,7,0.8,0.9844998121261597,,,PRUNED
3,3,0.9848695993423462,2022-12-28 11:21:52.849248,2022-12-28 11:26:17.545035,0 days 00:04:24.695787,tanh,0.35000000000000003,4,0.6,0.9880789518356323,0.9880789518356323,,COMPLETE
4,4,0.9794259667396545,2022-12-28 11:21:52.933297,2022-12-28 11:26:01.848766,0 days 00:04:08.915469,sigmoid,0.4,4,0.6,,,,COMPLETE
5,5,0.9791919589042664,2022-12-28 11:21:53.014321,2022-12-28 11:26:05.090715,0 days 00:04:12.076394,sigmoid,0.0,3,0.85,,,,COMPLETE
6,6,0.9833750128746033,2022-12-28 11:21:53.016324,2022-12-28 11:26:48.165256,0 days 00:04:55.148932,relu,0.35000000000000003,8,0.6,0.9879307746887207,0.9879307746887207,0.9874807000160217,COMPLETE
7,7,0.983722448348999,2022-12-28 11:21:53.103479,2022-12-28 11:26:03.287072,0 days 00:04:10.183593,relu,0.15000000000000002,5,0.9,,,,COMPLETE
8,8,0.9832848906517029,2022-12-28 11:21:53.020328,2022-12-28 11:26:16.864416,0 days 00:04:23.844088,tanh,0.15000000000000002,4,0.65,0.9832848906517029,,,PRUNED
9,9,0.9838627576828003,2022-12-28 11:21:53.019327,2022-12-28 11:26:19.917189,0 days 00:04:26.897862,relu,0.4,6,1.0,0.9838627576828003,,,PRUNED
10,10,0.9769005179405212,2022-12-28 11:21:53.016324,2022-12-28 11:26:07.970332,0 days 00:04:14.954008,relu,0.45,8,0.7,0.9845387935638428,,,COMPLETE
11,11,0.983067512512207,2022-12-28 11:21:53.023330,2022-12-28 11:26:08.682985,0 days 00:04:15.659655,sigmoid,0.45,7,1.0,0.987527072429657,,,COMPLETE
12,12,0.9847227334976196,2022-12-28 11:26:02.281158,2022-12-28 11:27:31.972059,0 days 00:01:29.690901,sigmoid,0.25,7,0.75,0.9847227334976196,,,PRUNED
13,13,0.9856855869293213,2022-12-28 11:26:03.755498,2022-12-28 11:27:25.988624,0 days 00:01:22.233126,relu,0.4,2,0.8,0.9856855869293213,,,PRUNED
14,14,0.9688335657119751,2022-12-28 11:26:05.531114,2022-12-28 11:27:09.832948,0 days 00:01:04.301834,sigmoid,0.35000000000000003,8,0.95,0.9688335657119751,,,PRUNED
15,15,0.9700151681900024,2022-12-28 11:26:08.481802,2022-12-28 11:27:10.658698,0 days 00:01:02.176896,sigmoid,0.05,4,0.8,0.9700151681900024,,,PRUNED
16,16,0.9690935015678406,2022-12-28 11:26:09.511737,2022-12-28 11:27:09.164342,0 days 00:00:59.652605,tanh,0.25,2,0.75,0.9690935015678406,,,PRUNED
17,17,0.971424400806427,2022-12-28 11:26:11.432483,2022-12-28 11:27:11.683631,0 days 00:01:00.251148,sigmoid,0.15000000000000002,3,0.75,0.971424400806427,,,PRUNED
18,18,0.9706884622573853,2022-12-28 11:26:16.035665,2022-12-28 11:27:17.424844,0 days 00:01:01.389179,relu,0.35000000000000003,3,0.9,0.9706884622573853,,,PRUNED
19,19,0.9699960350990295,2022-12-28 11:26:17.473970,2022-12-28 11:27:19.109376,0 days 00:01:01.635406,relu,0.15000000000000002,3,0.9,0.9699960350990295,,,PRUNED
20,20,0.969813883304596,2022-12-28 11:26:18.724106,2022-12-28 11:27:19.254506,0 days 00:01:00.530400,relu,0.45,2,0.7,0.969813883304596,,,PRUNED
21,21,0.9697546362876892,2022-12-28 11:26:18.723104,2022-12-28 11:27:20.417563,0 days 00:01:01.694459,relu,0.2,4,0.65,0.9697546362876892,,,PRUNED
22,22,0.9611051082611084,2022-12-28 11:26:20.791984,2022-12-28 11:27:20.300456,0 days 00:00:59.508472,tanh,0.2,8,0.75,0.9611051082611084,,,PRUNED
23,23,0.9651792049407959,2022-12-28 11:26:48.679724,2022-12-28 11:27:40.378695,0 days 00:00:51.698971,sigmoid,0.35000000000000003,6,0.65,0.9651792049407959,,,PRUNED
24,24,0.9674810767173767,2022-12-28 11:27:09.626761,2022-12-28 11:28:10.876405,0 days 00:01:01.249644,tanh,0.5,5,0.65,0.9674810767173767,,,PRUNED
25,25,0.975856602191925,2022-12-28 11:27:10.311383,2022-12-28 11:28:12.587959,0 days 00:01:02.276576,tanh,0.5,6,0.85,0.975856602191925,,,PRUNED
26,26,0.9750910401344299,2022-12-28 11:27:11.122120,2022-12-28 11:28:11.967396,0 days 00:01:00.845276,tanh,0.5,6,0.85,0.9750910401344299,,,PRUNED
27,27,0.9838936924934387,2022-12-28 11:27:12.190090,2022-12-28 11:28:51.407233,0 days 00:01:39.217143,tanh,0.4,2,1.0,0.9838936924934387,,,PRUNED
28,28,0.9655107259750366,2022-12-28 11:27:17.855235,2022-12-28 11:28:22.826262,0 days 00:01:04.971027,tanh,0.5,6,0.85,0.9655107259750366,,,PRUNED
29,29,0.9713330864906311,2022-12-28 11:27:20.064241,2022-12-28 11:28:26.237366,0 days 00:01:06.173125,tanh,0.0,6,0.85,0.9713330864906311,,,PRUNED
30,30,0.9707379937171936,2022-12-28 11:27:20.071248,2022-12-28 11:28:27.718712,0 days 00:01:07.647464,tanh,0.0,6,0.85,0.9707379937171936,,,PRUNED
31,31,0.9853613972663879,2022-12-28 11:27:20.957053,2022-12-28 11:29:09.955490,0 days 00:01:48.998437,sigmoid,0.4,4,0.9,0.9853613972663879,,,PRUNED
32,32,0.979655385017395,2022-12-28 11:27:21.346407,2022-12-28 11:30:52.388106,0 days 00:03:31.041699,sigmoid,0.4,2,0.9,0.987409770488739,,,COMPLETE
33,33,0.9698600769042969,2022-12-28 11:27:26.745311,2022-12-28 11:28:28.908793,0 days 00:01:02.163482,tanh,0.0,6,0.85,0.9698600769042969,,,PRUNED
34,34,0.9662927985191345,2022-12-28 11:27:32.567600,2022-12-28 11:28:30.925625,0 days 00:00:58.358025,tanh,0.0,6,0.85,0.9662927985191345,,,PRUNED
35,35,0.9859194755554199,2022-12-28 11:27:40.851125,2022-12-28 11:31:36.853516,0 days 00:03:56.002391,relu,0.25,2,0.7,0.9859670400619507,,,COMPLETE
36,36,0.972484290599823,2022-12-28 11:28:11.315803,2022-12-28 11:29:11.947303,0 days 00:01:00.631500,tanh,0.0,6,0.85,0.972484290599823,,,PRUNED
37,37,0.9859485626220703,2022-12-28 11:28:12.412800,2022-12-28 11:30:01.910706,0 days 00:01:49.497906,relu,0.35000000000000003,3,0.65,0.9859485626220703,,,PRUNED
38,38,0.9842497706413269,2022-12-28 11:28:13.020351,2022-12-28 11:30:08.915071,0 days 00:01:55.894720,relu,0.35000000000000003,8,0.75,0.9842497706413269,,,PRUNED
39,39,0.9833781123161316,2022-12-28 11:28:23.316713,2022-12-28 11:30:23.075276,0 days 00:01:59.758563,tanh,0.45,8,0.95,0.9833781123161316,,,PRUNED
40,40,0.9839362502098083,2022-12-28 11:28:26.680769,2022-12-28 11:30:18.383671,0 days 00:01:51.702902,tanh,0.0,2,0.9,0.9839362502098083,,,PRUNED
41,41,0.9798290729522705,2022-12-28 11:28:28.209157,2022-12-28 11:32:10.004642,0 days 00:03:41.795485,sigmoid,0.25,5,0.7,0.9861800670623779,,,COMPLETE
42,42,0.965220034122467,2022-12-28 11:28:29.332176,2022-12-28 11:29:32.720176,0 days 00:01:03.388000,relu,0.30000000000000004,5,0.6,0.965220034122467,,,PRUNED
43,43,0.9615224003791809,2022-12-28 11:28:31.332995,2022-12-28 11:29:35.837010,0 days 00:01:04.504015,relu,0.30000000000000004,7,0.6,0.9615224003791809,,,PRUNED
44,44,0.978346049785614,2022-12-28 11:28:51.840627,2022-12-28 11:32:32.954494,0 days 00:03:41.113867,sigmoid,0.15000000000000002,6,0.7,0.9873899817466736,,,COMPLETE
45,45,0.9425746202468872,2022-12-28 11:29:10.391887,2022-12-28 11:30:14.255922,0 days 00:01:03.864035,relu,0.30000000000000004,7,0.6,0.9425746202468872,,,PRUNED
46,46,0.9863620400428772,2022-12-28 11:29:12.393708,2022-12-28 11:33:22.653975,0 days 00:04:10.260267,relu,0.4,6,0.6,0.9861689209938049,,,COMPLETE
47,47,0.9627236723899841,2022-12-28 11:29:33.214625,2022-12-28 11:30:35.931958,0 days 00:01:02.717333,relu,0.4,7,0.6,0.9627236723899841,,,PRUNED
48,48,0.9837726354598999,2022-12-28 11:29:36.305436,2022-12-28 11:31:29.011390,0 days 00:01:52.705954,tanh,0.25,4,0.9,0.9837726354598999,,,PRUNED
49,49,0.9856739044189453,2022-12-28 11:30:02.363118,2022-12-28 11:31:55.720668,0 days 00:01:53.357550,tanh,0.2,6,1.0,0.9856739044189453,,,PRUNED
50,50,0.9793540835380554,2022-12-28 11:30:09.428538,2022-12-28 11:32:01.575986,0 days 00:01:52.147448,sigmoid,0.25,5,0.6,0.9793540835380554,,,PRUNED
51,51,0.9874535202980042,2022-12-28 11:30:14.753374,2022-12-28 11:32:08.483260,0 days 00:01:53.729886,relu,0.1,5,0.7,0.9744688868522644,0.9874535202980042,,PRUNED
52,52,0.9705577492713928,2022-12-28 11:30:18.865109,2022-12-28 11:31:20.675820,0 days 00:01:01.810711,relu,0.4,5,0.7,0.9705577492713928,,,PRUNED
53,53,0.9854183197021484,2022-12-28 11:30:23.563720,2022-12-28 11:32:16.818837,0 days 00:01:53.255117,relu,0.1,5,0.7,0.9736059308052063,0.9854183197021484,,PRUNED
54,54,0.9675564765930176,2022-12-28 11:30:36.452431,2022-12-28 11:31:37.589182,0 days 00:01:01.136751,relu,0.25,5,0.7,0.9675564765930176,,,PRUNED
55,55,0.968063235282898,2022-12-28 11:30:52.868542,2022-12-28 11:31:55.601560,0 days 00:01:02.733018,relu,0.25,5,0.7,0.968063235282898,,,PRUNED
56,56,0.9782754778862,2022-12-28 11:31:21.088193,2022-12-28 11:35:04.111018,0 days 00:03:43.022825,sigmoid,0.25,6,1.0,0.9886295795440674,,,COMPLETE
57,57,0.9843114614486694,2022-12-28 11:31:29.431772,2022-12-28 11:33:20.608116,0 days 00:01:51.176344,relu,0.25,4,1.0,0.9722410440444946,0.9843114614486694,,PRUNED
58,58,0.9832245111465454,2022-12-28 11:31:37.397008,2022-12-28 11:33:33.743406,0 days 00:01:56.346398,sigmoid,0.15000000000000002,6,1.0,0.9832245111465454,,,PRUNED
59,59,0.9802175760269165,2022-12-28 11:31:38.046598,2022-12-28 11:35:20.928296,0 days 00:03:42.881698,relu,0.15000000000000002,6,1.0,0.9880449175834656,,,COMPLETE
60,60,0.9678601026535034,2022-12-28 11:31:56.352242,2022-12-28 11:32:58.163397,0 days 00:01:01.811155,relu,0.1,4,1.0,0.9678601026535034,,,PRUNED
61,61,0.9841842651367188,2022-12-28 11:31:56.460340,2022-12-28 11:33:55.167015,0 days 00:01:58.706675,relu,0.15000000000000002,6,0.6,0.9841842651367188,,,PRUNED
62,62,0.9843367338180542,2022-12-28 11:32:02.003374,2022-12-28 11:34:00.118512,0 days 00:01:58.115138,relu,0.1,6,0.7,0.9843367338180542,,,PRUNED
63,63,0.984584391117096,2022-12-28 11:32:08.937673,2022-12-28 11:34:05.137204,0 days 00:01:56.199531,relu,0.15000000000000002,6,0.7,0.984584391117096,,,PRUNED
64,64,0.9801089763641357,2022-12-28 11:32:10.541130,2022-12-28 11:35:50.435099,0 days 00:03:39.893969,relu,0.15000000000000002,6,0.7,0.9859962463378906,,,COMPLETE
65,65,0.9875499606132507,2022-12-28 11:32:17.355324,2022-12-28 11:36:27.731431,0 days 00:04:10.376107,relu,0.15000000000000002,6,0.7,0.9877375960350037,,,COMPLETE
66,66,0.9689694046974182,2022-12-28 11:32:33.525012,2022-12-28 11:33:35.143684,0 days 00:01:01.618672,relu,0.45,4,1.0,0.9689694046974182,,,PRUNED
67,67,0.9687108397483826,2022-12-28 11:32:58.678865,2022-12-28 11:34:00.688029,0 days 00:01:02.009164,sigmoid,0.45,3,0.95,0.9687108397483826,,,PRUNED
68,68,0.9845818877220154,2022-12-28 11:33:21.098562,2022-12-28 11:35:14.290264,0 days 00:01:53.191702,relu,0.15000000000000002,6,0.75,0.9845818877220154,,,PRUNED
69,69,0.98366779088974,2022-12-28 11:33:23.301562,2022-12-28 11:35:17.277977,0 days 00:01:53.976415,relu,0.1,6,0.65,0.98366779088974,,,PRUNED
70,70,0.9860312342643738,2022-12-28 11:33:34.321933,2022-12-28 11:35:23.736848,0 days 00:01:49.414915,sigmoid,0.45,3,0.95,0.9773213863372803,0.9860312342643738,,PRUNED
71,71,0.9845788478851318,2022-12-28 11:33:35.587086,2022-12-28 11:35:28.585253,0 days 00:01:52.998167,relu,0.5,7,0.65,0.9845788478851318,,,PRUNED
72,72,0.9689564108848572,2022-12-28 11:33:55.587396,2022-12-28 11:34:56.489093,0 days 00:01:00.901697,sigmoid,0.4,3,0.95,0.9689564108848572,,,PRUNED
73,73,0.9695199728012085,2022-12-28 11:34:00.687029,2022-12-28 11:35:06.011744,0 days 00:01:05.324715,sigmoid,0.4,2,0.95,0.9695199728012085,,,PRUNED
74,74,0.9709736704826355,2022-12-28 11:34:01.282570,2022-12-28 11:35:03.321300,0 days 00:01:02.038730,sigmoid,0.4,2,0.95,0.9709736704826355,,,PRUNED
75,75,0.9667465686798096,2022-12-28 11:34:05.789797,2022-12-28 11:35:07.954508,0 days 00:01:02.164711,sigmoid,0.4,2,0.95,0.9667465686798096,,,PRUNED
76,76,0.968386709690094,2022-12-28 11:34:56.960522,2022-12-28 11:35:49.866584,0 days 00:00:52.906062,relu,0.35000000000000003,2,0.95,0.968386709690094,,,PRUNED
77,77,0.9850380420684814,2022-12-28 11:35:03.796732,2022-12-28 11:36:51.454064,0 days 00:01:47.657332,tanh,0.35000000000000003,2,0.9,0.9721176028251648,0.9850380420684814,,PRUNED
78,78,0.9869019389152527,2022-12-28 11:35:04.785631,2022-12-28 11:39:01.313083,0 days 00:03:56.527452,relu,0.5,7,0.65,0.987148642539978,,,COMPLETE
79,79,0.9828362464904785,2022-12-28 11:35:06.448140,2022-12-28 11:36:59.320211,0 days 00:01:52.872071,relu,0.5,7,0.65,0.9828362464904785,,,PRUNED
80,80,0.9866943359375,2022-12-28 11:35:08.364881,2022-12-28 11:36:57.339410,0 days 00:01:48.974529,tanh,0.2,3,0.9,0.9739861488342285,0.9866943359375,,PRUNED
81,81,0.9850651621818542,2022-12-28 11:35:14.827752,2022-12-28 11:37:02.453060,0 days 00:01:47.625308,tanh,0.2,3,0.9,0.9720546007156372,0.9850651621818542,,PRUNED
82,82,0.9672719240188599,2022-12-28 11:35:17.681344,2022-12-28 11:36:17.640262,0 days 00:00:59.958918,tanh,0.2,3,0.9,0.9672719240188599,,,PRUNED
83,83,0.9796404838562012,2022-12-28 11:35:21.578888,2022-12-28 11:37:17.270546,0 days 00:01:55.691658,relu,0.5,7,0.65,0.9796404838562012,,,PRUNED
84,84,0.9689867496490479,2022-12-28 11:35:24.207275,2022-12-28 11:36:24.758730,0 days 00:01:00.551455,tanh,0.2,3,0.9,0.9689867496490479,,,PRUNED
85,85,0.9858030080795288,2022-12-28 11:35:28.986616,2022-12-28 11:37:22.265079,0 days 00:01:53.278463,relu,0.5,7,0.85,0.9858030080795288,,,PRUNED
86,86,0.982538640499115,2022-12-28 11:35:50.339013,2022-12-28 11:37:44.806566,0 days 00:01:54.467553,relu,0.5,7,0.95,0.982538640499115,,,PRUNED
87,87,0.9679415225982666,2022-12-28 11:35:51.286873,2022-12-28 11:36:52.820305,0 days 00:01:01.533432,tanh,0.2,4,0.8,0.9679415225982666,,,PRUNED
88,88,0.9711052775382996,2022-12-28 11:36:18.096676,2022-12-28 11:37:15.526959,0 days 00:00:57.430283,tanh,0.35000000000000003,4,0.8,0.9711052775382996,,,PRUNED
89,89,0.9871492385864258,2022-12-28 11:36:25.295217,2022-12-28 11:38:08.437035,0 days 00:01:43.141818,relu,0.30000000000000004,4,0.8,0.9729533791542053,0.9871492385864258,,PRUNED
90,90,0.9709441065788269,2022-12-28 11:36:28.194852,2022-12-28 11:37:27.110488,0 days 00:00:58.915636,relu,0.30000000000000004,4,0.8,0.9709441065788269,,,PRUNED
91,91,0.9705724716186523,2022-12-28 11:36:51.907477,2022-12-28 11:37:49.721034,0 days 00:00:57.813557,relu,0.30000000000000004,4,0.75,0.9705724716186523,,,PRUNED
92,92,0.9613544344902039,2022-12-28 11:36:53.316756,2022-12-28 11:37:54.280175,0 days 00:01:00.963419,relu,0.30000000000000004,8,0.75,0.9613544344902039,,,PRUNED
93,93,0.9693742990493774,2022-12-28 11:36:57.940957,2022-12-28 11:37:57.188818,0 days 00:00:59.247861,relu,0.30000000000000004,4,0.75,0.9693742990493774,,,PRUNED
94,94,0.9574471116065979,2022-12-28 11:36:59.798646,2022-12-28 11:38:01.212473,0 days 00:01:01.413827,relu,0.30000000000000004,8,0.75,0.9574471116065979,,,PRUNED
95,95,0.9654742479324341,2022-12-28 11:37:02.917482,2022-12-28 11:38:02.242408,0 days 00:00:59.324926,relu,0.30000000000000004,8,0.65,0.9654742479324341,,,PRUNED
96,96,0.9618384838104248,2022-12-28 11:37:15.954347,2022-12-28 11:38:13.986076,0 days 00:00:58.031729,relu,0.30000000000000004,8,0.65,0.9618384838104248,,,PRUNED
97,97,0.9582149386405945,2022-12-28 11:37:17.743972,2022-12-28 11:38:16.819653,0 days 00:00:59.075681,relu,0.30000000000000004,8,0.65,0.9582149386405945,,,PRUNED
98,98,0.964156985282898,2022-12-28 11:37:22.704478,2022-12-28 11:38:23.244493,0 days 00:01:00.540015,relu,0.30000000000000004,8,0.65,0.964156985282898,,,PRUNED
99,99,0.9828979969024658,2022-12-28 11:37:27.648976,2022-12-28 11:39:16.922701,0 days 00:01:49.273725,relu,0.30000000000000004,5,0.8,0.9828979969024658,,,PRUNED
100,100,0.9821245074272156,2022-12-28 11:37:45.289004,2022-12-28 11:39:32.705037,0 days 00:01:47.416033,relu,0.30000000000000004,5,0.8,0.9821245074272156,,,PRUNED
101,101,0.9578427076339722,2022-12-28 11:37:50.181452,2022-12-28 11:38:53.567043,0 days 00:01:03.385591,relu,0.15000000000000002,8,0.65,0.9578427076339722,,,PRUNED
102,102,0.9632001519203186,2022-12-28 11:37:54.770622,2022-12-28 11:38:57.882967,0 days 00:01:03.112345,relu,0.15000000000000002,8,0.65,0.9632001519203186,,,PRUNED
103,103,0.9641082286834717,2022-12-28 11:37:57.650237,2022-12-28 11:39:00.235103,0 days 00:01:02.584866,relu,0.35000000000000003,8,0.65,0.9641082286834717,,,PRUNED
104,104,0.9850367903709412,2022-12-28 11:38:01.690907,2022-12-28 11:39:57.045147,0 days 00:01:55.354240,relu,0.35000000000000003,7,1.0,0.9720867872238159,0.9850367903709412,,PRUNED
105,105,0.985634982585907,2022-12-28 11:38:02.868978,2022-12-28 11:39:53.436869,0 days 00:01:50.567891,relu,0.15000000000000002,5,1.0,0.9726428389549255,0.985634982585907,,PRUNED
106,106,0.9857763648033142,2022-12-28 11:38:08.883440,2022-12-28 11:40:00.831586,0 days 00:01:51.948146,relu,0.30000000000000004,5,0.8,0.9857763648033142,,,PRUNED
107,107,0.9841856360435486,2022-12-28 11:38:14.443491,2022-12-28 11:40:02.713296,0 days 00:01:48.269805,relu,0.30000000000000004,5,0.8,0.9841856360435486,,,PRUNED
108,108,0.9666421413421631,2022-12-28 11:38:17.248041,2022-12-28 11:39:17.651363,0 days 00:01:00.403322,tanh,0.15000000000000002,5,0.6,0.9666421413421631,,,PRUNED
109,109,0.9819024205207825,2022-12-28 11:38:23.690897,2022-12-28 11:41:58.962924,0 days 00:03:35.272027,relu,0.30000000000000004,5,0.8,0.9860479235649109,,,COMPLETE
110,110,0.9853622317314148,2022-12-28 11:38:54.069500,2022-12-28 11:40:44.182984,0 days 00:01:50.113484,relu,0.30000000000000004,5,0.8,0.9853622317314148,,,PRUNED
111,111,0.9695645570755005,2022-12-28 11:38:58.331375,2022-12-28 11:40:01.353060,0 days 00:01:03.021685,tanh,0.15000000000000002,7,0.6,0.9695645570755005,,,PRUNED
112,112,0.9849887490272522,2022-12-28 11:39:00.754576,2022-12-28 11:40:51.208366,0 days 00:01:50.453790,relu,0.30000000000000004,5,0.8,0.9849887490272522,,,PRUNED
113,113,0.9840684533119202,2022-12-28 11:39:01.767495,2022-12-28 11:40:53.948856,0 days 00:01:52.181361,relu,0.30000000000000004,5,0.6,0.9840684533119202,,,PRUNED
114,114,0.9845757484436035,2022-12-28 11:39:17.379115,2022-12-28 11:41:12.530740,0 days 00:01:55.151625,relu,0.30000000000000004,5,0.6,0.9845757484436035,,,PRUNED
115,115,0.9844751358032227,2022-12-28 11:39:18.145812,2022-12-28 11:42:58.728224,0 days 00:03:40.582412,relu,0.30000000000000004,5,0.6,0.9875930547714233,,,COMPLETE
116,116,0.9653366804122925,2022-12-28 11:39:33.180469,2022-12-28 11:40:34.775434,0 days 00:01:01.594965,tanh,0.05,7,0.6,0.9653366804122925,,,PRUNED
117,117,0.9867353439331055,2022-12-28 11:39:53.943330,2022-12-28 11:43:52.089699,0 days 00:03:58.146369,relu,0.45,3,0.6,0.9863163828849792,,,COMPLETE
118,118,0.9642724990844727,2022-12-28 11:39:57.540597,2022-12-28 11:41:01.923100,0 days 00:01:04.382503,tanh,0.05,7,0.6,0.9642724990844727,,,PRUNED
119,119,0.9634563326835632,2022-12-28 11:40:01.351058,2022-12-28 11:41:04.934838,0 days 00:01:03.583780,tanh,0.05,5,0.6,0.9634563326835632,,,PRUNED
120,120,0.9831146001815796,2022-12-28 11:40:01.965617,2022-12-28 11:43:41.330927,0 days 00:03:39.365310,relu,0.45,3,0.6,0.9876164793968201,,,COMPLETE
121,121,0.9819404482841492,2022-12-28 11:40:03.243777,2022-12-28 11:43:47.661676,0 days 00:03:44.417899,sigmoid,0.45,8,0.6,0.9861658811569214,,,COMPLETE
122,122,0.9686996936798096,2022-12-28 11:40:35.185806,2022-12-28 11:41:35.627722,0 days 00:01:00.441916,tanh,0.25,5,0.6,0.9686996936798096,,,PRUNED
123,123,0.9695267677307129,2022-12-28 11:40:44.668426,2022-12-28 11:41:43.528901,0 days 00:00:58.860475,tanh,0.25,5,0.6,0.9695267677307129,,,PRUNED
124,124,0.9856647253036499,2022-12-28 11:40:51.688803,2022-12-28 11:42:51.439603,0 days 00:01:59.750800,sigmoid,0.45,8,0.6,0.9856647253036499,,,PRUNED
125,125,0.9831781983375549,2022-12-28 11:40:54.361230,2022-12-28 11:42:53.707664,0 days 00:01:59.346434,sigmoid,0.45,8,0.75,0.9831781983375549,,,PRUNED
126,126,0.9845238327980042,2022-12-28 11:41:02.340480,2022-12-28 11:42:59.074538,0 days 00:01:56.734058,tanh,0.1,5,0.7,0.973237931728363,0.9845238327980042,,PRUNED
127,127,0.9843759536743164,2022-12-28 11:41:05.392254,2022-12-28 11:44:40.407595,0 days 00:03:35.015341,tanh,0.1,5,0.7,0.9734020829200745,0.9883282780647278,,COMPLETE
128,128,0.9861208200454712,2022-12-28 11:41:13.018182,2022-12-28 11:43:06.973715,0 days 00:01:53.955533,tanh,0.1,5,0.7,0.9715368151664734,0.9861208200454712,,PRUNED
129,129,0.9858097434043884,2022-12-28 11:41:36.270305,2022-12-28 11:43:34.128381,0 days 00:01:57.858076,sigmoid,0.45,8,0.75,0.9858097434043884,,,PRUNED
130,130,0.9674354791641235,2022-12-28 11:41:44.077400,2022-12-28 11:42:46.957532,0 days 00:01:02.880132,relu,0.1,6,0.7,0.9674354791641235,,,PRUNED
131,131,0.9659459590911865,2022-12-28 11:41:59.455371,2022-12-28 11:43:00.890188,0 days 00:01:01.434817,relu,0.1,6,0.7,0.9659459590911865,,,PRUNED
132,132,0.9851140975952148,2022-12-28 11:42:47.420953,2022-12-28 11:44:38.577934,0 days 00:01:51.156981,sigmoid,0.45,8,0.75,0.9851140975952148,,,PRUNED
133,133,0.970566987991333,2022-12-28 11:42:51.970085,2022-12-28 11:43:49.194069,0 days 00:00:57.223984,relu,0.1,2,0.7,0.970566987991333,,,PRUNED
134,134,0.9696744084358215,2022-12-28 11:42:54.147063,2022-12-28 11:43:51.110809,0 days 00:00:56.963746,relu,0.45,2,0.7,0.9696744084358215,,,PRUNED
135,135,0.9696014523506165,2022-12-28 11:42:59.513938,2022-12-28 11:44:01.685416,0 days 00:01:02.171478,relu,0.45,6,0.7,0.9696014523506165,,,PRUNED
136,136,0.9689015746116638,2022-12-28 11:42:59.753155,2022-12-28 11:44:03.235824,0 days 00:01:03.482669,relu,0.45,6,0.7,0.9689015746116638,,,PRUNED
137,137,0.985431969165802,2022-12-28 11:43:01.323582,2022-12-28 11:44:52.880926,0 days 00:01:51.557344,relu,0.35000000000000003,3,1.0,0.9732310771942139,0.985431969165802,,PRUNED
