,number,value,datetime_start,datetime_complete,duration,params_activation,params_dropout,params_layers,params_shrink,system_attrs_completed_rung_0,system_attrs_completed_rung_1,system_attrs_completed_rung_2,state
1235,1235,0.9808329939842224,2022-12-28 14:38:50.091012,2022-12-28 14:40:38.439450,0 days 00:01:48.348438,relu,0.2,4,0.6,0.9808329939842224,,,PRUNED
1236,1236,0.9713638424873352,2022-12-28 14:39:12.674529,2022-12-28 14:40:05.151206,0 days 00:00:52.476677,sigmoid,0.25,3,0.85,0.9713638424873352,,,PRUNED
1237,1237,0.9669885635375977,2022-12-28 14:39:23.551412,2022-12-28 14:40:24.516804,0 days 00:01:00.965392,sigmoid,0.25,8,0.85,0.9669885635375977,,,PRUNED
1238,1238,0.9678946733474731,2022-12-28 14:39:46.830562,2022-12-28 14:40:50.480389,0 days 00:01:03.649827,sigmoid,0.25,8,0.85,0.9678946733474731,,,PRUNED
1239,1239,0.9673113822937012,2022-12-28 14:39:49.036566,2022-12-28 14:40:54.483026,0 days 00:01:05.446460,sigmoid,0.25,8,0.85,0.9673113822937012,,,PRUNED
1240,1240,0.9821268916130066,2022-12-28 14:39:51.533834,2022-12-28 14:41:42.852977,0 days 00:01:51.319143,relu,0.30000000000000004,4,0.6,0.9821268916130066,,,PRUNED
1241,1241,0.9675965309143066,2022-12-28 14:39:52.506718,2022-12-28 14:40:58.140350,0 days 00:01:05.633632,sigmoid,0.25,8,0.85,0.9675965309143066,,,PRUNED
1242,1242,0.9820707440376282,2022-12-28 14:39:54.783787,2022-12-28 14:41:46.892647,0 days 00:01:52.108860,sigmoid,0.45,3,0.85,0.9733176231384277,0.9820707440376282,,PRUNED
1243,1243,0.9706113338470459,2022-12-28 14:39:58.190881,2022-12-28 14:41:00.604589,0 days 00:01:02.413708,sigmoid,0.30000000000000004,3,0.9,0.9706113338470459,,,PRUNED
1244,1244,0.9677656888961792,2022-12-28 14:40:05.622634,2022-12-28 14:41:02.912689,0 days 00:00:57.290055,relu,0.2,3,0.9,0.9677656888961792,,,PRUNED
1245,1245,0.9690274000167847,2022-12-28 14:40:10.683233,2022-12-28 14:41:08.262549,0 days 00:00:57.579316,relu,0.2,3,0.9,0.9690274000167847,,,PRUNED
1246,1246,0.9872509837150574,2022-12-28 14:40:24.990233,2022-12-28 14:44:30.023881,0 days 00:04:05.033648,relu,0.2,3,0.9,0.9728126525878906,0.9873573184013367,,COMPLETE
1247,1247,0.979075014591217,2022-12-28 14:40:38.914881,2022-12-28 14:42:28.606549,0 days 00:01:49.691668,relu,0.2,3,0.9,0.972259521484375,0.979075014591217,,PRUNED
1248,1248,0.9862144589424133,2022-12-28 14:40:50.929799,2022-12-28 14:44:55.030005,0 days 00:04:04.100206,relu,0.45,6,0.6,0.9861077666282654,,,COMPLETE
1249,1249,0.9816344380378723,2022-12-28 14:40:54.974473,2022-12-28 14:42:46.933198,0 days 00:01:51.958725,relu,0.35000000000000003,4,0.6,0.9816344380378723,,,PRUNED
1250,1250,0.9833831191062927,2022-12-28 14:40:58.956092,2022-12-28 14:42:54.154758,0 days 00:01:55.198666,relu,0.35000000000000003,6,0.6,0.9833831191062927,,,PRUNED
1251,1251,0.9701632261276245,2022-12-28 14:41:01.018964,2022-12-28 14:42:04.208382,0 days 00:01:03.189418,relu,0.2,3,0.9,0.9701632261276245,,,PRUNED
1252,1252,0.9841899275779724,2022-12-28 14:41:03.347084,2022-12-28 14:43:01.395339,0 days 00:01:58.048255,relu,0.35000000000000003,6,0.6,0.9841899275779724,,,PRUNED
1253,1253,0.9818628430366516,2022-12-28 14:41:09.060273,2022-12-28 14:43:06.617084,0 days 00:01:57.556811,relu,0.35000000000000003,6,0.6,0.9818628430366516,,,PRUNED
1254,1254,0.9706181883811951,2022-12-28 14:41:43.415489,2022-12-28 14:42:43.087705,0 days 00:00:59.672216,tanh,0.45,3,0.9,0.9706181883811951,,,PRUNED
1255,1255,0.9861798286437988,2022-12-28 14:41:47.355068,2022-12-28 14:45:52.358091,0 days 00:04:05.003023,tanh,0.5,3,0.9,0.9749287366867065,0.9864072203636169,,COMPLETE
1256,1256,0.9833307266235352,2022-12-28 14:42:04.658790,2022-12-28 14:44:02.159560,0 days 00:01:57.500770,relu,0.35000000000000003,6,0.6,0.9833307266235352,,,PRUNED
1257,1257,0.9857804775238037,2022-12-28 14:42:09.814474,2022-12-28 14:46:12.126051,0 days 00:04:02.311577,sigmoid,0.45,2,0.6,0.9863584637641907,,,COMPLETE
1258,1258,0.9694305062294006,2022-12-28 14:42:19.024843,2022-12-28 14:43:18.783143,0 days 00:00:59.758300,tanh,0.5,3,0.9,0.9694305062294006,,,PRUNED
1259,1259,0.984538733959198,2022-12-28 14:42:29.064964,2022-12-28 14:44:24.881206,0 days 00:01:55.816242,sigmoid,0.45,6,0.6,0.984538733959198,,,PRUNED
1260,1260,0.98601895570755,2022-12-28 14:42:43.602172,2022-12-28 14:44:35.759090,0 days 00:01:52.156918,tanh,0.30000000000000004,3,0.9,0.9732238054275513,0.98601895570755,,PRUNED
1261,1261,0.9713879823684692,2022-12-28 14:42:47.429649,2022-12-28 14:43:48.092771,0 days 00:01:00.663122,tanh,0.30000000000000004,3,0.9,0.9713879823684692,,,PRUNED
1262,1262,0.9681675434112549,2022-12-28 14:42:54.633192,2022-12-28 14:43:55.150188,0 days 00:01:00.516996,tanh,0.30000000000000004,3,0.9,0.9681675434112549,,,PRUNED
1263,1263,0.9708126187324524,2022-12-28 14:43:01.926822,2022-12-28 14:44:03.591860,0 days 00:01:01.665038,tanh,0.30000000000000004,3,0.9,0.9708126187324524,,,PRUNED
1264,1264,0.9699792861938477,2022-12-28 14:43:07.063487,2022-12-28 14:44:07.257190,0 days 00:01:00.193703,tanh,0.30000000000000004,3,0.9,0.9699792861938477,,,PRUNED
1265,1265,0.9813715219497681,2022-12-28 14:43:19.216536,2022-12-28 14:46:56.731585,0 days 00:03:37.515049,sigmoid,0.45,2,0.7,0.9880110025405884,,,COMPLETE
1266,1266,0.9698386192321777,2022-12-28 14:43:48.563198,2022-12-28 14:44:47.395661,0 days 00:00:58.832463,sigmoid,0.4,3,0.9,0.9698386192321777,,,PRUNED
1267,1267,0.9795083403587341,2022-12-28 14:43:55.631626,2022-12-28 14:45:47.757913,0 days 00:01:52.126287,sigmoid,0.45,2,0.7,0.9795083403587341,,,PRUNED
1268,1268,0.9692028164863586,2022-12-28 14:44:02.612971,2022-12-28 14:45:02.512807,0 days 00:00:59.899836,sigmoid,0.4,3,0.9,0.9692028164863586,,,PRUNED
1269,1269,0.9853190779685974,2022-12-28 14:44:04.034262,2022-12-28 14:45:56.624966,0 days 00:01:52.590704,sigmoid,0.45,2,0.7,0.9853190779685974,,,PRUNED
1270,1270,0.9861825704574585,2022-12-28 14:44:07.730620,2022-12-28 14:47:43.448026,0 days 00:03:35.717406,relu,0.45,2,0.7,0.9862818121910095,,,COMPLETE
1271,1271,0.9822140336036682,2022-12-28 14:44:25.351634,2022-12-28 14:46:14.822500,0 days 00:01:49.470866,sigmoid,0.4,3,0.85,0.9724757075309753,0.9822140336036682,,PRUNED
1272,1272,0.9831165671348572,2022-12-28 14:44:30.590396,2022-12-28 14:46:22.885830,0 days 00:01:52.295434,relu,0.2,2,0.85,0.9831165671348572,,,PRUNED
1273,1273,0.9703825116157532,2022-12-28 14:44:36.414686,2022-12-28 14:45:37.131259,0 days 00:01:00.716573,relu,0.15000000000000002,3,0.9,0.9703825116157532,,,PRUNED
1274,1274,0.9858097434043884,2022-12-28 14:44:47.841065,2022-12-28 14:46:41.722954,0 days 00:01:53.881889,relu,0.15000000000000002,3,0.9,0.9724046587944031,0.9858097434043884,,PRUNED
1275,1275,0.980980634689331,2022-12-28 14:44:55.454390,2022-12-28 14:46:46.088918,0 days 00:01:50.634528,relu,0.4,2,0.7,0.980980634689331,,,PRUNED
1276,1276,0.9688447117805481,2022-12-28 14:45:02.995246,2022-12-28 14:46:03.465180,0 days 00:01:00.469934,relu,0.2,2,0.9,0.9688447117805481,,,PRUNED
1277,1277,0.9691224694252014,2022-12-28 14:45:37.572660,2022-12-28 14:46:35.205025,0 days 00:00:57.632365,relu,0.2,2,0.9,0.9691224694252014,,,PRUNED
1278,1278,0.9844991564750671,2022-12-28 14:45:48.191306,2022-12-28 14:47:36.908085,0 days 00:01:48.716779,relu,0.2,2,0.7,0.9844991564750671,,,PRUNED
1279,1279,0.9658101797103882,2022-12-28 14:45:52.866552,2022-12-28 14:46:50.867260,0 days 00:00:58.000708,relu,0.15000000000000002,2,0.9,0.9658101797103882,,,PRUNED
1280,1280,0.9647749066352844,2022-12-28 14:45:57.048351,2022-12-28 14:46:53.962071,0 days 00:00:56.913720,relu,0.15000000000000002,3,0.9,0.9647749066352844,,,PRUNED
1281,1281,0.9706225395202637,2022-12-28 14:46:03.916590,2022-12-28 14:47:01.566978,0 days 00:00:57.650388,tanh,0.15000000000000002,3,0.9,0.9706225395202637,,,PRUNED
1282,1282,0.9783342480659485,2022-12-28 14:46:12.593476,2022-12-28 14:48:04.507166,0 days 00:01:51.913690,relu,0.15000000000000002,3,0.9,0.9728521108627319,0.9783342480659485,,PRUNED
1283,1283,0.9874610304832458,2022-12-28 14:46:15.305940,2022-12-28 14:50:22.143992,0 days 00:04:06.838052,relu,0.15000000000000002,3,0.9,0.9756664037704468,0.9878325462341309,,COMPLETE
1284,1284,0.9835517406463623,2022-12-28 14:46:23.343245,2022-12-28 14:48:13.305157,0 days 00:01:49.961912,relu,0.4,3,0.7,0.9835517406463623,,,PRUNED
1285,1285,0.9857739806175232,2022-12-28 14:46:35.662448,2022-12-28 14:50:40.794160,0 days 00:04:05.131712,relu,0.4,3,0.7,0.9861955046653748,,,COMPLETE
1286,1286,0.9831312894821167,2022-12-28 14:46:42.227410,2022-12-28 14:48:35.069935,0 days 00:01:52.842525,relu,0.4,3,0.7,0.9831312894821167,,,PRUNED
1287,1287,0.9707088470458984,2022-12-28 14:46:46.526315,2022-12-28 14:47:45.724097,0 days 00:00:59.197782,relu,0.15000000000000002,3,0.9,0.9707088470458984,,,PRUNED
1288,1288,0.9712485074996948,2022-12-28 14:46:51.323674,2022-12-28 14:47:50.910811,0 days 00:00:59.587137,relu,0.2,3,0.8,0.9712485074996948,,,PRUNED
1289,1289,0.9711090326309204,2022-12-28 14:46:54.385454,2022-12-28 14:47:54.807350,0 days 00:01:00.421896,relu,0.45,3,0.8,0.9711090326309204,,,PRUNED
1290,1290,0.9850245714187622,2022-12-28 14:46:57.293096,2022-12-28 14:48:50.879303,0 days 00:01:53.586207,relu,0.2,3,0.7,0.9850245714187622,,,PRUNED
1291,1291,0.9879699945449829,2022-12-28 14:47:02.019390,2022-12-28 14:51:04.087322,0 days 00:04:02.067932,relu,0.2,3,0.85,0.9724984169006348,0.9882991313934326,,COMPLETE
1292,1292,0.96860271692276,2022-12-28 14:47:37.358493,2022-12-28 14:48:35.789589,0 days 00:00:58.431096,relu,0.2,3,0.85,0.96860271692276,,,PRUNED
1293,1293,0.9871334433555603,2022-12-28 14:47:43.907443,2022-12-28 14:51:44.827330,0 days 00:04:00.919887,relu,0.5,3,0.8,0.9866572618484497,,,COMPLETE
1294,1294,0.9861018061637878,2022-12-28 14:47:46.167499,2022-12-28 14:49:40.032432,0 days 00:01:53.864933,relu,0.2,4,0.85,0.9722923040390015,0.9861018061637878,,PRUNED
1295,1295,0.9676342010498047,2022-12-28 14:47:51.351211,2022-12-28 14:48:52.169475,0 days 00:01:00.818264,relu,0.45,3,0.85,0.9676342010498047,,,PRUNED
1296,1296,0.9768053293228149,2022-12-28 14:47:55.227732,2022-12-28 14:49:51.322983,0 days 00:01:56.095251,relu,0.5,3,0.7,0.9768053293228149,,,PRUNED
1297,1297,0.979892909526825,2022-12-28 14:48:04.980595,2022-12-28 14:49:57.289404,0 days 00:01:52.308809,relu,0.5,3,0.8,0.979892909526825,,,PRUNED
1298,1298,0.9673354625701904,2022-12-28 14:48:13.753565,2022-12-28 14:49:14.200499,0 days 00:01:00.446934,relu,0.5,3,0.85,0.9673354625701904,,,PRUNED
1299,1299,0.9829115271568298,2022-12-28 14:48:35.584403,2022-12-28 14:50:31.079109,0 days 00:01:55.494706,relu,0.5,3,0.85,0.9730645418167114,0.9829115271568298,,PRUNED
1300,1300,0.981810986995697,2022-12-28 14:48:36.268024,2022-12-28 14:50:31.813776,0 days 00:01:55.545752,relu,0.30000000000000004,4,0.8,0.981810986995697,,,PRUNED
1301,1301,0.9829455018043518,2022-12-28 14:48:51.342724,2022-12-28 14:50:45.814724,0 days 00:01:54.472000,relu,0.30000000000000004,4,0.8,0.9829455018043518,,,PRUNED
1302,1302,0.9856956005096436,2022-12-28 14:48:52.616882,2022-12-28 14:50:45.080055,0 days 00:01:52.463173,relu,0.5,4,0.85,0.9729287624359131,0.9856956005096436,,PRUNED
1303,1303,0.9817368388175964,2022-12-28 14:49:14.670926,2022-12-28 14:51:03.242555,0 days 00:01:48.571629,relu,0.30000000000000004,4,0.7,0.9817368388175964,,,PRUNED
1304,1304,0.9703324437141418,2022-12-28 14:49:40.484842,2022-12-28 14:50:39.825281,0 days 00:00:59.340439,tanh,0.5,3,0.85,0.9703324437141418,,,PRUNED
1305,1305,0.9713799953460693,2022-12-28 14:49:51.794410,2022-12-28 14:50:50.660125,0 days 00:00:58.865715,tanh,0.5,3,0.85,0.9713799953460693,,,PRUNED
1306,1306,0.9701910018920898,2022-12-28 14:49:57.826892,2022-12-28 14:50:54.535646,0 days 00:00:56.708754,tanh,0.5,3,0.85,0.9701910018920898,,,PRUNED
1307,1307,0.9847986102104187,2022-12-28 14:50:22.602408,2022-12-28 14:52:09.403662,0 days 00:01:46.801254,relu,0.05,4,0.75,0.9847986102104187,,,PRUNED
1308,1308,0.9869564771652222,2022-12-28 14:50:31.567553,2022-12-28 14:54:37.336074,0 days 00:04:05.768521,relu,0.05,4,0.75,0.9867566823959351,,,COMPLETE
1309,1309,0.9705163240432739,2022-12-28 14:50:32.251173,2022-12-28 14:51:30.649451,0 days 00:00:58.398278,relu,0.15000000000000002,3,0.9,0.9705163240432739,,,PRUNED
1310,1310,0.9700478315353394,2022-12-28 14:50:40.577965,2022-12-28 14:51:39.123148,0 days 00:00:58.545183,relu,0.15000000000000002,3,0.9,0.9700478315353394,,,PRUNED
1311,1311,0.9842869639396667,2022-12-28 14:50:41.593888,2022-12-28 14:54:24.292226,0 days 00:03:42.698338,relu,0.05,4,0.75,0.9866529703140259,,,COMPLETE
1312,1312,0.9665409922599792,2022-12-28 14:50:45.605534,2022-12-28 14:51:44.930424,0 days 00:00:59.324890,relu,0.15000000000000002,3,0.9,0.9665409922599792,,,PRUNED
1313,1313,0.9688379168510437,2022-12-28 14:50:46.284151,2022-12-28 14:51:45.023508,0 days 00:00:58.739357,relu,0.15000000000000002,3,0.9,0.9688379168510437,,,PRUNED
1314,1314,0.9813898801803589,2022-12-28 14:50:51.082510,2022-12-28 14:52:43.617751,0 days 00:01:52.535241,relu,0.05,4,0.75,0.9813898801803589,,,PRUNED
1315,1315,0.9683281779289246,2022-12-28 14:50:55.045110,2022-12-28 14:51:53.578278,0 days 00:00:58.533168,relu,0.15000000000000002,3,0.9,0.9683281779289246,,,PRUNED
1316,1316,0.9656835198402405,2022-12-28 14:51:03.706976,2022-12-28 14:52:02.313213,0 days 00:00:58.606237,relu,0.1,3,0.9,0.9656835198402405,,,PRUNED
1317,1317,0.9668108224868774,2022-12-28 14:51:04.775948,2022-12-28 14:52:05.805389,0 days 00:01:01.029441,relu,0.2,3,0.9,0.9668108224868774,,,PRUNED
1318,1318,0.9855244159698486,2022-12-28 14:51:31.093855,2022-12-28 14:55:30.531405,0 days 00:03:59.437550,relu,0.5,3,0.65,0.9860560297966003,,,COMPLETE
1319,1319,0.984830379486084,2022-12-28 14:51:39.579563,2022-12-28 14:55:15.004301,0 days 00:03:35.424738,relu,0.5,3,0.65,0.9859350919723511,,,COMPLETE
1320,1320,0.9827820062637329,2022-12-28 14:51:45.470916,2022-12-28 14:53:43.804438,0 days 00:01:58.333522,relu,0.15000000000000002,3,0.9,0.9725522398948669,0.9827820062637329,,PRUNED
1321,1321,0.9794250726699829,2022-12-28 14:51:45.868275,2022-12-28 14:55:24.394832,0 days 00:03:38.526557,relu,0.5,3,0.8,0.9860227108001709,,,COMPLETE
1322,1322,0.9856641292572021,2022-12-28 14:51:45.961360,2022-12-28 14:53:42.755481,0 days 00:01:56.794121,relu,0.15000000000000002,3,0.9,0.9720391035079956,0.9856641292572021,,PRUNED
1323,1323,0.9853948950767517,2022-12-28 14:51:54.469089,2022-12-28 14:53:46.521905,0 days 00:01:52.052816,relu,0.2,3,0.9,0.9719484448432922,0.9853948950767517,,PRUNED
1324,1324,0.9711286425590515,2022-12-28 14:52:02.765624,2022-12-28 14:53:05.500635,0 days 00:01:02.735011,relu,0.2,3,0.9,0.9711286425590515,,,PRUNED
1325,1325,0.9853992462158203,2022-12-28 14:52:06.322859,2022-12-28 14:54:01.904882,0 days 00:01:55.582023,relu,0.5,3,0.8,0.9853992462158203,,,PRUNED
1326,1326,0.9698798656463623,2022-12-28 14:52:09.847064,2022-12-28 14:53:10.725380,0 days 00:01:00.878316,relu,0.2,3,0.9,0.9698798656463623,,,PRUNED
1327,1327,0.983549177646637,2022-12-28 14:52:44.104195,2022-12-28 14:54:40.559002,0 days 00:01:56.454807,relu,0.5,3,0.8,0.983549177646637,,,PRUNED
1328,1328,0.9826683402061462,2022-12-28 14:53:05.933027,2022-12-28 14:54:58.057903,0 days 00:01:52.124876,relu,0.5,3,0.8,0.9826683402061462,,,PRUNED
1329,1329,0.9809133410453796,2022-12-28 14:53:11.173788,2022-12-28 14:55:02.821234,0 days 00:01:51.647446,relu,0.2,3,0.9,0.9743287563323975,0.9809133410453796,,PRUNED
1330,1330,0.968814492225647,2022-12-28 14:53:43.273952,2022-12-28 14:54:44.094213,0 days 00:01:00.820261,relu,0.2,3,0.65,0.968814492225647,,,PRUNED
1331,1331,0.9673582315444946,2022-12-28 14:53:44.447020,2022-12-28 14:54:45.639618,0 days 00:01:01.192598,relu,0.2,3,1.0,0.9673582315444946,,,PRUNED
1332,1332,0.984216570854187,2022-12-28 14:53:46.982324,2022-12-28 14:57:27.392088,0 days 00:03:40.409764,relu,0.2,3,0.65,0.9726811051368713,0.98822021484375,,COMPLETE
1333,1333,0.9702762365341187,2022-12-28 14:54:02.315253,2022-12-28 14:55:01.991481,0 days 00:00:59.676228,relu,0.2,3,1.0,0.9702762365341187,,,PRUNED
1334,1334,0.9863709211349487,2022-12-28 14:54:24.744637,2022-12-28 14:58:30.669819,0 days 00:04:05.925182,relu,0.5,3,0.8,0.9866034984588623,,,COMPLETE
1335,1335,0.986675500869751,2022-12-28 14:54:37.958641,2022-12-28 14:58:47.040696,0 days 00:04:09.082055,relu,0.2,3,1.0,0.972486138343811,0.9870250821113586,,COMPLETE
1336,1336,0.9835979342460632,2022-12-28 14:54:41.005408,2022-12-28 14:56:36.160546,0 days 00:01:55.155138,relu,0.5,3,0.8,0.9835979342460632,,,PRUNED
1337,1337,0.9840739369392395,2022-12-28 14:54:44.872921,2022-12-28 14:56:36.877196,0 days 00:01:52.004275,relu,0.5,3,0.8,0.9840739369392395,,,PRUNED
1338,1338,0.9827949404716492,2022-12-28 14:54:46.208134,2022-12-28 14:56:40.319323,0 days 00:01:54.111189,relu,0.5,3,0.8,0.9827949404716492,,,PRUNED
1339,1339,0.9851980805397034,2022-12-28 14:54:58.487297,2022-12-28 14:59:08.258974,0 days 00:04:09.771677,relu,0.5,3,0.65,0.9854893684387207,,,COMPLETE
1340,1340,0.9863075017929077,2022-12-28 14:55:02.417867,2022-12-28 14:59:16.462430,0 days 00:04:14.044563,relu,0.5,3,0.8,0.9865065217018127,,,COMPLETE
1341,1341,0.9871869683265686,2022-12-28 14:55:03.396757,2022-12-28 14:59:14.662795,0 days 00:04:11.266038,relu,0.5,3,0.8,0.9876782894134521,,,COMPLETE
1342,1342,0.9857330322265625,2022-12-28 14:55:15.476730,2022-12-28 14:59:25.438584,0 days 00:04:09.961854,relu,0.15000000000000002,4,0.85,0.9733028411865234,0.9864411354064941,,COMPLETE
1343,1343,0.9797368049621582,2022-12-28 14:55:24.859253,2022-12-28 14:57:21.582810,0 days 00:01:56.723557,relu,0.15000000000000002,4,0.7,0.9725589752197266,0.9797368049621582,,PRUNED
1344,1344,0.9846732020378113,2022-12-28 14:55:30.999831,2022-12-28 14:57:26.976710,0 days 00:01:55.976879,relu,0.15000000000000002,4,0.85,0.972353994846344,0.9846732020378113,,PRUNED
1345,1345,0.9818089604377747,2022-12-28 14:56:36.636978,2022-12-28 15:00:17.899255,0 days 00:03:41.262277,relu,0.2,2,0.8,0.9857183694839478,,,COMPLETE
1346,1346,0.9696540832519531,2022-12-28 14:56:37.341619,2022-12-28 14:57:38.364054,0 days 00:01:01.022435,relu,0.15000000000000002,4,0.85,0.9696540832519531,,,PRUNED
1347,1347,0.9873830080032349,2022-12-28 14:56:40.830788,2022-12-28 15:00:40.402702,0 days 00:03:59.571914,relu,0.1,2,0.8,0.9876585006713867,,,COMPLETE
1348,1348,0.9837270975112915,2022-12-28 14:57:22.058242,2022-12-28 14:59:18.257060,0 days 00:01:56.198818,relu,0.1,2,0.85,0.9837270975112915,,,PRUNED
1349,1349,0.9851622581481934,2022-12-28 14:57:27.545226,2022-12-28 14:59:20.882452,0 days 00:01:53.337226,relu,0.2,2,0.8,0.9851622581481934,,,PRUNED
1350,1350,0.9693965315818787,2022-12-28 14:57:28.143770,2022-12-28 14:58:30.902030,0 days 00:01:02.758260,relu,0.15000000000000002,3,0.75,0.9693965315818787,,,PRUNED
1351,1351,0.9810107946395874,2022-12-28 14:57:38.828476,2022-12-28 14:59:28.757603,0 days 00:01:49.929127,relu,0.2,3,0.75,0.9722151160240173,0.9810107946395874,,PRUNED
1352,1352,0.9805595278739929,2022-12-28 14:58:31.335424,2022-12-28 15:00:21.224276,0 days 00:01:49.888852,relu,0.2,2,0.8,0.9805595278739929,,,PRUNED
1353,1353,0.9693205952644348,2022-12-28 14:58:31.454533,2022-12-28 14:59:29.452234,0 days 00:00:57.997701,relu,0.2,3,0.8,0.9693205952644348,,,PRUNED
1354,1354,0.9845597147941589,2022-12-28 14:58:47.579183,2022-12-28 15:00:31.943016,0 days 00:01:44.363833,relu,0.1,2,0.75,0.9845597147941589,,,PRUNED
1355,1355,0.9874204993247986,2022-12-28 14:59:08.706381,2022-12-28 15:03:01.708091,0 days 00:03:53.001710,relu,0.2,3,0.9,0.9752170443534851,0.987729549407959,,COMPLETE
1356,1356,0.9838671088218689,2022-12-28 14:59:15.227308,2022-12-28 15:01:05.365383,0 days 00:01:50.138075,relu,0.30000000000000004,3,0.8,0.9738249778747559,0.9838671088218689,,PRUNED
1357,1357,0.9853429794311523,2022-12-28 14:59:17.112020,2022-12-28 15:01:06.464381,0 days 00:01:49.352361,relu,0.5,3,0.8,0.9853429794311523,,,PRUNED
1358,1358,0.966842770576477,2022-12-28 14:59:18.676441,2022-12-28 15:00:18.254579,0 days 00:00:59.578138,relu,0.2,3,0.8,0.966842770576477,,,PRUNED
1359,1359,0.9711261987686157,2022-12-28 14:59:21.333856,2022-12-28 15:00:22.999889,0 days 00:01:01.666033,relu,0.30000000000000004,3,0.8,0.9711261987686157,,,PRUNED
1360,1360,0.9712706208229065,2022-12-28 14:59:25.972069,2022-12-28 15:00:26.734280,0 days 00:01:00.762211,relu,0.2,3,0.9,0.9712706208229065,,,PRUNED
1361,1361,0.985791027545929,2022-12-28 14:59:29.236037,2022-12-28 15:03:30.254030,0 days 00:04:01.017993,relu,0.5,3,0.8,0.985766589641571,,,COMPLETE
1362,1362,0.9711577296257019,2022-12-28 14:59:30.013744,2022-12-28 15:00:29.595883,0 days 00:00:59.582139,relu,0.2,3,0.9,0.9711577296257019,,,PRUNED
1363,1363,0.9835682511329651,2022-12-28 15:00:18.655942,2022-12-28 15:02:10.821848,0 days 00:01:52.165906,relu,0.5,3,0.8,0.9835682511329651,,,PRUNED
1364,1364,0.969673752784729,2022-12-28 15:00:18.746024,2022-12-28 15:01:19.897587,0 days 00:01:01.151563,relu,0.2,3,0.9,0.969673752784729,,,PRUNED
1365,1365,0.9823103547096252,2022-12-28 15:00:21.649661,2022-12-28 15:02:11.910836,0 days 00:01:50.261175,tanh,0.5,3,0.65,0.9823103547096252,,,PRUNED
1366,1366,0.9712293148040771,2022-12-28 15:00:23.455302,2022-12-28 15:01:23.640987,0 days 00:01:00.185685,relu,0.2,3,0.9,0.9712293148040771,,,PRUNED
1367,1367,0.9687268137931824,2022-12-28 15:00:27.672133,2022-12-28 15:01:27.597582,0 days 00:00:59.925449,relu,0.30000000000000004,3,0.9,0.9687268137931824,,,PRUNED
1368,1368,0.98237144947052,2022-12-28 15:00:30.149385,2022-12-28 15:02:19.534766,0 days 00:01:49.385381,tanh,0.5,3,0.8,0.98237144947052,,,PRUNED
1369,1369,0.9713941812515259,2022-12-28 15:00:32.353388,2022-12-28 15:01:32.645167,0 days 00:01:00.291779,relu,0.25,3,0.85,0.9713941812515259,,,PRUNED
1370,1370,0.9702386260032654,2022-12-28 15:00:40.888142,2022-12-28 15:01:40.012858,0 days 00:00:59.124716,relu,0.25,3,0.85,0.9702386260032654,,,PRUNED
1371,1371,0.9698595404624939,2022-12-28 15:01:05.840815,2022-12-28 15:02:07.931222,0 days 00:01:02.090407,relu,0.25,3,0.9,0.9698595404624939,,,PRUNED
