,number,value,datetime_start,datetime_complete,duration,params_activation,params_dropout,params_layers,params_shrink,system_attrs_completed_rung_0,system_attrs_completed_rung_1,system_attrs_completed_rung_2,state
2058,2058,0.06285908818244934,2023-01-05 02:34:19.917727,2023-01-05 02:34:35.523279,0 days 00:00:15.605552,relu,0.30000000000000004,2,0.8,0.09980295598506927,0.06285908818244934,,PRUNED
2059,2059,0.10746727138757706,2023-01-05 02:34:35.616518,2023-01-05 02:34:51.196981,0 days 00:00:15.580463,tanh,0.25,2,0.65,0.10746727138757706,,,PRUNED
2060,2060,0.2223501205444336,2023-01-05 02:34:51.288428,2023-01-05 02:34:59.996128,0 days 00:00:08.707700,tanh,0.0,2,0.5,0.2223501205444336,,,PRUNED
2061,2061,0.11209899187088013,2023-01-05 02:35:00.104001,2023-01-05 02:35:08.687292,0 days 00:00:08.583291,tanh,0.35000000000000003,2,0.8500000000000001,0.11209899187088013,,,PRUNED
2062,2062,0.5200377106666565,2023-01-05 02:35:08.798607,2023-01-05 02:35:18.036624,0 days 00:00:09.238017,relu,0.5,8,0.7,0.5200377106666565,,,PRUNED
2063,2063,0.15452469885349274,2023-01-05 02:35:18.129740,2023-01-05 02:35:57.562055,0 days 00:00:39.432315,sigmoid,0.30000000000000004,2,0.7,0.06388713419437408,0.04482410475611687,,COMPLETE
2064,2064,0.06882169842720032,2023-01-05 02:35:57.671200,2023-01-05 02:36:13.190657,0 days 00:00:15.519457,tanh,0.4,2,0.6,0.09655875712633133,0.06882169842720032,,PRUNED
2065,2065,0.16507850587368011,2023-01-05 02:36:13.291541,2023-01-05 02:36:21.864992,0 days 00:00:08.573451,relu,0.1,2,0.65,0.16507850587368011,,,PRUNED
2066,2066,0.08279502391815186,2023-01-05 02:36:22.171167,2023-01-05 02:36:37.613137,0 days 00:00:15.441970,tanh,0.5,2,0.7,0.08279502391815186,,,PRUNED
2067,2067,0.1473865509033203,2023-01-05 02:36:37.722222,2023-01-05 02:37:23.865718,0 days 00:00:46.143496,sigmoid,0.30000000000000004,2,0.7,0.07441627234220505,0.04277573525905609,,COMPLETE
2068,2068,0.06239936500787735,2023-01-05 02:37:23.981580,2023-01-05 02:37:39.683998,0 days 00:00:15.702418,tanh,0.30000000000000004,3,0.8500000000000001,0.09619306772947311,0.06239936500787735,,PRUNED
2069,2069,0.130038321018219,2023-01-05 02:37:39.795094,2023-01-05 02:37:48.374999,0 days 00:00:08.579905,relu,0.35000000000000003,2,0.55,0.130038321018219,,,PRUNED
2070,2070,0.08854424208402634,2023-01-05 02:37:48.476663,2023-01-05 02:38:04.190276,0 days 00:00:15.713613,sigmoid,0.35000000000000003,4,0.65,0.08854424208402634,,,PRUNED
2071,2071,0.1654030978679657,2023-01-05 02:38:04.284780,2023-01-05 02:38:50.566974,0 days 00:00:46.282194,tanh,0.2,2,0.5,0.05351435765624046,,,COMPLETE
2072,2072,0.17793849110603333,2023-01-05 02:38:50.693213,2023-01-05 02:38:59.236191,0 days 00:00:08.542978,tanh,0.45,2,0.6,0.17793849110603333,,,PRUNED
2073,2073,0.04872266948223114,2023-01-05 02:38:59.357533,2023-01-05 02:39:35.274393,0 days 00:00:35.916860,tanh,0.5,2,0.55,0.0646146610379219,0.04872266948223114,,PRUNED
2074,2074,0.13429592549800873,2023-01-05 02:39:35.377757,2023-01-05 02:39:44.157737,0 days 00:00:08.779980,relu,0.30000000000000004,2,0.9,0.13429592549800873,,,PRUNED
2075,2075,0.12569209933280945,2023-01-05 02:39:44.265895,2023-01-05 02:39:52.940391,0 days 00:00:08.674496,tanh,0.1,2,0.65,0.12569209933280945,,,PRUNED
2076,2076,0.05339287966489792,2023-01-05 02:39:53.043053,2023-01-05 02:40:28.761633,0 days 00:00:35.718580,sigmoid,0.5,2,0.7,0.07993514090776443,0.05339287966489792,,PRUNED
2077,2077,0.10972860455513,2023-01-05 02:40:28.854971,2023-01-05 02:40:44.428095,0 days 00:00:15.573124,tanh,0.30000000000000004,3,0.65,0.10972860455513,,,PRUNED
2078,2078,0.11537230014801025,2023-01-05 02:40:44.710606,2023-01-05 02:40:53.369074,0 days 00:00:08.658468,tanh,0.30000000000000004,2,0.7,0.11537230014801025,,,PRUNED
2079,2079,0.14088691771030426,2023-01-05 02:40:53.471740,2023-01-05 02:41:42.978761,0 days 00:00:49.507021,tanh,0.2,2,0.5,0.0396994911134243,,,COMPLETE
2080,2080,0.13046549260616302,2023-01-05 02:41:43.107482,2023-01-05 02:41:51.689579,0 days 00:00:08.582097,relu,0.5,2,0.8500000000000001,0.13046549260616302,,,PRUNED
2081,2081,0.15551672875881195,2023-01-05 02:41:51.969737,2023-01-05 02:42:00.855358,0 days 00:00:08.885621,tanh,0.25,4,0.95,0.15551672875881195,,,PRUNED
2082,2082,0.17473311722278595,2023-01-05 02:42:00.946869,2023-01-05 02:42:09.629869,0 days 00:00:08.683000,relu,0.4,2,0.6,0.17473311722278595,,,PRUNED
2083,2083,0.15726244449615479,2023-01-05 02:42:09.732145,2023-01-05 02:42:59.345875,0 days 00:00:49.613730,tanh,0.2,2,0.5,0.04760006442666054,,,COMPLETE
2084,2084,0.19673098623752594,2023-01-05 02:42:59.497534,2023-01-05 02:43:08.567085,0 days 00:00:09.069551,tanh,0.35000000000000003,7,0.75,0.19673098623752594,,,PRUNED
2085,2085,0.15653550624847412,2023-01-05 02:43:08.676999,2023-01-05 02:43:54.811294,0 days 00:00:46.134295,tanh,0.2,2,0.5,0.046150412410497665,,,COMPLETE
2086,2086,0.04993889108300209,2023-01-05 02:43:54.926119,2023-01-05 02:44:30.885669,0 days 00:00:35.959550,sigmoid,0.2,2,0.7,0.0740361139178276,0.04993889108300209,,PRUNED
2087,2087,0.06276204437017441,2023-01-05 02:44:30.987407,2023-01-05 02:44:46.684453,0 days 00:00:15.697046,relu,0.0,2,0.6,0.0981254130601883,0.06276204437017441,,PRUNED
2088,2088,0.18086554110050201,2023-01-05 02:44:46.778659,2023-01-05 02:44:55.400450,0 days 00:00:08.621791,tanh,0.05,2,0.65,0.18086554110050201,,,PRUNED
2089,2089,0.0492190420627594,2023-01-05 02:44:55.501115,2023-01-05 02:45:31.546595,0 days 00:00:36.045480,sigmoid,0.4,2,0.75,0.07662498205900192,0.0492190420627594,,PRUNED
2090,2090,0.13424794375896454,2023-01-05 02:45:31.649341,2023-01-05 02:45:40.206675,0 days 00:00:08.557334,relu,0.2,2,0.8,0.13424794375896454,,,PRUNED
2091,2091,0.11217138916254044,2023-01-05 02:45:40.321667,2023-01-05 02:45:48.921336,0 days 00:00:08.599669,tanh,0.1,2,0.5,0.11217138916254044,,,PRUNED
2092,2092,0.15439417958259583,2023-01-05 02:45:49.015670,2023-01-05 02:46:35.587112,0 days 00:00:46.571442,tanh,0.1,2,0.5,0.04529564455151558,,,COMPLETE
2093,2093,0.15667058527469635,2023-01-05 02:46:35.697086,2023-01-05 02:47:25.400462,0 days 00:00:49.703376,tanh,0.1,2,0.5,0.048599790781736374,,,COMPLETE
2094,2094,0.12856552004814148,2023-01-05 02:47:25.527590,2023-01-05 02:47:34.030113,0 days 00:00:08.502523,tanh,0.30000000000000004,2,0.8500000000000001,0.12856552004814148,,,PRUNED
2095,2095,0.12840411067008972,2023-01-05 02:47:34.149253,2023-01-05 02:47:42.970899,0 days 00:00:08.821646,relu,0.45,2,0.95,0.12840411067008972,,,PRUNED
2096,2096,0.062436655163764954,2023-01-05 02:47:43.080190,2023-01-05 02:47:58.661119,0 days 00:00:15.580929,tanh,0.35000000000000003,2,0.6,0.09284304082393646,0.062436655163764954,,PRUNED
2097,2097,0.04931068420410156,2023-01-05 02:47:58.770196,2023-01-05 02:48:34.466836,0 days 00:00:35.696640,tanh,0.30000000000000004,2,1.0,0.0752033218741417,0.04931068420410156,,PRUNED
2098,2098,0.05333387479186058,2023-01-05 02:48:34.573766,2023-01-05 02:49:10.605815,0 days 00:00:36.032049,sigmoid,0.35000000000000003,2,0.7,0.0758659765124321,0.05333387479186058,,PRUNED
2099,2099,0.05127079412341118,2023-01-05 02:49:10.716813,2023-01-05 02:49:46.593714,0 days 00:00:35.876901,sigmoid,0.5,2,0.65,0.0712096318602562,0.05127079412341118,,PRUNED
2100,2100,0.05115998163819313,2023-01-05 02:49:46.695381,2023-01-05 02:50:22.541651,0 days 00:00:35.846270,tanh,0.35000000000000003,2,0.75,0.07092510908842087,0.05115998163819313,,PRUNED
2101,2101,0.1481849104166031,2023-01-05 02:50:22.651974,2023-01-05 02:51:15.494990,0 days 00:00:52.843016,tanh,0.2,2,0.5,0.04361259192228317,,,COMPLETE
2102,2102,0.15892687439918518,2023-01-05 02:51:15.828903,2023-01-05 02:52:02.040489,0 days 00:00:46.211586,tanh,0.2,2,0.5,0.04914160445332527,,,COMPLETE
2103,2103,0.16659753024578094,2023-01-05 02:52:02.155311,2023-01-05 02:52:10.683629,0 days 00:00:08.528318,relu,0.5,2,0.7,0.16659753024578094,,,PRUNED
2104,2104,0.07966011017560959,2023-01-05 02:52:10.793662,2023-01-05 02:52:26.532485,0 days 00:00:15.738823,tanh,0.4,2,0.55,0.08942006528377533,0.07966011017560959,,PRUNED
2105,2105,0.0863679051399231,2023-01-05 02:52:26.640838,2023-01-05 02:52:42.030224,0 days 00:00:15.389386,sigmoid,0.5,2,0.7,0.0863679051399231,,,PRUNED
2106,2106,0.05010094866156578,2023-01-05 02:52:42.143228,2023-01-05 02:53:18.069117,0 days 00:00:35.925889,tanh,0.25,2,0.65,0.060613248497247696,0.05010094866156578,,PRUNED
2107,2107,0.11510103195905685,2023-01-05 02:53:18.190451,2023-01-05 02:53:26.927766,0 days 00:00:08.737315,relu,0.25,2,0.9,0.11510103195905685,,,PRUNED
2108,2108,0.11370116472244263,2023-01-05 02:53:27.024712,2023-01-05 02:53:35.710343,0 days 00:00:08.685631,tanh,0.30000000000000004,2,0.6,0.11370116472244263,,,PRUNED
2109,2109,0.11384294182062149,2023-01-05 02:53:35.813093,2023-01-05 02:53:44.426756,0 days 00:00:08.613663,relu,0.1,2,0.8500000000000001,0.11384294182062149,,,PRUNED
2110,2110,0.04799860343337059,2023-01-05 02:53:44.536423,2023-01-05 02:54:20.548638,0 days 00:00:36.012215,sigmoid,0.30000000000000004,2,0.7,0.06519937515258789,0.04799860343337059,,PRUNED
2111,2111,0.2537521421909332,2023-01-05 02:54:20.656628,2023-01-05 02:54:36.690475,0 days 00:00:16.033847,sigmoid,0.5,8,0.7,0.2537521421909332,,,PRUNED
2112,2112,0.13775494694709778,2023-01-05 02:54:36.797417,2023-01-05 02:54:45.405790,0 days 00:00:08.608373,tanh,0.15000000000000002,2,0.7,0.13775494694709778,,,PRUNED
2113,2113,0.16814668476581573,2023-01-05 02:54:45.506280,2023-01-05 02:55:21.707438,0 days 00:00:36.201158,tanh,0.2,2,0.5,0.050134770572185516,,,COMPLETE
2114,2114,0.12697356939315796,2023-01-05 02:55:21.816941,2023-01-05 02:55:30.459914,0 days 00:00:08.642973,tanh,0.35000000000000003,2,0.65,0.12697356939315796,,,PRUNED
2115,2115,0.16027973592281342,2023-01-05 02:55:30.596128,2023-01-05 02:56:13.419462,0 days 00:00:42.823334,tanh,0.25,2,0.5,0.04782642424106598,,,COMPLETE
2116,2116,0.2152923047542572,2023-01-05 02:56:13.527462,2023-01-05 02:56:22.339246,0 days 00:00:08.811784,relu,0.30000000000000004,3,0.5,0.2152923047542572,,,PRUNED
2117,2117,0.052939608693122864,2023-01-05 02:56:22.455266,2023-01-05 02:56:58.436478,0 days 00:00:35.981212,tanh,0.2,2,0.55,0.07333766669034958,0.052939608693122864,,PRUNED
2118,2118,0.15036311745643616,2023-01-05 02:56:58.572320,2023-01-05 02:57:54.893025,0 days 00:00:56.320705,sigmoid,0.30000000000000004,2,0.7,0.07256176322698593,0.04622148349881172,,COMPLETE
2119,2119,0.11542107164859772,2023-01-05 02:57:55.013478,2023-01-05 02:58:03.748120,0 days 00:00:08.734642,tanh,0.5,2,0.6,0.11542107164859772,,,PRUNED
2120,2120,0.13538536429405212,2023-01-05 02:58:03.858124,2023-01-05 02:58:12.539106,0 days 00:00:08.680982,relu,0.30000000000000004,2,0.65,0.13538536429405212,,,PRUNED
2121,2121,0.07100022584199905,2023-01-05 02:58:12.648106,2023-01-05 02:58:28.096194,0 days 00:00:15.448088,tanh,0.4,2,0.8500000000000001,0.1000300720334053,0.07100022584199905,,PRUNED
2122,2122,0.13480733335018158,2023-01-05 02:58:28.211107,2023-01-05 02:58:37.037473,0 days 00:00:08.826366,relu,0.1,2,0.6,0.13480733335018158,,,PRUNED
2123,2123,0.07404974848031998,2023-01-05 02:58:37.130833,2023-01-05 02:58:52.828139,0 days 00:00:15.697306,tanh,0.05,2,0.7,0.09609299898147583,0.07404974848031998,,PRUNED
2124,2124,0.1468486785888672,2023-01-05 02:58:52.929343,2023-01-05 02:59:39.024225,0 days 00:00:46.094882,tanh,0.2,2,0.55,0.0441497340798378,,,COMPLETE
2125,2125,0.10017981380224228,2023-01-05 02:59:39.136223,2023-01-05 02:59:54.505686,0 days 00:00:15.369463,tanh,0.5,2,0.65,0.10017981380224228,,,PRUNED
2126,2126,0.049014776945114136,2023-01-05 02:59:54.599874,2023-01-05 03:00:30.703470,0 days 00:00:36.103596,sigmoid,0.30000000000000004,2,0.7,0.06866484880447388,0.049014776945114136,,PRUNED
2127,2127,0.06527019292116165,2023-01-05 03:00:30.824808,2023-01-05 03:00:46.453661,0 days 00:00:15.628853,relu,0.35000000000000003,2,0.75,0.10055164247751236,0.06527019292116165,,PRUNED
2128,2128,0.1795460432767868,2023-01-05 03:00:46.554927,2023-01-05 03:00:55.434897,0 days 00:00:08.879970,tanh,0.2,2,0.55,0.1795460432767868,,,PRUNED
2129,2129,0.12631620466709137,2023-01-05 03:00:55.537566,2023-01-05 03:01:04.259217,0 days 00:00:08.721651,tanh,0.45,2,0.6,0.12631620466709137,,,PRUNED
2130,2130,0.15915103256702423,2023-01-05 03:01:04.361887,2023-01-05 03:01:47.053765,0 days 00:00:42.691878,tanh,0.2,2,0.55,0.04158439487218857,,,COMPLETE
2131,2131,0.1287631243467331,2023-01-05 03:01:47.172605,2023-01-05 03:01:56.040947,0 days 00:00:08.868342,relu,0.35000000000000003,2,0.8500000000000001,0.1287631243467331,,,PRUNED
2132,2132,0.16942594945430756,2023-01-05 03:01:56.157895,2023-01-05 03:02:04.871457,0 days 00:00:08.713562,tanh,0.30000000000000004,2,0.7,0.16942594945430756,,,PRUNED
2133,2133,0.14991717040538788,2023-01-05 03:02:04.972881,2023-01-05 03:02:54.524568,0 days 00:00:49.551687,sigmoid,0.4,2,1.0,0.06985826045274734,0.047088488936424255,,COMPLETE
2134,2134,0.16443151235580444,2023-01-05 03:02:54.639617,2023-01-05 03:03:40.929031,0 days 00:00:46.289414,tanh,0.2,2,0.55,0.04876450449228287,,,COMPLETE
2135,2135,0.2001153528690338,2023-01-05 03:03:41.046155,2023-01-05 03:03:49.654707,0 days 00:00:08.608552,relu,0.0,2,0.6,0.2001153528690338,,,PRUNED
2136,2136,0.1475532054901123,2023-01-05 03:03:49.757480,2023-01-05 03:04:42.588853,0 days 00:00:52.831373,tanh,0.0,2,0.55,0.04276074841618538,,,COMPLETE
2137,2137,0.14642736315727234,2023-01-05 03:04:42.705080,2023-01-05 03:05:32.226747,0 days 00:00:49.521667,tanh,0.0,2,0.55,0.043237410485744476,,,COMPLETE
2138,2138,0.12753258645534515,2023-01-05 03:05:32.345773,2023-01-05 03:05:41.263399,0 days 00:00:08.917626,tanh,0.45,2,0.65,0.12753258645534515,,,PRUNED
2139,2139,0.14561812579631805,2023-01-05 03:05:41.361254,2023-01-05 03:06:30.813021,0 days 00:00:49.451767,tanh,0.0,2,0.55,0.042222097516059875,,,COMPLETE
2140,2140,0.1578534096479416,2023-01-05 03:06:30.940432,2023-01-05 03:07:17.046601,0 days 00:00:46.106169,tanh,0.0,2,0.55,0.049549806863069534,,,COMPLETE
2141,2141,0.16415882110595703,2023-01-05 03:07:17.169205,2023-01-05 03:07:25.996303,0 days 00:00:08.827098,relu,0.5,2,0.55,0.16415882110595703,,,PRUNED
2142,2142,0.14528733491897583,2023-01-05 03:07:26.107509,2023-01-05 03:08:12.347122,0 days 00:00:46.239613,tanh,0.35000000000000003,2,0.55,0.06799726188182831,0.04200911521911621,,COMPLETE
2143,2143,0.16476809978485107,2023-01-05 03:08:12.480622,2023-01-05 03:08:58.587245,0 days 00:00:46.106623,tanh,0.0,2,0.55,0.05117204040288925,,,COMPLETE
2144,2144,0.10952670127153397,2023-01-05 03:08:58.710412,2023-01-05 03:09:07.531107,0 days 00:00:08.820695,tanh,0.4,2,0.8500000000000001,0.10952670127153397,,,PRUNED
2145,2145,0.15672917664051056,2023-01-05 03:09:07.641395,2023-01-05 03:09:50.308012,0 days 00:00:42.666617,tanh,0.0,2,0.55,0.04630589485168457,,,COMPLETE
2146,2146,0.1541050672531128,2023-01-05 03:09:50.435446,2023-01-05 03:09:59.152091,0 days 00:00:08.716645,relu,0.35000000000000003,2,0.5,0.1541050672531128,,,PRUNED
2147,2147,0.1511341631412506,2023-01-05 03:09:59.249802,2023-01-05 03:10:07.951398,0 days 00:00:08.701596,tanh,0.30000000000000004,2,0.9,0.1511341631412506,,,PRUNED
2148,2148,0.0854429230093956,2023-01-05 03:10:08.058488,2023-01-05 03:10:23.449355,0 days 00:00:15.390867,sigmoid,0.35000000000000003,2,0.95,0.0854429230093956,,,PRUNED
2149,2149,0.10691464692354202,2023-01-05 03:10:23.556198,2023-01-05 03:10:32.223879,0 days 00:00:08.667681,tanh,0.1,2,0.6,0.10691464692354202,,,PRUNED
2150,2150,0.15113022923469543,2023-01-05 03:10:32.326057,2023-01-05 03:10:41.198609,0 days 00:00:08.872552,relu,0.15000000000000002,2,0.8,0.15113022923469543,,,PRUNED
2151,2151,0.1606137752532959,2023-01-05 03:10:41.298537,2023-01-05 03:11:27.598802,0 days 00:00:46.300265,tanh,0.0,2,0.55,0.048569705337285995,,,COMPLETE
2152,2152,0.049198467284440994,2023-01-05 03:11:27.725983,2023-01-05 03:12:03.716848,0 days 00:00:35.990865,tanh,0.35000000000000003,2,0.75,0.06597009301185608,0.049198467284440994,,PRUNED
2153,2153,0.15710455179214478,2023-01-05 03:12:03.825843,2023-01-05 03:12:46.678050,0 days 00:00:42.852207,tanh,0.0,2,0.55,0.04715055599808693,,,COMPLETE
2154,2154,0.15360108017921448,2023-01-05 03:12:46.793884,2023-01-05 03:13:29.763070,0 days 00:00:42.969186,sigmoid,0.35000000000000003,2,0.7,0.06237232685089111,0.04410934075713158,,COMPLETE
2155,2155,0.1451815813779831,2023-01-05 03:13:29.883242,2023-01-05 03:14:19.574603,0 days 00:00:49.691361,tanh,0.0,2,0.55,0.04150105267763138,,,COMPLETE
2156,2156,0.22467702627182007,2023-01-05 03:14:19.692710,2023-01-05 03:14:28.439447,0 days 00:00:08.746737,tanh,0.30000000000000004,3,0.65,0.22467702627182007,,,PRUNED
2157,2157,0.15401694178581238,2023-01-05 03:14:28.525055,2023-01-05 03:15:11.265943,0 days 00:00:42.740888,tanh,0.35000000000000003,2,0.65,0.06393741816282272,0.04549216851592064,,COMPLETE
2158,2158,0.17622093856334686,2023-01-05 03:15:11.398436,2023-01-05 03:15:47.479127,0 days 00:00:36.080691,tanh,0.0,2,0.55,0.053409457206726074,,,COMPLETE
2159,2159,0.1383643001317978,2023-01-05 03:15:47.598313,2023-01-05 03:15:56.266639,0 days 00:00:08.668326,relu,0.25,2,0.7,0.1383643001317978,,,PRUNED
2160,2160,0.1604534238576889,2023-01-05 03:15:56.378272,2023-01-05 03:16:42.617262,0 days 00:00:46.238990,tanh,0.0,2,0.55,0.04823094233870506,,,COMPLETE
2161,2161,0.16274401545524597,2023-01-05 03:16:42.734093,2023-01-05 03:16:51.820706,0 days 00:00:09.086613,tanh,0.1,5,0.8500000000000001,0.16274401545524597,,,PRUNED
2162,2162,0.1079506129026413,2023-01-05 03:16:51.922706,2023-01-05 03:17:00.585695,0 days 00:00:08.662989,relu,0.5,2,0.6,0.1079506129026413,,,PRUNED
2163,2163,0.04777975380420685,2023-01-05 03:17:00.670707,2023-01-05 03:17:36.365524,0 days 00:00:35.694817,sigmoid,0.35000000000000003,2,0.65,0.06881317496299744,0.04777975380420685,,PRUNED
2164,2164,0.07129434496164322,2023-01-05 03:17:36.466961,2023-01-05 03:17:52.116463,0 days 00:00:15.649502,tanh,0.4,2,0.95,0.09443502873182297,0.07129434496164322,,PRUNED
2165,2165,0.14854931831359863,2023-01-05 03:17:52.231638,2023-01-05 03:18:00.847738,0 days 00:00:08.616100,relu,0.30000000000000004,2,0.55,0.14854931831359863,,,PRUNED
2166,2166,0.16326482594013214,2023-01-05 03:18:00.931734,2023-01-05 03:18:47.067270,0 days 00:00:46.135536,tanh,0.0,2,0.55,0.05074528232216835,,,COMPLETE
2167,2167,0.15072424709796906,2023-01-05 03:18:47.190187,2023-01-05 03:19:33.394640,0 days 00:00:46.204453,sigmoid,0.35000000000000003,2,0.7,0.07185985893011093,0.04457274451851845,,COMPLETE
2168,2168,0.14194194972515106,2023-01-05 03:19:33.504294,2023-01-05 03:19:42.081606,0 days 00:00:08.577312,tanh,0.35000000000000003,2,0.7,0.14194194972515106,,,PRUNED
2169,2169,0.1344018131494522,2023-01-05 03:19:42.168185,2023-01-05 03:19:50.897602,0 days 00:00:08.729417,relu,0.1,2,0.65,0.1344018131494522,,,PRUNED
2170,2170,0.09363418817520142,2023-01-05 03:19:51.009597,2023-01-05 03:20:06.404742,0 days 00:00:15.395145,tanh,0.35000000000000003,2,0.7,0.09363418817520142,,,PRUNED
2171,2171,0.12030642479658127,2023-01-05 03:20:06.506410,2023-01-05 03:20:15.371733,0 days 00:00:08.865323,tanh,0.05,2,0.6,0.12030642479658127,,,PRUNED
2172,2172,0.09319528937339783,2023-01-05 03:20:15.479997,2023-01-05 03:20:31.036186,0 days 00:00:15.556189,sigmoid,0.4,3,0.55,0.09319528937339783,,,PRUNED
2173,2173,0.17013652622699738,2023-01-05 03:20:31.137845,2023-01-05 03:21:17.329457,0 days 00:00:46.191612,tanh,0.0,2,0.55,0.05454973503947258,,,COMPLETE
2174,2174,0.05243653059005737,2023-01-05 03:21:17.458559,2023-01-05 03:21:53.570491,0 days 00:00:36.111932,tanh,0.35000000000000003,2,0.7,0.07121238857507706,0.05243653059005737,,PRUNED
2175,2175,0.13016648590564728,2023-01-05 03:21:53.672158,2023-01-05 03:22:02.337118,0 days 00:00:08.664960,tanh,0.25,2,0.8500000000000001,0.13016648590564728,,,PRUNED
2176,2176,0.12448316067457199,2023-01-05 03:22:02.439000,2023-01-05 03:22:11.111999,0 days 00:00:08.672999,relu,0.35000000000000003,2,0.5,0.12448316067457199,,,PRUNED
2177,2177,0.1526540070772171,2023-01-05 03:22:11.386848,2023-01-05 03:23:01.021487,0 days 00:00:49.634639,tanh,0.0,2,0.55,0.04851633682847023,,,COMPLETE
2178,2178,0.117722287774086,2023-01-05 03:23:01.138309,2023-01-05 03:23:09.757267,0 days 00:00:08.618958,tanh,0.5,2,0.8,0.117722287774086,,,PRUNED
2179,2179,0.12634582817554474,2023-01-05 03:23:09.846935,2023-01-05 03:23:18.565005,0 days 00:00:08.718070,relu,0.30000000000000004,2,0.6,0.12634582817554474,,,PRUNED
2180,2180,0.15422208607196808,2023-01-05 03:23:18.668616,2023-01-05 03:23:58.147862,0 days 00:00:39.479246,sigmoid,0.5,2,0.75,0.0645921379327774,0.04633459448814392,,COMPLETE
2181,2181,0.10604781657457352,2023-01-05 03:23:58.268249,2023-01-05 03:24:06.844564,0 days 00:00:08.576315,tanh,0.30000000000000004,2,0.9,0.10604781657457352,,,PRUNED
2182,2182,0.0673847571015358,2023-01-05 03:24:06.936259,2023-01-05 03:24:22.451693,0 days 00:00:15.515434,relu,0.1,2,0.8500000000000001,0.10401993244886398,0.0673847571015358,,PRUNED
2183,2183,0.09898708015680313,2023-01-05 03:24:22.737225,2023-01-05 03:24:38.350473,0 days 00:00:15.613248,tanh,0.45,2,0.65,0.08704666793346405,0.09898708015680313,,PRUNED
2184,2184,0.10755941271781921,2023-01-05 03:24:38.443806,2023-01-05 03:24:47.250418,0 days 00:00:08.806612,relu,0.4,2,0.75,0.10755941271781921,,,PRUNED
2185,2185,0.05112495273351669,2023-01-05 03:24:47.358433,2023-01-05 03:25:23.388679,0 days 00:00:36.030246,sigmoid,0.4,2,0.65,0.07440414279699326,0.05112495273351669,,PRUNED
2186,2186,0.12035760283470154,2023-01-05 03:25:23.490335,2023-01-05 03:25:32.162987,0 days 00:00:08.672652,tanh,0.35000000000000003,2,0.6,0.12035760283470154,,,PRUNED
2187,2187,0.13656926155090332,2023-01-05 03:25:32.271566,2023-01-05 03:25:40.945648,0 days 00:00:08.674082,tanh,0.0,2,0.55,0.13656926155090332,,,PRUNED
2188,2188,0.1866803914308548,2023-01-05 03:25:41.048980,2023-01-05 03:25:49.703223,0 days 00:00:08.654243,relu,0.25,2,0.7,0.1866803914308548,,,PRUNED
