,number,value,datetime_start,datetime_complete,duration,params_activation,params_dropout,params_layers,params_shrink,system_attrs_completed_rung_0,system_attrs_completed_rung_1,system_attrs_completed_rung_2,state
3110,3110,0.19347752630710602,2023-01-05 08:58:43.792912,2023-01-05 08:58:52.696879,0 days 00:00:08.903967,sigmoid,0.4,2,0.8500000000000001,0.19347752630710602,,,PRUNED
3111,3111,0.12929807603359222,2023-01-05 08:58:52.800555,2023-01-05 08:59:01.546751,0 days 00:00:08.746196,tanh,0.35000000000000003,2,0.55,0.12929807603359222,,,PRUNED
3112,3112,0.14532119035720825,2023-01-05 08:59:01.668577,2023-01-05 08:59:44.799458,0 days 00:00:43.130881,tanh,0.1,2,0.6,0.0411544069647789,,,COMPLETE
3113,3113,0.11005531251430511,2023-01-05 08:59:44.918878,2023-01-05 08:59:53.550025,0 days 00:00:08.631147,relu,0.25,2,0.65,0.11005531251430511,,,PRUNED
3114,3114,0.15540862083435059,2023-01-05 08:59:53.655234,2023-01-05 09:00:02.625324,0 days 00:00:08.970090,tanh,0.05,2,0.95,0.15540862083435059,,,PRUNED
3115,3115,0.13084381818771362,2023-01-05 09:00:02.734890,2023-01-05 09:00:11.523377,0 days 00:00:08.788487,tanh,0.1,2,0.6,0.13084381818771362,,,PRUNED
3116,3116,0.13439743220806122,2023-01-05 09:00:11.632475,2023-01-05 09:00:20.556772,0 days 00:00:08.924297,relu,0.45,2,0.7,0.13439743220806122,,,PRUNED
3117,3117,0.1290242075920105,2023-01-05 09:00:20.695776,2023-01-05 09:00:29.438906,0 days 00:00:08.743130,tanh,0.30000000000000004,2,0.6,0.1290242075920105,,,PRUNED
3118,3118,0.057804450392723083,2023-01-05 09:00:29.533780,2023-01-05 09:01:05.777287,0 days 00:00:36.243507,tanh,0.1,4,0.6,0.057804450392723083,,,PRUNED
3119,3119,0.27590733766555786,2023-01-05 09:01:05.892291,2023-01-05 09:01:14.910966,0 days 00:00:09.018675,relu,0.5,3,0.5,0.27590733766555786,,,PRUNED
3120,3120,0.15335361659526825,2023-01-05 09:01:15.021456,2023-01-05 09:01:58.028452,0 days 00:00:43.006996,sigmoid,0.5,2,0.7,0.07524742931127548,0.042956527322530746,,COMPLETE
3121,3121,0.0603308230638504,2023-01-05 09:01:58.156531,2023-01-05 09:02:14.130350,0 days 00:00:15.973819,tanh,0.30000000000000004,2,0.8500000000000001,0.10024881362915039,0.0603308230638504,,PRUNED
3122,3122,0.07245431840419769,2023-01-05 09:02:14.244720,2023-01-05 09:02:29.954919,0 days 00:00:15.710199,relu,0.35000000000000003,2,0.6,0.10181936621665955,0.07245431840419769,,PRUNED
3123,3123,0.16622141003608704,2023-01-05 09:02:30.059605,2023-01-05 09:02:39.562724,0 days 00:00:09.503119,tanh,0.30000000000000004,7,0.9,0.16622141003608704,,,PRUNED
3124,3124,0.13104379177093506,2023-01-05 09:02:39.676726,2023-01-05 09:02:48.470970,0 days 00:00:08.794244,relu,0.1,2,0.65,0.13104379177093506,,,PRUNED
3125,3125,0.16726261377334595,2023-01-05 09:02:48.582735,2023-01-05 09:02:57.802981,0 days 00:00:09.220246,tanh,0.5,5,0.8500000000000001,0.16726261377334595,,,PRUNED
3126,3126,0.1530233472585678,2023-01-05 09:02:57.908659,2023-01-05 09:03:44.135930,0 days 00:00:46.227271,tanh,0.1,2,0.6,0.04459955170750618,,,COMPLETE
3127,3127,0.1158972978591919,2023-01-05 09:03:44.258760,2023-01-05 09:03:53.173727,0 days 00:00:08.914967,tanh,0.4,2,0.8,0.1158972978591919,,,PRUNED
3128,3128,0.14405249059200287,2023-01-05 09:03:53.295076,2023-01-05 09:04:02.056359,0 days 00:00:08.761283,relu,0.35000000000000003,2,0.7,0.14405249059200287,,,PRUNED
3129,3129,0.12576721608638763,2023-01-05 09:04:02.160518,2023-01-05 09:04:11.155665,0 days 00:00:08.995147,tanh,0.45,2,0.6,0.12576721608638763,,,PRUNED
3130,3130,0.1845799684524536,2023-01-05 09:04:11.278008,2023-01-05 09:04:20.071639,0 days 00:00:08.793631,relu,0.25,2,0.6,0.1845799684524536,,,PRUNED
3131,3131,0.12638196349143982,2023-01-05 09:04:20.175687,2023-01-05 09:04:29.095390,0 days 00:00:08.919703,tanh,0.2,2,0.8500000000000001,0.12638196349143982,,,PRUNED
3132,3132,0.14572639763355255,2023-01-05 09:04:29.207393,2023-01-05 09:05:15.506817,0 days 00:00:46.299424,tanh,0.1,2,0.6,0.04235891252756119,,,COMPLETE
3133,3133,0.12674115598201752,2023-01-05 09:05:15.632935,2023-01-05 09:05:24.625511,0 days 00:00:08.992576,relu,0.30000000000000004,2,0.75,0.12674115598201752,,,PRUNED
3134,3134,0.08380573987960815,2023-01-05 09:05:24.747353,2023-01-05 09:05:40.514438,0 days 00:00:15.767085,tanh,0.15000000000000002,2,0.55,0.10984092205762863,0.08380573987960815,,PRUNED
3135,3135,0.04642273113131523,2023-01-05 09:05:40.616253,2023-01-05 09:06:16.928285,0 days 00:00:36.312032,sigmoid,0.30000000000000004,2,0.6,0.07435398548841476,0.04642273113131523,,PRUNED
3136,3136,0.1447233110666275,2023-01-05 09:06:17.030970,2023-01-05 09:06:25.929901,0 days 00:00:08.898931,sigmoid,0.1,2,0.5,0.1447233110666275,,,PRUNED
3137,3137,0.304598331451416,2023-01-05 09:06:26.057275,2023-01-05 09:06:35.502300,0 days 00:00:09.445025,relu,0.45,8,0.65,0.304598331451416,,,PRUNED
3138,3138,0.0965445265173912,2023-01-05 09:06:35.624203,2023-01-05 09:06:51.500093,0 days 00:00:15.875890,relu,0.35000000000000003,5,0.7,0.0965445265173912,,,PRUNED
3139,3139,0.11798270791769028,2023-01-05 09:06:51.604312,2023-01-05 09:07:00.634260,0 days 00:00:09.029948,tanh,0.0,2,0.7,0.11798270791769028,,,PRUNED
3140,3140,0.1227651834487915,2023-01-05 09:07:00.747266,2023-01-05 09:07:09.500252,0 days 00:00:08.752986,tanh,0.1,2,0.8500000000000001,0.1227651834487915,,,PRUNED
3141,3141,0.06518235057592392,2023-01-05 09:07:09.617889,2023-01-05 09:07:25.465103,0 days 00:00:15.847214,relu,0.35000000000000003,2,0.6,0.08484691381454468,0.06518235057592392,,PRUNED
3142,3142,0.08398972451686859,2023-01-05 09:07:25.579688,2023-01-05 09:07:41.196805,0 days 00:00:15.617117,sigmoid,0.5,2,0.55,0.08398972451686859,,,PRUNED
3143,3143,0.16124612092971802,2023-01-05 09:07:41.299485,2023-01-05 09:07:50.263772,0 days 00:00:08.964287,tanh,0.5,2,0.6,0.16124612092971802,,,PRUNED
3144,3144,0.049494460225105286,2023-01-05 09:07:50.380751,2023-01-05 09:08:26.351658,0 days 00:00:35.970907,sigmoid,0.4,2,0.95,0.06885913759469986,0.049494460225105286,,PRUNED
3145,3145,0.08042825758457184,2023-01-05 09:08:26.457042,2023-01-05 09:08:42.133775,0 days 00:00:15.676733,sigmoid,0.35000000000000003,2,0.65,0.08042825758457184,,,PRUNED
3146,3146,0.1638772189617157,2023-01-05 09:08:42.239448,2023-01-05 09:09:22.437658,0 days 00:00:40.198210,tanh,0.1,2,0.6,0.050281379371881485,,,COMPLETE
3147,3147,0.16788925230503082,2023-01-05 09:09:22.577365,2023-01-05 09:09:31.680229,0 days 00:00:09.102864,relu,0.05,2,0.65,0.16788925230503082,,,PRUNED
3148,3148,,2023-01-05 09:09:31.794355,,,tanh,0.1,2,0.6,,,,RUNNING
