,number,value,datetime_start,datetime_complete,duration,params_activation,params_dropout,params_layers,params_shrink,system_attrs_completed_rung_0,system_attrs_completed_rung_1,system_attrs_completed_rung_2,state
896,896,0.16961102187633514,2023-01-04 19:32:21.319688,2023-01-04 19:32:57.946825,0 days 00:00:36.627137,sigmoid,0.5,2,0.65,0.09403213858604431,0.06485860049724579,0.04231381416320801,COMPLETE
897,897,0.15061232447624207,2023-01-04 19:32:58.044866,2023-01-04 19:33:06.676925,0 days 00:00:08.632059,sigmoid,0.5,2,0.8500000000000001,0.15061232447624207,,,PRUNED
898,898,0.16570937633514404,2023-01-04 19:33:06.781062,2023-01-04 19:33:15.517658,0 days 00:00:08.736596,sigmoid,0.5,2,0.8500000000000001,0.16570937633514404,,,PRUNED
899,899,0.1685345619916916,2023-01-04 19:33:15.624924,2023-01-04 19:33:24.367176,0 days 00:00:08.742252,sigmoid,0.5,2,0.95,0.1685345619916916,,,PRUNED
900,900,0.1686127632856369,2023-01-04 19:33:24.480201,2023-01-04 19:33:33.433824,0 days 00:00:08.953623,sigmoid,0.5,2,0.8500000000000001,0.1686127632856369,,,PRUNED
901,901,0.14505194127559662,2023-01-04 19:33:33.540067,2023-01-04 19:34:23.661638,0 days 00:00:50.121571,relu,0.0,2,0.5,0.07230883091688156,0.04269782081246376,,COMPLETE
902,902,0.3161259889602661,2023-01-04 19:34:23.797463,2023-01-04 19:34:40.227169,0 days 00:00:16.429706,relu,0.0,8,0.5,0.3161259889602661,,,PRUNED
903,903,0.07348103821277618,2023-01-04 19:34:40.332758,2023-01-04 19:34:56.675987,0 days 00:00:16.343229,tanh,0.35000000000000003,3,0.8500000000000001,0.10558951646089554,0.07348103821277618,,PRUNED
904,904,0.05077362433075905,2023-01-04 19:34:56.773997,2023-01-04 19:35:33.048299,0 days 00:00:36.274302,relu,0.0,2,0.5,0.06525158137083054,0.05077362433075905,,PRUNED
905,905,0.12359619140625,2023-01-04 19:35:33.138217,2023-01-04 19:35:41.855874,0 days 00:00:08.717657,sigmoid,0.5,2,0.9,0.12359619140625,,,PRUNED
906,906,0.07532311230897903,2023-01-04 19:35:41.960880,2023-01-04 19:35:57.563786,0 days 00:00:15.602906,relu,0.0,2,0.5,0.07532311230897903,,,PRUNED
907,907,0.04576493054628372,2023-01-04 19:35:57.653475,2023-01-04 19:36:34.137197,0 days 00:00:36.483722,tanh,0.30000000000000004,2,0.8,0.11000720411539078,0.06189136952161789,0.04576493054628372,PRUNED
908,908,0.0913255512714386,2023-01-04 19:36:34.241570,2023-01-04 19:36:49.884081,0 days 00:00:15.642511,relu,0.0,2,0.5,0.0913255512714386,,,PRUNED
909,909,0.13647209107875824,2023-01-04 19:36:49.973413,2023-01-04 19:36:58.775815,0 days 00:00:08.802402,tanh,0.5,2,0.5,0.13647209107875824,,,PRUNED
910,910,0.0749879702925682,2023-01-04 19:36:58.880594,2023-01-04 19:37:14.507224,0 days 00:00:15.626630,relu,0.1,2,0.5,0.0749879702925682,,,PRUNED
911,911,0.08136185258626938,2023-01-04 19:37:14.597626,2023-01-04 19:37:30.539469,0 days 00:00:15.941843,tanh,0.35000000000000003,2,1.0,0.11412321031093597,0.08136185258626938,,PRUNED
912,912,0.1559799164533615,2023-01-04 19:37:30.655906,2023-01-04 19:37:39.373011,0 days 00:00:08.717105,sigmoid,0.5,2,0.8500000000000001,0.1559799164533615,,,PRUNED
913,913,0.0958862155675888,2023-01-04 19:37:39.478104,2023-01-04 19:37:55.020832,0 days 00:00:15.542728,relu,0.35000000000000003,2,0.95,0.0958862155675888,,,PRUNED
914,914,0.14791078865528107,2023-01-04 19:37:55.110552,2023-01-04 19:38:38.205699,0 days 00:00:43.095147,relu,0.30000000000000004,2,0.5,0.05827757716178894,0.040706485509872437,,COMPLETE
915,915,0.08406127244234085,2023-01-04 19:38:38.528893,2023-01-04 19:38:54.116369,0 days 00:00:15.587476,relu,0.30000000000000004,2,0.5,0.08406127244234085,,,PRUNED
916,916,0.05669739469885826,2023-01-04 19:38:54.224006,2023-01-04 19:39:30.471578,0 days 00:00:36.247572,relu,0.30000000000000004,2,0.5,0.06589791178703308,0.05669739469885826,,PRUNED
917,917,0.04722825810313225,2023-01-04 19:39:30.562295,2023-01-04 19:40:06.677805,0 days 00:00:36.115510,relu,0.30000000000000004,2,0.5,0.06728023290634155,0.04722825810313225,,PRUNED
918,918,0.07271420210599899,2023-01-04 19:40:06.765903,2023-01-04 19:40:22.594327,0 days 00:00:15.828424,sigmoid,0.30000000000000004,2,0.5,0.07271420210599899,,,PRUNED
919,919,0.07856560498476028,2023-01-04 19:40:22.700036,2023-01-04 19:40:38.308501,0 days 00:00:15.608465,tanh,0.5,2,0.9,0.11657393723726273,0.07856560498476028,,PRUNED
920,920,0.07349023222923279,2023-01-04 19:40:38.425011,2023-01-04 19:40:53.957323,0 days 00:00:15.532312,tanh,0.35000000000000003,2,0.8500000000000001,0.1192936822772026,0.07349023222923279,,PRUNED
921,921,0.12970885634422302,2023-01-04 19:40:54.073137,2023-01-04 19:41:02.724324,0 days 00:00:08.651187,sigmoid,0.5,2,0.8500000000000001,0.12970885634422302,,,PRUNED
922,922,0.05030720680952072,2023-01-04 19:41:02.829627,2023-01-04 19:41:39.314647,0 days 00:00:36.485020,relu,0.30000000000000004,2,0.5,0.06977313756942749,0.05030720680952072,,PRUNED
923,923,0.09321410953998566,2023-01-04 19:41:39.419228,2023-01-04 19:41:55.327700,0 days 00:00:15.908472,tanh,0.4,4,0.8500000000000001,0.10296964645385742,0.09321410953998566,,PRUNED
924,924,0.14569906890392303,2023-01-04 19:41:55.444717,2023-01-04 19:42:04.144094,0 days 00:00:08.699377,tanh,0.5,2,1.0,0.14569906890392303,,,PRUNED
925,925,0.05142207071185112,2023-01-04 19:42:04.250191,2023-01-04 19:42:40.749463,0 days 00:00:36.499272,relu,0.25,2,0.5,0.07154565304517746,0.05142207071185112,,PRUNED
926,926,0.07804123312234879,2023-01-04 19:42:40.846922,2023-01-04 19:42:56.491573,0 days 00:00:15.644651,tanh,0.1,2,0.55,0.07804123312234879,,,PRUNED
927,927,0.07420623302459717,2023-01-04 19:42:56.613422,2023-01-04 19:43:12.272765,0 days 00:00:15.659343,tanh,0.5,2,0.5,0.07420623302459717,,,PRUNED
928,928,0.07313430309295654,2023-01-04 19:43:12.371252,2023-01-04 19:43:28.136958,0 days 00:00:15.765706,tanh,0.35000000000000003,2,0.8,0.1119617223739624,0.07313430309295654,,PRUNED
929,929,0.04656802862882614,2023-01-04 19:43:28.227040,2023-01-04 19:44:04.884916,0 days 00:00:36.657876,relu,0.15000000000000002,2,0.75,0.05944029241800308,0.04656802862882614,,PRUNED
930,930,0.1481102555990219,2023-01-04 19:44:04.990569,2023-01-04 19:44:51.849145,0 days 00:00:46.858576,tanh,0.1,2,0.55,0.07078731805086136,0.04313633218407631,,COMPLETE
931,931,0.13612037897109985,2023-01-04 19:44:51.966243,2023-01-04 19:45:00.730352,0 days 00:00:08.764109,sigmoid,0.5,2,0.8500000000000001,0.13612037897109985,,,PRUNED
932,932,0.08152305334806442,2023-01-04 19:45:00.836833,2023-01-04 19:45:16.271416,0 days 00:00:15.434583,tanh,0.1,2,0.65,0.08152305334806442,,,PRUNED
933,933,0.15822499990463257,2023-01-04 19:45:16.569690,2023-01-04 19:45:25.304442,0 days 00:00:08.734752,tanh,0.30000000000000004,2,0.7,0.15822499990463257,,,PRUNED
934,934,0.09004976600408554,2023-01-04 19:45:25.409494,2023-01-04 19:45:41.043979,0 days 00:00:15.634485,tanh,0.1,2,0.55,0.09004976600408554,,,PRUNED
935,935,0.04675234481692314,2023-01-04 19:45:41.149999,2023-01-04 19:46:17.366236,0 days 00:00:36.216237,tanh,0.1,2,0.65,0.0681149810552597,0.04675234481692314,,PRUNED
936,936,0.14939671754837036,2023-01-04 19:46:17.571924,2023-01-04 19:47:01.205736,0 days 00:00:43.633812,tanh,0.5,2,0.8500000000000001,0.11961536854505539,0.06368923932313919,0.041109196841716766,COMPLETE
937,937,0.04558806121349335,2023-01-04 19:47:01.322554,2023-01-04 19:47:37.426861,0 days 00:00:36.104307,tanh,0.4,2,0.7,0.07168199867010117,0.04558806121349335,,PRUNED
938,938,0.09699420630931854,2023-01-04 19:47:37.552253,2023-01-04 19:47:53.126468,0 days 00:00:15.574215,tanh,0.30000000000000004,2,0.8,0.09699420630931854,,,PRUNED
939,939,0.15246500074863434,2023-01-04 19:47:53.241001,2023-01-04 19:48:43.298058,0 days 00:00:50.057057,tanh,0.1,2,0.5,0.06874587386846542,0.043950632214546204,,COMPLETE
940,940,0.07659726589918137,2023-01-04 19:48:43.415952,2023-01-04 19:48:59.137405,0 days 00:00:15.721453,tanh,0.1,2,0.55,0.07659726589918137,,,PRUNED
941,941,0.13866527378559113,2023-01-04 19:48:59.244455,2023-01-04 19:49:07.929666,0 days 00:00:08.685211,sigmoid,0.35000000000000003,2,0.6,0.13866527378559113,,,PRUNED
942,942,0.17440776526927948,2023-01-04 19:49:08.035485,2023-01-04 19:49:16.894767,0 days 00:00:08.859282,relu,0.5,2,0.8500000000000001,0.17440776526927948,,,PRUNED
943,943,0.1651170402765274,2023-01-04 19:49:17.009676,2023-01-04 19:49:25.794343,0 days 00:00:08.784667,tanh,0.4,2,0.9,0.1651170402765274,,,PRUNED
944,944,0.08449432253837585,2023-01-04 19:49:25.901121,2023-01-04 19:49:41.750685,0 days 00:00:15.849564,tanh,0.1,2,0.6,0.08449432253837585,,,PRUNED
945,945,0.07294274121522903,2023-01-04 19:49:41.848762,2023-01-04 19:49:57.332970,0 days 00:00:15.484208,tanh,0.0,2,0.65,0.07294274121522903,,,PRUNED
946,946,0.17570137977600098,2023-01-04 19:49:57.438105,2023-01-04 19:50:06.224952,0 days 00:00:08.786847,relu,0.5,2,0.8500000000000001,0.17570137977600098,,,PRUNED
947,947,0.04711570590734482,2023-01-04 19:50:06.328950,2023-01-04 19:50:42.646199,0 days 00:00:36.317249,sigmoid,0.1,2,0.55,0.06748711317777634,0.04711570590734482,,PRUNED
948,948,0.08293166011571884,2023-01-04 19:50:42.760553,2023-01-04 19:50:58.695987,0 days 00:00:15.935434,tanh,0.30000000000000004,2,0.95,0.10626790672540665,0.08293166011571884,,PRUNED
949,949,0.1308835744857788,2023-01-04 19:50:58.810362,2023-01-04 19:51:07.603421,0 days 00:00:08.793059,relu,0.25,2,0.8500000000000001,0.1308835744857788,,,PRUNED
950,950,0.15141527354717255,2023-01-04 19:51:07.708107,2023-01-04 19:51:50.969215,0 days 00:00:43.261108,tanh,0.4,2,0.6,0.060598526149988174,0.04320535808801651,,COMPLETE
951,951,0.1572529673576355,2023-01-04 19:51:51.084048,2023-01-04 19:51:59.982017,0 days 00:00:08.897969,tanh,0.5,3,0.8500000000000001,0.1572529673576355,,,PRUNED
952,952,0.07649747282266617,2023-01-04 19:52:00.088097,2023-01-04 19:52:15.531465,0 days 00:00:15.443368,tanh,0.1,2,0.6,0.07649747282266617,,,PRUNED
953,953,0.07282877713441849,2023-01-04 19:52:15.636677,2023-01-04 19:52:31.404650,0 days 00:00:15.767973,sigmoid,0.2,2,0.75,0.11778602749109268,0.07282877713441849,,PRUNED
954,954,0.04866138845682144,2023-01-04 19:52:31.516259,2023-01-04 19:53:07.735241,0 days 00:00:36.218982,tanh,0.45,2,0.5,0.06855850666761398,0.04866138845682144,,PRUNED
955,955,0.12425707280635834,2023-01-04 19:53:07.841160,2023-01-04 19:53:16.718826,0 days 00:00:08.877666,relu,0.35000000000000003,2,0.8500000000000001,0.12425707280635834,,,PRUNED
956,956,0.04379703849554062,2023-01-04 19:53:16.823891,2023-01-04 19:53:53.215138,0 days 00:00:36.391247,tanh,0.5,2,0.5,0.1108568087220192,0.06336981058120728,0.04379703849554062,PRUNED
957,957,0.08205719292163849,2023-01-04 19:53:53.320983,2023-01-04 19:54:08.922384,0 days 00:00:15.601401,tanh,0.25,2,0.6,0.08205719292163849,,,PRUNED
958,958,0.08333007246255875,2023-01-04 19:54:09.028282,2023-01-04 19:54:24.755377,0 days 00:00:15.727095,tanh,0.5,2,0.8,0.10225046426057816,0.08333007246255875,,PRUNED
959,959,0.21775950491428375,2023-01-04 19:54:24.877081,2023-01-04 19:54:33.829738,0 days 00:00:08.952657,relu,0.30000000000000004,2,0.7,0.21775950491428375,,,PRUNED
960,960,0.150992289185524,2023-01-04 19:54:33.933891,2023-01-04 19:54:42.778524,0 days 00:00:08.844633,sigmoid,0.35000000000000003,2,0.8500000000000001,0.150992289185524,,,PRUNED
961,961,0.15443523228168488,2023-01-04 19:54:42.884058,2023-01-04 19:54:51.603112,0 days 00:00:08.719054,tanh,0.5,2,0.8500000000000001,0.15443523228168488,,,PRUNED
962,962,0.14537575840950012,2023-01-04 19:54:51.702553,2023-01-04 19:55:00.311199,0 days 00:00:08.608646,relu,0.5,2,1.0,0.14537575840950012,,,PRUNED
963,963,0.1387697160243988,2023-01-04 19:55:00.416294,2023-01-04 19:55:09.376432,0 days 00:00:08.960138,tanh,0.4,2,0.9,0.1387697160243988,,,PRUNED
964,964,0.12410816550254822,2023-01-04 19:55:09.482050,2023-01-04 19:55:18.293343,0 days 00:00:08.811293,relu,0.35000000000000003,2,0.8500000000000001,0.12410816550254822,,,PRUNED
965,965,0.149149551987648,2023-01-04 19:55:18.397040,2023-01-04 19:56:01.741657,0 days 00:00:43.344617,tanh,0.30000000000000004,2,0.65,0.06291838735342026,0.042259905487298965,,COMPLETE
966,966,0.08031652122735977,2023-01-04 19:56:01.866042,2023-01-04 19:56:17.429755,0 days 00:00:15.563713,sigmoid,0.5,2,0.8,0.10894020646810532,0.08031652122735977,,PRUNED
967,967,0.07700707763433456,2023-01-04 19:56:17.542577,2023-01-04 19:56:33.302809,0 days 00:00:15.760232,tanh,0.1,2,0.55,0.07700707763433456,,,PRUNED
968,968,0.13279816508293152,2023-01-04 19:56:33.409166,2023-01-04 19:56:42.153489,0 days 00:00:08.744323,tanh,0.5,2,0.8500000000000001,0.13279816508293152,,,PRUNED
969,969,0.14523491263389587,2023-01-04 19:56:42.261560,2023-01-04 19:57:32.261103,0 days 00:00:49.999543,relu,0.35000000000000003,2,0.8500000000000001,0.0935850739479065,0.06808187067508698,0.04270409792661667,COMPLETE
970,970,0.1572675257921219,2023-01-04 19:57:32.374635,2023-01-04 19:57:41.007183,0 days 00:00:08.632548,relu,0.35000000000000003,2,0.9,0.1572675257921219,,,PRUNED
971,971,0.05237026885151863,2023-01-04 19:57:41.310383,2023-01-04 19:58:17.528814,0 days 00:00:36.218431,sigmoid,0.05,2,0.6,0.07014154642820358,0.05237026885151863,,PRUNED
972,972,0.07827688008546829,2023-01-04 19:58:17.637511,2023-01-04 19:58:33.069007,0 days 00:00:15.431496,tanh,0.1,2,0.6,0.07827688008546829,,,PRUNED
973,973,0.07674050331115723,2023-01-04 19:58:33.178069,2023-01-04 19:58:48.759839,0 days 00:00:15.581770,relu,0.4,2,0.55,0.07674050331115723,,,PRUNED
974,974,0.07814247906208038,2023-01-04 19:58:48.867135,2023-01-04 19:59:04.750427,0 days 00:00:15.883292,tanh,0.4,2,0.5,0.07814247906208038,,,PRUNED
975,975,0.1487240046262741,2023-01-04 19:59:04.855473,2023-01-04 19:59:13.624750,0 days 00:00:08.769277,tanh,0.35000000000000003,2,0.8500000000000001,0.1487240046262741,,,PRUNED
976,976,0.08581851422786713,2023-01-04 19:59:13.732755,2023-01-04 19:59:29.573894,0 days 00:00:15.841139,relu,0.35000000000000003,2,0.8500000000000001,0.11977881193161011,0.08581851422786713,,PRUNED
977,977,0.07787706702947617,2023-01-04 19:59:29.696483,2023-01-04 19:59:45.263629,0 days 00:00:15.567146,relu,0.1,2,0.65,0.07787706702947617,,,PRUNED
978,978,0.13824807107448578,2023-01-04 19:59:45.379777,2023-01-04 19:59:54.355409,0 days 00:00:08.975632,sigmoid,0.35000000000000003,2,0.65,0.13824807107448578,,,PRUNED
979,979,0.0804985761642456,2023-01-04 19:59:54.462465,2023-01-04 20:00:10.212713,0 days 00:00:15.750248,tanh,0.35000000000000003,2,0.55,0.10810618102550507,0.0804985761642456,,PRUNED
980,980,0.07826394587755203,2023-01-04 20:00:10.335323,2023-01-04 20:00:25.955145,0 days 00:00:15.619822,tanh,0.45,2,0.6,0.07826394587755203,,,PRUNED
981,981,0.0792626142501831,2023-01-04 20:00:26.197503,2023-01-04 20:00:41.926261,0 days 00:00:15.728758,relu,0.1,2,0.65,0.0792626142501831,,,PRUNED
982,982,0.1288277506828308,2023-01-04 20:00:42.030750,2023-01-04 20:00:50.993267,0 days 00:00:08.962517,relu,0.30000000000000004,2,0.8500000000000001,0.1288277506828308,,,PRUNED
983,983,0.07742569595575333,2023-01-04 20:00:51.099922,2023-01-04 20:01:06.766784,0 days 00:00:15.666862,tanh,0.30000000000000004,2,0.6,0.07742569595575333,,,PRUNED
984,984,0.08801601082086563,2023-01-04 20:01:06.879073,2023-01-04 20:01:22.389555,0 days 00:00:15.510482,relu,0.25,2,0.55,0.08801601082086563,,,PRUNED
985,985,0.08868524432182312,2023-01-04 20:01:22.495695,2023-01-04 20:01:38.238352,0 days 00:00:15.742657,tanh,0.4,2,0.6,0.08868524432182312,,,PRUNED
986,986,0.12299371510744095,2023-01-04 20:01:38.346372,2023-01-04 20:01:47.204963,0 days 00:00:08.858591,tanh,0.35000000000000003,3,0.8500000000000001,0.12299371510744095,,,PRUNED
987,987,0.17307700216770172,2023-01-04 20:01:47.310460,2023-01-04 20:02:02.936493,0 days 00:00:15.626033,tanh,0.35000000000000003,2,1.0,0.11446960270404816,0.17307700216770172,,PRUNED
988,988,0.19148962199687958,2023-01-04 20:02:03.068679,2023-01-04 20:02:11.795157,0 days 00:00:08.726478,relu,0.35000000000000003,2,0.75,0.19148962199687958,,,PRUNED
989,989,0.12863066792488098,2023-01-04 20:02:11.899935,2023-01-04 20:02:20.952328,0 days 00:00:09.052393,sigmoid,0.4,2,0.7,0.12863066792488098,,,PRUNED
990,990,0.0844922736287117,2023-01-04 20:02:21.056904,2023-01-04 20:02:36.584121,0 days 00:00:15.527217,tanh,0.0,2,0.7,0.0844922736287117,,,PRUNED
991,991,0.1519121527671814,2023-01-04 20:02:36.690105,2023-01-04 20:02:45.442042,0 days 00:00:08.751937,tanh,0.35000000000000003,2,0.8500000000000001,0.1519121527671814,,,PRUNED
992,992,0.15173092484474182,2023-01-04 20:02:45.548468,2023-01-04 20:03:32.160668,0 days 00:00:46.612200,relu,0.1,2,0.5,0.06760270148515701,0.04326897859573364,,COMPLETE
993,993,0.08763173222541809,2023-01-04 20:03:32.284103,2023-01-04 20:03:48.120689,0 days 00:00:15.836586,tanh,0.05,2,0.6,0.08763173222541809,,,PRUNED
994,994,0.08214221894741058,2023-01-04 20:03:48.226217,2023-01-04 20:04:03.835696,0 days 00:00:15.609479,relu,0.1,2,0.65,0.08214221894741058,,,PRUNED
995,995,0.13051778078079224,2023-01-04 20:04:03.942860,2023-01-04 20:04:12.677658,0 days 00:00:08.734798,relu,0.35000000000000003,2,0.8500000000000001,0.13051778078079224,,,PRUNED
996,996,0.08321919292211533,2023-01-04 20:04:12.775361,2023-01-04 20:04:28.625488,0 days 00:00:15.850127,sigmoid,0.1,2,0.55,0.08321919292211533,,,PRUNED
997,997,0.1285620927810669,2023-01-04 20:04:28.732646,2023-01-04 20:04:37.433608,0 days 00:00:08.700962,tanh,0.35000000000000003,2,0.95,0.1285620927810669,,,PRUNED
998,998,0.14312991499900818,2023-01-04 20:04:37.550493,2023-01-04 20:05:31.007288,0 days 00:00:53.456795,tanh,0.30000000000000004,2,0.6,0.0651858001947403,0.04236123338341713,,COMPLETE
999,999,0.1527598351240158,2023-01-04 20:05:31.122126,2023-01-04 20:06:14.495584,0 days 00:00:43.373458,relu,0.4,2,0.5,0.09155429154634476,0.06043865904211998,0.0348978228867054,COMPLETE
1000,1000,0.047966424375772476,2023-01-04 20:06:14.629271,2023-01-04 20:06:50.956417,0 days 00:00:36.327146,relu,0.30000000000000004,2,0.6,0.06943874806165695,0.047966424375772476,,PRUNED
1001,1001,0.16523106396198273,2023-01-04 20:06:51.062504,2023-01-04 20:06:59.781862,0 days 00:00:08.719358,sigmoid,0.30000000000000004,2,0.8,0.16523106396198273,,,PRUNED
1002,1002,0.045797575265169144,2023-01-04 20:06:59.887749,2023-01-04 20:07:36.128083,0 days 00:00:36.240334,tanh,0.35000000000000003,2,0.9,0.10885635763406754,0.06248600035905838,0.045797575265169144,PRUNED
1003,1003,0.0906720981001854,2023-01-04 20:07:36.236006,2023-01-04 20:07:51.836095,0 days 00:00:15.600089,tanh,0.30000000000000004,2,0.6,0.0906720981001854,,,PRUNED
1004,1004,0.08551573753356934,2023-01-04 20:07:51.940151,2023-01-04 20:08:07.917266,0 days 00:00:15.977115,relu,0.30000000000000004,2,0.8500000000000001,0.1015673354268074,0.08551573753356934,,PRUNED
1005,1005,0.1269734501838684,2023-01-04 20:08:08.024267,2023-01-04 20:08:16.825158,0 days 00:00:08.800891,tanh,0.35000000000000003,2,0.8500000000000001,0.1269734501838684,,,PRUNED
1006,1006,0.07667671144008636,2023-01-04 20:08:16.932930,2023-01-04 20:08:32.465788,0 days 00:00:15.532858,tanh,0.30000000000000004,2,0.6,0.07667671144008636,,,PRUNED
1007,1007,0.16802673041820526,2023-01-04 20:08:32.572553,2023-01-04 20:08:41.448845,0 days 00:00:08.876292,relu,0.45,2,0.8500000000000001,0.16802673041820526,,,PRUNED
1008,1008,0.0735226646065712,2023-01-04 20:08:41.554075,2023-01-04 20:08:57.163667,0 days 00:00:15.609592,relu,0.30000000000000004,2,0.6,0.0735226646065712,,,PRUNED
1009,1009,0.07243227958679199,2023-01-04 20:08:57.270684,2023-01-04 20:09:12.878989,0 days 00:00:15.608305,tanh,0.30000000000000004,2,0.6,0.07243227958679199,,,PRUNED
1010,1010,0.08042996376752853,2023-01-04 20:09:12.994362,2023-01-04 20:09:28.652847,0 days 00:00:15.658485,relu,0.30000000000000004,2,0.65,0.08042996376752853,,,PRUNED
1011,1011,0.17574714124202728,2023-01-04 20:09:28.758691,2023-01-04 20:09:37.694831,0 days 00:00:08.936140,sigmoid,0.4,2,0.95,0.17574714124202728,,,PRUNED
1012,1012,0.1230585128068924,2023-01-04 20:09:37.800829,2023-01-04 20:09:46.651525,0 days 00:00:08.850696,tanh,0.35000000000000003,2,0.8500000000000001,0.1230585128068924,,,PRUNED
1013,1013,0.14504320919513702,2023-01-04 20:09:46.769595,2023-01-04 20:09:55.559934,0 days 00:00:08.790339,relu,0.45,2,0.8500000000000001,0.14504320919513702,,,PRUNED
1014,1014,0.17186219990253448,2023-01-04 20:09:55.676846,2023-01-04 20:10:04.542807,0 days 00:00:08.865961,tanh,0.30000000000000004,2,0.8,0.17186219990253448,,,PRUNED
1015,1015,0.0917913019657135,2023-01-04 20:10:04.660928,2023-01-04 20:10:20.558147,0 days 00:00:15.897219,relu,0.35000000000000003,2,0.8500000000000001,0.1032879576086998,0.0917913019657135,,PRUNED
1016,1016,0.1354467272758484,2023-01-04 20:10:20.683210,2023-01-04 20:10:29.348387,0 days 00:00:08.665177,tanh,0.4,2,0.9,0.1354467272758484,,,PRUNED
1017,1017,0.09012492001056671,2023-01-04 20:10:29.483257,2023-01-04 20:10:45.048085,0 days 00:00:15.564828,tanh,0.25,2,0.6,0.09012492001056671,,,PRUNED
1018,1018,0.12453881651163101,2023-01-04 20:10:45.164559,2023-01-04 20:10:53.730771,0 days 00:00:08.566212,sigmoid,0.5,2,1.0,0.12453881651163101,,,PRUNED
1019,1019,0.1396254152059555,2023-01-04 20:10:53.848397,2023-01-04 20:11:03.004349,0 days 00:00:09.155952,relu,0.25,2,0.7,0.1396254152059555,,,PRUNED
1020,1020,0.1770453304052353,2023-01-04 20:11:03.122825,2023-01-04 20:11:12.387793,0 days 00:00:09.264968,tanh,0.35000000000000003,6,0.8500000000000001,0.1770453304052353,,,PRUNED
1021,1021,0.1380957067012787,2023-01-04 20:11:12.506195,2023-01-04 20:11:21.288426,0 days 00:00:08.782231,relu,0.30000000000000004,2,0.8500000000000001,0.1380957067012787,,,PRUNED
1022,1022,0.15567129850387573,2023-01-04 20:11:21.388479,2023-01-04 20:11:30.286393,0 days 00:00:08.897914,tanh,0.45,2,0.8500000000000001,0.15567129850387573,,,PRUNED
1023,1023,0.1409827172756195,2023-01-04 20:11:30.404454,2023-01-04 20:12:17.027649,0 days 00:00:46.623195,relu,0.05,2,0.6,0.06729702651500702,0.038947634398937225,,COMPLETE
