,number,value,datetime_start,datetime_complete,duration,params_activation,params_dropout,params_layers,params_shrink,system_attrs_completed_rung_0,system_attrs_completed_rung_1,system_attrs_completed_rung_2,state
2980,2980,0.08187045156955719,2023-01-05 08:10:08.710800,2023-01-05 08:10:24.453617,0 days 00:00:15.742817,tanh,0.4,2,0.6,0.10896631330251694,0.08187045156955719,,PRUNED
2981,2981,0.08667012304067612,2023-01-05 08:10:24.557578,2023-01-05 08:10:40.254725,0 days 00:00:15.697147,sigmoid,0.35000000000000003,2,0.6,0.08667012304067612,,,PRUNED
2982,2982,0.11734697222709656,2023-01-05 08:10:40.365693,2023-01-05 08:10:49.177713,0 days 00:00:08.812020,relu,0.30000000000000004,2,0.7,0.11734697222709656,,,PRUNED
2983,2983,0.14560618996620178,2023-01-05 08:10:49.283813,2023-01-05 08:10:58.052026,0 days 00:00:08.768213,tanh,0.30000000000000004,2,0.8500000000000001,0.14560618996620178,,,PRUNED
2984,2984,0.11790091544389725,2023-01-05 08:10:58.172888,2023-01-05 08:11:07.150834,0 days 00:00:08.977946,tanh,0.30000000000000004,2,0.65,0.11790091544389725,,,PRUNED
2985,2985,0.16437524557113647,2023-01-05 08:11:07.282998,2023-01-05 08:11:50.135515,0 days 00:00:42.852517,tanh,0.2,2,0.6,0.04802916198968887,,,COMPLETE
2986,2986,0.14177143573760986,2023-01-05 08:11:50.265142,2023-01-05 08:12:40.142991,0 days 00:00:49.877849,sigmoid,0.35000000000000003,2,0.6,0.06038415804505348,0.040251120924949646,,COMPLETE
2987,2987,0.21849043667316437,2023-01-05 08:12:40.279793,2023-01-05 08:12:48.921056,0 days 00:00:08.641263,relu,0.25,2,0.6,0.21849043667316437,,,PRUNED
2988,2988,0.08331861346960068,2023-01-05 08:12:49.039098,2023-01-05 08:13:04.816243,0 days 00:00:15.777145,relu,0.35000000000000003,2,0.6,0.08331861346960068,,,PRUNED
2989,2989,0.04732232168316841,2023-01-05 08:13:04.931538,2023-01-05 08:13:40.971784,0 days 00:00:36.040246,sigmoid,0.35000000000000003,2,0.6,0.07310368120670319,0.04732232168316841,,PRUNED
2990,2990,0.1548103541135788,2023-01-05 08:13:41.095461,2023-01-05 08:14:31.061773,0 days 00:00:49.966312,tanh,0.25,2,0.5,0.04726092889904976,,,COMPLETE
2991,2991,0.06558475643396378,2023-01-05 08:14:31.195234,2023-01-05 08:14:46.784794,0 days 00:00:15.589560,tanh,0.5,2,0.5,0.10606275498867035,0.06558475643396378,,PRUNED
2992,2992,0.11698249727487564,2023-01-05 08:14:46.899915,2023-01-05 08:15:02.749812,0 days 00:00:15.849897,relu,0.1,2,0.55,0.10703114420175552,0.11698249727487564,,PRUNED
2993,2993,0.15352191030979156,2023-01-05 08:15:02.863104,2023-01-05 08:15:45.809999,0 days 00:00:42.946895,sigmoid,0.35000000000000003,2,0.6,0.06788409501314163,0.04453020170331001,,COMPLETE
2994,2994,0.1621236503124237,2023-01-05 08:15:45.946768,2023-01-05 08:16:28.713667,0 days 00:00:42.766899,tanh,0.2,2,0.6,0.04770192503929138,,,COMPLETE
2995,2995,0.14508259296417236,2023-01-05 08:16:28.844485,2023-01-05 08:16:37.800809,0 days 00:00:08.956324,tanh,0.35000000000000003,2,0.65,0.14508259296417236,,,PRUNED
2996,2996,0.11472456902265549,2023-01-05 08:16:37.920928,2023-01-05 08:16:46.675115,0 days 00:00:08.754187,relu,0.15000000000000002,2,0.8500000000000001,0.11472456902265549,,,PRUNED
2997,2997,0.06103168800473213,2023-01-05 08:16:46.797758,2023-01-05 08:17:23.270300,0 days 00:00:36.472542,tanh,0.15000000000000002,4,0.5,0.06103168800473213,,,PRUNED
2998,2998,0.086299829185009,2023-01-05 08:17:23.385448,2023-01-05 08:17:38.929811,0 days 00:00:15.544363,sigmoid,0.35000000000000003,2,0.6,0.086299829185009,,,PRUNED
2999,2999,0.1538524329662323,2023-01-05 08:17:39.050050,2023-01-05 08:18:28.720461,0 days 00:00:49.670411,tanh,0.1,2,0.5,0.04670806974172592,,,COMPLETE
3000,3000,0.13027288019657135,2023-01-05 08:18:29.042385,2023-01-05 08:18:37.823876,0 days 00:00:08.781491,tanh,0.4,2,0.7,0.13027288019657135,,,PRUNED
3001,3001,0.0810578316450119,2023-01-05 08:18:37.947150,2023-01-05 08:18:53.522277,0 days 00:00:15.575127,relu,0.45,2,0.9,0.10449427366256714,0.0810578316450119,,PRUNED
3002,3002,0.15269224345684052,2023-01-05 08:18:53.644710,2023-01-05 08:19:36.751506,0 days 00:00:43.106796,sigmoid,0.35000000000000003,2,0.6,0.06595871597528458,0.045602209866046906,,COMPLETE
3003,3003,0.09051153808832169,2023-01-05 08:19:36.879973,2023-01-05 08:19:52.359788,0 days 00:00:15.479815,relu,0.35000000000000003,2,0.6,0.09051153808832169,,,PRUNED
3004,3004,0.12989084422588348,2023-01-05 08:19:52.483924,2023-01-05 08:20:01.343432,0 days 00:00:08.859508,tanh,0.35000000000000003,2,0.6,0.12989084422588348,,,PRUNED
3005,3005,0.054177965968847275,2023-01-05 08:20:01.475629,2023-01-05 08:20:37.356175,0 days 00:00:35.880546,tanh,0.2,2,0.5,0.054177965968847275,,,PRUNED
3006,3006,0.04710967093706131,2023-01-05 08:20:37.470943,2023-01-05 08:21:13.603523,0 days 00:00:36.132580,sigmoid,0.35000000000000003,2,0.6,0.0745600014925003,0.04710967093706131,,PRUNED
3007,3007,0.11209433525800705,2023-01-05 08:21:13.716635,2023-01-05 08:21:22.478834,0 days 00:00:08.762199,tanh,0.05,2,0.8,0.11209433525800705,,,PRUNED
3008,3008,0.11221933364868164,2023-01-05 08:21:22.602464,2023-01-05 08:21:31.428144,0 days 00:00:08.825680,relu,0.0,2,0.55,0.11221933364868164,,,PRUNED
3009,3009,0.04923145845532417,2023-01-05 08:21:31.552783,2023-01-05 08:22:07.882663,0 days 00:00:36.329880,sigmoid,0.35000000000000003,2,0.6,0.0748976469039917,0.04923145845532417,,PRUNED
3010,3010,0.18710851669311523,2023-01-05 08:22:07.994963,2023-01-05 08:22:16.774636,0 days 00:00:08.779673,tanh,0.4,2,0.8500000000000001,0.18710851669311523,,,PRUNED
3011,3011,0.1498045176267624,2023-01-05 08:22:16.894354,2023-01-05 08:22:25.856705,0 days 00:00:08.962351,relu,0.2,2,0.6,0.1498045176267624,,,PRUNED
3012,3012,0.21483580768108368,2023-01-05 08:22:25.976813,2023-01-05 08:22:35.256281,0 days 00:00:09.279468,tanh,0.5,7,0.6,0.21483580768108368,,,PRUNED
3013,3013,0.18269997835159302,2023-01-05 08:22:35.380181,2023-01-05 08:22:44.289343,0 days 00:00:08.909162,relu,0.1,2,0.5,0.18269997835159302,,,PRUNED
3014,3014,0.1488843709230423,2023-01-05 08:22:44.401480,2023-01-05 08:22:53.180169,0 days 00:00:08.778689,tanh,0.30000000000000004,2,0.7,0.1488843709230423,,,PRUNED
3015,3015,0.14633750915527344,2023-01-05 08:22:53.302794,2023-01-05 08:23:43.038827,0 days 00:00:49.736033,tanh,0.2,2,0.6,0.04573598504066467,,,COMPLETE
3016,3016,0.10189966857433319,2023-01-05 08:23:43.358296,2023-01-05 08:23:59.049078,0 days 00:00:15.690782,relu,0.25,2,0.65,0.09873607009649277,0.10189966857433319,,PRUNED
3017,3017,0.051608938723802567,2023-01-05 08:23:59.156047,2023-01-05 08:24:35.187951,0 days 00:00:36.031904,sigmoid,0.35000000000000003,2,0.6,0.058967527002096176,0.051608938723802567,,PRUNED
3018,3018,0.15405972301959991,2023-01-05 08:24:35.303255,2023-01-05 08:24:44.170995,0 days 00:00:08.867740,tanh,0.30000000000000004,2,0.75,0.15405972301959991,,,PRUNED
3019,3019,0.14714445173740387,2023-01-05 08:24:44.295224,2023-01-05 08:25:30.664853,0 days 00:00:46.369629,tanh,0.2,2,0.5,0.042415015399456024,,,COMPLETE
3020,3020,0.13044600188732147,2023-01-05 08:25:30.803653,2023-01-05 08:25:39.683984,0 days 00:00:08.880331,sigmoid,0.35000000000000003,2,0.95,0.13044600188732147,,,PRUNED
3021,3021,0.15606454014778137,2023-01-05 08:25:39.805609,2023-01-05 08:26:26.010581,0 days 00:00:46.204972,tanh,0.1,2,0.5,0.044926706701517105,,,COMPLETE
3022,3022,0.11730462312698364,2023-01-05 08:26:26.145697,2023-01-05 08:26:34.979711,0 days 00:00:08.834014,tanh,0.1,2,0.55,0.11730462312698364,,,PRUNED
3023,3023,0.06951640546321869,2023-01-05 08:26:35.101342,2023-01-05 08:26:50.835612,0 days 00:00:15.734270,relu,0.4,2,0.6,0.10254999995231628,0.06951640546321869,,PRUNED
3024,3024,0.07800348103046417,2023-01-05 08:26:50.942782,2023-01-05 08:27:06.592972,0 days 00:00:15.650190,sigmoid,0.35000000000000003,2,0.6,0.07800348103046417,,,PRUNED
3025,3025,0.1556953489780426,2023-01-05 08:27:06.707261,2023-01-05 08:27:49.538468,0 days 00:00:42.831207,tanh,0.15000000000000002,2,0.6,0.04594799503684044,,,COMPLETE
3026,3026,0.16305629909038544,2023-01-05 08:27:49.679021,2023-01-05 08:28:32.449819,0 days 00:00:42.770798,tanh,0.25,2,0.5,0.050586894154548645,,,COMPLETE
3027,3027,0.18950405716896057,2023-01-05 08:28:32.589617,2023-01-05 08:28:41.561608,0 days 00:00:08.971991,tanh,0.15000000000000002,3,0.8500000000000001,0.18950405716896057,,,PRUNED
3028,3028,0.15285009145736694,2023-01-05 08:28:41.684258,2023-01-05 08:28:50.510914,0 days 00:00:08.826656,relu,0.5,2,0.65,0.15285009145736694,,,PRUNED
3029,3029,0.07827547192573547,2023-01-05 08:28:50.622917,2023-01-05 08:29:06.342028,0 days 00:00:15.719111,relu,0.35000000000000003,2,0.6,0.07827547192573547,,,PRUNED
3030,3030,0.15383726358413696,2023-01-05 08:29:06.444371,2023-01-05 08:29:56.068924,0 days 00:00:49.624553,tanh,0.2,2,0.5,0.04732457175850868,,,COMPLETE
3031,3031,0.1348363757133484,2023-01-05 08:29:56.198536,2023-01-05 08:30:04.913504,0 days 00:00:08.714968,tanh,0.30000000000000004,2,0.9,0.1348363757133484,,,PRUNED
3032,3032,0.0612170472741127,2023-01-05 08:30:05.031649,2023-01-05 08:30:20.861497,0 days 00:00:15.829848,relu,0.35000000000000003,2,0.7,0.10948791354894638,0.0612170472741127,,PRUNED
3033,3033,0.15975646674633026,2023-01-05 08:30:20.976914,2023-01-05 08:31:10.745921,0 days 00:00:49.769007,tanh,0.1,2,0.5,0.0485580749809742,,,COMPLETE
3034,3034,0.1504160463809967,2023-01-05 08:31:10.885432,2023-01-05 08:31:54.133247,0 days 00:00:43.247815,sigmoid,0.35000000000000003,2,0.55,0.06163481995463371,0.04336216300725937,,COMPLETE
3035,3035,0.25640714168548584,2023-01-05 08:31:54.263212,2023-01-05 08:32:10.319492,0 days 00:00:16.056280,sigmoid,0.35000000000000003,7,0.6,0.25640714168548584,,,PRUNED
3036,3036,0.15785442292690277,2023-01-05 08:32:10.414225,2023-01-05 08:32:19.186472,0 days 00:00:08.772247,tanh,0.45,2,0.6,0.15785442292690277,,,PRUNED
3037,3037,0.05446414276957512,2023-01-05 08:32:19.484575,2023-01-05 08:32:55.465676,0 days 00:00:35.981101,tanh,0.15000000000000002,2,0.6,0.05446414276957512,,,PRUNED
3038,3038,0.08778674155473709,2023-01-05 08:32:55.588346,2023-01-05 08:33:11.289784,0 days 00:00:15.701438,sigmoid,0.35000000000000003,3,0.6,0.08778674155473709,,,PRUNED
3039,3039,0.1495366394519806,2023-01-05 08:33:11.385122,2023-01-05 08:33:20.290090,0 days 00:00:08.904968,relu,0.1,2,0.8500000000000001,0.1495366394519806,,,PRUNED
3040,3040,0.15221336483955383,2023-01-05 08:33:20.405701,2023-01-05 08:34:07.891598,0 days 00:00:47.485897,tanh,0.2,2,0.5,0.04492569342255592,,,COMPLETE
3041,3041,0.13162153959274292,2023-01-05 08:34:08.019779,2023-01-05 08:34:16.952381,0 days 00:00:08.932602,tanh,0.30000000000000004,2,0.6,0.13162153959274292,,,PRUNED
3042,3042,0.15439149737358093,2023-01-05 08:34:17.062386,2023-01-05 08:34:25.885026,0 days 00:00:08.822640,tanh,0.05,2,0.65,0.15439149737358093,,,PRUNED
3043,3043,0.0861249640583992,2023-01-05 08:34:25.996029,2023-01-05 08:34:41.499487,0 days 00:00:15.503458,sigmoid,0.35000000000000003,2,0.6,0.0861249640583992,,,PRUNED
3044,3044,0.04775364696979523,2023-01-05 08:34:41.612490,2023-01-05 08:35:17.905012,0 days 00:00:36.292522,relu,0.30000000000000004,2,0.55,0.06378874182701111,0.04775364696979523,,PRUNED
3045,3045,0.09178097546100616,2023-01-05 08:35:18.021076,2023-01-05 08:35:33.637133,0 days 00:00:15.616057,relu,0.25,2,0.7,0.09744758158922195,0.09178097546100616,,PRUNED
3046,3046,0.1799134910106659,2023-01-05 08:35:33.740800,2023-01-05 08:35:42.654099,0 days 00:00:08.913299,tanh,0.5,2,0.8500000000000001,0.1799134910106659,,,PRUNED
3047,3047,0.14541374146938324,2023-01-05 08:35:42.767108,2023-01-05 08:35:51.578412,0 days 00:00:08.811304,relu,0.35000000000000003,2,0.5,0.14541374146938324,,,PRUNED
3048,3048,0.1462353765964508,2023-01-05 08:35:51.690419,2023-01-05 08:36:41.495275,0 days 00:00:49.804856,sigmoid,0.30000000000000004,2,0.7,0.06452371925115585,0.041573792695999146,,COMPLETE
3049,3049,0.1437520533800125,2023-01-05 08:36:41.624578,2023-01-05 08:37:31.163567,0 days 00:00:49.538989,tanh,0.2,2,0.6,0.0433560386300087,,,COMPLETE
3050,3050,0.0487373024225235,2023-01-05 08:37:31.287412,2023-01-05 08:38:07.508654,0 days 00:00:36.221242,sigmoid,0.35000000000000003,2,0.6,0.06717830151319504,0.0487373024225235,,PRUNED
3051,3051,0.11529693007469177,2023-01-05 08:38:07.610734,2023-01-05 08:38:16.375677,0 days 00:00:08.764943,tanh,0.4,2,0.6,0.11529693007469177,,,PRUNED
3052,3052,0.14622081816196442,2023-01-05 08:38:16.489682,2023-01-05 08:38:59.618072,0 days 00:00:43.128390,sigmoid,0.35000000000000003,2,0.6,0.06122904270887375,0.04135088995099068,,COMPLETE
3053,3053,0.06253257393836975,2023-01-05 08:38:59.746243,2023-01-05 08:39:15.320017,0 days 00:00:15.573774,relu,0.1,2,0.55,0.09821874648332596,0.06253257393836975,,PRUNED
3054,3054,0.1507861316204071,2023-01-05 08:39:15.433019,2023-01-05 08:40:01.849598,0 days 00:00:46.416579,sigmoid,0.5,2,0.6,0.07420530915260315,0.044420238584280014,,COMPLETE
3055,3055,0.14625510573387146,2023-01-05 08:40:01.975767,2023-01-05 08:40:11.133375,0 days 00:00:09.157608,tanh,0.45,4,0.8500000000000001,0.14625510573387146,,,PRUNED
3056,3056,0.07957448810338974,2023-01-05 08:40:11.246379,2023-01-05 08:40:26.764792,0 days 00:00:15.518413,relu,0.35000000000000003,2,0.55,0.07957448810338974,,,PRUNED
3057,3057,0.1244097426533699,2023-01-05 08:40:26.878507,2023-01-05 08:40:35.806470,0 days 00:00:08.927963,relu,0.30000000000000004,2,0.8,0.1244097426533699,,,PRUNED
3058,3058,0.14535680413246155,2023-01-05 08:40:35.926805,2023-01-05 08:41:32.388610,0 days 00:00:56.461805,tanh,0.1,2,0.6,0.0447382852435112,,,COMPLETE
3059,3059,0.14894913136959076,2023-01-05 08:41:32.516720,2023-01-05 08:41:41.459732,0 days 00:00:08.943012,tanh,0.30000000000000004,2,0.65,0.14894913136959076,,,PRUNED
3060,3060,0.11468710750341415,2023-01-05 08:41:41.565405,2023-01-05 08:41:50.400709,0 days 00:00:08.835304,tanh,0.35000000000000003,2,0.75,0.11468710750341415,,,PRUNED
3061,3061,0.17487139999866486,2023-01-05 08:41:50.510936,2023-01-05 08:42:26.498765,0 days 00:00:35.987829,tanh,0.1,2,0.6,0.04764924198389053,,,COMPLETE
3062,3062,0.1239761933684349,2023-01-05 08:42:26.636494,2023-01-05 08:42:35.597237,0 days 00:00:08.960743,relu,0.05,2,0.6,0.1239761933684349,,,PRUNED
3063,3063,0.12038981914520264,2023-01-05 08:42:35.713818,2023-01-05 08:42:44.488132,0 days 00:00:08.774314,sigmoid,0.0,2,0.7,0.12038981914520264,,,PRUNED
3064,3064,0.11719211935997009,2023-01-05 08:42:44.623001,2023-01-05 08:42:53.570929,0 days 00:00:08.947928,tanh,0.2,2,0.9,0.11719211935997009,,,PRUNED
3065,3065,0.08240561932325363,2023-01-05 08:42:53.675498,2023-01-05 08:43:09.418610,0 days 00:00:15.743112,relu,0.4,2,0.6,0.0923062115907669,0.08240561932325363,,PRUNED
3066,3066,0.09375417232513428,2023-01-05 08:43:09.538852,2023-01-05 08:43:25.234061,0 days 00:00:15.695209,sigmoid,0.30000000000000004,2,0.95,0.09375417232513428,,,PRUNED
3067,3067,0.11396276205778122,2023-01-05 08:43:25.348059,2023-01-05 08:43:34.142402,0 days 00:00:08.794343,tanh,0.5,2,0.65,0.11396276205778122,,,PRUNED
3068,3068,0.06054629012942314,2023-01-05 08:43:34.243478,2023-01-05 08:43:50.098811,0 days 00:00:15.855333,relu,0.25,2,0.5,0.1082054078578949,0.06054629012942314,,PRUNED
3069,3069,0.09085173159837723,2023-01-05 08:43:50.203727,2023-01-05 08:44:05.815972,0 days 00:00:15.612245,sigmoid,0.5,2,0.6,0.09085173159837723,,,PRUNED
3070,3070,0.128060445189476,2023-01-05 08:44:05.927265,2023-01-05 08:44:14.698107,0 days 00:00:08.770842,tanh,0.35000000000000003,2,0.8500000000000001,0.128060445189476,,,PRUNED
3071,3071,0.14988282322883606,2023-01-05 08:44:14.808906,2023-01-05 08:44:23.872192,0 days 00:00:09.063286,relu,0.30000000000000004,3,0.6,0.14988282322883606,,,PRUNED
3072,3072,0.198705792427063,2023-01-05 08:44:23.988332,2023-01-05 08:44:32.779845,0 days 00:00:08.791513,tanh,0.1,2,0.55,0.198705792427063,,,PRUNED
3073,3073,0.1563582718372345,2023-01-05 08:44:32.908513,2023-01-05 08:44:41.812480,0 days 00:00:08.903967,tanh,0.4,2,0.95,0.1563582718372345,,,PRUNED
3074,3074,0.08606591820716858,2023-01-05 08:44:41.909596,2023-01-05 08:44:57.460274,0 days 00:00:15.550678,sigmoid,0.30000000000000004,2,0.7,0.08606591820716858,,,PRUNED
3075,3075,0.04608936607837677,2023-01-05 08:44:57.564942,2023-01-05 08:45:33.615813,0 days 00:00:36.050871,sigmoid,0.35000000000000003,2,0.7,0.06425205618143082,0.04608936607837677,,PRUNED
3076,3076,0.20263266563415527,2023-01-05 08:45:33.726824,2023-01-05 08:45:42.584618,0 days 00:00:08.857794,relu,0.35000000000000003,2,0.65,0.20263266563415527,,,PRUNED
3077,3077,0.07926775515079498,2023-01-05 08:45:42.686467,2023-01-05 08:45:58.238921,0 days 00:00:15.552454,relu,0.5,2,0.6,0.07926775515079498,,,PRUNED
3078,3078,0.14893369376659393,2023-01-05 08:45:58.343592,2023-01-05 08:46:41.757412,0 days 00:00:43.413820,tanh,0.30000000000000004,2,0.6,0.10491117089986801,0.05940312147140503,0.04230446368455887,COMPLETE
3079,3079,0.14946109056472778,2023-01-05 08:46:41.888579,2023-01-05 08:46:50.628053,0 days 00:00:08.739474,relu,0.45,2,0.7,0.14946109056472778,,,PRUNED
3080,3080,0.0948934257030487,2023-01-05 08:46:50.761439,2023-01-05 08:47:06.383673,0 days 00:00:15.622234,sigmoid,0.30000000000000004,2,0.7,0.0948934257030487,,,PRUNED
3081,3081,0.1617000699043274,2023-01-05 08:47:06.496463,2023-01-05 08:47:15.308985,0 days 00:00:08.812522,tanh,0.30000000000000004,2,0.8500000000000001,0.1617000699043274,,,PRUNED
3082,3082,0.14669927954673767,2023-01-05 08:47:15.411657,2023-01-05 08:48:01.560594,0 days 00:00:46.148937,tanh,0.1,2,0.6,0.04221624508500099,,,COMPLETE
3083,3083,0.1085483729839325,2023-01-05 08:48:01.686341,2023-01-05 08:48:17.461526,0 days 00:00:15.775185,sigmoid,0.35000000000000003,2,0.55,0.1085483729839325,,,PRUNED
3084,3084,0.12312085181474686,2023-01-05 08:48:17.576903,2023-01-05 08:48:26.370169,0 days 00:00:08.793266,relu,0.5,2,0.8500000000000001,0.12312085181474686,,,PRUNED
3085,3085,0.14829358458518982,2023-01-05 08:48:26.465508,2023-01-05 08:48:35.345110,0 days 00:00:08.879602,tanh,0.35000000000000003,2,0.8,0.14829358458518982,,,PRUNED
3086,3086,0.15934708714485168,2023-01-05 08:48:35.458480,2023-01-05 08:48:44.252122,0 days 00:00:08.793642,relu,0.1,2,0.7,0.15934708714485168,,,PRUNED
3087,3087,0.07854501903057098,2023-01-05 08:48:44.364801,2023-01-05 08:49:00.082563,0 days 00:00:15.717762,sigmoid,0.5,2,0.7,0.07854501903057098,,,PRUNED
3088,3088,0.1494261771440506,2023-01-05 08:49:00.195233,2023-01-05 08:49:46.533837,0 days 00:00:46.338604,tanh,0.15000000000000002,2,1.0,0.10148632526397705,0.056097522377967834,0.04314581677317619,COMPLETE
3089,3089,0.14592121541500092,2023-01-05 08:49:46.675413,2023-01-05 08:50:42.980485,0 days 00:00:56.305072,sigmoid,0.35000000000000003,2,0.7,0.07535836845636368,0.044193241745233536,,COMPLETE
3090,3090,0.08433756977319717,2023-01-05 08:50:43.111786,2023-01-05 08:50:58.807412,0 days 00:00:15.695626,relu,0.30000000000000004,2,0.7,0.08433756977319717,,,PRUNED
3091,3091,0.0757332369685173,2023-01-05 08:50:58.911010,2023-01-05 08:51:14.564664,0 days 00:00:15.653654,sigmoid,0.5,3,0.95,0.0757332369685173,,,PRUNED
3092,3092,0.052431512624025345,2023-01-05 08:51:14.689675,2023-01-05 08:51:50.853402,0 days 00:00:36.163727,tanh,0.1,2,0.6,0.052431512624025345,,,PRUNED
3093,3093,0.3504819869995117,2023-01-05 08:51:50.981199,2023-01-05 08:52:00.230096,0 days 00:00:09.248897,tanh,0.0,6,0.6,0.3504819869995117,,,PRUNED
3094,3094,0.1575307697057724,2023-01-05 08:52:00.351024,2023-01-05 08:52:09.378252,0 days 00:00:09.027228,relu,0.1,2,0.5,0.1575307697057724,,,PRUNED
3095,3095,0.13348272442817688,2023-01-05 08:52:09.513871,2023-01-05 08:52:18.303289,0 days 00:00:08.789418,tanh,0.35000000000000003,2,0.9,0.13348272442817688,,,PRUNED
3096,3096,0.05437088385224342,2023-01-05 08:52:18.425459,2023-01-05 08:52:54.623449,0 days 00:00:36.197990,tanh,0.1,2,0.6,0.05437088385224342,,,PRUNED
3097,3097,0.0764361172914505,2023-01-05 08:52:54.735744,2023-01-05 08:53:10.455595,0 days 00:00:15.719851,relu,0.30000000000000004,2,0.6,0.10392595082521439,0.0764361172914505,,PRUNED
3098,3098,0.18546609580516815,2023-01-05 08:53:10.562909,2023-01-05 08:53:19.383323,0 days 00:00:08.820414,tanh,0.4,2,0.7,0.18546609580516815,,,PRUNED
3099,3099,0.0773196667432785,2023-01-05 08:53:19.501246,2023-01-05 08:53:35.262468,0 days 00:00:15.761222,sigmoid,0.35000000000000003,2,0.6,0.0773196667432785,,,PRUNED
3100,3100,0.155920147895813,2023-01-05 08:53:35.376030,2023-01-05 08:53:44.204456,0 days 00:00:08.828426,relu,0.5,2,0.75,0.155920147895813,,,PRUNED
3101,3101,0.155886709690094,2023-01-05 08:53:44.315945,2023-01-05 08:54:30.935001,0 days 00:00:46.619056,tanh,0.1,2,0.6,0.04670447111129761,,,COMPLETE
3102,3102,0.05148623511195183,2023-01-05 08:54:31.076421,2023-01-05 08:55:07.013281,0 days 00:00:35.936860,sigmoid,0.35000000000000003,2,0.7,0.07344359904527664,0.05148623511195183,,PRUNED
3103,3103,0.07420326769351959,2023-01-05 08:55:07.138626,2023-01-05 08:55:22.970387,0 days 00:00:15.831761,tanh,0.05,2,0.65,0.09668728709220886,0.07420326769351959,,PRUNED
3104,3104,0.04904970899224281,2023-01-05 08:55:23.074713,2023-01-05 08:55:59.309177,0 days 00:00:36.234464,sigmoid,0.30000000000000004,2,0.5,0.06811382621526718,0.04904970899224281,,PRUNED
3105,3105,0.08243699371814728,2023-01-05 08:55:59.414050,2023-01-05 08:56:15.116713,0 days 00:00:15.702663,relu,0.5,2,0.55,0.08243699371814728,,,PRUNED
3106,3106,0.14829885959625244,2023-01-05 08:56:15.239702,2023-01-05 08:57:01.797955,0 days 00:00:46.558253,sigmoid,0.30000000000000004,2,0.6,0.07240196317434311,0.041086968034505844,,COMPLETE
3107,3107,0.048422787338495255,2023-01-05 08:57:01.954447,2023-01-05 08:57:37.876651,0 days 00:00:35.922204,sigmoid,0.35000000000000003,2,0.7,0.06977951526641846,0.048422787338495255,,PRUNED
3108,3108,0.156791090965271,2023-01-05 08:57:37.982664,2023-01-05 08:58:27.937718,0 days 00:00:49.955054,tanh,0.1,2,0.6,0.049052998423576355,,,COMPLETE
3109,3109,0.061245404183864594,2023-01-05 08:58:28.074802,2023-01-05 08:58:43.696572,0 days 00:00:15.621770,relu,0.30000000000000004,2,0.55,0.10557708889245987,0.061245404183864594,,PRUNED
