,number,value,datetime_start,datetime_complete,duration,params_activation,params_dropout,params_layers,params_shrink,system_attrs_completed_rung_0,system_attrs_completed_rung_1,system_attrs_completed_rung_2,state
1151,1151,0.14372828602790833,2023-01-04 20:50:03.227140,2023-01-04 20:50:11.885627,0 days 00:00:08.658487,tanh,0.5,2,0.8500000000000001,0.14372828602790833,,,PRUNED
1152,1152,0.15079472959041595,2023-01-04 20:50:12.009794,2023-01-04 20:50:55.523337,0 days 00:00:43.513543,relu,0.35000000000000003,2,0.7,0.1009204313158989,0.06269579380750656,0.04026868939399719,COMPLETE
1153,1153,0.07156296819448471,2023-01-04 20:50:55.672748,2023-01-04 20:51:11.448434,0 days 00:00:15.775686,tanh,0.5,2,0.8500000000000001,0.10640186816453934,0.07156296819448471,,PRUNED
1154,1154,0.07322902977466583,2023-01-04 20:51:11.565479,2023-01-04 20:51:27.121639,0 days 00:00:15.556160,relu,0.30000000000000004,2,0.8500000000000001,0.07322902977466583,,,PRUNED
1155,1155,0.07552991062402725,2023-01-04 20:51:27.269785,2023-01-04 20:51:42.845375,0 days 00:00:15.575590,tanh,0.0,2,0.5,0.07552991062402725,,,PRUNED
1156,1156,0.08027723431587219,2023-01-04 20:51:42.982327,2023-01-04 20:51:58.702651,0 days 00:00:15.720324,relu,0.1,3,0.65,0.08027723431587219,,,PRUNED
1157,1157,0.14927318692207336,2023-01-04 20:51:58.845290,2023-01-04 20:52:42.501954,0 days 00:00:43.656664,tanh,0.1,2,0.6,0.06550382077693939,0.04327528923749924,,COMPLETE
1158,1158,0.04795018211007118,2023-01-04 20:52:42.645663,2023-01-04 20:53:18.837740,0 days 00:00:36.192077,relu,0.45,2,0.9,0.11238453537225723,0.06749121844768524,0.04795018211007118,PRUNED
1159,1159,0.04564287140965462,2023-01-04 20:53:18.973076,2023-01-04 20:53:55.360037,0 days 00:00:36.386961,tanh,0.30000000000000004,2,0.6,0.10172055661678314,0.0623733215034008,0.04564287140965462,PRUNED
1160,1160,0.04713859036564827,2023-01-04 20:53:55.496322,2023-01-04 20:54:31.999150,0 days 00:00:36.502828,sigmoid,0.5,2,0.8500000000000001,0.11701782792806625,0.06036357209086418,0.04713859036564827,PRUNED
1161,1161,0.16104868054389954,2023-01-04 20:54:32.117560,2023-01-04 20:54:40.924165,0 days 00:00:08.806605,relu,0.15000000000000002,2,0.8,0.16104868054389954,,,PRUNED
1162,1162,0.13852058351039886,2023-01-04 20:54:41.044331,2023-01-04 20:54:50.047586,0 days 00:00:09.003255,tanh,0.35000000000000003,4,0.8500000000000001,0.13852058351039886,,,PRUNED
1163,1163,0.1524532437324524,2023-01-04 20:54:50.174527,2023-01-04 20:55:33.615602,0 days 00:00:43.441075,sigmoid,0.30000000000000004,2,0.55,0.06134527921676636,0.04393858090043068,,COMPLETE
1164,1164,0.13102836906909943,2023-01-04 20:55:33.866782,2023-01-04 20:55:42.952537,0 days 00:00:09.085755,relu,0.5,2,0.8500000000000001,0.13102836906909943,,,PRUNED
1165,1165,0.14328283071517944,2023-01-04 20:55:43.076452,2023-01-04 20:55:51.885494,0 days 00:00:08.809042,tanh,0.5,2,0.8500000000000001,0.14328283071517944,,,PRUNED
1166,1166,0.13437272608280182,2023-01-04 20:55:52.004189,2023-01-04 20:56:00.734814,0 days 00:00:08.730625,sigmoid,0.25,2,1.0,0.13437272608280182,,,PRUNED
1167,1167,0.045378170907497406,2023-01-04 20:56:00.853530,2023-01-04 20:56:37.239396,0 days 00:00:36.385866,relu,0.35000000000000003,2,0.6,0.07111922651529312,0.045378170907497406,,PRUNED
1168,1168,0.07969030737876892,2023-01-04 20:56:37.570760,2023-01-04 20:56:53.197113,0 days 00:00:15.626353,tanh,0.15000000000000002,2,0.6,0.07969030737876892,,,PRUNED
1169,1169,0.08928214013576508,2023-01-04 20:56:53.333214,2023-01-04 20:57:08.978991,0 days 00:00:15.645777,relu,0.05,2,0.65,0.08928214013576508,,,PRUNED
1170,1170,0.09115349501371384,2023-01-04 20:57:09.114506,2023-01-04 20:57:24.744141,0 days 00:00:15.629635,tanh,0.1,2,0.6,0.09115349501371384,,,PRUNED
1171,1171,0.13251733779907227,2023-01-04 20:57:24.872217,2023-01-04 20:57:33.844444,0 days 00:00:08.972227,relu,0.4,2,0.7,0.13251733779907227,,,PRUNED
1172,1172,0.13813146948814392,2023-01-04 20:57:33.962170,2023-01-04 20:58:24.244805,0 days 00:00:50.282635,tanh,0.35000000000000003,2,0.55,0.06440164148807526,0.03988129645586014,,COMPLETE
1173,1173,0.12934772670269012,2023-01-04 20:58:24.375690,2023-01-04 20:58:32.988986,0 days 00:00:08.613296,tanh,0.45,2,0.8500000000000001,0.12934772670269012,,,PRUNED
1174,1174,0.07348963618278503,2023-01-04 20:58:33.108724,2023-01-04 20:58:48.929709,0 days 00:00:15.820985,relu,0.35000000000000003,3,0.9,0.11355161666870117,0.07348963618278503,,PRUNED
1175,1175,0.15293985605239868,2023-01-04 20:58:49.047164,2023-01-04 20:58:58.029765,0 days 00:00:08.982601,tanh,0.5,2,0.8500000000000001,0.15293985605239868,,,PRUNED
1176,1176,0.1254255473613739,2023-01-04 20:58:58.148472,2023-01-04 20:59:06.962241,0 days 00:00:08.813769,sigmoid,0.5,2,0.65,0.1254255473613739,,,PRUNED
1177,1177,0.12685611844062805,2023-01-04 20:59:07.062090,2023-01-04 20:59:15.711765,0 days 00:00:08.649675,tanh,0.30000000000000004,2,0.8,0.12685611844062805,,,PRUNED
1178,1178,0.12368334829807281,2023-01-04 20:59:15.837806,2023-01-04 20:59:24.594420,0 days 00:00:08.756614,relu,0.35000000000000003,2,0.8500000000000001,0.12368334829807281,,,PRUNED
1179,1179,0.07619401812553406,2023-01-04 20:59:24.713057,2023-01-04 20:59:40.693205,0 days 00:00:15.980148,tanh,0.5,2,0.5,0.1153811663389206,0.07619401812553406,,PRUNED
1180,1180,0.1488805115222931,2023-01-04 20:59:40.811791,2023-01-04 21:00:24.142363,0 days 00:00:43.330572,relu,0.45,2,0.8500000000000001,0.09581732749938965,0.05539490655064583,0.04273209348320961,COMPLETE
1181,1181,0.16683168709278107,2023-01-04 21:00:24.292554,2023-01-04 21:01:00.756040,0 days 00:00:36.463486,tanh,0.35000000000000003,2,0.55,0.0640653669834137,0.043817754834890366,,COMPLETE
1182,1182,0.15396466851234436,2023-01-04 21:01:00.893366,2023-01-04 21:01:09.761193,0 days 00:00:08.867827,tanh,0.4,2,0.8500000000000001,0.15396466851234436,,,PRUNED
1183,1183,0.07731105387210846,2023-01-04 21:01:09.889300,2023-01-04 21:01:25.584293,0 days 00:00:15.694993,tanh,0.35000000000000003,2,0.55,0.07731105387210846,,,PRUNED
1184,1184,0.11111772805452347,2023-01-04 21:01:25.712317,2023-01-04 21:01:41.533628,0 days 00:00:15.821311,tanh,0.35000000000000003,4,0.55,0.11111772805452347,,,PRUNED
1185,1185,0.14923468232154846,2023-01-04 21:01:41.669474,2023-01-04 21:02:25.107971,0 days 00:00:43.438497,tanh,0.35000000000000003,2,0.55,0.061647433787584305,0.04372163489460945,,COMPLETE
1186,1186,0.24890311062335968,2023-01-04 21:02:25.253817,2023-01-04 21:02:33.938468,0 days 00:00:08.684651,sigmoid,0.5,2,0.8,0.24890311062335968,,,PRUNED
1187,1187,0.08332721889019012,2023-01-04 21:02:34.057184,2023-01-04 21:02:49.753370,0 days 00:00:15.696186,relu,0.35000000000000003,2,0.95,0.11264481395483017,0.08332721889019012,,PRUNED
1188,1188,0.08275877684354782,2023-01-04 21:02:49.873410,2023-01-04 21:03:05.643691,0 days 00:00:15.770281,tanh,0.35000000000000003,2,0.9,0.10550116747617722,0.08275877684354782,,PRUNED
1189,1189,0.0697707012295723,2023-01-04 21:03:05.771754,2023-01-04 21:03:21.743193,0 days 00:00:15.971439,relu,0.2,2,1.0,0.1162482500076294,0.0697707012295723,,PRUNED
1190,1190,0.07411316782236099,2023-01-04 21:03:21.869187,2023-01-04 21:03:37.542086,0 days 00:00:15.672899,tanh,0.35000000000000003,2,0.55,0.07411316782236099,,,PRUNED
1191,1191,0.2155565470457077,2023-01-04 21:03:37.690665,2023-01-04 21:03:46.507773,0 days 00:00:08.817108,tanh,0.45,2,0.8500000000000001,0.2155565470457077,,,PRUNED
1192,1192,0.04523036628961563,2023-01-04 21:03:46.635045,2023-01-04 21:04:22.704608,0 days 00:00:36.069563,tanh,0.35000000000000003,2,0.55,0.0678454115986824,0.04523036628961563,,PRUNED
1193,1193,0.4692298173904419,2023-01-04 21:04:22.842644,2023-01-04 21:04:32.179545,0 days 00:00:09.336901,relu,0.5,6,0.8500000000000001,0.4692298173904419,,,PRUNED
1194,1194,0.16046305000782013,2023-01-04 21:04:32.306628,2023-01-04 21:04:41.087207,0 days 00:00:08.780579,sigmoid,0.30000000000000004,2,0.75,0.16046305000782013,,,PRUNED
1195,1195,0.07095566391944885,2023-01-04 21:04:41.214365,2023-01-04 21:04:56.884567,0 days 00:00:15.670202,tanh,0.5,2,0.8500000000000001,0.10942597687244415,0.07095566391944885,,PRUNED
1196,1196,0.16434313356876373,2023-01-04 21:04:57.013063,2023-01-04 21:05:06.001991,0 days 00:00:08.988928,relu,0.4,2,0.8500000000000001,0.16434313356876373,,,PRUNED
1197,1197,0.09055130183696747,2023-01-04 21:05:06.127042,2023-01-04 21:05:21.825313,0 days 00:00:15.698271,tanh,0.35000000000000003,2,0.8500000000000001,0.11231574416160583,0.09055130183696747,,PRUNED
1198,1198,0.13945646584033966,2023-01-04 21:05:21.943512,2023-01-04 21:05:30.675273,0 days 00:00:08.731761,relu,0.5,2,0.9,0.13945646584033966,,,PRUNED
1199,1199,0.15224690735340118,2023-01-04 21:05:30.803182,2023-01-04 21:05:39.574264,0 days 00:00:08.771082,sigmoid,0.5,2,0.8500000000000001,0.15224690735340118,,,PRUNED
1200,1200,0.17235229909420013,2023-01-04 21:05:39.693887,2023-01-04 21:05:48.748606,0 days 00:00:09.054719,tanh,0.5,3,0.5,0.17235229909420013,,,PRUNED
1201,1201,0.0771632194519043,2023-01-04 21:05:48.877815,2023-01-04 21:06:04.529915,0 days 00:00:15.652100,tanh,0.30000000000000004,2,0.6,0.0771632194519043,,,PRUNED
1202,1202,0.1321025788784027,2023-01-04 21:06:04.665018,2023-01-04 21:06:13.438277,0 days 00:00:08.773259,relu,0.35000000000000003,2,0.7,0.1321025788784027,,,PRUNED
1203,1203,0.07743053138256073,2023-01-04 21:06:13.574477,2023-01-04 21:06:29.536350,0 days 00:00:15.961873,tanh,0.30000000000000004,2,0.6,0.07743053138256073,,,PRUNED
1204,1204,0.14867739379405975,2023-01-04 21:06:29.673732,2023-01-04 21:07:13.101680,0 days 00:00:43.427948,tanh,0.35000000000000003,2,0.6,0.06502627581357956,0.042453911155462265,,COMPLETE
1205,1205,0.08148142695426941,2023-01-04 21:07:13.227230,2023-01-04 21:07:28.723674,0 days 00:00:15.496444,tanh,0.25,2,0.55,0.08148142695426941,,,PRUNED
1206,1206,0.04565174877643585,2023-01-04 21:07:28.851602,2023-01-04 21:08:05.046008,0 days 00:00:36.194406,tanh,0.45,2,1.0,0.10083044320344925,0.06318746507167816,0.04565174877643585,PRUNED
1207,1207,0.04752586409449577,2023-01-04 21:08:05.189047,2023-01-04 21:08:41.668046,0 days 00:00:36.478999,tanh,0.35000000000000003,2,0.65,0.05683377385139465,0.04752586409449577,,PRUNED
1208,1208,0.08020003139972687,2023-01-04 21:08:41.802117,2023-01-04 21:08:57.466644,0 days 00:00:15.664527,relu,0.5,2,0.8500000000000001,0.11398367583751678,0.08020003139972687,,PRUNED
1209,1209,0.14695391058921814,2023-01-04 21:08:57.585569,2023-01-04 21:09:06.425554,0 days 00:00:08.839985,tanh,0.30000000000000004,2,0.9,0.14695391058921814,,,PRUNED
1210,1210,0.07533252984285355,2023-01-04 21:09:06.552570,2023-01-04 21:09:22.332033,0 days 00:00:15.779463,tanh,0.30000000000000004,2,0.6,0.07533252984285355,,,PRUNED
1211,1211,0.14376099407672882,2023-01-04 21:09:22.467183,2023-01-04 21:09:31.256959,0 days 00:00:08.789776,sigmoid,0.35000000000000003,2,0.8,0.14376099407672882,,,PRUNED
1212,1212,0.10145428031682968,2023-01-04 21:09:31.383014,2023-01-04 21:09:47.063101,0 days 00:00:15.680087,sigmoid,0.0,2,0.6,0.10145428031682968,,,PRUNED
1213,1213,0.08710122108459473,2023-01-04 21:09:47.199531,2023-01-04 21:10:02.805591,0 days 00:00:15.606060,tanh,0.35000000000000003,2,0.65,0.08710122108459473,,,PRUNED
1214,1214,0.24650481343269348,2023-01-04 21:10:02.937783,2023-01-04 21:10:12.144927,0 days 00:00:09.207144,relu,0.5,4,0.8500000000000001,0.24650481343269348,,,PRUNED
1215,1215,0.14306575059890747,2023-01-04 21:10:12.267212,2023-01-04 21:11:02.378264,0 days 00:00:50.111052,tanh,0.30000000000000004,2,0.55,0.07008426636457443,0.04157770425081253,,COMPLETE
1216,1216,0.07325965911149979,2023-01-04 21:11:02.520796,2023-01-04 21:11:18.206603,0 days 00:00:15.685807,tanh,0.4,2,0.8500000000000001,0.10933235287666321,0.07325965911149979,,PRUNED
1217,1217,0.1525053083896637,2023-01-04 21:11:18.342609,2023-01-04 21:12:05.232275,0 days 00:00:46.889666,tanh,0.30000000000000004,2,0.6,0.0579380989074707,0.04375027120113373,,COMPLETE
1218,1218,0.2292986512184143,2023-01-04 21:12:05.381022,2023-01-04 21:12:21.593600,0 days 00:00:16.212578,tanh,0.30000000000000004,8,0.7,0.2292986512184143,,,PRUNED
1219,1219,0.14334388077259064,2023-01-04 21:12:21.730785,2023-01-04 21:13:18.885307,0 days 00:00:57.154522,relu,0.45,2,0.7,0.1067563071846962,0.061897676438093185,0.042968567460775375,COMPLETE
1220,1220,0.21648450195789337,2023-01-04 21:13:19.029408,2023-01-04 21:13:27.872670,0 days 00:00:08.843262,relu,0.45,3,0.7,0.21648450195789337,,,PRUNED
1221,1221,0.07897311449050903,2023-01-04 21:13:27.997492,2023-01-04 21:13:43.829569,0 days 00:00:15.832077,tanh,0.30000000000000004,2,0.6,0.07897311449050903,,,PRUNED
1222,1222,0.07468073815107346,2023-01-04 21:13:43.964088,2023-01-04 21:13:59.578231,0 days 00:00:15.614143,tanh,0.30000000000000004,2,0.65,0.07468073815107346,,,PRUNED
1223,1223,0.14081862568855286,2023-01-04 21:13:59.713810,2023-01-04 21:14:56.716912,0 days 00:00:57.003102,tanh,0.30000000000000004,2,0.6,0.06937935203313828,0.04222927242517471,,COMPLETE
1224,1224,0.07259750366210938,2023-01-04 21:14:56.858991,2023-01-04 21:15:12.815314,0 days 00:00:15.956323,relu,0.45,2,0.7,0.11887530237436295,0.07259750366210938,,PRUNED
1225,1225,0.07931758463382721,2023-01-04 21:15:12.947483,2023-01-04 21:15:28.554001,0 days 00:00:15.606518,relu,0.30000000000000004,2,0.55,0.07931758463382721,,,PRUNED
1226,1226,0.08495524525642395,2023-01-04 21:15:28.680395,2023-01-04 21:15:44.203816,0 days 00:00:15.523421,tanh,0.30000000000000004,2,0.95,0.08495524525642395,,,PRUNED
1227,1227,0.0772876963019371,2023-01-04 21:15:44.338242,2023-01-04 21:16:00.202392,0 days 00:00:15.864150,relu,0.45,2,0.7,0.10945511609315872,0.0772876963019371,,PRUNED
1228,1228,0.14479848742485046,2023-01-04 21:16:00.319331,2023-01-04 21:16:09.118610,0 days 00:00:08.799279,relu,0.45,2,0.7,0.14479848742485046,,,PRUNED
1229,1229,0.07757730782032013,2023-01-04 21:16:09.247243,2023-01-04 21:16:24.966425,0 days 00:00:15.719182,sigmoid,0.30000000000000004,3,0.65,0.07757730782032013,,,PRUNED
1230,1230,0.09461413323879242,2023-01-04 21:16:25.119077,2023-01-04 21:16:40.791221,0 days 00:00:15.672144,relu,0.45,2,0.7,0.11843910813331604,0.09461413323879242,,PRUNED
1231,1231,0.07359737157821655,2023-01-04 21:16:40.914886,2023-01-04 21:16:56.755829,0 days 00:00:15.840943,relu,0.30000000000000004,2,0.6,0.07359737157821655,,,PRUNED
1232,1232,0.04473061487078667,2023-01-04 21:16:56.891572,2023-01-04 21:17:33.202927,0 days 00:00:36.311355,relu,0.45,2,0.7,0.10999301075935364,0.06672258675098419,0.04473061487078667,PRUNED
1233,1233,0.14656972885131836,2023-01-04 21:17:33.353276,2023-01-04 21:18:16.581333,0 days 00:00:43.228057,tanh,0.30000000000000004,2,0.6,0.0625528022646904,0.041055962443351746,,COMPLETE
1234,1234,0.07860158383846283,2023-01-04 21:18:16.730399,2023-01-04 21:18:32.424461,0 days 00:00:15.694062,relu,0.45,2,0.7,0.11647254973649979,0.07860158383846283,,PRUNED
1235,1235,0.08821361511945724,2023-01-04 21:18:32.739356,2023-01-04 21:18:48.388926,0 days 00:00:15.649570,tanh,0.25,2,0.6,0.08821361511945724,,,PRUNED
1236,1236,0.47091105580329895,2023-01-04 21:18:48.521787,2023-01-04 21:18:57.706078,0 days 00:00:09.184291,relu,0.45,7,0.7,0.47091105580329895,,,PRUNED
1237,1237,0.12493845820426941,2023-01-04 21:18:57.833936,2023-01-04 21:19:06.546852,0 days 00:00:08.712916,relu,0.4,2,0.7,0.12493845820426941,,,PRUNED
1238,1238,0.04486649110913277,2023-01-04 21:19:06.667894,2023-01-04 21:19:43.285555,0 days 00:00:36.617661,relu,0.45,2,0.7,0.11044604331254959,0.06381978839635849,0.04486649110913277,PRUNED
1239,1239,0.08426158130168915,2023-01-04 21:19:43.420641,2023-01-04 21:19:59.043047,0 days 00:00:15.622406,tanh,0.30000000000000004,2,0.6,0.08426158130168915,,,PRUNED
1240,1240,0.1846332848072052,2023-01-04 21:19:59.168591,2023-01-04 21:20:07.958423,0 days 00:00:08.789832,relu,0.45,2,0.65,0.1846332848072052,,,PRUNED
1241,1241,0.1654823124408722,2023-01-04 21:20:08.073511,2023-01-04 21:20:16.875270,0 days 00:00:08.801759,relu,0.35000000000000003,2,0.7,0.1654823124408722,,,PRUNED
1242,1242,0.16814486682415009,2023-01-04 21:20:16.989244,2023-01-04 21:20:25.741112,0 days 00:00:08.751868,relu,0.30000000000000004,2,0.75,0.16814486682415009,,,PRUNED
1243,1243,0.15006288886070251,2023-01-04 21:20:25.857084,2023-01-04 21:21:15.905966,0 days 00:00:50.048882,tanh,0.30000000000000004,2,0.6,0.06959405541419983,0.043886698782444,,COMPLETE
1244,1244,0.13786573708057404,2023-01-04 21:21:16.022793,2023-01-04 21:21:24.670050,0 days 00:00:08.647257,relu,0.25,2,0.65,0.13786573708057404,,,PRUNED
1245,1245,0.15324532985687256,2023-01-04 21:21:24.776794,2023-01-04 21:22:08.226437,0 days 00:00:43.449643,tanh,0.25,2,0.6,0.060906991362571716,0.04387657344341278,,COMPLETE
1246,1246,0.16179417073726654,2023-01-04 21:22:08.351499,2023-01-04 21:22:16.990851,0 days 00:00:08.639352,sigmoid,0.4,2,0.75,0.16179417073726654,,,PRUNED
1247,1247,0.08372301608324051,2023-01-04 21:22:17.107439,2023-01-04 21:22:32.822985,0 days 00:00:15.715546,relu,0.45,2,0.7,0.10722598433494568,0.08372301608324051,,PRUNED
1248,1248,0.15195198357105255,2023-01-04 21:22:32.938316,2023-01-04 21:22:41.672622,0 days 00:00:08.734306,relu,0.35000000000000003,2,1.0,0.15195198357105255,,,PRUNED
1249,1249,0.07186912000179291,2023-01-04 21:22:41.777653,2023-01-04 21:22:57.645109,0 days 00:00:15.867456,sigmoid,0.30000000000000004,2,0.55,0.11848029494285583,0.07186912000179291,,PRUNED
1250,1250,0.09622178226709366,2023-01-04 21:22:57.771768,2023-01-04 21:23:13.360357,0 days 00:00:15.588589,tanh,0.30000000000000004,2,0.6,0.09622178226709366,,,PRUNED
1251,1251,0.08157449960708618,2023-01-04 21:23:13.478917,2023-01-04 21:23:29.202063,0 days 00:00:15.723146,relu,0.45,2,0.5,0.11066017299890518,0.08157449960708618,,PRUNED
1252,1252,0.086355060338974,2023-01-04 21:23:29.318396,2023-01-04 21:23:45.059199,0 days 00:00:15.740803,tanh,0.35000000000000003,2,0.6,0.086355060338974,,,PRUNED
1253,1253,0.15651080012321472,2023-01-04 21:23:45.176503,2023-01-04 21:24:00.890719,0 days 00:00:15.714216,relu,0.35000000000000003,2,0.7,0.10364587604999542,0.15651080012321472,,PRUNED
1254,1254,0.0455993190407753,2023-01-04 21:24:00.997643,2023-01-04 21:24:37.196304,0 days 00:00:36.198661,tanh,0.30000000000000004,2,0.6,0.07024971395730972,0.0455993190407753,,PRUNED
1255,1255,0.12770742177963257,2023-01-04 21:24:37.330863,2023-01-04 21:24:46.045896,0 days 00:00:08.715033,sigmoid,0.35000000000000003,2,0.95,0.12770742177963257,,,PRUNED
1256,1256,0.13706517219543457,2023-01-04 21:24:46.162024,2023-01-04 21:24:55.145160,0 days 00:00:08.983136,relu,0.4,2,1.0,0.13706517219543457,,,PRUNED
1257,1257,0.1157495528459549,2023-01-04 21:24:55.252573,2023-01-04 21:25:11.227692,0 days 00:00:15.975119,tanh,0.30000000000000004,6,0.65,0.1157495528459549,,,PRUNED
1258,1258,0.07385755330324173,2023-01-04 21:25:11.343025,2023-01-04 21:25:27.034292,0 days 00:00:15.691267,tanh,0.35000000000000003,2,1.0,0.07385755330324173,,,PRUNED
1259,1259,0.07681391388177872,2023-01-04 21:25:27.156746,2023-01-04 21:25:42.950298,0 days 00:00:15.793552,tanh,0.35000000000000003,2,0.6,0.07681391388177872,,,PRUNED
1260,1260,0.04471619427204132,2023-01-04 21:25:43.072410,2023-01-04 21:26:19.621536,0 days 00:00:36.549126,tanh,0.30000000000000004,2,0.55,0.062475722283124924,0.04471619427204132,,PRUNED
1261,1261,0.13400569558143616,2023-01-04 21:26:19.753529,2023-01-04 21:26:28.538530,0 days 00:00:08.785001,relu,0.45,2,0.8,0.13400569558143616,,,PRUNED
1262,1262,0.17707513272762299,2023-01-04 21:26:28.652859,2023-01-04 21:26:37.387860,0 days 00:00:08.735001,relu,0.35000000000000003,2,0.8500000000000001,0.17707513272762299,,,PRUNED
1263,1263,0.07260895520448685,2023-01-04 21:26:37.504921,2023-01-04 21:26:53.461650,0 days 00:00:15.956729,sigmoid,0.45,2,0.7,0.10134847462177277,0.07260895520448685,,PRUNED
1264,1264,0.04661159962415695,2023-01-04 21:26:53.570786,2023-01-04 21:27:29.791698,0 days 00:00:36.220912,tanh,0.25,2,0.6,0.06581755727529526,0.04661159962415695,,PRUNED
1265,1265,0.08973784744739532,2023-01-04 21:27:29.922745,2023-01-04 21:27:45.415117,0 days 00:00:15.492372,tanh,0.30000000000000004,2,0.65,0.08973784744739532,,,PRUNED
1266,1266,0.16306252777576447,2023-01-04 21:27:45.538719,2023-01-04 21:27:54.207061,0 days 00:00:08.668342,relu,0.30000000000000004,2,0.8500000000000001,0.16306252777576447,,,PRUNED
1267,1267,0.09030359983444214,2023-01-04 21:27:54.324028,2023-01-04 21:28:10.389008,0 days 00:00:16.064980,tanh,0.30000000000000004,5,0.55,0.09030359983444214,,,PRUNED
1268,1268,0.12328381091356277,2023-01-04 21:28:10.512831,2023-01-04 21:28:19.421828,0 days 00:00:08.908997,relu,0.35000000000000003,3,0.6,0.12328381091356277,,,PRUNED
1269,1269,0.09345318377017975,2023-01-04 21:28:19.538966,2023-01-04 21:28:35.045427,0 days 00:00:15.506461,sigmoid,0.35000000000000003,2,0.6,0.09345318377017975,,,PRUNED
1270,1270,0.07418452203273773,2023-01-04 21:28:35.175926,2023-01-04 21:28:51.001608,0 days 00:00:15.825682,tanh,0.0,2,0.6,0.07418452203273773,,,PRUNED
1271,1271,0.06985035538673401,2023-01-04 21:28:51.124609,2023-01-04 21:29:06.834913,0 days 00:00:15.710304,sigmoid,0.35000000000000003,2,0.8500000000000001,0.11368736624717712,0.06985035538673401,,PRUNED
1272,1272,0.09501625597476959,2023-01-04 21:29:06.951241,2023-01-04 21:29:22.524394,0 days 00:00:15.573153,tanh,0.35000000000000003,2,0.65,0.09501625597476959,,,PRUNED
1273,1273,0.14615537226200104,2023-01-04 21:29:22.647057,2023-01-04 21:30:06.148330,0 days 00:00:43.501273,relu,0.4,2,0.9,0.09695518761873245,0.060835402458906174,0.042605992406606674,COMPLETE
1274,1274,0.0775073990225792,2023-01-04 21:30:06.265430,2023-01-04 21:30:21.754258,0 days 00:00:15.488828,tanh,0.05,2,0.6,0.0775073990225792,,,PRUNED
1275,1275,0.14422333240509033,2023-01-04 21:30:21.876402,2023-01-04 21:30:30.770546,0 days 00:00:08.894144,relu,0.35000000000000003,2,0.9,0.14422333240509033,,,PRUNED
1276,1276,0.1422390639781952,2023-01-04 21:30:30.885573,2023-01-04 21:30:39.669562,0 days 00:00:08.783989,relu,0.4,2,0.95,0.1422390639781952,,,PRUNED
