,number,value,datetime_start,datetime_complete,duration,params_activation,params_dropout,params_layers,params_shrink,system_attrs_completed_rung_0,system_attrs_completed_rung_1,system_attrs_completed_rung_2,state
1662,1662,0.1555538922548294,2023-01-05 00:05:19.195040,2023-01-05 00:06:05.316798,0 days 00:00:46.121758,sigmoid,0.30000000000000004,2,0.7,0.07871568948030472,0.04712778329849243,,COMPLETE
1663,1663,0.1490175426006317,2023-01-05 00:06:05.452527,2023-01-05 00:06:55.481865,0 days 00:00:50.029338,sigmoid,0.5,2,0.75,0.08556932210922241,0.04443962126970291,,COMPLETE
1664,1664,0.12611785531044006,2023-01-05 00:06:55.613464,2023-01-05 00:07:04.261272,0 days 00:00:08.647808,relu,0.05,2,0.5,0.12611785531044006,,,PRUNED
1665,1665,0.30117252469062805,2023-01-05 00:07:04.382021,2023-01-05 00:07:33.968276,0 days 00:00:29.586255,sigmoid,0.1,6,0.55,,,,COMPLETE
1666,1666,0.11330186575651169,2023-01-05 00:07:34.257533,2023-01-05 00:07:43.041929,0 days 00:00:08.784396,tanh,0.0,2,0.6,0.11330186575651169,,,PRUNED
1667,1667,0.16691704094409943,2023-01-05 00:07:43.178109,2023-01-05 00:08:33.118105,0 days 00:00:49.939996,sigmoid,0.1,3,0.5,0.05170218273997307,,,COMPLETE
1668,1668,0.22775910794734955,2023-01-05 00:08:33.247591,2023-01-05 00:08:41.921311,0 days 00:00:08.673720,relu,0.25,2,0.65,0.22775910794734955,,,PRUNED
1669,1669,0.05016467347741127,2023-01-05 00:08:42.043527,2023-01-05 00:09:18.342996,0 days 00:00:36.299469,sigmoid,0.45,2,0.7,0.06955350935459137,0.05016467347741127,,PRUNED
1670,1670,0.10660236328840256,2023-01-05 00:09:18.568019,2023-01-05 00:09:27.317311,0 days 00:00:08.749292,tanh,0.4,2,0.9,0.10660236328840256,,,PRUNED
1671,1671,0.38663914799690247,2023-01-05 00:09:27.436776,2023-01-05 00:09:36.808278,0 days 00:00:09.371502,relu,0.30000000000000004,8,0.75,0.38663914799690247,,,PRUNED
1672,1672,0.1977710872888565,2023-01-05 00:09:36.929747,2023-01-05 00:10:20.308774,0 days 00:00:43.379027,sigmoid,0.1,4,0.5,0.06306829303503036,,,COMPLETE
1673,1673,0.16940812766551971,2023-01-05 00:10:20.433090,2023-01-05 00:10:29.079629,0 days 00:00:08.646539,tanh,0.30000000000000004,2,0.55,0.16940812766551971,,,PRUNED
1674,1674,0.20089519023895264,2023-01-05 00:10:29.175745,2023-01-05 00:10:37.883851,0 days 00:00:08.708106,relu,0.2,2,0.6,0.20089519023895264,,,PRUNED
1675,1675,0.1748378872871399,2023-01-05 00:10:37.993739,2023-01-05 00:10:46.986825,0 days 00:00:08.993086,tanh,0.30000000000000004,2,0.65,0.1748378872871399,,,PRUNED
1676,1676,0.14328399300575256,2023-01-05 00:10:47.109942,2023-01-05 00:11:33.306685,0 days 00:00:46.196743,sigmoid,0.5,2,0.7,0.0677894726395607,0.04108548164367676,,COMPLETE
1677,1677,0.15496855974197388,2023-01-05 00:11:33.435856,2023-01-05 00:12:19.714488,0 days 00:00:46.278632,sigmoid,0.30000000000000004,2,0.7,0.07172389328479767,0.043702177703380585,,COMPLETE
1678,1678,0.08799498528242111,2023-01-05 00:12:19.846985,2023-01-05 00:12:35.423770,0 days 00:00:15.576785,sigmoid,0.5,2,0.7,0.08799498528242111,,,PRUNED
1679,1679,0.10535142570734024,2023-01-05 00:12:35.527738,2023-01-05 00:12:44.215777,0 days 00:00:08.688039,tanh,0.1,2,0.7,0.10535142570734024,,,PRUNED
1680,1680,0.15826265513896942,2023-01-05 00:12:44.333106,2023-01-05 00:12:53.056772,0 days 00:00:08.723666,relu,0.4,2,0.6,0.15826265513896942,,,PRUNED
1681,1681,0.18264280259609222,2023-01-05 00:12:53.173769,2023-01-05 00:13:01.864424,0 days 00:00:08.690655,tanh,0.05,2,0.5,0.18264280259609222,,,PRUNED
1682,1682,0.14180047810077667,2023-01-05 00:13:02.145268,2023-01-05 00:13:58.772549,0 days 00:00:56.627281,sigmoid,0.5,2,0.7,0.06947941333055496,0.0433477945625782,,COMPLETE
1683,1683,0.1553499698638916,2023-01-05 00:13:58.908094,2023-01-05 00:14:48.472105,0 days 00:00:49.564011,sigmoid,0.45,2,0.7,0.06843883544206619,0.04625239223241806,,COMPLETE
1684,1684,0.09872496128082275,2023-01-05 00:14:48.603176,2023-01-05 00:14:57.163970,0 days 00:00:08.560794,relu,0.30000000000000004,2,0.7,0.09872496128082275,,,PRUNED
1685,1685,0.11467164009809494,2023-01-05 00:14:57.284170,2023-01-05 00:15:06.129945,0 days 00:00:08.845775,tanh,0.4,2,0.65,0.11467164009809494,,,PRUNED
1686,1686,0.10724961012601852,2023-01-05 00:15:06.249903,2023-01-05 00:15:14.920891,0 days 00:00:08.670988,relu,0.0,2,0.6,0.10724961012601852,,,PRUNED
1687,1687,0.17992015182971954,2023-01-05 00:15:15.042012,2023-01-05 00:16:01.710860,0 days 00:00:46.668848,sigmoid,0.1,4,0.5,0.06141585856676102,,,COMPLETE
1688,1688,0.13586948812007904,2023-01-05 00:16:01.841011,2023-01-05 00:16:17.523926,0 days 00:00:15.682915,sigmoid,0.5,2,0.7,0.13586948812007904,,,PRUNED
1689,1689,0.23473763465881348,2023-01-05 00:16:17.636235,2023-01-05 00:16:26.232173,0 days 00:00:08.595938,tanh,0.25,2,0.6,0.23473763465881348,,,PRUNED
1690,1690,0.059088461101055145,2023-01-05 00:16:26.353133,2023-01-05 00:16:41.947173,0 days 00:00:15.594040,relu,0.1,2,0.9,0.091825932264328,0.059088461101055145,,PRUNED
1691,1691,0.10801750421524048,2023-01-05 00:16:42.067734,2023-01-05 00:16:50.946012,0 days 00:00:08.878278,tanh,0.30000000000000004,2,0.95,0.10801750421524048,,,PRUNED
1692,1692,0.17742176353931427,2023-01-05 00:16:51.040640,2023-01-05 00:17:30.961429,0 days 00:00:39.920789,sigmoid,0.1,4,0.5,0.06569309532642365,,,COMPLETE
1693,1693,0.09383101761341095,2023-01-05 00:17:31.085204,2023-01-05 00:17:46.433388,0 days 00:00:15.348184,sigmoid,0.30000000000000004,2,0.7,0.09383101761341095,,,PRUNED
1694,1694,0.1708587110042572,2023-01-05 00:17:46.544381,2023-01-05 00:17:55.476382,0 days 00:00:08.932001,relu,0.15000000000000002,2,0.6,0.1708587110042572,,,PRUNED
1695,1695,0.16076497733592987,2023-01-05 00:17:55.601607,2023-01-05 00:18:04.316356,0 days 00:00:08.714749,tanh,0.4,2,0.55,0.16076497733592987,,,PRUNED
1696,1696,0.1296122521162033,2023-01-05 00:18:04.438314,2023-01-05 00:18:13.115298,0 days 00:00:08.676984,tanh,0.1,2,0.65,0.1296122521162033,,,PRUNED
1697,1697,0.16717001795768738,2023-01-05 00:18:13.243290,2023-01-05 00:18:56.295564,0 days 00:00:43.052274,sigmoid,0.1,3,0.5,0.05205237492918968,,,COMPLETE
1698,1698,0.1314437985420227,2023-01-05 00:18:56.424059,2023-01-05 00:19:05.328081,0 days 00:00:08.904022,relu,0.30000000000000004,2,0.75,0.1314437985420227,,,PRUNED
1699,1699,0.08757854998111725,2023-01-05 00:19:05.449313,2023-01-05 00:19:20.935499,0 days 00:00:15.486186,sigmoid,0.5,2,0.65,0.08757854998111725,,,PRUNED
1700,1700,0.09945545345544815,2023-01-05 00:19:21.042793,2023-01-05 00:19:29.667922,0 days 00:00:08.625129,tanh,0.05,2,0.7,0.09945545345544815,,,PRUNED
1701,1701,0.0674203485250473,2023-01-05 00:19:29.787121,2023-01-05 00:19:45.666622,0 days 00:00:15.879501,relu,0.25,2,0.5,0.0898672416806221,0.0674203485250473,,PRUNED
1702,1702,0.18199507892131805,2023-01-05 00:19:45.759955,2023-01-05 00:19:54.591262,0 days 00:00:08.831307,tanh,0.30000000000000004,3,0.9,0.18199507892131805,,,PRUNED
1703,1703,0.17238405346870422,2023-01-05 00:19:54.713216,2023-01-05 00:20:03.457282,0 days 00:00:08.744066,relu,0.1,2,0.6,0.17238405346870422,,,PRUNED
1704,1704,0.11494091898202896,2023-01-05 00:20:03.552204,2023-01-05 00:20:12.373428,0 days 00:00:08.821224,tanh,0.0,2,0.65,0.11494091898202896,,,PRUNED
1705,1705,0.1782786250114441,2023-01-05 00:20:12.477520,2023-01-05 00:20:55.550507,0 days 00:00:43.072987,sigmoid,0.1,3,0.5,0.060789626091718674,,,COMPLETE
1706,1706,0.1464567482471466,2023-01-05 00:20:55.787557,2023-01-05 00:21:04.461248,0 days 00:00:08.673691,relu,0.4,2,0.55,0.1464567482471466,,,PRUNED
1707,1707,0.1164228767156601,2023-01-05 00:21:04.556867,2023-01-05 00:21:13.201903,0 days 00:00:08.645036,tanh,0.30000000000000004,2,0.7,0.1164228767156601,,,PRUNED
1708,1708,0.10592173784971237,2023-01-05 00:21:13.329059,2023-01-05 00:21:22.167813,0 days 00:00:08.838754,tanh,0.35000000000000003,2,0.6,0.10592173784971237,,,PRUNED
1709,1709,0.20066942274570465,2023-01-05 00:21:22.288927,2023-01-05 00:21:38.066669,0 days 00:00:15.777742,sigmoid,0.0,5,0.7,0.20066942274570465,,,PRUNED
1710,1710,0.1851334422826767,2023-01-05 00:21:38.188515,2023-01-05 00:21:46.915672,0 days 00:00:08.727157,relu,0.30000000000000004,2,0.6,0.1851334422826767,,,PRUNED
1711,1711,0.14692039787769318,2023-01-05 00:21:47.036944,2023-01-05 00:22:37.144303,0 days 00:00:50.107359,sigmoid,0.45,2,0.7,0.0641101598739624,0.04303548485040665,,COMPLETE
1712,1712,0.11693800985813141,2023-01-05 00:22:37.270107,2023-01-05 00:22:45.853048,0 days 00:00:08.582941,tanh,0.1,2,0.6,0.11693800985813141,,,PRUNED
1713,1713,0.05012364685535431,2023-01-05 00:22:45.960138,2023-01-05 00:23:21.691253,0 days 00:00:35.731115,sigmoid,0.45,2,0.7,0.0727524608373642,0.05012364685535431,,PRUNED
1714,1714,0.07406731694936752,2023-01-05 00:23:21.809413,2023-01-05 00:23:58.322387,0 days 00:00:36.512974,sigmoid,0.45,4,0.7,0.07689525932073593,0.07406731694936752,,PRUNED
1715,1715,0.1839117854833603,2023-01-05 00:23:58.434213,2023-01-05 00:24:07.154623,0 days 00:00:08.720410,relu,0.15000000000000002,2,0.65,0.1839117854833603,,,PRUNED
1716,1716,0.05224600061774254,2023-01-05 00:24:07.273731,2023-01-05 00:24:43.102497,0 days 00:00:35.828766,sigmoid,0.45,2,0.7,0.07892121374607086,0.05224600061774254,,PRUNED
1717,1717,0.12958014011383057,2023-01-05 00:24:43.216118,2023-01-05 00:24:51.860160,0 days 00:00:08.644042,tanh,0.35000000000000003,2,0.7,0.12958014011383057,,,PRUNED
1718,1718,0.12714992463588715,2023-01-05 00:24:51.980516,2023-01-05 00:25:00.917461,0 days 00:00:08.936945,relu,0.4,2,0.5,0.12714992463588715,,,PRUNED
1719,1719,0.15634487569332123,2023-01-05 00:25:01.037088,2023-01-05 00:25:09.700478,0 days 00:00:08.663390,tanh,0.25,2,0.65,0.15634487569332123,,,PRUNED
1720,1720,0.15462897717952728,2023-01-05 00:25:09.801673,2023-01-05 00:25:52.418032,0 days 00:00:42.616359,sigmoid,0.45,2,0.7,0.06562847644090652,0.044921163469552994,,COMPLETE
1721,1721,0.05101689696311951,2023-01-05 00:25:52.555157,2023-01-05 00:26:28.868404,0 days 00:00:36.313247,sigmoid,0.45,2,0.7,0.07058357447385788,0.05101689696311951,,PRUNED
1722,1722,0.15869222581386566,2023-01-05 00:26:28.994065,2023-01-05 00:27:18.831101,0 days 00:00:49.837036,sigmoid,0.1,3,0.5,0.04664885625243187,,,COMPLETE
1723,1723,0.17339421808719635,2023-01-05 00:27:18.968108,2023-01-05 00:27:55.133565,0 days 00:00:36.165457,sigmoid,0.1,3,0.5,0.05322211980819702,,,COMPLETE
1724,1724,0.12660041451454163,2023-01-05 00:27:55.270784,2023-01-05 00:28:04.120633,0 days 00:00:08.849849,relu,0.30000000000000004,2,0.55,0.12660041451454163,,,PRUNED
1725,1725,0.15237434208393097,2023-01-05 00:28:04.245710,2023-01-05 00:28:53.745852,0 days 00:00:49.500142,sigmoid,0.45,2,0.7,0.07090207934379578,0.04695216193795204,,COMPLETE
1726,1726,0.14546743035316467,2023-01-05 00:28:53.885107,2023-01-05 00:29:02.524338,0 days 00:00:08.639231,tanh,0.1,2,0.6,0.14546743035316467,,,PRUNED
1727,1727,0.12771694362163544,2023-01-05 00:29:02.647298,2023-01-05 00:29:11.516166,0 days 00:00:08.868868,tanh,0.30000000000000004,2,0.95,0.12771694362163544,,,PRUNED
1728,1728,0.052212007343769073,2023-01-05 00:29:11.641845,2023-01-05 00:29:47.569901,0 days 00:00:35.928056,sigmoid,0.45,2,0.7,0.07215972244739532,0.052212007343769073,,PRUNED
1729,1729,0.13960431516170502,2023-01-05 00:29:47.684377,2023-01-05 00:29:56.478552,0 days 00:00:08.794175,relu,0.2,2,0.7,0.13960431516170502,,,PRUNED
1730,1730,0.05712643265724182,2023-01-05 00:29:56.610552,2023-01-05 00:30:12.410673,0 days 00:00:15.800121,tanh,0.05,2,0.6,0.09546530246734619,0.05712643265724182,,PRUNED
1731,1731,0.10530846565961838,2023-01-05 00:30:12.532639,2023-01-05 00:30:21.260002,0 days 00:00:08.727363,relu,0.35000000000000003,2,0.9,0.10530846565961838,,,PRUNED
1732,1732,0.11067534983158112,2023-01-05 00:30:21.382966,2023-01-05 00:30:30.167649,0 days 00:00:08.784683,tanh,0.30000000000000004,2,0.75,0.11067534983158112,,,PRUNED
1733,1733,0.14481642842292786,2023-01-05 00:30:30.260775,2023-01-05 00:31:13.403864,0 days 00:00:43.143089,sigmoid,0.1,3,0.5,0.041743095964193344,,,COMPLETE
1734,1734,0.04987518861889839,2023-01-05 00:31:13.532652,2023-01-05 00:31:49.427696,0 days 00:00:35.895044,sigmoid,0.45,2,0.65,0.07910340279340744,0.04987518861889839,,PRUNED
1735,1735,0.04954232648015022,2023-01-05 00:31:49.556931,2023-01-05 00:32:25.499505,0 days 00:00:35.942574,sigmoid,0.2,2,0.7,0.07810596376657486,0.04954232648015022,,PRUNED
1736,1736,0.16155804693698883,2023-01-05 00:32:25.613556,2023-01-05 00:33:15.640247,0 days 00:00:50.026691,sigmoid,0.1,3,0.5,0.053204670548439026,,,COMPLETE
1737,1737,0.12916287779808044,2023-01-05 00:33:15.772315,2023-01-05 00:33:24.712546,0 days 00:00:08.940231,relu,0.4,2,0.55,0.12916287779808044,,,PRUNED
1738,1738,0.14562202990055084,2023-01-05 00:33:24.838331,2023-01-05 00:34:18.218759,0 days 00:00:53.380428,sigmoid,0.1,3,0.5,0.04311301186680794,,,COMPLETE
1739,1739,0.1377178281545639,2023-01-05 00:34:18.350866,2023-01-05 00:34:26.949561,0 days 00:00:08.598695,tanh,0.1,2,0.5,0.1377178281545639,,,PRUNED
1740,1740,0.17096000909805298,2023-01-05 00:34:27.072521,2023-01-05 00:35:10.469084,0 days 00:00:43.396563,sigmoid,0.1,3,0.5,0.05400463566184044,,,COMPLETE
1741,1741,0.5136467814445496,2023-01-05 00:35:10.603183,2023-01-05 00:35:19.795530,0 days 00:00:09.192347,relu,0.4,8,0.6,0.5136467814445496,,,PRUNED
1742,1742,0.16727562248706818,2023-01-05 00:35:19.921191,2023-01-05 00:36:03.094910,0 days 00:00:43.173719,sigmoid,0.05,3,0.5,0.05217493698000908,,,COMPLETE
1743,1743,0.15100178122520447,2023-01-05 00:36:03.224262,2023-01-05 00:37:00.154385,0 days 00:00:56.930123,sigmoid,0.1,3,0.5,0.047507211565971375,,,COMPLETE
1744,1744,0.13515563309192657,2023-01-05 00:37:00.285204,2023-01-05 00:37:08.887203,0 days 00:00:08.601999,tanh,0.1,2,0.65,0.13515563309192657,,,PRUNED
1745,1745,0.1680099070072174,2023-01-05 00:37:09.009166,2023-01-05 00:37:52.148413,0 days 00:00:43.139247,sigmoid,0.1,3,0.5,0.04686428979039192,,,COMPLETE
1746,1746,0.10377471148967743,2023-01-05 00:37:52.274206,2023-01-05 00:38:01.058224,0 days 00:00:08.784018,tanh,0.35000000000000003,2,0.6,0.10377471148967743,,,PRUNED
1747,1747,0.1170932799577713,2023-01-05 00:38:01.154262,2023-01-05 00:38:09.908925,0 days 00:00:08.754663,relu,0.35000000000000003,2,0.65,0.1170932799577713,,,PRUNED
1748,1748,0.0502629429101944,2023-01-05 00:38:10.035831,2023-01-05 00:38:46.012116,0 days 00:00:35.976285,sigmoid,0.5,2,0.7,0.07224317640066147,0.0502629429101944,,PRUNED
1749,1749,0.13799700140953064,2023-01-05 00:38:46.133200,2023-01-05 00:38:54.912438,0 days 00:00:08.779238,tanh,0.25,2,0.7,0.13799700140953064,,,PRUNED
1750,1750,0.1041974350810051,2023-01-05 00:38:55.037041,2023-01-05 00:39:03.995066,0 days 00:00:08.958025,relu,0.05,2,0.6,0.1041974350810051,,,PRUNED
1751,1751,0.18536227941513062,2023-01-05 00:39:04.117035,2023-01-05 00:39:12.869390,0 days 00:00:08.752355,tanh,0.30000000000000004,2,0.65,0.18536227941513062,,,PRUNED
1752,1752,0.17490988969802856,2023-01-05 00:39:12.965356,2023-01-05 00:39:21.777046,0 days 00:00:08.811690,relu,0.15000000000000002,2,0.7,0.17490988969802856,,,PRUNED
1753,1753,0.16275665163993835,2023-01-05 00:39:21.885045,2023-01-05 00:39:30.876343,0 days 00:00:08.991298,tanh,0.30000000000000004,3,0.6,0.16275665163993835,,,PRUNED
1754,1754,0.05439493805170059,2023-01-05 00:39:30.998309,2023-01-05 00:40:07.014248,0 days 00:00:36.015939,sigmoid,0.5,2,0.7,0.07491086423397064,0.05439493805170059,,PRUNED
1755,1755,0.11607924848794937,2023-01-05 00:40:07.127869,2023-01-05 00:40:15.764594,0 days 00:00:08.636725,relu,0.4,2,0.5,0.11607924848794937,,,PRUNED
1756,1756,0.1539100706577301,2023-01-05 00:40:15.886540,2023-01-05 00:41:05.882591,0 days 00:00:49.996051,sigmoid,0.30000000000000004,2,0.65,0.0807013288140297,0.048035379499197006,,COMPLETE
1757,1757,0.14594212174415588,2023-01-05 00:41:06.010382,2023-01-05 00:41:14.551755,0 days 00:00:08.541373,tanh,0.30000000000000004,2,0.95,0.14594212174415588,,,PRUNED
1758,1758,0.05900753289461136,2023-01-05 00:41:14.666130,2023-01-05 00:41:50.814646,0 days 00:00:36.148516,sigmoid,0.5,3,1.0,0.0842297375202179,0.05900753289461136,,PRUNED
1759,1759,0.1350044161081314,2023-01-05 00:41:50.935965,2023-01-05 00:41:59.548317,0 days 00:00:08.612352,tanh,0.35000000000000003,2,0.9,0.1350044161081314,,,PRUNED
1760,1760,0.11640988290309906,2023-01-05 00:41:59.655079,2023-01-05 00:42:08.489297,0 days 00:00:08.834218,relu,0.2,2,0.7,0.11640988290309906,,,PRUNED
1761,1761,0.0897144302725792,2023-01-05 00:42:08.616961,2023-01-05 00:42:24.079768,0 days 00:00:15.462807,sigmoid,0.45,2,0.7,0.0897144302725792,,,PRUNED
1762,1762,0.15716516971588135,2023-01-05 00:42:24.192392,2023-01-05 00:43:17.496278,0 days 00:00:53.303886,sigmoid,0.1,3,0.5,0.04952419549226761,,,COMPLETE
1763,1763,0.1662885993719101,2023-01-05 00:43:17.627312,2023-01-05 00:43:26.524998,0 days 00:00:08.897686,tanh,0.35000000000000003,2,0.65,0.1662885993719101,,,PRUNED
1764,1764,0.04995490983128548,2023-01-05 00:43:26.621957,2023-01-05 00:44:02.713655,0 days 00:00:36.091698,sigmoid,0.25,2,0.7,0.07065165042877197,0.04995490983128548,,PRUNED
1765,1765,0.14983956515789032,2023-01-05 00:44:02.827549,2023-01-05 00:44:52.730500,0 days 00:00:49.902951,sigmoid,0.5,2,0.75,0.0829412192106247,0.04437099024653435,,COMPLETE
1766,1766,0.18804995715618134,2023-01-05 00:44:52.868053,2023-01-05 00:45:01.655183,0 days 00:00:08.787130,relu,0.05,2,0.55,0.18804995715618134,,,PRUNED
1767,1767,0.12563589215278625,2023-01-05 00:45:01.785099,2023-01-05 00:45:10.425401,0 days 00:00:08.640302,tanh,0.0,2,0.75,0.12563589215278625,,,PRUNED
1768,1768,0.1301639825105667,2023-01-05 00:45:10.546362,2023-01-05 00:45:19.099738,0 days 00:00:08.553376,relu,0.1,2,0.6,0.1301639825105667,,,PRUNED
1769,1769,0.1918531209230423,2023-01-05 00:45:19.195697,2023-01-05 00:45:28.049255,0 days 00:00:08.853558,tanh,0.30000000000000004,2,0.6,0.1918531209230423,,,PRUNED
1770,1770,0.15046238899230957,2023-01-05 00:45:28.144017,2023-01-05 00:46:17.808400,0 days 00:00:49.664383,sigmoid,0.4,2,0.65,0.07409761846065521,0.045156512409448624,,COMPLETE
1771,1771,0.185217946767807,2023-01-05 00:46:17.943211,2023-01-05 00:46:26.519728,0 days 00:00:08.576517,relu,0.1,2,0.55,0.185217946767807,,,PRUNED
1772,1772,0.12498949468135834,2023-01-05 00:46:26.639551,2023-01-05 00:46:35.268926,0 days 00:00:08.629375,tanh,0.30000000000000004,2,0.9,0.12498949468135834,,,PRUNED
1773,1773,0.15534049272537231,2023-01-05 00:46:35.379928,2023-01-05 00:47:18.664465,0 days 00:00:43.284537,sigmoid,0.1,3,0.5,0.046994708478450775,,,COMPLETE
1774,1774,0.19917918741703033,2023-01-05 00:47:18.800585,2023-01-05 00:47:27.348401,0 days 00:00:08.547816,tanh,0.25,2,0.65,0.19917918741703033,,,PRUNED
1775,1775,0.0994563028216362,2023-01-05 00:47:27.467606,2023-01-05 00:47:36.089296,0 days 00:00:08.621690,relu,0.35000000000000003,2,0.6,0.0994563028216362,,,PRUNED
1776,1776,0.13239556550979614,2023-01-05 00:47:36.199135,2023-01-05 00:47:45.005399,0 days 00:00:08.806264,tanh,0.15000000000000002,2,0.5,0.13239556550979614,,,PRUNED
1777,1777,0.1184091717004776,2023-01-05 00:47:45.132955,2023-01-05 00:47:53.762938,0 days 00:00:08.629983,relu,0.4,2,0.6,0.1184091717004776,,,PRUNED
1778,1778,0.1640925258398056,2023-01-05 00:47:53.891602,2023-01-05 00:48:33.600792,0 days 00:00:39.709190,sigmoid,0.1,3,0.5,0.05242463946342468,,,COMPLETE
1779,1779,0.16009196639060974,2023-01-05 00:48:33.730680,2023-01-05 00:48:42.592547,0 days 00:00:08.861867,tanh,0.1,2,0.7,0.16009196639060974,,,PRUNED
1780,1780,0.2719806730747223,2023-01-05 00:48:42.748839,2023-01-05 00:48:51.933745,0 days 00:00:09.184906,relu,0.4,6,0.7,0.2719806730747223,,,PRUNED
1781,1781,0.13361826539039612,2023-01-05 00:48:52.033177,2023-01-05 00:49:48.558340,0 days 00:00:56.525163,sigmoid,0.30000000000000004,2,0.7,0.07120797038078308,0.04067528620362282,,COMPLETE
1782,1782,0.1501009613275528,2023-01-05 00:49:48.700466,2023-01-05 00:50:35.103793,0 days 00:00:46.403327,sigmoid,0.30000000000000004,2,0.7,0.07575411349534988,0.04204140976071358,,COMPLETE
1783,1783,0.06310360878705978,2023-01-05 00:50:35.232620,2023-01-05 00:50:50.699740,0 days 00:00:15.467120,tanh,0.30000000000000004,2,0.65,0.09649588912725449,0.06310360878705978,,PRUNED
1784,1784,0.07935619354248047,2023-01-05 00:50:50.812051,2023-01-05 00:51:06.481559,0 days 00:00:15.669508,relu,0.35000000000000003,3,0.5,0.09788575023412704,0.07935619354248047,,PRUNED
1785,1785,0.1516030877828598,2023-01-05 00:51:06.659064,2023-01-05 00:51:53.310416,0 days 00:00:46.651352,sigmoid,0.05,3,0.5,0.04151986911892891,,,COMPLETE
1786,1786,0.16583889722824097,2023-01-05 00:51:53.436950,2023-01-05 00:52:39.873278,0 days 00:00:46.436328,sigmoid,0.05,3,0.5,0.050876185297966,,,COMPLETE
1787,1787,0.10479361563920975,2023-01-05 00:52:40.002069,2023-01-05 00:52:48.623761,0 days 00:00:08.621692,tanh,0.30000000000000004,2,0.6,0.10479361563920975,,,PRUNED
1788,1788,0.13513000309467316,2023-01-05 00:52:48.719525,2023-01-05 00:53:41.772890,0 days 00:00:53.053365,sigmoid,0.30000000000000004,2,0.7,0.0707070603966713,0.03782994672656059,,COMPLETE
1789,1789,0.17444029450416565,2023-01-05 00:53:41.913016,2023-01-05 00:53:50.547234,0 days 00:00:08.634218,tanh,0.1,2,0.6,0.17444029450416565,,,PRUNED
1790,1790,0.19346128404140472,2023-01-05 00:53:50.672538,2023-01-05 00:53:59.335036,0 days 00:00:08.662498,relu,0.0,2,0.6,0.19346128404140472,,,PRUNED
1791,1791,0.06594937294721603,2023-01-05 00:53:59.438328,2023-01-05 00:54:15.158581,0 days 00:00:15.720253,tanh,0.35000000000000003,2,0.55,0.09580829739570618,0.06594937294721603,,PRUNED
1792,1792,0.05405725538730621,2023-01-05 00:54:15.298453,2023-01-05 00:54:51.255078,0 days 00:00:35.956625,sigmoid,0.30000000000000004,2,0.7,0.08078858256340027,0.05405725538730621,,PRUNED
1793,1793,0.08451703935861588,2023-01-05 00:54:51.369704,2023-01-05 00:55:06.788228,0 days 00:00:15.418524,sigmoid,0.30000000000000004,2,0.7,0.08451703935861588,,,PRUNED
1794,1794,0.15122543275356293,2023-01-05 00:55:06.899849,2023-01-05 00:55:15.579306,0 days 00:00:08.679457,relu,0.30000000000000004,2,0.65,0.15122543275356293,,,PRUNED
