,number,value,datetime_start,datetime_complete,duration,params_activation,params_dropout,params_layers,params_shrink,system_attrs_completed_rung_0,system_attrs_completed_rung_1,system_attrs_completed_rung_2,state
2321,2321,0.12341359257698059,2023-01-05 04:13:29.310635,2023-01-05 04:13:37.924665,0 days 00:00:08.614030,relu,0.05,2,0.55,0.12341359257698059,,,PRUNED
2322,2322,0.22044959664344788,2023-01-05 04:13:38.025836,2023-01-05 04:13:47.507284,0 days 00:00:09.481448,tanh,0.30000000000000004,8,0.8500000000000001,0.22044959664344788,,,PRUNED
2323,2323,0.11920444667339325,2023-01-05 04:13:47.617349,2023-01-05 04:13:56.322539,0 days 00:00:08.705190,tanh,0.0,2,0.5,0.11920444667339325,,,PRUNED
2324,2324,0.13335731625556946,2023-01-05 04:13:56.425206,2023-01-05 04:14:05.096856,0 days 00:00:08.671650,relu,0.4,2,0.6,0.13335731625556946,,,PRUNED
2325,2325,0.12131302058696747,2023-01-05 04:14:05.191199,2023-01-05 04:14:14.104501,0 days 00:00:08.913302,tanh,0.1,2,0.8500000000000001,0.12131302058696747,,,PRUNED
2326,2326,0.08132860064506531,2023-01-05 04:14:14.224008,2023-01-05 04:14:29.628104,0 days 00:00:15.404096,sigmoid,0.5,2,0.65,0.08132860064506531,,,PRUNED
2327,2327,0.08785903453826904,2023-01-05 04:14:29.747355,2023-01-05 04:14:45.226904,0 days 00:00:15.479549,sigmoid,0.4,2,0.75,0.08785903453826904,,,PRUNED
2328,2328,0.14261803030967712,2023-01-05 04:14:45.345434,2023-01-05 04:15:35.225272,0 days 00:00:49.879838,tanh,0.35000000000000003,2,1.0,0.06542467325925827,0.042332593351602554,,COMPLETE
2329,2329,0.15167221426963806,2023-01-05 04:15:35.350524,2023-01-05 04:16:21.373867,0 days 00:00:46.023343,relu,0.30000000000000004,2,1.0,0.07710962742567062,0.04600665718317032,,COMPLETE
2330,2330,0.04734710603952408,2023-01-05 04:16:21.502037,2023-01-05 04:16:57.333584,0 days 00:00:35.831547,sigmoid,0.25,2,1.0,0.07407119870185852,0.04734710603952408,,PRUNED
2331,2331,0.04753335565328598,2023-01-05 04:16:57.445581,2023-01-05 04:17:33.572460,0 days 00:00:36.126879,tanh,0.5,2,1.0,0.06736862659454346,0.04753335565328598,,PRUNED
2332,2332,0.11546777933835983,2023-01-05 04:17:33.683458,2023-01-05 04:17:49.312908,0 days 00:00:15.629450,sigmoid,0.5,3,1.0,0.11546777933835983,,,PRUNED
2333,2333,0.14567984640598297,2023-01-05 04:17:49.413974,2023-01-05 04:17:58.087248,0 days 00:00:08.673274,relu,0.5,2,0.65,0.14567984640598297,,,PRUNED
2334,2334,0.142369344830513,2023-01-05 04:17:58.195644,2023-01-05 04:18:07.079209,0 days 00:00:08.883565,tanh,0.15000000000000002,2,0.95,0.142369344830513,,,PRUNED
2335,2335,0.053159985691308975,2023-01-05 04:18:07.190442,2023-01-05 04:18:43.108153,0 days 00:00:35.917711,sigmoid,0.35000000000000003,2,1.0,0.07444003969430923,0.053159985691308975,,PRUNED
2336,2336,0.15501856803894043,2023-01-05 04:18:43.219229,2023-01-05 04:19:26.191951,0 days 00:00:42.972722,tanh,0.2,2,1.0,0.06545419245958328,0.04625532031059265,,COMPLETE
2337,2337,0.24165421724319458,2023-01-05 04:19:26.320138,2023-01-05 04:19:34.929758,0 days 00:00:08.609620,relu,0.30000000000000004,2,0.6,0.24165421724319458,,,PRUNED
2338,2338,0.1539519727230072,2023-01-05 04:19:35.013774,2023-01-05 04:20:17.823311,0 days 00:00:42.809537,relu,0.30000000000000004,2,1.0,0.06433887779712677,0.0450446791946888,,COMPLETE
2339,2339,0.1158381775021553,2023-01-05 04:20:17.949479,2023-01-05 04:20:26.834778,0 days 00:00:08.885299,tanh,0.05,2,0.7,0.1158381775021553,,,PRUNED
2340,2340,0.24994736909866333,2023-01-05 04:20:26.943109,2023-01-05 04:20:35.625546,0 days 00:00:08.682437,relu,0.45,2,0.55,0.24994736909866333,,,PRUNED
2341,2341,0.15504208207130432,2023-01-05 04:20:35.719435,2023-01-05 04:21:18.343651,0 days 00:00:42.624216,sigmoid,0.35000000000000003,2,1.0,0.05685592070221901,0.04316083714365959,,COMPLETE
2342,2342,0.1420411318540573,2023-01-05 04:21:18.461376,2023-01-05 04:21:27.221122,0 days 00:00:08.759746,tanh,0.1,2,0.6,0.1420411318540573,,,PRUNED
2343,2343,0.04748983681201935,2023-01-05 04:21:27.324794,2023-01-05 04:22:03.135079,0 days 00:00:35.810285,tanh,0.30000000000000004,2,1.0,0.07420336455106735,0.04748983681201935,,PRUNED
2344,2344,0.052358757704496384,2023-01-05 04:22:03.245316,2023-01-05 04:22:39.417306,0 days 00:00:36.171990,sigmoid,0.5,2,1.0,0.06975346803665161,0.052358757704496384,,PRUNED
2345,2345,0.07224404811859131,2023-01-05 04:22:39.642783,2023-01-05 04:22:56.555624,0 days 00:00:16.912841,tanh,0.35000000000000003,2,0.8500000000000001,0.09314847737550735,0.07224404811859131,,PRUNED
2346,2346,0.12013714760541916,2023-01-05 04:22:56.649709,2023-01-05 04:23:05.414777,0 days 00:00:08.765068,relu,0.30000000000000004,2,0.75,0.12013714760541916,,,PRUNED
2347,2347,0.15782812237739563,2023-01-05 04:23:05.529882,2023-01-05 04:23:51.931721,0 days 00:00:46.401839,tanh,0.0,2,0.55,0.04574710130691528,,,COMPLETE
2348,2348,0.14696913957595825,2023-01-05 04:23:52.048737,2023-01-05 04:24:48.693178,0 days 00:00:56.644441,tanh,0.0,2,0.55,0.04770921915769577,,,COMPLETE
2349,2349,0.14580059051513672,2023-01-05 04:24:48.810000,2023-01-05 04:24:57.381977,0 days 00:00:08.571977,tanh,0.35000000000000003,2,0.8,0.14580059051513672,,,PRUNED
2350,2350,0.07852008938789368,2023-01-05 04:24:57.480653,2023-01-05 04:25:13.022121,0 days 00:00:15.541468,relu,0.15000000000000002,2,0.65,0.10152692347764969,0.07852008938789368,,PRUNED
2351,2351,0.0810961127281189,2023-01-05 04:25:13.122184,2023-01-05 04:25:28.729316,0 days 00:00:15.607132,relu,0.25,2,0.95,0.0810961127281189,,,PRUNED
2352,2352,0.15759339928627014,2023-01-05 04:25:28.849508,2023-01-05 04:26:11.637775,0 days 00:00:42.788267,tanh,0.0,2,0.55,0.04517542943358421,,,COMPLETE
2353,2353,0.147369384765625,2023-01-05 04:26:11.753738,2023-01-05 04:26:20.266076,0 days 00:00:08.512338,tanh,0.4,2,0.9,0.147369384765625,,,PRUNED
2354,2354,0.1591358482837677,2023-01-05 04:26:20.376277,2023-01-05 04:27:06.773197,0 days 00:00:46.396920,tanh,0.0,2,0.55,0.04922376573085785,,,COMPLETE
2355,2355,0.14870688319206238,2023-01-05 04:27:06.894357,2023-01-05 04:27:52.975942,0 days 00:00:46.081585,tanh,0.0,2,0.6,0.042319413274526596,,,COMPLETE
2356,2356,0.14864549040794373,2023-01-05 04:27:53.096978,2023-01-05 04:28:35.718147,0 days 00:00:42.621169,tanh,0.0,2,0.55,0.04220113903284073,,,COMPLETE
2357,2357,0.05077136680483818,2023-01-05 04:28:35.834448,2023-01-05 04:29:11.911731,0 days 00:00:36.077283,sigmoid,0.35000000000000003,2,1.0,0.07056988775730133,0.05077136680483818,,PRUNED
2358,2358,0.11062966287136078,2023-01-05 04:29:12.013062,2023-01-05 04:29:20.728184,0 days 00:00:08.715122,relu,0.5,2,0.6,0.11062966287136078,,,PRUNED
2359,2359,0.125407412648201,2023-01-05 04:29:20.835131,2023-01-05 04:29:29.710822,0 days 00:00:08.875691,tanh,0.30000000000000004,2,0.5,0.125407412648201,,,PRUNED
2360,2360,0.14712244272232056,2023-01-05 04:29:29.817020,2023-01-05 04:30:12.724105,0 days 00:00:42.907085,tanh,0.4,2,0.65,0.059142958372831345,0.040371086448431015,,COMPLETE
2361,2361,0.10640648752450943,2023-01-05 04:30:12.846389,2023-01-05 04:30:21.505838,0 days 00:00:08.659449,relu,0.35000000000000003,2,0.8500000000000001,0.10640648752450943,,,PRUNED
2362,2362,0.12469420582056046,2023-01-05 04:30:21.601967,2023-01-05 04:30:30.298282,0 days 00:00:08.696315,tanh,0.4,2,0.7,0.12469420582056046,,,PRUNED
2363,2363,0.16035784780979156,2023-01-05 04:30:30.409343,2023-01-05 04:31:13.431691,0 days 00:00:43.022348,tanh,0.0,2,0.6,0.047367583960294724,,,COMPLETE
2364,2364,0.15090522170066833,2023-01-05 04:31:13.557170,2023-01-05 04:31:22.468679,0 days 00:00:08.911509,tanh,0.25,2,0.65,0.15090522170066833,,,PRUNED
2365,2365,0.1519082635641098,2023-01-05 04:31:22.591254,2023-01-05 04:32:19.186367,0 days 00:00:56.595113,tanh,0.0,2,0.55,0.048261962831020355,,,COMPLETE
2366,2366,0.15767920017242432,2023-01-05 04:32:19.312046,2023-01-05 04:32:28.037764,0 days 00:00:08.725718,relu,0.1,2,0.6,0.15767920017242432,,,PRUNED
2367,2367,0.285321980714798,2023-01-05 04:32:28.139807,2023-01-05 04:32:37.195558,0 days 00:00:09.055751,tanh,0.45,6,0.5,0.285321980714798,,,PRUNED
2368,2368,0.20422998070716858,2023-01-05 04:32:37.298281,2023-01-05 04:32:46.170567,0 days 00:00:08.872286,relu,0.30000000000000004,2,0.55,0.20422998070716858,,,PRUNED
2369,2369,0.11032567918300629,2023-01-05 04:32:46.271777,2023-01-05 04:32:54.978354,0 days 00:00:08.706577,tanh,0.5,2,0.6,0.11032567918300629,,,PRUNED
2370,2370,0.12210723757743835,2023-01-05 04:32:55.070889,2023-01-05 04:33:10.409498,0 days 00:00:15.338609,sigmoid,0.5,2,0.7,0.12210723757743835,,,PRUNED
2371,2371,0.1517525464296341,2023-01-05 04:33:10.512366,2023-01-05 04:34:00.478551,0 days 00:00:49.966185,tanh,0.0,2,0.55,0.04625587537884712,,,COMPLETE
2372,2372,0.1184932217001915,2023-01-05 04:34:00.604691,2023-01-05 04:34:09.188739,0 days 00:00:08.584048,relu,0.35000000000000003,2,0.8500000000000001,0.1184932217001915,,,PRUNED
2373,2373,0.12641121447086334,2023-01-05 04:34:09.307833,2023-01-05 04:34:17.996828,0 days 00:00:08.688995,tanh,0.30000000000000004,2,0.7,0.12641121447086334,,,PRUNED
2374,2374,0.12240848690271378,2023-01-05 04:34:18.106295,2023-01-05 04:34:33.869775,0 days 00:00:15.763480,tanh,0.30000000000000004,2,0.7,0.12240848690271378,,,PRUNED
2375,2375,0.08070700615644455,2023-01-05 04:34:33.988993,2023-01-05 04:34:49.643656,0 days 00:00:15.654663,relu,0.1,2,0.8500000000000001,0.09985430538654327,0.08070700615644455,,PRUNED
2376,2376,0.1067030280828476,2023-01-05 04:34:49.737046,2023-01-05 04:34:58.393988,0 days 00:00:08.656942,tanh,0.2,2,0.65,0.1067030280828476,,,PRUNED
2377,2377,0.12765806913375854,2023-01-05 04:34:58.491969,2023-01-05 04:35:07.467451,0 days 00:00:08.975482,tanh,0.4,2,0.6,0.12765806913375854,,,PRUNED
2378,2378,0.08894229680299759,2023-01-05 04:35:07.569003,2023-01-05 04:35:23.174403,0 days 00:00:15.605400,relu,0.05,2,0.9,0.09867061674594879,0.08894229680299759,,PRUNED
2379,2379,0.15824924409389496,2023-01-05 04:35:23.266485,2023-01-05 04:36:06.032547,0 days 00:00:42.766062,tanh,0.0,2,0.55,0.047253482043743134,,,COMPLETE
2380,2380,0.16513746976852417,2023-01-05 04:36:06.163837,2023-01-05 04:36:49.130216,0 days 00:00:42.966379,tanh,0.0,2,0.5,0.05319155380129814,,,COMPLETE
2381,2381,0.16588379442691803,2023-01-05 04:36:49.246169,2023-01-05 04:36:57.917097,0 days 00:00:08.670928,tanh,0.0,2,0.6,0.16588379442691803,,,PRUNED
2382,2382,0.12077029794454575,2023-01-05 04:36:58.028589,2023-01-05 04:37:06.759047,0 days 00:00:08.730458,relu,0.45,2,1.0,0.12077029794454575,,,PRUNED
2383,2383,0.11481790244579315,2023-01-05 04:37:06.858263,2023-01-05 04:37:15.708391,0 days 00:00:08.850128,tanh,0.25,2,0.7,0.11481790244579315,,,PRUNED
2384,2384,0.0634341761469841,2023-01-05 04:37:15.812783,2023-01-05 04:37:31.438896,0 days 00:00:15.626113,relu,0.5,2,0.55,0.10003823786973953,0.0634341761469841,,PRUNED
2385,2385,0.08227625489234924,2023-01-05 04:37:31.578585,2023-01-05 04:37:47.163303,0 days 00:00:15.584718,sigmoid,0.15000000000000002,2,0.7,0.08227625489234924,,,PRUNED
2386,2386,0.11099208891391754,2023-01-05 04:37:47.264382,2023-01-05 04:37:56.180208,0 days 00:00:08.915826,tanh,0.30000000000000004,2,0.95,0.11099208891391754,,,PRUNED
2387,2387,0.11304601281881332,2023-01-05 04:37:56.293754,2023-01-05 04:38:05.120910,0 days 00:00:08.827156,relu,0.35000000000000003,3,0.75,0.11304601281881332,,,PRUNED
2388,2388,0.16618426144123077,2023-01-05 04:38:05.221942,2023-01-05 04:38:47.868221,0 days 00:00:42.646279,tanh,0.0,2,0.6,0.04925009235739708,,,COMPLETE
2389,2389,0.114360012114048,2023-01-05 04:38:47.997347,2023-01-05 04:38:56.900584,0 days 00:00:08.903237,tanh,0.1,2,0.7,0.114360012114048,,,PRUNED
2390,2390,0.05723874643445015,2023-01-05 04:38:56.999674,2023-01-05 04:39:12.456718,0 days 00:00:15.457044,tanh,0.15000000000000002,2,0.8,0.08994173258543015,0.05723874643445015,,PRUNED
2391,2391,0.1324695348739624,2023-01-05 04:39:12.550884,2023-01-05 04:39:21.198708,0 days 00:00:08.647824,relu,0.30000000000000004,2,0.6,0.1324695348739624,,,PRUNED
2392,2392,0.04722660034894943,2023-01-05 04:39:21.308785,2023-01-05 04:39:57.544342,0 days 00:00:36.235557,relu,0.5,2,0.95,0.07584244757890701,0.04722660034894943,,PRUNED
2393,2393,0.15525034070014954,2023-01-05 04:39:57.659719,2023-01-05 04:40:40.668247,0 days 00:00:43.008528,sigmoid,0.35000000000000003,2,0.65,0.06308896094560623,0.04395344480872154,,COMPLETE
2394,2394,0.10913363099098206,2023-01-05 04:40:40.789647,2023-01-05 04:40:49.399240,0 days 00:00:08.609593,tanh,0.35000000000000003,2,0.65,0.10913363099098206,,,PRUNED
2395,2395,0.14495104551315308,2023-01-05 04:40:49.483302,2023-01-05 04:40:58.357886,0 days 00:00:08.874584,relu,0.5,2,0.8500000000000001,0.14495104551315308,,,PRUNED
2396,2396,0.08108007162809372,2023-01-05 04:40:58.458619,2023-01-05 04:41:13.847356,0 days 00:00:15.388737,tanh,0.25,2,0.7,0.08108007162809372,,,PRUNED
2397,2397,0.1308293342590332,2023-01-05 04:41:13.946477,2023-01-05 04:41:22.846657,0 days 00:00:08.900180,tanh,0.30000000000000004,2,0.5,0.1308293342590332,,,PRUNED
2398,2398,0.1305210143327713,2023-01-05 04:41:22.956714,2023-01-05 04:41:31.662647,0 days 00:00:08.705933,relu,0.4,2,0.8500000000000001,0.1305210143327713,,,PRUNED
2399,2399,0.08312389999628067,2023-01-05 04:41:31.815729,2023-01-05 04:41:47.244751,0 days 00:00:15.429022,sigmoid,0.45,2,0.7,0.08312389999628067,,,PRUNED
2400,2400,0.16678038239479065,2023-01-05 04:41:47.347956,2023-01-05 04:42:23.659486,0 days 00:00:36.311530,tanh,0.5,2,0.65,0.07537326961755753,0.04561185464262962,,COMPLETE
2401,2401,0.08218936622142792,2023-01-05 04:42:23.780961,2023-01-05 04:42:39.099117,0 days 00:00:15.318156,sigmoid,0.30000000000000004,2,0.75,0.08218936622142792,,,PRUNED
2402,2402,0.12671124935150146,2023-01-05 04:42:39.199835,2023-01-05 04:42:47.748448,0 days 00:00:08.548613,tanh,0.1,2,0.6,0.12671124935150146,,,PRUNED
2403,2403,0.14514349400997162,2023-01-05 04:42:47.852759,2023-01-05 04:43:30.702572,0 days 00:00:42.849813,relu,0.30000000000000004,2,0.7,0.05506925657391548,0.040072690695524216,,COMPLETE
2404,2404,0.12358696013689041,2023-01-05 04:43:30.827622,2023-01-05 04:43:39.402794,0 days 00:00:08.575172,relu,0.05,2,0.65,0.12358696013689041,,,PRUNED
2405,2405,0.1623309850692749,2023-01-05 04:43:39.491919,2023-01-05 04:43:48.193783,0 days 00:00:08.701864,tanh,0.25,2,0.6,0.1623309850692749,,,PRUNED
2406,2406,0.1557377129793167,2023-01-05 04:43:48.310280,2023-01-05 04:43:57.234754,0 days 00:00:08.924474,tanh,0.2,2,0.9,0.1557377129793167,,,PRUNED
2407,2407,0.1472470760345459,2023-01-05 04:43:57.336469,2023-01-05 04:44:47.060843,0 days 00:00:49.724374,sigmoid,0.35000000000000003,2,0.7,0.06927641481161118,0.0446302555501461,,COMPLETE
2408,2408,0.12255778163671494,2023-01-05 04:44:47.180575,2023-01-05 04:44:55.730241,0 days 00:00:08.549666,relu,0.30000000000000004,2,0.65,0.12255778163671494,,,PRUNED
2409,2409,0.13293351233005524,2023-01-05 04:44:55.981445,2023-01-05 04:45:04.729715,0 days 00:00:08.748270,tanh,0.0,2,0.95,0.13293351233005524,,,PRUNED
2410,2410,0.0627840906381607,2023-01-05 04:45:04.829002,2023-01-05 04:45:20.362146,0 days 00:00:15.533144,relu,0.35000000000000003,2,0.7,0.09966880828142166,0.0627840906381607,,PRUNED
2411,2411,0.14942827820777893,2023-01-05 04:45:20.472760,2023-01-05 04:46:06.812421,0 days 00:00:46.339661,tanh,0.0,2,0.55,0.04309734329581261,,,COMPLETE
2412,2412,0.14999553561210632,2023-01-05 04:46:06.939496,2023-01-05 04:46:15.682410,0 days 00:00:08.742914,tanh,0.45,2,0.6,0.14999553561210632,,,PRUNED
2413,2413,0.07344641536474228,2023-01-05 04:46:15.782126,2023-01-05 04:46:31.306206,0 days 00:00:15.524080,relu,0.1,2,0.8500000000000001,0.1033402532339096,0.07344641536474228,,PRUNED
2414,2414,0.15977033972740173,2023-01-05 04:46:31.399593,2023-01-05 04:47:14.384654,0 days 00:00:42.985061,tanh,0.05,2,0.55,0.04727320373058319,,,COMPLETE
2415,2415,0.14904581010341644,2023-01-05 04:47:14.507525,2023-01-05 04:48:00.521321,0 days 00:00:46.013796,tanh,0.05,2,0.5,0.04223988577723503,,,COMPLETE
2416,2416,0.07949025928974152,2023-01-05 04:48:00.641298,2023-01-05 04:48:15.981475,0 days 00:00:15.340177,tanh,0.5,2,0.65,0.07949025928974152,,,PRUNED
2417,2417,0.12082060426473618,2023-01-05 04:48:16.075863,2023-01-05 04:48:25.223426,0 days 00:00:09.147563,tanh,0.4,4,0.55,0.12082060426473618,,,PRUNED
2418,2418,0.05296175181865692,2023-01-05 04:48:25.323144,2023-01-05 04:49:01.319642,0 days 00:00:35.996498,sigmoid,0.4,2,0.6,0.07807297259569168,0.05296175181865692,,PRUNED
2419,2419,0.1526898741722107,2023-01-05 04:49:01.422370,2023-01-05 04:49:50.987818,0 days 00:00:49.565448,tanh,0.0,2,0.6,0.045442741364240646,,,COMPLETE
2420,2420,0.07722272723913193,2023-01-05 04:49:51.113735,2023-01-05 04:50:06.814607,0 days 00:00:15.700872,relu,0.35000000000000003,2,0.5,0.10475575923919678,0.07722272723913193,,PRUNED
2421,2421,0.12911032140254974,2023-01-05 04:50:06.906983,2023-01-05 04:50:15.664910,0 days 00:00:08.757927,tanh,0.5,2,0.6,0.12911032140254974,,,PRUNED
2422,2422,0.1493045538663864,2023-01-05 04:50:15.765839,2023-01-05 04:51:02.230288,0 days 00:00:46.464449,relu,0.25,2,1.0,0.06600935757160187,0.04335439205169678,,COMPLETE
2423,2423,0.12347707152366638,2023-01-05 04:51:02.355382,2023-01-05 04:51:11.059555,0 days 00:00:08.704173,tanh,0.30000000000000004,2,0.7,0.12347707152366638,,,PRUNED
2424,2424,0.11416779458522797,2023-01-05 04:51:11.160567,2023-01-05 04:51:19.875626,0 days 00:00:08.715059,relu,0.1,2,0.75,0.11416779458522797,,,PRUNED
2425,2425,0.1285950243473053,2023-01-05 04:51:19.977418,2023-01-05 04:51:29.018204,0 days 00:00:09.040786,tanh,0.30000000000000004,2,0.65,0.1285950243473053,,,PRUNED
2426,2426,0.14379112422466278,2023-01-05 04:51:29.118409,2023-01-05 04:51:37.807576,0 days 00:00:08.689167,relu,0.35000000000000003,2,0.8,0.14379112422466278,,,PRUNED
2427,2427,0.05019437149167061,2023-01-05 04:51:37.895551,2023-01-05 04:52:13.696241,0 days 00:00:35.800690,tanh,0.5,2,0.75,0.07188817113637924,0.05019437149167061,,PRUNED
2428,2428,0.10722382366657257,2023-01-05 04:52:13.801260,2023-01-05 04:52:22.830102,0 days 00:00:09.028842,tanh,0.45,3,0.55,0.10722382366657257,,,PRUNED
2429,2429,0.1472863405942917,2023-01-05 04:52:22.935394,2023-01-05 04:53:12.506609,0 days 00:00:49.571215,tanh,0.25,2,0.5,0.04497860372066498,,,COMPLETE
2430,2430,0.04721611738204956,2023-01-05 04:53:12.632673,2023-01-05 04:53:48.547488,0 days 00:00:35.914815,sigmoid,0.30000000000000004,2,0.9,0.06768708676099777,0.04721611738204956,,PRUNED
2431,2431,0.10890036821365356,2023-01-05 04:53:48.664876,2023-01-05 04:53:57.347811,0 days 00:00:08.682935,relu,0.4,2,0.8500000000000001,0.10890036821365356,,,PRUNED
2432,2432,0.1662651002407074,2023-01-05 04:53:57.449538,2023-01-05 04:54:47.255751,0 days 00:00:49.806213,tanh,0.25,2,0.5,0.054918721318244934,,,COMPLETE
2433,2433,0.189264714717865,2023-01-05 04:54:47.380480,2023-01-05 04:54:56.186350,0 days 00:00:08.805870,tanh,0.05,2,0.6,0.189264714717865,,,PRUNED
2434,2434,0.114605613052845,2023-01-05 04:54:56.293987,2023-01-05 04:55:32.281152,0 days 00:00:35.987165,sigmoid,0.35000000000000003,2,0.7,0.07691909372806549,0.114605613052845,,PRUNED
2435,2435,0.171905055642128,2023-01-05 04:55:32.383172,2023-01-05 04:55:41.064812,0 days 00:00:08.681640,relu,0.25,2,0.6,0.171905055642128,,,PRUNED
2436,2436,0.05066810920834541,2023-01-05 04:55:41.173869,2023-01-05 04:56:17.377678,0 days 00:00:36.203809,tanh,0.5,3,0.7,0.07795567810535431,0.05066810920834541,,PRUNED
2437,2437,0.12585203349590302,2023-01-05 04:56:17.503131,2023-01-05 04:56:26.193715,0 days 00:00:08.690584,tanh,0.5,2,0.8500000000000001,0.12585203349590302,,,PRUNED
2438,2438,0.07899361103773117,2023-01-05 04:56:26.295511,2023-01-05 04:56:41.667468,0 days 00:00:15.371957,sigmoid,0.35000000000000003,2,0.7,0.07899361103773117,,,PRUNED
2439,2439,0.16192856431007385,2023-01-05 04:56:41.775212,2023-01-05 04:56:50.642787,0 days 00:00:08.867575,tanh,0.30000000000000004,2,0.65,0.16192856431007385,,,PRUNED
2440,2440,0.11299740523099899,2023-01-05 04:56:50.743499,2023-01-05 04:56:59.341343,0 days 00:00:08.597844,relu,0.1,2,0.7,0.11299740523099899,,,PRUNED
2441,2441,0.14905843138694763,2023-01-05 04:56:59.448894,2023-01-05 04:57:08.198875,0 days 00:00:08.749981,tanh,0.35000000000000003,2,0.6,0.14905843138694763,,,PRUNED
2442,2442,0.12248443067073822,2023-01-05 04:57:08.319144,2023-01-05 04:57:17.206394,0 days 00:00:08.887250,relu,0.30000000000000004,2,0.9,0.12248443067073822,,,PRUNED
2443,2443,0.06859282404184341,2023-01-05 04:57:17.314182,2023-01-05 04:57:33.029898,0 days 00:00:15.715716,tanh,0.5,2,0.55,0.10224851965904236,0.06859282404184341,,PRUNED
2444,2444,0.1666928231716156,2023-01-05 04:57:33.131967,2023-01-05 04:57:41.912877,0 days 00:00:08.780910,relu,0.4,2,0.5,0.1666928231716156,,,PRUNED
2445,2445,0.11738194525241852,2023-01-05 04:57:42.037038,2023-01-05 04:57:51.029249,0 days 00:00:08.992211,tanh,0.30000000000000004,2,0.8500000000000001,0.11738194525241852,,,PRUNED
2446,2446,0.12779662013053894,2023-01-05 04:57:51.151848,2023-01-05 04:57:59.910484,0 days 00:00:08.758636,relu,0.15000000000000002,2,0.6,0.12779662013053894,,,PRUNED
2447,2447,0.13923582434654236,2023-01-05 04:58:00.000467,2023-01-05 04:58:08.735807,0 days 00:00:08.735340,tanh,0.35000000000000003,2,0.65,0.13923582434654236,,,PRUNED
2448,2448,0.1512443870306015,2023-01-05 04:58:08.836924,2023-01-05 04:58:55.428842,0 days 00:00:46.591918,relu,0.4,2,0.65,0.07360152155160904,0.044137101620435715,,COMPLETE
2449,2449,0.15102069079875946,2023-01-05 04:58:55.558854,2023-01-05 04:59:04.263855,0 days 00:00:08.705001,tanh,0.1,2,0.7,0.15102069079875946,,,PRUNED
2450,2450,0.048158127814531326,2023-01-05 04:59:04.365712,2023-01-05 04:59:40.512471,0 days 00:00:36.146759,tanh,0.45,2,0.65,0.0697091594338417,0.048158127814531326,,PRUNED
2451,2451,0.1200077086687088,2023-01-05 04:59:40.614733,2023-01-05 04:59:49.318714,0 days 00:00:08.703981,relu,0.0,2,0.8500000000000001,0.1200077086687088,,,PRUNED
