,number,value,datetime_start,datetime_complete,duration,params_activation,params_dropout,params_layers,params_shrink,system_attrs_completed_rung_0,system_attrs_completed_rung_1,system_attrs_completed_rung_2,state
1277,1277,0.14574018120765686,2023-01-04 21:30:39.777200,2023-01-04 21:31:23.359882,0 days 00:00:43.582682,tanh,0.30000000000000004,2,0.55,0.061485935002565384,0.04035169258713722,,COMPLETE
1278,1278,0.046253614127635956,2023-01-04 21:31:23.485282,2023-01-04 21:31:59.687532,0 days 00:00:36.202250,relu,0.4,2,0.9,0.10952199250459671,0.06423790007829666,0.046253614127635956,PRUNED
1279,1279,0.048962127417325974,2023-01-04 21:31:59.818903,2023-01-04 21:32:36.254766,0 days 00:00:36.435863,tanh,0.30000000000000004,2,0.55,0.06940704584121704,0.048962127417325974,,PRUNED
1280,1280,0.1383482664823532,2023-01-04 21:32:36.392409,2023-01-04 21:32:45.184625,0 days 00:00:08.792216,relu,0.4,2,0.95,0.1383482664823532,,,PRUNED
1281,1281,0.09994819760322571,2023-01-04 21:32:45.307734,2023-01-04 21:33:01.116706,0 days 00:00:15.808972,tanh,0.30000000000000004,2,0.8,0.09994819760322571,,,PRUNED
1282,1282,0.12627485394477844,2023-01-04 21:33:01.239840,2023-01-04 21:33:10.033054,0 days 00:00:08.793214,relu,0.4,2,0.95,0.12627485394477844,,,PRUNED
1283,1283,0.08799061179161072,2023-01-04 21:33:10.149198,2023-01-04 21:33:25.714817,0 days 00:00:15.565619,relu,0.4,2,0.9,0.11561167985200882,0.08799061179161072,,PRUNED
1284,1284,0.13611358404159546,2023-01-04 21:33:25.839037,2023-01-04 21:33:34.489410,0 days 00:00:08.650373,relu,0.4,2,0.9,0.13611358404159546,,,PRUNED
1285,1285,0.07940753549337387,2023-01-04 21:33:34.605522,2023-01-04 21:33:50.556373,0 days 00:00:15.950851,tanh,0.30000000000000004,3,0.55,0.07940753549337387,,,PRUNED
1286,1286,0.07466478645801544,2023-01-04 21:33:50.681824,2023-01-04 21:34:06.352970,0 days 00:00:15.671146,tanh,0.25,2,0.55,0.07466478645801544,,,PRUNED
1287,1287,0.04519103094935417,2023-01-04 21:34:06.468294,2023-01-04 21:34:42.700410,0 days 00:00:36.232116,relu,0.45,2,0.95,0.09483659267425537,0.06367835402488708,0.04519103094935417,PRUNED
1288,1288,0.13044209778308868,2023-01-04 21:34:42.815956,2023-01-04 21:34:51.825535,0 days 00:00:09.009579,relu,0.30000000000000004,2,0.9,0.13044209778308868,,,PRUNED
1289,1289,0.0448167659342289,2023-01-04 21:34:51.938675,2023-01-04 21:35:28.142799,0 days 00:00:36.204124,relu,0.35000000000000003,2,0.9,0.11862847208976746,0.06394904851913452,0.0448167659342289,PRUNED
1290,1290,0.13281702995300293,2023-01-04 21:35:28.256030,2023-01-04 21:35:37.063490,0 days 00:00:08.807460,relu,0.45,2,0.95,0.13281702995300293,,,PRUNED
1291,1291,0.16534093022346497,2023-01-04 21:35:37.179115,2023-01-04 21:35:46.079500,0 days 00:00:08.900385,relu,0.35000000000000003,2,0.95,0.16534093022346497,,,PRUNED
1292,1292,0.13719779253005981,2023-01-04 21:35:46.186569,2023-01-04 21:35:55.053409,0 days 00:00:08.866840,relu,0.30000000000000004,2,0.9,0.13719779253005981,,,PRUNED
1293,1293,0.04544350132346153,2023-01-04 21:35:55.187412,2023-01-04 21:36:31.500342,0 days 00:00:36.312930,relu,0.25,2,1.0,0.10816197842359543,0.06360247731208801,0.04544350132346153,PRUNED
1294,1294,0.10323362052440643,2023-01-04 21:36:31.615319,2023-01-04 21:36:47.199717,0 days 00:00:15.584398,tanh,0.30000000000000004,2,0.55,0.10323362052440643,,,PRUNED
1295,1295,0.1367735117673874,2023-01-04 21:36:47.316692,2023-01-04 21:36:56.366130,0 days 00:00:09.049438,relu,0.45,3,0.5,0.1367735117673874,,,PRUNED
1296,1296,0.16129286587238312,2023-01-04 21:36:56.482846,2023-01-04 21:37:05.240267,0 days 00:00:08.757421,sigmoid,0.1,2,0.9,0.16129286587238312,,,PRUNED
1297,1297,0.07625386118888855,2023-01-04 21:37:05.354407,2023-01-04 21:37:20.929886,0 days 00:00:15.575479,tanh,0.30000000000000004,2,0.55,0.07625386118888855,,,PRUNED
1298,1298,0.1488349735736847,2023-01-04 21:37:21.035940,2023-01-04 21:37:29.863788,0 days 00:00:08.827848,relu,0.35000000000000003,2,1.0,0.1488349735736847,,,PRUNED
1299,1299,0.12261763960123062,2023-01-04 21:37:29.978424,2023-01-04 21:37:39.004703,0 days 00:00:09.026279,relu,0.4,2,0.8500000000000001,0.12261763960123062,,,PRUNED
1300,1300,0.12434810400009155,2023-01-04 21:37:39.111819,2023-01-04 21:37:47.849319,0 days 00:00:08.737500,relu,0.35000000000000003,2,0.7,0.12434810400009155,,,PRUNED
1301,1301,0.17939257621765137,2023-01-04 21:37:47.950651,2023-01-04 21:37:56.973132,0 days 00:00:09.022481,sigmoid,0.4,5,0.8,0.17939257621765137,,,PRUNED
1302,1302,0.04539545252919197,2023-01-04 21:37:57.093552,2023-01-04 21:38:33.753328,0 days 00:00:36.659776,relu,0.35000000000000003,2,0.65,0.11500561982393265,0.06502100825309753,0.04539545252919197,PRUNED
1303,1303,0.14589031040668488,2023-01-04 21:38:33.875108,2023-01-04 21:39:17.334676,0 days 00:00:43.459568,relu,0.45,2,0.8500000000000001,0.08082053810358047,0.06202367693185806,0.04255839064717293,COMPLETE
1304,1304,0.04886745288968086,2023-01-04 21:39:17.466790,2023-01-04 21:39:53.738462,0 days 00:00:36.271672,relu,0.45,2,0.8500000000000001,0.11797168105840683,0.06540388613939285,0.04886745288968086,PRUNED
1305,1305,0.07302723079919815,2023-01-04 21:39:53.859737,2023-01-04 21:40:09.546458,0 days 00:00:15.686721,tanh,0.30000000000000004,2,0.55,0.07302723079919815,,,PRUNED
1306,1306,0.09948907792568207,2023-01-04 21:40:09.668196,2023-01-04 21:40:25.578701,0 days 00:00:15.910505,tanh,0.30000000000000004,2,0.55,0.09948907792568207,,,PRUNED
1307,1307,0.14857685565948486,2023-01-04 21:40:25.707959,2023-01-04 21:40:34.535716,0 days 00:00:08.827757,relu,0.45,2,0.8500000000000001,0.14857685565948486,,,PRUNED
1308,1308,0.2320893257856369,2023-01-04 21:40:34.664993,2023-01-04 21:40:43.791171,0 days 00:00:09.126178,relu,0.45,6,0.8500000000000001,0.2320893257856369,,,PRUNED
1309,1309,0.04828103631734848,2023-01-04 21:40:43.904949,2023-01-04 21:41:20.490097,0 days 00:00:36.585148,tanh,0.25,2,0.6,0.06652161478996277,0.04828103631734848,,PRUNED
1310,1310,0.044508665800094604,2023-01-04 21:41:20.610518,2023-01-04 21:41:56.979005,0 days 00:00:36.368487,tanh,0.30000000000000004,2,0.55,0.06499847769737244,0.044508665800094604,,PRUNED
1311,1311,0.07470943033695221,2023-01-04 21:41:57.100650,2023-01-04 21:42:12.828301,0 days 00:00:15.727651,relu,0.45,2,0.9,0.1209239736199379,0.07470943033695221,,PRUNED
1312,1312,0.07236184179782867,2023-01-04 21:42:12.949320,2023-01-04 21:42:28.869272,0 days 00:00:15.919952,relu,0.45,2,0.95,0.11176370829343796,0.07236184179782867,,PRUNED
1313,1313,0.07232080399990082,2023-01-04 21:42:28.990132,2023-01-04 21:42:44.742371,0 days 00:00:15.752239,relu,0.45,2,0.8,0.11863704025745392,0.07232080399990082,,PRUNED
1314,1314,0.09281881153583527,2023-01-04 21:42:44.863483,2023-01-04 21:43:00.724663,0 days 00:00:15.861180,relu,0.45,2,0.5,0.12056351453065872,0.09281881153583527,,PRUNED
1315,1315,0.051900748163461685,2023-01-04 21:43:00.837633,2023-01-04 21:43:37.113195,0 days 00:00:36.275562,tanh,0.30000000000000004,2,0.6,0.07099635899066925,0.051900748163461685,,PRUNED
1316,1316,0.082400843501091,2023-01-04 21:43:37.234536,2023-01-04 21:43:53.736849,0 days 00:00:16.502313,tanh,0.2,2,0.7,0.082400843501091,,,PRUNED
1317,1317,0.045798610895872116,2023-01-04 21:43:53.861281,2023-01-04 21:44:30.217527,0 days 00:00:36.356246,sigmoid,0.45,2,0.6,0.06393816322088242,0.045798610895872116,,PRUNED
1318,1318,0.078742116689682,2023-01-04 21:44:30.339863,2023-01-04 21:44:46.000328,0 days 00:00:15.660465,tanh,0.0,2,0.55,0.078742116689682,,,PRUNED
1319,1319,0.07552767544984818,2023-01-04 21:44:46.111381,2023-01-04 21:45:01.649396,0 days 00:00:15.538015,tanh,0.25,2,0.65,0.07552767544984818,,,PRUNED
1320,1320,0.07277809083461761,2023-01-04 21:45:01.769820,2023-01-04 21:45:17.711784,0 days 00:00:15.941964,tanh,0.05,2,0.6,0.07277809083461761,,,PRUNED
1321,1321,0.14257663488388062,2023-01-04 21:45:17.834129,2023-01-04 21:46:08.215239,0 days 00:00:50.381110,tanh,0.30000000000000004,2,0.6,0.0666201189160347,0.03965608403086662,,COMPLETE
1322,1322,0.19174377620220184,2023-01-04 21:46:08.368458,2023-01-04 21:46:17.926970,0 days 00:00:09.558512,relu,0.45,8,1.0,0.19174377620220184,,,PRUNED
1323,1323,0.04763829708099365,2023-01-04 21:46:18.040076,2023-01-04 21:46:54.707075,0 days 00:00:36.666999,tanh,0.30000000000000004,2,0.6,0.060678448528051376,0.04763829708099365,,PRUNED
1324,1324,0.12315867096185684,2023-01-04 21:46:54.811145,2023-01-04 21:47:03.615185,0 days 00:00:08.804040,relu,0.45,2,0.7,0.12315867096185684,,,PRUNED
1325,1325,0.07353207468986511,2023-01-04 21:47:03.734605,2023-01-04 21:47:19.372333,0 days 00:00:15.637728,tanh,0.05,2,0.6,0.07353207468986511,,,PRUNED
1326,1326,0.19346876442432404,2023-01-04 21:47:19.498711,2023-01-04 21:47:35.837946,0 days 00:00:16.339235,tanh,0.30000000000000004,7,0.6,0.19346876442432404,,,PRUNED
1327,1327,0.14913709461688995,2023-01-04 21:47:35.958143,2023-01-04 21:48:19.235677,0 days 00:00:43.277534,tanh,0.15000000000000002,2,0.6,0.06359407305717468,0.042640939354896545,,COMPLETE
1328,1328,0.15105630457401276,2023-01-04 21:48:19.376097,2023-01-04 21:48:28.033893,0 days 00:00:08.657796,relu,0.45,2,0.8500000000000001,0.15105630457401276,,,PRUNED
1329,1329,0.13544824719429016,2023-01-04 21:48:28.146370,2023-01-04 21:48:37.091914,0 days 00:00:08.945544,relu,0.4,2,0.8500000000000001,0.13544824719429016,,,PRUNED
1330,1330,0.049297161400318146,2023-01-04 21:48:37.211036,2023-01-04 21:49:13.454644,0 days 00:00:36.243608,tanh,0.4,2,0.8500000000000001,0.06473349034786224,0.049297161400318146,,PRUNED
1331,1331,0.1512041538953781,2023-01-04 21:49:13.575651,2023-01-04 21:49:56.864636,0 days 00:00:43.288985,tanh,0.30000000000000004,2,0.6,0.059379126876592636,0.04197200387716293,,COMPLETE
1332,1332,0.13252660632133484,2023-01-04 21:49:56.983535,2023-01-04 21:50:05.751697,0 days 00:00:08.768162,relu,0.45,2,0.8500000000000001,0.13252660632133484,,,PRUNED
1333,1333,0.04801127687096596,2023-01-04 21:50:05.879909,2023-01-04 21:50:42.773274,0 days 00:00:36.893365,relu,0.35000000000000003,3,0.65,0.10064955055713654,0.06393019109964371,0.04801127687096596,PRUNED
1334,1334,0.080434150993824,2023-01-04 21:50:42.893429,2023-01-04 21:50:58.580729,0 days 00:00:15.687300,tanh,0.25,2,0.6,0.080434150993824,,,PRUNED
1335,1335,0.07826227694749832,2023-01-04 21:50:58.710231,2023-01-04 21:51:14.446247,0 days 00:00:15.736016,relu,0.4,2,0.8500000000000001,0.11639079451560974,0.07826227694749832,,PRUNED
1336,1336,0.08344654738903046,2023-01-04 21:51:14.566686,2023-01-04 21:51:30.461703,0 days 00:00:15.895017,sigmoid,0.30000000000000004,2,0.8,0.11351589858531952,0.08344654738903046,,PRUNED
1337,1337,0.12987513840198517,2023-01-04 21:51:30.582123,2023-01-04 21:51:39.486281,0 days 00:00:08.904158,relu,0.45,2,0.9,0.12987513840198517,,,PRUNED
1338,1338,0.07305082678794861,2023-01-04 21:51:39.606927,2023-01-04 21:51:55.292331,0 days 00:00:15.685404,tanh,0.15000000000000002,3,0.65,0.07305082678794861,,,PRUNED
1339,1339,0.20656201243400574,2023-01-04 21:51:55.405372,2023-01-04 21:52:04.201558,0 days 00:00:08.796186,relu,0.35000000000000003,2,0.8500000000000001,0.20656201243400574,,,PRUNED
1340,1340,0.1278967559337616,2023-01-04 21:52:04.313932,2023-01-04 21:52:13.316529,0 days 00:00:09.002597,relu,0.30000000000000004,2,0.8500000000000001,0.1278967559337616,,,PRUNED
1341,1341,0.12734313309192657,2023-01-04 21:52:13.429358,2023-01-04 21:52:22.433244,0 days 00:00:09.003886,sigmoid,0.0,4,1.0,0.12734313309192657,,,PRUNED
1342,1342,0.1775229126214981,2023-01-04 21:52:22.554201,2023-01-04 21:52:31.348852,0 days 00:00:08.794651,relu,0.4,2,0.55,0.1775229126214981,,,PRUNED
1343,1343,0.12962768971920013,2023-01-04 21:52:31.451866,2023-01-04 21:52:40.415079,0 days 00:00:08.963213,relu,0.45,2,0.8500000000000001,0.12962768971920013,,,PRUNED
1344,1344,0.08993992209434509,2023-01-04 21:52:40.517512,2023-01-04 21:52:56.179265,0 days 00:00:15.661753,sigmoid,0.35000000000000003,2,0.8500000000000001,0.11956900358200073,0.08993992209434509,,PRUNED
1345,1345,0.14683401584625244,2023-01-04 21:52:56.300332,2023-01-04 21:53:53.201514,0 days 00:00:56.901182,tanh,0.05,2,0.6,0.06480173021554947,0.043452903628349304,,COMPLETE
1346,1346,0.12708917260169983,2023-01-04 21:53:53.341603,2023-01-04 21:54:01.999769,0 days 00:00:08.658166,relu,0.45,2,0.9,0.12708917260169983,,,PRUNED
1347,1347,0.12834309041500092,2023-01-04 21:54:02.096871,2023-01-04 21:54:11.107910,0 days 00:00:09.011039,relu,0.35000000000000003,2,0.95,0.12834309041500092,,,PRUNED
1348,1348,0.20064540207386017,2023-01-04 21:54:11.219544,2023-01-04 21:54:20.015754,0 days 00:00:08.796210,relu,0.30000000000000004,2,0.75,0.20064540207386017,,,PRUNED
1349,1349,0.13640955090522766,2023-01-04 21:54:20.133987,2023-01-04 21:54:28.956638,0 days 00:00:08.822651,sigmoid,0.45,2,0.7,0.13640955090522766,,,PRUNED
1350,1350,0.12701761722564697,2023-01-04 21:54:29.063316,2023-01-04 21:54:37.839223,0 days 00:00:08.775907,relu,0.4,2,0.6,0.12701761722564697,,,PRUNED
1351,1351,0.13635574281215668,2023-01-04 21:54:37.952313,2023-01-04 21:54:46.880211,0 days 00:00:08.927898,relu,0.05,2,0.8,0.13635574281215668,,,PRUNED
1352,1352,0.04569274187088013,2023-01-04 21:54:46.993307,2023-01-04 21:55:23.293856,0 days 00:00:36.300549,relu,0.35000000000000003,2,0.8500000000000001,0.10513224452733994,0.06194198876619339,0.04569274187088013,PRUNED
1353,1353,0.051286887377500534,2023-01-04 21:55:23.416576,2023-01-04 21:55:59.707671,0 days 00:00:36.291095,sigmoid,0.45,2,0.8500000000000001,0.11388766020536423,0.06494530290365219,0.051286887377500534,PRUNED
1354,1354,0.07491399347782135,2023-01-04 21:55:59.829468,2023-01-04 21:56:15.540182,0 days 00:00:15.710714,tanh,0.05,2,0.6,0.07491399347782135,,,PRUNED
1355,1355,0.07439451664686203,2023-01-04 21:56:15.659602,2023-01-04 21:56:31.372276,0 days 00:00:15.712674,relu,0.25,2,0.7,0.12096851319074631,0.07439451664686203,,PRUNED
1356,1356,0.12681037187576294,2023-01-04 21:56:31.494403,2023-01-04 21:56:40.280503,0 days 00:00:08.786100,relu,0.35000000000000003,2,0.5,0.12681037187576294,,,PRUNED
1357,1357,0.07638859003782272,2023-01-04 21:56:40.393447,2023-01-04 21:56:56.045457,0 days 00:00:15.652010,tanh,0.30000000000000004,2,0.6,0.07638859003782272,,,PRUNED
1358,1358,0.12668299674987793,2023-01-04 21:56:56.157641,2023-01-04 21:57:05.261420,0 days 00:00:09.103779,sigmoid,0.30000000000000004,3,0.8500000000000001,0.12668299674987793,,,PRUNED
1359,1359,0.1583976000547409,2023-01-04 21:57:05.381592,2023-01-04 21:57:14.194070,0 days 00:00:08.812478,relu,0.4,2,0.8500000000000001,0.1583976000547409,,,PRUNED
1360,1360,0.1289638727903366,2023-01-04 21:57:14.306076,2023-01-04 21:57:23.059940,0 days 00:00:08.753864,relu,0.45,2,0.9,0.1289638727903366,,,PRUNED
1361,1361,0.07740756124258041,2023-01-04 21:57:23.164035,2023-01-04 21:57:38.941216,0 days 00:00:15.777181,tanh,0.0,2,0.65,0.07740756124258041,,,PRUNED
1362,1362,0.1782301962375641,2023-01-04 21:57:39.054305,2023-01-04 21:57:47.850043,0 days 00:00:08.795738,relu,0.35000000000000003,2,1.0,0.1782301962375641,,,PRUNED
1363,1363,0.15473376214504242,2023-01-04 21:57:47.969833,2023-01-04 21:58:31.281587,0 days 00:00:43.311754,sigmoid,0.4,2,0.8500000000000001,0.11023367941379547,0.062183018773794174,0.04282738268375397,COMPLETE
1364,1364,0.1274300515651703,2023-01-04 21:58:31.414396,2023-01-04 21:58:39.996715,0 days 00:00:08.582319,relu,0.30000000000000004,2,0.8500000000000001,0.1274300515651703,,,PRUNED
1365,1365,0.14348775148391724,2023-01-04 21:58:40.100693,2023-01-04 21:59:26.917000,0 days 00:00:46.816307,relu,0.35000000000000003,2,0.8500000000000001,0.11745095998048782,0.05598881468176842,0.040001627057790756,COMPLETE
1366,1366,0.07699176669120789,2023-01-04 21:59:27.050826,2023-01-04 21:59:42.449155,0 days 00:00:15.398329,tanh,0.45,2,0.7,0.07699176669120789,,,PRUNED
1367,1367,0.04502278193831444,2023-01-04 21:59:42.570285,2023-01-04 22:00:18.887178,0 days 00:00:36.316893,tanh,0.30000000000000004,2,0.6,0.057212263345718384,0.04502278193831444,,PRUNED
1368,1368,0.0800747200846672,2023-01-04 22:00:19.030263,2023-01-04 22:00:34.786271,0 days 00:00:15.756008,sigmoid,0.2,2,0.6,0.0800747200846672,,,PRUNED
1369,1369,0.1222815290093422,2023-01-04 22:00:34.908700,2023-01-04 22:00:43.711114,0 days 00:00:08.802414,relu,0.35000000000000003,2,0.8,0.1222815290093422,,,PRUNED
1370,1370,0.14178943634033203,2023-01-04 22:00:43.815357,2023-01-04 22:00:52.386239,0 days 00:00:08.570882,relu,0.45,2,0.8500000000000001,0.14178943634033203,,,PRUNED
1371,1371,0.1221316009759903,2023-01-04 22:00:52.507345,2023-01-04 22:01:01.310272,0 days 00:00:08.802927,relu,0.35000000000000003,3,0.8,0.1221316009759903,,,PRUNED
1372,1372,0.2136950045824051,2023-01-04 22:01:01.422357,2023-01-04 22:01:10.408479,0 days 00:00:08.986122,relu,0.45,2,0.75,0.2136950045824051,,,PRUNED
1373,1373,0.1745455414056778,2023-01-04 22:01:10.529456,2023-01-04 22:01:43.349467,0 days 00:00:32.820011,relu,0.35000000000000003,2,0.8500000000000001,0.11499548703432083,0.05718737095594406,,COMPLETE
1374,1374,0.044373586773872375,2023-01-04 22:01:43.481953,2023-01-04 22:02:19.503745,0 days 00:00:36.021792,tanh,0.4,2,0.65,0.06769976019859314,0.044373586773872375,,PRUNED
1375,1375,0.16750775277614594,2023-01-04 22:02:19.632115,2023-01-04 22:02:28.495357,0 days 00:00:08.863242,relu,0.30000000000000004,2,0.8500000000000001,0.16750775277614594,,,PRUNED
1376,1376,0.10591337084770203,2023-01-04 22:02:28.614778,2023-01-04 22:02:44.293164,0 days 00:00:15.678386,relu,0.45,2,0.8500000000000001,0.10955864191055298,0.10591337084770203,,PRUNED
1377,1377,0.1687878668308258,2023-01-04 22:02:44.413296,2023-01-04 22:02:53.176828,0 days 00:00:08.763532,relu,0.4,2,0.8500000000000001,0.1687878668308258,,,PRUNED
1378,1378,0.13509395718574524,2023-01-04 22:02:53.295912,2023-01-04 22:03:02.009484,0 days 00:00:08.713572,relu,0.35000000000000003,2,0.8500000000000001,0.13509395718574524,,,PRUNED
1379,1379,0.07526341825723648,2023-01-04 22:03:02.129911,2023-01-04 22:03:18.032884,0 days 00:00:15.902973,relu,0.45,2,0.8,0.10100614279508591,0.07526341825723648,,PRUNED
1380,1380,0.07402059435844421,2023-01-04 22:03:18.152948,2023-01-04 22:03:33.681758,0 days 00:00:15.528810,relu,0.35000000000000003,2,0.8500000000000001,0.09980759769678116,0.07402059435844421,,PRUNED
1381,1381,0.07375126332044601,2023-01-04 22:03:33.801866,2023-01-04 22:03:49.497325,0 days 00:00:15.695459,relu,0.35000000000000003,2,0.8500000000000001,0.11860917508602142,0.07375126332044601,,PRUNED
1382,1382,0.05272601172327995,2023-01-04 22:03:49.624409,2023-01-04 22:04:26.068919,0 days 00:00:36.444510,tanh,0.30000000000000004,2,0.6,0.06353828310966492,0.05272601172327995,,PRUNED
1383,1383,0.044584739953279495,2023-01-04 22:04:26.189983,2023-01-04 22:05:02.557258,0 days 00:00:36.367275,relu,0.4,2,0.8500000000000001,0.09177158027887344,0.06341078877449036,0.044584739953279495,PRUNED
1384,1384,0.1376470923423767,2023-01-04 22:05:02.681033,2023-01-04 22:05:11.533517,0 days 00:00:08.852484,relu,0.25,2,0.8500000000000001,0.1376470923423767,,,PRUNED
1385,1385,0.07000408321619034,2023-01-04 22:05:11.645943,2023-01-04 22:05:27.298711,0 days 00:00:15.652768,relu,0.45,2,0.75,0.11261570453643799,0.07000408321619034,,PRUNED
1386,1386,0.10680557042360306,2023-01-04 22:05:27.418591,2023-01-04 22:05:43.246316,0 days 00:00:15.827725,tanh,0.5,2,0.6,0.10680557042360306,,,PRUNED
1387,1387,0.12526284158229828,2023-01-04 22:05:43.368500,2023-01-04 22:05:52.305236,0 days 00:00:08.936736,relu,0.45,2,0.8500000000000001,0.12526284158229828,,,PRUNED
1388,1388,0.04566537216305733,2023-01-04 22:05:52.435217,2023-01-04 22:06:28.676218,0 days 00:00:36.241001,tanh,0.05,2,0.65,0.0648653507232666,0.04566537216305733,,PRUNED
1389,1389,0.16159985959529877,2023-01-04 22:06:28.798639,2023-01-04 22:06:37.573306,0 days 00:00:08.774667,sigmoid,0.30000000000000004,2,0.8500000000000001,0.16159985959529877,,,PRUNED
1390,1390,0.13472610712051392,2023-01-04 22:06:37.680304,2023-01-04 22:06:46.622622,0 days 00:00:08.942318,relu,0.35000000000000003,2,0.7,0.13472610712051392,,,PRUNED
1391,1391,0.08163668215274811,2023-01-04 22:06:46.736687,2023-01-04 22:07:02.196217,0 days 00:00:15.459530,tanh,0.1,2,0.6,0.08163668215274811,,,PRUNED
1392,1392,0.09164542704820633,2023-01-04 22:07:02.312263,2023-01-04 22:07:17.928430,0 days 00:00:15.616167,tanh,0.30000000000000004,2,0.6,0.09164542704820633,,,PRUNED
1393,1393,0.17199842631816864,2023-01-04 22:07:18.044274,2023-01-04 22:07:26.969578,0 days 00:00:08.925304,relu,0.4,2,0.65,0.17199842631816864,,,PRUNED
1394,1394,0.15144693851470947,2023-01-04 22:07:27.087339,2023-01-04 22:07:35.694168,0 days 00:00:08.606829,sigmoid,0.30000000000000004,2,0.8,0.15144693851470947,,,PRUNED
1395,1395,0.10195378214120865,2023-01-04 22:07:35.809243,2023-01-04 22:07:51.776051,0 days 00:00:15.966808,tanh,0.25,6,0.6,0.10195378214120865,,,PRUNED
1396,1396,0.0946970134973526,2023-01-04 22:07:51.901128,2023-01-04 22:08:07.674742,0 days 00:00:15.773614,tanh,0.30000000000000004,2,0.65,0.0946970134973526,,,PRUNED
1397,1397,0.13128358125686646,2023-01-04 22:08:07.804749,2023-01-04 22:08:16.565406,0 days 00:00:08.760657,relu,0.35000000000000003,2,0.8500000000000001,0.13128358125686646,,,PRUNED
1398,1398,0.049690473824739456,2023-01-04 22:08:16.680432,2023-01-04 22:08:52.812095,0 days 00:00:36.131663,sigmoid,0.1,2,0.6,0.06868920475244522,0.049690473824739456,,PRUNED
1399,1399,0.08593469113111496,2023-01-04 22:08:52.937336,2023-01-04 22:09:08.595238,0 days 00:00:15.657902,relu,0.5,2,0.8500000000000001,0.11269049346446991,0.08593469113111496,,PRUNED
1400,1400,0.08782043308019638,2023-01-04 22:09:08.709009,2023-01-04 22:09:24.468482,0 days 00:00:15.759473,tanh,0.15000000000000002,2,0.6,0.08782043308019638,,,PRUNED
1401,1401,0.13608285784721375,2023-01-04 22:09:24.585378,2023-01-04 22:09:33.260137,0 days 00:00:08.674759,relu,0.45,2,0.8500000000000001,0.13608285784721375,,,PRUNED
