,number,value,datetime_start,datetime_complete,duration,params_activation,params_dropout,params_layers,params_shrink,system_attrs_completed_rung_0,system_attrs_completed_rung_1,system_attrs_completed_rung_2,state
769,769,0.07943345606327057,2023-01-04 18:53:39.471110,2023-01-04 18:53:54.995116,0 days 00:00:15.524006,relu,0.35000000000000003,2,0.55,0.07943345606327057,,,PRUNED
770,770,0.13916155695915222,2023-01-04 18:53:55.112894,2023-01-04 18:54:44.751868,0 days 00:00:49.638974,relu,0.30000000000000004,2,0.95,0.06193770468235016,0.041179925203323364,,COMPLETE
771,771,0.08066924661397934,2023-01-04 18:54:44.870840,2023-01-04 18:55:00.190196,0 days 00:00:15.319356,relu,0.30000000000000004,2,0.8500000000000001,0.08066924661397934,,,PRUNED
772,772,0.2705129086971283,2023-01-04 18:55:00.307240,2023-01-04 18:55:09.439951,0 days 00:00:09.132711,relu,0.35000000000000003,5,0.8500000000000001,0.2705129086971283,,,PRUNED
773,773,0.14704376459121704,2023-01-04 18:55:09.549639,2023-01-04 18:55:18.072768,0 days 00:00:08.523129,tanh,0.5,2,0.8500000000000001,0.14704376459121704,,,PRUNED
774,774,0.08154266327619553,2023-01-04 18:55:18.190653,2023-01-04 18:55:33.754377,0 days 00:00:15.563724,relu,0.45,2,0.5,0.11923551559448242,0.08154266327619553,,PRUNED
775,775,0.07278106361627579,2023-01-04 18:55:33.863470,2023-01-04 18:55:49.344820,0 days 00:00:15.481350,tanh,0.5,2,0.7,0.12185543775558472,0.07278106361627579,,PRUNED
776,776,0.1441163569688797,2023-01-04 18:55:49.452964,2023-01-04 18:55:58.327707,0 days 00:00:08.874743,relu,0.5,2,0.8500000000000001,0.1441163569688797,,,PRUNED
777,777,0.13266965746879578,2023-01-04 18:55:58.436609,2023-01-04 18:56:13.868577,0 days 00:00:15.431968,relu,0.30000000000000004,2,0.8,0.13266965746879578,,,PRUNED
778,778,0.14222154021263123,2023-01-04 18:56:13.977595,2023-01-04 18:56:22.508979,0 days 00:00:08.531384,tanh,0.45,2,0.8500000000000001,0.14222154021263123,,,PRUNED
779,779,0.0775047317147255,2023-01-04 18:56:22.610715,2023-01-04 18:56:38.032638,0 days 00:00:15.421923,relu,0.4,2,0.9,0.11432845145463943,0.0775047317147255,,PRUNED
780,780,0.14245042204856873,2023-01-04 18:56:38.157597,2023-01-04 18:56:47.049435,0 days 00:00:08.891838,tanh,0.35000000000000003,2,0.8500000000000001,0.14245042204856873,,,PRUNED
781,781,0.12404356896877289,2023-01-04 18:56:47.159098,2023-01-04 18:56:55.740034,0 days 00:00:08.580936,sigmoid,0.5,2,0.8500000000000001,0.12404356896877289,,,PRUNED
782,782,0.06912201642990112,2023-01-04 18:56:55.850347,2023-01-04 18:57:11.472016,0 days 00:00:15.621669,relu,0.25,2,0.8,0.10352304577827454,0.06912201642990112,,PRUNED
783,783,0.08631514757871628,2023-01-04 18:57:11.597265,2023-01-04 18:57:27.237406,0 days 00:00:15.640141,tanh,0.35000000000000003,3,0.7,0.10150759667158127,0.08631514757871628,,PRUNED
784,784,0.22570176422595978,2023-01-04 18:57:27.354215,2023-01-04 18:57:36.520101,0 days 00:00:09.165886,relu,0.5,5,0.9,0.22570176422595978,,,PRUNED
785,785,0.10019747912883759,2023-01-04 18:57:36.629333,2023-01-04 18:57:52.485513,0 days 00:00:15.856180,relu,0.30000000000000004,5,0.9,0.10019747912883759,,,PRUNED
786,786,0.24042271077632904,2023-01-04 18:57:52.603580,2023-01-04 18:58:01.626694,0 days 00:00:09.023114,tanh,0.5,4,0.8500000000000001,0.24042271077632904,,,PRUNED
787,787,0.20484918355941772,2023-01-04 18:58:01.744801,2023-01-04 18:58:10.675814,0 days 00:00:08.931013,relu,0.45,2,0.65,0.20484918355941772,,,PRUNED
788,788,0.08018554002046585,2023-01-04 18:58:10.787005,2023-01-04 18:58:26.225085,0 days 00:00:15.438080,relu,0.4,2,0.95,0.08018554002046585,,,PRUNED
789,789,0.07468715310096741,2023-01-04 18:58:26.333789,2023-01-04 18:58:41.840130,0 days 00:00:15.506341,relu,0.30000000000000004,2,1.0,0.07468715310096741,,,PRUNED
790,790,0.13591526448726654,2023-01-04 18:58:41.951276,2023-01-04 18:58:50.898171,0 days 00:00:08.946895,sigmoid,0.4,2,0.8500000000000001,0.13591526448726654,,,PRUNED
791,791,0.05026203393936157,2023-01-04 18:58:51.008258,2023-01-04 18:59:27.161813,0 days 00:00:36.153555,tanh,0.5,2,0.8500000000000001,0.09621182829141617,0.05971398949623108,0.05026203393936157,PRUNED
792,792,0.05229952186346054,2023-01-04 18:59:27.273022,2023-01-04 19:00:03.266823,0 days 00:00:35.993801,relu,0.35000000000000003,2,0.7,0.0716031864285469,0.05229952186346054,,PRUNED
793,793,0.07745290547609329,2023-01-04 19:00:03.388976,2023-01-04 19:00:18.866457,0 days 00:00:15.477481,relu,0.30000000000000004,2,0.95,0.07745290547609329,,,PRUNED
794,794,0.08313880115747452,2023-01-04 19:00:18.983550,2023-01-04 19:00:34.890927,0 days 00:00:15.907377,relu,0.35000000000000003,2,0.95,0.1145961657166481,0.08313880115747452,,PRUNED
795,795,0.19174739718437195,2023-01-04 19:00:35.009401,2023-01-04 19:00:43.697967,0 days 00:00:08.688566,tanh,0.30000000000000004,2,0.8,0.19174739718437195,,,PRUNED
796,796,0.04840683564543724,2023-01-04 19:00:43.807995,2023-01-04 19:01:19.853195,0 days 00:00:36.045200,relu,0.30000000000000004,2,0.75,0.06630818545818329,0.04840683564543724,,PRUNED
797,797,0.22654244303703308,2023-01-04 19:01:19.969217,2023-01-04 19:01:28.753881,0 days 00:00:08.784664,relu,0.5,2,0.8500000000000001,0.22654244303703308,,,PRUNED
798,798,0.12493366003036499,2023-01-04 19:01:28.868997,2023-01-04 19:01:37.868505,0 days 00:00:08.999508,tanh,0.45,2,0.5,0.12493366003036499,,,PRUNED
799,799,0.08200395852327347,2023-01-04 19:01:37.978878,2023-01-04 19:01:53.517767,0 days 00:00:15.538889,sigmoid,0.5,2,0.75,0.0945672020316124,0.08200395852327347,,PRUNED
800,800,0.118301160633564,2023-01-04 19:01:53.627483,2023-01-04 19:02:09.141152,0 days 00:00:15.513669,relu,0.5,2,0.8500000000000001,0.11073081195354462,0.118301160633564,,PRUNED
801,801,0.0858430489897728,2023-01-04 19:02:09.251289,2023-01-04 19:02:24.881365,0 days 00:00:15.630076,tanh,0.5,2,0.9,0.10356251895427704,0.0858430489897728,,PRUNED
802,802,0.0755217969417572,2023-01-04 19:02:24.990420,2023-01-04 19:02:40.838381,0 days 00:00:15.847961,relu,0.25,3,0.7,0.0755217969417572,,,PRUNED
803,803,0.08020582050085068,2023-01-04 19:02:40.955225,2023-01-04 19:02:56.655611,0 days 00:00:15.700386,relu,0.35000000000000003,2,0.8500000000000001,0.1198788583278656,0.08020582050085068,,PRUNED
804,804,0.14183667302131653,2023-01-04 19:02:56.763547,2023-01-04 19:03:05.445593,0 days 00:00:08.682046,tanh,0.45,2,0.8500000000000001,0.14183667302131653,,,PRUNED
805,805,0.24371911585330963,2023-01-04 19:03:05.556374,2023-01-04 19:03:15.103932,0 days 00:00:09.547558,relu,0.5,8,0.8500000000000001,0.24371911585330963,,,PRUNED
806,806,0.13006946444511414,2023-01-04 19:03:15.210962,2023-01-04 19:03:23.893831,0 days 00:00:08.682869,tanh,0.4,2,0.8500000000000001,0.13006946444511414,,,PRUNED
807,807,0.13872259855270386,2023-01-04 19:03:24.005023,2023-01-04 19:04:14.037617,0 days 00:00:50.032594,relu,0.35000000000000003,2,0.55,0.06154784560203552,0.0402471162378788,,COMPLETE
808,808,0.13829194009304047,2023-01-04 19:04:14.163196,2023-01-04 19:04:22.747601,0 days 00:00:08.584405,sigmoid,0.5,2,0.7,0.13829194009304047,,,PRUNED
809,809,0.1302848756313324,2023-01-04 19:04:23.048716,2023-01-04 19:04:31.855372,0 days 00:00:08.806656,relu,0.30000000000000004,2,0.55,0.1302848756313324,,,PRUNED
810,810,0.07789985090494156,2023-01-04 19:04:31.965236,2023-01-04 19:04:47.754890,0 days 00:00:15.789654,tanh,0.45,3,0.8500000000000001,0.12268789112567902,0.07789985090494156,,PRUNED
811,811,0.08377743512392044,2023-01-04 19:04:47.871828,2023-01-04 19:05:03.394779,0 days 00:00:15.522951,relu,0.35000000000000003,2,0.9,0.11755924671888351,0.08377743512392044,,PRUNED
812,812,0.1493995636701584,2023-01-04 19:05:03.512767,2023-01-04 19:05:43.580486,0 days 00:00:40.067719,relu,0.35000000000000003,2,0.95,0.06907015293836594,0.041967883706092834,,COMPLETE
813,813,0.07423906028270721,2023-01-04 19:05:43.714615,2023-01-04 19:05:59.174244,0 days 00:00:15.459629,relu,0.35000000000000003,2,0.95,0.07423906028270721,,,PRUNED
814,814,0.0706300362944603,2023-01-04 19:05:59.291161,2023-01-04 19:06:15.080906,0 days 00:00:15.789745,tanh,0.5,2,0.8,0.09654604643583298,0.0706300362944603,,PRUNED
815,815,0.07005755603313446,2023-01-04 19:06:15.190315,2023-01-04 19:06:30.946374,0 days 00:00:15.756059,relu,0.5,2,0.8500000000000001,0.11140640825033188,0.07005755603313446,,PRUNED
816,816,0.07746624946594238,2023-01-04 19:06:31.055787,2023-01-04 19:06:46.956278,0 days 00:00:15.900491,relu,0.35000000000000003,2,0.95,0.07746624946594238,,,PRUNED
817,817,0.046232905238866806,2023-01-04 19:06:47.095973,2023-01-04 19:07:23.367482,0 days 00:00:36.271509,relu,0.35000000000000003,2,0.95,0.07181432098150253,0.046232905238866806,,PRUNED
818,818,0.15348270535469055,2023-01-04 19:07:23.475567,2023-01-04 19:08:06.558997,0 days 00:00:43.083430,relu,0.35000000000000003,2,0.95,0.06602749228477478,0.0430389866232872,,COMPLETE
819,819,0.08871917426586151,2023-01-04 19:08:06.695637,2023-01-04 19:08:22.388568,0 days 00:00:15.692931,relu,0.35000000000000003,2,0.95,0.08871917426586151,,,PRUNED
820,820,0.17645078897476196,2023-01-04 19:08:22.506668,2023-01-04 19:08:31.237287,0 days 00:00:08.730619,tanh,0.35000000000000003,2,0.95,0.17645078897476196,,,PRUNED
821,821,0.04943069443106651,2023-01-04 19:08:31.347425,2023-01-04 19:09:07.476697,0 days 00:00:36.129272,sigmoid,0.5,2,0.8500000000000001,0.09793870151042938,0.05993923172354698,0.04943069443106651,PRUNED
822,822,0.08295311033725739,2023-01-04 19:09:07.586794,2023-01-04 19:09:22.991717,0 days 00:00:15.404923,relu,0.35000000000000003,2,0.95,0.08295311033725739,,,PRUNED
823,823,0.0741141140460968,2023-01-04 19:09:23.110187,2023-01-04 19:09:38.907593,0 days 00:00:15.797406,relu,0.35000000000000003,2,0.95,0.0741141140460968,,,PRUNED
824,824,0.15869538486003876,2023-01-04 19:09:39.024656,2023-01-04 19:09:47.774189,0 days 00:00:08.749533,relu,0.4,2,0.8500000000000001,0.15869538486003876,,,PRUNED
825,825,0.08323701471090317,2023-01-04 19:09:47.882326,2023-01-04 19:10:03.546192,0 days 00:00:15.663866,relu,0.4,2,0.5,0.08323701471090317,,,PRUNED
826,826,0.045691583305597305,2023-01-04 19:10:03.671972,2023-01-04 19:10:39.920653,0 days 00:00:36.248681,relu,0.0,2,1.0,0.0674152821302414,0.045691583305597305,,PRUNED
827,827,0.08894456923007965,2023-01-04 19:10:40.052374,2023-01-04 19:10:55.543327,0 days 00:00:15.490953,relu,0.4,2,0.95,0.08894456923007965,,,PRUNED
828,828,0.08973671495914459,2023-01-04 19:10:55.661534,2023-01-04 19:11:11.117058,0 days 00:00:15.455524,relu,0.4,2,0.6,0.08973671495914459,,,PRUNED
829,829,0.07681070268154144,2023-01-04 19:11:11.235314,2023-01-04 19:11:26.758032,0 days 00:00:15.522718,tanh,0.45,2,0.5,0.10638327151536942,0.07681070268154144,,PRUNED
830,830,0.09248659014701843,2023-01-04 19:11:26.851443,2023-01-04 19:11:42.764501,0 days 00:00:15.913058,relu,0.35000000000000003,3,0.6,0.09248659014701843,,,PRUNED
831,831,0.14447449147701263,2023-01-04 19:11:42.870592,2023-01-04 19:12:33.305194,0 days 00:00:50.434602,relu,0.30000000000000004,2,0.8500000000000001,0.11944859474897385,0.06605876237154007,0.041803572326898575,COMPLETE
832,832,0.15094594657421112,2023-01-04 19:12:33.411685,2023-01-04 19:12:49.342805,0 days 00:00:15.931120,relu,0.35000000000000003,6,0.8500000000000001,0.15094594657421112,,,PRUNED
833,833,0.1769275814294815,2023-01-04 19:12:49.449809,2023-01-04 19:12:58.059811,0 days 00:00:08.610002,tanh,0.30000000000000004,2,0.8500000000000001,0.1769275814294815,,,PRUNED
834,834,0.08076941967010498,2023-01-04 19:12:58.157479,2023-01-04 19:13:14.076348,0 days 00:00:15.918869,relu,0.45,2,0.5,0.08076941967010498,,,PRUNED
835,835,0.08691797405481339,2023-01-04 19:13:14.198482,2023-01-04 19:13:29.723741,0 days 00:00:15.525259,relu,0.35000000000000003,2,0.55,0.08691797405481339,,,PRUNED
836,836,0.07308483123779297,2023-01-04 19:13:29.831743,2023-01-04 19:13:45.538671,0 days 00:00:15.706928,relu,0.30000000000000004,2,0.75,0.10671643167734146,0.07308483123779297,,PRUNED
837,837,0.04391215369105339,2023-01-04 19:13:45.635223,2023-01-04 19:14:21.877291,0 days 00:00:36.242068,tanh,0.30000000000000004,2,0.8,0.10494320839643478,0.06594327092170715,0.04391215369105339,PRUNED
838,838,0.04538295790553093,2023-01-04 19:14:21.983485,2023-01-04 19:14:58.291889,0 days 00:00:36.308404,relu,0.4,2,0.6,0.06596894562244415,0.04538295790553093,,PRUNED
839,839,0.08904504030942917,2023-01-04 19:14:58.396413,2023-01-04 19:15:14.206820,0 days 00:00:15.810407,tanh,0.05,4,0.6,0.08904504030942917,,,PRUNED
840,840,0.13799841701984406,2023-01-04 19:15:14.305537,2023-01-04 19:15:22.923034,0 days 00:00:08.617497,sigmoid,0.30000000000000004,2,0.8500000000000001,0.13799841701984406,,,PRUNED
841,841,0.1319485604763031,2023-01-04 19:15:23.014208,2023-01-04 19:15:31.930529,0 days 00:00:08.916321,relu,0.30000000000000004,2,0.8500000000000001,0.1319485604763031,,,PRUNED
842,842,0.1317291408777237,2023-01-04 19:15:32.029196,2023-01-04 19:15:40.671923,0 days 00:00:08.642727,tanh,0.25,2,0.9,0.1317291408777237,,,PRUNED
843,843,0.13953983783721924,2023-01-04 19:15:40.778535,2023-01-04 19:15:49.470862,0 days 00:00:08.692327,relu,0.30000000000000004,2,0.8500000000000001,0.13953983783721924,,,PRUNED
844,844,0.1985989809036255,2023-01-04 19:15:49.560703,2023-01-04 19:15:58.145216,0 days 00:00:08.584513,tanh,0.30000000000000004,2,0.7,0.1985989809036255,,,PRUNED
845,845,0.14590269327163696,2023-01-04 19:15:58.254230,2023-01-04 19:16:07.178864,0 days 00:00:08.924634,relu,0.30000000000000004,2,0.8500000000000001,0.14590269327163696,,,PRUNED
846,846,0.1894797831773758,2023-01-04 19:16:07.277921,2023-01-04 19:16:16.077197,0 days 00:00:08.799276,sigmoid,0.25,3,0.95,0.1894797831773758,,,PRUNED
847,847,0.04566144198179245,2023-01-04 19:16:16.166527,2023-01-04 19:16:52.491112,0 days 00:00:36.324585,tanh,0.35000000000000003,2,0.8,0.11451011151075363,0.06670264899730682,0.04566144198179245,PRUNED
848,848,0.13482479751110077,2023-01-04 19:16:52.614441,2023-01-04 19:17:01.365641,0 days 00:00:08.751200,relu,0.35000000000000003,2,0.6,0.13482479751110077,,,PRUNED
849,849,0.09026051312685013,2023-01-04 19:17:01.471586,2023-01-04 19:17:17.197582,0 days 00:00:15.725996,relu,0.35000000000000003,2,0.55,0.09026051312685013,,,PRUNED
850,850,0.1393032968044281,2023-01-04 19:17:17.302574,2023-01-04 19:17:26.238980,0 days 00:00:08.936406,tanh,0.30000000000000004,4,0.8500000000000001,0.1393032968044281,,,PRUNED
851,851,0.14755137264728546,2023-01-04 19:17:26.337022,2023-01-04 19:17:35.004747,0 days 00:00:08.667725,relu,0.35000000000000003,2,0.8500000000000001,0.14755137264728546,,,PRUNED
852,852,0.1265348643064499,2023-01-04 19:17:35.102949,2023-01-04 19:17:50.811712,0 days 00:00:15.708763,tanh,0.4,2,0.75,0.1265348643064499,,,PRUNED
853,853,0.07262349873781204,2023-01-04 19:17:50.909183,2023-01-04 19:18:06.460232,0 days 00:00:15.551049,tanh,0.45,2,0.8500000000000001,0.118156798183918,0.07262349873781204,,PRUNED
854,854,0.07754752039909363,2023-01-04 19:18:06.574255,2023-01-04 19:18:22.059879,0 days 00:00:15.485624,tanh,0.05,2,0.9,0.07754752039909363,,,PRUNED
855,855,0.06904727220535278,2023-01-04 19:18:22.149690,2023-01-04 19:18:37.941946,0 days 00:00:15.792256,relu,0.35000000000000003,2,0.55,0.11325515061616898,0.06904727220535278,,PRUNED
856,856,0.30479344725608826,2023-01-04 19:18:38.055877,2023-01-04 19:18:47.441174,0 days 00:00:09.385297,sigmoid,0.4,7,0.8500000000000001,0.30479344725608826,,,PRUNED
857,857,0.0756085067987442,2023-01-04 19:18:47.546116,2023-01-04 19:19:03.114587,0 days 00:00:15.568471,relu,0.45,2,0.6,0.0756085067987442,,,PRUNED
858,858,0.04835764691233635,2023-01-04 19:19:03.213661,2023-01-04 19:19:39.578078,0 days 00:00:36.364417,tanh,0.25,2,0.6,0.07192149758338928,0.04835764691233635,,PRUNED
859,859,0.17603035271167755,2023-01-04 19:19:39.668837,2023-01-04 19:19:48.952790,0 days 00:00:09.283953,tanh,0.30000000000000004,6,0.65,0.17603035271167755,,,PRUNED
860,860,0.10156360268592834,2023-01-04 19:19:49.041122,2023-01-04 19:20:04.618725,0 days 00:00:15.577603,relu,0.35000000000000003,2,0.6,0.10156360268592834,,,PRUNED
861,861,0.13626423478126526,2023-01-04 19:20:04.707728,2023-01-04 19:20:13.467861,0 days 00:00:08.760133,relu,0.35000000000000003,2,1.0,0.13626423478126526,,,PRUNED
862,862,0.14885255694389343,2023-01-04 19:20:13.573611,2023-01-04 19:20:56.866508,0 days 00:00:43.292897,tanh,0.4,2,0.55,0.05806392803788185,0.042080141603946686,,COMPLETE
863,863,0.0798041895031929,2023-01-04 19:20:56.982340,2023-01-04 19:21:12.929989,0 days 00:00:15.947649,tanh,0.4,2,0.55,0.0798041895031929,,,PRUNED
864,864,0.07037300616502762,2023-01-04 19:21:13.039019,2023-01-04 19:21:28.728336,0 days 00:00:15.689317,tanh,0.45,2,0.9,0.120499387383461,0.07037300616502762,,PRUNED
865,865,0.09291518479585648,2023-01-04 19:21:28.842931,2023-01-04 19:21:44.454538,0 days 00:00:15.611607,relu,0.4,2,0.55,0.09291518479585648,,,PRUNED
866,866,0.0735609233379364,2023-01-04 19:21:44.551611,2023-01-04 19:22:00.309544,0 days 00:00:15.757933,relu,0.35000000000000003,2,0.8500000000000001,0.12139133363962173,0.0735609233379364,,PRUNED
867,867,0.07308238744735718,2023-01-04 19:22:00.423887,2023-01-04 19:22:16.000538,0 days 00:00:15.576651,tanh,0.35000000000000003,2,0.55,0.07308238744735718,,,PRUNED
868,868,0.0812557190656662,2023-01-04 19:22:16.089355,2023-01-04 19:22:31.782312,0 days 00:00:15.692957,tanh,0.45,2,0.8500000000000001,0.09892207384109497,0.0812557190656662,,PRUNED
869,869,0.18958112597465515,2023-01-04 19:22:31.905419,2023-01-04 19:22:40.823629,0 days 00:00:08.918210,relu,0.4,3,0.5,0.18958112597465515,,,PRUNED
870,870,0.048731282353401184,2023-01-04 19:22:40.928153,2023-01-04 19:23:17.479133,0 days 00:00:36.550980,sigmoid,0.5,2,0.8,0.10581253468990326,0.0643019750714302,0.048731282353401184,PRUNED
871,871,0.09349535405635834,2023-01-04 19:23:17.567046,2023-01-04 19:23:33.319603,0 days 00:00:15.752557,tanh,0.4,3,0.55,0.09349535405635834,,,PRUNED
872,872,0.15804524719715118,2023-01-04 19:23:33.410660,2023-01-04 19:23:42.177855,0 days 00:00:08.767195,tanh,0.35000000000000003,2,0.75,0.15804524719715118,,,PRUNED
873,873,0.07642216235399246,2023-01-04 19:23:42.283865,2023-01-04 19:23:57.876457,0 days 00:00:15.592592,relu,0.4,2,0.5,0.07642216235399246,,,PRUNED
874,874,0.1255486011505127,2023-01-04 19:23:57.982664,2023-01-04 19:24:07.000981,0 days 00:00:09.018317,relu,0.25,2,0.7,0.1255486011505127,,,PRUNED
875,875,0.15452800691127777,2023-01-04 19:24:07.106983,2023-01-04 19:24:50.634693,0 days 00:00:43.527710,tanh,0.45,2,0.55,0.06856777518987656,0.04401123523712158,,COMPLETE
876,876,0.13164515793323517,2023-01-04 19:24:50.739747,2023-01-04 19:24:59.546017,0 days 00:00:08.806270,tanh,0.5,2,0.8500000000000001,0.13164515793323517,,,PRUNED
877,877,0.15556851029396057,2023-01-04 19:24:59.642898,2023-01-04 19:25:42.768921,0 days 00:00:43.126023,relu,0.4,2,0.95,0.05825737491250038,0.0441715382039547,,COMPLETE
878,878,0.04497483745217323,2023-01-04 19:25:42.869882,2023-01-04 19:26:19.340396,0 days 00:00:36.470514,tanh,0.35000000000000003,2,0.55,0.06742610782384872,0.04497483745217323,,PRUNED
879,879,0.08000437915325165,2023-01-04 19:26:19.430321,2023-01-04 19:26:35.238865,0 days 00:00:15.808544,relu,0.5,2,0.8500000000000001,0.10515579581260681,0.08000437915325165,,PRUNED
880,880,0.14894595742225647,2023-01-04 19:26:35.353126,2023-01-04 19:26:44.197393,0 days 00:00:08.844267,tanh,0.45,2,0.8500000000000001,0.14894595742225647,,,PRUNED
881,881,0.048108506947755814,2023-01-04 19:26:44.286785,2023-01-04 19:27:20.843697,0 days 00:00:36.556912,tanh,0.4,2,0.6,0.060860708355903625,0.048108506947755814,,PRUNED
882,882,0.15525083243846893,2023-01-04 19:27:20.933807,2023-01-04 19:27:29.610163,0 days 00:00:08.676356,relu,0.30000000000000004,2,0.8,0.15525083243846893,,,PRUNED
883,883,0.07659290730953217,2023-01-04 19:27:29.715691,2023-01-04 19:27:45.366833,0 days 00:00:15.651142,relu,0.25,2,0.55,0.07659290730953217,,,PRUNED
884,884,0.08675765991210938,2023-01-04 19:27:45.465501,2023-01-04 19:28:01.107056,0 days 00:00:15.641555,tanh,0.05,2,0.6,0.08675765991210938,,,PRUNED
885,885,0.1434919685125351,2023-01-04 19:28:01.197083,2023-01-04 19:28:17.480826,0 days 00:00:16.283743,relu,0.1,6,0.65,0.1434919685125351,,,PRUNED
886,886,0.13999678194522858,2023-01-04 19:28:17.579746,2023-01-04 19:29:04.428720,0 days 00:00:46.848974,sigmoid,0.5,2,0.8500000000000001,0.10546112805604935,0.06369882076978683,0.04118150472640991,COMPLETE
887,887,0.23008263111114502,2023-01-04 19:29:04.538205,2023-01-04 19:29:13.186068,0 days 00:00:08.647863,sigmoid,0.5,2,0.9,0.23008263111114502,,,PRUNED
888,888,0.04436527192592621,2023-01-04 19:29:13.274539,2023-01-04 19:29:49.740778,0 days 00:00:36.466239,tanh,0.4,2,0.55,0.06971074640750885,0.04436527192592621,,PRUNED
889,889,0.08005468547344208,2023-01-04 19:29:49.848722,2023-01-04 19:30:05.373294,0 days 00:00:15.524572,tanh,0.35000000000000003,2,0.6,0.08005468547344208,,,PRUNED
890,890,0.15308502316474915,2023-01-04 19:30:05.480078,2023-01-04 19:30:48.771607,0 days 00:00:43.291529,relu,0.30000000000000004,2,0.7,0.06123754382133484,0.04369167238473892,,COMPLETE
891,891,0.0451551154255867,2023-01-04 19:30:48.872379,2023-01-04 19:31:24.916933,0 days 00:00:36.044554,tanh,0.1,2,0.6,0.06808459758758545,0.0451551154255867,,PRUNED
892,892,0.08058410882949829,2023-01-04 19:31:25.007960,2023-01-04 19:31:40.949802,0 days 00:00:15.941842,sigmoid,0.5,2,1.0,0.11892543733119965,0.08058410882949829,,PRUNED
893,893,0.0807899534702301,2023-01-04 19:31:41.065840,2023-01-04 19:31:56.639541,0 days 00:00:15.573701,sigmoid,0.5,2,0.8500000000000001,0.10911684483289719,0.0807899534702301,,PRUNED
894,894,0.0905793309211731,2023-01-04 19:31:56.753076,2023-01-04 19:32:12.430419,0 days 00:00:15.677343,sigmoid,0.5,2,0.8500000000000001,0.10595685988664627,0.0905793309211731,,PRUNED
895,895,0.12828931212425232,2023-01-04 19:32:12.546447,2023-01-04 19:32:21.230353,0 days 00:00:08.683906,sigmoid,0.5,2,0.7,0.12828931212425232,,,PRUNED
