,number,value,datetime_start,datetime_complete,duration,params_activation,params_dropout,params_layers,params_shrink,system_attrs_completed_rung_0,system_attrs_completed_rung_1,system_attrs_completed_rung_2,state
1529,1529,0.16736505925655365,2023-01-04 23:15:35.881901,2023-01-04 23:16:15.922652,0 days 00:00:40.040751,sigmoid,0.0,2,0.6,0.07617401331663132,0.05031876638531685,,COMPLETE
1530,1530,0.11112115532159805,2023-01-04 23:16:16.038626,2023-01-04 23:16:24.705403,0 days 00:00:08.666777,tanh,0.05,2,0.7,0.11112115532159805,,,PRUNED
1531,1531,0.119075246155262,2023-01-04 23:16:24.815017,2023-01-04 23:16:33.565375,0 days 00:00:08.750358,tanh,0.1,2,0.65,0.119075246155262,,,PRUNED
1532,1532,0.22247806191444397,2023-01-04 23:16:33.681070,2023-01-04 23:17:07.403064,0 days 00:00:33.721994,sigmoid,0.15000000000000002,5,0.55,,,,COMPLETE
1533,1533,0.15262138843536377,2023-01-04 23:17:07.524964,2023-01-04 23:17:16.185058,0 days 00:00:08.660094,tanh,0.15000000000000002,2,0.6,0.15262138843536377,,,PRUNED
1534,1534,0.11603620648384094,2023-01-04 23:17:16.297167,2023-01-04 23:17:53.073451,0 days 00:00:36.776284,sigmoid,0.15000000000000002,5,0.55,0.11603620648384094,,,PRUNED
1535,1535,0.09598802775144577,2023-01-04 23:17:53.183540,2023-01-04 23:18:08.797670,0 days 00:00:15.614130,sigmoid,0.1,2,0.6,0.09598802775144577,,,PRUNED
1536,1536,0.054427552968263626,2023-01-04 23:18:08.918285,2023-01-04 23:18:45.269479,0 days 00:00:36.351194,sigmoid,0.1,2,0.6,0.07914543151855469,0.054427552968263626,,PRUNED
1537,1537,0.05210451781749725,2023-01-04 23:18:45.373186,2023-01-04 23:19:21.791704,0 days 00:00:36.418518,tanh,0.1,2,0.55,0.08137403428554535,0.05210451781749725,,PRUNED
1538,1538,0.10619672387838364,2023-01-04 23:19:21.903801,2023-01-04 23:19:30.916513,0 days 00:00:09.012712,tanh,0.25,2,0.65,0.10619672387838364,,,PRUNED
1539,1539,0.09652494639158249,2023-01-04 23:19:31.026431,2023-01-04 23:20:07.597133,0 days 00:00:36.570702,sigmoid,0.15000000000000002,5,0.55,0.09652494639158249,,,PRUNED
1540,1540,0.3867262899875641,2023-01-04 23:20:07.741167,2023-01-04 23:20:16.946754,0 days 00:00:09.205587,tanh,0.0,7,0.6,0.3867262899875641,,,PRUNED
1541,1541,0.13577860593795776,2023-01-04 23:20:17.056889,2023-01-04 23:20:53.884687,0 days 00:00:36.827798,sigmoid,0.15000000000000002,5,0.55,0.13577860593795776,,,PRUNED
1542,1542,0.19318225979804993,2023-01-04 23:20:54.021990,2023-01-04 23:21:02.792900,0 days 00:00:08.770910,tanh,0.1,2,0.7,0.19318225979804993,,,PRUNED
1543,1543,0.13482803106307983,2023-01-04 23:21:02.895863,2023-01-04 23:21:11.525691,0 days 00:00:08.629828,tanh,0.15000000000000002,2,0.7,0.13482803106307983,,,PRUNED
1544,1544,0.15290066599845886,2023-01-04 23:21:11.627806,2023-01-04 23:21:55.101905,0 days 00:00:43.474099,tanh,0.2,2,0.55,0.06483310461044312,0.04278576374053955,,COMPLETE
1545,1545,0.11022910475730896,2023-01-04 23:21:55.244830,2023-01-04 23:22:03.914176,0 days 00:00:08.669346,tanh,0.1,2,0.65,0.11022910475730896,,,PRUNED
1546,1546,0.14748091995716095,2023-01-04 23:22:04.047392,2023-01-04 23:22:40.785382,0 days 00:00:36.737990,sigmoid,0.15000000000000002,5,0.55,0.14748091995716095,,,PRUNED
1547,1547,0.12728142738342285,2023-01-04 23:22:40.921363,2023-01-04 23:23:17.803019,0 days 00:00:36.881656,sigmoid,0.15000000000000002,5,0.55,0.12728142738342285,,,PRUNED
1548,1548,0.15473805367946625,2023-01-04 23:23:17.929073,2023-01-04 23:24:08.195866,0 days 00:00:50.266793,tanh,0.05,2,0.75,0.07784943282604218,0.04735732078552246,,COMPLETE
1549,1549,0.19808104634284973,2023-01-04 23:24:08.318978,2023-01-04 23:24:17.003515,0 days 00:00:08.684537,tanh,0.05,2,0.6,0.19808104634284973,,,PRUNED
1550,1550,0.2200750708580017,2023-01-04 23:24:17.107577,2023-01-04 23:24:46.860526,0 days 00:00:29.752949,sigmoid,0.15000000000000002,5,0.55,,,,COMPLETE
1551,1551,0.2376117706298828,2023-01-04 23:24:46.975198,2023-01-04 23:25:20.546966,0 days 00:00:33.571768,sigmoid,0.15000000000000002,5,0.55,,,,COMPLETE
1552,1552,0.05777431279420853,2023-01-04 23:25:20.669894,2023-01-04 23:25:36.330160,0 days 00:00:15.660266,tanh,0.1,2,0.5,0.0925331562757492,0.05777431279420853,,PRUNED
1553,1553,0.05174198001623154,2023-01-04 23:25:36.432893,2023-01-04 23:26:12.743821,0 days 00:00:36.310928,sigmoid,0.05,2,0.6,0.09045512974262238,0.05174198001623154,,PRUNED
1554,1554,0.19610801339149475,2023-01-04 23:26:12.881505,2023-01-04 23:26:21.877531,0 days 00:00:08.996026,tanh,0.1,2,0.6,0.19610801339149475,,,PRUNED
1555,1555,0.052190713584423065,2023-01-04 23:26:21.978604,2023-01-04 23:26:58.223336,0 days 00:00:36.244732,tanh,0.1,2,0.6,0.07673545181751251,0.052190713584423065,,PRUNED
1556,1556,0.21730469167232513,2023-01-04 23:26:58.334787,2023-01-04 23:27:07.448601,0 days 00:00:09.113814,tanh,0.25,6,0.65,0.21730469167232513,,,PRUNED
1557,1557,0.19521693885326385,2023-01-04 23:27:07.551715,2023-01-04 23:27:16.507645,0 days 00:00:08.955930,tanh,0.0,2,0.6,0.19521693885326385,,,PRUNED
1558,1558,0.19357430934906006,2023-01-04 23:27:16.598678,2023-01-04 23:28:03.710691,0 days 00:00:47.112013,sigmoid,0.15000000000000002,5,0.55,0.0805724561214447,,,COMPLETE
1559,1559,0.1396387368440628,2023-01-04 23:28:03.832968,2023-01-04 23:28:12.460727,0 days 00:00:08.627759,tanh,0.25,2,0.7,0.1396387368440628,,,PRUNED
1560,1560,0.15438227355480194,2023-01-04 23:28:12.586495,2023-01-04 23:28:56.071577,0 days 00:00:43.485082,tanh,0.15000000000000002,2,0.6,0.062211647629737854,0.04670727252960205,,COMPLETE
1561,1561,0.11830364167690277,2023-01-04 23:28:56.196193,2023-01-04 23:29:04.948057,0 days 00:00:08.751864,tanh,0.1,2,0.6,0.11830364167690277,,,PRUNED
1562,1562,0.10578124225139618,2023-01-04 23:29:05.051756,2023-01-04 23:29:13.872733,0 days 00:00:08.820977,relu,0.05,2,0.5,0.10578124225139618,,,PRUNED
1563,1563,0.05127768591046333,2023-01-04 23:29:13.975830,2023-01-04 23:29:50.077313,0 days 00:00:36.101483,tanh,0.1,2,1.0,0.0912582129240036,0.05127768591046333,,PRUNED
1564,1564,0.14372926950454712,2023-01-04 23:29:50.216487,2023-01-04 23:29:59.202332,0 days 00:00:08.985845,tanh,0.05,2,0.65,0.14372926950454712,,,PRUNED
1565,1565,0.11678780615329742,2023-01-04 23:29:59.312177,2023-01-04 23:30:35.973816,0 days 00:00:36.661639,sigmoid,0.15000000000000002,5,0.55,0.11678780615329742,,,PRUNED
1566,1566,0.19018234312534332,2023-01-04 23:30:36.112904,2023-01-04 23:30:44.890888,0 days 00:00:08.777984,relu,0.1,2,0.7,0.19018234312534332,,,PRUNED
1567,1567,0.221603661775589,2023-01-04 23:30:45.013820,2023-01-04 23:31:18.530469,0 days 00:00:33.516649,sigmoid,0.15000000000000002,5,0.55,,,,COMPLETE
1568,1568,0.22696149349212646,2023-01-04 23:31:18.656570,2023-01-04 23:31:52.052233,0 days 00:00:33.395663,sigmoid,0.15000000000000002,5,0.55,,,,COMPLETE
1569,1569,0.10021862387657166,2023-01-04 23:31:52.177586,2023-01-04 23:32:00.943342,0 days 00:00:08.765756,tanh,0.15000000000000002,2,0.6,0.10021862387657166,,,PRUNED
1570,1570,0.19973473250865936,2023-01-04 23:32:01.218293,2023-01-04 23:32:37.989560,0 days 00:00:36.771267,sigmoid,0.15000000000000002,6,0.55,0.19973473250865936,,,PRUNED
1571,1571,0.09739271551370621,2023-01-04 23:32:38.116718,2023-01-04 23:32:53.646710,0 days 00:00:15.529992,sigmoid,0.5,2,0.6,0.09739271551370621,,,PRUNED
1572,1572,0.13669545948505402,2023-01-04 23:32:53.783800,2023-01-04 23:33:02.679465,0 days 00:00:08.895665,relu,0.25,2,0.6,0.13669545948505402,,,PRUNED
1573,1573,0.14568494260311127,2023-01-04 23:33:02.781104,2023-01-04 23:33:11.479120,0 days 00:00:08.698016,tanh,0.30000000000000004,2,0.7,0.14568494260311127,,,PRUNED
1574,1574,0.12845657765865326,2023-01-04 23:33:11.578889,2023-01-04 23:33:20.249187,0 days 00:00:08.670298,tanh,0.30000000000000004,2,0.65,0.12845657765865326,,,PRUNED
1575,1575,0.05361679196357727,2023-01-04 23:33:20.352787,2023-01-04 23:33:56.541924,0 days 00:00:36.189137,tanh,0.2,2,0.6,0.07791884988546371,0.05361679196357727,,PRUNED
1576,1576,0.1791219562292099,2023-01-04 23:33:56.650924,2023-01-04 23:34:05.667233,0 days 00:00:09.016309,relu,0.0,2,0.6,0.1791219562292099,,,PRUNED
1577,1577,0.14826585352420807,2023-01-04 23:34:05.764893,2023-01-04 23:34:48.977454,0 days 00:00:43.212561,tanh,0.5,2,0.75,0.05760103091597557,0.040738463401794434,,COMPLETE
1578,1578,0.09106549620628357,2023-01-04 23:34:49.189365,2023-01-04 23:35:25.768741,0 days 00:00:36.579376,sigmoid,0.15000000000000002,5,0.55,0.09106549620628357,,,PRUNED
1579,1579,0.054181057959795,2023-01-04 23:35:25.911069,2023-01-04 23:36:02.341582,0 days 00:00:36.430513,tanh,0.5,2,0.75,0.08573091775178909,0.054181057959795,,PRUNED
1580,1580,0.12910950183868408,2023-01-04 23:36:02.440595,2023-01-04 23:36:11.349091,0 days 00:00:08.908496,tanh,0.1,2,0.5,0.12910950183868408,,,PRUNED
1581,1581,0.16043633222579956,2023-01-04 23:36:11.466679,2023-01-04 23:36:54.743563,0 days 00:00:43.276884,sigmoid,0.5,2,0.75,0.06340993940830231,0.04895865544676781,,COMPLETE
1582,1582,0.10988710820674896,2023-01-04 23:36:54.881588,2023-01-04 23:37:31.734291,0 days 00:00:36.852703,sigmoid,0.2,5,0.55,0.10988710820674896,,,PRUNED
1583,1583,0.16466109454631805,2023-01-04 23:37:31.869906,2023-01-04 23:38:15.076399,0 days 00:00:43.206493,tanh,0.5,2,0.75,0.06914525479078293,0.05016399919986725,,COMPLETE
1584,1584,0.11686602234840393,2023-01-04 23:38:15.201628,2023-01-04 23:38:23.993103,0 days 00:00:08.791475,relu,0.30000000000000004,2,0.7,0.11686602234840393,,,PRUNED
1585,1585,0.05215045437216759,2023-01-04 23:38:24.121525,2023-01-04 23:39:00.552312,0 days 00:00:36.430787,tanh,0.5,2,0.7,0.07855107635259628,0.05215045437216759,,PRUNED
1586,1586,0.12278594076633453,2023-01-04 23:39:00.652831,2023-01-04 23:39:09.494286,0 days 00:00:08.841455,tanh,0.1,2,0.6,0.12278594076633453,,,PRUNED
1587,1587,0.2385290116071701,2023-01-04 23:39:09.601150,2023-01-04 23:39:42.824539,0 days 00:00:33.223389,sigmoid,0.15000000000000002,5,0.55,,,,COMPLETE
1588,1588,0.09660474210977554,2023-01-04 23:39:42.936566,2023-01-04 23:39:52.049248,0 days 00:00:09.112682,relu,0.30000000000000004,2,0.65,0.09660474210977554,,,PRUNED
1589,1589,0.17689266800880432,2023-01-04 23:39:52.148905,2023-01-04 23:40:08.471997,0 days 00:00:16.323092,sigmoid,0.5,8,1.0,0.17689266800880432,,,PRUNED
1590,1590,0.12602341175079346,2023-01-04 23:40:08.597155,2023-01-04 23:40:17.355661,0 days 00:00:08.758506,tanh,0.25,2,0.6,0.12602341175079346,,,PRUNED
1591,1591,0.05705991014838219,2023-01-04 23:40:17.456319,2023-01-04 23:40:53.410834,0 days 00:00:35.954515,tanh,0.5,2,0.55,0.06683219969272614,0.05705991014838219,,PRUNED
1592,1592,0.1404951810836792,2023-01-04 23:40:53.511519,2023-01-04 23:41:43.343683,0 days 00:00:49.832164,tanh,0.5,2,0.7,0.06497590988874435,0.04087768867611885,,COMPLETE
1593,1593,0.1650405377149582,2023-01-04 23:41:43.468131,2023-01-04 23:41:52.068370,0 days 00:00:08.600239,relu,0.30000000000000004,2,0.7,0.1650405377149582,,,PRUNED
1594,1594,0.1392199844121933,2023-01-04 23:41:52.174125,2023-01-04 23:42:00.830521,0 days 00:00:08.656396,tanh,0.2,2,0.65,0.1392199844121933,,,PRUNED
1595,1595,0.16685207188129425,2023-01-04 23:42:00.930527,2023-01-04 23:42:40.559482,0 days 00:00:39.628955,tanh,0.5,2,0.7,0.09000306576490402,0.04980397969484329,,COMPLETE
1596,1596,0.12451864778995514,2023-01-04 23:42:40.683455,2023-01-04 23:42:49.281192,0 days 00:00:08.597737,relu,0.05,2,0.75,0.12451864778995514,,,PRUNED
1597,1597,0.09583105891942978,2023-01-04 23:42:49.385437,2023-01-04 23:43:04.703463,0 days 00:00:15.318026,tanh,0.5,2,0.75,0.09583105891942978,,,PRUNED
1598,1598,0.14107531309127808,2023-01-04 23:43:04.813074,2023-01-04 23:44:01.582726,0 days 00:00:56.769652,sigmoid,0.5,2,0.7,0.07836074382066727,0.04332810640335083,,COMPLETE
1599,1599,0.16426792740821838,2023-01-04 23:44:01.708172,2023-01-04 23:44:10.291140,0 days 00:00:08.582968,tanh,0.30000000000000004,2,0.6,0.16426792740821838,,,PRUNED
1600,1600,0.1072305366396904,2023-01-04 23:44:10.419777,2023-01-04 23:44:19.157131,0 days 00:00:08.737354,tanh,0.1,2,0.5,0.1072305366396904,,,PRUNED
1601,1601,0.12010649591684341,2023-01-04 23:44:19.271279,2023-01-04 23:44:27.989796,0 days 00:00:08.718517,relu,0.30000000000000004,2,0.6,0.12010649591684341,,,PRUNED
1602,1602,0.12446697801351547,2023-01-04 23:44:28.095501,2023-01-04 23:44:36.830804,0 days 00:00:08.735303,tanh,0.1,2,0.6,0.12446697801351547,,,PRUNED
1603,1603,0.051101598888635635,2023-01-04 23:44:36.937603,2023-01-04 23:45:12.760979,0 days 00:00:35.823376,sigmoid,0.5,2,0.7,0.07219039648771286,0.051101598888635635,,PRUNED
1604,1604,0.18708981573581696,2023-01-04 23:45:12.867442,2023-01-04 23:45:21.457540,0 days 00:00:08.590098,relu,0.15000000000000002,2,0.65,0.18708981573581696,,,PRUNED
1605,1605,0.15696679055690765,2023-01-04 23:45:21.557302,2023-01-04 23:46:04.709430,0 days 00:00:43.152128,sigmoid,0.5,2,0.7,0.06541969627141953,0.046201758086681366,,COMPLETE
1606,1606,0.13964422047138214,2023-01-04 23:46:04.834239,2023-01-04 23:46:13.586318,0 days 00:00:08.752079,tanh,0.05,2,0.9,0.13964422047138214,,,PRUNED
1607,1607,0.152177631855011,2023-01-04 23:46:13.709347,2023-01-04 23:46:56.698098,0 days 00:00:42.988751,sigmoid,0.5,2,0.7,0.06601995974779129,0.04277034476399422,,COMPLETE
1608,1608,0.15266206860542297,2023-01-04 23:46:56.823310,2023-01-04 23:47:39.929193,0 days 00:00:43.105883,sigmoid,0.5,2,0.7,0.06910379976034164,0.045181747525930405,,COMPLETE
1609,1609,0.21894271671772003,2023-01-04 23:47:40.057472,2023-01-04 23:48:13.131621,0 days 00:00:33.074149,sigmoid,0.15000000000000002,5,0.55,,,,COMPLETE
1610,1610,0.1576875001192093,2023-01-04 23:48:13.266781,2023-01-04 23:48:56.039078,0 days 00:00:42.772297,sigmoid,0.5,2,0.7,0.06811381131410599,0.048042137175798416,,COMPLETE
1611,1611,0.15847373008728027,2023-01-04 23:48:56.142566,2023-01-04 23:49:42.607441,0 days 00:00:46.464875,sigmoid,0.5,2,0.7,0.07802948355674744,0.04647989198565483,,COMPLETE
1612,1612,0.1522703617811203,2023-01-04 23:49:42.732693,2023-01-04 23:50:29.170962,0 days 00:00:46.438269,sigmoid,0.5,2,0.7,0.08165563642978668,0.04466652870178223,,COMPLETE
1613,1613,0.1210331842303276,2023-01-04 23:50:29.294823,2023-01-04 23:50:38.103083,0 days 00:00:08.808260,relu,0.0,2,0.7,0.1210331842303276,,,PRUNED
1614,1614,0.22146746516227722,2023-01-04 23:50:38.244914,2023-01-04 23:51:11.265130,0 days 00:00:33.020216,sigmoid,0.15000000000000002,5,0.55,,,,COMPLETE
1615,1615,0.12776722013950348,2023-01-04 23:51:11.580240,2023-01-04 23:51:20.405432,0 days 00:00:08.825192,tanh,0.30000000000000004,2,0.6,0.12776722013950348,,,PRUNED
1616,1616,0.12689444422721863,2023-01-04 23:51:20.530934,2023-01-04 23:51:29.232374,0 days 00:00:08.701440,relu,0.4,2,0.75,0.12689444422721863,,,PRUNED
1617,1617,0.10821494460105896,2023-01-04 23:51:29.363581,2023-01-04 23:51:38.007213,0 days 00:00:08.643632,tanh,0.25,2,0.5,0.10821494460105896,,,PRUNED
1618,1618,0.1384563148021698,2023-01-04 23:51:38.112407,2023-01-04 23:51:46.961403,0 days 00:00:08.848996,tanh,0.1,2,0.6,0.1384563148021698,,,PRUNED
1619,1619,0.11827947199344635,2023-01-04 23:51:47.063237,2023-01-04 23:51:55.755762,0 days 00:00:08.692525,relu,0.30000000000000004,2,0.65,0.11827947199344635,,,PRUNED
1620,1620,0.17676815390586853,2023-01-04 23:51:55.876566,2023-01-04 23:52:04.588418,0 days 00:00:08.711852,tanh,0.05,2,0.65,0.17676815390586853,,,PRUNED
1621,1621,0.12187596410512924,2023-01-04 23:52:04.709433,2023-01-04 23:52:13.563294,0 days 00:00:08.853861,relu,0.30000000000000004,2,0.7,0.12187596410512924,,,PRUNED
1622,1622,0.30941033363342285,2023-01-04 23:52:13.659207,2023-01-04 23:52:29.703170,0 days 00:00:16.043963,sigmoid,0.5,8,0.7,0.30941033363342285,,,PRUNED
1623,1623,0.1597435176372528,2023-01-04 23:52:29.834252,2023-01-04 23:52:38.585857,0 days 00:00:08.751605,tanh,0.4,2,0.6,0.1597435176372528,,,PRUNED
1624,1624,0.14499275386333466,2023-01-04 23:52:38.692641,2023-01-04 23:53:28.563007,0 days 00:00:49.870366,sigmoid,0.5,2,0.7,0.06577569246292114,0.04181196168065071,,COMPLETE
1625,1625,0.15721005201339722,2023-01-04 23:53:28.691510,2023-01-04 23:54:19.634477,0 days 00:00:50.942967,sigmoid,0.5,2,0.7,0.08381687104701996,0.049562085419893265,,COMPLETE
1626,1626,0.10280220955610275,2023-01-04 23:54:19.762625,2023-01-04 23:54:28.385816,0 days 00:00:08.623191,relu,0.1,2,0.5,0.10280220955610275,,,PRUNED
1627,1627,0.13040198385715485,2023-01-04 23:54:28.516625,2023-01-04 23:54:37.451791,0 days 00:00:08.935166,tanh,0.30000000000000004,2,0.7,0.13040198385715485,,,PRUNED
1628,1628,0.1205553188920021,2023-01-04 23:54:37.583761,2023-01-04 23:54:46.334716,0 days 00:00:08.750955,relu,0.2,2,0.6,0.1205553188920021,,,PRUNED
1629,1629,0.10155750066041946,2023-01-04 23:54:46.440245,2023-01-04 23:54:55.000442,0 days 00:00:08.560197,tanh,0.25,2,0.65,0.10155750066041946,,,PRUNED
1630,1630,0.11671657860279083,2023-01-04 23:54:55.121919,2023-01-04 23:55:03.758526,0 days 00:00:08.636607,tanh,0.30000000000000004,2,0.7,0.11671657860279083,,,PRUNED
1631,1631,0.12457370012998581,2023-01-04 23:55:04.070632,2023-01-04 23:55:12.815764,0 days 00:00:08.745132,relu,0.0,2,0.75,0.12457370012998581,,,PRUNED
1632,1632,0.11564228683710098,2023-01-04 23:55:12.956921,2023-01-04 23:55:28.506222,0 days 00:00:15.549301,sigmoid,0.5,2,0.7,0.11564228683710098,,,PRUNED
1633,1633,0.1358625292778015,2023-01-04 23:55:28.653994,2023-01-04 23:55:37.355789,0 days 00:00:08.701795,tanh,0.1,2,0.9,0.1358625292778015,,,PRUNED
1634,1634,0.12119364738464355,2023-01-04 23:55:37.621580,2023-01-04 23:55:46.388203,0 days 00:00:08.766623,relu,0.15000000000000002,2,0.6,0.12119364738464355,,,PRUNED
1635,1635,0.15279968082904816,2023-01-04 23:55:46.499087,2023-01-04 23:56:29.407969,0 days 00:00:42.908882,sigmoid,0.5,2,0.7,0.06157932057976723,0.0441264733672142,,COMPLETE
1636,1636,0.14671212434768677,2023-01-04 23:56:29.553730,2023-01-04 23:57:15.780279,0 days 00:00:46.226549,sigmoid,0.5,2,0.7,0.0827576145529747,0.04236849397420883,,COMPLETE
1637,1637,0.09583449363708496,2023-01-04 23:57:15.913875,2023-01-04 23:57:24.897356,0 days 00:00:08.983481,tanh,0.4,2,0.65,0.09583449363708496,,,PRUNED
1638,1638,0.15640059113502502,2023-01-04 23:57:25.030597,2023-01-04 23:58:14.737945,0 days 00:00:49.707348,sigmoid,0.5,2,0.7,0.07844433933496475,0.04698993265628815,,COMPLETE
1639,1639,0.13705380260944366,2023-01-04 23:58:14.877819,2023-01-04 23:58:23.593305,0 days 00:00:08.715486,relu,0.30000000000000004,2,0.6,0.13705380260944366,,,PRUNED
1640,1640,0.13012342154979706,2023-01-04 23:58:23.723520,2023-01-04 23:59:00.205761,0 days 00:00:36.482241,sigmoid,0.1,5,0.55,0.13012342154979706,,,PRUNED
1641,1641,0.14791348576545715,2023-01-04 23:59:00.321903,2023-01-04 23:59:09.056090,0 days 00:00:08.734187,tanh,0.30000000000000004,2,0.65,0.14791348576545715,,,PRUNED
1642,1642,0.15771852433681488,2023-01-04 23:59:09.194718,2023-01-04 23:59:55.369214,0 days 00:00:46.174496,sigmoid,0.5,2,0.7,0.0843202993273735,0.04659378156065941,,COMPLETE
1643,1643,0.26450127363204956,2023-01-04 23:59:55.504716,2023-01-05 00:00:11.242602,0 days 00:00:15.737886,sigmoid,0.5,2,0.7,0.26450127363204956,,,PRUNED
1644,1644,0.15330077707767487,2023-01-05 00:00:11.365168,2023-01-05 00:00:20.067355,0 days 00:00:08.702187,relu,0.4,2,0.5,0.15330077707767487,,,PRUNED
1645,1645,0.15343797206878662,2023-01-05 00:00:20.201155,2023-01-05 00:00:28.925007,0 days 00:00:08.723852,tanh,0.05,2,0.6,0.15343797206878662,,,PRUNED
1646,1646,0.12405221909284592,2023-01-05 00:00:29.062231,2023-01-05 00:00:37.923963,0 days 00:00:08.861732,tanh,0.1,2,0.7,0.12405221909284592,,,PRUNED
1647,1647,0.0688096433877945,2023-01-05 00:00:38.065468,2023-01-05 00:00:53.630503,0 days 00:00:15.565035,relu,0.25,2,0.9,0.09269676357507706,0.0688096433877945,,PRUNED
1648,1648,0.08855263143777847,2023-01-05 00:00:53.755031,2023-01-05 00:01:09.460400,0 days 00:00:15.705369,sigmoid,0.5,2,0.7,0.08855263143777847,,,PRUNED
1649,1649,0.12921518087387085,2023-01-05 00:01:09.576468,2023-01-05 00:01:18.462905,0 days 00:00:08.886437,tanh,0.1,2,0.55,0.12921518087387085,,,PRUNED
1650,1650,0.1822294294834137,2023-01-05 00:01:18.567714,2023-01-05 00:01:27.495548,0 days 00:00:08.927834,relu,0.30000000000000004,2,0.6,0.1822294294834137,,,PRUNED
1651,1651,0.05252119153738022,2023-01-05 00:01:27.626355,2023-01-05 00:02:03.559037,0 days 00:00:35.932682,sigmoid,0.5,2,0.75,0.08089784532785416,0.05252119153738022,,PRUNED
1652,1652,0.15518802404403687,2023-01-05 00:02:03.673605,2023-01-05 00:02:49.950584,0 days 00:00:46.276979,sigmoid,0.30000000000000004,2,0.7,0.07615114748477936,0.04409153386950493,,COMPLETE
1653,1653,0.13245397806167603,2023-01-05 00:02:50.096541,2023-01-05 00:02:59.046908,0 days 00:00:08.950367,tanh,0.30000000000000004,2,0.6,0.13245397806167603,,,PRUNED
1654,1654,0.2294462025165558,2023-01-05 00:02:59.169372,2023-01-05 00:03:32.174891,0 days 00:00:33.005519,sigmoid,0.15000000000000002,5,0.55,,,,COMPLETE
1655,1655,0.1367197483778,2023-01-05 00:03:32.302043,2023-01-05 00:03:40.935146,0 days 00:00:08.633103,relu,0.4,2,0.7,0.1367197483778,,,PRUNED
1656,1656,0.09243188053369522,2023-01-05 00:03:41.032856,2023-01-05 00:03:56.767517,0 days 00:00:15.734661,sigmoid,0.5,2,0.7,0.09243188053369522,,,PRUNED
1657,1657,0.16140109300613403,2023-01-05 00:03:56.892298,2023-01-05 00:04:05.621976,0 days 00:00:08.729678,tanh,0.15000000000000002,2,0.65,0.16140109300613403,,,PRUNED
1658,1658,0.19989868998527527,2023-01-05 00:04:05.738959,2023-01-05 00:04:14.507824,0 days 00:00:08.768865,relu,0.1,3,0.6,0.19989868998527527,,,PRUNED
1659,1659,0.09757421910762787,2023-01-05 00:04:14.631312,2023-01-05 00:04:23.323826,0 days 00:00:08.692514,tanh,0.30000000000000004,2,0.7,0.09757421910762787,,,PRUNED
1660,1660,0.18483127653598785,2023-01-05 00:04:23.445923,2023-01-05 00:05:10.323518,0 days 00:00:46.877595,sigmoid,0.1,4,0.55,0.07358153164386749,,,COMPLETE
1661,1661,0.18423934280872345,2023-01-05 00:05:10.446864,2023-01-05 00:05:19.069561,0 days 00:00:08.622697,tanh,0.1,2,0.55,0.18423934280872345,,,PRUNED
