,number,value,datetime_start,datetime_complete,duration,params_activation,params_dropout,params_layers,params_shrink,system_attrs_completed_rung_0,system_attrs_completed_rung_1,system_attrs_completed_rung_2,state
384,384,0.04937349259853363,2023-01-04 16:44:42.133981,2023-01-04 16:45:19.711178,0 days 00:00:37.577197,relu,0.2,2,0.6,0.07180102169513702,0.04937349259853363,,PRUNED
385,385,0.07256026566028595,2023-01-04 16:45:19.806825,2023-01-04 16:45:35.419715,0 days 00:00:15.612890,sigmoid,0.5,2,0.8500000000000001,0.12625467777252197,0.07256026566028595,,PRUNED
386,386,0.07047935575246811,2023-01-04 16:45:35.513798,2023-01-04 16:45:51.075457,0 days 00:00:15.561659,tanh,0.15000000000000002,2,1.0,0.11168576776981354,0.07047935575246811,,PRUNED
387,387,0.13589292764663696,2023-01-04 16:45:51.170116,2023-01-04 16:45:59.933124,0 days 00:00:08.763008,sigmoid,0.30000000000000004,2,0.8,0.13589292764663696,,,PRUNED
388,388,0.08539575338363647,2023-01-04 16:46:00.019208,2023-01-04 16:46:15.515278,0 days 00:00:15.496070,relu,0.35000000000000003,2,0.8500000000000001,0.10866527259349823,0.08539575338363647,,PRUNED
389,389,0.06986089050769806,2023-01-04 16:46:15.602604,2023-01-04 16:46:31.153512,0 days 00:00:15.550908,tanh,0.45,2,0.8500000000000001,0.11399012058973312,0.06986089050769806,,PRUNED
390,390,0.15276212990283966,2023-01-04 16:46:31.242588,2023-01-04 16:47:21.077814,0 days 00:00:49.835226,tanh,0.2,2,0.55,0.07233627140522003,0.045405469834804535,,COMPLETE
391,391,0.09678153693675995,2023-01-04 16:47:21.176169,2023-01-04 16:47:36.807024,0 days 00:00:15.630855,sigmoid,0.4,2,1.0,0.10737071931362152,0.09678153693675995,,PRUNED
392,392,0.07376549392938614,2023-01-04 16:47:36.913643,2023-01-04 16:47:52.372516,0 days 00:00:15.458873,relu,0.30000000000000004,2,0.9,0.1114882156252861,0.07376549392938614,,PRUNED
393,393,0.07712791860103607,2023-01-04 16:47:52.469381,2023-01-04 16:48:07.950927,0 days 00:00:15.481546,tanh,0.2,2,0.55,0.07712791860103607,,,PRUNED
394,394,0.15003080666065216,2023-01-04 16:48:08.043001,2023-01-04 16:48:54.399363,0 days 00:00:46.356362,tanh,0.15000000000000002,2,0.65,0.07242957502603531,0.04294361546635628,,COMPLETE
395,395,0.17410413920879364,2023-01-04 16:48:54.538941,2023-01-04 16:49:03.355542,0 days 00:00:08.816601,tanh,0.35000000000000003,2,0.8500000000000001,0.17410413920879364,,,PRUNED
396,396,0.15387926995754242,2023-01-04 16:49:03.489687,2023-01-04 16:49:11.938587,0 days 00:00:08.448900,sigmoid,0.45,2,0.8500000000000001,0.15387926995754242,,,PRUNED
397,397,0.15058545768260956,2023-01-04 16:49:12.073912,2023-01-04 16:49:58.271034,0 days 00:00:46.197122,tanh,0.1,2,0.65,0.0737333744764328,0.04484996944665909,,COMPLETE
398,398,0.14071881771087646,2023-01-04 16:49:58.364452,2023-01-04 16:50:07.060078,0 days 00:00:08.695626,tanh,0.05,3,1.0,0.14071881771087646,,,PRUNED
399,399,0.08022494614124298,2023-01-04 16:50:07.160095,2023-01-04 16:50:22.833184,0 days 00:00:15.673089,tanh,0.1,2,0.65,0.08022494614124298,,,PRUNED
400,400,0.04341847822070122,2023-01-04 16:50:22.934187,2023-01-04 16:50:58.896809,0 days 00:00:35.962622,relu,0.5,2,0.8,0.1026904433965683,0.06428881734609604,0.04341847822070122,PRUNED
401,401,0.2094803899526596,2023-01-04 16:50:58.990524,2023-01-04 16:51:07.896129,0 days 00:00:08.905605,sigmoid,0.30000000000000004,5,0.9,0.2094803899526596,,,PRUNED
402,402,0.2496470957994461,2023-01-04 16:51:07.997205,2023-01-04 16:51:16.826849,0 days 00:00:08.829644,tanh,0.45,4,0.95,0.2496470957994461,,,PRUNED
403,403,0.15168438851833344,2023-01-04 16:51:16.921505,2023-01-04 16:52:06.744319,0 days 00:00:49.822814,tanh,0.15000000000000002,2,0.7,0.06962525844573975,0.04507002979516983,,COMPLETE
404,404,0.14342893660068512,2023-01-04 16:52:06.863083,2023-01-04 16:52:15.338097,0 days 00:00:08.475014,relu,0.35000000000000003,2,0.8500000000000001,0.14342893660068512,,,PRUNED
405,405,0.15295208990573883,2023-01-04 16:52:15.442044,2023-01-04 16:53:01.814958,0 days 00:00:46.372914,tanh,0.15000000000000002,2,0.65,0.06950095295906067,0.044776637107133865,,COMPLETE
406,406,0.15433229506015778,2023-01-04 16:53:01.925576,2023-01-04 16:53:44.893329,0 days 00:00:42.967753,tanh,0.15000000000000002,2,0.7,0.066977858543396,0.043531838804483414,,COMPLETE
407,407,0.19068515300750732,2023-01-04 16:53:45.014990,2023-01-04 16:53:53.530662,0 days 00:00:08.515672,sigmoid,0.25,2,0.8500000000000001,0.19068515300750732,,,PRUNED
408,408,0.17410391569137573,2023-01-04 16:53:53.625486,2023-01-04 16:54:02.205299,0 days 00:00:08.579813,tanh,0.45,2,1.0,0.17410391569137573,,,PRUNED
409,409,0.08974625170230865,2023-01-04 16:54:02.309003,2023-01-04 16:54:17.645510,0 days 00:00:15.336507,relu,0.30000000000000004,2,0.75,0.10552790760993958,0.08974625170230865,,PRUNED
410,410,0.15643945336341858,2023-01-04 16:54:17.741167,2023-01-04 16:54:26.445460,0 days 00:00:08.704293,sigmoid,0.35000000000000003,2,0.65,0.15643945336341858,,,PRUNED
411,411,0.15081115067005157,2023-01-04 16:54:26.541626,2023-01-04 16:54:35.294170,0 days 00:00:08.752544,tanh,0.45,2,0.8500000000000001,0.15081115067005157,,,PRUNED
412,412,0.06982798874378204,2023-01-04 16:54:35.390275,2023-01-04 16:54:50.801493,0 days 00:00:15.411218,tanh,0.35000000000000003,2,1.0,0.12646009027957916,0.06982798874378204,,PRUNED
413,413,0.33304455876350403,2023-01-04 16:54:50.897644,2023-01-04 16:55:00.075392,0 days 00:00:09.177748,relu,0.4,8,0.8,0.33304455876350403,,,PRUNED
414,414,0.0514962412416935,2023-01-04 16:55:00.170398,2023-01-04 16:55:36.447897,0 days 00:00:36.277499,sigmoid,0.45,2,0.8500000000000001,0.10868030041456223,0.06833384931087494,0.0514962412416935,PRUNED
415,415,0.15675309300422668,2023-01-04 16:55:36.535217,2023-01-04 16:56:19.398816,0 days 00:00:42.863599,tanh,0.15000000000000002,2,0.65,0.06591280549764633,0.04423144832253456,,COMPLETE
416,416,0.08212022483348846,2023-01-04 16:56:19.502420,2023-01-04 16:56:34.868066,0 days 00:00:15.365646,tanh,0.15000000000000002,2,0.6,0.08212022483348846,,,PRUNED
417,417,0.16870613396167755,2023-01-04 16:56:34.964013,2023-01-04 16:56:43.476166,0 days 00:00:08.512153,tanh,0.5,2,0.9,0.16870613396167755,,,PRUNED
418,418,0.047887228429317474,2023-01-04 16:56:43.571820,2023-01-04 16:57:19.786694,0 days 00:00:36.214874,tanh,0.15000000000000002,2,0.65,0.06954072415828705,0.047887228429317474,,PRUNED
419,419,0.33396920561790466,2023-01-04 16:57:19.900699,2023-01-04 16:57:29.065301,0 days 00:00:09.164602,relu,0.30000000000000004,7,0.8500000000000001,0.33396920561790466,,,PRUNED
420,420,0.07395073771476746,2023-01-04 16:57:29.160343,2023-01-04 16:57:44.579874,0 days 00:00:15.419531,sigmoid,0.15000000000000002,2,0.6,0.07395073771476746,,,PRUNED
421,421,0.15852074325084686,2023-01-04 16:57:44.675522,2023-01-04 16:57:53.337339,0 days 00:00:08.661817,sigmoid,0.35000000000000003,2,1.0,0.15852074325084686,,,PRUNED
422,422,0.07490163296461105,2023-01-04 16:57:53.425367,2023-01-04 16:58:08.911354,0 days 00:00:15.485987,tanh,0.05,2,0.7,0.07490163296461105,,,PRUNED
423,423,0.2270166426897049,2023-01-04 16:58:08.997314,2023-01-04 16:58:17.610708,0 days 00:00:08.613394,tanh,0.0,2,0.8500000000000001,0.2270166426897049,,,PRUNED
424,424,0.15134726464748383,2023-01-04 16:58:17.697034,2023-01-04 16:58:26.343086,0 days 00:00:08.646052,sigmoid,0.05,2,0.95,0.15134726464748383,,,PRUNED
425,425,0.14882829785346985,2023-01-04 16:58:26.438045,2023-01-04 16:59:09.523319,0 days 00:00:43.085274,tanh,0.1,2,0.6,0.061281491070985794,0.04309343546628952,,COMPLETE
426,426,0.08630204200744629,2023-01-04 16:59:09.631660,2023-01-04 16:59:25.038950,0 days 00:00:15.407290,tanh,0.1,2,0.6,0.08630204200744629,,,PRUNED
427,427,0.14377281069755554,2023-01-04 16:59:25.126273,2023-01-04 17:00:11.674364,0 days 00:00:46.548091,relu,0.4,2,0.7,0.116373710334301,0.06874212622642517,0.04067051783204079,COMPLETE
428,428,0.151697039604187,2023-01-04 17:00:11.760127,2023-01-04 17:00:20.376436,0 days 00:00:08.616309,relu,0.4,2,0.7,0.151697039604187,,,PRUNED
429,429,0.047734349966049194,2023-01-04 17:00:20.463765,2023-01-04 17:00:56.740352,0 days 00:00:36.276587,tanh,0.1,2,0.6,0.07072224467992783,0.047734349966049194,,PRUNED
430,430,0.1702570617198944,2023-01-04 17:00:56.828685,2023-01-04 17:01:05.648290,0 days 00:00:08.819605,tanh,0.4,3,0.65,0.1702570617198944,,,PRUNED
431,431,0.07216664403676987,2023-01-04 17:01:05.736081,2023-01-04 17:01:21.180182,0 days 00:00:15.444101,sigmoid,0.45,2,0.7,0.10121554881334305,0.07216664403676987,,PRUNED
432,432,0.1373666524887085,2023-01-04 17:01:21.259059,2023-01-04 17:02:10.930331,0 days 00:00:49.671272,tanh,0.1,2,0.65,0.0686706081032753,0.0385093130171299,,COMPLETE
433,433,0.08673857152462006,2023-01-04 17:02:11.042741,2023-01-04 17:02:26.591692,0 days 00:00:15.548951,tanh,0.1,2,0.65,0.08673857152462006,,,PRUNED
434,434,0.13135549426078796,2023-01-04 17:02:26.689564,2023-01-04 17:02:35.241245,0 days 00:00:08.551681,tanh,0.35000000000000003,2,0.65,0.13135549426078796,,,PRUNED
435,435,0.13186770677566528,2023-01-04 17:02:35.328577,2023-01-04 17:02:43.898378,0 days 00:00:08.569801,relu,0.45,2,0.6,0.13186770677566528,,,PRUNED
436,436,0.14899292588233948,2023-01-04 17:02:43.986270,2023-01-04 17:02:52.473365,0 days 00:00:08.487095,sigmoid,0.4,2,1.0,0.14899292588233948,,,PRUNED
437,437,0.07786066085100174,2023-01-04 17:02:52.560608,2023-01-04 17:03:08.262948,0 days 00:00:15.702340,tanh,0.05,2,0.6,0.07786066085100174,,,PRUNED
438,438,0.04795161262154579,2023-01-04 17:03:08.350974,2023-01-04 17:03:44.411016,0 days 00:00:36.060042,sigmoid,0.1,2,0.65,0.07036441564559937,0.04795161262154579,,PRUNED
439,439,0.07614608854055405,2023-01-04 17:03:44.498351,2023-01-04 17:03:59.909847,0 days 00:00:15.411496,tanh,0.05,2,0.6,0.07614608854055405,,,PRUNED
440,440,0.046142030507326126,2023-01-04 17:03:59.997152,2023-01-04 17:04:36.132192,0 days 00:00:36.135040,tanh,0.4,2,0.6,0.0619056299328804,0.046142030507326126,,PRUNED
441,441,0.14282771944999695,2023-01-04 17:04:36.220746,2023-01-04 17:05:19.329040,0 days 00:00:43.108294,tanh,0.35000000000000003,2,0.7,0.12265349179506302,0.05691685527563095,0.04010094702243805,COMPLETE
442,442,0.14299382269382477,2023-01-04 17:05:19.428188,2023-01-04 17:06:09.223939,0 days 00:00:49.795751,tanh,0.35000000000000003,2,0.7,0.10823269188404083,0.06592106074094772,0.04191727563738823,COMPLETE
443,443,0.12756820023059845,2023-01-04 17:06:09.334749,2023-01-04 17:06:17.924437,0 days 00:00:08.589688,tanh,0.35000000000000003,2,0.7,0.12756820023059845,,,PRUNED
444,444,0.07268618792295456,2023-01-04 17:06:18.012413,2023-01-04 17:06:33.781675,0 days 00:00:15.769262,tanh,0.35000000000000003,2,0.7,0.12381715327501297,0.07268618792295456,,PRUNED
445,445,0.19413407146930695,2023-01-04 17:06:33.868763,2023-01-04 17:06:42.422565,0 days 00:00:08.553802,tanh,0.35000000000000003,2,0.7,0.19413407146930695,,,PRUNED
446,446,0.15258480608463287,2023-01-04 17:06:42.500227,2023-01-04 17:07:25.428518,0 days 00:00:42.928291,relu,0.1,2,0.6,0.06059878319501877,0.04406033828854561,,COMPLETE
447,447,0.09346819669008255,2023-01-04 17:07:25.535326,2023-01-04 17:07:40.918150,0 days 00:00:15.382824,tanh,0.1,2,0.65,0.09346819669008255,,,PRUNED
448,448,0.0766858458518982,2023-01-04 17:07:41.005484,2023-01-04 17:07:56.750284,0 days 00:00:15.744800,tanh,0.15000000000000002,2,0.7,0.0766858458518982,,,PRUNED
449,449,0.16981056332588196,2023-01-04 17:07:56.829453,2023-01-04 17:08:05.466627,0 days 00:00:08.637174,tanh,0.35000000000000003,2,0.75,0.16981056332588196,,,PRUNED
450,450,0.07440859079360962,2023-01-04 17:08:05.552626,2023-01-04 17:08:21.164473,0 days 00:00:15.611847,tanh,0.35000000000000003,2,0.65,0.10109644383192062,0.07440859079360962,,PRUNED
451,451,0.14251816272735596,2023-01-04 17:08:21.259592,2023-01-04 17:09:11.080489,0 days 00:00:49.820897,tanh,0.1,2,0.65,0.06428657472133636,0.04073983430862427,,COMPLETE
452,452,0.08868898451328278,2023-01-04 17:09:11.185995,2023-01-04 17:09:26.926707,0 days 00:00:15.740712,tanh,0.1,2,0.65,0.08868898451328278,,,PRUNED
453,453,0.04391363635659218,2023-01-04 17:09:27.014143,2023-01-04 17:10:03.099080,0 days 00:00:36.084937,tanh,0.30000000000000004,2,0.7,0.12527720630168915,0.0668332502245903,0.04391363635659218,PRUNED
454,454,0.12888765335083008,2023-01-04 17:10:03.195427,2023-01-04 17:10:11.940566,0 days 00:00:08.745139,tanh,0.35000000000000003,2,0.7,0.12888765335083008,,,PRUNED
455,455,0.1582922488451004,2023-01-04 17:10:12.035101,2023-01-04 17:10:21.214721,0 days 00:00:09.179620,sigmoid,0.35000000000000003,2,0.65,0.1582922488451004,,,PRUNED
456,456,0.04513484984636307,2023-01-04 17:10:21.318884,2023-01-04 17:10:57.552894,0 days 00:00:36.234010,tanh,0.1,2,0.65,0.06154153496026993,0.04513484984636307,,PRUNED
457,457,0.11254405975341797,2023-01-04 17:10:57.648961,2023-01-04 17:11:13.177509,0 days 00:00:15.528548,tanh,0.05,2,0.6,0.11254405975341797,,,PRUNED
458,458,0.14445802569389343,2023-01-04 17:11:13.284378,2023-01-04 17:11:21.926458,0 days 00:00:08.642080,tanh,0.35000000000000003,2,0.7,0.14445802569389343,,,PRUNED
459,459,0.13811342418193817,2023-01-04 17:11:22.021555,2023-01-04 17:11:30.600982,0 days 00:00:08.579427,sigmoid,0.30000000000000004,2,0.75,0.13811342418193817,,,PRUNED
460,460,0.14756116271018982,2023-01-04 17:11:30.695078,2023-01-04 17:11:39.575122,0 days 00:00:08.880044,tanh,0.35000000000000003,2,0.7,0.14756116271018982,,,PRUNED
461,461,0.0776888057589531,2023-01-04 17:11:39.662454,2023-01-04 17:11:55.117006,0 days 00:00:15.454552,sigmoid,0.35000000000000003,2,0.65,0.0776888057589531,,,PRUNED
462,462,0.1566917896270752,2023-01-04 17:11:55.219624,2023-01-04 17:12:03.856622,0 days 00:00:08.636998,sigmoid,0.35000000000000003,2,0.6,0.1566917896270752,,,PRUNED
463,463,0.14133548736572266,2023-01-04 17:12:03.954290,2023-01-04 17:12:12.514410,0 days 00:00:08.560120,tanh,0.30000000000000004,2,1.0,0.14133548736572266,,,PRUNED
464,464,0.08857019245624542,2023-01-04 17:12:12.601419,2023-01-04 17:12:28.438092,0 days 00:00:15.836673,sigmoid,0.4,2,0.65,0.09423470497131348,0.08857019245624542,,PRUNED
465,465,0.14012093842029572,2023-01-04 17:12:28.533758,2023-01-04 17:12:37.242571,0 days 00:00:08.708813,tanh,0.35000000000000003,2,0.7,0.14012093842029572,,,PRUNED
466,466,0.1663752943277359,2023-01-04 17:12:37.349658,2023-01-04 17:13:13.613557,0 days 00:00:36.263899,relu,0.5,2,0.6,0.06799009442329407,0.04197610169649124,,COMPLETE
467,467,0.1793833076953888,2023-01-04 17:13:13.709896,2023-01-04 17:13:46.427646,0 days 00:00:32.717750,relu,0.05,2,0.6,0.06189549341797829,,,COMPLETE
468,468,0.04895894229412079,2023-01-04 17:13:46.531756,2023-01-04 17:14:22.979197,0 days 00:00:36.447441,tanh,0.1,2,0.5,0.0655386671423912,0.04895894229412079,,PRUNED
469,469,0.191599503159523,2023-01-04 17:14:23.067085,2023-01-04 17:14:39.169946,0 days 00:00:16.102861,relu,0.4,8,0.55,0.191599503159523,,,PRUNED
470,470,0.14427542686462402,2023-01-04 17:14:39.257123,2023-01-04 17:15:25.853470,0 days 00:00:46.596347,tanh,0.1,2,0.7,0.05592842400074005,0.04365973174571991,,COMPLETE
471,471,0.04611360654234886,2023-01-04 17:15:25.966704,2023-01-04 17:16:02.571585,0 days 00:00:36.604881,tanh,0.30000000000000004,2,0.7,0.08872991055250168,0.06822465360164642,0.04611360654234886,PRUNED
472,472,0.04394541680812836,2023-01-04 17:16:02.667524,2023-01-04 17:16:39.244154,0 days 00:00:36.576630,sigmoid,0.5,2,0.75,0.1058821976184845,0.06440079212188721,0.04394541680812836,PRUNED
473,473,0.0453074648976326,2023-01-04 17:16:39.340818,2023-01-04 17:17:15.599735,0 days 00:00:36.258917,tanh,0.1,2,0.65,0.06528099626302719,0.0453074648976326,,PRUNED
474,474,0.1609421968460083,2023-01-04 17:17:15.697402,2023-01-04 17:17:24.265449,0 days 00:00:08.568047,tanh,0.35000000000000003,2,1.0,0.1609421968460083,,,PRUNED
475,475,0.12837161123752594,2023-01-04 17:17:24.361541,2023-01-04 17:17:33.265068,0 days 00:00:08.903527,sigmoid,0.35000000000000003,2,0.8500000000000001,0.12837161123752594,,,PRUNED
476,476,0.07375983893871307,2023-01-04 17:17:33.361156,2023-01-04 17:17:48.913887,0 days 00:00:15.552731,relu,0.30000000000000004,2,0.55,0.12148129194974899,0.07375983893871307,,PRUNED
477,477,0.14936374127864838,2023-01-04 17:17:49.009549,2023-01-04 17:17:57.629893,0 days 00:00:08.620344,tanh,0.4,2,1.0,0.14936374127864838,,,PRUNED
478,478,0.07296871393918991,2023-01-04 17:17:57.734893,2023-01-04 17:18:13.445337,0 days 00:00:15.710444,sigmoid,0.35000000000000003,2,0.8500000000000001,0.10540661960840225,0.07296871393918991,,PRUNED
479,479,0.15106751024723053,2023-01-04 17:18:13.541463,2023-01-04 17:18:53.654388,0 days 00:00:40.112925,tanh,0.1,2,0.6,0.06008226051926613,0.04203297570347786,,COMPLETE
480,480,0.0451473630964756,2023-01-04 17:18:53.767516,2023-01-04 17:19:30.070627,0 days 00:00:36.303111,tanh,0.30000000000000004,2,0.8500000000000001,0.11319621652364731,0.06599409878253937,0.0451473630964756,PRUNED
481,481,0.044394347816705704,2023-01-04 17:19:30.160243,2023-01-04 17:20:06.537202,0 days 00:00:36.376959,relu,0.5,2,1.0,0.1070382297039032,0.0625174343585968,0.044394347816705704,PRUNED
482,482,0.1063539907336235,2023-01-04 17:20:06.623145,2023-01-04 17:20:22.866196,0 days 00:00:16.243051,tanh,0.35000000000000003,2,0.8500000000000001,0.11430402100086212,0.1063539907336235,,PRUNED
483,483,0.17573393881320953,2023-01-04 17:20:22.964585,2023-01-04 17:20:39.126070,0 days 00:00:16.161485,tanh,0.1,7,0.6,0.17573393881320953,,,PRUNED
484,484,0.15534357726573944,2023-01-04 17:20:39.221929,2023-01-04 17:20:47.958689,0 days 00:00:08.736760,sigmoid,0.4,2,0.8500000000000001,0.15534357726573944,,,PRUNED
485,485,0.0472465418279171,2023-01-04 17:20:48.062668,2023-01-04 17:21:24.264278,0 days 00:00:36.201610,tanh,0.1,2,0.65,0.06688889116048813,0.0472465418279171,,PRUNED
486,486,0.07570206373929977,2023-01-04 17:21:24.351644,2023-01-04 17:21:40.246281,0 days 00:00:15.894637,relu,0.35000000000000003,2,1.0,0.12544924020767212,0.07570206373929977,,PRUNED
487,487,0.16908709704875946,2023-01-04 17:21:40.350403,2023-01-04 17:21:49.062405,0 days 00:00:08.712002,tanh,0.35000000000000003,2,0.65,0.16908709704875946,,,PRUNED
488,488,0.07319699227809906,2023-01-04 17:21:49.149736,2023-01-04 17:22:04.602949,0 days 00:00:15.453213,tanh,0.1,2,0.6,0.07319699227809906,,,PRUNED
489,489,0.0759047344326973,2023-01-04 17:22:04.692031,2023-01-04 17:22:20.302072,0 days 00:00:15.610041,tanh,0.1,2,0.6,0.0759047344326973,,,PRUNED
490,490,0.13174237310886383,2023-01-04 17:22:20.389042,2023-01-04 17:22:36.242169,0 days 00:00:15.853127,sigmoid,0.30000000000000004,2,0.8500000000000001,0.11632414162158966,0.13174237310886383,,PRUNED
491,491,0.14936049282550812,2023-01-04 17:22:36.329551,2023-01-04 17:23:19.511347,0 days 00:00:43.181796,tanh,0.5,2,0.8500000000000001,0.12321186065673828,0.06220640987157822,0.041880618780851364,COMPLETE
492,492,0.1483020782470703,2023-01-04 17:23:19.614589,2023-01-04 17:24:03.161187,0 days 00:00:43.546598,tanh,0.5,2,0.8500000000000001,0.11740819364786148,0.061491597443819046,0.04212818294763565,COMPLETE
493,493,0.12966252863407135,2023-01-04 17:24:03.287844,2023-01-04 17:24:12.034807,0 days 00:00:08.746963,tanh,0.5,2,0.8500000000000001,0.12966252863407135,,,PRUNED
494,494,0.07165727764368057,2023-01-04 17:24:12.130599,2023-01-04 17:24:27.867337,0 days 00:00:15.736738,tanh,0.5,2,0.8500000000000001,0.08819828927516937,0.07165727764368057,,PRUNED
495,495,0.16020356118679047,2023-01-04 17:24:27.953399,2023-01-04 17:24:36.591332,0 days 00:00:08.637933,tanh,0.5,2,0.8500000000000001,0.16020356118679047,,,PRUNED
496,496,0.04454774782061577,2023-01-04 17:24:36.687469,2023-01-04 17:25:12.796868,0 days 00:00:36.109399,tanh,0.5,2,0.8500000000000001,0.09897185117006302,0.06663105636835098,0.04454774782061577,PRUNED
497,497,0.07817346602678299,2023-01-04 17:25:12.885341,2023-01-04 17:25:28.595532,0 days 00:00:15.710191,tanh,0.5,2,0.8500000000000001,0.12109653651714325,0.07817346602678299,,PRUNED
498,498,0.1410093456506729,2023-01-04 17:25:28.684156,2023-01-04 17:25:37.236694,0 days 00:00:08.552538,tanh,0.5,2,0.8,0.1410093456506729,,,PRUNED
499,499,0.14837008714675903,2023-01-04 17:25:37.324164,2023-01-04 17:26:30.869077,0 days 00:00:53.544913,tanh,0.5,2,0.8500000000000001,0.10889148712158203,0.06701217591762543,0.04282582551240921,COMPLETE
500,500,0.1484343260526657,2023-01-04 17:26:30.983118,2023-01-04 17:27:17.447717,0 days 00:00:46.464599,tanh,0.5,2,0.8500000000000001,0.10689007490873337,0.0637352466583252,0.0420239120721817,COMPLETE
501,501,0.10088959336280823,2023-01-04 17:27:17.562788,2023-01-04 17:27:33.236309,0 days 00:00:15.673521,tanh,0.1,2,0.6,0.10088959336280823,,,PRUNED
502,502,0.048984598368406296,2023-01-04 17:27:33.324732,2023-01-04 17:28:09.524949,0 days 00:00:36.200217,tanh,0.30000000000000004,2,0.65,0.06884755939245224,0.048984598368406296,,PRUNED
503,503,0.0701083093881607,2023-01-04 17:28:09.620722,2023-01-04 17:28:25.274416,0 days 00:00:15.653694,tanh,0.5,2,0.8500000000000001,0.10938557982444763,0.0701083093881607,,PRUNED
504,504,0.04911414533853531,2023-01-04 17:28:25.361463,2023-01-04 17:29:01.370982,0 days 00:00:36.009519,tanh,0.05,2,0.6,0.0712798461318016,0.04911414533853531,,PRUNED
505,505,0.04737784340977669,2023-01-04 17:29:01.466981,2023-01-04 17:29:37.968784,0 days 00:00:36.501803,tanh,0.5,2,0.8500000000000001,0.10906343162059784,0.06593509763479233,0.04737784340977669,PRUNED
506,506,0.0828072652220726,2023-01-04 17:29:38.073631,2023-01-04 17:29:53.659462,0 days 00:00:15.585831,tanh,0.4,2,0.7,0.0828072652220726,,,PRUNED
507,507,0.04915284737944603,2023-01-04 17:29:53.771506,2023-01-04 17:30:30.398337,0 days 00:00:36.626831,tanh,0.5,2,0.8500000000000001,0.1147400438785553,0.06745072454214096,0.04915284737944603,PRUNED
508,508,0.07560348510742188,2023-01-04 17:30:30.486396,2023-01-04 17:30:46.121819,0 days 00:00:15.635423,sigmoid,0.2,2,0.55,0.07560348510742188,,,PRUNED
509,509,0.11842051148414612,2023-01-04 17:30:46.216917,2023-01-04 17:31:02.030340,0 days 00:00:15.813423,relu,0.1,2,0.6,0.11842051148414612,,,PRUNED
