,number,value,datetime_start,datetime_complete,duration,params_activation,params_dropout,params_layers,params_shrink,system_attrs_completed_rung_0,system_attrs_completed_rung_1,system_attrs_completed_rung_2,state
1024,1024,0.09055852144956589,2023-01-04 20:12:17.153521,2023-01-04 20:12:32.880611,0 days 00:00:15.727090,sigmoid,0.5,3,1.0,0.12147631496191025,0.09055852144956589,,PRUNED
1025,1025,0.1538059115409851,2023-01-04 20:12:33.007791,2023-01-04 20:12:41.945088,0 days 00:00:08.937297,relu,0.5,4,0.65,0.1538059115409851,,,PRUNED
1026,1026,0.09668108075857162,2023-01-04 20:12:42.073111,2023-01-04 20:12:58.216183,0 days 00:00:16.143072,relu,0.05,5,0.75,0.09668108075857162,,,PRUNED
1027,1027,0.047633521258831024,2023-01-04 20:12:58.339269,2023-01-04 20:13:34.562621,0 days 00:00:36.223352,relu,0.0,2,0.6,0.06462452560663223,0.047633521258831024,,PRUNED
1028,1028,0.08893764019012451,2023-01-04 20:13:34.685462,2023-01-04 20:13:50.353709,0 days 00:00:15.668247,tanh,0.35000000000000003,2,0.8500000000000001,0.10521798580884933,0.08893764019012451,,PRUNED
1029,1029,0.14411942660808563,2023-01-04 20:13:50.475082,2023-01-04 20:14:06.268838,0 days 00:00:15.793756,relu,0.5,2,0.75,0.09466788172721863,0.14411942660808563,,PRUNED
1030,1030,0.4603535830974579,2023-01-04 20:14:06.390957,2023-01-04 20:14:15.707000,0 days 00:00:09.316043,tanh,0.45,8,0.9,0.4603535830974579,,,PRUNED
1031,1031,0.07500378042459488,2023-01-04 20:14:15.824519,2023-01-04 20:14:31.491479,0 days 00:00:15.666960,sigmoid,0.5,2,0.8500000000000001,0.11327552050352097,0.07500378042459488,,PRUNED
1032,1032,0.08701752126216888,2023-01-04 20:14:31.614501,2023-01-04 20:14:47.078814,0 days 00:00:15.464313,relu,0.05,2,1.0,0.08701752126216888,,,PRUNED
1033,1033,0.14741812646389008,2023-01-04 20:14:47.196138,2023-01-04 20:14:56.215443,0 days 00:00:09.019305,tanh,0.35000000000000003,2,0.8500000000000001,0.14741812646389008,,,PRUNED
1034,1034,0.07622294872999191,2023-01-04 20:14:56.313946,2023-01-04 20:15:11.939613,0 days 00:00:15.625667,relu,0.5,2,0.8,0.09601032733917236,0.07622294872999191,,PRUNED
1035,1035,0.08796469867229462,2023-01-04 20:15:12.054965,2023-01-04 20:15:27.638432,0 days 00:00:15.583467,relu,0.05,2,0.6,0.08796469867229462,,,PRUNED
1036,1036,0.04698849096894264,2023-01-04 20:15:27.751806,2023-01-04 20:16:03.901597,0 days 00:00:36.149791,relu,0.0,2,0.6,0.07223272323608398,0.04698849096894264,,PRUNED
1037,1037,0.13100185990333557,2023-01-04 20:16:04.026071,2023-01-04 20:16:13.040173,0 days 00:00:09.014102,tanh,0.4,2,0.8500000000000001,0.13100185990333557,,,PRUNED
1038,1038,0.06939385831356049,2023-01-04 20:16:13.149417,2023-01-04 20:16:28.749892,0 days 00:00:15.600475,relu,0.5,2,0.7,0.10153614729642868,0.06939385831356049,,PRUNED
1039,1039,0.14035680890083313,2023-01-04 20:16:28.863855,2023-01-04 20:16:37.624805,0 days 00:00:08.760950,tanh,0.45,2,0.5,0.14035680890083313,,,PRUNED
1040,1040,0.07695335149765015,2023-01-04 20:16:37.755067,2023-01-04 20:16:53.556939,0 days 00:00:15.801872,relu,0.35000000000000003,2,0.65,0.07695335149765015,,,PRUNED
1041,1041,0.04465653374791145,2023-01-04 20:16:53.670322,2023-01-04 20:17:29.929276,0 days 00:00:36.258954,sigmoid,0.2,2,0.8500000000000001,0.11530965566635132,0.06846743077039719,0.04465653374791145,PRUNED
1042,1042,0.18895182013511658,2023-01-04 20:17:30.046592,2023-01-04 20:17:38.786436,0 days 00:00:08.739844,relu,0.30000000000000004,2,0.9,0.18895182013511658,,,PRUNED
1043,1043,0.20372700691223145,2023-01-04 20:17:38.902515,2023-01-04 20:17:47.702862,0 days 00:00:08.800347,tanh,0.35000000000000003,3,0.8500000000000001,0.20372700691223145,,,PRUNED
1044,1044,0.07414966076612473,2023-01-04 20:17:47.818061,2023-01-04 20:18:03.597334,0 days 00:00:15.779273,relu,0.30000000000000004,2,0.65,0.07414966076612473,,,PRUNED
1045,1045,0.1270359307527542,2023-01-04 20:18:03.707214,2023-01-04 20:18:12.622880,0 days 00:00:08.915666,relu,0.5,2,0.6,0.1270359307527542,,,PRUNED
1046,1046,0.08044088631868362,2023-01-04 20:18:12.732022,2023-01-04 20:18:28.324490,0 days 00:00:15.592468,relu,0.05,2,0.6,0.08044088631868362,,,PRUNED
1047,1047,0.07516052573919296,2023-01-04 20:18:28.478693,2023-01-04 20:18:44.128249,0 days 00:00:15.649556,tanh,0.4,2,0.8500000000000001,0.11186003684997559,0.07516052573919296,,PRUNED
1048,1048,0.14947539567947388,2023-01-04 20:18:44.237341,2023-01-04 20:18:53.161248,0 days 00:00:08.923907,relu,0.25,2,0.65,0.14947539567947388,,,PRUNED
1049,1049,0.07816503942012787,2023-01-04 20:18:53.269246,2023-01-04 20:19:08.784431,0 days 00:00:15.515185,sigmoid,0.30000000000000004,2,0.7,0.07816503942012787,,,PRUNED
1050,1050,0.22019988298416138,2023-01-04 20:19:08.904588,2023-01-04 20:19:18.071405,0 days 00:00:09.166817,sigmoid,0.35000000000000003,7,0.8500000000000001,0.22019988298416138,,,PRUNED
1051,1051,0.12802326679229736,2023-01-04 20:19:18.184490,2023-01-04 20:19:27.078815,0 days 00:00:08.894325,tanh,0.5,2,0.8,0.12802326679229736,,,PRUNED
1052,1052,0.04903898760676384,2023-01-04 20:19:27.175140,2023-01-04 20:20:03.397076,0 days 00:00:36.221936,relu,0.35000000000000003,2,0.5,0.06869138777256012,0.04903898760676384,,PRUNED
1053,1053,0.1441141963005066,2023-01-04 20:20:03.506163,2023-01-04 20:20:53.496712,0 days 00:00:49.990549,relu,0.1,2,0.6,0.0661126896739006,0.04215007275342941,,COMPLETE
1054,1054,0.046662479639053345,2023-01-04 20:20:53.649566,2023-01-04 20:21:29.743519,0 days 00:00:36.093953,relu,0.5,2,0.8500000000000001,0.11453965306282043,0.0661015436053276,0.046662479639053345,PRUNED
1055,1055,0.07478582859039307,2023-01-04 20:21:29.859854,2023-01-04 20:21:45.651503,0 days 00:00:15.791649,relu,0.1,2,0.8,0.07478582859039307,,,PRUNED
1056,1056,0.17220725119113922,2023-01-04 20:21:45.775207,2023-01-04 20:21:54.576218,0 days 00:00:08.801011,tanh,0.30000000000000004,3,1.0,0.17220725119113922,,,PRUNED
1057,1057,0.0789942741394043,2023-01-04 20:21:54.689325,2023-01-04 20:22:10.363036,0 days 00:00:15.673711,relu,0.45,2,0.8500000000000001,0.11909589916467667,0.0789942741394043,,PRUNED
1058,1058,0.07349920272827148,2023-01-04 20:22:10.480749,2023-01-04 20:22:26.090306,0 days 00:00:15.609557,relu,0.1,2,0.6,0.07349920272827148,,,PRUNED
1059,1059,0.23285265266895294,2023-01-04 20:22:26.204796,2023-01-04 20:22:35.239296,0 days 00:00:09.034500,sigmoid,0.35000000000000003,5,0.95,0.23285265266895294,,,PRUNED
1060,1060,0.08300513029098511,2023-01-04 20:22:35.352869,2023-01-04 20:22:51.137413,0 days 00:00:15.784544,relu,0.1,3,0.65,0.08300513029098511,,,PRUNED
1061,1061,0.15130236744880676,2023-01-04 20:22:51.269339,2023-01-04 20:23:34.625162,0 days 00:00:43.355823,relu,0.1,2,0.6,0.05842701345682144,0.04177626222372055,,COMPLETE
1062,1062,0.07607699185609818,2023-01-04 20:23:34.753066,2023-01-04 20:23:50.637702,0 days 00:00:15.884636,tanh,0.15000000000000002,2,0.5,0.07607699185609818,,,PRUNED
1063,1063,0.07580693811178207,2023-01-04 20:23:50.747759,2023-01-04 20:24:06.495039,0 days 00:00:15.747280,tanh,0.5,2,0.8,0.11948391795158386,0.07580693811178207,,PRUNED
1064,1064,0.045682962983846664,2023-01-04 20:24:06.606433,2023-01-04 20:24:43.004489,0 days 00:00:36.398056,sigmoid,0.1,2,0.6,0.061657700687646866,0.045682962983846664,,PRUNED
1065,1065,0.15200147032737732,2023-01-04 20:24:43.134888,2023-01-04 20:24:52.100823,0 days 00:00:08.965935,relu,0.5,2,0.8500000000000001,0.15200147032737732,,,PRUNED
1066,1066,0.14291401207447052,2023-01-04 20:24:52.216989,2023-01-04 20:25:01.260803,0 days 00:00:09.043814,tanh,0.30000000000000004,2,0.9,0.14291401207447052,,,PRUNED
1067,1067,0.08748582005500793,2023-01-04 20:25:01.385523,2023-01-04 20:25:17.114604,0 days 00:00:15.729081,relu,0.35000000000000003,2,0.8500000000000001,0.09727173298597336,0.08748582005500793,,PRUNED
1068,1068,0.07440876960754395,2023-01-04 20:25:17.231315,2023-01-04 20:25:32.963783,0 days 00:00:15.732468,relu,0.05,2,0.6,0.07440876960754395,,,PRUNED
1069,1069,0.04540764540433884,2023-01-04 20:25:33.108530,2023-01-04 20:26:09.719963,0 days 00:00:36.611433,tanh,0.5,2,0.7,0.10775117576122284,0.06406862288713455,0.04540764540433884,PRUNED
1070,1070,0.07043673098087311,2023-01-04 20:26:09.851960,2023-01-04 20:26:25.638535,0 days 00:00:15.786575,sigmoid,0.5,2,0.5,0.09741915017366409,0.07043673098087311,,PRUNED
1071,1071,0.15248797833919525,2023-01-04 20:26:25.766583,2023-01-04 20:27:12.628749,0 days 00:00:46.862166,tanh,0.1,2,0.65,0.07182668149471283,0.04383288323879242,,COMPLETE
1072,1072,0.07606611400842667,2023-01-04 20:27:12.775886,2023-01-04 20:27:28.241868,0 days 00:00:15.465982,relu,0.1,2,0.6,0.07606611400842667,,,PRUNED
1073,1073,0.07453891634941101,2023-01-04 20:27:28.360698,2023-01-04 20:27:44.165945,0 days 00:00:15.805247,tanh,0.0,2,0.5,0.07453891634941101,,,PRUNED
1074,1074,0.12732483446598053,2023-01-04 20:27:44.387992,2023-01-04 20:27:53.078844,0 days 00:00:08.690852,relu,0.45,2,0.8500000000000001,0.12732483446598053,,,PRUNED
1075,1075,0.1311476081609726,2023-01-04 20:27:53.202317,2023-01-04 20:28:01.914308,0 days 00:00:08.711991,tanh,0.35000000000000003,2,0.8500000000000001,0.1311476081609726,,,PRUNED
1076,1076,0.07484860718250275,2023-01-04 20:28:02.042411,2023-01-04 20:28:17.587936,0 days 00:00:15.545525,relu,0.25,2,0.7,0.07484860718250275,,,PRUNED
1077,1077,0.14373120665550232,2023-01-04 20:28:17.709908,2023-01-04 20:28:26.629759,0 days 00:00:08.919851,relu,0.5,2,0.8500000000000001,0.14373120665550232,,,PRUNED
1078,1078,0.16923297941684723,2023-01-04 20:28:26.755908,2023-01-04 20:28:35.395761,0 days 00:00:08.639853,tanh,0.45,2,1.0,0.16923297941684723,,,PRUNED
1079,1079,0.0777827575802803,2023-01-04 20:28:35.527302,2023-01-04 20:28:50.981151,0 days 00:00:15.453849,tanh,0.15000000000000002,2,0.9,0.0777827575802803,,,PRUNED
1080,1080,0.04912234842777252,2023-01-04 20:28:51.097216,2023-01-04 20:29:27.457405,0 days 00:00:36.360189,sigmoid,0.4,2,0.8500000000000001,0.1114426776766777,0.06566163897514343,0.04912234842777252,PRUNED
1081,1081,0.178335502743721,2023-01-04 20:29:27.585038,2023-01-04 20:29:36.586957,0 days 00:00:09.001919,relu,0.5,2,0.9,0.178335502743721,,,PRUNED
1082,1082,0.0795178934931755,2023-01-04 20:29:36.701064,2023-01-04 20:29:52.185875,0 days 00:00:15.484811,tanh,0.1,2,0.6,0.0795178934931755,,,PRUNED
1083,1083,0.08877936005592346,2023-01-04 20:29:52.301842,2023-01-04 20:30:08.138762,0 days 00:00:15.836920,relu,0.30000000000000004,4,0.65,0.08877936005592346,,,PRUNED
1084,1084,0.07322067767381668,2023-01-04 20:30:08.267581,2023-01-04 20:30:24.108097,0 days 00:00:15.840516,tanh,0.30000000000000004,2,0.8500000000000001,0.10001666098833084,0.07322067767381668,,PRUNED
1085,1085,0.12786687910556793,2023-01-04 20:30:24.224175,2023-01-04 20:30:32.991773,0 days 00:00:08.767598,tanh,0.35000000000000003,2,0.8,0.12786687910556793,,,PRUNED
1086,1086,0.1290225386619568,2023-01-04 20:30:33.124609,2023-01-04 20:30:41.898422,0 days 00:00:08.773813,relu,0.5,2,0.75,0.1290225386619568,,,PRUNED
1087,1087,0.12471199780702591,2023-01-04 20:30:42.022717,2023-01-04 20:30:50.798485,0 days 00:00:08.775768,sigmoid,0.35000000000000003,2,0.8500000000000001,0.12471199780702591,,,PRUNED
1088,1088,0.08202309161424637,2023-01-04 20:30:50.914072,2023-01-04 20:31:06.733752,0 days 00:00:15.819680,tanh,0.1,2,0.6,0.08202309161424637,,,PRUNED
1089,1089,0.07155025750398636,2023-01-04 20:31:06.972238,2023-01-04 20:31:22.737004,0 days 00:00:15.764766,tanh,0.45,2,0.95,0.11725097894668579,0.07155025750398636,,PRUNED
1090,1090,0.1268240213394165,2023-01-04 20:31:22.859072,2023-01-04 20:31:31.632462,0 days 00:00:08.773390,relu,0.5,2,0.5,0.1268240213394165,,,PRUNED
1091,1091,0.13265416026115417,2023-01-04 20:31:31.742325,2023-01-04 20:31:40.406176,0 days 00:00:08.663851,tanh,0.5,2,0.8500000000000001,0.13265416026115417,,,PRUNED
1092,1092,0.1512359231710434,2023-01-04 20:31:40.525305,2023-01-04 20:31:49.472855,0 days 00:00:08.947550,relu,0.4,2,0.55,0.1512359231710434,,,PRUNED
1093,1093,0.1611921787261963,2023-01-04 20:31:49.591971,2023-01-04 20:31:58.218825,0 days 00:00:08.626854,tanh,0.35000000000000003,2,0.7,0.1611921787261963,,,PRUNED
1094,1094,0.1348983347415924,2023-01-04 20:31:58.357216,2023-01-04 20:32:07.138111,0 days 00:00:08.780895,sigmoid,0.25,2,0.8500000000000001,0.1348983347415924,,,PRUNED
1095,1095,0.04457768797874451,2023-01-04 20:32:07.251211,2023-01-04 20:32:43.818679,0 days 00:00:36.567468,relu,0.30000000000000004,2,0.8500000000000001,0.11332309991121292,0.06685734540224075,0.04457768797874451,PRUNED
1096,1096,0.07469882816076279,2023-01-04 20:32:43.946268,2023-01-04 20:32:59.658804,0 days 00:00:15.712536,relu,0.05,2,0.6,0.07469882816076279,,,PRUNED
1097,1097,0.07439116388559341,2023-01-04 20:32:59.785684,2023-01-04 20:33:15.340401,0 days 00:00:15.554717,tanh,0.30000000000000004,2,0.6,0.07439116388559341,,,PRUNED
1098,1098,0.08469885587692261,2023-01-04 20:33:15.460501,2023-01-04 20:33:31.197437,0 days 00:00:15.736936,tanh,0.5,2,0.9,0.11750788986682892,0.08469885587692261,,PRUNED
1099,1099,0.07457776367664337,2023-01-04 20:33:31.302505,2023-01-04 20:33:47.129568,0 days 00:00:15.827063,relu,0.35000000000000003,2,0.65,0.07457776367664337,,,PRUNED
1100,1100,0.10736630856990814,2023-01-04 20:33:47.257390,2023-01-04 20:34:02.954449,0 days 00:00:15.697059,sigmoid,0.1,2,0.5,0.10736630856990814,,,PRUNED
1101,1101,0.045044030994176865,2023-01-04 20:34:03.075579,2023-01-04 20:34:39.475839,0 days 00:00:36.400260,tanh,0.1,2,0.6,0.07151558250188828,0.045044030994176865,,PRUNED
1102,1102,0.07928793132305145,2023-01-04 20:34:39.603153,2023-01-04 20:34:55.246685,0 days 00:00:15.643532,relu,0.25,2,0.55,0.07928793132305145,,,PRUNED
1103,1103,0.07621083408594131,2023-01-04 20:34:55.370875,2023-01-04 20:35:11.261909,0 days 00:00:15.891034,tanh,0.15000000000000002,2,0.65,0.07621083408594131,,,PRUNED
1104,1104,0.13825595378875732,2023-01-04 20:35:11.383895,2023-01-04 20:35:20.145089,0 days 00:00:08.761194,relu,0.45,2,0.8500000000000001,0.13825595378875732,,,PRUNED
1105,1105,0.047008249908685684,2023-01-04 20:35:20.258832,2023-01-04 20:35:56.511485,0 days 00:00:36.252653,tanh,0.5,2,1.0,0.10215315967798233,0.05820305645465851,0.047008249908685684,PRUNED
1106,1106,0.08784721046686172,2023-01-04 20:35:56.638436,2023-01-04 20:36:12.269614,0 days 00:00:15.631178,tanh,0.1,2,0.6,0.08784721046686172,,,PRUNED
1107,1107,0.1444769650697708,2023-01-04 20:36:12.398150,2023-01-04 20:36:21.364999,0 days 00:00:08.966849,sigmoid,0.4,2,0.8500000000000001,0.1444769650697708,,,PRUNED
1108,1108,0.04603440687060356,2023-01-04 20:36:21.488129,2023-01-04 20:36:57.840175,0 days 00:00:36.352046,relu,0.35000000000000003,2,0.8500000000000001,0.11020037531852722,0.06295786052942276,0.04603440687060356,PRUNED
1109,1109,0.1312873363494873,2023-01-04 20:36:57.967294,2023-01-04 20:37:13.866307,0 days 00:00:15.899013,tanh,0.5,3,0.8,0.09902341663837433,0.1312873363494873,,PRUNED
1110,1110,0.13069148361682892,2023-01-04 20:37:13.992500,2023-01-04 20:37:23.000655,0 days 00:00:09.008155,relu,0.5,2,0.8500000000000001,0.13069148361682892,,,PRUNED
1111,1111,0.09904128313064575,2023-01-04 20:37:23.109018,2023-01-04 20:37:38.878863,0 days 00:00:15.769845,tanh,0.35000000000000003,2,0.7,0.12120827287435532,0.09904128313064575,,PRUNED
1112,1112,0.074400395154953,2023-01-04 20:37:38.989514,2023-01-04 20:37:54.644986,0 days 00:00:15.655472,relu,0.30000000000000004,2,0.7,0.074400395154953,,,PRUNED
1113,1113,0.07100050151348114,2023-01-04 20:37:54.773897,2023-01-04 20:38:10.509569,0 days 00:00:15.735672,sigmoid,0.45,2,0.8500000000000001,0.09487177431583405,0.07100050151348114,,PRUNED
1114,1114,0.04408760741353035,2023-01-04 20:38:10.621547,2023-01-04 20:38:47.282792,0 days 00:00:36.661245,relu,0.5,2,0.8500000000000001,0.1081618145108223,0.057116083800792694,0.04408760741353035,PRUNED
1115,1115,0.08778584003448486,2023-01-04 20:38:47.410362,2023-01-04 20:39:03.106084,0 days 00:00:15.695722,tanh,0.05,2,0.55,0.08778584003448486,,,PRUNED
1116,1116,0.15094153583049774,2023-01-04 20:39:03.237291,2023-01-04 20:39:11.993879,0 days 00:00:08.756588,tanh,0.30000000000000004,2,0.8,0.15094153583049774,,,PRUNED
1117,1117,0.1666475385427475,2023-01-04 20:39:12.122958,2023-01-04 20:39:21.083581,0 days 00:00:08.960623,relu,0.35000000000000003,2,1.0,0.1666475385427475,,,PRUNED
1118,1118,0.3187754452228546,2023-01-04 20:39:21.200010,2023-01-04 20:39:30.262819,0 days 00:00:09.062809,tanh,0.5,5,0.9,0.3187754452228546,,,PRUNED
1119,1119,0.14337755739688873,2023-01-04 20:39:30.383904,2023-01-04 20:39:39.165562,0 days 00:00:08.781658,relu,0.5,2,0.8500000000000001,0.14337755739688873,,,PRUNED
1120,1120,0.12390222400426865,2023-01-04 20:39:39.290716,2023-01-04 20:39:48.124873,0 days 00:00:08.834157,sigmoid,0.35000000000000003,2,0.8500000000000001,0.12390222400426865,,,PRUNED
1121,1121,0.09758492559194565,2023-01-04 20:39:48.248529,2023-01-04 20:40:04.131992,0 days 00:00:15.883463,tanh,0.30000000000000004,2,0.9,0.1151105985045433,0.09758492559194565,,PRUNED
1122,1122,0.14630256593227386,2023-01-04 20:40:04.264985,2023-01-04 20:40:13.039574,0 days 00:00:08.774589,relu,0.45,2,0.8500000000000001,0.14630256593227386,,,PRUNED
1123,1123,0.12321731448173523,2023-01-04 20:40:13.152507,2023-01-04 20:40:21.930378,0 days 00:00:08.777871,tanh,0.4,2,0.75,0.12321731448173523,,,PRUNED
1124,1124,0.08173561096191406,2023-01-04 20:40:22.064467,2023-01-04 20:40:37.903438,0 days 00:00:15.838971,relu,0.1,3,0.6,0.08173561096191406,,,PRUNED
1125,1125,0.04370834305882454,2023-01-04 20:40:38.229178,2023-01-04 20:41:14.575675,0 days 00:00:36.346497,tanh,0.5,2,0.8500000000000001,0.10337317734956741,0.06026812642812729,0.04370834305882454,PRUNED
1126,1126,0.0833650752902031,2023-01-04 20:41:14.684802,2023-01-04 20:41:30.392304,0 days 00:00:15.707502,relu,0.5,2,0.65,0.1197127029299736,0.0833650752902031,,PRUNED
1127,1127,0.1981106996536255,2023-01-04 20:41:30.508333,2023-01-04 20:41:39.216531,0 days 00:00:08.708198,sigmoid,0.35000000000000003,2,0.8,0.1981106996536255,,,PRUNED
1128,1128,0.16370315849781036,2023-01-04 20:41:39.326867,2023-01-04 20:41:48.332475,0 days 00:00:09.005608,tanh,0.5,2,0.95,0.16370315849781036,,,PRUNED
1129,1129,0.05202328413724899,2023-01-04 20:41:48.459604,2023-01-04 20:42:24.795375,0 days 00:00:36.335771,tanh,0.1,2,0.5,0.07250364869832993,0.05202328413724899,,PRUNED
1130,1130,0.07922302931547165,2023-01-04 20:42:24.905751,2023-01-04 20:42:40.528036,0 days 00:00:15.622285,relu,0.35000000000000003,2,0.6,0.07922302931547165,,,PRUNED
1131,1131,0.09086627513170242,2023-01-04 20:42:40.633753,2023-01-04 20:42:56.518978,0 days 00:00:15.885225,relu,0.4,2,0.8500000000000001,0.11354924738407135,0.09086627513170242,,PRUNED
1132,1132,0.07425332069396973,2023-01-04 20:42:56.645884,2023-01-04 20:43:12.450111,0 days 00:00:15.804227,tanh,0.1,2,0.65,0.07425332069396973,,,PRUNED
1133,1133,0.09115339815616608,2023-01-04 20:43:12.560496,2023-01-04 20:43:28.357583,0 days 00:00:15.797087,relu,0.05,2,0.6,0.09115339815616608,,,PRUNED
1134,1134,0.04476694390177727,2023-01-04 20:43:28.467145,2023-01-04 20:44:04.771166,0 days 00:00:36.304021,tanh,0.30000000000000004,2,0.5,0.06407801806926727,0.04476694390177727,,PRUNED
1135,1135,0.07365094125270844,2023-01-04 20:44:04.889782,2023-01-04 20:44:20.804016,0 days 00:00:15.914234,tanh,0.45,2,0.8500000000000001,0.11869793385267258,0.07365094125270844,,PRUNED
1136,1136,0.08325038105249405,2023-01-04 20:44:20.914764,2023-01-04 20:44:36.677297,0 days 00:00:15.762533,relu,0.5,2,0.8500000000000001,0.10534825921058655,0.08325038105249405,,PRUNED
1137,1137,0.04529504105448723,2023-01-04 20:44:36.805140,2023-01-04 20:45:13.174454,0 days 00:00:36.369314,sigmoid,0.0,2,0.55,0.06871659308671951,0.04529504105448723,,PRUNED
1138,1138,0.1312040239572525,2023-01-04 20:45:13.295058,2023-01-04 20:45:22.141333,0 days 00:00:08.846275,sigmoid,0.35000000000000003,2,0.5,0.1312040239572525,,,PRUNED
1139,1139,0.04386596009135246,2023-01-04 20:45:22.261052,2023-01-04 20:45:58.887969,0 days 00:00:36.626917,tanh,0.5,2,0.95,0.11195719987154007,0.06665117293596268,0.04386596009135246,PRUNED
1140,1140,0.17175209522247314,2023-01-04 20:45:58.997989,2023-01-04 20:46:15.178690,0 days 00:00:16.180701,relu,0.35000000000000003,7,0.6,0.17175209522247314,,,PRUNED
1141,1141,0.05078784003853798,2023-01-04 20:46:15.289626,2023-01-04 20:46:51.683587,0 days 00:00:36.393961,tanh,0.1,2,0.65,0.07159997522830963,0.05078784003853798,,PRUNED
1142,1142,0.07871630042791367,2023-01-04 20:46:51.798277,2023-01-04 20:47:07.824529,0 days 00:00:16.026252,tanh,0.15000000000000002,2,0.75,0.07871630042791367,,,PRUNED
1143,1143,0.07967010140419006,2023-01-04 20:47:07.940340,2023-01-04 20:47:23.682158,0 days 00:00:15.741818,relu,0.05,2,0.6,0.07967010140419006,,,PRUNED
1144,1144,0.050860803574323654,2023-01-04 20:47:23.788479,2023-01-04 20:48:00.145285,0 days 00:00:36.356806,tanh,0.1,2,0.55,0.07226914167404175,0.050860803574323654,,PRUNED
1145,1145,0.04499873146414757,2023-01-04 20:48:00.265791,2023-01-04 20:48:36.575751,0 days 00:00:36.309960,relu,0.25,2,0.7,0.06740649044513702,0.04499873146414757,,PRUNED
1146,1146,0.08539710193872452,2023-01-04 20:48:36.685039,2023-01-04 20:48:52.550447,0 days 00:00:15.865408,tanh,0.1,2,0.6,0.08539710193872452,,,PRUNED
1147,1147,0.14655861258506775,2023-01-04 20:48:52.675364,2023-01-04 20:49:01.599310,0 days 00:00:08.923946,relu,0.45,3,0.55,0.14655861258506775,,,PRUNED
1148,1148,0.07700978964567184,2023-01-04 20:49:01.709151,2023-01-04 20:49:17.497775,0 days 00:00:15.788624,tanh,0.5,2,0.8500000000000001,0.11234863102436066,0.07700978964567184,,PRUNED
1149,1149,0.04643046483397484,2023-01-04 20:49:17.616769,2023-01-04 20:49:54.145865,0 days 00:00:36.529096,relu,0.35000000000000003,2,1.0,0.11659976094961166,0.06575881689786911,0.04643046483397484,PRUNED
1150,1150,0.1865285336971283,2023-01-04 20:49:54.278832,2023-01-04 20:50:03.103049,0 days 00:00:08.824217,sigmoid,0.30000000000000004,2,0.75,0.1865285336971283,,,PRUNED
