,number,value,datetime_start,datetime_complete,duration,params_activation,params_dropout,params_layers,params_shrink,system_attrs_completed_rung_0,system_attrs_completed_rung_1,system_attrs_completed_rung_2,state
2189,2189,0.1202053651213646,2023-01-05 03:25:49.994207,2023-01-05 03:25:58.702514,0 days 00:00:08.708307,tanh,0.4,2,0.6,0.1202053651213646,,,PRUNED
2190,2190,0.14813145995140076,2023-01-05 03:25:58.788612,2023-01-05 03:26:55.229431,0 days 00:00:56.440819,tanh,0.0,2,0.55,0.04588031768798828,,,COMPLETE
2191,2191,0.13516172766685486,2023-01-05 03:26:55.345267,2023-01-05 03:27:04.040241,0 days 00:00:08.694974,relu,0.5,2,0.8500000000000001,0.13516172766685486,,,PRUNED
2192,2192,0.14634457230567932,2023-01-05 03:27:04.124245,2023-01-05 03:27:53.722919,0 days 00:00:49.598674,tanh,0.35000000000000003,2,0.7,0.06772933900356293,0.0435534343123436,,COMPLETE
2193,2193,0.056570954620838165,2023-01-05 03:27:53.849087,2023-01-05 03:28:09.317541,0 days 00:00:15.468454,tanh,0.30000000000000004,2,0.65,0.08706725388765335,0.056570954620838165,,PRUNED
2194,2194,0.10758215934038162,2023-01-05 03:28:09.410923,2023-01-05 03:28:25.016360,0 days 00:00:15.605437,sigmoid,0.35000000000000003,2,0.7,0.10758215934038162,,,PRUNED
2195,2195,0.14109094440937042,2023-01-05 03:28:25.132333,2023-01-05 03:28:33.875822,0 days 00:00:08.743489,relu,0.05,2,0.9,0.14109094440937042,,,PRUNED
2196,2196,0.05020845681428909,2023-01-05 03:28:33.991364,2023-01-05 03:29:09.970203,0 days 00:00:35.978839,tanh,0.5,2,0.55,0.07313728332519531,0.05020845681428909,,PRUNED
2197,2197,0.07016792893409729,2023-01-05 03:29:10.073928,2023-01-05 03:29:25.653121,0 days 00:00:15.579193,tanh,0.2,2,0.8500000000000001,0.09645462036132812,0.07016792893409729,,PRUNED
2198,2198,0.10979451984167099,2023-01-05 03:29:25.746698,2023-01-05 03:29:34.611982,0 days 00:00:08.865284,relu,0.1,2,0.6,0.10979451984167099,,,PRUNED
2199,2199,0.1406785547733307,2023-01-05 03:29:34.710645,2023-01-05 03:29:43.360295,0 days 00:00:08.649650,tanh,0.35000000000000003,2,0.5,0.1406785547733307,,,PRUNED
2200,2200,0.07886677980422974,2023-01-05 03:29:43.467422,2023-01-05 03:29:58.900763,0 days 00:00:15.433341,sigmoid,0.4,2,0.65,0.07886677980422974,,,PRUNED
2201,2201,0.150963693857193,2023-01-05 03:29:59.016592,2023-01-05 03:30:45.150611,0 days 00:00:46.134019,sigmoid,0.5,2,0.7,0.07379863411188126,0.04505328834056854,,COMPLETE
2202,2202,0.16514340043067932,2023-01-05 03:30:45.272212,2023-01-05 03:31:27.938255,0 days 00:00:42.666043,tanh,0.0,2,0.55,0.05118515342473984,,,COMPLETE
2203,2203,0.16690608859062195,2023-01-05 03:31:28.049325,2023-01-05 03:32:10.911657,0 days 00:00:42.862332,tanh,0.0,2,0.55,0.05099807679653168,,,COMPLETE
2204,2204,0.13624373078346252,2023-01-05 03:32:11.028275,2023-01-05 03:32:26.981021,0 days 00:00:15.952746,tanh,0.35000000000000003,6,0.9,0.13624373078346252,,,PRUNED
2205,2205,0.12884165346622467,2023-01-05 03:32:27.088411,2023-01-05 03:32:35.688824,0 days 00:00:08.600413,tanh,0.30000000000000004,2,0.7,0.12884165346622467,,,PRUNED
2206,2206,0.06300605088472366,2023-01-05 03:32:35.798857,2023-01-05 03:32:51.737446,0 days 00:00:15.938589,relu,0.45,2,0.65,0.09793851524591446,0.06300605088472366,,PRUNED
2207,2207,0.15293507277965546,2023-01-05 03:32:51.840392,2023-01-05 03:33:41.432464,0 days 00:00:49.592072,tanh,0.0,2,0.55,0.04469865933060646,,,COMPLETE
2208,2208,0.07649321854114532,2023-01-05 03:33:41.557633,2023-01-05 03:33:57.074105,0 days 00:00:15.516472,tanh,0.35000000000000003,2,0.6,0.10121968388557434,0.07649321854114532,,PRUNED
2209,2209,0.04768463224172592,2023-01-05 03:33:57.175794,2023-01-05 03:34:33.395887,0 days 00:00:36.220093,sigmoid,0.5,2,1.0,0.07170666754245758,0.04768463224172592,,PRUNED
2210,2210,0.11577635258436203,2023-01-05 03:34:33.505310,2023-01-05 03:34:42.245592,0 days 00:00:08.740282,relu,0.5,2,0.55,0.11577635258436203,,,PRUNED
2211,2211,0.11734279245138168,2023-01-05 03:34:42.353818,2023-01-05 03:34:50.978251,0 days 00:00:08.624433,tanh,0.15000000000000002,2,0.8500000000000001,0.11734279245138168,,,PRUNED
2212,2212,0.1822793185710907,2023-01-05 03:34:51.090364,2023-01-05 03:35:00.011161,0 days 00:00:08.920797,relu,0.4,2,0.6,0.1822793185710907,,,PRUNED
2213,2213,0.144142746925354,2023-01-05 03:35:00.119259,2023-01-05 03:35:49.753901,0 days 00:00:49.634642,tanh,0.25,2,0.7,0.07448577135801315,0.04337357357144356,,COMPLETE
2214,2214,0.14571616053581238,2023-01-05 03:35:49.881068,2023-01-05 03:36:46.150642,0 days 00:00:56.269574,tanh,0.0,2,0.55,0.04444659501314163,,,COMPLETE
2215,2215,0.14606070518493652,2023-01-05 03:36:46.267651,2023-01-05 03:36:54.844167,0 days 00:00:08.576516,tanh,0.1,2,0.75,0.14606070518493652,,,PRUNED
2216,2216,0.15536975860595703,2023-01-05 03:36:54.941646,2023-01-05 03:37:41.542285,0 days 00:00:46.600639,sigmoid,0.25,2,0.7,0.07814472168684006,0.046396128833293915,,COMPLETE
2217,2217,0.08191747963428497,2023-01-05 03:37:41.663136,2023-01-05 03:37:57.047103,0 days 00:00:15.383967,tanh,0.35000000000000003,2,0.7,0.08191747963428497,,,PRUNED
2218,2218,0.1554974615573883,2023-01-05 03:37:57.146262,2023-01-05 03:38:06.054891,0 days 00:00:08.908629,relu,0.30000000000000004,2,0.7,0.1554974615573883,,,PRUNED
2219,2219,0.10742312669754028,2023-01-05 03:38:06.156560,2023-01-05 03:38:21.778677,0 days 00:00:15.622117,tanh,0.35000000000000003,2,0.5,0.09713635593652725,0.10742312669754028,,PRUNED
2220,2220,0.16795623302459717,2023-01-05 03:38:21.885143,2023-01-05 03:39:07.928301,0 days 00:00:46.043158,tanh,0.0,2,0.55,0.05335536599159241,,,COMPLETE
2221,2221,0.1622222363948822,2023-01-05 03:39:08.048136,2023-01-05 03:39:16.974426,0 days 00:00:08.926290,tanh,0.5,3,0.95,0.1622222363948822,,,PRUNED
2222,2222,0.2372453361749649,2023-01-05 03:39:17.083905,2023-01-05 03:39:26.190142,0 days 00:00:09.106237,relu,0.30000000000000004,7,0.8,0.2372453361749649,,,PRUNED
2223,2223,0.12670674920082092,2023-01-05 03:39:26.292051,2023-01-05 03:39:34.956712,0 days 00:00:08.664661,tanh,0.1,2,0.65,0.12670674920082092,,,PRUNED
2224,2224,0.1393829733133316,2023-01-05 03:39:35.068697,2023-01-05 03:39:43.972347,0 days 00:00:08.903650,relu,0.4,2,0.6,0.1393829733133316,,,PRUNED
2225,2225,0.1682818979024887,2023-01-05 03:39:44.066685,2023-01-05 03:40:26.740899,0 days 00:00:42.674214,tanh,0.0,2,0.55,0.0515591986477375,,,COMPLETE
2226,2226,0.1049073338508606,2023-01-05 03:40:26.858733,2023-01-05 03:40:42.192861,0 days 00:00:15.334128,sigmoid,0.25,2,0.7,0.1049073338508606,,,PRUNED
2227,2227,0.25306835770606995,2023-01-05 03:40:42.309716,2023-01-05 03:40:51.450484,0 days 00:00:09.140768,tanh,0.30000000000000004,5,0.55,0.25306835770606995,,,PRUNED
2228,2228,0.08556567877531052,2023-01-05 03:40:51.554150,2023-01-05 03:41:07.098820,0 days 00:00:15.544670,tanh,0.2,2,0.7,0.08556567877531052,,,PRUNED
2229,2229,0.05840873718261719,2023-01-05 03:41:07.211277,2023-01-05 03:41:22.841141,0 days 00:00:15.629864,relu,0.25,2,0.7,0.09640398621559143,0.05840873718261719,,PRUNED
2230,2230,0.1329992562532425,2023-01-05 03:41:22.953358,2023-01-05 03:41:39.221797,0 days 00:00:16.268439,sigmoid,0.25,7,0.7,0.1329992562532425,,,PRUNED
2231,2231,0.08543174713850021,2023-01-05 03:41:39.324468,2023-01-05 03:41:54.878980,0 days 00:00:15.554512,sigmoid,0.25,2,0.7,0.08543174713850021,,,PRUNED
2232,2232,0.16733290255069733,2023-01-05 03:41:54.971878,2023-01-05 03:42:44.506274,0 days 00:00:49.534396,tanh,0.0,2,0.55,0.054899912327528,,,COMPLETE
2233,2233,0.12037768959999084,2023-01-05 03:42:44.632452,2023-01-05 03:42:53.443461,0 days 00:00:08.811009,tanh,0.05,2,0.8500000000000001,0.12037768959999084,,,PRUNED
2234,2234,0.08829917758703232,2023-01-05 03:42:53.560407,2023-01-05 03:43:09.048202,0 days 00:00:15.487795,tanh,0.25,2,0.7,0.08829917758703232,,,PRUNED
2235,2235,0.1629364937543869,2023-01-05 03:43:09.148941,2023-01-05 03:43:17.789196,0 days 00:00:08.640255,relu,0.35000000000000003,2,0.9,0.1629364937543869,,,PRUNED
2236,2236,0.051588937640190125,2023-01-05 03:43:17.896261,2023-01-05 03:43:53.968738,0 days 00:00:36.072477,sigmoid,0.25,2,0.65,0.06411565840244293,0.051588937640190125,,PRUNED
2237,2237,0.07932978868484497,2023-01-05 03:43:54.079580,2023-01-05 03:44:09.585201,0 days 00:00:15.505621,tanh,0.25,2,0.75,0.07932978868484497,,,PRUNED
2238,2238,0.08161602914333344,2023-01-05 03:44:09.688136,2023-01-05 03:44:25.133150,0 days 00:00:15.445014,sigmoid,0.25,2,0.7,0.08161602914333344,,,PRUNED
2239,2239,0.054333217442035675,2023-01-05 03:44:25.234242,2023-01-05 03:45:00.973068,0 days 00:00:35.738826,sigmoid,0.25,2,0.65,0.0782066062092781,0.054333217442035675,,PRUNED
2240,2240,0.123892642557621,2023-01-05 03:45:01.075844,2023-01-05 03:45:10.041281,0 days 00:00:08.965437,tanh,0.0,2,0.6,0.123892642557621,,,PRUNED
2241,2241,0.09544410556554794,2023-01-05 03:45:10.156102,2023-01-05 03:45:25.695999,0 days 00:00:15.539897,tanh,0.25,2,0.7,0.09544410556554794,,,PRUNED
2242,2242,0.11532179266214371,2023-01-05 03:45:25.797725,2023-01-05 03:45:34.687497,0 days 00:00:08.889772,tanh,0.45,2,0.8500000000000001,0.11532179266214371,,,PRUNED
2243,2243,0.09631656855344772,2023-01-05 03:45:34.786743,2023-01-05 03:45:50.251742,0 days 00:00:15.464999,sigmoid,0.5,2,0.7,0.09631656855344772,,,PRUNED
2244,2244,0.15318578481674194,2023-01-05 03:45:50.364781,2023-01-05 03:46:33.137561,0 days 00:00:42.772780,tanh,0.35000000000000003,2,0.75,0.058466993272304535,0.04495828598737717,,COMPLETE
2245,2245,0.14948318898677826,2023-01-05 03:46:33.256473,2023-01-05 03:47:29.641899,0 days 00:00:56.385426,tanh,0.0,2,0.55,0.04758560284972191,,,COMPLETE
2246,2246,0.15902107954025269,2023-01-05 03:47:29.963273,2023-01-05 03:48:12.838287,0 days 00:00:42.875014,tanh,0.0,2,0.6,0.04996718466281891,,,COMPLETE
2247,2247,0.10485604405403137,2023-01-05 03:48:12.956353,2023-01-05 03:48:21.540887,0 days 00:00:08.584534,relu,0.1,2,0.6,0.10485604405403137,,,PRUNED
2248,2248,0.09477301687002182,2023-01-05 03:48:21.657951,2023-01-05 03:48:37.131238,0 days 00:00:15.473287,sigmoid,0.2,2,0.65,0.09477301687002182,,,PRUNED
2249,2249,0.1575741469860077,2023-01-05 03:48:37.232016,2023-01-05 03:48:52.796696,0 days 00:00:15.564680,tanh,0.30000000000000004,2,0.65,0.09868188947439194,0.1575741469860077,,PRUNED
2250,2250,0.16133816540241241,2023-01-05 03:48:52.899366,2023-01-05 03:49:01.704340,0 days 00:00:08.804974,relu,0.4,3,0.65,0.16133816540241241,,,PRUNED
2251,2251,0.06282609701156616,2023-01-05 03:49:01.806081,2023-01-05 03:49:17.461458,0 days 00:00:15.655377,tanh,0.5,2,0.7,0.1014261245727539,0.06282609701156616,,PRUNED
2252,2252,0.13082528114318848,2023-01-05 03:49:17.564132,2023-01-05 03:49:26.211208,0 days 00:00:08.647076,relu,0.35000000000000003,2,0.5,0.13082528114318848,,,PRUNED
2253,2253,0.08030643314123154,2023-01-05 03:49:26.305124,2023-01-05 03:49:41.842231,0 days 00:00:15.537107,sigmoid,0.5,3,0.95,0.08030643314123154,,,PRUNED
2254,2254,0.15942704677581787,2023-01-05 03:49:41.942680,2023-01-05 03:49:50.693233,0 days 00:00:08.750553,tanh,0.30000000000000004,2,0.6,0.15942704677581787,,,PRUNED
2255,2255,0.12085486948490143,2023-01-05 03:49:50.792907,2023-01-05 03:49:59.374892,0 days 00:00:08.581985,relu,0.05,2,0.8500000000000001,0.12085486948490143,,,PRUNED
2256,2256,0.11768411844968796,2023-01-05 03:49:59.486890,2023-01-05 03:50:08.149920,0 days 00:00:08.663030,tanh,0.1,2,0.55,0.11768411844968796,,,PRUNED
2257,2257,0.09362102299928665,2023-01-05 03:50:08.249984,2023-01-05 03:50:23.881348,0 days 00:00:15.631364,tanh,0.25,2,0.7,0.09362102299928665,,,PRUNED
2258,2258,0.12177734076976776,2023-01-05 03:50:23.988403,2023-01-05 03:50:32.639992,0 days 00:00:08.651589,tanh,0.5,2,0.6,0.12177734076976776,,,PRUNED
2259,2259,0.08549349009990692,2023-01-05 03:50:32.741843,2023-01-05 03:50:48.061891,0 days 00:00:15.320048,sigmoid,0.35000000000000003,2,0.7,0.08549349009990692,,,PRUNED
2260,2260,0.15785712003707886,2023-01-05 03:50:48.175209,2023-01-05 03:50:57.046321,0 days 00:00:08.871112,relu,0.30000000000000004,2,0.9,0.15785712003707886,,,PRUNED
2261,2261,0.16201667487621307,2023-01-05 03:50:57.138775,2023-01-05 03:51:05.828521,0 days 00:00:08.689746,tanh,0.35000000000000003,2,0.95,0.16201667487621307,,,PRUNED
2262,2262,0.07880890369415283,2023-01-05 03:51:05.922650,2023-01-05 03:51:21.401896,0 days 00:00:15.479246,tanh,0.5,2,0.55,0.07880890369415283,,,PRUNED
2263,2263,0.14621573686599731,2023-01-05 03:51:21.495244,2023-01-05 03:52:11.111295,0 days 00:00:49.616051,tanh,0.0,2,0.55,0.04254822060465813,,,COMPLETE
2264,2264,0.05138672888278961,2023-01-05 03:52:11.242749,2023-01-05 03:52:47.028632,0 days 00:00:35.785883,sigmoid,0.30000000000000004,2,0.65,0.07215284556150436,0.05138672888278961,,PRUNED
2265,2265,0.1586478054523468,2023-01-05 03:52:47.140635,2023-01-05 03:53:33.255155,0 days 00:00:46.114520,tanh,0.0,2,0.55,0.04662523791193962,,,COMPLETE
2266,2266,0.1260416954755783,2023-01-05 03:53:33.375082,2023-01-05 03:53:42.116356,0 days 00:00:08.741274,relu,0.30000000000000004,2,0.7,0.1260416954755783,,,PRUNED
2267,2267,0.14359696209430695,2023-01-05 03:53:42.226055,2023-01-05 03:53:50.924710,0 days 00:00:08.698655,tanh,0.15000000000000002,2,0.65,0.14359696209430695,,,PRUNED
2268,2268,0.11629974097013474,2023-01-05 03:53:51.026156,2023-01-05 03:53:59.739696,0 days 00:00:08.713540,relu,0.4,2,0.75,0.11629974097013474,,,PRUNED
2269,2269,0.14127299189567566,2023-01-05 03:53:59.842361,2023-01-05 03:54:56.364515,0 days 00:00:56.522154,tanh,0.0,2,0.55,0.04399731382727623,,,COMPLETE
2270,2270,0.11694277822971344,2023-01-05 03:54:56.492679,2023-01-05 03:55:05.067993,0 days 00:00:08.575314,tanh,0.25,2,0.8500000000000001,0.11694277822971344,,,PRUNED
2271,2271,0.14754299819469452,2023-01-05 03:55:05.171828,2023-01-05 03:55:51.319288,0 days 00:00:46.147460,tanh,0.0,2,0.55,0.04113393276929855,,,COMPLETE
2272,2272,0.15074937045574188,2023-01-05 03:55:51.444773,2023-01-05 03:56:44.400860,0 days 00:00:52.956087,tanh,0.0,2,0.55,0.04688231647014618,,,COMPLETE
2273,2273,0.06774473190307617,2023-01-05 03:56:44.526023,2023-01-05 03:57:00.033403,0 days 00:00:15.507380,relu,0.45,2,0.6,0.09557017683982849,0.06774473190307617,,PRUNED
2274,2274,0.06582429260015488,2023-01-05 03:57:00.126488,2023-01-05 03:57:15.782930,0 days 00:00:15.656442,tanh,0.35000000000000003,2,0.5,0.09438248723745346,0.06582429260015488,,PRUNED
2275,2275,0.147694930434227,2023-01-05 03:57:15.869087,2023-01-05 03:58:05.633267,0 days 00:00:49.764180,sigmoid,0.35000000000000003,2,0.7,0.07174278050661087,0.0421479232609272,,COMPLETE
2276,2276,0.14581528306007385,2023-01-05 03:58:05.769235,2023-01-05 03:58:14.311852,0 days 00:00:08.542617,tanh,0.0,2,0.8500000000000001,0.14581528306007385,,,PRUNED
2277,2277,0.13184164464473724,2023-01-05 03:58:14.414425,2023-01-05 03:58:23.036083,0 days 00:00:08.621658,relu,0.1,2,0.7,0.13184164464473724,,,PRUNED
2278,2278,0.14766445755958557,2023-01-05 03:58:23.130422,2023-01-05 03:58:32.035393,0 days 00:00:08.904971,tanh,0.30000000000000004,2,0.6,0.14766445755958557,,,PRUNED
2279,2279,0.11835511028766632,2023-01-05 03:58:32.146394,2023-01-05 03:58:47.617535,0 days 00:00:15.471141,tanh,0.5,2,0.7,0.11835511028766632,,,PRUNED
2280,2280,0.16592943668365479,2023-01-05 03:58:47.719217,2023-01-05 03:59:23.770922,0 days 00:00:36.051705,tanh,0.0,2,0.55,0.04919975623488426,,,COMPLETE
2281,2281,0.07247452437877655,2023-01-05 03:59:23.887808,2023-01-05 03:59:39.580546,0 days 00:00:15.692738,relu,0.2,2,0.8,0.08872654289007187,0.07247452437877655,,PRUNED
2282,2282,0.19081062078475952,2023-01-05 03:59:39.679702,2023-01-05 03:59:48.337852,0 days 00:00:08.658150,tanh,0.4,2,0.65,0.19081062078475952,,,PRUNED
2283,2283,0.15157920122146606,2023-01-05 03:59:48.448852,2023-01-05 04:00:34.498967,0 days 00:00:46.050115,tanh,0.0,2,0.6,0.046495694667100906,,,COMPLETE
2284,2284,0.09549133479595184,2023-01-05 04:00:34.625115,2023-01-05 04:00:50.591392,0 days 00:00:15.966277,sigmoid,0.30000000000000004,5,0.65,0.09549133479595184,,,PRUNED
2285,2285,0.12967856228351593,2023-01-05 04:00:50.701409,2023-01-05 04:00:59.399698,0 days 00:00:08.698289,relu,0.5,2,0.6,0.12967856228351593,,,PRUNED
2286,2286,0.10697312653064728,2023-01-05 04:00:59.501714,2023-01-05 04:01:08.057711,0 days 00:00:08.555997,tanh,0.1,2,0.8500000000000001,0.10697312653064728,,,PRUNED
2287,2287,0.15604275465011597,2023-01-05 04:01:08.174046,2023-01-05 04:01:54.697960,0 days 00:00:46.523914,tanh,0.0,2,0.55,0.0458621010184288,,,COMPLETE
2288,2288,0.05028844624757767,2023-01-05 04:01:54.825131,2023-01-05 04:02:30.650355,0 days 00:00:35.825224,tanh,0.15000000000000002,2,0.7,0.0718303844332695,0.05028844624757767,,PRUNED
2289,2289,0.1126425564289093,2023-01-05 04:02:30.753742,2023-01-05 04:02:39.466529,0 days 00:00:08.712787,relu,0.35000000000000003,2,0.5,0.1126425564289093,,,PRUNED
2290,2290,0.1610104888677597,2023-01-05 04:02:39.584671,2023-01-05 04:03:22.592197,0 days 00:00:43.007526,tanh,0.0,2,0.55,0.04863760992884636,,,COMPLETE
2291,2291,0.1570471227169037,2023-01-05 04:03:22.702701,2023-01-05 04:04:05.515495,0 days 00:00:42.812794,sigmoid,0.30000000000000004,2,0.75,0.06345150619745255,0.042404476553201675,,COMPLETE
2292,2292,0.12482956051826477,2023-01-05 04:04:05.632726,2023-01-05 04:04:14.260049,0 days 00:00:08.627323,tanh,0.45,2,0.55,0.12482956051826477,,,PRUNED
2293,2293,0.0657537579536438,2023-01-05 04:04:14.362685,2023-01-05 04:04:30.140475,0 days 00:00:15.777790,tanh,0.05,2,0.9,0.10210778564214706,0.0657537579536438,,PRUNED
2294,2294,0.1483997106552124,2023-01-05 04:04:30.259495,2023-01-05 04:04:38.948814,0 days 00:00:08.689319,relu,0.35000000000000003,2,0.65,0.1483997106552124,,,PRUNED
2295,2295,0.1639552265405655,2023-01-05 04:04:39.032816,2023-01-05 04:05:18.242645,0 days 00:00:39.209829,tanh,0.0,2,0.6,0.04959399253129959,,,COMPLETE
2296,2296,0.1500449776649475,2023-01-05 04:05:18.386514,2023-01-05 04:06:08.231091,0 days 00:00:49.844577,sigmoid,0.5,2,0.7,0.07446129620075226,0.04556747153401375,,COMPLETE
2297,2297,0.12653197348117828,2023-01-05 04:06:08.355612,2023-01-05 04:06:17.116547,0 days 00:00:08.760935,tanh,0.30000000000000004,2,0.7,0.12653197348117828,,,PRUNED
2298,2298,0.11719989031553268,2023-01-05 04:06:17.236592,2023-01-05 04:06:25.915581,0 days 00:00:08.678989,relu,0.5,2,0.6,0.11719989031553268,,,PRUNED
2299,2299,0.08733551949262619,2023-01-05 04:06:26.009912,2023-01-05 04:06:41.781139,0 days 00:00:15.771227,tanh,0.25,2,0.55,0.08733551949262619,,,PRUNED
2300,2300,0.16547873616218567,2023-01-05 04:06:41.881978,2023-01-05 04:06:50.605350,0 days 00:00:08.723372,tanh,0.4,2,1.0,0.16547873616218567,,,PRUNED
2301,2301,0.2116912454366684,2023-01-05 04:06:50.715345,2023-01-05 04:06:59.487995,0 days 00:00:08.772650,relu,0.30000000000000004,3,0.8500000000000001,0.2116912454366684,,,PRUNED
2302,2302,0.10785634815692902,2023-01-05 04:06:59.595071,2023-01-05 04:07:08.446605,0 days 00:00:08.851534,tanh,0.35000000000000003,2,0.75,0.10785634815692902,,,PRUNED
2303,2303,0.14925594627857208,2023-01-05 04:07:08.548307,2023-01-05 04:07:17.404275,0 days 00:00:08.855968,relu,0.1,4,0.6,0.14925594627857208,,,PRUNED
2304,2304,0.15585008263587952,2023-01-05 04:07:17.514077,2023-01-05 04:07:56.866752,0 days 00:00:39.352675,tanh,0.0,2,0.55,0.04576592519879341,,,COMPLETE
2305,2305,0.14597967267036438,2023-01-05 04:07:57.005775,2023-01-05 04:08:53.350066,0 days 00:00:56.344291,sigmoid,0.35000000000000003,2,1.0,0.06970226764678955,0.04406144842505455,,COMPLETE
2306,2306,0.11376792937517166,2023-01-05 04:08:53.476239,2023-01-05 04:09:02.070505,0 days 00:00:08.594266,tanh,0.30000000000000004,2,0.65,0.11376792937517166,,,PRUNED
2307,2307,0.15793104469776154,2023-01-05 04:09:02.179744,2023-01-05 04:09:48.363496,0 days 00:00:46.183752,sigmoid,0.30000000000000004,2,0.65,0.07758060842752457,0.04666455462574959,,COMPLETE
2308,2308,0.12775564193725586,2023-01-05 04:09:48.488667,2023-01-05 04:09:57.349277,0 days 00:00:08.860610,tanh,0.25,2,0.7,0.12775564193725586,,,PRUNED
2309,2309,0.1790398210287094,2023-01-05 04:09:57.460296,2023-01-05 04:10:06.166254,0 days 00:00:08.705958,relu,0.45,2,0.55,0.1790398210287094,,,PRUNED
2310,2310,0.14156389236450195,2023-01-05 04:10:06.289216,2023-01-05 04:10:14.956264,0 days 00:00:08.667048,tanh,0.5,2,0.8,0.14156389236450195,,,PRUNED
2311,2311,0.14931416511535645,2023-01-05 04:10:15.055276,2023-01-05 04:10:23.955577,0 days 00:00:08.900301,relu,0.30000000000000004,2,0.6,0.14931416511535645,,,PRUNED
2312,2312,0.1874602735042572,2023-01-05 04:10:24.050325,2023-01-05 04:10:32.663100,0 days 00:00:08.612775,tanh,0.4,2,0.8500000000000001,0.1874602735042572,,,PRUNED
2313,2313,0.09589549154043198,2023-01-05 04:10:32.766907,2023-01-05 04:10:48.178708,0 days 00:00:15.411801,tanh,0.5,2,0.7,0.09589549154043198,,,PRUNED
2314,2314,0.11459612846374512,2023-01-05 04:10:48.281378,2023-01-05 04:10:57.086471,0 days 00:00:08.805093,relu,0.1,2,0.6,0.11459612846374512,,,PRUNED
2315,2315,0.1222422868013382,2023-01-05 04:10:57.195554,2023-01-05 04:11:05.885590,0 days 00:00:08.690036,tanh,0.25,2,0.7,0.1222422868013382,,,PRUNED
2316,2316,0.1531277298927307,2023-01-05 04:11:05.980016,2023-01-05 04:11:49.030200,0 days 00:00:43.050184,sigmoid,0.35000000000000003,2,0.7,0.06084374338388443,0.04561629146337509,,COMPLETE
2317,2317,0.15594728291034698,2023-01-05 04:11:49.156364,2023-01-05 04:12:28.432491,0 days 00:00:39.276127,tanh,0.0,2,0.6,0.0433664508163929,,,COMPLETE
2318,2318,0.04946542903780937,2023-01-05 04:12:28.568606,2023-01-05 04:13:04.318197,0 days 00:00:35.749591,tanh,0.30000000000000004,2,0.7,0.0646643191576004,0.04946542903780937,,PRUNED
2319,2319,0.058332692831754684,2023-01-05 04:13:04.430423,2023-01-05 04:13:20.041883,0 days 00:00:15.611460,relu,0.35000000000000003,2,0.9,0.09484563022851944,0.058332692831754684,,PRUNED
2320,2320,0.16090087592601776,2023-01-05 04:13:20.144671,2023-01-05 04:13:29.199631,0 days 00:00:09.054960,tanh,0.35000000000000003,3,0.65,0.16090087592601776,,,PRUNED
