,number,value,datetime_start,datetime_complete,duration,params_activation,params_dropout,params_layers,params_shrink,system_attrs_completed_rung_0,system_attrs_completed_rung_1,system_attrs_completed_rung_2,state
2848,2848,0.08670556545257568,2023-01-05 07:20:36.914301,2023-01-05 07:20:52.599544,0 days 00:00:15.685243,sigmoid,0.45,2,0.7,0.08670556545257568,,,PRUNED
2849,2849,0.14558982849121094,2023-01-05 07:20:52.705781,2023-01-05 07:21:49.352390,0 days 00:00:56.646609,tanh,0.0,2,0.55,0.04844032973051071,,,COMPLETE
2850,2850,0.307807058095932,2023-01-05 07:21:49.480082,2023-01-05 07:21:58.653492,0 days 00:00:09.173410,relu,0.0,5,0.8500000000000001,0.307807058095932,,,PRUNED
2851,2851,0.14508353173732758,2023-01-05 07:21:58.768125,2023-01-05 07:22:48.579163,0 days 00:00:49.811038,sigmoid,0.45,2,0.75,0.0635145902633667,0.04191170260310173,,COMPLETE
2852,2852,0.16736456751823425,2023-01-05 07:22:48.723508,2023-01-05 07:22:57.432579,0 days 00:00:08.709071,tanh,0.30000000000000004,2,0.7,0.16736456751823425,,,PRUNED
2853,2853,0.11662009358406067,2023-01-05 07:22:57.544148,2023-01-05 07:23:06.466171,0 days 00:00:08.922023,relu,0.45,2,0.9,0.11662009358406067,,,PRUNED
2854,2854,0.07990800589323044,2023-01-05 07:23:06.577655,2023-01-05 07:23:22.113197,0 days 00:00:15.535542,tanh,0.1,2,0.6,0.09361710399389267,0.07990800589323044,,PRUNED
2855,2855,0.14347612857818604,2023-01-05 07:23:22.211620,2023-01-05 07:24:18.859486,0 days 00:00:56.647866,sigmoid,0.45,2,0.65,0.07394734770059586,0.044091999530792236,,COMPLETE
2856,2856,0.2238582819700241,2023-01-05 07:24:18.984614,2023-01-05 07:24:27.699626,0 days 00:00:08.715012,relu,0.30000000000000004,2,0.6,0.2238582819700241,,,PRUNED
2857,2857,0.10037495940923691,2023-01-05 07:24:27.812198,2023-01-05 07:24:43.414850,0 days 00:00:15.602652,tanh,0.5,2,0.8500000000000001,0.10161852836608887,0.10037495940923691,,PRUNED
2858,2858,0.11034567654132843,2023-01-05 07:24:43.509984,2023-01-05 07:24:59.330276,0 days 00:00:15.820292,sigmoid,0.35000000000000003,2,0.65,0.1020376905798912,0.11034567654132843,,PRUNED
2859,2859,0.1961957812309265,2023-01-05 07:24:59.426825,2023-01-05 07:25:08.139168,0 days 00:00:08.712343,tanh,0.45,2,0.95,0.1961957812309265,,,PRUNED
2860,2860,0.07718100398778915,2023-01-05 07:25:08.251042,2023-01-05 07:25:24.011945,0 days 00:00:15.760903,sigmoid,0.45,2,0.65,0.07718100398778915,,,PRUNED
2861,2861,0.13030588626861572,2023-01-05 07:25:24.125432,2023-01-05 07:25:32.913640,0 days 00:00:08.788208,relu,0.4,2,0.5,0.13030588626861572,,,PRUNED
2862,2862,0.08539541065692902,2023-01-05 07:25:33.033237,2023-01-05 07:25:48.676708,0 days 00:00:15.643471,sigmoid,0.45,2,0.65,0.08539541065692902,,,PRUNED
2863,2863,0.06257504224777222,2023-01-05 07:25:48.782123,2023-01-05 07:26:04.458823,0 days 00:00:15.676700,tanh,0.1,2,0.6,0.10176466405391693,0.06257504224777222,,PRUNED
2864,2864,0.25288039445877075,2023-01-05 07:26:04.558649,2023-01-05 07:26:41.388310,0 days 00:00:36.829661,tanh,0.0,7,0.6,0.25288039445877075,,,PRUNED
2865,2865,0.2050415277481079,2023-01-05 07:26:41.503795,2023-01-05 07:26:50.381213,0 days 00:00:08.877418,relu,0.25,2,1.0,0.2050415277481079,,,PRUNED
2866,2866,0.07823162525892258,2023-01-05 07:26:50.493008,2023-01-05 07:27:06.054149,0 days 00:00:15.561141,sigmoid,0.45,2,0.65,0.07823162525892258,,,PRUNED
2867,2867,0.16367535293102264,2023-01-05 07:27:06.176895,2023-01-05 07:27:49.214265,0 days 00:00:43.037370,tanh,0.0,2,0.5,0.049687471240758896,,,COMPLETE
2868,2868,0.04921315610408783,2023-01-05 07:27:49.350957,2023-01-05 07:28:25.272965,0 days 00:00:35.922008,sigmoid,0.45,2,0.65,0.06665003299713135,0.04921315610408783,,PRUNED
2869,2869,0.15396304428577423,2023-01-05 07:28:25.386452,2023-01-05 07:29:08.585415,0 days 00:00:43.198963,sigmoid,0.45,2,0.65,0.06259335577487946,0.042657271027565,,COMPLETE
2870,2870,0.14589637517929077,2023-01-05 07:29:08.709170,2023-01-05 07:29:58.210124,0 days 00:00:49.500954,sigmoid,0.45,2,0.65,0.06395527720451355,0.04111003503203392,,COMPLETE
2871,2871,0.16177016496658325,2023-01-05 07:29:58.342244,2023-01-05 07:30:41.067665,0 days 00:00:42.725421,tanh,0.0,2,0.55,0.04466350004076958,,,COMPLETE
2872,2872,0.06479017436504364,2023-01-05 07:30:41.178172,2023-01-05 07:30:56.936265,0 days 00:00:15.758093,tanh,0.5,2,0.7,0.10665325820446014,0.06479017436504364,,PRUNED
2873,2873,0.11388766020536423,2023-01-05 07:30:57.024269,2023-01-05 07:31:05.779422,0 days 00:00:08.755153,relu,0.35000000000000003,2,0.8500000000000001,0.11388766020536423,,,PRUNED
2874,2874,0.12755835056304932,2023-01-05 07:31:05.879919,2023-01-05 07:31:14.835881,0 days 00:00:08.955962,tanh,0.30000000000000004,2,0.6,0.12755835056304932,,,PRUNED
2875,2875,0.14979290962219238,2023-01-05 07:31:14.943303,2023-01-05 07:31:23.693534,0 days 00:00:08.750231,relu,0.4,2,0.8,0.14979290962219238,,,PRUNED
2876,2876,0.27188798785209656,2023-01-05 07:31:23.795203,2023-01-05 07:31:56.873156,0 days 00:00:33.077953,tanh,0.0,6,0.5,,,,COMPLETE
2877,2877,0.15148207545280457,2023-01-05 07:31:56.988223,2023-01-05 07:32:43.480222,0 days 00:00:46.491999,tanh,0.25,2,0.6,0.04329795017838478,,,COMPLETE
2878,2878,0.1598646640777588,2023-01-05 07:32:43.595725,2023-01-05 07:33:23.194824,0 days 00:00:39.599099,sigmoid,0.45,2,0.65,0.06298211216926575,0.04549413546919823,,COMPLETE
2879,2879,0.15790042281150818,2023-01-05 07:33:23.311334,2023-01-05 07:34:13.136356,0 days 00:00:49.825022,tanh,0.0,2,0.55,0.049298252910375595,,,COMPLETE
2880,2880,0.11581321805715561,2023-01-05 07:34:13.255528,2023-01-05 07:34:22.031192,0 days 00:00:08.775664,tanh,0.35000000000000003,2,0.55,0.11581321805715561,,,PRUNED
2881,2881,0.11293278634548187,2023-01-05 07:34:22.150417,2023-01-05 07:34:31.120748,0 days 00:00:08.970331,tanh,0.05,3,0.65,0.11293278634548187,,,PRUNED
2882,2882,0.16159220039844513,2023-01-05 07:34:31.235341,2023-01-05 07:34:39.936887,0 days 00:00:08.701546,relu,0.15000000000000002,2,0.8500000000000001,0.16159220039844513,,,PRUNED
2883,2883,0.14677777886390686,2023-01-05 07:34:40.039772,2023-01-05 07:35:36.528219,0 days 00:00:56.488447,sigmoid,0.45,2,0.6,0.06945669651031494,0.04381004720926285,,COMPLETE
2884,2884,0.15374889969825745,2023-01-05 07:35:36.647050,2023-01-05 07:36:19.810491,0 days 00:00:43.163441,tanh,0.2,2,0.5,0.044094283133745193,,,COMPLETE
2885,2885,0.14641839265823364,2023-01-05 07:36:19.947902,2023-01-05 07:37:09.645789,0 days 00:00:49.697887,tanh,0.0,2,0.55,0.04225835204124451,,,COMPLETE
2886,2886,0.1638392210006714,2023-01-05 07:37:09.773873,2023-01-05 07:37:49.393973,0 days 00:00:39.620100,tanh,0.2,2,0.5,0.04780688136816025,,,COMPLETE
2887,2887,0.0887998566031456,2023-01-05 07:37:49.504467,2023-01-05 07:38:04.869930,0 days 00:00:15.365463,sigmoid,0.45,2,0.65,0.0887998566031456,,,PRUNED
2888,2888,0.15146677196025848,2023-01-05 07:38:04.972224,2023-01-05 07:38:13.620256,0 days 00:00:08.648032,tanh,0.1,2,0.9,0.15146677196025848,,,PRUNED
2889,2889,0.14047977328300476,2023-01-05 07:38:13.706263,2023-01-05 07:38:22.693555,0 days 00:00:08.987292,relu,0.30000000000000004,2,0.7,0.14047977328300476,,,PRUNED
2890,2890,0.1389758139848709,2023-01-05 07:38:22.799229,2023-01-05 07:38:31.585537,0 days 00:00:08.786308,tanh,0.0,2,0.75,0.1389758139848709,,,PRUNED
2891,2891,0.15457764267921448,2023-01-05 07:38:31.689218,2023-01-05 07:39:18.142461,0 days 00:00:46.453243,tanh,0.0,2,0.5,0.046024665236473083,,,COMPLETE
2892,2892,0.11258107423782349,2023-01-05 07:39:18.254961,2023-01-05 07:39:26.897960,0 days 00:00:08.642999,relu,0.5,2,0.6,0.11258107423782349,,,PRUNED
2893,2893,0.11786181479692459,2023-01-05 07:39:27.000617,2023-01-05 07:39:35.780577,0 days 00:00:08.779960,tanh,0.35000000000000003,2,0.65,0.11786181479692459,,,PRUNED
2894,2894,0.15000486373901367,2023-01-05 07:39:35.886959,2023-01-05 07:39:44.820683,0 days 00:00:08.933724,relu,0.30000000000000004,2,0.5,0.15000486373901367,,,PRUNED
2895,2895,0.04814426973462105,2023-01-05 07:39:44.915999,2023-01-05 07:40:21.016760,0 days 00:00:36.100761,sigmoid,0.45,2,0.65,0.06478407233953476,0.04814426973462105,,PRUNED
2896,2896,0.14954917132854462,2023-01-05 07:40:21.121843,2023-01-05 07:41:04.487250,0 days 00:00:43.365407,tanh,0.25,2,0.6,0.10402429848909378,0.057071130722761154,0.0422670841217041,COMPLETE
2897,2897,0.1334151327610016,2023-01-05 07:41:04.600731,2023-01-05 07:41:13.248214,0 days 00:00:08.647483,tanh,0.35000000000000003,2,0.8500000000000001,0.1334151327610016,,,PRUNED
2898,2898,0.15913867950439453,2023-01-05 07:41:13.354315,2023-01-05 07:41:59.773037,0 days 00:00:46.418722,tanh,0.0,2,0.55,0.04700639471411705,,,COMPLETE
2899,2899,0.2496703863143921,2023-01-05 07:41:59.895188,2023-01-05 07:42:08.627126,0 days 00:00:08.731938,relu,0.1,2,0.55,0.2496703863143921,,,PRUNED
2900,2900,0.109390027821064,2023-01-05 07:42:08.722293,2023-01-05 07:42:17.535189,0 days 00:00:08.812896,sigmoid,0.4,2,0.7,0.109390027821064,,,PRUNED
2901,2901,0.13884234428405762,2023-01-05 07:42:17.637670,2023-01-05 07:42:26.433529,0 days 00:00:08.795859,tanh,0.30000000000000004,2,0.9,0.13884234428405762,,,PRUNED
2902,2902,0.1631268858909607,2023-01-05 07:42:26.540207,2023-01-05 07:43:09.327617,0 days 00:00:42.787410,tanh,0.1,2,0.6,0.048387378454208374,,,COMPLETE
2903,2903,0.1181475967168808,2023-01-05 07:43:09.437113,2023-01-05 07:43:18.429887,0 days 00:00:08.992774,relu,0.5,2,0.6,0.1181475967168808,,,PRUNED
2904,2904,0.14935924112796783,2023-01-05 07:43:18.532161,2023-01-05 07:44:04.949332,0 days 00:00:46.417171,sigmoid,0.45,2,0.6,0.06852056086063385,0.041229620575904846,,COMPLETE
2905,2905,0.1748902052640915,2023-01-05 07:44:05.068163,2023-01-05 07:44:13.976290,0 days 00:00:08.908127,tanh,0.1,2,0.8500000000000001,0.1748902052640915,,,PRUNED
2906,2906,0.09080909192562103,2023-01-05 07:44:14.080404,2023-01-05 07:44:29.731904,0 days 00:00:15.651500,relu,0.30000000000000004,2,0.7,0.09983447194099426,0.09080909192562103,,PRUNED
2907,2907,0.06189759820699692,2023-01-05 07:44:29.820041,2023-01-05 07:44:45.614013,0 days 00:00:15.793972,tanh,0.4,2,0.65,0.10285705327987671,0.06189759820699692,,PRUNED
2908,2908,0.1093287318944931,2023-01-05 07:44:45.706576,2023-01-05 07:44:54.481005,0 days 00:00:08.774429,relu,0.45,2,0.6,0.1093287318944931,,,PRUNED
2909,2909,0.08958543837070465,2023-01-05 07:44:54.583657,2023-01-05 07:45:10.237114,0 days 00:00:15.653457,tanh,0.35000000000000003,2,0.6,0.10790728032588959,0.08958543837070465,,PRUNED
2910,2910,0.2962401807308197,2023-01-05 07:45:10.324160,2023-01-05 07:45:19.795613,0 days 00:00:09.471453,tanh,0.05,8,0.8500000000000001,0.2962401807308197,,,PRUNED
2911,2911,0.06694966554641724,2023-01-05 07:45:19.898413,2023-01-05 07:45:35.560159,0 days 00:00:15.661746,relu,0.30000000000000004,2,0.5,0.09966890513896942,0.06694966554641724,,PRUNED
2912,2912,0.27908262610435486,2023-01-05 07:45:35.645205,2023-01-05 07:45:44.718901,0 days 00:00:09.073696,tanh,0.5,4,0.65,0.27908262610435486,,,PRUNED
2913,2913,0.17039793729782104,2023-01-05 07:45:44.821453,2023-01-05 07:46:27.720950,0 days 00:00:42.899497,tanh,0.2,2,0.5,0.052511394023895264,,,COMPLETE
2914,2914,0.171922966837883,2023-01-05 07:46:27.832874,2023-01-05 07:46:36.630981,0 days 00:00:08.798107,relu,0.45,2,0.8,0.171922966837883,,,PRUNED
2915,2915,0.14286240935325623,2023-01-05 07:46:36.737117,2023-01-05 07:46:45.447434,0 days 00:00:08.710317,tanh,0.0,2,0.95,0.14286240935325623,,,PRUNED
2916,2916,0.1491962969303131,2023-01-05 07:46:45.540766,2023-01-05 07:47:28.356113,0 days 00:00:42.815347,tanh,0.25,2,0.55,0.04220183193683624,,,COMPLETE
2917,2917,0.17485345900058746,2023-01-05 07:47:28.470292,2023-01-05 07:47:37.384560,0 days 00:00:08.914268,relu,0.1,2,0.6,0.17485345900058746,,,PRUNED
2918,2918,0.15883520245552063,2023-01-05 07:47:37.481695,2023-01-05 07:48:23.787696,0 days 00:00:46.306001,tanh,0.2,2,0.5,0.04951015114784241,,,COMPLETE
2919,2919,0.11375392228364944,2023-01-05 07:48:23.912871,2023-01-05 07:48:32.939148,0 days 00:00:09.026277,tanh,0.2,3,0.55,0.11375392228364944,,,PRUNED
2920,2920,0.15882481634616852,2023-01-05 07:48:33.043020,2023-01-05 07:49:12.471971,0 days 00:00:39.428951,tanh,0.0,2,0.55,0.0484592504799366,,,COMPLETE
2921,2921,0.12171992659568787,2023-01-05 07:49:12.600778,2023-01-05 07:49:21.352070,0 days 00:00:08.751292,relu,0.30000000000000004,2,0.8500000000000001,0.12171992659568787,,,PRUNED
2922,2922,0.14170095324516296,2023-01-05 07:49:21.453735,2023-01-05 07:49:30.168059,0 days 00:00:08.714324,tanh,0.35000000000000003,2,0.7,0.14170095324516296,,,PRUNED
2923,2923,0.19624583423137665,2023-01-05 07:49:30.272728,2023-01-05 07:49:38.983473,0 days 00:00:08.710745,tanh,0.1,2,0.6,0.19624583423137665,,,PRUNED
2924,2924,0.12725085020065308,2023-01-05 07:49:39.088712,2023-01-05 07:49:48.066678,0 days 00:00:08.977966,relu,0.4,2,0.65,0.12725085020065308,,,PRUNED
2925,2925,0.1376645416021347,2023-01-05 07:49:48.167798,2023-01-05 07:50:03.656136,0 days 00:00:15.488338,sigmoid,0.45,2,0.65,0.1376645416021347,,,PRUNED
2926,2926,0.07690165191888809,2023-01-05 07:50:03.751261,2023-01-05 07:50:19.488263,0 days 00:00:15.737002,sigmoid,0.45,2,0.65,0.07690165191888809,,,PRUNED
2927,2927,0.049305036664009094,2023-01-05 07:50:19.583593,2023-01-05 07:50:55.568805,0 days 00:00:35.985212,sigmoid,0.45,2,0.65,0.07457249611616135,0.049305036664009094,,PRUNED
2928,2928,0.04712046682834625,2023-01-05 07:50:55.664723,2023-01-05 07:51:31.623607,0 days 00:00:35.958884,sigmoid,0.45,2,0.65,0.07079227268695831,0.04712046682834625,,PRUNED
2929,2929,0.12887413799762726,2023-01-05 07:51:31.901174,2023-01-05 07:51:40.724250,0 days 00:00:08.823076,tanh,0.25,2,0.75,0.12887413799762726,,,PRUNED
2930,2930,0.15311521291732788,2023-01-05 07:51:40.817990,2023-01-05 07:52:23.942177,0 days 00:00:43.124187,sigmoid,0.45,2,0.6,0.07248688489198685,0.04508185759186745,,COMPLETE
2931,2931,0.14594486355781555,2023-01-05 07:52:24.055153,2023-01-05 07:52:32.988668,0 days 00:00:08.933515,relu,0.30000000000000004,2,0.5,0.14594486355781555,,,PRUNED
2932,2932,0.16056500375270844,2023-01-05 07:52:33.093085,2023-01-05 07:52:41.794452,0 days 00:00:08.701367,tanh,0.35000000000000003,2,0.9,0.16056500375270844,,,PRUNED
2933,2933,0.1594228893518448,2023-01-05 07:52:41.897610,2023-01-05 07:52:50.877562,0 days 00:00:08.979952,relu,0.15000000000000002,2,0.7,0.1594228893518448,,,PRUNED
2934,2934,0.11635761708021164,2023-01-05 07:52:50.985038,2023-01-05 07:52:59.760222,0 days 00:00:08.775184,tanh,0.05,2,0.8500000000000001,0.11635761708021164,,,PRUNED
2935,2935,0.12645860016345978,2023-01-05 07:52:59.864094,2023-01-05 07:53:08.675563,0 days 00:00:08.811469,sigmoid,0.4,2,0.55,0.12645860016345978,,,PRUNED
2936,2936,0.12347640842199326,2023-01-05 07:53:08.941489,2023-01-05 07:53:17.725501,0 days 00:00:08.784012,relu,0.5,2,0.65,0.12347640842199326,,,PRUNED
2937,2937,0.11316952109336853,2023-01-05 07:53:17.820191,2023-01-05 07:53:33.519430,0 days 00:00:15.699239,tanh,0.30000000000000004,2,0.6,0.09885580837726593,0.11316952109336853,,PRUNED
2938,2938,0.12357775121927261,2023-01-05 07:53:33.611537,2023-01-05 07:53:49.388314,0 days 00:00:15.776777,sigmoid,0.45,2,0.65,0.12357775121927261,,,PRUNED
2939,2939,0.12362536042928696,2023-01-05 07:53:49.493431,2023-01-05 07:53:58.221373,0 days 00:00:08.727942,relu,0.35000000000000003,2,0.6,0.12362536042928696,,,PRUNED
2940,2940,0.1137373223900795,2023-01-05 07:53:58.333375,2023-01-05 07:54:07.280007,0 days 00:00:08.946632,tanh,0.45,2,0.8500000000000001,0.1137373223900795,,,PRUNED
2941,2941,0.14349393546581268,2023-01-05 07:54:07.396661,2023-01-05 07:55:03.950489,0 days 00:00:56.553828,tanh,0.2,2,0.6,0.04295755922794342,,,COMPLETE
2942,2942,0.1639997959136963,2023-01-05 07:55:04.084991,2023-01-05 07:55:50.325957,0 days 00:00:46.240966,tanh,0.2,2,0.6,0.05187983438372612,,,COMPLETE
2943,2943,0.12328576296567917,2023-01-05 07:55:50.459950,2023-01-05 07:55:59.513017,0 days 00:00:09.053067,tanh,0.05,2,0.6,0.12328576296567917,,,PRUNED
2944,2944,0.17736396193504333,2023-01-05 07:55:59.626025,2023-01-05 07:56:08.570657,0 days 00:00:08.944632,relu,0.25,2,0.7,0.17736396193504333,,,PRUNED
2945,2945,0.13684265315532684,2023-01-05 07:56:08.690638,2023-01-05 07:56:17.661915,0 days 00:00:08.971277,tanh,0.1,2,0.5,0.13684265315532684,,,PRUNED
2946,2946,0.05204884707927704,2023-01-05 07:56:17.756961,2023-01-05 07:56:54.033821,0 days 00:00:36.276860,sigmoid,0.5,2,0.65,0.07040784507989883,0.05204884707927704,,PRUNED
2947,2947,0.1472049355506897,2023-01-05 07:56:54.136974,2023-01-05 07:57:43.845482,0 days 00:00:49.708508,tanh,0.2,2,0.6,0.04364106431603432,,,COMPLETE
2948,2948,0.046289440244436264,2023-01-05 07:57:43.968651,2023-01-05 07:58:20.344400,0 days 00:00:36.375749,sigmoid,0.45,2,0.6,0.06612168997526169,0.046289440244436264,,PRUNED
2949,2949,0.15340420603752136,2023-01-05 07:58:20.448520,2023-01-05 07:58:29.618597,0 days 00:00:09.170077,relu,0.30000000000000004,6,0.65,0.15340420603752136,,,PRUNED
2950,2950,0.07888217270374298,2023-01-05 07:58:29.729395,2023-01-05 07:58:45.524437,0 days 00:00:15.795042,sigmoid,0.5,2,0.5,0.07888217270374298,,,PRUNED
2951,2951,0.06023848056793213,2023-01-05 07:58:45.620544,2023-01-05 07:59:01.281334,0 days 00:00:15.660790,tanh,0.4,2,0.8500000000000001,0.09895738959312439,0.06023848056793213,,PRUNED
2952,2952,0.1506071537733078,2023-01-05 07:59:01.381968,2023-01-05 07:59:44.592498,0 days 00:00:43.210530,tanh,0.2,2,0.6,0.041657764464616776,,,COMPLETE
2953,2953,0.07005158811807632,2023-01-05 07:59:44.728003,2023-01-05 08:00:00.442856,0 days 00:00:15.714853,relu,0.5,2,0.6,0.10249920934438705,0.07005158811807632,,PRUNED
2954,2954,0.11004935950040817,2023-01-05 08:00:00.553957,2023-01-05 08:00:09.593727,0 days 00:00:09.039770,tanh,0.35000000000000003,2,0.55,0.11004935950040817,,,PRUNED
2955,2955,0.061838626861572266,2023-01-05 08:00:09.703729,2023-01-05 08:00:25.408467,0 days 00:00:15.704738,relu,0.0,2,0.7,0.10680125653743744,0.061838626861572266,,PRUNED
2956,2956,0.08789389580488205,2023-01-05 08:00:25.520245,2023-01-05 08:00:41.165294,0 days 00:00:15.645049,tanh,0.30000000000000004,2,0.8,0.10743309557437897,0.08789389580488205,,PRUNED
2957,2957,0.1570901721715927,2023-01-05 08:00:41.469011,2023-01-05 08:01:24.417144,0 days 00:00:42.948133,tanh,0.2,2,0.6,0.04500817134976387,,,COMPLETE
2958,2958,0.14573673903942108,2023-01-05 08:01:24.526635,2023-01-05 08:01:33.161567,0 days 00:00:08.634932,tanh,0.30000000000000004,2,0.9,0.14573673903942108,,,PRUNED
2959,2959,0.13311190903186798,2023-01-05 08:01:33.255927,2023-01-05 08:01:42.186585,0 days 00:00:08.930658,relu,0.5,2,0.75,0.13311190903186798,,,PRUNED
2960,2960,0.05015892907977104,2023-01-05 08:01:42.298588,2023-01-05 08:02:18.291525,0 days 00:00:35.992937,sigmoid,0.5,2,0.65,0.07571621239185333,0.05015892907977104,,PRUNED
2961,2961,0.14523275196552277,2023-01-05 08:02:18.387468,2023-01-05 08:03:08.167149,0 days 00:00:49.779681,sigmoid,0.45,2,0.9,0.06717267632484436,0.04146793484687805,,COMPLETE
2962,2962,0.11143633723258972,2023-01-05 08:03:08.293248,2023-01-05 08:03:16.937611,0 days 00:00:08.644363,tanh,0.1,2,1.0,0.11143633723258972,,,PRUNED
2963,2963,0.0475846603512764,2023-01-05 08:03:17.055388,2023-01-05 08:03:53.108089,0 days 00:00:36.052701,sigmoid,0.5,2,0.8,0.07068129628896713,0.0475846603512764,,PRUNED
2964,2964,0.08853048086166382,2023-01-05 08:03:53.224906,2023-01-05 08:04:08.774578,0 days 00:00:15.549672,sigmoid,0.5,2,0.65,0.08853048086166382,,,PRUNED
2965,2965,0.13607917726039886,2023-01-05 08:04:08.871614,2023-01-05 08:04:17.557923,0 days 00:00:08.686309,relu,0.45,2,0.8500000000000001,0.13607917726039886,,,PRUNED
2966,2966,0.09491793066263199,2023-01-05 08:04:17.670146,2023-01-05 08:04:33.464031,0 days 00:00:15.793885,sigmoid,0.45,3,0.75,0.09491793066263199,,,PRUNED
2967,2967,0.14970260858535767,2023-01-05 08:04:33.578648,2023-01-05 08:05:19.949958,0 days 00:00:46.371310,relu,0.35000000000000003,2,0.65,0.07224764674901962,0.04324224591255188,,COMPLETE
2968,2968,0.13289237022399902,2023-01-05 08:05:20.078136,2023-01-05 08:06:13.388503,0 days 00:00:53.310367,sigmoid,0.35000000000000003,2,0.6,0.07452607154846191,0.036338478326797485,,COMPLETE
2969,2969,0.15129292011260986,2023-01-05 08:06:13.496032,2023-01-05 08:06:56.287104,0 days 00:00:42.791072,sigmoid,0.35000000000000003,2,0.6,0.06342872977256775,0.04340681433677673,,COMPLETE
2970,2970,0.13581395149230957,2023-01-05 08:06:56.412361,2023-01-05 08:07:04.995007,0 days 00:00:08.582646,tanh,0.35000000000000003,2,0.65,0.13581395149230957,,,PRUNED
2971,2971,0.14910253882408142,2023-01-05 08:07:05.287946,2023-01-05 08:07:14.152640,0 days 00:00:08.864694,sigmoid,0.1,3,0.6,0.14910253882408142,,,PRUNED
2972,2972,0.0883389562368393,2023-01-05 08:07:14.249421,2023-01-05 08:07:30.134179,0 days 00:00:15.884758,sigmoid,0.35000000000000003,6,0.6,0.0883389562368393,,,PRUNED
2973,2973,0.15640445053577423,2023-01-05 08:07:30.413395,2023-01-05 08:08:13.260399,0 days 00:00:42.847004,tanh,0.2,2,0.6,0.046363115310668945,,,COMPLETE
2974,2974,0.07980356365442276,2023-01-05 08:08:13.397531,2023-01-05 08:08:28.945504,0 days 00:00:15.547973,sigmoid,0.35000000000000003,2,0.6,0.07980356365442276,,,PRUNED
2975,2975,0.08073543012142181,2023-01-05 08:08:29.061328,2023-01-05 08:08:44.819637,0 days 00:00:15.758309,relu,0.35000000000000003,2,0.6,0.08073543012142181,,,PRUNED
2976,2976,0.11299436539411545,2023-01-05 08:08:44.935263,2023-01-05 08:08:53.728286,0 days 00:00:08.793023,relu,0.35000000000000003,2,0.95,0.11299436539411545,,,PRUNED
2977,2977,0.07685891538858414,2023-01-05 08:08:53.849913,2023-01-05 08:09:09.542729,0 days 00:00:15.692816,sigmoid,0.35000000000000003,2,0.6,0.07685891538858414,,,PRUNED
2978,2978,0.1509978175163269,2023-01-05 08:09:09.662299,2023-01-05 08:09:52.567828,0 days 00:00:42.905529,tanh,0.15000000000000002,2,0.6,0.04438520595431328,,,COMPLETE
2979,2979,0.10439256578683853,2023-01-05 08:09:52.689973,2023-01-05 08:10:08.596505,0 days 00:00:15.906532,sigmoid,0.35000000000000003,4,0.6,0.10439256578683853,,,PRUNED
