,number,value,datetime_start,datetime_complete,duration,params_activation,params_dropout,params_layers,params_shrink,system_attrs_completed_rung_0,system_attrs_completed_rung_1,system_attrs_completed_rung_2,state
1402,1402,0.07200311124324799,2023-01-04 22:09:33.375254,2023-01-04 22:09:48.900201,0 days 00:00:15.524947,sigmoid,0.30000000000000004,2,0.8,0.10290824621915817,0.07200311124324799,,PRUNED
1403,1403,0.04682566598057747,2023-01-04 22:09:49.014230,2023-01-04 22:10:25.346771,0 days 00:00:36.332541,tanh,0.1,2,0.75,0.06875436753034592,0.04682566598057747,,PRUNED
1404,1404,0.17863032221794128,2023-01-04 22:10:25.462099,2023-01-04 22:10:34.422064,0 days 00:00:08.959965,relu,0.35000000000000003,4,0.8500000000000001,0.17863032221794128,,,PRUNED
1405,1405,0.07588396966457367,2023-01-04 22:10:34.554294,2023-01-04 22:10:49.995658,0 days 00:00:15.441364,tanh,0.1,2,0.6,0.07588396966457367,,,PRUNED
1406,1406,0.043957751244306564,2023-01-04 22:10:50.112992,2023-01-04 22:11:26.693141,0 days 00:00:36.580149,relu,0.45,2,0.5,0.10053025931119919,0.06368834525346756,0.043957751244306564,PRUNED
1407,1407,0.07690165191888809,2023-01-04 22:11:26.811152,2023-01-04 22:11:42.349646,0 days 00:00:15.538494,tanh,0.05,2,0.65,0.07690165191888809,,,PRUNED
1408,1408,0.07305622845888138,2023-01-04 22:11:42.465623,2023-01-04 22:11:58.056818,0 days 00:00:15.591195,tanh,0.4,2,0.6,0.07305622845888138,,,PRUNED
1409,1409,0.1511707454919815,2023-01-04 22:11:58.173793,2023-01-04 22:12:41.423040,0 days 00:00:43.249247,tanh,0.30000000000000004,2,0.6,0.06298133730888367,0.04337140917778015,,COMPLETE
1410,1410,0.14524896442890167,2023-01-04 22:12:41.547490,2023-01-04 22:12:50.578470,0 days 00:00:09.030980,relu,0.5,3,0.8500000000000001,0.14524896442890167,,,PRUNED
1411,1411,0.06835243105888367,2023-01-04 22:12:50.696806,2023-01-04 22:13:06.277233,0 days 00:00:15.580427,sigmoid,0.5,2,0.8500000000000001,0.1102064773440361,0.06835243105888367,,PRUNED
1412,1412,0.13746654987335205,2023-01-04 22:13:06.391620,2023-01-04 22:13:56.316342,0 days 00:00:49.924722,tanh,0.30000000000000004,2,0.65,0.06204667687416077,0.040511179715394974,,COMPLETE
1413,1413,0.04538394883275032,2023-01-04 22:13:56.441938,2023-01-04 22:14:33.563639,0 days 00:00:37.121701,relu,0.4,2,0.7,0.11712364852428436,0.06710153818130493,0.04538394883275032,PRUNED
1414,1414,0.07907865196466446,2023-01-04 22:14:33.677607,2023-01-04 22:14:49.302846,0 days 00:00:15.625239,tanh,0.30000000000000004,2,0.65,0.07907865196466446,,,PRUNED
1415,1415,0.07718729972839355,2023-01-04 22:14:49.417011,2023-01-04 22:15:05.025714,0 days 00:00:15.608703,sigmoid,0.30000000000000004,2,0.65,0.07718729972839355,,,PRUNED
1416,1416,0.10484813898801804,2023-01-04 22:15:05.143811,2023-01-04 22:15:20.533806,0 days 00:00:15.389995,tanh,0.30000000000000004,2,0.65,0.10484813898801804,,,PRUNED
1417,1417,0.12121406942605972,2023-01-04 22:15:20.647744,2023-01-04 22:15:29.582714,0 days 00:00:08.934970,relu,0.35000000000000003,2,0.8500000000000001,0.12121406942605972,,,PRUNED
1418,1418,0.04895868897438049,2023-01-04 22:15:29.697811,2023-01-04 22:16:05.996517,0 days 00:00:36.298706,tanh,0.30000000000000004,3,0.7,0.07001074403524399,0.04895868897438049,,PRUNED
1419,1419,0.12110686302185059,2023-01-04 22:16:06.111172,2023-01-04 22:16:14.929976,0 days 00:00:08.818804,relu,0.5,2,0.8500000000000001,0.12110686302185059,,,PRUNED
1420,1420,0.08616570383310318,2023-01-04 22:16:15.045003,2023-01-04 22:16:30.828502,0 days 00:00:15.783499,tanh,0.30000000000000004,2,0.65,0.08616570383310318,,,PRUNED
1421,1421,0.04657324403524399,2023-01-04 22:16:30.950695,2023-01-04 22:17:07.224858,0 days 00:00:36.274163,sigmoid,0.45,2,0.8500000000000001,0.10604849457740784,0.06702693551778793,0.04657324403524399,PRUNED
1422,1422,0.08647926896810532,2023-01-04 22:17:07.339974,2023-01-04 22:17:22.832575,0 days 00:00:15.492601,tanh,0.25,2,0.65,0.08647926896810532,,,PRUNED
1423,1423,0.0447060652077198,2023-01-04 22:17:22.949230,2023-01-04 22:17:59.280133,0 days 00:00:36.330903,relu,0.5,2,0.8,0.09893468767404556,0.060895420610904694,0.0447060652077198,PRUNED
1424,1424,0.14485424757003784,2023-01-04 22:17:59.394028,2023-01-04 22:18:08.163082,0 days 00:00:08.769054,relu,0.30000000000000004,2,0.7,0.14485424757003784,,,PRUNED
1425,1425,0.14971256256103516,2023-01-04 22:18:08.277200,2023-01-04 22:18:54.936542,0 days 00:00:46.659342,tanh,0.30000000000000004,2,0.65,0.0703500509262085,0.0437750406563282,,COMPLETE
1426,1426,0.1457696557044983,2023-01-04 22:18:55.057278,2023-01-04 22:19:38.075378,0 days 00:00:43.018100,tanh,0.30000000000000004,2,0.7,0.059645842760801315,0.03977438062429428,,COMPLETE
1427,1427,0.08351787179708481,2023-01-04 22:19:38.194482,2023-01-04 22:19:53.913101,0 days 00:00:15.718619,tanh,0.30000000000000004,2,0.7,0.08351787179708481,,,PRUNED
1428,1428,0.15853610634803772,2023-01-04 22:19:54.029229,2023-01-04 22:20:02.729065,0 days 00:00:08.699836,relu,0.25,2,0.8500000000000001,0.15853610634803772,,,PRUNED
1429,1429,0.053134117275476456,2023-01-04 22:20:02.846227,2023-01-04 22:20:38.967066,0 days 00:00:36.120839,tanh,0.35000000000000003,2,0.75,0.07204298675060272,0.053134117275476456,,PRUNED
1430,1430,0.18442004919052124,2023-01-04 22:20:39.082395,2023-01-04 22:20:47.892394,0 days 00:00:08.809999,sigmoid,0.35000000000000003,2,0.8500000000000001,0.18442004919052124,,,PRUNED
1431,1431,0.12548677623271942,2023-01-04 22:20:48.006838,2023-01-04 22:20:56.991273,0 days 00:00:08.984435,relu,0.4,2,0.8500000000000001,0.12548677623271942,,,PRUNED
1432,1432,0.07892654091119766,2023-01-04 22:20:57.124341,2023-01-04 22:21:12.915500,0 days 00:00:15.791159,relu,0.45,2,0.8,0.12067952007055283,0.07892654091119766,,PRUNED
1433,1433,0.07389062643051147,2023-01-04 22:21:13.022499,2023-01-04 22:21:28.638315,0 days 00:00:15.615816,sigmoid,0.35000000000000003,2,0.7,0.07389062643051147,,,PRUNED
1434,1434,0.1430937945842743,2023-01-04 22:21:28.753643,2023-01-04 22:21:37.697810,0 days 00:00:08.944167,relu,0.35000000000000003,2,0.8500000000000001,0.1430937945842743,,,PRUNED
1435,1435,0.08881960064172745,2023-01-04 22:21:37.788115,2023-01-04 22:21:53.295566,0 days 00:00:15.507451,tanh,0.25,2,0.65,0.08881960064172745,,,PRUNED
1436,1436,0.14068999886512756,2023-01-04 22:21:53.412662,2023-01-04 22:22:02.078450,0 days 00:00:08.665788,sigmoid,0.5,2,0.8500000000000001,0.14068999886512756,,,PRUNED
1437,1437,0.08733521401882172,2023-01-04 22:22:02.192779,2023-01-04 22:22:17.968922,0 days 00:00:15.776143,tanh,0.30000000000000004,2,0.75,0.08733521401882172,,,PRUNED
1438,1438,0.12490258365869522,2023-01-04 22:22:18.085837,2023-01-04 22:22:26.835709,0 days 00:00:08.749872,relu,0.5,2,0.8500000000000001,0.12490258365869522,,,PRUNED
1439,1439,0.07972899824380875,2023-01-04 22:22:26.952249,2023-01-04 22:22:42.374957,0 days 00:00:15.422708,tanh,0.35000000000000003,2,0.65,0.07972899824380875,,,PRUNED
1440,1440,0.09382746368646622,2023-01-04 22:22:42.481847,2023-01-04 22:22:58.024234,0 days 00:00:15.542387,tanh,0.30000000000000004,2,0.65,0.09382746368646622,,,PRUNED
1441,1441,0.13149239122867584,2023-01-04 22:22:58.142264,2023-01-04 22:23:07.123540,0 days 00:00:08.981276,relu,0.5,2,0.7,0.13149239122867584,,,PRUNED
1442,1442,0.1424519121646881,2023-01-04 22:23:07.230539,2023-01-04 22:23:16.014533,0 days 00:00:08.783994,relu,0.45,2,0.55,0.1424519121646881,,,PRUNED
1443,1443,0.1491517573595047,2023-01-04 22:23:16.138680,2023-01-04 22:23:24.863864,0 days 00:00:08.725184,sigmoid,0.35000000000000003,2,0.75,0.1491517573595047,,,PRUNED
1444,1444,0.09208540618419647,2023-01-04 22:23:24.972434,2023-01-04 22:23:40.904129,0 days 00:00:15.931695,tanh,0.4,4,0.7,0.09208540618419647,,,PRUNED
1445,1445,0.13461999595165253,2023-01-04 22:23:41.010222,2023-01-04 22:23:49.815431,0 days 00:00:08.805209,relu,0.4,2,0.6,0.13461999595165253,,,PRUNED
1446,1446,0.07643654942512512,2023-01-04 22:23:49.917977,2023-01-04 22:24:05.643480,0 days 00:00:15.725503,relu,0.35000000000000003,2,0.5,0.12060800194740295,0.07643654942512512,,PRUNED
1447,1447,0.14476481080055237,2023-01-04 22:24:05.753586,2023-01-04 22:24:14.647716,0 days 00:00:08.894130,sigmoid,0.5,3,0.8500000000000001,0.14476481080055237,,,PRUNED
1448,1448,0.08956277370452881,2023-01-04 22:24:14.800436,2023-01-04 22:24:30.716491,0 days 00:00:15.916055,relu,0.30000000000000004,2,0.8,0.08956277370452881,,,PRUNED
1449,1449,0.07712478935718536,2023-01-04 22:24:30.807561,2023-01-04 22:24:46.440096,0 days 00:00:15.632535,tanh,0.25,2,0.7,0.07712478935718536,,,PRUNED
1450,1450,0.1375158727169037,2023-01-04 22:24:46.565598,2023-01-04 22:24:55.290368,0 days 00:00:08.724770,relu,0.30000000000000004,2,0.9,0.1375158727169037,,,PRUNED
1451,1451,0.044262006878852844,2023-01-04 22:24:55.407699,2023-01-04 22:25:31.711615,0 days 00:00:36.303916,tanh,0.30000000000000004,2,0.65,0.06906261295080185,0.044262006878852844,,PRUNED
1452,1452,0.08042369037866592,2023-01-04 22:25:31.813967,2023-01-04 22:25:47.528226,0 days 00:00:15.714259,relu,0.45,2,0.8500000000000001,0.09781225770711899,0.08042369037866592,,PRUNED
1453,1453,0.045758165419101715,2023-01-04 22:25:47.634078,2023-01-04 22:26:23.932788,0 days 00:00:36.298710,relu,0.1,2,0.75,0.07221763581037521,0.045758165419101715,,PRUNED
1454,1454,0.15219733119010925,2023-01-04 22:26:24.024999,2023-01-04 22:27:07.198267,0 days 00:00:43.173268,tanh,0.45,2,0.7,0.06301778554916382,0.04307812079787254,,COMPLETE
1455,1455,0.1458982527256012,2023-01-04 22:27:07.307741,2023-01-04 22:27:16.304723,0 days 00:00:08.996982,relu,0.45,2,0.8500000000000001,0.1458982527256012,,,PRUNED
1456,1456,0.15168923139572144,2023-01-04 22:27:16.411028,2023-01-04 22:27:25.178936,0 days 00:00:08.767908,sigmoid,0.4,2,0.8,0.15168923139572144,,,PRUNED
1457,1457,0.07408799231052399,2023-01-04 22:27:25.278975,2023-01-04 22:27:40.861192,0 days 00:00:15.582217,sigmoid,0.35000000000000003,2,0.65,0.07408799231052399,,,PRUNED
1458,1458,0.12572789192199707,2023-01-04 22:27:40.960975,2023-01-04 22:27:49.927164,0 days 00:00:08.966189,relu,0.35000000000000003,2,0.8500000000000001,0.12572789192199707,,,PRUNED
1459,1459,0.1604360193014145,2023-01-04 22:27:50.034558,2023-01-04 22:27:58.743178,0 days 00:00:08.708620,relu,0.5,2,0.7,0.1604360193014145,,,PRUNED
1460,1460,0.0685097798705101,2023-01-04 22:27:58.848441,2023-01-04 22:28:14.608171,0 days 00:00:15.759730,relu,0.5,2,0.65,0.11919501423835754,0.0685097798705101,,PRUNED
1461,1461,0.2739473879337311,2023-01-04 22:28:14.743312,2023-01-04 22:28:31.032391,0 days 00:00:16.289079,tanh,0.30000000000000004,7,0.7,0.2739473879337311,,,PRUNED
1462,1462,0.04368716850876808,2023-01-04 22:28:31.142025,2023-01-04 22:29:07.371079,0 days 00:00:36.229054,sigmoid,0.35000000000000003,2,0.9,0.11509127169847488,0.06699204444885254,0.04368716850876808,PRUNED
1463,1463,0.1645028442144394,2023-01-04 22:29:07.493856,2023-01-04 22:29:16.254335,0 days 00:00:08.760479,relu,0.5,2,0.8500000000000001,0.1645028442144394,,,PRUNED
1464,1464,0.13813930749893188,2023-01-04 22:29:16.359711,2023-01-04 22:29:25.293970,0 days 00:00:08.934259,relu,0.45,2,0.8,0.13813930749893188,,,PRUNED
1465,1465,0.05011345073580742,2023-01-04 22:29:25.420005,2023-01-04 22:30:01.670568,0 days 00:00:36.250563,tanh,0.1,2,0.65,0.0718652755022049,0.05011345073580742,,PRUNED
1466,1466,0.08846119046211243,2023-01-04 22:30:01.795955,2023-01-04 22:30:17.499196,0 days 00:00:15.703241,relu,0.2,2,0.55,0.08846119046211243,,,PRUNED
1467,1467,0.131596639752388,2023-01-04 22:30:17.609488,2023-01-04 22:30:26.423126,0 days 00:00:08.813638,relu,0.30000000000000004,2,0.8500000000000001,0.131596639752388,,,PRUNED
1468,1468,0.16546572744846344,2023-01-04 22:30:26.533851,2023-01-04 22:30:35.764154,0 days 00:00:09.230303,sigmoid,0.25,4,0.8500000000000001,0.16546572744846344,,,PRUNED
1469,1469,0.19560903310775757,2023-01-04 22:30:35.876221,2023-01-04 22:30:44.647276,0 days 00:00:08.771055,relu,0.35000000000000003,2,0.8500000000000001,0.19560903310775757,,,PRUNED
1470,1470,0.08666867762804031,2023-01-04 22:30:44.756511,2023-01-04 22:31:00.487472,0 days 00:00:15.730961,tanh,0.15000000000000002,2,0.65,0.08666867762804031,,,PRUNED
1471,1471,0.07370012998580933,2023-01-04 22:31:00.599839,2023-01-04 22:31:16.411696,0 days 00:00:15.811857,tanh,0.1,2,0.55,0.07370012998580933,,,PRUNED
1472,1472,0.04749319329857826,2023-01-04 22:31:16.529716,2023-01-04 22:31:52.924308,0 days 00:00:36.394592,relu,0.5,2,0.8500000000000001,0.1078738197684288,0.06477418541908264,0.04749319329857826,PRUNED
1473,1473,0.15868738293647766,2023-01-04 22:31:53.025332,2023-01-04 22:32:01.774775,0 days 00:00:08.749443,relu,0.4,2,0.8500000000000001,0.15868738293647766,,,PRUNED
1474,1474,0.12153716385364532,2023-01-04 22:32:01.895187,2023-01-04 22:32:10.857403,0 days 00:00:08.962216,sigmoid,0.2,2,0.9,0.12153716385364532,,,PRUNED
1475,1475,0.12562242150306702,2023-01-04 22:32:10.974837,2023-01-04 22:32:19.748402,0 days 00:00:08.773565,relu,0.35000000000000003,2,0.7,0.12562242150306702,,,PRUNED
1476,1476,0.045334115624427795,2023-01-04 22:32:19.853160,2023-01-04 22:32:56.202785,0 days 00:00:36.349625,relu,0.30000000000000004,2,0.55,0.06409811973571777,0.045334115624427795,,PRUNED
1477,1477,0.08370441198348999,2023-01-04 22:32:56.314987,2023-01-04 22:33:12.164856,0 days 00:00:15.849869,tanh,0.30000000000000004,3,0.65,0.08370441198348999,,,PRUNED
1478,1478,0.0473618358373642,2023-01-04 22:33:12.279966,2023-01-04 22:33:48.915633,0 days 00:00:36.635667,tanh,0.35000000000000003,2,0.55,0.07034765928983688,0.0473618358373642,,PRUNED
1479,1479,0.07285154610872269,2023-01-04 22:33:49.025847,2023-01-04 22:34:04.823763,0 days 00:00:15.797916,relu,0.45,2,0.5,0.10668762028217316,0.07285154610872269,,PRUNED
1480,1480,0.14303353428840637,2023-01-04 22:34:04.959583,2023-01-04 22:34:13.865015,0 days 00:00:08.905432,relu,0.5,3,0.8500000000000001,0.14303353428840637,,,PRUNED
1481,1481,0.13872995972633362,2023-01-04 22:34:13.992509,2023-01-04 22:34:22.935846,0 days 00:00:08.943337,sigmoid,0.45,2,0.8500000000000001,0.13872995972633362,,,PRUNED
1482,1482,0.13238079845905304,2023-01-04 22:34:23.233670,2023-01-04 22:34:32.067213,0 days 00:00:08.833543,relu,0.30000000000000004,2,0.8,0.13238079845905304,,,PRUNED
1483,1483,0.07316762208938599,2023-01-04 22:34:32.164177,2023-01-04 22:34:47.760868,0 days 00:00:15.596691,relu,0.1,2,0.65,0.07316762208938599,,,PRUNED
1484,1484,0.12665075063705444,2023-01-04 22:34:47.863920,2023-01-04 22:34:56.687500,0 days 00:00:08.823580,relu,0.5,2,0.75,0.12665075063705444,,,PRUNED
1485,1485,0.0859903022646904,2023-01-04 22:34:56.814260,2023-01-04 22:35:12.643427,0 days 00:00:15.829167,tanh,0.4,2,0.65,0.0859903022646904,,,PRUNED
1486,1486,0.07149037718772888,2023-01-04 22:35:12.743544,2023-01-04 22:35:28.525743,0 days 00:00:15.782199,relu,0.4,2,0.65,0.11776794493198395,0.07149037718772888,,PRUNED
1487,1487,0.06820452213287354,2023-01-04 22:35:28.659833,2023-01-04 22:35:44.290410,0 days 00:00:15.630577,sigmoid,0.35000000000000003,2,0.8500000000000001,0.11813138425350189,0.06820452213287354,,PRUNED
1488,1488,0.08256256580352783,2023-01-04 22:35:44.416969,2023-01-04 22:36:00.314571,0 days 00:00:15.897602,relu,0.5,2,0.9,0.09963002800941467,0.08256256580352783,,PRUNED
1489,1489,0.16391579806804657,2023-01-04 22:36:00.549652,2023-01-04 22:36:09.713831,0 days 00:00:09.164179,relu,0.45,5,0.8500000000000001,0.16391579806804657,,,PRUNED
1490,1490,0.07790204137563705,2023-01-04 22:36:09.814871,2023-01-04 22:36:25.321431,0 days 00:00:15.506560,tanh,0.30000000000000004,2,0.7,0.07790204137563705,,,PRUNED
1491,1491,0.09796811640262604,2023-01-04 22:36:25.421919,2023-01-04 22:36:41.320352,0 days 00:00:15.898433,relu,0.35000000000000003,2,0.7,0.12101394683122635,0.09796811640262604,,PRUNED
1492,1492,0.14756684005260468,2023-01-04 22:36:41.455911,2023-01-04 22:37:31.759895,0 days 00:00:50.303984,sigmoid,0.1,2,0.6,0.06511495262384415,0.04371626675128937,,COMPLETE
1493,1493,0.1552540361881256,2023-01-04 22:37:31.891495,2023-01-04 22:37:40.674222,0 days 00:00:08.782727,sigmoid,0.5,2,0.8500000000000001,0.1552540361881256,,,PRUNED
1494,1494,0.07877290993928909,2023-01-04 22:37:40.792223,2023-01-04 22:37:56.405352,0 days 00:00:15.613129,relu,0.35000000000000003,2,0.6,0.07877290993928909,,,PRUNED
1495,1495,0.490654855966568,2023-01-04 22:37:56.518277,2023-01-04 22:38:05.963792,0 days 00:00:09.445515,relu,0.30000000000000004,7,0.8,0.490654855966568,,,PRUNED
1496,1496,0.14763511717319489,2023-01-04 22:38:06.074887,2023-01-04 22:38:49.488771,0 days 00:00:43.413884,tanh,0.45,2,0.8500000000000001,0.09838493913412094,0.06264867633581161,0.04096439853310585,COMPLETE
1497,1497,0.06811531633138657,2023-01-04 22:38:49.642871,2023-01-04 22:39:05.442740,0 days 00:00:15.799869,tanh,0.45,2,0.8500000000000001,0.10984894633293152,0.06811531633138657,,PRUNED
1498,1498,0.07276102900505066,2023-01-04 22:39:05.562932,2023-01-04 22:39:21.183034,0 days 00:00:15.620102,tanh,0.25,2,0.8,0.07276102900505066,,,PRUNED
1499,1499,0.16159099340438843,2023-01-04 22:39:21.301515,2023-01-04 22:39:30.090742,0 days 00:00:08.789227,tanh,0.45,2,0.8500000000000001,0.16159099340438843,,,PRUNED
1500,1500,0.2679970860481262,2023-01-04 23:04:20.489965,2023-01-04 23:04:32.693128,0 days 00:00:12.203163,sigmoid,0.30000000000000004,5,1.0,0.2679970860481262,,,PRUNED
1501,1501,0.125596284866333,2023-01-04 23:04:32.795170,2023-01-04 23:04:41.559628,0 days 00:00:08.764458,tanh,0.0,2,0.6,0.125596284866333,,,PRUNED
1502,1502,0.15177907049655914,2023-01-04 23:04:41.680228,2023-01-04 23:05:39.837613,0 days 00:00:58.157385,sigmoid,0.1,2,0.6,0.07025604695081711,0.04772142693400383,,COMPLETE
1503,1503,0.1615297943353653,2023-01-04 23:05:39.981362,2023-01-04 23:06:26.697972,0 days 00:00:46.716610,sigmoid,0.1,2,0.75,0.08564122021198273,0.05086459591984749,,COMPLETE
1504,1504,0.15492719411849976,2023-01-04 23:06:26.831937,2023-01-04 23:07:10.018675,0 days 00:00:43.186738,sigmoid,0.1,2,0.6,0.0668889582157135,0.04728806018829346,,COMPLETE
1505,1505,0.1106644719839096,2023-01-04 23:07:10.144770,2023-01-04 23:07:19.105933,0 days 00:00:08.961163,tanh,0.05,2,0.7,0.1106644719839096,,,PRUNED
1506,1506,0.16125699877738953,2023-01-04 23:07:19.209026,2023-01-04 23:07:59.155120,0 days 00:00:39.946094,sigmoid,0.15000000000000002,2,0.6,0.07869821041822433,0.04745699465274811,,COMPLETE
1507,1507,0.13135597109794617,2023-01-04 23:07:59.283375,2023-01-04 23:08:07.918404,0 days 00:00:08.635029,tanh,0.05,2,0.6,0.13135597109794617,,,PRUNED
1508,1508,0.0666150152683258,2023-01-04 23:08:08.038199,2023-01-04 23:08:44.215311,0 days 00:00:36.177112,sigmoid,0.2,2,0.6,0.06854655593633652,0.0666150152683258,,PRUNED
1509,1509,0.24758730828762054,2023-01-04 23:08:44.338304,2023-01-04 23:08:53.790264,0 days 00:00:09.451960,tanh,0.15000000000000002,7,0.65,0.24758730828762054,,,PRUNED
1510,1510,0.20291954278945923,2023-01-04 23:08:53.908694,2023-01-04 23:09:02.548250,0 days 00:00:08.639556,tanh,0.0,2,0.6,0.20291954278945923,,,PRUNED
1511,1511,0.10904709994792938,2023-01-04 23:09:02.659348,2023-01-04 23:09:18.197067,0 days 00:00:15.537719,sigmoid,0.1,2,0.6,0.10904709994792938,,,PRUNED
1512,1512,0.06331546604633331,2023-01-04 23:09:18.324832,2023-01-04 23:09:54.835328,0 days 00:00:36.510496,sigmoid,0.1,2,0.6,0.08739344030618668,0.06331546604633331,,PRUNED
1513,1513,0.126408651471138,2023-01-04 23:09:54.955644,2023-01-04 23:10:03.718231,0 days 00:00:08.762587,tanh,0.05,2,0.7,0.126408651471138,,,PRUNED
1514,1514,0.16433823108673096,2023-01-04 23:10:03.822372,2023-01-04 23:10:47.212582,0 days 00:00:43.390210,sigmoid,0.1,2,0.55,0.0667102113366127,0.04870950058102608,,COMPLETE
1515,1515,0.21958766877651215,2023-01-04 23:10:47.336383,2023-01-04 23:11:20.860566,0 days 00:00:33.524183,sigmoid,0.15000000000000002,5,0.55,,,,COMPLETE
1516,1516,0.10843687504529953,2023-01-04 23:11:20.984077,2023-01-04 23:11:29.736596,0 days 00:00:08.752519,tanh,0.25,2,0.6,0.10843687504529953,,,PRUNED
1517,1517,0.15986968576908112,2023-01-04 23:11:29.848135,2023-01-04 23:12:19.912855,0 days 00:00:50.064720,sigmoid,0.15000000000000002,2,0.55,0.051849789917469025,,,COMPLETE
1518,1518,0.11693128943443298,2023-01-04 23:12:20.045976,2023-01-04 23:12:28.924017,0 days 00:00:08.878041,tanh,0.05,2,0.65,0.11693128943443298,,,PRUNED
1519,1519,0.10073526948690414,2023-01-04 23:12:29.034118,2023-01-04 23:12:37.865163,0 days 00:00:08.831045,tanh,0.0,2,0.6,0.10073526948690414,,,PRUNED
1520,1520,0.17187970876693726,2023-01-04 23:12:37.976892,2023-01-04 23:12:47.013719,0 days 00:00:09.036827,tanh,0.0,6,0.65,0.17187970876693726,,,PRUNED
1521,1521,0.15448321402072906,2023-01-04 23:12:47.125564,2023-01-04 23:13:30.698932,0 days 00:00:43.573368,sigmoid,0.1,2,0.6,0.05790746957063675,0.04383350908756256,,COMPLETE
1522,1522,0.10070488601922989,2023-01-04 23:13:30.831130,2023-01-04 23:13:39.518135,0 days 00:00:08.687005,tanh,0.15000000000000002,2,0.7,0.10070488601922989,,,PRUNED
1523,1523,0.2450587898492813,2023-01-04 23:13:39.636118,2023-01-04 23:14:12.917375,0 days 00:00:33.281257,sigmoid,0.15000000000000002,5,0.55,,,,COMPLETE
1524,1524,0.18199501931667328,2023-01-04 23:14:13.038714,2023-01-04 23:14:28.639408,0 days 00:00:15.600694,sigmoid,0.15000000000000002,2,0.6,0.18199501931667328,,,PRUNED
1525,1525,0.15023380517959595,2023-01-04 23:14:28.751169,2023-01-04 23:14:37.739081,0 days 00:00:08.987912,tanh,0.25,2,0.6,0.15023380517959595,,,PRUNED
1526,1526,0.1105794906616211,2023-01-04 23:14:37.850029,2023-01-04 23:14:46.588654,0 days 00:00:08.738625,tanh,0.25,2,0.6,0.1105794906616211,,,PRUNED
1527,1527,0.1603798121213913,2023-01-04 23:14:46.698063,2023-01-04 23:14:55.479660,0 days 00:00:08.781597,tanh,0.05,2,0.6,0.1603798121213913,,,PRUNED
1528,1528,0.16607405245304108,2023-01-04 23:14:55.580531,2023-01-04 23:15:35.756038,0 days 00:00:40.175507,sigmoid,0.0,2,0.55,0.07785861194133759,0.050365760922431946,,COMPLETE
