,number,value,datetime_start,datetime_complete,duration,params_activation,params_dropout,params_layers,params_shrink,system_attrs_completed_rung_0,system_attrs_completed_rung_1,system_attrs_completed_rung_2,state
0,0,0.4236590564250946,2023-01-04 14:38:31.054194,2023-01-04 14:39:00.082505,0 days 00:00:29.028311,relu,0.0,6,0.8,,,,COMPLETE
1,1,0.17539697885513306,2023-01-04 14:39:00.191305,2023-01-04 14:39:42.845794,0 days 00:00:42.654489,tanh,0.45,3,0.9,0.2512301504611969,0.0765516385436058,0.05938556417822838,COMPLETE
2,2,0.08325057476758957,2023-01-04 14:39:42.950753,2023-01-04 14:39:58.439006,0 days 00:00:15.488253,tanh,0.0,3,0.65,0.09996289014816284,0.08325057476758957,,PRUNED
3,3,0.36975011229515076,2023-01-04 14:39:58.540511,2023-01-04 14:40:31.344303,0 days 00:00:32.803792,sigmoid,0.25,6,0.8,0.20354418456554413,,,COMPLETE
4,4,0.2219674438238144,2023-01-04 14:40:31.453445,2023-01-04 14:40:47.518648,0 days 00:00:16.065203,relu,0.35000000000000003,7,1.0,0.2219674438238144,,,PRUNED
5,5,0.2213178277015686,2023-01-04 14:40:47.612308,2023-01-04 14:40:56.376318,0 days 00:00:08.764010,relu,0.45,5,0.55,0.2213178277015686,,,PRUNED
6,6,0.15682175755500793,2023-01-04 14:40:56.478207,2023-01-04 14:41:04.992335,0 days 00:00:08.514128,sigmoid,0.0,2,0.7,0.15682175755500793,,,PRUNED
7,7,0.17837843298912048,2023-01-04 14:41:05.093146,2023-01-04 14:41:47.604229,0 days 00:00:42.511083,sigmoid,0.45,3,0.75,0.11541552096605301,0.05292607098817825,,COMPLETE
8,8,0.16751256585121155,2023-01-04 14:41:47.712367,2023-01-04 14:42:30.450454,0 days 00:00:42.738087,relu,0.45,2,0.9,0.10151630640029907,0.07364802807569504,0.05147479847073555,COMPLETE
9,9,0.3340695798397064,2023-01-04 14:42:30.553819,2023-01-04 14:42:46.393034,0 days 00:00:15.839215,relu,0.05,8,0.5,0.3340695798397064,,,PRUNED
10,10,0.22895628213882446,2023-01-04 14:42:46.521294,2023-01-04 14:43:02.316599,0 days 00:00:15.795305,relu,0.0,8,0.55,0.22895628213882446,,,PRUNED
11,11,0.19208276271820068,2023-01-04 14:43:02.428065,2023-01-04 14:43:11.141169,0 days 00:00:08.713104,tanh,0.0,2,0.8,0.19208276271820068,,,PRUNED
12,12,0.14583276212215424,2023-01-04 14:43:11.244097,2023-01-04 14:43:19.931807,0 days 00:00:08.687710,relu,0.35000000000000003,5,0.6,0.14583276212215424,,,PRUNED
13,13,0.19560526311397552,2023-01-04 14:43:20.017407,2023-01-04 14:43:28.689622,0 days 00:00:08.672215,relu,0.45,4,0.95,0.19560526311397552,,,PRUNED
14,14,0.2359894961118698,2023-01-04 14:43:28.776082,2023-01-04 14:43:44.555323,0 days 00:00:15.779241,relu,0.25,8,0.55,0.2359894961118698,,,PRUNED
15,15,0.4867984354496002,2023-01-04 14:43:44.658226,2023-01-04 14:43:53.929617,0 days 00:00:09.271391,relu,0.2,8,0.75,0.4867984354496002,,,PRUNED
16,16,0.2752912640571594,2023-01-04 14:43:54.022753,2023-01-04 14:44:26.677655,0 days 00:00:32.654902,sigmoid,0.15000000000000002,5,0.55,0.12009236216545105,,,COMPLETE
17,17,0.20290111005306244,2023-01-04 14:44:26.777403,2023-01-04 14:44:35.884430,0 days 00:00:09.107027,sigmoid,0.25,7,1.0,0.20290111005306244,,,PRUNED
18,18,0.14814400672912598,2023-01-04 14:44:35.978821,2023-01-04 14:45:21.857106,0 days 00:00:45.878285,relu,0.1,2,0.5,0.0800422728061676,0.042531974613666534,,COMPLETE
19,19,0.09234537929296494,2023-01-04 14:45:21.957647,2023-01-04 14:45:57.920297,0 days 00:00:35.962650,tanh,0.05,5,0.55,0.10099321603775024,0.09234537929296494,,PRUNED
20,20,0.21644695103168488,2023-01-04 14:45:58.040888,2023-01-04 14:46:06.677969,0 days 00:00:08.637081,tanh,0.5,3,0.9,0.21644695103168488,,,PRUNED
21,21,0.05186723917722702,2023-01-04 14:46:06.772731,2023-01-04 14:46:42.775260,0 days 00:00:36.002529,tanh,0.35000000000000003,3,0.9,0.1475842148065567,0.06888654828071594,0.05186723917722702,PRUNED
22,22,0.1415807008743286,2023-01-04 14:46:42.861489,2023-01-04 14:47:31.883674,0 days 00:00:49.022185,tanh,0.35000000000000003,2,0.8500000000000001,0.13504399359226227,0.07033582776784897,0.040079183876514435,COMPLETE
23,23,0.14365093410015106,2023-01-04 14:47:31.978138,2023-01-04 14:48:21.035291,0 days 00:00:49.057153,tanh,0.4,2,0.6,0.061373867094516754,0.04048106446862221,,COMPLETE
24,24,0.16296297311782837,2023-01-04 14:48:21.135773,2023-01-04 14:48:29.891194,0 days 00:00:08.755421,sigmoid,0.35000000000000003,2,0.8500000000000001,0.16296297311782837,,,PRUNED
25,25,0.08707044273614883,2023-01-04 14:48:29.986757,2023-01-04 14:48:45.649002,0 days 00:00:15.662245,relu,0.2,4,1.0,0.125271275639534,0.08707044273614883,,PRUNED
26,26,0.23703934252262115,2023-01-04 14:48:45.760478,2023-01-04 14:48:54.448682,0 days 00:00:08.688204,tanh,0.30000000000000004,4,0.8,0.23703934252262115,,,PRUNED
27,27,0.04840250685811043,2023-01-04 14:48:54.533906,2023-01-04 14:49:29.954874,0 days 00:00:35.420968,tanh,0.5,3,0.7,0.09283880889415741,0.04840250685811043,,PRUNED
28,28,0.046004291623830795,2023-01-04 14:49:30.040571,2023-01-04 14:50:05.692951,0 days 00:00:35.652380,tanh,0.35000000000000003,2,0.65,0.062061335891485214,0.046004291623830795,,PRUNED
29,29,0.0577511191368103,2023-01-04 14:50:05.796231,2023-01-04 14:50:41.147964,0 days 00:00:35.351733,tanh,0.15000000000000002,2,0.65,0.07861359417438507,0.0577511191368103,,PRUNED
30,30,0.13852077722549438,2023-01-04 14:50:41.250160,2023-01-04 14:50:56.731132,0 days 00:00:15.480972,relu,0.35000000000000003,4,0.95,0.13852077722549438,,,PRUNED
31,31,0.056233059614896774,2023-01-04 14:50:56.842303,2023-01-04 14:51:32.461727,0 days 00:00:35.619424,tanh,0.15000000000000002,3,0.8500000000000001,0.0791090726852417,0.056233059614896774,,PRUNED
32,32,0.14976003766059875,2023-01-04 14:51:32.580854,2023-01-04 14:52:21.851237,0 days 00:00:49.270383,tanh,0.1,2,0.8500000000000001,0.1176641657948494,0.06879884004592896,0.04431990906596184,COMPLETE
33,33,0.1033746600151062,2023-01-04 14:52:21.948957,2023-01-04 14:52:37.590192,0 days 00:00:15.641235,tanh,0.1,6,0.7,0.14563755691051483,0.1033746600151062,,PRUNED
34,34,0.17558777332305908,2023-01-04 14:52:37.709780,2023-01-04 14:52:46.422859,0 days 00:00:08.713079,tanh,0.1,4,0.5,0.17558777332305908,,,PRUNED
35,35,0.14658530056476593,2023-01-04 14:52:46.523715,2023-01-04 14:52:55.263854,0 days 00:00:08.740139,tanh,0.1,2,0.8500000000000001,0.14658530056476593,,,PRUNED
36,36,0.04674812778830528,2023-01-04 14:52:55.365778,2023-01-04 14:53:31.519455,0 days 00:00:36.153677,relu,0.45,2,0.65,0.06632333993911743,0.04674812778830528,,PRUNED
37,37,0.048514753580093384,2023-01-04 14:53:31.605132,2023-01-04 14:54:07.941705,0 days 00:00:36.336573,tanh,0.4,2,0.95,0.1416284441947937,0.0695853903889656,0.048514753580093384,PRUNED
38,38,0.07616712898015976,2023-01-04 14:54:08.078301,2023-01-04 14:54:23.732186,0 days 00:00:15.653885,relu,0.5,3,0.8500000000000001,0.11033676564693451,0.07616712898015976,,PRUNED
39,39,0.1718534529209137,2023-01-04 14:54:23.808868,2023-01-04 14:54:32.672601,0 days 00:00:08.863733,sigmoid,0.25,2,0.75,0.1718534529209137,,,PRUNED
40,40,0.08165010064840317,2023-01-04 14:54:32.793527,2023-01-04 14:54:48.255711,0 days 00:00:15.462184,tanh,0.15000000000000002,3,0.95,0.13021107017993927,0.08165010064840317,,PRUNED
41,41,0.07188338786363602,2023-01-04 14:54:48.333036,2023-01-04 14:55:03.629321,0 days 00:00:15.296285,relu,0.4,2,0.8500000000000001,0.1349056363105774,0.07188338786363602,,PRUNED
42,42,0.24353131651878357,2023-01-04 14:55:03.706226,2023-01-04 14:55:12.578799,0 days 00:00:08.872573,tanh,0.30000000000000004,3,0.9,0.24353131651878357,,,PRUNED
43,43,0.14199784398078918,2023-01-04 14:55:12.689735,2023-01-04 14:55:21.144523,0 days 00:00:08.454788,relu,0.4,2,0.8,0.14199784398078918,,,PRUNED
44,44,0.17373551428318024,2023-01-04 14:55:21.239038,2023-01-04 14:55:36.809710,0 days 00:00:15.570672,tanh,0.30000000000000004,4,0.95,0.13593725860118866,0.17373551428318024,,PRUNED
45,45,0.0805554986000061,2023-01-04 14:55:36.912527,2023-01-04 14:55:52.483536,0 days 00:00:15.571009,tanh,0.30000000000000004,4,0.5,0.0805554986000061,,,PRUNED
46,46,0.358074814081192,2023-01-04 14:55:52.611716,2023-01-04 14:56:01.824719,0 days 00:00:09.213003,sigmoid,0.2,7,0.8,0.358074814081192,,,PRUNED
47,47,0.10327403992414474,2023-01-04 14:56:01.927761,2023-01-04 14:56:17.490840,0 days 00:00:15.563079,tanh,0.2,4,0.6,0.10327403992414474,,,PRUNED
48,48,0.052190713584423065,2023-01-04 14:56:17.601504,2023-01-04 14:56:53.196098,0 days 00:00:35.594594,relu,0.1,2,0.6,0.07673545181751251,0.052190713584423065,,PRUNED
49,49,0.08913807570934296,2023-01-04 14:56:53.316474,2023-01-04 14:57:09.003352,0 days 00:00:15.686878,sigmoid,0.4,3,0.75,0.08913807570934296,,,PRUNED
50,50,0.1994752436876297,2023-01-04 14:57:09.122499,2023-01-04 14:57:24.792735,0 days 00:00:15.670236,tanh,0.25,6,0.5,0.1994752436876297,,,PRUNED
51,51,0.32391127943992615,2023-01-04 14:57:24.895889,2023-01-04 14:57:33.842879,0 days 00:00:08.946990,relu,0.05,6,0.7,0.32391127943992615,,,PRUNED
52,52,0.18051588535308838,2023-01-04 14:57:33.938077,2023-01-04 14:57:42.450759,0 days 00:00:08.512682,tanh,0.45,3,0.9,0.18051588535308838,,,PRUNED
53,53,0.07640480250120163,2023-01-04 14:57:42.553814,2023-01-04 14:57:58.399320,0 days 00:00:15.845506,tanh,0.5,3,0.8500000000000001,0.11805165559053421,0.07640480250120163,,PRUNED
54,54,0.07444366067647934,2023-01-04 14:57:58.501276,2023-01-04 14:58:13.973428,0 days 00:00:15.472152,tanh,0.45,2,0.9,0.13311035931110382,0.07444366067647934,,PRUNED
55,55,0.05352875590324402,2023-01-04 14:58:14.075527,2023-01-04 14:58:49.937102,0 days 00:00:35.861575,sigmoid,0.45,3,0.9,0.06891381740570068,0.05352875590324402,,PRUNED
56,56,0.09420794993638992,2023-01-04 14:58:50.063765,2023-01-04 14:59:05.610929,0 days 00:00:15.547164,sigmoid,0.5,2,0.75,0.09420794993638992,,,PRUNED
57,57,0.07468260824680328,2023-01-04 14:59:05.729475,2023-01-04 14:59:21.126414,0 days 00:00:15.396939,tanh,0.4,2,0.75,0.12407052516937256,0.07468260824680328,,PRUNED
58,58,0.051059234887361526,2023-01-04 14:59:21.204423,2023-01-04 14:59:56.940633,0 days 00:00:35.736210,sigmoid,0.4,3,0.7,0.06495506316423416,0.051059234887361526,,PRUNED
59,59,0.09385707229375839,2023-01-04 14:59:57.054968,2023-01-04 15:00:12.688864,0 days 00:00:15.633896,sigmoid,0.45,4,0.8,0.09385707229375839,,,PRUNED
60,60,0.1428430825471878,2023-01-04 15:00:12.803917,2023-01-04 15:01:02.370538,0 days 00:00:49.566621,sigmoid,0.4,2,0.6,0.06609951704740524,0.04113880172371864,,COMPLETE
61,61,0.04814482107758522,2023-01-04 15:01:02.462075,2023-01-04 15:01:38.182753,0 days 00:00:35.720678,tanh,0.35000000000000003,2,1.0,0.1264929324388504,0.06458066403865814,0.04814482107758522,PRUNED
62,62,0.23022575676441193,2023-01-04 15:01:38.305699,2023-01-04 15:01:46.907238,0 days 00:00:08.601539,tanh,0.45,3,0.8,0.23022575676441193,,,PRUNED
63,63,0.17682068049907684,2023-01-04 15:01:47.013260,2023-01-04 15:01:55.864726,0 days 00:00:08.851466,relu,0.5,5,0.95,0.17682068049907684,,,PRUNED
64,64,0.08054731041193008,2023-01-04 15:01:55.962390,2023-01-04 15:02:11.546883,0 days 00:00:15.584493,relu,0.30000000000000004,2,0.6,0.08054731041193008,,,PRUNED
65,65,0.1402178406715393,2023-01-04 15:02:11.644473,2023-01-04 15:02:20.262660,0 days 00:00:08.618187,tanh,0.4,3,0.8500000000000001,0.1402178406715393,,,PRUNED
66,66,0.08908416330814362,2023-01-04 15:02:20.369187,2023-01-04 15:02:35.761712,0 days 00:00:15.392525,relu,0.05,2,0.65,0.12319759279489517,0.08908416330814362,,PRUNED
67,67,0.05099372938275337,2023-01-04 15:02:35.876347,2023-01-04 15:03:11.450697,0 days 00:00:35.574350,relu,0.30000000000000004,2,0.6,0.07181670516729355,0.05099372938275337,,PRUNED
68,68,0.3497704565525055,2023-01-04 15:03:11.565763,2023-01-04 15:03:20.608324,0 days 00:00:09.042561,sigmoid,0.25,5,0.9,0.3497704565525055,,,PRUNED
69,69,0.17649763822555542,2023-01-04 15:03:20.697425,2023-01-04 15:03:29.649706,0 days 00:00:08.952281,relu,0.0,6,0.75,0.17649763822555542,,,PRUNED
70,70,0.0817272737622261,2023-01-04 15:03:29.755987,2023-01-04 15:03:45.297337,0 days 00:00:15.541350,tanh,0.4,3,0.5,0.0817272737622261,,,PRUNED
71,71,0.16909806430339813,2023-01-04 15:03:45.413203,2023-01-04 15:03:54.580654,0 days 00:00:09.167451,relu,0.0,6,0.8500000000000001,0.16909806430339813,,,PRUNED
72,72,0.301774263381958,2023-01-04 15:03:54.678651,2023-01-04 15:04:03.763395,0 days 00:00:09.084744,relu,0.05,7,0.8,0.301774263381958,,,PRUNED
73,73,0.13295866549015045,2023-01-04 15:04:03.869697,2023-01-04 15:04:19.670145,0 days 00:00:15.800448,sigmoid,0.2,6,0.7,0.13295866549015045,,,PRUNED
74,74,0.20344805717468262,2023-01-04 15:04:19.776550,2023-01-04 15:04:28.911498,0 days 00:00:09.134948,relu,0.15000000000000002,5,0.9,0.20344805717468262,,,PRUNED
75,75,0.08155245333909988,2023-01-04 15:04:29.008918,2023-01-04 15:04:44.743392,0 days 00:00:15.734474,sigmoid,0.0,4,0.55,0.08155245333909988,,,PRUNED
76,76,0.39790430665016174,2023-01-04 15:04:44.849378,2023-01-04 15:04:54.001272,0 days 00:00:09.151894,relu,0.35000000000000003,8,0.8,0.39790430665016174,,,PRUNED
77,77,0.1566273421049118,2023-01-04 15:04:54.140907,2023-01-04 15:05:37.301916,0 days 00:00:43.161009,sigmoid,0.5,2,0.8,0.06698215752840042,0.046468399465084076,,COMPLETE
78,78,0.1683027744293213,2023-01-04 15:05:37.424589,2023-01-04 15:05:45.972256,0 days 00:00:08.547667,tanh,0.0,2,0.95,0.1683027744293213,,,PRUNED
79,79,0.37633198499679565,2023-01-04 15:05:46.070313,2023-01-04 15:05:55.154718,0 days 00:00:09.084405,sigmoid,0.45,7,0.8500000000000001,0.37633198499679565,,,PRUNED
80,80,0.08114492893218994,2023-01-04 15:05:55.252767,2023-01-04 15:06:10.753795,0 days 00:00:15.501028,sigmoid,0.5,2,0.8500000000000001,0.08114492893218994,,,PRUNED
81,81,0.19595807790756226,2023-01-04 15:06:10.868729,2023-01-04 15:06:19.486481,0 days 00:00:08.617752,tanh,0.15000000000000002,3,0.9,0.19595807790756226,,,PRUNED
82,82,0.09949963539838791,2023-01-04 15:06:19.601114,2023-01-04 15:06:35.035305,0 days 00:00:15.434191,sigmoid,0.4,2,0.8,0.09949963539838791,,,PRUNED
83,83,0.07974190264940262,2023-01-04 15:06:35.133293,2023-01-04 15:06:50.833803,0 days 00:00:15.700510,relu,0.05,4,0.75,0.13389307260513306,0.07974190264940262,,PRUNED
84,84,0.19350579380989075,2023-01-04 15:06:50.940889,2023-01-04 15:07:00.058069,0 days 00:00:09.117180,tanh,0.30000000000000004,6,1.0,0.19350579380989075,,,PRUNED
85,85,0.1593509465456009,2023-01-04 15:07:00.147149,2023-01-04 15:07:08.649812,0 days 00:00:08.502663,tanh,0.35000000000000003,2,1.0,0.1593509465456009,,,PRUNED
86,86,0.1723869889974594,2023-01-04 15:07:08.755910,2023-01-04 15:07:17.290442,0 days 00:00:08.534532,tanh,0.25,2,1.0,0.1723869889974594,,,PRUNED
87,87,0.061227042227983475,2023-01-04 15:07:17.405080,2023-01-04 15:07:53.595579,0 days 00:00:36.190499,sigmoid,0.45,3,1.0,0.0779537707567215,0.061227042227983475,,PRUNED
88,88,0.08219391107559204,2023-01-04 15:07:53.718005,2023-01-04 15:08:09.220293,0 days 00:00:15.502288,tanh,0.35000000000000003,2,0.95,0.13737525045871735,0.08219391107559204,,PRUNED
89,89,0.07689057290554047,2023-01-04 15:08:09.335297,2023-01-04 15:08:24.651891,0 days 00:00:15.316594,tanh,0.45,2,0.8,0.12168822437524796,0.07689057290554047,,PRUNED
90,90,0.1438979208469391,2023-01-04 15:08:24.748994,2023-01-04 15:08:33.325792,0 days 00:00:08.576798,tanh,0.2,3,0.9,0.1438979208469391,,,PRUNED
91,91,0.07895191758871078,2023-01-04 15:08:33.440871,2023-01-04 15:08:49.149539,0 days 00:00:15.708668,tanh,0.30000000000000004,2,0.8500000000000001,0.10285419225692749,0.07895191758871078,,PRUNED
92,92,0.1498226523399353,2023-01-04 15:08:49.265052,2023-01-04 15:08:57.707582,0 days 00:00:08.442530,relu,0.4,2,0.95,0.1498226523399353,,,PRUNED
93,93,0.04965556785464287,2023-01-04 15:08:57.830723,2023-01-04 15:09:34.021788,0 days 00:00:36.191065,sigmoid,0.5,3,0.5,0.10871857404708862,0.06843648850917816,0.04965556785464287,PRUNED
94,94,0.15367351472377777,2023-01-04 15:09:34.144391,2023-01-04 15:10:16.878380,0 days 00:00:42.733989,tanh,0.35000000000000003,2,0.8500000000000001,0.11447852104902267,0.06639638543128967,0.04510629549622536,COMPLETE
95,95,0.19717594981193542,2023-01-04 15:10:17.003762,2023-01-04 15:10:33.175417,0 days 00:00:16.171655,sigmoid,0.5,7,0.8500000000000001,0.19717594981193542,,,PRUNED
96,96,0.09579199552536011,2023-01-04 15:10:33.290476,2023-01-04 15:10:48.740459,0 days 00:00:15.449983,relu,0.35000000000000003,2,0.65,0.09579199552536011,,,PRUNED
97,97,0.1443769335746765,2023-01-04 15:10:48.856525,2023-01-04 15:11:04.598290,0 days 00:00:15.741765,tanh,0.1,4,0.8,0.1320948451757431,0.1443769335746765,,PRUNED
98,98,0.0810166448354721,2023-01-04 15:11:04.696544,2023-01-04 15:11:20.030440,0 days 00:00:15.333896,tanh,0.35000000000000003,2,0.8500000000000001,0.13417237997055054,0.0810166448354721,,PRUNED
99,99,0.13931818306446075,2023-01-04 15:11:20.145323,2023-01-04 15:11:28.946446,0 days 00:00:08.801123,tanh,0.4,2,0.8500000000000001,0.13931818306446075,,,PRUNED
100,100,0.10311245173215866,2023-01-04 15:11:29.052744,2023-01-04 15:11:44.670255,0 days 00:00:15.617511,tanh,0.45,3,0.9,0.13342022895812988,0.10311245173215866,,PRUNED
101,101,0.049902599304914474,2023-01-04 15:11:44.768164,2023-01-04 15:12:20.784192,0 days 00:00:36.016028,relu,0.05,3,0.7,0.07363564521074295,0.049902599304914474,,PRUNED
102,102,0.07690424472093582,2023-01-04 15:12:20.914389,2023-01-04 15:12:36.632549,0 days 00:00:15.718160,tanh,0.35000000000000003,2,0.55,0.12653052806854248,0.07690424472093582,,PRUNED
103,103,0.0841553583741188,2023-01-04 15:12:36.748612,2023-01-04 15:12:52.257189,0 days 00:00:15.508577,tanh,0.30000000000000004,2,0.8,0.0913740023970604,0.0841553583741188,,PRUNED
104,104,0.15635144710540771,2023-01-04 15:12:52.364223,2023-01-04 15:13:01.047672,0 days 00:00:08.683449,relu,0.4,3,0.9,0.15635144710540771,,,PRUNED
105,105,0.150306835770607,2023-01-04 15:13:01.153122,2023-01-04 15:13:47.421081,0 days 00:00:46.267959,sigmoid,0.2,2,0.55,0.0720488578081131,0.043853215873241425,,COMPLETE
106,106,0.14613065123558044,2023-01-04 15:13:47.529122,2023-01-04 15:14:04.376381,0 days 00:00:16.847259,relu,0.1,7,0.55,0.14613065123558044,,,PRUNED
107,107,0.1658095419406891,2023-01-04 15:14:04.499520,2023-01-04 15:14:13.250696,0 days 00:00:08.751176,tanh,0.25,2,0.8500000000000001,0.1658095419406891,,,PRUNED
108,108,0.051600389182567596,2023-01-04 15:14:13.348662,2023-01-04 15:14:49.471551,0 days 00:00:36.122889,tanh,0.5,3,0.95,0.13166411221027374,0.07098912447690964,0.051600389182567596,PRUNED
109,109,0.10588578134775162,2023-01-04 15:14:49.586648,2023-01-04 15:15:05.112011,0 days 00:00:15.525363,relu,0.45,2,1.0,0.1338682919740677,0.10588578134775162,,PRUNED
110,110,0.08712247014045715,2023-01-04 15:15:05.203022,2023-01-04 15:15:20.911314,0 days 00:00:15.708292,sigmoid,0.30000000000000004,2,0.75,0.12451102584600449,0.08712247014045715,,PRUNED
111,111,0.10537521541118622,2023-01-04 15:15:21.010472,2023-01-04 15:15:36.709646,0 days 00:00:15.699174,tanh,0.2,5,0.5,0.10537521541118622,,,PRUNED
112,112,0.08349791169166565,2023-01-04 15:15:36.825693,2023-01-04 15:15:52.216813,0 days 00:00:15.391120,sigmoid,0.1,2,0.55,0.08349791169166565,,,PRUNED
113,113,0.08335220813751221,2023-01-04 15:15:52.333178,2023-01-04 15:16:08.065650,0 days 00:00:15.732472,tanh,0.4,2,0.95,0.1331072747707367,0.08335220813751221,,PRUNED
114,114,0.047427546232938766,2023-01-04 15:16:08.172908,2023-01-04 15:16:44.238575,0 days 00:00:36.065667,sigmoid,0.30000000000000004,2,0.6,0.06768234074115753,0.047427546232938766,,PRUNED
115,115,0.14423435926437378,2023-01-04 15:16:44.328554,2023-01-04 15:16:52.929267,0 days 00:00:08.600713,tanh,0.4,2,0.9,0.14423435926437378,,,PRUNED
116,116,0.16081978380680084,2023-01-04 15:16:53.018627,2023-01-04 15:17:01.619901,0 days 00:00:08.601274,tanh,0.35000000000000003,3,1.0,0.16081978380680084,,,PRUNED
117,117,0.1854320466518402,2023-01-04 15:17:01.701517,2023-01-04 15:17:10.560897,0 days 00:00:08.859380,tanh,0.35000000000000003,2,0.95,0.1854320466518402,,,PRUNED
118,118,0.13787806034088135,2023-01-04 15:17:10.642114,2023-01-04 15:17:19.151456,0 days 00:00:08.509342,tanh,0.4,2,0.8500000000000001,0.13787806034088135,,,PRUNED
119,119,0.08098709583282471,2023-01-04 15:17:19.234365,2023-01-04 15:17:34.556968,0 days 00:00:15.322603,sigmoid,0.25,2,0.55,0.08098709583282471,,,PRUNED
120,120,0.2804659605026245,2023-01-04 15:17:34.674630,2023-01-04 15:17:43.706496,0 days 00:00:09.031866,relu,0.1,6,0.9,0.2804659605026245,,,PRUNED
121,121,0.1552959531545639,2023-01-04 15:17:43.790606,2023-01-04 15:17:52.697265,0 days 00:00:08.906659,tanh,0.45,3,0.8500000000000001,0.1552959531545639,,,PRUNED
122,122,0.19400300085544586,2023-01-04 15:17:52.797444,2023-01-04 15:18:01.596593,0 days 00:00:08.799149,tanh,0.5,4,0.9,0.19400300085544586,,,PRUNED
123,123,0.08142688870429993,2023-01-04 15:18:01.697108,2023-01-04 15:18:17.303739,0 days 00:00:15.606631,sigmoid,0.15000000000000002,3,0.5,0.08142688870429993,,,PRUNED
124,124,0.08816138654947281,2023-01-04 15:18:17.403352,2023-01-04 15:18:33.086182,0 days 00:00:15.682830,relu,0.15000000000000002,2,0.95,0.11504993587732315,0.08816138654947281,,PRUNED
125,125,0.24169401824474335,2023-01-04 15:18:33.187193,2023-01-04 15:18:42.227542,0 days 00:00:09.040349,tanh,0.4,7,0.8,0.24169401824474335,,,PRUNED
126,126,0.14769339561462402,2023-01-04 15:18:42.327848,2023-01-04 15:19:28.978971,0 days 00:00:46.651123,sigmoid,0.5,3,0.5,0.09338951110839844,0.07281417399644852,0.04428805783390999,COMPLETE
127,127,0.0756429135799408,2023-01-04 15:19:29.078731,2023-01-04 15:19:44.638816,0 days 00:00:15.560085,sigmoid,0.5,4,0.65,0.12501083314418793,0.0756429135799408,,PRUNED
128,128,0.086237333714962,2023-01-04 15:19:44.722935,2023-01-04 15:20:00.312324,0 days 00:00:15.589389,sigmoid,0.35000000000000003,2,0.6,0.086237333714962,,,PRUNED
129,129,0.2723686695098877,2023-01-04 15:20:00.438018,2023-01-04 15:20:09.303620,0 days 00:00:08.865602,sigmoid,0.45,5,0.55,0.2723686695098877,,,PRUNED
