,number,value,datetime_start,datetime_complete,duration,params_activation,params_dropout,params_layers,params_shrink,system_attrs_completed_rung_0,system_attrs_completed_rung_1,system_attrs_completed_rung_2,state
2716,2716,0.17184680700302124,2023-01-05 06:34:29.088326,2023-01-05 06:34:37.840722,0 days 00:00:08.752396,tanh,0.30000000000000004,2,0.7,0.17184680700302124,,,PRUNED
2717,2717,0.15044961869716644,2023-01-05 06:34:37.944593,2023-01-05 06:35:20.951125,0 days 00:00:43.006532,tanh,0.30000000000000004,2,0.75,0.06400541961193085,0.04311380535364151,,COMPLETE
2718,2718,0.06306745111942291,2023-01-05 06:35:21.103574,2023-01-05 06:35:36.902014,0 days 00:00:15.798440,relu,0.1,2,0.5,0.10350062698125839,0.06306745111942291,,PRUNED
2719,2719,0.10100952535867691,2023-01-05 06:35:37.005001,2023-01-05 06:35:52.567426,0 days 00:00:15.562425,sigmoid,0.35000000000000003,2,1.0,0.10100952535867691,,,PRUNED
2720,2720,0.08171016722917557,2023-01-05 06:35:52.679816,2023-01-05 06:36:08.733656,0 days 00:00:16.053840,tanh,0.4,2,0.65,0.08171016722917557,,,PRUNED
2721,2721,0.16312837600708008,2023-01-05 06:36:08.844982,2023-01-05 06:36:17.623020,0 days 00:00:08.778038,tanh,0.05,2,0.55,0.16312837600708008,,,PRUNED
2722,2722,0.1236221119761467,2023-01-05 06:36:17.743272,2023-01-05 06:36:26.456738,0 days 00:00:08.713466,tanh,0.5,2,0.8500000000000001,0.1236221119761467,,,PRUNED
2723,2723,0.08817555010318756,2023-01-05 06:36:26.570312,2023-01-05 06:36:42.596667,0 days 00:00:16.026355,relu,0.4,2,0.6,0.09404423832893372,0.08817555010318756,,PRUNED
2724,2724,0.15476597845554352,2023-01-05 06:36:42.716355,2023-01-05 06:37:25.606461,0 days 00:00:42.890106,sigmoid,0.30000000000000004,2,0.95,0.06117387115955353,0.043555308133363724,,COMPLETE
2725,2725,0.14533519744873047,2023-01-05 06:37:25.725466,2023-01-05 06:37:34.601481,0 days 00:00:08.876015,tanh,0.30000000000000004,2,0.65,0.14533519744873047,,,PRUNED
2726,2726,0.18113219738006592,2023-01-05 06:37:34.711340,2023-01-05 06:37:43.367259,0 days 00:00:08.655919,relu,0.25,2,0.9,0.18113219738006592,,,PRUNED
2727,2727,0.0769554078578949,2023-01-05 06:37:43.460667,2023-01-05 06:37:59.056929,0 days 00:00:15.596262,sigmoid,0.45,2,0.65,0.0769554078578949,,,PRUNED
2728,2728,0.1215033009648323,2023-01-05 06:37:59.160726,2023-01-05 06:38:08.140563,0 days 00:00:08.979837,tanh,0.0,2,0.7,0.1215033009648323,,,PRUNED
2729,2729,0.1194644644856453,2023-01-05 06:38:08.258869,2023-01-05 06:38:16.931548,0 days 00:00:08.672679,relu,0.35000000000000003,2,0.6,0.1194644644856453,,,PRUNED
2730,2730,0.14666889607906342,2023-01-05 06:38:17.042406,2023-01-05 06:38:25.965451,0 days 00:00:08.923045,tanh,0.30000000000000004,2,0.65,0.14666889607906342,,,PRUNED
2731,2731,0.12455786019563675,2023-01-05 06:38:26.093965,2023-01-05 06:38:34.771931,0 days 00:00:08.677966,relu,0.35000000000000003,2,0.6,0.12455786019563675,,,PRUNED
2732,2732,0.15818902850151062,2023-01-05 06:38:34.885608,2023-01-05 06:39:17.747690,0 days 00:00:42.862082,tanh,0.30000000000000004,2,1.0,0.06307055801153183,0.04553622007369995,,COMPLETE
2733,2733,0.08729667216539383,2023-01-05 06:39:17.887242,2023-01-05 06:39:33.282848,0 days 00:00:15.395606,sigmoid,0.35000000000000003,2,0.7,0.08729667216539383,,,PRUNED
2734,2734,0.15025320649147034,2023-01-05 06:39:33.405193,2023-01-05 06:40:16.337034,0 days 00:00:42.931841,tanh,0.4,2,0.75,0.05979425832629204,0.042506229132413864,,COMPLETE
2735,2735,0.11277609318494797,2023-01-05 06:40:16.453556,2023-01-05 06:40:25.313321,0 days 00:00:08.859765,tanh,0.1,2,0.8500000000000001,0.11277609318494797,,,PRUNED
2736,2736,0.14827494323253632,2023-01-05 06:40:25.442102,2023-01-05 06:41:15.213695,0 days 00:00:49.771593,sigmoid,0.30000000000000004,2,0.5,0.06974874436855316,0.044577937573194504,,COMPLETE
2737,2737,0.13701389729976654,2023-01-05 06:41:15.351262,2023-01-05 06:41:24.225451,0 days 00:00:08.874189,tanh,0.5,3,0.55,0.13701389729976654,,,PRUNED
2738,2738,0.06847307085990906,2023-01-05 06:41:24.345904,2023-01-05 06:41:40.039995,0 days 00:00:15.694091,relu,0.15000000000000002,2,0.5,0.10440333932638168,0.06847307085990906,,PRUNED
2739,2739,0.1683473140001297,2023-01-05 06:41:40.144422,2023-01-05 06:42:16.312949,0 days 00:00:36.168527,tanh,0.35000000000000003,2,0.7,0.06907350569963455,0.04532585293054581,,COMPLETE
2740,2740,0.14191900193691254,2023-01-05 06:42:16.437508,2023-01-05 06:43:13.048274,0 days 00:00:56.610766,sigmoid,0.25,2,0.65,0.07537826150655746,0.04187494143843651,,COMPLETE
2741,2741,0.09958349913358688,2023-01-05 06:43:13.175570,2023-01-05 06:43:28.523201,0 days 00:00:15.347631,sigmoid,0.25,2,0.65,0.09958349913358688,,,PRUNED
2742,2742,0.1232774406671524,2023-01-05 06:43:28.625725,2023-01-05 06:43:44.405312,0 days 00:00:15.779587,sigmoid,0.25,3,0.65,0.1232774406671524,,,PRUNED
2743,2743,0.12228693813085556,2023-01-05 06:43:44.510085,2023-01-05 06:44:00.554063,0 days 00:00:16.043978,sigmoid,0.25,7,0.65,0.12228693813085556,,,PRUNED
2744,2744,0.046308618038892746,2023-01-05 06:44:00.657869,2023-01-05 06:44:36.617952,0 days 00:00:35.960083,sigmoid,0.25,2,0.65,0.06840930134057999,0.046308618038892746,,PRUNED
2745,2745,0.17838121950626373,2023-01-05 06:44:36.724188,2023-01-05 06:44:45.693253,0 days 00:00:08.969065,tanh,0.4,2,0.7,0.17838121950626373,,,PRUNED
2746,2746,0.16888904571533203,2023-01-05 06:44:45.795675,2023-01-05 06:44:54.842549,0 days 00:00:09.046874,relu,0.45,6,0.8500000000000001,0.16888904571533203,,,PRUNED
2747,2747,0.05501904338598251,2023-01-05 06:44:54.961991,2023-01-05 06:45:31.113387,0 days 00:00:36.151396,sigmoid,0.25,2,0.65,0.07461605966091156,0.05501904338598251,,PRUNED
2748,2748,0.12967894971370697,2023-01-05 06:45:31.219532,2023-01-05 06:45:39.964070,0 days 00:00:08.744538,tanh,0.30000000000000004,2,0.6,0.12967894971370697,,,PRUNED
2749,2749,0.12897583842277527,2023-01-05 06:45:40.083545,2023-01-05 06:45:48.963376,0 days 00:00:08.879831,relu,0.35000000000000003,2,0.8,0.12897583842277527,,,PRUNED
2750,2750,0.1417059600353241,2023-01-05 06:45:49.056462,2023-01-05 06:45:57.821027,0 days 00:00:08.764565,tanh,0.1,2,0.65,0.1417059600353241,,,PRUNED
2751,2751,0.1473650187253952,2023-01-05 06:45:57.916270,2023-01-05 06:46:54.287681,0 days 00:00:56.371411,tanh,0.1,2,0.55,0.04886560142040253,,,COMPLETE
2752,2752,0.11068234592676163,2023-01-05 06:46:54.417794,2023-01-05 06:47:03.290995,0 days 00:00:08.873201,relu,0.30000000000000004,2,0.8500000000000001,0.11068234592676163,,,PRUNED
2753,2753,0.17149843275547028,2023-01-05 06:47:03.404087,2023-01-05 06:47:12.039465,0 days 00:00:08.635378,tanh,0.5,2,0.6,0.17149843275547028,,,PRUNED
2754,2754,0.15632839500904083,2023-01-05 06:47:12.145079,2023-01-05 06:47:55.226652,0 days 00:00:43.081573,tanh,0.0,2,0.5,0.04245252534747124,,,COMPLETE
2755,2755,0.12100006639957428,2023-01-05 06:47:55.345891,2023-01-05 06:48:04.069628,0 days 00:00:08.723737,tanh,0.35000000000000003,2,0.9,0.12100006639957428,,,PRUNED
2756,2756,0.08315642923116684,2023-01-05 06:48:04.172772,2023-01-05 06:48:19.684090,0 days 00:00:15.511318,sigmoid,0.25,2,0.65,0.08315642923116684,,,PRUNED
2757,2757,0.14872822165489197,2023-01-05 06:48:19.786897,2023-01-05 06:48:28.675657,0 days 00:00:08.888760,relu,0.0,2,0.6,0.14872822165489197,,,PRUNED
2758,2758,0.14480699598789215,2023-01-05 06:48:28.787769,2023-01-05 06:49:25.334372,0 days 00:00:56.546603,tanh,0.15000000000000002,2,0.5,0.056468281894922256,,,COMPLETE
2759,2759,0.1549026221036911,2023-01-05 06:49:25.463483,2023-01-05 06:49:34.327934,0 days 00:00:08.864451,tanh,0.05,2,0.7,0.1549026221036911,,,PRUNED
2760,2760,0.15456239879131317,2023-01-05 06:49:34.434076,2023-01-05 06:50:17.297031,0 days 00:00:42.862955,tanh,0.15000000000000002,2,0.5,0.04471518099308014,,,COMPLETE
2761,2761,0.13236172497272491,2023-01-05 06:50:17.415806,2023-01-05 06:50:26.133675,0 days 00:00:08.717869,relu,0.4,2,0.75,0.13236172497272491,,,PRUNED
2762,2762,0.14663158357143402,2023-01-05 06:50:26.411611,2023-01-05 06:51:09.410430,0 days 00:00:42.998819,sigmoid,0.25,2,0.65,0.05998579412698746,0.041594721376895905,,COMPLETE
2763,2763,0.04774673283100128,2023-01-05 06:51:09.537788,2023-01-05 06:51:45.468222,0 days 00:00:35.930434,sigmoid,0.25,2,0.65,0.06650073081254959,0.04774673283100128,,PRUNED
2764,2764,0.1616109311580658,2023-01-05 06:51:45.574287,2023-01-05 06:52:35.618700,0 days 00:00:50.044413,tanh,0.15000000000000002,2,0.5,0.0516582727432251,,,COMPLETE
2765,2765,0.06142982840538025,2023-01-05 06:52:35.746816,2023-01-05 06:53:11.577795,0 days 00:00:35.830979,tanh,0.15000000000000002,2,0.5,0.06142982840538025,,,PRUNED
2766,2766,0.059022460132837296,2023-01-05 06:53:11.683020,2023-01-05 06:53:27.477030,0 days 00:00:15.794010,tanh,0.25,2,0.55,0.0945548564195633,0.059022460132837296,,PRUNED
2767,2767,0.0971502810716629,2023-01-05 06:53:27.572468,2023-01-05 06:53:43.483815,0 days 00:00:15.911347,sigmoid,0.25,5,0.65,0.0971502810716629,,,PRUNED
2768,2768,0.1516076922416687,2023-01-05 06:53:43.600242,2023-01-05 06:53:52.251117,0 days 00:00:08.650875,relu,0.30000000000000004,2,0.65,0.1516076922416687,,,PRUNED
2769,2769,0.1275358498096466,2023-01-05 06:53:52.346234,2023-01-05 06:54:01.225422,0 days 00:00:08.879188,tanh,0.5,2,0.8500000000000001,0.1275358498096466,,,PRUNED
2770,2770,0.15418854355812073,2023-01-05 06:54:01.346868,2023-01-05 06:54:47.767876,0 days 00:00:46.421008,tanh,0.15000000000000002,2,0.5,0.044955044984817505,,,COMPLETE
2771,2771,0.06892380118370056,2023-01-05 06:54:47.895698,2023-01-05 06:55:24.276355,0 days 00:00:36.380657,tanh,0.1,4,0.5,0.06892380118370056,,,PRUNED
2772,2772,0.1477476805448532,2023-01-05 06:55:24.379773,2023-01-05 06:55:33.101786,0 days 00:00:08.722013,relu,0.45,2,0.6,0.1477476805448532,,,PRUNED
2773,2773,0.12886953353881836,2023-01-05 06:55:33.223859,2023-01-05 06:55:42.068170,0 days 00:00:08.844311,tanh,0.1,2,0.95,0.12886953353881836,,,PRUNED
2774,2774,0.17307591438293457,2023-01-05 06:55:42.182110,2023-01-05 06:55:50.959402,0 days 00:00:08.777292,relu,0.25,2,0.5,0.17307591438293457,,,PRUNED
2775,2775,0.04782981052994728,2023-01-05 06:55:51.086601,2023-01-05 06:56:27.037768,0 days 00:00:35.951167,sigmoid,0.25,2,0.65,0.07086483389139175,0.04782981052994728,,PRUNED
2776,2776,0.11539142578840256,2023-01-05 06:56:27.167697,2023-01-05 06:56:36.055462,0 days 00:00:08.887765,tanh,0.35000000000000003,2,0.7,0.11539142578840256,,,PRUNED
2777,2777,0.1281978040933609,2023-01-05 06:56:36.164998,2023-01-05 06:56:44.879636,0 days 00:00:08.714638,tanh,0.30000000000000004,2,0.6,0.1281978040933609,,,PRUNED
2778,2778,0.15475846827030182,2023-01-05 06:56:44.991322,2023-01-05 06:57:31.370698,0 days 00:00:46.379376,tanh,0.2,2,0.5,0.046986982226371765,,,COMPLETE
2779,2779,0.17361383140087128,2023-01-05 06:57:31.589435,2023-01-05 06:57:40.291649,0 days 00:00:08.702214,relu,0.4,2,0.65,0.17361383140087128,,,PRUNED
2780,2780,0.25182434916496277,2023-01-05 06:57:40.403717,2023-01-05 06:57:49.316410,0 days 00:00:08.912693,tanh,0.30000000000000004,2,0.6,0.25182434916496277,,,PRUNED
2781,2781,0.15803201496601105,2023-01-05 06:57:49.420114,2023-01-05 06:57:58.157173,0 days 00:00:08.737059,relu,0.1,2,0.8,0.15803201496601105,,,PRUNED
2782,2782,0.14668379724025726,2023-01-05 06:57:58.269008,2023-01-05 06:58:07.064394,0 days 00:00:08.795386,tanh,0.35000000000000003,2,0.55,0.14668379724025726,,,PRUNED
2783,2783,0.1624729335308075,2023-01-05 06:58:07.184986,2023-01-05 06:58:47.095560,0 days 00:00:39.910574,tanh,0.25,2,0.5,0.048295579850673676,,,COMPLETE
2784,2784,0.16306252777576447,2023-01-05 06:58:47.211582,2023-01-05 06:58:55.853021,0 days 00:00:08.641439,relu,0.05,2,0.8500000000000001,0.16306252777576447,,,PRUNED
2785,2785,0.15718062222003937,2023-01-05 06:58:55.957228,2023-01-05 06:59:04.885653,0 days 00:00:08.928425,tanh,0.15000000000000002,2,0.9,0.15718062222003937,,,PRUNED
2786,2786,0.1177762970328331,2023-01-05 06:59:05.005947,2023-01-05 06:59:14.135126,0 days 00:00:09.129179,relu,0.2,4,0.5,0.1177762970328331,,,PRUNED
2787,2787,0.15717773139476776,2023-01-05 06:59:14.247519,2023-01-05 07:00:00.762499,0 days 00:00:46.514980,tanh,0.2,2,0.5,0.04671882092952728,,,COMPLETE
2788,2788,0.10937714576721191,2023-01-05 07:00:00.907902,2023-01-05 07:00:09.813983,0 days 00:00:08.906081,tanh,0.4,2,0.7,0.10937714576721191,,,PRUNED
2789,2789,0.12177103757858276,2023-01-05 07:00:09.933283,2023-01-05 07:00:18.688300,0 days 00:00:08.755017,tanh,0.5,2,0.6,0.12177103757858276,,,PRUNED
2790,2790,0.048759471625089645,2023-01-05 07:00:18.782147,2023-01-05 07:00:55.092826,0 days 00:00:36.310679,sigmoid,0.2,2,0.65,0.07396096736192703,0.048759471625089645,,PRUNED
2791,2791,0.15003590285778046,2023-01-05 07:00:55.198037,2023-01-05 07:01:51.945593,0 days 00:00:56.747556,tanh,0.15000000000000002,2,0.55,0.0473051480948925,,,COMPLETE
2792,2792,0.15656690299510956,2023-01-05 07:01:52.082661,2023-01-05 07:02:38.331907,0 days 00:00:46.249246,tanh,0.1,2,0.55,0.04409484565258026,,,COMPLETE
2793,2793,0.15836142003536224,2023-01-05 07:02:38.432524,2023-01-05 07:02:47.342316,0 days 00:00:08.909792,relu,0.1,2,1.0,0.15836142003536224,,,PRUNED
2794,2794,0.04924001544713974,2023-01-05 07:02:47.438416,2023-01-05 07:03:23.455437,0 days 00:00:36.017021,sigmoid,0.25,2,0.7,0.067258320748806,0.04924001544713974,,PRUNED
2795,2795,0.14402151107788086,2023-01-05 07:03:23.568929,2023-01-05 07:03:32.493083,0 days 00:00:08.924154,tanh,0.45,2,0.8500000000000001,0.14402151107788086,,,PRUNED
2796,2796,0.12582069635391235,2023-01-05 07:03:32.600561,2023-01-05 07:03:41.363390,0 days 00:00:08.762829,relu,0.30000000000000004,2,0.65,0.12582069635391235,,,PRUNED
2797,2797,0.0918138325214386,2023-01-05 07:03:41.475302,2023-01-05 07:03:57.186168,0 days 00:00:15.710866,sigmoid,0.25,2,0.65,0.0918138325214386,,,PRUNED
2798,2798,0.15381892025470734,2023-01-05 07:03:57.298676,2023-01-05 07:04:40.403606,0 days 00:00:43.104930,sigmoid,0.30000000000000004,2,0.7,0.06716658920049667,0.042413823306560516,,COMPLETE
2799,2799,0.16720439493656158,2023-01-05 07:04:40.549007,2023-01-05 07:04:49.341180,0 days 00:00:08.792173,tanh,0.25,3,0.8500000000000001,0.16720439493656158,,,PRUNED
2800,2800,0.15165694057941437,2023-01-05 07:04:49.444636,2023-01-05 07:05:39.526260,0 days 00:00:50.081624,sigmoid,0.30000000000000004,2,0.7,0.07255580276250839,0.04587841033935547,,COMPLETE
2801,2801,0.08645283430814743,2023-01-05 07:05:39.654791,2023-01-05 07:05:55.210409,0 days 00:00:15.555618,relu,0.35000000000000003,2,0.6,0.10823051631450653,0.08645283430814743,,PRUNED
2802,2802,0.04738782346248627,2023-01-05 07:05:55.305649,2023-01-05 07:06:31.582565,0 days 00:00:36.276916,sigmoid,0.30000000000000004,2,0.7,0.07548201084136963,0.04738782346248627,,PRUNED
2803,2803,0.11742789298295975,2023-01-05 07:06:31.688741,2023-01-05 07:06:40.449584,0 days 00:00:08.760843,tanh,0.0,2,0.55,0.11742789298295975,,,PRUNED
2804,2804,0.04948687553405762,2023-01-05 07:06:40.561448,2023-01-05 07:07:17.003099,0 days 00:00:36.441651,relu,0.25,2,0.65,0.0728774219751358,0.04948687553405762,,PRUNED
2805,2805,0.15947793424129486,2023-01-05 07:07:17.113209,2023-01-05 07:07:25.892311,0 days 00:00:08.779102,relu,0.30000000000000004,2,0.65,0.15947793424129486,,,PRUNED
2806,2806,0.12352816760540009,2023-01-05 07:07:26.008951,2023-01-05 07:07:34.711428,0 days 00:00:08.702477,tanh,0.35000000000000003,2,0.6,0.12352816760540009,,,PRUNED
2807,2807,0.20832666754722595,2023-01-05 07:07:34.817299,2023-01-05 07:07:43.786159,0 days 00:00:08.968860,tanh,0.5,2,0.7,0.20832666754722595,,,PRUNED
2808,2808,0.134904682636261,2023-01-05 07:07:43.900937,2023-01-05 07:07:52.649273,0 days 00:00:08.748336,relu,0.4,2,0.75,0.134904682636261,,,PRUNED
2809,2809,0.11459477990865707,2023-01-05 07:07:52.756583,2023-01-05 07:08:01.625657,0 days 00:00:08.869074,tanh,0.30000000000000004,2,0.8500000000000001,0.11459477990865707,,,PRUNED
2810,2810,0.1716170459985733,2023-01-05 07:08:01.730892,2023-01-05 07:08:10.501087,0 days 00:00:08.770195,relu,0.1,2,0.6,0.1716170459985733,,,PRUNED
2811,2811,0.10565228760242462,2023-01-05 07:08:10.605205,2023-01-05 07:08:26.115435,0 days 00:00:15.510230,sigmoid,0.5,2,0.8,0.10565228760242462,,,PRUNED
2812,2812,0.04802640527486801,2023-01-05 07:08:26.218982,2023-01-05 07:09:02.504858,0 days 00:00:36.285876,sigmoid,0.35000000000000003,2,0.7,0.07425940036773682,0.04802640527486801,,PRUNED
2813,2813,0.1743478924036026,2023-01-05 07:09:02.626512,2023-01-05 07:09:11.605042,0 days 00:00:08.978530,tanh,0.35000000000000003,5,0.65,0.1743478924036026,,,PRUNED
2814,2814,0.14965590834617615,2023-01-05 07:09:11.716167,2023-01-05 07:10:01.781825,0 days 00:00:50.065658,sigmoid,0.30000000000000004,2,0.65,0.07521139830350876,0.04473689943552017,,COMPLETE
2815,2815,0.1644403487443924,2023-01-05 07:10:01.918276,2023-01-05 07:10:48.183578,0 days 00:00:46.265302,tanh,0.1,2,0.5,0.05000806599855423,,,COMPLETE
2816,2816,0.15314477682113647,2023-01-05 07:10:48.335645,2023-01-05 07:10:57.071463,0 days 00:00:08.735818,sigmoid,0.45,2,0.5,0.15314477682113647,,,PRUNED
2817,2817,0.04747886583209038,2023-01-05 07:10:57.176694,2023-01-05 07:11:33.184452,0 days 00:00:36.007758,sigmoid,0.5,2,0.75,0.06116776913404465,0.04747886583209038,,PRUNED
2818,2818,0.12434810400009155,2023-01-05 07:11:33.298046,2023-01-05 07:11:42.026326,0 days 00:00:08.728280,relu,0.5,2,0.7,0.12434810400009155,,,PRUNED
2819,2819,0.11851949989795685,2023-01-05 07:11:42.132559,2023-01-05 07:11:51.158959,0 days 00:00:09.026400,tanh,0.05,2,0.9,0.11851949989795685,,,PRUNED
2820,2820,0.15441879630088806,2023-01-05 07:11:51.274224,2023-01-05 07:12:41.012706,0 days 00:00:49.738482,tanh,0.2,2,0.6,0.04537874832749367,,,COMPLETE
2821,2821,0.12146122008562088,2023-01-05 07:12:41.162028,2023-01-05 07:12:49.954430,0 days 00:00:08.792402,relu,0.30000000000000004,2,0.6,0.12146122008562088,,,PRUNED
2822,2822,0.1361721307039261,2023-01-05 07:12:50.068012,2023-01-05 07:12:58.829440,0 days 00:00:08.761428,tanh,0.2,2,0.95,0.1361721307039261,,,PRUNED
2823,2823,0.1563825160264969,2023-01-05 07:12:58.932977,2023-01-05 07:13:48.566852,0 days 00:00:49.633875,tanh,0.2,2,0.55,0.04815145209431648,,,COMPLETE
2824,2824,0.05155061185359955,2023-01-05 07:13:48.718152,2023-01-05 07:14:24.879437,0 days 00:00:36.161285,relu,0.45,2,0.7,0.07589251548051834,0.05155061185359955,,PRUNED
2825,2825,0.11027013510465622,2023-01-05 07:14:24.985626,2023-01-05 07:14:40.433111,0 days 00:00:15.447485,sigmoid,0.25,2,0.7,0.11027013510465622,,,PRUNED
2826,2826,0.13831540942192078,2023-01-05 07:14:40.542114,2023-01-05 07:14:55.967767,0 days 00:00:15.425653,sigmoid,0.2,2,0.6,0.13831540942192078,,,PRUNED
2827,2827,0.13097530603408813,2023-01-05 07:14:56.249023,2023-01-05 07:15:11.842478,0 days 00:00:15.593455,sigmoid,0.30000000000000004,2,0.65,0.13097530603408813,,,PRUNED
2828,2828,0.07648404687643051,2023-01-05 07:15:11.946563,2023-01-05 07:15:27.316291,0 days 00:00:15.369728,relu,0.35000000000000003,2,0.9,0.07648404687643051,,,PRUNED
2829,2829,0.15620094537734985,2023-01-05 07:15:27.421526,2023-01-05 07:15:36.333258,0 days 00:00:08.911732,tanh,0.1,2,0.55,0.15620094537734985,,,PRUNED
2830,2830,0.11075962334871292,2023-01-05 07:15:36.458718,2023-01-05 07:15:45.174247,0 days 00:00:08.715529,relu,0.4,2,0.8500000000000001,0.11075962334871292,,,PRUNED
2831,2831,0.086571104824543,2023-01-05 07:15:45.279489,2023-01-05 07:16:01.071488,0 days 00:00:15.791999,sigmoid,0.5,3,0.7,0.086571104824543,,,PRUNED
2832,2832,0.061965007334947586,2023-01-05 07:16:01.179298,2023-01-05 07:16:37.085910,0 days 00:00:35.906612,tanh,0.15000000000000002,2,0.5,0.061965007334947586,,,PRUNED
2833,2833,0.07735150307416916,2023-01-05 07:16:37.192172,2023-01-05 07:16:52.842506,0 days 00:00:15.650334,sigmoid,0.25,2,0.65,0.07735150307416916,,,PRUNED
2834,2834,0.1502438485622406,2023-01-05 07:16:52.948568,2023-01-05 07:17:01.868097,0 days 00:00:08.919529,tanh,0.30000000000000004,2,0.7,0.1502438485622406,,,PRUNED
2835,2835,0.12400313466787338,2023-01-05 07:17:01.973570,2023-01-05 07:17:10.717651,0 days 00:00:08.744081,relu,0.35000000000000003,2,0.8500000000000001,0.12400313466787338,,,PRUNED
2836,2836,0.1101359948515892,2023-01-05 07:17:10.822897,2023-01-05 07:17:19.750287,0 days 00:00:08.927390,tanh,0.1,2,0.6,0.1101359948515892,,,PRUNED
2837,2837,0.1361120641231537,2023-01-05 07:17:19.861500,2023-01-05 07:17:28.591276,0 days 00:00:08.729776,relu,0.25,2,0.65,0.1361120641231537,,,PRUNED
2838,2838,0.15255622565746307,2023-01-05 07:17:28.701151,2023-01-05 07:17:44.339840,0 days 00:00:15.638689,sigmoid,0.30000000000000004,2,0.7,0.15255622565746307,,,PRUNED
2839,2839,0.13320164382457733,2023-01-05 07:17:44.460275,2023-01-05 07:17:53.222706,0 days 00:00:08.762431,tanh,0.5,2,0.8,0.13320164382457733,,,PRUNED
2840,2840,0.14323581755161285,2023-01-05 07:17:53.336592,2023-01-05 07:18:42.957429,0 days 00:00:49.620837,sigmoid,0.45,2,0.7,0.06363362073898315,0.04049355909228325,,COMPLETE
2841,2841,0.14544901251792908,2023-01-05 07:18:43.094066,2023-01-05 07:19:29.569642,0 days 00:00:46.475576,tanh,0.0,2,0.5,0.04057043418288231,,,COMPLETE
2842,2842,0.06753380596637726,2023-01-05 07:19:29.698502,2023-01-05 07:19:45.312298,0 days 00:00:15.613796,relu,0.30000000000000004,2,0.55,0.10191319137811661,0.06753380596637726,,PRUNED
2843,2843,0.18237122893333435,2023-01-05 07:19:45.408271,2023-01-05 07:19:54.313371,0 days 00:00:08.905100,tanh,0.15000000000000002,2,0.5,0.18237122893333435,,,PRUNED
2844,2844,0.1272246390581131,2023-01-05 07:19:54.418427,2023-01-05 07:20:03.204345,0 days 00:00:08.785918,tanh,0.4,2,0.6,0.1272246390581131,,,PRUNED
2845,2845,0.11982574313879013,2023-01-05 07:20:03.317234,2023-01-05 07:20:12.037051,0 days 00:00:08.719817,relu,0.35000000000000003,2,0.65,0.11982574313879013,,,PRUNED
2846,2846,0.13241630792617798,2023-01-05 07:20:12.148574,2023-01-05 07:20:21.169417,0 days 00:00:09.020843,tanh,0.05,3,0.75,0.13241630792617798,,,PRUNED
2847,2847,0.10063489526510239,2023-01-05 07:20:21.284204,2023-01-05 07:20:36.809092,0 days 00:00:15.524888,sigmoid,0.45,2,0.8,0.10063489526510239,,,PRUNED
