,number,value,datetime_start,datetime_complete,duration,params_activation,params_dropout,params_layers,params_shrink,system_attrs_completed_rung_0,system_attrs_completed_rung_1,system_attrs_completed_rung_2,state
257,257,0.1445363163948059,2023-01-04 16:06:26.179708,2023-01-04 16:06:34.761637,0 days 00:00:08.581929,tanh,0.4,2,0.8500000000000001,0.1445363163948059,,,PRUNED
258,258,0.1315097212791443,2023-01-04 16:06:34.854509,2023-01-04 16:06:43.578265,0 days 00:00:08.723756,tanh,0.45,2,0.8500000000000001,0.1315097212791443,,,PRUNED
259,259,0.14250557124614716,2023-01-04 16:06:43.670285,2023-01-04 16:07:29.969216,0 days 00:00:46.298931,tanh,0.45,2,0.8500000000000001,0.09196329116821289,0.06730163842439651,0.040781207382678986,COMPLETE
260,260,0.1489308476448059,2023-01-04 16:07:30.096451,2023-01-04 16:08:16.736754,0 days 00:00:46.640303,relu,0.15000000000000002,2,0.55,0.07069772481918335,0.04362237825989723,,COMPLETE
261,261,0.07776302099227905,2023-01-04 16:08:16.850247,2023-01-04 16:08:32.328493,0 days 00:00:15.478246,tanh,0.45,2,0.8500000000000001,0.11860305070877075,0.07776302099227905,,PRUNED
262,262,0.07913460582494736,2023-01-04 16:08:32.444519,2023-01-04 16:08:47.785074,0 days 00:00:15.340555,tanh,0.15000000000000002,2,0.7,0.07913460582494736,,,PRUNED
263,263,0.1922951489686966,2023-01-04 16:08:47.911367,2023-01-04 16:08:56.901690,0 days 00:00:08.990323,tanh,0.45,5,0.9,0.1922951489686966,,,PRUNED
264,264,0.15973497927188873,2023-01-04 16:08:57.009663,2023-01-04 16:09:05.842845,0 days 00:00:08.833182,tanh,0.25,2,0.9,0.15973497927188873,,,PRUNED
265,265,0.048892755061388016,2023-01-04 16:09:05.941864,2023-01-04 16:09:42.081061,0 days 00:00:36.139197,relu,0.15000000000000002,3,0.6,0.07296109944581985,0.048892755061388016,,PRUNED
266,266,0.1503000110387802,2023-01-04 16:09:42.172198,2023-01-04 16:09:50.963723,0 days 00:00:08.791525,tanh,0.45,3,0.8500000000000001,0.1503000110387802,,,PRUNED
267,267,0.046727634966373444,2023-01-04 16:09:51.055769,2023-01-04 16:10:26.985981,0 days 00:00:35.930212,tanh,0.45,2,1.0,0.10336220264434814,0.06622926145792007,0.046727634966373444,PRUNED
268,268,0.13622818887233734,2023-01-04 16:10:27.095063,2023-01-04 16:10:35.951990,0 days 00:00:08.856927,tanh,0.4,2,0.55,0.13622818887233734,,,PRUNED
269,269,0.13365791738033295,2023-01-04 16:10:36.060054,2023-01-04 16:10:44.618004,0 days 00:00:08.557950,tanh,0.15000000000000002,2,0.8500000000000001,0.13365791738033295,,,PRUNED
270,270,0.152339369058609,2023-01-04 16:10:44.726063,2023-01-04 16:11:27.484623,0 days 00:00:42.758560,tanh,0.30000000000000004,2,0.8500000000000001,0.11632802337408066,0.058834195137023926,0.04262783005833626,COMPLETE
271,271,0.0808509811758995,2023-01-04 16:11:27.610644,2023-01-04 16:11:43.138575,0 days 00:00:15.527931,sigmoid,0.1,2,0.6,0.0808509811758995,,,PRUNED
272,272,0.1391964852809906,2023-01-04 16:11:43.230651,2023-01-04 16:11:51.771019,0 days 00:00:08.540368,tanh,0.30000000000000004,2,0.8500000000000001,0.1391964852809906,,,PRUNED
273,273,0.20436659455299377,2023-01-04 16:11:51.863244,2023-01-04 16:12:00.420130,0 days 00:00:08.556886,tanh,0.30000000000000004,2,0.5,0.20436659455299377,,,PRUNED
274,274,0.05908235162496567,2023-01-04 16:12:00.520104,2023-01-04 16:12:36.276233,0 days 00:00:35.756129,tanh,0.15000000000000002,2,0.55,0.07417646795511246,0.05908235162496567,,PRUNED
275,275,0.04935944825410843,2023-01-04 16:12:36.410294,2023-01-04 16:13:12.931857,0 days 00:00:36.521563,relu,0.1,3,0.65,0.06178944557905197,0.04935944825410843,,PRUNED
276,276,0.0520959235727787,2023-01-04 16:13:13.057726,2023-01-04 16:13:49.278579,0 days 00:00:36.220853,relu,0.25,2,0.55,0.07231834530830383,0.0520959235727787,,PRUNED
277,277,0.048830803483724594,2023-01-04 16:13:49.404588,2023-01-04 16:14:25.384575,0 days 00:00:35.979987,relu,0.2,2,0.5,0.07171478122472763,0.048830803483724594,,PRUNED
278,278,0.13979533314704895,2023-01-04 16:14:25.501744,2023-01-04 16:14:34.208986,0 days 00:00:08.707242,tanh,0.05,2,0.8500000000000001,0.13979533314704895,,,PRUNED
279,279,0.051137715578079224,2023-01-04 16:14:34.350387,2023-01-04 16:15:10.556242,0 days 00:00:36.205855,relu,0.2,2,0.55,0.06927267462015152,0.051137715578079224,,PRUNED
280,280,0.1326327621936798,2023-01-04 16:15:10.689797,2023-01-04 16:15:19.330585,0 days 00:00:08.640788,tanh,0.30000000000000004,2,1.0,0.1326327621936798,,,PRUNED
281,281,0.07516201585531235,2023-01-04 16:15:19.431312,2023-01-04 16:15:34.837667,0 days 00:00:15.406355,relu,0.30000000000000004,2,0.8500000000000001,0.1286478489637375,0.07516201585531235,,PRUNED
282,282,0.14821891486644745,2023-01-04 16:15:34.945743,2023-01-04 16:15:50.412948,0 days 00:00:15.467205,tanh,0.25,2,0.9,0.10245067626237869,0.14821891486644745,,PRUNED
283,283,0.08202187716960907,2023-01-04 16:15:50.537297,2023-01-04 16:16:06.553968,0 days 00:00:16.016671,tanh,0.45,2,1.0,0.10398037731647491,0.08202187716960907,,PRUNED
284,284,0.14152434468269348,2023-01-04 16:16:06.680135,2023-01-04 16:16:16.702891,0 days 00:00:10.022756,tanh,0.4,2,0.8500000000000001,0.14152434468269348,,,PRUNED
285,285,0.14704401791095734,2023-01-04 16:16:16.825927,2023-01-04 16:17:03.368215,0 days 00:00:46.542288,relu,0.35000000000000003,2,0.8500000000000001,0.09604174643754959,0.055593620985746384,0.042883049696683884,COMPLETE
286,286,0.1501692533493042,2023-01-04 16:17:03.495956,2023-01-04 16:17:46.622966,0 days 00:00:43.127010,relu,0.35000000000000003,2,0.8500000000000001,0.11317793279886246,0.061801690608263016,0.04213529825210571,COMPLETE
287,287,0.08641443401575089,2023-01-04 16:17:46.771663,2023-01-04 16:18:02.552176,0 days 00:00:15.780513,relu,0.35000000000000003,2,0.8500000000000001,0.11534137278795242,0.08641443401575089,,PRUNED
288,288,0.16320540010929108,2023-01-04 16:18:02.662275,2023-01-04 16:18:11.342982,0 days 00:00:08.680707,relu,0.35000000000000003,2,0.8500000000000001,0.16320540010929108,,,PRUNED
289,289,0.08828455954790115,2023-01-04 16:18:11.435288,2023-01-04 16:18:27.283042,0 days 00:00:15.847754,relu,0.45,2,0.5,0.08828455954790115,,,PRUNED
290,290,0.17143766582012177,2023-01-04 16:18:27.417433,2023-01-04 16:18:36.099257,0 days 00:00:08.681824,relu,0.35000000000000003,2,0.8500000000000001,0.17143766582012177,,,PRUNED
291,291,0.1477915197610855,2023-01-04 16:18:36.181797,2023-01-04 16:19:21.148651,0 days 00:00:44.966854,relu,0.30000000000000004,2,0.8500000000000001,0.1051950603723526,0.06185091659426689,0.04326378181576729,COMPLETE
292,292,0.20472924411296844,2023-01-04 16:19:21.276589,2023-01-04 16:19:29.863046,0 days 00:00:08.586457,relu,0.30000000000000004,2,0.8500000000000001,0.20472924411296844,,,PRUNED
293,293,0.06949851661920547,2023-01-04 16:19:29.970680,2023-01-04 16:19:45.610456,0 days 00:00:15.639776,relu,0.30000000000000004,2,0.8500000000000001,0.11463355273008347,0.06949851661920547,,PRUNED
294,294,0.15605880320072174,2023-01-04 16:19:45.711524,2023-01-04 16:20:28.921616,0 days 00:00:43.210092,relu,0.25,2,0.6,0.06811559200286865,0.045937441289424896,,COMPLETE
295,295,0.14279817044734955,2023-01-04 16:20:29.072588,2023-01-04 16:20:37.891238,0 days 00:00:08.818650,relu,0.25,2,0.8500000000000001,0.14279817044734955,,,PRUNED
296,296,0.1346079707145691,2023-01-04 16:20:37.999279,2023-01-04 16:20:46.714171,0 days 00:00:08.714892,relu,0.30000000000000004,2,1.0,0.1346079707145691,,,PRUNED
297,297,0.05222882702946663,2023-01-04 16:20:46.814924,2023-01-04 16:21:23.079487,0 days 00:00:36.264563,tanh,0.05,2,0.55,0.07176406681537628,0.05222882702946663,,PRUNED
298,298,0.1312185674905777,2023-01-04 16:21:23.212019,2023-01-04 16:21:31.902410,0 days 00:00:08.690391,relu,0.35000000000000003,2,0.8500000000000001,0.1312185674905777,,,PRUNED
299,299,0.15057587623596191,2023-01-04 16:21:31.994011,2023-01-04 16:21:40.918313,0 days 00:00:08.924302,relu,0.35000000000000003,2,0.9,0.15057587623596191,,,PRUNED
300,300,0.0822773203253746,2023-01-04 16:21:41.009420,2023-01-04 16:21:56.575326,0 days 00:00:15.565906,tanh,0.30000000000000004,2,0.8500000000000001,0.12625859677791595,0.0822773203253746,,PRUNED
301,301,0.07312575727701187,2023-01-04 16:21:56.691330,2023-01-04 16:22:12.357492,0 days 00:00:15.666162,relu,0.35000000000000003,2,1.0,0.12743254005908966,0.07312575727701187,,PRUNED
302,302,0.046318419277668,2023-01-04 16:22:12.465064,2023-01-04 16:22:48.546746,0 days 00:00:36.081682,sigmoid,0.15000000000000002,2,0.6,0.06233857199549675,0.046318419277668,,PRUNED
303,303,0.19247235357761383,2023-01-04 16:22:48.646059,2023-01-04 16:22:57.554264,0 days 00:00:08.908205,tanh,0.45,2,0.8500000000000001,0.19247235357761383,,,PRUNED
304,304,0.08868219703435898,2023-01-04 16:22:57.655412,2023-01-04 16:23:13.069091,0 days 00:00:15.413679,relu,0.35000000000000003,2,0.5,0.08868219703435898,,,PRUNED
305,305,0.07707483321428299,2023-01-04 16:23:13.185473,2023-01-04 16:23:28.736249,0 days 00:00:15.550776,tanh,0.30000000000000004,2,0.65,0.09356577694416046,0.07707483321428299,,PRUNED
306,306,0.04649878665804863,2023-01-04 16:23:28.861349,2023-01-04 16:24:04.991055,0 days 00:00:36.129706,relu,0.35000000000000003,2,0.9,0.11665769666433334,0.0632556676864624,0.04649878665804863,PRUNED
307,307,0.09056038409471512,2023-01-04 16:24:05.116169,2023-01-04 16:24:20.997965,0 days 00:00:15.881796,tanh,0.2,3,0.55,0.09056038409471512,,,PRUNED
308,308,0.14797279238700867,2023-01-04 16:24:21.089674,2023-01-04 16:25:04.306205,0 days 00:00:43.216531,tanh,0.35000000000000003,2,0.95,0.11517000198364258,0.06459444016218185,0.04068150743842125,COMPLETE
309,309,0.19655564427375793,2023-01-04 16:25:04.450420,2023-01-04 16:25:19.985173,0 days 00:00:15.534753,tanh,0.35000000000000003,2,0.95,0.09560845792293549,0.19655564427375793,,PRUNED
310,310,0.14830084145069122,2023-01-04 16:25:20.102878,2023-01-04 16:26:06.907795,0 days 00:00:46.804917,relu,0.4,2,0.6,0.06452444940805435,0.04268588498234749,,COMPLETE
311,311,0.14228688180446625,2023-01-04 16:26:07.029013,2023-01-04 16:26:15.889317,0 days 00:00:08.860304,sigmoid,0.35000000000000003,2,1.0,0.14228688180446625,,,PRUNED
312,312,0.07591691613197327,2023-01-04 16:26:15.980364,2023-01-04 16:26:31.629757,0 days 00:00:15.649393,tanh,0.30000000000000004,2,0.95,0.1190304085612297,0.07591691613197327,,PRUNED
313,313,0.08151480555534363,2023-01-04 16:26:31.756880,2023-01-04 16:26:47.295239,0 days 00:00:15.538359,relu,0.4,2,0.6,0.08151480555534363,,,PRUNED
314,314,0.06979985535144806,2023-01-04 16:26:47.402654,2023-01-04 16:27:03.035717,0 days 00:00:15.633063,tanh,0.35000000000000003,2,0.8500000000000001,0.12612903118133545,0.06979985535144806,,PRUNED
315,315,0.08273223787546158,2023-01-04 16:27:03.161667,2023-01-04 16:27:19.042169,0 days 00:00:15.880502,tanh,0.4,2,0.95,0.11207129061222076,0.08273223787546158,,PRUNED
316,316,0.13801105320453644,2023-01-04 16:27:19.169879,2023-01-04 16:27:27.959478,0 days 00:00:08.789599,tanh,0.45,2,1.0,0.13801105320453644,,,PRUNED
317,317,0.07629988342523575,2023-01-04 16:27:28.066606,2023-01-04 16:27:43.599251,0 days 00:00:15.532645,relu,0.4,2,0.6,0.07629988342523575,,,PRUNED
318,318,0.1353694349527359,2023-01-04 16:27:43.708424,2023-01-04 16:27:52.306994,0 days 00:00:08.598570,tanh,0.35000000000000003,2,0.9,0.1353694349527359,,,PRUNED
319,319,0.170311838388443,2023-01-04 16:27:52.408212,2023-01-04 16:28:01.322978,0 days 00:00:08.914766,sigmoid,0.5,2,0.8500000000000001,0.170311838388443,,,PRUNED
320,320,0.15490496158599854,2023-01-04 16:28:01.415693,2023-01-04 16:28:10.047009,0 days 00:00:08.631316,tanh,0.30000000000000004,2,1.0,0.15490496158599854,,,PRUNED
321,321,0.14848701655864716,2023-01-04 16:28:10.139030,2023-01-04 16:28:53.411878,0 days 00:00:43.272848,relu,0.45,2,0.8500000000000001,0.09681342542171478,0.06140165776014328,0.042957283556461334,COMPLETE
322,322,0.07530869543552399,2023-01-04 16:28:53.543735,2023-01-04 16:29:09.209514,0 days 00:00:15.665779,relu,0.4,2,0.65,0.07530869543552399,,,PRUNED
323,323,0.13281723856925964,2023-01-04 16:29:09.310610,2023-01-04 16:29:18.092045,0 days 00:00:08.781435,relu,0.4,2,0.8500000000000001,0.13281723856925964,,,PRUNED
324,324,0.08028597384691238,2023-01-04 16:29:18.194038,2023-01-04 16:29:33.674333,0 days 00:00:15.480295,relu,0.45,2,0.6,0.08028597384691238,,,PRUNED
325,325,0.04812433198094368,2023-01-04 16:29:33.891945,2023-01-04 16:30:10.538211,0 days 00:00:36.646266,relu,0.1,2,0.55,0.07002978771924973,0.04812433198094368,,PRUNED
326,326,0.13077783584594727,2023-01-04 16:30:10.646587,2023-01-04 16:30:19.670645,0 days 00:00:09.024058,relu,0.45,2,0.8500000000000001,0.13077783584594727,,,PRUNED
327,327,0.10077042877674103,2023-01-04 16:30:19.771776,2023-01-04 16:30:35.244679,0 days 00:00:15.472903,sigmoid,0.4,2,0.6,0.10077042877674103,,,PRUNED
328,328,0.12993428111076355,2023-01-04 16:30:35.353059,2023-01-04 16:30:44.052356,0 days 00:00:08.699297,relu,0.45,2,0.8500000000000001,0.12993428111076355,,,PRUNED
329,329,0.14755389094352722,2023-01-04 16:30:44.162648,2023-01-04 16:31:27.186603,0 days 00:00:43.023955,relu,0.45,2,0.8500000000000001,0.09544141590595245,0.05740007385611534,0.0397971048951149,COMPLETE
330,330,0.07096011191606522,2023-01-04 16:31:27.321213,2023-01-04 16:31:43.038986,0 days 00:00:15.717773,relu,0.45,2,0.8500000000000001,0.11857497692108154,0.07096011191606522,,PRUNED
331,331,0.07958421856164932,2023-01-04 16:31:43.133095,2023-01-04 16:31:58.554471,0 days 00:00:15.421376,tanh,0.05,2,0.65,0.07958421856164932,,,PRUNED
332,332,0.07467734813690186,2023-01-04 16:31:58.663503,2023-01-04 16:32:14.328166,0 days 00:00:15.664663,relu,0.35000000000000003,2,0.55,0.07467734813690186,,,PRUNED
333,333,0.044324785470962524,2023-01-04 16:32:14.431178,2023-01-04 16:32:50.434577,0 days 00:00:36.003399,relu,0.45,2,0.8500000000000001,0.10801862925291061,0.06244618818163872,0.044324785470962524,PRUNED
334,334,0.17340195178985596,2023-01-04 16:32:50.542613,2023-01-04 16:32:59.426006,0 days 00:00:08.883393,relu,0.35000000000000003,2,0.8500000000000001,0.17340195178985596,,,PRUNED
335,335,0.08305363357067108,2023-01-04 16:32:59.526160,2023-01-04 16:33:15.207577,0 days 00:00:15.681417,relu,0.2,3,0.5,0.08305363357067108,,,PRUNED
336,336,0.08410340547561646,2023-01-04 16:33:15.317629,2023-01-04 16:33:30.781517,0 days 00:00:15.463888,tanh,0.25,2,0.6,0.08410340547561646,,,PRUNED
337,337,0.07479953020811081,2023-01-04 16:33:30.874064,2023-01-04 16:33:46.244602,0 days 00:00:15.370538,tanh,0.05,2,0.7,0.07479953020811081,,,PRUNED
338,338,0.1375533938407898,2023-01-04 16:33:46.346956,2023-01-04 16:33:55.146231,0 days 00:00:08.799275,relu,0.45,2,0.8500000000000001,0.1375533938407898,,,PRUNED
339,339,0.15849162638187408,2023-01-04 16:33:55.248385,2023-01-04 16:34:03.912514,0 days 00:00:08.664129,relu,0.5,2,0.8500000000000001,0.15849162638187408,,,PRUNED
340,340,0.11293961852788925,2023-01-04 16:34:04.014586,2023-01-04 16:34:19.369412,0 days 00:00:15.354826,tanh,0.1,2,0.75,0.11293961852788925,,,PRUNED
341,341,0.12826497852802277,2023-01-04 16:34:19.466065,2023-01-04 16:34:28.035356,0 days 00:00:08.569291,relu,0.30000000000000004,2,1.0,0.12826497852802277,,,PRUNED
342,342,0.21698105335235596,2023-01-04 16:34:28.148371,2023-01-04 16:34:36.859727,0 days 00:00:08.711356,sigmoid,0.35000000000000003,2,0.8500000000000001,0.21698105335235596,,,PRUNED
343,343,0.050538983196020126,2023-01-04 16:34:36.962738,2023-01-04 16:35:12.940349,0 days 00:00:35.977611,tanh,0.15000000000000002,2,0.7,0.06992851942777634,0.050538983196020126,,PRUNED
344,344,0.09693996608257294,2023-01-04 16:35:13.035016,2023-01-04 16:35:28.463663,0 days 00:00:15.428647,tanh,0.1,2,0.75,0.09693996608257294,,,PRUNED
345,345,0.15610861778259277,2023-01-04 16:35:28.558717,2023-01-04 16:36:11.583388,0 days 00:00:43.024671,sigmoid,0.1,2,0.65,0.06497395783662796,0.04562583938241005,,COMPLETE
346,346,0.17832505702972412,2023-01-04 16:36:11.685381,2023-01-04 16:36:20.451973,0 days 00:00:08.766592,sigmoid,0.45,2,0.7,0.17832505702972412,,,PRUNED
347,347,0.12751805782318115,2023-01-04 16:36:20.547101,2023-01-04 16:36:29.101322,0 days 00:00:08.554221,tanh,0.45,2,0.9,0.12751805782318115,,,PRUNED
348,348,0.13394397497177124,2023-01-04 16:36:29.179404,2023-01-04 16:36:37.809036,0 days 00:00:08.629632,relu,0.45,2,0.8500000000000001,0.13394397497177124,,,PRUNED
349,349,0.17026633024215698,2023-01-04 16:36:37.906047,2023-01-04 16:36:46.591603,0 days 00:00:08.685556,tanh,0.45,2,0.95,0.17026633024215698,,,PRUNED
350,350,0.20328548550605774,2023-01-04 16:36:46.677948,2023-01-04 16:36:55.566422,0 days 00:00:08.888474,sigmoid,0.5,2,1.0,0.20328548550605774,,,PRUNED
351,351,0.13001517951488495,2023-01-04 16:36:55.653252,2023-01-04 16:37:04.279832,0 days 00:00:08.626580,tanh,0.35000000000000003,2,0.8500000000000001,0.13001517951488495,,,PRUNED
352,352,0.13572609424591064,2023-01-04 16:37:04.375959,2023-01-04 16:37:13.064741,0 days 00:00:08.688782,relu,0.45,2,0.8500000000000001,0.13572609424591064,,,PRUNED
353,353,0.1711215078830719,2023-01-04 16:37:13.149934,2023-01-04 16:37:21.822275,0 days 00:00:08.672341,sigmoid,0.4,2,0.9,0.1711215078830719,,,PRUNED
354,354,0.07866401970386505,2023-01-04 16:37:21.900820,2023-01-04 16:37:37.779672,0 days 00:00:15.878852,tanh,0.30000000000000004,2,0.8500000000000001,0.11030181497335434,0.07866401970386505,,PRUNED
355,355,0.14583206176757812,2023-01-04 16:37:37.874065,2023-01-04 16:37:46.844983,0 days 00:00:08.970918,sigmoid,0.25,3,0.55,0.14583206176757812,,,PRUNED
356,356,0.1460815817117691,2023-01-04 16:37:46.932236,2023-01-04 16:37:55.803462,0 days 00:00:08.871226,relu,0.45,4,1.0,0.1460815817117691,,,PRUNED
357,357,0.28881144523620605,2023-01-04 16:37:55.890418,2023-01-04 16:38:05.111152,0 days 00:00:09.220734,relu,0.2,6,0.8,0.28881144523620605,,,PRUNED
358,358,0.16664183139801025,2023-01-04 16:38:05.206159,2023-01-04 16:38:13.951669,0 days 00:00:08.745510,relu,0.0,2,0.8500000000000001,0.16664183139801025,,,PRUNED
359,359,0.17832377552986145,2023-01-04 16:38:14.047339,2023-01-04 16:38:22.759332,0 days 00:00:08.711993,relu,0.30000000000000004,2,0.8,0.17832377552986145,,,PRUNED
360,360,0.09637986123561859,2023-01-04 16:38:22.845666,2023-01-04 16:38:38.424811,0 days 00:00:15.579145,tanh,0.15000000000000002,2,0.6,0.09637986123561859,,,PRUNED
361,361,0.18479813635349274,2023-01-04 16:38:38.511147,2023-01-04 16:38:54.323619,0 days 00:00:15.812472,relu,0.05,2,0.6,0.18479813635349274,,,PRUNED
362,362,0.04830445349216461,2023-01-04 16:38:54.409951,2023-01-04 16:39:30.787360,0 days 00:00:36.377409,relu,0.1,2,0.8500000000000001,0.11532597988843918,0.06315768510103226,0.04830445349216461,PRUNED
363,363,0.36340978741645813,2023-01-04 16:39:30.882190,2023-01-04 16:39:40.178280,0 days 00:00:09.296090,tanh,0.35000000000000003,7,0.8500000000000001,0.36340978741645813,,,PRUNED
364,364,0.1174083948135376,2023-01-04 16:39:40.264271,2023-01-04 16:39:55.743975,0 days 00:00:15.479704,tanh,0.4,2,0.55,0.1174083948135376,,,PRUNED
365,365,0.26098906993865967,2023-01-04 16:39:55.839911,2023-01-04 16:40:05.184930,0 days 00:00:09.345019,sigmoid,0.45,6,0.5,0.26098906993865967,,,PRUNED
366,366,0.14877955615520477,2023-01-04 16:40:05.272253,2023-01-04 16:40:14.034256,0 days 00:00:08.762003,tanh,0.35000000000000003,2,0.9,0.14877955615520477,,,PRUNED
367,367,0.07565269619226456,2023-01-04 16:40:14.120587,2023-01-04 16:40:29.640317,0 days 00:00:15.519730,relu,0.0,2,0.5,0.07565269619226456,,,PRUNED
368,368,0.13962531089782715,2023-01-04 16:40:29.738076,2023-01-04 16:40:38.532067,0 days 00:00:08.793991,relu,0.5,2,0.6,0.13962531089782715,,,PRUNED
369,369,0.056667398661375046,2023-01-04 16:40:38.628072,2023-01-04 16:41:15.304627,0 days 00:00:36.676555,sigmoid,0.45,4,0.55,0.07291896641254425,0.056667398661375046,,PRUNED
370,370,0.07717806845903397,2023-01-04 16:41:15.401306,2023-01-04 16:41:31.070343,0 days 00:00:15.669037,sigmoid,0.35000000000000003,2,0.8500000000000001,0.10384690016508102,0.07717806845903397,,PRUNED
371,371,0.15032397210597992,2023-01-04 16:41:31.166523,2023-01-04 16:42:14.291276,0 days 00:00:43.124753,tanh,0.45,2,1.0,0.10607156902551651,0.06374851614236832,0.04321923851966858,COMPLETE
372,372,0.1581743210554123,2023-01-04 16:42:14.399513,2023-01-04 16:42:23.191165,0 days 00:00:08.791652,tanh,0.45,2,1.0,0.1581743210554123,,,PRUNED
373,373,0.15622831881046295,2023-01-04 16:42:23.304509,2023-01-04 16:42:39.191363,0 days 00:00:15.886854,relu,0.25,5,0.55,0.15622831881046295,,,PRUNED
374,374,0.1542808562517166,2023-01-04 16:42:39.276278,2023-01-04 16:42:47.914130,0 days 00:00:08.637852,tanh,0.45,2,1.0,0.1542808562517166,,,PRUNED
375,375,0.15003740787506104,2023-01-04 16:42:48.001630,2023-01-04 16:42:56.597208,0 days 00:00:08.595578,tanh,0.45,2,1.0,0.15003740787506104,,,PRUNED
376,376,0.07259141653776169,2023-01-04 16:42:56.683305,2023-01-04 16:43:12.487687,0 days 00:00:15.804382,tanh,0.45,2,1.0,0.11212959885597229,0.07259141653776169,,PRUNED
377,377,0.12021789699792862,2023-01-04 16:43:12.591710,2023-01-04 16:43:28.269099,0 days 00:00:15.677389,relu,0.25,3,0.55,0.12021789699792862,,,PRUNED
378,378,0.13493302464485168,2023-01-04 16:43:28.364242,2023-01-04 16:43:37.018638,0 days 00:00:08.654396,tanh,0.4,2,0.8500000000000001,0.13493302464485168,,,PRUNED
379,379,0.1075875461101532,2023-01-04 16:43:37.122915,2023-01-04 16:43:52.809734,0 days 00:00:15.686819,relu,0.30000000000000004,3,0.6,0.1075875461101532,,,PRUNED
380,380,0.10095782577991486,2023-01-04 16:43:52.895961,2023-01-04 16:44:08.908178,0 days 00:00:16.012217,relu,0.2,4,0.9,0.10095782577991486,,,PRUNED
381,381,0.12932343780994415,2023-01-04 16:44:09.002649,2023-01-04 16:44:17.624181,0 days 00:00:08.621532,relu,0.45,2,1.0,0.12932343780994415,,,PRUNED
382,382,0.15507552027702332,2023-01-04 16:44:17.710514,2023-01-04 16:44:26.382267,0 days 00:00:08.671753,tanh,0.1,2,0.95,0.15507552027702332,,,PRUNED
383,383,0.0793435350060463,2023-01-04 16:44:26.478315,2023-01-04 16:44:42.038895,0 days 00:00:15.560580,relu,0.25,2,0.5,0.0793435350060463,,,PRUNED
