,number,value,datetime_start,datetime_complete,duration,params_activation,params_dropout,params_layers,params_shrink,state
0,0,0.6443544626235962,2026-03-13 22:37:00.109258,2026-03-13 22:37:19.478880,0 days 00:00:19.369622,sigmoid,0.5,7,0.7,COMPLETE
1,1,0.6473020911216736,2026-03-13 22:37:19.618866,2026-03-13 22:37:32.903285,0 days 00:00:13.284419,tanh,0.0,6,0.55,COMPLETE
2,2,1.5485329627990723,2026-03-13 22:37:33.037161,2026-03-13 22:37:46.757349,0 days 00:00:13.720188,relu,0.15000000000000002,7,0.8,COMPLETE
3,3,0.6457651853561401,2026-03-13 22:37:46.914985,2026-03-13 22:38:00.607760,0 days 00:00:13.692775,sigmoid,0.35000000000000003,5,0.7,COMPLETE
4,4,0.6478301286697388,2026-03-13 22:38:00.774889,2026-03-13 22:38:13.517880,0 days 00:00:12.742991,sigmoid,0.30000000000000004,2,0.95,COMPLETE
5,5,0.6570495367050171,2026-03-13 22:38:13.642329,2026-03-13 22:38:27.722153,0 days 00:00:14.079824,tanh,0.15000000000000002,8,0.65,COMPLETE
6,6,0.64570552110672,2026-03-13 22:38:27.857038,2026-03-13 22:38:41.399330,0 days 00:00:13.542292,sigmoid,0.4,6,0.7,COMPLETE
7,7,1.682591199874878,2026-03-13 22:38:41.522995,2026-03-13 22:38:54.884881,0 days 00:00:13.361886,relu,0.30000000000000004,5,0.7,COMPLETE
8,8,0.7624192237854004,2026-03-13 22:38:55.026485,2026-03-13 22:39:08.713177,0 days 00:00:13.686692,tanh,0.30000000000000004,7,0.8,COMPLETE
9,9,0.6419854760169983,2026-03-13 22:39:08.859077,2026-03-13 22:39:22.393486,0 days 00:00:13.534409,sigmoid,0.1,6,0.5,COMPLETE
10,10,0.6422950029373169,2026-03-13 22:39:22.519535,2026-03-13 22:39:35.237569,0 days 00:00:12.718034,sigmoid,0.0,3,0.5,COMPLETE
11,11,0.6433053016662598,2026-03-13 22:39:35.380643,2026-03-13 22:39:47.939221,0 days 00:00:12.558578,sigmoid,0.0,3,0.5,COMPLETE
12,12,0.6445583701133728,2026-03-13 22:39:48.086839,2026-03-13 22:40:00.979466,0 days 00:00:12.892627,sigmoid,0.1,4,0.55,COMPLETE
13,13,0.4866865575313568,2026-03-13 22:40:01.106488,2026-03-13 22:40:14.103565,0 days 00:00:12.997077,sigmoid,0.1,2,0.5,COMPLETE
14,14,0.5023279190063477,2026-03-13 22:40:14.277164,2026-03-13 22:40:27.192983,0 days 00:00:12.915819,sigmoid,0.1,2,0.6,COMPLETE
15,15,0.4712786078453064,2026-03-13 22:40:27.335333,2026-03-13 22:40:39.992995,0 days 00:00:12.657662,relu,0.2,2,0.6,COMPLETE
16,16,0.49166738986968994,2026-03-13 22:40:40.134017,2026-03-13 22:40:53.160389,0 days 00:00:13.026372,relu,0.2,3,0.6,COMPLETE
17,17,0.4712828993797302,2026-03-13 22:40:53.300904,2026-03-13 22:41:06.058788,0 days 00:00:12.757884,relu,0.2,2,1.0,COMPLETE
18,18,0.8081943988800049,2026-03-13 22:41:06.190888,2026-03-13 22:41:19.285777,0 days 00:00:13.094889,relu,0.2,4,1.0,COMPLETE
19,19,0.7615535259246826,2026-03-13 22:41:19.416290,2026-03-13 22:41:32.562061,0 days 00:00:13.145771,relu,0.25,4,0.9,COMPLETE
20,20,0.6500228643417358,2026-03-13 22:41:32.714584,2026-03-13 22:41:45.473479,0 days 00:00:12.758895,relu,0.45,3,0.8,COMPLETE
21,21,0.478887677192688,2026-03-13 22:41:45.591247,2026-03-13 22:41:58.178452,0 days 00:00:12.587205,relu,0.2,2,0.9,COMPLETE
22,22,0.4780195653438568,2026-03-13 22:41:58.295381,2026-03-13 22:42:10.866451,0 days 00:00:12.571070,relu,0.2,2,0.9,COMPLETE
23,23,0.48929569125175476,2026-03-13 22:42:10.998352,2026-03-13 22:42:23.791576,0 days 00:00:12.793224,relu,0.25,2,1.0,COMPLETE
24,24,0.5674348473548889,2026-03-13 22:42:23.906596,2026-03-13 22:42:36.679688,0 days 00:00:12.773092,relu,0.25,3,0.8500000000000001,COMPLETE
25,25,0.49317044019699097,2026-03-13 22:42:36.818872,2026-03-13 22:42:49.314297,0 days 00:00:12.495425,relu,0.15000000000000002,2,0.95,COMPLETE
26,26,0.6998814940452576,2026-03-13 22:42:49.469819,2026-03-13 22:43:02.225017,0 days 00:00:12.755198,relu,0.35000000000000003,4,0.95,COMPLETE
27,27,0.46193090081214905,2026-03-13 22:43:02.378775,2026-03-13 22:43:15.286542,0 days 00:00:12.907767,relu,0.05,3,0.9,COMPLETE
28,28,0.4676358699798584,2026-03-13 22:43:15.418360,2026-03-13 22:43:28.373456,0 days 00:00:12.955096,relu,0.05,3,1.0,COMPLETE
29,29,0.45129072666168213,2026-03-13 22:43:28.509518,2026-03-13 22:43:41.281760,0 days 00:00:12.772242,tanh,0.5,3,0.8500000000000001,COMPLETE
30,30,0.7724031209945679,2026-03-13 22:43:41.402798,2026-03-13 22:43:54.607527,0 days 00:00:13.204729,tanh,0.5,4,0.8500000000000001,COMPLETE
31,31,0.4791286587715149,2026-03-13 22:43:54.740035,2026-03-13 22:44:07.396482,0 days 00:00:12.656447,tanh,0.05,3,0.75,COMPLETE
32,32,0.4347333014011383,2026-03-13 22:44:07.511999,2026-03-13 22:44:20.481170,0 days 00:00:12.969171,tanh,0.05,3,0.8500000000000001,COMPLETE
33,33,0.504808247089386,2026-03-13 22:44:20.616966,2026-03-13 22:44:33.330490,0 days 00:00:12.713524,tanh,0.05,3,0.8500000000000001,COMPLETE
34,34,0.4296170771121979,2026-03-13 22:44:33.463519,2026-03-13 22:44:46.406715,0 days 00:00:12.943196,tanh,0.05,4,0.75,COMPLETE
35,35,0.45872586965560913,2026-03-13 22:44:46.627183,2026-03-13 22:44:59.461644,0 days 00:00:12.834461,tanh,0.0,4,0.75,COMPLETE
36,36,0.4243256449699402,2026-03-13 22:44:59.589279,2026-03-13 22:45:12.496772,0 days 00:00:12.907493,tanh,0.0,5,0.75,COMPLETE
37,37,0.6566115617752075,2026-03-13 22:45:12.626330,2026-03-13 22:45:26.354177,0 days 00:00:13.727847,tanh,0.05,5,0.75,COMPLETE
38,38,0.8430609107017517,2026-03-13 22:45:26.476354,2026-03-13 22:45:39.674548,0 days 00:00:13.198194,tanh,0.5,5,0.8,COMPLETE
39,39,0.6439914703369141,2026-03-13 22:45:39.800815,2026-03-13 22:45:52.828886,0 days 00:00:13.028071,tanh,0.0,5,0.65,COMPLETE
40,40,0.8803203105926514,2026-03-13 22:45:52.956649,2026-03-13 22:46:06.282082,0 days 00:00:13.325433,tanh,0.4,6,0.8,COMPLETE
41,41,0.4638356864452362,2026-03-13 22:46:06.425533,2026-03-13 22:46:19.445018,0 days 00:00:13.019485,tanh,0.0,4,0.75,COMPLETE
42,42,0.4307090640068054,2026-03-13 22:46:19.590484,2026-03-13 22:46:32.420119,0 days 00:00:12.829635,tanh,0.0,4,0.7,COMPLETE
43,43,0.6924698948860168,2026-03-13 22:46:32.549911,2026-03-13 22:46:45.945261,0 days 00:00:13.395350,tanh,0.05,5,0.7,COMPLETE
44,44,0.6580350995063782,2026-03-13 22:46:46.076636,2026-03-13 22:46:59.060060,0 days 00:00:12.983424,tanh,0.0,5,0.65,COMPLETE
45,45,0.42800045013427734,2026-03-13 22:46:59.215046,2026-03-13 22:47:12.268269,0 days 00:00:13.053223,tanh,0.15000000000000002,4,0.7,COMPLETE
46,46,0.6504541635513306,2026-03-13 22:47:12.399823,2026-03-13 22:47:26.326303,0 days 00:00:13.926480,tanh,0.15000000000000002,8,0.65,COMPLETE
47,47,0.4620707035064697,2026-03-13 22:47:26.498521,2026-03-13 22:47:39.504224,0 days 00:00:13.005703,tanh,0.1,4,0.7,COMPLETE
48,48,0.6520775556564331,2026-03-13 22:47:39.659610,2026-03-13 22:47:53.249260,0 days 00:00:13.589650,tanh,0.1,6,0.7,COMPLETE
49,49,0.44638681411743164,2026-03-13 22:47:53.398450,2026-03-13 22:48:06.482061,0 days 00:00:13.083611,tanh,0.0,4,0.7,COMPLETE
50,50,0.6770876049995422,2026-03-13 22:48:06.619881,2026-03-13 22:48:20.958895,0 days 00:00:14.339014,tanh,0.15000000000000002,5,0.8,COMPLETE
51,51,0.437485009431839,2026-03-13 22:48:21.111847,2026-03-13 22:48:34.944192,0 days 00:00:13.832345,tanh,0.0,4,0.7,COMPLETE
52,52,0.6444467902183533,2026-03-13 22:48:35.108509,2026-03-13 22:48:50.189825,0 days 00:00:15.081316,tanh,0.05,7,0.75,COMPLETE
53,53,0.42098352313041687,2026-03-13 22:48:50.338882,2026-03-13 22:49:04.108365,0 days 00:00:13.769483,tanh,0.0,4,0.65,COMPLETE
54,54,0.6438834071159363,2026-03-13 22:49:04.257908,2026-03-13 22:49:18.828075,0 days 00:00:14.570167,tanh,0.1,5,0.65,COMPLETE
55,55,0.44054529070854187,2026-03-13 22:49:18.993108,2026-03-13 22:49:32.806175,0 days 00:00:13.813067,tanh,0.05,4,0.6,COMPLETE
56,56,0.4385121464729309,2026-03-13 22:49:32.965936,2026-03-13 22:49:46.445962,0 days 00:00:13.480026,tanh,0.0,4,0.55,COMPLETE
57,57,0.6413677930831909,2026-03-13 22:49:46.637998,2026-03-13 22:50:00.328391,0 days 00:00:13.690393,tanh,0.0,5,0.65,COMPLETE
58,58,0.6478774547576904,2026-03-13 22:50:00.490072,2026-03-13 22:50:14.597442,0 days 00:00:14.107370,sigmoid,0.1,4,0.7,COMPLETE
59,59,0.6423611640930176,2026-03-13 22:50:14.754518,2026-03-13 22:50:29.312274,0 days 00:00:14.557756,tanh,0.05,6,0.75,COMPLETE
60,60,0.46844786405563354,2026-03-13 22:50:29.466787,2026-03-13 22:50:43.306161,0 days 00:00:13.839374,tanh,0.15000000000000002,4,0.8,COMPLETE
61,61,0.46906447410583496,2026-03-13 22:50:43.465735,2026-03-13 22:50:57.060371,0 days 00:00:13.594636,tanh,0.0,4,0.7,COMPLETE
62,62,0.4351433217525482,2026-03-13 22:50:57.218471,2026-03-13 22:51:11.330870,0 days 00:00:14.112399,tanh,0.0,4,0.7,COMPLETE
63,63,0.4487784802913666,2026-03-13 22:51:11.487389,2026-03-13 22:51:25.179882,0 days 00:00:13.692493,tanh,0.05,3,0.75,COMPLETE
64,64,0.4229793846607208,2026-03-13 22:51:25.332406,2026-03-13 22:51:38.879389,0 days 00:00:13.546983,tanh,0.0,3,0.6,COMPLETE
65,65,0.5234400033950806,2026-03-13 22:51:39.030918,2026-03-13 22:51:52.730920,0 days 00:00:13.700002,tanh,0.1,3,0.6,COMPLETE
66,66,0.6425238847732544,2026-03-13 22:51:52.887699,2026-03-13 22:52:06.692395,0 days 00:00:13.804696,sigmoid,0.05,3,0.55,COMPLETE
67,67,0.4615105986595154,2026-03-13 22:52:06.862909,2026-03-13 22:52:20.504387,0 days 00:00:13.641478,tanh,0.0,3,0.6,COMPLETE
68,68,0.4727967083454132,2026-03-13 22:52:20.643388,2026-03-13 22:52:34.371350,0 days 00:00:13.727962,tanh,0.05,3,0.65,COMPLETE
69,69,0.44370847940444946,2026-03-13 22:52:34.493397,2026-03-13 22:52:47.891604,0 days 00:00:13.398207,tanh,0.0,4,0.65,COMPLETE
70,70,0.48042774200439453,2026-03-13 22:52:48.030433,2026-03-13 22:53:01.707842,0 days 00:00:13.677409,tanh,0.1,3,0.75,COMPLETE
71,71,0.4766254723072052,2026-03-13 22:53:01.905217,2026-03-13 22:53:15.491376,0 days 00:00:13.586159,tanh,0.0,4,0.75,COMPLETE
72,72,0.4617266058921814,2026-03-13 22:53:15.640409,2026-03-13 22:53:29.300399,0 days 00:00:13.659990,tanh,0.0,4,0.7,COMPLETE
73,73,0.6504691243171692,2026-03-13 22:53:29.459920,2026-03-13 22:53:43.378893,0 days 00:00:13.918973,tanh,0.05,5,0.7,COMPLETE
74,74,0.4659184515476227,2026-03-13 22:53:43.519418,2026-03-13 22:53:56.952091,0 days 00:00:13.432673,tanh,0.0,4,0.6,COMPLETE
75,75,0.5098630785942078,2026-03-13 22:53:57.087610,2026-03-13 22:54:10.702958,0 days 00:00:13.615348,tanh,0.05,3,0.65,COMPLETE
76,76,0.6429184675216675,2026-03-13 22:54:10.850003,2026-03-13 22:54:24.598471,0 days 00:00:13.748468,sigmoid,0.0,4,0.75,COMPLETE
77,77,0.75333172082901,2026-03-13 22:54:24.750529,2026-03-13 22:54:38.888225,0 days 00:00:14.137696,tanh,0.30000000000000004,5,0.65,COMPLETE
78,78,0.46975788474082947,2026-03-13 22:54:39.048382,2026-03-13 22:54:52.375660,0 days 00:00:13.327278,tanh,0.05,2,0.8,COMPLETE
79,79,0.43325746059417725,2026-03-13 22:54:52.503177,2026-03-13 22:55:05.981173,0 days 00:00:13.477996,tanh,0.0,4,0.6,COMPLETE
80,80,0.4202463924884796,2026-03-13 22:55:06.149712,2026-03-13 22:55:19.495507,0 days 00:00:13.345795,tanh,0.0,3,0.6,COMPLETE
81,81,0.42364779114723206,2026-03-13 22:55:19.722072,2026-03-13 22:55:33.022265,0 days 00:00:13.300193,tanh,0.0,3,0.55,COMPLETE
82,82,0.4251014292240143,2026-03-13 22:55:33.188874,2026-03-13 22:55:46.566208,0 days 00:00:13.377334,tanh,0.0,3,0.55,COMPLETE
83,83,0.43613532185554504,2026-03-13 22:55:46.728111,2026-03-13 22:56:00.113720,0 days 00:00:13.385609,tanh,0.0,3,0.5,COMPLETE
84,84,0.4742724597454071,2026-03-13 22:56:00.270402,2026-03-13 22:56:13.352578,0 days 00:00:13.082176,tanh,0.0,2,0.55,COMPLETE
85,85,0.4791181683540344,2026-03-13 22:56:13.501603,2026-03-13 22:56:26.997478,0 days 00:00:13.495875,tanh,0.0,3,0.55,COMPLETE
86,86,0.4678981900215149,2026-03-13 22:56:27.160472,2026-03-13 22:56:40.760353,0 days 00:00:13.599881,tanh,0.05,3,0.5,COMPLETE
87,87,0.44979628920555115,2026-03-13 22:56:40.902882,2026-03-13 22:56:54.380115,0 days 00:00:13.477233,tanh,0.0,2,0.6,COMPLETE
88,88,0.4690130650997162,2026-03-13 22:56:54.527121,2026-03-13 22:57:07.882576,0 days 00:00:13.355455,tanh,0.0,3,0.55,COMPLETE
89,89,0.45764240622520447,2026-03-13 22:57:08.035121,2026-03-13 22:57:21.561263,0 days 00:00:13.526142,tanh,0.05,3,0.55,COMPLETE
90,90,0.6429932713508606,2026-03-13 22:57:21.688302,2026-03-13 22:57:35.717391,0 days 00:00:14.029089,sigmoid,0.0,5,0.6,COMPLETE
91,91,0.48145419359207153,2026-03-13 22:57:35.843855,2026-03-13 22:57:49.628583,0 days 00:00:13.784728,tanh,0.0,4,0.6,COMPLETE
92,92,0.4393251836299896,2026-03-13 22:57:49.908096,2026-03-13 22:58:03.392122,0 days 00:00:13.484026,tanh,0.0,4,0.55,COMPLETE
93,93,0.4579274654388428,2026-03-13 22:58:03.524654,2026-03-13 22:58:17.192242,0 days 00:00:13.667588,tanh,0.05,4,0.6,COMPLETE
94,94,0.43743956089019775,2026-03-13 22:58:17.332577,2026-03-13 22:58:30.700452,0 days 00:00:13.367875,tanh,0.0,3,0.6,COMPLETE
95,95,0.4401225745677948,2026-03-13 22:58:30.820985,2026-03-13 22:58:44.466669,0 days 00:00:13.645684,tanh,0.0,4,0.55,COMPLETE
96,96,0.4686247408390045,2026-03-13 22:58:44.623211,2026-03-13 22:58:58.234928,0 days 00:00:13.611717,tanh,0.05,3,0.65,COMPLETE
97,97,0.4958515763282776,2026-03-13 22:58:58.375949,2026-03-13 22:59:12.035164,0 days 00:00:13.659215,tanh,0.0,5,0.5,COMPLETE
98,98,0.6480656266212463,2026-03-13 22:59:12.175260,2026-03-13 22:59:26.755661,0 days 00:00:14.580401,tanh,0.05,6,0.6,COMPLETE
99,99,0.5532503724098206,2026-03-13 22:59:26.897331,2026-03-13 22:59:40.152613,0 days 00:00:13.255282,tanh,0.0,2,0.55,COMPLETE
100,100,0.4387933313846588,2026-03-13 22:59:40.310395,2026-03-13 22:59:54.628588,0 days 00:00:14.318193,tanh,0.1,4,0.65,COMPLETE
101,101,0.4606799781322479,2026-03-13 22:59:54.774585,2026-03-13 23:00:08.277008,0 days 00:00:13.502423,tanh,0.05,3,0.75,COMPLETE
102,102,0.4609551429748535,2026-03-13 23:00:08.429035,2026-03-13 23:00:21.817291,0 days 00:00:13.388256,tanh,0.0,3,0.8,COMPLETE
103,103,0.45839717984199524,2026-03-13 23:00:21.975410,2026-03-13 23:00:35.556043,0 days 00:00:13.580633,tanh,0.05,3,0.8500000000000001,COMPLETE
104,104,0.6465233564376831,2026-03-13 23:00:35.707025,2026-03-13 23:00:49.994003,0 days 00:00:14.286978,tanh,0.0,8,0.7,COMPLETE
105,105,0.5437865257263184,2026-03-13 23:00:50.151571,2026-03-13 23:01:03.732293,0 days 00:00:13.580722,tanh,0.15000000000000002,4,0.6,COMPLETE
106,106,0.5960216522216797,2026-03-13 23:01:03.885804,2026-03-13 23:01:17.382199,0 days 00:00:13.496395,relu,0.2,3,0.55,COMPLETE
107,107,0.4864109754562378,2026-03-13 23:01:17.542760,2026-03-13 23:01:31.090740,0 days 00:00:13.547980,tanh,0.05,3,0.65,COMPLETE
108,108,0.4513530135154724,2026-03-13 23:01:31.242856,2026-03-13 23:01:44.846489,0 days 00:00:13.603633,tanh,0.0,4,0.7,COMPLETE
109,109,0.4603617489337921,2026-03-13 23:01:45.013007,2026-03-13 23:01:59.041601,0 days 00:00:14.028594,tanh,0.1,3,0.95,COMPLETE
110,110,0.6438997387886047,2026-03-13 23:01:59.181841,2026-03-13 23:02:12.731783,0 days 00:00:13.549942,sigmoid,0.0,4,0.6,COMPLETE
111,111,0.4825383424758911,2026-03-13 23:02:12.881772,2026-03-13 23:02:26.307393,0 days 00:00:13.425621,tanh,0.0,4,0.7,COMPLETE
112,112,0.46807774901390076,2026-03-13 23:02:26.450439,2026-03-13 23:02:39.999661,0 days 00:00:13.549222,tanh,0.0,4,0.75,COMPLETE
113,113,0.6414510607719421,2026-03-13 23:02:40.166442,2026-03-13 23:02:54.025035,0 days 00:00:13.858593,tanh,0.0,5,0.7,COMPLETE
114,114,0.4435206651687622,2026-03-13 23:02:54.183137,2026-03-13 23:03:08.210936,0 days 00:00:14.027799,tanh,0.05,4,0.65,COMPLETE
115,115,0.44600191712379456,2026-03-13 23:03:08.372485,2026-03-13 23:03:21.780664,0 days 00:00:13.408179,tanh,0.0,4,0.75,COMPLETE
116,116,0.4316672682762146,2026-03-13 23:03:21.924697,2026-03-13 23:03:35.132571,0 days 00:00:13.207874,tanh,0.0,3,0.7,COMPLETE
117,117,0.4742490351200104,2026-03-13 23:03:35.270167,2026-03-13 23:03:49.083640,0 days 00:00:13.813473,tanh,0.05,3,0.65,COMPLETE
118,118,0.48634329438209534,2026-03-13 23:03:49.295031,2026-03-13 23:04:02.776917,0 days 00:00:13.481886,tanh,0.0,3,0.75,COMPLETE
119,119,0.4435243010520935,2026-03-13 23:04:02.927946,2026-03-13 23:04:16.507682,0 days 00:00:13.579736,tanh,0.0,3,0.7,COMPLETE
120,120,0.4469735622406006,2026-03-13 23:04:16.642462,2026-03-13 23:04:30.378054,0 days 00:00:13.735592,tanh,0.05,3,0.5,COMPLETE
121,121,0.4569297730922699,2026-03-13 23:04:30.536077,2026-03-13 23:04:44.311406,0 days 00:00:13.775329,tanh,0.0,4,0.7,COMPLETE
122,122,0.42090529203414917,2026-03-13 23:04:44.457458,2026-03-13 23:04:58.098719,0 days 00:00:13.641261,tanh,0.0,3,0.7,COMPLETE
123,123,0.5009661912918091,2026-03-13 23:04:58.235779,2026-03-13 23:05:11.811066,0 days 00:00:13.575287,tanh,0.0,3,0.7,COMPLETE
124,124,0.43378937244415283,2026-03-13 23:05:11.971017,2026-03-13 23:05:25.479583,0 days 00:00:13.508566,tanh,0.25,3,0.75,COMPLETE
125,125,0.4545818865299225,2026-03-13 23:05:25.636617,2026-03-13 23:05:39.319255,0 days 00:00:13.682638,tanh,0.35000000000000003,3,0.75,COMPLETE
126,126,0.5077077746391296,2026-03-13 23:05:39.458793,2026-03-13 23:05:52.838957,0 days 00:00:13.380164,relu,0.2,2,0.75,COMPLETE
127,127,0.4395773112773895,2026-03-13 23:05:52.955476,2026-03-13 23:06:06.557985,0 days 00:00:13.602509,tanh,0.0,3,0.7,COMPLETE
128,128,0.4642164707183838,2026-03-13 23:06:06.711022,2026-03-13 23:06:20.520443,0 days 00:00:13.809421,tanh,0.30000000000000004,3,0.65,COMPLETE
129,129,0.460016667842865,2026-03-13 23:06:20.678957,2026-03-13 23:06:33.949303,0 days 00:00:13.270346,tanh,0.30000000000000004,2,0.8,COMPLETE
130,130,0.8290905952453613,2026-03-13 23:06:34.087862,2026-03-13 23:06:48.742184,0 days 00:00:14.654322,tanh,0.4,7,0.75,COMPLETE
131,131,0.4567031264305115,2026-03-13 23:06:48.887718,2026-03-13 23:07:02.719918,0 days 00:00:13.832200,tanh,0.25,3,0.8,COMPLETE
132,132,0.4715583324432373,2026-03-13 23:07:02.876722,2026-03-13 23:07:16.360916,0 days 00:00:13.484194,tanh,0.0,3,0.6,COMPLETE
133,133,0.44218000769615173,2026-03-13 23:07:16.519446,2026-03-13 23:07:30.020326,0 days 00:00:13.500880,tanh,0.0,3,0.55,COMPLETE
134,134,0.47902366518974304,2026-03-13 23:07:30.194141,2026-03-13 23:07:43.731351,0 days 00:00:13.537210,tanh,0.0,3,0.7,COMPLETE
135,135,0.5176952481269836,2026-03-13 23:07:43.952020,2026-03-13 23:07:57.756793,0 days 00:00:13.804773,tanh,0.35000000000000003,3,0.75,COMPLETE
136,136,0.6447285413742065,2026-03-13 23:07:57.912823,2026-03-13 23:08:11.755088,0 days 00:00:13.842265,sigmoid,0.25,3,0.9,COMPLETE
137,137,0.4366585314273834,2026-03-13 23:08:11.904706,2026-03-13 23:08:25.777558,0 days 00:00:13.872852,tanh,0.45,3,0.7,COMPLETE
138,138,0.4537438452243805,2026-03-13 23:08:25.928101,2026-03-13 23:08:40.068968,0 days 00:00:14.140867,tanh,0.05,4,0.6,COMPLETE
139,139,0.4326705038547516,2026-03-13 23:08:40.230410,2026-03-13 23:08:53.614939,0 days 00:00:13.384529,tanh,0.0,3,0.65,COMPLETE
140,140,0.4659862220287323,2026-03-13 23:08:53.777978,2026-03-13 23:09:07.159770,0 days 00:00:13.381792,tanh,0.0,3,0.65,COMPLETE
141,141,0.46561628580093384,2026-03-13 23:09:07.316853,2026-03-13 23:09:20.749055,0 days 00:00:13.432202,tanh,0.0,3,0.6,COMPLETE
142,142,0.44053712487220764,2026-03-13 23:09:20.892574,2026-03-13 23:09:34.268997,0 days 00:00:13.376423,tanh,0.0,3,0.65,COMPLETE
143,143,0.5081039667129517,2026-03-13 23:09:34.421517,2026-03-13 23:09:47.812024,0 days 00:00:13.390507,tanh,0.0,3,0.55,COMPLETE
144,144,0.4860861897468567,2026-03-13 23:09:47.963055,2026-03-13 23:10:01.441825,0 days 00:00:13.478770,tanh,0.0,4,0.75,COMPLETE
145,145,0.46117305755615234,2026-03-13 23:10:01.588735,2026-03-13 23:10:14.898729,0 days 00:00:13.309994,tanh,0.05,2,0.7,COMPLETE
146,146,0.4634682238101959,2026-03-13 23:10:15.047851,2026-03-13 23:10:28.933874,0 days 00:00:13.886023,tanh,0.15000000000000002,3,0.65,COMPLETE
147,147,0.4656660556793213,2026-03-13 23:10:29.076576,2026-03-13 23:10:42.544087,0 days 00:00:13.467511,tanh,0.0,3,0.75,COMPLETE
148,148,0.47857046127319336,2026-03-13 23:10:42.691121,2026-03-13 23:10:56.217837,0 days 00:00:13.526716,tanh,0.0,4,0.7,COMPLETE
149,149,0.4430546164512634,2026-03-13 23:10:56.368351,2026-03-13 23:11:10.145758,0 days 00:00:13.777407,relu,0.05,3,0.55,COMPLETE
150,150,0.44300782680511475,2026-03-13 23:11:10.307033,2026-03-13 23:11:23.891919,0 days 00:00:13.584886,tanh,0.0,4,0.6,COMPLETE
151,151,0.4574512839317322,2026-03-13 23:11:24.043533,2026-03-13 23:11:37.797540,0 days 00:00:13.754007,tanh,0.0,4,0.7,COMPLETE
152,152,0.46441543102264404,2026-03-13 23:11:37.954560,2026-03-13 23:11:51.544567,0 days 00:00:13.590007,tanh,0.0,4,0.8500000000000001,COMPLETE
153,153,0.4534543752670288,2026-03-13 23:11:51.699083,2026-03-13 23:12:05.389461,0 days 00:00:13.690378,tanh,0.0,4,0.7,COMPLETE
154,154,0.7050385475158691,2026-03-13 23:12:05.537056,2026-03-13 23:12:19.683359,0 days 00:00:14.146303,tanh,0.2,5,0.65,COMPLETE
155,155,0.4879474937915802,2026-03-13 23:12:19.857369,2026-03-13 23:12:33.415847,0 days 00:00:13.558478,tanh,0.25,3,0.7,COMPLETE
156,156,0.42918112874031067,2026-03-13 23:12:33.565993,2026-03-13 23:12:47.174574,0 days 00:00:13.608581,tanh,0.0,4,0.6,COMPLETE
157,157,0.43779027462005615,2026-03-13 23:12:47.320088,2026-03-13 23:13:00.499847,0 days 00:00:13.179759,tanh,0.0,3,0.6,COMPLETE
158,158,0.6496588587760925,2026-03-13 23:13:00.650365,2026-03-13 23:13:14.824384,0 days 00:00:14.174019,tanh,0.05,6,0.6,COMPLETE
159,159,0.6429848670959473,2026-03-13 23:13:14.964921,2026-03-13 23:13:28.573953,0 days 00:00:13.609032,sigmoid,0.0,5,0.6,COMPLETE
160,160,0.44710469245910645,2026-03-13 23:13:28.731479,2026-03-13 23:13:42.373953,0 days 00:00:13.642474,tanh,0.0,4,0.55,COMPLETE
161,161,0.42820626497268677,2026-03-13 23:13:42.531505,2026-03-13 23:13:56.142654,0 days 00:00:13.611149,tanh,0.0,4,0.65,COMPLETE
162,162,0.47261136770248413,2026-03-13 23:13:56.298320,2026-03-13 23:14:09.917966,0 days 00:00:13.619646,tanh,0.0,4,0.65,COMPLETE
163,163,0.4401153028011322,2026-03-13 23:14:10.087497,2026-03-13 23:14:23.710900,0 days 00:00:13.623403,tanh,0.0,4,0.65,COMPLETE
164,164,0.473541796207428,2026-03-13 23:14:23.872923,2026-03-13 23:14:37.591806,0 days 00:00:13.718883,tanh,0.0,4,0.6,COMPLETE
