,number,value,datetime_start,datetime_complete,duration,params_activation,params_dropout,params_layers,params_shrink,state
2977,2977,0.42148253321647644,2026-03-14 10:19:54.454745,2026-03-14 10:20:09.948093,0 days 00:00:15.493348,tanh,0.0,3,0.55,COMPLETE
2978,2978,0.48042502999305725,2026-03-14 10:20:10.128268,2026-03-14 10:20:25.262686,0 days 00:00:15.134418,tanh,0.0,3,0.55,COMPLETE
2979,2979,0.5197248458862305,2026-03-14 10:20:25.419844,2026-03-14 10:20:41.090706,0 days 00:00:15.670862,tanh,0.0,3,0.55,COMPLETE
2980,2980,0.4804737865924835,2026-03-14 10:20:41.228733,2026-03-14 10:20:56.661369,0 days 00:00:15.432636,relu,0.0,3,0.55,COMPLETE
2981,2981,0.47777584195137024,2026-03-14 10:20:56.799885,2026-03-14 10:21:12.659400,0 days 00:00:15.859515,tanh,0.05,3,0.55,COMPLETE
2982,2982,0.4426693618297577,2026-03-14 10:21:12.961241,2026-03-14 10:21:27.997481,0 days 00:00:15.036240,tanh,0.0,3,0.55,COMPLETE
2983,2983,0.44164225459098816,2026-03-14 10:21:28.147012,2026-03-14 10:21:43.810706,0 days 00:00:15.663694,tanh,0.0,3,0.55,COMPLETE
2984,2984,0.42921462655067444,2026-03-14 10:21:43.959810,2026-03-14 10:21:59.294050,0 days 00:00:15.334240,tanh,0.0,3,0.55,COMPLETE
2985,2985,0.4610178768634796,2026-03-14 10:21:59.448192,2026-03-14 10:22:14.901264,0 days 00:00:15.453072,tanh,0.0,3,0.55,COMPLETE
2986,2986,0.46899864077568054,2026-03-14 10:22:15.049790,2026-03-14 10:22:30.083555,0 days 00:00:15.033765,tanh,0.0,3,0.55,COMPLETE
2987,2987,0.4897286891937256,2026-03-14 10:22:30.234584,2026-03-14 10:22:45.405516,0 days 00:00:15.170932,tanh,0.0,3,0.55,COMPLETE
2988,2988,0.4405135214328766,2026-03-14 10:22:45.555147,2026-03-14 10:23:00.878221,0 days 00:00:15.323074,tanh,0.0,3,0.55,COMPLETE
2989,2989,0.47921547293663025,2026-03-14 10:23:01.020268,2026-03-14 10:23:16.553031,0 days 00:00:15.532763,tanh,0.05,3,0.55,COMPLETE
2990,2990,0.6432920098304749,2026-03-14 10:23:16.694543,2026-03-14 10:23:32.032611,0 days 00:00:15.338068,sigmoid,0.0,3,0.55,COMPLETE
2991,2991,0.44676128029823303,2026-03-14 10:23:32.185819,2026-03-14 10:23:47.699455,0 days 00:00:15.513636,tanh,0.0,4,0.55,COMPLETE
2992,2992,0.4761933386325836,2026-03-14 10:23:47.840015,2026-03-14 10:24:03.467342,0 days 00:00:15.627327,tanh,0.0,3,0.55,COMPLETE
2993,2993,0.4524908661842346,2026-03-14 10:24:03.628866,2026-03-14 10:24:19.242566,0 days 00:00:15.613700,tanh,0.0,3,0.55,COMPLETE
2994,2994,0.6675847172737122,2026-03-14 10:24:19.742361,2026-03-14 10:24:35.868342,0 days 00:00:16.125981,tanh,0.05,5,0.55,COMPLETE
2995,2995,0.4545419216156006,2026-03-14 10:24:36.016890,2026-03-14 10:24:51.202333,0 days 00:00:15.185443,tanh,0.0,3,0.55,COMPLETE
2996,2996,0.42786675691604614,2026-03-14 10:24:51.345447,2026-03-14 10:25:06.575848,0 days 00:00:15.230401,tanh,0.0,3,0.55,COMPLETE
2997,2997,0.4201573133468628,2026-03-14 10:25:06.746877,2026-03-14 10:25:21.873180,0 days 00:00:15.126303,tanh,0.0,3,0.55,COMPLETE
2998,2998,0.4911652207374573,2026-03-14 10:25:22.017209,2026-03-14 10:25:37.195048,0 days 00:00:15.177839,tanh,0.0,3,0.55,COMPLETE
2999,2999,0.46892663836479187,2026-03-14 10:25:37.337249,2026-03-14 10:25:52.750382,0 days 00:00:15.413133,tanh,0.0,3,0.55,COMPLETE
