,number,value,datetime_start,datetime_complete,duration,params_activation,params_dropout,params_layers,params_shrink,state
499,499,0.47292494773864746,2026-03-14 00:31:11.331359,2026-03-14 00:31:24.637195,0 days 00:00:13.305836,tanh,0.0,2,0.7,COMPLETE
500,500,0.46832606196403503,2026-03-14 00:31:24.818222,2026-03-14 00:31:38.496524,0 days 00:00:13.678302,tanh,0.0,3,0.65,COMPLETE
501,501,0.4576996862888336,2026-03-14 00:31:38.653045,2026-03-14 00:31:52.060303,0 days 00:00:13.407258,tanh,0.0,3,0.6,COMPLETE
502,502,0.4629438817501068,2026-03-14 00:31:52.229503,2026-03-14 00:32:05.994538,0 days 00:00:13.765035,tanh,0.05,3,0.65,COMPLETE
503,503,0.47895118594169617,2026-03-14 00:32:06.162246,2026-03-14 00:32:19.982251,0 days 00:00:13.820005,tanh,0.0,3,0.6,COMPLETE
504,504,0.4959534704685211,2026-03-14 00:32:20.146679,2026-03-14 00:32:33.756956,0 days 00:00:13.610277,tanh,0.0,3,0.65,COMPLETE
505,505,0.43295109272003174,2026-03-14 00:32:33.923422,2026-03-14 00:32:47.619623,0 days 00:00:13.696201,tanh,0.0,3,0.7,COMPLETE
506,506,0.4997025430202484,2026-03-14 00:32:47.793632,2026-03-14 00:33:01.758824,0 days 00:00:13.965192,relu,0.0,5,0.75,COMPLETE
507,507,0.46856236457824707,2026-03-14 00:33:01.923533,2026-03-14 00:33:15.537701,0 days 00:00:13.614168,tanh,0.0,3,0.6,COMPLETE
508,508,0.4585496485233307,2026-03-14 00:33:15.711215,2026-03-14 00:33:29.600230,0 days 00:00:13.889015,tanh,0.5,3,0.65,COMPLETE
509,509,0.4599837362766266,2026-03-14 00:33:29.776259,2026-03-14 00:33:43.594348,0 days 00:00:13.818089,tanh,0.05,3,0.65,COMPLETE
510,510,0.4613370895385742,2026-03-14 00:33:43.954986,2026-03-14 00:33:57.607684,0 days 00:00:13.652698,tanh,0.0,3,0.65,COMPLETE
511,511,0.4616154730319977,2026-03-14 00:33:57.828619,2026-03-14 00:34:11.494892,0 days 00:00:13.666273,tanh,0.0,3,0.65,COMPLETE
512,512,0.472176730632782,2026-03-14 00:34:11.678941,2026-03-14 00:34:25.054659,0 days 00:00:13.375718,tanh,0.0,3,0.55,COMPLETE
513,513,0.5053099393844604,2026-03-14 00:34:25.217227,2026-03-14 00:34:38.794213,0 days 00:00:13.576986,tanh,0.0,3,0.6,COMPLETE
514,514,0.47922882437705994,2026-03-14 00:34:38.970734,2026-03-14 00:34:52.694292,0 days 00:00:13.723558,tanh,0.0,3,0.65,COMPLETE
515,515,0.4372190535068512,2026-03-14 00:34:52.998868,2026-03-14 00:35:06.438206,0 days 00:00:13.439338,tanh,0.0,3,0.7,COMPLETE
516,516,0.6418824195861816,2026-03-14 00:35:06.615238,2026-03-14 00:35:20.128769,0 days 00:00:13.513531,sigmoid,0.0,3,0.65,COMPLETE
517,517,0.4972556531429291,2026-03-14 00:35:20.314865,2026-03-14 00:35:33.973211,0 days 00:00:13.658346,tanh,0.0,2,0.8500000000000001,COMPLETE
518,518,0.4737039804458618,2026-03-14 00:35:34.151788,2026-03-14 00:35:47.593773,0 days 00:00:13.441985,tanh,0.0,3,0.65,COMPLETE
519,519,0.44062790274620056,2026-03-14 00:35:47.748051,2026-03-14 00:36:01.662061,0 days 00:00:13.914010,tanh,0.0,3,0.6,COMPLETE
520,520,0.4665153920650482,2026-03-14 00:36:01.829579,2026-03-14 00:36:15.605324,0 days 00:00:13.775745,tanh,0.0,3,0.65,COMPLETE
521,521,0.5040997266769409,2026-03-14 00:36:15.856140,2026-03-14 00:36:29.471577,0 days 00:00:13.615437,tanh,0.05,3,0.5,COMPLETE
522,522,0.4539118707180023,2026-03-14 00:36:29.629091,2026-03-14 00:36:43.358035,0 days 00:00:13.728944,tanh,0.0,3,0.6,COMPLETE
523,523,0.4815971255302429,2026-03-14 00:36:43.527059,2026-03-14 00:36:57.130968,0 days 00:00:13.603909,tanh,0.2,3,0.7,COMPLETE
524,524,0.4947243630886078,2026-03-14 00:36:57.303880,2026-03-14 00:37:10.904877,0 days 00:00:13.600997,tanh,0.0,3,0.55,COMPLETE
525,525,0.46895748376846313,2026-03-14 00:37:11.086504,2026-03-14 00:37:24.529191,0 days 00:00:13.442687,tanh,0.0,3,0.65,COMPLETE
526,526,0.4484061300754547,2026-03-14 00:37:24.706068,2026-03-14 00:37:38.243202,0 days 00:00:13.537134,tanh,0.0,3,0.65,COMPLETE
527,527,0.45975562930107117,2026-03-14 00:37:38.406188,2026-03-14 00:37:52.194232,0 days 00:00:13.788044,tanh,0.05,3,0.65,COMPLETE
528,528,0.5164814591407776,2026-03-14 00:37:52.342252,2026-03-14 00:38:06.221370,0 days 00:00:13.879118,relu,0.0,3,0.6,COMPLETE
529,529,0.5109571814537048,2026-03-14 00:38:06.376914,2026-03-14 00:38:19.962410,0 days 00:00:13.585496,tanh,0.0,3,0.75,COMPLETE
530,530,0.44258084893226624,2026-03-14 00:38:20.143030,2026-03-14 00:38:33.793534,0 days 00:00:13.650504,tanh,0.0,3,0.65,COMPLETE
531,531,0.43956488370895386,2026-03-14 00:38:33.977121,2026-03-14 00:38:47.411771,0 days 00:00:13.434650,tanh,0.0,3,0.7,COMPLETE
532,532,0.4521479904651642,2026-03-14 00:38:47.585844,2026-03-14 00:39:01.281234,0 days 00:00:13.695390,tanh,0.0,3,0.65,COMPLETE
533,533,0.4152337610721588,2026-03-14 00:39:01.590287,2026-03-14 00:39:15.294252,0 days 00:00:13.703965,tanh,0.0,3,0.6,COMPLETE
534,534,0.4818556308746338,2026-03-14 00:39:15.463292,2026-03-14 00:39:29.161098,0 days 00:00:13.697806,tanh,0.05,3,0.6,COMPLETE
535,535,0.45178329944610596,2026-03-14 00:39:29.327212,2026-03-14 00:39:42.925340,0 days 00:00:13.598128,tanh,0.0,3,0.6,COMPLETE
536,536,0.44170284271240234,2026-03-14 00:39:43.103203,2026-03-14 00:39:56.585378,0 days 00:00:13.482175,tanh,0.0,3,0.6,COMPLETE
537,537,0.5021436214447021,2026-03-14 00:39:56.741893,2026-03-14 00:40:10.148186,0 days 00:00:13.406293,tanh,0.0,3,0.6,COMPLETE
538,538,0.6474872827529907,2026-03-14 00:40:10.313831,2026-03-14 00:40:24.163456,0 days 00:00:13.849625,sigmoid,0.25,3,0.6,COMPLETE
539,539,0.5907072424888611,2026-03-14 00:40:24.320054,2026-03-14 00:40:37.849373,0 days 00:00:13.529319,tanh,0.0,3,0.6,COMPLETE
540,540,0.5032223463058472,2026-03-14 00:40:38.031403,2026-03-14 00:40:51.699236,0 days 00:00:13.667833,tanh,0.0,3,0.6,COMPLETE
541,541,0.45449987053871155,2026-03-14 00:40:51.854262,2026-03-14 00:41:05.296816,0 days 00:00:13.442554,tanh,0.0,3,0.55,COMPLETE
542,542,0.5449072122573853,2026-03-14 00:41:05.471389,2026-03-14 00:41:19.235961,0 days 00:00:13.764572,tanh,0.0,3,0.6,COMPLETE
543,543,0.5150340795516968,2026-03-14 00:41:19.402674,2026-03-14 00:41:33.303312,0 days 00:00:13.900638,tanh,0.25,3,0.6,COMPLETE
544,544,0.43880072236061096,2026-03-14 00:41:33.472595,2026-03-14 00:41:46.972931,0 days 00:00:13.500336,tanh,0.0,3,0.55,COMPLETE
545,545,0.44462817907333374,2026-03-14 00:41:47.140214,2026-03-14 00:42:00.534666,0 days 00:00:13.394452,tanh,0.0,2,0.65,COMPLETE
546,546,0.4744684100151062,2026-03-14 00:42:00.706195,2026-03-14 00:42:14.383686,0 days 00:00:13.677491,tanh,0.05,3,0.65,COMPLETE
547,547,0.485958993434906,2026-03-14 00:42:14.556707,2026-03-14 00:42:28.177134,0 days 00:00:13.620427,tanh,0.0,3,0.65,COMPLETE
548,548,0.4950392246246338,2026-03-14 00:42:28.326644,2026-03-14 00:42:41.817717,0 days 00:00:13.491073,tanh,0.0,3,0.6,COMPLETE
549,549,0.41282007098197937,2026-03-14 00:42:41.956822,2026-03-14 00:42:55.130044,0 days 00:00:13.173222,tanh,0.0,3,0.5,COMPLETE
550,550,0.4837943911552429,2026-03-14 00:42:55.303699,2026-03-14 00:43:08.719562,0 days 00:00:13.415863,tanh,0.0,3,0.65,COMPLETE
551,551,0.4665748178958893,2026-03-14 00:43:08.869070,2026-03-14 00:43:22.269759,0 days 00:00:13.400689,tanh,0.0,3,0.5,COMPLETE
552,552,0.47581756114959717,2026-03-14 00:43:22.446297,2026-03-14 00:43:36.107558,0 days 00:00:13.661261,relu,0.0,3,0.5,COMPLETE
553,553,0.43617531657218933,2026-03-14 00:43:36.290723,2026-03-14 00:43:49.837441,0 days 00:00:13.546718,tanh,0.0,3,0.5,COMPLETE
554,554,0.4265132248401642,2026-03-14 00:43:50.031510,2026-03-14 00:44:03.705329,0 days 00:00:13.673819,tanh,0.0,3,0.5,COMPLETE
555,555,0.4472786486148834,2026-03-14 00:44:03.892870,2026-03-14 00:44:17.551601,0 days 00:00:13.658731,tanh,0.05,3,0.5,COMPLETE
556,556,0.4597039222717285,2026-03-14 00:44:17.721143,2026-03-14 00:44:31.641543,0 days 00:00:13.920400,tanh,0.35000000000000003,3,0.65,COMPLETE
557,557,0.47466179728507996,2026-03-14 00:44:31.815674,2026-03-14 00:44:45.413990,0 days 00:00:13.598316,tanh,0.0,3,0.5,COMPLETE
558,558,0.4934661388397217,2026-03-14 00:44:45.601781,2026-03-14 00:44:59.096041,0 days 00:00:13.494260,tanh,0.0,3,0.65,COMPLETE
559,559,0.4428415596485138,2026-03-14 00:44:59.240640,2026-03-14 00:45:12.751317,0 days 00:00:13.510677,tanh,0.0,3,0.5,COMPLETE
560,560,0.6417886018753052,2026-03-14 00:45:12.906844,2026-03-14 00:45:26.242311,0 days 00:00:13.335467,sigmoid,0.05,3,0.5,COMPLETE
561,561,0.48175767064094543,2026-03-14 00:45:26.407008,2026-03-14 00:45:39.916337,0 days 00:00:13.509329,tanh,0.0,2,0.5,COMPLETE
562,562,0.44708001613616943,2026-03-14 00:45:40.073072,2026-03-14 00:45:53.490842,0 days 00:00:13.417770,tanh,0.0,3,0.5,COMPLETE
563,563,0.43596363067626953,2026-03-14 00:45:53.651362,2026-03-14 00:46:07.024388,0 days 00:00:13.373026,tanh,0.0,3,0.55,COMPLETE
564,564,0.4577721953392029,2026-03-14 00:46:07.197482,2026-03-14 00:46:20.512534,0 days 00:00:13.315052,tanh,0.0,3,0.65,COMPLETE
565,565,0.4613420069217682,2026-03-14 00:46:20.660045,2026-03-14 00:46:33.948360,0 days 00:00:13.288315,tanh,0.0,3,0.65,COMPLETE
566,566,0.43946731090545654,2026-03-14 00:46:34.091870,2026-03-14 00:46:47.642246,0 days 00:00:13.550376,tanh,0.0,3,0.65,COMPLETE
567,567,0.45804330706596375,2026-03-14 00:46:47.810761,2026-03-14 00:47:01.102269,0 days 00:00:13.291508,tanh,0.0,3,0.65,COMPLETE
568,568,0.4794744551181793,2026-03-14 00:47:01.248354,2026-03-14 00:47:14.692349,0 days 00:00:13.443995,tanh,0.0,3,0.65,COMPLETE
569,569,0.5170595049858093,2026-03-14 00:47:14.836870,2026-03-14 00:47:28.392586,0 days 00:00:13.555716,tanh,0.0,3,0.65,COMPLETE
570,570,0.436935693025589,2026-03-14 00:47:28.533858,2026-03-14 00:47:42.232146,0 days 00:00:13.698288,tanh,0.05,3,0.7,COMPLETE
571,571,0.4309695065021515,2026-03-14 00:47:42.410179,2026-03-14 00:47:55.909870,0 days 00:00:13.499691,tanh,0.0,3,0.5,COMPLETE
572,572,0.4577975869178772,2026-03-14 00:47:56.058905,2026-03-14 00:48:09.592341,0 days 00:00:13.533436,tanh,0.0,3,0.55,COMPLETE
573,573,0.4577784240245819,2026-03-14 00:48:09.733855,2026-03-14 00:48:23.094495,0 days 00:00:13.360640,tanh,0.0,3,0.65,COMPLETE
574,574,0.4909443259239197,2026-03-14 00:48:23.235756,2026-03-14 00:48:36.871785,0 days 00:00:13.636029,relu,0.0,3,1.0,COMPLETE
575,575,0.4335327744483948,2026-03-14 00:48:37.024612,2026-03-14 00:48:50.689996,0 days 00:00:13.665384,tanh,0.0,3,0.65,COMPLETE
576,576,0.45587947964668274,2026-03-14 00:48:50.857536,2026-03-14 00:49:04.534751,0 days 00:00:13.677215,tanh,0.05,3,0.65,COMPLETE
577,577,0.4697400629520416,2026-03-14 00:49:04.680798,2026-03-14 00:49:18.079529,0 days 00:00:13.398731,tanh,0.0,3,0.65,COMPLETE
578,578,0.4543873369693756,2026-03-14 00:49:18.224619,2026-03-14 00:49:31.530248,0 days 00:00:13.305629,tanh,0.0,3,0.7,COMPLETE
579,579,0.4333561062812805,2026-03-14 00:49:31.709769,2026-03-14 00:49:44.934734,0 days 00:00:13.224965,tanh,0.0,3,0.65,COMPLETE
580,580,0.4227713942527771,2026-03-14 00:49:45.083834,2026-03-14 00:49:58.875223,0 days 00:00:13.791389,tanh,0.0,3,0.55,COMPLETE
581,581,0.415734201669693,2026-03-14 00:49:59.021745,2026-03-14 00:50:12.355124,0 days 00:00:13.333379,tanh,0.0,3,0.55,COMPLETE
582,582,0.4478844702243805,2026-03-14 00:50:12.508643,2026-03-14 00:50:25.694223,0 days 00:00:13.185580,tanh,0.0,3,0.55,COMPLETE
583,583,0.45092740654945374,2026-03-14 00:50:25.866272,2026-03-14 00:50:39.468571,0 days 00:00:13.602299,tanh,0.15000000000000002,3,0.55,COMPLETE
584,584,0.6468822956085205,2026-03-14 00:50:39.604093,2026-03-14 00:50:53.115477,0 days 00:00:13.511384,sigmoid,0.0,3,0.5,COMPLETE
585,585,0.47623658180236816,2026-03-14 00:50:53.256136,2026-03-14 00:51:06.986572,0 days 00:00:13.730436,tanh,0.0,3,0.5,COMPLETE
586,586,0.46422630548477173,2026-03-14 00:51:07.126964,2026-03-14 00:51:20.786411,0 days 00:00:13.659447,tanh,0.0,3,0.55,COMPLETE
587,587,0.47684246301651,2026-03-14 00:51:20.965943,2026-03-14 00:51:34.755239,0 days 00:00:13.789296,tanh,0.05,3,0.5,COMPLETE
588,588,0.4315493404865265,2026-03-14 00:51:34.898889,2026-03-14 00:51:48.343772,0 days 00:00:13.444883,tanh,0.0,3,0.55,COMPLETE
589,589,0.4685518145561218,2026-03-14 00:51:48.510797,2026-03-14 00:52:02.046269,0 days 00:00:13.535472,tanh,0.0,3,0.55,COMPLETE
590,590,0.4268990457057953,2026-03-14 00:52:02.197870,2026-03-14 00:52:15.854518,0 days 00:00:13.656648,tanh,0.0,3,0.6,COMPLETE
591,591,0.44321945309638977,2026-03-14 00:52:16.003045,2026-03-14 00:52:29.491164,0 days 00:00:13.488119,tanh,0.0,3,0.6,COMPLETE
592,592,0.45256760716438293,2026-03-14 00:52:29.652659,2026-03-14 00:52:43.116121,0 days 00:00:13.463462,tanh,0.0,3,0.5,COMPLETE
593,593,0.47033125162124634,2026-03-14 00:52:43.277822,2026-03-14 00:52:56.684674,0 days 00:00:13.406852,tanh,0.05,3,0.6,COMPLETE
594,594,0.45797231793403625,2026-03-14 00:52:56.828688,2026-03-14 00:53:10.407307,0 days 00:00:13.578619,tanh,0.0,3,0.6,COMPLETE
595,595,0.453848272562027,2026-03-14 00:53:10.574836,2026-03-14 00:53:24.143777,0 days 00:00:13.568941,tanh,0.0,3,0.55,COMPLETE
596,596,0.442266047000885,2026-03-14 00:53:24.313817,2026-03-14 00:53:37.767568,0 days 00:00:13.453751,tanh,0.0,3,0.7,COMPLETE
597,597,0.49453994631767273,2026-03-14 00:53:37.951128,2026-03-14 00:53:51.617434,0 days 00:00:13.666306,relu,0.0,3,0.9,COMPLETE
598,598,0.48555445671081543,2026-03-14 00:53:51.800097,2026-03-14 00:54:05.490507,0 days 00:00:13.690410,tanh,0.0,3,0.6,COMPLETE
599,599,0.4223288893699646,2026-03-14 00:54:05.650018,2026-03-14 00:54:19.504145,0 days 00:00:13.854127,tanh,0.0,3,0.65,COMPLETE
600,600,0.5177969932556152,2026-03-14 00:54:19.696703,2026-03-14 00:54:33.069021,0 days 00:00:13.372318,tanh,0.0,2,0.65,COMPLETE
601,601,0.44974571466445923,2026-03-14 00:54:33.239629,2026-03-14 00:54:47.033304,0 days 00:00:13.793675,tanh,0.0,3,0.65,COMPLETE
602,602,0.4497772753238678,2026-03-14 00:54:47.183872,2026-03-14 00:55:00.688457,0 days 00:00:13.504585,tanh,0.0,3,0.65,COMPLETE
603,603,0.46850255131721497,2026-03-14 00:55:00.838019,2026-03-14 00:55:14.353991,0 days 00:00:13.515972,tanh,0.0,3,0.65,COMPLETE
604,604,0.4608069062232971,2026-03-14 00:55:14.512537,2026-03-14 00:55:28.166975,0 days 00:00:13.654438,tanh,0.0,3,0.65,COMPLETE
605,605,0.6495093703269958,2026-03-14 00:55:28.318042,2026-03-14 00:55:42.739724,0 days 00:00:14.421682,tanh,0.05,7,0.65,COMPLETE
606,606,0.4646320641040802,2026-03-14 00:55:42.881258,2026-03-14 00:55:56.164529,0 days 00:00:13.283271,tanh,0.0,3,0.7,COMPLETE
607,607,0.6426711678504944,2026-03-14 00:55:56.325654,2026-03-14 00:56:09.888910,0 days 00:00:13.563256,sigmoid,0.0,3,0.5,COMPLETE
608,608,0.5002802014350891,2026-03-14 00:56:10.038283,2026-03-14 00:56:23.792136,0 days 00:00:13.753853,tanh,0.05,3,0.65,COMPLETE
609,609,0.45008185505867004,2026-03-14 00:56:23.955729,2026-03-14 00:56:37.464825,0 days 00:00:13.509096,tanh,0.0,3,0.65,COMPLETE
610,610,0.44736480712890625,2026-03-14 00:56:37.655324,2026-03-14 00:56:51.483536,0 days 00:00:13.828212,tanh,0.0,3,0.65,COMPLETE
611,611,0.48201873898506165,2026-03-14 00:56:51.665658,2026-03-14 00:57:05.106181,0 days 00:00:13.440523,tanh,0.0,3,0.65,COMPLETE
612,612,0.4593420624732971,2026-03-14 00:57:05.272786,2026-03-14 00:57:18.793486,0 days 00:00:13.520700,tanh,0.0,3,0.65,COMPLETE
613,613,0.4345239996910095,2026-03-14 00:57:18.972578,2026-03-14 00:57:32.869268,0 days 00:00:13.896690,tanh,0.0,3,0.7,COMPLETE
614,614,0.4616883099079132,2026-03-14 00:57:33.047015,2026-03-14 00:57:46.530287,0 days 00:00:13.483272,tanh,0.0,3,0.65,COMPLETE
615,615,0.4317205548286438,2026-03-14 00:57:46.697888,2026-03-14 00:58:00.225656,0 days 00:00:13.527768,tanh,0.0,3,0.65,COMPLETE
616,616,0.48171767592430115,2026-03-14 00:58:00.387189,2026-03-14 00:58:13.972973,0 days 00:00:13.585784,tanh,0.0,3,0.65,COMPLETE
617,617,0.4646562933921814,2026-03-14 00:58:14.119532,2026-03-14 00:58:27.332573,0 days 00:00:13.213041,tanh,0.0,3,0.5,COMPLETE
618,618,0.49018070101737976,2026-03-14 00:58:27.624759,2026-03-14 00:58:41.242516,0 days 00:00:13.617757,tanh,0.0,3,0.7,COMPLETE
619,619,0.45137646794319153,2026-03-14 00:58:41.406028,2026-03-14 00:58:55.169914,0 days 00:00:13.763886,tanh,0.05,3,0.65,COMPLETE
620,620,0.47921299934387207,2026-03-14 00:58:55.327434,2026-03-14 00:59:08.889961,0 days 00:00:13.562527,relu,0.0,3,0.65,COMPLETE
621,621,0.46574169397354126,2026-03-14 00:59:09.064986,2026-03-14 00:59:22.652247,0 days 00:00:13.587261,tanh,0.0,3,0.65,COMPLETE
622,622,0.4223889410495758,2026-03-14 00:59:22.826801,2026-03-14 00:59:36.480498,0 days 00:00:13.653697,tanh,0.0,3,0.55,COMPLETE
623,623,0.42397379875183105,2026-03-14 00:59:36.654434,2026-03-14 00:59:50.483747,0 days 00:00:13.829313,tanh,0.0,3,0.55,COMPLETE
624,624,0.4794921875,2026-03-14 00:59:50.653771,2026-03-14 01:00:04.236565,0 days 00:00:13.582794,tanh,0.0,3,0.55,COMPLETE
625,625,0.4515654742717743,2026-03-14 01:00:04.399022,2026-03-14 01:00:17.971039,0 days 00:00:13.572017,tanh,0.0,3,0.55,COMPLETE
626,626,0.49302995204925537,2026-03-14 01:00:18.142573,2026-03-14 01:00:31.924410,0 days 00:00:13.781837,tanh,0.05,3,0.55,COMPLETE
627,627,0.44087913632392883,2026-03-14 01:00:32.091499,2026-03-14 01:00:45.654256,0 days 00:00:13.562757,tanh,0.0,3,0.55,COMPLETE
628,628,0.4803634583950043,2026-03-14 01:00:45.831789,2026-03-14 01:00:59.358132,0 days 00:00:13.526343,tanh,0.0,2,0.55,COMPLETE
629,629,0.6465238928794861,2026-03-14 01:00:59.523224,2026-03-14 01:01:13.035395,0 days 00:00:13.512171,sigmoid,0.0,3,0.55,COMPLETE
630,630,0.4759005904197693,2026-03-14 01:01:13.205486,2026-03-14 01:01:26.700169,0 days 00:00:13.494683,tanh,0.0,3,0.55,COMPLETE
631,631,0.5250049233436584,2026-03-14 01:01:26.868207,2026-03-14 01:01:40.562769,0 days 00:00:13.694562,tanh,0.05,3,0.65,COMPLETE
632,632,0.478240430355072,2026-03-14 01:01:40.724295,2026-03-14 01:01:54.257194,0 days 00:00:13.532899,tanh,0.0,3,0.55,COMPLETE
633,633,0.44077497720718384,2026-03-14 01:01:54.416755,2026-03-14 01:02:07.929717,0 days 00:00:13.512962,tanh,0.0,3,0.7,COMPLETE
634,634,0.43935978412628174,2026-03-14 01:02:08.089895,2026-03-14 01:02:21.464186,0 days 00:00:13.374291,tanh,0.0,3,0.65,COMPLETE
635,635,0.4757138788700104,2026-03-14 01:02:21.634360,2026-03-14 01:02:35.544945,0 days 00:00:13.910585,tanh,0.4,3,0.65,COMPLETE
636,636,0.4711439311504364,2026-03-14 01:02:35.706996,2026-03-14 01:02:49.404823,0 days 00:00:13.697827,tanh,0.0,3,0.65,COMPLETE
637,637,0.48271864652633667,2026-03-14 01:02:49.586174,2026-03-14 01:03:03.312039,0 days 00:00:13.725865,tanh,0.0,3,0.65,COMPLETE
638,638,0.4296894669532776,2026-03-14 01:03:03.496939,2026-03-14 01:03:16.973448,0 days 00:00:13.476509,tanh,0.0,3,0.55,COMPLETE
639,639,0.4362444281578064,2026-03-14 01:03:17.142112,2026-03-14 01:03:30.781966,0 days 00:00:13.639854,tanh,0.0,3,0.65,COMPLETE
640,640,0.42566049098968506,2026-03-14 01:03:30.951997,2026-03-14 01:03:44.494753,0 days 00:00:13.542756,tanh,0.0,3,0.7,COMPLETE
641,641,0.45710745453834534,2026-03-14 01:03:44.663782,2026-03-14 01:03:58.483030,0 days 00:00:13.819248,tanh,0.05,3,0.65,COMPLETE
642,642,0.4733601212501526,2026-03-14 01:03:58.656055,2026-03-14 01:04:12.427314,0 days 00:00:13.771259,tanh,0.45,3,0.6,COMPLETE
643,643,0.45620521903038025,2026-03-14 01:04:12.596339,2026-03-14 01:04:26.135581,0 days 00:00:13.539242,tanh,0.30000000000000004,3,0.65,COMPLETE
644,644,0.4497971832752228,2026-03-14 01:04:26.298690,2026-03-14 01:04:39.931194,0 days 00:00:13.632504,tanh,0.2,3,0.6,COMPLETE
645,645,0.4510747194290161,2026-03-14 01:04:40.090226,2026-03-14 01:04:53.674378,0 days 00:00:13.584152,relu,0.0,3,0.65,COMPLETE
646,646,0.4583180546760559,2026-03-14 01:04:53.835908,2026-03-14 01:05:07.512572,0 days 00:00:13.676664,tanh,0.0,3,0.7,COMPLETE
647,647,0.4718822240829468,2026-03-14 01:05:07.686608,2026-03-14 01:05:21.264861,0 days 00:00:13.578253,tanh,0.0,3,0.8500000000000001,COMPLETE
648,648,0.46746087074279785,2026-03-14 01:05:21.438629,2026-03-14 01:05:35.055338,0 days 00:00:13.616709,tanh,0.0,3,0.65,COMPLETE
649,649,0.46002355217933655,2026-03-14 01:05:35.228461,2026-03-14 01:05:48.880542,0 days 00:00:13.652081,tanh,0.0,3,0.55,COMPLETE
650,650,0.47634977102279663,2026-03-14 01:05:49.052568,2026-03-14 01:06:02.617353,0 days 00:00:13.564785,tanh,0.0,3,0.65,COMPLETE
651,651,0.5110055208206177,2026-03-14 01:06:02.784868,2026-03-14 01:06:16.297998,0 days 00:00:13.513130,sigmoid,0.0,2,0.6,COMPLETE
652,652,0.4694756865501404,2026-03-14 01:06:16.452563,2026-03-14 01:06:30.111400,0 days 00:00:13.658837,tanh,0.0,3,0.65,COMPLETE
653,653,0.5066609382629395,2026-03-14 01:06:30.281734,2026-03-14 01:06:44.076463,0 days 00:00:13.794729,tanh,0.05,3,0.7,COMPLETE
654,654,0.43736833333969116,2026-03-14 01:06:44.246655,2026-03-14 01:06:57.559779,0 days 00:00:13.313124,tanh,0.0,3,0.65,COMPLETE
655,655,0.4702666699886322,2026-03-14 01:06:57.713310,2026-03-14 01:07:10.954203,0 days 00:00:13.240893,tanh,0.0,3,0.6,COMPLETE
656,656,0.46972009539604187,2026-03-14 01:07:11.117019,2026-03-14 01:07:24.782281,0 days 00:00:13.665262,tanh,0.0,3,0.75,COMPLETE
657,657,0.45107322931289673,2026-03-14 01:07:24.939805,2026-03-14 01:07:38.239405,0 days 00:00:13.299600,tanh,0.0,3,0.55,COMPLETE
658,658,0.4405834376811981,2026-03-14 01:07:38.402868,2026-03-14 01:07:52.306092,0 days 00:00:13.903224,tanh,0.05,3,0.6,COMPLETE
659,659,0.4891131818294525,2026-03-14 01:07:52.471136,2026-03-14 01:08:05.978872,0 days 00:00:13.507736,tanh,0.0,3,0.65,COMPLETE
660,660,0.45109912753105164,2026-03-14 01:08:06.160498,2026-03-14 01:08:20.155586,0 days 00:00:13.995088,tanh,0.0,3,0.65,COMPLETE
661,661,0.4373827278614044,2026-03-14 01:08:20.336036,2026-03-14 01:08:33.988925,0 days 00:00:13.652889,tanh,0.0,3,0.65,COMPLETE
662,662,0.43967491388320923,2026-03-14 01:08:34.154458,2026-03-14 01:08:47.887842,0 days 00:00:13.733384,tanh,0.35000000000000003,3,0.65,COMPLETE
663,663,0.45352813601493835,2026-03-14 01:08:48.053879,2026-03-14 01:09:01.580275,0 days 00:00:13.526396,tanh,0.0,3,0.6,COMPLETE
664,664,0.5226254463195801,2026-03-14 01:09:01.758306,2026-03-14 01:09:15.340329,0 days 00:00:13.582023,relu,0.0,3,0.65,COMPLETE
665,665,0.4386902451515198,2026-03-14 01:09:15.527353,2026-03-14 01:09:29.189769,0 days 00:00:13.662416,tanh,0.0,3,0.7,COMPLETE
