,number,value,datetime_start,datetime_complete,duration,params_activation,params_dropout,params_layers,params_shrink,state
1822,1822,0.47868797183036804,2026-03-14 05:38:24.531863,2026-03-14 05:38:38.801661,0 days 00:00:14.269798,tanh,0.2,3,0.55,COMPLETE
1823,1823,0.6416371464729309,2026-03-14 05:38:39.135197,2026-03-14 05:38:53.379968,0 days 00:00:14.244771,sigmoid,0.05,3,0.55,COMPLETE
1824,1824,0.4287779927253723,2026-03-14 05:38:53.530447,2026-03-14 05:39:07.527968,0 days 00:00:13.997521,tanh,0.0,3,0.55,COMPLETE
1825,1825,0.5052569508552551,2026-03-14 05:39:07.651939,2026-03-14 05:39:21.678093,0 days 00:00:14.026154,tanh,0.0,3,0.55,COMPLETE
1826,1826,0.49219635128974915,2026-03-14 05:39:21.808644,2026-03-14 05:39:35.899224,0 days 00:00:14.090580,tanh,0.0,3,0.55,COMPLETE
1827,1827,0.4460468888282776,2026-03-14 05:39:36.025749,2026-03-14 05:39:50.173138,0 days 00:00:14.147389,tanh,0.05,3,0.55,COMPLETE
1828,1828,0.45808738470077515,2026-03-14 05:39:50.307157,2026-03-14 05:40:04.300426,0 days 00:00:13.993269,tanh,0.0,3,0.5,COMPLETE
1829,1829,0.4417990744113922,2026-03-14 05:40:04.441958,2026-03-14 05:40:18.608629,0 days 00:00:14.166671,tanh,0.0,3,0.55,COMPLETE
1830,1830,0.5103076100349426,2026-03-14 05:40:18.743935,2026-03-14 05:40:32.627122,0 days 00:00:13.883187,tanh,0.25,3,0.5,COMPLETE
1831,1831,0.4489249289035797,2026-03-14 05:40:32.762213,2026-03-14 05:40:46.521488,0 days 00:00:13.759275,tanh,0.0,3,0.55,COMPLETE
1832,1832,0.4625137448310852,2026-03-14 05:40:46.649010,2026-03-14 05:41:00.548304,0 days 00:00:13.899294,tanh,0.0,2,0.5,COMPLETE
1833,1833,0.4186185598373413,2026-03-14 05:41:00.693805,2026-03-14 05:41:14.704728,0 days 00:00:14.010923,tanh,0.0,3,0.55,COMPLETE
1834,1834,0.47209107875823975,2026-03-14 05:41:14.830247,2026-03-14 05:41:28.978412,0 days 00:00:14.148165,tanh,0.05,3,0.8500000000000001,COMPLETE
1835,1835,0.4013690650463104,2026-03-14 05:41:29.117543,2026-03-14 05:41:43.135282,0 days 00:00:14.017739,tanh,0.0,3,0.5,COMPLETE
1836,1836,0.4323148727416992,2026-03-14 05:41:43.262787,2026-03-14 05:41:57.390117,0 days 00:00:14.127330,tanh,0.0,3,0.5,COMPLETE
1837,1837,0.48733147978782654,2026-03-14 05:41:57.529188,2026-03-14 05:42:11.548085,0 days 00:00:14.018897,relu,0.0,3,0.5,COMPLETE
1838,1838,0.6350029110908508,2026-03-14 05:42:11.684118,2026-03-14 05:42:25.856680,0 days 00:00:14.172562,tanh,0.0,4,0.5,COMPLETE
1839,1839,0.47129952907562256,2026-03-14 05:42:26.007702,2026-03-14 05:42:39.944147,0 days 00:00:13.936445,tanh,0.0,3,0.5,COMPLETE
1840,1840,0.4071156978607178,2026-03-14 05:42:40.068671,2026-03-14 05:42:53.885491,0 days 00:00:13.816820,tanh,0.0,3,0.5,COMPLETE
1841,1841,0.4743816554546356,2026-03-14 05:42:54.110512,2026-03-14 05:43:08.185109,0 days 00:00:14.074597,tanh,0.0,3,0.5,COMPLETE
1842,1842,0.4385707974433899,2026-03-14 05:43:08.329142,2026-03-14 05:43:22.307025,0 days 00:00:13.977883,tanh,0.0,3,0.5,COMPLETE
1843,1843,0.4736745059490204,2026-03-14 05:43:22.457681,2026-03-14 05:43:36.454201,0 days 00:00:13.996520,tanh,0.0,3,0.5,COMPLETE
1844,1844,0.4923493266105652,2026-03-14 05:43:36.579715,2026-03-14 05:43:50.423151,0 days 00:00:13.843436,tanh,0.0,3,0.5,COMPLETE
1845,1845,0.4861573576927185,2026-03-14 05:43:50.566185,2026-03-14 05:44:04.675158,0 days 00:00:14.108973,tanh,0.0,3,0.5,COMPLETE
1846,1846,0.46897614002227783,2026-03-14 05:44:04.803690,2026-03-14 05:44:18.745338,0 days 00:00:13.941648,tanh,0.0,3,0.5,COMPLETE
1847,1847,0.6429716944694519,2026-03-14 05:44:18.893367,2026-03-14 05:44:32.845203,0 days 00:00:13.951836,sigmoid,0.05,3,0.5,COMPLETE
1848,1848,0.42266392707824707,2026-03-14 05:44:32.990232,2026-03-14 05:44:46.836647,0 days 00:00:13.846415,tanh,0.0,3,0.5,COMPLETE
1849,1849,0.4224390387535095,2026-03-14 05:44:46.980666,2026-03-14 05:45:00.943166,0 days 00:00:13.962500,tanh,0.0,3,0.5,COMPLETE
1850,1850,0.42140018939971924,2026-03-14 05:45:01.102210,2026-03-14 05:45:15.078937,0 days 00:00:13.976727,tanh,0.0,3,0.5,COMPLETE
1851,1851,0.43549153208732605,2026-03-14 05:45:15.233585,2026-03-14 05:45:29.214839,0 days 00:00:13.981254,tanh,0.0,3,0.5,COMPLETE
1852,1852,0.6431454420089722,2026-03-14 05:45:29.379368,2026-03-14 05:45:43.852205,0 days 00:00:14.472837,tanh,0.0,6,0.5,COMPLETE
1853,1853,0.5079314112663269,2026-03-14 05:45:43.992251,2026-03-14 05:45:58.088632,0 days 00:00:14.096381,tanh,0.0,3,0.5,COMPLETE
1854,1854,0.44641733169555664,2026-03-14 05:45:58.224727,2026-03-14 05:46:12.293524,0 days 00:00:14.068797,tanh,0.05,3,0.5,COMPLETE
1855,1855,0.43359845876693726,2026-03-14 05:46:12.432581,2026-03-14 05:46:26.321677,0 days 00:00:13.889096,tanh,0.0,3,0.5,COMPLETE
1856,1856,0.4962756335735321,2026-03-14 05:46:26.455323,2026-03-14 05:46:40.200054,0 days 00:00:13.744731,tanh,0.0,2,0.5,COMPLETE
1857,1857,0.4474170506000519,2026-03-14 05:46:40.344083,2026-03-14 05:46:54.184126,0 days 00:00:13.840043,tanh,0.0,3,0.5,COMPLETE
1858,1858,0.435183584690094,2026-03-14 05:46:54.308649,2026-03-14 05:47:08.377033,0 days 00:00:14.068384,tanh,0.0,3,0.5,COMPLETE
1859,1859,0.4816648066043854,2026-03-14 05:47:08.505601,2026-03-14 05:47:22.374768,0 days 00:00:13.869167,relu,0.0,3,0.5,COMPLETE
1860,1860,0.4639413356781006,2026-03-14 05:47:22.511319,2026-03-14 05:47:36.582639,0 days 00:00:14.071320,tanh,0.05,3,0.5,COMPLETE
1861,1861,0.4500046670436859,2026-03-14 05:47:36.710166,2026-03-14 05:47:50.671448,0 days 00:00:13.961282,tanh,0.0,3,0.5,COMPLETE
1862,1862,0.4206075668334961,2026-03-14 05:47:50.818192,2026-03-14 05:48:04.788741,0 days 00:00:13.970549,tanh,0.0,3,0.5,COMPLETE
1863,1863,0.4657931923866272,2026-03-14 05:48:04.922015,2026-03-14 05:48:18.556537,0 days 00:00:13.634522,tanh,0.0,3,0.5,COMPLETE
1864,1864,0.4231445789337158,2026-03-14 05:48:18.792582,2026-03-14 05:48:32.690890,0 days 00:00:13.898308,tanh,0.0,3,0.5,COMPLETE
1865,1865,0.48610225319862366,2026-03-14 05:48:32.821915,2026-03-14 05:48:46.853524,0 days 00:00:14.031609,tanh,0.0,3,0.5,COMPLETE
1866,1866,0.4608083963394165,2026-03-14 05:48:46.986042,2026-03-14 05:49:01.344539,0 days 00:00:14.358497,tanh,0.0,3,0.5,COMPLETE
1867,1867,0.4446033239364624,2026-03-14 05:49:01.484286,2026-03-14 05:49:15.402490,0 days 00:00:13.918204,tanh,0.0,3,0.5,COMPLETE
1868,1868,0.6434645652770996,2026-03-14 05:49:15.532514,2026-03-14 05:49:29.573244,0 days 00:00:14.040730,sigmoid,0.05,3,0.5,COMPLETE
1869,1869,0.4840923547744751,2026-03-14 05:49:29.708713,2026-03-14 05:49:43.558905,0 days 00:00:13.850192,tanh,0.0,3,0.5,COMPLETE
1870,1870,0.45277029275894165,2026-03-14 05:49:43.716861,2026-03-14 05:49:57.938272,0 days 00:00:14.221411,tanh,0.0,3,0.5,COMPLETE
1871,1871,0.5486207008361816,2026-03-14 05:49:58.082032,2026-03-14 05:50:12.181655,0 days 00:00:14.099623,tanh,0.0,4,0.5,COMPLETE
1872,1872,0.4758285582065582,2026-03-14 05:50:12.329993,2026-03-14 05:50:26.340932,0 days 00:00:14.010939,tanh,0.0,3,0.5,COMPLETE
1873,1873,0.4115488529205322,2026-03-14 05:50:26.473944,2026-03-14 05:50:40.440623,0 days 00:00:13.966679,tanh,0.0,3,0.5,COMPLETE
1874,1874,0.44599881768226624,2026-03-14 05:50:40.612661,2026-03-14 05:50:54.651478,0 days 00:00:14.038817,tanh,0.0,3,0.5,COMPLETE
1875,1875,0.42624276876449585,2026-03-14 05:50:54.792679,2026-03-14 05:51:09.106468,0 days 00:00:14.313789,tanh,0.0,3,0.5,COMPLETE
1876,1876,0.47242844104766846,2026-03-14 05:51:09.259636,2026-03-14 05:51:23.385239,0 days 00:00:14.125603,tanh,0.0,3,0.5,COMPLETE
1877,1877,0.5374758839607239,2026-03-14 05:51:23.535982,2026-03-14 05:51:37.456251,0 days 00:00:13.920269,tanh,0.0,3,0.5,COMPLETE
1878,1878,0.499931275844574,2026-03-14 05:51:37.594396,2026-03-14 05:51:51.689084,0 days 00:00:14.094688,tanh,0.0,3,0.5,COMPLETE
1879,1879,0.43919259309768677,2026-03-14 05:51:51.834846,2026-03-14 05:52:06.181167,0 days 00:00:14.346321,tanh,0.05,3,0.5,COMPLETE
1880,1880,0.4624433219432831,2026-03-14 05:52:06.323691,2026-03-14 05:52:20.345078,0 days 00:00:14.021387,tanh,0.0,3,0.5,COMPLETE
1881,1881,0.4771711826324463,2026-03-14 05:52:20.504601,2026-03-14 05:52:34.373930,0 days 00:00:13.869329,tanh,0.0,3,0.5,COMPLETE
1882,1882,0.501819908618927,2026-03-14 05:52:34.501443,2026-03-14 05:52:48.347957,0 days 00:00:13.846514,relu,0.0,3,0.5,COMPLETE
1883,1883,0.4547136127948761,2026-03-14 05:52:48.477474,2026-03-14 05:53:02.544783,0 days 00:00:14.067309,tanh,0.05,3,0.5,COMPLETE
1884,1884,0.4449094533920288,2026-03-14 05:53:02.724821,2026-03-14 05:53:16.627776,0 days 00:00:13.902955,tanh,0.0,3,0.5,COMPLETE
1885,1885,0.46180301904678345,2026-03-14 05:53:16.779320,2026-03-14 05:53:30.560374,0 days 00:00:13.781054,tanh,0.0,2,0.5,COMPLETE
1886,1886,0.4105396568775177,2026-03-14 05:53:30.723405,2026-03-14 05:53:44.485625,0 days 00:00:13.762220,tanh,0.0,3,0.5,COMPLETE
1887,1887,0.4641958773136139,2026-03-14 05:53:44.635145,2026-03-14 05:53:58.669904,0 days 00:00:14.034759,tanh,0.0,3,0.5,COMPLETE
1888,1888,0.6423461437225342,2026-03-14 05:53:58.827093,2026-03-14 05:54:13.575119,0 days 00:00:14.748026,tanh,0.0,7,0.5,COMPLETE
1889,1889,0.4908769130706787,2026-03-14 05:54:13.728142,2026-03-14 05:54:27.820557,0 days 00:00:14.092415,tanh,0.0,3,0.5,COMPLETE
1890,1890,0.4576722979545593,2026-03-14 05:54:27.953115,2026-03-14 05:54:42.032773,0 days 00:00:14.079658,tanh,0.0,3,0.5,COMPLETE
1891,1891,0.643447756767273,2026-03-14 05:54:42.168773,2026-03-14 05:54:56.271632,0 days 00:00:14.102859,sigmoid,0.0,3,0.5,COMPLETE
1892,1892,0.4531380534172058,2026-03-14 05:54:56.400154,2026-03-14 05:55:10.564244,0 days 00:00:14.164090,tanh,0.05,3,0.5,COMPLETE
1893,1893,0.4108681082725525,2026-03-14 05:55:10.723793,2026-03-14 05:55:24.773359,0 days 00:00:14.049566,tanh,0.0,3,0.5,COMPLETE
1894,1894,0.4275483191013336,2026-03-14 05:55:24.900363,2026-03-14 05:55:39.006350,0 days 00:00:14.105987,tanh,0.0,3,0.5,COMPLETE
1895,1895,0.4358086585998535,2026-03-14 05:55:39.143541,2026-03-14 05:55:53.056835,0 days 00:00:13.913294,tanh,0.0,3,0.5,COMPLETE
1896,1896,0.4742363393306732,2026-03-14 05:55:53.185932,2026-03-14 05:56:06.953056,0 days 00:00:13.767124,tanh,0.0,3,0.5,COMPLETE
1897,1897,0.45594727993011475,2026-03-14 05:56:07.086092,2026-03-14 05:56:20.923950,0 days 00:00:13.837858,tanh,0.0,3,0.5,COMPLETE
1898,1898,0.4633873999118805,2026-03-14 05:56:21.256589,2026-03-14 05:56:35.357002,0 days 00:00:14.100413,tanh,0.05,3,0.5,COMPLETE
1899,1899,0.4774697721004486,2026-03-14 05:56:35.488453,2026-03-14 05:56:49.421449,0 days 00:00:13.932996,tanh,0.0,3,0.5,COMPLETE
1900,1900,0.6418413519859314,2026-03-14 05:56:49.576523,2026-03-14 05:57:03.808355,0 days 00:00:14.231832,tanh,0.0,4,0.5,COMPLETE
1901,1901,0.47818470001220703,2026-03-14 05:57:04.149506,2026-03-14 05:57:18.155286,0 days 00:00:14.005780,tanh,0.0,3,0.5,COMPLETE
1902,1902,0.4348980486392975,2026-03-14 05:57:18.315325,2026-03-14 05:57:32.242654,0 days 00:00:13.927329,tanh,0.0,3,0.5,COMPLETE
1903,1903,0.47531917691230774,2026-03-14 05:57:32.374170,2026-03-14 05:57:46.375072,0 days 00:00:14.000902,tanh,0.0,3,0.5,COMPLETE
1904,1904,0.4676942825317383,2026-03-14 05:57:46.676615,2026-03-14 05:58:00.546085,0 days 00:00:13.869470,tanh,0.0,3,0.5,COMPLETE
1905,1905,0.7811362147331238,2026-03-14 05:58:00.683623,2026-03-14 05:58:15.271169,0 days 00:00:14.587546,relu,0.15000000000000002,5,0.5,COMPLETE
1906,1906,0.45427554845809937,2026-03-14 05:58:15.428682,2026-03-14 05:58:29.207640,0 days 00:00:13.778958,tanh,0.0,3,0.5,COMPLETE
1907,1907,0.701612651348114,2026-03-14 05:58:29.339176,2026-03-14 05:58:42.980970,0 days 00:00:13.641794,tanh,0.0,3,0.5,COMPLETE
1908,1908,0.5025663375854492,2026-03-14 05:58:43.104510,2026-03-14 05:58:57.016108,0 days 00:00:13.911598,tanh,0.0,3,0.5,COMPLETE
1909,1909,0.4458083212375641,2026-03-14 05:58:57.163419,2026-03-14 05:59:11.559885,0 days 00:00:14.396466,tanh,0.05,3,0.5,COMPLETE
1910,1910,0.4587966799736023,2026-03-14 05:59:11.696414,2026-03-14 05:59:25.660218,0 days 00:00:13.963804,tanh,0.0,3,0.5,COMPLETE
1911,1911,0.4591200351715088,2026-03-14 05:59:25.805732,2026-03-14 05:59:39.898434,0 days 00:00:14.092702,tanh,0.0,3,0.5,COMPLETE
1912,1912,0.49312296509742737,2026-03-14 05:59:40.029461,2026-03-14 05:59:54.139554,0 days 00:00:14.110093,tanh,0.0,2,0.5,COMPLETE
1913,1913,0.6428239345550537,2026-03-14 05:59:54.270564,2026-03-14 06:00:08.436992,0 days 00:00:14.166428,sigmoid,0.0,4,0.5,COMPLETE
1914,1914,0.4811265468597412,2026-03-14 06:00:08.594015,2026-03-14 06:00:22.603309,0 days 00:00:14.009294,tanh,0.0,3,0.5,COMPLETE
1915,1915,0.46718811988830566,2026-03-14 06:00:22.739501,2026-03-14 06:00:37.110871,0 days 00:00:14.371370,tanh,0.5,3,0.5,COMPLETE
1916,1916,0.43870455026626587,2026-03-14 06:00:37.258478,2026-03-14 06:00:51.528078,0 days 00:00:14.269600,tanh,0.0,3,0.5,COMPLETE
1917,1917,0.44784456491470337,2026-03-14 06:00:51.705021,2026-03-14 06:01:05.940968,0 days 00:00:14.235947,tanh,0.4,3,0.5,COMPLETE
1918,1918,0.47548478841781616,2026-03-14 06:01:06.091995,2026-03-14 06:01:19.963766,0 days 00:00:13.871771,tanh,0.0,3,0.5,COMPLETE
1919,1919,0.45312127470970154,2026-03-14 06:01:20.310171,2026-03-14 06:01:34.284688,0 days 00:00:13.974517,tanh,0.05,3,0.5,COMPLETE
1920,1920,0.44049739837646484,2026-03-14 06:01:34.445715,2026-03-14 06:01:48.168080,0 days 00:00:13.722365,tanh,0.0,3,0.5,COMPLETE
1921,1921,0.4299125075340271,2026-03-14 06:01:48.311114,2026-03-14 06:02:02.003214,0 days 00:00:13.692100,tanh,0.0,3,0.5,COMPLETE
1922,1922,0.46939992904663086,2026-03-14 06:02:02.336551,2026-03-14 06:02:16.175064,0 days 00:00:13.838513,tanh,0.0,3,0.5,COMPLETE
1923,1923,0.42795440554618835,2026-03-14 06:02:16.303582,2026-03-14 06:02:29.998614,0 days 00:00:13.695032,tanh,0.0,3,0.5,COMPLETE
1924,1924,0.43635568022727966,2026-03-14 06:02:30.136147,2026-03-14 06:02:43.985789,0 days 00:00:13.849642,tanh,0.0,3,0.5,COMPLETE
1925,1925,0.5027651786804199,2026-03-14 06:02:44.288993,2026-03-14 06:02:58.276727,0 days 00:00:13.987734,tanh,0.0,3,0.5,COMPLETE
1926,1926,0.43992969393730164,2026-03-14 06:02:58.422238,2026-03-14 06:03:12.396924,0 days 00:00:13.974686,tanh,0.05,3,0.5,COMPLETE
1927,1927,0.4688883125782013,2026-03-14 06:03:12.535438,2026-03-14 06:03:26.515568,0 days 00:00:13.980130,tanh,0.0,3,0.5,COMPLETE
1928,1928,0.5034151673316956,2026-03-14 06:03:26.816103,2026-03-14 06:03:40.592462,0 days 00:00:13.776359,relu,0.0,3,0.5,COMPLETE
1929,1929,0.4488717019557953,2026-03-14 06:03:40.723975,2026-03-14 06:03:54.778687,0 days 00:00:14.054712,tanh,0.0,3,0.5,COMPLETE
1930,1930,0.4268316924571991,2026-03-14 06:03:54.934712,2026-03-14 06:04:08.971056,0 days 00:00:14.036344,tanh,0.0,3,0.5,COMPLETE
1931,1931,0.9497827887535095,2026-03-14 06:04:09.099199,2026-03-14 06:04:23.835692,0 days 00:00:14.736493,tanh,0.0,8,0.5,COMPLETE
1932,1932,0.46701502799987793,2026-03-14 06:04:23.975243,2026-03-14 06:04:37.862445,0 days 00:00:13.887202,tanh,0.0,3,0.5,COMPLETE
1933,1933,0.43988749384880066,2026-03-14 06:04:37.999965,2026-03-14 06:04:51.885807,0 days 00:00:13.885842,tanh,0.0,3,0.5,COMPLETE
1934,1934,0.45752066373825073,2026-03-14 06:04:52.034836,2026-03-14 06:05:06.276054,0 days 00:00:14.241218,tanh,0.0,3,0.5,COMPLETE
1935,1935,0.5118590593338013,2026-03-14 06:05:06.409572,2026-03-14 06:05:20.340553,0 days 00:00:13.930981,sigmoid,0.05,2,0.5,COMPLETE
1936,1936,0.45095905661582947,2026-03-14 06:05:20.476580,2026-03-14 06:05:34.255741,0 days 00:00:13.779161,tanh,0.0,3,0.5,COMPLETE
1937,1937,0.41885772347450256,2026-03-14 06:05:34.407255,2026-03-14 06:05:48.414676,0 days 00:00:14.007421,tanh,0.0,3,0.5,COMPLETE
1938,1938,0.4345182180404663,2026-03-14 06:05:48.544184,2026-03-14 06:06:02.517529,0 days 00:00:13.973345,tanh,0.0,3,0.5,COMPLETE
1939,1939,0.4879711866378784,2026-03-14 06:06:02.696569,2026-03-14 06:06:16.580065,0 days 00:00:13.883496,tanh,0.0,3,0.5,COMPLETE
1940,1940,0.4627656042575836,2026-03-14 06:06:16.731593,2026-03-14 06:06:30.701268,0 days 00:00:13.969675,tanh,0.0,3,0.5,COMPLETE
1941,1941,0.4461769163608551,2026-03-14 06:06:30.860794,2026-03-14 06:06:44.593139,0 days 00:00:13.732345,tanh,0.0,3,0.5,COMPLETE
1942,1942,0.46701696515083313,2026-03-14 06:06:44.740973,2026-03-14 06:06:58.849513,0 days 00:00:14.108540,tanh,0.05,3,0.5,COMPLETE
1943,1943,0.4190092980861664,2026-03-14 06:06:58.986625,2026-03-14 06:07:13.053977,0 days 00:00:14.067352,tanh,0.0,3,0.5,COMPLETE
1944,1944,0.45632198452949524,2026-03-14 06:07:13.375212,2026-03-14 06:07:27.247258,0 days 00:00:13.872046,tanh,0.0,3,0.5,COMPLETE
1945,1945,0.460986852645874,2026-03-14 06:07:27.384770,2026-03-14 06:07:41.326807,0 days 00:00:13.942037,tanh,0.0,3,0.5,COMPLETE
1946,1946,0.475962370634079,2026-03-14 06:07:41.472328,2026-03-14 06:07:55.448937,0 days 00:00:13.976609,tanh,0.0,3,0.5,COMPLETE
1947,1947,0.44889408349990845,2026-03-14 06:07:55.740478,2026-03-14 06:08:09.780094,0 days 00:00:14.039616,tanh,0.0,4,0.5,COMPLETE
1948,1948,0.4542449116706848,2026-03-14 06:08:09.915607,2026-03-14 06:08:24.161954,0 days 00:00:14.246347,tanh,0.45,3,0.5,COMPLETE
1949,1949,0.4778072237968445,2026-03-14 06:08:24.294018,2026-03-14 06:08:38.379279,0 days 00:00:14.085261,tanh,0.05,3,0.55,COMPLETE
1950,1950,0.5047789812088013,2026-03-14 06:08:38.535803,2026-03-14 06:08:52.780560,0 days 00:00:14.244757,tanh,0.0,3,0.5,COMPLETE
1951,1951,0.4702044725418091,2026-03-14 06:08:52.916083,2026-03-14 06:09:06.689192,0 days 00:00:13.773109,relu,0.0,3,0.5,COMPLETE
1952,1952,0.5165773630142212,2026-03-14 06:09:06.860710,2026-03-14 06:09:20.995039,0 days 00:00:14.134329,tanh,0.0,3,0.55,COMPLETE
1953,1953,0.48879843950271606,2026-03-14 06:09:21.135557,2026-03-14 06:09:34.946792,0 days 00:00:13.811235,tanh,0.0,3,0.5,COMPLETE
1954,1954,0.4853507876396179,2026-03-14 06:09:35.090891,2026-03-14 06:09:49.131174,0 days 00:00:14.040283,tanh,0.0,3,0.5,COMPLETE
1955,1955,0.43478599190711975,2026-03-14 06:09:49.263773,2026-03-14 06:10:03.377421,0 days 00:00:14.113648,tanh,0.0,3,0.55,COMPLETE
1956,1956,0.6419034600257874,2026-03-14 06:10:03.542452,2026-03-14 06:10:17.877790,0 days 00:00:14.335338,tanh,0.0,5,0.5,COMPLETE
1957,1957,0.532854437828064,2026-03-14 06:10:18.028824,2026-03-14 06:10:32.029903,0 days 00:00:14.001079,tanh,0.05,3,0.5,COMPLETE
1958,1958,0.6429952383041382,2026-03-14 06:10:32.166875,2026-03-14 06:10:46.432099,0 days 00:00:14.265224,sigmoid,0.0,3,0.55,COMPLETE
1959,1959,0.4417150020599365,2026-03-14 06:10:46.554143,2026-03-14 06:11:00.839890,0 days 00:00:14.285747,tanh,0.30000000000000004,3,0.55,COMPLETE
1960,1960,0.4387880265712738,2026-03-14 06:11:00.993535,2026-03-14 06:11:15.018539,0 days 00:00:14.025004,tanh,0.0,3,0.5,COMPLETE
1961,1961,0.4317227005958557,2026-03-14 06:11:15.158371,2026-03-14 06:11:29.125754,0 days 00:00:13.967383,tanh,0.0,3,0.5,COMPLETE
1962,1962,0.4848370850086212,2026-03-14 06:11:29.268203,2026-03-14 06:11:43.164833,0 days 00:00:13.896630,tanh,0.0,2,0.55,COMPLETE
1963,1963,0.4418405294418335,2026-03-14 06:11:43.299856,2026-03-14 06:11:57.456534,0 days 00:00:14.156678,tanh,0.15000000000000002,3,0.5,COMPLETE
1964,1964,0.4466143846511841,2026-03-14 06:11:57.621563,2026-03-14 06:12:11.782673,0 days 00:00:14.161110,tanh,0.0,3,0.5,COMPLETE
1965,1965,0.47868770360946655,2026-03-14 06:12:11.912404,2026-03-14 06:12:26.056218,0 days 00:00:14.143814,tanh,0.0,3,0.55,COMPLETE
1966,1966,0.47138711810112,2026-03-14 06:12:26.212549,2026-03-14 06:12:40.188730,0 days 00:00:13.976181,tanh,0.05,3,0.5,COMPLETE
1967,1967,0.4644603133201599,2026-03-14 06:12:40.321272,2026-03-14 06:12:54.417168,0 days 00:00:14.095896,tanh,0.0,3,0.5,COMPLETE
1968,1968,0.4822002947330475,2026-03-14 06:12:54.555692,2026-03-14 06:13:08.688789,0 days 00:00:14.133097,tanh,0.0,3,0.5,COMPLETE
1969,1969,0.49361515045166016,2026-03-14 06:13:08.820858,2026-03-14 06:13:22.723418,0 days 00:00:13.902560,relu,0.0,3,0.5,COMPLETE
1970,1970,0.4533151388168335,2026-03-14 06:13:22.875970,2026-03-14 06:13:36.825891,0 days 00:00:13.949921,tanh,0.0,3,0.55,COMPLETE
1971,1971,0.45559078454971313,2026-03-14 06:13:37.000455,2026-03-14 06:13:50.952482,0 days 00:00:13.952027,tanh,0.0,4,0.5,COMPLETE
1972,1972,0.6424115896224976,2026-03-14 06:13:51.087996,2026-03-14 06:14:05.493046,0 days 00:00:14.405050,tanh,0.0,6,0.55,COMPLETE
1973,1973,0.4495495557785034,2026-03-14 06:14:05.683088,2026-03-14 06:14:19.870408,0 days 00:00:14.187320,tanh,0.0,3,0.5,COMPLETE
1974,1974,0.49116194248199463,2026-03-14 06:14:20.021919,2026-03-14 06:14:34.211431,0 days 00:00:14.189512,tanh,0.05,3,0.5,COMPLETE
1975,1975,0.4981715977191925,2026-03-14 06:14:34.359016,2026-03-14 06:14:48.443014,0 days 00:00:14.083998,tanh,0.0,3,0.55,COMPLETE
1976,1976,0.5026484131813049,2026-03-14 06:14:48.598038,2026-03-14 06:15:02.613547,0 days 00:00:14.015509,tanh,0.0,3,0.5,COMPLETE
1977,1977,0.4787358343601227,2026-03-14 06:15:02.981100,2026-03-14 06:15:17.300391,0 days 00:00:14.319291,tanh,0.2,3,0.55,COMPLETE
1978,1978,0.6413974761962891,2026-03-14 06:15:17.437902,2026-03-14 06:15:31.423195,0 days 00:00:13.985293,sigmoid,0.0,3,0.5,COMPLETE
1979,1979,0.45792850852012634,2026-03-14 06:15:31.582721,2026-03-14 06:15:45.553990,0 days 00:00:13.971269,tanh,0.0,3,0.5,COMPLETE
1980,1980,0.43302494287490845,2026-03-14 06:15:45.848548,2026-03-14 06:15:59.750880,0 days 00:00:13.902332,tanh,0.0,3,0.5,COMPLETE
1981,1981,0.4812547564506531,2026-03-14 06:15:59.895392,2026-03-14 06:16:13.878162,0 days 00:00:13.982770,tanh,0.0,3,0.55,COMPLETE
1982,1982,0.48894181847572327,2026-03-14 06:16:14.016012,2026-03-14 06:16:27.914310,0 days 00:00:13.898298,tanh,0.0,3,0.5,COMPLETE
1983,1983,0.4382787346839905,2026-03-14 06:16:28.051357,2026-03-14 06:16:42.227339,0 days 00:00:14.175982,tanh,0.0,3,0.55,COMPLETE
1984,1984,0.465856671333313,2026-03-14 06:16:42.360384,2026-03-14 06:16:56.293715,0 days 00:00:13.933331,tanh,0.0,3,0.5,COMPLETE
1985,1985,0.470456063747406,2026-03-14 06:16:56.428726,2026-03-14 06:17:10.751850,0 days 00:00:14.323124,tanh,0.05,3,0.5,COMPLETE
1986,1986,0.46267861127853394,2026-03-14 06:17:11.055912,2026-03-14 06:17:25.100511,0 days 00:00:14.044599,tanh,0.0,3,0.55,COMPLETE
