,number,value,datetime_start,datetime_complete,duration,params_activation,params_dropout,params_layers,params_shrink,state
2812,2812,0.4734034836292267,2026-03-14 09:36:52.260774,2026-03-14 09:37:09.011096,0 days 00:00:16.750322,tanh,0.0,3,0.55,COMPLETE
2813,2813,0.6435182690620422,2026-03-14 09:37:09.157120,2026-03-14 09:37:26.072169,0 days 00:00:16.915049,tanh,0.0,5,0.5,COMPLETE
2814,2814,0.6425198912620544,2026-03-14 09:37:26.226720,2026-03-14 09:37:42.529996,0 days 00:00:16.303276,sigmoid,0.0,3,0.5,COMPLETE
2815,2815,0.42808976769447327,2026-03-14 09:37:42.682788,2026-03-14 09:37:59.480724,0 days 00:00:16.797936,tanh,0.0,3,0.55,COMPLETE
2816,2816,0.43197882175445557,2026-03-14 09:37:59.634024,2026-03-14 09:38:15.499740,0 days 00:00:15.865716,tanh,0.0,3,0.5,COMPLETE
2817,2817,0.4893459975719452,2026-03-14 09:38:15.631257,2026-03-14 09:38:31.018062,0 days 00:00:15.386805,tanh,0.0,2,0.65,COMPLETE
2818,2818,0.44697266817092896,2026-03-14 09:38:31.181000,2026-03-14 09:38:46.782231,0 days 00:00:15.601231,tanh,0.5,3,0.5,COMPLETE
2819,2819,0.4562571048736572,2026-03-14 09:38:46.968144,2026-03-14 09:39:02.640394,0 days 00:00:15.672250,tanh,0.05,3,0.6,COMPLETE
2820,2820,0.43840381503105164,2026-03-14 09:39:02.816433,2026-03-14 09:39:18.331942,0 days 00:00:15.515509,tanh,0.0,3,0.55,COMPLETE
2821,2821,0.45632413029670715,2026-03-14 09:39:18.490972,2026-03-14 09:39:34.494009,0 days 00:00:16.003037,tanh,0.30000000000000004,3,0.5,COMPLETE
2822,2822,0.47114866971969604,2026-03-14 09:39:34.638523,2026-03-14 09:39:50.178958,0 days 00:00:15.540435,tanh,0.0,3,0.65,COMPLETE
2823,2823,0.43645042181015015,2026-03-14 09:39:50.359726,2026-03-14 09:40:05.888113,0 days 00:00:15.528387,tanh,0.0,3,0.5,COMPLETE
2824,2824,0.45282816886901855,2026-03-14 09:40:06.032930,2026-03-14 09:40:22.053168,0 days 00:00:16.020238,tanh,0.0,3,0.55,COMPLETE
2825,2825,0.4849090576171875,2026-03-14 09:40:22.220355,2026-03-14 09:40:37.574899,0 days 00:00:15.354544,tanh,0.05,3,0.5,COMPLETE
2826,2826,0.4734707176685333,2026-03-14 09:40:37.739924,2026-03-14 09:40:53.235321,0 days 00:00:15.495397,relu,0.0,3,0.6,COMPLETE
2827,2827,0.5020171999931335,2026-03-14 09:40:53.404833,2026-03-14 09:41:09.018497,0 days 00:00:15.613664,tanh,0.0,3,0.5,COMPLETE
2828,2828,0.4583240747451782,2026-03-14 09:41:09.167891,2026-03-14 09:41:24.673327,0 days 00:00:15.505436,tanh,0.0,3,0.6,COMPLETE
2829,2829,0.465774804353714,2026-03-14 09:41:24.808846,2026-03-14 09:41:40.379060,0 days 00:00:15.570214,tanh,0.0,3,0.65,COMPLETE
2830,2830,0.49482282996177673,2026-03-14 09:41:40.581099,2026-03-14 09:41:56.116687,0 days 00:00:15.535588,tanh,0.0,3,0.5,COMPLETE
2831,2831,0.47155502438545227,2026-03-14 09:41:56.294713,2026-03-14 09:42:11.653733,0 days 00:00:15.359020,tanh,0.0,3,0.55,COMPLETE
2832,2832,0.459320604801178,2026-03-14 09:42:11.808425,2026-03-14 09:42:27.159946,0 days 00:00:15.351521,tanh,0.0,3,0.5,COMPLETE
2833,2833,0.43761539459228516,2026-03-14 09:42:27.337966,2026-03-14 09:42:42.984077,0 days 00:00:15.646111,tanh,0.0,3,0.5,COMPLETE
2834,2834,0.43061181902885437,2026-03-14 09:42:43.149603,2026-03-14 09:42:58.677140,0 days 00:00:15.527537,tanh,0.4,3,0.65,COMPLETE
2835,2835,0.45787155628204346,2026-03-14 09:42:58.824670,2026-03-14 09:43:15.267562,0 days 00:00:16.442892,tanh,0.05,3,0.55,COMPLETE
2836,2836,0.6471888422966003,2026-03-14 09:43:15.417591,2026-03-14 09:43:31.207280,0 days 00:00:15.789689,sigmoid,0.0,3,1.0,COMPLETE
2837,2837,0.4630419611930847,2026-03-14 09:43:31.368301,2026-03-14 09:43:47.418429,0 days 00:00:16.050128,tanh,0.0,3,0.5,COMPLETE
2838,2838,0.41955530643463135,2026-03-14 09:43:47.584941,2026-03-14 09:44:03.050065,0 days 00:00:15.465124,tanh,0.0,3,0.6,COMPLETE
2839,2839,0.4509508013725281,2026-03-14 09:44:03.213580,2026-03-14 09:44:18.820321,0 days 00:00:15.606741,tanh,0.1,3,0.5,COMPLETE
2840,2840,0.6428432464599609,2026-03-14 09:44:18.961959,2026-03-14 09:44:35.519338,0 days 00:00:16.557379,tanh,0.0,8,0.65,COMPLETE
2841,2841,0.4520776569843292,2026-03-14 09:44:35.672975,2026-03-14 09:44:51.121671,0 days 00:00:15.448696,tanh,0.0,3,0.5,COMPLETE
2842,2842,0.47064802050590515,2026-03-14 09:44:51.426171,2026-03-14 09:45:06.865553,0 days 00:00:15.439382,tanh,0.0,3,0.5,COMPLETE
2843,2843,0.478807657957077,2026-03-14 09:45:07.022066,2026-03-14 09:45:22.537273,0 days 00:00:15.515207,tanh,0.0,4,0.55,COMPLETE
2844,2844,0.457878053188324,2026-03-14 09:45:22.860671,2026-03-14 09:45:38.211225,0 days 00:00:15.350554,tanh,0.05,3,0.6,COMPLETE
2845,2845,0.44572049379348755,2026-03-14 09:45:38.378920,2026-03-14 09:45:53.875484,0 days 00:00:15.496564,tanh,0.0,3,0.5,COMPLETE
2846,2846,0.47333866357803345,2026-03-14 09:45:54.227662,2026-03-14 09:46:09.832754,0 days 00:00:15.605092,tanh,0.0,3,0.95,COMPLETE
2847,2847,0.4936342239379883,2026-03-14 09:46:10.188363,2026-03-14 09:46:25.341696,0 days 00:00:15.153333,tanh,0.0,2,0.55,COMPLETE
2848,2848,0.47769007086753845,2026-03-14 09:46:25.570819,2026-03-14 09:46:41.120524,0 days 00:00:15.549705,relu,0.0,3,0.65,COMPLETE
2849,2849,0.4234500229358673,2026-03-14 09:46:41.269042,2026-03-14 09:46:56.835383,0 days 00:00:15.566341,tanh,0.0,3,0.5,COMPLETE
2850,2850,0.44649264216423035,2026-03-14 09:46:56.991907,2026-03-14 09:47:12.622106,0 days 00:00:15.630199,tanh,0.0,3,0.55,COMPLETE
2851,2851,0.4566689431667328,2026-03-14 09:47:12.779131,2026-03-14 09:47:28.680075,0 days 00:00:15.900944,tanh,0.05,3,0.5,COMPLETE
2852,2852,0.4417405426502228,2026-03-14 09:47:28.843879,2026-03-14 09:47:45.362973,0 days 00:00:16.519094,tanh,0.0,3,0.6,COMPLETE
2853,2853,0.4450317919254303,2026-03-14 09:47:45.521512,2026-03-14 09:48:00.604141,0 days 00:00:15.082629,tanh,0.0,3,0.5,COMPLETE
2854,2854,0.4443897008895874,2026-03-14 09:48:00.744667,2026-03-14 09:48:16.026204,0 days 00:00:15.281537,tanh,0.0,3,0.65,COMPLETE
2855,2855,0.6418917775154114,2026-03-14 09:48:16.165506,2026-03-14 09:48:31.760641,0 days 00:00:15.595135,tanh,0.0,7,0.5,COMPLETE
2856,2856,0.46341776847839355,2026-03-14 09:48:31.894677,2026-03-14 09:48:47.803127,0 days 00:00:15.908450,tanh,0.0,3,0.6,COMPLETE
2857,2857,0.45087531208992004,2026-03-14 09:48:48.163244,2026-03-14 09:49:04.393404,0 days 00:00:16.230160,tanh,0.0,3,0.55,COMPLETE
2858,2858,0.47865262627601624,2026-03-14 09:49:04.560837,2026-03-14 09:49:20.204398,0 days 00:00:15.643561,tanh,0.0,3,0.5,COMPLETE
2859,2859,0.48300740122795105,2026-03-14 09:49:20.345023,2026-03-14 09:49:35.801970,0 days 00:00:15.456947,tanh,0.05,3,0.5,COMPLETE
2860,2860,0.6445171236991882,2026-03-14 09:49:35.943008,2026-03-14 09:49:51.936704,0 days 00:00:15.993696,sigmoid,0.45,3,0.65,COMPLETE
2861,2861,0.4592379927635193,2026-03-14 09:49:52.076215,2026-03-14 09:50:07.332405,0 days 00:00:15.256190,tanh,0.0,3,0.5,COMPLETE
2862,2862,0.44964659214019775,2026-03-14 09:50:07.488134,2026-03-14 09:50:23.403308,0 days 00:00:15.915174,tanh,0.0,3,0.55,COMPLETE
2863,2863,0.4818791449069977,2026-03-14 09:50:23.543656,2026-03-14 09:50:39.456230,0 days 00:00:15.912574,tanh,0.0,3,0.6,COMPLETE
2864,2864,0.4746934771537781,2026-03-14 09:50:39.599934,2026-03-14 09:50:55.187576,0 days 00:00:15.587642,tanh,0.0,3,0.5,COMPLETE
2865,2865,0.45962265133857727,2026-03-14 09:50:55.398189,2026-03-14 09:51:10.820137,0 days 00:00:15.421948,tanh,0.0,3,0.5,COMPLETE
2866,2866,0.6416334509849548,2026-03-14 09:51:10.981171,2026-03-14 09:51:26.798298,0 days 00:00:15.817127,tanh,0.0,4,0.55,COMPLETE
2867,2867,0.5196821093559265,2026-03-14 09:51:26.969818,2026-03-14 09:51:42.334239,0 days 00:00:15.364421,tanh,0.05,2,0.5,COMPLETE
2868,2868,0.46739888191223145,2026-03-14 09:51:42.473561,2026-03-14 09:51:57.741780,0 days 00:00:15.268219,tanh,0.0,3,0.65,COMPLETE
2869,2869,0.4721764028072357,2026-03-14 09:51:57.999803,2026-03-14 09:52:13.337436,0 days 00:00:15.337633,tanh,0.0,3,0.6,COMPLETE
2870,2870,0.4513383209705353,2026-03-14 09:52:13.475967,2026-03-14 09:52:29.008613,0 days 00:00:15.532646,relu,0.0,3,0.5,COMPLETE
2871,2871,0.4209215044975281,2026-03-14 09:52:29.194865,2026-03-14 09:52:44.235197,0 days 00:00:15.040332,tanh,0.0,3,0.55,COMPLETE
2872,2872,0.44118887186050415,2026-03-14 09:52:44.406799,2026-03-14 09:52:59.547999,0 days 00:00:15.141200,tanh,0.0,3,0.5,COMPLETE
2873,2873,0.45585498213768005,2026-03-14 09:52:59.725521,2026-03-14 09:53:14.900763,0 days 00:00:15.175242,tanh,0.0,3,0.65,COMPLETE
2874,2874,0.4355936348438263,2026-03-14 09:53:15.075790,2026-03-14 09:53:30.304188,0 days 00:00:15.228398,tanh,0.0,3,0.55,COMPLETE
2875,2875,0.44373828172683716,2026-03-14 09:53:30.494094,2026-03-14 09:53:46.504390,0 days 00:00:16.010296,tanh,0.25,3,0.5,COMPLETE
2876,2876,0.4480155110359192,2026-03-14 09:53:46.656759,2026-03-14 09:54:01.905138,0 days 00:00:15.248379,tanh,0.05,3,0.5,COMPLETE
2877,2877,0.454271525144577,2026-03-14 09:54:02.046654,2026-03-14 09:54:17.525421,0 days 00:00:15.478767,tanh,0.0,3,0.6,COMPLETE
2878,2878,0.41396936774253845,2026-03-14 09:54:17.710499,2026-03-14 09:54:32.960864,0 days 00:00:15.250365,tanh,0.0,3,0.5,COMPLETE
2879,2879,0.42236676812171936,2026-03-14 09:54:33.145450,2026-03-14 09:54:48.599008,0 days 00:00:15.453558,tanh,0.0,3,0.55,COMPLETE
2880,2880,0.6437920928001404,2026-03-14 09:54:48.763534,2026-03-14 09:55:03.768278,0 days 00:00:15.004744,sigmoid,0.0,3,0.6,COMPLETE
2881,2881,0.42563512921333313,2026-03-14 09:55:03.916454,2026-03-14 09:55:19.288045,0 days 00:00:15.371591,tanh,0.0,3,0.5,COMPLETE
2882,2882,0.44708991050720215,2026-03-14 09:55:19.456696,2026-03-14 09:55:34.804688,0 days 00:00:15.347992,tanh,0.0,3,0.65,COMPLETE
2883,2883,0.4885966181755066,2026-03-14 09:55:34.976719,2026-03-14 09:55:50.399332,0 days 00:00:15.422613,tanh,0.0,3,0.5,COMPLETE
2884,2884,0.46343618631362915,2026-03-14 09:55:50.573117,2026-03-14 09:56:05.996662,0 days 00:00:15.423545,tanh,0.05,4,0.6,COMPLETE
2885,2885,0.4412096440792084,2026-03-14 09:56:06.331293,2026-03-14 09:56:21.680826,0 days 00:00:15.349533,tanh,0.0,3,0.5,COMPLETE
2886,2886,0.46552082896232605,2026-03-14 09:56:21.843311,2026-03-14 09:56:37.200950,0 days 00:00:15.357639,tanh,0.0,3,0.65,COMPLETE
2887,2887,0.4772404432296753,2026-03-14 09:56:37.366090,2026-03-14 09:56:52.852998,0 days 00:00:15.486908,tanh,0.0,3,0.55,COMPLETE
2888,2888,0.4607650637626648,2026-03-14 09:56:53.016080,2026-03-14 09:57:08.276542,0 days 00:00:15.260462,tanh,0.0,3,0.5,COMPLETE
2889,2889,0.5664455890655518,2026-03-14 09:57:08.442692,2026-03-14 09:57:23.939520,0 days 00:00:15.496828,tanh,0.0,3,0.5,COMPLETE
2890,2890,0.48137369751930237,2026-03-14 09:57:24.104550,2026-03-14 09:57:39.642786,0 days 00:00:15.538236,tanh,0.0,3,0.55,COMPLETE
2891,2891,0.4846935570240021,2026-03-14 09:57:39.807977,2026-03-14 09:57:55.169815,0 days 00:00:15.361838,tanh,0.0,3,0.5,COMPLETE
2892,2892,0.48860964179039,2026-03-14 09:57:55.345426,2026-03-14 09:58:10.490463,0 days 00:00:15.145037,relu,0.0,3,0.65,COMPLETE
2893,2893,0.645350992679596,2026-03-14 09:58:10.658511,2026-03-14 09:58:26.980172,0 days 00:00:16.321661,tanh,0.05,7,0.5,COMPLETE
2894,2894,0.45724454522132874,2026-03-14 09:58:27.163841,2026-03-14 09:58:42.243037,0 days 00:00:15.079196,tanh,0.0,3,0.55,COMPLETE
2895,2895,0.4414491057395935,2026-03-14 09:58:42.523983,2026-03-14 09:58:57.346539,0 days 00:00:14.822556,tanh,0.0,3,0.6,COMPLETE
2896,2896,0.4856107831001282,2026-03-14 09:58:57.511504,2026-03-14 09:59:13.061914,0 days 00:00:15.550410,tanh,0.0,2,0.5,COMPLETE
2897,2897,0.45802247524261475,2026-03-14 09:59:13.389061,2026-03-14 09:59:28.699861,0 days 00:00:15.310800,tanh,0.0,3,0.5,COMPLETE
2898,2898,0.4374743402004242,2026-03-14 09:59:28.868900,2026-03-14 09:59:44.530491,0 days 00:00:15.661591,tanh,0.0,3,0.5,COMPLETE
2899,2899,0.41890594363212585,2026-03-14 09:59:44.691516,2026-03-14 09:59:59.982900,0 days 00:00:15.291384,tanh,0.0,3,0.6,COMPLETE
2900,2900,0.43385955691337585,2026-03-14 10:00:00.146421,2026-03-14 10:00:15.619180,0 days 00:00:15.472759,tanh,0.0,3,0.65,COMPLETE
2901,2901,0.441995769739151,2026-03-14 10:00:15.776704,2026-03-14 10:00:31.018841,0 days 00:00:15.242137,tanh,0.05,3,0.55,COMPLETE
2902,2902,0.6436474919319153,2026-03-14 10:00:31.220872,2026-03-14 10:00:46.633589,0 days 00:00:15.412717,sigmoid,0.0,3,0.5,COMPLETE
2903,2903,0.6424951553344727,2026-03-14 10:00:46.974160,2026-03-14 10:01:02.729135,0 days 00:00:15.754975,tanh,0.0,5,0.5,COMPLETE
2904,2904,0.47457823157310486,2026-03-14 10:01:02.893648,2026-03-14 10:01:18.106473,0 days 00:00:15.212825,tanh,0.0,3,0.55,COMPLETE
2905,2905,0.4303216338157654,2026-03-14 10:01:18.269006,2026-03-14 10:01:33.440524,0 days 00:00:15.171518,tanh,0.0,3,0.6,COMPLETE
2906,2906,0.4490973949432373,2026-03-14 10:01:33.595112,2026-03-14 10:01:49.133848,0 days 00:00:15.538736,tanh,0.05,3,0.65,COMPLETE
2907,2907,0.43041688203811646,2026-03-14 10:01:49.302371,2026-03-14 10:02:04.590113,0 days 00:00:15.287742,tanh,0.0,3,0.5,COMPLETE
2908,2908,0.4672864079475403,2026-03-14 10:02:04.753116,2026-03-14 10:02:20.042854,0 days 00:00:15.289738,tanh,0.0,3,0.5,COMPLETE
2909,2909,0.47291550040245056,2026-03-14 10:02:20.211881,2026-03-14 10:02:35.494633,0 days 00:00:15.282752,tanh,0.0,3,0.6,COMPLETE
2910,2910,0.4516313970088959,2026-03-14 10:02:35.654150,2026-03-14 10:02:51.031668,0 days 00:00:15.377518,tanh,0.15000000000000002,3,0.55,COMPLETE
2911,2911,0.410867303609848,2026-03-14 10:02:51.207694,2026-03-14 10:03:06.364326,0 days 00:00:15.156632,tanh,0.0,3,0.5,COMPLETE
2912,2912,0.45407992601394653,2026-03-14 10:03:06.532858,2026-03-14 10:03:21.471430,0 days 00:00:14.938572,tanh,0.0,3,0.65,COMPLETE
2913,2913,0.44973132014274597,2026-03-14 10:03:21.644033,2026-03-14 10:03:36.883655,0 days 00:00:15.239622,tanh,0.0,3,0.5,COMPLETE
2914,2914,0.4751368761062622,2026-03-14 10:03:37.048681,2026-03-14 10:03:52.206813,0 days 00:00:15.158132,relu,0.0,3,0.55,COMPLETE
2915,2915,0.44947949051856995,2026-03-14 10:03:52.380912,2026-03-14 10:04:07.750469,0 days 00:00:15.369557,tanh,0.05,3,0.6,COMPLETE
2916,2916,0.4229445457458496,2026-03-14 10:04:07.911002,2026-03-14 10:04:22.976693,0 days 00:00:15.065691,tanh,0.0,3,0.5,COMPLETE
2917,2917,0.43125301599502563,2026-03-14 10:04:23.143209,2026-03-14 10:04:38.344124,0 days 00:00:15.200915,tanh,0.0,3,0.5,COMPLETE
2918,2918,0.4406089782714844,2026-03-14 10:04:38.510663,2026-03-14 10:04:53.914621,0 days 00:00:15.403958,tanh,0.25,3,0.5,COMPLETE
2919,2919,0.4777514636516571,2026-03-14 10:04:54.087361,2026-03-14 10:05:09.821226,0 days 00:00:15.733865,tanh,0.0,4,0.65,COMPLETE
2920,2920,0.6422101259231567,2026-03-14 10:05:09.985270,2026-03-14 10:05:25.646103,0 days 00:00:15.660833,tanh,0.0,6,0.55,COMPLETE
2921,2921,0.4211215376853943,2026-03-14 10:05:25.804293,2026-03-14 10:05:41.600827,0 days 00:00:15.796534,tanh,0.0,3,0.5,COMPLETE
2922,2922,0.46786221861839294,2026-03-14 10:05:41.755417,2026-03-14 10:05:57.102315,0 days 00:00:15.346898,tanh,0.0,3,0.6,COMPLETE
2923,2923,0.4627014994621277,2026-03-14 10:05:57.262869,2026-03-14 10:06:13.139206,0 days 00:00:15.876337,tanh,0.05,3,0.55,COMPLETE
2924,2924,0.46960920095443726,2026-03-14 10:06:13.307734,2026-03-14 10:06:28.653317,0 days 00:00:15.345583,tanh,0.0,3,0.5,COMPLETE
2925,2925,0.49631085991859436,2026-03-14 10:06:28.815327,2026-03-14 10:06:44.105745,0 days 00:00:15.290418,sigmoid,0.0,2,0.65,COMPLETE
2926,2926,0.4474833905696869,2026-03-14 10:06:44.282775,2026-03-14 10:06:59.448341,0 days 00:00:15.165566,tanh,0.0,3,0.5,COMPLETE
2927,2927,0.44437915086746216,2026-03-14 10:06:59.621489,2026-03-14 10:07:14.785151,0 days 00:00:15.163662,tanh,0.0,3,0.55,COMPLETE
2928,2928,0.4430527091026306,2026-03-14 10:07:14.955844,2026-03-14 10:07:30.097436,0 days 00:00:15.141592,tanh,0.0,3,0.6,COMPLETE
2929,2929,0.4128126800060272,2026-03-14 10:07:30.271463,2026-03-14 10:07:45.324162,0 days 00:00:15.052699,tanh,0.0,3,0.5,COMPLETE
2930,2930,0.42755186557769775,2026-03-14 10:07:45.483766,2026-03-14 10:08:00.600359,0 days 00:00:15.116593,tanh,0.0,3,0.65,COMPLETE
2931,2931,0.4795759618282318,2026-03-14 10:08:00.770890,2026-03-14 10:08:15.752837,0 days 00:00:14.981947,tanh,0.0,3,0.5,COMPLETE
2932,2932,0.4278194308280945,2026-03-14 10:08:15.924862,2026-03-14 10:08:30.950202,0 days 00:00:15.025340,tanh,0.0,3,0.5,COMPLETE
2933,2933,0.42488640546798706,2026-03-14 10:08:31.095239,2026-03-14 10:08:46.268708,0 days 00:00:15.173469,tanh,0.0,3,0.55,COMPLETE
2934,2934,0.44203734397888184,2026-03-14 10:08:46.436841,2026-03-14 10:09:02.019159,0 days 00:00:15.582318,tanh,0.05,3,0.6,COMPLETE
2935,2935,0.4531897008419037,2026-03-14 10:09:02.203682,2026-03-14 10:09:17.482668,0 days 00:00:15.278986,relu,0.0,4,0.5,COMPLETE
2936,2936,0.43156903982162476,2026-03-14 10:09:17.675704,2026-03-14 10:09:33.225294,0 days 00:00:15.549590,tanh,0.0,3,0.5,COMPLETE
2937,2937,0.48680636286735535,2026-03-14 10:09:33.404942,2026-03-14 10:09:48.558047,0 days 00:00:15.153105,tanh,0.0,3,0.65,COMPLETE
2938,2938,0.4482029676437378,2026-03-14 10:09:48.726571,2026-03-14 10:10:04.168999,0 days 00:00:15.442428,tanh,0.0,3,0.5,COMPLETE
2939,2939,0.45924112200737,2026-03-14 10:10:04.354649,2026-03-14 10:10:19.396827,0 days 00:00:15.042178,tanh,0.0,3,0.55,COMPLETE
2940,2940,0.4592529833316803,2026-03-14 10:10:19.553717,2026-03-14 10:10:34.794921,0 days 00:00:15.241204,tanh,0.05,3,0.6,COMPLETE
2941,2941,0.47564926743507385,2026-03-14 10:10:34.952430,2026-03-14 10:10:50.083141,0 days 00:00:15.130711,tanh,0.0,3,0.5,COMPLETE
2942,2942,0.4886356592178345,2026-03-14 10:10:50.245167,2026-03-14 10:11:05.620150,0 days 00:00:15.374983,tanh,0.0,3,0.55,COMPLETE
2943,2943,0.4557209312915802,2026-03-14 10:11:05.788179,2026-03-14 10:11:20.912486,0 days 00:00:15.124307,tanh,0.0,3,0.65,COMPLETE
2944,2944,0.49013447761535645,2026-03-14 10:11:21.079032,2026-03-14 10:11:36.529327,0 days 00:00:15.450295,tanh,0.0,3,0.5,COMPLETE
2945,2945,0.6468006372451782,2026-03-14 10:11:36.660800,2026-03-14 10:11:51.962508,0 days 00:00:15.301708,sigmoid,0.0,3,0.5,COMPLETE
2946,2946,0.48087024688720703,2026-03-14 10:11:52.099613,2026-03-14 10:12:07.201284,0 days 00:00:15.101671,tanh,0.0,3,0.55,COMPLETE
2947,2947,0.5001348257064819,2026-03-14 10:12:07.546692,2026-03-14 10:12:22.717843,0 days 00:00:15.171151,tanh,0.0,3,0.65,COMPLETE
2948,2948,0.458736777305603,2026-03-14 10:12:22.855518,2026-03-14 10:12:37.998955,0 days 00:00:15.143437,tanh,0.0,3,0.6,COMPLETE
2949,2949,0.49305784702301025,2026-03-14 10:12:38.303910,2026-03-14 10:12:53.670529,0 days 00:00:15.366619,tanh,0.35000000000000003,2,0.5,COMPLETE
2950,2950,0.519403338432312,2026-03-14 10:12:53.820041,2026-03-14 10:13:09.149927,0 days 00:00:15.329886,tanh,0.0,3,0.5,COMPLETE
2951,2951,0.5213204026222229,2026-03-14 10:13:09.313990,2026-03-14 10:13:24.614875,0 days 00:00:15.300885,tanh,0.05,3,0.55,COMPLETE
2952,2952,0.4754500389099121,2026-03-14 10:13:24.758908,2026-03-14 10:13:39.922716,0 days 00:00:15.163808,tanh,0.0,3,0.5,COMPLETE
2953,2953,0.44965478777885437,2026-03-14 10:13:40.252944,2026-03-14 10:13:55.473439,0 days 00:00:15.220495,tanh,0.0,3,0.65,COMPLETE
2954,2954,0.46185073256492615,2026-03-14 10:13:55.614470,2026-03-14 10:14:11.145375,0 days 00:00:15.530905,tanh,0.05,3,0.6,COMPLETE
2955,2955,0.4519083499908447,2026-03-14 10:14:11.314415,2026-03-14 10:14:26.756705,0 days 00:00:15.442290,tanh,0.0,3,0.5,COMPLETE
2956,2956,0.4672739803791046,2026-03-14 10:14:26.916728,2026-03-14 10:14:42.306809,0 days 00:00:15.390081,tanh,0.0,3,0.5,COMPLETE
2957,2957,0.476204514503479,2026-03-14 10:14:42.613368,2026-03-14 10:14:57.806280,0 days 00:00:15.192912,relu,0.0,3,0.55,COMPLETE
2958,2958,0.48247766494750977,2026-03-14 10:14:57.959302,2026-03-14 10:15:13.644547,0 days 00:00:15.685245,tanh,0.0,3,0.5,COMPLETE
2959,2959,0.4710732102394104,2026-03-14 10:15:13.808059,2026-03-14 10:15:28.852609,0 days 00:00:15.044550,tanh,0.0,3,0.65,COMPLETE
2960,2960,0.4005381762981415,2026-03-14 10:15:29.018869,2026-03-14 10:15:45.256390,0 days 00:00:16.237521,tanh,0.0,3,0.55,COMPLETE
2961,2961,0.4914800226688385,2026-03-14 10:15:45.391970,2026-03-14 10:16:00.754612,0 days 00:00:15.362642,tanh,0.05,3,0.55,COMPLETE
2962,2962,0.4238014817237854,2026-03-14 10:16:01.066836,2026-03-14 10:16:16.497207,0 days 00:00:15.430371,tanh,0.0,3,0.55,COMPLETE
2963,2963,0.4365766644477844,2026-03-14 10:16:16.662261,2026-03-14 10:16:31.665135,0 days 00:00:15.002874,tanh,0.0,3,0.55,COMPLETE
2964,2964,0.474212110042572,2026-03-14 10:16:31.973680,2026-03-14 10:16:47.149703,0 days 00:00:15.176023,tanh,0.0,3,0.55,COMPLETE
2965,2965,0.4364950656890869,2026-03-14 10:16:47.294729,2026-03-14 10:17:02.590869,0 days 00:00:15.296140,tanh,0.0,3,0.55,COMPLETE
2966,2966,0.4247302711009979,2026-03-14 10:17:02.740046,2026-03-14 10:17:17.940369,0 days 00:00:15.200323,tanh,0.0,3,0.55,COMPLETE
2967,2967,0.6469271183013916,2026-03-14 10:17:18.110974,2026-03-14 10:17:32.926035,0 days 00:00:14.815061,sigmoid,0.0,3,0.55,COMPLETE
2968,2968,0.4360867142677307,2026-03-14 10:17:33.240137,2026-03-14 10:17:48.076535,0 days 00:00:14.836398,tanh,0.0,3,0.55,COMPLETE
2969,2969,0.45855215191841125,2026-03-14 10:17:48.241571,2026-03-14 10:18:04.000177,0 days 00:00:15.758606,tanh,0.0,3,0.55,COMPLETE
2970,2970,0.43920931220054626,2026-03-14 10:18:04.150213,2026-03-14 10:18:19.119653,0 days 00:00:14.969440,tanh,0.0,3,0.55,COMPLETE
2971,2971,0.6430421471595764,2026-03-14 10:18:19.279882,2026-03-14 10:18:35.853668,0 days 00:00:16.573786,tanh,0.0,8,0.55,COMPLETE
2972,2972,0.41613975167274475,2026-03-14 10:18:36.034197,2026-03-14 10:18:51.296273,0 days 00:00:15.262076,tanh,0.0,3,0.55,COMPLETE
2973,2973,0.4974169433116913,2026-03-14 10:18:51.433843,2026-03-14 10:19:07.474372,0 days 00:00:16.040529,tanh,0.2,4,0.55,COMPLETE
2974,2974,0.49528440833091736,2026-03-14 10:19:07.635886,2026-03-14 10:19:22.581905,0 days 00:00:14.946019,tanh,0.0,2,0.55,COMPLETE
2975,2975,0.4306437373161316,2026-03-14 10:19:22.743420,2026-03-14 10:19:38.519526,0 days 00:00:15.776106,tanh,0.1,3,0.55,COMPLETE
2976,2976,0.478554368019104,2026-03-14 10:19:38.671064,2026-03-14 10:19:54.311616,0 days 00:00:15.640552,tanh,0.05,3,0.55,COMPLETE
