,number,value,datetime_start,datetime_complete,duration,params_activation,params_dropout,params_layers,params_shrink,state
1328,1328,0.5113551020622253,2026-03-14 03:42:20.139058,2026-03-14 03:42:33.834015,0 days 00:00:13.694957,relu,0.0,3,0.6,COMPLETE
1329,1329,0.43101662397384644,2026-03-14 03:42:34.007075,2026-03-14 03:42:47.796769,0 days 00:00:13.789694,tanh,0.0,3,0.65,COMPLETE
1330,1330,0.43398284912109375,2026-03-14 03:42:47.948305,2026-03-14 03:43:02.096831,0 days 00:00:14.148526,tanh,0.0,3,0.65,COMPLETE
1331,1331,0.46550172567367554,2026-03-14 03:43:02.259504,2026-03-14 03:43:16.074798,0 days 00:00:13.815294,tanh,0.0,3,0.55,COMPLETE
1332,1332,0.4955257773399353,2026-03-14 03:43:16.238484,2026-03-14 03:43:30.867652,0 days 00:00:14.629168,tanh,0.05,3,0.6,COMPLETE
1333,1333,0.4572069048881531,2026-03-14 03:43:31.033683,2026-03-14 03:43:44.864960,0 days 00:00:13.831277,tanh,0.1,3,0.65,COMPLETE
1334,1334,0.4293542206287384,2026-03-14 03:43:45.028987,2026-03-14 03:43:58.892364,0 days 00:00:13.863377,tanh,0.0,3,0.6,COMPLETE
1335,1335,0.4211900532245636,2026-03-14 03:43:59.266123,2026-03-14 03:44:13.161662,0 days 00:00:13.895539,tanh,0.0,3,0.65,COMPLETE
1336,1336,0.6417551040649414,2026-03-14 03:44:13.326402,2026-03-14 03:44:26.889459,0 days 00:00:13.563057,sigmoid,0.0,3,0.65,COMPLETE
1337,1337,0.5077399015426636,2026-03-14 03:44:27.045505,2026-03-14 03:44:40.837705,0 days 00:00:13.792200,tanh,0.0,3,0.7,COMPLETE
1338,1338,0.41959965229034424,2026-03-14 03:44:41.011193,2026-03-14 03:44:54.634048,0 days 00:00:13.622855,tanh,0.0,3,0.6,COMPLETE
1339,1339,0.4319424331188202,2026-03-14 03:44:54.873599,2026-03-14 03:45:08.679811,0 days 00:00:13.806212,tanh,0.05,3,0.65,COMPLETE
1340,1340,0.4188946485519409,2026-03-14 03:45:08.847350,2026-03-14 03:45:22.816844,0 days 00:00:13.969494,tanh,0.0,4,0.55,COMPLETE
1341,1341,0.44221219420433044,2026-03-14 03:45:22.968878,2026-03-14 03:45:36.714344,0 days 00:00:13.745466,tanh,0.0,3,0.55,COMPLETE
1342,1342,0.47672611474990845,2026-03-14 03:45:36.875369,2026-03-14 03:45:50.485964,0 days 00:00:13.610595,tanh,0.0,3,0.55,COMPLETE
1343,1343,0.43352603912353516,2026-03-14 03:45:50.862054,2026-03-14 03:46:04.732914,0 days 00:00:13.870860,tanh,0.0,3,0.55,COMPLETE
1344,1344,0.4470032751560211,2026-03-14 03:46:04.906636,2026-03-14 03:46:18.534773,0 days 00:00:13.628137,tanh,0.0,3,0.65,COMPLETE
1345,1345,0.43366509675979614,2026-03-14 03:46:18.701806,2026-03-14 03:46:32.517497,0 days 00:00:13.815691,tanh,0.0,3,0.55,COMPLETE
1346,1346,0.4650724530220032,2026-03-14 03:46:32.679051,2026-03-14 03:46:46.520752,0 days 00:00:13.841701,tanh,0.0,3,0.55,COMPLETE
1347,1347,0.5326223373413086,2026-03-14 03:46:46.683811,2026-03-14 03:47:00.472183,0 days 00:00:13.788372,tanh,0.0,3,0.55,COMPLETE
1348,1348,0.490573525428772,2026-03-14 03:47:00.631228,2026-03-14 03:47:14.388941,0 days 00:00:13.757713,tanh,0.0,3,0.55,COMPLETE
1349,1349,0.44761934876441956,2026-03-14 03:47:14.555669,2026-03-14 03:47:28.278641,0 days 00:00:13.722972,tanh,0.0,3,0.55,COMPLETE
1350,1350,0.5073487758636475,2026-03-14 03:47:28.436674,2026-03-14 03:47:42.070444,0 days 00:00:13.633770,tanh,0.0,2,0.7,COMPLETE
1351,1351,0.47676387429237366,2026-03-14 03:47:42.436288,2026-03-14 03:47:56.205198,0 days 00:00:13.768910,tanh,0.0,3,0.55,COMPLETE
1352,1352,0.4719460904598236,2026-03-14 03:47:56.362234,2026-03-14 03:48:10.083306,0 days 00:00:13.721072,relu,0.0,3,0.65,COMPLETE
1353,1353,0.4292784631252289,2026-03-14 03:48:10.271853,2026-03-14 03:48:23.949699,0 days 00:00:13.677846,tanh,0.0,3,0.65,COMPLETE
1354,1354,0.5882846713066101,2026-03-14 03:48:24.108228,2026-03-14 03:48:38.304258,0 days 00:00:14.196030,tanh,0.0,4,1.0,COMPLETE
1355,1355,0.4738503396511078,2026-03-14 03:48:38.468797,2026-03-14 03:48:52.192267,0 days 00:00:13.723470,tanh,0.0,3,0.65,COMPLETE
1356,1356,0.4474317729473114,2026-03-14 03:48:52.349779,2026-03-14 03:49:06.096359,0 days 00:00:13.746580,tanh,0.0,3,0.7,COMPLETE
1357,1357,0.437704473733902,2026-03-14 03:49:06.276968,2026-03-14 03:49:19.935778,0 days 00:00:13.658810,tanh,0.0,3,0.65,COMPLETE
1358,1358,0.6443535089492798,2026-03-14 03:49:20.093882,2026-03-14 03:49:33.936537,0 days 00:00:13.842655,sigmoid,0.0,3,0.65,COMPLETE
1359,1359,0.6432608962059021,2026-03-14 03:49:34.095886,2026-03-14 03:49:48.383982,0 days 00:00:14.288096,tanh,0.0,5,0.55,COMPLETE
1360,1360,0.49822333455085754,2026-03-14 03:49:48.549550,2026-03-14 03:50:02.350897,0 days 00:00:13.801347,tanh,0.0,3,0.65,COMPLETE
1361,1361,0.4901910722255707,2026-03-14 03:50:02.517497,2026-03-14 03:50:16.265286,0 days 00:00:13.747789,tanh,0.0,3,0.65,COMPLETE
1362,1362,0.40572187304496765,2026-03-14 03:50:16.428860,2026-03-14 03:50:30.303573,0 days 00:00:13.874713,tanh,0.0,3,0.65,COMPLETE
1363,1363,0.47222208976745605,2026-03-14 03:50:30.483613,2026-03-14 03:50:44.125827,0 days 00:00:13.642214,tanh,0.0,3,0.65,COMPLETE
1364,1364,0.44879356026649475,2026-03-14 03:50:44.290009,2026-03-14 03:50:58.034591,0 days 00:00:13.744582,tanh,0.0,3,0.65,COMPLETE
1365,1365,0.44473567605018616,2026-03-14 03:50:58.191273,2026-03-14 03:51:12.064545,0 days 00:00:13.873272,tanh,0.0,3,0.65,COMPLETE
1366,1366,0.45611849427223206,2026-03-14 03:51:12.217130,2026-03-14 03:51:25.995091,0 days 00:00:13.777961,tanh,0.0,3,0.65,COMPLETE
1367,1367,0.44594520330429077,2026-03-14 03:51:26.385018,2026-03-14 03:51:40.065563,0 days 00:00:13.680545,tanh,0.0,3,0.65,COMPLETE
1368,1368,0.4505476653575897,2026-03-14 03:51:40.243651,2026-03-14 03:51:53.962160,0 days 00:00:13.718509,tanh,0.0,3,0.65,COMPLETE
1369,1369,0.48685207962989807,2026-03-14 03:51:54.154489,2026-03-14 03:52:07.833296,0 days 00:00:13.678807,tanh,0.0,3,0.7,COMPLETE
1370,1370,0.4561159014701843,2026-03-14 03:52:07.994821,2026-03-14 03:52:21.679200,0 days 00:00:13.684379,tanh,0.0,3,0.65,COMPLETE
1371,1371,0.4754682183265686,2026-03-14 03:52:21.838732,2026-03-14 03:52:35.764801,0 days 00:00:13.926069,tanh,0.0,3,0.65,COMPLETE
1372,1372,0.5045124888420105,2026-03-14 03:52:35.924317,2026-03-14 03:52:49.566808,0 days 00:00:13.642491,relu,0.0,3,0.65,COMPLETE
1373,1373,0.45736196637153625,2026-03-14 03:52:49.743858,2026-03-14 03:53:03.458072,0 days 00:00:13.714214,tanh,0.0,3,0.65,COMPLETE
1374,1374,0.4689854383468628,2026-03-14 03:53:03.619613,2026-03-14 03:53:17.232922,0 days 00:00:13.613309,tanh,0.0,3,0.65,COMPLETE
1375,1375,0.4607609808444977,2026-03-14 03:53:17.400953,2026-03-14 03:53:31.126311,0 days 00:00:13.725358,tanh,0.0,3,0.65,COMPLETE
1376,1376,0.4580898880958557,2026-03-14 03:53:31.289973,2026-03-14 03:53:44.846890,0 days 00:00:13.556917,tanh,0.0,3,0.7,COMPLETE
1377,1377,0.4526786208152771,2026-03-14 03:53:45.014422,2026-03-14 03:53:58.816462,0 days 00:00:13.802040,tanh,0.0,3,0.65,COMPLETE
1378,1378,0.5005542635917664,2026-03-14 03:53:58.977506,2026-03-14 03:54:12.576443,0 days 00:00:13.598937,tanh,0.0,3,0.65,COMPLETE
1379,1379,0.48108622431755066,2026-03-14 03:54:12.745015,2026-03-14 03:54:26.663373,0 days 00:00:13.918358,tanh,0.0,3,0.65,COMPLETE
1380,1380,0.64182448387146,2026-03-14 03:54:26.823402,2026-03-14 03:54:40.569203,0 days 00:00:13.745801,sigmoid,0.0,3,0.65,COMPLETE
1381,1381,0.41355302929878235,2026-03-14 03:54:40.719774,2026-03-14 03:54:54.328488,0 days 00:00:13.608714,tanh,0.0,3,0.7,COMPLETE
1382,1382,0.5056008100509644,2026-03-14 03:54:54.483025,2026-03-14 03:55:08.426167,0 days 00:00:13.943142,tanh,0.0,3,0.7,COMPLETE
1383,1383,0.46489784121513367,2026-03-14 03:55:08.587680,2026-03-14 03:55:22.496822,0 days 00:00:13.909142,tanh,0.30000000000000004,3,0.7,COMPLETE
1384,1384,0.45336708426475525,2026-03-14 03:55:22.656374,2026-03-14 03:55:36.490703,0 days 00:00:13.834329,tanh,0.0,3,0.7,COMPLETE
1385,1385,0.4622972309589386,2026-03-14 03:55:36.633477,2026-03-14 03:55:50.356889,0 days 00:00:13.723412,tanh,0.0,3,0.7,COMPLETE
1386,1386,0.46316659450531006,2026-03-14 03:55:50.521418,2026-03-14 03:56:04.027249,0 days 00:00:13.505831,tanh,0.0,3,0.7,COMPLETE
1387,1387,0.4262418746948242,2026-03-14 03:56:04.186454,2026-03-14 03:56:18.018571,0 days 00:00:13.832117,tanh,0.0,3,0.7,COMPLETE
1388,1388,0.44297513365745544,2026-03-14 03:56:18.189297,2026-03-14 03:56:32.109480,0 days 00:00:13.920183,tanh,0.0,3,0.7,COMPLETE
1389,1389,0.459188312292099,2026-03-14 03:56:32.276174,2026-03-14 03:56:45.989667,0 days 00:00:13.713493,tanh,0.0,3,0.7,COMPLETE
1390,1390,0.43624255061149597,2026-03-14 03:56:46.154184,2026-03-14 03:56:59.846898,0 days 00:00:13.692714,tanh,0.0,3,0.7,COMPLETE
1391,1391,0.6430916786193848,2026-03-14 03:57:00.213018,2026-03-14 03:57:14.246693,0 days 00:00:14.033675,tanh,0.0,6,0.7,COMPLETE
1392,1392,0.4729135036468506,2026-03-14 03:57:14.405725,2026-03-14 03:57:28.072241,0 days 00:00:13.666516,tanh,0.0,3,0.7,COMPLETE
1393,1393,0.6421765089035034,2026-03-14 03:57:28.229857,2026-03-14 03:57:42.626516,0 days 00:00:14.396659,tanh,0.0,7,0.7,COMPLETE
1394,1394,0.5318199396133423,2026-03-14 03:57:42.813642,2026-03-14 03:57:56.865961,0 days 00:00:14.052319,relu,0.0,3,0.7,COMPLETE
1395,1395,0.46573689579963684,2026-03-14 03:57:57.030013,2026-03-14 03:58:10.484145,0 days 00:00:13.454132,tanh,0.0,3,0.7,COMPLETE
1396,1396,0.46004071831703186,2026-03-14 03:58:10.640179,2026-03-14 03:58:24.436240,0 days 00:00:13.796061,tanh,0.0,3,0.7,COMPLETE
1397,1397,0.46647876501083374,2026-03-14 03:58:24.611501,2026-03-14 03:58:38.374832,0 days 00:00:13.763331,tanh,0.0,3,0.7,COMPLETE
1398,1398,0.47833946347236633,2026-03-14 03:58:38.539357,2026-03-14 03:58:52.433075,0 days 00:00:13.893718,tanh,0.0,3,0.7,COMPLETE
1399,1399,0.42539581656455994,2026-03-14 03:58:52.579603,2026-03-14 03:59:06.606022,0 days 00:00:14.026419,tanh,0.0,3,0.7,COMPLETE
1400,1400,0.44721755385398865,2026-03-14 03:59:06.775075,2026-03-14 03:59:20.408397,0 days 00:00:13.633322,tanh,0.0,3,0.7,COMPLETE
1401,1401,0.4531653821468353,2026-03-14 03:59:20.594456,2026-03-14 03:59:34.304212,0 days 00:00:13.709756,tanh,0.0,3,0.7,COMPLETE
1402,1402,0.4502578377723694,2026-03-14 03:59:34.462756,2026-03-14 03:59:48.271322,0 days 00:00:13.808566,tanh,0.0,3,0.7,COMPLETE
1403,1403,0.6430509686470032,2026-03-14 03:59:48.444850,2026-03-14 04:00:02.241300,0 days 00:00:13.796450,sigmoid,0.0,3,0.7,COMPLETE
1404,1404,0.43905800580978394,2026-03-14 04:00:02.404114,2026-03-14 04:00:16.157512,0 days 00:00:13.753398,tanh,0.0,3,0.7,COMPLETE
1405,1405,0.4496847689151764,2026-03-14 04:00:16.316150,2026-03-14 04:00:29.855365,0 days 00:00:13.539215,tanh,0.0,3,0.65,COMPLETE
1406,1406,0.4554566442966461,2026-03-14 04:00:30.014173,2026-03-14 04:00:43.911068,0 days 00:00:13.896895,tanh,0.0,3,0.65,COMPLETE
1407,1407,0.4445562958717346,2026-03-14 04:00:44.069645,2026-03-14 04:00:57.893669,0 days 00:00:13.824024,tanh,0.0,3,0.65,COMPLETE
1408,1408,0.4774376451969147,2026-03-14 04:00:58.109617,2026-03-14 04:01:11.901124,0 days 00:00:13.791507,tanh,0.0,3,0.65,COMPLETE
1409,1409,0.46598121523857117,2026-03-14 04:01:12.060689,2026-03-14 04:01:25.714066,0 days 00:00:13.653377,tanh,0.0,3,0.65,COMPLETE
1410,1410,0.46033769845962524,2026-03-14 04:01:25.893593,2026-03-14 04:01:39.686251,0 days 00:00:13.792658,tanh,0.0,3,0.9,COMPLETE
1411,1411,0.43721121549606323,2026-03-14 04:01:39.845300,2026-03-14 04:01:53.432892,0 days 00:00:13.587592,tanh,0.0,3,0.65,COMPLETE
1412,1412,0.5034574866294861,2026-03-14 04:01:53.587924,2026-03-14 04:02:07.560618,0 days 00:00:13.972694,tanh,0.05,3,0.7,COMPLETE
1413,1413,0.44171613454818726,2026-03-14 04:02:07.710699,2026-03-14 04:02:21.567752,0 days 00:00:13.857053,tanh,0.0,3,0.6,COMPLETE
1414,1414,0.43932756781578064,2026-03-14 04:02:21.725474,2026-03-14 04:02:35.406538,0 days 00:00:13.681064,tanh,0.0,3,0.65,COMPLETE
1415,1415,0.4337305426597595,2026-03-14 04:02:35.567063,2026-03-14 04:02:49.365863,0 days 00:00:13.798800,tanh,0.0,3,0.7,COMPLETE
1416,1416,0.4324542284011841,2026-03-14 04:02:49.532287,2026-03-14 04:03:03.237799,0 days 00:00:13.705512,tanh,0.0,3,0.6,COMPLETE
1417,1417,0.49196311831474304,2026-03-14 04:03:03.387236,2026-03-14 04:03:17.237768,0 days 00:00:13.850532,relu,0.0,3,0.65,COMPLETE
1418,1418,0.49002254009246826,2026-03-14 04:03:17.408797,2026-03-14 04:03:31.146199,0 days 00:00:13.737402,tanh,0.0,3,0.65,COMPLETE
1419,1419,0.4430931508541107,2026-03-14 04:03:31.493796,2026-03-14 04:03:45.227750,0 days 00:00:13.733954,tanh,0.0,3,0.6,COMPLETE
1420,1420,0.48765668272972107,2026-03-14 04:03:45.376944,2026-03-14 04:03:59.208987,0 days 00:00:13.832043,tanh,0.05,3,0.65,COMPLETE
1421,1421,0.4605414569377899,2026-03-14 04:03:59.366020,2026-03-14 04:04:13.040183,0 days 00:00:13.674163,tanh,0.0,3,0.6,COMPLETE
1422,1422,0.5038645267486572,2026-03-14 04:04:13.216369,2026-03-14 04:04:27.077571,0 days 00:00:13.861202,tanh,0.0,3,0.7,COMPLETE
1423,1423,0.4880794286727905,2026-03-14 04:04:27.245113,2026-03-14 04:04:41.030157,0 days 00:00:13.785044,tanh,0.0,3,0.65,COMPLETE
1424,1424,0.45187410712242126,2026-03-14 04:04:41.227963,2026-03-14 04:04:55.082207,0 days 00:00:13.854244,tanh,0.05,3,0.6,COMPLETE
1425,1425,0.6447691321372986,2026-03-14 04:04:55.243843,2026-03-14 04:05:09.069303,0 days 00:00:13.825460,sigmoid,0.0,3,0.65,COMPLETE
1426,1426,0.4892243444919586,2026-03-14 04:05:09.221916,2026-03-14 04:05:22.965678,0 days 00:00:13.743762,tanh,0.0,3,0.6,COMPLETE
1427,1427,0.4759463965892792,2026-03-14 04:05:23.226904,2026-03-14 04:05:36.958343,0 days 00:00:13.731439,tanh,0.0,3,0.65,COMPLETE
1428,1428,0.5105511546134949,2026-03-14 04:05:37.121755,2026-03-14 04:05:50.882006,0 days 00:00:13.760251,tanh,0.0,3,0.65,COMPLETE
1429,1429,0.4899510443210602,2026-03-14 04:05:51.043121,2026-03-14 04:06:04.604417,0 days 00:00:13.561296,tanh,0.0,2,0.6,COMPLETE
1430,1430,0.46451646089553833,2026-03-14 04:06:04.934488,2026-03-14 04:06:18.792044,0 days 00:00:13.857556,tanh,0.0,3,0.7,COMPLETE
1431,1431,0.4482336640357971,2026-03-14 04:06:18.955074,2026-03-14 04:06:32.713241,0 days 00:00:13.758167,tanh,0.0,3,0.65,COMPLETE
1432,1432,0.5281013250350952,2026-03-14 04:06:32.894788,2026-03-14 04:06:46.971306,0 days 00:00:14.076518,tanh,0.0,3,0.65,COMPLETE
1433,1433,0.46005791425704956,2026-03-14 04:06:47.117430,2026-03-14 04:07:01.402977,0 days 00:00:14.285547,tanh,0.4,3,0.6,COMPLETE
1434,1434,0.4474487900733948,2026-03-14 04:07:01.565383,2026-03-14 04:07:15.673743,0 days 00:00:14.108360,tanh,0.05,3,0.7,COMPLETE
1435,1435,0.44355642795562744,2026-03-14 04:07:15.840282,2026-03-14 04:07:29.753201,0 days 00:00:13.912919,tanh,0.0,3,0.6,COMPLETE
1436,1436,0.44592177867889404,2026-03-14 04:07:29.923230,2026-03-14 04:07:43.741061,0 days 00:00:13.817831,tanh,0.0,3,0.65,COMPLETE
1437,1437,0.47952935099601746,2026-03-14 04:07:43.893591,2026-03-14 04:07:57.925943,0 days 00:00:14.032352,tanh,0.0,3,0.8500000000000001,COMPLETE
1438,1438,0.47256937623023987,2026-03-14 04:07:58.091973,2026-03-14 04:08:11.877494,0 days 00:00:13.785521,relu,0.0,3,0.65,COMPLETE
1439,1439,0.4777818024158478,2026-03-14 04:08:12.036517,2026-03-14 04:08:25.621001,0 days 00:00:13.584484,tanh,0.0,3,0.6,COMPLETE
1440,1440,0.42503243684768677,2026-03-14 04:08:25.781520,2026-03-14 04:08:39.740738,0 days 00:00:13.959218,tanh,0.0,3,0.7,COMPLETE
1441,1441,0.4864577651023865,2026-03-14 04:08:39.895414,2026-03-14 04:08:53.577368,0 days 00:00:13.681954,tanh,0.0,3,0.65,COMPLETE
1442,1442,0.48420432209968567,2026-03-14 04:08:53.751912,2026-03-14 04:09:07.882528,0 days 00:00:14.130616,tanh,0.05,3,0.65,COMPLETE
1443,1443,0.4462487995624542,2026-03-14 04:09:08.049125,2026-03-14 04:09:21.979408,0 days 00:00:13.930283,tanh,0.0,3,0.65,COMPLETE
1444,1444,0.4211268126964569,2026-03-14 04:09:22.148458,2026-03-14 04:09:35.965704,0 days 00:00:13.817246,tanh,0.0,3,0.6,COMPLETE
1445,1445,0.4481503963470459,2026-03-14 04:09:36.124231,2026-03-14 04:09:49.872200,0 days 00:00:13.747969,tanh,0.0,3,0.65,COMPLETE
1446,1446,0.4811193645000458,2026-03-14 04:09:50.044714,2026-03-14 04:10:04.300951,0 days 00:00:14.256237,tanh,0.05,3,0.7,COMPLETE
1447,1447,0.641880452632904,2026-03-14 04:10:04.467025,2026-03-14 04:10:18.288371,0 days 00:00:13.821346,sigmoid,0.0,3,0.6,COMPLETE
1448,1448,0.44357627630233765,2026-03-14 04:10:18.435514,2026-03-14 04:10:32.352116,0 days 00:00:13.916602,tanh,0.0,3,0.65,COMPLETE
1449,1449,0.45038869976997375,2026-03-14 04:10:32.514193,2026-03-14 04:10:46.214666,0 days 00:00:13.700473,tanh,0.0,3,0.6,COMPLETE
1450,1450,0.5139828324317932,2026-03-14 04:10:46.407219,2026-03-14 04:11:00.248310,0 days 00:00:13.841091,tanh,0.0,3,0.65,COMPLETE
1451,1451,0.49244022369384766,2026-03-14 04:11:00.411346,2026-03-14 04:11:14.365125,0 days 00:00:13.953779,tanh,0.0,3,0.65,COMPLETE
1452,1452,0.4691426753997803,2026-03-14 04:11:14.511630,2026-03-14 04:11:28.011730,0 days 00:00:13.500100,tanh,0.0,2,0.6,COMPLETE
1453,1453,0.47327274084091187,2026-03-14 04:11:28.164858,2026-03-14 04:11:42.176482,0 days 00:00:14.011624,tanh,0.0,3,0.7,COMPLETE
1454,1454,0.45929330587387085,2026-03-14 04:11:42.354509,2026-03-14 04:11:56.052396,0 days 00:00:13.697887,tanh,0.0,3,0.75,COMPLETE
1455,1455,0.4389522671699524,2026-03-14 04:11:56.223991,2026-03-14 04:12:10.379795,0 days 00:00:14.155804,tanh,0.2,3,0.65,COMPLETE
1456,1456,0.44507917761802673,2026-03-14 04:12:10.729359,2026-03-14 04:12:24.617881,0 days 00:00:13.888522,tanh,0.0,3,0.6,COMPLETE
1457,1457,0.6434574723243713,2026-03-14 04:12:24.779931,2026-03-14 04:12:39.573630,0 days 00:00:14.793699,tanh,0.0,8,0.65,COMPLETE
1458,1458,0.45050179958343506,2026-03-14 04:12:39.732142,2026-03-14 04:12:53.506931,0 days 00:00:13.774789,tanh,0.0,3,0.65,COMPLETE
1459,1459,0.501813530921936,2026-03-14 04:12:53.693979,2026-03-14 04:13:07.730380,0 days 00:00:14.036401,tanh,0.05,3,0.6,COMPLETE
1460,1460,0.47776758670806885,2026-03-14 04:13:07.896808,2026-03-14 04:13:21.703234,0 days 00:00:13.806426,relu,0.0,3,0.65,COMPLETE
1461,1461,0.43545037508010864,2026-03-14 04:13:21.889817,2026-03-14 04:13:35.759464,0 days 00:00:13.869647,tanh,0.0,3,0.65,COMPLETE
1462,1462,0.44440576434135437,2026-03-14 04:13:35.930493,2026-03-14 04:13:49.626552,0 days 00:00:13.696059,tanh,0.0,3,0.6,COMPLETE
1463,1463,0.4643096327781677,2026-03-14 04:13:49.821591,2026-03-14 04:14:03.777555,0 days 00:00:13.955964,tanh,0.0,3,0.8500000000000001,COMPLETE
1464,1464,0.4397405683994293,2026-03-14 04:14:03.940295,2026-03-14 04:14:18.002043,0 days 00:00:14.061748,tanh,0.05,3,0.7,COMPLETE
1465,1465,0.4747354984283447,2026-03-14 04:14:18.184246,2026-03-14 04:14:32.160037,0 days 00:00:13.975791,tanh,0.0,3,0.65,COMPLETE
1466,1466,0.45825737714767456,2026-03-14 04:14:32.337857,2026-03-14 04:14:46.168056,0 days 00:00:13.830199,tanh,0.0,3,0.6,COMPLETE
1467,1467,0.5261789560317993,2026-03-14 04:14:46.319609,2026-03-14 04:15:00.343088,0 days 00:00:14.023479,tanh,0.0,3,0.7,COMPLETE
1468,1468,0.6455782055854797,2026-03-14 04:15:00.494342,2026-03-14 04:15:14.430917,0 days 00:00:13.936575,sigmoid,0.0,3,0.65,COMPLETE
1469,1469,0.47210416197776794,2026-03-14 04:15:14.593947,2026-03-14 04:15:28.369490,0 days 00:00:13.775543,tanh,0.0,3,0.95,COMPLETE
1470,1470,0.4451866149902344,2026-03-14 04:15:28.518591,2026-03-14 04:15:42.283773,0 days 00:00:13.765182,tanh,0.30000000000000004,3,0.65,COMPLETE
1471,1471,0.4684886336326599,2026-03-14 04:15:42.434448,2026-03-14 04:15:56.237593,0 days 00:00:13.803145,tanh,0.0,3,0.6,COMPLETE
1472,1472,0.5230041742324829,2026-03-14 04:15:56.373215,2026-03-14 04:16:10.142490,0 days 00:00:13.769275,tanh,0.05,3,0.65,COMPLETE
1473,1473,0.4388359487056732,2026-03-14 04:16:10.295099,2026-03-14 04:16:23.956593,0 days 00:00:13.661494,tanh,0.0,3,0.65,COMPLETE
1474,1474,0.4635760486125946,2026-03-14 04:16:24.106630,2026-03-14 04:16:37.869775,0 days 00:00:13.763145,tanh,0.0,3,0.7,COMPLETE
1475,1475,0.43868741393089294,2026-03-14 04:16:38.025844,2026-03-14 04:16:51.875354,0 days 00:00:13.849510,tanh,0.0,3,0.6,COMPLETE
1476,1476,0.48418569564819336,2026-03-14 04:16:52.039388,2026-03-14 04:17:06.033378,0 days 00:00:13.993990,tanh,0.0,3,0.6,COMPLETE
1477,1477,0.6418229341506958,2026-03-14 04:17:06.174982,2026-03-14 04:17:20.441903,0 days 00:00:14.266921,tanh,0.0,6,0.65,COMPLETE
1478,1478,0.4668550491333008,2026-03-14 04:17:20.593417,2026-03-14 04:17:34.329664,0 days 00:00:13.736247,tanh,0.0,2,0.65,COMPLETE
1479,1479,0.44610533118247986,2026-03-14 04:17:34.486679,2026-03-14 04:17:48.749515,0 days 00:00:14.262836,tanh,0.05,3,0.6,COMPLETE
1480,1480,0.4635874629020691,2026-03-14 04:17:48.904031,2026-03-14 04:18:02.932245,0 days 00:00:14.028214,tanh,0.0,3,0.65,COMPLETE
1481,1481,0.4842658042907715,2026-03-14 04:18:03.090268,2026-03-14 04:18:16.995700,0 days 00:00:13.905432,tanh,0.0,3,0.7,COMPLETE
1482,1482,0.5687676072120667,2026-03-14 04:18:17.368933,2026-03-14 04:18:31.200762,0 days 00:00:13.831829,relu,0.0,3,0.6,COMPLETE
1483,1483,0.4548877477645874,2026-03-14 04:18:31.353061,2026-03-14 04:18:44.999700,0 days 00:00:13.646639,tanh,0.0,3,0.65,COMPLETE
1484,1484,0.46470826864242554,2026-03-14 04:18:45.145265,2026-03-14 04:18:58.775703,0 days 00:00:13.630438,tanh,0.0,3,0.75,COMPLETE
1485,1485,0.4131428003311157,2026-03-14 04:18:58.927232,2026-03-14 04:19:13.030596,0 days 00:00:14.103364,tanh,0.0,3,0.65,COMPLETE
1486,1486,0.4718329608440399,2026-03-14 04:19:13.170188,2026-03-14 04:19:27.050556,0 days 00:00:13.880368,tanh,0.05,3,0.65,COMPLETE
1487,1487,0.4788101613521576,2026-03-14 04:19:27.327714,2026-03-14 04:19:41.065858,0 days 00:00:13.738144,tanh,0.0,3,0.6,COMPLETE
1488,1488,0.46712207794189453,2026-03-14 04:19:41.224936,2026-03-14 04:19:55.376482,0 days 00:00:14.151546,tanh,0.35000000000000003,3,0.7,COMPLETE
1489,1489,0.4567267596721649,2026-03-14 04:19:55.520507,2026-03-14 04:20:09.644969,0 days 00:00:14.124462,tanh,0.4,3,0.65,COMPLETE
1490,1490,0.4494224190711975,2026-03-14 04:20:09.798497,2026-03-14 04:20:23.758399,0 days 00:00:13.959902,tanh,0.0,3,0.6,COMPLETE
1491,1491,0.6439908742904663,2026-03-14 04:20:23.899055,2026-03-14 04:20:37.584764,0 days 00:00:13.685709,sigmoid,0.0,3,0.6,COMPLETE
