,number,value,datetime_start,datetime_complete,duration,params_activation,params_dropout,params_layers,params_shrink,state
1164,1164,0.4826364517211914,2026-03-14 03:04:07.688840,2026-03-14 03:04:21.160111,0 days 00:00:13.471271,tanh,0.0,3,0.65,COMPLETE
1165,1165,0.46466001868247986,2026-03-14 03:04:21.321296,2026-03-14 03:04:35.217299,0 days 00:00:13.896003,tanh,0.05,3,0.65,COMPLETE
1166,1166,0.4441535472869873,2026-03-14 03:04:35.375619,2026-03-14 03:04:49.213682,0 days 00:00:13.838063,tanh,0.0,3,0.55,COMPLETE
1167,1167,0.471910685300827,2026-03-14 03:04:49.353208,2026-03-14 03:05:02.989521,0 days 00:00:13.636313,tanh,0.0,3,0.7,COMPLETE
1168,1168,0.45498427748680115,2026-03-14 03:05:03.132553,2026-03-14 03:05:16.790783,0 days 00:00:13.658230,tanh,0.0,3,0.65,COMPLETE
1169,1169,0.48457595705986023,2026-03-14 03:05:16.941815,2026-03-14 03:05:30.732338,0 days 00:00:13.790523,tanh,0.0,3,0.65,COMPLETE
1170,1170,0.548947811126709,2026-03-14 03:05:30.888562,2026-03-14 03:05:44.877109,0 days 00:00:13.988547,tanh,0.0,4,0.65,COMPLETE
1171,1171,0.45421797037124634,2026-03-14 03:05:45.036562,2026-03-14 03:05:58.753658,0 days 00:00:13.717096,tanh,0.2,3,0.55,COMPLETE
1172,1172,0.5020188093185425,2026-03-14 03:05:58.910103,2026-03-14 03:06:12.544929,0 days 00:00:13.634826,tanh,0.05,2,0.5,COMPLETE
1173,1173,0.44212839007377625,2026-03-14 03:06:12.698447,2026-03-14 03:06:26.367889,0 days 00:00:13.669442,tanh,0.0,3,0.65,COMPLETE
1174,1174,0.5131922960281372,2026-03-14 03:06:26.530068,2026-03-14 03:06:40.336868,0 days 00:00:13.806800,tanh,0.0,3,0.7,COMPLETE
1175,1175,0.4190155565738678,2026-03-14 03:06:40.524722,2026-03-14 03:06:54.170527,0 days 00:00:13.645805,tanh,0.0,3,0.75,COMPLETE
1176,1176,0.4766596555709839,2026-03-14 03:06:54.315894,2026-03-14 03:07:08.037551,0 days 00:00:13.721657,relu,0.0,3,0.7,COMPLETE
1177,1177,0.45829594135284424,2026-03-14 03:07:08.182293,2026-03-14 03:07:21.740724,0 days 00:00:13.558431,tanh,0.0,3,0.7,COMPLETE
1178,1178,0.653544008731842,2026-03-14 03:07:21.885143,2026-03-14 03:07:36.419734,0 days 00:00:14.534591,tanh,0.0,8,0.8,COMPLETE
1179,1179,0.4723578989505768,2026-03-14 03:07:36.562269,2026-03-14 03:07:50.525863,0 days 00:00:13.963594,tanh,0.05,3,0.7,COMPLETE
1180,1180,0.4759691655635834,2026-03-14 03:07:50.671067,2026-03-14 03:08:04.327612,0 days 00:00:13.656545,tanh,0.0,3,0.9,COMPLETE
1181,1181,0.4307982623577118,2026-03-14 03:08:04.494274,2026-03-14 03:08:18.189872,0 days 00:00:13.695598,tanh,0.0,3,0.75,COMPLETE
1182,1182,0.4824222922325134,2026-03-14 03:08:18.351550,2026-03-14 03:08:32.155820,0 days 00:00:13.804270,tanh,0.0,3,0.75,COMPLETE
1183,1183,0.46325260400772095,2026-03-14 03:08:32.323927,2026-03-14 03:08:46.350341,0 days 00:00:14.026414,tanh,0.0,3,0.75,COMPLETE
1184,1184,0.4380634129047394,2026-03-14 03:08:46.482408,2026-03-14 03:09:00.552732,0 days 00:00:14.070324,tanh,0.0,5,0.75,COMPLETE
1185,1185,0.6438860297203064,2026-03-14 03:09:00.706307,2026-03-14 03:09:14.577343,0 days 00:00:13.871036,sigmoid,0.05,3,0.8,COMPLETE
1186,1186,0.4762956500053406,2026-03-14 03:09:14.712857,2026-03-14 03:09:28.310400,0 days 00:00:13.597543,tanh,0.0,3,0.8,COMPLETE
1187,1187,0.5084187388420105,2026-03-14 03:09:28.455839,2026-03-14 03:09:42.316687,0 days 00:00:13.860848,tanh,0.0,3,0.8500000000000001,COMPLETE
1188,1188,0.467479944229126,2026-03-14 03:09:42.492962,2026-03-14 03:09:56.484101,0 days 00:00:13.991139,tanh,0.05,3,0.8,COMPLETE
1189,1189,0.47806379199028015,2026-03-14 03:09:56.637666,2026-03-14 03:10:10.268585,0 days 00:00:13.630919,tanh,0.0,3,0.8,COMPLETE
1190,1190,0.4476628601551056,2026-03-14 03:10:10.422269,2026-03-14 03:10:24.135643,0 days 00:00:13.713374,tanh,0.0,3,0.75,COMPLETE
1191,1191,0.4868430197238922,2026-03-14 03:10:24.290235,2026-03-14 03:10:38.349035,0 days 00:00:14.058800,tanh,0.1,3,0.7,COMPLETE
1192,1192,0.4733545184135437,2026-03-14 03:10:38.492547,2026-03-14 03:10:52.177825,0 days 00:00:13.685278,tanh,0.0,4,0.75,COMPLETE
1193,1193,0.45977216958999634,2026-03-14 03:10:52.395866,2026-03-14 03:11:05.889239,0 days 00:00:13.493373,tanh,0.0,3,0.65,COMPLETE
1194,1194,0.45957058668136597,2026-03-14 03:11:06.032301,2026-03-14 03:11:19.627097,0 days 00:00:13.594796,tanh,0.0,3,0.7,COMPLETE
1195,1195,0.8141406178474426,2026-03-14 03:11:19.778647,2026-03-14 03:11:34.602736,0 days 00:00:14.824089,tanh,0.35000000000000003,6,0.75,COMPLETE
1196,1196,0.48550838232040405,2026-03-14 03:11:34.745252,2026-03-14 03:11:48.439333,0 days 00:00:13.694081,relu,0.0,3,0.75,COMPLETE
1197,1197,0.4723978042602539,2026-03-14 03:11:48.608361,2026-03-14 03:12:02.294402,0 days 00:00:13.686041,tanh,0.0,3,0.75,COMPLETE
1198,1198,0.46751946210861206,2026-03-14 03:12:02.432935,2026-03-14 03:12:16.195817,0 days 00:00:13.762882,tanh,0.0,3,0.75,COMPLETE
1199,1199,0.4664744734764099,2026-03-14 03:12:16.336117,2026-03-14 03:12:30.246387,0 days 00:00:13.910270,tanh,0.05,3,0.65,COMPLETE
1200,1200,0.46094948053359985,2026-03-14 03:12:30.596925,2026-03-14 03:12:44.261363,0 days 00:00:13.664438,tanh,0.0,3,0.8,COMPLETE
1201,1201,0.47480693459510803,2026-03-14 03:12:44.420878,2026-03-14 03:12:58.182057,0 days 00:00:13.761179,tanh,0.0,3,0.6,COMPLETE
1202,1202,0.44987842440605164,2026-03-14 03:12:58.331086,2026-03-14 03:13:11.938196,0 days 00:00:13.607110,tanh,0.0,3,0.65,COMPLETE
1203,1203,0.4326949119567871,2026-03-14 03:13:12.109766,2026-03-14 03:13:25.796694,0 days 00:00:13.686928,tanh,0.0,3,0.6,COMPLETE
1204,1204,0.4734897017478943,2026-03-14 03:13:25.939217,2026-03-14 03:13:39.559952,0 days 00:00:13.620735,tanh,0.0,2,0.8500000000000001,COMPLETE
1205,1205,0.48910364508628845,2026-03-14 03:13:39.709475,2026-03-14 03:13:53.371441,0 days 00:00:13.661966,tanh,0.0,3,0.65,COMPLETE
1206,1206,0.6421971321105957,2026-03-14 03:13:53.520957,2026-03-14 03:14:07.200266,0 days 00:00:13.679309,sigmoid,0.05,3,0.6,COMPLETE
1207,1207,0.4325870871543884,2026-03-14 03:14:07.349780,2026-03-14 03:14:20.893296,0 days 00:00:13.543516,tanh,0.0,3,0.65,COMPLETE
1208,1208,0.4308362603187561,2026-03-14 03:14:21.038818,2026-03-14 03:14:34.834643,0 days 00:00:13.795825,tanh,0.0,3,0.7,COMPLETE
1209,1209,0.430853933095932,2026-03-14 03:14:34.985164,2026-03-14 03:14:49.004336,0 days 00:00:14.019172,tanh,0.0,4,0.65,COMPLETE
1210,1210,0.45144858956336975,2026-03-14 03:14:49.160894,2026-03-14 03:15:03.029220,0 days 00:00:13.868326,tanh,0.0,3,0.6,COMPLETE
1211,1211,0.4786362051963806,2026-03-14 03:15:03.186019,2026-03-14 03:15:16.935284,0 days 00:00:13.749265,tanh,0.0,3,0.65,COMPLETE
1212,1212,0.4219093918800354,2026-03-14 03:15:17.085907,2026-03-14 03:15:30.756123,0 days 00:00:13.670216,tanh,0.0,3,0.6,COMPLETE
1213,1213,0.4389711320400238,2026-03-14 03:15:30.917233,2026-03-14 03:15:45.083143,0 days 00:00:14.165910,tanh,0.15000000000000002,3,0.65,COMPLETE
1214,1214,0.4901522397994995,2026-03-14 03:15:45.245859,2026-03-14 03:15:59.370737,0 days 00:00:14.124878,tanh,0.05,3,0.6,COMPLETE
1215,1215,0.4688430726528168,2026-03-14 03:15:59.538786,2026-03-14 03:16:13.179391,0 days 00:00:13.640605,tanh,0.0,3,0.65,COMPLETE
1216,1216,0.44568711519241333,2026-03-14 03:16:13.329428,2026-03-14 03:16:27.069180,0 days 00:00:13.739752,tanh,0.0,3,0.7,COMPLETE
1217,1217,0.4567375183105469,2026-03-14 03:16:27.223951,2026-03-14 03:16:41.277294,0 days 00:00:14.053343,tanh,0.0,3,0.65,COMPLETE
1218,1218,0.44104400277137756,2026-03-14 03:16:41.469811,2026-03-14 03:16:55.084837,0 days 00:00:13.615026,tanh,0.0,3,0.75,COMPLETE
1219,1219,0.471328467130661,2026-03-14 03:16:55.245141,2026-03-14 03:17:08.894177,0 days 00:00:13.649036,relu,0.0,3,0.6,COMPLETE
1220,1220,0.4543140232563019,2026-03-14 03:17:09.061712,2026-03-14 03:17:22.866876,0 days 00:00:13.805164,tanh,0.05,3,0.65,COMPLETE
1221,1221,0.4681331515312195,2026-03-14 03:17:23.025840,2026-03-14 03:17:36.773096,0 days 00:00:13.747256,tanh,0.0,3,0.6,COMPLETE
1222,1222,0.46421465277671814,2026-03-14 03:17:36.933122,2026-03-14 03:17:50.830874,0 days 00:00:13.897752,tanh,0.30000000000000004,3,0.65,COMPLETE
1223,1223,0.4680135250091553,2026-03-14 03:17:50.991979,2026-03-14 03:18:04.690758,0 days 00:00:13.698779,tanh,0.0,3,0.7,COMPLETE
1224,1224,0.4262281060218811,2026-03-14 03:18:04.860290,2026-03-14 03:18:18.539834,0 days 00:00:13.679544,tanh,0.0,3,0.6,COMPLETE
1225,1225,0.5057286024093628,2026-03-14 03:18:18.680347,2026-03-14 03:18:32.395255,0 days 00:00:13.714908,tanh,0.0,2,0.65,COMPLETE
1226,1226,0.5642475485801697,2026-03-14 03:18:32.553281,2026-03-14 03:18:46.284641,0 days 00:00:13.731360,tanh,0.05,3,0.6,COMPLETE
1227,1227,0.4684375524520874,2026-03-14 03:18:46.436167,2026-03-14 03:19:00.176617,0 days 00:00:13.740450,tanh,0.0,3,0.65,COMPLETE
1228,1228,0.6440514326095581,2026-03-14 03:19:00.357653,2026-03-14 03:19:14.371662,0 days 00:00:14.014009,sigmoid,0.5,3,0.6,COMPLETE
1229,1229,0.45590296387672424,2026-03-14 03:19:14.533814,2026-03-14 03:19:28.093609,0 days 00:00:13.559795,tanh,0.0,3,0.7,COMPLETE
1230,1230,0.478042870759964,2026-03-14 03:19:28.255736,2026-03-14 03:19:41.826456,0 days 00:00:13.570720,tanh,0.0,3,0.65,COMPLETE
1231,1231,0.46299684047698975,2026-03-14 03:19:41.991513,2026-03-14 03:19:55.547079,0 days 00:00:13.555566,tanh,0.0,3,0.65,COMPLETE
1232,1232,0.45850878953933716,2026-03-14 03:19:55.698602,2026-03-14 03:20:09.183831,0 days 00:00:13.485229,tanh,0.0,3,0.6,COMPLETE
1233,1233,0.4633907973766327,2026-03-14 03:20:09.378864,2026-03-14 03:20:23.562806,0 days 00:00:14.183942,tanh,0.1,4,0.65,COMPLETE
1234,1234,0.5102260708808899,2026-03-14 03:20:23.722373,2026-03-14 03:20:37.624774,0 days 00:00:13.902401,tanh,0.0,5,0.65,COMPLETE
1235,1235,0.45185229182243347,2026-03-14 03:20:37.799322,2026-03-14 03:20:51.482448,0 days 00:00:13.683126,tanh,0.0,3,0.8,COMPLETE
1236,1236,0.5224349498748779,2026-03-14 03:20:51.656979,2026-03-14 03:21:05.462985,0 days 00:00:13.806006,tanh,0.0,3,0.75,COMPLETE
1237,1237,0.4809703230857849,2026-03-14 03:21:05.622016,2026-03-14 03:21:19.724447,0 days 00:00:14.102431,tanh,0.05,3,0.6,COMPLETE
1238,1238,0.4551474153995514,2026-03-14 03:21:19.889059,2026-03-14 03:21:33.508621,0 days 00:00:13.619562,tanh,0.0,3,0.55,COMPLETE
1239,1239,0.4441172480583191,2026-03-14 03:21:33.666649,2026-03-14 03:21:47.346589,0 days 00:00:13.679940,tanh,0.0,3,0.7,COMPLETE
1240,1240,0.45958274602890015,2026-03-14 03:21:47.508615,2026-03-14 03:22:01.178630,0 days 00:00:13.670015,tanh,0.0,3,0.65,COMPLETE
1241,1241,0.5070878863334656,2026-03-14 03:22:01.344472,2026-03-14 03:22:15.270008,0 days 00:00:13.925536,relu,0.0,3,0.65,COMPLETE
1242,1242,0.4611597955226898,2026-03-14 03:22:15.430519,2026-03-14 03:22:29.130532,0 days 00:00:13.700013,tanh,0.0,3,0.6,COMPLETE
1243,1243,0.47470155358314514,2026-03-14 03:22:29.283599,2026-03-14 03:22:42.868183,0 days 00:00:13.584584,tanh,0.0,3,0.6,COMPLETE
1244,1244,0.48110225796699524,2026-03-14 03:22:43.031732,2026-03-14 03:22:57.075098,0 days 00:00:14.043366,tanh,0.05,3,0.65,COMPLETE
1245,1245,0.45573097467422485,2026-03-14 03:22:57.238049,2026-03-14 03:23:11.225433,0 days 00:00:13.987384,tanh,0.0,4,0.65,COMPLETE
1246,1246,0.44503962993621826,2026-03-14 03:23:11.382953,2026-03-14 03:23:25.061962,0 days 00:00:13.679009,tanh,0.0,3,0.55,COMPLETE
1247,1247,0.43598634004592896,2026-03-14 03:23:25.224704,2026-03-14 03:23:38.830718,0 days 00:00:13.606014,tanh,0.0,3,0.6,COMPLETE
1248,1248,0.43070489168167114,2026-03-14 03:23:39.001838,2026-03-14 03:23:52.518278,0 days 00:00:13.516440,tanh,0.0,3,0.65,COMPLETE
1249,1249,0.6419581174850464,2026-03-14 03:23:52.690306,2026-03-14 03:24:06.658472,0 days 00:00:13.968166,sigmoid,0.05,3,0.6,COMPLETE
1250,1250,0.4424474239349365,2026-03-14 03:24:06.818982,2026-03-14 03:24:20.551531,0 days 00:00:13.732549,tanh,0.0,3,0.7,COMPLETE
1251,1251,0.4677300453186035,2026-03-14 03:24:20.718054,2026-03-14 03:24:34.564711,0 days 00:00:13.846657,tanh,0.0,3,0.8500000000000001,COMPLETE
1252,1252,0.4840671718120575,2026-03-14 03:24:34.751262,2026-03-14 03:24:48.503180,0 days 00:00:13.751918,tanh,0.0,2,0.65,COMPLETE
1253,1253,0.4980745315551758,2026-03-14 03:24:48.672771,2026-03-14 03:25:02.517493,0 days 00:00:13.844722,tanh,0.0,3,0.6,COMPLETE
1254,1254,0.44753220677375793,2026-03-14 03:25:02.678486,2026-03-14 03:25:16.781317,0 days 00:00:14.102831,tanh,0.05,3,0.65,COMPLETE
1255,1255,0.4634077250957489,2026-03-14 03:25:16.928894,2026-03-14 03:25:30.679992,0 days 00:00:13.751098,tanh,0.0,3,0.6,COMPLETE
1256,1256,0.45925670862197876,2026-03-14 03:25:30.846015,2026-03-14 03:25:44.479299,0 days 00:00:13.633284,tanh,0.0,3,0.65,COMPLETE
1257,1257,0.4390673339366913,2026-03-14 03:25:44.659331,2026-03-14 03:25:58.507520,0 days 00:00:13.848189,tanh,0.0,3,0.75,COMPLETE
1258,1258,0.45510134100914,2026-03-14 03:25:58.720211,2026-03-14 03:26:12.447782,0 days 00:00:13.727571,tanh,0.0,3,0.7,COMPLETE
1259,1259,0.48964062333106995,2026-03-14 03:26:12.616309,2026-03-14 03:26:26.370761,0 days 00:00:13.754452,tanh,0.0,3,0.55,COMPLETE
1260,1260,0.43817493319511414,2026-03-14 03:26:26.535788,2026-03-14 03:26:40.427909,0 days 00:00:13.892121,tanh,0.0,3,0.8,COMPLETE
1261,1261,0.42585816979408264,2026-03-14 03:26:40.604045,2026-03-14 03:26:54.534429,0 days 00:00:13.930384,tanh,0.0,3,0.6,COMPLETE
1262,1262,0.5043414235115051,2026-03-14 03:26:54.693936,2026-03-14 03:27:08.597129,0 days 00:00:13.903193,relu,0.05,3,0.65,COMPLETE
1263,1263,0.4351106882095337,2026-03-14 03:27:08.758161,2026-03-14 03:27:22.427262,0 days 00:00:13.669101,tanh,0.0,3,0.65,COMPLETE
1264,1264,0.4757830798625946,2026-03-14 03:27:22.581296,2026-03-14 03:27:36.326510,0 days 00:00:13.745214,tanh,0.0,3,0.6,COMPLETE
1265,1265,0.47094956040382385,2026-03-14 03:27:36.608246,2026-03-14 03:27:50.327263,0 days 00:00:13.719017,tanh,0.0,3,0.65,COMPLETE
1266,1266,0.7644243240356445,2026-03-14 03:27:50.489327,2026-03-14 03:28:04.895208,0 days 00:00:14.405881,tanh,0.45,4,0.65,COMPLETE
1267,1267,0.4715149700641632,2026-03-14 03:28:05.048336,2026-03-14 03:28:18.757020,0 days 00:00:13.708684,tanh,0.05,3,0.6,COMPLETE
1268,1268,0.4438686966896057,2026-03-14 03:28:18.926077,2026-03-14 03:28:32.519478,0 days 00:00:13.593401,tanh,0.0,3,0.7,COMPLETE
1269,1269,0.4304056465625763,2026-03-14 03:28:32.667026,2026-03-14 03:28:46.416152,0 days 00:00:13.749126,tanh,0.0,3,0.6,COMPLETE
1270,1270,0.4630919396877289,2026-03-14 03:28:46.584677,2026-03-14 03:29:00.330119,0 days 00:00:13.745442,tanh,0.0,3,0.65,COMPLETE
1271,1271,0.6435851454734802,2026-03-14 03:29:00.490639,2026-03-14 03:29:14.243064,0 days 00:00:13.752425,sigmoid,0.0,3,0.55,COMPLETE
1272,1272,0.442696750164032,2026-03-14 03:29:14.397577,2026-03-14 03:29:28.160906,0 days 00:00:13.763329,tanh,0.0,3,0.65,COMPLETE
1273,1273,0.4510503113269806,2026-03-14 03:29:28.319425,2026-03-14 03:29:42.042427,0 days 00:00:13.723002,tanh,0.0,3,0.6,COMPLETE
1274,1274,0.46782878041267395,2026-03-14 03:29:42.209527,2026-03-14 03:29:56.095495,0 days 00:00:13.885968,tanh,0.05,3,0.75,COMPLETE
1275,1275,0.49222344160079956,2026-03-14 03:29:56.269578,2026-03-14 03:30:09.812250,0 days 00:00:13.542672,tanh,0.0,2,0.7,COMPLETE
1276,1276,0.46525123715400696,2026-03-14 03:30:09.965657,2026-03-14 03:30:23.524379,0 days 00:00:13.558722,tanh,0.0,3,0.65,COMPLETE
1277,1277,0.4048859179019928,2026-03-14 03:30:23.723424,2026-03-14 03:30:37.170163,0 days 00:00:13.446739,tanh,0.0,3,0.65,COMPLETE
1278,1278,0.44220539927482605,2026-03-14 03:30:37.421923,2026-03-14 03:30:51.567946,0 days 00:00:14.146023,tanh,0.1,3,0.65,COMPLETE
1279,1279,0.46333327889442444,2026-03-14 03:30:51.728016,2026-03-14 03:31:05.555695,0 days 00:00:13.827679,tanh,0.25,3,0.65,COMPLETE
1280,1280,0.4438684284687042,2026-03-14 03:31:05.716727,2026-03-14 03:31:19.462186,0 days 00:00:13.745459,tanh,0.0,3,0.65,COMPLETE
1281,1281,0.44483432173728943,2026-03-14 03:31:19.631213,2026-03-14 03:31:33.256135,0 days 00:00:13.624922,tanh,0.0,3,0.65,COMPLETE
1282,1282,0.473526269197464,2026-03-14 03:31:33.421159,2026-03-14 03:31:47.406136,0 days 00:00:13.984977,tanh,0.05,3,0.65,COMPLETE
1283,1283,0.4943375587463379,2026-03-14 03:31:47.572162,2026-03-14 03:32:01.370150,0 days 00:00:13.797988,tanh,0.0,4,0.65,COMPLETE
1284,1284,0.4727976322174072,2026-03-14 03:32:01.538678,2026-03-14 03:32:15.304535,0 days 00:00:13.765857,tanh,0.0,3,0.65,COMPLETE
1285,1285,0.47025230526924133,2026-03-14 03:32:15.469567,2026-03-14 03:32:29.126146,0 days 00:00:13.656579,tanh,0.0,3,0.65,COMPLETE
1286,1286,0.5017884373664856,2026-03-14 03:32:29.284177,2026-03-14 03:32:43.228698,0 days 00:00:13.944521,relu,0.0,3,0.65,COMPLETE
1287,1287,0.4589345157146454,2026-03-14 03:32:43.397734,2026-03-14 03:32:57.009834,0 days 00:00:13.612100,tanh,0.0,3,0.65,COMPLETE
1288,1288,0.455742210149765,2026-03-14 03:32:57.162917,2026-03-14 03:33:11.139545,0 days 00:00:13.976628,tanh,0.0,3,0.65,COMPLETE
1289,1289,0.4508392810821533,2026-03-14 03:33:11.307664,2026-03-14 03:33:25.598144,0 days 00:00:14.290480,tanh,0.05,3,0.65,COMPLETE
1290,1290,0.44433486461639404,2026-03-14 03:33:25.757655,2026-03-14 03:33:39.509715,0 days 00:00:13.752060,tanh,0.0,3,0.65,COMPLETE
1291,1291,0.6428205966949463,2026-03-14 03:33:39.659754,2026-03-14 03:33:53.520412,0 days 00:00:13.860658,tanh,0.0,5,0.6,COMPLETE
1292,1292,0.47743287682533264,2026-03-14 03:33:53.733096,2026-03-14 03:34:07.487613,0 days 00:00:13.754517,tanh,0.0,3,0.65,COMPLETE
1293,1293,0.4440046548843384,2026-03-14 03:34:07.645534,2026-03-14 03:34:21.574217,0 days 00:00:13.928683,tanh,0.4,3,0.65,COMPLETE
1294,1294,0.6500522494316101,2026-03-14 03:34:21.726348,2026-03-14 03:34:36.014354,0 days 00:00:14.288006,sigmoid,0.15000000000000002,3,0.6,COMPLETE
1295,1295,0.46288228034973145,2026-03-14 03:34:36.171903,2026-03-14 03:34:49.754402,0 days 00:00:13.582499,tanh,0.0,3,0.6,COMPLETE
1296,1296,0.478203147649765,2026-03-14 03:34:49.936441,2026-03-14 03:35:03.675501,0 days 00:00:13.739060,tanh,0.0,3,0.65,COMPLETE
1297,1297,0.4404453635215759,2026-03-14 03:35:03.831038,2026-03-14 03:35:17.653941,0 days 00:00:13.822903,tanh,0.0,3,0.65,COMPLETE
1298,1298,0.5167450308799744,2026-03-14 03:35:17.813423,2026-03-14 03:35:31.553748,0 days 00:00:13.740325,tanh,0.0,3,0.65,COMPLETE
1299,1299,0.4884459972381592,2026-03-14 03:35:31.715324,2026-03-14 03:35:45.370005,0 days 00:00:13.654681,tanh,0.0,2,0.6,COMPLETE
1300,1300,0.4894770383834839,2026-03-14 03:35:45.541053,2026-03-14 03:35:59.556898,0 days 00:00:14.015845,tanh,0.05,3,0.65,COMPLETE
1301,1301,0.46800482273101807,2026-03-14 03:35:59.722924,2026-03-14 03:36:13.432540,0 days 00:00:13.709616,tanh,0.0,3,0.6,COMPLETE
1302,1302,0.44096994400024414,2026-03-14 03:36:13.602095,2026-03-14 03:36:27.510164,0 days 00:00:13.908069,tanh,0.0,4,0.55,COMPLETE
1303,1303,0.47937989234924316,2026-03-14 03:36:27.666287,2026-03-14 03:36:41.502474,0 days 00:00:13.836187,tanh,0.0,3,0.6,COMPLETE
1304,1304,0.4384513795375824,2026-03-14 03:36:41.675489,2026-03-14 03:36:55.420452,0 days 00:00:13.744963,tanh,0.0,3,0.65,COMPLETE
1305,1305,0.6793818473815918,2026-03-14 03:36:55.577993,2026-03-14 03:37:10.795508,0 days 00:00:15.217515,tanh,0.25,8,0.65,COMPLETE
1306,1306,0.5814496874809265,2026-03-14 03:37:10.958030,2026-03-14 03:37:24.720141,0 days 00:00:13.762111,relu,0.05,3,0.65,COMPLETE
1307,1307,0.4425008296966553,2026-03-14 03:37:24.868657,2026-03-14 03:37:38.711346,0 days 00:00:13.842689,tanh,0.2,3,0.6,COMPLETE
1308,1308,0.46178004145622253,2026-03-14 03:37:38.878878,2026-03-14 03:37:52.654060,0 days 00:00:13.775182,tanh,0.0,3,0.65,COMPLETE
1309,1309,0.47448739409446716,2026-03-14 03:37:52.811089,2026-03-14 03:38:06.491535,0 days 00:00:13.680446,tanh,0.0,3,0.6,COMPLETE
1310,1310,0.6265980005264282,2026-03-14 03:38:06.643569,2026-03-14 03:38:20.510806,0 days 00:00:13.867237,tanh,0.0,3,0.55,COMPLETE
1311,1311,0.4784238934516907,2026-03-14 03:38:20.852366,2026-03-14 03:38:34.794144,0 days 00:00:13.941778,tanh,0.05,3,0.65,COMPLETE
1312,1312,0.4330974221229553,2026-03-14 03:38:34.967701,2026-03-14 03:38:48.779089,0 days 00:00:13.811388,tanh,0.0,3,0.6,COMPLETE
1313,1313,0.4743695557117462,2026-03-14 03:38:48.944132,2026-03-14 03:39:03.087034,0 days 00:00:14.142902,tanh,0.35000000000000003,3,0.65,COMPLETE
1314,1314,0.6429752111434937,2026-03-14 03:39:03.242642,2026-03-14 03:39:17.625390,0 days 00:00:14.382748,sigmoid,0.0,6,0.65,COMPLETE
1315,1315,0.46166014671325684,2026-03-14 03:39:17.784006,2026-03-14 03:39:31.770053,0 days 00:00:13.986047,tanh,0.0,4,0.6,COMPLETE
1316,1316,0.4976314902305603,2026-03-14 03:39:31.931151,2026-03-14 03:39:45.660804,0 days 00:00:13.729653,tanh,0.0,3,0.65,COMPLETE
1317,1317,0.6410828828811646,2026-03-14 03:39:45.831841,2026-03-14 03:40:00.247542,0 days 00:00:14.415701,tanh,0.0,7,0.6,COMPLETE
1318,1318,0.43586835265159607,2026-03-14 03:40:00.410569,2026-03-14 03:40:13.995829,0 days 00:00:13.585260,tanh,0.0,3,0.65,COMPLETE
1319,1319,0.4489425718784332,2026-03-14 03:40:14.385593,2026-03-14 03:40:28.253134,0 days 00:00:13.867541,tanh,0.05,3,0.6,COMPLETE
1320,1320,0.4368797242641449,2026-03-14 03:40:28.415165,2026-03-14 03:40:42.229050,0 days 00:00:13.813885,tanh,0.0,3,0.65,COMPLETE
1321,1321,0.4577244520187378,2026-03-14 03:40:42.394458,2026-03-14 03:40:56.138606,0 days 00:00:13.744148,tanh,0.0,3,0.55,COMPLETE
1322,1322,0.42150524258613586,2026-03-14 03:40:56.293698,2026-03-14 03:41:10.033822,0 days 00:00:13.740124,tanh,0.0,3,0.6,COMPLETE
1323,1323,0.4486716687679291,2026-03-14 03:41:10.198400,2026-03-14 03:41:23.901839,0 days 00:00:13.703439,tanh,0.0,3,0.65,COMPLETE
1324,1324,0.450644850730896,2026-03-14 03:41:24.061898,2026-03-14 03:41:37.926900,0 days 00:00:13.865002,tanh,0.0,3,0.65,COMPLETE
1325,1325,0.4922265410423279,2026-03-14 03:41:38.100587,2026-03-14 03:41:51.678496,0 days 00:00:13.577909,tanh,0.0,2,0.6,COMPLETE
1326,1326,0.4515383541584015,2026-03-14 03:41:51.856336,2026-03-14 03:42:05.672113,0 days 00:00:13.815777,tanh,0.05,3,0.65,COMPLETE
1327,1327,0.4200764000415802,2026-03-14 03:42:06.040631,2026-03-14 03:42:19.999974,0 days 00:00:13.959343,tanh,0.0,3,0.7,COMPLETE
