,number,value,datetime_start,datetime_complete,duration,params_activation,params_dropout,params_layers,params_shrink,state
1987,1987,0.45354747772216797,2026-03-14 06:17:25.230073,2026-03-14 06:17:39.057586,0 days 00:00:13.827513,tanh,0.0,3,0.5,COMPLETE
1988,1988,0.43250325322151184,2026-03-14 06:17:39.203422,2026-03-14 06:17:53.362946,0 days 00:00:14.159524,tanh,0.05,3,0.5,COMPLETE
1989,1989,0.43666377663612366,2026-03-14 06:17:53.517511,2026-03-14 06:18:07.820546,0 days 00:00:14.303035,tanh,0.0,3,0.55,COMPLETE
1990,1990,0.4944342076778412,2026-03-14 06:18:07.955074,2026-03-14 06:18:21.760354,0 days 00:00:13.805280,tanh,0.0,2,0.5,COMPLETE
1991,1991,0.471660852432251,2026-03-14 06:18:21.902866,2026-03-14 06:18:35.623772,0 days 00:00:13.720906,relu,0.0,3,0.55,COMPLETE
1992,1992,0.4719148874282837,2026-03-14 06:18:35.796292,2026-03-14 06:18:49.939286,0 days 00:00:14.142994,tanh,0.0,3,0.5,COMPLETE
1993,1993,0.48137834668159485,2026-03-14 06:18:50.079368,2026-03-14 06:19:03.800152,0 days 00:00:13.720784,tanh,0.0,3,0.5,COMPLETE
1994,1994,0.4208070635795593,2026-03-14 06:19:03.975182,2026-03-14 06:19:17.769954,0 days 00:00:13.794772,tanh,0.0,3,0.5,COMPLETE
1995,1995,0.4618290960788727,2026-03-14 06:19:17.920469,2026-03-14 06:19:31.956895,0 days 00:00:14.036426,tanh,0.0,3,0.55,COMPLETE
1996,1996,0.46433645486831665,2026-03-14 06:19:32.095993,2026-03-14 06:19:46.025215,0 days 00:00:13.929222,tanh,0.0,3,0.5,COMPLETE
1997,1997,0.4400647282600403,2026-03-14 06:19:46.156136,2026-03-14 06:20:00.145749,0 days 00:00:13.989613,tanh,0.0,3,0.5,COMPLETE
1998,1998,0.43307945132255554,2026-03-14 06:20:00.316781,2026-03-14 06:20:14.308357,0 days 00:00:13.991576,tanh,0.0,3,0.55,COMPLETE
1999,1999,0.4568585157394409,2026-03-14 06:20:14.446899,2026-03-14 06:20:28.506714,0 days 00:00:14.059815,tanh,0.05,3,0.5,COMPLETE
2000,2000,0.4510285258293152,2026-03-14 06:20:28.648230,2026-03-14 06:20:42.797314,0 days 00:00:14.149084,tanh,0.0,4,0.5,COMPLETE
2001,2001,0.6426000595092773,2026-03-14 06:20:42.957459,2026-03-14 06:20:57.071852,0 days 00:00:14.114393,sigmoid,0.0,3,0.55,COMPLETE
2002,2002,0.643038809299469,2026-03-14 06:20:57.209547,2026-03-14 06:21:12.048156,0 days 00:00:14.838609,tanh,0.0,7,0.5,COMPLETE
2003,2003,0.4607824981212616,2026-03-14 06:21:12.188748,2026-03-14 06:21:26.239670,0 days 00:00:14.050922,tanh,0.0,3,0.55,COMPLETE
2004,2004,0.448699414730072,2026-03-14 06:21:26.389183,2026-03-14 06:21:40.495627,0 days 00:00:14.106444,tanh,0.0,3,0.5,COMPLETE
2005,2005,0.43939653038978577,2026-03-14 06:21:40.626175,2026-03-14 06:21:54.684028,0 days 00:00:14.057853,tanh,0.0,3,0.5,COMPLETE
2006,2006,0.47201797366142273,2026-03-14 06:21:54.816363,2026-03-14 06:22:09.226712,0 days 00:00:14.410349,tanh,0.05,3,0.55,COMPLETE
2007,2007,0.4784233868122101,2026-03-14 06:22:09.351737,2026-03-14 06:22:23.761096,0 days 00:00:14.409359,tanh,0.0,3,0.5,COMPLETE
2008,2008,0.44103682041168213,2026-03-14 06:22:23.900134,2026-03-14 06:22:37.912424,0 days 00:00:14.012290,tanh,0.0,3,0.5,COMPLETE
2009,2009,0.48870405554771423,2026-03-14 06:22:38.036561,2026-03-14 06:22:51.929564,0 days 00:00:13.893003,tanh,0.0,3,0.55,COMPLETE
2010,2010,0.4727935194969177,2026-03-14 06:22:52.085184,2026-03-14 06:23:06.086547,0 days 00:00:14.001363,tanh,0.0,3,0.5,COMPLETE
2011,2011,0.44439253211021423,2026-03-14 06:23:06.234448,2026-03-14 06:23:19.797900,0 days 00:00:13.563452,tanh,0.0,3,0.5,COMPLETE
2012,2012,0.45039084553718567,2026-03-14 06:23:19.943414,2026-03-14 06:23:33.737727,0 days 00:00:13.794313,tanh,0.0,3,0.55,COMPLETE
2013,2013,0.47130388021469116,2026-03-14 06:23:33.877189,2026-03-14 06:23:48.279638,0 days 00:00:14.402449,relu,0.05,3,0.5,COMPLETE
2014,2014,0.44341546297073364,2026-03-14 06:23:48.433175,2026-03-14 06:24:02.345612,0 days 00:00:13.912437,tanh,0.0,3,0.55,COMPLETE
2015,2015,0.4668479561805725,2026-03-14 06:24:02.486122,2026-03-14 06:24:16.630845,0 days 00:00:14.144723,tanh,0.0,3,0.5,COMPLETE
2016,2016,0.4388391971588135,2026-03-14 06:24:16.774371,2026-03-14 06:24:30.997000,0 days 00:00:14.222629,tanh,0.0,3,0.5,COMPLETE
2017,2017,0.43952420353889465,2026-03-14 06:24:31.128029,2026-03-14 06:24:45.215587,0 days 00:00:14.087558,tanh,0.0,3,0.5,COMPLETE
2018,2018,0.4754440188407898,2026-03-14 06:24:45.362913,2026-03-14 06:24:59.334938,0 days 00:00:13.972025,tanh,0.0,2,0.55,COMPLETE
2019,2019,0.49335595965385437,2026-03-14 06:24:59.466962,2026-03-14 06:25:13.582969,0 days 00:00:14.116007,tanh,0.0,3,0.5,COMPLETE
2020,2020,0.43061479926109314,2026-03-14 06:25:13.913094,2026-03-14 06:25:28.038126,0 days 00:00:14.125032,tanh,0.0,4,0.5,COMPLETE
2021,2021,0.4561631977558136,2026-03-14 06:25:28.173266,2026-03-14 06:25:42.396382,0 days 00:00:14.223116,tanh,0.05,3,0.55,COMPLETE
2022,2022,0.4184715151786804,2026-03-14 06:25:42.528919,2026-03-14 06:25:56.578983,0 days 00:00:14.050064,tanh,0.0,3,0.5,COMPLETE
2023,2023,0.6443008184432983,2026-03-14 06:25:56.737496,2026-03-14 06:26:10.810531,0 days 00:00:14.073035,sigmoid,0.0,3,0.5,COMPLETE
2024,2024,0.46438732743263245,2026-03-14 06:26:10.952651,2026-03-14 06:26:24.922939,0 days 00:00:13.970288,tanh,0.0,3,0.55,COMPLETE
2025,2025,0.4345284104347229,2026-03-14 06:26:25.091968,2026-03-14 06:26:38.815858,0 days 00:00:13.723890,tanh,0.0,3,0.5,COMPLETE
2026,2026,0.4724106788635254,2026-03-14 06:26:38.947907,2026-03-14 06:26:52.866406,0 days 00:00:13.918499,tanh,0.0,3,0.5,COMPLETE
2027,2027,0.4321937561035156,2026-03-14 06:26:53.008305,2026-03-14 06:27:07.026052,0 days 00:00:14.017747,tanh,0.25,3,0.55,COMPLETE
2028,2028,0.43542197346687317,2026-03-14 06:27:07.170656,2026-03-14 06:27:20.919425,0 days 00:00:13.748769,tanh,0.0,3,0.5,COMPLETE
2029,2029,0.4694492220878601,2026-03-14 06:27:21.058955,2026-03-14 06:27:35.555226,0 days 00:00:14.496271,tanh,0.35000000000000003,3,0.5,COMPLETE
2030,2030,0.4512287378311157,2026-03-14 06:27:35.688496,2026-03-14 06:27:49.730555,0 days 00:00:14.042059,tanh,0.0,3,0.55,COMPLETE
2031,2031,0.4790082275867462,2026-03-14 06:27:49.859096,2026-03-14 06:28:04.239489,0 days 00:00:14.380393,tanh,0.05,3,0.5,COMPLETE
2032,2032,0.44683676958084106,2026-03-14 06:28:04.372002,2026-03-14 06:28:18.660446,0 days 00:00:14.288444,tanh,0.0,3,0.55,COMPLETE
2033,2033,0.4374855160713196,2026-03-14 06:28:18.821508,2026-03-14 06:28:32.720476,0 days 00:00:13.898968,tanh,0.0,3,0.5,COMPLETE
2034,2034,0.4637030065059662,2026-03-14 06:28:32.865894,2026-03-14 06:28:46.883919,0 days 00:00:14.018025,tanh,0.0,3,0.55,COMPLETE
2035,2035,0.46349310874938965,2026-03-14 06:28:47.043430,2026-03-14 06:29:01.053553,0 days 00:00:14.010123,relu,0.0,2,0.5,COMPLETE
2036,2036,0.4481065571308136,2026-03-14 06:29:01.215645,2026-03-14 06:29:15.360419,0 days 00:00:14.144774,tanh,0.0,3,0.5,COMPLETE
2037,2037,0.4278426170349121,2026-03-14 06:29:15.499600,2026-03-14 06:29:29.498063,0 days 00:00:13.998463,tanh,0.0,3,0.5,COMPLETE
2038,2038,0.47908687591552734,2026-03-14 06:29:29.638578,2026-03-14 06:29:43.680513,0 days 00:00:14.041935,tanh,0.0,3,0.55,COMPLETE
2039,2039,0.44016000628471375,2026-03-14 06:29:43.826320,2026-03-14 06:29:58.050514,0 days 00:00:14.224194,tanh,0.05,3,0.5,COMPLETE
2040,2040,0.43270865082740784,2026-03-14 06:29:58.194100,2026-03-14 06:30:12.199240,0 days 00:00:14.005140,tanh,0.0,3,0.5,COMPLETE
2041,2041,0.4674132764339447,2026-03-14 06:30:12.349146,2026-03-14 06:30:26.506200,0 days 00:00:14.157054,tanh,0.0,3,0.55,COMPLETE
2042,2042,0.4266854226589203,2026-03-14 06:30:26.656280,2026-03-14 06:30:40.816467,0 days 00:00:14.160187,tanh,0.0,3,0.5,COMPLETE
2043,2043,0.46352601051330566,2026-03-14 06:30:40.958221,2026-03-14 06:30:55.092672,0 days 00:00:14.134451,tanh,0.0,3,0.8500000000000001,COMPLETE
2044,2044,0.6484302282333374,2026-03-14 06:30:55.237886,2026-03-14 06:31:10.027424,0 days 00:00:14.789538,sigmoid,0.0,3,0.55,COMPLETE
2045,2045,0.4037199914455414,2026-03-14 06:31:10.181536,2026-03-14 06:31:24.341335,0 days 00:00:14.159799,tanh,0.0,3,0.5,COMPLETE
2046,2046,0.4707995355129242,2026-03-14 06:31:24.493074,2026-03-14 06:31:38.570064,0 days 00:00:14.076990,tanh,0.0,3,0.5,COMPLETE
2047,2047,0.41892218589782715,2026-03-14 06:31:38.742574,2026-03-14 06:31:53.353161,0 days 00:00:14.610587,tanh,0.05,3,0.5,COMPLETE
2048,2048,0.41120725870132446,2026-03-14 06:31:53.488721,2026-03-14 06:32:07.614882,0 days 00:00:14.126161,tanh,0.0,3,0.5,COMPLETE
2049,2049,0.4515659511089325,2026-03-14 06:32:07.815606,2026-03-14 06:32:21.612102,0 days 00:00:13.796496,tanh,0.0,3,0.5,COMPLETE
2050,2050,0.4400445520877838,2026-03-14 06:32:21.747027,2026-03-14 06:32:36.115041,0 days 00:00:14.368014,tanh,0.35000000000000003,3,0.5,COMPLETE
2051,2051,0.4538015127182007,2026-03-14 06:32:36.276661,2026-03-14 06:32:50.464549,0 days 00:00:14.187888,tanh,0.0,4,0.5,COMPLETE
2052,2052,0.43325895071029663,2026-03-14 06:32:50.614870,2026-03-14 06:33:04.765807,0 days 00:00:14.150937,tanh,0.0,3,0.5,COMPLETE
2053,2053,0.43549051880836487,2026-03-14 06:33:04.911845,2026-03-14 06:33:18.961785,0 days 00:00:14.049940,tanh,0.0,3,0.5,COMPLETE
2054,2054,0.43077051639556885,2026-03-14 06:33:19.294411,2026-03-14 06:33:33.263615,0 days 00:00:13.969204,tanh,0.0,3,0.5,COMPLETE
2055,2055,0.4604426622390747,2026-03-14 06:33:33.420639,2026-03-14 06:33:47.422750,0 days 00:00:14.002111,tanh,0.0,3,0.5,COMPLETE
2056,2056,0.4439721405506134,2026-03-14 06:33:47.557271,2026-03-14 06:34:01.757125,0 days 00:00:14.199854,tanh,0.05,3,0.5,COMPLETE
2057,2057,0.44022661447525024,2026-03-14 06:34:01.912675,2026-03-14 06:34:16.149000,0 days 00:00:14.236325,tanh,0.0,3,0.5,COMPLETE
2058,2058,0.48369693756103516,2026-03-14 06:34:16.287729,2026-03-14 06:34:30.403179,0 days 00:00:14.115450,relu,0.0,3,0.5,COMPLETE
2059,2059,0.49147123098373413,2026-03-14 06:34:30.575628,2026-03-14 06:34:44.426084,0 days 00:00:13.850456,tanh,0.0,3,0.5,COMPLETE
2060,2060,0.453969806432724,2026-03-14 06:34:44.566088,2026-03-14 06:34:58.810861,0 days 00:00:14.244773,tanh,0.0,3,0.5,COMPLETE
2061,2061,0.4622478783130646,2026-03-14 06:34:58.963914,2026-03-14 06:35:12.897296,0 days 00:00:13.933382,tanh,0.0,3,0.5,COMPLETE
2062,2062,0.47762084007263184,2026-03-14 06:35:13.072373,2026-03-14 06:35:27.177462,0 days 00:00:14.105089,tanh,0.0,3,0.5,COMPLETE
2063,2063,0.46484559774398804,2026-03-14 06:35:27.308495,2026-03-14 06:35:41.628831,0 days 00:00:14.320336,tanh,0.05,3,0.5,COMPLETE
2064,2064,0.47228720784187317,2026-03-14 06:35:41.787156,2026-03-14 06:35:55.767372,0 days 00:00:13.980216,tanh,0.0,3,0.5,COMPLETE
2065,2065,0.45038145780563354,2026-03-14 06:35:55.905815,2026-03-14 06:36:09.839915,0 days 00:00:13.934100,tanh,0.0,3,0.5,COMPLETE
2066,2066,0.4795694649219513,2026-03-14 06:36:09.996442,2026-03-14 06:36:24.219757,0 days 00:00:14.223315,tanh,0.0,2,0.5,COMPLETE
2067,2067,0.6420409083366394,2026-03-14 06:36:24.368708,2026-03-14 06:36:38.496676,0 days 00:00:14.127968,tanh,0.0,5,0.5,COMPLETE
2068,2068,0.42347031831741333,2026-03-14 06:36:38.663363,2026-03-14 06:36:52.750835,0 days 00:00:14.087472,tanh,0.0,3,0.5,COMPLETE
2069,2069,0.42939653992652893,2026-03-14 06:36:52.909350,2026-03-14 06:37:07.041056,0 days 00:00:14.131706,tanh,0.0,3,0.55,COMPLETE
2070,2070,0.45896023511886597,2026-03-14 06:37:07.387673,2026-03-14 06:37:21.380931,0 days 00:00:13.993258,tanh,0.0,3,0.5,COMPLETE
2071,2071,0.45585447549819946,2026-03-14 06:37:21.561959,2026-03-14 06:37:35.701804,0 days 00:00:14.139845,tanh,0.0,3,0.5,COMPLETE
2072,2072,0.643376886844635,2026-03-14 06:37:35.852324,2026-03-14 06:37:50.161193,0 days 00:00:14.308869,sigmoid,0.0,3,0.55,COMPLETE
2073,2073,0.47677433490753174,2026-03-14 06:37:50.314271,2026-03-14 06:38:04.462488,0 days 00:00:14.148217,tanh,0.05,3,0.5,COMPLETE
2074,2074,0.6472955942153931,2026-03-14 06:38:04.608511,2026-03-14 06:38:18.686373,0 days 00:00:14.077862,tanh,0.0,4,0.5,COMPLETE
2075,2075,0.4614671468734741,2026-03-14 06:38:18.838903,2026-03-14 06:38:33.137535,0 days 00:00:14.298632,tanh,0.2,3,0.5,COMPLETE
2076,2076,0.4664662182331085,2026-03-14 06:38:33.269650,2026-03-14 06:38:47.240871,0 days 00:00:13.971221,tanh,0.0,3,0.55,COMPLETE
2077,2077,0.49503204226493835,2026-03-14 06:38:47.381414,2026-03-14 06:39:01.435763,0 days 00:00:14.054349,tanh,0.0,3,0.5,COMPLETE
2078,2078,0.43581992387771606,2026-03-14 06:39:01.595297,2026-03-14 06:39:15.724181,0 days 00:00:14.128884,tanh,0.0,3,0.5,COMPLETE
2079,2079,0.44195207953453064,2026-03-14 06:39:15.858548,2026-03-14 06:39:29.892795,0 days 00:00:14.034247,tanh,0.0,3,0.55,COMPLETE
2080,2080,0.5273312926292419,2026-03-14 06:39:30.027821,2026-03-14 06:39:44.191990,0 days 00:00:14.164169,tanh,0.05,3,0.5,COMPLETE
2081,2081,0.4930070638656616,2026-03-14 06:39:44.351022,2026-03-14 06:39:58.341456,0 days 00:00:13.990434,relu,0.0,3,0.5,COMPLETE
2082,2082,0.42375874519348145,2026-03-14 06:39:58.662006,2026-03-14 06:40:12.697713,0 days 00:00:14.035707,tanh,0.0,3,0.55,COMPLETE
2083,2083,0.41544589400291443,2026-03-14 06:40:12.848177,2026-03-14 06:40:26.781515,0 days 00:00:13.933338,tanh,0.0,3,0.5,COMPLETE
2084,2084,0.45122289657592773,2026-03-14 06:40:26.951030,2026-03-14 06:40:40.893631,0 days 00:00:13.942601,tanh,0.0,3,0.5,COMPLETE
2085,2085,0.45786917209625244,2026-03-14 06:40:41.047146,2026-03-14 06:40:55.214684,0 days 00:00:14.167538,tanh,0.0,3,0.5,COMPLETE
2086,2086,0.43702876567840576,2026-03-14 06:40:55.359198,2026-03-14 06:41:09.622973,0 days 00:00:14.263775,tanh,0.25,3,0.55,COMPLETE
2087,2087,0.45429152250289917,2026-03-14 06:41:09.752505,2026-03-14 06:41:24.042147,0 days 00:00:14.289642,tanh,0.05,3,0.55,COMPLETE
2088,2088,0.4300081133842468,2026-03-14 06:41:24.191179,2026-03-14 06:41:38.183130,0 days 00:00:13.991951,tanh,0.0,3,0.5,COMPLETE
2089,2089,0.4272178113460541,2026-03-14 06:41:38.332162,2026-03-14 06:41:51.856569,0 days 00:00:13.524407,tanh,0.0,3,0.5,COMPLETE
2090,2090,0.6435542702674866,2026-03-14 06:41:52.010607,2026-03-14 06:42:06.110296,0 days 00:00:14.099689,sigmoid,0.0,3,0.55,COMPLETE
2091,2091,0.4669215977191925,2026-03-14 06:42:06.267428,2026-03-14 06:42:20.118121,0 days 00:00:13.850693,tanh,0.0,3,0.5,COMPLETE
2092,2092,0.39995354413986206,2026-03-14 06:42:20.257242,2026-03-14 06:42:34.151655,0 days 00:00:13.894413,tanh,0.0,3,0.5,COMPLETE
2093,2093,0.7516972422599792,2026-03-14 06:42:34.318358,2026-03-14 06:42:48.968066,0 days 00:00:14.649708,tanh,0.4,4,0.5,COMPLETE
2094,2094,0.462778240442276,2026-03-14 06:42:49.133623,2026-03-14 06:43:03.053012,0 days 00:00:13.919389,tanh,0.0,2,0.5,COMPLETE
2095,2095,0.4638504385948181,2026-03-14 06:43:03.212638,2026-03-14 06:43:17.293470,0 days 00:00:14.080832,tanh,0.0,3,0.5,COMPLETE
2096,2096,0.6429412364959717,2026-03-14 06:43:17.433987,2026-03-14 06:43:32.292113,0 days 00:00:14.858126,tanh,0.0,7,0.5,COMPLETE
2097,2097,0.4723851680755615,2026-03-14 06:43:32.438650,2026-03-14 06:43:46.453376,0 days 00:00:14.014726,tanh,0.0,3,0.5,COMPLETE
2098,2098,0.44437241554260254,2026-03-14 06:43:46.603904,2026-03-14 06:44:00.908201,0 days 00:00:14.304297,tanh,0.05,3,0.5,COMPLETE
2099,2099,0.4663826823234558,2026-03-14 06:44:01.043266,2026-03-14 06:44:14.901876,0 days 00:00:13.858610,tanh,0.0,3,0.5,COMPLETE
2100,2100,0.4511535167694092,2026-03-14 06:44:15.238514,2026-03-14 06:44:29.469702,0 days 00:00:14.231188,tanh,0.0,3,0.5,COMPLETE
2101,2101,0.44683846831321716,2026-03-14 06:44:29.608731,2026-03-14 06:44:43.542636,0 days 00:00:13.933905,tanh,0.0,3,0.5,COMPLETE
2102,2102,0.4853929281234741,2026-03-14 06:44:43.734874,2026-03-14 06:44:57.776943,0 days 00:00:14.042069,relu,0.0,3,0.5,COMPLETE
2103,2103,0.43313342332839966,2026-03-14 06:44:57.918981,2026-03-14 06:45:12.107194,0 days 00:00:14.188213,tanh,0.0,3,0.5,COMPLETE
2104,2104,0.4682517945766449,2026-03-14 06:45:12.253077,2026-03-14 06:45:26.109536,0 days 00:00:13.856459,tanh,0.0,3,0.5,COMPLETE
2105,2105,0.477828711271286,2026-03-14 06:45:26.254679,2026-03-14 06:45:40.571376,0 days 00:00:14.316697,tanh,0.05,3,0.5,COMPLETE
2106,2106,0.4757319688796997,2026-03-14 06:45:40.741379,2026-03-14 06:45:54.709714,0 days 00:00:13.968335,tanh,0.0,3,0.5,COMPLETE
2107,2107,0.47047460079193115,2026-03-14 06:45:54.852242,2026-03-14 06:46:09.027070,0 days 00:00:14.174828,tanh,0.0,3,0.5,COMPLETE
2108,2108,0.4768303334712982,2026-03-14 06:46:09.176493,2026-03-14 06:46:23.445534,0 days 00:00:14.269041,tanh,0.0,3,0.5,COMPLETE
2109,2109,0.44516268372535706,2026-03-14 06:46:23.595564,2026-03-14 06:46:37.312932,0 days 00:00:13.717368,tanh,0.0,3,0.5,COMPLETE
2110,2110,0.6834908127784729,2026-03-14 06:46:37.471111,2026-03-14 06:46:52.078194,0 days 00:00:14.607083,tanh,0.0,8,0.5,COMPLETE
2111,2111,0.643740713596344,2026-03-14 06:46:52.244896,2026-03-14 06:47:06.596283,0 days 00:00:14.351387,sigmoid,0.5,3,0.5,COMPLETE
2112,2112,0.5196712017059326,2026-03-14 06:47:06.749796,2026-03-14 06:47:20.711740,0 days 00:00:13.961944,tanh,0.0,3,0.5,COMPLETE
2113,2113,0.44608423113822937,2026-03-14 06:47:20.874256,2026-03-14 06:47:34.828109,0 days 00:00:13.953853,tanh,0.0,3,0.5,COMPLETE
2114,2114,0.5647414326667786,2026-03-14 06:47:34.995662,2026-03-14 06:47:48.819689,0 days 00:00:13.824027,tanh,0.0,3,0.5,COMPLETE
2115,2115,0.4311869442462921,2026-03-14 06:47:48.998008,2026-03-14 06:48:03.005089,0 days 00:00:14.007081,tanh,0.15000000000000002,3,0.5,COMPLETE
2116,2116,0.4848351776599884,2026-03-14 06:48:03.158126,2026-03-14 06:48:17.239882,0 days 00:00:14.081756,tanh,0.05,2,0.5,COMPLETE
2117,2117,0.4737572968006134,2026-03-14 06:48:17.432401,2026-03-14 06:48:31.673634,0 days 00:00:14.241233,tanh,0.0,3,0.8,COMPLETE
2118,2118,0.4130527675151825,2026-03-14 06:48:31.844751,2026-03-14 06:48:45.975104,0 days 00:00:14.130353,tanh,0.0,3,0.5,COMPLETE
2119,2119,0.43039757013320923,2026-03-14 06:48:46.139617,2026-03-14 06:49:00.134822,0 days 00:00:13.995205,tanh,0.0,3,0.5,COMPLETE
2120,2120,0.4482373893260956,2026-03-14 06:49:00.429452,2026-03-14 06:49:14.924473,0 days 00:00:14.495021,tanh,0.0,3,0.5,COMPLETE
2121,2121,0.44827359914779663,2026-03-14 06:49:15.070996,2026-03-14 06:49:29.475641,0 days 00:00:14.404645,tanh,0.30000000000000004,3,0.5,COMPLETE
2122,2122,0.4897257089614868,2026-03-14 06:49:29.617663,2026-03-14 06:49:43.558461,0 days 00:00:13.940798,tanh,0.0,3,0.9,COMPLETE
2123,2123,0.4165984094142914,2026-03-14 06:49:43.872006,2026-03-14 06:49:57.752026,0 days 00:00:13.880020,tanh,0.0,3,0.5,COMPLETE
2124,2124,0.4570072889328003,2026-03-14 06:49:57.896540,2026-03-14 06:50:12.056046,0 days 00:00:14.159506,tanh,0.05,3,0.5,COMPLETE
2125,2125,0.46760880947113037,2026-03-14 06:50:12.193115,2026-03-14 06:50:26.318508,0 days 00:00:14.125393,relu,0.0,3,0.5,COMPLETE
2126,2126,0.43799203634262085,2026-03-14 06:50:26.458537,2026-03-14 06:50:40.464394,0 days 00:00:14.005857,tanh,0.0,3,0.5,COMPLETE
2127,2127,0.46940797567367554,2026-03-14 06:50:40.607944,2026-03-14 06:50:54.603919,0 days 00:00:13.995975,tanh,0.0,3,0.5,COMPLETE
2128,2128,0.41243433952331543,2026-03-14 06:50:54.737998,2026-03-14 06:51:09.260667,0 days 00:00:14.522669,tanh,0.0,4,0.5,COMPLETE
2129,2129,0.4133276641368866,2026-03-14 06:51:09.427691,2026-03-14 06:51:23.537055,0 days 00:00:14.109364,tanh,0.0,3,0.5,COMPLETE
2130,2130,0.44859591126441956,2026-03-14 06:51:23.676573,2026-03-14 06:51:37.586021,0 days 00:00:13.909448,tanh,0.0,3,0.5,COMPLETE
2131,2131,0.4515986740589142,2026-03-14 06:51:37.728052,2026-03-14 06:51:51.900510,0 days 00:00:14.172458,tanh,0.0,3,0.5,COMPLETE
2132,2132,0.4782367944717407,2026-03-14 06:51:52.086442,2026-03-14 06:52:06.428623,0 days 00:00:14.342181,tanh,0.05,3,0.5,COMPLETE
2133,2133,0.6424661874771118,2026-03-14 06:52:06.553744,2026-03-14 06:52:20.640178,0 days 00:00:14.086434,sigmoid,0.0,3,0.5,COMPLETE
2134,2134,0.4345700442790985,2026-03-14 06:52:20.783726,2026-03-14 06:52:34.863458,0 days 00:00:14.079732,tanh,0.45,3,0.5,COMPLETE
2135,2135,0.4548088610172272,2026-03-14 06:52:35.011972,2026-03-14 06:52:48.778221,0 days 00:00:13.766249,tanh,0.0,3,0.5,COMPLETE
2136,2136,0.41919368505477905,2026-03-14 06:52:48.910738,2026-03-14 06:53:02.933123,0 days 00:00:14.022385,tanh,0.0,3,0.5,COMPLETE
2137,2137,0.4314023554325104,2026-03-14 06:53:03.075853,2026-03-14 06:53:17.379378,0 days 00:00:14.303525,tanh,0.0,3,0.5,COMPLETE
2138,2138,0.5066993236541748,2026-03-14 06:53:17.525897,2026-03-14 06:53:31.372267,0 days 00:00:13.846370,tanh,0.0,3,0.8,COMPLETE
2139,2139,0.43400838971138,2026-03-14 06:53:31.505389,2026-03-14 06:53:45.284213,0 days 00:00:13.778824,tanh,0.0,3,0.5,COMPLETE
2140,2140,0.5136955380439758,2026-03-14 06:53:45.422737,2026-03-14 06:53:59.564547,0 days 00:00:14.141810,tanh,0.0,2,0.5,COMPLETE
2141,2141,0.49558204412460327,2026-03-14 06:53:59.701579,2026-03-14 06:54:14.178373,0 days 00:00:14.476794,tanh,0.05,3,0.5,COMPLETE
2142,2142,0.40769118070602417,2026-03-14 06:54:14.325193,2026-03-14 06:54:28.424861,0 days 00:00:14.099668,tanh,0.0,3,0.5,COMPLETE
2143,2143,0.45509713888168335,2026-03-14 06:54:28.556929,2026-03-14 06:54:42.732294,0 days 00:00:14.175365,tanh,0.0,3,0.5,COMPLETE
2144,2144,0.49799099564552307,2026-03-14 06:54:42.877816,2026-03-14 06:54:57.150978,0 days 00:00:14.273162,tanh,0.0,3,0.5,COMPLETE
2145,2145,0.4272462725639343,2026-03-14 06:54:57.274074,2026-03-14 06:55:11.498641,0 days 00:00:14.224567,tanh,0.0,3,0.5,COMPLETE
2146,2146,0.45056650042533875,2026-03-14 06:55:11.646716,2026-03-14 06:55:26.226760,0 days 00:00:14.580044,tanh,0.05,3,0.5,COMPLETE
2147,2147,0.4795278310775757,2026-03-14 06:55:26.370791,2026-03-14 06:55:40.443319,0 days 00:00:14.072528,relu,0.0,3,0.5,COMPLETE
2148,2148,0.5194412469863892,2026-03-14 06:55:40.598359,2026-03-14 06:55:54.621230,0 days 00:00:14.022871,tanh,0.0,3,0.5,COMPLETE
2149,2149,0.41371801495552063,2026-03-14 06:55:54.953227,2026-03-14 06:56:08.914353,0 days 00:00:13.961126,tanh,0.0,3,0.5,COMPLETE
2150,2150,0.6466001868247986,2026-03-14 06:56:09.087899,2026-03-14 06:56:23.102894,0 days 00:00:14.014995,tanh,0.0,6,0.5,COMPLETE
2151,2151,0.44687339663505554,2026-03-14 06:56:23.248916,2026-03-14 06:56:37.511837,0 days 00:00:14.262921,tanh,0.0,4,0.5,COMPLETE
