,number,value,datetime_start,datetime_complete,duration,params_activation,params_dropout,params_layers,params_shrink,state
833,833,0.460138738155365,2026-03-14 01:47:45.411619,2026-03-14 01:47:58.869760,0 days 00:00:13.458141,tanh,0.0,3,0.6,COMPLETE
834,834,0.5510772466659546,2026-03-14 01:47:59.014277,2026-03-14 01:48:12.553271,0 days 00:00:13.538994,tanh,0.0,3,0.65,COMPLETE
835,835,0.4577661454677582,2026-03-14 01:48:12.702450,2026-03-14 01:48:26.502117,0 days 00:00:13.799667,tanh,0.0,3,0.75,COMPLETE
836,836,0.42302125692367554,2026-03-14 01:48:26.693158,2026-03-14 01:48:40.107491,0 days 00:00:13.414333,tanh,0.0,3,0.65,COMPLETE
837,837,0.45700913667678833,2026-03-14 01:48:40.256791,2026-03-14 01:48:53.818495,0 days 00:00:13.561704,tanh,0.0,3,0.6,COMPLETE
838,838,0.4649697244167328,2026-03-14 01:48:53.980075,2026-03-14 01:49:07.567392,0 days 00:00:13.587317,tanh,0.0,3,0.65,COMPLETE
839,839,0.4397473633289337,2026-03-14 01:49:07.711917,2026-03-14 01:49:21.471044,0 days 00:00:13.759127,tanh,0.25,3,0.55,COMPLETE
840,840,0.47524502873420715,2026-03-14 01:49:21.641045,2026-03-14 01:49:35.158290,0 days 00:00:13.517245,tanh,0.0,3,0.6,COMPLETE
841,841,0.6686055064201355,2026-03-14 01:49:35.334820,2026-03-14 01:49:49.676024,0 days 00:00:14.341204,relu,0.05,5,0.65,COMPLETE
842,842,0.4632002115249634,2026-03-14 01:49:49.842050,2026-03-14 01:50:03.240627,0 days 00:00:13.398577,tanh,0.0,3,0.65,COMPLETE
843,843,0.4656561315059662,2026-03-14 01:50:03.382144,2026-03-14 01:50:16.832641,0 days 00:00:13.450497,tanh,0.0,3,0.7,COMPLETE
844,844,0.43035826086997986,2026-03-14 01:50:16.974155,2026-03-14 01:50:30.635921,0 days 00:00:13.661766,tanh,0.0,3,0.65,COMPLETE
845,845,0.6422320008277893,2026-03-14 01:50:30.783050,2026-03-14 01:50:44.816531,0 days 00:00:14.033481,tanh,0.0,6,0.6,COMPLETE
846,846,0.4774658977985382,2026-03-14 01:50:44.967050,2026-03-14 01:50:58.442548,0 days 00:00:13.475498,tanh,0.0,3,0.65,COMPLETE
847,847,0.4517255425453186,2026-03-14 01:50:58.585093,2026-03-14 01:51:12.163637,0 days 00:00:13.578544,tanh,0.0,3,0.6,COMPLETE
848,848,0.44272711873054504,2026-03-14 01:51:12.311180,2026-03-14 01:51:26.308759,0 days 00:00:13.997579,tanh,0.05,3,0.55,COMPLETE
849,849,0.4749630093574524,2026-03-14 01:51:26.474816,2026-03-14 01:51:40.068421,0 days 00:00:13.593605,tanh,0.0,3,0.65,COMPLETE
850,850,0.6455345749855042,2026-03-14 01:51:40.244004,2026-03-14 01:51:53.623555,0 days 00:00:13.379551,sigmoid,0.0,2,0.65,COMPLETE
851,851,0.43685007095336914,2026-03-14 01:51:53.797588,2026-03-14 01:52:07.385328,0 days 00:00:13.587740,tanh,0.0,3,0.6,COMPLETE
852,852,0.471669465303421,2026-03-14 01:52:07.564408,2026-03-14 01:52:21.173704,0 days 00:00:13.609296,tanh,0.0,3,0.7,COMPLETE
853,853,0.45109236240386963,2026-03-14 01:52:21.317220,2026-03-14 01:52:35.023363,0 days 00:00:13.706143,tanh,0.0,3,0.65,COMPLETE
854,854,0.4406699240207672,2026-03-14 01:52:35.312122,2026-03-14 01:52:48.998388,0 days 00:00:13.686266,tanh,0.0,3,0.6,COMPLETE
855,855,0.5324506163597107,2026-03-14 01:52:49.151909,2026-03-14 01:53:02.744432,0 days 00:00:13.592523,tanh,0.0,3,0.65,COMPLETE
856,856,0.4396098852157593,2026-03-14 01:53:02.906936,2026-03-14 01:53:16.456688,0 days 00:00:13.549752,tanh,0.0,4,0.6,COMPLETE
857,857,0.4663121700286865,2026-03-14 01:53:16.631726,2026-03-14 01:53:30.422098,0 days 00:00:13.790372,tanh,0.0,3,0.65,COMPLETE
858,858,0.4561596214771271,2026-03-14 01:53:30.594156,2026-03-14 01:53:44.520014,0 days 00:00:13.925858,tanh,0.05,3,0.6,COMPLETE
859,859,0.4357573986053467,2026-03-14 01:53:44.678175,2026-03-14 01:53:58.100875,0 days 00:00:13.422700,tanh,0.0,3,0.7,COMPLETE
860,860,0.453730046749115,2026-03-14 01:53:58.276528,2026-03-14 01:54:11.916727,0 days 00:00:13.640199,tanh,0.0,3,0.55,COMPLETE
861,861,0.47655874490737915,2026-03-14 01:54:12.055757,2026-03-14 01:54:25.841882,0 days 00:00:13.786125,tanh,0.05,3,0.8,COMPLETE
862,862,0.4265386760234833,2026-03-14 01:54:26.016907,2026-03-14 01:54:39.726622,0 days 00:00:13.709715,tanh,0.0,3,0.65,COMPLETE
863,863,0.4690301716327667,2026-03-14 01:54:39.917648,2026-03-14 01:54:53.432057,0 days 00:00:13.514409,relu,0.0,3,0.65,COMPLETE
864,864,0.43946999311447144,2026-03-14 01:54:53.611213,2026-03-14 01:55:07.364838,0 days 00:00:13.753625,tanh,0.0,3,0.65,COMPLETE
865,865,0.43812552094459534,2026-03-14 01:55:07.511886,2026-03-14 01:55:20.994804,0 days 00:00:13.482918,tanh,0.0,3,0.6,COMPLETE
866,866,0.4861527383327484,2026-03-14 01:55:21.165210,2026-03-14 01:55:35.125296,0 days 00:00:13.960086,tanh,0.0,3,0.75,COMPLETE
867,867,0.4452255666255951,2026-03-14 01:55:35.292367,2026-03-14 01:55:48.912485,0 days 00:00:13.620118,tanh,0.0,3,0.65,COMPLETE
868,868,0.4750455915927887,2026-03-14 01:55:49.085761,2026-03-14 01:56:02.635982,0 days 00:00:13.550221,tanh,0.0,3,0.6,COMPLETE
869,869,0.444189190864563,2026-03-14 01:56:02.793504,2026-03-14 01:56:16.527018,0 days 00:00:13.733514,tanh,0.0,4,0.55,COMPLETE
870,870,0.43797507882118225,2026-03-14 01:56:16.688532,2026-03-14 01:56:30.451375,0 days 00:00:13.762843,tanh,0.05,3,0.65,COMPLETE
871,871,0.41507479548454285,2026-03-14 01:56:30.622906,2026-03-14 01:56:44.360392,0 days 00:00:13.737486,tanh,0.0,3,0.7,COMPLETE
872,872,0.641889750957489,2026-03-14 01:56:44.614812,2026-03-14 01:56:58.653778,0 days 00:00:14.038966,tanh,0.0,7,0.7,COMPLETE
873,873,0.6420427560806274,2026-03-14 01:56:58.796289,2026-03-14 01:57:12.439356,0 days 00:00:13.643067,sigmoid,0.0,3,0.7,COMPLETE
874,874,0.4875485599040985,2026-03-14 01:57:12.576495,2026-03-14 01:57:25.924611,0 days 00:00:13.348116,tanh,0.0,3,0.7,COMPLETE
875,875,0.5143343210220337,2026-03-14 01:57:26.118164,2026-03-14 01:57:39.790313,0 days 00:00:13.672149,tanh,0.0,3,0.7,COMPLETE
876,876,0.42122209072113037,2026-03-14 01:57:39.964841,2026-03-14 01:57:53.561844,0 days 00:00:13.597003,tanh,0.0,3,0.7,COMPLETE
877,877,0.453869104385376,2026-03-14 01:57:53.739869,2026-03-14 01:58:07.281437,0 days 00:00:13.541568,tanh,0.0,3,0.7,COMPLETE
878,878,0.4674908220767975,2026-03-14 01:58:07.440224,2026-03-14 01:58:21.294927,0 days 00:00:13.854703,tanh,0.0,3,0.7,COMPLETE
879,879,0.47996237874031067,2026-03-14 01:58:21.478119,2026-03-14 01:58:35.009024,0 days 00:00:13.530905,tanh,0.0,3,0.7,COMPLETE
880,880,0.44847017526626587,2026-03-14 01:58:35.181421,2026-03-14 01:58:49.229667,0 days 00:00:14.048246,tanh,0.05,3,0.7,COMPLETE
881,881,0.430351197719574,2026-03-14 01:58:49.373186,2026-03-14 01:59:02.935127,0 days 00:00:13.561941,tanh,0.0,3,0.7,COMPLETE
882,882,0.45712119340896606,2026-03-14 01:59:03.110643,2026-03-14 01:59:16.551546,0 days 00:00:13.440903,tanh,0.0,3,0.7,COMPLETE
883,883,0.4616823196411133,2026-03-14 01:59:16.703557,2026-03-14 01:59:30.452324,0 days 00:00:13.748767,tanh,0.0,3,0.75,COMPLETE
884,884,0.4968016743659973,2026-03-14 01:59:30.620860,2026-03-14 01:59:44.201776,0 days 00:00:13.580916,tanh,0.0,3,0.7,COMPLETE
885,885,0.4612268805503845,2026-03-14 01:59:44.373836,2026-03-14 01:59:57.948525,0 days 00:00:13.574689,tanh,0.0,3,0.7,COMPLETE
886,886,0.44079795479774475,2026-03-14 01:59:58.093562,2026-03-14 02:00:11.552914,0 days 00:00:13.459352,tanh,0.0,3,0.75,COMPLETE
887,887,0.4881453216075897,2026-03-14 02:00:11.731943,2026-03-14 02:00:25.284767,0 days 00:00:13.552824,relu,0.0,3,0.6,COMPLETE
888,888,0.4488772749900818,2026-03-14 02:00:25.453320,2026-03-14 02:00:39.253287,0 days 00:00:13.799967,tanh,0.4,3,0.6,COMPLETE
889,889,0.4448765814304352,2026-03-14 02:00:39.453319,2026-03-14 02:00:53.039058,0 days 00:00:13.585739,tanh,0.0,3,0.7,COMPLETE
890,890,0.4162214398384094,2026-03-14 02:00:53.208521,2026-03-14 02:01:06.972239,0 days 00:00:13.763718,tanh,0.05,3,0.6,COMPLETE
891,891,0.5119506120681763,2026-03-14 02:01:07.135916,2026-03-14 02:01:20.897764,0 days 00:00:13.761848,tanh,0.05,3,0.55,COMPLETE
892,892,0.4309656023979187,2026-03-14 02:01:21.057805,2026-03-14 02:01:34.865643,0 days 00:00:13.807838,tanh,0.05,3,0.75,COMPLETE
893,893,0.45787379145622253,2026-03-14 02:01:35.044190,2026-03-14 02:01:48.853238,0 days 00:00:13.809048,tanh,0.05,3,0.6,COMPLETE
894,894,0.44814690947532654,2026-03-14 02:01:49.016766,2026-03-14 02:02:03.130194,0 days 00:00:14.113428,tanh,0.15000000000000002,3,0.6,COMPLETE
895,895,0.6439267992973328,2026-03-14 02:02:03.296278,2026-03-14 02:02:16.997356,0 days 00:00:13.701078,sigmoid,0.1,3,0.7,COMPLETE
896,896,0.46461814641952515,2026-03-14 02:02:17.143938,2026-03-14 02:02:30.685543,0 days 00:00:13.541605,tanh,0.1,3,0.6,COMPLETE
897,897,0.4325004518032074,2026-03-14 02:02:30.846077,2026-03-14 02:02:44.628610,0 days 00:00:13.782533,tanh,0.05,3,0.5,COMPLETE
898,898,0.46652957797050476,2026-03-14 02:02:44.769204,2026-03-14 02:02:58.867185,0 days 00:00:14.097981,tanh,0.05,3,0.65,COMPLETE
899,899,0.47799044847488403,2026-03-14 02:02:59.035709,2026-03-14 02:03:12.843066,0 days 00:00:13.807357,tanh,0.05,3,0.55,COMPLETE
900,900,0.49024251103401184,2026-03-14 02:03:12.986096,2026-03-14 02:03:26.500368,0 days 00:00:13.514272,tanh,0.0,3,0.65,COMPLETE
901,901,0.4317075312137604,2026-03-14 02:03:26.670379,2026-03-14 02:03:40.202359,0 days 00:00:13.531980,tanh,0.0,3,0.6,COMPLETE
902,902,0.46598729491233826,2026-03-14 02:03:40.372418,2026-03-14 02:03:53.788647,0 days 00:00:13.416229,tanh,0.0,3,0.7,COMPLETE
903,903,0.4374955892562866,2026-03-14 02:03:53.975699,2026-03-14 02:04:07.864238,0 days 00:00:13.888539,tanh,0.0,3,0.65,COMPLETE
904,904,0.4889659583568573,2026-03-14 02:04:08.026262,2026-03-14 02:04:21.794058,0 days 00:00:13.767796,tanh,0.0,3,0.6,COMPLETE
905,905,0.4749690890312195,2026-03-14 02:04:21.954082,2026-03-14 02:04:35.893832,0 days 00:00:13.939750,tanh,0.05,3,0.8,COMPLETE
906,906,0.4810637831687927,2026-03-14 02:04:36.066105,2026-03-14 02:04:49.608832,0 days 00:00:13.542727,tanh,0.0,3,0.9,COMPLETE
907,907,0.42841869592666626,2026-03-14 02:04:49.787860,2026-03-14 02:05:03.379436,0 days 00:00:13.591576,tanh,0.0,2,0.75,COMPLETE
908,908,0.4916269779205322,2026-03-14 02:05:03.521954,2026-03-14 02:05:17.024079,0 days 00:00:13.502125,relu,0.0,3,0.65,COMPLETE
909,909,0.45744431018829346,2026-03-14 02:05:17.201771,2026-03-14 02:05:30.720346,0 days 00:00:13.518575,tanh,0.0,3,0.7,COMPLETE
910,910,0.44427958130836487,2026-03-14 02:05:30.869374,2026-03-14 02:05:44.318938,0 days 00:00:13.449564,tanh,0.0,3,0.6,COMPLETE
911,911,0.781792402267456,2026-03-14 02:05:44.498966,2026-03-14 02:05:59.022670,0 days 00:00:14.523704,tanh,0.30000000000000004,6,0.65,COMPLETE
912,912,0.45686662197113037,2026-03-14 02:05:59.386389,2026-03-14 02:06:13.166316,0 days 00:00:13.779927,tanh,0.05,3,0.65,COMPLETE
913,913,0.4708330035209656,2026-03-14 02:06:13.344349,2026-03-14 02:06:26.688206,0 days 00:00:13.343857,tanh,0.0,3,0.55,COMPLETE
914,914,0.47462430596351624,2026-03-14 02:06:26.854231,2026-03-14 02:06:40.411733,0 days 00:00:13.557502,tanh,0.0,3,0.6,COMPLETE
915,915,0.4561663866043091,2026-03-14 02:06:40.619563,2026-03-14 02:06:54.179735,0 days 00:00:13.560172,tanh,0.0,3,0.65,COMPLETE
916,916,0.48222944140434265,2026-03-14 02:06:54.345182,2026-03-14 02:07:08.209908,0 days 00:00:13.864726,tanh,0.0,3,0.65,COMPLETE
917,917,0.6440132260322571,2026-03-14 02:07:08.374522,2026-03-14 02:07:22.088955,0 days 00:00:13.714433,sigmoid,0.2,3,0.7,COMPLETE
918,918,0.45586809515953064,2026-03-14 02:07:22.244086,2026-03-14 02:07:35.747248,0 days 00:00:13.503162,tanh,0.0,3,0.6,COMPLETE
919,919,0.46104007959365845,2026-03-14 02:07:35.916257,2026-03-14 02:07:49.567962,0 days 00:00:13.651705,tanh,0.05,3,0.8500000000000001,COMPLETE
920,920,0.4540596902370453,2026-03-14 02:07:49.732150,2026-03-14 02:08:03.304657,0 days 00:00:13.572507,tanh,0.0,3,0.65,COMPLETE
921,921,0.43309035897254944,2026-03-14 02:08:03.451688,2026-03-14 02:08:16.901052,0 days 00:00:13.449364,tanh,0.0,3,0.6,COMPLETE
922,922,0.4636571407318115,2026-03-14 02:08:17.063355,2026-03-14 02:08:30.748109,0 days 00:00:13.684754,tanh,0.0,3,0.5,COMPLETE
923,923,0.47085684537887573,2026-03-14 02:08:30.921515,2026-03-14 02:08:44.420726,0 days 00:00:13.499211,tanh,0.0,3,0.65,COMPLETE
924,924,0.4675341844558716,2026-03-14 02:08:44.611281,2026-03-14 02:08:58.261483,0 days 00:00:13.650202,tanh,0.0,3,0.55,COMPLETE
925,925,0.4582103192806244,2026-03-14 02:08:58.426504,2026-03-14 02:09:12.215917,0 days 00:00:13.789413,tanh,0.0,3,0.6,COMPLETE
926,926,0.4507720470428467,2026-03-14 02:09:12.384477,2026-03-14 02:09:25.956198,0 days 00:00:13.571721,tanh,0.0,3,0.65,COMPLETE
927,927,0.43066373467445374,2026-03-14 02:09:26.117361,2026-03-14 02:09:39.674769,0 days 00:00:13.557408,tanh,0.0,3,0.8,COMPLETE
928,928,0.44992509484291077,2026-03-14 02:09:39.839801,2026-03-14 02:09:53.303998,0 days 00:00:13.464197,tanh,0.0,3,0.7,COMPLETE
929,929,0.4510028064250946,2026-03-14 02:09:53.470662,2026-03-14 02:10:07.061520,0 days 00:00:13.590858,tanh,0.0,3,0.6,COMPLETE
930,930,0.5034838318824768,2026-03-14 02:10:07.222110,2026-03-14 02:10:20.902844,0 days 00:00:13.680734,relu,0.05,3,0.65,COMPLETE
931,931,0.49338263273239136,2026-03-14 02:10:21.071363,2026-03-14 02:10:34.594823,0 days 00:00:13.523460,tanh,0.0,3,0.65,COMPLETE
932,932,0.4866599440574646,2026-03-14 02:10:34.812058,2026-03-14 02:10:48.235213,0 days 00:00:13.423155,tanh,0.0,2,0.65,COMPLETE
933,933,0.4682370722293854,2026-03-14 02:10:48.391419,2026-03-14 02:11:01.821841,0 days 00:00:13.430422,tanh,0.0,3,0.6,COMPLETE
934,934,0.46201610565185547,2026-03-14 02:11:01.989389,2026-03-14 02:11:15.645623,0 days 00:00:13.656234,tanh,0.0,3,0.7,COMPLETE
935,935,0.4436788260936737,2026-03-14 02:11:15.809645,2026-03-14 02:11:29.389455,0 days 00:00:13.579810,tanh,0.0,3,0.65,COMPLETE
936,936,0.44972458481788635,2026-03-14 02:11:29.535971,2026-03-14 02:11:43.400686,0 days 00:00:13.864715,tanh,0.1,3,0.55,COMPLETE
937,937,0.45433905720710754,2026-03-14 02:11:43.575210,2026-03-14 02:11:57.335009,0 days 00:00:13.759799,tanh,0.05,3,0.65,COMPLETE
938,938,0.451031893491745,2026-03-14 02:11:57.491536,2026-03-14 02:12:11.144413,0 days 00:00:13.652877,tanh,0.0,3,0.6,COMPLETE
939,939,0.6430505514144897,2026-03-14 02:12:11.305513,2026-03-14 02:12:24.935560,0 days 00:00:13.630047,sigmoid,0.0,3,0.6,COMPLETE
940,940,0.47189754247665405,2026-03-14 02:12:25.098088,2026-03-14 02:12:38.607807,0 days 00:00:13.509719,tanh,0.0,3,0.65,COMPLETE
941,941,0.436700701713562,2026-03-14 02:12:38.806021,2026-03-14 02:12:52.313567,0 days 00:00:13.507546,tanh,0.0,3,0.65,COMPLETE
942,942,0.4469687044620514,2026-03-14 02:12:52.478085,2026-03-14 02:13:05.892334,0 days 00:00:13.414249,tanh,0.0,3,0.7,COMPLETE
943,943,0.40749844908714294,2026-03-14 02:13:06.055553,2026-03-14 02:13:19.688158,0 days 00:00:13.632605,tanh,0.0,3,0.6,COMPLETE
944,944,0.4824449419975281,2026-03-14 02:13:19.857224,2026-03-14 02:13:33.243616,0 days 00:00:13.386392,tanh,0.0,3,0.6,COMPLETE
945,945,0.528190016746521,2026-03-14 02:13:33.397129,2026-03-14 02:13:46.776595,0 days 00:00:13.379466,tanh,0.05,3,0.6,COMPLETE
946,946,0.4948253929615021,2026-03-14 02:13:46.941128,2026-03-14 02:14:00.502954,0 days 00:00:13.561826,tanh,0.0,3,0.6,COMPLETE
947,947,0.49172142148017883,2026-03-14 02:14:00.642485,2026-03-14 02:14:14.334951,0 days 00:00:13.692466,tanh,0.0,3,0.6,COMPLETE
948,948,0.42931535840034485,2026-03-14 02:14:14.496979,2026-03-14 02:14:28.152107,0 days 00:00:13.655128,tanh,0.0,3,0.6,COMPLETE
949,949,0.4548068642616272,2026-03-14 02:14:28.327436,2026-03-14 02:14:41.836725,0 days 00:00:13.509289,tanh,0.0,3,0.6,COMPLETE
950,950,0.47949448227882385,2026-03-14 02:14:42.018764,2026-03-14 02:14:55.580988,0 days 00:00:13.562224,tanh,0.0,3,0.6,COMPLETE
951,951,0.45650365948677063,2026-03-14 02:14:55.745015,2026-03-14 02:15:09.547917,0 days 00:00:13.802902,tanh,0.05,3,0.6,COMPLETE
952,952,0.5151886343955994,2026-03-14 02:15:09.713343,2026-03-14 02:15:23.433293,0 days 00:00:13.719950,relu,0.0,3,0.55,COMPLETE
953,953,0.472859650850296,2026-03-14 02:15:23.598793,2026-03-14 02:15:37.108310,0 days 00:00:13.509517,tanh,0.0,3,0.6,COMPLETE
954,954,0.4831879436969757,2026-03-14 02:15:37.291006,2026-03-14 02:15:50.835660,0 days 00:00:13.544654,tanh,0.0,3,0.6,COMPLETE
955,955,0.4367280900478363,2026-03-14 02:15:51.005185,2026-03-14 02:16:04.676404,0 days 00:00:13.671219,tanh,0.0,3,0.6,COMPLETE
956,956,0.4620819687843323,2026-03-14 02:16:04.837074,2026-03-14 02:16:18.467499,0 days 00:00:13.630425,tanh,0.0,3,0.55,COMPLETE
957,957,0.44830331206321716,2026-03-14 02:16:18.607016,2026-03-14 02:16:31.870051,0 days 00:00:13.263035,tanh,0.0,3,0.6,COMPLETE
958,958,0.6467693448066711,2026-03-14 02:16:32.029592,2026-03-14 02:16:46.418088,0 days 00:00:14.388496,tanh,0.05,7,0.75,COMPLETE
959,959,0.4444595277309418,2026-03-14 02:16:46.559284,2026-03-14 02:17:00.085991,0 days 00:00:13.526707,tanh,0.0,3,0.6,COMPLETE
960,960,0.47183722257614136,2026-03-14 02:17:00.247611,2026-03-14 02:17:13.599742,0 days 00:00:13.352131,tanh,0.0,3,0.6,COMPLETE
961,961,0.4820895493030548,2026-03-14 02:17:13.988805,2026-03-14 02:17:27.516398,0 days 00:00:13.527593,tanh,0.0,3,0.55,COMPLETE
962,962,0.4192163944244385,2026-03-14 02:17:27.668517,2026-03-14 02:17:41.150537,0 days 00:00:13.482020,tanh,0.0,3,0.5,COMPLETE
963,963,0.467379629611969,2026-03-14 02:17:41.317590,2026-03-14 02:17:54.901308,0 days 00:00:13.583718,tanh,0.0,3,0.5,COMPLETE
964,964,0.6438542008399963,2026-03-14 02:17:55.070826,2026-03-14 02:18:08.668253,0 days 00:00:13.597427,sigmoid,0.0,3,0.5,COMPLETE
965,965,0.4740031063556671,2026-03-14 02:18:08.840426,2026-03-14 02:18:22.610927,0 days 00:00:13.770501,tanh,0.0,2,0.5,COMPLETE
966,966,0.47781503200531006,2026-03-14 02:18:22.770107,2026-03-14 02:18:36.536195,0 days 00:00:13.766088,tanh,0.05,3,0.5,COMPLETE
967,967,0.47496354579925537,2026-03-14 02:18:36.707747,2026-03-14 02:18:50.239897,0 days 00:00:13.532150,tanh,0.0,3,0.5,COMPLETE
968,968,0.44301918148994446,2026-03-14 02:18:50.397959,2026-03-14 02:19:03.798828,0 days 00:00:13.400869,tanh,0.0,3,0.5,COMPLETE
969,969,0.48812103271484375,2026-03-14 02:19:03.944855,2026-03-14 02:19:17.277126,0 days 00:00:13.332271,tanh,0.0,3,0.55,COMPLETE
970,970,0.7054331302642822,2026-03-14 02:19:17.437380,2026-03-14 02:19:31.928317,0 days 00:00:14.490937,tanh,0.0,8,0.5,COMPLETE
971,971,0.48665204644203186,2026-03-14 02:19:32.070894,2026-03-14 02:19:45.706023,0 days 00:00:13.635129,tanh,0.0,3,0.6,COMPLETE
972,972,0.49454987049102783,2026-03-14 02:19:45.871552,2026-03-14 02:19:59.317006,0 days 00:00:13.445454,tanh,0.0,3,0.5,COMPLETE
973,973,0.4843744933605194,2026-03-14 02:19:59.481573,2026-03-14 02:20:13.221492,0 days 00:00:13.739919,tanh,0.05,3,0.5,COMPLETE
974,974,0.4839593470096588,2026-03-14 02:20:13.381523,2026-03-14 02:20:27.510914,0 days 00:00:14.129391,tanh,0.15000000000000002,3,0.5,COMPLETE
975,975,0.49434322118759155,2026-03-14 02:20:27.689950,2026-03-14 02:20:41.137882,0 days 00:00:13.447932,tanh,0.0,3,0.5,COMPLETE
976,976,0.49638205766677856,2026-03-14 02:20:41.309476,2026-03-14 02:20:54.770679,0 days 00:00:13.461203,tanh,0.0,3,0.5,COMPLETE
977,977,0.44321319460868835,2026-03-14 02:20:54.932205,2026-03-14 02:21:08.574933,0 days 00:00:13.642728,tanh,0.0,3,0.5,COMPLETE
978,978,0.47781193256378174,2026-03-14 02:21:08.736470,2026-03-14 02:21:22.187204,0 days 00:00:13.450734,relu,0.0,3,0.5,COMPLETE
979,979,0.43048760294914246,2026-03-14 02:21:22.354130,2026-03-14 02:21:36.054035,0 days 00:00:13.699905,tanh,0.0,3,0.5,COMPLETE
980,980,0.6368854641914368,2026-03-14 02:21:36.274743,2026-03-14 02:21:49.947985,0 days 00:00:13.673242,tanh,0.25,3,0.5,COMPLETE
981,981,0.4531511962413788,2026-03-14 02:21:50.114094,2026-03-14 02:22:03.623094,0 days 00:00:13.509000,tanh,0.05,3,0.5,COMPLETE
982,982,0.4382753372192383,2026-03-14 02:22:03.833131,2026-03-14 02:22:17.221806,0 days 00:00:13.388675,tanh,0.0,3,0.55,COMPLETE
983,983,0.48611530661582947,2026-03-14 02:22:17.498047,2026-03-14 02:22:31.127734,0 days 00:00:13.629687,tanh,0.0,2,0.6,COMPLETE
984,984,0.469445139169693,2026-03-14 02:22:31.297005,2026-03-14 02:22:44.798986,0 days 00:00:13.501981,tanh,0.0,3,0.6,COMPLETE
985,985,0.6423303484916687,2026-03-14 02:22:44.962531,2026-03-14 02:22:58.494073,0 days 00:00:13.531542,sigmoid,0.0,3,0.6,COMPLETE
986,986,0.44148433208465576,2026-03-14 02:22:58.641600,2026-03-14 02:23:12.089572,0 days 00:00:13.447972,tanh,0.0,3,0.55,COMPLETE
987,987,0.44241228699684143,2026-03-14 02:23:12.252175,2026-03-14 02:23:25.648674,0 days 00:00:13.396499,tanh,0.0,3,0.6,COMPLETE
988,988,0.48541781306266785,2026-03-14 02:23:25.807717,2026-03-14 02:23:39.463461,0 days 00:00:13.655744,tanh,0.0,3,0.6,COMPLETE
989,989,0.4228074550628662,2026-03-14 02:23:39.627206,2026-03-14 02:23:53.309053,0 days 00:00:13.681847,tanh,0.0,3,0.5,COMPLETE
990,990,0.44612494111061096,2026-03-14 02:23:53.477563,2026-03-14 02:24:07.302657,0 days 00:00:13.825094,tanh,0.1,3,0.6,COMPLETE
991,991,0.46992039680480957,2026-03-14 02:24:07.460302,2026-03-14 02:24:20.972094,0 days 00:00:13.511792,tanh,0.0,3,0.55,COMPLETE
992,992,0.4481019377708435,2026-03-14 02:24:21.118629,2026-03-14 02:24:34.582656,0 days 00:00:13.464027,tanh,0.0,3,0.6,COMPLETE
993,993,0.46719083189964294,2026-03-14 02:24:34.724176,2026-03-14 02:24:48.321828,0 days 00:00:13.597652,tanh,0.05,3,0.5,COMPLETE
994,994,0.4510636329650879,2026-03-14 02:24:48.492962,2026-03-14 02:25:02.205677,0 days 00:00:13.712715,tanh,0.0,3,0.6,COMPLETE
995,995,0.48061805963516235,2026-03-14 02:25:02.349897,2026-03-14 02:25:15.928534,0 days 00:00:13.578637,tanh,0.0,3,0.65,COMPLETE
996,996,0.45569026470184326,2026-03-14 02:25:16.083058,2026-03-14 02:25:29.596698,0 days 00:00:13.513640,tanh,0.0,3,0.8500000000000001,COMPLETE
997,997,0.48276352882385254,2026-03-14 02:25:29.756224,2026-03-14 02:25:43.574469,0 days 00:00:13.818245,relu,0.05,3,0.6,COMPLETE
998,998,0.4678998291492462,2026-03-14 02:25:43.744986,2026-03-14 02:25:57.169025,0 days 00:00:13.424039,tanh,0.0,3,0.65,COMPLETE
999,999,0.4430420398712158,2026-03-14 02:25:57.360052,2026-03-14 02:26:10.775446,0 days 00:00:13.415394,tanh,0.0,3,0.8,COMPLETE
