,number,value,datetime_start,datetime_complete,duration,params_activation,params_dropout,params_layers,params_shrink,state
2317,2317,0.445294052362442,2026-03-14 07:36:03.603332,2026-03-14 07:36:17.842588,0 days 00:00:14.239256,tanh,0.0,3,0.55,COMPLETE
2318,2318,0.488168865442276,2026-03-14 07:36:17.992140,2026-03-14 07:36:32.367128,0 days 00:00:14.374988,tanh,0.35000000000000003,3,0.55,COMPLETE
2319,2319,0.4608585238456726,2026-03-14 07:36:32.524156,2026-03-14 07:36:46.810005,0 days 00:00:14.285849,tanh,0.0,3,0.55,COMPLETE
2320,2320,0.4848434329032898,2026-03-14 07:36:46.970025,2026-03-14 07:37:01.267505,0 days 00:00:14.297480,tanh,0.0,3,0.55,COMPLETE
2321,2321,0.5683295130729675,2026-03-14 07:37:01.421934,2026-03-14 07:37:15.726675,0 days 00:00:14.304741,tanh,0.0,3,0.55,COMPLETE
2322,2322,0.4790870249271393,2026-03-14 07:37:15.890694,2026-03-14 07:37:30.007641,0 days 00:00:14.116947,tanh,0.0,3,0.55,COMPLETE
2323,2323,0.5517213940620422,2026-03-14 07:37:30.157701,2026-03-14 07:37:44.120224,0 days 00:00:13.962523,relu,0.0,3,0.55,COMPLETE
2324,2324,0.425800085067749,2026-03-14 07:37:44.268370,2026-03-14 07:37:58.489775,0 days 00:00:14.221405,tanh,0.0,3,0.55,COMPLETE
2325,2325,0.4771294891834259,2026-03-14 07:37:58.810317,2026-03-14 07:38:12.775205,0 days 00:00:13.964888,tanh,0.05,2,0.55,COMPLETE
2326,2326,0.41710057854652405,2026-03-14 07:38:12.927482,2026-03-14 07:38:27.132571,0 days 00:00:14.205089,tanh,0.0,3,0.55,COMPLETE
2327,2327,0.44178736209869385,2026-03-14 07:38:27.277681,2026-03-14 07:38:41.310863,0 days 00:00:14.033182,tanh,0.0,3,0.55,COMPLETE
2328,2328,0.46397727727890015,2026-03-14 07:38:41.460407,2026-03-14 07:38:55.497363,0 days 00:00:14.036956,tanh,0.0,3,1.0,COMPLETE
2329,2329,0.46861207485198975,2026-03-14 07:38:55.648907,2026-03-14 07:39:09.977257,0 days 00:00:14.328350,tanh,0.0,3,0.55,COMPLETE
2330,2330,0.6571585536003113,2026-03-14 07:39:10.278510,2026-03-14 07:39:25.376914,0 days 00:00:15.098404,tanh,0.05,6,0.55,COMPLETE
2331,2331,0.5125027894973755,2026-03-14 07:39:25.524391,2026-03-14 07:39:39.845330,0 days 00:00:14.320939,tanh,0.0,3,0.55,COMPLETE
2332,2332,0.4374689757823944,2026-03-14 07:39:39.990850,2026-03-14 07:39:54.010772,0 days 00:00:14.019922,tanh,0.0,3,0.55,COMPLETE
2333,2333,0.4644870460033417,2026-03-14 07:39:54.154323,2026-03-14 07:40:08.368061,0 days 00:00:14.213738,tanh,0.0,3,0.55,COMPLETE
2334,2334,0.6440160870552063,2026-03-14 07:40:08.520576,2026-03-14 07:40:22.909953,0 days 00:00:14.389377,sigmoid,0.0,3,0.55,COMPLETE
2335,2335,0.4314456582069397,2026-03-14 07:40:23.055572,2026-03-14 07:40:37.208801,0 days 00:00:14.153229,tanh,0.0,3,0.55,COMPLETE
2336,2336,0.447891503572464,2026-03-14 07:40:37.351334,2026-03-14 07:40:51.936267,0 days 00:00:14.584933,tanh,0.05,4,0.55,COMPLETE
2337,2337,0.4242410659790039,2026-03-14 07:40:52.089296,2026-03-14 07:41:06.349959,0 days 00:00:14.260663,tanh,0.0,3,0.55,COMPLETE
2338,2338,0.4414517879486084,2026-03-14 07:41:06.499082,2026-03-14 07:41:20.771324,0 days 00:00:14.272242,tanh,0.0,3,0.55,COMPLETE
2339,2339,0.43276330828666687,2026-03-14 07:41:20.921390,2026-03-14 07:41:35.602404,0 days 00:00:14.681014,tanh,0.0,5,0.55,COMPLETE
2340,2340,0.4136478304862976,2026-03-14 07:41:35.932938,2026-03-14 07:41:50.018650,0 days 00:00:14.085712,tanh,0.0,3,0.55,COMPLETE
2341,2341,0.4415948688983917,2026-03-14 07:41:50.181798,2026-03-14 07:42:04.476734,0 days 00:00:14.294936,tanh,0.0,3,0.55,COMPLETE
2342,2342,0.44435155391693115,2026-03-14 07:42:04.649275,2026-03-14 07:42:18.930508,0 days 00:00:14.281233,tanh,0.0,3,0.55,COMPLETE
2343,2343,0.4304715394973755,2026-03-14 07:42:19.092649,2026-03-14 07:42:33.419387,0 days 00:00:14.326738,tanh,0.0,3,0.55,COMPLETE
2344,2344,0.461727499961853,2026-03-14 07:42:33.598105,2026-03-14 07:42:48.041398,0 days 00:00:14.443293,tanh,0.05,3,0.55,COMPLETE
2345,2345,0.4669944643974304,2026-03-14 07:42:48.396020,2026-03-14 07:43:02.405398,0 days 00:00:14.009378,relu,0.0,3,0.55,COMPLETE
2346,2346,0.466181218624115,2026-03-14 07:43:02.562437,2026-03-14 07:43:16.801138,0 days 00:00:14.238701,tanh,0.0,3,1.0,COMPLETE
2347,2347,0.45186758041381836,2026-03-14 07:43:16.971169,2026-03-14 07:43:31.118889,0 days 00:00:14.147720,tanh,0.0,3,0.55,COMPLETE
2348,2348,0.43273288011550903,2026-03-14 07:43:31.272010,2026-03-14 07:43:45.391549,0 days 00:00:14.119539,tanh,0.0,3,0.55,COMPLETE
2349,2349,0.47062259912490845,2026-03-14 07:43:45.547916,2026-03-14 07:43:59.723772,0 days 00:00:14.175856,tanh,0.0,3,0.55,COMPLETE
2350,2350,0.43953022360801697,2026-03-14 07:43:59.883810,2026-03-14 07:44:13.823026,0 days 00:00:13.939216,tanh,0.0,3,0.8,COMPLETE
2351,2351,0.44021910429000854,2026-03-14 07:44:14.004581,2026-03-14 07:44:28.060238,0 days 00:00:14.055657,tanh,0.0,3,0.55,COMPLETE
2352,2352,0.4350169599056244,2026-03-14 07:44:28.215332,2026-03-14 07:44:42.499114,0 days 00:00:14.283782,tanh,0.0,3,0.55,COMPLETE
2353,2353,0.47153010964393616,2026-03-14 07:44:42.672631,2026-03-14 07:44:56.578784,0 days 00:00:13.906153,tanh,0.05,2,0.9,COMPLETE
2354,2354,0.6418150067329407,2026-03-14 07:44:56.748806,2026-03-14 07:45:10.948991,0 days 00:00:14.200185,sigmoid,0.0,3,0.55,COMPLETE
2355,2355,0.5197762250900269,2026-03-14 07:45:11.101062,2026-03-14 07:45:25.142138,0 days 00:00:14.041076,tanh,0.0,3,0.8500000000000001,COMPLETE
2356,2356,0.5563092231750488,2026-03-14 07:45:25.303730,2026-03-14 07:45:39.303950,0 days 00:00:14.000220,tanh,0.0,3,0.55,COMPLETE
2357,2357,0.5489891171455383,2026-03-14 07:45:39.464495,2026-03-14 07:45:53.721675,0 days 00:00:14.257180,tanh,0.0,3,0.55,COMPLETE
2358,2358,0.4939786493778229,2026-03-14 07:45:53.891703,2026-03-14 07:46:08.059814,0 days 00:00:14.168111,tanh,0.0,3,0.55,COMPLETE
2359,2359,0.4922288656234741,2026-03-14 07:46:08.229158,2026-03-14 07:46:22.579951,0 days 00:00:14.350793,tanh,0.05,3,0.55,COMPLETE
2360,2360,0.8024625182151794,2026-03-14 07:46:22.732498,2026-03-14 07:46:37.059796,0 days 00:00:14.327298,tanh,0.0,4,0.8,COMPLETE
2361,2361,0.4846842288970947,2026-03-14 07:46:37.228367,2026-03-14 07:46:51.211154,0 days 00:00:13.982787,tanh,0.0,3,0.55,COMPLETE
2362,2362,0.4178086817264557,2026-03-14 07:46:51.383188,2026-03-14 07:47:05.714317,0 days 00:00:14.331129,tanh,0.0,3,0.5,COMPLETE
2363,2363,0.5336543321609497,2026-03-14 07:47:05.875057,2026-03-14 07:47:20.133570,0 days 00:00:14.258513,tanh,0.0,3,0.5,COMPLETE
2364,2364,0.4177863299846649,2026-03-14 07:47:20.284673,2026-03-14 07:47:34.438939,0 days 00:00:14.154266,tanh,0.0,3,0.5,COMPLETE
2365,2365,0.4759122431278229,2026-03-14 07:47:34.618004,2026-03-14 07:47:48.972261,0 days 00:00:14.354257,tanh,0.0,3,0.55,COMPLETE
2366,2366,0.4988526403903961,2026-03-14 07:47:49.127799,2026-03-14 07:48:03.301335,0 days 00:00:14.173536,relu,0.0,3,0.5,COMPLETE
2367,2367,0.4749757647514343,2026-03-14 07:48:03.463880,2026-03-14 07:48:17.748476,0 days 00:00:14.284596,tanh,0.0,3,0.5,COMPLETE
2368,2368,0.4824104905128479,2026-03-14 07:48:17.968505,2026-03-14 07:48:32.340249,0 days 00:00:14.371744,tanh,0.05,3,0.55,COMPLETE
2369,2369,0.4340171813964844,2026-03-14 07:48:32.500767,2026-03-14 07:48:46.828883,0 days 00:00:14.328116,tanh,0.0,3,0.5,COMPLETE
2370,2370,0.45689043402671814,2026-03-14 07:48:47.162985,2026-03-14 07:49:01.276790,0 days 00:00:14.113805,tanh,0.0,3,0.5,COMPLETE
2371,2371,0.47004684805870056,2026-03-14 07:49:01.441305,2026-03-14 07:49:15.739197,0 days 00:00:14.297892,tanh,0.0,3,0.5,COMPLETE
2372,2372,0.44127896428108215,2026-03-14 07:49:15.894222,2026-03-14 07:49:30.398358,0 days 00:00:14.504136,tanh,0.0,3,0.55,COMPLETE
2373,2373,0.4647795855998993,2026-03-14 07:49:30.544877,2026-03-14 07:49:44.599471,0 days 00:00:14.054594,tanh,0.0,2,0.5,COMPLETE
2374,2374,0.4806921184062958,2026-03-14 07:49:44.763507,2026-03-14 07:49:59.043179,0 days 00:00:14.279672,tanh,0.05,3,0.5,COMPLETE
2375,2375,0.6486895084381104,2026-03-14 07:49:59.416273,2026-03-14 07:50:13.818124,0 days 00:00:14.401851,sigmoid,0.25,3,0.5,COMPLETE
2376,2376,0.504490852355957,2026-03-14 07:50:13.973647,2026-03-14 07:50:28.132042,0 days 00:00:14.158395,tanh,0.0,3,0.55,COMPLETE
2377,2377,0.43912336230278015,2026-03-14 07:50:28.296154,2026-03-14 07:50:42.441443,0 days 00:00:14.145289,tanh,0.0,3,0.5,COMPLETE
2378,2378,0.45533159375190735,2026-03-14 07:50:42.608482,2026-03-14 07:50:56.614408,0 days 00:00:14.005926,tanh,0.0,3,0.5,COMPLETE
2379,2379,0.4902191162109375,2026-03-14 07:50:56.771646,2026-03-14 07:51:10.901525,0 days 00:00:14.129879,tanh,0.0,3,0.55,COMPLETE
2380,2380,0.4320790767669678,2026-03-14 07:51:11.041578,2026-03-14 07:51:25.888985,0 days 00:00:14.847407,tanh,0.0,4,0.5,COMPLETE
2381,2381,0.45777368545532227,2026-03-14 07:51:26.061104,2026-03-14 07:51:40.120086,0 days 00:00:14.058982,tanh,0.0,3,0.55,COMPLETE
2382,2382,0.4480990171432495,2026-03-14 07:51:40.273711,2026-03-14 07:51:54.465921,0 days 00:00:14.192210,tanh,0.05,3,0.5,COMPLETE
2383,2383,0.49448660016059875,2026-03-14 07:51:54.621467,2026-03-14 07:52:08.844892,0 days 00:00:14.223425,tanh,0.0,3,0.5,COMPLETE
2384,2384,0.4329725503921509,2026-03-14 07:52:08.982406,2026-03-14 07:52:23.137025,0 days 00:00:14.154619,tanh,0.0,3,0.55,COMPLETE
2385,2385,0.645313560962677,2026-03-14 07:52:23.316658,2026-03-14 07:52:37.854859,0 days 00:00:14.538201,tanh,0.0,5,0.5,COMPLETE
2386,2386,0.42653247714042664,2026-03-14 07:52:38.015384,2026-03-14 07:52:52.130942,0 days 00:00:14.115558,tanh,0.0,3,0.8,COMPLETE
2387,2387,0.4510164260864258,2026-03-14 07:52:52.292011,2026-03-14 07:53:06.652325,0 days 00:00:14.360314,tanh,0.0,3,0.5,COMPLETE
2388,2388,0.49435895681381226,2026-03-14 07:53:06.812903,2026-03-14 07:53:21.019998,0 days 00:00:14.207095,relu,0.0,3,0.55,COMPLETE
2389,2389,0.46187663078308105,2026-03-14 07:53:21.184308,2026-03-14 07:53:35.371202,0 days 00:00:14.186894,tanh,0.0,3,0.5,COMPLETE
2390,2390,0.4590180814266205,2026-03-14 07:53:35.551938,2026-03-14 07:53:49.933872,0 days 00:00:14.381934,tanh,0.05,3,0.55,COMPLETE
2391,2391,0.4515511393547058,2026-03-14 07:53:50.086961,2026-03-14 07:54:04.383603,0 days 00:00:14.296642,tanh,0.0,3,0.5,COMPLETE
2392,2392,0.475890576839447,2026-03-14 07:54:04.549640,2026-03-14 07:54:18.636040,0 days 00:00:14.086400,tanh,0.0,3,0.5,COMPLETE
2393,2393,0.4595627188682556,2026-03-14 07:54:18.803737,2026-03-14 07:54:33.142192,0 days 00:00:14.338455,tanh,0.0,3,0.5,COMPLETE
2394,2394,0.432669073343277,2026-03-14 07:54:33.305825,2026-03-14 07:54:47.436372,0 days 00:00:14.130547,tanh,0.0,3,0.55,COMPLETE
2395,2395,0.4550849497318268,2026-03-14 07:54:47.601052,2026-03-14 07:55:01.646155,0 days 00:00:14.045103,tanh,0.0,3,0.5,COMPLETE
2396,2396,0.4813540279865265,2026-03-14 07:55:01.823187,2026-03-14 07:55:16.042066,0 days 00:00:14.218879,tanh,0.05,3,0.5,COMPLETE
2397,2397,0.4443695545196533,2026-03-14 07:55:16.197646,2026-03-14 07:55:30.393123,0 days 00:00:14.195477,tanh,0.0,3,0.5,COMPLETE
2398,2398,0.6456143856048584,2026-03-14 07:55:30.543644,2026-03-14 07:55:44.679313,0 days 00:00:14.135669,sigmoid,0.0,3,0.5,COMPLETE
2399,2399,0.4436614513397217,2026-03-14 07:55:44.842559,2026-03-14 07:55:58.825756,0 days 00:00:13.983197,tanh,0.0,3,0.55,COMPLETE
2400,2400,0.4642622172832489,2026-03-14 07:55:58.988786,2026-03-14 07:56:12.974078,0 days 00:00:13.985292,tanh,0.0,3,0.5,COMPLETE
2401,2401,0.44876083731651306,2026-03-14 07:56:13.132098,2026-03-14 07:56:27.220697,0 days 00:00:14.088599,tanh,0.0,3,0.5,COMPLETE
2402,2402,0.48641765117645264,2026-03-14 07:56:27.376216,2026-03-14 07:56:41.584811,0 days 00:00:14.208595,tanh,0.0,3,0.8500000000000001,COMPLETE
2403,2403,0.4651424288749695,2026-03-14 07:56:41.731470,2026-03-14 07:56:55.859162,0 days 00:00:14.127692,tanh,0.0,3,0.55,COMPLETE
2404,2404,0.47323739528656006,2026-03-14 07:56:56.022200,2026-03-14 07:57:10.162951,0 days 00:00:14.140751,tanh,0.0,3,0.5,COMPLETE
2405,2405,0.5159549713134766,2026-03-14 07:57:10.316537,2026-03-14 07:57:24.727953,0 days 00:00:14.411416,tanh,0.0,3,0.5,COMPLETE
2406,2406,0.46052154898643494,2026-03-14 07:57:24.888048,2026-03-14 07:57:39.380951,0 days 00:00:14.492903,tanh,0.1,4,0.55,COMPLETE
2407,2407,0.4592680037021637,2026-03-14 07:57:39.518530,2026-03-14 07:57:53.596392,0 days 00:00:14.077862,tanh,0.0,2,0.5,COMPLETE
2408,2408,0.4507234990596771,2026-03-14 07:57:53.748418,2026-03-14 07:58:08.287715,0 days 00:00:14.539297,tanh,0.35000000000000003,3,0.5,COMPLETE
2409,2409,0.4350050389766693,2026-03-14 07:58:08.425259,2026-03-14 07:58:22.997360,0 days 00:00:14.572101,tanh,0.30000000000000004,3,0.55,COMPLETE
2410,2410,0.5141428112983704,2026-03-14 07:58:23.160927,2026-03-14 07:58:37.553571,0 days 00:00:14.392644,relu,0.15000000000000002,3,0.8,COMPLETE
2411,2411,0.4750368595123291,2026-03-14 07:58:37.717086,2026-03-14 07:58:52.161133,0 days 00:00:14.444047,tanh,0.05,3,0.5,COMPLETE
2412,2412,0.4027355909347534,2026-03-14 07:58:52.303190,2026-03-14 07:59:06.469555,0 days 00:00:14.166365,tanh,0.0,3,0.5,COMPLETE
2413,2413,0.4659616947174072,2026-03-14 07:59:06.809841,2026-03-14 07:59:20.944541,0 days 00:00:14.134700,tanh,0.0,3,0.5,COMPLETE
2414,2414,0.46821698546409607,2026-03-14 07:59:21.106573,2026-03-14 07:59:35.308969,0 days 00:00:14.202396,tanh,0.0,3,0.5,COMPLETE
2415,2415,0.42288103699684143,2026-03-14 07:59:35.462489,2026-03-14 07:59:49.675148,0 days 00:00:14.212659,tanh,0.0,3,0.5,COMPLETE
2416,2416,0.44004425406455994,2026-03-14 07:59:49.828965,2026-03-14 08:00:04.069781,0 days 00:00:14.240816,tanh,0.0,3,0.5,COMPLETE
2417,2417,0.4563412368297577,2026-03-14 08:00:04.222409,2026-03-14 08:00:18.643308,0 days 00:00:14.420899,tanh,0.05,3,0.5,COMPLETE
2418,2418,0.642960786819458,2026-03-14 08:00:18.796846,2026-03-14 08:00:33.530705,0 days 00:00:14.733859,tanh,0.0,7,0.5,COMPLETE
2419,2419,0.4088670611381531,2026-03-14 08:00:33.683265,2026-03-14 08:00:47.792872,0 days 00:00:14.109607,tanh,0.0,3,0.5,COMPLETE
2420,2420,0.646553635597229,2026-03-14 08:00:47.941558,2026-03-14 08:01:02.066779,0 days 00:00:14.125221,sigmoid,0.0,3,0.5,COMPLETE
2421,2421,0.4358123242855072,2026-03-14 08:01:02.213179,2026-03-14 08:01:16.310517,0 days 00:00:14.097338,tanh,0.0,3,0.5,COMPLETE
2422,2422,0.46465763449668884,2026-03-14 08:01:16.483552,2026-03-14 08:01:30.821896,0 days 00:00:14.338344,tanh,0.0,3,0.5,COMPLETE
2423,2423,0.4495975375175476,2026-03-14 08:01:30.980439,2026-03-14 08:01:45.192862,0 days 00:00:14.212423,tanh,0.0,3,0.5,COMPLETE
2424,2424,0.47311931848526,2026-03-14 08:01:45.355387,2026-03-14 08:01:59.642186,0 days 00:00:14.286799,tanh,0.0,3,0.5,COMPLETE
2425,2425,0.4595758020877838,2026-03-14 08:01:59.784211,2026-03-14 08:02:14.038829,0 days 00:00:14.254618,tanh,0.0,3,0.5,COMPLETE
2426,2426,0.674297571182251,2026-03-14 08:02:14.202553,2026-03-14 08:02:28.760131,0 days 00:00:14.557578,tanh,0.5,4,0.5,COMPLETE
2427,2427,0.44552913308143616,2026-03-14 08:02:28.917161,2026-03-14 08:02:42.886600,0 days 00:00:13.969439,tanh,0.0,3,0.5,COMPLETE
2428,2428,0.47695690393447876,2026-03-14 08:02:43.256058,2026-03-14 08:02:57.289796,0 days 00:00:14.033738,tanh,0.0,3,0.5,COMPLETE
2429,2429,0.445837140083313,2026-03-14 08:02:57.424747,2026-03-14 08:03:11.793910,0 days 00:00:14.369163,tanh,0.0,3,0.5,COMPLETE
2430,2430,0.46335479617118835,2026-03-14 08:03:11.953447,2026-03-14 08:03:26.567171,0 days 00:00:14.613724,tanh,0.05,3,0.5,COMPLETE
2431,2431,0.4306611120700836,2026-03-14 08:03:26.717052,2026-03-14 08:03:40.926038,0 days 00:00:14.208986,tanh,0.0,3,0.5,COMPLETE
2432,2432,0.4649945795536041,2026-03-14 08:03:41.084151,2026-03-14 08:03:55.321375,0 days 00:00:14.237224,tanh,0.0,3,0.5,COMPLETE
2433,2433,0.482589453458786,2026-03-14 08:03:55.641531,2026-03-14 08:04:09.802746,0 days 00:00:14.161215,relu,0.0,3,0.5,COMPLETE
2434,2434,0.48040834069252014,2026-03-14 08:04:09.936291,2026-03-14 08:04:24.362937,0 days 00:00:14.426646,tanh,0.0,3,0.5,COMPLETE
2435,2435,0.48927509784698486,2026-03-14 08:04:24.512463,2026-03-14 08:04:38.936110,0 days 00:00:14.423647,tanh,0.0,3,0.5,COMPLETE
2436,2436,0.45690253376960754,2026-03-14 08:04:39.079834,2026-03-14 08:04:53.510942,0 days 00:00:14.431108,tanh,0.05,3,0.5,COMPLETE
2437,2437,0.4676905870437622,2026-03-14 08:04:53.685977,2026-03-14 08:05:07.649954,0 days 00:00:13.963977,tanh,0.0,2,0.5,COMPLETE
2438,2438,0.4396062195301056,2026-03-14 08:05:07.975011,2026-03-14 08:05:22.160535,0 days 00:00:14.185524,tanh,0.0,3,0.5,COMPLETE
2439,2439,0.46200206875801086,2026-03-14 08:05:22.310165,2026-03-14 08:05:36.486909,0 days 00:00:14.176744,tanh,0.0,3,0.55,COMPLETE
2440,2440,0.4950113296508789,2026-03-14 08:05:36.647435,2026-03-14 08:05:50.679318,0 days 00:00:14.031883,tanh,0.0,3,0.5,COMPLETE
2441,2441,0.4598223865032196,2026-03-14 08:05:50.878853,2026-03-14 08:06:04.976358,0 days 00:00:14.097505,tanh,0.0,3,0.5,COMPLETE
2442,2442,0.6474838852882385,2026-03-14 08:06:05.131005,2026-03-14 08:06:19.666544,0 days 00:00:14.535539,sigmoid,0.05,3,0.55,COMPLETE
2443,2443,0.47647181153297424,2026-03-14 08:06:20.012608,2026-03-14 08:06:34.355804,0 days 00:00:14.343196,tanh,0.0,3,0.5,COMPLETE
2444,2444,0.48217204213142395,2026-03-14 08:06:34.553886,2026-03-14 08:06:48.918542,0 days 00:00:14.364656,tanh,0.0,3,0.5,COMPLETE
2445,2445,0.4461420476436615,2026-03-14 08:06:49.063094,2026-03-14 08:07:03.465694,0 days 00:00:14.402600,tanh,0.0,3,0.5,COMPLETE
2446,2446,0.44234588742256165,2026-03-14 08:07:03.623208,2026-03-14 08:07:17.999899,0 days 00:00:14.376691,tanh,0.0,3,0.55,COMPLETE
2447,2447,0.5095904469490051,2026-03-14 08:07:18.159460,2026-03-14 08:07:32.611603,0 days 00:00:14.452143,tanh,0.0,3,0.5,COMPLETE
2448,2448,0.45808669924736023,2026-03-14 08:07:32.937157,2026-03-14 08:07:47.031860,0 days 00:00:14.094703,tanh,0.0,3,0.5,COMPLETE
2449,2449,0.4355960190296173,2026-03-14 08:07:47.182625,2026-03-14 08:08:01.464270,0 days 00:00:14.281645,tanh,0.0,3,0.55,COMPLETE
2450,2450,0.6462403535842896,2026-03-14 08:08:01.631859,2026-03-14 08:08:16.043819,0 days 00:00:14.411960,tanh,0.0,4,0.5,COMPLETE
2451,2451,0.4669719338417053,2026-03-14 08:08:16.204148,2026-03-14 08:08:30.427577,0 days 00:00:14.223429,tanh,0.0,3,0.5,COMPLETE
2452,2452,0.41971978545188904,2026-03-14 08:08:30.572093,2026-03-14 08:08:44.672799,0 days 00:00:14.100706,tanh,0.0,3,0.55,COMPLETE
2453,2453,0.48567652702331543,2026-03-14 08:08:44.825832,2026-03-14 08:08:59.141246,0 days 00:00:14.315414,tanh,0.45,3,0.5,COMPLETE
2454,2454,0.49052950739860535,2026-03-14 08:08:59.294384,2026-03-14 08:09:13.663704,0 days 00:00:14.369320,tanh,0.05,3,0.5,COMPLETE
2455,2455,0.4857223927974701,2026-03-14 08:09:13.845754,2026-03-14 08:09:27.871873,0 days 00:00:14.026119,relu,0.0,3,0.55,COMPLETE
2456,2456,0.44356411695480347,2026-03-14 08:09:28.015390,2026-03-14 08:09:42.589019,0 days 00:00:14.573629,tanh,0.0,5,0.5,COMPLETE
2457,2457,0.4783115088939667,2026-03-14 08:09:42.739076,2026-03-14 08:09:57.088847,0 days 00:00:14.349771,tanh,0.0,3,0.5,COMPLETE
2458,2458,0.45024898648262024,2026-03-14 08:09:57.236460,2026-03-14 08:10:11.197271,0 days 00:00:13.960811,tanh,0.0,2,0.5,COMPLETE
2459,2459,0.430099219083786,2026-03-14 08:10:11.351813,2026-03-14 08:10:25.409696,0 days 00:00:14.057883,tanh,0.0,3,0.5,COMPLETE
2460,2460,0.46426108479499817,2026-03-14 08:10:25.599870,2026-03-14 08:10:40.125290,0 days 00:00:14.525420,tanh,0.05,3,0.55,COMPLETE
2461,2461,0.7140963673591614,2026-03-14 08:10:40.274459,2026-03-14 08:10:55.222649,0 days 00:00:14.948190,tanh,0.0,8,0.5,COMPLETE
2462,2462,0.6432472467422485,2026-03-14 08:10:55.365766,2026-03-14 08:11:10.112929,0 days 00:00:14.747163,tanh,0.0,6,0.55,COMPLETE
2463,2463,0.41362258791923523,2026-03-14 08:11:10.258525,2026-03-14 08:11:24.281727,0 days 00:00:14.023202,tanh,0.0,3,0.5,COMPLETE
2464,2464,0.47742658853530884,2026-03-14 08:11:24.424750,2026-03-14 08:11:38.695294,0 days 00:00:14.270544,tanh,0.0,3,0.5,COMPLETE
2465,2465,0.6421477198600769,2026-03-14 08:11:38.829315,2026-03-14 08:11:52.953610,0 days 00:00:14.124295,sigmoid,0.0,3,0.5,COMPLETE
2466,2466,0.4877949059009552,2026-03-14 08:11:53.088949,2026-03-14 08:12:07.350009,0 days 00:00:14.261060,tanh,0.0,3,0.5,COMPLETE
2467,2467,0.43279507756233215,2026-03-14 08:12:07.497528,2026-03-14 08:12:21.835401,0 days 00:00:14.337873,tanh,0.05,3,0.55,COMPLETE
2468,2468,0.4400412142276764,2026-03-14 08:12:21.964917,2026-03-14 08:12:36.384411,0 days 00:00:14.419494,tanh,0.0,3,0.5,COMPLETE
2469,2469,0.47122901678085327,2026-03-14 08:12:36.525623,2026-03-14 08:12:50.851407,0 days 00:00:14.325784,tanh,0.4,3,0.5,COMPLETE
2470,2470,0.42481571435928345,2026-03-14 08:12:50.989938,2026-03-14 08:13:05.242538,0 days 00:00:14.252600,tanh,0.0,3,0.55,COMPLETE
2471,2471,0.42479589581489563,2026-03-14 08:13:05.373566,2026-03-14 08:13:19.646011,0 days 00:00:14.272445,tanh,0.0,3,0.5,COMPLETE
2472,2472,0.518073558807373,2026-03-14 08:13:19.787535,2026-03-14 08:13:34.352060,0 days 00:00:14.564525,tanh,0.0,3,0.5,COMPLETE
2473,2473,0.47429805994033813,2026-03-14 08:13:34.493611,2026-03-14 08:13:48.733880,0 days 00:00:14.240269,tanh,0.0,3,0.55,COMPLETE
2474,2474,0.4612565338611603,2026-03-14 08:13:49.042051,2026-03-14 08:14:03.065605,0 days 00:00:14.023554,tanh,0.0,3,0.5,COMPLETE
2475,2475,0.48557519912719727,2026-03-14 08:14:03.207044,2026-03-14 08:14:17.553245,0 days 00:00:14.346201,tanh,0.05,3,0.5,COMPLETE
2476,2476,0.4837862253189087,2026-03-14 08:14:17.705294,2026-03-14 08:14:31.889147,0 days 00:00:14.183853,tanh,0.0,3,0.5,COMPLETE
2477,2477,0.43886539340019226,2026-03-14 08:14:32.051773,2026-03-14 08:14:46.173884,0 days 00:00:14.122111,tanh,0.0,3,0.55,COMPLETE
2478,2478,0.5025122761726379,2026-03-14 08:14:46.354908,2026-03-14 08:15:00.560587,0 days 00:00:14.205679,relu,0.0,3,0.5,COMPLETE
2479,2479,0.4308988153934479,2026-03-14 08:15:00.718111,2026-03-14 08:15:15.587667,0 days 00:00:14.869556,tanh,0.0,3,0.5,COMPLETE
2480,2480,0.4856571555137634,2026-03-14 08:15:15.725185,2026-03-14 08:15:30.329607,0 days 00:00:14.604422,tanh,0.0,2,0.55,COMPLETE
2481,2481,0.41711533069610596,2026-03-14 08:15:30.477929,2026-03-14 08:15:45.391078,0 days 00:00:14.913149,tanh,0.0,4,0.5,COMPLETE
