,number,value,datetime_start,datetime_complete,duration,params_activation,params_dropout,params_layers,params_shrink,state
2482,2482,0.4403761327266693,2026-03-14 08:15:45.561612,2026-03-14 08:15:59.919024,0 days 00:00:14.357412,tanh,0.0,3,0.5,COMPLETE
2483,2483,0.44941002130508423,2026-03-14 08:16:00.051535,2026-03-14 08:16:14.391844,0 days 00:00:14.340309,tanh,0.0,3,0.55,COMPLETE
2484,2484,0.49182137846946716,2026-03-14 08:16:14.549365,2026-03-14 08:16:29.123329,0 days 00:00:14.573964,tanh,0.05,3,0.5,COMPLETE
2485,2485,0.4658503234386444,2026-03-14 08:16:29.251087,2026-03-14 08:16:43.616451,0 days 00:00:14.365364,tanh,0.0,3,0.5,COMPLETE
2486,2486,0.418914794921875,2026-03-14 08:16:43.750979,2026-03-14 08:16:58.074381,0 days 00:00:14.323402,tanh,0.0,3,0.55,COMPLETE
2487,2487,0.46633556485176086,2026-03-14 08:16:58.231545,2026-03-14 08:17:12.629875,0 days 00:00:14.398330,tanh,0.0,3,0.5,COMPLETE
2488,2488,0.4650871753692627,2026-03-14 08:17:12.760410,2026-03-14 08:17:27.136097,0 days 00:00:14.375687,tanh,0.2,3,0.5,COMPLETE
2489,2489,0.4674154818058014,2026-03-14 08:17:27.353695,2026-03-14 08:17:41.731145,0 days 00:00:14.377450,tanh,0.0,3,0.5,COMPLETE
2490,2490,0.6437163949012756,2026-03-14 08:17:41.893664,2026-03-14 08:17:56.086094,0 days 00:00:14.192430,sigmoid,0.0,3,0.55,COMPLETE
2491,2491,0.4382551312446594,2026-03-14 08:17:56.245200,2026-03-14 08:18:10.665608,0 days 00:00:14.420408,tanh,0.0,3,0.5,COMPLETE
2492,2492,0.47234609723091125,2026-03-14 08:18:10.801014,2026-03-14 08:18:25.110767,0 days 00:00:14.309753,tanh,0.0,3,0.5,COMPLETE
2493,2493,0.46089839935302734,2026-03-14 08:18:25.261870,2026-03-14 08:18:39.824137,0 days 00:00:14.562267,tanh,0.05,3,0.55,COMPLETE
2494,2494,0.42412877082824707,2026-03-14 08:18:40.009164,2026-03-14 08:18:54.143867,0 days 00:00:14.134703,tanh,0.0,3,0.5,COMPLETE
2495,2495,0.42308875918388367,2026-03-14 08:18:54.313417,2026-03-14 08:19:08.714240,0 days 00:00:14.400823,tanh,0.0,3,0.5,COMPLETE
2496,2496,0.43598273396492004,2026-03-14 08:19:08.875760,2026-03-14 08:19:23.251273,0 days 00:00:14.375513,tanh,0.0,3,0.5,COMPLETE
2497,2497,0.4769397974014282,2026-03-14 08:19:23.418842,2026-03-14 08:19:37.717880,0 days 00:00:14.299038,tanh,0.0,3,0.55,COMPLETE
2498,2498,0.48662760853767395,2026-03-14 08:19:37.879435,2026-03-14 08:19:52.092442,0 days 00:00:14.213007,relu,0.0,3,0.5,COMPLETE
2499,2499,0.4255397617816925,2026-03-14 08:19:52.413562,2026-03-14 08:20:06.907853,0 days 00:00:14.494291,tanh,0.05,3,0.5,COMPLETE
2500,2500,0.44951850175857544,2026-03-14 08:20:07.070363,2026-03-14 08:20:21.380632,0 days 00:00:14.310269,tanh,0.0,3,0.55,COMPLETE
2501,2501,0.4247487783432007,2026-03-14 08:20:21.546686,2026-03-14 08:20:35.938163,0 days 00:00:14.391477,tanh,0.0,3,0.5,COMPLETE
2502,2502,0.6434796452522278,2026-03-14 08:20:36.099724,2026-03-14 08:20:50.518275,0 days 00:00:14.418551,tanh,0.0,4,0.5,COMPLETE
2503,2503,0.4592525362968445,2026-03-14 08:20:50.676127,2026-03-14 08:21:04.972250,0 days 00:00:14.296123,tanh,0.0,3,0.5,COMPLETE
2504,2504,0.4703564941883087,2026-03-14 08:21:05.303667,2026-03-14 08:21:19.617740,0 days 00:00:14.314073,tanh,0.0,3,0.55,COMPLETE
2505,2505,0.5124478340148926,2026-03-14 08:21:19.788454,2026-03-14 08:21:34.677865,0 days 00:00:14.889411,tanh,0.15000000000000002,3,0.5,COMPLETE
2506,2506,0.523857593536377,2026-03-14 08:21:34.831381,2026-03-14 08:21:49.737914,0 days 00:00:14.906533,tanh,0.1,3,0.5,COMPLETE
2507,2507,0.4537978172302246,2026-03-14 08:21:49.898939,2026-03-14 08:22:04.218996,0 days 00:00:14.320057,tanh,0.0,3,0.55,COMPLETE
2508,2508,0.648547351360321,2026-03-14 08:22:04.394024,2026-03-14 08:22:18.582809,0 days 00:00:14.188785,sigmoid,0.05,3,0.5,COMPLETE
2509,2509,0.46544569730758667,2026-03-14 08:22:18.934696,2026-03-14 08:22:33.164209,0 days 00:00:14.229513,tanh,0.0,3,0.55,COMPLETE
2510,2510,0.43273818492889404,2026-03-14 08:22:33.331230,2026-03-14 08:22:47.515884,0 days 00:00:14.184654,tanh,0.0,3,0.5,COMPLETE
2511,2511,0.4058292508125305,2026-03-14 08:22:47.675395,2026-03-14 08:23:02.236863,0 days 00:00:14.561468,tanh,0.0,3,0.5,COMPLETE
2512,2512,0.49059057235717773,2026-03-14 08:23:02.374379,2026-03-14 08:23:16.388394,0 days 00:00:14.014015,tanh,0.0,2,0.5,COMPLETE
2513,2513,0.42628082633018494,2026-03-14 08:23:16.527618,2026-03-14 08:23:31.061138,0 days 00:00:14.533520,tanh,0.0,3,0.5,COMPLETE
2514,2514,0.47321534156799316,2026-03-14 08:23:31.379315,2026-03-14 08:23:45.686811,0 days 00:00:14.307496,tanh,0.30000000000000004,3,0.5,COMPLETE
2515,2515,0.4106141924858093,2026-03-14 08:23:45.851853,2026-03-14 08:24:00.183933,0 days 00:00:14.332080,tanh,0.0,3,0.55,COMPLETE
2516,2516,0.47025513648986816,2026-03-14 08:24:00.349454,2026-03-14 08:24:14.714368,0 days 00:00:14.364914,tanh,0.0,3,0.5,COMPLETE
2517,2517,0.5438571572303772,2026-03-14 08:24:14.874397,2026-03-14 08:24:29.129141,0 days 00:00:14.254744,tanh,0.0,3,0.55,COMPLETE
2518,2518,0.4266885221004486,2026-03-14 08:24:29.295267,2026-03-14 08:24:43.611670,0 days 00:00:14.316403,tanh,0.05,3,0.5,COMPLETE
2519,2519,0.4795267879962921,2026-03-14 08:24:43.942210,2026-03-14 08:24:58.267667,0 days 00:00:14.325457,tanh,0.0,3,0.5,COMPLETE
2520,2520,0.5391828417778015,2026-03-14 08:24:58.409361,2026-03-14 08:25:12.742374,0 days 00:00:14.333013,relu,0.0,3,0.5,COMPLETE
2521,2521,0.5700745582580566,2026-03-14 08:25:12.903429,2026-03-14 08:25:27.212481,0 days 00:00:14.309052,tanh,0.0,3,0.55,COMPLETE
2522,2522,0.4912055432796478,2026-03-14 08:25:27.369996,2026-03-14 08:25:41.517874,0 days 00:00:14.147878,tanh,0.0,3,0.5,COMPLETE
2523,2523,0.4383012652397156,2026-03-14 08:25:41.683256,2026-03-14 08:25:55.990324,0 days 00:00:14.307068,tanh,0.0,3,0.55,COMPLETE
2524,2524,0.4296910762786865,2026-03-14 08:25:56.150448,2026-03-14 08:26:10.160681,0 days 00:00:14.010233,tanh,0.0,3,0.5,COMPLETE
2525,2525,0.46979910135269165,2026-03-14 08:26:10.306769,2026-03-14 08:26:24.806481,0 days 00:00:14.499712,tanh,0.0,3,0.5,COMPLETE
2526,2526,0.449673056602478,2026-03-14 08:26:24.967523,2026-03-14 08:26:39.342803,0 days 00:00:14.375280,tanh,0.0,3,0.5,COMPLETE
2527,2527,0.46000778675079346,2026-03-14 08:26:39.494340,2026-03-14 08:26:53.547818,0 days 00:00:14.053478,tanh,0.05,3,0.5,COMPLETE
2528,2528,0.4653869569301605,2026-03-14 08:26:53.722335,2026-03-14 08:27:07.993642,0 days 00:00:14.271307,tanh,0.0,3,0.55,COMPLETE
2529,2529,0.4373493492603302,2026-03-14 08:27:08.144742,2026-03-14 08:27:22.216526,0 days 00:00:14.071784,tanh,0.0,3,0.5,COMPLETE
2530,2530,0.6441522240638733,2026-03-14 08:27:22.385139,2026-03-14 08:27:36.774351,0 days 00:00:14.389212,sigmoid,0.0,4,0.5,COMPLETE
2531,2531,0.4455537796020508,2026-03-14 08:27:36.933441,2026-03-14 08:27:51.244710,0 days 00:00:14.311269,tanh,0.05,3,0.55,COMPLETE
2532,2532,0.4424949586391449,2026-03-14 08:27:51.409249,2026-03-14 08:28:05.590592,0 days 00:00:14.181343,tanh,0.0,3,0.5,COMPLETE
2533,2533,0.4427194595336914,2026-03-14 08:28:05.760128,2026-03-14 08:28:20.195168,0 days 00:00:14.435040,tanh,0.0,3,0.55,COMPLETE
2534,2534,0.46187204122543335,2026-03-14 08:28:20.347664,2026-03-14 08:28:34.664284,0 days 00:00:14.316620,tanh,0.0,3,0.5,COMPLETE
2535,2535,0.6424602270126343,2026-03-14 08:28:34.823672,2026-03-14 08:28:49.645912,0 days 00:00:14.822240,tanh,0.0,6,0.5,COMPLETE
2536,2536,0.472944051027298,2026-03-14 08:28:49.821943,2026-03-14 08:29:04.450628,0 days 00:00:14.628685,tanh,0.0,3,0.5,COMPLETE
2537,2537,0.469448983669281,2026-03-14 08:29:04.615247,2026-03-14 08:29:18.928049,0 days 00:00:14.312802,tanh,0.0,2,0.55,COMPLETE
2538,2538,0.45237892866134644,2026-03-14 08:29:19.100565,2026-03-14 08:29:33.655577,0 days 00:00:14.555012,tanh,0.0,3,0.5,COMPLETE
2539,2539,0.44660213589668274,2026-03-14 08:29:33.822097,2026-03-14 08:29:47.972087,0 days 00:00:14.149990,tanh,0.0,3,0.5,COMPLETE
2540,2540,0.49247482419013977,2026-03-14 08:29:48.140111,2026-03-14 08:30:02.350211,0 days 00:00:14.210100,tanh,0.0,3,0.5,COMPLETE
2541,2541,0.440646231174469,2026-03-14 08:30:02.525217,2026-03-14 08:30:17.002611,0 days 00:00:14.477394,tanh,0.0,3,0.55,COMPLETE
2542,2542,0.5168052911758423,2026-03-14 08:30:17.163403,2026-03-14 08:30:31.505624,0 days 00:00:14.342221,relu,0.05,3,0.5,COMPLETE
2543,2543,0.644858181476593,2026-03-14 08:30:31.665163,2026-03-14 08:30:46.222397,0 days 00:00:14.557234,tanh,0.0,5,0.55,COMPLETE
2544,2544,0.45897212624549866,2026-03-14 08:30:46.384920,2026-03-14 08:31:00.584914,0 days 00:00:14.199994,tanh,0.0,3,0.5,COMPLETE
2545,2545,0.4630085527896881,2026-03-14 08:31:00.755941,2026-03-14 08:31:14.789989,0 days 00:00:14.034048,tanh,0.0,3,0.5,COMPLETE
2546,2546,0.4693690538406372,2026-03-14 08:31:14.954526,2026-03-14 08:31:29.317916,0 days 00:00:14.363390,tanh,0.05,3,0.5,COMPLETE
2547,2547,0.43302997946739197,2026-03-14 08:31:29.484446,2026-03-14 08:31:43.728975,0 days 00:00:14.244529,tanh,0.0,3,0.5,COMPLETE
2548,2548,0.4599306583404541,2026-03-14 08:31:43.880917,2026-03-14 08:31:58.526796,0 days 00:00:14.645879,tanh,0.0,3,0.55,COMPLETE
2549,2549,0.4813021421432495,2026-03-14 08:31:58.686314,2026-03-14 08:32:13.064126,0 days 00:00:14.377812,tanh,0.0,4,0.5,COMPLETE
2550,2550,0.4320163428783417,2026-03-14 08:32:13.229222,2026-03-14 08:32:27.643056,0 days 00:00:14.413834,tanh,0.2,3,0.5,COMPLETE
2551,2551,0.6425516605377197,2026-03-14 08:32:28.001595,2026-03-14 08:32:42.053159,0 days 00:00:14.051564,sigmoid,0.0,3,0.55,COMPLETE
2552,2552,0.45574551820755005,2026-03-14 08:32:42.190746,2026-03-14 08:32:56.325927,0 days 00:00:14.135181,tanh,0.0,3,0.5,COMPLETE
2553,2553,0.4522501826286316,2026-03-14 08:32:56.482957,2026-03-14 08:33:11.132833,0 days 00:00:14.649876,tanh,0.0,3,0.5,COMPLETE
2554,2554,0.48981785774230957,2026-03-14 08:33:11.381423,2026-03-14 08:33:25.585602,0 days 00:00:14.204179,tanh,0.0,3,0.55,COMPLETE
2555,2555,0.45588889718055725,2026-03-14 08:33:25.746120,2026-03-14 08:33:39.774113,0 days 00:00:14.027993,tanh,0.0,3,0.5,COMPLETE
2556,2556,0.45623087882995605,2026-03-14 08:33:40.101927,2026-03-14 08:33:54.176825,0 days 00:00:14.074898,tanh,0.0,3,0.5,COMPLETE
2557,2557,0.48425817489624023,2026-03-14 08:33:54.335404,2026-03-14 08:34:08.498197,0 days 00:00:14.162793,tanh,0.05,2,0.55,COMPLETE
2558,2558,0.4543822407722473,2026-03-14 08:34:08.657709,2026-03-14 08:34:22.886431,0 days 00:00:14.228722,tanh,0.0,3,0.5,COMPLETE
2559,2559,0.4689086973667145,2026-03-14 08:34:23.060057,2026-03-14 08:34:37.215693,0 days 00:00:14.155636,tanh,0.0,3,0.5,COMPLETE
2560,2560,0.4494299590587616,2026-03-14 08:34:37.382213,2026-03-14 08:34:51.632783,0 days 00:00:14.250570,tanh,0.0,3,0.55,COMPLETE
2561,2561,0.44220972061157227,2026-03-14 08:34:51.802318,2026-03-14 08:35:06.149436,0 days 00:00:14.347118,tanh,0.0,3,0.5,COMPLETE
2562,2562,0.45524200797080994,2026-03-14 08:35:06.322583,2026-03-14 08:35:20.479455,0 days 00:00:14.156872,tanh,0.0,3,0.5,COMPLETE
2563,2563,0.484199196100235,2026-03-14 08:35:20.663488,2026-03-14 08:35:35.169061,0 days 00:00:14.505573,tanh,0.0,3,0.5,COMPLETE
2564,2564,0.5270041823387146,2026-03-14 08:35:35.334586,2026-03-14 08:35:49.616710,0 days 00:00:14.282124,relu,0.0,3,0.5,COMPLETE
2565,2565,0.47793474793434143,2026-03-14 08:35:49.779733,2026-03-14 08:36:04.348332,0 days 00:00:14.568599,tanh,0.0,3,0.55,COMPLETE
2566,2566,0.4129049479961395,2026-03-14 08:36:04.514472,2026-03-14 08:36:18.826141,0 days 00:00:14.311669,tanh,0.0,3,0.5,COMPLETE
2567,2567,0.4497085511684418,2026-03-14 08:36:18.989497,2026-03-14 08:36:33.556494,0 days 00:00:14.566997,tanh,0.0,3,0.55,COMPLETE
2568,2568,0.4333903193473816,2026-03-14 08:36:33.723519,2026-03-14 08:36:48.147536,0 days 00:00:14.424017,tanh,0.0,3,0.5,COMPLETE
2569,2569,0.44383329153060913,2026-03-14 08:36:48.310157,2026-03-14 08:37:02.805396,0 days 00:00:14.495239,tanh,0.05,3,0.5,COMPLETE
2570,2570,0.44926443696022034,2026-03-14 08:37:02.964406,2026-03-14 08:37:17.299361,0 days 00:00:14.334955,tanh,0.0,3,0.5,COMPLETE
2571,2571,0.450308233499527,2026-03-14 08:37:17.466365,2026-03-14 08:37:32.174706,0 days 00:00:14.708341,tanh,0.0,3,0.55,COMPLETE
2572,2572,0.4307480454444885,2026-03-14 08:37:32.345136,2026-03-14 08:37:46.711769,0 days 00:00:14.366633,tanh,0.0,3,0.5,COMPLETE
2573,2573,0.420099675655365,2026-03-14 08:37:46.868801,2026-03-14 08:38:01.118637,0 days 00:00:14.249836,tanh,0.0,3,0.5,COMPLETE
2574,2574,0.647235631942749,2026-03-14 08:38:01.273755,2026-03-14 08:38:15.725440,0 days 00:00:14.451685,sigmoid,0.05,3,0.5,COMPLETE
2575,2575,0.4632246196269989,2026-03-14 08:38:15.896965,2026-03-14 08:38:30.180541,0 days 00:00:14.283576,tanh,0.0,3,0.55,COMPLETE
2576,2576,0.4357006251811981,2026-03-14 08:38:30.318056,2026-03-14 08:38:44.804692,0 days 00:00:14.486636,tanh,0.0,3,0.5,COMPLETE
2577,2577,0.436727374792099,2026-03-14 08:38:44.991641,2026-03-14 08:38:59.177476,0 days 00:00:14.185835,tanh,0.0,3,0.55,COMPLETE
2578,2578,0.42982640862464905,2026-03-14 08:38:59.330990,2026-03-14 08:39:13.967307,0 days 00:00:14.636317,tanh,0.05,3,0.6,COMPLETE
2579,2579,0.44636356830596924,2026-03-14 08:39:14.121374,2026-03-14 08:39:28.823862,0 days 00:00:14.702488,tanh,0.0,3,0.5,COMPLETE
2580,2580,0.4467507004737854,2026-03-14 08:39:28.971895,2026-03-14 08:39:43.159432,0 days 00:00:14.187537,tanh,0.0,4,0.5,COMPLETE
2581,2581,0.4447456896305084,2026-03-14 08:39:43.322063,2026-03-14 08:39:57.796809,0 days 00:00:14.474746,tanh,0.0,3,0.5,COMPLETE
2582,2582,0.4518786370754242,2026-03-14 08:39:57.953101,2026-03-14 08:40:12.409050,0 days 00:00:14.455949,tanh,0.25,3,0.55,COMPLETE
2583,2583,0.45841050148010254,2026-03-14 08:40:12.564581,2026-03-14 08:40:26.940726,0 days 00:00:14.376145,tanh,0.0,3,0.5,COMPLETE
2584,2584,0.6430697441101074,2026-03-14 08:40:27.130752,2026-03-14 08:40:42.255333,0 days 00:00:15.124581,tanh,0.0,7,0.5,COMPLETE
2585,2585,0.49374547600746155,2026-03-14 08:40:42.405404,2026-03-14 08:40:56.482752,0 days 00:00:14.077348,tanh,0.0,2,0.6,COMPLETE
2586,2586,0.4915720820426941,2026-03-14 08:40:56.684780,2026-03-14 08:41:11.264803,0 days 00:00:14.580023,relu,0.0,3,0.55,COMPLETE
2587,2587,0.4431352913379669,2026-03-14 08:41:11.419325,2026-03-14 08:41:25.675783,0 days 00:00:14.256458,tanh,0.0,3,0.5,COMPLETE
2588,2588,0.43603309988975525,2026-03-14 08:41:25.874810,2026-03-14 08:41:40.869045,0 days 00:00:14.994235,tanh,0.05,3,0.5,COMPLETE
2589,2589,0.642840564250946,2026-03-14 08:41:41.005816,2026-03-14 08:41:56.279474,0 days 00:00:15.273658,tanh,0.0,7,0.5,COMPLETE
2590,2590,0.4551439583301544,2026-03-14 08:41:56.439493,2026-03-14 08:42:11.082298,0 days 00:00:14.642805,tanh,0.0,3,0.55,COMPLETE
2591,2591,0.47212502360343933,2026-03-14 08:42:11.237902,2026-03-14 08:42:25.495559,0 days 00:00:14.257657,tanh,0.0,3,0.95,COMPLETE
2592,2592,0.45502105355262756,2026-03-14 08:42:25.648078,2026-03-14 08:42:39.857628,0 days 00:00:14.209550,tanh,0.0,3,0.5,COMPLETE
2593,2593,0.4743209779262543,2026-03-14 08:42:40.015154,2026-03-14 08:42:54.659437,0 days 00:00:14.644283,tanh,0.0,3,0.6,COMPLETE
2594,2594,0.4392798840999603,2026-03-14 08:42:54.818024,2026-03-14 08:43:09.269818,0 days 00:00:14.451794,tanh,0.0,3,0.5,COMPLETE
2595,2595,0.6436653137207031,2026-03-14 08:43:09.427851,2026-03-14 08:43:23.731373,0 days 00:00:14.303522,sigmoid,0.0,3,0.5,COMPLETE
2596,2596,0.4678301513195038,2026-03-14 08:43:23.891898,2026-03-14 08:43:38.398491,0 days 00:00:14.506593,tanh,0.05,3,0.6,COMPLETE
2597,2597,0.47113293409347534,2026-03-14 08:43:38.558524,2026-03-14 08:43:53.064380,0 days 00:00:14.505856,tanh,0.0,3,0.55,COMPLETE
2598,2598,0.46888023614883423,2026-03-14 08:43:53.242096,2026-03-14 08:44:07.527221,0 days 00:00:14.285125,tanh,0.0,3,0.5,COMPLETE
2599,2599,0.47220826148986816,2026-03-14 08:44:07.677997,2026-03-14 08:44:21.786302,0 days 00:00:14.108305,tanh,0.0,3,0.5,COMPLETE
2600,2600,0.4541776776313782,2026-03-14 08:44:21.944201,2026-03-14 08:44:36.440220,0 days 00:00:14.496019,tanh,0.0,3,0.5,COMPLETE
2601,2601,0.4607321321964264,2026-03-14 08:44:36.602246,2026-03-14 08:44:51.006112,0 days 00:00:14.403866,tanh,0.1,3,0.55,COMPLETE
2602,2602,0.46889254450798035,2026-03-14 08:44:51.333068,2026-03-14 08:45:05.647834,0 days 00:00:14.314766,tanh,0.0,3,0.5,COMPLETE
2603,2603,0.4518450200557709,2026-03-14 08:45:05.819574,2026-03-14 08:45:20.203434,0 days 00:00:14.383860,tanh,0.0,3,0.6,COMPLETE
2604,2604,0.47110843658447266,2026-03-14 08:45:20.377880,2026-03-14 08:45:34.834337,0 days 00:00:14.456457,tanh,0.0,3,0.5,COMPLETE
2605,2605,0.4628981649875641,2026-03-14 08:45:35.164522,2026-03-14 08:45:49.364550,0 days 00:00:14.200028,tanh,0.0,3,0.55,COMPLETE
2606,2606,0.4759769141674042,2026-03-14 08:45:49.517113,2026-03-14 08:46:04.237612,0 days 00:00:14.720499,tanh,0.4,3,0.5,COMPLETE
2607,2607,0.4406481981277466,2026-03-14 08:46:04.396130,2026-03-14 08:46:18.720151,0 days 00:00:14.324021,tanh,0.0,3,0.55,COMPLETE
2608,2608,0.5192289352416992,2026-03-14 08:46:18.878160,2026-03-14 08:46:33.129812,0 days 00:00:14.251652,relu,0.05,2,0.5,COMPLETE
2609,2609,0.43822941184043884,2026-03-14 08:46:33.293402,2026-03-14 08:46:47.789146,0 days 00:00:14.495744,tanh,0.0,3,0.5,COMPLETE
2610,2610,0.49136486649513245,2026-03-14 08:46:47.984192,2026-03-14 08:47:02.338002,0 days 00:00:14.353810,tanh,0.0,3,0.6,COMPLETE
2611,2611,0.42645350098609924,2026-03-14 08:47:02.512535,2026-03-14 08:47:16.561880,0 days 00:00:14.049345,tanh,0.0,3,0.5,COMPLETE
2612,2612,0.4506181478500366,2026-03-14 08:47:16.760945,2026-03-14 08:47:31.288153,0 days 00:00:14.527208,tanh,0.0,4,0.5,COMPLETE
2613,2613,0.4632122218608856,2026-03-14 08:47:31.448678,2026-03-14 08:47:45.734922,0 days 00:00:14.286244,tanh,0.0,3,0.55,COMPLETE
2614,2614,0.810465931892395,2026-03-14 08:47:45.896702,2026-03-14 08:48:00.093648,0 days 00:00:14.196946,tanh,0.0,3,0.5,COMPLETE
2615,2615,0.4449472725391388,2026-03-14 08:48:00.260236,2026-03-14 08:48:15.054186,0 days 00:00:14.793950,tanh,0.05,3,0.6,COMPLETE
2616,2616,0.4168072044849396,2026-03-14 08:48:15.217837,2026-03-14 08:48:29.306787,0 days 00:00:14.088950,tanh,0.0,3,0.5,COMPLETE
2617,2617,0.644621729850769,2026-03-14 08:48:29.477301,2026-03-14 08:48:43.702671,0 days 00:00:14.225370,sigmoid,0.0,3,0.55,COMPLETE
2618,2618,0.42346006631851196,2026-03-14 08:48:43.870614,2026-03-14 08:48:58.336218,0 days 00:00:14.465604,tanh,0.0,3,0.5,COMPLETE
2619,2619,0.43755245208740234,2026-03-14 08:48:58.512248,2026-03-14 08:49:12.845240,0 days 00:00:14.332992,tanh,0.0,3,0.5,COMPLETE
2620,2620,0.4324170649051666,2026-03-14 08:49:13.023430,2026-03-14 08:49:27.357233,0 days 00:00:14.333803,tanh,0.25,3,0.5,COMPLETE
2621,2621,0.45446744561195374,2026-03-14 08:49:27.515754,2026-03-14 08:49:42.070104,0 days 00:00:14.554350,tanh,0.0,3,0.55,COMPLETE
2622,2622,0.5051867961883545,2026-03-14 08:49:42.231501,2026-03-14 08:49:56.637405,0 days 00:00:14.405904,tanh,0.0,3,0.55,COMPLETE
2623,2623,0.6431959867477417,2026-03-14 08:49:56.814437,2026-03-14 08:50:11.885774,0 days 00:00:15.071337,tanh,0.0,5,0.5,COMPLETE
2624,2624,0.4561476707458496,2026-03-14 08:50:12.051814,2026-03-14 08:50:26.565130,0 days 00:00:14.513316,tanh,0.05,3,0.6,COMPLETE
2625,2625,0.7213002443313599,2026-03-14 08:50:26.758750,2026-03-14 08:50:41.758838,0 days 00:00:15.000088,tanh,0.5,4,0.5,COMPLETE
2626,2626,0.44032350182533264,2026-03-14 08:50:41.945867,2026-03-14 08:50:56.273174,0 days 00:00:14.327307,tanh,0.0,3,0.5,COMPLETE
2627,2627,0.4612061083316803,2026-03-14 08:50:56.474327,2026-03-14 08:51:10.980147,0 days 00:00:14.505820,tanh,0.0,3,0.55,COMPLETE
2628,2628,0.48273637890815735,2026-03-14 08:51:11.157239,2026-03-14 08:51:25.584470,0 days 00:00:14.427231,tanh,0.0,3,0.5,COMPLETE
2629,2629,0.46077606081962585,2026-03-14 08:51:25.753332,2026-03-14 08:51:40.268553,0 days 00:00:14.515221,tanh,0.05,3,0.6,COMPLETE
2630,2630,0.4817534387111664,2026-03-14 08:51:40.445578,2026-03-14 08:51:54.911295,0 days 00:00:14.465717,relu,0.0,3,0.5,COMPLETE
2631,2631,0.45061394572257996,2026-03-14 08:51:55.121328,2026-03-14 08:52:09.538692,0 days 00:00:14.417364,tanh,0.0,3,0.55,COMPLETE
2632,2632,0.41174155473709106,2026-03-14 08:52:09.728556,2026-03-14 08:52:24.201891,0 days 00:00:14.473335,tanh,0.0,3,0.5,COMPLETE
2633,2633,0.4586183428764343,2026-03-14 08:52:24.384300,2026-03-14 08:52:38.659573,0 days 00:00:14.275273,tanh,0.0,3,1.0,COMPLETE
2634,2634,0.4897322356700897,2026-03-14 08:52:38.838115,2026-03-14 08:52:53.161164,0 days 00:00:14.323049,tanh,0.0,3,0.5,COMPLETE
2635,2635,0.4997706115245819,2026-03-14 08:52:53.363230,2026-03-14 08:53:07.831844,0 days 00:00:14.468614,tanh,0.0,3,0.5,COMPLETE
2636,2636,0.47652241587638855,2026-03-14 08:53:08.008877,2026-03-14 08:53:22.226503,0 days 00:00:14.217626,tanh,0.0,3,0.6,COMPLETE
2637,2637,0.4536392092704773,2026-03-14 08:53:22.409534,2026-03-14 08:53:37.340563,0 days 00:00:14.931029,tanh,0.05,3,0.5,COMPLETE
2638,2638,0.45029547810554504,2026-03-14 08:53:37.531591,2026-03-14 08:53:51.702232,0 days 00:00:14.170641,tanh,0.0,3,0.55,COMPLETE
2639,2639,0.6447123885154724,2026-03-14 08:53:51.881274,2026-03-14 08:54:06.436833,0 days 00:00:14.555559,sigmoid,0.0,3,0.5,COMPLETE
2640,2640,0.49216851592063904,2026-03-14 08:54:06.607506,2026-03-14 08:54:21.205649,0 days 00:00:14.598143,tanh,0.0,3,0.5,COMPLETE
2641,2641,0.46940144896507263,2026-03-14 08:54:21.404943,2026-03-14 08:54:35.932879,0 days 00:00:14.527936,tanh,0.0,3,0.55,COMPLETE
2642,2642,0.478625625371933,2026-03-14 08:54:36.122919,2026-03-14 08:54:50.545094,0 days 00:00:14.422175,tanh,0.0,2,0.5,COMPLETE
2643,2643,0.47781896591186523,2026-03-14 08:54:50.713341,2026-03-14 08:55:05.368959,0 days 00:00:14.655618,tanh,0.05,3,0.6,COMPLETE
2644,2644,0.5242430567741394,2026-03-14 08:55:05.559494,2026-03-14 08:55:20.183900,0 days 00:00:14.624406,tanh,0.0,3,0.5,COMPLETE
2645,2645,0.5049975514411926,2026-03-14 08:55:20.360924,2026-03-14 08:55:35.127475,0 days 00:00:14.766551,tanh,0.0,3,0.55,COMPLETE
2646,2646,0.47765839099884033,2026-03-14 08:55:35.294462,2026-03-14 08:55:49.614565,0 days 00:00:14.320103,tanh,0.0,3,0.5,COMPLETE
