,number,value,datetime_start,datetime_complete,duration,params_activation,params_dropout,params_layers,params_shrink,state
2647,2647,0.4871141314506531,2026-03-14 08:55:49.789591,2026-03-14 08:56:04.102873,0 days 00:00:14.313282,tanh,0.0,3,0.6,COMPLETE
2648,2648,0.4045431315898895,2026-03-14 08:56:04.321981,2026-03-14 08:56:18.529940,0 days 00:00:14.207959,tanh,0.0,3,0.5,COMPLETE
2649,2649,0.4545595049858093,2026-03-14 08:56:18.712020,2026-03-14 08:56:32.990377,0 days 00:00:14.278357,tanh,0.0,3,0.55,COMPLETE
2650,2650,0.42954322695732117,2026-03-14 08:56:33.166540,2026-03-14 08:56:47.427777,0 days 00:00:14.261237,tanh,0.0,3,0.5,COMPLETE
2651,2651,0.4781290888786316,2026-03-14 08:56:47.590696,2026-03-14 08:57:01.454899,0 days 00:00:13.864203,relu,0.0,3,0.5,COMPLETE
2652,2652,0.43828102946281433,2026-03-14 08:57:01.788120,2026-03-14 08:57:16.331169,0 days 00:00:14.543049,tanh,0.0,3,0.5,COMPLETE
2653,2653,0.4708094000816345,2026-03-14 08:57:16.511206,2026-03-14 08:57:30.727151,0 days 00:00:14.215945,tanh,0.0,3,0.55,COMPLETE
2654,2654,0.6420406699180603,2026-03-14 08:57:30.906680,2026-03-14 08:57:45.745582,0 days 00:00:14.838902,tanh,0.0,6,0.6,COMPLETE
2655,2655,0.4131314754486084,2026-03-14 08:57:45.935670,2026-03-14 08:58:00.210211,0 days 00:00:14.274541,tanh,0.0,3,0.55,COMPLETE
2656,2656,0.4441702365875244,2026-03-14 08:58:00.390294,2026-03-14 08:58:14.816445,0 days 00:00:14.426151,tanh,0.0,3,0.5,COMPLETE
2657,2657,0.45595505833625793,2026-03-14 08:58:14.999511,2026-03-14 08:58:29.615473,0 days 00:00:14.615962,tanh,0.05,3,0.5,COMPLETE
2658,2658,0.43845099210739136,2026-03-14 08:58:29.765001,2026-03-14 08:58:43.782168,0 days 00:00:14.017167,tanh,0.0,3,0.5,COMPLETE
2659,2659,0.42039820551872253,2026-03-14 08:58:44.142232,2026-03-14 08:58:58.471957,0 days 00:00:14.329725,tanh,0.0,3,0.5,COMPLETE
2660,2660,0.5204986333847046,2026-03-14 08:58:58.670981,2026-03-14 08:59:12.975645,0 days 00:00:14.304664,tanh,0.0,3,0.5,COMPLETE
2661,2661,0.6421589255332947,2026-03-14 08:59:13.170840,2026-03-14 08:59:27.947948,0 days 00:00:14.777108,sigmoid,0.05,3,0.55,COMPLETE
2662,2662,0.4422239363193512,2026-03-14 08:59:28.118053,2026-03-14 08:59:42.766112,0 days 00:00:14.648059,tanh,0.35000000000000003,3,0.6,COMPLETE
2663,2663,0.4436988830566406,2026-03-14 08:59:42.939146,2026-03-14 08:59:57.448659,0 days 00:00:14.509513,tanh,0.0,4,0.5,COMPLETE
2664,2664,0.47370588779449463,2026-03-14 08:59:57.630195,2026-03-14 09:00:11.678818,0 days 00:00:14.048623,tanh,0.0,2,0.55,COMPLETE
2665,2665,0.4803601801395416,2026-03-14 09:00:11.870362,2026-03-14 09:00:26.085962,0 days 00:00:14.215600,tanh,0.0,3,0.5,COMPLETE
2666,2666,0.4721715450286865,2026-03-14 09:00:26.261507,2026-03-14 09:00:40.666322,0 days 00:00:14.404815,tanh,0.0,3,0.5,COMPLETE
2667,2667,0.4655561149120331,2026-03-14 09:00:40.841369,2026-03-14 09:00:55.060937,0 days 00:00:14.219568,tanh,0.0,3,0.6,COMPLETE
2668,2668,0.45752349495887756,2026-03-14 09:00:55.226066,2026-03-14 09:01:09.941471,0 days 00:00:14.715405,tanh,0.0,3,0.5,COMPLETE
2669,2669,0.5166842937469482,2026-03-14 09:01:10.109493,2026-03-14 09:01:24.570616,0 days 00:00:14.461123,tanh,0.05,3,0.5,COMPLETE
2670,2670,0.47051817178726196,2026-03-14 09:01:24.761638,2026-03-14 09:01:39.500394,0 days 00:00:14.738756,tanh,0.0,3,0.55,COMPLETE
2671,2671,0.4645276665687561,2026-03-14 09:01:39.681926,2026-03-14 09:01:53.859941,0 days 00:00:14.178015,tanh,0.0,3,0.5,COMPLETE
2672,2672,0.4240657091140747,2026-03-14 09:01:54.039479,2026-03-14 09:02:08.637903,0 days 00:00:14.598424,tanh,0.0,3,0.5,COMPLETE
2673,2673,0.5139972567558289,2026-03-14 09:02:08.836930,2026-03-14 09:02:23.083012,0 days 00:00:14.246082,relu,0.0,3,0.55,COMPLETE
2674,2674,0.46651095151901245,2026-03-14 09:02:23.267634,2026-03-14 09:02:37.466162,0 days 00:00:14.198528,tanh,0.0,3,0.5,COMPLETE
2675,2675,0.47630372643470764,2026-03-14 09:02:37.831819,2026-03-14 09:02:51.969243,0 days 00:00:14.137424,tanh,0.0,3,0.6,COMPLETE
2676,2676,0.5043845772743225,2026-03-14 09:02:52.167536,2026-03-14 09:03:06.512084,0 days 00:00:14.344548,tanh,0.0,3,0.5,COMPLETE
2677,2677,0.42784321308135986,2026-03-14 09:03:06.676598,2026-03-14 09:03:21.085561,0 days 00:00:14.408963,tanh,0.0,3,0.55,COMPLETE
2678,2678,0.4651733934879303,2026-03-14 09:03:21.254704,2026-03-14 09:03:35.582756,0 days 00:00:14.328052,tanh,0.05,3,0.5,COMPLETE
2679,2679,0.44229206442832947,2026-03-14 09:03:35.757286,2026-03-14 09:03:50.413244,0 days 00:00:14.655958,tanh,0.0,3,0.5,COMPLETE
2680,2680,0.4471112787723541,2026-03-14 09:03:50.588269,2026-03-14 09:04:04.875020,0 days 00:00:14.286751,tanh,0.0,3,0.6,COMPLETE
2681,2681,0.45545700192451477,2026-03-14 09:04:05.055649,2026-03-14 09:04:19.386294,0 days 00:00:14.330645,tanh,0.0,3,0.5,COMPLETE
2682,2682,0.6432122588157654,2026-03-14 09:04:19.563355,2026-03-14 09:04:34.236454,0 days 00:00:14.673099,sigmoid,0.0,3,0.55,COMPLETE
2683,2683,0.4675338864326477,2026-03-14 09:04:34.398685,2026-03-14 09:04:48.594708,0 days 00:00:14.196023,tanh,0.0,3,0.5,COMPLETE
2684,2684,0.46610915660858154,2026-03-14 09:04:48.752230,2026-03-14 09:05:03.043614,0 days 00:00:14.291384,tanh,0.0,3,0.55,COMPLETE
2685,2685,0.4608887732028961,2026-03-14 09:05:03.223278,2026-03-14 09:05:17.986760,0 days 00:00:14.763482,tanh,0.05,3,0.5,COMPLETE
2686,2686,0.4217697083950043,2026-03-14 09:05:18.165960,2026-03-14 09:05:32.732385,0 days 00:00:14.566425,tanh,0.0,4,0.5,COMPLETE
2687,2687,0.48197388648986816,2026-03-14 09:05:32.974471,2026-03-14 09:05:47.232540,0 days 00:00:14.258069,tanh,0.15000000000000002,2,0.5,COMPLETE
2688,2688,0.46474963426589966,2026-03-14 09:05:47.425374,2026-03-14 09:06:01.829144,0 days 00:00:14.403770,tanh,0.0,3,0.55,COMPLETE
2689,2689,0.45599043369293213,2026-03-14 09:06:02.023180,2026-03-14 09:06:16.599790,0 days 00:00:14.576610,tanh,0.0,3,0.5,COMPLETE
2690,2690,0.4619137942790985,2026-03-14 09:06:16.793848,2026-03-14 09:06:31.169567,0 days 00:00:14.375719,tanh,0.0,3,0.6,COMPLETE
2691,2691,0.4638763964176178,2026-03-14 09:06:31.344602,2026-03-14 09:06:46.020997,0 days 00:00:14.676395,tanh,0.0,3,0.5,COMPLETE
2692,2692,0.46888262033462524,2026-03-14 09:06:46.249775,2026-03-14 09:07:00.623840,0 days 00:00:14.374065,tanh,0.0,3,0.55,COMPLETE
2693,2693,0.9708706736564636,2026-03-14 09:07:00.801400,2026-03-14 09:07:16.676129,0 days 00:00:15.874729,tanh,0.05,8,0.5,COMPLETE
2694,2694,0.45629262924194336,2026-03-14 09:07:16.847164,2026-03-14 09:07:31.305987,0 days 00:00:14.458823,tanh,0.0,3,0.6,COMPLETE
2695,2695,0.4948371946811676,2026-03-14 09:07:31.481011,2026-03-14 09:07:45.876236,0 days 00:00:14.395225,relu,0.30000000000000004,3,0.5,COMPLETE
2696,2696,0.4595637023448944,2026-03-14 09:07:46.062260,2026-03-14 09:08:00.620780,0 days 00:00:14.558520,tanh,0.0,3,0.55,COMPLETE
2697,2697,0.46394142508506775,2026-03-14 09:08:00.809852,2026-03-14 09:08:15.599406,0 days 00:00:14.789554,tanh,0.45,3,0.5,COMPLETE
2698,2698,0.5112127065658569,2026-03-14 09:08:15.786480,2026-03-14 09:08:30.199656,0 days 00:00:14.413176,tanh,0.0,3,0.5,COMPLETE
2699,2699,0.44446977972984314,2026-03-14 09:08:30.380219,2026-03-14 09:08:44.724780,0 days 00:00:14.344561,tanh,0.0,3,0.65,COMPLETE
2700,2700,0.40877097845077515,2026-03-14 09:08:44.901494,2026-03-14 09:08:59.476563,0 days 00:00:14.575069,tanh,0.0,3,0.6,COMPLETE
2701,2701,0.4609919488430023,2026-03-14 09:08:59.690644,2026-03-14 09:09:13.896009,0 days 00:00:14.205365,tanh,0.0,3,0.6,COMPLETE
2702,2702,0.4756454825401306,2026-03-14 09:09:14.072632,2026-03-14 09:09:28.109433,0 days 00:00:14.036801,tanh,0.0,3,0.6,COMPLETE
2703,2703,0.4563874304294586,2026-03-14 09:09:28.484874,2026-03-14 09:09:43.003347,0 days 00:00:14.518473,tanh,0.0,3,0.6,COMPLETE
2704,2704,0.648495078086853,2026-03-14 09:09:43.204073,2026-03-14 09:09:57.660557,0 days 00:00:14.456484,sigmoid,0.05,3,0.6,COMPLETE
2705,2705,0.6515859961509705,2026-03-14 09:09:57.842902,2026-03-14 09:10:12.453833,0 days 00:00:14.610931,tanh,0.0,5,0.6,COMPLETE
2706,2706,0.44683805108070374,2026-03-14 09:10:12.645361,2026-03-14 09:10:27.192506,0 days 00:00:14.547145,tanh,0.0,3,0.6,COMPLETE
2707,2707,0.4662516415119171,2026-03-14 09:10:27.396043,2026-03-14 09:10:41.683531,0 days 00:00:14.287488,tanh,0.0,3,0.6,COMPLETE
2708,2708,0.4712635278701782,2026-03-14 09:10:41.858052,2026-03-14 09:10:56.281896,0 days 00:00:14.423844,tanh,0.2,3,0.6,COMPLETE
2709,2709,0.49184051156044006,2026-03-14 09:10:56.456412,2026-03-14 09:11:11.024504,0 days 00:00:14.568092,tanh,0.0,3,0.6,COMPLETE
2710,2710,0.4656972587108612,2026-03-14 09:11:11.202695,2026-03-14 09:11:25.605394,0 days 00:00:14.402699,tanh,0.0,3,0.6,COMPLETE
2711,2711,0.5051487684249878,2026-03-14 09:11:25.781935,2026-03-14 09:11:40.294485,0 days 00:00:14.512550,tanh,0.0,2,0.6,COMPLETE
2712,2712,0.45353806018829346,2026-03-14 09:11:40.482058,2026-03-14 09:11:54.873768,0 days 00:00:14.391710,tanh,0.0,3,0.6,COMPLETE
2713,2713,0.45488154888153076,2026-03-14 09:11:55.057796,2026-03-14 09:12:09.491364,0 days 00:00:14.433568,tanh,0.1,3,0.6,COMPLETE
2714,2714,0.4328230023384094,2026-03-14 09:12:09.666404,2026-03-14 09:12:24.152709,0 days 00:00:14.486305,tanh,0.0,3,0.6,COMPLETE
2715,2715,0.458916038274765,2026-03-14 09:12:24.332822,2026-03-14 09:12:38.526619,0 days 00:00:14.193797,tanh,0.0,3,0.6,COMPLETE
2716,2716,0.4381750226020813,2026-03-14 09:12:38.705149,2026-03-14 09:12:53.564994,0 days 00:00:14.859845,tanh,0.05,4,0.6,COMPLETE
2717,2717,0.4710918664932251,2026-03-14 09:12:53.926061,2026-03-14 09:13:08.163772,0 days 00:00:14.237711,relu,0.0,3,0.6,COMPLETE
2718,2718,0.42266684770584106,2026-03-14 09:13:08.355466,2026-03-14 09:13:22.452428,0 days 00:00:14.096962,tanh,0.0,3,0.6,COMPLETE
2719,2719,0.43368610739707947,2026-03-14 09:13:22.643947,2026-03-14 09:13:37.044835,0 days 00:00:14.400888,tanh,0.0,3,0.6,COMPLETE
2720,2720,0.48110535740852356,2026-03-14 09:13:37.225410,2026-03-14 09:13:51.525722,0 days 00:00:14.300312,tanh,0.0,3,0.6,COMPLETE
2721,2721,0.47775694727897644,2026-03-14 09:13:51.701767,2026-03-14 09:14:06.409190,0 days 00:00:14.707423,tanh,0.05,3,0.6,COMPLETE
2722,2722,0.453795850276947,2026-03-14 09:14:06.586010,2026-03-14 09:14:20.959324,0 days 00:00:14.373314,tanh,0.0,3,0.6,COMPLETE
2723,2723,0.4649273157119751,2026-03-14 09:14:21.153361,2026-03-14 09:14:35.422540,0 days 00:00:14.269179,tanh,0.0,3,0.65,COMPLETE
2724,2724,0.4634239971637726,2026-03-14 09:14:35.619566,2026-03-14 09:14:49.847179,0 days 00:00:14.227613,tanh,0.0,3,0.6,COMPLETE
2725,2725,0.5001873970031738,2026-03-14 09:14:49.997206,2026-03-14 09:15:04.144842,0 days 00:00:14.147636,tanh,0.0,3,0.6,COMPLETE
2726,2726,0.6426531672477722,2026-03-14 09:15:04.315957,2026-03-14 09:15:19.139043,0 days 00:00:14.823086,sigmoid,0.0,3,0.6,COMPLETE
2727,2727,0.44117239117622375,2026-03-14 09:15:19.285624,2026-03-14 09:15:33.697256,0 days 00:00:14.411632,tanh,0.05,3,0.6,COMPLETE
2728,2728,0.44652870297431946,2026-03-14 09:15:33.896991,2026-03-14 09:15:48.364964,0 days 00:00:14.467973,tanh,0.0,3,0.6,COMPLETE
2729,2729,0.43234801292419434,2026-03-14 09:15:48.493482,2026-03-14 09:16:02.836390,0 days 00:00:14.342908,tanh,0.0,3,0.6,COMPLETE
2730,2730,0.4370562732219696,2026-03-14 09:16:03.005028,2026-03-14 09:16:17.583215,0 days 00:00:14.578187,tanh,0.0,3,0.6,COMPLETE
2731,2731,0.642958402633667,2026-03-14 09:16:17.728726,2026-03-14 09:16:32.457551,0 days 00:00:14.728825,tanh,0.0,6,0.6,COMPLETE
2732,2732,0.4862340986728668,2026-03-14 09:16:32.642309,2026-03-14 09:16:46.987864,0 days 00:00:14.345555,tanh,0.0,3,0.6,COMPLETE
2733,2733,0.48763203620910645,2026-03-14 09:16:47.157080,2026-03-14 09:17:01.576769,0 days 00:00:14.419689,tanh,0.0,3,0.6,COMPLETE
2734,2734,0.5019018650054932,2026-03-14 09:17:01.778598,2026-03-14 09:17:15.932258,0 days 00:00:14.153660,tanh,0.0,3,0.6,COMPLETE
2735,2735,0.4620090126991272,2026-03-14 09:17:16.075806,2026-03-14 09:17:30.291918,0 days 00:00:14.216112,tanh,0.0,3,0.6,COMPLETE
2736,2736,0.5093043446540833,2026-03-14 09:17:30.509947,2026-03-14 09:17:45.201873,0 days 00:00:14.691926,tanh,0.05,3,0.6,COMPLETE
2737,2737,0.43914633989334106,2026-03-14 09:17:45.350384,2026-03-14 09:17:59.948089,0 days 00:00:14.597705,tanh,0.0,3,0.65,COMPLETE
2738,2738,0.4324245750904083,2026-03-14 09:18:00.123128,2026-03-14 09:18:14.824178,0 days 00:00:14.701050,tanh,0.0,3,0.6,COMPLETE
2739,2739,0.4603702425956726,2026-03-14 09:18:14.957696,2026-03-14 09:18:29.365220,0 days 00:00:14.407524,relu,0.0,3,0.65,COMPLETE
2740,2740,0.48649632930755615,2026-03-14 09:18:29.553784,2026-03-14 09:18:43.598596,0 days 00:00:14.044812,tanh,0.0,2,0.6,COMPLETE
2741,2741,0.4332531988620758,2026-03-14 09:18:43.737120,2026-03-14 09:18:58.162516,0 days 00:00:14.425396,tanh,0.0,3,0.6,COMPLETE
2742,2742,0.47703003883361816,2026-03-14 09:18:58.344609,2026-03-14 09:19:12.969439,0 days 00:00:14.624830,tanh,0.0,3,0.65,COMPLETE
2743,2743,0.4361814260482788,2026-03-14 09:19:13.148573,2026-03-14 09:19:27.795061,0 days 00:00:14.646488,tanh,0.05,4,0.6,COMPLETE
2744,2744,0.4770100712776184,2026-03-14 09:19:27.961468,2026-03-14 09:19:42.207631,0 days 00:00:14.246163,tanh,0.0,3,0.65,COMPLETE
2745,2745,0.4705142378807068,2026-03-14 09:19:42.373468,2026-03-14 09:19:56.684161,0 days 00:00:14.310693,tanh,0.0,3,0.65,COMPLETE
2746,2746,0.4776443541049957,2026-03-14 09:19:56.867679,2026-03-14 09:20:11.679918,0 days 00:00:14.812239,tanh,0.0,3,0.6,COMPLETE
2747,2747,0.4165785312652588,2026-03-14 09:20:11.850811,2026-03-14 09:20:25.970626,0 days 00:00:14.119815,tanh,0.0,3,0.55,COMPLETE
2748,2748,0.6434438824653625,2026-03-14 09:20:26.149297,2026-03-14 09:20:40.591142,0 days 00:00:14.441845,sigmoid,0.0,3,0.6,COMPLETE
2749,2749,0.4809684157371521,2026-03-14 09:20:40.781167,2026-03-14 09:20:54.790288,0 days 00:00:14.009121,tanh,0.0,3,0.65,COMPLETE
2750,2750,0.46809086203575134,2026-03-14 09:20:54.972318,2026-03-14 09:21:09.256651,0 days 00:00:14.284333,tanh,0.0,3,0.55,COMPLETE
2751,2751,0.4543464779853821,2026-03-14 09:21:09.430729,2026-03-14 09:21:23.806015,0 days 00:00:14.375286,tanh,0.0,3,0.65,COMPLETE
2752,2752,0.4454592168331146,2026-03-14 09:21:23.992038,2026-03-14 09:21:38.271869,0 days 00:00:14.279831,tanh,0.0,3,0.6,COMPLETE
2753,2753,0.44955408573150635,2026-03-14 09:21:38.449892,2026-03-14 09:21:52.913575,0 days 00:00:14.463683,tanh,0.0,3,0.55,COMPLETE
2754,2754,0.45481887459754944,2026-03-14 09:21:53.137709,2026-03-14 09:22:07.790928,0 days 00:00:14.653219,tanh,0.05,3,0.55,COMPLETE
2755,2755,0.4328514039516449,2026-03-14 09:22:07.975956,2026-03-14 09:22:22.179055,0 days 00:00:14.203099,tanh,0.0,3,0.65,COMPLETE
2756,2756,0.4861089885234833,2026-03-14 09:22:22.364052,2026-03-14 09:22:36.881669,0 days 00:00:14.517617,tanh,0.0,3,0.6,COMPLETE
2757,2757,0.442667156457901,2026-03-14 09:22:37.057203,2026-03-14 09:22:51.378659,0 days 00:00:14.321456,tanh,0.0,3,0.6,COMPLETE
2758,2758,0.44012147188186646,2026-03-14 09:22:51.518181,2026-03-14 09:23:05.752968,0 days 00:00:14.234787,tanh,0.0,3,0.55,COMPLETE
2759,2759,0.46457982063293457,2026-03-14 09:23:05.918991,2026-03-14 09:23:20.318676,0 days 00:00:14.399685,tanh,0.0,3,0.65,COMPLETE
2760,2760,0.44427409768104553,2026-03-14 09:23:20.504857,2026-03-14 09:23:34.876878,0 days 00:00:14.372021,tanh,0.05,3,0.55,COMPLETE
2761,2761,0.46675899624824524,2026-03-14 09:23:35.046313,2026-03-14 09:23:49.428717,0 days 00:00:14.382404,relu,0.0,3,0.65,COMPLETE
2762,2762,0.4389689266681671,2026-03-14 09:23:49.605796,2026-03-14 09:24:03.866516,0 days 00:00:14.260720,tanh,0.0,3,0.6,COMPLETE
2763,2763,0.43450823426246643,2026-03-14 09:24:04.052545,2026-03-14 09:24:18.853412,0 days 00:00:14.800867,tanh,0.0,3,0.55,COMPLETE
2764,2764,0.470721572637558,2026-03-14 09:24:19.033967,2026-03-14 09:24:33.379962,0 days 00:00:14.345995,tanh,0.0,3,0.65,COMPLETE
2765,2765,0.6423336863517761,2026-03-14 09:24:33.571011,2026-03-14 09:24:47.907276,0 days 00:00:14.336265,tanh,0.0,4,0.55,COMPLETE
2766,2766,0.438946932554245,2026-03-14 09:24:48.099815,2026-03-14 09:25:03.482600,0 days 00:00:15.382785,tanh,0.0,3,0.6,COMPLETE
2767,2767,0.4569122791290283,2026-03-14 09:25:03.704251,2026-03-14 09:25:18.269864,0 days 00:00:14.565613,tanh,0.0,3,0.55,COMPLETE
2768,2768,0.4906083047389984,2026-03-14 09:25:18.446395,2026-03-14 09:25:31.368502,0 days 00:00:12.922107,tanh,0.05,3,0.65,COMPLETE
2769,2769,0.41788357496261597,2026-03-14 09:25:31.566526,2026-03-14 09:25:44.494111,0 days 00:00:12.927585,tanh,0.0,3,0.55,COMPLETE
2770,2770,0.442940354347229,2026-03-14 09:25:44.658628,2026-03-14 09:25:57.565771,0 days 00:00:12.907143,tanh,0.0,3,0.6,COMPLETE
2771,2771,0.644167423248291,2026-03-14 09:25:57.744346,2026-03-14 09:26:10.572983,0 days 00:00:12.828637,sigmoid,0.0,3,0.6,COMPLETE
2772,2772,0.4610053598880768,2026-03-14 09:26:10.720016,2026-03-14 09:26:23.525278,0 days 00:00:12.805262,tanh,0.0,3,0.65,COMPLETE
2773,2773,0.4829666018486023,2026-03-14 09:26:23.675797,2026-03-14 09:26:36.542027,0 days 00:00:12.866230,tanh,0.0,2,0.55,COMPLETE
2774,2774,0.4252404272556305,2026-03-14 09:26:36.844165,2026-03-14 09:26:51.212016,0 days 00:00:14.367851,tanh,0.0,3,0.6,COMPLETE
2775,2775,0.4479721486568451,2026-03-14 09:26:51.368726,2026-03-14 09:27:06.940728,0 days 00:00:15.572002,tanh,0.0,3,0.55,COMPLETE
2776,2776,0.4358867108821869,2026-03-14 09:27:07.104008,2026-03-14 09:27:21.932939,0 days 00:00:14.828931,tanh,0.0,3,0.65,COMPLETE
2777,2777,0.47310870885849,2026-03-14 09:27:22.099399,2026-03-14 09:27:36.997935,0 days 00:00:14.898536,tanh,0.0,3,0.65,COMPLETE
2778,2778,0.47568273544311523,2026-03-14 09:27:37.223052,2026-03-14 09:27:52.031628,0 days 00:00:14.808576,tanh,0.05,3,0.6,COMPLETE
2779,2779,0.4780653119087219,2026-03-14 09:27:52.168049,2026-03-14 09:28:06.914307,0 days 00:00:14.746258,tanh,0.0,3,0.55,COMPLETE
2780,2780,0.44017332792282104,2026-03-14 09:28:07.080348,2026-03-14 09:28:22.019485,0 days 00:00:14.939137,tanh,0.05,3,0.55,COMPLETE
2781,2781,0.44413819909095764,2026-03-14 09:28:22.181595,2026-03-14 09:28:36.782856,0 days 00:00:14.601261,tanh,0.0,3,0.6,COMPLETE
2782,2782,0.46973785758018494,2026-03-14 09:28:36.947715,2026-03-14 09:28:51.944197,0 days 00:00:14.996482,tanh,0.0,3,0.65,COMPLETE
2783,2783,0.46912306547164917,2026-03-14 09:28:52.099390,2026-03-14 09:29:06.868423,0 days 00:00:14.769033,relu,0.0,3,0.55,COMPLETE
2784,2784,0.46046608686447144,2026-03-14 09:29:07.045465,2026-03-14 09:29:21.850994,0 days 00:00:14.805529,tanh,0.0,3,0.6,COMPLETE
2785,2785,0.43748795986175537,2026-03-14 09:29:22.016018,2026-03-14 09:29:37.245620,0 days 00:00:15.229602,tanh,0.0,4,0.65,COMPLETE
2786,2786,0.45935025811195374,2026-03-14 09:29:37.418493,2026-03-14 09:29:52.241700,0 days 00:00:14.823207,tanh,0.0,3,0.55,COMPLETE
2787,2787,0.48735055327415466,2026-03-14 09:29:52.401227,2026-03-14 09:30:07.398405,0 days 00:00:14.997178,tanh,0.0,3,0.6,COMPLETE
2788,2788,0.44600462913513184,2026-03-14 09:30:07.748911,2026-03-14 09:30:23.234305,0 days 00:00:15.485394,tanh,0.0,3,0.55,COMPLETE
2789,2789,0.4527719020843506,2026-03-14 09:30:23.415271,2026-03-14 09:30:38.477320,0 days 00:00:15.062049,tanh,0.0,3,0.65,COMPLETE
2790,2790,0.519985020160675,2026-03-14 09:30:38.631834,2026-03-14 09:30:54.434352,0 days 00:00:15.802518,tanh,0.15000000000000002,2,0.6,COMPLETE
2791,2791,0.437146931886673,2026-03-14 09:30:54.689564,2026-03-14 09:31:11.289057,0 days 00:00:16.599493,tanh,0.05,3,0.55,COMPLETE
2792,2792,0.645031213760376,2026-03-14 09:31:11.453570,2026-03-14 09:31:27.754066,0 days 00:00:16.300496,sigmoid,0.0,3,0.6,COMPLETE
2793,2793,0.4792570173740387,2026-03-14 09:31:27.950143,2026-03-14 09:31:44.901169,0 days 00:00:16.951026,tanh,0.0,3,0.55,COMPLETE
2794,2794,0.4315691888332367,2026-03-14 09:31:45.126079,2026-03-14 09:32:03.531715,0 days 00:00:18.405636,tanh,0.0,3,0.65,COMPLETE
2795,2795,0.44165393710136414,2026-03-14 09:32:03.714655,2026-03-14 09:32:22.053378,0 days 00:00:18.338723,tanh,0.0,3,0.5,COMPLETE
2796,2796,0.4734223186969757,2026-03-14 09:32:22.319572,2026-03-14 09:32:40.753745,0 days 00:00:18.434173,tanh,0.0,3,0.5,COMPLETE
2797,2797,0.4611896276473999,2026-03-14 09:32:41.614929,2026-03-14 09:32:58.423460,0 days 00:00:16.808531,tanh,0.35000000000000003,3,0.55,COMPLETE
2798,2798,0.4440785050392151,2026-03-14 09:32:58.595971,2026-03-14 09:33:15.309177,0 days 00:00:16.713206,tanh,0.0,3,0.65,COMPLETE
2799,2799,0.4641566574573517,2026-03-14 09:33:15.442102,2026-03-14 09:33:31.468478,0 days 00:00:16.026376,tanh,0.0,3,0.5,COMPLETE
2800,2800,0.4881862998008728,2026-03-14 09:33:31.625998,2026-03-14 09:33:49.908240,0 days 00:00:18.282242,tanh,0.05,3,0.6,COMPLETE
2801,2801,0.4884687066078186,2026-03-14 09:33:50.305157,2026-03-14 09:34:07.163969,0 days 00:00:16.858812,tanh,0.0,3,0.5,COMPLETE
2802,2802,0.45347273349761963,2026-03-14 09:34:07.330642,2026-03-14 09:34:23.967358,0 days 00:00:16.636716,tanh,0.0,3,0.6,COMPLETE
2803,2803,0.47929665446281433,2026-03-14 09:34:24.122881,2026-03-14 09:34:40.339051,0 days 00:00:16.216170,tanh,0.0,3,0.55,COMPLETE
2804,2804,0.4383470118045807,2026-03-14 09:34:40.509127,2026-03-14 09:34:56.110127,0 days 00:00:15.601000,tanh,0.0,3,0.5,COMPLETE
2805,2805,0.524555504322052,2026-03-14 09:34:56.258149,2026-03-14 09:35:12.044919,0 days 00:00:15.786770,tanh,0.0,3,0.65,COMPLETE
2806,2806,0.485605925321579,2026-03-14 09:35:12.192944,2026-03-14 09:35:28.246644,0 days 00:00:16.053700,relu,0.0,3,0.5,COMPLETE
2807,2807,0.4751834273338318,2026-03-14 09:35:28.395875,2026-03-14 09:35:45.284755,0 days 00:00:16.888880,tanh,0.0,3,0.55,COMPLETE
2808,2808,0.449749231338501,2026-03-14 09:35:45.454965,2026-03-14 09:36:02.128735,0 days 00:00:16.673770,tanh,0.2,3,0.5,COMPLETE
2809,2809,0.4699747860431671,2026-03-14 09:36:02.449780,2026-03-14 09:36:19.075072,0 days 00:00:16.625292,tanh,0.05,3,0.6,COMPLETE
2810,2810,0.447581022977829,2026-03-14 09:36:19.271619,2026-03-14 09:36:35.583887,0 days 00:00:16.312268,tanh,0.0,4,0.65,COMPLETE
2811,2811,0.4008394479751587,2026-03-14 09:36:35.811173,2026-03-14 09:36:52.107126,0 days 00:00:16.295953,tanh,0.0,3,0.5,COMPLETE
