,number,value,datetime_start,datetime_complete,duration,params_activation,params_dropout,params_layers,params_shrink,state
2152,2152,0.4630342423915863,2026-03-14 06:56:37.648913,2026-03-14 06:56:51.597430,0 days 00:00:13.948517,tanh,0.0,3,0.5,COMPLETE
2153,2153,0.4567701816558838,2026-03-14 06:56:51.741547,2026-03-14 06:57:05.708293,0 days 00:00:13.966746,tanh,0.0,3,0.5,COMPLETE
2154,2154,0.4861108362674713,2026-03-14 06:57:05.853805,2026-03-14 06:57:19.887288,0 days 00:00:14.033483,tanh,0.0,3,0.5,COMPLETE
2155,2155,0.49347659945487976,2026-03-14 06:57:20.032304,2026-03-14 06:57:34.197879,0 days 00:00:14.165575,tanh,0.05,3,0.5,COMPLETE
2156,2156,0.6440417170524597,2026-03-14 06:57:34.345984,2026-03-14 06:57:48.416206,0 days 00:00:14.070222,sigmoid,0.0,3,0.5,COMPLETE
2157,2157,0.4618537425994873,2026-03-14 06:57:48.565450,2026-03-14 06:58:02.651726,0 days 00:00:14.086276,tanh,0.0,3,0.5,COMPLETE
2158,2158,0.44686001539230347,2026-03-14 06:58:02.799240,2026-03-14 06:58:16.807315,0 days 00:00:14.008075,tanh,0.0,3,0.5,COMPLETE
2159,2159,0.4245521128177643,2026-03-14 06:58:16.953338,2026-03-14 06:58:31.070164,0 days 00:00:14.116826,tanh,0.0,3,0.5,COMPLETE
2160,2160,0.4248496890068054,2026-03-14 06:58:31.219731,2026-03-14 06:58:45.140862,0 days 00:00:13.921131,tanh,0.0,3,0.5,COMPLETE
2161,2161,0.4382125437259674,2026-03-14 06:58:45.284573,2026-03-14 06:58:59.295647,0 days 00:00:14.011074,tanh,0.0,3,0.5,COMPLETE
2162,2162,0.4728298783302307,2026-03-14 06:58:59.435861,2026-03-14 06:59:13.589818,0 days 00:00:14.153957,tanh,0.0,3,0.5,COMPLETE
2163,2163,0.447957307100296,2026-03-14 06:59:13.739833,2026-03-14 06:59:27.660758,0 days 00:00:13.920925,tanh,0.0,3,0.5,COMPLETE
2164,2164,0.4753282368183136,2026-03-14 06:59:27.806794,2026-03-14 06:59:41.816578,0 days 00:00:14.009784,tanh,0.0,3,0.5,COMPLETE
2165,2165,0.45378512144088745,2026-03-14 06:59:41.956098,2026-03-14 06:59:56.335913,0 days 00:00:14.379815,tanh,0.05,3,0.5,COMPLETE
2166,2166,0.41261550784111023,2026-03-14 06:59:56.488430,2026-03-14 07:00:10.538423,0 days 00:00:14.049993,tanh,0.0,3,0.5,COMPLETE
2167,2167,0.42969435453414917,2026-03-14 07:00:10.680931,2026-03-14 07:00:24.660005,0 days 00:00:13.979074,tanh,0.0,3,0.8500000000000001,COMPLETE
2168,2168,0.5040943026542664,2026-03-14 07:00:24.981539,2026-03-14 07:00:38.995072,0 days 00:00:14.013533,relu,0.0,3,0.5,COMPLETE
2169,2169,0.646819531917572,2026-03-14 07:00:39.139102,2026-03-14 07:00:53.483889,0 days 00:00:14.344787,tanh,0.0,5,0.5,COMPLETE
2170,2170,0.459066778421402,2026-03-14 07:00:53.629919,2026-03-14 07:01:08.147984,0 days 00:00:14.518065,tanh,0.05,3,0.5,COMPLETE
2171,2171,0.4404365122318268,2026-03-14 07:01:08.378313,2026-03-14 07:01:22.528614,0 days 00:00:14.150301,tanh,0.0,3,0.5,COMPLETE
2172,2172,0.46150827407836914,2026-03-14 07:01:22.681642,2026-03-14 07:01:36.799276,0 days 00:00:14.117634,tanh,0.0,3,0.5,COMPLETE
2173,2173,0.4290967285633087,2026-03-14 07:01:36.949795,2026-03-14 07:01:51.131999,0 days 00:00:14.182204,tanh,0.0,3,0.5,COMPLETE
2174,2174,0.41055724024772644,2026-03-14 07:01:51.286092,2026-03-14 07:02:05.212636,0 days 00:00:13.926544,tanh,0.0,3,0.5,COMPLETE
2175,2175,0.49671921133995056,2026-03-14 07:02:05.357037,2026-03-14 07:02:19.148300,0 days 00:00:13.791263,tanh,0.0,2,0.5,COMPLETE
2176,2176,0.44163548946380615,2026-03-14 07:02:19.476901,2026-03-14 07:02:33.521890,0 days 00:00:14.044989,tanh,0.0,3,0.5,COMPLETE
2177,2177,0.41440245509147644,2026-03-14 07:02:33.670424,2026-03-14 07:02:47.382031,0 days 00:00:13.711607,tanh,0.0,3,0.5,COMPLETE
2178,2178,0.6441053748130798,2026-03-14 07:02:47.531055,2026-03-14 07:03:01.698678,0 days 00:00:14.167623,sigmoid,0.0,3,0.5,COMPLETE
2179,2179,0.6721239686012268,2026-03-14 07:03:01.846656,2026-03-14 07:03:16.769037,0 days 00:00:14.922381,tanh,0.1,4,0.5,COMPLETE
2180,2180,0.4735298752784729,2026-03-14 07:03:16.910109,2026-03-14 07:03:31.113899,0 days 00:00:14.203790,tanh,0.05,3,0.5,COMPLETE
2181,2181,0.5422471165657043,2026-03-14 07:03:31.254793,2026-03-14 07:03:45.432191,0 days 00:00:14.177398,tanh,0.0,3,0.5,COMPLETE
2182,2182,0.48217740654945374,2026-03-14 07:03:45.574730,2026-03-14 07:03:59.918755,0 days 00:00:14.344025,tanh,0.0,3,0.5,COMPLETE
2183,2183,0.46585261821746826,2026-03-14 07:04:00.058451,2026-03-14 07:04:14.007542,0 days 00:00:13.949091,tanh,0.0,3,0.5,COMPLETE
2184,2184,0.4309622347354889,2026-03-14 07:04:14.152175,2026-03-14 07:04:28.232759,0 days 00:00:14.080584,tanh,0.0,3,0.5,COMPLETE
2185,2185,0.5713787078857422,2026-03-14 07:04:28.376798,2026-03-14 07:04:42.449912,0 days 00:00:14.073114,tanh,0.0,3,0.5,COMPLETE
2186,2186,0.4289848208427429,2026-03-14 07:04:42.598466,2026-03-14 07:04:56.709040,0 days 00:00:14.110574,tanh,0.0,3,0.5,COMPLETE
2187,2187,0.4598366320133209,2026-03-14 07:04:56.853576,2026-03-14 07:05:11.034436,0 days 00:00:14.180860,tanh,0.0,3,0.5,COMPLETE
2188,2188,0.4455680251121521,2026-03-14 07:05:11.174634,2026-03-14 07:05:25.346061,0 days 00:00:14.171427,tanh,0.0,3,0.5,COMPLETE
2189,2189,0.45720264315605164,2026-03-14 07:05:25.496155,2026-03-14 07:05:39.529082,0 days 00:00:14.032927,tanh,0.0,3,0.5,COMPLETE
2190,2190,0.4206009805202484,2026-03-14 07:05:39.672599,2026-03-14 07:05:53.567667,0 days 00:00:13.895068,tanh,0.0,3,0.5,COMPLETE
2191,2191,0.45706015825271606,2026-03-14 07:05:53.709188,2026-03-14 07:06:07.981039,0 days 00:00:14.271851,tanh,0.05,3,0.5,COMPLETE
2192,2192,0.46580761671066284,2026-03-14 07:06:08.130213,2026-03-14 07:06:22.249137,0 days 00:00:14.118924,relu,0.0,3,0.5,COMPLETE
2193,2193,0.4271154999732971,2026-03-14 07:06:22.562682,2026-03-14 07:06:36.389934,0 days 00:00:13.827252,tanh,0.0,3,0.5,COMPLETE
2194,2194,0.4545650780200958,2026-03-14 07:06:36.551961,2026-03-14 07:06:50.516251,0 days 00:00:13.964290,tanh,0.0,3,0.5,COMPLETE
2195,2195,0.44466161727905273,2026-03-14 07:06:50.680869,2026-03-14 07:07:04.885994,0 days 00:00:14.205125,tanh,0.0,3,0.5,COMPLETE
2196,2196,0.5076099634170532,2026-03-14 07:07:05.030527,2026-03-14 07:07:19.748375,0 days 00:00:14.717848,tanh,0.2,3,0.5,COMPLETE
2197,2197,0.42371368408203125,2026-03-14 07:07:19.893893,2026-03-14 07:07:33.940166,0 days 00:00:14.046273,tanh,0.0,3,0.5,COMPLETE
2198,2198,0.42832618951797485,2026-03-14 07:07:34.084190,2026-03-14 07:07:48.322972,0 days 00:00:14.238782,tanh,0.0,3,0.5,COMPLETE
2199,2199,0.45879095792770386,2026-03-14 07:07:48.470501,2026-03-14 07:08:02.897784,0 days 00:00:14.427283,tanh,0.05,3,0.5,COMPLETE
2200,2200,0.451850026845932,2026-03-14 07:08:03.037381,2026-03-14 07:08:17.338758,0 days 00:00:14.301377,tanh,0.0,3,0.5,COMPLETE
2201,2201,0.6445998549461365,2026-03-14 07:08:17.492274,2026-03-14 07:08:31.532206,0 days 00:00:14.039932,sigmoid,0.0,2,0.5,COMPLETE
2202,2202,0.42499712109565735,2026-03-14 07:08:31.681719,2026-03-14 07:08:45.836021,0 days 00:00:14.154302,tanh,0.0,4,0.5,COMPLETE
2203,2203,0.4611935019493103,2026-03-14 07:08:45.983544,2026-03-14 07:08:59.959729,0 days 00:00:13.976185,tanh,0.0,3,0.95,COMPLETE
2204,2204,0.4654397964477539,2026-03-14 07:09:00.264344,2026-03-14 07:09:14.547059,0 days 00:00:14.282715,tanh,0.0,3,0.5,COMPLETE
2205,2205,0.4459783732891083,2026-03-14 07:09:14.693863,2026-03-14 07:09:28.955528,0 days 00:00:14.261665,tanh,0.05,3,0.5,COMPLETE
2206,2206,0.4415736496448517,2026-03-14 07:09:29.105045,2026-03-14 07:09:43.193822,0 days 00:00:14.088777,tanh,0.0,3,0.5,COMPLETE
2207,2207,0.4565238356590271,2026-03-14 07:09:43.335355,2026-03-14 07:09:57.107519,0 days 00:00:13.772164,tanh,0.0,3,0.5,COMPLETE
2208,2208,0.48442092537879944,2026-03-14 07:09:57.256688,2026-03-14 07:10:11.329821,0 days 00:00:14.073133,tanh,0.0,3,0.5,COMPLETE
2209,2209,0.4425014853477478,2026-03-14 07:10:11.469026,2026-03-14 07:10:25.710688,0 days 00:00:14.241662,tanh,0.0,3,0.5,COMPLETE
2210,2210,0.4536809027194977,2026-03-14 07:10:25.856208,2026-03-14 07:10:39.778194,0 days 00:00:13.921986,tanh,0.0,3,0.5,COMPLETE
2211,2211,0.45656177401542664,2026-03-14 07:10:39.923233,2026-03-14 07:10:53.834975,0 days 00:00:13.911742,tanh,0.05,3,0.5,COMPLETE
2212,2212,0.4703860878944397,2026-03-14 07:10:53.990505,2026-03-14 07:11:08.315345,0 days 00:00:14.324840,tanh,0.30000000000000004,3,0.5,COMPLETE
2213,2213,0.6446746587753296,2026-03-14 07:11:08.479872,2026-03-14 07:11:23.168383,0 days 00:00:14.688511,tanh,0.0,5,0.5,COMPLETE
2214,2214,0.4812401235103607,2026-03-14 07:11:23.302515,2026-03-14 07:11:37.579898,0 days 00:00:14.277383,relu,0.15000000000000002,3,0.5,COMPLETE
2215,2215,0.47940993309020996,2026-03-14 07:11:37.718612,2026-03-14 07:11:52.031122,0 days 00:00:14.312510,tanh,0.0,3,0.5,COMPLETE
2216,2216,0.4229559600353241,2026-03-14 07:11:52.178710,2026-03-14 07:12:06.077870,0 days 00:00:13.899160,tanh,0.0,3,0.5,COMPLETE
2217,2217,0.44976192712783813,2026-03-14 07:12:06.219907,2026-03-14 07:12:20.243355,0 days 00:00:14.023448,tanh,0.0,3,0.5,COMPLETE
2218,2218,0.4750325381755829,2026-03-14 07:12:20.421875,2026-03-14 07:12:34.498996,0 days 00:00:14.077121,tanh,0.0,3,0.5,COMPLETE
2219,2219,0.43463048338890076,2026-03-14 07:12:34.641520,2026-03-14 07:12:48.785507,0 days 00:00:14.143987,tanh,0.0,4,0.55,COMPLETE
2220,2220,0.41507720947265625,2026-03-14 07:12:48.934017,2026-03-14 07:13:03.050216,0 days 00:00:14.116199,tanh,0.0,3,0.8,COMPLETE
2221,2221,0.44608330726623535,2026-03-14 07:13:03.198746,2026-03-14 07:13:17.428781,0 days 00:00:14.230035,tanh,0.0,3,0.5,COMPLETE
2222,2222,0.5380128026008606,2026-03-14 07:13:17.582299,2026-03-14 07:13:31.607275,0 days 00:00:14.024976,sigmoid,0.0,2,0.8500000000000001,COMPLETE
2223,2223,0.45328736305236816,2026-03-14 07:13:31.770424,2026-03-14 07:13:46.094967,0 days 00:00:14.324543,tanh,0.05,3,0.5,COMPLETE
2224,2224,0.46279001235961914,2026-03-14 07:13:46.252116,2026-03-14 07:14:00.563612,0 days 00:00:14.311496,tanh,0.4,3,0.55,COMPLETE
2225,2225,0.4192478358745575,2026-03-14 07:14:00.718157,2026-03-14 07:14:14.797458,0 days 00:00:14.079301,tanh,0.0,3,0.5,COMPLETE
2226,2226,0.4732093811035156,2026-03-14 07:14:14.943626,2026-03-14 07:14:29.243456,0 days 00:00:14.299830,tanh,0.0,3,0.9,COMPLETE
2227,2227,0.43435436487197876,2026-03-14 07:14:29.388102,2026-03-14 07:14:43.475167,0 days 00:00:14.087065,tanh,0.0,3,0.5,COMPLETE
2228,2228,0.4177170693874359,2026-03-14 07:14:43.618685,2026-03-14 07:14:57.495200,0 days 00:00:13.876515,tanh,0.0,3,0.5,COMPLETE
2229,2229,0.40779998898506165,2026-03-14 07:14:57.634235,2026-03-14 07:15:11.736665,0 days 00:00:14.102430,tanh,0.0,3,0.55,COMPLETE
2230,2230,0.4817149341106415,2026-03-14 07:15:11.917777,2026-03-14 07:15:26.132718,0 days 00:00:14.214941,tanh,0.0,3,0.5,COMPLETE
2231,2231,0.4422317445278168,2026-03-14 07:15:26.283249,2026-03-14 07:15:40.433383,0 days 00:00:14.150134,tanh,0.05,3,0.5,COMPLETE
2232,2232,0.4272262454032898,2026-03-14 07:15:40.572974,2026-03-14 07:15:54.482812,0 days 00:00:13.909838,tanh,0.0,3,0.55,COMPLETE
2233,2233,0.45795828104019165,2026-03-14 07:15:54.652330,2026-03-14 07:16:08.713044,0 days 00:00:14.060714,tanh,0.0,3,0.5,COMPLETE
2234,2234,0.4058939218521118,2026-03-14 07:16:08.862567,2026-03-14 07:16:22.917212,0 days 00:00:14.054645,tanh,0.0,3,0.5,COMPLETE
2235,2235,0.5043606758117676,2026-03-14 07:16:23.064238,2026-03-14 07:16:37.227441,0 days 00:00:14.163203,relu,0.0,3,0.5,COMPLETE
2236,2236,0.43633633852005005,2026-03-14 07:16:37.377956,2026-03-14 07:16:51.405060,0 days 00:00:14.027104,tanh,0.0,3,0.5,COMPLETE
2237,2237,0.44535186886787415,2026-03-14 07:16:51.548597,2026-03-14 07:17:05.558225,0 days 00:00:14.009628,tanh,0.0,3,0.55,COMPLETE
2238,2238,0.4657256603240967,2026-03-14 07:17:05.725272,2026-03-14 07:17:20.254646,0 days 00:00:14.529374,tanh,0.05,3,0.5,COMPLETE
2239,2239,0.46297594904899597,2026-03-14 07:17:20.424682,2026-03-14 07:17:34.477573,0 days 00:00:14.052891,tanh,0.0,3,0.55,COMPLETE
2240,2240,0.48189568519592285,2026-03-14 07:17:34.615633,2026-03-14 07:17:48.866383,0 days 00:00:14.250750,tanh,0.0,3,0.5,COMPLETE
2241,2241,0.4512106478214264,2026-03-14 07:17:49.015918,2026-03-14 07:18:03.294784,0 days 00:00:14.278866,tanh,0.0,3,0.5,COMPLETE
2242,2242,0.4434085488319397,2026-03-14 07:18:03.437566,2026-03-14 07:18:17.357197,0 days 00:00:13.919631,tanh,0.0,3,0.5,COMPLETE
2243,2243,0.4832382798194885,2026-03-14 07:18:17.504714,2026-03-14 07:18:31.935212,0 days 00:00:14.430498,tanh,0.05,3,0.55,COMPLETE
2244,2244,0.6441876292228699,2026-03-14 07:18:32.102488,2026-03-14 07:18:46.102008,0 days 00:00:13.999520,sigmoid,0.0,3,0.5,COMPLETE
2245,2245,0.41320890188217163,2026-03-14 07:18:46.249782,2026-03-14 07:19:00.271254,0 days 00:00:14.021472,tanh,0.0,3,0.5,COMPLETE
2246,2246,0.45123183727264404,2026-03-14 07:19:00.409914,2026-03-14 07:19:15.008391,0 days 00:00:14.598477,tanh,0.0,3,0.5,COMPLETE
2247,2247,0.43363839387893677,2026-03-14 07:19:15.158419,2026-03-14 07:19:29.168029,0 days 00:00:14.009610,tanh,0.0,3,0.55,COMPLETE
2248,2248,0.4831730127334595,2026-03-14 07:19:29.314056,2026-03-14 07:19:43.370313,0 days 00:00:14.056257,tanh,0.0,3,0.5,COMPLETE
2249,2249,0.45440760254859924,2026-03-14 07:19:43.511238,2026-03-14 07:19:57.662761,0 days 00:00:14.151523,tanh,0.0,3,0.5,COMPLETE
2250,2250,0.5025653839111328,2026-03-14 07:19:57.824819,2026-03-14 07:20:11.805103,0 days 00:00:13.980284,tanh,0.0,2,0.55,COMPLETE
2251,2251,0.48799020051956177,2026-03-14 07:20:11.956150,2026-03-14 07:20:25.978531,0 days 00:00:14.022381,tanh,0.0,4,0.5,COMPLETE
2252,2252,0.4574328660964966,2026-03-14 07:20:26.298107,2026-03-14 07:20:40.178387,0 days 00:00:13.880280,tanh,0.0,3,0.5,COMPLETE
2253,2253,0.48702114820480347,2026-03-14 07:20:40.317920,2026-03-14 07:20:54.505374,0 days 00:00:14.187454,tanh,0.05,3,0.5,COMPLETE
2254,2254,0.5162868499755859,2026-03-14 07:20:54.668317,2026-03-14 07:21:08.954045,0 days 00:00:14.285728,tanh,0.0,3,0.5,COMPLETE
2255,2255,0.4157089293003082,2026-03-14 07:21:09.090557,2026-03-14 07:21:23.372047,0 days 00:00:14.281490,tanh,0.0,3,0.55,COMPLETE
2256,2256,0.4610375761985779,2026-03-14 07:21:23.520568,2026-03-14 07:21:37.570126,0 days 00:00:14.049558,tanh,0.0,3,0.8500000000000001,COMPLETE
2257,2257,0.5008178353309631,2026-03-14 07:21:37.709601,2026-03-14 07:21:52.155513,0 days 00:00:14.445912,relu,0.0,3,0.5,COMPLETE
2258,2258,0.4490889012813568,2026-03-14 07:21:52.318129,2026-03-14 07:22:06.423271,0 days 00:00:14.105142,tanh,0.0,3,0.5,COMPLETE
2259,2259,0.6438235640525818,2026-03-14 07:22:06.588790,2026-03-14 07:22:21.188621,0 days 00:00:14.599831,tanh,0.0,6,0.55,COMPLETE
2260,2260,0.4153331518173218,2026-03-14 07:22:21.542172,2026-03-14 07:22:35.692015,0 days 00:00:14.149843,tanh,0.0,3,0.5,COMPLETE
2261,2261,0.43725109100341797,2026-03-14 07:22:35.854463,2026-03-14 07:22:49.655145,0 days 00:00:13.800682,tanh,0.0,3,0.5,COMPLETE
2262,2262,0.47661393880844116,2026-03-14 07:22:49.826180,2026-03-14 07:23:04.003234,0 days 00:00:14.177054,tanh,0.0,3,0.8,COMPLETE
2263,2263,0.4326365888118744,2026-03-14 07:23:04.164644,2026-03-14 07:23:18.197090,0 days 00:00:14.032446,tanh,0.0,3,0.5,COMPLETE
2264,2264,0.4137703776359558,2026-03-14 07:23:18.352114,2026-03-14 07:23:32.775281,0 days 00:00:14.423167,tanh,0.05,3,0.5,COMPLETE
2265,2265,0.49671730399131775,2026-03-14 07:23:32.927844,2026-03-14 07:23:47.083802,0 days 00:00:14.155958,tanh,0.0,3,0.55,COMPLETE
2266,2266,0.6459680199623108,2026-03-14 07:23:47.238745,2026-03-14 07:24:01.390025,0 days 00:00:14.151280,sigmoid,0.05,3,0.5,COMPLETE
2267,2267,0.4388812482357025,2026-03-14 07:24:01.552046,2026-03-14 07:24:15.693410,0 days 00:00:14.141364,tanh,0.0,3,0.5,COMPLETE
2268,2268,0.46511512994766235,2026-03-14 07:24:15.847936,2026-03-14 07:24:30.216726,0 days 00:00:14.368790,tanh,0.0,3,0.55,COMPLETE
2269,2269,0.447372704744339,2026-03-14 07:24:30.374825,2026-03-14 07:24:44.566455,0 days 00:00:14.191630,tanh,0.0,3,0.5,COMPLETE
2270,2270,0.429517537355423,2026-03-14 07:24:44.730489,2026-03-14 07:24:58.933299,0 days 00:00:14.202810,tanh,0.0,3,0.5,COMPLETE
2271,2271,0.45070159435272217,2026-03-14 07:24:59.248684,2026-03-14 07:25:13.592078,0 days 00:00:14.343394,tanh,0.0,3,0.55,COMPLETE
2272,2272,0.458535760641098,2026-03-14 07:25:13.759102,2026-03-14 07:25:27.795965,0 days 00:00:14.036863,tanh,0.0,3,0.5,COMPLETE
2273,2273,0.4125290513038635,2026-03-14 07:25:27.972033,2026-03-14 07:25:42.397459,0 days 00:00:14.425426,tanh,0.0,3,0.5,COMPLETE
2274,2274,0.46659335494041443,2026-03-14 07:25:42.560500,2026-03-14 07:25:56.960905,0 days 00:00:14.400405,tanh,0.45,3,0.5,COMPLETE
2275,2275,0.44019991159439087,2026-03-14 07:25:57.133435,2026-03-14 07:26:11.255158,0 days 00:00:14.121723,tanh,0.0,3,0.55,COMPLETE
2276,2276,0.46006667613983154,2026-03-14 07:26:11.413677,2026-03-14 07:26:25.751002,0 days 00:00:14.337325,tanh,0.0,3,0.5,COMPLETE
2277,2277,0.5006393194198608,2026-03-14 07:26:25.935094,2026-03-14 07:26:39.715819,0 days 00:00:13.780725,tanh,0.0,2,0.5,COMPLETE
2278,2278,0.486541748046875,2026-03-14 07:26:39.868851,2026-03-14 07:26:54.132632,0 days 00:00:14.263781,tanh,0.05,3,0.5,COMPLETE
2279,2279,0.48139581084251404,2026-03-14 07:26:54.464801,2026-03-14 07:27:08.900427,0 days 00:00:14.435626,relu,0.0,3,0.55,COMPLETE
2280,2280,0.4655017554759979,2026-03-14 07:27:09.059947,2026-03-14 07:27:23.387257,0 days 00:00:14.327310,tanh,0.0,4,0.5,COMPLETE
2281,2281,0.3966469168663025,2026-03-14 07:27:23.546778,2026-03-14 07:27:37.522770,0 days 00:00:13.975992,tanh,0.0,3,0.5,COMPLETE
2282,2282,0.46217623353004456,2026-03-14 07:27:37.680314,2026-03-14 07:27:51.644235,0 days 00:00:13.963921,tanh,0.0,3,0.5,COMPLETE
2283,2283,0.643174946308136,2026-03-14 07:27:51.802263,2026-03-14 07:28:06.666500,0 days 00:00:14.864237,tanh,0.0,7,0.55,COMPLETE
2284,2284,0.4461025595664978,2026-03-14 07:28:06.836548,2026-03-14 07:28:21.169074,0 days 00:00:14.332526,tanh,0.05,3,0.8,COMPLETE
2285,2285,0.432359904050827,2026-03-14 07:28:21.320862,2026-03-14 07:28:35.414218,0 days 00:00:14.093356,tanh,0.1,3,0.5,COMPLETE
2286,2286,0.489972859621048,2026-03-14 07:28:35.573260,2026-03-14 07:28:49.740662,0 days 00:00:14.167402,tanh,0.0,3,0.5,COMPLETE
2287,2287,0.4570819139480591,2026-03-14 07:28:49.899176,2026-03-14 07:29:03.949040,0 days 00:00:14.049864,tanh,0.0,3,0.55,COMPLETE
2288,2288,0.6414082050323486,2026-03-14 07:29:04.111565,2026-03-14 07:29:18.193302,0 days 00:00:14.081737,sigmoid,0.0,3,0.5,COMPLETE
2289,2289,0.43387019634246826,2026-03-14 07:29:18.365340,2026-03-14 07:29:32.703535,0 days 00:00:14.338195,tanh,0.0,3,0.5,COMPLETE
2290,2290,0.466759592294693,2026-03-14 07:29:32.868064,2026-03-14 07:29:46.894823,0 days 00:00:14.026759,tanh,0.0,3,0.5,COMPLETE
2291,2291,0.4590936005115509,2026-03-14 07:29:47.056895,2026-03-14 07:30:01.414781,0 days 00:00:14.357886,tanh,0.0,3,0.5,COMPLETE
2292,2292,0.49625369906425476,2026-03-14 07:30:01.592162,2026-03-14 07:30:15.924510,0 days 00:00:14.332348,tanh,0.0,3,0.55,COMPLETE
2293,2293,0.4795626997947693,2026-03-14 07:30:16.088495,2026-03-14 07:30:30.931860,0 days 00:00:14.843365,tanh,0.05,4,0.5,COMPLETE
2294,2294,0.44331395626068115,2026-03-14 07:30:31.088397,2026-03-14 07:30:45.249911,0 days 00:00:14.161514,tanh,0.0,3,0.5,COMPLETE
2295,2295,0.4630216360092163,2026-03-14 07:30:45.408273,2026-03-14 07:30:59.537509,0 days 00:00:14.129236,tanh,0.0,3,0.5,COMPLETE
2296,2296,0.47497236728668213,2026-03-14 07:30:59.710036,2026-03-14 07:31:13.959145,0 days 00:00:14.249109,tanh,0.15000000000000002,3,0.5,COMPLETE
2297,2297,0.4601280987262726,2026-03-14 07:31:14.133787,2026-03-14 07:31:28.193735,0 days 00:00:14.059948,tanh,0.0,3,0.55,COMPLETE
2298,2298,0.4623444378376007,2026-03-14 07:31:28.364273,2026-03-14 07:31:42.218311,0 days 00:00:13.854038,tanh,0.0,2,0.5,COMPLETE
2299,2299,0.45554792881011963,2026-03-14 07:31:42.388337,2026-03-14 07:31:56.537035,0 days 00:00:14.148698,tanh,0.0,3,0.55,COMPLETE
2300,2300,0.4228377938270569,2026-03-14 07:31:56.719078,2026-03-14 07:32:10.631008,0 days 00:00:13.911930,tanh,0.0,3,0.5,COMPLETE
2301,2301,0.5176599621772766,2026-03-14 07:32:10.773040,2026-03-14 07:32:25.107390,0 days 00:00:14.334350,relu,0.0,3,0.5,COMPLETE
2302,2302,0.515762209892273,2026-03-14 07:32:25.264372,2026-03-14 07:32:39.335425,0 days 00:00:14.071053,tanh,0.0,3,0.5,COMPLETE
2303,2303,0.5997175574302673,2026-03-14 07:32:39.458946,2026-03-14 07:32:53.727123,0 days 00:00:14.268177,tanh,0.2,3,0.55,COMPLETE
2304,2304,0.42022332549095154,2026-03-14 07:32:54.051656,2026-03-14 07:33:08.347940,0 days 00:00:14.296284,tanh,0.0,3,0.5,COMPLETE
2305,2305,0.7782633900642395,2026-03-14 07:33:08.534587,2026-03-14 07:33:24.418240,0 days 00:00:15.883653,tanh,0.05,8,0.5,COMPLETE
2306,2306,0.48212310671806335,2026-03-14 07:33:24.574785,2026-03-14 07:33:38.821550,0 days 00:00:14.246765,tanh,0.0,3,0.5,COMPLETE
2307,2307,0.42687612771987915,2026-03-14 07:33:38.980239,2026-03-14 07:33:53.098803,0 days 00:00:14.118564,tanh,0.0,3,0.55,COMPLETE
2308,2308,0.45244893431663513,2026-03-14 07:33:53.252467,2026-03-14 07:34:07.360104,0 days 00:00:14.107637,tanh,0.0,3,0.8500000000000001,COMPLETE
2309,2309,0.45566317439079285,2026-03-14 07:34:07.516131,2026-03-14 07:34:22.206034,0 days 00:00:14.689903,tanh,0.25,3,0.5,COMPLETE
2310,2310,0.6442922353744507,2026-03-14 07:34:22.373063,2026-03-14 07:34:36.603148,0 days 00:00:14.230085,sigmoid,0.0,3,0.5,COMPLETE
2311,2311,0.43852660059928894,2026-03-14 07:34:36.758176,2026-03-14 07:34:51.084216,0 days 00:00:14.326040,tanh,0.0,3,0.5,COMPLETE
2312,2312,0.47073525190353394,2026-03-14 07:34:51.237808,2026-03-14 07:35:05.310123,0 days 00:00:14.072315,tanh,0.0,3,0.55,COMPLETE
2313,2313,0.4602285921573639,2026-03-14 07:35:05.465151,2026-03-14 07:35:20.103330,0 days 00:00:14.638179,tanh,0.05,3,0.95,COMPLETE
2314,2314,0.4671691060066223,2026-03-14 07:35:20.258603,2026-03-14 07:35:34.461147,0 days 00:00:14.202544,tanh,0.0,3,0.5,COMPLETE
2315,2315,0.4409511387348175,2026-03-14 07:35:34.618680,2026-03-14 07:35:48.707710,0 days 00:00:14.089030,tanh,0.0,3,0.5,COMPLETE
2316,2316,0.40676623582839966,2026-03-14 07:35:48.859225,2026-03-14 07:36:03.262668,0 days 00:00:14.403443,tanh,0.0,3,0.55,COMPLETE
