,number,value,datetime_start,datetime_complete,duration,params_activation,params_dropout,params_layers,params_shrink,state
1000,1000,0.46195247769355774,2026-03-14 02:26:10.934967,2026-03-14 02:26:24.529226,0 days 00:00:13.594259,tanh,0.0,3,0.95,COMPLETE
1001,1001,0.4489695727825165,2026-03-14 02:26:24.692768,2026-03-14 02:26:38.381880,0 days 00:00:13.689112,tanh,0.0,3,0.6,COMPLETE
1002,1002,0.4496348202228546,2026-03-14 02:26:38.547496,2026-03-14 02:26:52.030406,0 days 00:00:13.482910,tanh,0.0,3,0.65,COMPLETE
1003,1003,0.49642112851142883,2026-03-14 02:26:52.193314,2026-03-14 02:27:05.686826,0 days 00:00:13.493512,tanh,0.0,3,0.55,COMPLETE
1004,1004,0.45557427406311035,2026-03-14 02:27:05.845854,2026-03-14 02:27:19.432806,0 days 00:00:13.586952,tanh,0.0,3,0.6,COMPLETE
1005,1005,0.43797460198402405,2026-03-14 02:27:19.592322,2026-03-14 02:27:32.818194,0 days 00:00:13.225872,tanh,0.0,3,0.65,COMPLETE
1006,1006,0.4410789906978607,2026-03-14 02:27:32.968218,2026-03-14 02:27:46.898144,0 days 00:00:13.929926,tanh,0.0,3,0.65,COMPLETE
1007,1007,0.6466653347015381,2026-03-14 02:27:47.069785,2026-03-14 02:28:00.951848,0 days 00:00:13.882063,sigmoid,0.05,3,0.6,COMPLETE
1008,1008,0.4917513132095337,2026-03-14 02:28:01.102926,2026-03-14 02:28:14.489187,0 days 00:00:13.386261,tanh,0.0,2,0.65,COMPLETE
1009,1009,0.6421970129013062,2026-03-14 02:28:14.643717,2026-03-14 02:28:28.828226,0 days 00:00:14.184509,tanh,0.0,6,0.55,COMPLETE
1010,1010,0.46390438079833984,2026-03-14 02:28:28.996170,2026-03-14 02:28:42.658691,0 days 00:00:13.662521,tanh,0.0,3,0.65,COMPLETE
1011,1011,0.4318472445011139,2026-03-14 02:28:42.833243,2026-03-14 02:28:56.675217,0 days 00:00:13.841974,tanh,0.25,3,0.5,COMPLETE
1012,1012,0.46166178584098816,2026-03-14 02:28:56.841253,2026-03-14 02:29:10.474927,0 days 00:00:13.633674,tanh,0.0,3,0.6,COMPLETE
1013,1013,0.4439333379268646,2026-03-14 02:29:10.631968,2026-03-14 02:29:24.563315,0 days 00:00:13.931347,tanh,0.05,3,0.65,COMPLETE
1014,1014,0.44229820370674133,2026-03-14 02:29:24.722346,2026-03-14 02:29:38.478685,0 days 00:00:13.756339,tanh,0.0,3,0.6,COMPLETE
1015,1015,0.4532490074634552,2026-03-14 02:29:38.649465,2026-03-14 02:29:52.339875,0 days 00:00:13.690410,tanh,0.0,3,0.65,COMPLETE
1016,1016,0.4207673966884613,2026-03-14 02:29:52.501389,2026-03-14 02:30:06.043702,0 days 00:00:13.542313,tanh,0.0,3,0.6,COMPLETE
1017,1017,0.43023115396499634,2026-03-14 02:30:06.209185,2026-03-14 02:30:19.629728,0 days 00:00:13.420543,tanh,0.0,3,0.55,COMPLETE
1018,1018,0.44930365681648254,2026-03-14 02:30:19.787245,2026-03-14 02:30:33.177761,0 days 00:00:13.390516,tanh,0.0,3,0.65,COMPLETE
1019,1019,0.4672895073890686,2026-03-14 02:30:33.332803,2026-03-14 02:30:46.773355,0 days 00:00:13.440552,tanh,0.0,3,0.6,COMPLETE
1020,1020,0.48729002475738525,2026-03-14 02:30:46.953400,2026-03-14 02:31:00.829544,0 days 00:00:13.876144,tanh,0.05,3,0.65,COMPLETE
1021,1021,0.4753624498844147,2026-03-14 02:31:00.986569,2026-03-14 02:31:14.490883,0 days 00:00:13.504314,tanh,0.0,3,0.6,COMPLETE
1022,1022,0.45884445309638977,2026-03-14 02:31:14.655406,2026-03-14 02:31:28.311183,0 days 00:00:13.655777,tanh,0.0,3,0.65,COMPLETE
1023,1023,0.4666006565093994,2026-03-14 02:31:28.484229,2026-03-14 02:31:42.024924,0 days 00:00:13.540695,tanh,0.0,3,0.6,COMPLETE
1024,1024,0.45523542165756226,2026-03-14 02:31:42.185549,2026-03-14 02:31:55.981520,0 days 00:00:13.795971,relu,0.0,3,0.5,COMPLETE
1025,1025,0.5781217217445374,2026-03-14 02:31:56.152113,2026-03-14 02:32:09.792256,0 days 00:00:13.640143,tanh,0.0,3,0.65,COMPLETE
1026,1026,0.44664570689201355,2026-03-14 02:32:09.960290,2026-03-14 02:32:23.394614,0 days 00:00:13.434324,tanh,0.0,3,0.65,COMPLETE
1027,1027,0.48579275608062744,2026-03-14 02:32:23.561637,2026-03-14 02:32:37.347171,0 days 00:00:13.785534,tanh,0.05,3,0.6,COMPLETE
1028,1028,0.6450150609016418,2026-03-14 02:32:37.523222,2026-03-14 02:32:51.100527,0 days 00:00:13.577305,sigmoid,0.0,3,0.55,COMPLETE
1029,1029,0.46434351801872253,2026-03-14 02:32:51.461706,2026-03-14 02:33:04.998765,0 days 00:00:13.537059,tanh,0.0,3,0.75,COMPLETE
1030,1030,0.47177064418792725,2026-03-14 02:33:05.152745,2026-03-14 02:33:18.679011,0 days 00:00:13.526266,tanh,0.0,3,0.65,COMPLETE
1031,1031,0.4258183240890503,2026-03-14 02:33:18.853608,2026-03-14 02:33:32.392504,0 days 00:00:13.538896,tanh,0.0,3,0.6,COMPLETE
1032,1032,0.45680972933769226,2026-03-14 02:33:32.550128,2026-03-14 02:33:46.008164,0 days 00:00:13.458036,tanh,0.35000000000000003,2,0.65,COMPLETE
1033,1033,0.45613017678260803,2026-03-14 02:33:46.176709,2026-03-14 02:33:59.953416,0 days 00:00:13.776707,tanh,0.2,3,0.6,COMPLETE
1034,1034,0.49407699704170227,2026-03-14 02:34:00.114937,2026-03-14 02:34:13.627969,0 days 00:00:13.513032,tanh,0.0,3,0.65,COMPLETE
1035,1035,0.4941597878932953,2026-03-14 02:34:13.804519,2026-03-14 02:34:27.493261,0 days 00:00:13.688742,tanh,0.0,3,0.8500000000000001,COMPLETE
1036,1036,0.4689071774482727,2026-03-14 02:34:27.654354,2026-03-14 02:34:41.500254,0 days 00:00:13.845900,tanh,0.05,3,0.9,COMPLETE
1037,1037,0.4503130614757538,2026-03-14 02:34:41.660781,2026-03-14 02:34:55.143839,0 days 00:00:13.483058,tanh,0.0,3,0.5,COMPLETE
1038,1038,0.4569568932056427,2026-03-14 02:34:55.314965,2026-03-14 02:35:09.140225,0 days 00:00:13.825260,tanh,0.0,3,0.6,COMPLETE
1039,1039,0.46401771903038025,2026-03-14 02:35:09.304788,2026-03-14 02:35:22.801503,0 days 00:00:13.496715,tanh,0.0,3,0.8,COMPLETE
1040,1040,0.4634312689304352,2026-03-14 02:35:22.952022,2026-03-14 02:35:36.590466,0 days 00:00:13.638444,tanh,0.0,3,0.65,COMPLETE
1041,1041,0.4714166522026062,2026-03-14 02:35:36.746500,2026-03-14 02:35:50.251713,0 days 00:00:13.505213,tanh,0.0,3,0.65,COMPLETE
1042,1042,0.6073338389396667,2026-03-14 02:35:50.397229,2026-03-14 02:36:04.161665,0 days 00:00:13.764436,tanh,0.0,4,0.55,COMPLETE
1043,1043,0.4950387477874756,2026-03-14 02:36:04.306768,2026-03-14 02:36:17.901908,0 days 00:00:13.595140,relu,0.0,3,0.6,COMPLETE
1044,1044,0.45462748408317566,2026-03-14 02:36:18.050716,2026-03-14 02:36:31.984361,0 days 00:00:13.933645,tanh,0.05,3,0.65,COMPLETE
1045,1045,0.4736768901348114,2026-03-14 02:36:32.127985,2026-03-14 02:36:45.649199,0 days 00:00:13.521214,tanh,0.0,3,0.6,COMPLETE
1046,1046,0.5608024597167969,2026-03-14 02:36:45.804244,2026-03-14 02:36:59.382424,0 days 00:00:13.578180,tanh,0.0,3,0.65,COMPLETE
1047,1047,0.452974796295166,2026-03-14 02:36:59.558979,2026-03-14 02:37:13.344527,0 days 00:00:13.785548,tanh,0.0,3,0.6,COMPLETE
1048,1048,0.46224603056907654,2026-03-14 02:37:13.508064,2026-03-14 02:37:26.940050,0 days 00:00:13.431986,tanh,0.0,3,0.5,COMPLETE
1049,1049,0.5108196139335632,2026-03-14 02:37:27.102082,2026-03-14 02:37:40.798825,0 days 00:00:13.696743,tanh,0.15000000000000002,3,0.55,COMPLETE
1050,1050,0.4466762840747833,2026-03-14 02:37:40.953850,2026-03-14 02:37:54.591970,0 days 00:00:13.638120,tanh,0.0,3,0.65,COMPLETE
1051,1051,0.6436091065406799,2026-03-14 02:37:54.754326,2026-03-14 02:38:08.561331,0 days 00:00:13.807005,sigmoid,0.0,3,0.65,COMPLETE
1052,1052,0.4887821078300476,2026-03-14 02:38:08.720862,2026-03-14 02:38:22.237472,0 days 00:00:13.516610,tanh,0.0,3,0.6,COMPLETE
1053,1053,0.46181347966194153,2026-03-14 02:38:22.395984,2026-03-14 02:38:36.179178,0 days 00:00:13.783194,tanh,0.05,3,0.75,COMPLETE
1054,1054,0.4830749034881592,2026-03-14 02:38:36.340233,2026-03-14 02:38:49.727544,0 days 00:00:13.387311,tanh,0.0,3,0.65,COMPLETE
1055,1055,0.5297825932502747,2026-03-14 02:38:49.877082,2026-03-14 02:39:03.558467,0 days 00:00:13.681385,tanh,0.0,3,0.65,COMPLETE
1056,1056,0.41443175077438354,2026-03-14 02:39:03.720995,2026-03-14 02:39:17.223050,0 days 00:00:13.502055,tanh,0.0,3,0.6,COMPLETE
1057,1057,0.44290491938591003,2026-03-14 02:39:17.391081,2026-03-14 02:39:30.882569,0 days 00:00:13.491488,tanh,0.0,3,0.6,COMPLETE
1058,1058,0.48984766006469727,2026-03-14 02:39:31.039821,2026-03-14 02:39:44.306068,0 days 00:00:13.266247,tanh,0.0,2,0.6,COMPLETE
1059,1059,0.4661283493041992,2026-03-14 02:39:44.470621,2026-03-14 02:39:58.053605,0 days 00:00:13.582984,tanh,0.0,3,0.6,COMPLETE
1060,1060,0.4298211634159088,2026-03-14 02:39:58.220244,2026-03-14 02:40:12.166395,0 days 00:00:13.946151,tanh,0.05,3,0.6,COMPLETE
1061,1061,0.4884365200996399,2026-03-14 02:40:12.327301,2026-03-14 02:40:25.912567,0 days 00:00:13.585266,tanh,0.0,3,0.6,COMPLETE
1062,1062,0.4422520697116852,2026-03-14 02:40:26.064585,2026-03-14 02:40:39.690121,0 days 00:00:13.625536,tanh,0.0,3,0.6,COMPLETE
1063,1063,0.5215616822242737,2026-03-14 02:40:39.850142,2026-03-14 02:40:53.394960,0 days 00:00:13.544818,relu,0.0,3,0.6,COMPLETE
1064,1064,0.4383021593093872,2026-03-14 02:40:53.551985,2026-03-14 02:41:07.228739,0 days 00:00:13.676754,tanh,0.0,3,0.6,COMPLETE
1065,1065,0.4599563479423523,2026-03-14 02:41:07.394250,2026-03-14 02:41:21.449662,0 days 00:00:14.055412,tanh,0.5,3,0.6,COMPLETE
1066,1066,0.4563438892364502,2026-03-14 02:41:21.592174,2026-03-14 02:41:35.046721,0 days 00:00:13.454547,tanh,0.0,3,0.6,COMPLETE
1067,1067,0.4490262269973755,2026-03-14 02:41:35.245703,2026-03-14 02:41:48.590348,0 days 00:00:13.344645,tanh,0.0,3,0.6,COMPLETE
1068,1068,0.44694599509239197,2026-03-14 02:41:48.743373,2026-03-14 02:42:02.313764,0 days 00:00:13.570391,tanh,0.0,3,0.55,COMPLETE
1069,1069,0.43392226099967957,2026-03-14 02:42:02.462802,2026-03-14 02:42:16.440287,0 days 00:00:13.977485,tanh,0.05,3,0.6,COMPLETE
1070,1070,0.4712258279323578,2026-03-14 02:42:16.585321,2026-03-14 02:42:30.163300,0 days 00:00:13.577979,tanh,0.0,3,0.6,COMPLETE
1071,1071,0.4861452877521515,2026-03-14 02:42:30.308886,2026-03-14 02:42:43.950859,0 days 00:00:13.641973,tanh,0.0,3,0.55,COMPLETE
1072,1072,0.6438724994659424,2026-03-14 02:42:44.096856,2026-03-14 02:42:57.903663,0 days 00:00:13.806807,sigmoid,0.30000000000000004,3,0.6,COMPLETE
1073,1073,0.4596569836139679,2026-03-14 02:42:58.038190,2026-03-14 02:43:11.747509,0 days 00:00:13.709319,tanh,0.45,3,0.6,COMPLETE
1074,1074,0.4717075526714325,2026-03-14 02:43:11.898149,2026-03-14 02:43:25.851311,0 days 00:00:13.953162,tanh,0.0,4,0.6,COMPLETE
1075,1075,0.462539941072464,2026-03-14 02:43:25.996340,2026-03-14 02:43:39.580089,0 days 00:00:13.583749,tanh,0.0,3,0.55,COMPLETE
1076,1076,0.448660671710968,2026-03-14 02:43:39.717116,2026-03-14 02:43:53.270174,0 days 00:00:13.553058,tanh,0.0,3,0.6,COMPLETE
1077,1077,0.4646904766559601,2026-03-14 02:43:53.413215,2026-03-14 02:44:07.104190,0 days 00:00:13.690975,tanh,0.05,3,0.6,COMPLETE
1078,1078,0.4625189006328583,2026-03-14 02:44:07.250789,2026-03-14 02:44:20.883264,0 days 00:00:13.632475,tanh,0.0,3,0.5,COMPLETE
1079,1079,0.44999855756759644,2026-03-14 02:44:21.029505,2026-03-14 02:44:34.891825,0 days 00:00:13.862320,tanh,0.0,3,0.6,COMPLETE
1080,1080,0.4556674361228943,2026-03-14 02:44:35.033345,2026-03-14 02:44:48.603786,0 days 00:00:13.570441,tanh,0.0,3,0.55,COMPLETE
1081,1081,0.4758923351764679,2026-03-14 02:44:48.773820,2026-03-14 02:45:02.346506,0 days 00:00:13.572686,tanh,0.0,3,0.6,COMPLETE
1082,1082,0.45519912242889404,2026-03-14 02:45:02.491492,2026-03-14 02:45:16.187964,0 days 00:00:13.696472,tanh,0.0,3,0.75,COMPLETE
1083,1083,0.6970924139022827,2026-03-14 02:45:16.326486,2026-03-14 02:45:31.340773,0 days 00:00:15.014287,tanh,0.2,7,0.8,COMPLETE
1084,1084,0.4801838994026184,2026-03-14 02:45:31.480808,2026-03-14 02:45:45.241893,0 days 00:00:13.761085,tanh,0.05,3,0.6,COMPLETE
1085,1085,0.47392505407333374,2026-03-14 02:45:45.390928,2026-03-14 02:45:59.113760,0 days 00:00:13.722832,tanh,0.0,3,0.5,COMPLETE
1086,1086,0.4683188796043396,2026-03-14 02:45:59.261821,2026-03-14 02:46:12.874875,0 days 00:00:13.613054,relu,0.0,3,0.6,COMPLETE
1087,1087,0.47062453627586365,2026-03-14 02:46:13.013904,2026-03-14 02:46:26.846230,0 days 00:00:13.832326,tanh,0.0,2,0.95,COMPLETE
1088,1088,0.46591514348983765,2026-03-14 02:46:26.989747,2026-03-14 02:46:40.515495,0 days 00:00:13.525748,tanh,0.0,3,0.55,COMPLETE
1089,1089,0.4418941140174866,2026-03-14 02:46:40.653017,2026-03-14 02:46:54.342149,0 days 00:00:13.689132,tanh,0.0,3,0.6,COMPLETE
1090,1090,0.44775068759918213,2026-03-14 02:46:54.478662,2026-03-14 02:47:08.480909,0 days 00:00:14.002247,tanh,0.0,4,0.6,COMPLETE
1091,1091,0.4623596966266632,2026-03-14 02:47:08.624327,2026-03-14 02:47:22.178665,0 days 00:00:13.554338,tanh,0.0,3,0.6,COMPLETE
1092,1092,0.4898800253868103,2026-03-14 02:47:22.324545,2026-03-14 02:47:36.199690,0 days 00:00:13.875145,tanh,0.0,3,0.6,COMPLETE
1093,1093,0.4658368229866028,2026-03-14 02:47:36.346209,2026-03-14 02:47:49.916097,0 days 00:00:13.569888,tanh,0.05,3,0.5,COMPLETE
1094,1094,0.6416835784912109,2026-03-14 02:47:50.094708,2026-03-14 02:48:03.718492,0 days 00:00:13.623784,sigmoid,0.0,3,0.55,COMPLETE
1095,1095,0.46583399176597595,2026-03-14 02:48:03.862512,2026-03-14 02:48:17.521897,0 days 00:00:13.659385,tanh,0.0,3,0.65,COMPLETE
1096,1096,0.5429986119270325,2026-03-14 02:48:17.668417,2026-03-14 02:48:31.607845,0 days 00:00:13.939428,tanh,0.0,3,0.6,COMPLETE
1097,1097,0.46303895115852356,2026-03-14 02:48:31.754382,2026-03-14 02:48:45.325777,0 days 00:00:13.571395,tanh,0.0,3,0.65,COMPLETE
1098,1098,0.4716129004955292,2026-03-14 02:48:45.474293,2026-03-14 02:48:59.300756,0 days 00:00:13.826463,tanh,0.05,3,0.6,COMPLETE
1099,1099,0.4743380844593048,2026-03-14 02:48:59.439778,2026-03-14 02:49:13.110252,0 days 00:00:13.670474,tanh,0.0,3,0.6,COMPLETE
1100,1100,0.4670352637767792,2026-03-14 02:49:13.252335,2026-03-14 02:49:26.904827,0 days 00:00:13.652492,tanh,0.0,3,0.65,COMPLETE
1101,1101,0.4967072308063507,2026-03-14 02:49:27.050863,2026-03-14 02:49:40.921925,0 days 00:00:13.871062,tanh,0.0,3,0.8,COMPLETE
1102,1102,0.4392126202583313,2026-03-14 02:49:41.094496,2026-03-14 02:49:54.833126,0 days 00:00:13.738630,tanh,0.0,3,0.55,COMPLETE
1103,1103,0.4690600335597992,2026-03-14 02:49:54.995242,2026-03-14 02:50:08.654461,0 days 00:00:13.659219,tanh,0.0,3,0.5,COMPLETE
1104,1104,0.4735458791255951,2026-03-14 02:50:08.810014,2026-03-14 02:50:22.360913,0 days 00:00:13.550899,tanh,0.0,3,0.6,COMPLETE
1105,1105,0.4832589030265808,2026-03-14 02:50:22.519459,2026-03-14 02:50:36.127141,0 days 00:00:13.607682,tanh,0.0,3,0.65,COMPLETE
1106,1106,0.49269840121269226,2026-03-14 02:50:36.466912,2026-03-14 02:50:49.664205,0 days 00:00:13.197293,tanh,0.0,2,0.65,COMPLETE
1107,1107,0.5267002582550049,2026-03-14 02:50:49.814381,2026-03-14 02:51:03.763286,0 days 00:00:13.948905,relu,0.1,3,0.6,COMPLETE
1108,1108,0.43599817156791687,2026-03-14 02:51:03.918314,2026-03-14 02:51:17.664275,0 days 00:00:13.745961,tanh,0.0,3,0.75,COMPLETE
1109,1109,0.4438800513744354,2026-03-14 02:51:17.816298,2026-03-14 02:51:31.425390,0 days 00:00:13.609092,tanh,0.0,3,0.65,COMPLETE
1110,1110,0.41892537474632263,2026-03-14 02:51:31.569918,2026-03-14 02:51:45.795756,0 days 00:00:14.225838,tanh,0.05,4,0.6,COMPLETE
1111,1111,0.43955737352371216,2026-03-14 02:51:45.949294,2026-03-14 02:51:59.969958,0 days 00:00:14.020664,tanh,0.05,4,0.6,COMPLETE
1112,1112,0.6612243056297302,2026-03-14 02:52:00.127494,2026-03-14 02:52:14.380778,0 days 00:00:14.253284,tanh,0.1,5,0.65,COMPLETE
1113,1113,0.46059826016426086,2026-03-14 02:52:14.534295,2026-03-14 02:52:28.615110,0 days 00:00:14.080815,tanh,0.1,4,0.5,COMPLETE
1114,1114,0.6417054533958435,2026-03-14 02:52:28.778158,2026-03-14 02:52:43.230607,0 days 00:00:14.452449,tanh,0.1,5,0.65,COMPLETE
1115,1115,0.45839565992355347,2026-03-14 02:52:43.368134,2026-03-14 02:52:57.517992,0 days 00:00:14.149858,tanh,0.05,4,0.6,COMPLETE
1116,1116,0.6436082124710083,2026-03-14 02:52:57.678853,2026-03-14 02:53:11.753679,0 days 00:00:14.074826,sigmoid,0.05,4,0.55,COMPLETE
1117,1117,0.6466452479362488,2026-03-14 02:53:11.919051,2026-03-14 02:53:26.289380,0 days 00:00:14.370329,tanh,0.05,5,0.65,COMPLETE
1118,1118,0.43707823753356934,2026-03-14 02:53:26.435905,2026-03-14 02:53:41.163112,0 days 00:00:14.727207,tanh,0.1,5,1.0,COMPLETE
1119,1119,0.448044091463089,2026-03-14 02:53:41.347137,2026-03-14 02:53:55.369802,0 days 00:00:14.022665,tanh,0.05,4,0.55,COMPLETE
1120,1120,0.45910900831222534,2026-03-14 02:53:55.534842,2026-03-14 02:54:09.568842,0 days 00:00:14.034000,tanh,0.05,4,0.6,COMPLETE
1121,1121,0.4392451047897339,2026-03-14 02:54:09.724838,2026-03-14 02:54:23.880226,0 days 00:00:14.155388,tanh,0.05,4,0.65,COMPLETE
1122,1122,0.4833083152770996,2026-03-14 02:54:24.055272,2026-03-14 02:54:37.767032,0 days 00:00:13.711760,tanh,0.1,2,0.6,COMPLETE
1123,1123,0.47404879331588745,2026-03-14 02:54:37.923560,2026-03-14 02:54:51.961934,0 days 00:00:14.038374,tanh,0.05,4,0.65,COMPLETE
1124,1124,0.4954221248626709,2026-03-14 02:54:52.102445,2026-03-14 02:55:05.614946,0 days 00:00:13.512501,tanh,0.05,2,0.6,COMPLETE
1125,1125,0.5048399567604065,2026-03-14 02:55:05.777984,2026-03-14 02:55:19.990778,0 days 00:00:14.212794,tanh,0.1,4,0.5,COMPLETE
1126,1126,0.4199126362800598,2026-03-14 02:55:20.145892,2026-03-14 02:55:33.957232,0 days 00:00:13.811340,tanh,0.0,3,0.65,COMPLETE
1127,1127,0.4525979459285736,2026-03-14 02:55:34.109757,2026-03-14 02:55:47.929870,0 days 00:00:13.820113,tanh,0.05,3,0.65,COMPLETE
1128,1128,0.4256336987018585,2026-03-14 02:55:48.085455,2026-03-14 02:56:01.676808,0 days 00:00:13.591353,tanh,0.0,3,0.65,COMPLETE
1129,1129,0.44883185625076294,2026-03-14 02:56:01.831331,2026-03-14 02:56:15.321765,0 days 00:00:13.490434,tanh,0.0,3,0.65,COMPLETE
1130,1130,0.4509577453136444,2026-03-14 02:56:15.475281,2026-03-14 02:56:29.059729,0 days 00:00:13.584448,tanh,0.0,3,0.65,COMPLETE
1131,1131,0.5715593099594116,2026-03-14 02:56:29.210448,2026-03-14 02:56:43.410044,0 days 00:00:14.199596,relu,0.15000000000000002,3,0.65,COMPLETE
1132,1132,0.4541333317756653,2026-03-14 02:56:43.592317,2026-03-14 02:56:57.656680,0 days 00:00:14.064363,tanh,0.05,4,0.65,COMPLETE
1133,1133,0.47312217950820923,2026-03-14 02:56:57.806347,2026-03-14 02:57:11.420930,0 days 00:00:13.614583,tanh,0.0,3,0.65,COMPLETE
1134,1134,0.48491916060447693,2026-03-14 02:57:11.581234,2026-03-14 02:57:25.302042,0 days 00:00:13.720808,tanh,0.0,3,0.7,COMPLETE
1135,1135,0.4764603078365326,2026-03-14 02:57:25.474086,2026-03-14 02:57:39.199337,0 days 00:00:13.725251,tanh,0.0,3,0.65,COMPLETE
1136,1136,0.4362640380859375,2026-03-14 02:57:39.329871,2026-03-14 02:57:52.789969,0 days 00:00:13.460098,tanh,0.0,3,0.65,COMPLETE
1137,1137,0.405834823846817,2026-03-14 02:57:52.983872,2026-03-14 02:58:06.643450,0 days 00:00:13.659578,tanh,0.0,3,0.65,COMPLETE
1138,1138,0.5417881608009338,2026-03-14 02:58:06.806488,2026-03-14 02:58:20.217524,0 days 00:00:13.411036,tanh,0.0,3,0.7,COMPLETE
1139,1139,0.642187237739563,2026-03-14 02:58:20.396809,2026-03-14 02:58:34.182789,0 days 00:00:13.785980,sigmoid,0.0,3,0.65,COMPLETE
1140,1140,0.4887220561504364,2026-03-14 02:58:34.341951,2026-03-14 02:58:48.054154,0 days 00:00:13.712203,tanh,0.0,3,0.65,COMPLETE
1141,1141,0.4464777708053589,2026-03-14 02:58:48.195243,2026-03-14 02:59:01.789897,0 days 00:00:13.594654,tanh,0.0,3,0.65,COMPLETE
1142,1142,0.45725753903388977,2026-03-14 02:59:01.925412,2026-03-14 02:59:15.910998,0 days 00:00:13.985586,tanh,0.15000000000000002,3,0.7,COMPLETE
1143,1143,0.4342321455478668,2026-03-14 02:59:16.062528,2026-03-14 02:59:29.923527,0 days 00:00:13.860999,tanh,0.05,3,0.65,COMPLETE
1144,1144,0.42882609367370605,2026-03-14 02:59:30.074998,2026-03-14 02:59:43.788367,0 days 00:00:13.713369,tanh,0.0,3,0.65,COMPLETE
1145,1145,0.43252232670783997,2026-03-14 02:59:43.962934,2026-03-14 02:59:57.586111,0 days 00:00:13.623177,tanh,0.0,3,0.65,COMPLETE
1146,1146,0.6471112966537476,2026-03-14 02:59:57.756209,2026-03-14 03:00:11.824983,0 days 00:00:14.068774,tanh,0.0,5,0.65,COMPLETE
1147,1147,0.45646950602531433,2026-03-14 03:00:11.981831,2026-03-14 03:00:25.686695,0 days 00:00:13.704864,tanh,0.0,3,0.65,COMPLETE
1148,1148,0.4797670841217041,2026-03-14 03:00:25.827208,2026-03-14 03:00:39.792662,0 days 00:00:13.965454,tanh,0.0,3,0.8,COMPLETE
1149,1149,0.45376402139663696,2026-03-14 03:00:39.938180,2026-03-14 03:00:53.721256,0 days 00:00:13.783076,tanh,0.0,3,0.7,COMPLETE
1150,1150,0.4639873206615448,2026-03-14 03:00:53.855284,2026-03-14 03:01:07.713846,0 days 00:00:13.858562,tanh,0.05,3,0.75,COMPLETE
1151,1151,0.46345025300979614,2026-03-14 03:01:07.857570,2026-03-14 03:01:21.144750,0 days 00:00:13.287180,tanh,0.0,2,0.65,COMPLETE
1152,1152,0.4694936275482178,2026-03-14 03:01:21.289868,2026-03-14 03:01:34.968618,0 days 00:00:13.678750,relu,0.0,3,0.65,COMPLETE
1153,1153,0.4475255608558655,2026-03-14 03:01:35.127343,2026-03-14 03:01:48.711544,0 days 00:00:13.584201,tanh,0.0,3,0.5,COMPLETE
1154,1154,0.44926685094833374,2026-03-14 03:01:48.854058,2026-03-14 03:02:02.428422,0 days 00:00:13.574364,tanh,0.0,3,0.65,COMPLETE
1155,1155,0.4650683104991913,2026-03-14 03:02:02.578941,2026-03-14 03:02:16.310242,0 days 00:00:13.731301,tanh,0.0,3,0.65,COMPLETE
1156,1156,0.4719277322292328,2026-03-14 03:02:16.458268,2026-03-14 03:02:30.376158,0 days 00:00:13.917890,tanh,0.05,3,0.7,COMPLETE
1157,1157,0.47876617312431335,2026-03-14 03:02:30.525771,2026-03-14 03:02:44.378592,0 days 00:00:13.852821,tanh,0.0,3,0.65,COMPLETE
1158,1158,0.4386358857154846,2026-03-14 03:02:44.524107,2026-03-14 03:02:58.173735,0 days 00:00:13.649628,tanh,0.0,4,0.8500000000000001,COMPLETE
1159,1159,0.4583432376384735,2026-03-14 03:02:58.323255,2026-03-14 03:03:11.848494,0 days 00:00:13.525239,tanh,0.0,3,0.65,COMPLETE
1160,1160,0.43795669078826904,2026-03-14 03:03:12.003520,2026-03-14 03:03:25.900867,0 days 00:00:13.897347,tanh,0.1,3,0.65,COMPLETE
1161,1161,0.6449323296546936,2026-03-14 03:03:26.063468,2026-03-14 03:03:39.814101,0 days 00:00:13.750633,sigmoid,0.0,3,0.5,COMPLETE
1162,1162,0.4446737468242645,2026-03-14 03:03:39.953619,2026-03-14 03:03:53.736847,0 days 00:00:13.783228,tanh,0.0,3,0.65,COMPLETE
1163,1163,0.44760239124298096,2026-03-14 03:03:53.992827,2026-03-14 03:04:07.535807,0 days 00:00:13.542980,tanh,0.0,3,0.7,COMPLETE
