,number,value,datetime_start,datetime_complete,duration,params_activation,params_dropout,params_layers,params_shrink,state
1657,1657,0.42814120650291443,2026-03-14 04:59:34.673280,2026-03-14 04:59:48.534555,0 days 00:00:13.861275,tanh,0.0,3,0.5,COMPLETE
1658,1658,0.4435443580150604,2026-03-14 04:59:48.681582,2026-03-14 05:00:02.640106,0 days 00:00:13.958524,tanh,0.0,3,0.5,COMPLETE
1659,1659,0.42914751172065735,2026-03-14 05:00:02.806133,2026-03-14 05:00:16.754604,0 days 00:00:13.948471,tanh,0.0,3,0.5,COMPLETE
1660,1660,0.5122825503349304,2026-03-14 05:00:16.905653,2026-03-14 05:00:30.881055,0 days 00:00:13.975402,relu,0.0,3,0.5,COMPLETE
1661,1661,0.43967995047569275,2026-03-14 05:00:31.039083,2026-03-14 05:00:44.754623,0 days 00:00:13.715540,tanh,0.0,3,0.75,COMPLETE
1662,1662,0.4443517029285431,2026-03-14 05:00:44.924510,2026-03-14 05:00:59.219444,0 days 00:00:14.294934,tanh,0.0,3,0.5,COMPLETE
1663,1663,0.46045729517936707,2026-03-14 05:00:59.370959,2026-03-14 05:01:13.096086,0 days 00:00:13.725127,tanh,0.0,3,0.5,COMPLETE
1664,1664,0.42388367652893066,2026-03-14 05:01:13.246196,2026-03-14 05:01:27.174097,0 days 00:00:13.927901,tanh,0.0,3,0.5,COMPLETE
1665,1665,0.4619634747505188,2026-03-14 05:01:27.322613,2026-03-14 05:01:41.085544,0 days 00:00:13.762931,tanh,0.0,3,0.5,COMPLETE
1666,1666,0.46956396102905273,2026-03-14 05:01:41.369164,2026-03-14 05:01:55.268119,0 days 00:00:13.898955,tanh,0.0,3,0.5,COMPLETE
1667,1667,0.42030584812164307,2026-03-14 05:01:55.403631,2026-03-14 05:02:09.075463,0 days 00:00:13.671832,tanh,0.0,3,0.5,COMPLETE
1668,1668,0.46317213773727417,2026-03-14 05:02:09.225059,2026-03-14 05:02:22.946792,0 days 00:00:13.721733,tanh,0.0,3,0.5,COMPLETE
1669,1669,0.43350088596343994,2026-03-14 05:02:23.102419,2026-03-14 05:02:37.039085,0 days 00:00:13.936666,tanh,0.0,3,0.5,COMPLETE
1670,1670,0.47306764125823975,2026-03-14 05:02:37.193622,2026-03-14 05:02:51.027162,0 days 00:00:13.833540,tanh,0.0,3,0.5,COMPLETE
1671,1671,0.6316845417022705,2026-03-14 05:02:51.206495,2026-03-14 05:03:05.678079,0 days 00:00:14.471584,tanh,0.0,7,0.5,COMPLETE
1672,1672,0.6424546837806702,2026-03-14 05:03:05.824597,2026-03-14 05:03:19.675849,0 days 00:00:13.851252,sigmoid,0.0,3,0.5,COMPLETE
1673,1673,0.4634843170642853,2026-03-14 05:03:20.027234,2026-03-14 05:03:33.880821,0 days 00:00:13.853587,tanh,0.0,3,0.5,COMPLETE
1674,1674,0.4504219889640808,2026-03-14 05:03:34.023318,2026-03-14 05:03:47.800896,0 days 00:00:13.777578,tanh,0.0,3,0.5,COMPLETE
1675,1675,0.4282190203666687,2026-03-14 05:03:47.945415,2026-03-14 05:04:02.084198,0 days 00:00:14.138783,tanh,0.0,4,0.5,COMPLETE
1676,1676,0.4705007076263428,2026-03-14 05:04:02.232380,2026-03-14 05:04:16.118739,0 days 00:00:13.886359,tanh,0.0,3,0.5,COMPLETE
1677,1677,0.4773600399494171,2026-03-14 05:04:16.265524,2026-03-14 05:04:29.838190,0 days 00:00:13.572666,tanh,0.0,3,0.5,COMPLETE
1678,1678,0.4938238561153412,2026-03-14 05:04:29.999646,2026-03-14 05:04:43.937456,0 days 00:00:13.937810,tanh,0.0,3,0.5,COMPLETE
1679,1679,0.4842521548271179,2026-03-14 05:04:44.078050,2026-03-14 05:04:57.990757,0 days 00:00:13.912707,tanh,0.0,3,0.5,COMPLETE
1680,1680,0.47097575664520264,2026-03-14 05:04:58.338423,2026-03-14 05:05:12.242895,0 days 00:00:13.904472,tanh,0.35000000000000003,2,0.5,COMPLETE
1681,1681,0.44002392888069153,2026-03-14 05:05:12.397924,2026-03-14 05:05:26.214236,0 days 00:00:13.816312,tanh,0.0,3,0.5,COMPLETE
1682,1682,0.5875680446624756,2026-03-14 05:05:26.355793,2026-03-14 05:05:40.408716,0 days 00:00:14.052923,relu,0.5,3,0.5,COMPLETE
1683,1683,0.4789379835128784,2026-03-14 05:05:40.553268,2026-03-14 05:05:54.762101,0 days 00:00:14.208833,tanh,0.0,3,0.5,COMPLETE
1684,1684,0.4325067400932312,2026-03-14 05:05:54.906996,2026-03-14 05:06:08.743127,0 days 00:00:13.836131,tanh,0.0,3,0.5,COMPLETE
1685,1685,0.45980018377304077,2026-03-14 05:06:08.885648,2026-03-14 05:06:22.704529,0 days 00:00:13.818881,tanh,0.0,3,0.5,COMPLETE
1686,1686,0.4664627015590668,2026-03-14 05:06:22.853064,2026-03-14 05:06:36.850243,0 days 00:00:13.997179,tanh,0.0,3,0.5,COMPLETE
1687,1687,0.49747538566589355,2026-03-14 05:06:36.996257,2026-03-14 05:06:50.805697,0 days 00:00:13.809440,tanh,0.0,3,0.5,COMPLETE
1688,1688,0.48472923040390015,2026-03-14 05:06:50.952721,2026-03-14 05:07:05.113706,0 days 00:00:14.160985,tanh,0.0,3,0.5,COMPLETE
1689,1689,0.45684194564819336,2026-03-14 05:07:05.264836,2026-03-14 05:07:19.328654,0 days 00:00:14.063818,tanh,0.30000000000000004,3,0.5,COMPLETE
1690,1690,0.42976611852645874,2026-03-14 05:07:19.474167,2026-03-14 05:07:33.583584,0 days 00:00:14.109417,tanh,0.0,3,0.5,COMPLETE
1691,1691,0.5161382555961609,2026-03-14 05:07:33.740613,2026-03-14 05:07:47.676981,0 days 00:00:13.936368,tanh,0.0,3,0.5,COMPLETE
1692,1692,0.6456169486045837,2026-03-14 05:07:47.815326,2026-03-14 05:08:01.566490,0 days 00:00:13.751164,sigmoid,0.0,3,0.5,COMPLETE
1693,1693,0.47934064269065857,2026-03-14 05:08:01.715661,2026-03-14 05:08:15.489162,0 days 00:00:13.773501,tanh,0.0,3,0.5,COMPLETE
1694,1694,0.4567817151546478,2026-03-14 05:08:15.627672,2026-03-14 05:08:29.536115,0 days 00:00:13.908443,tanh,0.0,3,0.5,COMPLETE
1695,1695,0.47313860058784485,2026-03-14 05:08:29.685472,2026-03-14 05:08:43.496807,0 days 00:00:13.811335,tanh,0.0,3,0.5,COMPLETE
1696,1696,0.4779767692089081,2026-03-14 05:08:43.641356,2026-03-14 05:08:57.549045,0 days 00:00:13.907689,tanh,0.0,3,0.5,COMPLETE
1697,1697,0.45879897475242615,2026-03-14 05:08:57.696068,2026-03-14 05:09:11.664458,0 days 00:00:13.968390,tanh,0.0,3,0.5,COMPLETE
1698,1698,0.4725123345851898,2026-03-14 05:09:11.804486,2026-03-14 05:09:25.829895,0 days 00:00:14.025409,tanh,0.05,3,0.5,COMPLETE
1699,1699,0.43056976795196533,2026-03-14 05:09:25.981413,2026-03-14 05:09:39.855401,0 days 00:00:13.873988,tanh,0.0,3,0.5,COMPLETE
1700,1700,0.45476362109184265,2026-03-14 05:09:40.000937,2026-03-14 05:09:53.820603,0 days 00:00:13.819666,tanh,0.0,3,0.5,COMPLETE
1701,1701,0.41075196862220764,2026-03-14 05:09:53.956116,2026-03-14 05:10:07.791247,0 days 00:00:13.835131,tanh,0.0,3,0.5,COMPLETE
1702,1702,0.4667738974094391,2026-03-14 05:10:07.940369,2026-03-14 05:10:21.917444,0 days 00:00:13.977075,tanh,0.0,3,0.5,COMPLETE
1703,1703,0.48887190222740173,2026-03-14 05:10:22.053478,2026-03-14 05:10:35.885183,0 days 00:00:13.831705,tanh,0.0,3,0.5,COMPLETE
1704,1704,0.48385822772979736,2026-03-14 05:10:36.022048,2026-03-14 05:10:50.064902,0 days 00:00:14.042854,relu,0.0,3,0.5,COMPLETE
1705,1705,0.42050856351852417,2026-03-14 05:10:50.198520,2026-03-14 05:11:04.175722,0 days 00:00:13.977202,tanh,0.0,3,0.5,COMPLETE
1706,1706,0.46840357780456543,2026-03-14 05:11:04.311232,2026-03-14 05:11:18.099406,0 days 00:00:13.788174,tanh,0.0,3,0.5,COMPLETE
1707,1707,0.4859631359577179,2026-03-14 05:11:18.244048,2026-03-14 05:11:32.458063,0 days 00:00:14.214015,tanh,0.05,3,0.5,COMPLETE
1708,1708,0.50664883852005,2026-03-14 05:11:32.598620,2026-03-14 05:11:46.713301,0 days 00:00:14.114681,tanh,0.2,2,0.5,COMPLETE
1709,1709,0.4343504011631012,2026-03-14 05:11:46.856821,2026-03-14 05:12:00.666419,0 days 00:00:13.809598,tanh,0.0,4,0.5,COMPLETE
1710,1710,0.48260754346847534,2026-03-14 05:12:00.807970,2026-03-14 05:12:14.456813,0 days 00:00:13.648843,tanh,0.0,3,0.5,COMPLETE
1711,1711,0.45422089099884033,2026-03-14 05:12:14.600585,2026-03-14 05:12:28.864559,0 days 00:00:14.263974,tanh,0.05,3,0.5,COMPLETE
1712,1712,0.4466628432273865,2026-03-14 05:12:29.022169,2026-03-14 05:12:42.587233,0 days 00:00:13.565064,tanh,0.0,3,0.5,COMPLETE
1713,1713,0.642026424407959,2026-03-14 05:12:42.734772,2026-03-14 05:12:56.570330,0 days 00:00:13.835558,sigmoid,0.0,3,0.5,COMPLETE
1714,1714,0.4410930275917053,2026-03-14 05:12:56.722357,2026-03-14 05:13:10.706466,0 days 00:00:13.984109,tanh,0.0,3,0.5,COMPLETE
1715,1715,0.4891160726547241,2026-03-14 05:13:10.845009,2026-03-14 05:13:24.758448,0 days 00:00:13.913439,tanh,0.0,3,0.5,COMPLETE
1716,1716,0.4456431269645691,2026-03-14 05:13:24.897978,2026-03-14 05:13:38.768599,0 days 00:00:13.870621,tanh,0.0,3,0.5,COMPLETE
1717,1717,0.46560245752334595,2026-03-14 05:13:38.927130,2026-03-14 05:13:52.681994,0 days 00:00:13.754864,tanh,0.0,3,0.5,COMPLETE
1718,1718,0.4436400532722473,2026-03-14 05:13:52.829960,2026-03-14 05:14:06.937549,0 days 00:00:14.107589,tanh,0.0,3,0.5,COMPLETE
1719,1719,0.6497848033905029,2026-03-14 05:14:07.079250,2026-03-14 05:14:21.855396,0 days 00:00:14.776146,tanh,0.05,6,0.5,COMPLETE
1720,1720,0.4465789794921875,2026-03-14 05:14:21.994922,2026-03-14 05:14:35.902181,0 days 00:00:13.907259,tanh,0.0,3,0.5,COMPLETE
1721,1721,0.4969576299190521,2026-03-14 05:14:36.047702,2026-03-14 05:14:50.308888,0 days 00:00:14.261186,tanh,0.15000000000000002,3,0.5,COMPLETE
1722,1722,0.5198080539703369,2026-03-14 05:14:50.452403,2026-03-14 05:15:04.311753,0 days 00:00:13.859350,tanh,0.0,3,0.5,COMPLETE
1723,1723,0.4182312488555908,2026-03-14 05:15:04.528780,2026-03-14 05:15:18.202762,0 days 00:00:13.673982,tanh,0.0,3,0.5,COMPLETE
1724,1724,0.48146525025367737,2026-03-14 05:15:18.341329,2026-03-14 05:15:32.349549,0 days 00:00:14.008220,tanh,0.0,3,0.5,COMPLETE
1725,1725,0.47151559591293335,2026-03-14 05:15:32.494063,2026-03-14 05:15:46.350888,0 days 00:00:13.856825,tanh,0.0,3,0.5,COMPLETE
1726,1726,0.5091311931610107,2026-03-14 05:15:46.499401,2026-03-14 05:15:59.844124,0 days 00:00:13.344723,tanh,0.0,2,0.5,COMPLETE
1727,1727,0.5041581392288208,2026-03-14 05:15:59.995688,2026-03-14 05:16:13.900256,0 days 00:00:13.904568,relu,0.0,3,0.5,COMPLETE
1728,1728,0.47052890062332153,2026-03-14 05:16:14.037778,2026-03-14 05:16:28.128871,0 days 00:00:14.091093,tanh,0.05,3,0.5,COMPLETE
1729,1729,0.4602346122264862,2026-03-14 05:16:28.275009,2026-03-14 05:16:42.135882,0 days 00:00:13.860873,tanh,0.0,3,0.5,COMPLETE
1730,1730,0.4670652449131012,2026-03-14 05:16:42.283839,2026-03-14 05:16:56.339082,0 days 00:00:14.055243,tanh,0.0,3,0.5,COMPLETE
1731,1731,0.4348277747631073,2026-03-14 05:16:56.481902,2026-03-14 05:17:10.516775,0 days 00:00:14.034873,tanh,0.0,3,0.5,COMPLETE
1732,1732,0.4307847023010254,2026-03-14 05:17:10.654026,2026-03-14 05:17:24.865797,0 days 00:00:14.211771,tanh,0.0,4,0.5,COMPLETE
1733,1733,0.44566264748573303,2026-03-14 05:17:24.998428,2026-03-14 05:17:38.861124,0 days 00:00:13.862696,tanh,0.0,3,0.55,COMPLETE
1734,1734,0.5090287327766418,2026-03-14 05:17:38.996645,2026-03-14 05:17:52.900211,0 days 00:00:13.903566,tanh,0.0,3,0.5,COMPLETE
1735,1735,0.6417279243469238,2026-03-14 05:17:53.036728,2026-03-14 05:18:07.120665,0 days 00:00:14.083937,sigmoid,0.0,3,0.5,COMPLETE
1736,1736,0.44278788566589355,2026-03-14 05:18:07.257418,2026-03-14 05:18:21.218065,0 days 00:00:13.960647,tanh,0.0,3,0.55,COMPLETE
1737,1737,0.5060890913009644,2026-03-14 05:18:21.358679,2026-03-14 05:18:35.343177,0 days 00:00:13.984498,tanh,0.0,3,0.55,COMPLETE
1738,1738,0.45483851432800293,2026-03-14 05:18:35.482702,2026-03-14 05:18:49.627197,0 days 00:00:14.144495,tanh,0.4,3,0.5,COMPLETE
1739,1739,0.4705715775489807,2026-03-14 05:18:49.769744,2026-03-14 05:19:03.514367,0 days 00:00:13.744623,tanh,0.0,3,0.55,COMPLETE
1740,1740,0.4541853070259094,2026-03-14 05:19:03.659403,2026-03-14 05:19:17.960443,0 days 00:00:14.301040,tanh,0.05,3,0.5,COMPLETE
1741,1741,0.4283458888530731,2026-03-14 05:19:18.114958,2026-03-14 05:19:31.899913,0 days 00:00:13.784955,tanh,0.0,3,0.5,COMPLETE
1742,1742,0.4597218632698059,2026-03-14 05:19:32.046439,2026-03-14 05:19:46.062543,0 days 00:00:14.016104,tanh,0.30000000000000004,3,0.55,COMPLETE
1743,1743,0.4730033874511719,2026-03-14 05:19:46.213069,2026-03-14 05:20:00.142868,0 days 00:00:13.929799,tanh,0.0,3,0.5,COMPLETE
1744,1744,0.4279644787311554,2026-03-14 05:20:00.280481,2026-03-14 05:20:14.168030,0 days 00:00:13.887549,tanh,0.0,3,0.8,COMPLETE
1745,1745,0.4214492440223694,2026-03-14 05:20:14.311057,2026-03-14 05:20:28.094801,0 days 00:00:13.783744,tanh,0.0,3,0.55,COMPLETE
1746,1746,0.4383789598941803,2026-03-14 05:20:28.523934,2026-03-14 05:20:42.558080,0 days 00:00:14.034146,tanh,0.0,3,0.8500000000000001,COMPLETE
1747,1747,0.45932266116142273,2026-03-14 05:20:42.690847,2026-03-14 05:20:56.368556,0 days 00:00:13.677709,tanh,0.0,3,0.5,COMPLETE
1748,1748,0.4807780683040619,2026-03-14 05:20:56.525098,2026-03-14 05:21:10.811023,0 days 00:00:14.285925,relu,0.0,3,0.55,COMPLETE
1749,1749,0.477343887090683,2026-03-14 05:21:10.961055,2026-03-14 05:21:24.909872,0 days 00:00:13.948817,tanh,0.0,2,0.5,COMPLETE
1750,1750,0.4485549032688141,2026-03-14 05:21:25.054321,2026-03-14 05:21:39.217884,0 days 00:00:14.163563,tanh,0.05,3,0.55,COMPLETE
1751,1751,0.5028077363967896,2026-03-14 05:21:39.356528,2026-03-14 05:21:53.281151,0 days 00:00:13.924623,tanh,0.0,3,0.5,COMPLETE
1752,1752,0.48003751039505005,2026-03-14 05:21:53.422692,2026-03-14 05:22:07.428260,0 days 00:00:14.005568,tanh,0.0,3,0.55,COMPLETE
1753,1753,0.4737008512020111,2026-03-14 05:22:07.585858,2026-03-14 05:22:21.612475,0 days 00:00:14.026617,tanh,0.0,3,0.5,COMPLETE
1754,1754,0.48110631108283997,2026-03-14 05:22:21.754993,2026-03-14 05:22:35.665778,0 days 00:00:13.910785,tanh,0.0,3,0.5,COMPLETE
1755,1755,0.4574027955532074,2026-03-14 05:22:35.807752,2026-03-14 05:22:49.858467,0 days 00:00:14.050715,tanh,0.05,3,0.65,COMPLETE
1756,1756,0.4696696698665619,2026-03-14 05:22:49.996985,2026-03-14 05:23:03.908644,0 days 00:00:13.911659,tanh,0.0,3,0.8,COMPLETE
1757,1757,0.6451455354690552,2026-03-14 05:23:04.055667,2026-03-14 05:23:17.781631,0 days 00:00:13.725964,sigmoid,0.0,3,0.55,COMPLETE
1758,1758,0.6414167881011963,2026-03-14 05:23:17.974658,2026-03-14 05:23:31.740349,0 days 00:00:13.765691,tanh,0.0,4,0.55,COMPLETE
1759,1759,0.45137813687324524,2026-03-14 05:23:31.895865,2026-03-14 05:23:45.848489,0 days 00:00:13.952624,tanh,0.0,3,0.65,COMPLETE
1760,1760,0.49712520837783813,2026-03-14 05:23:45.980698,2026-03-14 05:24:00.042874,0 days 00:00:14.062176,tanh,0.0,3,0.5,COMPLETE
1761,1761,0.4308002293109894,2026-03-14 05:24:00.216478,2026-03-14 05:24:13.993461,0 days 00:00:13.776983,tanh,0.0,3,0.65,COMPLETE
1762,1762,0.4872328042984009,2026-03-14 05:24:14.141443,2026-03-14 05:24:28.022967,0 days 00:00:13.881524,tanh,0.0,3,0.5,COMPLETE
1763,1763,0.454025000333786,2026-03-14 05:24:28.196056,2026-03-14 05:24:42.205163,0 days 00:00:14.009107,tanh,0.0,3,0.65,COMPLETE
1764,1764,0.47208619117736816,2026-03-14 05:24:42.348675,2026-03-14 05:24:56.588382,0 days 00:00:14.239707,tanh,0.05,3,0.8500000000000001,COMPLETE
1765,1765,0.49094629287719727,2026-03-14 05:24:56.747903,2026-03-14 05:25:10.635552,0 days 00:00:13.887649,tanh,0.0,3,0.65,COMPLETE
1766,1766,0.6800843477249146,2026-03-14 05:25:10.791586,2026-03-14 05:25:25.568385,0 days 00:00:14.776799,tanh,0.45,5,0.55,COMPLETE
1767,1767,0.45300817489624023,2026-03-14 05:25:25.717954,2026-03-14 05:25:39.574633,0 days 00:00:13.856679,tanh,0.0,3,0.5,COMPLETE
1768,1768,0.45094457268714905,2026-03-14 05:25:39.750119,2026-03-14 05:25:53.618641,0 days 00:00:13.868522,tanh,0.0,3,0.65,COMPLETE
1769,1769,0.4796634018421173,2026-03-14 05:25:53.758155,2026-03-14 05:26:07.775902,0 days 00:00:14.017747,tanh,0.05,3,0.65,COMPLETE
1770,1770,0.48048701882362366,2026-03-14 05:26:08.096009,2026-03-14 05:26:22.111226,0 days 00:00:14.015217,relu,0.0,3,0.65,COMPLETE
1771,1771,0.5143656730651855,2026-03-14 05:26:22.260896,2026-03-14 05:26:36.004232,0 days 00:00:13.743336,tanh,0.0,3,0.55,COMPLETE
1772,1772,0.47146883606910706,2026-03-14 05:26:36.151256,2026-03-14 05:26:49.981218,0 days 00:00:13.829962,tanh,0.0,3,0.9,COMPLETE
1773,1773,0.4391521215438843,2026-03-14 05:26:50.185674,2026-03-14 05:27:04.369870,0 days 00:00:14.184196,tanh,0.0,3,0.65,COMPLETE
1774,1774,0.4711609482765198,2026-03-14 05:27:04.504383,2026-03-14 05:27:18.207912,0 days 00:00:13.703529,tanh,0.0,2,0.5,COMPLETE
1775,1775,0.4438256323337555,2026-03-14 05:27:18.363954,2026-03-14 05:27:32.195537,0 days 00:00:13.831583,tanh,0.0,3,0.55,COMPLETE
1776,1776,0.4591831862926483,2026-03-14 05:27:32.382751,2026-03-14 05:27:46.383438,0 days 00:00:14.000687,tanh,0.0,3,0.65,COMPLETE
1777,1777,0.4523718059062958,2026-03-14 05:27:46.523954,2026-03-14 05:28:00.345103,0 days 00:00:13.821149,tanh,0.0,3,0.5,COMPLETE
1778,1778,0.6437258720397949,2026-03-14 05:28:00.490629,2026-03-14 05:28:14.637181,0 days 00:00:14.146552,tanh,0.05,3,0.65,COMPLETE
1779,1779,0.451833575963974,2026-03-14 05:28:14.780561,2026-03-14 05:28:28.778313,0 days 00:00:13.997752,tanh,0.25,3,0.65,COMPLETE
1780,1780,0.5033208727836609,2026-03-14 05:28:28.932600,2026-03-14 05:28:42.707090,0 days 00:00:13.774490,tanh,0.0,3,0.95,COMPLETE
1781,1781,0.6444156169891357,2026-03-14 05:28:42.843380,2026-03-14 05:28:56.743772,0 days 00:00:13.900392,sigmoid,0.0,3,0.8,COMPLETE
1782,1782,0.4540031850337982,2026-03-14 05:28:56.900299,2026-03-14 05:29:10.882185,0 days 00:00:13.981886,tanh,0.0,3,0.55,COMPLETE
1783,1783,0.4498095214366913,2026-03-14 05:29:11.228485,2026-03-14 05:29:24.892791,0 days 00:00:13.664306,tanh,0.0,3,0.5,COMPLETE
1784,1784,0.48325374722480774,2026-03-14 05:29:25.033414,2026-03-14 05:29:38.823941,0 days 00:00:13.790527,tanh,0.0,3,0.65,COMPLETE
1785,1785,0.4282236099243164,2026-03-14 05:29:39.005479,2026-03-14 05:29:52.706720,0 days 00:00:13.701241,tanh,0.0,3,0.65,COMPLETE
1786,1786,0.46125704050064087,2026-03-14 05:29:52.973685,2026-03-14 05:30:07.038837,0 days 00:00:14.065152,tanh,0.0,3,0.75,COMPLETE
1787,1787,0.4344223439693451,2026-03-14 05:30:07.176962,2026-03-14 05:30:21.189633,0 days 00:00:14.012671,tanh,0.05,3,0.5,COMPLETE
1788,1788,0.4584302604198456,2026-03-14 05:30:21.333168,2026-03-14 05:30:35.107818,0 days 00:00:13.774650,tanh,0.0,3,0.65,COMPLETE
1789,1789,0.45722538232803345,2026-03-14 05:30:35.292915,2026-03-14 05:30:49.226717,0 days 00:00:13.933802,tanh,0.0,3,0.55,COMPLETE
1790,1790,0.45145267248153687,2026-03-14 05:30:49.366231,2026-03-14 05:31:03.175167,0 days 00:00:13.808936,tanh,0.0,3,0.65,COMPLETE
1791,1791,0.5624061226844788,2026-03-14 05:31:03.358192,2026-03-14 05:31:17.063934,0 days 00:00:13.705742,tanh,0.0,3,0.55,COMPLETE
1792,1792,0.4708065390586853,2026-03-14 05:31:17.286598,2026-03-14 05:31:31.011050,0 days 00:00:13.724452,relu,0.0,3,0.5,COMPLETE
1793,1793,0.46104270219802856,2026-03-14 05:31:31.342723,2026-03-14 05:31:45.251558,0 days 00:00:13.908835,tanh,0.0,3,0.65,COMPLETE
1794,1794,0.4314846396446228,2026-03-14 05:31:45.376069,2026-03-14 05:31:59.250576,0 days 00:00:13.874507,tanh,0.0,3,0.65,COMPLETE
1795,1795,0.4249357283115387,2026-03-14 05:31:59.395088,2026-03-14 05:32:13.763305,0 days 00:00:14.368217,tanh,0.05,4,0.5,COMPLETE
1796,1796,0.4761297404766083,2026-03-14 05:32:13.897491,2026-03-14 05:32:28.015258,0 days 00:00:14.117767,tanh,0.0,3,0.65,COMPLETE
1797,1797,0.4608417749404907,2026-03-14 05:32:28.151294,2026-03-14 05:32:42.021869,0 days 00:00:13.870575,tanh,0.0,3,0.65,COMPLETE
1798,1798,0.4569482207298279,2026-03-14 05:32:42.167975,2026-03-14 05:32:56.314851,0 days 00:00:14.146876,tanh,0.0,3,0.55,COMPLETE
1799,1799,0.4491107761859894,2026-03-14 05:32:56.452387,2026-03-14 05:33:11.042444,0 days 00:00:14.590057,tanh,0.0,3,0.5,COMPLETE
1800,1800,0.4858562648296356,2026-03-14 05:33:11.174140,2026-03-14 05:33:25.231651,0 days 00:00:14.057511,tanh,0.0,2,0.65,COMPLETE
1801,1801,0.46588531136512756,2026-03-14 05:33:25.381595,2026-03-14 05:33:39.202224,0 days 00:00:13.820629,tanh,0.0,3,0.65,COMPLETE
1802,1802,0.48191410303115845,2026-03-14 05:33:39.339545,2026-03-14 05:33:53.404456,0 days 00:00:14.064911,tanh,0.0,3,0.8,COMPLETE
1803,1803,0.6466562151908875,2026-03-14 05:33:53.551977,2026-03-14 05:34:07.872424,0 days 00:00:14.320447,sigmoid,0.05,3,0.55,COMPLETE
1804,1804,0.5281125903129578,2026-03-14 05:34:08.020972,2026-03-14 05:34:21.872196,0 days 00:00:13.851224,tanh,0.0,3,0.65,COMPLETE
1805,1805,0.4784233868122101,2026-03-14 05:34:22.026763,2026-03-14 05:34:36.115834,0 days 00:00:14.089071,tanh,0.0,3,0.5,COMPLETE
1806,1806,0.4957628548145294,2026-03-14 05:34:36.250506,2026-03-14 05:34:50.209834,0 days 00:00:13.959328,tanh,0.0,3,0.65,COMPLETE
1807,1807,0.47852957248687744,2026-03-14 05:34:50.348914,2026-03-14 05:35:04.283342,0 days 00:00:13.934428,tanh,0.0,3,0.75,COMPLETE
1808,1808,0.4061320126056671,2026-03-14 05:35:04.424861,2026-03-14 05:35:18.609351,0 days 00:00:14.184490,tanh,0.0,3,0.55,COMPLETE
1809,1809,0.4720408618450165,2026-03-14 05:35:18.759947,2026-03-14 05:35:32.531161,0 days 00:00:13.771214,tanh,0.0,3,0.55,COMPLETE
1810,1810,0.4929737448692322,2026-03-14 05:35:32.746203,2026-03-14 05:35:47.218002,0 days 00:00:14.471799,tanh,0.0,3,0.55,COMPLETE
1811,1811,0.6416652202606201,2026-03-14 05:35:47.393652,2026-03-14 05:36:01.676621,0 days 00:00:14.282969,tanh,0.0,5,0.55,COMPLETE
1812,1812,0.4883899390697479,2026-03-14 05:36:01.805145,2026-03-14 05:36:16.113936,0 days 00:00:14.308791,tanh,0.05,3,0.55,COMPLETE
1813,1813,0.46126148104667664,2026-03-14 05:36:16.257544,2026-03-14 05:36:30.303528,0 days 00:00:14.045984,tanh,0.0,3,0.55,COMPLETE
1814,1814,0.5580770373344421,2026-03-14 05:36:30.436040,2026-03-14 05:36:44.544311,0 days 00:00:14.108271,relu,0.35000000000000003,3,0.55,COMPLETE
1815,1815,0.4713141620159149,2026-03-14 05:36:44.692368,2026-03-14 05:36:58.703629,0 days 00:00:14.011261,tanh,0.0,3,0.55,COMPLETE
1816,1816,0.4481286108493805,2026-03-14 05:36:58.845145,2026-03-14 05:37:12.992408,0 days 00:00:14.147263,tanh,0.0,3,0.55,COMPLETE
1817,1817,0.4431065618991852,2026-03-14 05:37:13.123248,2026-03-14 05:37:27.008585,0 days 00:00:13.885337,tanh,0.0,3,0.55,COMPLETE
1818,1818,0.4248533248901367,2026-03-14 05:37:27.173175,2026-03-14 05:37:40.996230,0 days 00:00:13.823055,tanh,0.0,3,0.55,COMPLETE
1819,1819,0.6430266499519348,2026-03-14 05:37:41.135332,2026-03-14 05:37:56.001141,0 days 00:00:14.865809,tanh,0.0,8,0.55,COMPLETE
1820,1820,0.4278877377510071,2026-03-14 05:37:56.141757,2026-03-14 05:38:10.043547,0 days 00:00:13.901790,tanh,0.0,3,0.55,COMPLETE
1821,1821,0.43155109882354736,2026-03-14 05:38:10.174212,2026-03-14 05:38:24.385340,0 days 00:00:14.211128,tanh,0.0,4,0.55,COMPLETE
