,number,value,datetime_start,datetime_complete,duration,params_activation,params_dropout,params_layers,params_shrink,state
1492,1492,0.44289112091064453,2026-03-14 04:20:37.749295,2026-03-14 04:20:52.186669,0 days 00:00:14.437374,tanh,0.45,3,0.65,COMPLETE
1493,1493,0.4492642879486084,2026-03-14 04:20:52.522743,2026-03-14 04:21:06.273603,0 days 00:00:13.750860,tanh,0.0,3,0.65,COMPLETE
1494,1494,0.5098570585250854,2026-03-14 04:21:06.446642,2026-03-14 04:21:20.167760,0 days 00:00:13.721118,tanh,0.0,3,0.7,COMPLETE
1495,1495,0.4675607681274414,2026-03-14 04:21:20.312866,2026-03-14 04:21:34.029342,0 days 00:00:13.716476,tanh,0.0,3,0.65,COMPLETE
1496,1496,0.43572065234184265,2026-03-14 04:21:34.195990,2026-03-14 04:21:48.167691,0 days 00:00:13.971701,tanh,0.0,3,0.65,COMPLETE
1497,1497,0.46699851751327515,2026-03-14 04:21:48.315172,2026-03-14 04:22:02.386327,0 days 00:00:14.071155,tanh,0.05,3,0.55,COMPLETE
1498,1498,0.4548148512840271,2026-03-14 04:22:02.539854,2026-03-14 04:22:16.306644,0 days 00:00:13.766790,tanh,0.0,3,0.6,COMPLETE
1499,1499,0.4557732939720154,2026-03-14 04:22:16.461015,2026-03-14 04:22:30.285629,0 days 00:00:13.824614,tanh,0.0,3,0.6,COMPLETE
1500,1500,0.45322385430336,2026-03-14 04:22:30.441655,2026-03-14 04:22:44.581429,0 days 00:00:14.139774,tanh,0.0,3,0.65,COMPLETE
1501,1501,0.4959283769130707,2026-03-14 04:22:44.720634,2026-03-14 04:22:58.350083,0 days 00:00:13.629449,tanh,0.0,2,0.7,COMPLETE
1502,1502,0.4508304297924042,2026-03-14 04:22:58.529674,2026-03-14 04:23:12.118042,0 days 00:00:13.588368,tanh,0.0,3,0.65,COMPLETE
1503,1503,0.42491355538368225,2026-03-14 04:23:12.275690,2026-03-14 04:23:25.971111,0 days 00:00:13.695421,tanh,0.0,3,0.55,COMPLETE
1504,1504,0.48625633120536804,2026-03-14 04:23:26.238282,2026-03-14 04:23:40.476658,0 days 00:00:14.238376,relu,0.0,3,0.65,COMPLETE
1505,1505,0.42870163917541504,2026-03-14 04:23:40.620198,2026-03-14 04:23:54.653529,0 days 00:00:14.033331,tanh,0.05,3,0.6,COMPLETE
1506,1506,0.4230116307735443,2026-03-14 04:23:54.808054,2026-03-14 04:24:08.752711,0 days 00:00:13.944657,tanh,0.0,3,0.65,COMPLETE
1507,1507,0.45978042483329773,2026-03-14 04:24:08.917784,2026-03-14 04:24:22.663685,0 days 00:00:13.745901,tanh,0.0,3,0.75,COMPLETE
1508,1508,0.502364456653595,2026-03-14 04:24:22.820202,2026-03-14 04:24:36.930382,0 days 00:00:14.110180,tanh,0.0,3,0.6,COMPLETE
1509,1509,0.45871031284332275,2026-03-14 04:24:37.071570,2026-03-14 04:24:50.965324,0 days 00:00:13.893754,tanh,0.0,3,0.65,COMPLETE
1510,1510,0.4719296991825104,2026-03-14 04:24:51.116838,2026-03-14 04:25:04.832226,0 days 00:00:13.715388,tanh,0.0,3,0.7,COMPLETE
1511,1511,0.4851434528827667,2026-03-14 04:25:04.971259,2026-03-14 04:25:18.934254,0 days 00:00:13.962995,tanh,0.0,3,0.6,COMPLETE
1512,1512,0.460670530796051,2026-03-14 04:25:19.073282,2026-03-14 04:25:32.952899,0 days 00:00:13.879617,tanh,0.0,3,0.65,COMPLETE
1513,1513,0.6417285799980164,2026-03-14 04:25:33.095513,2026-03-14 04:25:47.056648,0 days 00:00:13.961135,sigmoid,0.05,3,0.8,COMPLETE
1514,1514,0.4404888451099396,2026-03-14 04:25:47.191422,2026-03-14 04:26:00.969334,0 days 00:00:13.777912,tanh,0.0,3,0.65,COMPLETE
1515,1515,0.43875691294670105,2026-03-14 04:26:01.117385,2026-03-14 04:26:15.257077,0 days 00:00:14.139692,tanh,0.0,3,0.6,COMPLETE
1516,1516,0.4983508884906769,2026-03-14 04:26:15.403593,2026-03-14 04:26:29.366703,0 days 00:00:13.963110,tanh,0.0,3,0.7,COMPLETE
1517,1517,0.4879615008831024,2026-03-14 04:26:29.499228,2026-03-14 04:26:43.317271,0 days 00:00:13.818043,tanh,0.0,3,0.65,COMPLETE
1518,1518,0.46636322140693665,2026-03-14 04:26:43.459310,2026-03-14 04:26:57.187066,0 days 00:00:13.727756,tanh,0.05,3,0.55,COMPLETE
1519,1519,0.49917176365852356,2026-03-14 04:26:57.339089,2026-03-14 04:27:11.241666,0 days 00:00:13.902577,tanh,0.0,3,0.75,COMPLETE
1520,1520,0.42315009236335754,2026-03-14 04:27:11.426184,2026-03-14 04:27:25.204850,0 days 00:00:13.778666,tanh,0.0,3,0.65,COMPLETE
1521,1521,0.4295583963394165,2026-03-14 04:27:25.371885,2026-03-14 04:27:39.099687,0 days 00:00:13.727802,tanh,0.0,3,0.6,COMPLETE
1522,1522,0.4788419008255005,2026-03-14 04:27:39.257620,2026-03-14 04:27:58.199615,0 days 00:00:18.941995,tanh,0.0,2,0.65,COMPLETE
1523,1523,0.47339674830436707,2026-03-14 04:27:58.356149,2026-03-14 04:28:12.312952,0 days 00:00:13.956803,tanh,0.0,3,0.7,COMPLETE
1524,1524,0.4691804349422455,2026-03-14 04:28:12.468231,2026-03-14 04:28:26.257034,0 days 00:00:13.788803,tanh,0.0,3,0.6,COMPLETE
1525,1525,0.4734477400779724,2026-03-14 04:28:26.407597,2026-03-14 04:28:40.503130,0 days 00:00:14.095533,tanh,0.2,3,0.65,COMPLETE
1526,1526,0.5098492503166199,2026-03-14 04:28:40.657646,2026-03-14 04:28:54.738785,0 days 00:00:14.081139,relu,0.0,3,0.65,COMPLETE
1527,1527,0.48147013783454895,2026-03-14 04:28:54.912304,2026-03-14 04:29:09.210287,0 days 00:00:14.297983,tanh,0.05,3,0.55,COMPLETE
1528,1528,0.45618298649787903,2026-03-14 04:29:09.369708,2026-03-14 04:29:23.219754,0 days 00:00:13.850046,tanh,0.0,3,0.6,COMPLETE
1529,1529,0.4727710485458374,2026-03-14 04:29:23.378274,2026-03-14 04:29:37.308839,0 days 00:00:13.930565,tanh,0.0,3,0.65,COMPLETE
1530,1530,0.46917155385017395,2026-03-14 04:29:37.466973,2026-03-14 04:29:51.288758,0 days 00:00:13.821785,tanh,0.0,3,0.7,COMPLETE
1531,1531,0.41516992449760437,2026-03-14 04:29:51.485798,2026-03-14 04:30:05.415956,0 days 00:00:13.930158,tanh,0.0,3,0.6,COMPLETE
1532,1532,0.43507304787635803,2026-03-14 04:30:05.566508,2026-03-14 04:30:19.370613,0 days 00:00:13.804105,tanh,0.0,3,0.6,COMPLETE
1533,1533,0.4965810775756836,2026-03-14 04:30:19.523140,2026-03-14 04:30:33.652427,0 days 00:00:14.129287,tanh,0.25,3,0.6,COMPLETE
1534,1534,0.6428777575492859,2026-03-14 04:30:33.811468,2026-03-14 04:30:48.481793,0 days 00:00:14.670325,tanh,0.0,7,0.6,COMPLETE
1535,1535,0.46122032403945923,2026-03-14 04:30:48.632290,2026-03-14 04:31:02.587680,0 days 00:00:13.955390,tanh,0.0,3,0.6,COMPLETE
1536,1536,0.6420378088951111,2026-03-14 04:31:02.739191,2026-03-14 04:31:16.581066,0 days 00:00:13.841875,sigmoid,0.0,3,0.6,COMPLETE
1537,1537,0.4533766210079193,2026-03-14 04:31:16.731090,2026-03-14 04:31:30.877445,0 days 00:00:14.146355,tanh,0.05,3,0.6,COMPLETE
1538,1538,0.45143651962280273,2026-03-14 04:31:31.066474,2026-03-14 04:31:44.979029,0 days 00:00:13.912555,tanh,0.0,3,0.6,COMPLETE
1539,1539,0.44837144017219543,2026-03-14 04:31:45.129990,2026-03-14 04:31:58.852627,0 days 00:00:13.722637,tanh,0.0,3,0.6,COMPLETE
1540,1540,0.4316823184490204,2026-03-14 04:31:59.006147,2026-03-14 04:32:12.745893,0 days 00:00:13.739746,tanh,0.0,3,0.6,COMPLETE
1541,1541,0.4785974323749542,2026-03-14 04:32:12.901410,2026-03-14 04:32:26.665501,0 days 00:00:13.764091,tanh,0.0,3,0.6,COMPLETE
1542,1542,0.5106205344200134,2026-03-14 04:32:26.822034,2026-03-14 04:32:41.016647,0 days 00:00:14.194613,tanh,0.05,3,0.6,COMPLETE
1543,1543,0.4621102809906006,2026-03-14 04:32:41.171339,2026-03-14 04:32:55.115628,0 days 00:00:13.944289,tanh,0.5,3,0.55,COMPLETE
1544,1544,0.48517513275146484,2026-03-14 04:32:55.274218,2026-03-14 04:33:09.676254,0 days 00:00:14.402036,tanh,0.0,3,0.6,COMPLETE
1545,1545,0.45483076572418213,2026-03-14 04:33:09.809771,2026-03-14 04:33:23.850302,0 days 00:00:14.040531,tanh,0.0,3,0.6,COMPLETE
1546,1546,0.4511733055114746,2026-03-14 04:33:23.999829,2026-03-14 04:33:38.096099,0 days 00:00:14.096270,tanh,0.0,3,0.6,COMPLETE
1547,1547,0.4984421133995056,2026-03-14 04:33:38.250679,2026-03-14 04:33:52.088305,0 days 00:00:13.837626,tanh,0.0,2,0.6,COMPLETE
1548,1548,0.4798451066017151,2026-03-14 04:33:52.255150,2026-03-14 04:34:06.273062,0 days 00:00:14.017912,relu,0.0,3,0.6,COMPLETE
1549,1549,0.4322679936885834,2026-03-14 04:34:06.427587,2026-03-14 04:34:20.405480,0 days 00:00:13.977893,tanh,0.0,3,0.55,COMPLETE
1550,1550,0.45019081234931946,2026-03-14 04:34:20.569997,2026-03-14 04:34:34.645270,0 days 00:00:14.075273,tanh,0.0,3,0.6,COMPLETE
1551,1551,0.42998620867729187,2026-03-14 04:34:34.815298,2026-03-14 04:34:49.206895,0 days 00:00:14.391597,tanh,0.05,3,0.6,COMPLETE
1552,1552,0.4752281606197357,2026-03-14 04:34:49.361413,2026-03-14 04:35:03.443211,0 days 00:00:14.081798,tanh,0.0,3,0.55,COMPLETE
1553,1553,0.45937684178352356,2026-03-14 04:35:03.593998,2026-03-14 04:35:17.541879,0 days 00:00:13.947881,tanh,0.0,3,0.6,COMPLETE
1554,1554,0.49125760793685913,2026-03-14 04:35:17.724906,2026-03-14 04:35:31.953864,0 days 00:00:14.228958,tanh,0.0,3,0.6,COMPLETE
1555,1555,0.46568217873573303,2026-03-14 04:35:32.104984,2026-03-14 04:35:46.049985,0 days 00:00:13.945001,tanh,0.0,3,0.6,COMPLETE
1556,1556,0.474624365568161,2026-03-14 04:35:46.203106,2026-03-14 04:36:00.091496,0 days 00:00:13.888390,tanh,0.0,3,0.6,COMPLETE
1557,1557,0.6419606804847717,2026-03-14 04:36:00.245164,2026-03-14 04:36:14.218624,0 days 00:00:13.973460,sigmoid,0.0,3,0.55,COMPLETE
1558,1558,0.4759894013404846,2026-03-14 04:36:14.390659,2026-03-14 04:36:28.072984,0 days 00:00:13.682325,tanh,0.0,3,0.6,COMPLETE
1559,1559,0.5331647992134094,2026-03-14 04:36:28.253545,2026-03-14 04:36:42.404444,0 days 00:00:14.150899,tanh,0.05,3,0.6,COMPLETE
1560,1560,0.4531933069229126,2026-03-14 04:36:42.557955,2026-03-14 04:36:56.886175,0 days 00:00:14.328220,tanh,0.0,3,0.6,COMPLETE
1561,1561,0.4898053705692291,2026-03-14 04:36:57.069654,2026-03-14 04:37:11.119461,0 days 00:00:14.049807,tanh,0.0,3,0.75,COMPLETE
1562,1562,0.4933505654335022,2026-03-14 04:37:11.266567,2026-03-14 04:37:25.248727,0 days 00:00:13.982160,tanh,0.0,3,0.9,COMPLETE
1563,1563,0.5449894666671753,2026-03-14 04:37:25.401318,2026-03-14 04:37:39.293051,0 days 00:00:13.891733,tanh,0.0,3,0.6,COMPLETE
1564,1564,0.4439680576324463,2026-03-14 04:37:39.458026,2026-03-14 04:37:53.349064,0 days 00:00:13.891038,tanh,0.0,3,0.55,COMPLETE
1565,1565,0.4816647171974182,2026-03-14 04:37:53.526658,2026-03-14 04:38:07.715180,0 days 00:00:14.188522,tanh,0.05,3,0.6,COMPLETE
1566,1566,0.4680721163749695,2026-03-14 04:38:07.866329,2026-03-14 04:38:21.815272,0 days 00:00:13.948943,tanh,0.0,3,0.6,COMPLETE
1567,1567,0.45742690563201904,2026-03-14 04:38:21.967813,2026-03-14 04:38:35.808144,0 days 00:00:13.840331,tanh,0.0,3,0.8500000000000001,COMPLETE
1568,1568,0.4861123859882355,2026-03-14 04:38:35.961201,2026-03-14 04:38:50.197301,0 days 00:00:14.236100,tanh,0.15000000000000002,3,0.8,COMPLETE
1569,1569,0.45922815799713135,2026-03-14 04:38:50.353840,2026-03-14 04:39:04.329633,0 days 00:00:13.975793,tanh,0.0,3,0.6,COMPLETE
1570,1570,0.5084248781204224,2026-03-14 04:39:04.500886,2026-03-14 04:39:18.670114,0 days 00:00:14.169228,relu,0.0,3,0.7,COMPLETE
1571,1571,0.4126163125038147,2026-03-14 04:39:18.820923,2026-03-14 04:39:32.802138,0 days 00:00:13.981215,tanh,0.0,3,0.55,COMPLETE
1572,1572,0.4720636308193207,2026-03-14 04:39:32.950683,2026-03-14 04:39:46.690194,0 days 00:00:13.739511,tanh,0.0,2,0.55,COMPLETE
1573,1573,0.48867887258529663,2026-03-14 04:39:46.946996,2026-03-14 04:40:01.297260,0 days 00:00:14.350264,tanh,0.05,3,0.55,COMPLETE
1574,1574,0.4917176067829132,2026-03-14 04:40:01.461270,2026-03-14 04:40:15.363374,0 days 00:00:13.902104,tanh,0.0,3,0.55,COMPLETE
1575,1575,0.4877319931983948,2026-03-14 04:40:15.526779,2026-03-14 04:40:29.472899,0 days 00:00:13.946120,tanh,0.0,3,0.5,COMPLETE
1576,1576,0.4709164798259735,2026-03-14 04:40:29.654932,2026-03-14 04:40:43.557880,0 days 00:00:13.902948,tanh,0.0,3,0.55,COMPLETE
1577,1577,0.4456980526447296,2026-03-14 04:40:43.756921,2026-03-14 04:40:57.594457,0 days 00:00:13.837536,tanh,0.0,3,0.5,COMPLETE
1578,1578,0.465912401676178,2026-03-14 04:40:57.751484,2026-03-14 04:41:11.597906,0 days 00:00:13.846422,tanh,0.0,3,0.55,COMPLETE
1579,1579,0.4369884133338928,2026-03-14 04:41:11.740421,2026-03-14 04:41:25.684689,0 days 00:00:13.944268,tanh,0.05,3,0.55,COMPLETE
1580,1580,0.43370234966278076,2026-03-14 04:41:25.838750,2026-03-14 04:41:39.688437,0 days 00:00:13.849687,tanh,0.0,3,0.5,COMPLETE
1581,1581,0.6414474248886108,2026-03-14 04:41:39.834629,2026-03-14 04:41:53.605792,0 days 00:00:13.771163,sigmoid,0.0,3,0.55,COMPLETE
1582,1582,0.4596584439277649,2026-03-14 04:41:53.785861,2026-03-14 04:42:07.733546,0 days 00:00:13.947685,tanh,0.0,3,0.55,COMPLETE
1583,1583,0.4365282952785492,2026-03-14 04:42:07.883579,2026-03-14 04:42:21.845200,0 days 00:00:13.961621,tanh,0.0,3,0.55,COMPLETE
1584,1584,0.437796413898468,2026-03-14 04:42:21.993761,2026-03-14 04:42:35.845573,0 days 00:00:13.851812,tanh,0.0,3,0.5,COMPLETE
1585,1585,0.5516199469566345,2026-03-14 04:42:35.992121,2026-03-14 04:42:49.879774,0 days 00:00:13.887653,tanh,0.0,3,0.55,COMPLETE
1586,1586,0.45988091826438904,2026-03-14 04:42:50.032304,2026-03-14 04:43:03.986731,0 days 00:00:13.954427,tanh,0.0,3,0.5,COMPLETE
1587,1587,0.46102994680404663,2026-03-14 04:43:04.135769,2026-03-14 04:43:18.296361,0 days 00:00:14.160592,tanh,0.05,3,0.55,COMPLETE
1588,1588,0.4478735029697418,2026-03-14 04:43:18.449215,2026-03-14 04:43:32.380571,0 days 00:00:13.931356,tanh,0.0,3,0.6,COMPLETE
1589,1589,0.501538872718811,2026-03-14 04:43:32.534606,2026-03-14 04:43:46.399436,0 days 00:00:13.864830,tanh,0.0,3,0.55,COMPLETE
1590,1590,0.452501505613327,2026-03-14 04:43:46.541234,2026-03-14 04:44:00.402398,0 days 00:00:13.861164,tanh,0.0,3,0.6,COMPLETE
1591,1591,0.42610034346580505,2026-03-14 04:44:00.557458,2026-03-14 04:44:14.516763,0 days 00:00:13.959305,tanh,0.0,3,0.5,COMPLETE
1592,1592,0.5035070776939392,2026-03-14 04:44:14.666793,2026-03-14 04:44:28.531196,0 days 00:00:13.864403,tanh,0.0,3,0.6,COMPLETE
1593,1593,0.5046759843826294,2026-03-14 04:44:28.679235,2026-03-14 04:44:42.501024,0 days 00:00:13.821789,relu,0.0,3,0.6,COMPLETE
1594,1594,0.4768654406070709,2026-03-14 04:44:42.659548,2026-03-14 04:44:56.648105,0 days 00:00:13.988557,tanh,0.0,3,0.6,COMPLETE
1595,1595,0.4859457015991211,2026-03-14 04:44:56.840814,2026-03-14 04:45:11.077900,0 days 00:00:14.237086,tanh,0.05,3,0.6,COMPLETE
1596,1596,0.4319685101509094,2026-03-14 04:45:11.246520,2026-03-14 04:45:25.113793,0 days 00:00:13.867273,tanh,0.0,3,0.55,COMPLETE
1597,1597,0.449167400598526,2026-03-14 04:45:25.273270,2026-03-14 04:45:39.254319,0 days 00:00:13.981049,tanh,0.0,3,0.6,COMPLETE
1598,1598,0.47942298650741577,2026-03-14 04:45:39.411755,2026-03-14 04:45:53.259318,0 days 00:00:13.847563,tanh,0.0,3,0.55,COMPLETE
1599,1599,0.4559224843978882,2026-03-14 04:45:53.427346,2026-03-14 04:46:07.565530,0 days 00:00:14.138184,tanh,0.25,3,0.6,COMPLETE
1600,1600,0.45925289392471313,2026-03-14 04:46:07.713049,2026-03-14 04:46:21.698425,0 days 00:00:13.985376,tanh,0.0,2,0.8,COMPLETE
1601,1601,0.446327269077301,2026-03-14 04:46:21.858449,2026-03-14 04:46:35.778944,0 days 00:00:13.920495,tanh,0.0,3,0.75,COMPLETE
1602,1602,0.6430232524871826,2026-03-14 04:46:35.929992,2026-03-14 04:46:50.588345,0 days 00:00:14.658353,sigmoid,0.0,6,0.6,COMPLETE
1603,1603,0.4659770429134369,2026-03-14 04:46:50.738959,2026-03-14 04:47:04.751462,0 days 00:00:14.012503,tanh,0.0,3,0.5,COMPLETE
1604,1604,0.4356227517127991,2026-03-14 04:47:04.902007,2026-03-14 04:47:18.727958,0 days 00:00:13.825951,tanh,0.0,3,0.6,COMPLETE
1605,1605,0.4375397562980652,2026-03-14 04:47:18.874995,2026-03-14 04:47:33.275046,0 days 00:00:14.400051,tanh,0.05,3,0.55,COMPLETE
1606,1606,0.48426756262779236,2026-03-14 04:47:33.435568,2026-03-14 04:47:47.453426,0 days 00:00:14.017858,tanh,0.0,3,0.6,COMPLETE
1607,1607,0.4634064733982086,2026-03-14 04:47:47.609953,2026-03-14 04:48:01.541223,0 days 00:00:13.931270,tanh,0.0,3,0.6,COMPLETE
1608,1608,0.4332105815410614,2026-03-14 04:48:01.699262,2026-03-14 04:48:15.605871,0 days 00:00:13.906609,tanh,0.0,3,0.75,COMPLETE
1609,1609,0.4432756006717682,2026-03-14 04:48:15.767377,2026-03-14 04:48:29.908207,0 days 00:00:14.140830,tanh,0.0,3,0.6,COMPLETE
1610,1610,0.47900649905204773,2026-03-14 04:48:30.064723,2026-03-14 04:48:43.871944,0 days 00:00:13.807221,tanh,0.0,3,0.6,COMPLETE
1611,1611,0.43256136775016785,2026-03-14 04:48:44.039979,2026-03-14 04:48:57.828223,0 days 00:00:13.788244,tanh,0.05,3,0.5,COMPLETE
1612,1612,0.48358020186424255,2026-03-14 04:48:57.997763,2026-03-14 04:49:11.932859,0 days 00:00:13.935096,tanh,0.0,3,1.0,COMPLETE
1613,1613,0.5007354021072388,2026-03-14 04:49:12.091411,2026-03-14 04:49:26.044769,0 days 00:00:13.953358,tanh,0.0,3,0.7,COMPLETE
1614,1614,0.4227411150932312,2026-03-14 04:49:26.215882,2026-03-14 04:49:40.263407,0 days 00:00:14.047525,tanh,0.0,3,0.6,COMPLETE
1615,1615,0.4864477813243866,2026-03-14 04:49:40.417933,2026-03-14 04:49:54.207205,0 days 00:00:13.789272,relu,0.0,3,0.55,COMPLETE
1616,1616,0.45941630005836487,2026-03-14 04:49:54.379231,2026-03-14 04:50:08.868627,0 days 00:00:14.489396,tanh,0.05,3,0.6,COMPLETE
1617,1617,0.43386998772621155,2026-03-14 04:50:09.021141,2026-03-14 04:50:23.238318,0 days 00:00:14.217177,tanh,0.0,3,0.55,COMPLETE
1618,1618,0.4644797742366791,2026-03-14 04:50:23.392349,2026-03-14 04:50:37.350030,0 days 00:00:13.957681,tanh,0.0,3,0.6,COMPLETE
1619,1619,0.4680359661579132,2026-03-14 04:50:37.508053,2026-03-14 04:50:51.394156,0 days 00:00:13.886103,tanh,0.0,3,0.7,COMPLETE
1620,1620,0.44435644149780273,2026-03-14 04:50:51.549678,2026-03-14 04:51:05.605921,0 days 00:00:14.056243,tanh,0.0,3,0.6,COMPLETE
1621,1621,0.5064846873283386,2026-03-14 04:51:05.758454,2026-03-14 04:51:19.815068,0 days 00:00:14.056614,tanh,0.0,2,0.7,COMPLETE
1622,1622,0.48733705282211304,2026-03-14 04:51:19.968586,2026-03-14 04:51:34.316336,0 days 00:00:14.347750,tanh,0.05,3,0.6,COMPLETE
1623,1623,0.641404926776886,2026-03-14 04:51:34.469852,2026-03-14 04:51:48.347581,0 days 00:00:13.877729,sigmoid,0.0,3,0.6,COMPLETE
1624,1624,0.4121026396751404,2026-03-14 04:51:48.516261,2026-03-14 04:52:02.527624,0 days 00:00:14.011363,tanh,0.0,3,0.55,COMPLETE
1625,1625,0.4332160949707031,2026-03-14 04:52:02.681140,2026-03-14 04:52:16.310298,0 days 00:00:13.629158,tanh,0.0,3,0.55,COMPLETE
1626,1626,0.40599948167800903,2026-03-14 04:52:16.468810,2026-03-14 04:52:30.220139,0 days 00:00:13.751329,tanh,0.0,3,0.55,COMPLETE
1627,1627,0.4700123369693756,2026-03-14 04:52:30.372306,2026-03-14 04:52:44.225567,0 days 00:00:13.853261,tanh,0.0,3,0.55,COMPLETE
1628,1628,0.47784799337387085,2026-03-14 04:52:44.400080,2026-03-14 04:52:58.487546,0 days 00:00:14.087466,tanh,0.0,3,0.55,COMPLETE
1629,1629,0.4642963707447052,2026-03-14 04:52:58.648582,2026-03-14 04:53:12.623263,0 days 00:00:13.974681,tanh,0.0,3,0.55,COMPLETE
1630,1630,0.4462784230709076,2026-03-14 04:53:12.780957,2026-03-14 04:53:26.585689,0 days 00:00:13.804732,tanh,0.0,3,0.55,COMPLETE
1631,1631,0.4370676875114441,2026-03-14 04:53:26.751722,2026-03-14 04:53:40.828164,0 days 00:00:14.076442,tanh,0.0,4,0.55,COMPLETE
1632,1632,0.4380631744861603,2026-03-14 04:53:40.970192,2026-03-14 04:53:54.883206,0 days 00:00:13.913014,tanh,0.0,3,0.55,COMPLETE
1633,1633,0.44436025619506836,2026-03-14 04:53:55.038718,2026-03-14 04:54:08.927819,0 days 00:00:13.889101,tanh,0.0,3,0.55,COMPLETE
1634,1634,0.46568068861961365,2026-03-14 04:54:09.080855,2026-03-14 04:54:23.182894,0 days 00:00:14.102039,tanh,0.0,3,0.55,COMPLETE
1635,1635,0.6429292559623718,2026-03-14 04:54:23.334413,2026-03-14 04:54:38.029389,0 days 00:00:14.694976,tanh,0.0,8,0.55,COMPLETE
1636,1636,0.4434880018234253,2026-03-14 04:54:38.180574,2026-03-14 04:54:52.173039,0 days 00:00:13.992465,tanh,0.0,3,0.55,COMPLETE
1637,1637,0.4336821138858795,2026-03-14 04:54:52.320591,2026-03-14 04:55:06.260042,0 days 00:00:13.939451,tanh,0.0,3,0.55,COMPLETE
1638,1638,0.509825587272644,2026-03-14 04:55:06.594192,2026-03-14 04:55:20.469123,0 days 00:00:13.874931,relu,0.0,3,0.55,COMPLETE
1639,1639,0.47895482182502747,2026-03-14 04:55:20.618203,2026-03-14 04:55:34.627744,0 days 00:00:14.009541,tanh,0.0,3,0.55,COMPLETE
1640,1640,0.436874657869339,2026-03-14 04:55:34.798296,2026-03-14 04:55:48.685793,0 days 00:00:13.887497,tanh,0.0,3,0.5,COMPLETE
1641,1641,0.6432256102561951,2026-03-14 04:55:48.838470,2026-03-14 04:56:03.132907,0 days 00:00:14.294437,tanh,0.0,6,0.55,COMPLETE
1642,1642,0.43137216567993164,2026-03-14 04:56:03.287997,2026-03-14 04:56:17.207315,0 days 00:00:13.919318,tanh,0.0,3,0.5,COMPLETE
1643,1643,0.4636398255825043,2026-03-14 04:56:17.366861,2026-03-14 04:56:31.107856,0 days 00:00:13.740995,tanh,0.0,3,0.55,COMPLETE
1644,1644,0.4741334915161133,2026-03-14 04:56:31.264501,2026-03-14 04:56:45.059507,0 days 00:00:13.795006,tanh,0.0,3,0.55,COMPLETE
1645,1645,0.41891515254974365,2026-03-14 04:56:45.228067,2026-03-14 04:56:59.148196,0 days 00:00:13.920129,tanh,0.0,3,0.55,COMPLETE
1646,1646,0.44909748435020447,2026-03-14 04:56:59.292805,2026-03-14 04:57:13.163685,0 days 00:00:13.870880,tanh,0.0,3,0.5,COMPLETE
1647,1647,0.6452596783638,2026-03-14 04:57:13.318254,2026-03-14 04:57:27.258548,0 days 00:00:13.940294,sigmoid,0.0,3,0.55,COMPLETE
1648,1648,0.4825232923030853,2026-03-14 04:57:27.412144,2026-03-14 04:57:41.450912,0 days 00:00:14.038768,tanh,0.0,3,0.55,COMPLETE
1649,1649,0.4266456663608551,2026-03-14 04:57:41.616938,2026-03-14 04:57:55.666774,0 days 00:00:14.049836,tanh,0.0,4,0.5,COMPLETE
1650,1650,0.4755050241947174,2026-03-14 04:57:55.837699,2026-03-14 04:58:09.847897,0 days 00:00:14.010198,tanh,0.0,3,0.55,COMPLETE
1651,1651,0.4599676728248596,2026-03-14 04:58:10.020928,2026-03-14 04:58:23.892889,0 days 00:00:13.871961,tanh,0.0,2,0.7,COMPLETE
1652,1652,0.45206719636917114,2026-03-14 04:58:24.038151,2026-03-14 04:58:37.915988,0 days 00:00:13.877837,tanh,0.0,3,0.55,COMPLETE
1653,1653,0.4020199179649353,2026-03-14 04:58:38.112097,2026-03-14 04:58:52.219163,0 days 00:00:14.107066,tanh,0.0,3,0.5,COMPLETE
1654,1654,0.5108739137649536,2026-03-14 04:58:52.375205,2026-03-14 04:59:06.289882,0 days 00:00:13.914677,tanh,0.0,3,0.5,COMPLETE
1655,1655,0.4119611382484436,2026-03-14 04:59:06.436399,2026-03-14 04:59:20.367469,0 days 00:00:13.931070,tanh,0.0,3,0.5,COMPLETE
1656,1656,0.46516478061676025,2026-03-14 04:59:20.516982,2026-03-14 04:59:34.512249,0 days 00:00:13.995267,tanh,0.0,3,0.55,COMPLETE
