,number,value,datetime_start,datetime_complete,duration,params_activation,params_dropout,params_layers,params_shrink,state
332,332,0.46886056661605835,2026-03-13 23:52:58.295050,2026-03-13 23:53:11.796850,0 days 00:00:13.501800,tanh,0.0,3,0.7,COMPLETE
333,333,0.432192325592041,2026-03-13 23:53:11.989872,2026-03-13 23:53:25.362188,0 days 00:00:13.372316,tanh,0.0,3,0.65,COMPLETE
334,334,0.46974313259124756,2026-03-13 23:53:25.519282,2026-03-13 23:53:39.023055,0 days 00:00:13.503773,tanh,0.0,3,0.7,COMPLETE
335,335,0.43083205819129944,2026-03-13 23:53:39.212707,2026-03-13 23:53:52.442684,0 days 00:00:13.229977,tanh,0.0,3,0.65,COMPLETE
336,336,0.6434745788574219,2026-03-13 23:53:52.640217,2026-03-13 23:54:06.090298,0 days 00:00:13.450081,sigmoid,0.0,3,0.65,COMPLETE
337,337,0.4634058475494385,2026-03-13 23:54:06.254327,2026-03-13 23:54:19.647435,0 days 00:00:13.393108,tanh,0.0,3,0.65,COMPLETE
338,338,0.46370193362236023,2026-03-13 23:54:19.839345,2026-03-13 23:54:33.304961,0 days 00:00:13.465616,tanh,0.45,2,0.7,COMPLETE
339,339,0.4690864086151123,2026-03-13 23:54:33.496390,2026-03-13 23:54:47.034108,0 days 00:00:13.537718,tanh,0.0,3,0.65,COMPLETE
340,340,0.4129205048084259,2026-03-13 23:54:47.230503,2026-03-13 23:55:00.758502,0 days 00:00:13.527999,tanh,0.0,3,0.65,COMPLETE
341,341,0.4537217617034912,2026-03-13 23:55:00.951300,2026-03-13 23:55:14.445321,0 days 00:00:13.494021,tanh,0.0,3,0.65,COMPLETE
342,342,0.4473174512386322,2026-03-13 23:55:14.640906,2026-03-13 23:55:28.177156,0 days 00:00:13.536250,tanh,0.0,3,0.65,COMPLETE
343,343,0.46226298809051514,2026-03-13 23:55:28.364184,2026-03-13 23:55:42.019558,0 days 00:00:13.655374,tanh,0.0,3,0.65,COMPLETE
344,344,0.41455382108688354,2026-03-13 23:55:42.208267,2026-03-13 23:55:55.544571,0 days 00:00:13.336304,tanh,0.0,3,0.65,COMPLETE
345,345,0.5097468495368958,2026-03-13 23:55:55.727620,2026-03-13 23:56:09.148379,0 days 00:00:13.420759,tanh,0.0,3,0.65,COMPLETE
346,346,0.44537150859832764,2026-03-13 23:56:09.337957,2026-03-13 23:56:22.547258,0 days 00:00:13.209301,tanh,0.0,3,0.65,COMPLETE
347,347,0.4760971665382385,2026-03-13 23:56:22.753291,2026-03-13 23:56:36.003300,0 days 00:00:13.250009,tanh,0.0,3,0.65,COMPLETE
348,348,0.45877805352211,2026-03-13 23:56:36.192187,2026-03-13 23:56:49.738625,0 days 00:00:13.546438,tanh,0.0,3,0.65,COMPLETE
349,349,0.4872739017009735,2026-03-13 23:56:49.908802,2026-03-13 23:57:03.123421,0 days 00:00:13.214619,tanh,0.0,3,0.65,COMPLETE
350,350,0.4412548243999481,2026-03-13 23:57:03.314485,2026-03-13 23:57:16.899002,0 days 00:00:13.584517,tanh,0.4,3,0.65,COMPLETE
351,351,0.5102055072784424,2026-03-13 23:57:17.074347,2026-03-13 23:57:30.631405,0 days 00:00:13.557058,tanh,0.0,3,0.65,COMPLETE
352,352,0.41711941361427307,2026-03-13 23:57:30.813228,2026-03-13 23:57:44.226634,0 days 00:00:13.413406,tanh,0.0,3,0.65,COMPLETE
353,353,0.4906648099422455,2026-03-13 23:57:44.396487,2026-03-13 23:57:58.098576,0 days 00:00:13.702089,relu,0.0,3,0.65,COMPLETE
354,354,0.43650367856025696,2026-03-13 23:57:58.302498,2026-03-13 23:58:11.830611,0 days 00:00:13.528113,tanh,0.0,3,0.65,COMPLETE
355,355,0.46397286653518677,2026-03-13 23:58:12.022933,2026-03-13 23:58:25.396654,0 days 00:00:13.373721,tanh,0.0,3,0.65,COMPLETE
356,356,0.4484236240386963,2026-03-13 23:58:25.559166,2026-03-13 23:58:38.907505,0 days 00:00:13.348339,tanh,0.0,3,0.65,COMPLETE
357,357,0.49609389901161194,2026-03-13 23:58:39.062025,2026-03-13 23:58:52.406103,0 days 00:00:13.344078,tanh,0.0,3,0.65,COMPLETE
358,358,0.4166196882724762,2026-03-13 23:58:52.600325,2026-03-13 23:59:06.151268,0 days 00:00:13.550943,tanh,0.0,3,0.65,COMPLETE
359,359,0.6437915563583374,2026-03-13 23:59:06.371586,2026-03-13 23:59:19.840731,0 days 00:00:13.469145,sigmoid,0.0,3,0.65,COMPLETE
360,360,0.452924519777298,2026-03-13 23:59:20.006250,2026-03-13 23:59:33.296610,0 days 00:00:13.290360,tanh,0.0,3,0.65,COMPLETE
361,361,0.46931448578834534,2026-03-13 23:59:33.488671,2026-03-13 23:59:46.909143,0 days 00:00:13.420472,tanh,0.0,3,0.8500000000000001,COMPLETE
362,362,0.5676063895225525,2026-03-13 23:59:47.081695,2026-03-14 00:00:00.246700,0 days 00:00:13.165005,tanh,0.0,2,0.7,COMPLETE
363,363,0.4599193036556244,2026-03-14 00:00:00.432702,2026-03-14 00:00:14.125376,0 days 00:00:13.692674,tanh,0.0,3,0.95,COMPLETE
364,364,0.4446720778942108,2026-03-14 00:00:14.309928,2026-03-14 00:00:28.103199,0 days 00:00:13.793271,tanh,0.5,3,0.65,COMPLETE
365,365,0.4820570647716522,2026-03-14 00:00:28.276641,2026-03-14 00:00:41.627391,0 days 00:00:13.350750,tanh,0.0,3,0.65,COMPLETE
366,366,0.42090535163879395,2026-03-14 00:00:41.824045,2026-03-14 00:00:55.200698,0 days 00:00:13.376653,tanh,0.0,3,0.65,COMPLETE
367,367,0.4109293222427368,2026-03-14 00:00:55.386223,2026-03-14 00:01:08.931638,0 days 00:00:13.545415,tanh,0.0,3,0.8,COMPLETE
368,368,0.42507803440093994,2026-03-14 00:01:09.120676,2026-03-14 00:01:22.574469,0 days 00:00:13.453793,tanh,0.0,3,0.8,COMPLETE
369,369,0.4519174098968506,2026-03-14 00:01:22.725324,2026-03-14 00:01:36.155813,0 days 00:00:13.430489,tanh,0.0,3,0.8,COMPLETE
370,370,0.4338670074939728,2026-03-14 00:01:36.342763,2026-03-14 00:01:49.664789,0 days 00:00:13.322026,tanh,0.0,3,0.75,COMPLETE
371,371,0.4837794601917267,2026-03-14 00:01:49.847526,2026-03-14 00:02:03.269074,0 days 00:00:13.421548,tanh,0.0,3,0.8,COMPLETE
372,372,0.46650588512420654,2026-03-14 00:02:03.432596,2026-03-14 00:02:16.615218,0 days 00:00:13.182622,tanh,0.0,3,0.8500000000000001,COMPLETE
373,373,0.4904923439025879,2026-03-14 00:02:16.807239,2026-03-14 00:02:30.561353,0 days 00:00:13.754114,relu,0.0,3,0.8500000000000001,COMPLETE
374,374,0.4778246283531189,2026-03-14 00:02:30.763792,2026-03-14 00:02:44.328726,0 days 00:00:13.564934,tanh,0.0,3,0.8,COMPLETE
375,375,0.45557600259780884,2026-03-14 00:02:44.508268,2026-03-14 00:02:58.031342,0 days 00:00:13.523074,tanh,0.0,3,0.65,COMPLETE
376,376,0.47764429450035095,2026-03-14 00:02:58.217757,2026-03-14 00:03:11.740814,0 days 00:00:13.523057,tanh,0.0,3,0.8,COMPLETE
377,377,0.4626651406288147,2026-03-14 00:03:11.929843,2026-03-14 00:03:25.306026,0 days 00:00:13.376183,tanh,0.0,3,0.65,COMPLETE
378,378,0.45335111021995544,2026-03-14 00:03:25.462538,2026-03-14 00:03:39.040757,0 days 00:00:13.578219,tanh,0.0,3,0.8,COMPLETE
379,379,0.46238601207733154,2026-03-14 00:03:39.199409,2026-03-14 00:03:52.422803,0 days 00:00:13.223394,tanh,0.0,3,0.8,COMPLETE
380,380,0.441446453332901,2026-03-14 00:03:52.604838,2026-03-14 00:04:06.184742,0 days 00:00:13.579904,tanh,0.0,3,0.8,COMPLETE
381,381,0.46509799361228943,2026-03-14 00:04:06.344766,2026-03-14 00:04:19.541906,0 days 00:00:13.197140,tanh,0.0,3,0.8,COMPLETE
382,382,0.6427936553955078,2026-03-14 00:04:19.742929,2026-03-14 00:04:33.561881,0 days 00:00:13.818952,sigmoid,0.0,6,0.65,COMPLETE
383,383,0.4309055507183075,2026-03-14 00:04:33.752403,2026-03-14 00:04:47.417205,0 days 00:00:13.664802,tanh,0.0,3,0.65,COMPLETE
384,384,0.4889145493507385,2026-03-14 00:04:47.605281,2026-03-14 00:05:00.776925,0 days 00:00:13.171644,tanh,0.0,2,0.75,COMPLETE
385,385,0.44000211358070374,2026-03-14 00:05:00.962986,2026-03-14 00:05:14.278729,0 days 00:00:13.315743,tanh,0.0,3,0.65,COMPLETE
386,386,0.5100307464599609,2026-03-14 00:05:14.475336,2026-03-14 00:05:28.057780,0 days 00:00:13.582444,tanh,0.30000000000000004,3,0.65,COMPLETE
387,387,0.43215489387512207,2026-03-14 00:05:28.248294,2026-03-14 00:05:41.909858,0 days 00:00:13.661564,tanh,0.0,3,0.8,COMPLETE
388,388,0.43602070212364197,2026-03-14 00:05:42.102736,2026-03-14 00:05:55.665035,0 days 00:00:13.562299,tanh,0.0,3,0.9,COMPLETE
389,389,0.47884199023246765,2026-03-14 00:05:55.846677,2026-03-14 00:06:09.598888,0 days 00:00:13.752211,tanh,0.0,3,0.65,COMPLETE
390,390,0.48325562477111816,2026-03-14 00:06:09.791487,2026-03-14 00:06:23.215052,0 days 00:00:13.423565,tanh,0.0,3,0.65,COMPLETE
391,391,0.47191178798675537,2026-03-14 00:06:23.359324,2026-03-14 00:06:36.705690,0 days 00:00:13.346366,tanh,0.0,3,0.65,COMPLETE
392,392,0.45923474431037903,2026-03-14 00:06:36.895753,2026-03-14 00:06:50.592417,0 days 00:00:13.696664,tanh,0.0,3,0.75,COMPLETE
393,393,0.4397711455821991,2026-03-14 00:06:50.751944,2026-03-14 00:07:04.468734,0 days 00:00:13.716790,tanh,0.0,3,0.8,COMPLETE
394,394,0.7943475842475891,2026-03-14 00:07:04.656304,2026-03-14 00:07:18.741863,0 days 00:00:14.085559,tanh,0.35000000000000003,5,0.65,COMPLETE
395,395,0.4347865879535675,2026-03-14 00:07:18.957510,2026-03-14 00:07:32.430603,0 days 00:00:13.473093,tanh,0.0,3,0.65,COMPLETE
396,396,0.479982852935791,2026-03-14 00:07:32.598239,2026-03-14 00:07:46.034272,0 days 00:00:13.436033,relu,0.0,3,0.65,COMPLETE
397,397,0.64793461561203,2026-03-14 00:07:46.198472,2026-03-14 00:07:59.960993,0 days 00:00:13.762521,tanh,0.0,5,0.6,COMPLETE
398,398,0.440723180770874,2026-03-14 00:08:00.221333,2026-03-14 00:08:13.942324,0 days 00:00:13.720991,tanh,0.0,3,0.65,COMPLETE
399,399,0.4703364670276642,2026-03-14 00:08:14.108227,2026-03-14 00:08:27.460505,0 days 00:00:13.352278,tanh,0.0,3,0.65,COMPLETE
400,400,0.446073055267334,2026-03-14 00:08:27.630416,2026-03-14 00:08:41.085089,0 days 00:00:13.454673,tanh,0.0,3,0.6,COMPLETE
401,401,0.47142985463142395,2026-03-14 00:08:41.225726,2026-03-14 00:08:54.748320,0 days 00:00:13.522594,tanh,0.0,3,0.65,COMPLETE
402,402,0.49247315526008606,2026-03-14 00:08:54.913898,2026-03-14 00:09:08.207539,0 days 00:00:13.293641,tanh,0.0,3,0.65,COMPLETE
403,403,0.4488263428211212,2026-03-14 00:09:08.380562,2026-03-14 00:09:21.841134,0 days 00:00:13.460572,tanh,0.0,3,0.65,COMPLETE
404,404,0.4658315181732178,2026-03-14 00:09:22.021190,2026-03-14 00:09:35.683053,0 days 00:00:13.661863,tanh,0.0,3,0.6,COMPLETE
405,405,0.643919050693512,2026-03-14 00:09:35.846082,2026-03-14 00:09:49.239557,0 days 00:00:13.393475,sigmoid,0.0,3,0.8,COMPLETE
406,406,0.48385679721832275,2026-03-14 00:09:49.407703,2026-03-14 00:10:02.728186,0 days 00:00:13.320483,tanh,0.0,2,0.7,COMPLETE
407,407,0.46656543016433716,2026-03-14 00:10:02.895706,2026-03-14 00:10:16.382334,0 days 00:00:13.486628,tanh,0.0,3,0.65,COMPLETE
408,408,0.4614679217338562,2026-03-14 00:10:16.545851,2026-03-14 00:10:30.089032,0 days 00:00:13.543181,tanh,0.0,3,0.65,COMPLETE
409,409,0.483786940574646,2026-03-14 00:10:30.249600,2026-03-14 00:10:43.653578,0 days 00:00:13.403978,tanh,0.0,3,0.6,COMPLETE
410,410,0.4297395646572113,2026-03-14 00:10:43.818102,2026-03-14 00:10:57.580391,0 days 00:00:13.762289,tanh,0.0,3,0.65,COMPLETE
411,411,0.45276591181755066,2026-03-14 00:10:57.757911,2026-03-14 00:11:11.215433,0 days 00:00:13.457522,tanh,0.0,3,0.6,COMPLETE
412,412,0.46080514788627625,2026-03-14 00:11:11.395825,2026-03-14 00:11:24.793091,0 days 00:00:13.397266,tanh,0.0,3,0.9,COMPLETE
413,413,0.47472211718559265,2026-03-14 00:11:24.935124,2026-03-14 00:11:38.449526,0 days 00:00:13.514402,tanh,0.0,3,0.7,COMPLETE
414,414,0.4341363310813904,2026-03-14 00:11:38.631565,2026-03-14 00:11:52.035133,0 days 00:00:13.403568,tanh,0.0,3,0.65,COMPLETE
415,415,0.47621333599090576,2026-03-14 00:11:52.206709,2026-03-14 00:12:05.771538,0 days 00:00:13.564829,tanh,0.0,3,0.75,COMPLETE
416,416,0.46028047800064087,2026-03-14 00:12:05.911721,2026-03-14 00:12:19.607059,0 days 00:00:13.695338,tanh,0.05,3,0.65,COMPLETE
417,417,0.5119854807853699,2026-03-14 00:12:19.785548,2026-03-14 00:12:33.238870,0 days 00:00:13.453322,tanh,0.0,3,0.65,COMPLETE
418,418,0.43863409757614136,2026-03-14 00:12:33.417096,2026-03-14 00:12:47.100165,0 days 00:00:13.683069,tanh,0.0,3,0.6,COMPLETE
419,419,0.4694368839263916,2026-03-14 00:12:47.272281,2026-03-14 00:13:00.776179,0 days 00:00:13.503898,tanh,0.0,3,0.7,COMPLETE
420,420,0.4711673855781555,2026-03-14 00:13:00.937725,2026-03-14 00:13:14.517517,0 days 00:00:13.579792,relu,0.0,3,0.65,COMPLETE
421,421,0.4400136470794678,2026-03-14 00:13:14.680559,2026-03-14 00:13:28.247345,0 days 00:00:13.566786,tanh,0.0,3,0.65,COMPLETE
422,422,0.44542381167411804,2026-03-14 00:13:28.421208,2026-03-14 00:13:41.982488,0 days 00:00:13.561280,tanh,0.0,3,0.8,COMPLETE
423,423,0.4635755717754364,2026-03-14 00:13:42.152866,2026-03-14 00:13:56.119927,0 days 00:00:13.967061,tanh,0.05,3,0.8500000000000001,COMPLETE
424,424,0.4323875904083252,2026-03-14 00:13:56.297449,2026-03-14 00:14:09.655336,0 days 00:00:13.357887,tanh,0.0,3,0.6,COMPLETE
425,425,0.5016894340515137,2026-03-14 00:14:09.823361,2026-03-14 00:14:23.079937,0 days 00:00:13.256576,tanh,0.0,2,0.65,COMPLETE
426,426,0.6448256969451904,2026-03-14 00:14:23.215477,2026-03-14 00:14:36.571506,0 days 00:00:13.356029,sigmoid,0.0,3,0.65,COMPLETE
427,427,0.6419873833656311,2026-03-14 00:14:36.734639,2026-03-14 00:14:50.539952,0 days 00:00:13.805313,tanh,0.0,6,0.65,COMPLETE
428,428,0.4054702818393707,2026-03-14 00:14:50.709583,2026-03-14 00:15:04.194043,0 days 00:00:13.484460,tanh,0.0,3,0.6,COMPLETE
429,429,0.6413838863372803,2026-03-14 00:15:04.375568,2026-03-14 00:15:18.283049,0 days 00:00:13.907481,tanh,0.0,5,0.6,COMPLETE
430,430,0.4631216526031494,2026-03-14 00:15:18.475090,2026-03-14 00:15:32.039069,0 days 00:00:13.563979,tanh,0.0,3,0.6,COMPLETE
431,431,0.48986896872520447,2026-03-14 00:15:32.209236,2026-03-14 00:15:45.993685,0 days 00:00:13.784449,tanh,0.05,3,0.6,COMPLETE
432,432,0.44049569964408875,2026-03-14 00:15:46.150731,2026-03-14 00:15:59.634688,0 days 00:00:13.483957,tanh,0.0,3,0.6,COMPLETE
433,433,0.4802342653274536,2026-03-14 00:15:59.797222,2026-03-14 00:16:13.417061,0 days 00:00:13.619839,tanh,0.0,3,0.6,COMPLETE
434,434,0.4513881504535675,2026-03-14 00:16:13.590084,2026-03-14 00:16:27.120717,0 days 00:00:13.530633,tanh,0.0,3,0.6,COMPLETE
435,435,0.43831077218055725,2026-03-14 00:16:27.268859,2026-03-14 00:16:40.841573,0 days 00:00:13.572714,tanh,0.0,3,0.55,COMPLETE
436,436,0.44825097918510437,2026-03-14 00:16:41.007608,2026-03-14 00:16:54.249407,0 days 00:00:13.241799,tanh,0.0,3,0.6,COMPLETE
437,437,0.5339287519454956,2026-03-14 00:16:54.552975,2026-03-14 00:17:07.961455,0 days 00:00:13.408480,tanh,0.0,3,0.7,COMPLETE
438,438,0.4604697823524475,2026-03-14 00:17:08.126064,2026-03-14 00:17:21.721606,0 days 00:00:13.595542,tanh,0.0,3,0.65,COMPLETE
439,439,0.4639284908771515,2026-03-14 00:17:21.860639,2026-03-14 00:17:35.090263,0 days 00:00:13.229624,tanh,0.0,3,0.55,COMPLETE
440,440,0.48110947012901306,2026-03-14 00:17:35.267636,2026-03-14 00:17:48.856193,0 days 00:00:13.588557,relu,0.0,3,0.65,COMPLETE
441,441,0.745680570602417,2026-03-14 00:17:49.021008,2026-03-14 00:18:03.638224,0 days 00:00:14.617216,tanh,0.30000000000000004,7,0.65,COMPLETE
442,442,0.5097183585166931,2026-03-14 00:18:03.792250,2026-03-14 00:18:17.606683,0 days 00:00:13.814433,tanh,0.05,3,0.6,COMPLETE
443,443,0.4449666142463684,2026-03-14 00:18:17.805709,2026-03-14 00:18:31.307907,0 days 00:00:13.502198,tanh,0.0,3,0.65,COMPLETE
444,444,0.44495251774787903,2026-03-14 00:18:31.478426,2026-03-14 00:18:44.990040,0 days 00:00:13.511614,tanh,0.0,3,0.65,COMPLETE
445,445,0.47818008065223694,2026-03-14 00:18:45.162654,2026-03-14 00:18:58.835178,0 days 00:00:13.672524,tanh,0.0,3,0.7,COMPLETE
446,446,0.6423429250717163,2026-03-14 00:18:58.996210,2026-03-14 00:19:12.831523,0 days 00:00:13.835313,tanh,0.0,5,0.6,COMPLETE
447,447,0.4502774477005005,2026-03-14 00:19:12.995551,2026-03-14 00:19:26.670119,0 days 00:00:13.674568,tanh,0.0,3,0.65,COMPLETE
448,448,0.6438913941383362,2026-03-14 00:19:26.856168,2026-03-14 00:19:40.697157,0 days 00:00:13.840989,sigmoid,0.05,3,0.65,COMPLETE
449,449,0.4366035461425781,2026-03-14 00:19:40.859185,2026-03-14 00:19:54.209432,0 days 00:00:13.350247,tanh,0.0,3,0.6,COMPLETE
450,450,0.45210880041122437,2026-03-14 00:19:54.375966,2026-03-14 00:20:07.992262,0 days 00:00:13.616296,tanh,0.0,3,0.7,COMPLETE
451,451,0.4561774432659149,2026-03-14 00:20:08.146576,2026-03-14 00:20:21.567090,0 days 00:00:13.420514,tanh,0.0,3,0.65,COMPLETE
452,452,0.45644158124923706,2026-03-14 00:20:21.725636,2026-03-14 00:20:35.360141,0 days 00:00:13.634505,tanh,0.0,3,0.65,COMPLETE
453,453,0.48565906286239624,2026-03-14 00:20:35.522658,2026-03-14 00:20:48.829883,0 days 00:00:13.307225,tanh,0.0,2,0.65,COMPLETE
454,454,0.4736500382423401,2026-03-14 00:20:49.000924,2026-03-14 00:21:02.603676,0 days 00:00:13.602752,tanh,0.0,3,0.75,COMPLETE
455,455,0.48471158742904663,2026-03-14 00:21:02.778720,2026-03-14 00:21:16.205809,0 days 00:00:13.427089,tanh,0.0,3,0.6,COMPLETE
456,456,0.44805848598480225,2026-03-14 00:21:16.366356,2026-03-14 00:21:29.779323,0 days 00:00:13.412967,tanh,0.0,3,0.65,COMPLETE
457,457,0.45253098011016846,2026-03-14 00:21:29.946852,2026-03-14 00:21:43.718313,0 days 00:00:13.771461,tanh,0.05,3,0.6,COMPLETE
458,458,0.48045533895492554,2026-03-14 00:21:43.925895,2026-03-14 00:21:57.479766,0 days 00:00:13.553871,tanh,0.0,3,0.55,COMPLETE
459,459,0.4728882312774658,2026-03-14 00:21:57.633796,2026-03-14 00:22:11.247771,0 days 00:00:13.613975,tanh,0.0,3,0.65,COMPLETE
460,460,0.4612959921360016,2026-03-14 00:22:11.414205,2026-03-14 00:22:25.660126,0 days 00:00:14.245921,tanh,0.45,3,0.7,COMPLETE
461,461,0.47983136773109436,2026-03-14 00:22:25.819661,2026-03-14 00:22:39.504859,0 days 00:00:13.685198,tanh,0.0,3,0.75,COMPLETE
462,462,0.4590073227882385,2026-03-14 00:22:39.670883,2026-03-14 00:22:53.238703,0 days 00:00:13.567820,tanh,0.0,3,0.65,COMPLETE
463,463,0.4733022451400757,2026-03-14 00:22:53.398223,2026-03-14 00:23:07.022082,0 days 00:00:13.623859,relu,0.0,3,0.6,COMPLETE
464,464,0.6634804010391235,2026-03-14 00:23:07.187167,2026-03-14 00:23:21.586328,0 days 00:00:14.399161,tanh,0.05,6,0.65,COMPLETE
465,465,0.49560680985450745,2026-03-14 00:23:21.722327,2026-03-14 00:23:35.153461,0 days 00:00:13.431134,tanh,0.0,3,0.65,COMPLETE
466,466,0.46609073877334595,2026-03-14 00:23:35.288954,2026-03-14 00:23:48.775230,0 days 00:00:13.486276,tanh,0.0,3,0.5,COMPLETE
467,467,0.4549819827079773,2026-03-14 00:23:48.919752,2026-03-14 00:24:02.416189,0 days 00:00:13.496437,tanh,0.0,3,0.7,COMPLETE
468,468,0.6436209082603455,2026-03-14 00:24:02.583522,2026-03-14 00:24:16.371012,0 days 00:00:13.787490,tanh,0.0,5,0.65,COMPLETE
469,469,0.48146188259124756,2026-03-14 00:24:16.525066,2026-03-14 00:24:30.042929,0 days 00:00:13.517863,tanh,0.0,3,0.55,COMPLETE
470,470,0.4260364770889282,2026-03-14 00:24:30.206784,2026-03-14 00:24:43.776962,0 days 00:00:13.570178,tanh,0.0,3,0.6,COMPLETE
471,471,0.6442782878875732,2026-03-14 00:24:43.950009,2026-03-14 00:24:57.489815,0 days 00:00:13.539806,sigmoid,0.0,3,0.65,COMPLETE
472,472,0.4300396144390106,2026-03-14 00:24:57.645856,2026-03-14 00:25:11.343634,0 days 00:00:13.697778,tanh,0.0,3,0.65,COMPLETE
473,473,0.4571398198604584,2026-03-14 00:25:11.515165,2026-03-14 00:25:24.961115,0 days 00:00:13.445950,tanh,0.05,3,0.65,COMPLETE
474,474,0.46698468923568726,2026-03-14 00:25:25.149189,2026-03-14 00:25:38.495642,0 days 00:00:13.346453,tanh,0.0,3,0.6,COMPLETE
475,475,0.4545776844024658,2026-03-14 00:25:38.656617,2026-03-14 00:25:52.162776,0 days 00:00:13.506159,tanh,0.0,3,0.65,COMPLETE
476,476,0.4264203608036041,2026-03-14 00:25:52.306845,2026-03-14 00:26:05.817976,0 days 00:00:13.511131,tanh,0.0,3,0.7,COMPLETE
477,477,0.515872597694397,2026-03-14 00:26:05.982653,2026-03-14 00:26:19.690956,0 days 00:00:13.708303,tanh,0.05,2,0.55,COMPLETE
478,478,0.45284730195999146,2026-03-14 00:26:19.860949,2026-03-14 00:26:33.474825,0 days 00:00:13.613876,tanh,0.0,3,0.65,COMPLETE
479,479,0.42702171206474304,2026-03-14 00:26:33.637196,2026-03-14 00:26:47.298498,0 days 00:00:13.661302,tanh,0.0,3,0.6,COMPLETE
480,480,0.44988277554512024,2026-03-14 00:26:47.464983,2026-03-14 00:27:01.093491,0 days 00:00:13.628508,tanh,0.0,3,0.6,COMPLETE
481,481,0.4779604375362396,2026-03-14 00:27:01.255069,2026-03-14 00:27:15.015823,0 days 00:00:13.760754,tanh,0.0,3,0.65,COMPLETE
482,482,0.4314728379249573,2026-03-14 00:27:15.177061,2026-03-14 00:27:28.719134,0 days 00:00:13.542073,tanh,0.0,3,0.7,COMPLETE
483,483,0.4504251778125763,2026-03-14 00:27:28.878143,2026-03-14 00:27:42.414689,0 days 00:00:13.536546,tanh,0.0,3,0.65,COMPLETE
484,484,0.4799121618270874,2026-03-14 00:27:42.558258,2026-03-14 00:27:56.066375,0 days 00:00:13.508117,relu,0.0,3,0.5,COMPLETE
485,485,0.4375349283218384,2026-03-14 00:27:56.233527,2026-03-14 00:28:09.617814,0 days 00:00:13.384287,tanh,0.0,3,0.75,COMPLETE
486,486,0.4719700217247009,2026-03-14 00:28:09.778348,2026-03-14 00:28:23.371646,0 days 00:00:13.593298,tanh,0.0,3,0.6,COMPLETE
487,487,0.4489462375640869,2026-03-14 00:28:23.514165,2026-03-14 00:28:37.192248,0 days 00:00:13.678083,tanh,0.05,3,0.65,COMPLETE
488,488,0.43826818466186523,2026-03-14 00:28:37.356291,2026-03-14 00:28:50.886074,0 days 00:00:13.529783,tanh,0.0,3,0.65,COMPLETE
489,489,0.6434723734855652,2026-03-14 00:28:51.043588,2026-03-14 00:29:05.087291,0 days 00:00:14.043703,tanh,0.0,6,0.65,COMPLETE
490,490,0.5230920314788818,2026-03-14 00:29:05.233932,2026-03-14 00:29:19.208616,0 days 00:00:13.974684,tanh,0.0,5,0.7,COMPLETE
491,491,0.4321318566799164,2026-03-14 00:29:19.376172,2026-03-14 00:29:33.197492,0 days 00:00:13.821320,tanh,0.0,3,0.6,COMPLETE
492,492,0.45084667205810547,2026-03-14 00:29:33.355006,2026-03-14 00:29:46.794642,0 days 00:00:13.439636,tanh,0.0,3,0.65,COMPLETE
493,493,0.42606619000434875,2026-03-14 00:29:46.956189,2026-03-14 00:30:00.741144,0 days 00:00:13.784955,tanh,0.4,3,0.95,COMPLETE
494,494,0.6442195177078247,2026-03-14 00:30:00.888662,2026-03-14 00:30:14.438646,0 days 00:00:13.549984,sigmoid,0.0,3,0.65,COMPLETE
495,495,0.6501676440238953,2026-03-14 00:30:14.599161,2026-03-14 00:30:29.655108,0 days 00:00:15.055947,tanh,0.05,8,0.65,COMPLETE
496,496,0.4696155786514282,2026-03-14 00:30:29.805632,2026-03-14 00:30:43.373323,0 days 00:00:13.567691,tanh,0.0,3,0.55,COMPLETE
497,497,0.43489277362823486,2026-03-14 00:30:43.536358,2026-03-14 00:30:57.255596,0 days 00:00:13.719238,tanh,0.0,3,0.6,COMPLETE
498,498,0.4772685468196869,2026-03-14 00:30:57.427345,2026-03-14 00:31:11.146294,0 days 00:00:13.718949,tanh,0.0,3,0.65,COMPLETE
